[I 2024-08-15 10:45:24,846] Trial 103 finished with value: 0.09424039737062251 and parameters: {'model_name': 'SimpleImputer', 'strategy': 'median'}. Best is trial 8 with value: 0.09424039737062251.
running
[I 2024-08-15 10:45:24,994] Trial 102 finished with value: 0.09424039737062251 and parameters: {'model_name': 'SimpleImputer', 'strategy': 'median'}. Best is trial 8 with value: 0.09424039737062251.
[I 2024-08-15 10:45:25,099] Trial 106 finished with value: 0.09424039737062251 and parameters: {'model_name': 'SimpleImputer', 'strategy': 'median'}. Best is trial 8 with value: 0.09424039737062251.
running
running
[I 2024-08-15 10:45:25,262] Trial 108 finished with value: 0.09424039737062251 and parameters: {'model_name': 'SimpleImputer', 'strategy': 'median'}. Best is trial 8 with value: 0.09424039737062251.
running
[I 2024-08-15 10:45:25,425] Trial 101 finished with value: 0.09424039737062251 and parameters: {'model_name': 'SimpleImputer', 'strategy': 'median'}. Best is trial 8 with value: 0.09424039737062251.
running
[I 2024-08-15 10:45:25,534] Trial 107 finished with value: 0.09424039737062251 and parameters: {'model_name': 'SimpleImputer', 'strategy': 'median'}. Best is trial 8 with value: 0.09424039737062251.
running
[I 2024-08-15 10:45:25,751] Trial 113 finished with value: 0.09424039737062251 and parameters: {'model_name': 'SimpleImputer', 'strategy': 'median'}. Best is trial 8 with value: 0.09424039737062251.
running
[I 2024-08-15 10:45:25,986] Trial 109 finished with value: 0.09424039737062251 and parameters: {'model_name': 'SimpleImputer', 'strategy': 'median'}. Best is trial 8 with value: 0.09424039737062251.
running
[I 2024-08-15 10:45:26,116] Trial 110 finished with value: 0.09424039737062251 and parameters: {'model_name': 'SimpleImputer', 'strategy': 'median'}. Best is trial 8 with value: 0.09424039737062251.
running
[I 2024-08-15 10:45:26,308] Trial 114 finished with value: 0.09424039737062251 and parameters: {'model_name': 'SimpleImputer', 'strategy': 'median'}. Best is trial 8 with value: 0.09424039737062251.
running
[I 2024-08-15 10:45:26,450] Trial 112 finished with value: 0.09424039737062251 and parameters: {'model_name': 'SimpleImputer', 'strategy': 'median'}. Best is trial 8 with value: 0.09424039737062251.
running
[I 2024-08-15 10:45:26,656] Trial 111 finished with value: 0.09424039737062251 and parameters: {'model_name': 'SimpleImputer', 'strategy': 'median'}. Best is trial 8 with value: 0.09424039737062251.
running
[I 2024-08-15 10:45:26,802] Trial 115 finished with value: 0.09424039737062251 and parameters: {'model_name': 'SimpleImputer', 'strategy': 'median'}. Best is trial 8 with value: 0.09424039737062251.
running
[I 2024-08-15 10:45:27,404] Trial 116 finished with value: 0.09424039737062251 and parameters: {'model_name': 'SimpleImputer', 'strategy': 'median'}. Best is trial 8 with value: 0.09424039737062251.
running
[I 2024-08-15 10:45:27,738] Trial 117 finished with value: 0.09424039737062251 and parameters: {'model_name': 'SimpleImputer', 'strategy': 'median'}. Best is trial 8 with value: 0.09424039737062251.
running
[I 2024-08-15 10:45:27,872] Trial 120 finished with value: 0.09424039737062251 and parameters: {'model_name': 'SimpleImputer', 'strategy': 'median'}. Best is trial 8 with value: 0.09424039737062251.
running
[I 2024-08-15 10:45:27,987] Trial 118 finished with value: 0.09424039737062251 and parameters: {'model_name': 'SimpleImputer', 'strategy': 'median'}. Best is trial 8 with value: 0.09424039737062251.
running
[I 2024-08-15 10:45:28,209] Trial 119 finished with value: 0.09424039737062251 and parameters: {'model_name': 'SimpleImputer', 'strategy': 'median'}. Best is trial 8 with value: 0.09424039737062251.
running
[I 2024-08-15 10:45:28,383] Trial 122 finished with value: 0.09424039737062251 and parameters: {'model_name': 'SimpleImputer', 'strategy': 'median'}. Best is trial 8 with value: 0.09424039737062251.
running
[I 2024-08-15 10:45:28,784] Trial 123 finished with value: 0.09424039737062251 and parameters: {'model_name': 'SimpleImputer', 'strategy': 'median'}. Best is trial 8 with value: 0.09424039737062251.
running
[I 2024-08-15 10:45:29,006] Trial 121 finished with value: 0.09424039737062251 and parameters: {'model_name': 'SimpleImputer', 'strategy': 'median'}. Best is trial 8 with value: 0.09424039737062251.
running
[I 2024-08-15 10:45:29,416] Trial 126 finished with value: 0.09424039737062251 and parameters: {'model_name': 'SimpleImputer', 'strategy': 'median'}. Best is trial 8 with value: 0.09424039737062251.
running
[I 2024-08-15 10:45:31,547] Trial 125 finished with value: 0.24675289608797285 and parameters: {'model_name': 'SimpleImputer', 'strategy': 'most_frequent'}. Best is trial 8 with value: 0.09424039737062251.
running
[I 2024-08-15 10:45:32,120] Trial 124 finished with value: 0.24675289608797285 and parameters: {'model_name': 'SimpleImputer', 'strategy': 'most_frequent'}. Best is trial 8 with value: 0.09424039737062251.
running
[I 2024-08-15 10:45:32,261] Trial 127 finished with value: 0.24675289608797285 and parameters: {'model_name': 'SimpleImputer', 'strategy': 'most_frequent'}. Best is trial 8 with value: 0.09424039737062251.
running
[I 2024-08-15 10:45:32,725] Trial 128 finished with value: 0.24675289608797285 and parameters: {'model_name': 'SimpleImputer', 'strategy': 'most_frequent'}. Best is trial 8 with value: 0.09424039737062251.
running
[I 2024-08-15 10:45:33,061] Trial 130 finished with value: 0.24675289608797285 and parameters: {'model_name': 'SimpleImputer', 'strategy': 'most_frequent'}. Best is trial 8 with value: 0.09424039737062251.
running
[I 2024-08-15 10:45:33,323] Trial 131 finished with value: 0.24675289608797285 and parameters: {'model_name': 'SimpleImputer', 'strategy': 'most_frequent'}. Best is trial 8 with value: 0.09424039737062251.
running
[I 2024-08-15 10:45:33,452] Trial 129 finished with value: 0.24675289608797285 and parameters: {'model_name': 'SimpleImputer', 'strategy': 'most_frequent'}. Best is trial 8 with value: 0.09424039737062251.
running
[I 2024-08-15 10:45:33,783] Trial 137 finished with value: 0.24675289608797285 and parameters: {'model_name': 'SimpleImputer', 'strategy': 'most_frequent'}. Best is trial 8 with value: 0.09424039737062251.
running
[I 2024-08-15 10:45:34,066] Trial 135 finished with value: 0.24675289608797285 and parameters: {'model_name': 'SimpleImputer', 'strategy': 'most_frequent'}. Best is trial 8 with value: 0.09424039737062251.
running
[I 2024-08-15 10:45:34,277] Trial 136 finished with value: 0.24675289608797285 and parameters: {'model_name': 'SimpleImputer', 'strategy': 'most_frequent'}. Best is trial 8 with value: 0.09424039737062251.
running
[I 2024-08-15 10:45:34,405] Trial 134 finished with value: 0.24675289608797285 and parameters: {'model_name': 'SimpleImputer', 'strategy': 'most_frequent'}. Best is trial 8 with value: 0.09424039737062251.
running
[I 2024-08-15 10:45:34,643] Trial 141 finished with value: 0.09424039737062251 and parameters: {'model_name': 'SimpleImputer', 'strategy': 'median'}. Best is trial 8 with value: 0.09424039737062251.
[I 2024-08-15 10:45:34,645] Trial 133 finished with value: 0.24675289608797285 and parameters: {'model_name': 'SimpleImputer', 'strategy': 'most_frequent'}. Best is trial 8 with value: 0.09424039737062251.
[I 2024-08-15 10:45:34,753] Trial 138 finished with value: 0.24675289608797285 and parameters: {'model_name': 'SimpleImputer', 'strategy': 'most_frequent'}. Best is trial 8 with value: 0.09424039737062251.
running
running
running
[I 2024-08-15 10:45:34,987] Trial 132 finished with value: 0.24675289608797285 and parameters: {'model_name': 'SimpleImputer', 'strategy': 'most_frequent'}. Best is trial 8 with value: 0.09424039737062251.
running
[I 2024-08-15 10:45:35,206] Trial 139 finished with value: 0.24675289608797285 and parameters: {'model_name': 'SimpleImputer', 'strategy': 'most_frequent'}. Best is trial 8 with value: 0.09424039737062251.
running
[I 2024-08-15 10:45:35,392] Trial 143 finished with value: 0.09424039737062251 and parameters: {'model_name': 'SimpleImputer', 'strategy': 'median'}. Best is trial 8 with value: 0.09424039737062251.
running
[I 2024-08-15 10:45:35,565] Trial 142 finished with value: 0.09424039737062251 and parameters: {'model_name': 'SimpleImputer', 'strategy': 'median'}. Best is trial 8 with value: 0.09424039737062251.
running
[I 2024-08-15 10:45:35,832] Trial 140 finished with value: 0.24675289608797285 and parameters: {'model_name': 'SimpleImputer', 'strategy': 'most_frequent'}. Best is trial 8 with value: 0.09424039737062251.
running
[I 2024-08-15 10:45:36,008] Trial 144 finished with value: 0.09424039737062251 and parameters: {'model_name': 'SimpleImputer', 'strategy': 'median'}. Best is trial 8 with value: 0.09424039737062251.
running
[I 2024-08-15 10:45:36,224] Trial 145 finished with value: 0.09424039737062251 and parameters: {'model_name': 'SimpleImputer', 'strategy': 'median'}. Best is trial 8 with value: 0.09424039737062251.
running
[I 2024-08-15 10:45:36,526] Trial 146 finished with value: 0.09424039737062251 and parameters: {'model_name': 'SimpleImputer', 'strategy': 'median'}. Best is trial 8 with value: 0.09424039737062251.
running
[I 2024-08-15 10:45:36,702] Trial 147 finished with value: 0.09424039737062251 and parameters: {'model_name': 'SimpleImputer', 'strategy': 'median'}. Best is trial 8 with value: 0.09424039737062251.
running
[I 2024-08-15 10:45:37,065] Trial 151 finished with value: 0.09424039737062251 and parameters: {'model_name': 'SimpleImputer', 'strategy': 'median'}. Best is trial 8 with value: 0.09424039737062251.
running
[I 2024-08-15 10:45:37,188] Trial 150 finished with value: 0.09424039737062251 and parameters: {'model_name': 'SimpleImputer', 'strategy': 'median'}. Best is trial 8 with value: 0.09424039737062251.
running
[I 2024-08-15 10:45:37,324] Trial 149 finished with value: 0.09424039737062251 and parameters: {'model_name': 'SimpleImputer', 'strategy': 'median'}. Best is trial 8 with value: 0.09424039737062251.
running
[I 2024-08-15 10:45:37,438] Trial 148 finished with value: 0.09424039737062251 and parameters: {'model_name': 'SimpleImputer', 'strategy': 'median'}. Best is trial 8 with value: 0.09424039737062251.
running
[I 2024-08-15 10:45:37,597] Trial 155 finished with value: 0.09424039737062251 and parameters: {'model_name': 'SimpleImputer', 'strategy': 'median'}. Best is trial 8 with value: 0.09424039737062251.
running
[I 2024-08-15 10:45:37,825] Trial 152 finished with value: 0.09424039737062251 and parameters: {'model_name': 'SimpleImputer', 'strategy': 'median'}. Best is trial 8 with value: 0.09424039737062251.
running
[I 2024-08-15 10:45:37,968] Trial 153 finished with value: 0.09424039737062251 and parameters: {'model_name': 'SimpleImputer', 'strategy': 'median'}. Best is trial 8 with value: 0.09424039737062251.
running
[I 2024-08-15 10:45:38,167] Trial 157 finished with value: 0.09424039737062251 and parameters: {'model_name': 'SimpleImputer', 'strategy': 'median'}. Best is trial 8 with value: 0.09424039737062251.
running
[I 2024-08-15 10:45:38,299] Trial 158 finished with value: 0.09424039737062251 and parameters: {'model_name': 'SimpleImputer', 'strategy': 'median'}. Best is trial 8 with value: 0.09424039737062251.
running
[I 2024-08-15 10:45:38,510] Trial 154 finished with value: 0.09424039737062251 and parameters: {'model_name': 'SimpleImputer', 'strategy': 'median'}. Best is trial 8 with value: 0.09424039737062251.
running
[I 2024-08-15 10:45:38,774] Trial 156 finished with value: 0.09424039737062251 and parameters: {'model_name': 'SimpleImputer', 'strategy': 'median'}. Best is trial 8 with value: 0.09424039737062251.
running
[I 2024-08-15 10:45:38,957] Trial 160 finished with value: 0.09424039737062251 and parameters: {'model_name': 'SimpleImputer', 'strategy': 'median'}. Best is trial 8 with value: 0.09424039737062251.
running
[I 2024-08-15 10:45:39,160] Trial 159 finished with value: 0.09424039737062251 and parameters: {'model_name': 'SimpleImputer', 'strategy': 'median'}. Best is trial 8 with value: 0.09424039737062251.
running
[I 2024-08-15 10:45:39,519] Trial 161 finished with value: 0.09424039737062251 and parameters: {'model_name': 'SimpleImputer', 'strategy': 'median'}. Best is trial 8 with value: 0.09424039737062251.
running
[I 2024-08-15 10:45:39,709] Trial 162 finished with value: 0.09424039737062251 and parameters: {'model_name': 'SimpleImputer', 'strategy': 'median'}. Best is trial 8 with value: 0.09424039737062251.
running
[I 2024-08-15 10:45:39,882] Trial 166 finished with value: 0.09424039737062251 and parameters: {'model_name': 'SimpleImputer', 'strategy': 'median'}. Best is trial 8 with value: 0.09424039737062251.
running
[I 2024-08-15 10:45:40,038] Trial 164 finished with value: 0.09424039737062251 and parameters: {'model_name': 'SimpleImputer', 'strategy': 'median'}. Best is trial 8 with value: 0.09424039737062251.
running
[I 2024-08-15 10:45:40,343] Trial 163 finished with value: 0.09424039737062251 and parameters: {'model_name': 'SimpleImputer', 'strategy': 'median'}. Best is trial 8 with value: 0.09424039737062251.
running
[I 2024-08-15 10:45:40,556] Trial 167 finished with value: 0.09424039737062251 and parameters: {'model_name': 'SimpleImputer', 'strategy': 'median'}. Best is trial 8 with value: 0.09424039737062251.
running
[I 2024-08-15 10:45:40,690] Trial 169 finished with value: 0.09424039737062251 and parameters: {'model_name': 'SimpleImputer', 'strategy': 'median'}. Best is trial 8 with value: 0.09424039737062251.
[I 2024-08-15 10:45:40,802] Trial 170 finished with value: 0.09424039737062251 and parameters: {'model_name': 'SimpleImputer', 'strategy': 'median'}. Best is trial 8 with value: 0.09424039737062251.
running
running
[I 2024-08-15 10:45:40,961] Trial 165 finished with value: 0.09424039737062251 and parameters: {'model_name': 'SimpleImputer', 'strategy': 'median'}. Best is trial 8 with value: 0.09424039737062251.
running
[I 2024-08-15 10:45:41,236] Trial 168 finished with value: 0.09424039737062251 and parameters: {'model_name': 'SimpleImputer', 'strategy': 'median'}. Best is trial 8 with value: 0.09424039737062251.
running
[I 2024-08-15 10:45:41,496] Trial 172 finished with value: 0.09424039737062251 and parameters: {'model_name': 'SimpleImputer', 'strategy': 'median'}. Best is trial 8 with value: 0.09424039737062251.
running
[I 2024-08-15 10:45:41,648] Trial 171 finished with value: 0.09424039737062251 and parameters: {'model_name': 'SimpleImputer', 'strategy': 'median'}. Best is trial 8 with value: 0.09424039737062251.
running
[I 2024-08-15 10:45:41,794] Trial 173 finished with value: 0.09424039737062251 and parameters: {'model_name': 'SimpleImputer', 'strategy': 'median'}. Best is trial 8 with value: 0.09424039737062251.
running
[I 2024-08-15 10:45:41,999] Trial 174 finished with value: 0.09424039737062251 and parameters: {'model_name': 'SimpleImputer', 'strategy': 'median'}. Best is trial 8 with value: 0.09424039737062251.
running
[I 2024-08-15 10:45:42,182] Trial 176 finished with value: 0.09424039737062251 and parameters: {'model_name': 'SimpleImputer', 'strategy': 'median'}. Best is trial 8 with value: 0.09424039737062251.
running
[I 2024-08-15 10:45:42,432] Trial 175 finished with value: 0.09424039737062251 and parameters: {'model_name': 'SimpleImputer', 'strategy': 'median'}. Best is trial 8 with value: 0.09424039737062251.
running
[I 2024-08-15 10:45:42,634] Trial 180 finished with value: 0.09424039737062251 and parameters: {'model_name': 'SimpleImputer', 'strategy': 'median'}. Best is trial 8 with value: 0.09424039737062251.
running
[I 2024-08-15 10:45:42,908] Trial 178 finished with value: 0.09424039737062251 and parameters: {'model_name': 'SimpleImputer', 'strategy': 'median'}. Best is trial 8 with value: 0.09424039737062251.
running
[I 2024-08-15 10:45:43,063] Trial 177 finished with value: 0.09424039737062251 and parameters: {'model_name': 'SimpleImputer', 'strategy': 'median'}. Best is trial 8 with value: 0.09424039737062251.
[I 2024-08-15 10:45:43,189] Trial 179 finished with value: 0.09424039737062251 and parameters: {'model_name': 'SimpleImputer', 'strategy': 'median'}. Best is trial 8 with value: 0.09424039737062251.
running
running
[I 2024-08-15 10:45:43,586] Trial 185 finished with value: 0.09424039737062251 and parameters: {'model_name': 'SimpleImputer', 'strategy': 'median'}. Best is trial 8 with value: 0.09424039737062251.
running
[I 2024-08-15 10:45:43,711] Trial 184 finished with value: 0.09424039737062251 and parameters: {'model_name': 'SimpleImputer', 'strategy': 'median'}. Best is trial 8 with value: 0.09424039737062251.
running
[I 2024-08-15 10:45:43,864] Trial 183 finished with value: 0.09424039737062251 and parameters: {'model_name': 'SimpleImputer', 'strategy': 'median'}. Best is trial 8 with value: 0.09424039737062251.
running
[I 2024-08-15 10:45:44,051] Trial 182 finished with value: 0.09424039737062251 and parameters: {'model_name': 'SimpleImputer', 'strategy': 'median'}. Best is trial 8 with value: 0.09424039737062251.
[I 2024-08-15 10:45:44,188] Trial 181 finished with value: 0.09424039737062251 and parameters: {'model_name': 'SimpleImputer', 'strategy': 'median'}. Best is trial 8 with value: 0.09424039737062251.
[I 2024-08-15 10:45:44,326] Trial 186 finished with value: 0.09424039737062251 and parameters: {'model_name': 'SimpleImputer', 'strategy': 'median'}. Best is trial 8 with value: 0.09424039737062251.
[I 2024-08-15 10:45:44,519] Trial 188 finished with value: 0.09424039737062251 and parameters: {'model_name': 'SimpleImputer', 'strategy': 'median'}. Best is trial 8 with value: 0.09424039737062251.
[I 2024-08-15 10:45:44,764] Trial 187 finished with value: 0.09424039737062251 and parameters: {'model_name': 'SimpleImputer', 'strategy': 'median'}. Best is trial 8 with value: 0.09424039737062251.
[I 2024-08-15 10:45:44,915] Trial 191 finished with value: 0.09424039737062251 and parameters: {'model_name': 'SimpleImputer', 'strategy': 'median'}. Best is trial 8 with value: 0.09424039737062251.
[I 2024-08-15 10:45:45,076] Trial 189 finished with value: 0.09424039737062251 and parameters: {'model_name': 'SimpleImputer', 'strategy': 'median'}. Best is trial 8 with value: 0.09424039737062251.
[I 2024-08-15 10:45:45,243] Trial 192 finished with value: 0.09424039737062251 and parameters: {'model_name': 'SimpleImputer', 'strategy': 'median'}. Best is trial 8 with value: 0.09424039737062251.
[I 2024-08-15 10:45:45,363] Trial 193 finished with value: 0.09424039737062251 and parameters: {'model_name': 'SimpleImputer', 'strategy': 'median'}. Best is trial 8 with value: 0.09424039737062251.
[I 2024-08-15 10:45:45,486] Trial 190 finished with value: 0.09424039737062251 and parameters: {'model_name': 'SimpleImputer', 'strategy': 'median'}. Best is trial 8 with value: 0.09424039737062251.
[I 2024-08-15 10:45:45,615] Trial 196 finished with value: 0.09424039737062251 and parameters: {'model_name': 'SimpleImputer', 'strategy': 'median'}. Best is trial 8 with value: 0.09424039737062251.
[I 2024-08-15 10:45:45,733] Trial 194 finished with value: 0.09424039737062251 and parameters: {'model_name': 'SimpleImputer', 'strategy': 'median'}. Best is trial 8 with value: 0.09424039737062251.
[I 2024-08-15 10:45:45,847] Trial 195 finished with value: 0.09424039737062251 and parameters: {'model_name': 'SimpleImputer', 'strategy': 'median'}. Best is trial 8 with value: 0.09424039737062251.
[I 2024-08-15 10:45:45,981] Trial 199 finished with value: 0.09424039737062251 and parameters: {'model_name': 'SimpleImputer', 'strategy': 'median'}. Best is trial 8 with value: 0.09424039737062251.
[I 2024-08-15 10:45:46,086] Trial 198 finished with value: 0.09424039737062251 and parameters: {'model_name': 'SimpleImputer', 'strategy': 'median'}. Best is trial 8 with value: 0.09424039737062251.
