[I 2024-11-21 21:18:46,641] Trial 101 finished with value: 0.3604004952420291 and parameters: {'model_name': 'SimpleImputer', 'strategy': 'mean'}. Best is trial 1 with value: 0.3604004952420291.
running
[I 2024-11-21 21:18:46,788] Trial 103 finished with value: 0.3604004952420291 and parameters: {'model_name': 'SimpleImputer', 'strategy': 'mean'}. Best is trial 1 with value: 0.3604004952420291.
running
[I 2024-11-21 21:18:46,917] Trial 106 finished with value: 0.3604004952420291 and parameters: {'model_name': 'SimpleImputer', 'strategy': 'mean'}. Best is trial 1 with value: 0.3604004952420291.
[I 2024-11-21 21:18:47,010] Trial 109 finished with value: 0.3604004952420291 and parameters: {'model_name': 'SimpleImputer', 'strategy': 'mean'}. Best is trial 1 with value: 0.3604004952420291.
running
[I 2024-11-21 21:18:47,101] Trial 105 finished with value: 0.3604004952420291 and parameters: {'model_name': 'SimpleImputer', 'strategy': 'mean'}. Best is trial 1 with value: 0.3604004952420291.
running
running
[I 2024-11-21 21:18:47,208] Trial 113 finished with value: 0.3604004952420291 and parameters: {'model_name': 'SimpleImputer', 'strategy': 'mean'}. Best is trial 1 with value: 0.3604004952420291.
[I 2024-11-21 21:18:47,301] Trial 111 finished with value: 0.3604004952420291 and parameters: {'model_name': 'SimpleImputer', 'strategy': 'mean'}. Best is trial 1 with value: 0.3604004952420291.
running
running
[I 2024-11-21 21:18:47,403] Trial 112 finished with value: 0.3604004952420291 and parameters: {'model_name': 'SimpleImputer', 'strategy': 'mean'}. Best is trial 1 with value: 0.3604004952420291.
running
[I 2024-11-21 21:18:47,529] Trial 107 finished with value: 0.3604004952420291 and parameters: {'model_name': 'SimpleImputer', 'strategy': 'mean'}. Best is trial 1 with value: 0.3604004952420291.
running
[I 2024-11-21 21:18:47,651] Trial 108 finished with value: 0.3604004952420291 and parameters: {'model_name': 'SimpleImputer', 'strategy': 'mean'}. Best is trial 1 with value: 0.3604004952420291.
running
[I 2024-11-21 21:18:47,799] Trial 110 finished with value: 0.3604004952420291 and parameters: {'model_name': 'SimpleImputer', 'strategy': 'mean'}. Best is trial 1 with value: 0.3604004952420291.
running
[I 2024-11-21 21:18:47,996] Trial 114 finished with value: 0.3604004952420291 and parameters: {'model_name': 'SimpleImputer', 'strategy': 'mean'}. Best is trial 1 with value: 0.3604004952420291.
running
[I 2024-11-21 21:18:48,122] Trial 116 finished with value: 0.3604004952420291 and parameters: {'model_name': 'SimpleImputer', 'strategy': 'mean'}. Best is trial 1 with value: 0.3604004952420291.
[I 2024-11-21 21:18:48,213] Trial 117 finished with value: 0.3604004952420291 and parameters: {'model_name': 'SimpleImputer', 'strategy': 'mean'}. Best is trial 1 with value: 0.3604004952420291.
running
running
[I 2024-11-21 21:18:48,324] Trial 115 finished with value: 0.3604004952420291 and parameters: {'model_name': 'SimpleImputer', 'strategy': 'mean'}. Best is trial 1 with value: 0.3604004952420291.
running
[I 2024-11-21 21:18:48,597] Trial 124 finished with value: 0.3604004952420291 and parameters: {'model_name': 'SimpleImputer', 'strategy': 'mean'}. Best is trial 1 with value: 0.3604004952420291.
running
[I 2024-11-21 21:18:48,755] Trial 119 finished with value: 0.3672367151158975 and parameters: {'model_name': 'SimpleImputer', 'strategy': 'median'}. Best is trial 1 with value: 0.3604004952420291.
running
[I 2024-11-21 21:18:48,888] Trial 126 finished with value: 0.3604004952420291 and parameters: {'model_name': 'SimpleImputer', 'strategy': 'mean'}. Best is trial 1 with value: 0.3604004952420291.
running
[I 2024-11-21 21:18:49,005] Trial 125 finished with value: 0.3604004952420291 and parameters: {'model_name': 'SimpleImputer', 'strategy': 'mean'}. Best is trial 1 with value: 0.3604004952420291.
[I 2024-11-21 21:18:49,099] Trial 120 finished with value: 0.3672367151158975 and parameters: {'model_name': 'SimpleImputer', 'strategy': 'median'}. Best is trial 1 with value: 0.3604004952420291.
running
running
[I 2024-11-21 21:18:49,223] Trial 128 finished with value: 0.3604004952420291 and parameters: {'model_name': 'SimpleImputer', 'strategy': 'mean'}. Best is trial 1 with value: 0.3604004952420291.
[I 2024-11-21 21:18:49,323] Trial 118 finished with value: 0.3672367151158975 and parameters: {'model_name': 'SimpleImputer', 'strategy': 'median'}. Best is trial 1 with value: 0.3604004952420291.
running
[I 2024-11-21 21:18:49,420] Trial 122 finished with value: 0.3672367151158975 and parameters: {'model_name': 'SimpleImputer', 'strategy': 'median'}. Best is trial 1 with value: 0.3604004952420291.
running
running
[I 2024-11-21 21:18:49,540] Trial 123 finished with value: 0.3672367151158975 and parameters: {'model_name': 'SimpleImputer', 'strategy': 'median'}. Best is trial 1 with value: 0.3604004952420291.
running
[I 2024-11-21 21:18:49,666] Trial 129 finished with value: 0.3672367151158975 and parameters: {'model_name': 'SimpleImputer', 'strategy': 'median'}. Best is trial 1 with value: 0.3604004952420291.
running
[I 2024-11-21 21:18:49,791] Trial 133 finished with value: 0.3604004952420291 and parameters: {'model_name': 'SimpleImputer', 'strategy': 'mean'}. Best is trial 1 with value: 0.3604004952420291.
[I 2024-11-21 21:18:49,879] Trial 131 finished with value: 0.3604004952420291 and parameters: {'model_name': 'SimpleImputer', 'strategy': 'mean'}. Best is trial 1 with value: 0.3604004952420291.
running
running
[I 2024-11-21 21:18:49,969] Trial 121 finished with value: 0.3672367151158975 and parameters: {'model_name': 'SimpleImputer', 'strategy': 'median'}. Best is trial 1 with value: 0.3604004952420291.
[I 2024-11-21 21:18:50,075] Trial 127 finished with value: 0.3672367151158975 and parameters: {'model_name': 'SimpleImputer', 'strategy': 'median'}. Best is trial 1 with value: 0.3604004952420291.
running
running
[I 2024-11-21 21:18:50,306] Trial 130 finished with value: 0.3672367151158975 and parameters: {'model_name': 'SimpleImputer', 'strategy': 'median'}. Best is trial 1 with value: 0.3604004952420291.
running
[I 2024-11-21 21:18:50,514] Trial 138 finished with value: 0.3604004952420291 and parameters: {'model_name': 'SimpleImputer', 'strategy': 'mean'}. Best is trial 1 with value: 0.3604004952420291.
running
[I 2024-11-21 21:18:50,661] Trial 137 finished with value: 0.3604004952420291 and parameters: {'model_name': 'SimpleImputer', 'strategy': 'mean'}. Best is trial 1 with value: 0.3604004952420291.
running
[I 2024-11-21 21:18:50,764] Trial 132 finished with value: 0.3672367151158975 and parameters: {'model_name': 'SimpleImputer', 'strategy': 'median'}. Best is trial 1 with value: 0.3604004952420291.
[I 2024-11-21 21:18:50,857] Trial 141 finished with value: 0.3604004952420291 and parameters: {'model_name': 'SimpleImputer', 'strategy': 'mean'}. Best is trial 1 with value: 0.3604004952420291.
running
running
[I 2024-11-21 21:18:51,033] Trial 140 finished with value: 0.3604004952420291 and parameters: {'model_name': 'SimpleImputer', 'strategy': 'mean'}. Best is trial 1 with value: 0.3604004952420291.
running
[I 2024-11-21 21:18:51,143] Trial 142 finished with value: 0.3604004952420291 and parameters: {'model_name': 'SimpleImputer', 'strategy': 'mean'}. Best is trial 1 with value: 0.3604004952420291.
running
[I 2024-11-21 21:18:51,246] Trial 146 finished with value: 0.3604004952420291 and parameters: {'model_name': 'SimpleImputer', 'strategy': 'mean'}. Best is trial 1 with value: 0.3604004952420291.
[I 2024-11-21 21:18:51,339] Trial 144 finished with value: 0.3604004952420291 and parameters: {'model_name': 'SimpleImputer', 'strategy': 'mean'}. Best is trial 1 with value: 0.3604004952420291.
running
running
[I 2024-11-21 21:18:51,444] Trial 135 finished with value: 0.3672367151158975 and parameters: {'model_name': 'SimpleImputer', 'strategy': 'median'}. Best is trial 1 with value: 0.3604004952420291.
[I 2024-11-21 21:18:51,533] Trial 143 finished with value: 0.3604004952420291 and parameters: {'model_name': 'SimpleImputer', 'strategy': 'mean'}. Best is trial 1 with value: 0.3604004952420291.
running
[I 2024-11-21 21:18:51,620] Trial 134 finished with value: 0.3672367151158975 and parameters: {'model_name': 'SimpleImputer', 'strategy': 'median'}. Best is trial 1 with value: 0.3604004952420291.
running
running
[I 2024-11-21 21:18:51,762] Trial 145 finished with value: 0.3604004952420291 and parameters: {'model_name': 'SimpleImputer', 'strategy': 'mean'}. Best is trial 1 with value: 0.3604004952420291.
running
[I 2024-11-21 21:18:51,922] Trial 139 finished with value: 0.3604004952420291 and parameters: {'model_name': 'SimpleImputer', 'strategy': 'mean'}. Best is trial 1 with value: 0.3604004952420291.
[I 2024-11-21 21:18:52,018] Trial 147 finished with value: 0.3604004952420291 and parameters: {'model_name': 'SimpleImputer', 'strategy': 'mean'}. Best is trial 1 with value: 0.3604004952420291.
running
running
[I 2024-11-21 21:18:52,147] Trial 136 finished with value: 0.3672367151158975 and parameters: {'model_name': 'SimpleImputer', 'strategy': 'median'}. Best is trial 1 with value: 0.3604004952420291.
[I 2024-11-21 21:18:52,247] Trial 148 finished with value: 0.3604004952420291 and parameters: {'model_name': 'SimpleImputer', 'strategy': 'mean'}. Best is trial 1 with value: 0.3604004952420291.
running
running
[I 2024-11-21 21:18:52,482] Trial 154 finished with value: 0.3604004952420291 and parameters: {'model_name': 'SimpleImputer', 'strategy': 'mean'}. Best is trial 1 with value: 0.3604004952420291.
[I 2024-11-21 21:18:52,575] Trial 150 finished with value: 0.3604004952420291 and parameters: {'model_name': 'SimpleImputer', 'strategy': 'mean'}. Best is trial 1 with value: 0.3604004952420291.
running
running
[I 2024-11-21 21:18:52,688] Trial 151 finished with value: 0.3604004952420291 and parameters: {'model_name': 'SimpleImputer', 'strategy': 'mean'}. Best is trial 1 with value: 0.3604004952420291.
running
[I 2024-11-21 21:18:52,832] Trial 152 finished with value: 0.3604004952420291 and parameters: {'model_name': 'SimpleImputer', 'strategy': 'mean'}. Best is trial 1 with value: 0.3604004952420291.
running
[I 2024-11-21 21:18:52,971] Trial 149 finished with value: 0.3604004952420291 and parameters: {'model_name': 'SimpleImputer', 'strategy': 'mean'}. Best is trial 1 with value: 0.3604004952420291.
running
[I 2024-11-21 21:18:53,114] Trial 158 finished with value: 0.3604004952420291 and parameters: {'model_name': 'SimpleImputer', 'strategy': 'mean'}. Best is trial 1 with value: 0.3604004952420291.
running
[I 2024-11-21 21:18:53,221] Trial 157 finished with value: 0.3604004952420291 and parameters: {'model_name': 'SimpleImputer', 'strategy': 'mean'}. Best is trial 1 with value: 0.3604004952420291.
running
[I 2024-11-21 21:18:53,314] Trial 153 finished with value: 0.3604004952420291 and parameters: {'model_name': 'SimpleImputer', 'strategy': 'mean'}. Best is trial 1 with value: 0.3604004952420291.
running
[I 2024-11-21 21:18:53,432] Trial 159 finished with value: 0.3604004952420291 and parameters: {'model_name': 'SimpleImputer', 'strategy': 'mean'}. Best is trial 1 with value: 0.3604004952420291.
running
[I 2024-11-21 21:18:53,559] Trial 156 finished with value: 0.3604004952420291 and parameters: {'model_name': 'SimpleImputer', 'strategy': 'mean'}. Best is trial 1 with value: 0.3604004952420291.
running
[I 2024-11-21 21:18:53,657] Trial 160 finished with value: 0.3604004952420291 and parameters: {'model_name': 'SimpleImputer', 'strategy': 'mean'}. Best is trial 1 with value: 0.3604004952420291.
running
[I 2024-11-21 21:18:53,771] Trial 155 finished with value: 0.3604004952420291 and parameters: {'model_name': 'SimpleImputer', 'strategy': 'mean'}. Best is trial 1 with value: 0.3604004952420291.
running
[I 2024-11-21 21:18:53,896] Trial 162 finished with value: 0.3604004952420291 and parameters: {'model_name': 'SimpleImputer', 'strategy': 'mean'}. Best is trial 1 with value: 0.3604004952420291.
running
[I 2024-11-21 21:18:54,004] Trial 161 finished with value: 0.3604004952420291 and parameters: {'model_name': 'SimpleImputer', 'strategy': 'mean'}. Best is trial 1 with value: 0.3604004952420291.
running
[I 2024-11-21 21:18:54,125] Trial 163 finished with value: 0.3604004952420291 and parameters: {'model_name': 'SimpleImputer', 'strategy': 'mean'}. Best is trial 1 with value: 0.3604004952420291.
running
[I 2024-11-21 21:18:54,285] Trial 164 finished with value: 0.3604004952420291 and parameters: {'model_name': 'SimpleImputer', 'strategy': 'mean'}. Best is trial 1 with value: 0.3604004952420291.
running
[I 2024-11-21 21:18:54,407] Trial 166 finished with value: 0.3604004952420291 and parameters: {'model_name': 'SimpleImputer', 'strategy': 'mean'}. Best is trial 1 with value: 0.3604004952420291.
running
[I 2024-11-21 21:18:54,575] Trial 168 finished with value: 0.3604004952420291 and parameters: {'model_name': 'SimpleImputer', 'strategy': 'mean'}. Best is trial 1 with value: 0.3604004952420291.
running
[I 2024-11-21 21:18:54,691] Trial 167 finished with value: 0.3604004952420291 and parameters: {'model_name': 'SimpleImputer', 'strategy': 'mean'}. Best is trial 1 with value: 0.3604004952420291.
running
[I 2024-11-21 21:18:54,800] Trial 172 finished with value: 0.3604004952420291 and parameters: {'model_name': 'SimpleImputer', 'strategy': 'mean'}. Best is trial 1 with value: 0.3604004952420291.
running
[I 2024-11-21 21:18:54,920] Trial 169 finished with value: 0.3604004952420291 and parameters: {'model_name': 'SimpleImputer', 'strategy': 'mean'}. Best is trial 1 with value: 0.3604004952420291.
running
[I 2024-11-21 21:18:55,110] Trial 165 finished with value: 0.3604004952420291 and parameters: {'model_name': 'SimpleImputer', 'strategy': 'mean'}. Best is trial 1 with value: 0.3604004952420291.
running
[I 2024-11-21 21:18:55,221] Trial 173 finished with value: 0.3604004952420291 and parameters: {'model_name': 'SimpleImputer', 'strategy': 'mean'}. Best is trial 1 with value: 0.3604004952420291.
running
[I 2024-11-21 21:18:55,360] Trial 171 finished with value: 0.3604004952420291 and parameters: {'model_name': 'SimpleImputer', 'strategy': 'mean'}. Best is trial 1 with value: 0.3604004952420291.
running
[I 2024-11-21 21:18:55,475] Trial 176 finished with value: 0.3604004952420291 and parameters: {'model_name': 'SimpleImputer', 'strategy': 'mean'}. Best is trial 1 with value: 0.3604004952420291.
running
[I 2024-11-21 21:18:55,585] Trial 177 finished with value: 0.3604004952420291 and parameters: {'model_name': 'SimpleImputer', 'strategy': 'mean'}. Best is trial 1 with value: 0.3604004952420291.
running
[I 2024-11-21 21:18:55,702] Trial 174 finished with value: 0.3604004952420291 and parameters: {'model_name': 'SimpleImputer', 'strategy': 'mean'}. Best is trial 1 with value: 0.3604004952420291.
running
[I 2024-11-21 21:18:55,807] Trial 178 finished with value: 0.3604004952420291 and parameters: {'model_name': 'SimpleImputer', 'strategy': 'mean'}. Best is trial 1 with value: 0.3604004952420291.
[I 2024-11-21 21:18:55,909] Trial 175 finished with value: 0.3604004952420291 and parameters: {'model_name': 'SimpleImputer', 'strategy': 'mean'}. Best is trial 1 with value: 0.3604004952420291.
running
running
[I 2024-11-21 21:18:56,016] Trial 170 finished with value: 0.3604004952420291 and parameters: {'model_name': 'SimpleImputer', 'strategy': 'mean'}. Best is trial 1 with value: 0.3604004952420291.
running
[I 2024-11-21 21:18:56,121] Trial 180 finished with value: 0.3604004952420291 and parameters: {'model_name': 'SimpleImputer', 'strategy': 'mean'}. Best is trial 1 with value: 0.3604004952420291.
running
[I 2024-11-21 21:18:56,244] Trial 181 finished with value: 0.3604004952420291 and parameters: {'model_name': 'SimpleImputer', 'strategy': 'mean'}. Best is trial 1 with value: 0.3604004952420291.
running
[I 2024-11-21 21:18:56,439] Trial 183 finished with value: 0.3604004952420291 and parameters: {'model_name': 'SimpleImputer', 'strategy': 'mean'}. Best is trial 1 with value: 0.3604004952420291.
running
[I 2024-11-21 21:18:56,543] Trial 184 finished with value: 0.3604004952420291 and parameters: {'model_name': 'SimpleImputer', 'strategy': 'mean'}. Best is trial 1 with value: 0.3604004952420291.
[I 2024-11-21 21:18:56,636] Trial 182 finished with value: 0.3604004952420291 and parameters: {'model_name': 'SimpleImputer', 'strategy': 'mean'}. Best is trial 1 with value: 0.3604004952420291.
running
running
[I 2024-11-21 21:18:56,787] Trial 179 finished with value: 0.3604004952420291 and parameters: {'model_name': 'SimpleImputer', 'strategy': 'mean'}. Best is trial 1 with value: 0.3604004952420291.
[I 2024-11-21 21:18:56,913] Trial 185 finished with value: 0.3604004952420291 and parameters: {'model_name': 'SimpleImputer', 'strategy': 'mean'}. Best is trial 1 with value: 0.3604004952420291.
[I 2024-11-21 21:18:57,082] Trial 187 finished with value: 0.3604004952420291 and parameters: {'model_name': 'SimpleImputer', 'strategy': 'mean'}. Best is trial 1 with value: 0.3604004952420291.
[I 2024-11-21 21:18:57,209] Trial 188 finished with value: 0.3604004952420291 and parameters: {'model_name': 'SimpleImputer', 'strategy': 'mean'}. Best is trial 1 with value: 0.3604004952420291.
[I 2024-11-21 21:18:57,346] Trial 189 finished with value: 0.3604004952420291 and parameters: {'model_name': 'SimpleImputer', 'strategy': 'mean'}. Best is trial 1 with value: 0.3604004952420291.
[I 2024-11-21 21:18:57,463] Trial 191 finished with value: 0.3604004952420291 and parameters: {'model_name': 'SimpleImputer', 'strategy': 'mean'}. Best is trial 1 with value: 0.3604004952420291.
[I 2024-11-21 21:18:57,574] Trial 186 finished with value: 0.3604004952420291 and parameters: {'model_name': 'SimpleImputer', 'strategy': 'mean'}. Best is trial 1 with value: 0.3604004952420291.
[I 2024-11-21 21:18:57,670] Trial 196 finished with value: 0.3604004952420291 and parameters: {'model_name': 'SimpleImputer', 'strategy': 'mean'}. Best is trial 1 with value: 0.3604004952420291.
[I 2024-11-21 21:18:57,775] Trial 190 finished with value: 0.3604004952420291 and parameters: {'model_name': 'SimpleImputer', 'strategy': 'mean'}. Best is trial 1 with value: 0.3604004952420291.
[I 2024-11-21 21:18:57,866] Trial 197 finished with value: 0.3604004952420291 and parameters: {'model_name': 'SimpleImputer', 'strategy': 'mean'}. Best is trial 1 with value: 0.3604004952420291.
[I 2024-11-21 21:18:57,943] Trial 194 finished with value: 0.3604004952420291 and parameters: {'model_name': 'SimpleImputer', 'strategy': 'mean'}. Best is trial 1 with value: 0.3604004952420291.
[I 2024-11-21 21:18:58,021] Trial 192 finished with value: 0.3604004952420291 and parameters: {'model_name': 'SimpleImputer', 'strategy': 'mean'}. Best is trial 1 with value: 0.3604004952420291.
[I 2024-11-21 21:18:58,101] Trial 198 finished with value: 0.3604004952420291 and parameters: {'model_name': 'SimpleImputer', 'strategy': 'mean'}. Best is trial 1 with value: 0.3604004952420291.
[I 2024-11-21 21:18:58,181] Trial 193 finished with value: 0.3604004952420291 and parameters: {'model_name': 'SimpleImputer', 'strategy': 'mean'}. Best is trial 1 with value: 0.3604004952420291.
[I 2024-11-21 21:18:58,264] Trial 195 finished with value: 0.3604004952420291 and parameters: {'model_name': 'SimpleImputer', 'strategy': 'mean'}. Best is trial 1 with value: 0.3604004952420291.
