Run: 51
/cm/local/apps/slurm/var/spool/job1010643/slurm_script: line 26: 
pip install -e tpot2
pip install -r tpot2/ImputerExperiments/requirements_.txt
: No such file or directory
RunStart
Version 0.1.7a0 of tpot2 is outdated. Version 0.1.8a0 was released Tuesday September 17, 2024.
starting loops
../data/c/251/251.pkl
working on 
../data/c/251/class_full_MCAR_0.3_3
2.1740314960479736
running experiment 1/3 - Does large hyperparameter space improve reconstruction accuracy over simple
[I 2024-10-22 02:13:24,447] A new study created in memory with name: no-name-1671917a-c5bc-4e25-8abb-ccce0697f85d
running
running
running
running
running
running
running
running
running
running
running
running
running
running
running
running
[I 2024-10-22 02:13:24,766] Trial 13 finished with value: 0.21617524261413962 and parameters: {'model_name': 'SimpleImputer', 'strategy': 'mean'}. Best is trial 13 with value: 0.21617524261413962.
running
[I 2024-10-22 02:13:26,460] Trial 5 finished with value: 0.2497187674733902 and parameters: {'model_name': 'SimpleImputer', 'strategy': 'median'}. Best is trial 13 with value: 0.21617524261413962.
running
[I 2024-10-22 02:13:43,067] Trial 3 finished with value: 0.19856102832365577 and parameters: {'model_name': 'IterativeImputer', 'estimator': 'Ridge', 'initial_strategy': 'most_frequent', 'n_nearest_features': 1, 'imputation_order': 'arabic'}. Best is trial 3 with value: 0.19856102832365577.
running
[I 2024-10-22 02:13:45,557] Trial 12 finished with value: 0.17765904909313826 and parameters: {'model_name': 'IterativeImputer', 'estimator': 'Ridge', 'initial_strategy': 'most_frequent', 'n_nearest_features': 3, 'imputation_order': 'arabic'}. Best is trial 12 with value: 0.17765904909313826.
running
[I 2024-10-22 02:13:46,113] Trial 2 finished with value: 0.1776369923858027 and parameters: {'model_name': 'IterativeImputer', 'estimator': 'Ridge', 'initial_strategy': 'median', 'n_nearest_features': 3, 'imputation_order': 'arabic'}. Best is trial 2 with value: 0.1776369923858027.
running
[I 2024-10-22 02:13:56,871] Trial 18 finished with value: 0.16672170852326065 and parameters: {'model_name': 'IterativeImputer', 'estimator': 'Ridge', 'initial_strategy': 'mean', 'n_nearest_features': 8, 'imputation_order': 'arabic'}. Best is trial 18 with value: 0.16672170852326065.
running
[I 2024-10-22 02:14:02,487] Trial 7 finished with value: 0.18571297695536249 and parameters: {'model_name': 'KNNImputer', 'n_neighbors': 2410, 'weights': 'uniform'}. Best is trial 18 with value: 0.16672170852326065.
running
[I 2024-10-22 02:14:13,829] Trial 14 finished with value: 0.21575960152642146 and parameters: {'model_name': 'KNNImputer', 'n_neighbors': 14577, 'weights': 'uniform'}. Best is trial 18 with value: 0.16672170852326065.
running
[I 2024-10-22 02:14:14,105] Trial 23 finished with value: 0.21617524261413962 and parameters: {'model_name': 'SimpleImputer', 'strategy': 'mean'}. Best is trial 18 with value: 0.16672170852326065.
running
[I 2024-10-22 02:14:14,485] Trial 24 finished with value: 0.21617524261413962 and parameters: {'model_name': 'SimpleImputer', 'strategy': 'mean'}. Best is trial 18 with value: 0.16672170852326065.
running
[I 2024-10-22 02:14:15,254] Trial 6 finished with value: 0.1692960471995312 and parameters: {'model_name': 'IterativeImputer', 'estimator': 'Bayesian', 'initial_strategy': 'mean', 'n_nearest_features': 6, 'imputation_order': 'ascending', 'sample_posterior': False}. Best is trial 18 with value: 0.16672170852326065.
running
[I 2024-10-22 02:14:37,350] Trial 20 finished with value: 0.21617524261413962 and parameters: {'model_name': 'KNNImputer', 'n_neighbors': 26220, 'weights': 'uniform'}. Best is trial 18 with value: 0.16672170852326065.
running
[I 2024-10-22 02:14:38,417] Trial 8 finished with value: 0.23297858525000534 and parameters: {'model_name': 'IterativeImputer', 'estimator': 'Bayesian', 'initial_strategy': 'median', 'n_nearest_features': 9, 'imputation_order': 'random', 'sample_posterior': True}. Best is trial 18 with value: 0.16672170852326065.
running
[I 2024-10-22 02:14:39,392] Trial 16 finished with value: 0.21847116759433494 and parameters: {'model_name': 'KNNImputer', 'n_neighbors': 21824, 'weights': 'distance'}. Best is trial 18 with value: 0.16672170852326065.
running
[I 2024-10-22 02:14:40,287] Trial 17 finished with value: 0.2189244303289189 and parameters: {'model_name': 'KNNImputer', 'n_neighbors': 21099, 'weights': 'distance'}. Best is trial 18 with value: 0.16672170852326065.
running
[I 2024-10-22 02:14:44,896] Trial 27 finished with value: 0.26593608711620204 and parameters: {'model_name': 'VAE', 'batch_size': 6, 'iterations': 1, 'learning_rate': 0.09859218569304021, 'p_miss': 0.22233753619447055}. Best is trial 18 with value: 0.16672170852326065.
running
[I 2024-10-22 02:14:47,105] Trial 28 finished with value: 0.32943641456403416 and parameters: {'model_name': 'VAE', 'batch_size': 3, 'iterations': 2, 'learning_rate': 0.0002459390645368461, 'p_miss': 0.17909655316839146}. Best is trial 18 with value: 0.16672170852326065.
running
[I 2024-10-22 02:14:47,799] Trial 1 finished with value: 0.32100676297041597 and parameters: {'model_name': 'VAE', 'batch_size': 143, 'iterations': 1, 'learning_rate': 0.00679905613757434, 'p_miss': 0.15298095722249785}. Best is trial 18 with value: 0.16672170852326065.
running
[I 2024-10-22 02:14:48,717] Trial 21 finished with value: 0.21193109069893992 and parameters: {'model_name': 'KNNImputer', 'n_neighbors': 11213, 'weights': 'distance'}. Best is trial 18 with value: 0.16672170852326065.
running
[I 2024-10-22 02:15:04,689] Trial 10 finished with value: 0.23341291308342632 and parameters: {'model_name': 'VAE', 'batch_size': 49, 'iterations': 5, 'learning_rate': 0.036150239613713914, 'p_miss': 0.021348440693977747}. Best is trial 18 with value: 0.16672170852326065.
running
[I 2024-10-22 02:15:10,544] Trial 11 finished with value: 0.2719762463505189 and parameters: {'model_name': 'GAIN', 'batch_size': 9, 'hint_rate': 0.5036781456641677, 'alpha': 98, 'iterations': 22, 'learning_rate': 0.060092368250838406, 'p_miss': 0.17489959996423185}. Best is trial 18 with value: 0.16672170852326065.
running
[I 2024-10-22 02:15:12,716] Trial 4 finished with value: 0.27336281870128426 and parameters: {'model_name': 'GAIN', 'batch_size': 46, 'hint_rate': 0.18778068006808668, 'alpha': 90, 'iterations': 26, 'learning_rate': 0.0045399058630174426, 'p_miss': 0.17565257773194506}. Best is trial 18 with value: 0.16672170852326065.
running
[I 2024-10-22 02:15:17,552] Trial 30 finished with value: inf and parameters: {'model_name': 'GAIN', 'batch_size': 1, 'hint_rate': 0.25464285188900293, 'alpha': 42, 'iterations': 228, 'learning_rate': 0.0019164329925400129, 'p_miss': 0.13747011500212558}. Best is trial 18 with value: 0.16672170852326065.
running
[I 2024-10-22 02:15:29,272] Trial 0 finished with value: inf and parameters: {'model_name': 'GAIN', 'batch_size': 5, 'hint_rate': 0.5994913203078827, 'alpha': 8, 'iterations': 439, 'learning_rate': 0.010684031911178221, 'p_miss': 0.09661057680987203}. Best is trial 18 with value: 0.16672170852326065.
running
[I 2024-10-22 02:15:33,236] Trial 25 finished with value: inf and parameters: {'model_name': 'GAIN', 'batch_size': 1, 'hint_rate': 0.3995413957662222, 'alpha': 8, 'iterations': 477, 'learning_rate': 0.027685402744553254, 'p_miss': 0.09587063396725877}. Best is trial 18 with value: 0.16672170852326065.
running
[I 2024-10-22 02:15:33,723] Trial 36 finished with value: 0.1674917608764141 and parameters: {'model_name': 'IterativeImputer', 'estimator': 'Ridge', 'initial_strategy': 'mean', 'n_nearest_features': 7, 'imputation_order': 'ascending'}. Best is trial 18 with value: 0.16672170852326065.
running
[I 2024-10-22 02:15:34,920] Trial 37 finished with value: 0.1674917608764141 and parameters: {'model_name': 'IterativeImputer', 'estimator': 'Ridge', 'initial_strategy': 'mean', 'n_nearest_features': 7, 'imputation_order': 'ascending'}. Best is trial 18 with value: 0.16672170852326065.
running
[I 2024-10-22 02:15:42,567] Trial 38 finished with value: 0.1674917608764141 and parameters: {'model_name': 'IterativeImputer', 'estimator': 'Ridge', 'initial_strategy': 'mean', 'n_nearest_features': 7, 'imputation_order': 'ascending'}. Best is trial 18 with value: 0.16672170852326065.
running
[I 2024-10-22 02:16:01,155] Trial 39 finished with value: 0.1674917608764141 and parameters: {'model_name': 'IterativeImputer', 'estimator': 'Ridge', 'initial_strategy': 'mean', 'n_nearest_features': 7, 'imputation_order': 'ascending'}. Best is trial 18 with value: 0.16672170852326065.
running
[I 2024-10-22 02:16:16,290] Trial 26 finished with value: 0.2738577642519694 and parameters: {'model_name': 'GAIN', 'batch_size': 138, 'hint_rate': 0.5462801613954557, 'alpha': 74, 'iterations': 159, 'learning_rate': 0.00017002372643863095, 'p_miss': 0.1342300086808996}. Best is trial 18 with value: 0.16672170852326065.
running
[I 2024-10-22 02:17:10,026] Trial 40 finished with value: 0.16750314738813718 and parameters: {'model_name': 'IterativeImputer', 'estimator': 'Bayesian', 'initial_strategy': 'mean', 'n_nearest_features': 7, 'imputation_order': 'ascending', 'sample_posterior': False}. Best is trial 18 with value: 0.16672170852326065.
running
[I 2024-10-22 02:17:40,805] Trial 46 finished with value: 0.16672171512891154 and parameters: {'model_name': 'IterativeImputer', 'estimator': 'Ridge', 'initial_strategy': 'mean', 'n_nearest_features': 8, 'imputation_order': 'roman'}. Best is trial 18 with value: 0.16672170852326065.
running
[I 2024-10-22 02:17:44,779] Trial 41 finished with value: 0.1748149741233558 and parameters: {'model_name': 'IterativeImputer', 'estimator': 'KNN', 'initial_strategy': 'mean', 'n_nearest_features': 8, 'imputation_order': 'ascending'}. Best is trial 18 with value: 0.16672170852326065.
running
[I 2024-10-22 02:17:47,785] Trial 42 finished with value: 0.1748149741233558 and parameters: {'model_name': 'IterativeImputer', 'estimator': 'KNN', 'initial_strategy': 'mean', 'n_nearest_features': 8, 'imputation_order': 'ascending'}. Best is trial 18 with value: 0.16672170852326065.
running
[I 2024-10-22 02:17:51,047] Trial 43 finished with value: 0.1748149741233558 and parameters: {'model_name': 'IterativeImputer', 'estimator': 'KNN', 'initial_strategy': 'mean', 'n_nearest_features': 8, 'imputation_order': 'ascending'}. Best is trial 18 with value: 0.16672170852326065.
running
[I 2024-10-22 02:17:58,995] Trial 44 finished with value: 0.17527568527776088 and parameters: {'model_name': 'IterativeImputer', 'estimator': 'KNN', 'initial_strategy': 'constant', 'n_nearest_features': 9, 'imputation_order': 'descending'}. Best is trial 18 with value: 0.16672170852326065.
running
[I 2024-10-22 02:18:08,386] Trial 45 finished with value: 0.17527568527776088 and parameters: {'model_name': 'IterativeImputer', 'estimator': 'KNN', 'initial_strategy': 'constant', 'n_nearest_features': 9, 'imputation_order': 'descending'}. Best is trial 18 with value: 0.16672170852326065.
running
[I 2024-10-22 02:22:33,038] Trial 29 finished with value: 0.28835829269061847 and parameters: {'model_name': 'GAIN', 'batch_size': 162, 'hint_rate': 0.5799687330121954, 'alpha': 86, 'iterations': 575, 'learning_rate': 0.0022821305575025275, 'p_miss': 0.22864707915359217}. Best is trial 18 with value: 0.16672170852326065.
running
[I 2024-10-22 02:54:28,350] Trial 9 finished with value: 0.22117166876874284 and parameters: {'model_name': 'VAE', 'batch_size': 721, 'iterations': 864, 'learning_rate': 0.00015237480944322936, 'p_miss': 0.2601275827737667}. Best is trial 18 with value: 0.16672170852326065.
running
[I 2024-10-22 03:01:18,298] Trial 15 finished with value: 0.17575010970809518 and parameters: {'model_name': 'IterativeImputer', 'estimator': 'RFR', 'initial_strategy': 'constant', 'n_nearest_features': 4, 'imputation_order': 'descending'}. Best is trial 18 with value: 0.16672170852326065.
running
[I 2024-10-22 03:01:44,330] Trial 55 finished with value: 0.17056439118529673 and parameters: {'model_name': 'IterativeImputer', 'estimator': 'Ridge', 'initial_strategy': 'mean', 'n_nearest_features': 6, 'imputation_order': 'roman'}. Best is trial 18 with value: 0.16672170852326065.
running
[I 2024-10-22 03:02:10,805] Trial 56 finished with value: 0.1678973851293189 and parameters: {'model_name': 'IterativeImputer', 'estimator': 'Ridge', 'initial_strategy': 'mean', 'n_nearest_features': 7, 'imputation_order': 'roman'}. Best is trial 18 with value: 0.16672170852326065.
running
[I 2024-10-22 03:02:33,705] Trial 57 finished with value: 0.17056439118529673 and parameters: {'model_name': 'IterativeImputer', 'estimator': 'Ridge', 'initial_strategy': 'mean', 'n_nearest_features': 6, 'imputation_order': 'roman'}. Best is trial 18 with value: 0.16672170852326065.
running
[I 2024-10-22 03:02:59,717] Trial 58 finished with value: 0.1674917608764141 and parameters: {'model_name': 'IterativeImputer', 'estimator': 'Ridge', 'initial_strategy': 'mean', 'n_nearest_features': 7, 'imputation_order': 'ascending'}. Best is trial 18 with value: 0.16672170852326065.
running
[I 2024-10-22 03:03:15,313] Trial 59 finished with value: 0.16672171512891154 and parameters: {'model_name': 'IterativeImputer', 'estimator': 'Ridge', 'initial_strategy': 'mean', 'n_nearest_features': 8, 'imputation_order': 'roman'}. Best is trial 18 with value: 0.16672170852326065.
running
[I 2024-10-22 03:03:32,837] Trial 60 finished with value: 0.16672171512891154 and parameters: {'model_name': 'IterativeImputer', 'estimator': 'Ridge', 'initial_strategy': 'mean', 'n_nearest_features': 8, 'imputation_order': 'roman'}. Best is trial 18 with value: 0.16672170852326065.
running
[I 2024-10-22 03:03:49,873] Trial 61 finished with value: 0.16672171512891154 and parameters: {'model_name': 'IterativeImputer', 'estimator': 'Ridge', 'initial_strategy': 'mean', 'n_nearest_features': 8, 'imputation_order': 'roman'}. Best is trial 18 with value: 0.16672170852326065.
running
[I 2024-10-22 03:04:07,345] Trial 62 finished with value: 0.16672171512891154 and parameters: {'model_name': 'IterativeImputer', 'estimator': 'Ridge', 'initial_strategy': 'mean', 'n_nearest_features': 8, 'imputation_order': 'roman'}. Best is trial 18 with value: 0.16672170852326065.
running
[I 2024-10-22 03:12:45,527] Trial 50 finished with value: 0.16864905533474348 and parameters: {'model_name': 'IterativeImputer', 'estimator': 'RFR', 'initial_strategy': 'constant', 'n_nearest_features': 5, 'imputation_order': 'roman'}. Best is trial 18 with value: 0.16672170852326065.
running
[I 2024-10-22 03:12:58,767] Trial 51 finished with value: 0.16938878393612516 and parameters: {'model_name': 'IterativeImputer', 'estimator': 'RFR', 'initial_strategy': 'mean', 'n_nearest_features': 5, 'imputation_order': 'roman'}. Best is trial 18 with value: 0.16672170852326065.
running
[I 2024-10-22 03:12:59,295] Trial 65 finished with value: 0.27649210471238905 and parameters: {'model_name': 'SimpleImputer', 'strategy': 'constant'}. Best is trial 18 with value: 0.16672170852326065.
running
[I 2024-10-22 03:13:00,567] Trial 52 finished with value: 0.169004042874861 and parameters: {'model_name': 'IterativeImputer', 'estimator': 'RFR', 'initial_strategy': 'mean', 'n_nearest_features': 5, 'imputation_order': 'roman'}. Best is trial 18 with value: 0.16672170852326065.
running
[I 2024-10-22 03:13:02,229] Trial 64 finished with value: 0.16672171512891154 and parameters: {'model_name': 'IterativeImputer', 'estimator': 'Ridge', 'initial_strategy': 'mean', 'n_nearest_features': 9, 'imputation_order': 'roman'}. Best is trial 18 with value: 0.16672170852326065.
running
[I 2024-10-22 03:13:17,352] Trial 66 finished with value: 0.16672171512891154 and parameters: {'model_name': 'IterativeImputer', 'estimator': 'Ridge', 'initial_strategy': 'mean', 'n_nearest_features': 8, 'imputation_order': 'roman'}. Best is trial 18 with value: 0.16672170852326065.
running
[I 2024-10-22 03:13:19,516] Trial 67 finished with value: 0.16672171512891154 and parameters: {'model_name': 'IterativeImputer', 'estimator': 'Ridge', 'initial_strategy': 'mean', 'n_nearest_features': 8, 'imputation_order': 'roman'}. Best is trial 18 with value: 0.16672170852326065.
running
[I 2024-10-22 03:13:20,797] Trial 68 finished with value: 0.16672171512891154 and parameters: {'model_name': 'IterativeImputer', 'estimator': 'Ridge', 'initial_strategy': 'mean', 'n_nearest_features': 8, 'imputation_order': 'roman'}. Best is trial 18 with value: 0.16672170852326065.
running
[I 2024-10-22 03:13:34,153] Trial 69 finished with value: 0.16672171512891154 and parameters: {'model_name': 'IterativeImputer', 'estimator': 'Ridge', 'initial_strategy': 'mean', 'n_nearest_features': 8, 'imputation_order': 'roman'}. Best is trial 18 with value: 0.16672170852326065.
running
[I 2024-10-22 03:13:39,553] Trial 70 finished with value: 0.16672171374232794 and parameters: {'model_name': 'IterativeImputer', 'estimator': 'Ridge', 'initial_strategy': 'most_frequent', 'n_nearest_features': 8, 'imputation_order': 'arabic'}. Best is trial 18 with value: 0.16672170852326065.
running
[I 2024-10-22 03:18:00,964] Trial 53 finished with value: 0.1688937002131628 and parameters: {'model_name': 'IterativeImputer', 'estimator': 'RFR', 'initial_strategy': 'mean', 'n_nearest_features': 5, 'imputation_order': 'roman'}. Best is trial 18 with value: 0.16672170852326065.
running
[I 2024-10-22 03:37:22,374] Trial 19 finished with value: 0.16080347057116687 and parameters: {'model_name': 'IterativeImputer', 'estimator': 'RFR', 'initial_strategy': 'mean', 'n_nearest_features': 9, 'imputation_order': 'roman'}. Best is trial 19 with value: 0.16080347057116687.
running
[I 2024-10-22 03:40:00,349] Trial 49 finished with value: 0.16137652332883984 and parameters: {'model_name': 'IterativeImputer', 'estimator': 'RFR', 'initial_strategy': 'constant', 'n_nearest_features': 9, 'imputation_order': 'roman'}. Best is trial 19 with value: 0.16080347057116687.
running
[I 2024-10-22 03:40:10,558] Trial 48 finished with value: 0.16098901763766454 and parameters: {'model_name': 'IterativeImputer', 'estimator': 'RFR', 'initial_strategy': 'constant', 'n_nearest_features': 9, 'imputation_order': 'roman'}. Best is trial 19 with value: 0.16080347057116687.
running
[I 2024-10-22 03:40:19,345] Trial 47 finished with value: 0.16071067842782566 and parameters: {'model_name': 'IterativeImputer', 'estimator': 'RFR', 'initial_strategy': 'mean', 'n_nearest_features': 9, 'imputation_order': 'roman'}. Best is trial 47 with value: 0.16071067842782566.
running
[I 2024-10-22 03:53:59,473] Trial 54 finished with value: 0.16918086963843862 and parameters: {'model_name': 'IterativeImputer', 'estimator': 'RFR', 'initial_strategy': 'mean', 'n_nearest_features': 5, 'imputation_order': 'roman'}. Best is trial 47 with value: 0.16071067842782566.
running
[I 2024-10-22 04:03:29,574] Trial 35 finished with value: 0.2994234238997666 and parameters: {'model_name': 'GAIN', 'batch_size': 667, 'hint_rate': 0.4939023753226081, 'alpha': 97, 'iterations': 5659, 'learning_rate': 0.00012994685428801346, 'p_miss': 0.29946081789681533}. Best is trial 47 with value: 0.16071067842782566.
running
[I 2024-10-22 04:10:51,682] Trial 33 finished with value: 0.2785574694524816 and parameters: {'model_name': 'GAIN', 'batch_size': 796, 'hint_rate': 0.4896542792756792, 'alpha': 17, 'iterations': 5794, 'learning_rate': 0.0001226395786121942, 'p_miss': 0.02988012632299339}. Best is trial 47 with value: 0.16071067842782566.
running
[I 2024-10-22 04:11:29,957] Trial 81 finished with value: 0.32530141515864786 and parameters: {'model_name': 'VAE', 'batch_size': 18, 'iterations': 7, 'learning_rate': 0.0005913563682172984, 'p_miss': 0.06888562525585556}. Best is trial 47 with value: 0.16071067842782566.
running
[I 2024-10-22 04:11:59,934] Trial 82 finished with value: 0.21637908969202294 and parameters: {'model_name': 'KNNImputer', 'n_neighbors': 30585, 'weights': 'distance'}. Best is trial 47 with value: 0.16071067842782566.
running
[I 2024-10-22 04:12:01,425] Trial 83 finished with value: 0.26342172599851416 and parameters: {'model_name': 'SimpleImputer', 'strategy': 'most_frequent'}. Best is trial 47 with value: 0.16071067842782566.
running
[I 2024-10-22 04:32:57,230] Trial 63 finished with value: 0.16098289214733072 and parameters: {'model_name': 'IterativeImputer', 'estimator': 'RFR', 'initial_strategy': 'mean', 'n_nearest_features': 9, 'imputation_order': 'roman'}. Best is trial 47 with value: 0.16071067842782566.
running
[I 2024-10-22 04:57:43,375] Trial 32 finished with value: 0.27696523325811206 and parameters: {'model_name': 'GAIN', 'batch_size': 942, 'hint_rate': 0.48535263074289986, 'alpha': 92, 'iterations': 7088, 'learning_rate': 0.01630915459115788, 'p_miss': 0.027423771473430475}. Best is trial 47 with value: 0.16071067842782566.
running
[I 2024-10-22 05:00:55,834] Trial 86 finished with value: 0.30413599813744174 and parameters: {'model_name': 'VAE', 'batch_size': 2, 'iterations': 45, 'learning_rate': 0.0009026207179858981, 'p_miss': 0.287945078148922}. Best is trial 47 with value: 0.16071067842782566.
running
[I 2024-10-22 05:03:33,834] Trial 31 finished with value: 0.2771654899287889 and parameters: {'model_name': 'GAIN', 'batch_size': 909, 'hint_rate': 0.05471062675973115, 'alpha': 85, 'iterations': 7410, 'learning_rate': 0.0001138181281238692, 'p_miss': 0.02838049950041352}. Best is trial 47 with value: 0.16071067842782566.
running
[I 2024-10-22 05:24:36,007] Trial 34 finished with value: 0.28089001260439067 and parameters: {'model_name': 'GAIN', 'batch_size': 491, 'hint_rate': 0.4482285751911359, 'alpha': 8, 'iterations': 8555, 'learning_rate': 0.00011391670848342236, 'p_miss': 0.04882675115290222}. Best is trial 47 with value: 0.16071067842782566.
running
