[I 2024-08-14 00:00:20,312] Trial 172 finished with value: 0.06765467674722808 and parameters: {'model_name': 'KNNImputer', 'n_neighbors': 1647, 'weights': 'uniform'}. Best is trial 93 with value: 0.0458692748749441.
running
[I 2024-08-14 00:07:19,515] Trial 156 finished with value: 0.047213039461324734 and parameters: {'model_name': 'IterativeImputer', 'estimator': 'RFR', 'initial_strategy': 'mean', 'n_nearest_features': 9, 'imputation_order': 'random'}. Best is trial 93 with value: 0.0458692748749441.
running
[I 2024-08-14 00:07:36,818] Trial 174 finished with value: 0.05892851946285964 and parameters: {'model_name': 'IterativeImputer', 'estimator': 'KNN', 'initial_strategy': 'mean', 'n_nearest_features': 9, 'imputation_order': 'random'}. Best is trial 93 with value: 0.0458692748749441.
running
[I 2024-08-14 00:08:25,952] Trial 157 finished with value: 0.04790183428263099 and parameters: {'model_name': 'IterativeImputer', 'estimator': 'RFR', 'initial_strategy': 'mean', 'n_nearest_features': 9, 'imputation_order': 'descending'}. Best is trial 93 with value: 0.0458692748749441.
running
[I 2024-08-14 00:16:25,820] Trial 158 finished with value: 0.04805935438830755 and parameters: {'model_name': 'IterativeImputer', 'estimator': 'RFR', 'initial_strategy': 'most_frequent', 'n_nearest_features': 9, 'imputation_order': 'random'}. Best is trial 93 with value: 0.0458692748749441.
running
[I 2024-08-14 00:18:21,422] Trial 159 finished with value: 0.047726898399713245 and parameters: {'model_name': 'IterativeImputer', 'estimator': 'RFR', 'initial_strategy': 'most_frequent', 'n_nearest_features': 9, 'imputation_order': 'random'}. Best is trial 93 with value: 0.0458692748749441.
running
[I 2024-08-14 00:19:04,991] Trial 160 finished with value: 0.04882014314925132 and parameters: {'model_name': 'IterativeImputer', 'estimator': 'RFR', 'initial_strategy': 'most_frequent', 'n_nearest_features': 9, 'imputation_order': 'random'}. Best is trial 93 with value: 0.0458692748749441.
running
[I 2024-08-14 00:19:43,777] Trial 161 finished with value: 0.049037547663212354 and parameters: {'model_name': 'IterativeImputer', 'estimator': 'RFR', 'initial_strategy': 'most_frequent', 'n_nearest_features': 9, 'imputation_order': 'random'}. Best is trial 93 with value: 0.0458692748749441.
running
[I 2024-08-14 00:25:31,909] Trial 162 finished with value: 0.04890713523242449 and parameters: {'model_name': 'IterativeImputer', 'estimator': 'RFR', 'initial_strategy': 'most_frequent', 'n_nearest_features': 9, 'imputation_order': 'random'}. Best is trial 93 with value: 0.0458692748749441.
running
[I 2024-08-14 00:25:33,972] Trial 181 finished with value: 0.06881387546961931 and parameters: {'model_name': 'KNNImputer', 'n_neighbors': 2022, 'weights': 'uniform'}. Best is trial 93 with value: 0.0458692748749441.
running
[I 2024-08-14 00:25:57,496] Trial 163 finished with value: 0.04754020974615424 and parameters: {'model_name': 'IterativeImputer', 'estimator': 'RFR', 'initial_strategy': 'most_frequent', 'n_nearest_features': 9, 'imputation_order': 'random'}. Best is trial 93 with value: 0.0458692748749441.
running
[I 2024-08-14 00:38:53,549] Trial 165 finished with value: 0.04907734614741579 and parameters: {'model_name': 'IterativeImputer', 'estimator': 'RFR', 'initial_strategy': 'most_frequent', 'n_nearest_features': 9, 'imputation_order': 'random'}. Best is trial 93 with value: 0.0458692748749441.
running
[I 2024-08-14 00:40:16,999] Trial 184 finished with value: 0.11462312861125996 and parameters: {'model_name': 'IterativeImputer', 'estimator': 'Bayesian', 'initial_strategy': 'most_frequent', 'n_nearest_features': 10, 'imputation_order': 'random', 'sample_posterior': True}. Best is trial 93 with value: 0.0458692748749441.
running
[I 2024-08-14 00:40:20,111] Trial 185 finished with value: 0.06503863195110286 and parameters: {'model_name': 'KNNImputer', 'n_neighbors': 1094, 'weights': 'uniform'}. Best is trial 93 with value: 0.0458692748749441.
running
[I 2024-08-14 00:45:35,637] Trial 166 finished with value: 0.04808698836648965 and parameters: {'model_name': 'IterativeImputer', 'estimator': 'RFR', 'initial_strategy': 'most_frequent', 'n_nearest_features': 9, 'imputation_order': 'random'}. Best is trial 93 with value: 0.0458692748749441.
running
[I 2024-08-14 00:47:50,496] Trial 167 finished with value: 0.04771217311556218 and parameters: {'model_name': 'IterativeImputer', 'estimator': 'RFR', 'initial_strategy': 'most_frequent', 'n_nearest_features': 9, 'imputation_order': 'random'}. Best is trial 93 with value: 0.0458692748749441.
running
[I 2024-08-14 00:49:33,427] Trial 168 finished with value: 0.048311073421556626 and parameters: {'model_name': 'IterativeImputer', 'estimator': 'RFR', 'initial_strategy': 'most_frequent', 'n_nearest_features': 9, 'imputation_order': 'random'}. Best is trial 93 with value: 0.0458692748749441.
running
[I 2024-08-14 00:56:53,280] Trial 169 finished with value: 0.047494562251824045 and parameters: {'model_name': 'IterativeImputer', 'estimator': 'RFR', 'initial_strategy': 'most_frequent', 'n_nearest_features': 9, 'imputation_order': 'random'}. Best is trial 93 with value: 0.0458692748749441.
running
[I 2024-08-14 00:57:18,913] Trial 170 finished with value: 0.047540275145990143 and parameters: {'model_name': 'IterativeImputer', 'estimator': 'RFR', 'initial_strategy': 'most_frequent', 'n_nearest_features': 9, 'imputation_order': 'random'}. Best is trial 93 with value: 0.0458692748749441.
running
[I 2024-08-14 00:57:44,115] Trial 191 finished with value: 0.05622142399282974 and parameters: {'model_name': 'IterativeImputer', 'estimator': 'Ridge', 'initial_strategy': 'constant', 'n_nearest_features': 10, 'imputation_order': 'random'}. Best is trial 93 with value: 0.0458692748749441.
running
[I 2024-08-14 01:06:28,670] Trial 171 finished with value: 0.04839017691255103 and parameters: {'model_name': 'IterativeImputer', 'estimator': 'RFR', 'initial_strategy': 'most_frequent', 'n_nearest_features': 9, 'imputation_order': 'random'}. Best is trial 93 with value: 0.0458692748749441.
running
[I 2024-08-14 01:06:28,900] Trial 193 finished with value: 0.07618823314153232 and parameters: {'model_name': 'SimpleImputer', 'strategy': 'mean'}. Best is trial 93 with value: 0.0458692748749441.
running
[I 2024-08-14 01:08:54,172] Trial 173 finished with value: 0.047578258620301336 and parameters: {'model_name': 'IterativeImputer', 'estimator': 'RFR', 'initial_strategy': 'most_frequent', 'n_nearest_features': 9, 'imputation_order': 'random'}. Best is trial 93 with value: 0.0458692748749441.
running
[I 2024-08-14 01:08:57,017] Trial 195 finished with value: 0.06817061724617528 and parameters: {'model_name': 'KNNImputer', 'n_neighbors': 1808, 'weights': 'uniform'}. Best is trial 93 with value: 0.0458692748749441.
running
[I 2024-08-14 01:16:04,158] Trial 175 finished with value: 0.048106901050855876 and parameters: {'model_name': 'IterativeImputer', 'estimator': 'RFR', 'initial_strategy': 'most_frequent', 'n_nearest_features': 9, 'imputation_order': 'random'}. Best is trial 93 with value: 0.0458692748749441.
running
[I 2024-08-14 01:16:49,213] Trial 176 finished with value: 0.046719533180438796 and parameters: {'model_name': 'IterativeImputer', 'estimator': 'RFR', 'initial_strategy': 'most_frequent', 'n_nearest_features': 9, 'imputation_order': 'random'}. Best is trial 93 with value: 0.0458692748749441.
running
[I 2024-08-14 01:24:35,965] Trial 177 finished with value: 0.04836729102378813 and parameters: {'model_name': 'IterativeImputer', 'estimator': 'RFR', 'initial_strategy': 'most_frequent', 'n_nearest_features': 9, 'imputation_order': 'random'}. Best is trial 93 with value: 0.0458692748749441.
running
[I 2024-08-14 01:26:44,894] Trial 178 finished with value: 0.047324772222340765 and parameters: {'model_name': 'IterativeImputer', 'estimator': 'RFR', 'initial_strategy': 'constant', 'n_nearest_features': 10, 'imputation_order': 'random'}. Best is trial 93 with value: 0.0458692748749441.
[I 2024-08-14 01:27:04,004] Trial 179 finished with value: 0.0477907969466285 and parameters: {'model_name': 'IterativeImputer', 'estimator': 'RFR', 'initial_strategy': 'constant', 'n_nearest_features': 10, 'imputation_order': 'random'}. Best is trial 93 with value: 0.0458692748749441.
[I 2024-08-14 01:27:51,359] Trial 180 finished with value: 0.04800598998006049 and parameters: {'model_name': 'IterativeImputer', 'estimator': 'RFR', 'initial_strategy': 'constant', 'n_nearest_features': 10, 'imputation_order': 'random'}. Best is trial 93 with value: 0.0458692748749441.
[I 2024-08-14 01:33:16,817] Trial 182 finished with value: 0.04768672732338891 and parameters: {'model_name': 'IterativeImputer', 'estimator': 'RFR', 'initial_strategy': 'constant', 'n_nearest_features': 10, 'imputation_order': 'random'}. Best is trial 93 with value: 0.0458692748749441.
[I 2024-08-14 01:33:50,357] Trial 183 finished with value: 0.0478122823795117 and parameters: {'model_name': 'IterativeImputer', 'estimator': 'RFR', 'initial_strategy': 'most_frequent', 'n_nearest_features': 10, 'imputation_order': 'random'}. Best is trial 93 with value: 0.0458692748749441.
[I 2024-08-14 01:46:07,232] Trial 186 finished with value: 0.0487444300385849 and parameters: {'model_name': 'IterativeImputer', 'estimator': 'RFR', 'initial_strategy': 'constant', 'n_nearest_features': 10, 'imputation_order': 'random'}. Best is trial 93 with value: 0.0458692748749441.
[I 2024-08-14 01:50:56,856] Trial 187 finished with value: 0.04764657429932319 and parameters: {'model_name': 'IterativeImputer', 'estimator': 'RFR', 'initial_strategy': 'constant', 'n_nearest_features': 10, 'imputation_order': 'random'}. Best is trial 93 with value: 0.0458692748749441.
[I 2024-08-14 01:53:03,399] Trial 188 finished with value: 0.04742886259686539 and parameters: {'model_name': 'IterativeImputer', 'estimator': 'RFR', 'initial_strategy': 'constant', 'n_nearest_features': 10, 'imputation_order': 'random'}. Best is trial 93 with value: 0.0458692748749441.
[I 2024-08-14 01:54:34,155] Trial 189 finished with value: 0.046372223861886865 and parameters: {'model_name': 'IterativeImputer', 'estimator': 'RFR', 'initial_strategy': 'constant', 'n_nearest_features': 10, 'imputation_order': 'random'}. Best is trial 93 with value: 0.0458692748749441.
[I 2024-08-14 02:01:10,641] Trial 190 finished with value: 0.04762093421255419 and parameters: {'model_name': 'IterativeImputer', 'estimator': 'RFR', 'initial_strategy': 'constant', 'n_nearest_features': 10, 'imputation_order': 'random'}. Best is trial 93 with value: 0.0458692748749441.
[I 2024-08-14 02:01:36,348] Trial 192 finished with value: 0.048037511788824074 and parameters: {'model_name': 'IterativeImputer', 'estimator': 'RFR', 'initial_strategy': 'constant', 'n_nearest_features': 10, 'imputation_order': 'random'}. Best is trial 93 with value: 0.0458692748749441.
[I 2024-08-14 02:09:28,000] Trial 194 finished with value: 0.04724189930864703 and parameters: {'model_name': 'IterativeImputer', 'estimator': 'RFR', 'initial_strategy': 'constant', 'n_nearest_features': 10, 'imputation_order': 'random'}. Best is trial 93 with value: 0.0458692748749441.
[I 2024-08-14 02:11:35,923] Trial 196 finished with value: 0.047442198624162324 and parameters: {'model_name': 'IterativeImputer', 'estimator': 'RFR', 'initial_strategy': 'constant', 'n_nearest_features': 10, 'imputation_order': 'random'}. Best is trial 93 with value: 0.0458692748749441.
[I 2024-08-14 02:17:43,424] Trial 197 finished with value: 0.04740851585347862 and parameters: {'model_name': 'IterativeImputer', 'estimator': 'RFR', 'initial_strategy': 'constant', 'n_nearest_features': 10, 'imputation_order': 'random'}. Best is trial 93 with value: 0.0458692748749441.
[I 2024-08-14 02:18:19,850] Trial 198 finished with value: 0.04790613658623079 and parameters: {'model_name': 'IterativeImputer', 'estimator': 'RFR', 'initial_strategy': 'constant', 'n_nearest_features': 10, 'imputation_order': 'random'}. Best is trial 93 with value: 0.0458692748749441.
