Run: 14
/cm/local/apps/slurm/var/spool/job1005407/slurm_script: line 26: 
pip install -e tpot2
pip install -r tpot2/ImputerExperiments/requirements_.txt
: No such file or directory
RunStart
Version 0.1.7a0 of tpot2 is outdated. Version 0.1.8a0 was released Tuesday September 17, 2024.
starting loops
../data/c/151/151.pkl
working on 
../data/c/151/class_simple_MCAR_0.1_1
0.6683981418609619
running experiment 1/3 - Does large hyperparameter space improve reconstruction accuracy over simple
[I 2024-10-16 00:24:19,640] A new study created in memory with name: no-name-e549559b-01d1-413d-82f5-2fb621a1d11b
running
running
running
running
running
running
running
running
running
running
running
running
running
running
running
running
[I 2024-10-16 00:24:20,098] Trial 0 finished with value: 0.4456924911163494 and parameters: {'model_name': 'SimpleImputer', 'strategy': 'constant'}. Best is trial 0 with value: 0.4456924911163494.
running
[I 2024-10-16 00:24:20,412] Trial 1 finished with value: 0.21120128310923875 and parameters: {'model_name': 'SimpleImputer', 'strategy': 'mean'}. Best is trial 1 with value: 0.21120128310923875.
[I 2024-10-16 00:24:20,540] Trial 14 finished with value: 0.4456924911163494 and parameters: {'model_name': 'SimpleImputer', 'strategy': 'constant'}. Best is trial 1 with value: 0.21120128310923875.
running
[I 2024-10-16 00:24:20,668] Trial 3 finished with value: 0.21120128310923875 and parameters: {'model_name': 'SimpleImputer', 'strategy': 'mean'}. Best is trial 1 with value: 0.21120128310923875.
[I 2024-10-16 00:24:20,782] Trial 11 finished with value: 0.4456924911163494 and parameters: {'model_name': 'SimpleImputer', 'strategy': 'constant'}. Best is trial 1 with value: 0.21120128310923875.
[I 2024-10-16 00:24:20,903] Trial 8 finished with value: 0.4456924911163494 and parameters: {'model_name': 'SimpleImputer', 'strategy': 'constant'}. Best is trial 1 with value: 0.21120128310923875.
running
[I 2024-10-16 00:24:21,077] Trial 10 finished with value: 0.4456924911163494 and parameters: {'model_name': 'SimpleImputer', 'strategy': 'constant'}. Best is trial 1 with value: 0.21120128310923875.
[I 2024-10-16 00:24:21,198] Trial 4 finished with value: 0.21120128310923875 and parameters: {'model_name': 'SimpleImputer', 'strategy': 'mean'}. Best is trial 1 with value: 0.21120128310923875.
running
running
running
[I 2024-10-16 00:24:21,351] Trial 9 finished with value: 0.21120128310923875 and parameters: {'model_name': 'SimpleImputer', 'strategy': 'mean'}. Best is trial 1 with value: 0.21120128310923875.
running
running
running
[I 2024-10-16 00:24:21,540] Trial 15 finished with value: 0.21120128310923875 and parameters: {'model_name': 'SimpleImputer', 'strategy': 'mean'}. Best is trial 1 with value: 0.21120128310923875.
[I 2024-10-16 00:24:21,675] Trial 7 finished with value: 0.21120128310923875 and parameters: {'model_name': 'SimpleImputer', 'strategy': 'mean'}. Best is trial 1 with value: 0.21120128310923875.
running
running
[I 2024-10-16 00:24:21,906] Trial 13 finished with value: 0.21120128310923875 and parameters: {'model_name': 'SimpleImputer', 'strategy': 'mean'}. Best is trial 1 with value: 0.21120128310923875.
running
[I 2024-10-16 00:24:22,102] Trial 2 finished with value: 0.21080759083096906 and parameters: {'model_name': 'SimpleImputer', 'strategy': 'median'}. Best is trial 2 with value: 0.21080759083096906.
running
[I 2024-10-16 00:24:22,358] Trial 16 finished with value: 0.21120128310923875 and parameters: {'model_name': 'SimpleImputer', 'strategy': 'mean'}. Best is trial 2 with value: 0.21080759083096906.
[I 2024-10-16 00:24:22,490] Trial 6 finished with value: 0.21080759083096906 and parameters: {'model_name': 'SimpleImputer', 'strategy': 'median'}. Best is trial 2 with value: 0.21080759083096906.
running
running
[I 2024-10-16 00:24:22,709] Trial 5 finished with value: 0.38969972723503693 and parameters: {'model_name': 'SimpleImputer', 'strategy': 'most_frequent'}. Best is trial 2 with value: 0.21080759083096906.
[I 2024-10-16 00:24:22,835] Trial 20 finished with value: 0.4456924911163494 and parameters: {'model_name': 'SimpleImputer', 'strategy': 'constant'}. Best is trial 2 with value: 0.21080759083096906.
running
running
[I 2024-10-16 00:24:22,998] Trial 21 finished with value: 0.4456924911163494 and parameters: {'model_name': 'SimpleImputer', 'strategy': 'constant'}. Best is trial 2 with value: 0.21080759083096906.
running
[I 2024-10-16 00:24:23,231] Trial 12 finished with value: 0.38969972723503693 and parameters: {'model_name': 'SimpleImputer', 'strategy': 'most_frequent'}. Best is trial 2 with value: 0.21080759083096906.
running
[I 2024-10-16 00:24:23,474] Trial 23 finished with value: 0.21120128310923875 and parameters: {'model_name': 'SimpleImputer', 'strategy': 'mean'}. Best is trial 2 with value: 0.21080759083096906.
[I 2024-10-16 00:24:23,594] Trial 18 finished with value: 0.21080759083096906 and parameters: {'model_name': 'SimpleImputer', 'strategy': 'median'}. Best is trial 2 with value: 0.21080759083096906.
running
running
[I 2024-10-16 00:24:23,861] Trial 17 finished with value: 0.21080759083096906 and parameters: {'model_name': 'SimpleImputer', 'strategy': 'median'}. Best is trial 2 with value: 0.21080759083096906.
running
[I 2024-10-16 00:24:24,106] Trial 28 finished with value: 0.21080759083096906 and parameters: {'model_name': 'SimpleImputer', 'strategy': 'median'}. Best is trial 2 with value: 0.21080759083096906.
running
[I 2024-10-16 00:24:24,246] Trial 26 finished with value: 0.21080759083096906 and parameters: {'model_name': 'SimpleImputer', 'strategy': 'median'}. Best is trial 2 with value: 0.21080759083096906.
running
[I 2024-10-16 00:24:24,384] Trial 24 finished with value: 0.21080759083096906 and parameters: {'model_name': 'SimpleImputer', 'strategy': 'median'}. Best is trial 2 with value: 0.21080759083096906.
running
[I 2024-10-16 00:24:24,593] Trial 22 finished with value: 0.38969972723503693 and parameters: {'model_name': 'SimpleImputer', 'strategy': 'most_frequent'}. Best is trial 2 with value: 0.21080759083096906.
running
[I 2024-10-16 00:24:24,743] Trial 19 finished with value: 0.38969972723503693 and parameters: {'model_name': 'SimpleImputer', 'strategy': 'most_frequent'}. Best is trial 2 with value: 0.21080759083096906.
running
[I 2024-10-16 00:24:24,887] Trial 27 finished with value: 0.21080759083096906 and parameters: {'model_name': 'SimpleImputer', 'strategy': 'median'}. Best is trial 2 with value: 0.21080759083096906.
running
[I 2024-10-16 00:24:25,145] Trial 30 finished with value: 0.21080759083096906 and parameters: {'model_name': 'SimpleImputer', 'strategy': 'median'}. Best is trial 2 with value: 0.21080759083096906.
[I 2024-10-16 00:24:25,257] Trial 32 finished with value: 0.21080759083096906 and parameters: {'model_name': 'SimpleImputer', 'strategy': 'median'}. Best is trial 2 with value: 0.21080759083096906.
running
running
[I 2024-10-16 00:24:25,427] Trial 29 finished with value: 0.21080759083096906 and parameters: {'model_name': 'SimpleImputer', 'strategy': 'median'}. Best is trial 2 with value: 0.21080759083096906.
[I 2024-10-16 00:24:25,547] Trial 31 finished with value: 0.21080759083096906 and parameters: {'model_name': 'SimpleImputer', 'strategy': 'median'}. Best is trial 2 with value: 0.21080759083096906.
running
running
[I 2024-10-16 00:24:25,696] Trial 25 finished with value: 0.38969972723503693 and parameters: {'model_name': 'SimpleImputer', 'strategy': 'most_frequent'}. Best is trial 2 with value: 0.21080759083096906.
running
[I 2024-10-16 00:24:25,828] Trial 33 finished with value: 0.21080759083096906 and parameters: {'model_name': 'SimpleImputer', 'strategy': 'median'}. Best is trial 2 with value: 0.21080759083096906.
running
[I 2024-10-16 00:24:26,085] Trial 35 finished with value: 0.21080759083096906 and parameters: {'model_name': 'SimpleImputer', 'strategy': 'median'}. Best is trial 2 with value: 0.21080759083096906.
running
[I 2024-10-16 00:24:26,262] Trial 34 finished with value: 0.21080759083096906 and parameters: {'model_name': 'SimpleImputer', 'strategy': 'median'}. Best is trial 2 with value: 0.21080759083096906.
running
[I 2024-10-16 00:24:26,415] Trial 36 finished with value: 0.21080759083096906 and parameters: {'model_name': 'SimpleImputer', 'strategy': 'median'}. Best is trial 2 with value: 0.21080759083096906.
running
[I 2024-10-16 00:24:26,745] Trial 37 finished with value: 0.21080759083096906 and parameters: {'model_name': 'SimpleImputer', 'strategy': 'median'}. Best is trial 2 with value: 0.21080759083096906.
running
[I 2024-10-16 00:24:26,927] Trial 39 finished with value: 0.21080759083096906 and parameters: {'model_name': 'SimpleImputer', 'strategy': 'median'}. Best is trial 2 with value: 0.21080759083096906.
running
[I 2024-10-16 00:24:27,083] Trial 40 finished with value: 0.21080759083096906 and parameters: {'model_name': 'SimpleImputer', 'strategy': 'median'}. Best is trial 2 with value: 0.21080759083096906.
running
[I 2024-10-16 00:24:27,277] Trial 42 finished with value: 0.21080759083096906 and parameters: {'model_name': 'SimpleImputer', 'strategy': 'median'}. Best is trial 2 with value: 0.21080759083096906.
[I 2024-10-16 00:24:27,401] Trial 41 finished with value: 0.21080759083096906 and parameters: {'model_name': 'SimpleImputer', 'strategy': 'median'}. Best is trial 2 with value: 0.21080759083096906.
running
running
[I 2024-10-16 00:24:27,610] Trial 38 finished with value: 0.21080759083096906 and parameters: {'model_name': 'SimpleImputer', 'strategy': 'median'}. Best is trial 2 with value: 0.21080759083096906.
running
[I 2024-10-16 00:24:27,785] Trial 45 finished with value: 0.21080759083096906 and parameters: {'model_name': 'SimpleImputer', 'strategy': 'median'}. Best is trial 2 with value: 0.21080759083096906.
running
[I 2024-10-16 00:24:27,966] Trial 46 finished with value: 0.21080759083096906 and parameters: {'model_name': 'SimpleImputer', 'strategy': 'median'}. Best is trial 2 with value: 0.21080759083096906.
running
[I 2024-10-16 00:24:28,108] Trial 49 finished with value: 0.21080759083096906 and parameters: {'model_name': 'SimpleImputer', 'strategy': 'median'}. Best is trial 2 with value: 0.21080759083096906.
[I 2024-10-16 00:24:28,225] Trial 44 finished with value: 0.21080759083096906 and parameters: {'model_name': 'SimpleImputer', 'strategy': 'median'}. Best is trial 2 with value: 0.21080759083096906.
running
[I 2024-10-16 00:24:28,342] Trial 43 finished with value: 0.21080759083096906 and parameters: {'model_name': 'SimpleImputer', 'strategy': 'median'}. Best is trial 2 with value: 0.21080759083096906.
running
running
[I 2024-10-16 00:24:28,558] Trial 48 finished with value: 0.21080759083096906 and parameters: {'model_name': 'SimpleImputer', 'strategy': 'median'}. Best is trial 2 with value: 0.21080759083096906.
running
[I 2024-10-16 00:24:28,701] Trial 47 finished with value: 0.21080759083096906 and parameters: {'model_name': 'SimpleImputer', 'strategy': 'median'}. Best is trial 2 with value: 0.21080759083096906.
running
[I 2024-10-16 00:24:28,892] Trial 52 finished with value: 0.21080759083096906 and parameters: {'model_name': 'SimpleImputer', 'strategy': 'median'}. Best is trial 2 with value: 0.21080759083096906.
running
[I 2024-10-16 00:24:29,194] Trial 50 finished with value: 0.21080759083096906 and parameters: {'model_name': 'SimpleImputer', 'strategy': 'median'}. Best is trial 2 with value: 0.21080759083096906.
running
[I 2024-10-16 00:24:29,360] Trial 51 finished with value: 0.21080759083096906 and parameters: {'model_name': 'SimpleImputer', 'strategy': 'median'}. Best is trial 2 with value: 0.21080759083096906.
running
[I 2024-10-16 00:24:29,657] Trial 53 finished with value: 0.21080759083096906 and parameters: {'model_name': 'SimpleImputer', 'strategy': 'median'}. Best is trial 2 with value: 0.21080759083096906.
[I 2024-10-16 00:24:29,754] Trial 56 finished with value: 0.21080759083096906 and parameters: {'model_name': 'SimpleImputer', 'strategy': 'median'}. Best is trial 2 with value: 0.21080759083096906.
running
[I 2024-10-16 00:24:29,855] Trial 55 finished with value: 0.21080759083096906 and parameters: {'model_name': 'SimpleImputer', 'strategy': 'median'}. Best is trial 2 with value: 0.21080759083096906.
running
[I 2024-10-16 00:24:29,971] Trial 54 finished with value: 0.21080759083096906 and parameters: {'model_name': 'SimpleImputer', 'strategy': 'median'}. Best is trial 2 with value: 0.21080759083096906.
running
running
[I 2024-10-16 00:24:30,214] Trial 57 finished with value: 0.21080759083096906 and parameters: {'model_name': 'SimpleImputer', 'strategy': 'median'}. Best is trial 2 with value: 0.21080759083096906.
running
[I 2024-10-16 00:24:30,398] Trial 60 finished with value: 0.21080759083096906 and parameters: {'model_name': 'SimpleImputer', 'strategy': 'median'}. Best is trial 2 with value: 0.21080759083096906.
running
[I 2024-10-16 00:24:30,510] Trial 58 finished with value: 0.21080759083096906 and parameters: {'model_name': 'SimpleImputer', 'strategy': 'median'}. Best is trial 2 with value: 0.21080759083096906.
running
[I 2024-10-16 00:24:30,676] Trial 59 finished with value: 0.21080759083096906 and parameters: {'model_name': 'SimpleImputer', 'strategy': 'median'}. Best is trial 2 with value: 0.21080759083096906.
running
[I 2024-10-16 00:24:30,870] Trial 65 finished with value: 0.38969972723503693 and parameters: {'model_name': 'SimpleImputer', 'strategy': 'most_frequent'}. Best is trial 2 with value: 0.21080759083096906.
running
[I 2024-10-16 00:24:31,110] Trial 62 finished with value: 0.21080759083096906 and parameters: {'model_name': 'SimpleImputer', 'strategy': 'median'}. Best is trial 2 with value: 0.21080759083096906.
[I 2024-10-16 00:24:31,218] Trial 61 finished with value: 0.21080759083096906 and parameters: {'model_name': 'SimpleImputer', 'strategy': 'median'}. Best is trial 2 with value: 0.21080759083096906.
running
running
[I 2024-10-16 00:24:31,488] Trial 63 finished with value: 0.21080759083096906 and parameters: {'model_name': 'SimpleImputer', 'strategy': 'median'}. Best is trial 2 with value: 0.21080759083096906.
running
[I 2024-10-16 00:24:31,766] Trial 73 finished with value: 0.4456924911163494 and parameters: {'model_name': 'SimpleImputer', 'strategy': 'constant'}. Best is trial 2 with value: 0.21080759083096906.
running
[I 2024-10-16 00:24:31,912] Trial 66 finished with value: 0.21080759083096906 and parameters: {'model_name': 'SimpleImputer', 'strategy': 'median'}. Best is trial 2 with value: 0.21080759083096906.
running
[I 2024-10-16 00:24:32,158] Trial 74 finished with value: 0.4456924911163494 and parameters: {'model_name': 'SimpleImputer', 'strategy': 'constant'}. Best is trial 2 with value: 0.21080759083096906.
running
[I 2024-10-16 00:24:32,410] Trial 75 finished with value: 0.4456924911163494 and parameters: {'model_name': 'SimpleImputer', 'strategy': 'constant'}. Best is trial 2 with value: 0.21080759083096906.
[I 2024-10-16 00:24:32,513] Trial 77 finished with value: 0.4456924911163494 and parameters: {'model_name': 'SimpleImputer', 'strategy': 'constant'}. Best is trial 2 with value: 0.21080759083096906.
running
running
[I 2024-10-16 00:24:32,656] Trial 79 finished with value: 0.4456924911163494 and parameters: {'model_name': 'SimpleImputer', 'strategy': 'constant'}. Best is trial 2 with value: 0.21080759083096906.
running
[I 2024-10-16 00:24:32,775] Trial 64 finished with value: 0.38969972723503693 and parameters: {'model_name': 'SimpleImputer', 'strategy': 'most_frequent'}. Best is trial 2 with value: 0.21080759083096906.
running
[I 2024-10-16 00:24:33,036] Trial 67 finished with value: 0.38969972723503693 and parameters: {'model_name': 'SimpleImputer', 'strategy': 'most_frequent'}. Best is trial 2 with value: 0.21080759083096906.
running
[I 2024-10-16 00:24:33,221] Trial 68 finished with value: 0.38969972723503693 and parameters: {'model_name': 'SimpleImputer', 'strategy': 'most_frequent'}. Best is trial 2 with value: 0.21080759083096906.
running
[I 2024-10-16 00:24:33,341] Trial 78 finished with value: 0.4456924911163494 and parameters: {'model_name': 'SimpleImputer', 'strategy': 'constant'}. Best is trial 2 with value: 0.21080759083096906.
running
[I 2024-10-16 00:24:33,556] Trial 69 finished with value: 0.38969972723503693 and parameters: {'model_name': 'SimpleImputer', 'strategy': 'most_frequent'}. Best is trial 2 with value: 0.21080759083096906.
[I 2024-10-16 00:24:33,655] Trial 80 finished with value: 0.4456924911163494 and parameters: {'model_name': 'SimpleImputer', 'strategy': 'constant'}. Best is trial 2 with value: 0.21080759083096906.
running
running
[I 2024-10-16 00:24:33,864] Trial 72 finished with value: 0.38969972723503693 and parameters: {'model_name': 'SimpleImputer', 'strategy': 'most_frequent'}. Best is trial 2 with value: 0.21080759083096906.
running
[I 2024-10-16 00:24:33,984] Trial 83 finished with value: 0.21120128310923875 and parameters: {'model_name': 'SimpleImputer', 'strategy': 'mean'}. Best is trial 2 with value: 0.21080759083096906.
running
[I 2024-10-16 00:24:34,116] Trial 82 finished with value: 0.21120128310923875 and parameters: {'model_name': 'SimpleImputer', 'strategy': 'mean'}. Best is trial 2 with value: 0.21080759083096906.
[I 2024-10-16 00:24:34,227] Trial 71 finished with value: 0.38969972723503693 and parameters: {'model_name': 'SimpleImputer', 'strategy': 'most_frequent'}. Best is trial 2 with value: 0.21080759083096906.
running
running
[I 2024-10-16 00:24:34,362] Trial 70 finished with value: 0.38969972723503693 and parameters: {'model_name': 'SimpleImputer', 'strategy': 'most_frequent'}. Best is trial 2 with value: 0.21080759083096906.
[I 2024-10-16 00:24:34,483] Trial 81 finished with value: 0.21120128310923875 and parameters: {'model_name': 'SimpleImputer', 'strategy': 'mean'}. Best is trial 2 with value: 0.21080759083096906.
running
running
[I 2024-10-16 00:24:34,669] Trial 87 finished with value: 0.21120128310923875 and parameters: {'model_name': 'SimpleImputer', 'strategy': 'mean'}. Best is trial 2 with value: 0.21080759083096906.
[I 2024-10-16 00:24:34,785] Trial 85 finished with value: 0.21120128310923875 and parameters: {'model_name': 'SimpleImputer', 'strategy': 'mean'}. Best is trial 2 with value: 0.21080759083096906.
running
running
[I 2024-10-16 00:24:35,010] Trial 76 finished with value: 0.38969972723503693 and parameters: {'model_name': 'SimpleImputer', 'strategy': 'most_frequent'}. Best is trial 2 with value: 0.21080759083096906.
running
[I 2024-10-16 00:24:35,136] Trial 86 finished with value: 0.21120128310923875 and parameters: {'model_name': 'SimpleImputer', 'strategy': 'mean'}. Best is trial 2 with value: 0.21080759083096906.
[I 2024-10-16 00:24:35,245] Trial 84 finished with value: 0.21120128310923875 and parameters: {'model_name': 'SimpleImputer', 'strategy': 'mean'}. Best is trial 2 with value: 0.21080759083096906.
running
running
[I 2024-10-16 00:24:35,428] Trial 90 finished with value: 0.21120128310923875 and parameters: {'model_name': 'SimpleImputer', 'strategy': 'mean'}. Best is trial 2 with value: 0.21080759083096906.
running
[I 2024-10-16 00:24:35,596] Trial 92 finished with value: 0.21120128310923875 and parameters: {'model_name': 'SimpleImputer', 'strategy': 'mean'}. Best is trial 2 with value: 0.21080759083096906.
running
[I 2024-10-16 00:24:35,764] Trial 88 finished with value: 0.21120128310923875 and parameters: {'model_name': 'SimpleImputer', 'strategy': 'mean'}. Best is trial 2 with value: 0.21080759083096906.
running
[I 2024-10-16 00:24:35,934] Trial 93 finished with value: 0.21120128310923875 and parameters: {'model_name': 'SimpleImputer', 'strategy': 'mean'}. Best is trial 2 with value: 0.21080759083096906.
running
[I 2024-10-16 00:24:36,094] Trial 91 finished with value: 0.21120128310923875 and parameters: {'model_name': 'SimpleImputer', 'strategy': 'mean'}. Best is trial 2 with value: 0.21080759083096906.
running
[I 2024-10-16 00:24:36,234] Trial 94 finished with value: 0.21120128310923875 and parameters: {'model_name': 'SimpleImputer', 'strategy': 'mean'}. Best is trial 2 with value: 0.21080759083096906.
[I 2024-10-16 00:24:36,351] Trial 89 finished with value: 0.21080759083096906 and parameters: {'model_name': 'SimpleImputer', 'strategy': 'median'}. Best is trial 2 with value: 0.21080759083096906.
running
running
[I 2024-10-16 00:24:36,635] Trial 96 finished with value: 0.21080759083096906 and parameters: {'model_name': 'SimpleImputer', 'strategy': 'median'}. Best is trial 2 with value: 0.21080759083096906.
running
[I 2024-10-16 00:24:36,835] Trial 98 finished with value: 0.21080759083096906 and parameters: {'model_name': 'SimpleImputer', 'strategy': 'median'}. Best is trial 2 with value: 0.21080759083096906.
running
[I 2024-10-16 00:24:36,957] Trial 95 finished with value: 0.21080759083096906 and parameters: {'model_name': 'SimpleImputer', 'strategy': 'median'}. Best is trial 2 with value: 0.21080759083096906.
running
[I 2024-10-16 00:24:37,092] Trial 97 finished with value: 0.21080759083096906 and parameters: {'model_name': 'SimpleImputer', 'strategy': 'median'}. Best is trial 2 with value: 0.21080759083096906.
running
[I 2024-10-16 00:24:37,288] Trial 100 finished with value: 0.21080759083096906 and parameters: {'model_name': 'SimpleImputer', 'strategy': 'median'}. Best is trial 2 with value: 0.21080759083096906.
running
[I 2024-10-16 00:24:37,434] Trial 99 finished with value: 0.21080759083096906 and parameters: {'model_name': 'SimpleImputer', 'strategy': 'median'}. Best is trial 2 with value: 0.21080759083096906.
running
[I 2024-10-16 00:24:37,603] Trial 101 finished with value: 0.21080759083096906 and parameters: {'model_name': 'SimpleImputer', 'strategy': 'median'}. Best is trial 2 with value: 0.21080759083096906.
running
