[I 2024-11-21 17:28:09,284] Trial 88 finished with value: 0.05532693916176119 and parameters: {'model_name': 'IterativeImputer', 'estimator': 'RFR', 'initial_strategy': 'constant', 'n_nearest_features': 3, 'imputation_order': 'ascending'}. Best is trial 34 with value: 0.052853982359621056.
running
[I 2024-11-21 17:29:53,879] Trial 83 finished with value: 0.13600247459308315 and parameters: {'model_name': 'VAE', 'batch_size': 600, 'iterations': 442, 'learning_rate': 0.0004438878069932048, 'p_miss': 0.2939204454486115}. Best is trial 34 with value: 0.052853982359621056.
running
[I 2024-11-21 17:29:57,309] Trial 89 finished with value: 0.05562942410437884 and parameters: {'model_name': 'IterativeImputer', 'estimator': 'RFR', 'initial_strategy': 'constant', 'n_nearest_features': 3, 'imputation_order': 'ascending'}. Best is trial 34 with value: 0.052853982359621056.
running
[I 2024-11-21 17:38:09,437] Trial 81 finished with value: 0.2666971330912634 and parameters: {'model_name': 'VAE', 'batch_size': 997, 'iterations': 517, 'learning_rate': 0.00012159208172231633, 'p_miss': 0.2877842585348529}. Best is trial 34 with value: 0.052853982359621056.
running
[I 2024-11-21 17:41:17,489] Trial 90 finished with value: 0.05491119273680604 and parameters: {'model_name': 'IterativeImputer', 'estimator': 'RFR', 'initial_strategy': 'constant', 'n_nearest_features': 3, 'imputation_order': 'ascending'}. Best is trial 34 with value: 0.052853982359621056.
running
[I 2024-11-21 17:43:09,511] Trial 91 finished with value: 0.05558840671643025 and parameters: {'model_name': 'IterativeImputer', 'estimator': 'RFR', 'initial_strategy': 'constant', 'n_nearest_features': 3, 'imputation_order': 'ascending'}. Best is trial 34 with value: 0.052853982359621056.
running
[I 2024-11-21 17:43:16,362] Trial 92 finished with value: 0.05494700457470949 and parameters: {'model_name': 'IterativeImputer', 'estimator': 'RFR', 'initial_strategy': 'constant', 'n_nearest_features': 3, 'imputation_order': 'ascending'}. Best is trial 34 with value: 0.052853982359621056.
running
[I 2024-11-21 17:51:32,338] Trial 93 finished with value: 0.05616768402355865 and parameters: {'model_name': 'IterativeImputer', 'estimator': 'RFR', 'initial_strategy': 'constant', 'n_nearest_features': 3, 'imputation_order': 'ascending'}. Best is trial 34 with value: 0.052853982359621056.
running
[I 2024-11-21 17:53:16,856] Trial 85 finished with value: 0.27267016079099543 and parameters: {'model_name': 'VAE', 'batch_size': 693, 'iterations': 604, 'learning_rate': 0.00010439919070124477, 'p_miss': 0.2966216025070515}. Best is trial 34 with value: 0.052853982359621056.
running
[I 2024-11-21 17:55:19,177] Trial 94 finished with value: 0.05392006754006522 and parameters: {'model_name': 'IterativeImputer', 'estimator': 'RFR', 'initial_strategy': 'constant', 'n_nearest_features': 4, 'imputation_order': 'ascending'}. Best is trial 34 with value: 0.052853982359621056.
running
[I 2024-11-21 17:56:22,137] Trial 96 finished with value: 0.056516373624520735 and parameters: {'model_name': 'IterativeImputer', 'estimator': 'RFR', 'initial_strategy': 'constant', 'n_nearest_features': 3, 'imputation_order': 'ascending'}. Best is trial 34 with value: 0.052853982359621056.
running
[I 2024-11-21 17:57:40,607] Trial 95 finished with value: 0.0532341062384303 and parameters: {'model_name': 'IterativeImputer', 'estimator': 'RFR', 'initial_strategy': 'constant', 'n_nearest_features': 4, 'imputation_order': 'ascending'}. Best is trial 34 with value: 0.052853982359621056.
running
[I 2024-11-21 18:04:39,222] Trial 97 finished with value: 0.05498351702219699 and parameters: {'model_name': 'IterativeImputer', 'estimator': 'RFR', 'initial_strategy': 'constant', 'n_nearest_features': 3, 'imputation_order': 'ascending'}. Best is trial 34 with value: 0.052853982359621056.
running
[I 2024-11-21 18:06:23,925] Trial 98 finished with value: 0.05518886610711784 and parameters: {'model_name': 'IterativeImputer', 'estimator': 'RFR', 'initial_strategy': 'constant', 'n_nearest_features': 3, 'imputation_order': 'ascending'}. Best is trial 34 with value: 0.052853982359621056.
running
[I 2024-11-21 18:08:51,443] Trial 99 finished with value: 0.05331621637845332 and parameters: {'model_name': 'IterativeImputer', 'estimator': 'RFR', 'initial_strategy': 'constant', 'n_nearest_features': 4, 'imputation_order': 'ascending'}. Best is trial 34 with value: 0.052853982359621056.
running
[I 2024-11-21 18:10:33,860] Trial 100 finished with value: 0.05287709864392988 and parameters: {'model_name': 'IterativeImputer', 'estimator': 'RFR', 'initial_strategy': 'constant', 'n_nearest_features': 4, 'imputation_order': 'ascending'}. Best is trial 34 with value: 0.052853982359621056.
running
[I 2024-11-21 18:11:03,231] Trial 43 finished with value: 0.08528903929868573 and parameters: {'model_name': 'VAE', 'batch_size': 25, 'iterations': 2676, 'learning_rate': 0.0001653164669321378, 'p_miss': 0.2973185281838018}. Best is trial 34 with value: 0.052853982359621056.
running
[I 2024-11-21 18:11:34,367] Trial 101 finished with value: 0.053772366296057236 and parameters: {'model_name': 'IterativeImputer', 'estimator': 'RFR', 'initial_strategy': 'constant', 'n_nearest_features': 4, 'imputation_order': 'ascending'}. Best is trial 34 with value: 0.052853982359621056.
running
[I 2024-11-21 18:11:38,206] Trial 87 finished with value: 0.2469754317862231 and parameters: {'model_name': 'VAE', 'batch_size': 852, 'iterations': 786, 'learning_rate': 0.00010038921067802582, 'p_miss': 0.122342261428438}. Best is trial 34 with value: 0.052853982359621056.
running
[I 2024-11-21 18:18:43,160] Trial 42 finished with value: 0.08974207567978569 and parameters: {'model_name': 'VAE', 'batch_size': 28, 'iterations': 2763, 'learning_rate': 0.00013010137374380287, 'p_miss': 0.29064727581344113}. Best is trial 34 with value: 0.052853982359621056.
running
[I 2024-11-21 18:18:46,803] Trial 102 finished with value: 0.05270834318071216 and parameters: {'model_name': 'IterativeImputer', 'estimator': 'RFR', 'initial_strategy': 'constant', 'n_nearest_features': 4, 'imputation_order': 'ascending'}. Best is trial 102 with value: 0.05270834318071216.
running
[I 2024-11-21 18:19:54,774] Trial 103 finished with value: 0.05347829632834319 and parameters: {'model_name': 'IterativeImputer', 'estimator': 'RFR', 'initial_strategy': 'constant', 'n_nearest_features': 4, 'imputation_order': 'ascending'}. Best is trial 102 with value: 0.05270834318071216.
running
[I 2024-11-21 18:22:20,659] Trial 104 finished with value: 0.05300247664909617 and parameters: {'model_name': 'IterativeImputer', 'estimator': 'RFR', 'initial_strategy': 'constant', 'n_nearest_features': 4, 'imputation_order': 'ascending'}. Best is trial 102 with value: 0.05270834318071216.
running
[I 2024-11-21 18:24:24,052] Trial 108 finished with value: 0.05372818741321541 and parameters: {'model_name': 'IterativeImputer', 'estimator': 'RFR', 'initial_strategy': 'constant', 'n_nearest_features': 4, 'imputation_order': 'ascending'}. Best is trial 102 with value: 0.05270834318071216.
running
[I 2024-11-21 18:24:34,647] Trial 107 finished with value: 0.05324527019084494 and parameters: {'model_name': 'IterativeImputer', 'estimator': 'RFR', 'initial_strategy': 'constant', 'n_nearest_features': 4, 'imputation_order': 'ascending'}. Best is trial 102 with value: 0.05270834318071216.
running
[I 2024-11-21 18:24:51,908] Trial 105 finished with value: 0.052874758203444096 and parameters: {'model_name': 'IterativeImputer', 'estimator': 'RFR', 'initial_strategy': 'constant', 'n_nearest_features': 4, 'imputation_order': 'ascending'}. Best is trial 102 with value: 0.05270834318071216.
running
[I 2024-11-21 18:25:06,122] Trial 106 finished with value: 0.053779923618471545 and parameters: {'model_name': 'IterativeImputer', 'estimator': 'RFR', 'initial_strategy': 'constant', 'n_nearest_features': 4, 'imputation_order': 'ascending'}. Best is trial 102 with value: 0.05270834318071216.
running
[I 2024-11-21 18:32:08,079] Trial 65 finished with value: 0.07619996143244771 and parameters: {'model_name': 'VAE', 'batch_size': 12, 'iterations': 2722, 'learning_rate': 0.008514434660551223, 'p_miss': 0.02007641675194574}. Best is trial 102 with value: 0.05270834318071216.
running
[I 2024-11-21 18:32:47,037] Trial 110 finished with value: 0.05296556145802027 and parameters: {'model_name': 'IterativeImputer', 'estimator': 'RFR', 'initial_strategy': 'constant', 'n_nearest_features': 4, 'imputation_order': 'ascending'}. Best is trial 102 with value: 0.05270834318071216.
running
[I 2024-11-21 18:32:58,842] Trial 109 finished with value: 0.0534268017230692 and parameters: {'model_name': 'IterativeImputer', 'estimator': 'RFR', 'initial_strategy': 'constant', 'n_nearest_features': 4, 'imputation_order': 'ascending'}. Best is trial 102 with value: 0.05270834318071216.
running
[I 2024-11-21 18:33:46,079] Trial 111 finished with value: 0.05378065053804516 and parameters: {'model_name': 'IterativeImputer', 'estimator': 'RFR', 'initial_strategy': 'most_frequent', 'n_nearest_features': 4, 'imputation_order': 'roman'}. Best is trial 102 with value: 0.05270834318071216.
running
[I 2024-11-21 18:36:08,270] Trial 112 finished with value: 0.053314028820116974 and parameters: {'model_name': 'IterativeImputer', 'estimator': 'RFR', 'initial_strategy': 'most_frequent', 'n_nearest_features': 4, 'imputation_order': 'roman'}. Best is trial 102 with value: 0.05270834318071216.
running
[I 2024-11-21 18:37:41,983] Trial 113 finished with value: 0.05276540271206222 and parameters: {'model_name': 'IterativeImputer', 'estimator': 'RFR', 'initial_strategy': 'constant', 'n_nearest_features': 4, 'imputation_order': 'arabic'}. Best is trial 102 with value: 0.05270834318071216.
running
[I 2024-11-21 18:37:44,199] Trial 122 finished with value: 0.07270054619150003 and parameters: {'model_name': 'KNNImputer', 'n_neighbors': 3763, 'weights': 'uniform'}. Best is trial 102 with value: 0.05270834318071216.
running
[I 2024-11-21 18:37:57,886] Trial 114 finished with value: 0.05254301677984522 and parameters: {'model_name': 'IterativeImputer', 'estimator': 'RFR', 'initial_strategy': 'mean', 'n_nearest_features': 4, 'imputation_order': 'arabic'}. Best is trial 114 with value: 0.05254301677984522.
running
[I 2024-11-21 18:39:06,531] Trial 115 finished with value: 0.052507806607321975 and parameters: {'model_name': 'IterativeImputer', 'estimator': 'RFR', 'initial_strategy': 'mean', 'n_nearest_features': 4, 'imputation_order': 'arabic'}. Best is trial 115 with value: 0.052507806607321975.
running
[I 2024-11-21 18:39:07,051] Trial 125 finished with value: 0.35086793386477944 and parameters: {'model_name': 'SimpleImputer', 'strategy': 'most_frequent'}. Best is trial 115 with value: 0.052507806607321975.
running
[I 2024-11-21 18:39:16,750] Trial 116 finished with value: 0.05224653952853463 and parameters: {'model_name': 'IterativeImputer', 'estimator': 'RFR', 'initial_strategy': 'mean', 'n_nearest_features': 4, 'imputation_order': 'arabic'}. Best is trial 116 with value: 0.05224653952853463.
running
[I 2024-11-21 18:45:30,270] Trial 117 finished with value: 0.05232267964698719 and parameters: {'model_name': 'IterativeImputer', 'estimator': 'RFR', 'initial_strategy': 'mean', 'n_nearest_features': 4, 'imputation_order': 'ascending'}. Best is trial 116 with value: 0.05224653952853463.
running
[I 2024-11-21 18:45:39,596] Trial 128 finished with value: 0.06199125274360686 and parameters: {'model_name': 'IterativeImputer', 'estimator': 'Ridge', 'initial_strategy': 'mean', 'n_nearest_features': 4, 'imputation_order': 'arabic'}. Best is trial 116 with value: 0.05224653952853463.
running
[I 2024-11-21 18:46:39,918] Trial 118 finished with value: 0.05318072729003796 and parameters: {'model_name': 'IterativeImputer', 'estimator': 'RFR', 'initial_strategy': 'mean', 'n_nearest_features': 4, 'imputation_order': 'arabic'}. Best is trial 116 with value: 0.05224653952853463.
running
[I 2024-11-21 18:47:15,528] Trial 119 finished with value: 0.05300820216601256 and parameters: {'model_name': 'IterativeImputer', 'estimator': 'RFR', 'initial_strategy': 'mean', 'n_nearest_features': 4, 'imputation_order': 'ascending'}. Best is trial 116 with value: 0.05224653952853463.
running
[I 2024-11-21 18:48:00,160] Trial 120 finished with value: 0.053144852104046944 and parameters: {'model_name': 'IterativeImputer', 'estimator': 'RFR', 'initial_strategy': 'mean', 'n_nearest_features': 4, 'imputation_order': 'arabic'}. Best is trial 116 with value: 0.05224653952853463.
running
[I 2024-11-21 18:50:27,565] Trial 121 finished with value: 0.052638873476077166 and parameters: {'model_name': 'IterativeImputer', 'estimator': 'RFR', 'initial_strategy': 'mean', 'n_nearest_features': 4, 'imputation_order': 'ascending'}. Best is trial 116 with value: 0.05224653952853463.
running
[I 2024-11-21 18:51:46,006] Trial 123 finished with value: 0.052854927698704104 and parameters: {'model_name': 'IterativeImputer', 'estimator': 'RFR', 'initial_strategy': 'most_frequent', 'n_nearest_features': 4, 'imputation_order': 'arabic'}. Best is trial 116 with value: 0.05224653952853463.
running
[I 2024-11-21 18:51:50,511] Trial 124 finished with value: 0.052596664410637 and parameters: {'model_name': 'IterativeImputer', 'estimator': 'RFR', 'initial_strategy': 'mean', 'n_nearest_features': 4, 'imputation_order': 'arabic'}. Best is trial 116 with value: 0.05224653952853463.
running
[I 2024-11-21 18:53:08,887] Trial 126 finished with value: 0.053096697131232704 and parameters: {'model_name': 'IterativeImputer', 'estimator': 'RFR', 'initial_strategy': 'mean', 'n_nearest_features': 4, 'imputation_order': 'arabic'}. Best is trial 116 with value: 0.05224653952853463.
running
[I 2024-11-21 18:53:37,619] Trial 127 finished with value: 0.051975289617652555 and parameters: {'model_name': 'IterativeImputer', 'estimator': 'RFR', 'initial_strategy': 'mean', 'n_nearest_features': 4, 'imputation_order': 'arabic'}. Best is trial 127 with value: 0.051975289617652555.
running
[I 2024-11-21 18:59:51,876] Trial 129 finished with value: 0.05187520716833951 and parameters: {'model_name': 'IterativeImputer', 'estimator': 'RFR', 'initial_strategy': 'mean', 'n_nearest_features': 4, 'imputation_order': 'arabic'}. Best is trial 129 with value: 0.05187520716833951.
running
[I 2024-11-21 19:00:18,069] Trial 130 finished with value: 0.05213365835780424 and parameters: {'model_name': 'IterativeImputer', 'estimator': 'RFR', 'initial_strategy': 'mean', 'n_nearest_features': 4, 'imputation_order': 'arabic'}. Best is trial 129 with value: 0.05187520716833951.
running
[I 2024-11-21 19:00:58,566] Trial 131 finished with value: 0.05339151199924648 and parameters: {'model_name': 'IterativeImputer', 'estimator': 'RFR', 'initial_strategy': 'mean', 'n_nearest_features': 5, 'imputation_order': 'arabic'}. Best is trial 129 with value: 0.05187520716833951.
running
[I 2024-11-21 19:01:06,760] Trial 140 finished with value: 0.06199125274360686 and parameters: {'model_name': 'IterativeImputer', 'estimator': 'Ridge', 'initial_strategy': 'mean', 'n_nearest_features': 5, 'imputation_order': 'arabic'}. Best is trial 129 with value: 0.05187520716833951.
running
[I 2024-11-21 19:01:08,763] Trial 141 finished with value: 0.06197600815315272 and parameters: {'model_name': 'KNNImputer', 'n_neighbors': 22, 'weights': 'uniform'}. Best is trial 129 with value: 0.05187520716833951.
running
[I 2024-11-21 19:02:11,377] Trial 132 finished with value: 0.05269882706591121 and parameters: {'model_name': 'IterativeImputer', 'estimator': 'RFR', 'initial_strategy': 'mean', 'n_nearest_features': 5, 'imputation_order': 'arabic'}. Best is trial 129 with value: 0.05187520716833951.
running
[I 2024-11-21 19:04:50,502] Trial 133 finished with value: 0.05316471427531115 and parameters: {'model_name': 'IterativeImputer', 'estimator': 'RFR', 'initial_strategy': 'mean', 'n_nearest_features': 5, 'imputation_order': 'arabic'}. Best is trial 129 with value: 0.05187520716833951.
running
[I 2024-11-21 19:05:50,075] Trial 135 finished with value: 0.05281255002844788 and parameters: {'model_name': 'IterativeImputer', 'estimator': 'RFR', 'initial_strategy': 'mean', 'n_nearest_features': 5, 'imputation_order': 'arabic'}. Best is trial 129 with value: 0.05187520716833951.
running
[I 2024-11-21 19:05:59,549] Trial 134 finished with value: 0.05220569212492521 and parameters: {'model_name': 'IterativeImputer', 'estimator': 'RFR', 'initial_strategy': 'mean', 'n_nearest_features': 5, 'imputation_order': 'arabic'}. Best is trial 129 with value: 0.05187520716833951.
running
[I 2024-11-21 19:07:20,758] Trial 136 finished with value: 0.05276550360545436 and parameters: {'model_name': 'IterativeImputer', 'estimator': 'RFR', 'initial_strategy': 'mean', 'n_nearest_features': 5, 'imputation_order': 'arabic'}. Best is trial 129 with value: 0.05187520716833951.
running
[I 2024-11-21 19:07:38,595] Trial 137 finished with value: 0.05307041227460339 and parameters: {'model_name': 'IterativeImputer', 'estimator': 'RFR', 'initial_strategy': 'mean', 'n_nearest_features': 5, 'imputation_order': 'arabic'}. Best is trial 129 with value: 0.05187520716833951.
running
[I 2024-11-21 19:13:19,590] Trial 139 finished with value: 0.05256207550444404 and parameters: {'model_name': 'IterativeImputer', 'estimator': 'RFR', 'initial_strategy': 'mean', 'n_nearest_features': 4, 'imputation_order': 'arabic'}. Best is trial 129 with value: 0.05187520716833951.
running
[I 2024-11-21 19:13:52,662] Trial 138 finished with value: 0.053307623609857954 and parameters: {'model_name': 'IterativeImputer', 'estimator': 'RFR', 'initial_strategy': 'mean', 'n_nearest_features': 5, 'imputation_order': 'arabic'}. Best is trial 129 with value: 0.05187520716833951.
running
[I 2024-11-21 19:13:53,361] Trial 150 finished with value: 0.07318252697756407 and parameters: {'model_name': 'SimpleImputer', 'strategy': 'median'}. Best is trial 129 with value: 0.05187520716833951.
running
[I 2024-11-21 19:14:11,785] Trial 142 finished with value: 0.05263873769269979 and parameters: {'model_name': 'IterativeImputer', 'estimator': 'RFR', 'initial_strategy': 'mean', 'n_nearest_features': 4, 'imputation_order': 'arabic'}. Best is trial 129 with value: 0.05187520716833951.
running
[I 2024-11-21 19:16:05,086] Trial 143 finished with value: 0.052768837182996645 and parameters: {'model_name': 'IterativeImputer', 'estimator': 'RFR', 'initial_strategy': 'mean', 'n_nearest_features': 5, 'imputation_order': 'arabic'}. Best is trial 129 with value: 0.05187520716833951.
running
[I 2024-11-21 19:18:57,361] Trial 144 finished with value: 0.05344692124485199 and parameters: {'model_name': 'IterativeImputer', 'estimator': 'RFR', 'initial_strategy': 'mean', 'n_nearest_features': 5, 'imputation_order': 'arabic'}. Best is trial 129 with value: 0.05187520716833951.
running
[I 2024-11-21 19:19:39,255] Trial 146 finished with value: 0.05205664898017678 and parameters: {'model_name': 'IterativeImputer', 'estimator': 'RFR', 'initial_strategy': 'mean', 'n_nearest_features': 5, 'imputation_order': 'arabic'}. Best is trial 129 with value: 0.05187520716833951.
running
[I 2024-11-21 19:20:02,101] Trial 145 finished with value: 0.053184333468370204 and parameters: {'model_name': 'IterativeImputer', 'estimator': 'RFR', 'initial_strategy': 'mean', 'n_nearest_features': 5, 'imputation_order': 'arabic'}. Best is trial 129 with value: 0.05187520716833951.
running
[I 2024-11-21 19:21:32,796] Trial 147 finished with value: 0.052094362473720665 and parameters: {'model_name': 'IterativeImputer', 'estimator': 'RFR', 'initial_strategy': 'mean', 'n_nearest_features': 5, 'imputation_order': 'arabic'}. Best is trial 129 with value: 0.05187520716833951.
running
[I 2024-11-21 19:21:50,306] Trial 148 finished with value: 0.053233908603254554 and parameters: {'model_name': 'IterativeImputer', 'estimator': 'RFR', 'initial_strategy': 'mean', 'n_nearest_features': 5, 'imputation_order': 'arabic'}. Best is trial 129 with value: 0.05187520716833951.
running
[I 2024-11-21 19:26:41,743] Trial 149 finished with value: 0.05243557770304883 and parameters: {'model_name': 'IterativeImputer', 'estimator': 'RFR', 'initial_strategy': 'mean', 'n_nearest_features': 4, 'imputation_order': 'arabic'}. Best is trial 129 with value: 0.05187520716833951.
running
[I 2024-11-21 19:27:36,105] Trial 152 finished with value: 0.05241121352947027 and parameters: {'model_name': 'IterativeImputer', 'estimator': 'RFR', 'initial_strategy': 'mean', 'n_nearest_features': 4, 'imputation_order': 'arabic'}. Best is trial 129 with value: 0.05187520716833951.
running
[I 2024-11-21 19:27:54,391] Trial 151 finished with value: 0.05209816816072952 and parameters: {'model_name': 'IterativeImputer', 'estimator': 'RFR', 'initial_strategy': 'mean', 'n_nearest_features': 4, 'imputation_order': 'arabic'}. Best is trial 129 with value: 0.05187520716833951.
running
[I 2024-11-21 19:30:05,044] Trial 153 finished with value: 0.0522575175793004 and parameters: {'model_name': 'IterativeImputer', 'estimator': 'RFR', 'initial_strategy': 'mean', 'n_nearest_features': 4, 'imputation_order': 'arabic'}. Best is trial 129 with value: 0.05187520716833951.
running
[I 2024-11-21 19:30:44,892] Trial 162 finished with value: 0.09182179588344037 and parameters: {'model_name': 'IterativeImputer', 'estimator': 'Bayesian', 'initial_strategy': 'mean', 'n_nearest_features': 4, 'imputation_order': 'arabic', 'sample_posterior': True}. Best is trial 129 with value: 0.05187520716833951.
running
[I 2024-11-21 19:33:23,674] Trial 154 finished with value: 0.05228461041220132 and parameters: {'model_name': 'IterativeImputer', 'estimator': 'RFR', 'initial_strategy': 'mean', 'n_nearest_features': 4, 'imputation_order': 'arabic'}. Best is trial 129 with value: 0.05187520716833951.
running
