Run: 58
/cm/local/apps/slurm/var/spool/job1069388/slurm_script: line 26: 
pip install -e tpot2
pip install -r tpot2/ImputerExperiments/requirements_.txt
: No such file or directory
RunStart
Version 0.1.7a0 of tpot2 is outdated. Version 0.1.8a0 was released Tuesday September 17, 2024.
starting loops
../data/c/23395/23395.pkl
working on 
../data/c/23395/class_full_MNAR_0.1_3
4.060183048248291
running experiment 1/3 - Does large hyperparameter space improve reconstruction accuracy over simple
[I 2024-11-23 04:43:38,404] A new study created in memory with name: no-name-c5ba7927-0c9e-4ac5-b7a0-d5c5f5aaf735
running
running
running
running
running
running
running
running
running
running
running
running
running
running
running
running
[I 2024-11-23 04:43:38,572] Trial 2 finished with value: inf and parameters: {'model_name': 'VAE', 'batch_size': 23, 'iterations': 3041, 'learning_rate': 0.0003652248551246022, 'p_miss': 0.29160506117774093}. Best is trial 2 with value: inf.
running
[I 2024-11-23 04:43:38,713] Trial 7 finished with value: inf and parameters: {'model_name': 'VAE', 'batch_size': 94, 'iterations': 340, 'learning_rate': 0.019775860814523503, 'p_miss': 0.09973762025881885}. Best is trial 2 with value: inf.
running
[I 2024-11-23 04:43:38,819] Trial 13 finished with value: inf and parameters: {'model_name': 'VAE', 'batch_size': 815, 'iterations': 553, 'learning_rate': 0.022107336305223997, 'p_miss': 0.2530153018575788}. Best is trial 2 with value: inf.
running
[I 2024-11-23 04:43:38,965] Trial 15 finished with value: inf and parameters: {'model_name': 'VAE', 'batch_size': 10, 'iterations': 10, 'learning_rate': 0.0011357628665422284, 'p_miss': 0.06955984823954957}. Best is trial 2 with value: inf.
running
[I 2024-11-23 04:43:39,123] Trial 16 finished with value: inf and parameters: {'model_name': 'VAE', 'batch_size': 146, 'iterations': 6275, 'learning_rate': 0.0016511101564547928, 'p_miss': 0.10579709662199097}. Best is trial 2 with value: inf.
running
[I 2024-11-23 04:43:39,238] Trial 18 finished with value: inf and parameters: {'model_name': 'VAE', 'batch_size': 2, 'iterations': 829, 'learning_rate': 0.0005448153173656787, 'p_miss': 0.23735374758922717}. Best is trial 2 with value: inf.
running
[I 2024-11-23 04:43:39,352] Trial 17 finished with value: inf and parameters: {'model_name': 'VAE', 'batch_size': 10, 'iterations': 161, 'learning_rate': 0.012620724455302292, 'p_miss': 0.042036876866042586}. Best is trial 2 with value: inf.
running
[I 2024-11-23 04:43:39,483] Trial 20 finished with value: inf and parameters: {'model_name': 'VAE', 'batch_size': 104, 'iterations': 341, 'learning_rate': 0.026303883388472428, 'p_miss': 0.06544821926859003}. Best is trial 2 with value: inf.
running
[I 2024-11-23 04:43:39,593] Trial 21 finished with value: inf and parameters: {'model_name': 'VAE', 'batch_size': 28, 'iterations': 13, 'learning_rate': 0.039616889486989285, 'p_miss': 0.1236114877543446}. Best is trial 2 with value: inf.
running
[I 2024-11-23 04:43:39,738] Trial 19 finished with value: 0.4196034410582511 and parameters: {'model_name': 'SimpleImputer', 'strategy': 'constant'}. Best is trial 19 with value: 0.4196034410582511.
running
[I 2024-11-23 04:43:39,978] Trial 4 finished with value: 0.23761495029341662 and parameters: {'model_name': 'SimpleImputer', 'strategy': 'median'}. Best is trial 4 with value: 0.23761495029341662.
running
[I 2024-11-23 04:43:40,125] Trial 1 finished with value: 0.23761495029341662 and parameters: {'model_name': 'SimpleImputer', 'strategy': 'median'}. Best is trial 4 with value: 0.23761495029341662.
running
[I 2024-11-23 04:43:40,323] Trial 10 finished with value: 0.4196034410582511 and parameters: {'model_name': 'SimpleImputer', 'strategy': 'most_frequent'}. Best is trial 4 with value: 0.23761495029341662.
running
[I 2024-11-23 04:43:40,470] Trial 25 finished with value: 0.4196034410582511 and parameters: {'model_name': 'SimpleImputer', 'strategy': 'constant'}. Best is trial 4 with value: 0.23761495029341662.
running
[I 2024-11-23 04:43:40,936] Trial 23 finished with value: 0.23761495029341662 and parameters: {'model_name': 'SimpleImputer', 'strategy': 'median'}. Best is trial 4 with value: 0.23761495029341662.
running
[I 2024-11-23 04:43:41,481] Trial 26 finished with value: 0.23761495029341662 and parameters: {'model_name': 'SimpleImputer', 'strategy': 'median'}. Best is trial 4 with value: 0.23761495029341662.
running
[I 2024-11-23 04:43:41,700] Trial 27 finished with value: 0.23761495029341662 and parameters: {'model_name': 'SimpleImputer', 'strategy': 'median'}. Best is trial 4 with value: 0.23761495029341662.
running
[I 2024-11-23 04:43:44,579] Trial 8 finished with value: 0.2398459535822171 and parameters: {'model_name': 'IterativeImputer', 'estimator': 'Ridge', 'initial_strategy': 'mean', 'n_nearest_features': 4, 'imputation_order': 'arabic'}. Best is trial 4 with value: 0.23761495029341662.
running
[I 2024-11-23 04:43:45,677] Trial 29 finished with value: 0.2398459835060153 and parameters: {'model_name': 'IterativeImputer', 'estimator': 'Ridge', 'initial_strategy': 'most_frequent', 'n_nearest_features': 3, 'imputation_order': 'ascending'}. Best is trial 4 with value: 0.23761495029341662.
running
[I 2024-11-23 04:43:46,235] Trial 32 finished with value: 0.23984595692993788 and parameters: {'model_name': 'IterativeImputer', 'estimator': 'Ridge', 'initial_strategy': 'mean', 'n_nearest_features': 3, 'imputation_order': 'descending'}. Best is trial 4 with value: 0.23761495029341662.
running
[I 2024-11-23 04:43:46,924] Trial 30 finished with value: inf and parameters: {'model_name': 'GAIN', 'batch_size': 1, 'hint_rate': 0.2698385236113262, 'alpha': 53, 'iterations': 1, 'learning_rate': 0.0001154135000217191, 'p_miss': 0.18292064544217432}. Best is trial 4 with value: 0.23761495029341662.
running
[I 2024-11-23 04:43:47,393] Trial 28 finished with value: inf and parameters: {'model_name': 'GAIN', 'batch_size': 1, 'hint_rate': 0.3251694178547738, 'alpha': 40, 'iterations': 2, 'learning_rate': 0.00011224265560872539, 'p_miss': 0.18643731289185236}. Best is trial 4 with value: 0.23761495029341662.
running
[I 2024-11-23 04:43:47,773] Trial 34 finished with value: inf and parameters: {'model_name': 'GAIN', 'batch_size': 1, 'hint_rate': 0.01716433713981047, 'alpha': 56, 'iterations': 1, 'learning_rate': 0.00014081823991926316, 'p_miss': 0.1999956343594064}. Best is trial 4 with value: 0.23761495029341662.
running
[I 2024-11-23 04:43:50,381] Trial 35 finished with value: 0.40645641306567865 and parameters: {'model_name': 'GAIN', 'batch_size': 1, 'hint_rate': 0.6646892776850848, 'alpha': 16, 'iterations': 1, 'learning_rate': 0.0001649487425942603, 'p_miss': 0.17938171565979844}. Best is trial 4 with value: 0.23761495029341662.
running
[I 2024-11-23 04:43:51,073] Trial 3 finished with value: 0.4097334177000884 and parameters: {'model_name': 'GAIN', 'batch_size': 210, 'hint_rate': 0.11993728255123341, 'alpha': 64, 'iterations': 3, 'learning_rate': 0.0022874495748221816, 'p_miss': 0.11418821925659849}. Best is trial 4 with value: 0.23761495029341662.
running
[I 2024-11-23 04:43:52,209] Trial 14 finished with value: 0.39717713565435353 and parameters: {'model_name': 'GAIN', 'batch_size': 917, 'hint_rate': 0.13083487528869703, 'alpha': 80, 'iterations': 4, 'learning_rate': 0.00021125014726001707, 'p_miss': 0.2351662392029915}. Best is trial 4 with value: 0.23761495029341662.
running
[I 2024-11-23 04:44:20,078] Trial 12 finished with value: 0.4187578817563772 and parameters: {'model_name': 'GAIN', 'batch_size': 854, 'hint_rate': 0.6389759686910662, 'alpha': 4, 'iterations': 51, 'learning_rate': 0.08826967452955453, 'p_miss': 0.03212643837633427}. Best is trial 4 with value: 0.23761495029341662.
running
[I 2024-11-23 04:44:21,690] Trial 0 finished with value: 0.41584372130306546 and parameters: {'model_name': 'GAIN', 'batch_size': 248, 'hint_rate': 0.6215349194397353, 'alpha': 78, 'iterations': 75, 'learning_rate': 0.0022337093112967128, 'p_miss': 0.041521356994084845}. Best is trial 4 with value: 0.23761495029341662.
running
[I 2024-11-23 04:44:26,150] Trial 11 finished with value: inf and parameters: {'model_name': 'GAIN', 'batch_size': 5, 'hint_rate': 0.8568129829936952, 'alpha': 72, 'iterations': 437, 'learning_rate': 0.018145310218526042, 'p_miss': 0.04768298734644689}. Best is trial 4 with value: 0.23761495029341662.
running
[I 2024-11-23 04:44:31,042] Trial 22 finished with value: 0.33429515239749613 and parameters: {'model_name': 'IterativeImputer', 'estimator': 'Bayesian', 'initial_strategy': 'constant', 'n_nearest_features': 4, 'imputation_order': 'roman', 'sample_posterior': True}. Best is trial 4 with value: 0.23761495029341662.
running
[I 2024-11-23 04:44:31,951] Trial 6 finished with value: 0.33568677484358816 and parameters: {'model_name': 'IterativeImputer', 'estimator': 'Bayesian', 'initial_strategy': 'median', 'n_nearest_features': 3, 'imputation_order': 'roman', 'sample_posterior': True}. Best is trial 4 with value: 0.23761495029341662.
running
[I 2024-11-23 04:45:05,089] Trial 36 finished with value: 0.23284981136711397 and parameters: {'model_name': 'KNNImputer', 'n_neighbors': 6069, 'weights': 'uniform'}. Best is trial 36 with value: 0.23284981136711397.
running
[I 2024-11-23 04:45:14,139] Trial 31 finished with value: 0.23097951525617555 and parameters: {'model_name': 'KNNImputer', 'n_neighbors': 58695, 'weights': 'uniform'}. Best is trial 31 with value: 0.23097951525617555.
running
[I 2024-11-23 04:45:18,528] Trial 37 finished with value: 0.22971994005762508 and parameters: {'model_name': 'KNNImputer', 'n_neighbors': 16246, 'weights': 'uniform'}. Best is trial 37 with value: 0.22971994005762508.
running
[I 2024-11-23 04:45:23,149] Trial 24 finished with value: 0.2305220971964542 and parameters: {'model_name': 'KNNImputer', 'n_neighbors': 45595, 'weights': 'uniform'}. Best is trial 37 with value: 0.22971994005762508.
running
[I 2024-11-23 04:45:24,172] Trial 38 finished with value: 0.23097951525617555 and parameters: {'model_name': 'KNNImputer', 'n_neighbors': 59422, 'weights': 'uniform'}. Best is trial 37 with value: 0.22971994005762508.
running
[I 2024-11-23 04:45:37,653] Trial 33 finished with value: 0.23051382747100924 and parameters: {'model_name': 'KNNImputer', 'n_neighbors': 44294, 'weights': 'uniform'}. Best is trial 37 with value: 0.22971994005762508.
running
[I 2024-11-23 04:45:49,078] Trial 44 finished with value: 0.22987207545357155 and parameters: {'model_name': 'KNNImputer', 'n_neighbors': 11079, 'weights': 'uniform'}. Best is trial 37 with value: 0.22971994005762508.
running
[I 2024-11-23 04:46:08,953] Trial 39 finished with value: 0.23855232177900554 and parameters: {'model_name': 'KNNImputer', 'n_neighbors': 44273, 'weights': 'distance'}. Best is trial 37 with value: 0.22971994005762508.
[I 2024-11-23 04:46:09,212] Trial 46 finished with value: 0.23857701007768303 and parameters: {'model_name': 'KNNImputer', 'n_neighbors': 10534, 'weights': 'distance'}. Best is trial 37 with value: 0.22971994005762508.
running
running
[I 2024-11-23 04:46:15,090] Trial 40 finished with value: 0.23854770530562694 and parameters: {'model_name': 'KNNImputer', 'n_neighbors': 48510, 'weights': 'distance'}. Best is trial 37 with value: 0.22971994005762508.
running
[I 2024-11-23 04:46:20,152] Trial 41 finished with value: 0.2385427953363676 and parameters: {'model_name': 'KNNImputer', 'n_neighbors': 52479, 'weights': 'distance'}. Best is trial 37 with value: 0.22971994005762508.
running
[I 2024-11-23 04:46:28,281] Trial 47 finished with value: 0.23280426548291827 and parameters: {'model_name': 'KNNImputer', 'n_neighbors': 6102, 'weights': 'uniform'}. Best is trial 37 with value: 0.22971994005762508.
running
[I 2024-11-23 04:46:34,560] Trial 49 finished with value: 0.2320382961927681 and parameters: {'model_name': 'KNNImputer', 'n_neighbors': 7187, 'weights': 'uniform'}. Best is trial 37 with value: 0.22971994005762508.
running
[I 2024-11-23 04:46:37,226] Trial 43 finished with value: 0.238540640829411 and parameters: {'model_name': 'KNNImputer', 'n_neighbors': 61193, 'weights': 'distance'}. Best is trial 37 with value: 0.22971994005762508.
running
[I 2024-11-23 04:46:37,578] Trial 42 finished with value: 0.238540640829411 and parameters: {'model_name': 'KNNImputer', 'n_neighbors': 65176, 'weights': 'distance'}. Best is trial 37 with value: 0.22971994005762508.
running
[I 2024-11-23 04:46:38,679] Trial 50 finished with value: 0.23263412765073874 and parameters: {'model_name': 'KNNImputer', 'n_neighbors': 6486, 'weights': 'uniform'}. Best is trial 37 with value: 0.22971994005762508.
running
[I 2024-11-23 04:46:43,343] Trial 45 finished with value: 0.238540640829411 and parameters: {'model_name': 'KNNImputer', 'n_neighbors': 65313, 'weights': 'distance'}. Best is trial 37 with value: 0.22971994005762508.
running
[I 2024-11-23 04:47:03,471] Trial 51 finished with value: 0.23097951525617555 and parameters: {'model_name': 'KNNImputer', 'n_neighbors': 60929, 'weights': 'uniform'}. Best is trial 37 with value: 0.22971994005762508.
running
[I 2024-11-23 04:47:05,103] Trial 48 finished with value: 0.23088663864865047 and parameters: {'model_name': 'KNNImputer', 'n_neighbors': 53549, 'weights': 'uniform'}. Best is trial 37 with value: 0.22971994005762508.
running
[I 2024-11-23 04:47:14,712] Trial 53 finished with value: 0.22970558260100163 and parameters: {'model_name': 'KNNImputer', 'n_neighbors': 12175, 'weights': 'uniform'}. Best is trial 53 with value: 0.22970558260100163.
running
[I 2024-11-23 04:47:27,732] Trial 52 finished with value: 0.23065678529689193 and parameters: {'model_name': 'KNNImputer', 'n_neighbors': 48356, 'weights': 'uniform'}. Best is trial 53 with value: 0.22970558260100163.
running
[I 2024-11-23 04:47:47,210] Trial 54 finished with value: 0.23004230272263632 and parameters: {'model_name': 'KNNImputer', 'n_neighbors': 30718, 'weights': 'uniform'}. Best is trial 53 with value: 0.22970558260100163.
running
[I 2024-11-23 04:47:47,717] Trial 55 finished with value: 0.23008614979750028 and parameters: {'model_name': 'KNNImputer', 'n_neighbors': 31887, 'weights': 'uniform'}. Best is trial 53 with value: 0.22970558260100163.
running
[I 2024-11-23 04:47:49,603] Trial 56 finished with value: 0.22982967534347792 and parameters: {'model_name': 'KNNImputer', 'n_neighbors': 23494, 'weights': 'uniform'}. Best is trial 53 with value: 0.22970558260100163.
running
[I 2024-11-23 04:47:56,794] Trial 57 finished with value: 0.2298223663789743 and parameters: {'model_name': 'KNNImputer', 'n_neighbors': 23601, 'weights': 'uniform'}. Best is trial 53 with value: 0.22970558260100163.
running
[I 2024-11-23 04:48:02,819] Trial 58 finished with value: 0.23003816922918005 and parameters: {'model_name': 'KNNImputer', 'n_neighbors': 29006, 'weights': 'uniform'}. Best is trial 53 with value: 0.22970558260100163.
running
[I 2024-11-23 04:48:11,036] Trial 59 finished with value: 0.23005331211466468 and parameters: {'model_name': 'KNNImputer', 'n_neighbors': 28565, 'weights': 'uniform'}. Best is trial 53 with value: 0.22970558260100163.
running
[I 2024-11-23 04:48:11,680] Trial 62 finished with value: 0.22996190891201196 and parameters: {'model_name': 'KNNImputer', 'n_neighbors': 25147, 'weights': 'uniform'}. Best is trial 53 with value: 0.22970558260100163.
running
[I 2024-11-23 04:48:14,174] Trial 60 finished with value: 0.22994330455098577 and parameters: {'model_name': 'KNNImputer', 'n_neighbors': 26246, 'weights': 'uniform'}. Best is trial 53 with value: 0.22970558260100163.
running
[I 2024-11-23 04:48:14,336] Trial 61 finished with value: 0.22993273468898706 and parameters: {'model_name': 'KNNImputer', 'n_neighbors': 24808, 'weights': 'uniform'}. Best is trial 53 with value: 0.22970558260100163.
running
[I 2024-11-23 04:48:17,191] Trial 63 finished with value: 0.22992332377719488 and parameters: {'model_name': 'KNNImputer', 'n_neighbors': 22941, 'weights': 'uniform'}. Best is trial 53 with value: 0.22970558260100163.
running
[I 2024-11-23 04:48:35,363] Trial 65 finished with value: 0.22995780039332078 and parameters: {'model_name': 'KNNImputer', 'n_neighbors': 22826, 'weights': 'uniform'}. Best is trial 53 with value: 0.22970558260100163.
running
[I 2024-11-23 04:48:38,952] Trial 64 finished with value: 0.22987559697258358 and parameters: {'model_name': 'KNNImputer', 'n_neighbors': 23094, 'weights': 'uniform'}. Best is trial 53 with value: 0.22970558260100163.
running
[I 2024-11-23 04:48:47,229] Trial 66 finished with value: 0.22986647925128553 and parameters: {'model_name': 'KNNImputer', 'n_neighbors': 23236, 'weights': 'uniform'}. Best is trial 53 with value: 0.22970558260100163.
running
[I 2024-11-23 04:48:59,002] Trial 67 finished with value: 0.22991486005159328 and parameters: {'model_name': 'KNNImputer', 'n_neighbors': 25980, 'weights': 'uniform'}. Best is trial 53 with value: 0.22970558260100163.
running
[I 2024-11-23 04:49:02,854] Trial 5 finished with value: 0.39741084904313756 and parameters: {'model_name': 'GAIN', 'batch_size': 110, 'hint_rate': 0.43873345465070906, 'alpha': 71, 'iterations': 993, 'learning_rate': 0.000245773804118931, 'p_miss': 0.29450520843497313}. Best is trial 53 with value: 0.22970558260100163.
running
[I 2024-11-23 04:49:11,633] Trial 68 finished with value: 0.22973505014855838 and parameters: {'model_name': 'KNNImputer', 'n_neighbors': 17934, 'weights': 'uniform'}. Best is trial 53 with value: 0.22970558260100163.
running
[I 2024-11-23 04:49:13,595] Trial 70 finished with value: 0.2296208794801137 and parameters: {'model_name': 'KNNImputer', 'n_neighbors': 19406, 'weights': 'uniform'}. Best is trial 70 with value: 0.2296208794801137.
running
[I 2024-11-23 04:49:15,570] Trial 69 finished with value: 0.22982996940659675 and parameters: {'model_name': 'KNNImputer', 'n_neighbors': 19981, 'weights': 'uniform'}. Best is trial 70 with value: 0.2296208794801137.
running
[I 2024-11-23 04:49:22,082] Trial 9 finished with value: 0.40201184255928657 and parameters: {'model_name': 'GAIN', 'batch_size': 52, 'hint_rate': 0.2947518808807813, 'alpha': 16, 'iterations': 1159, 'learning_rate': 0.00031607398427045355, 'p_miss': 0.2106408288801701}. Best is trial 70 with value: 0.2296208794801137.
running
[I 2024-11-23 04:49:23,893] Trial 71 finished with value: 0.22988681027001817 and parameters: {'model_name': 'KNNImputer', 'n_neighbors': 20814, 'weights': 'uniform'}. Best is trial 70 with value: 0.2296208794801137.
running
[I 2024-11-23 04:49:25,246] Trial 72 finished with value: 0.22981648100753332 and parameters: {'model_name': 'KNNImputer', 'n_neighbors': 18233, 'weights': 'uniform'}. Best is trial 70 with value: 0.2296208794801137.
running
[I 2024-11-23 04:49:27,129] Trial 73 finished with value: 0.22976305007761666 and parameters: {'model_name': 'KNNImputer', 'n_neighbors': 18614, 'weights': 'uniform'}. Best is trial 70 with value: 0.2296208794801137.
running
[I 2024-11-23 04:49:29,148] Trial 74 finished with value: 0.2296704172579071 and parameters: {'model_name': 'KNNImputer', 'n_neighbors': 17778, 'weights': 'uniform'}. Best is trial 70 with value: 0.2296208794801137.
running
[I 2024-11-23 04:49:30,999] Trial 75 finished with value: 0.22963116826766888 and parameters: {'model_name': 'KNNImputer', 'n_neighbors': 17665, 'weights': 'uniform'}. Best is trial 70 with value: 0.2296208794801137.
running
[I 2024-11-23 04:49:31,323] Trial 76 finished with value: 0.22986367932658935 and parameters: {'model_name': 'KNNImputer', 'n_neighbors': 20398, 'weights': 'uniform'}. Best is trial 70 with value: 0.2296208794801137.
running
[I 2024-11-23 04:49:32,905] Trial 77 finished with value: 0.22951283262382258 and parameters: {'model_name': 'KNNImputer', 'n_neighbors': 17121, 'weights': 'uniform'}. Best is trial 77 with value: 0.22951283262382258.
running
[I 2024-11-23 04:49:41,090] Trial 78 finished with value: 0.22962613434258078 and parameters: {'model_name': 'KNNImputer', 'n_neighbors': 17656, 'weights': 'uniform'}. Best is trial 77 with value: 0.22951283262382258.
running
[I 2024-11-23 04:50:42,402] Trial 81 finished with value: 0.2255354844259209 and parameters: {'model_name': 'IterativeImputer', 'estimator': 'KNN', 'initial_strategy': 'median', 'n_nearest_features': 1, 'imputation_order': 'random'}. Best is trial 81 with value: 0.2255354844259209.
running
[I 2024-11-23 04:50:57,576] Trial 86 finished with value: 0.2255354844259209 and parameters: {'model_name': 'IterativeImputer', 'estimator': 'KNN', 'initial_strategy': 'median', 'n_nearest_features': 1, 'imputation_order': 'random'}. Best is trial 81 with value: 0.2255354844259209.
running
[I 2024-11-23 04:50:58,567] Trial 82 finished with value: 0.22564355629598443 and parameters: {'model_name': 'IterativeImputer', 'estimator': 'KNN', 'initial_strategy': 'most_frequent', 'n_nearest_features': 1, 'imputation_order': 'random'}. Best is trial 81 with value: 0.2255354844259209.
running
[I 2024-11-23 04:51:01,762] Trial 89 finished with value: 0.2255354844259209 and parameters: {'model_name': 'IterativeImputer', 'estimator': 'KNN', 'initial_strategy': 'median', 'n_nearest_features': 1, 'imputation_order': 'random'}. Best is trial 81 with value: 0.2255354844259209.
running
[I 2024-11-23 04:51:02,766] Trial 90 finished with value: 0.2255354844259209 and parameters: {'model_name': 'IterativeImputer', 'estimator': 'KNN', 'initial_strategy': 'median', 'n_nearest_features': 1, 'imputation_order': 'random'}. Best is trial 81 with value: 0.2255354844259209.
running
[I 2024-11-23 04:51:13,047] Trial 88 finished with value: 0.22564355629598443 and parameters: {'model_name': 'IterativeImputer', 'estimator': 'KNN', 'initial_strategy': 'constant', 'n_nearest_features': 1, 'imputation_order': 'random'}. Best is trial 81 with value: 0.2255354844259209.
running
