[I 2024-11-13 07:39:02,507] Trial 187 finished with value: 0.3047799176385564 and parameters: {'model_name': 'KNNImputer', 'n_neighbors': 407, 'weights': 'uniform'}. Best is trial 73 with value: 0.30271037755929664.
running
[I 2024-11-13 07:39:08,497] Trial 188 finished with value: 0.3050576307674241 and parameters: {'model_name': 'KNNImputer', 'n_neighbors': 456, 'weights': 'uniform'}. Best is trial 73 with value: 0.30271037755929664.
running
[I 2024-11-13 07:39:10,829] Trial 189 finished with value: 0.3067627329793014 and parameters: {'model_name': 'KNNImputer', 'n_neighbors': 900, 'weights': 'uniform'}. Best is trial 73 with value: 0.30271037755929664.
running
[I 2024-11-13 07:39:13,049] Trial 179 finished with value: 0.6071013479449624 and parameters: {'model_name': 'GAIN', 'batch_size': 139, 'hint_rate': 0.02276790989287042, 'alpha': 30, 'iterations': 222, 'learning_rate': 0.00476582850242024, 'p_miss': 0.12780310561064515}. Best is trial 73 with value: 0.30271037755929664.
running
[I 2024-11-13 07:39:17,313] Trial 190 finished with value: 0.30703287939334645 and parameters: {'model_name': 'KNNImputer', 'n_neighbors': 1001, 'weights': 'uniform'}. Best is trial 73 with value: 0.30271037755929664.
running
[I 2024-11-13 07:39:19,435] Trial 191 finished with value: 0.3083850264980482 and parameters: {'model_name': 'KNNImputer', 'n_neighbors': 1730, 'weights': 'uniform'}. Best is trial 73 with value: 0.30271037755929664.
running
[I 2024-11-13 07:39:19,664] Trial 175 finished with value: 0.6160425938697294 and parameters: {'model_name': 'GAIN', 'batch_size': 152, 'hint_rate': 0.023436701011014416, 'alpha': 26, 'iterations': 249, 'learning_rate': 0.0060372750475616065, 'p_miss': 0.11713147011204278}. Best is trial 73 with value: 0.30271037755929664.
running
[I 2024-11-13 07:39:22,480] Trial 192 finished with value: 0.3082621901887051 and parameters: {'model_name': 'KNNImputer', 'n_neighbors': 1663, 'weights': 'uniform'}. Best is trial 73 with value: 0.30271037755929664.
running
[I 2024-11-13 07:39:27,196] Trial 193 finished with value: 0.3083561458164401 and parameters: {'model_name': 'KNNImputer', 'n_neighbors': 1714, 'weights': 'uniform'}. Best is trial 73 with value: 0.30271037755929664.
running
[I 2024-11-13 07:39:28,421] Trial 195 finished with value: 0.3051327143034125 and parameters: {'model_name': 'KNNImputer', 'n_neighbors': 475, 'weights': 'uniform'}. Best is trial 73 with value: 0.30271037755929664.
running
[I 2024-11-13 07:39:28,697] Trial 194 finished with value: 0.30452756398493486 and parameters: {'model_name': 'KNNImputer', 'n_neighbors': 360, 'weights': 'uniform'}. Best is trial 73 with value: 0.30271037755929664.
running
[I 2024-11-13 07:39:31,460] Trial 196 finished with value: 0.3045568708392593 and parameters: {'model_name': 'KNNImputer', 'n_neighbors': 365, 'weights': 'uniform'}. Best is trial 73 with value: 0.30271037755929664.
[I 2024-11-13 07:39:35,723] Trial 197 finished with value: 0.3045665903600605 and parameters: {'model_name': 'KNNImputer', 'n_neighbors': 368, 'weights': 'uniform'}. Best is trial 73 with value: 0.30271037755929664.
[I 2024-11-13 07:39:36,616] Trial 198 finished with value: 0.30465457649860317 and parameters: {'model_name': 'KNNImputer', 'n_neighbors': 379, 'weights': 'uniform'}. Best is trial 73 with value: 0.30271037755929664.
[I 2024-11-13 07:39:36,763] Trial 199 finished with value: 0.3042202424743338 and parameters: {'model_name': 'KNNImputer', 'n_neighbors': 309, 'weights': 'uniform'}. Best is trial 73 with value: 0.30271037755929664.
[I 2024-11-13 07:49:09,652] Trial 33 finished with value: 0.6082471811116291 and parameters: {'model_name': 'GAIN', 'batch_size': 557, 'hint_rate': 0.038229743124121474, 'alpha': 49, 'iterations': 6961, 'learning_rate': 0.00012166908298520004, 'p_miss': 0.016086574078598453}. Best is trial 73 with value: 0.30271037755929664.
[I 2024-11-13 07:53:45,020] Trial 45 finished with value: 0.6150238698962668 and parameters: {'model_name': 'GAIN', 'batch_size': 654, 'hint_rate': 0.1742063308225958, 'alpha': 85, 'iterations': 5357, 'learning_rate': 0.07249527978451369, 'p_miss': 0.28946926925762406}. Best is trial 73 with value: 0.30271037755929664.
[I 2024-11-13 07:54:10,269] Trial 39 finished with value: 0.6059485681818881 and parameters: {'model_name': 'GAIN', 'batch_size': 607, 'hint_rate': 0.7213642808664282, 'alpha': 50, 'iterations': 7184, 'learning_rate': 0.00010581496421787669, 'p_miss': 0.1448098857080736}. Best is trial 73 with value: 0.30271037755929664.
[I 2024-11-13 07:57:08,651] Trial 10 finished with value: 0.6230374972233907 and parameters: {'model_name': 'GAIN', 'batch_size': 54, 'hint_rate': 0.8138789299850016, 'alpha': 16, 'iterations': 8893, 'learning_rate': 0.0022099299653919762, 'p_miss': 0.13689306137275253}. Best is trial 73 with value: 0.30271037755929664.
[I 2024-11-13 08:05:58,006] Trial 34 finished with value: 0.6059656062132017 and parameters: {'model_name': 'GAIN', 'batch_size': 760, 'hint_rate': 0.8236944705312574, 'alpha': 41, 'iterations': 8445, 'learning_rate': 0.0002137638355305395, 'p_miss': 0.027661504808846715}. Best is trial 73 with value: 0.30271037755929664.
[I 2024-11-13 08:06:32,721] Trial 38 finished with value: 0.6159870561123232 and parameters: {'model_name': 'GAIN', 'batch_size': 803, 'hint_rate': 0.9660155329933187, 'alpha': 40, 'iterations': 8407, 'learning_rate': 0.00011647182376822943, 'p_miss': 0.15126742591747885}. Best is trial 73 with value: 0.30271037755929664.
[I 2024-11-13 08:06:53,000] Trial 41 finished with value: 0.6072874838331754 and parameters: {'model_name': 'GAIN', 'batch_size': 501, 'hint_rate': 0.9714271347639148, 'alpha': 37, 'iterations': 8407, 'learning_rate': 0.00015460554093153358, 'p_miss': 0.20108416615245767}. Best is trial 73 with value: 0.30271037755929664.
[I 2024-11-13 08:08:15,273] Trial 36 finished with value: 0.6136840816545559 and parameters: {'model_name': 'GAIN', 'batch_size': 879, 'hint_rate': 0.8707318466617795, 'alpha': 64, 'iterations': 8905, 'learning_rate': 0.00011313233249746161, 'p_miss': 0.13131351037905115}. Best is trial 73 with value: 0.30271037755929664.
[I 2024-11-13 08:08:35,244] Trial 37 finished with value: 0.611079571342386 and parameters: {'model_name': 'GAIN', 'batch_size': 947, 'hint_rate': 0.6663236439128875, 'alpha': 2, 'iterations': 9179, 'learning_rate': 0.0001245087535144229, 'p_miss': 0.12451746397837257}. Best is trial 73 with value: 0.30271037755929664.
[I 2024-11-13 08:08:42,321] Trial 46 finished with value: 0.60010843350229 and parameters: {'model_name': 'GAIN', 'batch_size': 8, 'hint_rate': 0.6611758056386962, 'alpha': 98, 'iterations': 8876, 'learning_rate': 0.00013717429716940166, 'p_miss': 0.2951427897516936}. Best is trial 73 with value: 0.30271037755929664.
[I 2024-11-13 08:08:43,981] Trial 35 finished with value: 0.6074308133677806 and parameters: {'model_name': 'GAIN', 'batch_size': 348, 'hint_rate': 0.09463827672997788, 'alpha': 39, 'iterations': 9988, 'learning_rate': 0.00014489417292464773, 'p_miss': 0.02089217740584981}. Best is trial 73 with value: 0.30271037755929664.
