[I 2024-10-24 14:35:26,597] Trial 198 finished with value: 0.2998466920089524 and parameters: {'model_name': 'SimpleImputer', 'strategy': 'mean'}. Best is trial 3 with value: 0.2998466920089524.
fit
simple fit
simple transform
0    0
1    0
2    0
3    0
4    0
5    0
6    0
dtype: int64
0    0
1    0
2    0
3    0
4    0
5    0
6    0
dtype: int64
0.2998466920089524
{'model_name': 'SimpleImputer', 'strategy': 'mean'}
running experiment 2/3 - Does reconstruction give good automl predictions
Start est fit
Version 0.1.7a0 of tpot2 is outdated. Version 0.1.8a0 was released Tuesday September 17, 2024.
Version 0.1.7a0 of tpot2 is outdated. Version 0.1.8a0 was released Tuesday September 17, 2024.
Version 0.1.7a0 of tpot2 is outdated. Version 0.1.8a0 was released Tuesday September 17, 2024.
Version 0.1.7a0 of tpot2 is outdated. Version 0.1.8a0 was released Tuesday September 17, 2024.
Version 0.1.7a0 of tpot2 is outdated. Version 0.1.8a0 was released Tuesday September 17, 2024.
Version 0.1.7a0 of tpot2 is outdated. Version 0.1.8a0 was released Tuesday September 17, 2024.
Version 0.1.7a0 of tpot2 is outdated. Version 0.1.8a0 was released Tuesday September 17, 2024.
Version 0.1.7a0 of tpot2 is outdated. Version 0.1.8a0 was released Tuesday September 17, 2024.
Version 0.1.7a0 of tpot2 is outdated. Version 0.1.8a0 was released Tuesday September 17, 2024.
Version 0.1.7a0 of tpot2 is outdated. Version 0.1.8a0 was released Tuesday September 17, 2024.
Version 0.1.7a0 of tpot2 is outdated. Version 0.1.8a0 was released Tuesday September 17, 2024.
Version 0.1.7a0 of tpot2 is outdated. Version 0.1.8a0 was released Tuesday September 17, 2024.
Version 0.1.7a0 of tpot2 is outdated. Version 0.1.8a0 was released Tuesday September 17, 2024.
Version 0.1.7a0 of tpot2 is outdated. Version 0.1.8a0 was released Tuesday September 17, 2024.
Version 0.1.7a0 of tpot2 is outdated. Version 0.1.8a0 was released Tuesday September 17, 2024.
Version 0.1.7a0 of tpot2 is outdated. Version 0.1.8a0 was released Tuesday September 17, 2024.
  0%|          | 0/25 [00:00<?, ?it/s]Generation:   0%|          | 0/25 [00:00<?, ?it/s]Generation:  1
Best f1_score score: 0.8849715773731349
Generation:   4%|▍         | 1/25 [00:06<02:28,  6.17s/it]Generation:  2
Best f1_score score: 0.8849715773731349
Generation:   8%|▊         | 2/25 [00:13<02:43,  7.09s/it]Generation:  3
Best f1_score score: 0.8849715773731349
Generation:  12%|█▏        | 3/25 [00:24<03:08,  8.58s/it]Generation:  4
Best f1_score score: 0.8849715773731349
Generation:  16%|█▌        | 4/25 [00:33<03:07,  8.92s/it]Generation:  5
Best f1_score score: 0.8849715773731349
Generation:  20%|██        | 5/25 [01:09<06:15, 18.78s/it]Generation:  6
Best f1_score score: 0.8849715773731349
Generation:  24%|██▍       | 6/25 [01:20<05:04, 16.01s/it]Generation:  7
Best f1_score score: 0.885186813509055
Generation:  28%|██▊       | 7/25 [01:32<04:25, 14.76s/it]Generation:  8
Best f1_score score: 0.885186813509055
Generation:  32%|███▏      | 8/25 [04:24<18:18, 64.59s/it]Generation:  9
Best f1_score score: 0.885186813509055
Generation:  36%|███▌      | 9/25 [04:35<12:47, 47.97s/it]Generation:  10
Best f1_score score: 0.885186813509055
Generation:  40%|████      | 10/25 [04:47<09:13, 36.89s/it]Generation:  11
Best f1_score score: 0.885186813509055
Generation:  44%|████▍     | 11/25 [04:59<06:49, 29.22s/it]Generation:  12
Best f1_score score: 0.885186813509055
Generation:  48%|████▊     | 12/25 [05:11<05:14, 24.16s/it]Generation:  13
Best f1_score score: 0.8854214380092479
Generation:  52%|█████▏    | 13/25 [05:23<04:05, 20.47s/it]Generation:  14
Best f1_score score: 0.8854214380092479
Generation:  56%|█████▌    | 14/25 [05:48<03:57, 21.57s/it]Generation:  15
Best f1_score score: 0.8854214380092479
Generation:  60%|██████    | 15/25 [06:02<03:14, 19.40s/it]Generation:  16
Best f1_score score: 0.8854214380092479
Generation:  64%|██████▍   | 16/25 [06:17<02:43, 18.15s/it]Generation:  17
Best f1_score score: 0.8854214380092479
Generation:  68%|██████▊   | 17/25 [06:33<02:20, 17.54s/it]Generation:  18
Best f1_score score: 0.8854214380092479
Generation:  72%|███████▏  | 18/25 [06:48<01:56, 16.70s/it]Generation:  19
Best f1_score score: 0.8854214380092479
Generation:  76%|███████▌  | 19/25 [07:05<01:39, 16.64s/it]Generation:  20
Best f1_score score: 0.8854214380092479
Generation:  80%|████████  | 20/25 [07:41<01:52, 22.56s/it]Generation:  21
Best f1_score score: 0.8854214380092479
Generation:  84%|████████▍ | 21/25 [07:56<01:21, 20.45s/it]Generation:  22
Best f1_score score: 0.8854214380092479
Generation:  88%|████████▊ | 22/25 [11:07<03:34, 71.38s/it]Generation:  23
Best f1_score score: 0.8854214380092479
Generation:  92%|█████████▏| 23/25 [11:23<01:50, 55.03s/it]Generation:  24
Best f1_score score: 0.8854214380092479
Generation:  96%|█████████▌| 24/25 [11:41<00:43, 43.90s/it]Generation:  25
Best f1_score score: 0.8854214380092479
Generation: 100%|██████████| 25/25 [11:59<00:00, 35.89s/it]Generation: 100%|██████████| 25/25 [12:02<00:00, 28.91s/it]
2024-10-24 14:47:35,461 - distributed.scheduler - ERROR - Removing worker 'tcp://127.0.0.1:38091' caused the cluster to lose scattered data, which can't be recovered: {'ndarray-98384d096df9b91ea418777d7047bef4', 'ndarray-dcbf3d9d9ba02101791d1e1d11a11239'} (stimulus_id='handle-worker-cleanup-1729806455.4616737')
Fitted
Pipeline(steps=[('adaboostclassifier',
                 AdaBoostClassifier(algorithm='SAMME',
                                    learning_rate=0.5601837625757,
                                    n_estimators=175))])
score start
train score: {'auroc': 0.9562043490614919, 'accuracy': 0.9250231410058624, 'balanced_accuracy': 0.8467133935883936, 'logloss': 0.42540040160626086, 'f1': 0.8847416773683691}
original test score: {'auroc': 0.9991436782569466, 'accuracy': 0.9950678175092479, 'balanced_accuracy': 0.9896907216494846, 'logloss': 0.33558176445294974, 'f1': 0.9931761577813678}
imputed test score: {'auroc': 0.9497318250931511, 'accuracy': 0.9235511713933415, 'balanced_accuracy': 0.8419731323831643, 'logloss': 0.42654888464785906, 'f1': 0.8815310815395635}
score end
check intended
EXP2 Finished
running experiment 3/3 - What is the best automl settings?
<tpot2.search_spaces.pipelines.sequential.SequentialPipeline object at 0x15543504f9d0>
Start tpot fit
Version 0.1.7a0 of tpot2 is outdated. Version 0.1.8a0 was released Tuesday September 17, 2024.
Version 0.1.7a0 of tpot2 is outdated. Version 0.1.8a0 was released Tuesday September 17, 2024.
Version 0.1.7a0 of tpot2 is outdated. Version 0.1.8a0 was released Tuesday September 17, 2024.
Version 0.1.7a0 of tpot2 is outdated. Version 0.1.8a0 was released Tuesday September 17, 2024.
Version 0.1.7a0 of tpot2 is outdated. Version 0.1.8a0 was released Tuesday September 17, 2024.
Version 0.1.7a0 of tpot2 is outdated. Version 0.1.8a0 was released Tuesday September 17, 2024.
Version 0.1.7a0 of tpot2 is outdated. Version 0.1.8a0 was released Tuesday September 17, 2024.
Version 0.1.7a0 of tpot2 is outdated. Version 0.1.8a0 was released Tuesday September 17, 2024.
Version 0.1.7a0 of tpot2 is outdated. Version 0.1.8a0 was released Tuesday September 17, 2024.
Version 0.1.7a0 of tpot2 is outdated. Version 0.1.8a0 was released Tuesday September 17, 2024.
Version 0.1.7a0 of tpot2 is outdated. Version 0.1.8a0 was released Tuesday September 17, 2024.
Version 0.1.7a0 of tpot2 is outdated. Version 0.1.8a0 was released Tuesday September 17, 2024.
Version 0.1.7a0 of tpot2 is outdated. Version 0.1.8a0 was released Tuesday September 17, 2024.
Version 0.1.7a0 of tpot2 is outdated. Version 0.1.8a0 was released Tuesday September 17, 2024.
Version 0.1.7a0 of tpot2 is outdated. Version 0.1.8a0 was released Tuesday September 17, 2024.
Version 0.1.7a0 of tpot2 is outdated. Version 0.1.8a0 was released Tuesday September 17, 2024.
  0%|          | 0/25 [00:00<?, ?it/s]Generation:   0%|          | 0/25 [00:00<?, ?it/s]Generation:  1
Best f1_score score: 0.8825062108890516
Generation:   4%|▍         | 1/25 [00:51<20:32, 51.36s/it]Generation:  2
Best f1_score score: 0.8825062108890516
Generation:   8%|▊         | 2/25 [01:49<21:15, 55.46s/it]Generation:  3
Best f1_score score: 0.8825062108890516
Generation:  12%|█▏        | 3/25 [04:02<33:19, 90.90s/it]Generation:  4
Best f1_score score: 0.8825062108890516
Generation:  16%|█▌        | 4/25 [05:40<32:42, 93.47s/it]Generation:  5
Best f1_score score: 0.8825062108890516
Generation:  20%|██        | 5/25 [06:53<28:45, 86.29s/it]Generation:  6
Best f1_score score: 0.8828974807218561
Generation:  24%|██▍       | 6/25 [08:59<31:31, 99.54s/it]Generation:  7
Best f1_score score: 0.8834106116646245
Generation:  28%|██▊       | 7/25 [09:07<20:56, 69.80s/it]Generation:  8
Best f1_score score: 0.8834106116646245
Generation:  32%|███▏      | 8/25 [09:14<14:07, 49.83s/it]Generation:  9
Best f1_score score: 0.8834106116646245
Generation:  36%|███▌      | 9/25 [09:42<11:25, 42.84s/it]Generation:  10
Best f1_score score: 0.8838123432484746
Generation:  40%|████      | 10/25 [09:51<08:05, 32.39s/it]Generation:  11
Best f1_score score: 0.8838123432484746
Generation:  44%|████▍     | 11/25 [10:00<05:56, 25.46s/it]Generation:  12
Best f1_score score: 0.8842289388943054
Generation:  48%|████▊     | 12/25 [10:15<04:48, 22.20s/it]Generation:  13
Best f1_score score: 0.8847771456036252
Generation:  52%|█████▏    | 13/25 [10:25<03:43, 18.62s/it]Generation:  14
Best f1_score score: 0.885186813509055
Generation:  56%|█████▌    | 14/25 [10:35<02:55, 15.93s/it]Generation:  15
Best f1_score score: 0.885186813509055
Generation:  60%|██████    | 15/25 [10:46<02:24, 14.44s/it]Generation:  16
Best f1_score score: 0.885186813509055
Generation:  64%|██████▍   | 16/25 [10:58<02:01, 13.53s/it]Generation:  17
Best f1_score score: 0.885186813509055
Generation:  68%|██████▊   | 17/25 [11:09<01:43, 12.97s/it]Generation:  18
Best f1_score score: 0.885186813509055
Generation:  72%|███████▏  | 18/25 [11:21<01:27, 12.55s/it]Generation:  19
Best f1_score score: 0.885186813509055
Generation:  76%|███████▌  | 19/25 [11:30<01:09, 11.55s/it]Generation:  20
Best f1_score score: 0.885186813509055
Generation:  80%|████████  | 20/25 [11:58<01:22, 16.49s/it]Generation:  21
Best f1_score score: 0.885186813509055
Generation:  84%|████████▍ | 21/25 [12:09<00:58, 14.70s/it]Generation:  22
Best f1_score score: 0.885186813509055
Generation:  88%|████████▊ | 22/25 [12:20<00:41, 13.83s/it]Generation:  23
Best f1_score score: 0.885186813509055
Generation:  92%|█████████▏| 23/25 [12:36<00:28, 14.28s/it]Generation:  24
Best f1_score score: 0.885186813509055
Generation:  96%|█████████▌| 24/25 [12:46<00:13, 13.16s/it]Generation:  25
Best f1_score score: 0.885186813509055
Generation: 100%|██████████| 25/25 [13:33<00:00, 23.20s/it]Generation: 100%|██████████| 25/25 [13:33<00:00, 32.54s/it]
2024-10-24 15:01:17,372 - distributed.scheduler - ERROR - Removing worker 'tcp://127.0.0.1:40217' caused the cluster to lose scattered data, which can't be recovered: {'ndarray-98384d096df9b91ea418777d7047bef4', 'DataFrame-c076c208c88e08596903c93aa2f6398a'} (stimulus_id='handle-worker-cleanup-1729807277.372627')
Fitted
Pipeline(steps=[('simpleimputer', SimpleImputer(strategy='constant')),
                ('adaboostclassifier',
                 AdaBoostClassifier(algorithm='SAMME',
                                    learning_rate=0.4185149135659,
                                    n_estimators=475))])
transform worked
try transform
transform worked
score start
train score: {'auroc': 0.9542354564675992, 'accuracy': 0.9250231410058624, 'balanced_accuracy': 0.8467133935883936, 'logloss': 0.46077546754340093, 'f1': 0.8847416773683691}
test score: {'auroc': 0.9492556266604286, 'accuracy': 0.9235511713933415, 'balanced_accuracy': 0.8419731323831643, 'logloss': 0.4616783168228808, 'f1': 0.8815310815395635}
original test score: {'auroc': 0.99852127855102, 'accuracy': 0.9950678175092479, 'balanced_accuracy': 0.9896907216494846, 'logloss': 0.38112268757860834, 'f1': 0.9931761577813678}
score end
728
lvl
0.3
type
MCAR
num_run
1
class_simple
finished
all finished
full run takes
0.4397147644228405
hours
DONE
