Run: 54
/cm/local/apps/slurm/var/spool/job1044377/slurm_script: line 27: 
pip install -e tpot2
pip install -r tpot2/ImputerExperiments/requirements_.txt
: No such file or directory
RunStart
Version 0.1.7a0 of tpot2 is outdated. Version 0.1.8a0 was released Tuesday September 17, 2024.
starting loops
../data/c/1507/1507.pkl
working on 
../data/c/1507/class_full_MAR_0.1_3
1.8343946933746338
running experiment 1/3 - Does large hyperparameter space improve reconstruction accuracy over simple
[I 2024-11-08 23:17:34,607] A new study created in memory with name: no-name-c2eec94d-96df-49ea-89f3-31e3009fcb15
running
running
running
running
running
running
running
running
running
running
running
running
running
running
running
running
[I 2024-11-08 23:17:34,928] Trial 6 finished with value: 0.13591000782520454 and parameters: {'model_name': 'SimpleImputer', 'strategy': 'median'}. Best is trial 6 with value: 0.13591000782520454.
running
[I 2024-11-08 23:17:35,321] Trial 15 finished with value: 0.3963912713165058 and parameters: {'model_name': 'SimpleImputer', 'strategy': 'most_frequent'}. Best is trial 6 with value: 0.13591000782520454.
running
[I 2024-11-08 23:17:35,494] Trial 9 finished with value: 0.3963912713165058 and parameters: {'model_name': 'SimpleImputer', 'strategy': 'most_frequent'}. Best is trial 6 with value: 0.13591000782520454.
running
[I 2024-11-08 23:17:37,311] Trial 14 finished with value: 0.14013628280359733 and parameters: {'model_name': 'KNNImputer', 'n_neighbors': 5491, 'weights': 'uniform'}. Best is trial 6 with value: 0.13591000782520454.
running
[I 2024-11-08 23:17:37,826] Trial 4 finished with value: 0.13588387462451454 and parameters: {'model_name': 'KNNImputer', 'n_neighbors': 2362, 'weights': 'uniform'}. Best is trial 4 with value: 0.13588387462451454.
running
[I 2024-11-08 23:17:40,502] Trial 7 finished with value: 0.14901365730974578 and parameters: {'model_name': 'VAE', 'batch_size': 3, 'iterations': 1, 'learning_rate': 0.005569132298761733, 'p_miss': 0.1566712428785455}. Best is trial 4 with value: 0.13588387462451454.
running
[I 2024-11-08 23:17:41,055] Trial 10 finished with value: 0.3806505012839261 and parameters: {'model_name': 'GAIN', 'batch_size': 2, 'hint_rate': 0.5573250910250112, 'alpha': 81, 'iterations': 1, 'learning_rate': 0.0023675894681640256, 'p_miss': 0.21513213379133111}. Best is trial 4 with value: 0.13588387462451454.
running
[I 2024-11-08 23:17:41,299] Trial 13 finished with value: 0.13844277668577082 and parameters: {'model_name': 'IterativeImputer', 'estimator': 'Ridge', 'initial_strategy': 'median', 'n_nearest_features': 1, 'imputation_order': 'roman'}. Best is trial 4 with value: 0.13588387462451454.
running
[I 2024-11-08 23:17:41,732] Trial 22 finished with value: 0.501427618454369 and parameters: {'model_name': 'SimpleImputer', 'strategy': 'constant'}. Best is trial 4 with value: 0.13588387462451454.
running
[I 2024-11-08 23:17:44,643] Trial 11 finished with value: 0.14286469650862657 and parameters: {'model_name': 'VAE', 'batch_size': 173, 'iterations': 3, 'learning_rate': 0.003198850975633538, 'p_miss': 0.0450454578313792}. Best is trial 4 with value: 0.13588387462451454.
running
[I 2024-11-08 23:17:45,525] Trial 20 finished with value: 0.15216054403210422 and parameters: {'model_name': 'VAE', 'batch_size': 1, 'iterations': 7, 'learning_rate': 0.0010518617488535357, 'p_miss': 0.16523273074507677}. Best is trial 4 with value: 0.13588387462451454.
running
[I 2024-11-08 23:17:48,254] Trial 8 finished with value: 0.394725052419162 and parameters: {'model_name': 'GAIN', 'batch_size': 12, 'hint_rate': 0.5488821265831729, 'alpha': 7, 'iterations': 17, 'learning_rate': 0.00035383689541526733, 'p_miss': 0.13942514526503433}. Best is trial 4 with value: 0.13588387462451454.
running
[I 2024-11-08 23:17:48,779] Trial 25 finished with value: 0.13363050890199063 and parameters: {'model_name': 'KNNImputer', 'n_neighbors': 1240, 'weights': 'uniform'}. Best is trial 25 with value: 0.13363050890199063.
running
[I 2024-11-08 23:17:49,657] Trial 26 finished with value: 0.1324918817368092 and parameters: {'model_name': 'KNNImputer', 'n_neighbors': 791, 'weights': 'uniform'}. Best is trial 26 with value: 0.1324918817368092.
running
[I 2024-11-08 23:17:51,723] Trial 1 finished with value: 0.15779251725597015 and parameters: {'model_name': 'VAE', 'batch_size': 3, 'iterations': 23, 'learning_rate': 0.00010281975049270897, 'p_miss': 0.10063453373494238}. Best is trial 26 with value: 0.1324918817368092.
running
[I 2024-11-08 23:17:53,278] Trial 24 finished with value: 0.4034007998767847 and parameters: {'model_name': 'GAIN', 'batch_size': 327, 'hint_rate': 0.5112040491388186, 'alpha': 35, 'iterations': 11, 'learning_rate': 0.00017614010355697962, 'p_miss': 0.04279577524387224}. Best is trial 26 with value: 0.1324918817368092.
running
[I 2024-11-08 23:17:53,520] Trial 27 finished with value: 0.13225856684058418 and parameters: {'model_name': 'KNNImputer', 'n_neighbors': 780, 'weights': 'distance'}. Best is trial 27 with value: 0.13225856684058418.
running
[I 2024-11-08 23:17:53,722] Trial 28 finished with value: 0.13345085206800542 and parameters: {'model_name': 'KNNImputer', 'n_neighbors': 1171, 'weights': 'uniform'}. Best is trial 27 with value: 0.13225856684058418.
running
[I 2024-11-08 23:17:54,294] Trial 29 finished with value: 0.13530884548143285 and parameters: {'model_name': 'KNNImputer', 'n_neighbors': 11, 'weights': 'uniform'}. Best is trial 27 with value: 0.13225856684058418.
running
[I 2024-11-08 23:17:56,286] Trial 30 finished with value: 0.13348092949235674 and parameters: {'model_name': 'KNNImputer', 'n_neighbors': 15, 'weights': 'uniform'}. Best is trial 27 with value: 0.13225856684058418.
running
