Run: 26
/cm/local/apps/slurm/var/spool/job921883/slurm_script: line 26: 
pip install -e tpot2
pip install -r tpot2/ImputerExperiments/requirements_.txt
: No such file or directory
RunStart
starting loops
../data/c/30/30.pkl
working on 
../data/c/30/class_full_MCAR_0.1_2
4.26118540763855
running experiment 1/3 - Does large hyperparameter space improve reconstruction accuracy over simple
[I 2024-08-13 14:10:00,758] A new study created in memory with name: no-name-90522a1e-c287-4900-84ac-b462705575a8
running
running
running
running
running
running
running
running
running
running
running
running
running
running
running
running
[I 2024-08-13 14:10:01,155] Trial 11 finished with value: 0.30343860856473126 and parameters: {'model_name': 'SimpleImputer', 'strategy': 'constant'}. Best is trial 11 with value: 0.30343860856473126.
running
[I 2024-08-13 14:10:01,344] Trial 14 finished with value: 0.30343860856473126 and parameters: {'model_name': 'SimpleImputer', 'strategy': 'constant'}. Best is trial 11 with value: 0.30343860856473126.
running
[I 2024-08-13 14:10:01,882] Trial 10 finished with value: 0.30343860856473126 and parameters: {'model_name': 'SimpleImputer', 'strategy': 'most_frequent'}. Best is trial 11 with value: 0.30343860856473126.
running
[I 2024-08-13 14:10:02,130] Trial 0 finished with value: 0.30343860856473126 and parameters: {'model_name': 'SimpleImputer', 'strategy': 'most_frequent'}. Best is trial 11 with value: 0.30343860856473126.
running
[I 2024-08-13 14:10:02,404] Trial 7 finished with value: 0.30343860856473126 and parameters: {'model_name': 'SimpleImputer', 'strategy': 'most_frequent'}. Best is trial 11 with value: 0.30343860856473126.
running
[I 2024-08-13 14:10:02,831] Trial 20 finished with value: 0.07618823314153232 and parameters: {'model_name': 'SimpleImputer', 'strategy': 'mean'}. Best is trial 20 with value: 0.07618823314153232.
running
[I 2024-08-13 14:10:03,630] Trial 19 finished with value: 0.30343860856473126 and parameters: {'model_name': 'SimpleImputer', 'strategy': 'most_frequent'}. Best is trial 20 with value: 0.07618823314153232.
running
[I 2024-08-13 14:10:05,655] Trial 17 finished with value: 0.07618823314153232 and parameters: {'model_name': 'KNNImputer', 'n_neighbors': 4603, 'weights': 'uniform'}. Best is trial 20 with value: 0.07618823314153232.
running
[I 2024-08-13 14:10:06,196] Trial 2 finished with value: 0.06892033195141761 and parameters: {'model_name': 'KNNImputer', 'n_neighbors': 2055, 'weights': 'uniform'}. Best is trial 2 with value: 0.06892033195141761.
running
[I 2024-08-13 14:10:06,560] Trial 9 finished with value: 0.06505789216682667 and parameters: {'model_name': 'KNNImputer', 'n_neighbors': 1099, 'weights': 'uniform'}. Best is trial 9 with value: 0.06505789216682667.
[I 2024-08-13 14:10:06,663] Trial 12 finished with value: 0.06385468357229684 and parameters: {'model_name': 'KNNImputer', 'n_neighbors': 913, 'weights': 'uniform'}. Best is trial 12 with value: 0.06385468357229684.
running
running
[I 2024-08-13 14:10:06,850] Trial 16 finished with value: 0.06675420546186676 and parameters: {'model_name': 'KNNImputer', 'n_neighbors': 1427, 'weights': 'uniform'}. Best is trial 12 with value: 0.06385468357229684.
running
[I 2024-08-13 14:10:07,177] Trial 5 finished with value: 0.06303143968723837 and parameters: {'model_name': 'KNNImputer', 'n_neighbors': 1996, 'weights': 'distance'}. Best is trial 5 with value: 0.06303143968723837.
running
[I 2024-08-13 14:10:07,409] Trial 23 finished with value: 0.30343860856473126 and parameters: {'model_name': 'SimpleImputer', 'strategy': 'most_frequent'}. Best is trial 5 with value: 0.06303143968723837.
running
[I 2024-08-13 14:10:07,711] Trial 4 finished with value: 0.06110575019796323 and parameters: {'model_name': 'KNNImputer', 'n_neighbors': 1543, 'weights': 'distance'}. Best is trial 4 with value: 0.06110575019796323.
running
[I 2024-08-13 14:10:08,773] Trial 18 finished with value: 0.06139105171532241 and parameters: {'model_name': 'KNNImputer', 'n_neighbors': 1601, 'weights': 'distance'}. Best is trial 4 with value: 0.06110575019796323.
running
[I 2024-08-13 14:10:09,287] Trial 21 finished with value: 0.06466266888463094 and parameters: {'model_name': 'KNNImputer', 'n_neighbors': 2491, 'weights': 'distance'}. Best is trial 4 with value: 0.06110575019796323.
running
[I 2024-08-13 14:10:10,834] Trial 26 finished with value: 0.0472078965359982 and parameters: {'model_name': 'KNNImputer', 'n_neighbors': 58, 'weights': 'uniform'}. Best is trial 26 with value: 0.0472078965359982.
running
[I 2024-08-13 14:10:11,042] Trial 25 finished with value: 0.052051840156370335 and parameters: {'model_name': 'KNNImputer', 'n_neighbors': 193, 'weights': 'uniform'}. Best is trial 26 with value: 0.0472078965359982.
running
[I 2024-08-13 14:10:17,527] Trial 34 finished with value: inf and parameters: {'model_name': 'GAIN', 'batch_size': 2, 'hint_rate': 0.8266664246174856, 'alpha': 95, 'iterations': 26, 'learning_rate': 0.0005991767154194512, 'p_miss': 0.1457366181522878}. Best is trial 26 with value: 0.0472078965359982.
running
[I 2024-08-13 14:10:18,366] Trial 6 finished with value: 0.3062205497385273 and parameters: {'model_name': 'GAIN', 'batch_size': 24, 'hint_rate': 0.35376063695083015, 'alpha': 42, 'iterations': 1, 'learning_rate': 0.005248386959522928, 'p_miss': 0.04913884242921199}. Best is trial 26 with value: 0.0472078965359982.
running
[I 2024-08-13 14:10:19,091] Trial 13 finished with value: 0.3027102746670364 and parameters: {'model_name': 'GAIN', 'batch_size': 7, 'hint_rate': 0.9674459616363768, 'alpha': 13, 'iterations': 1, 'learning_rate': 0.020824391982031575, 'p_miss': 0.2818676275860376}. Best is trial 26 with value: 0.0472078965359982.
running
[I 2024-08-13 14:10:22,227] Trial 24 finished with value: 0.07059117380233428 and parameters: {'model_name': 'IterativeImputer', 'estimator': 'Ridge', 'initial_strategy': 'mean', 'n_nearest_features': 1, 'imputation_order': 'descending'}. Best is trial 26 with value: 0.0472078965359982.
running
[I 2024-08-13 14:10:36,649] Trial 15 finished with value: 0.06277409512618486 and parameters: {'model_name': 'IterativeImputer', 'estimator': 'Ridge', 'initial_strategy': 'median', 'n_nearest_features': 3, 'imputation_order': 'arabic'}. Best is trial 26 with value: 0.0472078965359982.
running
[I 2024-08-13 14:10:41,336] Trial 39 finished with value: 0.048208758968252066 and parameters: {'model_name': 'KNNImputer', 'n_neighbors': 217, 'weights': 'distance'}. Best is trial 26 with value: 0.0472078965359982.
running
[I 2024-08-13 14:10:44,419] Trial 35 finished with value: 0.06699464281217922 and parameters: {'model_name': 'IterativeImputer', 'estimator': 'Ridge', 'initial_strategy': 'most_frequent', 'n_nearest_features': 2, 'imputation_order': 'ascending'}. Best is trial 26 with value: 0.0472078965359982.
running
[I 2024-08-13 14:10:45,504] Trial 28 finished with value: 0.06874448131547918 and parameters: {'model_name': 'IterativeImputer', 'estimator': 'KNN', 'initial_strategy': 'constant', 'n_nearest_features': 2, 'imputation_order': 'roman'}. Best is trial 26 with value: 0.0472078965359982.
running
[I 2024-08-13 14:10:45,754] Trial 33 finished with value: 0.07743508751753389 and parameters: {'model_name': 'IterativeImputer', 'estimator': 'KNN', 'initial_strategy': 'mean', 'n_nearest_features': 1, 'imputation_order': 'descending'}. Best is trial 26 with value: 0.0472078965359982.
running
[I 2024-08-13 14:10:46,068] Trial 8 finished with value: 0.2966271016389429 and parameters: {'model_name': 'GAIN', 'batch_size': 45, 'hint_rate': 0.05287112313004713, 'alpha': 54, 'iterations': 24, 'learning_rate': 0.0008394484340824049, 'p_miss': 0.2853907768802854}. Best is trial 26 with value: 0.0472078965359982.
running
[I 2024-08-13 14:10:46,818] Trial 40 finished with value: 0.04918838607721246 and parameters: {'model_name': 'KNNImputer', 'n_neighbors': 120, 'weights': 'uniform'}. Best is trial 26 with value: 0.0472078965359982.
running
[I 2024-08-13 14:10:47,485] Trial 31 finished with value: 0.06110594994670193 and parameters: {'model_name': 'IterativeImputer', 'estimator': 'Ridge', 'initial_strategy': 'mean', 'n_nearest_features': 4, 'imputation_order': 'descending'}. Best is trial 26 with value: 0.0472078965359982.
running
[I 2024-08-13 14:10:50,033] Trial 41 finished with value: 0.05730025336438658 and parameters: {'model_name': 'KNNImputer', 'n_neighbors': 6, 'weights': 'uniform'}. Best is trial 26 with value: 0.0472078965359982.
running
[I 2024-08-13 14:10:50,826] Trial 43 finished with value: 0.04855127708553237 and parameters: {'model_name': 'KNNImputer', 'n_neighbors': 20, 'weights': 'uniform'}. Best is trial 26 with value: 0.0472078965359982.
running
[I 2024-08-13 14:10:50,993] Trial 42 finished with value: 0.06599578257896509 and parameters: {'model_name': 'KNNImputer', 'n_neighbors': 3, 'weights': 'uniform'}. Best is trial 26 with value: 0.0472078965359982.
running
[I 2024-08-13 14:10:52,337] Trial 44 finished with value: 0.05465660080664979 and parameters: {'model_name': 'KNNImputer', 'n_neighbors': 278, 'weights': 'uniform'}. Best is trial 26 with value: 0.0472078965359982.
running
[I 2024-08-13 14:10:52,700] Trial 45 finished with value: 0.047173969941681895 and parameters: {'model_name': 'KNNImputer', 'n_neighbors': 65, 'weights': 'uniform'}. Best is trial 45 with value: 0.047173969941681895.
running
[I 2024-08-13 14:10:53,383] Trial 46 finished with value: 0.054781343567472676 and parameters: {'model_name': 'KNNImputer', 'n_neighbors': 284, 'weights': 'uniform'}. Best is trial 45 with value: 0.047173969941681895.
running
[I 2024-08-13 14:10:55,500] Trial 47 finished with value: 0.0498648089766065 and parameters: {'model_name': 'KNNImputer', 'n_neighbors': 13, 'weights': 'uniform'}. Best is trial 45 with value: 0.047173969941681895.
running
[I 2024-08-13 14:10:56,379] Trial 49 finished with value: 0.06102317865158793 and parameters: {'model_name': 'KNNImputer', 'n_neighbors': 615, 'weights': 'uniform'}. Best is trial 45 with value: 0.047173969941681895.
running
[I 2024-08-13 14:10:56,734] Trial 48 finished with value: 0.05793599958872482 and parameters: {'model_name': 'KNNImputer', 'n_neighbors': 429, 'weights': 'uniform'}. Best is trial 45 with value: 0.047173969941681895.
running
[I 2024-08-13 14:10:59,021] Trial 50 finished with value: 0.0544633495709113 and parameters: {'model_name': 'KNNImputer', 'n_neighbors': 635, 'weights': 'distance'}. Best is trial 45 with value: 0.047173969941681895.
running
[I 2024-08-13 14:10:59,668] Trial 51 finished with value: 0.05540906544086085 and parameters: {'model_name': 'KNNImputer', 'n_neighbors': 734, 'weights': 'distance'}. Best is trial 45 with value: 0.047173969941681895.
running
[I 2024-08-13 14:11:00,098] Trial 52 finished with value: 0.055737589385856955 and parameters: {'model_name': 'KNNImputer', 'n_neighbors': 769, 'weights': 'distance'}. Best is trial 45 with value: 0.047173969941681895.
running
[I 2024-08-13 14:11:02,675] Trial 53 finished with value: 0.055638448975376655 and parameters: {'model_name': 'KNNImputer', 'n_neighbors': 759, 'weights': 'distance'}. Best is trial 45 with value: 0.047173969941681895.
running
[I 2024-08-13 14:11:03,541] Trial 54 finished with value: 0.05637081023762123 and parameters: {'model_name': 'KNNImputer', 'n_neighbors': 836, 'weights': 'distance'}. Best is trial 45 with value: 0.047173969941681895.
running
[I 2024-08-13 14:11:04,170] Trial 36 finished with value: 0.0562238740353775 and parameters: {'model_name': 'IterativeImputer', 'estimator': 'Ridge', 'initial_strategy': 'median', 'n_nearest_features': 9, 'imputation_order': 'arabic'}. Best is trial 45 with value: 0.047173969941681895.
running
[I 2024-08-13 14:11:04,386] Trial 55 finished with value: 0.06643317574194671 and parameters: {'model_name': 'KNNImputer', 'n_neighbors': 3104, 'weights': 'distance'}. Best is trial 45 with value: 0.047173969941681895.
running
[I 2024-08-13 14:11:06,109] Trial 57 finished with value: 0.07144274166901428 and parameters: {'model_name': 'KNNImputer', 'n_neighbors': 2921, 'weights': 'uniform'}. Best is trial 45 with value: 0.047173969941681895.
running
[I 2024-08-13 14:11:06,322] Trial 56 finished with value: 0.05637081023762123 and parameters: {'model_name': 'KNNImputer', 'n_neighbors': 836, 'weights': 'distance'}. Best is trial 45 with value: 0.047173969941681895.
running
[I 2024-08-13 14:11:07,362] Trial 58 finished with value: 0.0742212762199995 and parameters: {'model_name': 'KNNImputer', 'n_neighbors': 3697, 'weights': 'uniform'}. Best is trial 45 with value: 0.047173969941681895.
running
[I 2024-08-13 14:11:08,876] Trial 59 finished with value: 0.0740806346996665 and parameters: {'model_name': 'KNNImputer', 'n_neighbors': 3657, 'weights': 'uniform'}. Best is trial 45 with value: 0.047173969941681895.
running
[I 2024-08-13 14:11:09,324] Trial 22 finished with value: 0.06152333642494644 and parameters: {'model_name': 'IterativeImputer', 'estimator': 'KNN', 'initial_strategy': 'mean', 'n_nearest_features': 7, 'imputation_order': 'ascending'}. Best is trial 45 with value: 0.047173969941681895.
running
[I 2024-08-13 14:11:23,535] Trial 37 finished with value: 0.058919376219004435 and parameters: {'model_name': 'IterativeImputer', 'estimator': 'KNN', 'initial_strategy': 'median', 'n_nearest_features': 9, 'imputation_order': 'ascending'}. Best is trial 45 with value: 0.047173969941681895.
running
[I 2024-08-13 14:12:15,814] Trial 29 finished with value: 0.11227111731383894 and parameters: {'model_name': 'IterativeImputer', 'estimator': 'Bayesian', 'initial_strategy': 'constant', 'n_nearest_features': 7, 'imputation_order': 'roman', 'sample_posterior': True}. Best is trial 45 with value: 0.047173969941681895.
running
[I 2024-08-13 14:38:51,992] Trial 32 finished with value: 0.3361338077883291 and parameters: {'model_name': 'GAIN', 'batch_size': 5, 'hint_rate': 0.351462792671683, 'alpha': 25, 'iterations': 857, 'learning_rate': 0.0065600581225075, 'p_miss': 0.19646981253859233}. Best is trial 45 with value: 0.047173969941681895.
running
[I 2024-08-13 14:38:55,160] Trial 70 finished with value: 0.04904489554307377 and parameters: {'model_name': 'KNNImputer', 'n_neighbors': 18, 'weights': 'uniform'}. Best is trial 45 with value: 0.047173969941681895.
running
[I 2024-08-13 14:38:58,952] Trial 71 finished with value: 0.052295078104140504 and parameters: {'model_name': 'KNNImputer', 'n_neighbors': 201, 'weights': 'uniform'}. Best is trial 45 with value: 0.047173969941681895.
running
[I 2024-08-13 15:15:33,389] Trial 27 finished with value: 0.3030187061111455 and parameters: {'model_name': 'GAIN', 'batch_size': 279, 'hint_rate': 0.4677673723514363, 'alpha': 44, 'iterations': 1653, 'learning_rate': 0.00026691302542410897, 'p_miss': 0.03993579678243145}. Best is trial 45 with value: 0.047173969941681895.
running
[I 2024-08-13 15:15:37,067] Trial 73 finished with value: 0.058029150985654906 and parameters: {'model_name': 'KNNImputer', 'n_neighbors': 433, 'weights': 'uniform'}. Best is trial 45 with value: 0.047173969941681895.
running
[I 2024-08-13 15:15:40,535] Trial 74 finished with value: 0.05777538394784974 and parameters: {'model_name': 'KNNImputer', 'n_neighbors': 422, 'weights': 'uniform'}. Best is trial 45 with value: 0.047173969941681895.
running
[I 2024-08-13 15:15:41,102] Trial 75 finished with value: 0.07137041862442584 and parameters: {'model_name': 'SimpleImputer', 'strategy': 'median'}. Best is trial 45 with value: 0.047173969941681895.
running
[I 2024-08-13 15:15:44,312] Trial 76 finished with value: 0.04855127708553237 and parameters: {'model_name': 'KNNImputer', 'n_neighbors': 20, 'weights': 'uniform'}. Best is trial 45 with value: 0.047173969941681895.
running
[I 2024-08-13 15:15:47,382] Trial 77 finished with value: 0.04712227312068532 and parameters: {'model_name': 'KNNImputer', 'n_neighbors': 36, 'weights': 'uniform'}. Best is trial 77 with value: 0.04712227312068532.
running
[I 2024-08-13 15:15:51,285] Trial 78 finished with value: 0.05885232259355132 and parameters: {'model_name': 'KNNImputer', 'n_neighbors': 476, 'weights': 'uniform'}. Best is trial 77 with value: 0.04712227312068532.
running
[I 2024-08-13 15:15:54,375] Trial 79 finished with value: 0.049225335849509146 and parameters: {'model_name': 'KNNImputer', 'n_neighbors': 17, 'weights': 'uniform'}. Best is trial 77 with value: 0.04712227312068532.
running
[I 2024-08-13 15:15:58,109] Trial 80 finished with value: 0.05591321750923306 and parameters: {'model_name': 'KNNImputer', 'n_neighbors': 337, 'weights': 'uniform'}. Best is trial 77 with value: 0.04712227312068532.
running
[I 2024-08-13 15:18:47,137] Trial 1 finished with value: 0.048132729552298484 and parameters: {'model_name': 'IterativeImputer', 'estimator': 'RFR', 'initial_strategy': 'mean', 'n_nearest_features': 6, 'imputation_order': 'roman'}. Best is trial 77 with value: 0.04712227312068532.
running
[I 2024-08-13 15:36:57,543] Trial 38 finished with value: 0.04824845796468621 and parameters: {'model_name': 'IterativeImputer', 'estimator': 'RFR', 'initial_strategy': 'median', 'n_nearest_features': 10, 'imputation_order': 'random'}. Best is trial 77 with value: 0.04712227312068532.
running
[I 2024-08-13 15:37:37,760] Trial 3 finished with value: 0.04793235660437675 and parameters: {'model_name': 'IterativeImputer', 'estimator': 'RFR', 'initial_strategy': 'constant', 'n_nearest_features': 9, 'imputation_order': 'descending'}. Best is trial 77 with value: 0.04712227312068532.
running
[I 2024-08-13 17:02:42,123] Trial 83 finished with value: 0.04818522791591599 and parameters: {'model_name': 'IterativeImputer', 'estimator': 'RFR', 'initial_strategy': 'most_frequent', 'n_nearest_features': 10, 'imputation_order': 'random'}. Best is trial 77 with value: 0.04712227312068532.
running
[I 2024-08-13 17:04:20,352] Trial 84 finished with value: 0.047384300134300644 and parameters: {'model_name': 'IterativeImputer', 'estimator': 'RFR', 'initial_strategy': 'constant', 'n_nearest_features': 10, 'imputation_order': 'random'}. Best is trial 77 with value: 0.04712227312068532.
running
[I 2024-08-13 17:27:53,045] Trial 69 finished with value: 0.30185600648319694 and parameters: {'model_name': 'GAIN', 'batch_size': 937, 'hint_rate': 0.5931346966331621, 'alpha': 88, 'iterations': 4145, 'learning_rate': 0.092674293235962, 'p_miss': 0.017197025987399805}. Best is trial 77 with value: 0.04712227312068532.
running
[I 2024-08-13 17:49:56,436] Trial 66 finished with value: 0.3032249620886502 and parameters: {'model_name': 'GAIN', 'batch_size': 994, 'hint_rate': 0.563044221861257, 'alpha': 97, 'iterations': 4574, 'learning_rate': 0.08320874021133533, 'p_miss': 0.017628900452085844}. Best is trial 77 with value: 0.04712227312068532.
running
[I 2024-08-13 17:54:33,529] Trial 72 finished with value: 0.3042610788157349 and parameters: {'model_name': 'GAIN', 'batch_size': 970, 'hint_rate': 0.6501617184641474, 'alpha': 100, 'iterations': 4125, 'learning_rate': 0.08804075832743907, 'p_miss': 0.014675030725501581}. Best is trial 77 with value: 0.04712227312068532.
running
[I 2024-08-13 18:09:36,600] Trial 30 finished with value: 0.3452902473670267 and parameters: {'model_name': 'GAIN', 'batch_size': 26, 'hint_rate': 0.404861446436512, 'alpha': 96, 'iterations': 6408, 'learning_rate': 0.005717003257318982, 'p_miss': 0.13265411280542475}. Best is trial 77 with value: 0.04712227312068532.
running
[I 2024-08-13 18:14:19,099] Trial 68 finished with value: 0.3054987602211614 and parameters: {'model_name': 'GAIN', 'batch_size': 889, 'hint_rate': 0.5561483032712462, 'alpha': 100, 'iterations': 5561, 'learning_rate': 0.08158254730719362, 'p_miss': 0.039019080603741166}. Best is trial 77 with value: 0.04712227312068532.
running
[I 2024-08-13 18:19:06,550] Trial 62 finished with value: 0.3011768427532991 and parameters: {'model_name': 'GAIN', 'batch_size': 583, 'hint_rate': 0.5666583922063249, 'alpha': 98, 'iterations': 5728, 'learning_rate': 0.00014628774057953524, 'p_miss': 0.020315060584101458}. Best is trial 77 with value: 0.04712227312068532.
running
[I 2024-08-13 18:21:46,933] Trial 85 finished with value: 0.04831369635370386 and parameters: {'model_name': 'IterativeImputer', 'estimator': 'RFR', 'initial_strategy': 'most_frequent', 'n_nearest_features': 7, 'imputation_order': 'random'}. Best is trial 77 with value: 0.04712227312068532.
running
[I 2024-08-13 18:36:40,643] Trial 86 finished with value: 0.04800709301483834 and parameters: {'model_name': 'IterativeImputer', 'estimator': 'RFR', 'initial_strategy': 'most_frequent', 'n_nearest_features': 10, 'imputation_order': 'random'}. Best is trial 77 with value: 0.04712227312068532.
running
[I 2024-08-13 18:50:47,740] Trial 63 finished with value: 0.3049807159900379 and parameters: {'model_name': 'GAIN', 'batch_size': 814, 'hint_rate': 0.41792934269231874, 'alpha': 96, 'iterations': 6309, 'learning_rate': 0.07513654898915616, 'p_miss': 0.01711887821854602}. Best is trial 77 with value: 0.04712227312068532.
running
[I 2024-08-13 18:59:19,814] Trial 87 finished with value: 0.04835435319625889 and parameters: {'model_name': 'IterativeImputer', 'estimator': 'RFR', 'initial_strategy': 'most_frequent', 'n_nearest_features': 10, 'imputation_order': 'random'}. Best is trial 77 with value: 0.04712227312068532.
running
[I 2024-08-13 19:11:55,166] Trial 64 finished with value: 0.3071119361769968 and parameters: {'model_name': 'GAIN', 'batch_size': 675, 'hint_rate': 0.5331787793905591, 'alpha': 96, 'iterations': 7055, 'learning_rate': 0.00013046192746029456, 'p_miss': 0.02586151670673459}. Best is trial 77 with value: 0.04712227312068532.
running
[I 2024-08-13 19:19:29,536] Trial 88 finished with value: 0.047714466053942674 and parameters: {'model_name': 'IterativeImputer', 'estimator': 'RFR', 'initial_strategy': 'most_frequent', 'n_nearest_features': 10, 'imputation_order': 'random'}. Best is trial 77 with value: 0.04712227312068532.
running
