[I 2024-11-05 20:13:54,047] Trial 108 finished with value: 0.22408387266657082 and parameters: {'model_name': 'SimpleImputer', 'strategy': 'mean'}. Best is trial 1 with value: 0.22408387266657082.
running
running
[I 2024-11-05 20:13:54,295] Trial 107 finished with value: 0.22408387266657082 and parameters: {'model_name': 'SimpleImputer', 'strategy': 'mean'}. Best is trial 1 with value: 0.22408387266657082.
[I 2024-11-05 20:13:54,388] Trial 93 finished with value: 0.4027684591544901 and parameters: {'model_name': 'SimpleImputer', 'strategy': 'most_frequent'}. Best is trial 1 with value: 0.22408387266657082.
[I 2024-11-05 20:13:54,473] Trial 104 finished with value: 0.22408387266657082 and parameters: {'model_name': 'SimpleImputer', 'strategy': 'mean'}. Best is trial 1 with value: 0.22408387266657082.
[I 2024-11-05 20:13:54,559] Trial 106 finished with value: 0.22408387266657082 and parameters: {'model_name': 'SimpleImputer', 'strategy': 'mean'}. Best is trial 1 with value: 0.22408387266657082.
[I 2024-11-05 20:13:54,655] Trial 110 finished with value: 0.22408387266657082 and parameters: {'model_name': 'SimpleImputer', 'strategy': 'mean'}. Best is trial 1 with value: 0.22408387266657082.
[I 2024-11-05 20:13:54,737] Trial 105 finished with value: 0.22408387266657082 and parameters: {'model_name': 'SimpleImputer', 'strategy': 'mean'}. Best is trial 1 with value: 0.22408387266657082.
running
running
running
running
running
running
[I 2024-11-05 20:13:54,916] Trial 111 finished with value: 0.22408387266657082 and parameters: {'model_name': 'SimpleImputer', 'strategy': 'mean'}. Best is trial 1 with value: 0.22408387266657082.
running
[I 2024-11-05 20:13:55,069] Trial 117 finished with value: 0.22408387266657082 and parameters: {'model_name': 'SimpleImputer', 'strategy': 'mean'}. Best is trial 1 with value: 0.22408387266657082.
[I 2024-11-05 20:13:55,164] Trial 109 finished with value: 0.22408387266657082 and parameters: {'model_name': 'SimpleImputer', 'strategy': 'mean'}. Best is trial 1 with value: 0.22408387266657082.
[I 2024-11-05 20:13:55,248] Trial 116 finished with value: 0.22408387266657082 and parameters: {'model_name': 'SimpleImputer', 'strategy': 'mean'}. Best is trial 1 with value: 0.22408387266657082.
running
running
running
[I 2024-11-05 20:13:55,458] Trial 115 finished with value: 0.22408387266657082 and parameters: {'model_name': 'SimpleImputer', 'strategy': 'mean'}. Best is trial 1 with value: 0.22408387266657082.
[I 2024-11-05 20:13:55,577] Trial 118 finished with value: 0.22408387266657082 and parameters: {'model_name': 'SimpleImputer', 'strategy': 'mean'}. Best is trial 1 with value: 0.22408387266657082.
running
running
[I 2024-11-05 20:13:55,777] Trial 119 finished with value: 0.22408387266657082 and parameters: {'model_name': 'SimpleImputer', 'strategy': 'mean'}. Best is trial 1 with value: 0.22408387266657082.
running
[I 2024-11-05 20:13:55,911] Trial 120 finished with value: 0.22408387266657082 and parameters: {'model_name': 'SimpleImputer', 'strategy': 'mean'}. Best is trial 1 with value: 0.22408387266657082.
[I 2024-11-05 20:13:56,004] Trial 114 finished with value: 0.4027684591544901 and parameters: {'model_name': 'SimpleImputer', 'strategy': 'most_frequent'}. Best is trial 1 with value: 0.22408387266657082.
running
running
[I 2024-11-05 20:13:56,169] Trial 113 finished with value: 0.4027684591544901 and parameters: {'model_name': 'SimpleImputer', 'strategy': 'most_frequent'}. Best is trial 1 with value: 0.22408387266657082.
running
[I 2024-11-05 20:13:56,278] Trial 121 finished with value: 0.22408387266657082 and parameters: {'model_name': 'SimpleImputer', 'strategy': 'mean'}. Best is trial 1 with value: 0.22408387266657082.
running
[I 2024-11-05 20:13:56,401] Trial 123 finished with value: 0.22408387266657082 and parameters: {'model_name': 'SimpleImputer', 'strategy': 'mean'}. Best is trial 1 with value: 0.22408387266657082.
[I 2024-11-05 20:13:56,503] Trial 122 finished with value: 0.22408387266657082 and parameters: {'model_name': 'SimpleImputer', 'strategy': 'mean'}. Best is trial 1 with value: 0.22408387266657082.
running
running
[I 2024-11-05 20:13:56,651] Trial 130 finished with value: 0.22408387266657082 and parameters: {'model_name': 'SimpleImputer', 'strategy': 'mean'}. Best is trial 1 with value: 0.22408387266657082.
[I 2024-11-05 20:13:56,747] Trial 124 finished with value: 0.22408387266657082 and parameters: {'model_name': 'SimpleImputer', 'strategy': 'mean'}. Best is trial 1 with value: 0.22408387266657082.
running
running
[I 2024-11-05 20:13:56,864] Trial 112 finished with value: 0.4027684591544901 and parameters: {'model_name': 'SimpleImputer', 'strategy': 'most_frequent'}. Best is trial 1 with value: 0.22408387266657082.
[I 2024-11-05 20:13:56,951] Trial 125 finished with value: 0.22408387266657082 and parameters: {'model_name': 'SimpleImputer', 'strategy': 'mean'}. Best is trial 1 with value: 0.22408387266657082.
running
running
[I 2024-11-05 20:13:57,073] Trial 129 finished with value: 0.22408387266657082 and parameters: {'model_name': 'SimpleImputer', 'strategy': 'mean'}. Best is trial 1 with value: 0.22408387266657082.
running
[I 2024-11-05 20:13:57,202] Trial 131 finished with value: 0.22408387266657082 and parameters: {'model_name': 'SimpleImputer', 'strategy': 'mean'}. Best is trial 1 with value: 0.22408387266657082.
[I 2024-11-05 20:13:57,289] Trial 127 finished with value: 0.22408387266657082 and parameters: {'model_name': 'SimpleImputer', 'strategy': 'mean'}. Best is trial 1 with value: 0.22408387266657082.
[I 2024-11-05 20:13:57,376] Trial 126 finished with value: 0.22408387266657082 and parameters: {'model_name': 'SimpleImputer', 'strategy': 'mean'}. Best is trial 1 with value: 0.22408387266657082.
running
running
[I 2024-11-05 20:13:57,472] Trial 128 finished with value: 0.22408387266657082 and parameters: {'model_name': 'SimpleImputer', 'strategy': 'mean'}. Best is trial 1 with value: 0.22408387266657082.
[I 2024-11-05 20:13:57,591] Trial 134 finished with value: 0.22408387266657082 and parameters: {'model_name': 'SimpleImputer', 'strategy': 'mean'}. Best is trial 1 with value: 0.22408387266657082.
running
running
running
[I 2024-11-05 20:13:57,771] Trial 133 finished with value: 0.22408387266657082 and parameters: {'model_name': 'SimpleImputer', 'strategy': 'mean'}. Best is trial 1 with value: 0.22408387266657082.
[I 2024-11-05 20:13:57,872] Trial 136 finished with value: 0.22408387266657082 and parameters: {'model_name': 'SimpleImputer', 'strategy': 'mean'}. Best is trial 1 with value: 0.22408387266657082.
running
running
[I 2024-11-05 20:13:58,026] Trial 132 finished with value: 0.22408387266657082 and parameters: {'model_name': 'SimpleImputer', 'strategy': 'mean'}. Best is trial 1 with value: 0.22408387266657082.
running
[I 2024-11-05 20:13:58,189] Trial 135 finished with value: 0.22408387266657082 and parameters: {'model_name': 'SimpleImputer', 'strategy': 'mean'}. Best is trial 1 with value: 0.22408387266657082.
running
[I 2024-11-05 20:13:58,316] Trial 141 finished with value: 0.22408387266657082 and parameters: {'model_name': 'SimpleImputer', 'strategy': 'mean'}. Best is trial 1 with value: 0.22408387266657082.
[I 2024-11-05 20:13:58,407] Trial 140 finished with value: 0.22408387266657082 and parameters: {'model_name': 'SimpleImputer', 'strategy': 'mean'}. Best is trial 1 with value: 0.22408387266657082.
[I 2024-11-05 20:13:58,498] Trial 138 finished with value: 0.22408387266657082 and parameters: {'model_name': 'SimpleImputer', 'strategy': 'mean'}. Best is trial 1 with value: 0.22408387266657082.
[I 2024-11-05 20:13:58,587] Trial 137 finished with value: 0.22408387266657082 and parameters: {'model_name': 'SimpleImputer', 'strategy': 'mean'}. Best is trial 1 with value: 0.22408387266657082.
running
running
running
running
[I 2024-11-05 20:13:58,753] Trial 142 finished with value: 0.22408387266657082 and parameters: {'model_name': 'SimpleImputer', 'strategy': 'mean'}. Best is trial 1 with value: 0.22408387266657082.
[I 2024-11-05 20:13:58,874] Trial 139 finished with value: 0.22408387266657082 and parameters: {'model_name': 'SimpleImputer', 'strategy': 'mean'}. Best is trial 1 with value: 0.22408387266657082.
running
running
[I 2024-11-05 20:13:58,898] Trial 144 finished with value: 0.22408387266657082 and parameters: {'model_name': 'SimpleImputer', 'strategy': 'mean'}. Best is trial 1 with value: 0.22408387266657082.
[I 2024-11-05 20:13:59,004] Trial 149 finished with value: 0.22408387266657082 and parameters: {'model_name': 'SimpleImputer', 'strategy': 'mean'}. Best is trial 1 with value: 0.22408387266657082.
[I 2024-11-05 20:13:59,192] Trial 143 finished with value: 0.22408387266657082 and parameters: {'model_name': 'SimpleImputer', 'strategy': 'mean'}. Best is trial 1 with value: 0.22408387266657082.
[I 2024-11-05 20:13:59,293] Trial 145 finished with value: 0.22408387266657082 and parameters: {'model_name': 'SimpleImputer', 'strategy': 'mean'}. Best is trial 1 with value: 0.22408387266657082.
[I 2024-11-05 20:13:59,379] Trial 146 finished with value: 0.22408387266657082 and parameters: {'model_name': 'SimpleImputer', 'strategy': 'mean'}. Best is trial 1 with value: 0.22408387266657082.
running
running
[I 2024-11-05 20:13:59,500] Trial 147 finished with value: 0.22408387266657082 and parameters: {'model_name': 'SimpleImputer', 'strategy': 'mean'}. Best is trial 1 with value: 0.22408387266657082.
running
running
running
[I 2024-11-05 20:13:59,622] Trial 148 finished with value: 0.22408387266657082 and parameters: {'model_name': 'SimpleImputer', 'strategy': 'mean'}. Best is trial 1 with value: 0.22408387266657082.
[I 2024-11-05 20:13:59,723] Trial 151 finished with value: 0.22408387266657082 and parameters: {'model_name': 'SimpleImputer', 'strategy': 'mean'}. Best is trial 1 with value: 0.22408387266657082.
[I 2024-11-05 20:13:59,807] Trial 150 finished with value: 0.22408387266657082 and parameters: {'model_name': 'SimpleImputer', 'strategy': 'mean'}. Best is trial 1 with value: 0.22408387266657082.
running
running
running
running
[I 2024-11-05 20:14:00,042] Trial 153 finished with value: 0.22408387266657082 and parameters: {'model_name': 'SimpleImputer', 'strategy': 'mean'}. Best is trial 1 with value: 0.22408387266657082.
running
[I 2024-11-05 20:14:00,195] Trial 152 finished with value: 0.22408387266657082 and parameters: {'model_name': 'SimpleImputer', 'strategy': 'mean'}. Best is trial 1 with value: 0.22408387266657082.
running
[I 2024-11-05 20:14:00,335] Trial 154 finished with value: 0.22408387266657082 and parameters: {'model_name': 'SimpleImputer', 'strategy': 'mean'}. Best is trial 1 with value: 0.22408387266657082.
running
[I 2024-11-05 20:14:00,458] Trial 155 finished with value: 0.22408387266657082 and parameters: {'model_name': 'SimpleImputer', 'strategy': 'mean'}. Best is trial 1 with value: 0.22408387266657082.
running
[I 2024-11-05 20:14:00,565] Trial 158 finished with value: 0.22408387266657082 and parameters: {'model_name': 'SimpleImputer', 'strategy': 'mean'}. Best is trial 1 with value: 0.22408387266657082.
[I 2024-11-05 20:14:00,651] Trial 163 finished with value: 0.22408387266657082 and parameters: {'model_name': 'SimpleImputer', 'strategy': 'mean'}. Best is trial 1 with value: 0.22408387266657082.
running
running
[I 2024-11-05 20:14:00,805] Trial 159 finished with value: 0.22408387266657082 and parameters: {'model_name': 'SimpleImputer', 'strategy': 'mean'}. Best is trial 1 with value: 0.22408387266657082.
[I 2024-11-05 20:14:00,910] Trial 162 finished with value: 0.22408387266657082 and parameters: {'model_name': 'SimpleImputer', 'strategy': 'mean'}. Best is trial 1 with value: 0.22408387266657082.
running
[I 2024-11-05 20:14:01,026] Trial 161 finished with value: 0.22408387266657082 and parameters: {'model_name': 'SimpleImputer', 'strategy': 'mean'}. Best is trial 1 with value: 0.22408387266657082.
running
running
[I 2024-11-05 20:14:01,139] Trial 166 finished with value: 0.22408387266657082 and parameters: {'model_name': 'SimpleImputer', 'strategy': 'mean'}. Best is trial 1 with value: 0.22408387266657082.
[I 2024-11-05 20:14:01,226] Trial 164 finished with value: 0.22408387266657082 and parameters: {'model_name': 'SimpleImputer', 'strategy': 'mean'}. Best is trial 1 with value: 0.22408387266657082.
[I 2024-11-05 20:14:01,307] Trial 160 finished with value: 0.22408387266657082 and parameters: {'model_name': 'SimpleImputer', 'strategy': 'mean'}. Best is trial 1 with value: 0.22408387266657082.
[I 2024-11-05 20:14:01,388] Trial 165 finished with value: 0.22408387266657082 and parameters: {'model_name': 'SimpleImputer', 'strategy': 'mean'}. Best is trial 1 with value: 0.22408387266657082.
[I 2024-11-05 20:14:01,469] Trial 156 finished with value: 0.22408387266657082 and parameters: {'model_name': 'SimpleImputer', 'strategy': 'mean'}. Best is trial 1 with value: 0.22408387266657082.
running
[I 2024-11-05 20:14:01,557] Trial 157 finished with value: 0.22408387266657082 and parameters: {'model_name': 'SimpleImputer', 'strategy': 'mean'}. Best is trial 1 with value: 0.22408387266657082.
running
running
running
running
running
[I 2024-11-05 20:14:01,753] Trial 167 finished with value: 0.22408387266657082 and parameters: {'model_name': 'SimpleImputer', 'strategy': 'mean'}. Best is trial 1 with value: 0.22408387266657082.
running
[I 2024-11-05 20:14:01,957] Trial 170 finished with value: 0.22408387266657082 and parameters: {'model_name': 'SimpleImputer', 'strategy': 'mean'}. Best is trial 1 with value: 0.22408387266657082.
[I 2024-11-05 20:14:02,088] Trial 169 finished with value: 0.22408387266657082 and parameters: {'model_name': 'SimpleImputer', 'strategy': 'mean'}. Best is trial 1 with value: 0.22408387266657082.
running
running
[I 2024-11-05 20:14:02,238] Trial 168 finished with value: 0.22408387266657082 and parameters: {'model_name': 'SimpleImputer', 'strategy': 'mean'}. Best is trial 1 with value: 0.22408387266657082.
[I 2024-11-05 20:14:02,358] Trial 177 finished with value: 0.22408387266657082 and parameters: {'model_name': 'SimpleImputer', 'strategy': 'mean'}. Best is trial 1 with value: 0.22408387266657082.
running
running
[I 2024-11-05 20:14:02,497] Trial 173 finished with value: 0.22408387266657082 and parameters: {'model_name': 'SimpleImputer', 'strategy': 'mean'}. Best is trial 1 with value: 0.22408387266657082.
running
[I 2024-11-05 20:14:02,615] Trial 174 finished with value: 0.22408387266657082 and parameters: {'model_name': 'SimpleImputer', 'strategy': 'mean'}. Best is trial 1 with value: 0.22408387266657082.
[I 2024-11-05 20:14:02,615] Trial 178 finished with value: 0.22408387266657082 and parameters: {'model_name': 'SimpleImputer', 'strategy': 'mean'}. Best is trial 1 with value: 0.22408387266657082.
[I 2024-11-05 20:14:02,817] Trial 179 finished with value: 0.22408387266657082 and parameters: {'model_name': 'SimpleImputer', 'strategy': 'mean'}. Best is trial 1 with value: 0.22408387266657082.
running
[I 2024-11-05 20:14:02,915] Trial 180 finished with value: 0.22408387266657082 and parameters: {'model_name': 'SimpleImputer', 'strategy': 'mean'}. Best is trial 1 with value: 0.22408387266657082.
running
[I 2024-11-05 20:14:03,005] Trial 171 finished with value: 0.22408387266657082 and parameters: {'model_name': 'SimpleImputer', 'strategy': 'mean'}. Best is trial 1 with value: 0.22408387266657082.
running
running
running
[I 2024-11-05 20:14:03,143] Trial 175 finished with value: 0.22408387266657082 and parameters: {'model_name': 'SimpleImputer', 'strategy': 'mean'}. Best is trial 1 with value: 0.22408387266657082.
[I 2024-11-05 20:14:03,230] Trial 183 finished with value: 0.22408387266657082 and parameters: {'model_name': 'SimpleImputer', 'strategy': 'mean'}. Best is trial 1 with value: 0.22408387266657082.
[I 2024-11-05 20:14:03,311] Trial 181 finished with value: 0.22408387266657082 and parameters: {'model_name': 'SimpleImputer', 'strategy': 'mean'}. Best is trial 1 with value: 0.22408387266657082.
running
running
[I 2024-11-05 20:14:03,411] Trial 182 finished with value: 0.22408387266657082 and parameters: {'model_name': 'SimpleImputer', 'strategy': 'mean'}. Best is trial 1 with value: 0.22408387266657082.
[I 2024-11-05 20:14:03,498] Trial 176 finished with value: 0.22408387266657082 and parameters: {'model_name': 'SimpleImputer', 'strategy': 'mean'}. Best is trial 1 with value: 0.22408387266657082.
running
[I 2024-11-05 20:14:03,591] Trial 172 finished with value: 0.22408387266657082 and parameters: {'model_name': 'SimpleImputer', 'strategy': 'mean'}. Best is trial 1 with value: 0.22408387266657082.
running
running
running
[I 2024-11-05 20:14:03,873] Trial 186 finished with value: 0.22408387266657082 and parameters: {'model_name': 'SimpleImputer', 'strategy': 'mean'}. Best is trial 1 with value: 0.22408387266657082.
[I 2024-11-05 20:14:04,008] Trial 187 finished with value: 0.22408387266657082 and parameters: {'model_name': 'SimpleImputer', 'strategy': 'mean'}. Best is trial 1 with value: 0.22408387266657082.
[I 2024-11-05 20:14:04,105] Trial 184 finished with value: 0.22408387266657082 and parameters: {'model_name': 'SimpleImputer', 'strategy': 'mean'}. Best is trial 1 with value: 0.22408387266657082.
[I 2024-11-05 20:14:04,203] Trial 191 finished with value: 0.4027684591544901 and parameters: {'model_name': 'SimpleImputer', 'strategy': 'constant'}. Best is trial 1 with value: 0.22408387266657082.
[I 2024-11-05 20:14:04,292] Trial 188 finished with value: 0.22408387266657082 and parameters: {'model_name': 'SimpleImputer', 'strategy': 'mean'}. Best is trial 1 with value: 0.22408387266657082.
[I 2024-11-05 20:14:04,379] Trial 185 finished with value: 0.22408387266657082 and parameters: {'model_name': 'SimpleImputer', 'strategy': 'mean'}. Best is trial 1 with value: 0.22408387266657082.
[I 2024-11-05 20:14:04,510] Trial 194 finished with value: 0.4027684591544901 and parameters: {'model_name': 'SimpleImputer', 'strategy': 'constant'}. Best is trial 1 with value: 0.22408387266657082.
[I 2024-11-05 20:14:04,606] Trial 193 finished with value: 0.22408387266657082 and parameters: {'model_name': 'SimpleImputer', 'strategy': 'mean'}. Best is trial 1 with value: 0.22408387266657082.
[I 2024-11-05 20:14:04,701] Trial 189 finished with value: 0.22408387266657082 and parameters: {'model_name': 'SimpleImputer', 'strategy': 'mean'}. Best is trial 1 with value: 0.22408387266657082.
[I 2024-11-05 20:14:04,782] Trial 197 finished with value: 0.4027684591544901 and parameters: {'model_name': 'SimpleImputer', 'strategy': 'constant'}. Best is trial 1 with value: 0.22408387266657082.
[I 2024-11-05 20:14:04,860] Trial 190 finished with value: 0.22408387266657082 and parameters: {'model_name': 'SimpleImputer', 'strategy': 'mean'}. Best is trial 1 with value: 0.22408387266657082.
[I 2024-11-05 20:14:04,952] Trial 192 finished with value: 0.4027684591544901 and parameters: {'model_name': 'SimpleImputer', 'strategy': 'constant'}. Best is trial 1 with value: 0.22408387266657082.
[I 2024-11-05 20:14:05,037] Trial 196 finished with value: 0.4027684591544901 and parameters: {'model_name': 'SimpleImputer', 'strategy': 'constant'}. Best is trial 1 with value: 0.22408387266657082.
[I 2024-11-05 20:14:05,128] Trial 198 finished with value: 0.4027684591544901 and parameters: {'model_name': 'SimpleImputer', 'strategy': 'constant'}. Best is trial 1 with value: 0.22408387266657082.
[I 2024-11-05 20:14:05,208] Trial 195 finished with value: 0.4027684591544901 and parameters: {'model_name': 'SimpleImputer', 'strategy': 'constant'}. Best is trial 1 with value: 0.22408387266657082.
