[I 2024-10-07 20:55:35,973] Trial 150 finished with value: 0.2006314351587093 and parameters: {'model_name': 'IterativeImputer', 'estimator': 'RFR', 'initial_strategy': 'most_frequent', 'n_nearest_features': 12, 'imputation_order': 'ascending'}. Best is trial 107 with value: 0.19850015889912181.
running
[I 2024-10-07 20:55:36,342] Trial 149 finished with value: 0.20088029231362273 and parameters: {'model_name': 'IterativeImputer', 'estimator': 'RFR', 'initial_strategy': 'most_frequent', 'n_nearest_features': 12, 'imputation_order': 'ascending'}. Best is trial 107 with value: 0.19850015889912181.
running
[I 2024-10-07 20:57:22,826] Trial 151 finished with value: 0.2005642188349248 and parameters: {'model_name': 'IterativeImputer', 'estimator': 'RFR', 'initial_strategy': 'most_frequent', 'n_nearest_features': 12, 'imputation_order': 'ascending'}. Best is trial 107 with value: 0.19850015889912181.
running
[I 2024-10-07 20:57:26,472] Trial 152 finished with value: 0.19943333588991252 and parameters: {'model_name': 'IterativeImputer', 'estimator': 'RFR', 'initial_strategy': 'most_frequent', 'n_nearest_features': 12, 'imputation_order': 'ascending'}. Best is trial 107 with value: 0.19850015889912181.
running
[I 2024-10-07 20:58:10,491] Trial 153 finished with value: 0.200741002989538 and parameters: {'model_name': 'IterativeImputer', 'estimator': 'RFR', 'initial_strategy': 'constant', 'n_nearest_features': 12, 'imputation_order': 'ascending'}. Best is trial 107 with value: 0.19850015889912181.
running
[I 2024-10-07 21:04:41,789] Trial 155 finished with value: 0.19933352217529846 and parameters: {'model_name': 'IterativeImputer', 'estimator': 'RFR', 'initial_strategy': 'mean', 'n_nearest_features': 12, 'imputation_order': 'ascending'}. Best is trial 107 with value: 0.19850015889912181.
running
[I 2024-10-07 21:05:04,618] Trial 156 finished with value: 0.19939922832010143 and parameters: {'model_name': 'IterativeImputer', 'estimator': 'RFR', 'initial_strategy': 'most_frequent', 'n_nearest_features': 12, 'imputation_order': 'ascending'}. Best is trial 107 with value: 0.19850015889912181.
running
[I 2024-10-07 21:06:21,430] Trial 157 finished with value: 0.19920457546759235 and parameters: {'model_name': 'IterativeImputer', 'estimator': 'RFR', 'initial_strategy': 'most_frequent', 'n_nearest_features': 12, 'imputation_order': 'ascending'}. Best is trial 107 with value: 0.19850015889912181.
running
[I 2024-10-07 21:11:29,966] Trial 158 finished with value: 0.19950398779411777 and parameters: {'model_name': 'IterativeImputer', 'estimator': 'RFR', 'initial_strategy': 'most_frequent', 'n_nearest_features': 11, 'imputation_order': 'ascending'}. Best is trial 107 with value: 0.19850015889912181.
running
[I 2024-10-07 21:11:31,091] Trial 172 finished with value: 0.26721967294989646 and parameters: {'model_name': 'SimpleImputer', 'strategy': 'most_frequent'}. Best is trial 107 with value: 0.19850015889912181.
running
[I 2024-10-07 21:15:53,177] Trial 159 finished with value: 0.1986554317439019 and parameters: {'model_name': 'IterativeImputer', 'estimator': 'RFR', 'initial_strategy': 'most_frequent', 'n_nearest_features': 11, 'imputation_order': 'ascending'}. Best is trial 107 with value: 0.19850015889912181.
running
[I 2024-10-07 21:16:18,957] Trial 160 finished with value: 0.19987049461013334 and parameters: {'model_name': 'IterativeImputer', 'estimator': 'RFR', 'initial_strategy': 'most_frequent', 'n_nearest_features': 11, 'imputation_order': 'ascending'}. Best is trial 107 with value: 0.19850015889912181.
running
[I 2024-10-07 21:16:23,957] Trial 174 finished with value: 0.20655183016401896 and parameters: {'model_name': 'IterativeImputer', 'estimator': 'Ridge', 'initial_strategy': 'most_frequent', 'n_nearest_features': 12, 'imputation_order': 'random'}. Best is trial 107 with value: 0.19850015889912181.
running
[I 2024-10-07 21:16:43,486] Trial 175 finished with value: 0.20655187517021883 and parameters: {'model_name': 'IterativeImputer', 'estimator': 'Ridge', 'initial_strategy': 'most_frequent', 'n_nearest_features': 12, 'imputation_order': 'ascending'}. Best is trial 107 with value: 0.19850015889912181.
running
[I 2024-10-07 21:24:11,345] Trial 162 finished with value: 0.1996503987742125 and parameters: {'model_name': 'IterativeImputer', 'estimator': 'RFR', 'initial_strategy': 'most_frequent', 'n_nearest_features': 12, 'imputation_order': 'roman'}. Best is trial 107 with value: 0.19850015889912181.
running
[I 2024-10-07 21:24:16,439] Trial 161 finished with value: 0.20021730277777686 and parameters: {'model_name': 'IterativeImputer', 'estimator': 'RFR', 'initial_strategy': 'most_frequent', 'n_nearest_features': 11, 'imputation_order': 'roman'}. Best is trial 107 with value: 0.19850015889912181.
running
[I 2024-10-07 21:29:32,919] Trial 163 finished with value: 0.20060299317121855 and parameters: {'model_name': 'IterativeImputer', 'estimator': 'RFR', 'initial_strategy': 'most_frequent', 'n_nearest_features': 12, 'imputation_order': 'ascending'}. Best is trial 107 with value: 0.19850015889912181.
running
[I 2024-10-07 21:39:40,124] Trial 164 finished with value: 0.1997754340394608 and parameters: {'model_name': 'IterativeImputer', 'estimator': 'RFR', 'initial_strategy': 'most_frequent', 'n_nearest_features': 11, 'imputation_order': 'roman'}. Best is trial 107 with value: 0.19850015889912181.
running
[I 2024-10-07 21:40:55,734] Trial 165 finished with value: 0.2003032901633056 and parameters: {'model_name': 'IterativeImputer', 'estimator': 'RFR', 'initial_strategy': 'most_frequent', 'n_nearest_features': 11, 'imputation_order': 'random'}. Best is trial 107 with value: 0.19850015889912181.
running
[I 2024-10-07 21:42:14,110] Trial 167 finished with value: 0.20077577648407202 and parameters: {'model_name': 'IterativeImputer', 'estimator': 'RFR', 'initial_strategy': 'most_frequent', 'n_nearest_features': 11, 'imputation_order': 'random'}. Best is trial 107 with value: 0.19850015889912181.
running
[I 2024-10-07 21:42:21,833] Trial 166 finished with value: 0.1996631135828859 and parameters: {'model_name': 'IterativeImputer', 'estimator': 'RFR', 'initial_strategy': 'most_frequent', 'n_nearest_features': 11, 'imputation_order': 'roman'}. Best is trial 107 with value: 0.19850015889912181.
running
[I 2024-10-07 21:42:53,186] Trial 168 finished with value: 0.19922287260858962 and parameters: {'model_name': 'IterativeImputer', 'estimator': 'RFR', 'initial_strategy': 'most_frequent', 'n_nearest_features': 11, 'imputation_order': 'roman'}. Best is trial 107 with value: 0.19850015889912181.
running
[I 2024-10-07 21:49:23,506] Trial 170 finished with value: 0.2005514686107747 and parameters: {'model_name': 'IterativeImputer', 'estimator': 'RFR', 'initial_strategy': 'most_frequent', 'n_nearest_features': 12, 'imputation_order': 'roman'}. Best is trial 107 with value: 0.19850015889912181.
running
[I 2024-10-07 21:49:57,720] Trial 169 finished with value: 0.20055284913565447 and parameters: {'model_name': 'IterativeImputer', 'estimator': 'RFR', 'initial_strategy': 'most_frequent', 'n_nearest_features': 11, 'imputation_order': 'random'}. Best is trial 107 with value: 0.19850015889912181.
running
[I 2024-10-07 21:50:26,602] Trial 171 finished with value: 0.19875431339015112 and parameters: {'model_name': 'IterativeImputer', 'estimator': 'RFR', 'initial_strategy': 'most_frequent', 'n_nearest_features': 12, 'imputation_order': 'ascending'}. Best is trial 107 with value: 0.19850015889912181.
running
[I 2024-10-07 21:52:39,564] Trial 64 finished with value: 0.2171363371128884 and parameters: {'model_name': 'VAE', 'batch_size': 213, 'iterations': 9925, 'learning_rate': 0.0003232133711834366, 'p_miss': 0.08755023823920113}. Best is trial 107 with value: 0.19850015889912181.
running
[I 2024-10-07 21:57:15,261] Trial 173 finished with value: 0.200072691041218 and parameters: {'model_name': 'IterativeImputer', 'estimator': 'RFR', 'initial_strategy': 'most_frequent', 'n_nearest_features': 12, 'imputation_order': 'ascending'}. Best is trial 107 with value: 0.19850015889912181.
running
[I 2024-10-07 22:01:02,863] Trial 176 finished with value: 0.1991533140428345 and parameters: {'model_name': 'IterativeImputer', 'estimator': 'RFR', 'initial_strategy': 'most_frequent', 'n_nearest_features': 12, 'imputation_order': 'ascending'}. Best is trial 107 with value: 0.19850015889912181.
running
[I 2024-10-07 22:01:51,049] Trial 177 finished with value: 0.19911384175097274 and parameters: {'model_name': 'IterativeImputer', 'estimator': 'RFR', 'initial_strategy': 'most_frequent', 'n_nearest_features': 11, 'imputation_order': 'ascending'}. Best is trial 107 with value: 0.19850015889912181.
running
[I 2024-10-07 22:03:36,418] Trial 183 finished with value: 0.26743405813472243 and parameters: {'model_name': 'VAE', 'batch_size': 1, 'iterations': 448, 'learning_rate': 0.02923577362763752, 'p_miss': 0.014476585838454237}. Best is trial 107 with value: 0.19850015889912181.
running
[I 2024-10-07 22:09:34,648] Trial 178 finished with value: 0.20085680059096914 and parameters: {'model_name': 'IterativeImputer', 'estimator': 'RFR', 'initial_strategy': 'most_frequent', 'n_nearest_features': 11, 'imputation_order': 'ascending'}. Best is trial 107 with value: 0.19850015889912181.
running
[I 2024-10-07 22:10:24,233] Trial 179 finished with value: 0.19984143956949832 and parameters: {'model_name': 'IterativeImputer', 'estimator': 'RFR', 'initial_strategy': 'most_frequent', 'n_nearest_features': 11, 'imputation_order': 'ascending'}. Best is trial 107 with value: 0.19850015889912181.
running
[I 2024-10-07 22:15:09,800] Trial 180 finished with value: 0.20138394778082205 and parameters: {'model_name': 'IterativeImputer', 'estimator': 'RFR', 'initial_strategy': 'most_frequent', 'n_nearest_features': 11, 'imputation_order': 'ascending'}. Best is trial 107 with value: 0.19850015889912181.
running
[I 2024-10-07 22:24:46,548] Trial 181 finished with value: 0.20037600641592368 and parameters: {'model_name': 'IterativeImputer', 'estimator': 'RFR', 'initial_strategy': 'most_frequent', 'n_nearest_features': 11, 'imputation_order': 'ascending'}. Best is trial 107 with value: 0.19850015889912181.
running
[I 2024-10-07 22:27:58,883] Trial 184 finished with value: 0.1994596759448772 and parameters: {'model_name': 'IterativeImputer', 'estimator': 'RFR', 'initial_strategy': 'mean', 'n_nearest_features': 12, 'imputation_order': 'ascending'}. Best is trial 107 with value: 0.19850015889912181.
running
[I 2024-10-07 22:33:58,005] Trial 186 finished with value: 0.20007220602873182 and parameters: {'model_name': 'IterativeImputer', 'estimator': 'RFR', 'initial_strategy': 'mean', 'n_nearest_features': 11, 'imputation_order': 'ascending'}. Best is trial 107 with value: 0.19850015889912181.
running
[I 2024-10-07 22:35:01,079] Trial 188 finished with value: 0.2564878296434112 and parameters: {'model_name': 'VAE', 'batch_size': 1, 'iterations': 1010, 'learning_rate': 0.023599725416818408, 'p_miss': 0.20275086928462782}. Best is trial 107 with value: 0.19850015889912181.
[I 2024-10-07 22:35:14,768] Trial 187 finished with value: 0.19972096531019173 and parameters: {'model_name': 'IterativeImputer', 'estimator': 'RFR', 'initial_strategy': 'mean', 'n_nearest_features': 12, 'imputation_order': 'ascending'}. Best is trial 107 with value: 0.19850015889912181.
[I 2024-10-07 22:36:47,139] Trial 189 finished with value: 0.20032300400139658 and parameters: {'model_name': 'IterativeImputer', 'estimator': 'RFR', 'initial_strategy': 'mean', 'n_nearest_features': 12, 'imputation_order': 'ascending'}. Best is trial 107 with value: 0.19850015889912181.
[I 2024-10-07 22:37:55,050] Trial 182 finished with value: 0.26123280574080004 and parameters: {'model_name': 'VAE', 'batch_size': 1, 'iterations': 1195, 'learning_rate': 0.017269096409939934, 'p_miss': 0.06834832486444198}. Best is trial 107 with value: 0.19850015889912181.
[I 2024-10-07 22:39:39,522] Trial 185 finished with value: 0.2576167555205087 and parameters: {'model_name': 'VAE', 'batch_size': 1, 'iterations': 1248, 'learning_rate': 0.025243505523206203, 'p_miss': 0.0629007196357718}. Best is trial 107 with value: 0.19850015889912181.
[I 2024-10-07 22:40:12,603] Trial 190 finished with value: 0.19983836229070664 and parameters: {'model_name': 'IterativeImputer', 'estimator': 'RFR', 'initial_strategy': 'mean', 'n_nearest_features': 12, 'imputation_order': 'ascending'}. Best is trial 107 with value: 0.19850015889912181.
[I 2024-10-07 22:40:48,520] Trial 63 finished with value: 0.21734322026121938 and parameters: {'model_name': 'VAE', 'batch_size': 256, 'iterations': 9994, 'learning_rate': 0.00022209330808104966, 'p_miss': 0.08519860544545586}. Best is trial 107 with value: 0.19850015889912181.
[I 2024-10-07 22:42:11,556] Trial 191 finished with value: 0.20010242087478983 and parameters: {'model_name': 'IterativeImputer', 'estimator': 'RFR', 'initial_strategy': 'mean', 'n_nearest_features': 12, 'imputation_order': 'ascending'}. Best is trial 107 with value: 0.19850015889912181.
[I 2024-10-07 22:42:53,339] Trial 192 finished with value: 0.19977554709440323 and parameters: {'model_name': 'IterativeImputer', 'estimator': 'RFR', 'initial_strategy': 'most_frequent', 'n_nearest_features': 12, 'imputation_order': 'ascending'}. Best is trial 107 with value: 0.19850015889912181.
[I 2024-10-07 22:43:44,089] Trial 193 finished with value: 0.20115148512315756 and parameters: {'model_name': 'IterativeImputer', 'estimator': 'RFR', 'initial_strategy': 'most_frequent', 'n_nearest_features': 12, 'imputation_order': 'ascending'}. Best is trial 107 with value: 0.19850015889912181.
[I 2024-10-07 22:46:27,555] Trial 194 finished with value: 0.2006744096990673 and parameters: {'model_name': 'IterativeImputer', 'estimator': 'RFR', 'initial_strategy': 'most_frequent', 'n_nearest_features': 12, 'imputation_order': 'ascending'}. Best is trial 107 with value: 0.19850015889912181.
[I 2024-10-07 22:47:08,207] Trial 195 finished with value: 0.19856367283690965 and parameters: {'model_name': 'IterativeImputer', 'estimator': 'RFR', 'initial_strategy': 'most_frequent', 'n_nearest_features': 12, 'imputation_order': 'ascending'}. Best is trial 107 with value: 0.19850015889912181.
[I 2024-10-07 22:49:18,356] Trial 196 finished with value: 0.19900883924695253 and parameters: {'model_name': 'IterativeImputer', 'estimator': 'RFR', 'initial_strategy': 'mean', 'n_nearest_features': 12, 'imputation_order': 'ascending'}. Best is trial 107 with value: 0.19850015889912181.
[I 2024-10-07 22:54:01,677] Trial 197 finished with value: 0.201080355035973 and parameters: {'model_name': 'IterativeImputer', 'estimator': 'RFR', 'initial_strategy': 'mean', 'n_nearest_features': 12, 'imputation_order': 'ascending'}. Best is trial 107 with value: 0.19850015889912181.
[I 2024-10-07 22:55:41,635] Trial 198 finished with value: 0.1993158226941788 and parameters: {'model_name': 'IterativeImputer', 'estimator': 'RFR', 'initial_strategy': 'mean', 'n_nearest_features': 12, 'imputation_order': 'ascending'}. Best is trial 107 with value: 0.19850015889912181.
