[I 2024-11-13 08:08:53,725] Trial 43 finished with value: 0.6221048734906615 and parameters: {'model_name': 'GAIN', 'batch_size': 832, 'hint_rate': 0.4400687231909892, 'alpha': 86, 'iterations': 9318, 'learning_rate': 0.00018438264611578986, 'p_miss': 0.22045360177403334}. Best is trial 73 with value: 0.30271037755929664.
fit
auto fit
auto transform
0    0
1    0
2    0
3    0
4    0
5    0
dtype: int64
0    0
1    0
2    0
3    0
4    0
5    0
dtype: int64
0.30271037755929664
{'model_name': 'KNNImputer', 'n_neighbors': 122, 'weights': 'uniform'}
running experiment 2/3 - Does reconstruction give good automl predictions
Start est fit
Version 0.1.7a0 of tpot2 is outdated. Version 0.1.8a0 was released Tuesday September 17, 2024.
Version 0.1.7a0 of tpot2 is outdated. Version 0.1.8a0 was released Tuesday September 17, 2024.
Version 0.1.7a0 of tpot2 is outdated. Version 0.1.8a0 was released Tuesday September 17, 2024.
Version 0.1.7a0 of tpot2 is outdated. Version 0.1.8a0 was released Tuesday September 17, 2024.
Version 0.1.7a0 of tpot2 is outdated. Version 0.1.8a0 was released Tuesday September 17, 2024.
Version 0.1.7a0 of tpot2 is outdated. Version 0.1.8a0 was released Tuesday September 17, 2024.
Version 0.1.7a0 of tpot2 is outdated. Version 0.1.8a0 was released Tuesday September 17, 2024.
Version 0.1.7a0 of tpot2 is outdated. Version 0.1.8a0 was released Tuesday September 17, 2024.
Version 0.1.7a0 of tpot2 is outdated. Version 0.1.8a0 was released Tuesday September 17, 2024.
Version 0.1.7a0 of tpot2 is outdated. Version 0.1.8a0 was released Tuesday September 17, 2024.
Version 0.1.7a0 of tpot2 is outdated. Version 0.1.8a0 was released Tuesday September 17, 2024.
Version 0.1.7a0 of tpot2 is outdated. Version 0.1.8a0 was released Tuesday September 17, 2024.
Version 0.1.7a0 of tpot2 is outdated. Version 0.1.8a0 was released Tuesday September 17, 2024.
Version 0.1.7a0 of tpot2 is outdated. Version 0.1.8a0 was released Tuesday September 17, 2024.
Version 0.1.7a0 of tpot2 is outdated. Version 0.1.8a0 was released Tuesday September 17, 2024.
Version 0.1.7a0 of tpot2 is outdated. Version 0.1.8a0 was released Tuesday September 17, 2024.
  0%|          | 0/25 [00:00<?, ?it/s]Generation:   0%|          | 0/25 [00:00<?, ?it/s]Generation:  1
Best f1_score score: 0.698863783229439
Generation:   4%|▍         | 1/25 [01:25<34:14, 85.61s/it]Generation:  2
Best f1_score score: 0.698863783229439
Generation:   8%|▊         | 2/25 [07:31<1:35:55, 250.25s/it]Generation:  3
Best f1_score score: 0.7819339049411796
Generation:  12%|█▏        | 3/25 [14:54<2:04:05, 338.41s/it]Generation:  4
Best f1_score score: 0.7967627338389737
Generation:  16%|█▌        | 4/25 [16:59<1:28:56, 254.11s/it]Generation:  5
Best f1_score score: 0.7967627338389737
Generation:  20%|██        | 5/25 [26:40<2:03:58, 371.94s/it]WARNING AN INDIVIDUAL TIMED OUT: 
 <tpot2.search_spaces.pipelines.sequential.SequentialPipelineIndividual object at 0x155474741ab0> 

Generation:  6
Best f1_score score: 0.7967627338389737
Generation:  24%|██▍       | 6/25 [36:46<2:23:00, 451.59s/it]Generation:  7
Best f1_score score: 0.7967627338389737
Generation:  28%|██▊       | 7/25 [37:42<1:36:39, 322.20s/it]WARNING AN INDIVIDUAL TIMED OUT: 
 <tpot2.search_spaces.pipelines.sequential.SequentialPipelineIndividual object at 0x1554678604f0> 

Generation:  8
Best f1_score score: 0.7967627338389737
Generation:  32%|███▏      | 8/25 [47:47<1:56:50, 412.41s/it]Generation:  9
Best f1_score score: 0.7967627338389737
Generation:  36%|███▌      | 9/25 [56:08<1:57:20, 440.05s/it]Generation:  10
Best f1_score score: 0.8080072546550614
Generation:  40%|████      | 10/25 [1:00:17<1:35:14, 380.99s/it]WARNING AN INDIVIDUAL TIMED OUT: 
 <tpot2.search_spaces.pipelines.sequential.SequentialPipelineIndividual object at 0x15546562f550> 

Generation:  11
Best f1_score score: 0.8080072546550614
Generation:  44%|████▍     | 11/25 [1:10:25<1:45:06, 450.47s/it]Generation:  12
Best f1_score score: 0.8260314716463082
Generation:  48%|████▊     | 12/25 [1:14:00<1:22:05, 378.88s/it]Generation:  13
Best f1_score score: 0.8260314716463082
Generation:  52%|█████▏    | 13/25 [1:16:24<1:01:31, 307.59s/it]WARNING THIS INDIVIDUAL CAUSED AND EXCEPTION 
 <tpot2.search_spaces.pipelines.sequential.SequentialPipelineIndividual object at 0x155467f13760> 
 The 'min_samples_split' parameter of DecisionTreeClassifier must be an int in the range [2, inf) or a float in the range (0.0, 1.0]. Got 1 instead. 
 Traceback (most recent call last):
  File "/common/ketrong/tpotexp/tpot2/tpot2/utils/eval_utils.py", line 53, in objective_nan_wrapper
    value = func_timeout.func_timeout(timeout, objective_function, args=[individual], kwargs=objective_kwargs)
  File "/common/ketrong/tpotexp/env/lib/python3.10/site-packages/func_timeout/dafunc.py", line 108, in func_timeout
    raise_exception(exception)
  File "/common/ketrong/tpotexp/env/lib/python3.10/site-packages/func_timeout/py3_raise.py", line 7, in raise_exception
    raise exception[0] from None
  File "/common/ketrong/tpotexp/tpot2/tpot2/tpot_estimator/estimator.py", line 623, in objective_function
    return objective_function_generator(
  File "/common/ketrong/tpotexp/tpot2/tpot2/tpot_estimator/estimator_utils.py", line 55, in objective_function_generator
    cv_obj_scores = cross_val_score_objective(sklearn.base.clone(pipeline),x,y,scorers=scorers, cv=cv , fold=step)
  File "/common/ketrong/tpotexp/tpot2/tpot2/tpot_estimator/cross_val_utils.py", line 28, in cross_val_score_objective
    this_fold_pipeline.fit(X_train,y_train)
  File "/common/ketrong/tpotexp/env/lib/python3.10/site-packages/sklearn/base.py", line 1473, in wrapper
    return fit_method(estimator, *args, **kwargs)
  File "/common/ketrong/tpotexp/env/lib/python3.10/site-packages/sklearn/pipeline.py", line 473, in fit
    self._final_estimator.fit(Xt, y, **last_step_params["fit"])
  File "/common/ketrong/tpotexp/env/lib/python3.10/site-packages/sklearn/base.py", line 1466, in wrapper
    estimator._validate_params()
  File "/common/ketrong/tpotexp/env/lib/python3.10/site-packages/sklearn/base.py", line 666, in _validate_params
    validate_parameter_constraints(
  File "/common/ketrong/tpotexp/env/lib/python3.10/site-packages/sklearn/utils/_param_validation.py", line 95, in validate_parameter_constraints
    raise InvalidParameterError(
sklearn.utils._param_validation.InvalidParameterError: The 'min_samples_split' parameter of DecisionTreeClassifier must be an int in the range [2, inf) or a float in the range (0.0, 1.0]. Got 1 instead.

Generation:  14
Best f1_score score: 0.8260314716463082
Generation:  56%|█████▌    | 14/25 [1:17:10<41:56, 228.79s/it]  Generation:  15
Best f1_score score: 0.8260314716463082
Generation:  60%|██████    | 15/25 [1:18:20<30:09, 180.92s/it]Generation:  16
Best f1_score score: 0.8260314716463082
Generation:  64%|██████▍   | 16/25 [1:21:05<26:25, 176.16s/it]Generation:  17
Best f1_score score: 0.8260314716463082
Generation:  68%|██████▊   | 17/25 [1:30:13<38:23, 287.93s/it]Generation:  18
Best f1_score score: 0.8260314716463082
Generation:  72%|███████▏  | 18/25 [1:32:40<28:37, 245.41s/it]Generation:  19
Best f1_score score: 0.8260314716463082
Generation:  76%|███████▌  | 19/25 [1:37:19<25:34, 255.72s/it]Generation:  20
Best f1_score score: 0.8260314716463082
Generation:  80%|████████  | 20/25 [1:42:07<22:05, 265.19s/it]Generation:  21
Best f1_score score: 0.8260314716463082
Generation:  84%|████████▍ | 21/25 [1:46:44<17:55, 268.87s/it]Generation:  22
Best f1_score score: 0.8260314716463082
Generation:  88%|████████▊ | 22/25 [1:51:15<13:28, 269.45s/it]Generation:  23
Best f1_score score: 0.8260314716463082
Generation:  92%|█████████▏| 23/25 [1:55:35<08:53, 266.75s/it]Generation:  24
Best f1_score score: 0.8260314716463082
Generation:  96%|█████████▌| 24/25 [2:00:36<04:37, 277.01s/it]Generation:  25
Best f1_score score: 0.834641771761631
Generation: 100%|██████████| 25/25 [2:02:00<00:00, 218.96s/it]Generation: 100%|██████████| 25/25 [2:02:04<00:00, 292.99s/it]
2024-11-13 10:11:55,541 - distributed.scheduler - ERROR - Removing worker 'tcp://127.0.0.1:41101' caused the cluster to lose scattered data, which can't be recovered: {'ndarray-04ef1e3a7246aa787bf6714e77e9803f', 'ndarray-c06566d9bbc9d10ea35a8c9b4e99b1b5'} (stimulus_id='handle-worker-cleanup-1731521515.5410378')
Fitted
Pipeline(steps=[('histgradientboostingclassifier',
                 HistGradientBoostingClassifier(early_stopping=True,
                                                l2_regularization=0.0406419636194,
                                                learning_rate=0.0752502969302,
                                                max_features=0.9910152115092,
                                                max_leaf_nodes=905,
                                                min_samples_leaf=39,
                                                n_iter_no_change=11, tol=0.0001,
                                                validation_fraction=None))])
score start
train score: {'auroc': 0.999998443158085, 'accuracy': 0.9978613437889859, 'balanced_accuracy': 0.9987406823088195, 'logloss': 0.08089543051105666, 'f1': 0.9985977587955621}
original test score: {'auroc': 0.9970547594820874, 'accuracy': 0.9066286528866714, 'balanced_accuracy': 0.8655084461114825, 'logloss': 0.29747749087836445, 'f1': 0.8767313078728729}
imputed test score: {'auroc': 0.9939156066530523, 'accuracy': 0.8809693513898789, 'balanced_accuracy': 0.8458499815540298, 'logloss': 0.39585148045651564, 'f1': 0.8553285819608221}
score end
check intended
EXP2 Finished
running experiment 3/3 - What is the best automl settings?
<tpot2.search_spaces.pipelines.sequential.SequentialPipeline object at 0x155435014610>
Start tpot fit
Version 0.1.7a0 of tpot2 is outdated. Version 0.1.8a0 was released Tuesday September 17, 2024.
Version 0.1.7a0 of tpot2 is outdated. Version 0.1.8a0 was released Tuesday September 17, 2024.
Version 0.1.7a0 of tpot2 is outdated. Version 0.1.8a0 was released Tuesday September 17, 2024.
Version 0.1.7a0 of tpot2 is outdated. Version 0.1.8a0 was released Tuesday September 17, 2024.
Version 0.1.7a0 of tpot2 is outdated. Version 0.1.8a0 was released Tuesday September 17, 2024.
Version 0.1.7a0 of tpot2 is outdated. Version 0.1.8a0 was released Tuesday September 17, 2024.
Version 0.1.7a0 of tpot2 is outdated. Version 0.1.8a0 was released Tuesday September 17, 2024.
Version 0.1.7a0 of tpot2 is outdated. Version 0.1.8a0 was released Tuesday September 17, 2024.
Version 0.1.7a0 of tpot2 is outdated. Version 0.1.8a0 was released Tuesday September 17, 2024.
Version 0.1.7a0 of tpot2 is outdated. Version 0.1.8a0 was released Tuesday September 17, 2024.
Version 0.1.7a0 of tpot2 is outdated. Version 0.1.8a0 was released Tuesday September 17, 2024.
Version 0.1.7a0 of tpot2 is outdated. Version 0.1.8a0 was released Tuesday September 17, 2024.
Version 0.1.7a0 of tpot2 is outdated. Version 0.1.8a0 was released Tuesday September 17, 2024.
Version 0.1.7a0 of tpot2 is outdated. Version 0.1.8a0 was released Tuesday September 17, 2024.
Version 0.1.7a0 of tpot2 is outdated. Version 0.1.8a0 was released Tuesday September 17, 2024.
Version 0.1.7a0 of tpot2 is outdated. Version 0.1.8a0 was released Tuesday September 17, 2024.
  0%|          | 0/25 [00:00<?, ?it/s]Generation:   0%|          | 0/25 [00:00<?, ?it/s]WARNING THIS INDIVIDUAL CAUSED AND EXCEPTION 
 <tpot2.search_spaces.pipelines.sequential.SequentialPipelineIndividual object at 0x1554746a5540> 
 Negative values in data passed to MultinomialNB (input X) 
 Traceback (most recent call last):
  File "/common/ketrong/tpotexp/tpot2/tpot2/utils/eval_utils.py", line 53, in objective_nan_wrapper
    value = func_timeout.func_timeout(timeout, objective_function, args=[individual], kwargs=objective_kwargs)
  File "/common/ketrong/tpotexp/env/lib/python3.10/site-packages/func_timeout/dafunc.py", line 108, in func_timeout
    raise_exception(exception)
  File "/common/ketrong/tpotexp/env/lib/python3.10/site-packages/func_timeout/py3_raise.py", line 7, in raise_exception
    raise exception[0] from None
  File "/common/ketrong/tpotexp/tpot2/tpot2/tpot_estimator/estimator.py", line 623, in objective_function
    return objective_function_generator(
  File "/common/ketrong/tpotexp/tpot2/tpot2/tpot_estimator/estimator_utils.py", line 55, in objective_function_generator
    cv_obj_scores = cross_val_score_objective(sklearn.base.clone(pipeline),x,y,scorers=scorers, cv=cv , fold=step)
  File "/common/ketrong/tpotexp/tpot2/tpot2/tpot_estimator/cross_val_utils.py", line 28, in cross_val_score_objective
    this_fold_pipeline.fit(X_train,y_train)
  File "/common/ketrong/tpotexp/env/lib/python3.10/site-packages/sklearn/base.py", line 1473, in wrapper
    return fit_method(estimator, *args, **kwargs)
  File "/common/ketrong/tpotexp/env/lib/python3.10/site-packages/sklearn/pipeline.py", line 473, in fit
    self._final_estimator.fit(Xt, y, **last_step_params["fit"])
  File "/common/ketrong/tpotexp/env/lib/python3.10/site-packages/sklearn/base.py", line 1473, in wrapper
    return fit_method(estimator, *args, **kwargs)
  File "/common/ketrong/tpotexp/env/lib/python3.10/site-packages/sklearn/naive_bayes.py", line 759, in fit
    self._count(X, Y)
  File "/common/ketrong/tpotexp/env/lib/python3.10/site-packages/sklearn/naive_bayes.py", line 881, in _count
    check_non_negative(X, "MultinomialNB (input X)")
  File "/common/ketrong/tpotexp/env/lib/python3.10/site-packages/sklearn/utils/validation.py", line 1689, in check_non_negative
    raise ValueError("Negative values in data passed to %s" % whom)
ValueError: Negative values in data passed to MultinomialNB (input X)

Generation:  1
Best f1_score score: 0.6352652637716041
Generation:   4%|▍         | 1/25 [07:04<2:49:59, 424.97s/it]Generation:  2
Best f1_score score: 0.6352652637716041
Generation:   8%|▊         | 2/25 [15:51<3:05:49, 484.76s/it]Generation:  3
Best f1_score score: 0.7761085130482465
Generation:  12%|█▏        | 3/25 [17:29<1:52:53, 307.90s/it]corrupted size vs. prev_size
2024-11-13 10:31:23,333 - distributed.nanny - WARNING - Restarting worker
Version 0.1.7a0 of tpot2 is outdated. Version 0.1.8a0 was released Tuesday September 17, 2024.
Generation:  4
Best f1_score score: 0.7900979261461304
Generation:  16%|█▌        | 4/25 [27:36<2:29:07, 426.08s/it]WARNING THIS INDIVIDUAL CAUSED AND EXCEPTION 
 <tpot2.search_spaces.pipelines.sequential.SequentialPipelineIndividual object at 0x155466900f40> 
 Input X contains NaN.
KNeighborsClassifier does not accept missing values encoded as NaN natively. For supervised learning, you might want to consider sklearn.ensemble.HistGradientBoostingClassifier and Regressor which accept missing values encoded as NaNs natively. Alternatively, it is possible to preprocess the data, for instance by using an imputer transformer in a pipeline or drop samples with missing values. See https://scikit-learn.org/stable/modules/impute.html You can find a list of all estimators that handle NaN values at the following page: https://scikit-learn.org/stable/modules/impute.html#estimators-that-handle-nan-values 
 Traceback (most recent call last):
  File "/common/ketrong/tpotexp/tpot2/tpot2/utils/eval_utils.py", line 53, in objective_nan_wrapper
    value = func_timeout.func_timeout(timeout, objective_function, args=[individual], kwargs=objective_kwargs)
  File "/common/ketrong/tpotexp/env/lib/python3.10/site-packages/func_timeout/dafunc.py", line 108, in func_timeout
    raise_exception(exception)
  File "/common/ketrong/tpotexp/env/lib/python3.10/site-packages/func_timeout/py3_raise.py", line 7, in raise_exception
    raise exception[0] from None
  File "/common/ketrong/tpotexp/tpot2/tpot2/tpot_estimator/estimator.py", line 623, in objective_function
    return objective_function_generator(
  File "/common/ketrong/tpotexp/tpot2/tpot2/tpot_estimator/estimator_utils.py", line 55, in objective_function_generator
    cv_obj_scores = cross_val_score_objective(sklearn.base.clone(pipeline),x,y,scorers=scorers, cv=cv , fold=step)
  File "/common/ketrong/tpotexp/tpot2/tpot2/tpot_estimator/cross_val_utils.py", line 28, in cross_val_score_objective
    this_fold_pipeline.fit(X_train,y_train)
  File "/common/ketrong/tpotexp/env/lib/python3.10/site-packages/sklearn/base.py", line 1473, in wrapper
    return fit_method(estimator, *args, **kwargs)
  File "/common/ketrong/tpotexp/env/lib/python3.10/site-packages/sklearn/pipeline.py", line 473, in fit
    self._final_estimator.fit(Xt, y, **last_step_params["fit"])
  File "/common/ketrong/tpotexp/env/lib/python3.10/site-packages/sklearn/base.py", line 1473, in wrapper
    return fit_method(estimator, *args, **kwargs)
  File "/common/ketrong/tpotexp/env/lib/python3.10/site-packages/sklearn/neighbors/_classification.py", line 238, in fit
    return self._fit(X, y)
  File "/common/ketrong/tpotexp/env/lib/python3.10/site-packages/sklearn/neighbors/_base.py", line 475, in _fit
    X, y = self._validate_data(
  File "/common/ketrong/tpotexp/env/lib/python3.10/site-packages/sklearn/base.py", line 650, in _validate_data
    X, y = check_X_y(X, y, **check_params)
  File "/common/ketrong/tpotexp/env/lib/python3.10/site-packages/sklearn/utils/validation.py", line 1301, in check_X_y
    X = check_array(
  File "/common/ketrong/tpotexp/env/lib/python3.10/site-packages/sklearn/utils/validation.py", line 1064, in check_array
    _assert_all_finite(
  File "/common/ketrong/tpotexp/env/lib/python3.10/site-packages/sklearn/utils/validation.py", line 123, in _assert_all_finite
    _assert_all_finite_element_wise(
  File "/common/ketrong/tpotexp/env/lib/python3.10/site-packages/sklearn/utils/validation.py", line 172, in _assert_all_finite_element_wise
    raise ValueError(msg_err)
ValueError: Input X contains NaN.
KNeighborsClassifier does not accept missing values encoded as NaN natively. For supervised learning, you might want to consider sklearn.ensemble.HistGradientBoostingClassifier and Regressor which accept missing values encoded as NaNs natively. Alternatively, it is possible to preprocess the data, for instance by using an imputer transformer in a pipeline or drop samples with missing values. See https://scikit-learn.org/stable/modules/impute.html You can find a list of all estimators that handle NaN values at the following page: https://scikit-learn.org/stable/modules/impute.html#estimators-that-handle-nan-values

Generation:  5
Best f1_score score: 0.7900979261461304
Generation:  20%|██        | 5/25 [31:26<1:58:30, 355.53s/it]WARNING THIS INDIVIDUAL CAUSED AND EXCEPTION 
 <tpot2.search_spaces.pipelines.sequential.SequentialPipelineIndividual object at 0x155467a40970> 
 Input X contains NaN.
ExtraTreesClassifier does not accept missing values encoded as NaN natively. For supervised learning, you might want to consider sklearn.ensemble.HistGradientBoostingClassifier and Regressor which accept missing values encoded as NaNs natively. Alternatively, it is possible to preprocess the data, for instance by using an imputer transformer in a pipeline or drop samples with missing values. See https://scikit-learn.org/stable/modules/impute.html You can find a list of all estimators that handle NaN values at the following page: https://scikit-learn.org/stable/modules/impute.html#estimators-that-handle-nan-values 
 Traceback (most recent call last):
  File "/common/ketrong/tpotexp/tpot2/tpot2/utils/eval_utils.py", line 53, in objective_nan_wrapper
    value = func_timeout.func_timeout(timeout, objective_function, args=[individual], kwargs=objective_kwargs)
  File "/common/ketrong/tpotexp/env/lib/python3.10/site-packages/func_timeout/dafunc.py", line 108, in func_timeout
    raise_exception(exception)
  File "/common/ketrong/tpotexp/env/lib/python3.10/site-packages/func_timeout/py3_raise.py", line 7, in raise_exception
    raise exception[0] from None
  File "/common/ketrong/tpotexp/tpot2/tpot2/tpot_estimator/estimator.py", line 623, in objective_function
    return objective_function_generator(
  File "/common/ketrong/tpotexp/tpot2/tpot2/tpot_estimator/estimator_utils.py", line 55, in objective_function_generator
    cv_obj_scores = cross_val_score_objective(sklearn.base.clone(pipeline),x,y,scorers=scorers, cv=cv , fold=step)
  File "/common/ketrong/tpotexp/tpot2/tpot2/tpot_estimator/cross_val_utils.py", line 28, in cross_val_score_objective
    this_fold_pipeline.fit(X_train,y_train)
  File "/common/ketrong/tpotexp/env/lib/python3.10/site-packages/sklearn/base.py", line 1473, in wrapper
    return fit_method(estimator, *args, **kwargs)
  File "/common/ketrong/tpotexp/env/lib/python3.10/site-packages/sklearn/pipeline.py", line 473, in fit
    self._final_estimator.fit(Xt, y, **last_step_params["fit"])
  File "/common/ketrong/tpotexp/env/lib/python3.10/site-packages/sklearn/base.py", line 1473, in wrapper
    return fit_method(estimator, *args, **kwargs)
  File "/common/ketrong/tpotexp/env/lib/python3.10/site-packages/sklearn/ensemble/_forest.py", line 377, in fit
    estimator._compute_missing_values_in_feature_mask(
  File "/common/ketrong/tpotexp/env/lib/python3.10/site-packages/sklearn/tree/_classes.py", line 214, in _compute_missing_values_in_feature_mask
    assert_all_finite(X, **common_kwargs)
  File "/common/ketrong/tpotexp/env/lib/python3.10/site-packages/sklearn/utils/validation.py", line 213, in assert_all_finite
    _assert_all_finite(
  File "/common/ketrong/tpotexp/env/lib/python3.10/site-packages/sklearn/utils/validation.py", line 123, in _assert_all_finite
    _assert_all_finite_element_wise(
  File "/common/ketrong/tpotexp/env/lib/python3.10/site-packages/sklearn/utils/validation.py", line 172, in _assert_all_finite_element_wise
    raise ValueError(msg_err)
ValueError: Input X contains NaN.
ExtraTreesClassifier does not accept missing values encoded as NaN natively. For supervised learning, you might want to consider sklearn.ensemble.HistGradientBoostingClassifier and