[I 2024-09-21 11:32:25,662] Trial 164 finished with value: 0.11847536246868628 and parameters: {'model_name': 'GAIN', 'batch_size': 3, 'hint_rate': 0.05715317610758491, 'alpha': 100, 'iterations': 20, 'learning_rate': 0.008671965161421828, 'p_miss': 0.25143042824166306}. Best is trial 52 with value: 0.07008405044821016.
running
[I 2024-09-21 11:37:28,806] Trial 146 finished with value: 0.07144975802746564 and parameters: {'model_name': 'IterativeImputer', 'estimator': 'RFR', 'initial_strategy': 'median', 'n_nearest_features': 21, 'imputation_order': 'roman'}. Best is trial 52 with value: 0.07008405044821016.
running
[I 2024-09-21 11:43:17,066] Trial 147 finished with value: 0.07133164948598766 and parameters: {'model_name': 'IterativeImputer', 'estimator': 'RFR', 'initial_strategy': 'median', 'n_nearest_features': 21, 'imputation_order': 'roman'}. Best is trial 52 with value: 0.07008405044821016.
running
[I 2024-09-21 11:49:21,086] Trial 148 finished with value: 0.0709190532645042 and parameters: {'model_name': 'IterativeImputer', 'estimator': 'RFR', 'initial_strategy': 'most_frequent', 'n_nearest_features': 21, 'imputation_order': 'roman'}. Best is trial 52 with value: 0.07008405044821016.
running
[I 2024-09-21 11:55:33,608] Trial 149 finished with value: 0.07069207214246173 and parameters: {'model_name': 'IterativeImputer', 'estimator': 'RFR', 'initial_strategy': 'most_frequent', 'n_nearest_features': 21, 'imputation_order': 'ascending'}. Best is trial 52 with value: 0.07008405044821016.
running
[I 2024-09-21 12:02:12,676] Trial 150 finished with value: 0.0713219920140363 and parameters: {'model_name': 'IterativeImputer', 'estimator': 'RFR', 'initial_strategy': 'most_frequent', 'n_nearest_features': 21, 'imputation_order': 'ascending'}. Best is trial 52 with value: 0.07008405044821016.
running
[I 2024-09-21 12:03:29,772] Trial 152 finished with value: 0.07106682558927759 and parameters: {'model_name': 'IterativeImputer', 'estimator': 'RFR', 'initial_strategy': 'most_frequent', 'n_nearest_features': 21, 'imputation_order': 'ascending'}. Best is trial 52 with value: 0.07008405044821016.
running
[I 2024-09-21 12:03:53,812] Trial 151 finished with value: 0.07103023495682667 and parameters: {'model_name': 'IterativeImputer', 'estimator': 'RFR', 'initial_strategy': 'most_frequent', 'n_nearest_features': 21, 'imputation_order': 'ascending'}. Best is trial 52 with value: 0.07008405044821016.
running
[I 2024-09-21 12:03:56,463] Trial 172 finished with value: 0.08208018388346952 and parameters: {'model_name': 'KNNImputer', 'n_neighbors': 1804, 'weights': 'uniform'}. Best is trial 52 with value: 0.07008405044821016.
running
[I 2024-09-21 12:08:03,467] Trial 154 finished with value: 0.07078260516379982 and parameters: {'model_name': 'IterativeImputer', 'estimator': 'RFR', 'initial_strategy': 'most_frequent', 'n_nearest_features': 21, 'imputation_order': 'ascending'}. Best is trial 52 with value: 0.07008405044821016.
running
[I 2024-09-21 12:09:36,170] Trial 155 finished with value: 0.07097949487773604 and parameters: {'model_name': 'IterativeImputer', 'estimator': 'RFR', 'initial_strategy': 'most_frequent', 'n_nearest_features': 21, 'imputation_order': 'ascending'}. Best is trial 52 with value: 0.07008405044821016.
running
[I 2024-09-21 12:10:03,681] Trial 156 finished with value: 0.07067540224231715 and parameters: {'model_name': 'IterativeImputer', 'estimator': 'RFR', 'initial_strategy': 'most_frequent', 'n_nearest_features': 21, 'imputation_order': 'ascending'}. Best is trial 52 with value: 0.07008405044821016.
running
[I 2024-09-21 12:12:47,497] Trial 161 finished with value: 0.07391344883939172 and parameters: {'model_name': 'IterativeImputer', 'estimator': 'RFR', 'initial_strategy': 'most_frequent', 'n_nearest_features': 11, 'imputation_order': 'ascending'}. Best is trial 52 with value: 0.07008405044821016.
running
[I 2024-09-21 12:16:05,756] Trial 157 finished with value: 0.0714576444033514 and parameters: {'model_name': 'IterativeImputer', 'estimator': 'RFR', 'initial_strategy': 'most_frequent', 'n_nearest_features': 21, 'imputation_order': 'ascending'}. Best is trial 52 with value: 0.07008405044821016.
running
[I 2024-09-21 12:39:16,733] Trial 169 finished with value: 0.07168282186047156 and parameters: {'model_name': 'IterativeImputer', 'estimator': 'RFR', 'initial_strategy': 'most_frequent', 'n_nearest_features': 10, 'imputation_order': 'ascending'}. Best is trial 52 with value: 0.07008405044821016.
running
[I 2024-09-21 12:46:59,953] Trial 158 finished with value: 0.07102066047749671 and parameters: {'model_name': 'IterativeImputer', 'estimator': 'RFR', 'initial_strategy': 'most_frequent', 'n_nearest_features': 21, 'imputation_order': 'ascending'}. Best is trial 52 with value: 0.07008405044821016.
running
[I 2024-09-21 12:50:33,305] Trial 159 finished with value: 0.07069126687440755 and parameters: {'model_name': 'IterativeImputer', 'estimator': 'RFR', 'initial_strategy': 'most_frequent', 'n_nearest_features': 21, 'imputation_order': 'ascending'}. Best is trial 52 with value: 0.07008405044821016.
running
[I 2024-09-21 12:52:58,560] Trial 163 finished with value: 0.070918341382991 and parameters: {'model_name': 'IterativeImputer', 'estimator': 'RFR', 'initial_strategy': 'most_frequent', 'n_nearest_features': 21, 'imputation_order': 'roman'}. Best is trial 52 with value: 0.07008405044821016.
running
[I 2024-09-21 12:59:27,205] Trial 165 finished with value: 0.07099362874556459 and parameters: {'model_name': 'IterativeImputer', 'estimator': 'RFR', 'initial_strategy': 'most_frequent', 'n_nearest_features': 21, 'imputation_order': 'ascending'}. Best is trial 52 with value: 0.07008405044821016.
running
[I 2024-09-21 12:59:27,444] Trial 183 finished with value: 0.12154076887083318 and parameters: {'model_name': 'SimpleImputer', 'strategy': 'constant'}. Best is trial 52 with value: 0.07008405044821016.
running
[I 2024-09-21 12:59:38,830] Trial 184 finished with value: 0.0761966055196315 and parameters: {'model_name': 'IterativeImputer', 'estimator': 'Ridge', 'initial_strategy': 'most_frequent', 'n_nearest_features': 20, 'imputation_order': 'ascending'}. Best is trial 52 with value: 0.07008405044821016.
running
[I 2024-09-21 13:04:42,624] Trial 166 finished with value: 0.07098191249646754 and parameters: {'model_name': 'IterativeImputer', 'estimator': 'RFR', 'initial_strategy': 'most_frequent', 'n_nearest_features': 21, 'imputation_order': 'ascending'}. Best is trial 52 with value: 0.07008405044821016.
running
[I 2024-09-21 13:10:47,368] Trial 167 finished with value: 0.07158231972121872 and parameters: {'model_name': 'IterativeImputer', 'estimator': 'RFR', 'initial_strategy': 'most_frequent', 'n_nearest_features': 20, 'imputation_order': 'ascending'}. Best is trial 52 with value: 0.07008405044821016.
running
[I 2024-09-21 13:16:48,649] Trial 168 finished with value: 0.07091064402937183 and parameters: {'model_name': 'IterativeImputer', 'estimator': 'RFR', 'initial_strategy': 'most_frequent', 'n_nearest_features': 20, 'imputation_order': 'ascending'}. Best is trial 52 with value: 0.07008405044821016.
running
[I 2024-09-21 13:29:50,145] Trial 170 finished with value: 0.07108540736724225 and parameters: {'model_name': 'IterativeImputer', 'estimator': 'RFR', 'initial_strategy': 'most_frequent', 'n_nearest_features': 20, 'imputation_order': 'ascending'}. Best is trial 52 with value: 0.07008405044821016.
running
[I 2024-09-21 13:31:02,403] Trial 171 finished with value: 0.07107892737900649 and parameters: {'model_name': 'IterativeImputer', 'estimator': 'RFR', 'initial_strategy': 'most_frequent', 'n_nearest_features': 20, 'imputation_order': 'ascending'}. Best is trial 52 with value: 0.07008405044821016.
running
[I 2024-09-21 13:31:17,838] Trial 173 finished with value: 0.07104012476562646 and parameters: {'model_name': 'IterativeImputer', 'estimator': 'RFR', 'initial_strategy': 'most_frequent', 'n_nearest_features': 20, 'imputation_order': 'ascending'}. Best is trial 52 with value: 0.07008405044821016.
running
[I 2024-09-21 13:35:36,005] Trial 174 finished with value: 0.07094229023781551 and parameters: {'model_name': 'IterativeImputer', 'estimator': 'RFR', 'initial_strategy': 'most_frequent', 'n_nearest_features': 20, 'imputation_order': 'ascending'}. Best is trial 52 with value: 0.07008405044821016.
running
[I 2024-09-21 13:37:03,305] Trial 175 finished with value: 0.07121610940130911 and parameters: {'model_name': 'IterativeImputer', 'estimator': 'RFR', 'initial_strategy': 'most_frequent', 'n_nearest_features': 20, 'imputation_order': 'ascending'}. Best is trial 52 with value: 0.07008405044821016.
running
[I 2024-09-21 13:37:30,260] Trial 176 finished with value: 0.07085408097342279 and parameters: {'model_name': 'IterativeImputer', 'estimator': 'RFR', 'initial_strategy': 'most_frequent', 'n_nearest_features': 20, 'imputation_order': 'ascending'}. Best is trial 52 with value: 0.07008405044821016.
running
[I 2024-09-21 13:37:53,165] Trial 194 finished with value: 0.07917519266797561 and parameters: {'model_name': 'IterativeImputer', 'estimator': 'KNN', 'initial_strategy': 'most_frequent', 'n_nearest_features': 19, 'imputation_order': 'random'}. Best is trial 52 with value: 0.07008405044821016.
running
[I 2024-09-21 13:40:53,774] Trial 177 finished with value: 0.07114451668101071 and parameters: {'model_name': 'IterativeImputer', 'estimator': 'RFR', 'initial_strategy': 'most_frequent', 'n_nearest_features': 20, 'imputation_order': 'ascending'}. Best is trial 52 with value: 0.07008405044821016.
running
[I 2024-09-21 13:41:14,909] Trial 195 finished with value: 0.08058275456182426 and parameters: {'model_name': 'VAE', 'batch_size': 21, 'iterations': 1131, 'learning_rate': 0.029206920944147226, 'p_miss': 0.16988435213525865}. Best is trial 52 with value: 0.07008405044821016.
running
[I 2024-09-21 13:41:18,858] Trial 193 finished with value: 0.08025462218987964 and parameters: {'model_name': 'VAE', 'batch_size': 33, 'iterations': 1706, 'learning_rate': 0.030133130581003913, 'p_miss': 0.1690815880221095}. Best is trial 52 with value: 0.07008405044821016.
running
[I 2024-09-21 13:44:02,221] Trial 178 finished with value: 0.0705867959356327 and parameters: {'model_name': 'IterativeImputer', 'estimator': 'RFR', 'initial_strategy': 'most_frequent', 'n_nearest_features': 20, 'imputation_order': 'ascending'}. Best is trial 52 with value: 0.07008405044821016.
running
[I 2024-09-21 13:46:06,911] Trial 199 finished with value: 0.10486787049653938 and parameters: {'model_name': 'IterativeImputer', 'estimator': 'Bayesian', 'initial_strategy': 'most_frequent', 'n_nearest_features': 19, 'imputation_order': 'roman', 'sample_posterior': True}. Best is trial 52 with value: 0.07008405044821016.
[I 2024-09-21 14:08:41,746] Trial 179 finished with value: 0.07097131729952769 and parameters: {'model_name': 'IterativeImputer', 'estimator': 'RFR', 'initial_strategy': 'most_frequent', 'n_nearest_features': 20, 'imputation_order': 'ascending'}. Best is trial 52 with value: 0.07008405044821016.
[I 2024-09-21 14:17:03,240] Trial 180 finished with value: 0.0715263962500122 and parameters: {'model_name': 'IterativeImputer', 'estimator': 'RFR', 'initial_strategy': 'most_frequent', 'n_nearest_features': 20, 'imputation_order': 'ascending'}. Best is trial 52 with value: 0.07008405044821016.
[I 2024-09-21 14:19:54,601] Trial 181 finished with value: 0.0710913513908524 and parameters: {'model_name': 'IterativeImputer', 'estimator': 'RFR', 'initial_strategy': 'most_frequent', 'n_nearest_features': 20, 'imputation_order': 'roman'}. Best is trial 52 with value: 0.07008405044821016.
[I 2024-09-21 14:22:16,521] Trial 182 finished with value: 0.07094414472638846 and parameters: {'model_name': 'IterativeImputer', 'estimator': 'RFR', 'initial_strategy': 'most_frequent', 'n_nearest_features': 20, 'imputation_order': 'ascending'}. Best is trial 52 with value: 0.07008405044821016.
[I 2024-09-21 14:28:34,432] Trial 185 finished with value: 0.07173477576460527 and parameters: {'model_name': 'IterativeImputer', 'estimator': 'RFR', 'initial_strategy': 'most_frequent', 'n_nearest_features': 20, 'imputation_order': 'roman'}. Best is trial 52 with value: 0.07008405044821016.
[I 2024-09-21 14:33:53,783] Trial 186 finished with value: 0.07086287215256473 and parameters: {'model_name': 'IterativeImputer', 'estimator': 'RFR', 'initial_strategy': 'most_frequent', 'n_nearest_features': 20, 'imputation_order': 'ascending'}. Best is trial 52 with value: 0.07008405044821016.
[I 2024-09-21 14:39:02,463] Trial 187 finished with value: 0.07088702514725205 and parameters: {'model_name': 'IterativeImputer', 'estimator': 'RFR', 'initial_strategy': 'most_frequent', 'n_nearest_features': 20, 'imputation_order': 'ascending'}. Best is trial 52 with value: 0.07008405044821016.
[I 2024-09-21 14:44:57,037] Trial 188 finished with value: 0.07104785426543234 and parameters: {'model_name': 'IterativeImputer', 'estimator': 'RFR', 'initial_strategy': 'most_frequent', 'n_nearest_features': 20, 'imputation_order': 'ascending'}. Best is trial 52 with value: 0.07008405044821016.
[I 2024-09-21 14:55:02,595] Trial 190 finished with value: 0.07075211738356389 and parameters: {'model_name': 'IterativeImputer', 'estimator': 'RFR', 'initial_strategy': 'most_frequent', 'n_nearest_features': 19, 'imputation_order': 'roman'}. Best is trial 52 with value: 0.07008405044821016.
[I 2024-09-21 14:55:04,964] Trial 191 finished with value: 0.07115574103275416 and parameters: {'model_name': 'IterativeImputer', 'estimator': 'RFR', 'initial_strategy': 'most_frequent', 'n_nearest_features': 19, 'imputation_order': 'random'}. Best is trial 52 with value: 0.07008405044821016.
[I 2024-09-21 14:57:35,038] Trial 189 finished with value: 0.07097149921811378 and parameters: {'model_name': 'IterativeImputer', 'estimator': 'RFR', 'initial_strategy': 'most_frequent', 'n_nearest_features': 20, 'imputation_order': 'roman'}. Best is trial 52 with value: 0.07008405044821016.
[I 2024-09-21 14:59:19,856] Trial 192 finished with value: 0.07061645123180278 and parameters: {'model_name': 'IterativeImputer', 'estimator': 'RFR', 'initial_strategy': 'most_frequent', 'n_nearest_features': 19, 'imputation_order': 'random'}. Best is trial 52 with value: 0.07008405044821016.
[I 2024-09-21 15:03:55,324] Trial 196 finished with value: 0.0707789472281418 and parameters: {'model_name': 'IterativeImputer', 'estimator': 'RFR', 'initial_strategy': 'most_frequent', 'n_nearest_features': 19, 'imputation_order': 'roman'}. Best is trial 52 with value: 0.07008405044821016.
[I 2024-09-21 15:04:20,814] Trial 197 finished with value: 0.07030399566220384 and parameters: {'model_name': 'IterativeImputer', 'estimator': 'RFR', 'initial_strategy': 'most_frequent', 'n_nearest_features': 19, 'imputation_order': 'roman'}. Best is trial 52 with value: 0.07008405044821016.
