Run: 53
/cm/local/apps/slurm/var/spool/job986188/slurm_script: line 26: 
pip install -e tpot2
pip install -r tpot2/ImputerExperiments/requirements_.txt
: No such file or directory
RunStart
Version 0.1.7a0 of tpot2 is outdated. Version 0.1.8a0 was released Tuesday September 17, 2024.
starting loops
../data/r/1213/1213.pkl
working on 
../data/r/1213/reg_full_MAR_0.01_3
4.558881044387817
running experiment 1/3 - Does large hyperparameter space improve reconstruction accuracy over simple
[I 2024-10-02 22:23:44,045] A new study created in memory with name: no-name-b3a4191c-8775-4289-ac24-4bd4f056a6c5
running
running
running
running
running
running
running
running
running
running
running
running
running
running
running
running
[I 2024-10-02 22:23:44,518] Trial 4 finished with value: 0.6256316969977391 and parameters: {'model_name': 'SimpleImputer', 'strategy': 'constant'}. Best is trial 4 with value: 0.6256316969977391.
running
[I 2024-10-02 22:23:44,855] Trial 5 finished with value: 0.6256316969977391 and parameters: {'model_name': 'SimpleImputer', 'strategy': 'constant'}. Best is trial 4 with value: 0.6256316969977391.
running
[I 2024-10-02 22:23:45,445] Trial 0 finished with value: 0.44122934902377714 and parameters: {'model_name': 'SimpleImputer', 'strategy': 'median'}. Best is trial 0 with value: 0.44122934902377714.
running
[I 2024-10-02 22:23:45,887] Trial 16 finished with value: 0.37415655166039297 and parameters: {'model_name': 'SimpleImputer', 'strategy': 'mean'}. Best is trial 16 with value: 0.37415655166039297.
running
[I 2024-10-02 22:23:46,457] Trial 2 finished with value: 0.4756937412282639 and parameters: {'model_name': 'SimpleImputer', 'strategy': 'most_frequent'}. Best is trial 16 with value: 0.37415655166039297.
running
[I 2024-10-02 22:24:02,832] Trial 13 finished with value: 0.3979555937671486 and parameters: {'model_name': 'VAE', 'batch_size': 8, 'iterations': 2, 'learning_rate': 0.01756186608492375, 'p_miss': 0.05724658284035339}. Best is trial 16 with value: 0.37415655166039297.
running
[I 2024-10-02 22:24:08,363] Trial 6 finished with value: 0.40801837639304817 and parameters: {'model_name': 'VAE', 'batch_size': 228, 'iterations': 4, 'learning_rate': 0.0002824283204019878, 'p_miss': 0.1635067956290408}. Best is trial 16 with value: 0.37415655166039297.
running
[I 2024-10-02 22:24:08,634] Trial 9 finished with value: 0.6085325146851515 and parameters: {'model_name': 'GAIN', 'batch_size': 109, 'hint_rate': 0.7504188810457609, 'alpha': 12, 'iterations': 8, 'learning_rate': 0.010332200726949856, 'p_miss': 0.04434861162321951}. Best is trial 16 with value: 0.37415655166039297.
running
[I 2024-10-02 22:24:34,864] Trial 12 finished with value: 0.41028637330796797 and parameters: {'model_name': 'VAE', 'batch_size': 8, 'iterations': 24, 'learning_rate': 0.000116727799789196, 'p_miss': 0.23419618656652413}. Best is trial 16 with value: 0.37415655166039297.
running
[I 2024-10-02 22:24:37,338] Trial 20 finished with value: 0.6093964832237856 and parameters: {'model_name': 'GAIN', 'batch_size': 43, 'hint_rate': 0.9757611571574469, 'alpha': 7, 'iterations': 40, 'learning_rate': 0.0007749924204466009, 'p_miss': 0.04146139844616818}. Best is trial 16 with value: 0.37415655166039297.
running
[I 2024-10-02 22:24:39,078] Trial 21 finished with value: 0.3606670881646944 and parameters: {'model_name': 'IterativeImputer', 'estimator': 'Ridge', 'initial_strategy': 'median', 'n_nearest_features': 10, 'imputation_order': 'descending'}. Best is trial 21 with value: 0.3606670881646944.
running
[I 2024-10-02 22:25:03,771] Trial 3 finished with value: 0.37415655166039297 and parameters: {'model_name': 'KNNImputer', 'n_neighbors': 60885, 'weights': 'uniform'}. Best is trial 21 with value: 0.3606670881646944.
running
[I 2024-10-02 22:25:05,679] Trial 15 finished with value: 0.3927685452544015 and parameters: {'model_name': 'IterativeImputer', 'estimator': 'KNN', 'initial_strategy': 'median', 'n_nearest_features': 2, 'imputation_order': 'random'}. Best is trial 21 with value: 0.3606670881646944.
running
[I 2024-10-02 22:25:16,883] Trial 26 finished with value: 0.3606670881646944 and parameters: {'model_name': 'IterativeImputer', 'estimator': 'Ridge', 'initial_strategy': 'median', 'n_nearest_features': 10, 'imputation_order': 'descending'}. Best is trial 21 with value: 0.3606670881646944.
running
[I 2024-10-02 22:25:39,331] Trial 27 finished with value: 0.3606670881646944 and parameters: {'model_name': 'IterativeImputer', 'estimator': 'Ridge', 'initial_strategy': 'median', 'n_nearest_features': 10, 'imputation_order': 'descending'}. Best is trial 21 with value: 0.3606670881646944.
running
[I 2024-10-02 22:25:46,331] Trial 22 finished with value: 0.37242608376824 and parameters: {'model_name': 'KNNImputer', 'n_neighbors': 38231, 'weights': 'uniform'}. Best is trial 21 with value: 0.3606670881646944.
running
[I 2024-10-02 22:25:53,354] Trial 23 finished with value: 0.37224097185035765 and parameters: {'model_name': 'KNNImputer', 'n_neighbors': 55168, 'weights': 'distance'}. Best is trial 21 with value: 0.3606670881646944.
running
[I 2024-10-02 22:25:53,741] Trial 29 finished with value: 0.3606670881646944 and parameters: {'model_name': 'IterativeImputer', 'estimator': 'Ridge', 'initial_strategy': 'median', 'n_nearest_features': 10, 'imputation_order': 'descending'}. Best is trial 21 with value: 0.3606670881646944.
running
[I 2024-10-02 22:26:08,187] Trial 25 finished with value: 0.3709453676760278 and parameters: {'model_name': 'KNNImputer', 'n_neighbors': 27626, 'weights': 'uniform'}. Best is trial 21 with value: 0.3606670881646944.
running
[I 2024-10-02 22:26:10,825] Trial 1 finished with value: 0.36065050582948033 and parameters: {'model_name': 'IterativeImputer', 'estimator': 'Bayesian', 'initial_strategy': 'mean', 'n_nearest_features': 5, 'imputation_order': 'ascending', 'sample_posterior': False}. Best is trial 1 with value: 0.36065050582948033.
running
[I 2024-10-02 22:26:11,979] Trial 14 finished with value: 0.38868638385170123 and parameters: {'model_name': 'IterativeImputer', 'estimator': 'KNN', 'initial_strategy': 'constant', 'n_nearest_features': 7, 'imputation_order': 'arabic'}. Best is trial 1 with value: 0.36065050582948033.
running
[I 2024-10-02 22:26:13,341] Trial 30 finished with value: 0.3606670881646944 and parameters: {'model_name': 'IterativeImputer', 'estimator': 'Ridge', 'initial_strategy': 'median', 'n_nearest_features': 10, 'imputation_order': 'descending'}. Best is trial 1 with value: 0.36065050582948033.
running
[I 2024-10-02 22:26:19,232] Trial 31 finished with value: 0.3606670881646944 and parameters: {'model_name': 'IterativeImputer', 'estimator': 'Ridge', 'initial_strategy': 'median', 'n_nearest_features': 10, 'imputation_order': 'descending'}. Best is trial 1 with value: 0.36065050582948033.
running
[I 2024-10-02 22:26:22,883] Trial 32 finished with value: 0.3606670881646944 and parameters: {'model_name': 'IterativeImputer', 'estimator': 'Ridge', 'initial_strategy': 'median', 'n_nearest_features': 10, 'imputation_order': 'descending'}. Best is trial 1 with value: 0.36065050582948033.
running
[I 2024-10-02 22:26:24,680] Trial 28 finished with value: 0.37415655166039297 and parameters: {'model_name': 'KNNImputer', 'n_neighbors': 62916, 'weights': 'uniform'}. Best is trial 1 with value: 0.36065050582948033.
running
[I 2024-10-02 22:26:37,405] Trial 7 finished with value: 0.5136881243720235 and parameters: {'model_name': 'IterativeImputer', 'estimator': 'Bayesian', 'initial_strategy': 'most_frequent', 'n_nearest_features': 8, 'imputation_order': 'random', 'sample_posterior': True}. Best is trial 1 with value: 0.36065050582948033.
running
[I 2024-10-02 22:26:46,429] Trial 33 finished with value: 0.36065005384601234 and parameters: {'model_name': 'IterativeImputer', 'estimator': 'Ridge', 'initial_strategy': 'mean', 'n_nearest_features': 8, 'imputation_order': 'ascending'}. Best is trial 33 with value: 0.36065005384601234.
running
[I 2024-10-02 22:26:54,165] Trial 34 finished with value: 0.36066944361677894 and parameters: {'model_name': 'IterativeImputer', 'estimator': 'Ridge', 'initial_strategy': 'most_frequent', 'n_nearest_features': 8, 'imputation_order': 'ascending'}. Best is trial 33 with value: 0.36065005384601234.
running
[I 2024-10-02 22:26:55,455] Trial 8 finished with value: 0.388332457845487 and parameters: {'model_name': 'VAE', 'batch_size': 4, 'iterations': 135, 'learning_rate': 0.008317631274544915, 'p_miss': 0.1503151523074275}. Best is trial 33 with value: 0.36065005384601234.
running
[I 2024-10-02 22:27:23,216] Trial 36 finished with value: 0.36065050582948033 and parameters: {'model_name': 'IterativeImputer', 'estimator': 'Bayesian', 'initial_strategy': 'mean', 'n_nearest_features': 5, 'imputation_order': 'ascending', 'sample_posterior': False}. Best is trial 33 with value: 0.36065005384601234.
running
[I 2024-10-02 22:27:25,107] Trial 37 finished with value: 0.36065050582948033 and parameters: {'model_name': 'IterativeImputer', 'estimator': 'Bayesian', 'initial_strategy': 'mean', 'n_nearest_features': 5, 'imputation_order': 'ascending', 'sample_posterior': False}. Best is trial 33 with value: 0.36065005384601234.
running
[I 2024-10-02 22:27:25,833] Trial 35 finished with value: 0.36065050582948033 and parameters: {'model_name': 'IterativeImputer', 'estimator': 'Bayesian', 'initial_strategy': 'mean', 'n_nearest_features': 5, 'imputation_order': 'ascending', 'sample_posterior': False}. Best is trial 33 with value: 0.36065005384601234.
running
[I 2024-10-02 22:27:27,418] Trial 38 finished with value: 0.36065050582948033 and parameters: {'model_name': 'IterativeImputer', 'estimator': 'Bayesian', 'initial_strategy': 'mean', 'n_nearest_features': 5, 'imputation_order': 'ascending', 'sample_posterior': False}. Best is trial 33 with value: 0.36065005384601234.
running
[I 2024-10-02 22:27:30,114] Trial 17 finished with value: 0.596849332209972 and parameters: {'model_name': 'GAIN', 'batch_size': 10, 'hint_rate': 0.8427869174308302, 'alpha': 27, 'iterations': 333, 'learning_rate': 0.0009980813504043384, 'p_miss': 0.13398740499091347}. Best is trial 33 with value: 0.36065005384601234.
running
[I 2024-10-02 22:27:30,827] Trial 40 finished with value: 0.36065050582948033 and parameters: {'model_name': 'IterativeImputer', 'estimator': 'Bayesian', 'initial_strategy': 'mean', 'n_nearest_features': 5, 'imputation_order': 'ascending', 'sample_posterior': False}. Best is trial 33 with value: 0.36065005384601234.
running
[I 2024-10-02 22:27:31,536] Trial 39 finished with value: 0.36065050582948033 and parameters: {'model_name': 'IterativeImputer', 'estimator': 'Bayesian', 'initial_strategy': 'mean', 'n_nearest_features': 5, 'imputation_order': 'ascending', 'sample_posterior': False}. Best is trial 33 with value: 0.36065005384601234.
running
[I 2024-10-02 22:27:32,061] Trial 51 finished with value: 0.37415655166039297 and parameters: {'model_name': 'SimpleImputer', 'strategy': 'mean'}. Best is trial 33 with value: 0.36065005384601234.
running
[I 2024-10-02 22:27:39,647] Trial 42 finished with value: 0.3605981998518632 and parameters: {'model_name': 'IterativeImputer', 'estimator': 'Bayesian', 'initial_strategy': 'mean', 'n_nearest_features': 4, 'imputation_order': 'ascending', 'sample_posterior': False}. Best is trial 42 with value: 0.3605981998518632.
running
[I 2024-10-02 22:28:04,797] Trial 49 finished with value: 0.36071348186644503 and parameters: {'model_name': 'IterativeImputer', 'estimator': 'Bayesian', 'initial_strategy': 'mean', 'n_nearest_features': 3, 'imputation_order': 'ascending', 'sample_posterior': False}. Best is trial 42 with value: 0.3605981998518632.
running
[I 2024-10-02 22:28:06,034] Trial 47 finished with value: 0.3605981998518632 and parameters: {'model_name': 'IterativeImputer', 'estimator': 'Bayesian', 'initial_strategy': 'mean', 'n_nearest_features': 4, 'imputation_order': 'ascending', 'sample_posterior': False}. Best is trial 42 with value: 0.3605981998518632.
running
[I 2024-10-02 22:28:06,639] Trial 46 finished with value: 0.3605981998518632 and parameters: {'model_name': 'IterativeImputer', 'estimator': 'Bayesian', 'initial_strategy': 'mean', 'n_nearest_features': 4, 'imputation_order': 'ascending', 'sample_posterior': False}. Best is trial 42 with value: 0.3605981998518632.
running
[I 2024-10-02 22:37:10,966] Trial 44 finished with value: inf and parameters: {'model_name': 'GAIN', 'batch_size': 1, 'hint_rate': 0.013667624728308625, 'alpha': 100, 'iterations': 5201, 'learning_rate': 0.08996052065636363, 'p_miss': 0.28444567784167796}. Best is trial 42 with value: 0.3605981998518632.
running
[I 2024-10-02 22:41:58,015] Trial 10 finished with value: 0.6181727461307165 and parameters: {'model_name': 'GAIN', 'batch_size': 30, 'hint_rate': 0.18377367628017285, 'alpha': 66, 'iterations': 1759, 'learning_rate': 0.0025498973865780094, 'p_miss': 0.09320195741491151}. Best is trial 42 with value: 0.3605981998518632.
running
[I 2024-10-02 22:42:19,367] Trial 18 finished with value: 0.6088273720779884 and parameters: {'model_name': 'GAIN', 'batch_size': 448, 'hint_rate': 0.10139919501633034, 'alpha': 91, 'iterations': 1442, 'learning_rate': 0.00012139079935328188, 'p_miss': 0.08750761354332348}. Best is trial 42 with value: 0.3605981998518632.
running
[I 2024-10-02 22:43:24,569] Trial 55 finished with value: inf and parameters: {'model_name': 'GAIN', 'batch_size': 1, 'hint_rate': 0.10600099451264777, 'alpha': 99, 'iterations': 7258, 'learning_rate': 0.06812284066462822, 'p_miss': 0.2733828700659176}. Best is trial 42 with value: 0.3605981998518632.
running
[I 2024-10-02 22:43:33,153] Trial 45 finished with value: inf and parameters: {'model_name': 'GAIN', 'batch_size': 1, 'hint_rate': 0.011911845273490207, 'alpha': 100, 'iterations': 9001, 'learning_rate': 0.07650675112502392, 'p_miss': 0.29794077821904946}. Best is trial 42 with value: 0.3605981998518632.
running
[I 2024-10-02 22:43:36,237] Trial 61 finished with value: 0.40720547053222944 and parameters: {'model_name': 'VAE', 'batch_size': 775, 'iterations': 1, 'learning_rate': 0.001833395647237616, 'p_miss': 0.21268147970698204}. Best is trial 42 with value: 0.3605981998518632.
running
[I 2024-10-02 22:43:36,674] Trial 62 finished with value: 0.44122934902377714 and parameters: {'model_name': 'SimpleImputer', 'strategy': 'median'}. Best is trial 42 with value: 0.3605981998518632.
running
[I 2024-10-02 22:46:41,732] Trial 54 finished with value: 0.6183044815087422 and parameters: {'model_name': 'GAIN', 'batch_size': 964, 'hint_rate': 0.02322055878977103, 'alpha': 99, 'iterations': 3315, 'learning_rate': 0.06723017130827261, 'p_miss': 0.29418042992416343}. Best is trial 42 with value: 0.3605981998518632.
running
[I 2024-10-02 22:49:36,460] Trial 24 finished with value: 0.44951509739001577 and parameters: {'model_name': 'VAE', 'batch_size': 1, 'iterations': 4210, 'learning_rate': 0.0004342935685904268, 'p_miss': 0.2013150141885212}. Best is trial 42 with value: 0.3605981998518632.
running
[I 2024-10-02 22:49:55,472] Trial 48 finished with value: 0.6195986050360216 and parameters: {'model_name': 'GAIN', 'batch_size': 989, 'hint_rate': 0.021434833873096637, 'alpha': 95, 'iterations': 7913, 'learning_rate': 0.09326552791483081, 'p_miss': 0.2993662017065659}. Best is trial 42 with value: 0.3605981998518632.
running
slurmstepd: error: Detected 1 oom-kill event(s) in StepId=986188.0. Some of your processes may have been killed by the cgroup out-of-memory handler.
srun: error: esplhpc-cp006: task 0: Out Of Memory
slurmstepd: error: Detected 1 oom-kill event(s) in StepId=986188.batch. Some of your processes may have been killed by the cgroup out-of-memory handler.
