[I 2024-11-20 22:46:49,419] Trial 106 finished with value: 0.43223081596941393 and parameters: {'model_name': 'SimpleImputer', 'strategy': 'mean'}. Best is trial 9 with value: 0.43223081596941393.
running
[I 2024-11-20 22:46:49,525] Trial 105 finished with value: 0.43223081596941393 and parameters: {'model_name': 'SimpleImputer', 'strategy': 'mean'}. Best is trial 9 with value: 0.43223081596941393.
[I 2024-11-20 22:46:49,614] Trial 108 finished with value: 0.43223081596941393 and parameters: {'model_name': 'SimpleImputer', 'strategy': 'mean'}. Best is trial 9 with value: 0.43223081596941393.
running
[I 2024-11-20 22:46:49,709] Trial 92 finished with value: 0.5864889703340403 and parameters: {'model_name': 'SimpleImputer', 'strategy': 'median'}. Best is trial 9 with value: 0.43223081596941393.
running
[I 2024-11-20 22:46:49,801] Trial 93 finished with value: 0.5864889703340403 and parameters: {'model_name': 'SimpleImputer', 'strategy': 'median'}. Best is trial 9 with value: 0.43223081596941393.
running
[I 2024-11-20 22:46:49,914] Trial 107 finished with value: 0.43223081596941393 and parameters: {'model_name': 'SimpleImputer', 'strategy': 'mean'}. Best is trial 9 with value: 0.43223081596941393.
running
running
[I 2024-11-20 22:46:50,049] Trial 110 finished with value: 0.43223081596941393 and parameters: {'model_name': 'SimpleImputer', 'strategy': 'mean'}. Best is trial 9 with value: 0.43223081596941393.
running
[I 2024-11-20 22:46:50,190] Trial 109 finished with value: 0.43223081596941393 and parameters: {'model_name': 'SimpleImputer', 'strategy': 'mean'}. Best is trial 9 with value: 0.43223081596941393.
running
[I 2024-11-20 22:46:50,345] Trial 111 finished with value: 0.43223081596941393 and parameters: {'model_name': 'SimpleImputer', 'strategy': 'mean'}. Best is trial 9 with value: 0.43223081596941393.
[I 2024-11-20 22:46:50,363] Trial 114 finished with value: 0.43223081596941393 and parameters: {'model_name': 'SimpleImputer', 'strategy': 'mean'}. Best is trial 9 with value: 0.43223081596941393.
running
running
[I 2024-11-20 22:46:50,646] Trial 112 finished with value: 0.43223081596941393 and parameters: {'model_name': 'SimpleImputer', 'strategy': 'mean'}. Best is trial 9 with value: 0.43223081596941393.
[I 2024-11-20 22:46:50,787] Trial 122 finished with value: 0.43223081596941393 and parameters: {'model_name': 'SimpleImputer', 'strategy': 'mean'}. Best is trial 9 with value: 0.43223081596941393.
[I 2024-11-20 22:46:50,892] Trial 117 finished with value: 0.43223081596941393 and parameters: {'model_name': 'SimpleImputer', 'strategy': 'mean'}. Best is trial 9 with value: 0.43223081596941393.
running
running
[I 2024-11-20 22:46:51,008] Trial 124 finished with value: 0.43223081596941393 and parameters: {'model_name': 'SimpleImputer', 'strategy': 'mean'}. Best is trial 9 with value: 0.43223081596941393.
[I 2024-11-20 22:46:51,101] Trial 118 finished with value: 0.43223081596941393 and parameters: {'model_name': 'SimpleImputer', 'strategy': 'mean'}. Best is trial 9 with value: 0.43223081596941393.
running
running
[I 2024-11-20 22:46:51,207] Trial 115 finished with value: 0.43223081596941393 and parameters: {'model_name': 'SimpleImputer', 'strategy': 'mean'}. Best is trial 9 with value: 0.43223081596941393.
[I 2024-11-20 22:46:51,292] Trial 125 finished with value: 0.43223081596941393 and parameters: {'model_name': 'SimpleImputer', 'strategy': 'mean'}. Best is trial 9 with value: 0.43223081596941393.
running
running
[I 2024-11-20 22:46:51,383] Trial 119 finished with value: 0.43223081596941393 and parameters: {'model_name': 'SimpleImputer', 'strategy': 'mean'}. Best is trial 9 with value: 0.43223081596941393.
running
running
[I 2024-11-20 22:46:51,529] Trial 128 finished with value: 0.43223081596941393 and parameters: {'model_name': 'SimpleImputer', 'strategy': 'mean'}. Best is trial 9 with value: 0.43223081596941393.
[I 2024-11-20 22:46:51,627] Trial 120 finished with value: 0.43223081596941393 and parameters: {'model_name': 'SimpleImputer', 'strategy': 'mean'}. Best is trial 9 with value: 0.43223081596941393.
running
[I 2024-11-20 22:46:51,729] Trial 116 finished with value: 0.43223081596941393 and parameters: {'model_name': 'SimpleImputer', 'strategy': 'mean'}. Best is trial 9 with value: 0.43223081596941393.
running
[I 2024-11-20 22:46:51,831] Trial 126 finished with value: 0.43223081596941393 and parameters: {'model_name': 'SimpleImputer', 'strategy': 'mean'}. Best is trial 9 with value: 0.43223081596941393.
running
running
[I 2024-11-20 22:46:52,005] Trial 113 finished with value: 0.5864889703340403 and parameters: {'model_name': 'SimpleImputer', 'strategy': 'median'}. Best is trial 9 with value: 0.43223081596941393.
[I 2024-11-20 22:46:52,098] Trial 123 finished with value: 0.43223081596941393 and parameters: {'model_name': 'SimpleImputer', 'strategy': 'mean'}. Best is trial 9 with value: 0.43223081596941393.
running
running
[I 2024-11-20 22:46:52,226] Trial 135 finished with value: 0.43223081596941393 and parameters: {'model_name': 'SimpleImputer', 'strategy': 'mean'}. Best is trial 9 with value: 0.43223081596941393.
[I 2024-11-20 22:46:52,332] Trial 121 finished with value: 0.43223081596941393 and parameters: {'model_name': 'SimpleImputer', 'strategy': 'mean'}. Best is trial 9 with value: 0.43223081596941393.
running
running
[I 2024-11-20 22:46:52,517] Trial 127 finished with value: 0.43223081596941393 and parameters: {'model_name': 'SimpleImputer', 'strategy': 'mean'}. Best is trial 9 with value: 0.43223081596941393.
running
[I 2024-11-20 22:46:52,649] Trial 129 finished with value: 0.43223081596941393 and parameters: {'model_name': 'SimpleImputer', 'strategy': 'mean'}. Best is trial 9 with value: 0.43223081596941393.
running
[I 2024-11-20 22:46:52,768] Trial 131 finished with value: 0.43223081596941393 and parameters: {'model_name': 'SimpleImputer', 'strategy': 'mean'}. Best is trial 9 with value: 0.43223081596941393.
running
[I 2024-11-20 22:46:52,890] Trial 136 finished with value: 0.43223081596941393 and parameters: {'model_name': 'SimpleImputer', 'strategy': 'mean'}. Best is trial 9 with value: 0.43223081596941393.
[I 2024-11-20 22:46:53,002] Trial 130 finished with value: 0.43223081596941393 and parameters: {'model_name': 'SimpleImputer', 'strategy': 'mean'}. Best is trial 9 with value: 0.43223081596941393.
running
running
[I 2024-11-20 22:46:53,131] Trial 134 finished with value: 0.43223081596941393 and parameters: {'model_name': 'SimpleImputer', 'strategy': 'mean'}. Best is trial 9 with value: 0.43223081596941393.
running
[I 2024-11-20 22:46:53,262] Trial 141 finished with value: 0.43223081596941393 and parameters: {'model_name': 'SimpleImputer', 'strategy': 'mean'}. Best is trial 9 with value: 0.43223081596941393.
[I 2024-11-20 22:46:53,355] Trial 133 finished with value: 0.43223081596941393 and parameters: {'model_name': 'SimpleImputer', 'strategy': 'mean'}. Best is trial 9 with value: 0.43223081596941393.
running
[I 2024-11-20 22:46:53,442] Trial 139 finished with value: 0.43223081596941393 and parameters: {'model_name': 'SimpleImputer', 'strategy': 'mean'}. Best is trial 9 with value: 0.43223081596941393.
running
[I 2024-11-20 22:46:53,546] Trial 132 finished with value: 0.43223081596941393 and parameters: {'model_name': 'SimpleImputer', 'strategy': 'mean'}. Best is trial 9 with value: 0.43223081596941393.
running
running
[I 2024-11-20 22:46:53,719] Trial 138 finished with value: 0.43223081596941393 and parameters: {'model_name': 'SimpleImputer', 'strategy': 'mean'}. Best is trial 9 with value: 0.43223081596941393.
[I 2024-11-20 22:46:53,819] Trial 144 finished with value: 0.43223081596941393 and parameters: {'model_name': 'SimpleImputer', 'strategy': 'mean'}. Best is trial 9 with value: 0.43223081596941393.
[I 2024-11-20 22:46:53,920] Trial 137 finished with value: 0.43223081596941393 and parameters: {'model_name': 'SimpleImputer', 'strategy': 'mean'}. Best is trial 9 with value: 0.43223081596941393.
[I 2024-11-20 22:46:54,013] Trial 140 finished with value: 0.43223081596941393 and parameters: {'model_name': 'SimpleImputer', 'strategy': 'mean'}. Best is trial 9 with value: 0.43223081596941393.
running
running
[I 2024-11-20 22:46:54,104] Trial 148 finished with value: 0.43223081596941393 and parameters: {'model_name': 'SimpleImputer', 'strategy': 'mean'}. Best is trial 9 with value: 0.43223081596941393.
running
running
[I 2024-11-20 22:46:54,217] Trial 143 finished with value: 0.43223081596941393 and parameters: {'model_name': 'SimpleImputer', 'strategy': 'mean'}. Best is trial 9 with value: 0.43223081596941393.
running
running
[I 2024-11-20 22:46:54,328] Trial 142 finished with value: 0.43223081596941393 and parameters: {'model_name': 'SimpleImputer', 'strategy': 'mean'}. Best is trial 9 with value: 0.43223081596941393.
running
[I 2024-11-20 22:46:54,549] Trial 146 finished with value: 0.43223081596941393 and parameters: {'model_name': 'SimpleImputer', 'strategy': 'mean'}. Best is trial 9 with value: 0.43223081596941393.
[I 2024-11-20 22:46:54,652] Trial 145 finished with value: 0.43223081596941393 and parameters: {'model_name': 'SimpleImputer', 'strategy': 'mean'}. Best is trial 9 with value: 0.43223081596941393.
running
running
[I 2024-11-20 22:46:54,795] Trial 152 finished with value: 0.43223081596941393 and parameters: {'model_name': 'SimpleImputer', 'strategy': 'mean'}. Best is trial 9 with value: 0.43223081596941393.
[I 2024-11-20 22:46:54,894] Trial 150 finished with value: 0.43223081596941393 and parameters: {'model_name': 'SimpleImputer', 'strategy': 'mean'}. Best is trial 9 with value: 0.43223081596941393.
[I 2024-11-20 22:46:54,995] Trial 154 finished with value: 0.43223081596941393 and parameters: {'model_name': 'SimpleImputer', 'strategy': 'mean'}. Best is trial 9 with value: 0.43223081596941393.
running
running
[I 2024-11-20 22:46:55,092] Trial 147 finished with value: 0.43223081596941393 and parameters: {'model_name': 'SimpleImputer', 'strategy': 'mean'}. Best is trial 9 with value: 0.43223081596941393.
running
running
[I 2024-11-20 22:46:55,233] Trial 151 finished with value: 0.43223081596941393 and parameters: {'model_name': 'SimpleImputer', 'strategy': 'mean'}. Best is trial 9 with value: 0.43223081596941393.
running
[I 2024-11-20 22:46:55,393] Trial 149 finished with value: 0.43223081596941393 and parameters: {'model_name': 'SimpleImputer', 'strategy': 'mean'}. Best is trial 9 with value: 0.43223081596941393.
[I 2024-11-20 22:46:55,510] Trial 157 finished with value: 0.43223081596941393 and parameters: {'model_name': 'SimpleImputer', 'strategy': 'mean'}. Best is trial 9 with value: 0.43223081596941393.
[I 2024-11-20 22:46:55,604] Trial 153 finished with value: 0.43223081596941393 and parameters: {'model_name': 'SimpleImputer', 'strategy': 'mean'}. Best is trial 9 with value: 0.43223081596941393.
running
running
running
[I 2024-11-20 22:46:55,746] Trial 159 finished with value: 0.43223081596941393 and parameters: {'model_name': 'SimpleImputer', 'strategy': 'mean'}. Best is trial 9 with value: 0.43223081596941393.
running
[I 2024-11-20 22:46:55,903] Trial 158 finished with value: 0.43223081596941393 and parameters: {'model_name': 'SimpleImputer', 'strategy': 'mean'}. Best is trial 9 with value: 0.43223081596941393.
running
[I 2024-11-20 22:46:56,041] Trial 155 finished with value: 0.43223081596941393 and parameters: {'model_name': 'SimpleImputer', 'strategy': 'mean'}. Best is trial 9 with value: 0.43223081596941393.
running
[I 2024-11-20 22:46:56,158] Trial 162 finished with value: 0.43223081596941393 and parameters: {'model_name': 'SimpleImputer', 'strategy': 'mean'}. Best is trial 9 with value: 0.43223081596941393.
[I 2024-11-20 22:46:56,252] Trial 161 finished with value: 0.43223081596941393 and parameters: {'model_name': 'SimpleImputer', 'strategy': 'mean'}. Best is trial 9 with value: 0.43223081596941393.
[I 2024-11-20 22:46:56,364] Trial 160 finished with value: 0.43223081596941393 and parameters: {'model_name': 'SimpleImputer', 'strategy': 'mean'}. Best is trial 9 with value: 0.43223081596941393.
running
running
running
[I 2024-11-20 22:46:56,506] Trial 166 finished with value: 0.43223081596941393 and parameters: {'model_name': 'SimpleImputer', 'strategy': 'mean'}. Best is trial 9 with value: 0.43223081596941393.
[I 2024-11-20 22:46:56,617] Trial 165 finished with value: 0.43223081596941393 and parameters: {'model_name': 'SimpleImputer', 'strategy': 'mean'}. Best is trial 9 with value: 0.43223081596941393.
running
[I 2024-11-20 22:46:56,764] Trial 164 finished with value: 0.43223081596941393 and parameters: {'model_name': 'SimpleImputer', 'strategy': 'mean'}. Best is trial 9 with value: 0.43223081596941393.
[I 2024-11-20 22:46:56,858] Trial 169 finished with value: 0.43223081596941393 and parameters: {'model_name': 'SimpleImputer', 'strategy': 'mean'}. Best is trial 9 with value: 0.43223081596941393.
running
running
[I 2024-11-20 22:46:56,990] Trial 171 finished with value: 0.43223081596941393 and parameters: {'model_name': 'SimpleImputer', 'strategy': 'mean'}. Best is trial 9 with value: 0.43223081596941393.
[I 2024-11-20 22:46:57,091] Trial 168 finished with value: 0.43223081596941393 and parameters: {'model_name': 'SimpleImputer', 'strategy': 'mean'}. Best is trial 9 with value: 0.43223081596941393.
[I 2024-11-20 22:46:57,190] Trial 163 finished with value: 0.43223081596941393 and parameters: {'model_name': 'SimpleImputer', 'strategy': 'mean'}. Best is trial 9 with value: 0.43223081596941393.
[I 2024-11-20 22:46:57,194] Trial 167 finished with value: 0.43223081596941393 and parameters: {'model_name': 'SimpleImputer', 'strategy': 'mean'}. Best is trial 9 with value: 0.43223081596941393.
running
running
running
[I 2024-11-20 22:46:57,199] Trial 172 finished with value: 0.43223081596941393 and parameters: {'model_name': 'SimpleImputer', 'strategy': 'mean'}. Best is trial 9 with value: 0.43223081596941393.
[I 2024-11-20 22:46:57,200] Trial 156 finished with value: 0.43223081596941393 and parameters: {'model_name': 'SimpleImputer', 'strategy': 'mean'}. Best is trial 9 with value: 0.43223081596941393.
[I 2024-11-20 22:46:57,582] Trial 170 finished with value: 0.43223081596941393 and parameters: {'model_name': 'SimpleImputer', 'strategy': 'mean'}. Best is trial 9 with value: 0.43223081596941393.
running
running
running
running
running
[I 2024-11-20 22:46:57,856] Trial 175 finished with value: 0.43223081596941393 and parameters: {'model_name': 'SimpleImputer', 'strategy': 'mean'}. Best is trial 9 with value: 0.43223081596941393.
[I 2024-11-20 22:46:57,966] Trial 178 finished with value: 0.43223081596941393 and parameters: {'model_name': 'SimpleImputer', 'strategy': 'mean'}. Best is trial 9 with value: 0.43223081596941393.
running
running
[I 2024-11-20 22:46:58,150] Trial 173 finished with value: 0.43223081596941393 and parameters: {'model_name': 'SimpleImputer', 'strategy': 'mean'}. Best is trial 9 with value: 0.43223081596941393.
running
[I 2024-11-20 22:46:58,254] Trial 176 finished with value: 0.43223081596941393 and parameters: {'model_name': 'SimpleImputer', 'strategy': 'mean'}. Best is trial 9 with value: 0.43223081596941393.
[I 2024-11-20 22:46:58,350] Trial 182 finished with value: 0.43223081596941393 and parameters: {'model_name': 'SimpleImputer', 'strategy': 'mean'}. Best is trial 9 with value: 0.43223081596941393.
[I 2024-11-20 22:46:58,437] Trial 174 finished with value: 0.43223081596941393 and parameters: {'model_name': 'SimpleImputer', 'strategy': 'mean'}. Best is trial 9 with value: 0.43223081596941393.
running
[I 2024-11-20 22:46:58,537] Trial 185 finished with value: 0.43223081596941393 and parameters: {'model_name': 'SimpleImputer', 'strategy': 'mean'}. Best is trial 9 with value: 0.43223081596941393.
running
running
running
[I 2024-11-20 22:46:58,668] Trial 177 finished with value: 0.43223081596941393 and parameters: {'model_name': 'SimpleImputer', 'strategy': 'mean'}. Best is trial 9 with value: 0.43223081596941393.
running
[I 2024-11-20 22:46:58,779] Trial 179 finished with value: 0.43223081596941393 and parameters: {'model_name': 'SimpleImputer', 'strategy': 'mean'}. Best is trial 9 with value: 0.43223081596941393.
[I 2024-11-20 22:46:58,901] Trial 188 finished with value: 0.43223081596941393 and parameters: {'model_name': 'SimpleImputer', 'strategy': 'mean'}. Best is trial 9 with value: 0.43223081596941393.
[I 2024-11-20 22:46:59,008] Trial 183 finished with value: 0.43223081596941393 and parameters: {'model_name': 'SimpleImputer', 'strategy': 'mean'}. Best is trial 9 with value: 0.43223081596941393.
[I 2024-11-20 22:46:59,097] Trial 184 finished with value: 0.43223081596941393 and parameters: {'model_name': 'SimpleImputer', 'strategy': 'mean'}. Best is trial 9 with value: 0.43223081596941393.
[I 2024-11-20 22:46:59,189] Trial 180 finished with value: 0.43223081596941393 and parameters: {'model_name': 'SimpleImputer', 'strategy': 'mean'}. Best is trial 9 with value: 0.43223081596941393.
running
running
running
[I 2024-11-20 22:46:59,303] Trial 187 finished with value: 0.43223081596941393 and parameters: {'model_name': 'SimpleImputer', 'strategy': 'mean'}. Best is trial 9 with value: 0.43223081596941393.
[I 2024-11-20 22:46:59,429] Trial 181 finished with value: 0.43223081596941393 and parameters: {'model_name': 'SimpleImputer', 'strategy': 'mean'}. Best is trial 9 with value: 0.43223081596941393.
[I 2024-11-20 22:46:59,602] Trial 186 finished with value: 0.43223081596941393 and parameters: {'model_name': 'SimpleImputer', 'strategy': 'mean'}. Best is trial 9 with value: 0.43223081596941393.
[I 2024-11-20 22:46:59,704] Trial 196 finished with value: 0.43223081596941393 and parameters: {'model_name': 'SimpleImputer', 'strategy': 'mean'}. Best is trial 9 with value: 0.43223081596941393.
[I 2024-11-20 22:46:59,872] Trial 192 finished with value: 0.43223081596941393 and parameters: {'model_name': 'SimpleImputer', 'strategy': 'mean'}. Best is trial 9 with value: 0.43223081596941393.
[I 2024-11-20 22:46:59,995] Trial 190 finished with value: 0.5864889703340403 and parameters: {'model_name': 'SimpleImputer', 'strategy': 'median'}. Best is trial 9 with value: 0.43223081596941393.
[I 2024-11-20 22:47:00,118] Trial 199 finished with value: 0.43223081596941393 and parameters: {'model_name': 'SimpleImputer', 'strategy': 'mean'}. Best is trial 9 with value: 0.43223081596941393.
[I 2024-11-20 22:47:00,210] Trial 189 finished with value: 0.5864889703340403 and parameters: {'model_name': 'SimpleImputer', 'strategy': 'median'}. Best is trial 9 with value: 0.43223081596941393.
[I 2024-11-20 22:47:00,305] Trial 191 finished with value: 0.5864889703340403 and parameters: {'model_name': 'SimpleImputer', 'strategy': 'median'}. Best is trial 9 with value: 0.43223081596941393.
[I 2024-11-20 22:47:00,417] Trial 195 finished with value: 0.5864889703340403 and parameters: {'model_name': 'SimpleImputer', 'strategy': 'median'}. Best is trial 9 with value: 0.43223081596941393.
[I 2024-11-20 22:47:00,508] Trial 193 finished with value: 0.5864889703340403 and parameters: {'model_name': 'SimpleImputer', 'strategy': 'median'}. Best is trial 9 with value: 0.43223081596941393.
[I 2024-11-20 22:47:00,593] Trial 197 finished with value: 0.5864889703340403 and parameters: {'model_name': 'SimpleImputer', 'strategy': 'median'}. Best is trial 9 with value: 0.43223081596941393.
[I 2024-11-20 22:47:00,677] Trial 198 finished with value: 0.5864889703340403 and parameters: {'model_name': 'SimpleImputer', 'strategy': 'median'}. Best is trial 9 with value: 0.43223081596941393.
