[I 2024-10-08 03:21:48,840] Trial 89 finished with value: 0.0639902920074974 and parameters: {'model_name': 'IterativeImputer', 'estimator': 'KNN', 'initial_strategy': 'mean', 'n_nearest_features': 6, 'imputation_order': 'descending'}. Best is trial 44 with value: 0.05796834839449868.
running
[I 2024-10-08 03:22:01,456] Trial 90 finished with value: 0.05818403366682016 and parameters: {'model_name': 'IterativeImputer', 'estimator': 'KNN', 'initial_strategy': 'most_frequent', 'n_nearest_features': 6, 'imputation_order': 'descending'}. Best is trial 44 with value: 0.05796834839449868.
running
[I 2024-10-08 03:22:15,186] Trial 91 finished with value: 0.06433526476801676 and parameters: {'model_name': 'IterativeImputer', 'estimator': 'KNN', 'initial_strategy': 'most_frequent', 'n_nearest_features': 6, 'imputation_order': 'roman'}. Best is trial 44 with value: 0.05796834839449868.
running
[I 2024-10-08 03:22:18,608] Trial 92 finished with value: 0.19501331609044223 and parameters: {'model_name': 'KNNImputer', 'n_neighbors': 5452, 'weights': 'uniform'}. Best is trial 44 with value: 0.05796834839449868.
running
[I 2024-10-08 03:22:19,500] Trial 56 finished with value: 0.05890548955268905 and parameters: {'model_name': 'IterativeImputer', 'estimator': 'RFR', 'initial_strategy': 'most_frequent', 'n_nearest_features': 4, 'imputation_order': 'descending'}. Best is trial 44 with value: 0.05796834839449868.
running
[I 2024-10-08 03:22:23,376] Trial 52 finished with value: inf and parameters: {'model_name': 'GAIN', 'batch_size': 1, 'hint_rate': 0.9838383568290625, 'alpha': 1, 'iterations': 8569, 'learning_rate': 0.00025510881661137817, 'p_miss': 0.145309793458086}. Best is trial 44 with value: 0.05796834839449868.
running
[I 2024-10-08 03:22:40,959] Trial 93 finished with value: 0.16051407237766818 and parameters: {'model_name': 'IterativeImputer', 'estimator': 'Bayesian', 'initial_strategy': 'most_frequent', 'n_nearest_features': 6, 'imputation_order': 'descending', 'sample_posterior': True}. Best is trial 44 with value: 0.05796834839449868.
running
[I 2024-10-08 03:23:18,884] Trial 57 finished with value: 0.05814680492908281 and parameters: {'model_name': 'IterativeImputer', 'estimator': 'RFR', 'initial_strategy': 'most_frequent', 'n_nearest_features': 4, 'imputation_order': 'descending'}. Best is trial 44 with value: 0.05796834839449868.
running
[I 2024-10-08 03:24:33,670] Trial 85 finished with value: inf and parameters: {'model_name': 'GAIN', 'batch_size': 4, 'hint_rate': 0.6343184459518266, 'alpha': 43, 'iterations': 1483, 'learning_rate': 0.009975172524654491, 'p_miss': 0.20996959793824227}. Best is trial 44 with value: 0.05796834839449868.
running
[I 2024-10-08 03:30:52,641] Trial 58 finished with value: 0.0611788132676175 and parameters: {'model_name': 'IterativeImputer', 'estimator': 'RFR', 'initial_strategy': 'constant', 'n_nearest_features': 4, 'imputation_order': 'descending'}. Best is trial 44 with value: 0.05796834839449868.
running
[I 2024-10-08 03:31:23,786] Trial 73 finished with value: inf and parameters: {'model_name': 'GAIN', 'batch_size': 3, 'hint_rate': 0.7124716198136224, 'alpha': 40, 'iterations': 6074, 'learning_rate': 0.00863317211399065, 'p_miss': 0.10525751103293023}. Best is trial 44 with value: 0.05796834839449868.
running
[I 2024-10-08 03:32:37,272] Trial 33 finished with value: 0.45389484807016967 and parameters: {'model_name': 'GAIN', 'batch_size': 544, 'hint_rate': 0.4614525423083205, 'alpha': 64, 'iterations': 2854, 'learning_rate': 0.00015117389203447916, 'p_miss': 0.2980070374489125}. Best is trial 44 with value: 0.05796834839449868.
running
[I 2024-10-08 03:39:09,286] Trial 74 finished with value: inf and parameters: {'model_name': 'GAIN', 'batch_size': 3, 'hint_rate': 0.6737205581586729, 'alpha': 40, 'iterations': 8099, 'learning_rate': 0.009764065760064031, 'p_miss': 0.09762521414372949}. Best is trial 44 with value: 0.05796834839449868.
running
[I 2024-10-08 03:46:29,457] Trial 94 finished with value: 0.22378378925815978 and parameters: {'model_name': 'VAE', 'batch_size': 3, 'iterations': 646, 'learning_rate': 0.010015075356635273, 'p_miss': 0.21779871588310917}. Best is trial 44 with value: 0.05796834839449868.
running
[I 2024-10-08 03:49:10,865] Trial 96 finished with value: 0.06014452216087227 and parameters: {'model_name': 'IterativeImputer', 'estimator': 'RFR', 'initial_strategy': 'most_frequent', 'n_nearest_features': 6, 'imputation_order': 'descending'}. Best is trial 44 with value: 0.05796834839449868.
running
[I 2024-10-08 03:49:49,882] Trial 97 finished with value: 0.05937076563832252 and parameters: {'model_name': 'IterativeImputer', 'estimator': 'RFR', 'initial_strategy': 'most_frequent', 'n_nearest_features': 6, 'imputation_order': 'descending'}. Best is trial 44 with value: 0.05796834839449868.
running
[I 2024-10-08 03:51:45,082] Trial 98 finished with value: 0.05873880822237387 and parameters: {'model_name': 'IterativeImputer', 'estimator': 'RFR', 'initial_strategy': 'most_frequent', 'n_nearest_features': 6, 'imputation_order': 'descending'}. Best is trial 44 with value: 0.05796834839449868.
running
[I 2024-10-08 03:56:58,185] Trial 99 finished with value: 0.058009378095059426 and parameters: {'model_name': 'IterativeImputer', 'estimator': 'RFR', 'initial_strategy': 'most_frequent', 'n_nearest_features': 6, 'imputation_order': 'descending'}. Best is trial 44 with value: 0.05796834839449868.
running
[I 2024-10-08 03:57:59,808] Trial 100 finished with value: 0.05920872659549788 and parameters: {'model_name': 'IterativeImputer', 'estimator': 'RFR', 'initial_strategy': 'most_frequent', 'n_nearest_features': 6, 'imputation_order': 'descending'}. Best is trial 44 with value: 0.05796834839449868.
running
[I 2024-10-08 03:59:25,159] Trial 101 finished with value: 0.059498581071130444 and parameters: {'model_name': 'IterativeImputer', 'estimator': 'RFR', 'initial_strategy': 'most_frequent', 'n_nearest_features': 6, 'imputation_order': 'descending'}. Best is trial 44 with value: 0.05796834839449868.
running
[I 2024-10-08 04:05:20,177] Trial 102 finished with value: 0.05817454924918597 and parameters: {'model_name': 'IterativeImputer', 'estimator': 'RFR', 'initial_strategy': 'most_frequent', 'n_nearest_features': 6, 'imputation_order': 'descending'}. Best is trial 44 with value: 0.05796834839449868.
running
[I 2024-10-08 04:08:55,947] Trial 95 finished with value: 0.20119321167901966 and parameters: {'model_name': 'VAE', 'batch_size': 52, 'iterations': 1168, 'learning_rate': 0.009189836040557491, 'p_miss': 0.22385906099478103}. Best is trial 44 with value: 0.05796834839449868.
running
[I 2024-10-08 04:12:08,343] Trial 103 finished with value: 0.06053160680721879 and parameters: {'model_name': 'IterativeImputer', 'estimator': 'RFR', 'initial_strategy': 'most_frequent', 'n_nearest_features': 6, 'imputation_order': 'descending'}. Best is trial 44 with value: 0.05796834839449868.
running
[I 2024-10-08 04:15:09,636] Trial 104 finished with value: 0.05992294546247986 and parameters: {'model_name': 'IterativeImputer', 'estimator': 'RFR', 'initial_strategy': 'most_frequent', 'n_nearest_features': 5, 'imputation_order': 'descending'}. Best is trial 44 with value: 0.05796834839449868.
running
[I 2024-10-08 04:15:10,084] Trial 113 finished with value: 0.5180219868975705 and parameters: {'model_name': 'SimpleImputer', 'strategy': 'constant'}. Best is trial 44 with value: 0.05796834839449868.
running
[I 2024-10-08 04:15:26,152] Trial 114 finished with value: 0.10773090894571095 and parameters: {'model_name': 'IterativeImputer', 'estimator': 'Ridge', 'initial_strategy': 'median', 'n_nearest_features': 5, 'imputation_order': 'ascending'}. Best is trial 44 with value: 0.05796834839449868.
running
[I 2024-10-08 04:15:46,035] Trial 105 finished with value: 0.06382587620157487 and parameters: {'model_name': 'IterativeImputer', 'estimator': 'RFR', 'initial_strategy': 'most_frequent', 'n_nearest_features': 5, 'imputation_order': 'ascending'}. Best is trial 44 with value: 0.05796834839449868.
running
[I 2024-10-08 04:18:50,604] Trial 106 finished with value: 0.061339677074581114 and parameters: {'model_name': 'IterativeImputer', 'estimator': 'RFR', 'initial_strategy': 'most_frequent', 'n_nearest_features': 5, 'imputation_order': 'descending'}. Best is trial 44 with value: 0.05796834839449868.
running
[I 2024-10-08 04:22:49,289] Trial 107 finished with value: 0.06406586131601355 and parameters: {'model_name': 'IterativeImputer', 'estimator': 'RFR', 'initial_strategy': 'most_frequent', 'n_nearest_features': 5, 'imputation_order': 'ascending'}. Best is trial 44 with value: 0.05796834839449868.
running
[I 2024-10-08 04:24:26,499] Trial 108 finished with value: 0.0598778286236154 and parameters: {'model_name': 'IterativeImputer', 'estimator': 'RFR', 'initial_strategy': 'most_frequent', 'n_nearest_features': 5, 'imputation_order': 'ascending'}. Best is trial 44 with value: 0.05796834839449868.
running
[I 2024-10-08 04:26:04,563] Trial 109 finished with value: 0.061518605612988345 and parameters: {'model_name': 'IterativeImputer', 'estimator': 'RFR', 'initial_strategy': 'most_frequent', 'n_nearest_features': 5, 'imputation_order': 'ascending'}. Best is trial 44 with value: 0.05796834839449868.
running
[I 2024-10-08 04:26:17,003] Trial 120 finished with value: 0.06845191083021374 and parameters: {'model_name': 'IterativeImputer', 'estimator': 'KNN', 'initial_strategy': 'median', 'n_nearest_features': 6, 'imputation_order': 'random'}. Best is trial 44 with value: 0.05796834839449868.
running
[I 2024-10-08 04:31:39,884] Trial 110 finished with value: 0.060384186288995015 and parameters: {'model_name': 'IterativeImputer', 'estimator': 'RFR', 'initial_strategy': 'median', 'n_nearest_features': 5, 'imputation_order': 'ascending'}. Best is trial 44 with value: 0.05796834839449868.
running
[I 2024-10-08 04:31:57,389] Trial 122 finished with value: 0.05818403366682016 and parameters: {'model_name': 'IterativeImputer', 'estimator': 'KNN', 'initial_strategy': 'most_frequent', 'n_nearest_features': 6, 'imputation_order': 'descending'}. Best is trial 44 with value: 0.05796834839449868.
running
[I 2024-10-08 04:32:08,992] Trial 123 finished with value: 0.05818403366682016 and parameters: {'model_name': 'IterativeImputer', 'estimator': 'KNN', 'initial_strategy': 'most_frequent', 'n_nearest_features': 6, 'imputation_order': 'descending'}. Best is trial 44 with value: 0.05796834839449868.
running
[I 2024-10-08 04:32:14,553] Trial 124 finished with value: 0.14205635265201705 and parameters: {'model_name': 'KNNImputer', 'n_neighbors': 5404, 'weights': 'distance'}. Best is trial 44 with value: 0.05796834839449868.
running
[I 2024-10-08 04:32:24,771] Trial 125 finished with value: 0.0639902920074974 and parameters: {'model_name': 'IterativeImputer', 'estimator': 'KNN', 'initial_strategy': 'mean', 'n_nearest_features': 6, 'imputation_order': 'descending'}. Best is trial 44 with value: 0.05796834839449868.
running
[I 2024-10-08 04:32:36,395] Trial 126 finished with value: 0.05818403366682016 and parameters: {'model_name': 'IterativeImputer', 'estimator': 'KNN', 'initial_strategy': 'most_frequent', 'n_nearest_features': 6, 'imputation_order': 'descending'}. Best is trial 44 with value: 0.05796834839449868.
running
[I 2024-10-08 04:32:49,499] Trial 127 finished with value: 0.05818403366682016 and parameters: {'model_name': 'IterativeImputer', 'estimator': 'KNN', 'initial_strategy': 'most_frequent', 'n_nearest_features': 6, 'imputation_order': 'descending'}. Best is trial 44 with value: 0.05796834839449868.
running
[I 2024-10-08 04:33:02,925] Trial 128 finished with value: 0.05818403366682016 and parameters: {'model_name': 'IterativeImputer', 'estimator': 'KNN', 'initial_strategy': 'most_frequent', 'n_nearest_features': 6, 'imputation_order': 'descending'}. Best is trial 44 with value: 0.05796834839449868.
running
[I 2024-10-08 04:33:14,036] Trial 129 finished with value: 0.05818403366682016 and parameters: {'model_name': 'IterativeImputer', 'estimator': 'KNN', 'initial_strategy': 'constant', 'n_nearest_features': 6, 'imputation_order': 'descending'}. Best is trial 44 with value: 0.05796834839449868.
running
[I 2024-10-08 04:33:28,392] Trial 130 finished with value: 0.05818403366682016 and parameters: {'model_name': 'IterativeImputer', 'estimator': 'KNN', 'initial_strategy': 'most_frequent', 'n_nearest_features': 6, 'imputation_order': 'descending'}. Best is trial 44 with value: 0.05796834839449868.
running
[I 2024-10-08 04:33:37,659] Trial 131 finished with value: 0.1372022909175987 and parameters: {'model_name': 'IterativeImputer', 'estimator': 'KNN', 'initial_strategy': 'constant', 'n_nearest_features': 1, 'imputation_order': 'descending'}. Best is trial 44 with value: 0.05796834839449868.
running
[I 2024-10-08 04:33:50,781] Trial 132 finished with value: 0.05818403366682016 and parameters: {'model_name': 'IterativeImputer', 'estimator': 'KNN', 'initial_strategy': 'constant', 'n_nearest_features': 6, 'imputation_order': 'descending'}. Best is trial 44 with value: 0.05796834839449868.
running
[I 2024-10-08 04:34:03,395] Trial 133 finished with value: 0.10578042497562068 and parameters: {'model_name': 'IterativeImputer', 'estimator': 'KNN', 'initial_strategy': 'most_frequent', 'n_nearest_features': 2, 'imputation_order': 'roman'}. Best is trial 44 with value: 0.05796834839449868.
running
[I 2024-10-08 04:34:03,759] Trial 134 finished with value: 0.20492140525175268 and parameters: {'model_name': 'SimpleImputer', 'strategy': 'mean'}. Best is trial 44 with value: 0.05796834839449868.
running
[I 2024-10-08 04:34:12,456] Trial 31 finished with value: 0.4416795998933223 and parameters: {'model_name': 'GAIN', 'batch_size': 316, 'hint_rate': 0.3001917798138368, 'alpha': 99, 'iterations': 6112, 'learning_rate': 0.00011135301399560878, 'p_miss': 0.0845321508335921}. Best is trial 44 with value: 0.05796834839449868.
running
[I 2024-10-08 04:34:18,817] Trial 135 finished with value: 0.05818403366682016 and parameters: {'model_name': 'IterativeImputer', 'estimator': 'KNN', 'initial_strategy': 'constant', 'n_nearest_features': 6, 'imputation_order': 'descending'}. Best is trial 44 with value: 0.05796834839449868.
running
[I 2024-10-08 04:34:29,723] Trial 136 finished with value: 0.05818403366682016 and parameters: {'model_name': 'IterativeImputer', 'estimator': 'KNN', 'initial_strategy': 'most_frequent', 'n_nearest_features': 6, 'imputation_order': 'descending'}. Best is trial 44 with value: 0.05796834839449868.
running
[I 2024-10-08 04:34:31,382] Trial 137 finished with value: 0.05818403366682016 and parameters: {'model_name': 'IterativeImputer', 'estimator': 'KNN', 'initial_strategy': 'most_frequent', 'n_nearest_features': 6, 'imputation_order': 'descending'}. Best is trial 44 with value: 0.05796834839449868.
running
[I 2024-10-08 04:34:44,552] Trial 138 finished with value: 0.05818403366682016 and parameters: {'model_name': 'IterativeImputer', 'estimator': 'KNN', 'initial_strategy': 'most_frequent', 'n_nearest_features': 6, 'imputation_order': 'descending'}. Best is trial 44 with value: 0.05796834839449868.
running
[I 2024-10-08 04:34:45,969] Trial 139 finished with value: 0.05818403366682016 and parameters: {'model_name': 'IterativeImputer', 'estimator': 'KNN', 'initial_strategy': 'most_frequent', 'n_nearest_features': 6, 'imputation_order': 'descending'}. Best is trial 44 with value: 0.05796834839449868.
running
[I 2024-10-08 04:34:57,451] Trial 111 finished with value: 0.06208177058652653 and parameters: {'model_name': 'IterativeImputer', 'estimator': 'RFR', 'initial_strategy': 'most_frequent', 'n_nearest_features': 5, 'imputation_order': 'ascending'}. Best is trial 44 with value: 0.05796834839449868.
running
[I 2024-10-08 04:35:03,317] Trial 141 finished with value: 0.10682438712458904 and parameters: {'model_name': 'IterativeImputer', 'estimator': 'Ridge', 'initial_strategy': 'constant', 'n_nearest_features': 6, 'imputation_order': 'random'}. Best is trial 44 with value: 0.05796834839449868.
running
[I 2024-10-08 04:35:07,591] Trial 140 finished with value: 0.061879533957808555 and parameters: {'model_name': 'IterativeImputer', 'estimator': 'KNN', 'initial_strategy': 'constant', 'n_nearest_features': 6, 'imputation_order': 'random'}. Best is trial 44 with value: 0.05796834839449868.
running
[I 2024-10-08 04:35:13,816] Trial 142 finished with value: 0.10731447724525467 and parameters: {'model_name': 'IterativeImputer', 'estimator': 'Ridge', 'initial_strategy': 'constant', 'n_nearest_features': 6, 'imputation_order': 'descending'}. Best is trial 44 with value: 0.05796834839449868.
running
[I 2024-10-08 04:35:29,544] Trial 144 finished with value: 0.05818403366682016 and parameters: {'model_name': 'IterativeImputer', 'estimator': 'KNN', 'initial_strategy': 'constant', 'n_nearest_features': 6, 'imputation_order': 'descending'}. Best is trial 44 with value: 0.05796834839449868.
running
[I 2024-10-08 04:35:39,805] Trial 143 finished with value: 0.1072997700736988 and parameters: {'model_name': 'IterativeImputer', 'estimator': 'Bayesian', 'initial_strategy': 'constant', 'n_nearest_features': 6, 'imputation_order': 'descending', 'sample_posterior': False}. Best is trial 44 with value: 0.05796834839449868.
running
[I 2024-10-08 04:35:50,048] Trial 146 finished with value: 0.05818403366682016 and parameters: {'model_name': 'IterativeImputer', 'estimator': 'KNN', 'initial_strategy': 'most_frequent', 'n_nearest_features': 6, 'imputation_order': 'descending'}. Best is trial 44 with value: 0.05796834839449868.
running
[I 2024-10-08 04:35:50,762] Trial 145 finished with value: 0.1072997700736988 and parameters: {'model_name': 'IterativeImputer', 'estimator': 'Bayesian', 'initial_strategy': 'most_frequent', 'n_nearest_features': 6, 'imputation_order': 'descending', 'sample_posterior': False}. Best is trial 44 with value: 0.05796834839449868.
running
[I 2024-10-08 04:36:00,423] Trial 147 finished with value: 0.05818403366682016 and parameters: {'model_name': 'IterativeImputer', 'estimator': 'KNN', 'initial_strategy': 'most_frequent', 'n_nearest_features': 6, 'imputation_order': 'descending'}. Best is trial 44 with value: 0.05796834839449868.
running
[I 2024-10-08 04:36:04,372] Trial 150 finished with value: 0.08196939082314394 and parameters: {'model_name': 'KNNImputer', 'n_neighbors': 382, 'weights': 'distance'}. Best is trial 44 with value: 0.05796834839449868.
running
[I 2024-10-08 04:36:07,393] Trial 149 finished with value: 0.05818403366682016 and parameters: {'model_name': 'IterativeImputer', 'estimator': 'KNN', 'initial_strategy': 'most_frequent', 'n_nearest_features': 6, 'imputation_order': 'descending'}. Best is trial 44 with value: 0.05796834839449868.
running
[I 2024-10-08 04:36:07,664] Trial 148 finished with value: 0.05818403366682016 and parameters: {'model_name': 'IterativeImputer', 'estimator': 'KNN', 'initial_strategy': 'most_frequent', 'n_nearest_features': 6, 'imputation_order': 'descending'}. Best is trial 44 with value: 0.05796834839449868.
running
[I 2024-10-08 04:36:20,402] Trial 151 finished with value: 0.2630220824740707 and parameters: {'model_name': 'VAE', 'batch_size': 111, 'iterations': 3, 'learning_rate': 0.0012729771328831947, 'p_miss': 0.04182933254523023}. Best is trial 44 with value: 0.05796834839449868.
running
[I 2024-10-08 04:36:25,579] Trial 153 finished with value: 0.06959716669920873 and parameters: {'model_name': 'IterativeImputer', 'estimator': 'KNN', 'initial_strategy': 'mean', 'n_nearest_features': 6, 'imputation_order': 'arabic'}. Best is trial 44 with value: 0.05796834839449868.
running
[I 2024-10-08 04:36:26,561] Trial 152 finished with value: 0.22183585680063578 and parameters: {'model_name': 'VAE', 'batch_size': 9, 'iterations': 4, 'learning_rate': 0.03225369507782375, 'p_miss': 0.03916810078372947}. Best is trial 44 with value: 0.05796834839449868.
running
[I 2024-10-08 04:36:39,742] Trial 154 finished with value: 0.06959716669920873 and parameters: {'model_name': 'IterativeImputer', 'estimator': 'KNN', 'initial_strategy': 'mean', 'n_nearest_features': 6, 'imputation_order': 'arabic'}. Best is trial 44 with value: 0.05796834839449868.
running
[I 2024-10-08 04:36:42,056] Trial 155 finished with value: 0.05818403366682016 and parameters: {'model_name': 'IterativeImputer', 'estimator': 'KNN', 'initial_strategy': 'most_frequent', 'n_nearest_features': 6, 'imputation_order': 'descending'}. Best is trial 44 with value: 0.05796834839449868.
running
[I 2024-10-08 04:36:43,721] Trial 156 finished with value: 0.05818403366682016 and parameters: {'model_name': 'IterativeImputer', 'estimator': 'KNN', 'initial_strategy': 'most_frequent', 'n_nearest_features': 6, 'imputation_order': 'descending'}. Best is trial 44 with value: 0.05796834839449868.
running
[I 2024-10-08 04:36:57,841] Trial 158 finished with value: 0.05818403366682016 and parameters: {'model_name': 'IterativeImputer', 'estimator': 'KNN', 'initial_strategy': 'most_frequent', 'n_nearest_features': 6, 'imputation_order': 'descending'}. Best is trial 44 with value: 0.05796834839449868.
running
[I 2024-10-08 04:36:58,848] Trial 157 finished with value: 0.05818403366682016 and parameters: {'model_name': 'IterativeImputer', 'estimator': 'KNN', 'initial_strategy': 'most_frequent', 'n_nearest_features': 6, 'imputation_order': 'descending'}. Best is trial 44 with value: 0.05796834839449868.
running
[I 2024-10-08 04:36:59,118] Trial 159 finished with value: 0.05818403366682016 and parameters: {'model_name': 'IterativeImputer', 'estimator': 'KNN', 'initial_strategy': 'most_frequent', 'n_nearest_features': 6, 'imputation_order': 'descending'}. Best is trial 44 with value: 0.05796834839449868.
running
