[I 2024-10-23 11:58:14,989] Trial 106 finished with value: 0.22829013333538378 and parameters: {'model_name': 'SimpleImputer', 'strategy': 'mean'}. Best is trial 4 with value: 0.22829013333538378.
running
[I 2024-10-23 11:58:15,103] Trial 100 finished with value: 0.22829013333538378 and parameters: {'model_name': 'SimpleImputer', 'strategy': 'mean'}. Best is trial 4 with value: 0.22829013333538378.
[I 2024-10-23 11:58:15,187] Trial 102 finished with value: 0.22829013333538378 and parameters: {'model_name': 'SimpleImputer', 'strategy': 'mean'}. Best is trial 4 with value: 0.22829013333538378.
running
running
[I 2024-10-23 11:58:15,318] Trial 107 finished with value: 0.22829013333538378 and parameters: {'model_name': 'SimpleImputer', 'strategy': 'mean'}. Best is trial 4 with value: 0.22829013333538378.
[I 2024-10-23 11:58:15,318] Trial 105 finished with value: 0.22829013333538378 and parameters: {'model_name': 'SimpleImputer', 'strategy': 'mean'}. Best is trial 4 with value: 0.22829013333538378.
[I 2024-10-23 11:58:15,549] Trial 109 finished with value: 0.22829013333538378 and parameters: {'model_name': 'SimpleImputer', 'strategy': 'mean'}. Best is trial 4 with value: 0.22829013333538378.
running
running
running
[I 2024-10-23 11:58:15,731] Trial 108 finished with value: 0.22829013333538378 and parameters: {'model_name': 'SimpleImputer', 'strategy': 'mean'}. Best is trial 4 with value: 0.22829013333538378.
running
[I 2024-10-23 11:58:15,856] Trial 113 finished with value: 0.22829013333538378 and parameters: {'model_name': 'SimpleImputer', 'strategy': 'mean'}. Best is trial 4 with value: 0.22829013333538378.
[I 2024-10-23 11:58:15,982] Trial 110 finished with value: 0.22829013333538378 and parameters: {'model_name': 'SimpleImputer', 'strategy': 'mean'}. Best is trial 4 with value: 0.22829013333538378.
running
running
[I 2024-10-23 11:58:16,102] Trial 116 finished with value: 0.22829013333538378 and parameters: {'model_name': 'SimpleImputer', 'strategy': 'mean'}. Best is trial 4 with value: 0.22829013333538378.
[I 2024-10-23 11:58:16,193] Trial 115 finished with value: 0.22829013333538378 and parameters: {'model_name': 'SimpleImputer', 'strategy': 'mean'}. Best is trial 4 with value: 0.22829013333538378.
running
running
[I 2024-10-23 11:58:16,327] Trial 114 finished with value: 0.22829013333538378 and parameters: {'model_name': 'SimpleImputer', 'strategy': 'mean'}. Best is trial 4 with value: 0.22829013333538378.
running
[I 2024-10-23 11:58:16,436] Trial 111 finished with value: 0.22829013333538378 and parameters: {'model_name': 'SimpleImputer', 'strategy': 'mean'}. Best is trial 4 with value: 0.22829013333538378.
running
[I 2024-10-23 11:58:16,577] Trial 112 finished with value: 0.22829013333538378 and parameters: {'model_name': 'SimpleImputer', 'strategy': 'mean'}. Best is trial 4 with value: 0.22829013333538378.
running
[I 2024-10-23 11:58:16,711] Trial 118 finished with value: 0.22829013333538378 and parameters: {'model_name': 'SimpleImputer', 'strategy': 'mean'}. Best is trial 4 with value: 0.22829013333538378.
[I 2024-10-23 11:58:16,711] Trial 123 finished with value: 0.22829013333538378 and parameters: {'model_name': 'SimpleImputer', 'strategy': 'mean'}. Best is trial 4 with value: 0.22829013333538378.
[I 2024-10-23 11:58:16,736] Trial 125 finished with value: 0.22829013333538378 and parameters: {'model_name': 'SimpleImputer', 'strategy': 'mean'}. Best is trial 4 with value: 0.22829013333538378.
running
running
[I 2024-10-23 11:58:16,831] Trial 121 finished with value: 0.22829013333538378 and parameters: {'model_name': 'SimpleImputer', 'strategy': 'mean'}. Best is trial 4 with value: 0.22829013333538378.
running
[I 2024-10-23 11:58:16,931] Trial 124 finished with value: 0.22829013333538378 and parameters: {'model_name': 'SimpleImputer', 'strategy': 'mean'}. Best is trial 4 with value: 0.22829013333538378.
running
running
[I 2024-10-23 11:58:17,265] Trial 119 finished with value: 0.22829013333538378 and parameters: {'model_name': 'SimpleImputer', 'strategy': 'mean'}. Best is trial 4 with value: 0.22829013333538378.
[I 2024-10-23 11:58:17,360] Trial 130 finished with value: 0.22829013333538378 and parameters: {'model_name': 'SimpleImputer', 'strategy': 'mean'}. Best is trial 4 with value: 0.22829013333538378.
[I 2024-10-23 11:58:17,468] Trial 120 finished with value: 0.22829013333538378 and parameters: {'model_name': 'SimpleImputer', 'strategy': 'mean'}. Best is trial 4 with value: 0.22829013333538378.
[I 2024-10-23 11:58:17,552] Trial 122 finished with value: 0.22829013333538378 and parameters: {'model_name': 'SimpleImputer', 'strategy': 'mean'}. Best is trial 4 with value: 0.22829013333538378.
running
running
running
running
[I 2024-10-23 11:58:17,677] Trial 128 finished with value: 0.22829013333538378 and parameters: {'model_name': 'SimpleImputer', 'strategy': 'mean'}. Best is trial 4 with value: 0.22829013333538378.
[I 2024-10-23 11:58:17,815] Trial 127 finished with value: 0.22829013333538378 and parameters: {'model_name': 'SimpleImputer', 'strategy': 'mean'}. Best is trial 4 with value: 0.22829013333538378.
running
running
[I 2024-10-23 11:58:17,930] Trial 117 finished with value: 0.22829013333538378 and parameters: {'model_name': 'SimpleImputer', 'strategy': 'mean'}. Best is trial 4 with value: 0.22829013333538378.
[I 2024-10-23 11:58:18,022] Trial 126 finished with value: 0.22829013333538378 and parameters: {'model_name': 'SimpleImputer', 'strategy': 'mean'}. Best is trial 4 with value: 0.22829013333538378.
running
running
[I 2024-10-23 11:58:18,168] Trial 132 finished with value: 0.22829013333538378 and parameters: {'model_name': 'SimpleImputer', 'strategy': 'mean'}. Best is trial 4 with value: 0.22829013333538378.
running
[I 2024-10-23 11:58:18,278] Trial 129 finished with value: 0.22829013333538378 and parameters: {'model_name': 'SimpleImputer', 'strategy': 'mean'}. Best is trial 4 with value: 0.22829013333538378.
running
[I 2024-10-23 11:58:18,441] Trial 137 finished with value: 0.22829013333538378 and parameters: {'model_name': 'SimpleImputer', 'strategy': 'mean'}. Best is trial 4 with value: 0.22829013333538378.
[I 2024-10-23 11:58:18,538] Trial 135 finished with value: 0.22829013333538378 and parameters: {'model_name': 'SimpleImputer', 'strategy': 'mean'}. Best is trial 4 with value: 0.22829013333538378.
[I 2024-10-23 11:58:18,630] Trial 131 finished with value: 0.22829013333538378 and parameters: {'model_name': 'SimpleImputer', 'strategy': 'mean'}. Best is trial 4 with value: 0.22829013333538378.
running
running
running
[I 2024-10-23 11:58:18,788] Trial 139 finished with value: 0.22829013333538378 and parameters: {'model_name': 'SimpleImputer', 'strategy': 'mean'}. Best is trial 4 with value: 0.22829013333538378.
running
[I 2024-10-23 11:58:19,009] Trial 136 finished with value: 0.22829013333538378 and parameters: {'model_name': 'SimpleImputer', 'strategy': 'mean'}. Best is trial 4 with value: 0.22829013333538378.
running
[I 2024-10-23 11:58:19,150] Trial 133 finished with value: 0.22829013333538378 and parameters: {'model_name': 'SimpleImputer', 'strategy': 'mean'}. Best is trial 4 with value: 0.22829013333538378.
[I 2024-10-23 11:58:19,247] Trial 134 finished with value: 0.22829013333538378 and parameters: {'model_name': 'SimpleImputer', 'strategy': 'mean'}. Best is trial 4 with value: 0.22829013333538378.
running
running
[I 2024-10-23 11:58:19,626] Trial 145 finished with value: 0.22829013333538378 and parameters: {'model_name': 'SimpleImputer', 'strategy': 'mean'}. Best is trial 4 with value: 0.22829013333538378.
running
[I 2024-10-23 11:58:20,022] Trial 138 finished with value: 0.3771968311098218 and parameters: {'model_name': 'SimpleImputer', 'strategy': 'most_frequent'}. Best is trial 4 with value: 0.22829013333538378.
running
[I 2024-10-23 11:58:20,282] Trial 141 finished with value: 0.3771968311098218 and parameters: {'model_name': 'SimpleImputer', 'strategy': 'most_frequent'}. Best is trial 4 with value: 0.22829013333538378.
running
[I 2024-10-23 11:58:20,406] Trial 142 finished with value: 0.3771968311098218 and parameters: {'model_name': 'SimpleImputer', 'strategy': 'most_frequent'}. Best is trial 4 with value: 0.22829013333538378.
[I 2024-10-23 11:58:20,503] Trial 140 finished with value: 0.3771968311098218 and parameters: {'model_name': 'SimpleImputer', 'strategy': 'most_frequent'}. Best is trial 4 with value: 0.22829013333538378.
running
[I 2024-10-23 11:58:20,639] Trial 143 finished with value: 0.3771968311098218 and parameters: {'model_name': 'SimpleImputer', 'strategy': 'most_frequent'}. Best is trial 4 with value: 0.22829013333538378.
[I 2024-10-23 11:58:20,737] Trial 144 finished with value: 0.3771968311098218 and parameters: {'model_name': 'SimpleImputer', 'strategy': 'most_frequent'}. Best is trial 4 with value: 0.22829013333538378.
running
running
[I 2024-10-23 11:58:20,908] Trial 150 finished with value: 0.3771968311098218 and parameters: {'model_name': 'SimpleImputer', 'strategy': 'most_frequent'}. Best is trial 4 with value: 0.22829013333538378.
running
running
[I 2024-10-23 11:58:21,106] Trial 146 finished with value: 0.3771968311098218 and parameters: {'model_name': 'SimpleImputer', 'strategy': 'most_frequent'}. Best is trial 4 with value: 0.22829013333538378.
running
[I 2024-10-23 11:58:21,228] Trial 149 finished with value: 0.3771968311098218 and parameters: {'model_name': 'SimpleImputer', 'strategy': 'most_frequent'}. Best is trial 4 with value: 0.22829013333538378.
[I 2024-10-23 11:58:21,313] Trial 151 finished with value: 0.3771968311098218 and parameters: {'model_name': 'SimpleImputer', 'strategy': 'most_frequent'}. Best is trial 4 with value: 0.22829013333538378.
running
[I 2024-10-23 11:58:21,437] Trial 153 finished with value: 0.3771968311098218 and parameters: {'model_name': 'SimpleImputer', 'strategy': 'most_frequent'}. Best is trial 4 with value: 0.22829013333538378.
[I 2024-10-23 11:58:21,536] Trial 156 finished with value: 0.22829013333538378 and parameters: {'model_name': 'SimpleImputer', 'strategy': 'mean'}. Best is trial 4 with value: 0.22829013333538378.
running
running
[I 2024-10-23 11:58:21,641] Trial 152 finished with value: 0.3771968311098218 and parameters: {'model_name': 'SimpleImputer', 'strategy': 'most_frequent'}. Best is trial 4 with value: 0.22829013333538378.
running
running
[I 2024-10-23 11:58:21,752] Trial 148 finished with value: 0.3771968311098218 and parameters: {'model_name': 'SimpleImputer', 'strategy': 'most_frequent'}. Best is trial 4 with value: 0.22829013333538378.
[I 2024-10-23 11:58:21,878] Trial 157 finished with value: 0.22829013333538378 and parameters: {'model_name': 'SimpleImputer', 'strategy': 'mean'}. Best is trial 4 with value: 0.22829013333538378.
[I 2024-10-23 11:58:21,974] Trial 147 finished with value: 0.3771968311098218 and parameters: {'model_name': 'SimpleImputer', 'strategy': 'most_frequent'}. Best is trial 4 with value: 0.22829013333538378.
running
running
running
[I 2024-10-23 11:58:22,250] Trial 154 finished with value: 0.3771968311098218 and parameters: {'model_name': 'SimpleImputer', 'strategy': 'most_frequent'}. Best is trial 4 with value: 0.22829013333538378.
[I 2024-10-23 11:58:22,359] Trial 159 finished with value: 0.22829013333538378 and parameters: {'model_name': 'SimpleImputer', 'strategy': 'mean'}. Best is trial 4 with value: 0.22829013333538378.
[I 2024-10-23 11:58:22,465] Trial 162 finished with value: 0.22829013333538378 and parameters: {'model_name': 'SimpleImputer', 'strategy': 'mean'}. Best is trial 4 with value: 0.22829013333538378.
running
running
[I 2024-10-23 11:58:22,607] Trial 158 finished with value: 0.22829013333538378 and parameters: {'model_name': 'SimpleImputer', 'strategy': 'mean'}. Best is trial 4 with value: 0.22829013333538378.
running
[I 2024-10-23 11:58:22,718] Trial 163 finished with value: 0.22829013333538378 and parameters: {'model_name': 'SimpleImputer', 'strategy': 'mean'}. Best is trial 4 with value: 0.22829013333538378.
running
running
[I 2024-10-23 11:58:22,843] Trial 168 finished with value: 0.22829013333538378 and parameters: {'model_name': 'SimpleImputer', 'strategy': 'mean'}. Best is trial 4 with value: 0.22829013333538378.
[I 2024-10-23 11:58:22,949] Trial 166 finished with value: 0.22829013333538378 and parameters: {'model_name': 'SimpleImputer', 'strategy': 'mean'}. Best is trial 4 with value: 0.22829013333538378.
[I 2024-10-23 11:58:23,040] Trial 164 finished with value: 0.22829013333538378 and parameters: {'model_name': 'SimpleImputer', 'strategy': 'mean'}. Best is trial 4 with value: 0.22829013333538378.
running
[I 2024-10-23 11:58:23,175] Trial 160 finished with value: 0.22829013333538378 and parameters: {'model_name': 'SimpleImputer', 'strategy': 'mean'}. Best is trial 4 with value: 0.22829013333538378.
[I 2024-10-23 11:58:23,269] Trial 161 finished with value: 0.22829013333538378 and parameters: {'model_name': 'SimpleImputer', 'strategy': 'mean'}. Best is trial 4 with value: 0.22829013333538378.
running
running
[I 2024-10-23 11:58:23,380] Trial 165 finished with value: 0.22829013333538378 and parameters: {'model_name': 'SimpleImputer', 'strategy': 'mean'}. Best is trial 4 with value: 0.22829013333538378.
running
running
[I 2024-10-23 11:58:23,515] Trial 155 finished with value: 0.3771968311098218 and parameters: {'model_name': 'SimpleImputer', 'strategy': 'most_frequent'}. Best is trial 4 with value: 0.22829013333538378.
running
[I 2024-10-23 11:58:23,647] Trial 172 finished with value: 0.22829013333538378 and parameters: {'model_name': 'SimpleImputer', 'strategy': 'mean'}. Best is trial 4 with value: 0.22829013333538378.
[I 2024-10-23 11:58:23,749] Trial 167 finished with value: 0.22829013333538378 and parameters: {'model_name': 'SimpleImputer', 'strategy': 'mean'}. Best is trial 4 with value: 0.22829013333538378.
running
running
[I 2024-10-23 11:58:23,878] Trial 170 finished with value: 0.22829013333538378 and parameters: {'model_name': 'SimpleImputer', 'strategy': 'mean'}. Best is trial 4 with value: 0.22829013333538378.
running
running
[I 2024-10-23 11:58:24,012] Trial 169 finished with value: 0.22829013333538378 and parameters: {'model_name': 'SimpleImputer', 'strategy': 'mean'}. Best is trial 4 with value: 0.22829013333538378.
running
[I 2024-10-23 11:58:24,136] Trial 175 finished with value: 0.22829013333538378 and parameters: {'model_name': 'SimpleImputer', 'strategy': 'mean'}. Best is trial 4 with value: 0.22829013333538378.
running
[I 2024-10-23 11:58:24,278] Trial 174 finished with value: 0.22829013333538378 and parameters: {'model_name': 'SimpleImputer', 'strategy': 'mean'}. Best is trial 4 with value: 0.22829013333538378.
[I 2024-10-23 11:58:24,381] Trial 177 finished with value: 0.22829013333538378 and parameters: {'model_name': 'SimpleImputer', 'strategy': 'mean'}. Best is trial 4 with value: 0.22829013333538378.
[I 2024-10-23 11:58:24,481] Trial 178 finished with value: 0.22829013333538378 and parameters: {'model_name': 'SimpleImputer', 'strategy': 'mean'}. Best is trial 4 with value: 0.22829013333538378.
running
running
running
[I 2024-10-23 11:58:24,619] Trial 171 finished with value: 0.22829013333538378 and parameters: {'model_name': 'SimpleImputer', 'strategy': 'mean'}. Best is trial 4 with value: 0.22829013333538378.
running
[I 2024-10-23 11:58:24,746] Trial 173 finished with value: 0.22829013333538378 and parameters: {'model_name': 'SimpleImputer', 'strategy': 'mean'}. Best is trial 4 with value: 0.22829013333538378.
running
[I 2024-10-23 11:58:24,931] Trial 183 finished with value: 0.22829013333538378 and parameters: {'model_name': 'SimpleImputer', 'strategy': 'mean'}. Best is trial 4 with value: 0.22829013333538378.
[I 2024-10-23 11:58:25,047] Trial 179 finished with value: 0.22829013333538378 and parameters: {'model_name': 'SimpleImputer', 'strategy': 'mean'}. Best is trial 4 with value: 0.22829013333538378.
[I 2024-10-23 11:58:25,146] Trial 185 finished with value: 0.22829013333538378 and parameters: {'model_name': 'SimpleImputer', 'strategy': 'mean'}. Best is trial 4 with value: 0.22829013333538378.
running
[I 2024-10-23 11:58:25,238] Trial 180 finished with value: 0.22829013333538378 and parameters: {'model_name': 'SimpleImputer', 'strategy': 'mean'}. Best is trial 4 with value: 0.22829013333538378.
[I 2024-10-23 11:58:25,327] Trial 181 finished with value: 0.22829013333538378 and parameters: {'model_name': 'SimpleImputer', 'strategy': 'mean'}. Best is trial 4 with value: 0.22829013333538378.
running
running
running
[I 2024-10-23 11:58:25,450] Trial 182 finished with value: 0.22829013333538378 and parameters: {'model_name': 'SimpleImputer', 'strategy': 'mean'}. Best is trial 4 with value: 0.22829013333538378.
[I 2024-10-23 11:58:25,538] Trial 176 finished with value: 0.22829013333538378 and parameters: {'model_name': 'SimpleImputer', 'strategy': 'mean'}. Best is trial 4 with value: 0.22829013333538378.
running
running
[I 2024-10-23 11:58:25,743] Trial 184 finished with value: 0.22829013333538378 and parameters: {'model_name': 'SimpleImputer', 'strategy': 'mean'}. Best is trial 4 with value: 0.22829013333538378.
[I 2024-10-23 11:58:25,837] Trial 186 finished with value: 0.22829013333538378 and parameters: {'model_name': 'SimpleImputer', 'strategy': 'mean'}. Best is trial 4 with value: 0.22829013333538378.
[I 2024-10-23 11:58:25,935] Trial 191 finished with value: 0.22829013333538378 and parameters: {'model_name': 'SimpleImputer', 'strategy': 'mean'}. Best is trial 4 with value: 0.22829013333538378.
[I 2024-10-23 11:58:26,033] Trial 187 finished with value: 0.22829013333538378 and parameters: {'model_name': 'SimpleImputer', 'strategy': 'mean'}. Best is trial 4 with value: 0.22829013333538378.
[I 2024-10-23 11:58:26,146] Trial 188 finished with value: 0.22829013333538378 and parameters: {'model_name': 'SimpleImputer', 'strategy': 'mean'}. Best is trial 4 with value: 0.22829013333538378.
[I 2024-10-23 11:58:26,250] Trial 189 finished with value: 0.22829013333538378 and parameters: {'model_name': 'SimpleImputer', 'strategy': 'mean'}. Best is trial 4 with value: 0.22829013333538378.
[I 2024-10-23 11:58:26,358] Trial 192 finished with value: 0.22829013333538378 and parameters: {'model_name': 'SimpleImputer', 'strategy': 'mean'}. Best is trial 4 with value: 0.22829013333538378.
[I 2024-10-23 11:58:26,444] Trial 199 finished with value: 0.22829013333538378 and parameters: {'model_name': 'SimpleImputer', 'strategy': 'mean'}. Best is trial 4 with value: 0.22829013333538378.
[I 2024-10-23 11:58:26,581] Trial 195 finished with value: 0.22829013333538378 and parameters: {'model_name': 'SimpleImputer', 'strategy': 'mean'}. Best is trial 4 with value: 0.22829013333538378.
[I 2024-10-23 11:58:26,681] Trial 198 finished with value: 0.22829013333538378 and parameters: {'model_name': 'SimpleImputer', 'strategy': 'mean'}. Best is trial 4 with value: 0.22829013333538378.
[I 2024-10-23 11:58:26,772] Trial 190 finished with value: 0.22829013333538378 and parameters: {'model_name': 'SimpleImputer', 'strategy': 'mean'}. Best is trial 4 with value: 0.22829013333538378.
[I 2024-10-23 11:58:26,860] Trial 193 finished with value: 0.22829013333538378 and parameters: {'model_name': 'SimpleImputer', 'strategy': 'mean'}. Best is trial 4 with value: 0.22829013333538378.
[I 2024-10-23 11:58:26,945] Trial 197 finished with value: 0.22829013333538378 and parameters: {'model_name': 'SimpleImputer', 'strategy': 'mean'}. Best is trial 4 with value: 0.22829013333538378.
[I 2024-10-23 11:58:27,037] Trial 194 finished with value: 0.22829013333538378 and parameters: {'model_name': 'SimpleImputer', 'strategy': 'mean'}. Best is trial 4 with value: 0.22829013333538378.
