[I 2024-08-16 10:57:42,279] Trial 108 finished with value: 0.1431743055927738 and parameters: {'model_name': 'SimpleImputer', 'strategy': 'mean'}. Best is trial 4 with value: 0.1431743055927738.
running
[I 2024-08-16 10:57:42,410] Trial 105 finished with value: 0.1431743055927738 and parameters: {'model_name': 'SimpleImputer', 'strategy': 'mean'}. Best is trial 4 with value: 0.1431743055927738.
running
[I 2024-08-16 10:57:42,530] Trial 103 finished with value: 0.1431743055927738 and parameters: {'model_name': 'SimpleImputer', 'strategy': 'mean'}. Best is trial 4 with value: 0.1431743055927738.
running
[I 2024-08-16 10:57:42,690] Trial 104 finished with value: 0.1431743055927738 and parameters: {'model_name': 'SimpleImputer', 'strategy': 'mean'}. Best is trial 4 with value: 0.1431743055927738.
[I 2024-08-16 10:57:42,789] Trial 106 finished with value: 0.1431743055927738 and parameters: {'model_name': 'SimpleImputer', 'strategy': 'mean'}. Best is trial 4 with value: 0.1431743055927738.
running
running
[I 2024-08-16 10:57:42,905] Trial 109 finished with value: 0.1431743055927738 and parameters: {'model_name': 'SimpleImputer', 'strategy': 'mean'}. Best is trial 4 with value: 0.1431743055927738.
running
[I 2024-08-16 10:57:43,078] Trial 111 finished with value: 0.1431743055927738 and parameters: {'model_name': 'SimpleImputer', 'strategy': 'mean'}. Best is trial 4 with value: 0.1431743055927738.
running
[I 2024-08-16 10:57:43,331] Trial 110 finished with value: 0.1431743055927738 and parameters: {'model_name': 'SimpleImputer', 'strategy': 'mean'}. Best is trial 4 with value: 0.1431743055927738.
running
[I 2024-08-16 10:57:43,558] Trial 112 finished with value: 0.1431743055927738 and parameters: {'model_name': 'SimpleImputer', 'strategy': 'mean'}. Best is trial 4 with value: 0.1431743055927738.
running
[I 2024-08-16 10:57:43,835] Trial 115 finished with value: 0.1431743055927738 and parameters: {'model_name': 'SimpleImputer', 'strategy': 'mean'}. Best is trial 4 with value: 0.1431743055927738.
[I 2024-08-16 10:57:43,944] Trial 116 finished with value: 0.1431743055927738 and parameters: {'model_name': 'SimpleImputer', 'strategy': 'mean'}. Best is trial 4 with value: 0.1431743055927738.
running
[I 2024-08-16 10:57:44,040] Trial 114 finished with value: 0.1431743055927738 and parameters: {'model_name': 'SimpleImputer', 'strategy': 'mean'}. Best is trial 4 with value: 0.1431743055927738.
running
running
[I 2024-08-16 10:57:44,271] Trial 113 finished with value: 0.1431743055927738 and parameters: {'model_name': 'SimpleImputer', 'strategy': 'mean'}. Best is trial 4 with value: 0.1431743055927738.
[I 2024-08-16 10:57:44,395] Trial 120 finished with value: 0.1431743055927738 and parameters: {'model_name': 'SimpleImputer', 'strategy': 'mean'}. Best is trial 4 with value: 0.1431743055927738.
running
running
[I 2024-08-16 10:57:44,571] Trial 117 finished with value: 0.1431743055927738 and parameters: {'model_name': 'SimpleImputer', 'strategy': 'mean'}. Best is trial 4 with value: 0.1431743055927738.
running
[I 2024-08-16 10:57:44,682] Trial 118 finished with value: 0.1431743055927738 and parameters: {'model_name': 'SimpleImputer', 'strategy': 'mean'}. Best is trial 4 with value: 0.1431743055927738.
running
[I 2024-08-16 10:57:44,833] Trial 121 finished with value: 0.1431743055927738 and parameters: {'model_name': 'SimpleImputer', 'strategy': 'mean'}. Best is trial 4 with value: 0.1431743055927738.
running
[I 2024-08-16 10:57:44,959] Trial 125 finished with value: 0.1431743055927738 and parameters: {'model_name': 'SimpleImputer', 'strategy': 'mean'}. Best is trial 4 with value: 0.1431743055927738.
running
[I 2024-08-16 10:57:45,088] Trial 122 finished with value: 0.1431743055927738 and parameters: {'model_name': 'SimpleImputer', 'strategy': 'mean'}. Best is trial 4 with value: 0.1431743055927738.
running
[I 2024-08-16 10:57:45,235] Trial 124 finished with value: 0.1431743055927738 and parameters: {'model_name': 'SimpleImputer', 'strategy': 'mean'}. Best is trial 4 with value: 0.1431743055927738.
[I 2024-08-16 10:57:45,335] Trial 126 finished with value: 0.1431743055927738 and parameters: {'model_name': 'SimpleImputer', 'strategy': 'mean'}. Best is trial 4 with value: 0.1431743055927738.
[I 2024-08-16 10:57:45,424] Trial 119 finished with value: 0.1431743055927738 and parameters: {'model_name': 'SimpleImputer', 'strategy': 'mean'}. Best is trial 4 with value: 0.1431743055927738.
running
running
running
[I 2024-08-16 10:57:45,632] Trial 123 finished with value: 0.1431743055927738 and parameters: {'model_name': 'SimpleImputer', 'strategy': 'mean'}. Best is trial 4 with value: 0.1431743055927738.
running
[I 2024-08-16 10:57:45,815] Trial 127 finished with value: 0.1431743055927738 and parameters: {'model_name': 'SimpleImputer', 'strategy': 'mean'}. Best is trial 4 with value: 0.1431743055927738.
running
[I 2024-08-16 10:57:46,055] Trial 128 finished with value: 0.1431743055927738 and parameters: {'model_name': 'SimpleImputer', 'strategy': 'mean'}. Best is trial 4 with value: 0.1431743055927738.
running
[I 2024-08-16 10:57:46,392] Trial 133 finished with value: 0.1431743055927738 and parameters: {'model_name': 'SimpleImputer', 'strategy': 'mean'}. Best is trial 4 with value: 0.1431743055927738.
[I 2024-08-16 10:57:46,497] Trial 130 finished with value: 0.1431743055927738 and parameters: {'model_name': 'SimpleImputer', 'strategy': 'mean'}. Best is trial 4 with value: 0.1431743055927738.
running
running
[I 2024-08-16 10:57:46,601] Trial 131 finished with value: 0.1431743055927738 and parameters: {'model_name': 'SimpleImputer', 'strategy': 'mean'}. Best is trial 4 with value: 0.1431743055927738.
running
[I 2024-08-16 10:57:46,701] Trial 129 finished with value: 0.1431743055927738 and parameters: {'model_name': 'SimpleImputer', 'strategy': 'mean'}. Best is trial 4 with value: 0.1431743055927738.
running
[I 2024-08-16 10:57:46,960] Trial 137 finished with value: 0.1431743055927738 and parameters: {'model_name': 'SimpleImputer', 'strategy': 'mean'}. Best is trial 4 with value: 0.1431743055927738.
running
[I 2024-08-16 10:57:47,097] Trial 132 finished with value: 0.1431743055927738 and parameters: {'model_name': 'SimpleImputer', 'strategy': 'mean'}. Best is trial 4 with value: 0.1431743055927738.
running
[I 2024-08-16 10:57:47,275] Trial 134 finished with value: 0.1431743055927738 and parameters: {'model_name': 'SimpleImputer', 'strategy': 'mean'}. Best is trial 4 with value: 0.1431743055927738.
running
[I 2024-08-16 10:57:47,589] Trial 139 finished with value: 0.1431743055927738 and parameters: {'model_name': 'SimpleImputer', 'strategy': 'mean'}. Best is trial 4 with value: 0.1431743055927738.
running
[I 2024-08-16 10:57:47,760] Trial 136 finished with value: 0.1431743055927738 and parameters: {'model_name': 'SimpleImputer', 'strategy': 'mean'}. Best is trial 4 with value: 0.1431743055927738.
running
[I 2024-08-16 10:57:47,942] Trial 135 finished with value: 0.1431743055927738 and parameters: {'model_name': 'SimpleImputer', 'strategy': 'mean'}. Best is trial 4 with value: 0.1431743055927738.
running
[I 2024-08-16 10:57:48,067] Trial 141 finished with value: 0.1431743055927738 and parameters: {'model_name': 'SimpleImputer', 'strategy': 'mean'}. Best is trial 4 with value: 0.1431743055927738.
running
[I 2024-08-16 10:57:48,209] Trial 138 finished with value: 0.1431743055927738 and parameters: {'model_name': 'SimpleImputer', 'strategy': 'mean'}. Best is trial 4 with value: 0.1431743055927738.
running
[I 2024-08-16 10:57:48,530] Trial 140 finished with value: 0.1431743055927738 and parameters: {'model_name': 'SimpleImputer', 'strategy': 'mean'}. Best is trial 4 with value: 0.1431743055927738.
running
[I 2024-08-16 10:57:48,678] Trial 142 finished with value: 0.1431743055927738 and parameters: {'model_name': 'SimpleImputer', 'strategy': 'mean'}. Best is trial 4 with value: 0.1431743055927738.
running
[I 2024-08-16 10:57:50,118] Trial 155 finished with value: 0.1431743055927738 and parameters: {'model_name': 'SimpleImputer', 'strategy': 'mean'}. Best is trial 4 with value: 0.1431743055927738.
running
[I 2024-08-16 10:57:52,625] Trial 144 finished with value: 0.1710077841200535 and parameters: {'model_name': 'SimpleImputer', 'strategy': 'most_frequent'}. Best is trial 4 with value: 0.1431743055927738.
running
[I 2024-08-16 10:57:53,061] Trial 147 finished with value: 0.1710077841200535 and parameters: {'model_name': 'SimpleImputer', 'strategy': 'most_frequent'}. Best is trial 4 with value: 0.1431743055927738.
running
[I 2024-08-16 10:57:53,212] Trial 145 finished with value: 0.1710077841200535 and parameters: {'model_name': 'SimpleImputer', 'strategy': 'most_frequent'}. Best is trial 4 with value: 0.1431743055927738.
running
[I 2024-08-16 10:57:53,350] Trial 143 finished with value: 0.1710077841200535 and parameters: {'model_name': 'SimpleImputer', 'strategy': 'most_frequent'}. Best is trial 4 with value: 0.1431743055927738.
running
[I 2024-08-16 10:57:53,970] Trial 151 finished with value: 0.1710077841200535 and parameters: {'model_name': 'SimpleImputer', 'strategy': 'most_frequent'}. Best is trial 4 with value: 0.1431743055927738.
running
[I 2024-08-16 10:57:54,265] Trial 146 finished with value: 0.1710077841200535 and parameters: {'model_name': 'SimpleImputer', 'strategy': 'most_frequent'}. Best is trial 4 with value: 0.1431743055927738.
[I 2024-08-16 10:57:54,362] Trial 148 finished with value: 0.1710077841200535 and parameters: {'model_name': 'SimpleImputer', 'strategy': 'most_frequent'}. Best is trial 4 with value: 0.1431743055927738.
running
running
[I 2024-08-16 10:57:54,490] Trial 149 finished with value: 0.1710077841200535 and parameters: {'model_name': 'SimpleImputer', 'strategy': 'most_frequent'}. Best is trial 4 with value: 0.1431743055927738.
running
[I 2024-08-16 10:57:54,795] Trial 157 finished with value: 0.1710077841200535 and parameters: {'model_name': 'SimpleImputer', 'strategy': 'most_frequent'}. Best is trial 4 with value: 0.1431743055927738.
running
[I 2024-08-16 10:57:55,073] Trial 160 finished with value: 0.1431743055927738 and parameters: {'model_name': 'SimpleImputer', 'strategy': 'mean'}. Best is trial 4 with value: 0.1431743055927738.
[I 2024-08-16 10:57:55,171] Trial 152 finished with value: 0.1710077841200535 and parameters: {'model_name': 'SimpleImputer', 'strategy': 'most_frequent'}. Best is trial 4 with value: 0.1431743055927738.
running
running
[I 2024-08-16 10:57:55,335] Trial 161 finished with value: 0.1431743055927738 and parameters: {'model_name': 'SimpleImputer', 'strategy': 'mean'}. Best is trial 4 with value: 0.1431743055927738.
running
[I 2024-08-16 10:57:55,515] Trial 150 finished with value: 0.1710077841200535 and parameters: {'model_name': 'SimpleImputer', 'strategy': 'most_frequent'}. Best is trial 4 with value: 0.1431743055927738.
running
[I 2024-08-16 10:57:55,755] Trial 162 finished with value: 0.1431743055927738 and parameters: {'model_name': 'SimpleImputer', 'strategy': 'mean'}. Best is trial 4 with value: 0.1431743055927738.
running
[I 2024-08-16 10:57:55,949] Trial 154 finished with value: 0.1710077841200535 and parameters: {'model_name': 'SimpleImputer', 'strategy': 'most_frequent'}. Best is trial 4 with value: 0.1431743055927738.
running
[I 2024-08-16 10:57:56,165] Trial 163 finished with value: 0.1431743055927738 and parameters: {'model_name': 'SimpleImputer', 'strategy': 'mean'}. Best is trial 4 with value: 0.1431743055927738.
[I 2024-08-16 10:57:56,263] Trial 156 finished with value: 0.1710077841200535 and parameters: {'model_name': 'SimpleImputer', 'strategy': 'most_frequent'}. Best is trial 4 with value: 0.1431743055927738.
running
running
[I 2024-08-16 10:57:56,362] Trial 158 finished with value: 0.1710077841200535 and parameters: {'model_name': 'SimpleImputer', 'strategy': 'most_frequent'}. Best is trial 4 with value: 0.1431743055927738.
running
[I 2024-08-16 10:57:56,684] Trial 165 finished with value: 0.1431743055927738 and parameters: {'model_name': 'SimpleImputer', 'strategy': 'mean'}. Best is trial 4 with value: 0.1431743055927738.
running
[I 2024-08-16 10:57:56,779] Trial 164 finished with value: 0.1431743055927738 and parameters: {'model_name': 'SimpleImputer', 'strategy': 'mean'}. Best is trial 4 with value: 0.1431743055927738.
running
[I 2024-08-16 10:57:56,944] Trial 167 finished with value: 0.1431743055927738 and parameters: {'model_name': 'SimpleImputer', 'strategy': 'mean'}. Best is trial 4 with value: 0.1431743055927738.
running
[I 2024-08-16 10:57:57,084] Trial 153 finished with value: 0.1710077841200535 and parameters: {'model_name': 'SimpleImputer', 'strategy': 'most_frequent'}. Best is trial 4 with value: 0.1431743055927738.
running
[I 2024-08-16 10:57:57,312] Trial 170 finished with value: 0.1431743055927738 and parameters: {'model_name': 'SimpleImputer', 'strategy': 'mean'}. Best is trial 4 with value: 0.1431743055927738.
running
[I 2024-08-16 10:57:57,433] Trial 166 finished with value: 0.1431743055927738 and parameters: {'model_name': 'SimpleImputer', 'strategy': 'mean'}. Best is trial 4 with value: 0.1431743055927738.
running
[I 2024-08-16 10:57:57,613] Trial 168 finished with value: 0.1431743055927738 and parameters: {'model_name': 'SimpleImputer', 'strategy': 'mean'}. Best is trial 4 with value: 0.1431743055927738.
[I 2024-08-16 10:57:57,722] Trial 169 finished with value: 0.1431743055927738 and parameters: {'model_name': 'SimpleImputer', 'strategy': 'mean'}. Best is trial 4 with value: 0.1431743055927738.
running
running
[I 2024-08-16 10:57:57,902] Trial 171 finished with value: 0.1431743055927738 and parameters: {'model_name': 'SimpleImputer', 'strategy': 'mean'}. Best is trial 4 with value: 0.1431743055927738.
running
[I 2024-08-16 10:57:58,116] Trial 172 finished with value: 0.1431743055927738 and parameters: {'model_name': 'SimpleImputer', 'strategy': 'mean'}. Best is trial 4 with value: 0.1431743055927738.
[I 2024-08-16 10:57:58,222] Trial 177 finished with value: 0.1431743055927738 and parameters: {'model_name': 'SimpleImputer', 'strategy': 'mean'}. Best is trial 4 with value: 0.1431743055927738.
running
running
[I 2024-08-16 10:57:58,435] Trial 173 finished with value: 0.1431743055927738 and parameters: {'model_name': 'SimpleImputer', 'strategy': 'mean'}. Best is trial 4 with value: 0.1431743055927738.
running
[I 2024-08-16 10:57:58,607] Trial 159 finished with value: 0.1710077841200535 and parameters: {'model_name': 'SimpleImputer', 'strategy': 'most_frequent'}. Best is trial 4 with value: 0.1431743055927738.
running
[I 2024-08-16 10:57:58,749] Trial 174 finished with value: 0.1431743055927738 and parameters: {'model_name': 'SimpleImputer', 'strategy': 'mean'}. Best is trial 4 with value: 0.1431743055927738.
running
[I 2024-08-16 10:57:58,998] Trial 178 finished with value: 0.1431743055927738 and parameters: {'model_name': 'SimpleImputer', 'strategy': 'mean'}. Best is trial 4 with value: 0.1431743055927738.
running
[I 2024-08-16 10:57:59,167] Trial 179 finished with value: 0.1431743055927738 and parameters: {'model_name': 'SimpleImputer', 'strategy': 'mean'}. Best is trial 4 with value: 0.1431743055927738.
running
[I 2024-08-16 10:57:59,328] Trial 175 finished with value: 0.1431743055927738 and parameters: {'model_name': 'SimpleImputer', 'strategy': 'mean'}. Best is trial 4 with value: 0.1431743055927738.
[I 2024-08-16 10:57:59,422] Trial 182 finished with value: 0.1431743055927738 and parameters: {'model_name': 'SimpleImputer', 'strategy': 'mean'}. Best is trial 4 with value: 0.1431743055927738.
running
running
[I 2024-08-16 10:57:59,541] Trial 181 finished with value: 0.1431743055927738 and parameters: {'model_name': 'SimpleImputer', 'strategy': 'mean'}. Best is trial 4 with value: 0.1431743055927738.
running
[I 2024-08-16 10:57:59,656] Trial 176 finished with value: 0.1431743055927738 and parameters: {'model_name': 'SimpleImputer', 'strategy': 'mean'}. Best is trial 4 with value: 0.1431743055927738.
running
[I 2024-08-16 10:57:59,778] Trial 180 finished with value: 0.1431743055927738 and parameters: {'model_name': 'SimpleImputer', 'strategy': 'mean'}. Best is trial 4 with value: 0.1431743055927738.
running
[I 2024-08-16 10:57:59,985] Trial 183 finished with value: 0.1431743055927738 and parameters: {'model_name': 'SimpleImputer', 'strategy': 'mean'}. Best is trial 4 with value: 0.1431743055927738.
running
[I 2024-08-16 10:58:00,176] Trial 185 finished with value: 0.1431743055927738 and parameters: {'model_name': 'SimpleImputer', 'strategy': 'mean'}. Best is trial 4 with value: 0.1431743055927738.
[I 2024-08-16 10:58:00,282] Trial 188 finished with value: 0.1431743055927738 and parameters: {'model_name': 'SimpleImputer', 'strategy': 'mean'}. Best is trial 4 with value: 0.1431743055927738.
[I 2024-08-16 10:58:00,442] Trial 186 finished with value: 0.1431743055927738 and parameters: {'model_name': 'SimpleImputer', 'strategy': 'mean'}. Best is trial 4 with value: 0.1431743055927738.
[I 2024-08-16 10:58:00,554] Trial 184 finished with value: 0.1431743055927738 and parameters: {'model_name': 'SimpleImputer', 'strategy': 'mean'}. Best is trial 4 with value: 0.1431743055927738.
[I 2024-08-16 10:58:00,728] Trial 187 finished with value: 0.1431743055927738 and parameters: {'model_name': 'SimpleImputer', 'strategy': 'mean'}. Best is trial 4 with value: 0.1431743055927738.
[I 2024-08-16 10:58:00,912] Trial 189 finished with value: 0.1431743055927738 and parameters: {'model_name': 'SimpleImputer', 'strategy': 'mean'}. Best is trial 4 with value: 0.1431743055927738.
[I 2024-08-16 10:58:01,088] Trial 190 finished with value: 0.1431743055927738 and parameters: {'model_name': 'SimpleImputer', 'strategy': 'mean'}. Best is trial 4 with value: 0.1431743055927738.
[I 2024-08-16 10:58:01,184] Trial 192 finished with value: 0.1431743055927738 and parameters: {'model_name': 'SimpleImputer', 'strategy': 'mean'}. Best is trial 4 with value: 0.1431743055927738.
[I 2024-08-16 10:58:01,323] Trial 191 finished with value: 0.1431743055927738 and parameters: {'model_name': 'SimpleImputer', 'strategy': 'mean'}. Best is trial 4 with value: 0.1431743055927738.
[I 2024-08-16 10:58:01,430] Trial 196 finished with value: 0.1431743055927738 and parameters: {'model_name': 'SimpleImputer', 'strategy': 'mean'}. Best is trial 4 with value: 0.1431743055927738.
[I 2024-08-16 10:58:01,534] Trial 197 finished with value: 0.1431743055927738 and parameters: {'model_name': 'SimpleImputer', 'strategy': 'mean'}. Best is trial 4 with value: 0.1431743055927738.
[I 2024-08-16 10:58:01,628] Trial 195 finished with value: 0.1431743055927738 and parameters: {'model_name': 'SimpleImputer', 'strategy': 'mean'}. Best is trial 4 with value: 0.1431743055927738.
[I 2024-08-16 10:58:01,714] Trial 194 finished with value: 0.1431743055927738 and parameters: {'model_name': 'SimpleImputer', 'strategy': 'mean'}. Best is trial 4 with value: 0.1431743055927738.
[I 2024-08-16 10:58:01,798] Trial 193 finished with value: 0.1431743055927738 and parameters: {'model_name': 'SimpleImputer', 'strategy': 'mean'}. Best is trial 4 with value: 0.1431743055927738.
[I 2024-08-16 10:58:01,882] Trial 199 finished with value: 0.1431743055927738 and parameters: {'model_name': 'SimpleImputer', 'strategy': 'mean'}. Best is trial 4 with value: 0.1431743055927738.
