[I 2024-08-15 10:45:46,183] Trial 197 finished with value: 0.09424039737062251 and parameters: {'model_name': 'SimpleImputer', 'strategy': 'median'}. Best is trial 8 with value: 0.09424039737062251.
fit
simple fit
simple transform
0     0
1     0
2     0
3     0
4     0
5     0
6     0
7     0
8     0
9     0
10    0
11    0
12    0
13    0
14    0
15    0
dtype: int64
0     0
1     0
2     0
3     0
4     0
5     0
6     0
7     0
8     0
9     0
10    0
11    0
12    0
13    0
14    0
15    0
dtype: int64
0.09424039737062251
{'model_name': 'SimpleImputer', 'strategy': 'median'}
running experiment 2/3 - Does reconstruction give good automl predictions
Start est fit
  0%|          | 0/25 [00:00<?, ?it/s]Generation:   0%|          | 0/25 [00:00<?, ?it/s]WARNING AN INDIVIDUAL TIMED OUT: 
 <tpot2.search_spaces.pipelines.sequential.SequentialPipelineIndividual object at 0x155475d3e0b0> 

Generation:  1
Best f1_score score: 0.9330899310189504
Generation:   4%|▍         | 1/25 [10:02<4:00:51, 602.14s/it]Generation:  2
Best f1_score score: 0.947870238397994
Generation:   8%|▊         | 2/25 [12:41<2:10:55, 341.54s/it]Generation:  3
Best f1_score score: 0.947870238397994
Generation:  12%|█▏        | 3/25 [18:13<2:03:44, 337.47s/it]WARNING AN INDIVIDUAL TIMED OUT: 
 <tpot2.search_spaces.pipelines.sequential.SequentialPipelineIndividual object at 0x155475de1cf0> 

Generation:  4
Best f1_score score: 0.9559266953659854
Generation:  16%|█▌        | 4/25 [28:18<2:35:00, 442.86s/it]WARNING THIS INDIVIDUAL CAUSED AND EXCEPTION 
 <tpot2.search_spaces.pipelines.sequential.SequentialPipelineIndividual object at 0x155475a3d3f0> 
 Argument 'metric' has incorrect type (expected str, got numpy.str_) 
 Traceback (most recent call last):
  File "/common/ketrong/tpotexp/tpot2/tpot2/utils/eval_utils.py", line 53, in objective_nan_wrapper
    value = func_timeout.func_timeout(timeout, objective_function, args=[individual], kwargs=objective_kwargs)
  File "/common/ketrong/tpotexp/env/lib/python3.10/site-packages/func_timeout/dafunc.py", line 108, in func_timeout
    raise_exception(exception)
  File "/common/ketrong/tpotexp/env/lib/python3.10/site-packages/func_timeout/py3_raise.py", line 7, in raise_exception
    raise exception[0] from None
  File "/common/ketrong/tpotexp/tpot2/tpot2/tpot_estimator/estimator.py", line 623, in objective_function
    return objective_function_generator(
  File "/common/ketrong/tpotexp/tpot2/tpot2/tpot_estimator/estimator_utils.py", line 55, in objective_function_generator
    cv_obj_scores = cross_val_score_objective(sklearn.base.clone(pipeline),x,y,scorers=scorers, cv=cv , fold=step)
  File "/common/ketrong/tpotexp/tpot2/tpot2/tpot_estimator/cross_val_utils.py", line 31, in cross_val_score_objective
    this_fold_scores = [sklearn.metrics.get_scorer(scorer)(this_fold_pipeline, X_test, y_test) for scorer in scorers]
  File "/common/ketrong/tpotexp/tpot2/tpot2/tpot_estimator/cross_val_utils.py", line 31, in <listcomp>
    this_fold_scores = [sklearn.metrics.get_scorer(scorer)(this_fold_pipeline, X_test, y_test) for scorer in scorers]
  File "/common/ketrong/tpotexp/env/lib/python3.10/site-packages/sklearn/metrics/_scorer.py", line 279, in __call__
    return self._score(partial(_cached_call, None), estimator, X, y_true, **_kwargs)
  File "/common/ketrong/tpotexp/env/lib/python3.10/site-packages/sklearn/metrics/_scorer.py", line 371, in _score
    y_pred = method_caller(
  File "/common/ketrong/tpotexp/env/lib/python3.10/site-packages/sklearn/metrics/_scorer.py", line 89, in _cached_call
    result, _ = _get_response_values(
  File "/common/ketrong/tpotexp/env/lib/python3.10/site-packages/sklearn/utils/_response.py", line 211, in _get_response_values
    y_pred = prediction_method(X)
  File "/common/ketrong/tpotexp/env/lib/python3.10/site-packages/sklearn/pipeline.py", line 601, in predict
    return self.steps[-1][1].predict(Xt, **params)
  File "/common/ketrong/tpotexp/env/lib/python3.10/site-packages/sklearn/neighbors/_classification.py", line 259, in predict
    probabilities = self.predict_proba(X)
  File "/common/ketrong/tpotexp/env/lib/python3.10/site-packages/sklearn/neighbors/_classification.py", line 343, in predict_proba
    probabilities = ArgKminClassMode.compute(
  File "/common/ketrong/tpotexp/env/lib/python3.10/site-packages/sklearn/metrics/_pairwise_distances_reduction/_dispatcher.py", line 584, in compute
    return ArgKminClassMode64.compute(
TypeError: Argument 'metric' has incorrect type (expected str, got numpy.str_)

Generation:  5
Best f1_score score: 0.9559266953659854
Generation:  20%|██        | 5/25 [34:40<2:20:21, 421.08s/it]WARNING THIS INDIVIDUAL CAUSED AND EXCEPTION 
 <tpot2.search_spaces.pipelines.sequential.SequentialPipelineIndividual object at 0x155474ca2500> 
 Argument 'metric' has incorrect type (expected str, got numpy.str_) 
 Traceback (most recent call last):
  File "/common/ketrong/tpotexp/tpot2/tpot2/utils/eval_utils.py", line 53, in objective_nan_wrapper
    value = func_timeout.func_timeout(timeout, objective_function, args=[individual], kwargs=objective_kwargs)
  File "/common/ketrong/tpotexp/env/lib/python3.10/site-packages/func_timeout/dafunc.py", line 108, in func_timeout
    raise_exception(exception)
  File "/common/ketrong/tpotexp/env/lib/python3.10/site-packages/func_timeout/py3_raise.py", line 7, in raise_exception
    raise exception[0] from None
  File "/common/ketrong/tpotexp/tpot2/tpot2/tpot_estimator/estimator.py", line 623, in objective_function
    return objective_function_generator(
  File "/common/ketrong/tpotexp/tpot2/tpot2/tpot_estimator/estimator_utils.py", line 55, in objective_function_generator
    cv_obj_scores = cross_val_score_objective(sklearn.base.clone(pipeline),x,y,scorers=scorers, cv=cv , fold=step)
  File "/common/ketrong/tpotexp/tpot2/tpot2/tpot_estimator/cross_val_utils.py", line 31, in cross_val_score_objective
    this_fold_scores = [sklearn.metrics.get_scorer(scorer)(this_fold_pipeline, X_test, y_test) for scorer in scorers]
  File "/common/ketrong/tpotexp/tpot2/tpot2/tpot_estimator/cross_val_utils.py", line 31, in <listcomp>
    this_fold_scores = [sklearn.metrics.get_scorer(scorer)(this_fold_pipeline, X_test, y_test) for scorer in scorers]
  File "/common/ketrong/tpotexp/env/lib/python3.10/site-packages/sklearn/metrics/_scorer.py", line 279, in __call__
    return self._score(partial(_cached_call, None), estimator, X, y_true, **_kwargs)
  File "/common/ketrong/tpotexp/env/lib/python3.10/site-packages/sklearn/metrics/_scorer.py", line 371, in _score
    y_pred = method_caller(
  File "/common/ketrong/tpotexp/env/lib/python3.10/site-packages/sklearn/metrics/_scorer.py", line 89, in _cached_call
    result, _ = _get_response_values(
  File "/common/ketrong/tpotexp/env/lib/python3.10/site-packages/sklearn/utils/_response.py", line 211, in _get_response_values
    y_pred = prediction_method(X)
  File "/common/ketrong/tpotexp/env/lib/python3.10/site-packages/sklearn/pipeline.py", line 601, in predict
    return self.steps[-1][1].predict(Xt, **params)
  File "/common/ketrong/tpotexp/env/lib/python3.10/site-packages/sklearn/neighbors/_classification.py", line 259, in predict
    probabilities = self.predict_proba(X)
  File "/common/ketrong/tpotexp/env/lib/python3.10/site-packages/sklearn/neighbors/_classification.py", line 343, in predict_proba
    probabilities = ArgKminClassMode.compute(
  File "/common/ketrong/tpotexp/env/lib/python3.10/site-packages/sklearn/metrics/_pairwise_distances_reduction/_dispatcher.py", line 584, in compute
    return ArgKminClassMode64.compute(
TypeError: Argument 'metric' has incorrect type (expected str, got numpy.str_)

WARNING AN INDIVIDUAL TIMED OUT: 
 <tpot2.search_spaces.pipelines.sequential.SequentialPipelineIndividual object at 0x155475d3fb50> 

Generation:  6
Best f1_score score: 0.9559266953659854
Generation:  24%|██▍       | 6/25 [44:45<2:33:04, 483.42s/it]WARNING THIS INDIVIDUAL CAUSED AND EXCEPTION 
 <tpot2.search_spaces.pipelines.sequential.SequentialPipelineIndividual object at 0x155475258eb0> 
 Argument 'metric' has incorrect type (expected str, got numpy.str_) 
 Traceback (most recent call last):
  File "/common/ketrong/tpotexp/tpot2/tpot2/utils/eval_utils.py", line 53, in objective_nan_wrapper
    value = func_timeout.func_timeout(timeout, objective_function, args=[individual], kwargs=objective_kwargs)
  File "/common/ketrong/tpotexp/env/lib/python3.10/site-packages/func_timeout/dafunc.py", line 108, in func_timeout
    raise_exception(exception)
  File "/common/ketrong/tpotexp/env/lib/python3.10/site-packages/func_timeout/py3_raise.py", line 7, in raise_exception
    raise exception[0] from None
  File "/common/ketrong/tpotexp/tpot2/tpot2/tpot_estimator/estimator.py", line 623, in objective_function
    return objective_function_generator(
  File "/common/ketrong/tpotexp/tpot2/tpot2/tpot_estimator/estimator_utils.py", line 55, in objective_function_generator
    cv_obj_scores = cross_val_score_objective(sklearn.base.clone(pipeline),x,y,scorers=scorers, cv=cv , fold=step)
  File "/common/ketrong/tpotexp/tpot2/tpot2/tpot_estimator/cross_val_utils.py", line 31, in cross_val_score_objective
    this_fold_scores = [sklearn.metrics.get_scorer(scorer)(this_fold_pipeline, X_test, y_test) for scorer in scorers]
  File "/common/ketrong/tpotexp/tpot2/tpot2/tpot_estimator/cross_val_utils.py", line 31, in <listcomp>
    this_fold_scores = [sklearn.metrics.get_scorer(scorer)(this_fold_pipeline, X_test, y_test) for scorer in scorers]
  File "/common/ketrong/tpotexp/env/lib/python3.10/site-packages/sklearn/metrics/_scorer.py", line 279, in __call__
    return self._score(partial(_cached_call, None), estimator, X, y_true, **_kwargs)
  File "/common/ketrong/tpotexp/env/lib/python3.10/site-packages/sklearn/metrics/_scorer.py", line 371, in _score
    y_pred = method_caller(
  File "/common/ketrong/tpotexp/env/lib/python3.10/site-packages/sklearn/metrics/_scorer.py", line 89, in _cached_call
    result, _ = _get_response_values(
  File "/common/ketrong/tpotexp/env/lib/python3.10/site-packages/sklearn/utils/_response.py", line 211, in _get_response_values
    y_pred = prediction_method(X)
  File "/common/ketrong/tpotexp/env/lib/python3.10/site-packages/sklearn/pipeline.py", line 601, in predict
    return self.steps[-1][1].predict(Xt, **params)
  File "/common/ketrong/tpotexp/env/lib/python3.10/site-packages/sklearn/neighbors/_classification.py", line 259, in predict
    probabilities = self.predict_proba(X)
  File "/common/ketrong/tpotexp/env/lib/python3.10/site-packages/sklearn/neighbors/_classification.py", line 343, in predict_proba
    probabilities = ArgKminClassMode.compute(
  File "/common/ketrong/tpotexp/env/lib/python3.10/site-packages/sklearn/metrics/_pairwise_distances_reduction/_dispatcher.py", line 584, in compute
    return ArgKminClassMode64.compute(
TypeError: Argument 'metric' has incorrect type (expected str, got numpy.str_)

WARNING THIS INDIVIDUAL CAUSED AND EXCEPTION 
 <tpot2.search_spaces.pipelines.sequential.SequentialPipelineIndividual object at 0x15547592a740> 
 Argument 'metric' has incorrect type (expected str, got numpy.str_) 
 Traceback (most recent call last):
  File "/common/ketrong/tpotexp/tpot2/tpot2/utils/eval_utils.py", line 53, in objective_nan_wrapper
    value = func_timeout.func_timeout(timeout, objective_function, args=[individual], kwargs=objective_kwargs)
  File "/common/ketrong/tpotexp/env/lib/python3.10/site-packages/func_timeout/dafunc.py", line 108, in func_timeout
    raise_exception(exception)
  File "/common/ketrong/tpotexp/env/lib/python3.10/site-packages/func_timeout/py3_raise.py", line 7, in raise_exception
    raise exception[0] from None
  File "/common/ketrong/tpotexp/tpot2/tpot2/tpot_estimator/estimator.py", line 623, in objective_function
    return objective_function_generator(
  File "/common/ketrong/tpotexp/tpot2/tpot2/tpot_estimator/estimator_utils.py", line 55, in objective_function_generator
    cv_obj_scores = cross_val_score_objective(sklearn.base.clone(pipeline),x,y,scorers=scorers, cv=cv , fold=step)
  File "/common/ketrong/tpotexp/tpot2/tpot2/tpot_estimator/cross_val_utils.py", line 31, in cross_val_score_objective
    this_fold_scores = [sklearn.metrics.get_scorer(scorer)(this_fold_pipeline, X_test, y_test) for scorer in scorers]
  File "/common/ketrong/tpotexp/tpot2/tpot2/tpot_estimator/cross_val_utils.py", line 31, in <listcomp>
    this_fold_scores = [sklearn.metrics.get_scorer(scorer)(this_fold_pipeline, X_test, y_test) for scorer in scorers]
  File "/common/ketrong/tpotexp/env/lib/python3.10/site-packages/sklearn/metrics/_scorer.py", line 279, in __call__
    return self._score(partial(_cached_call, None), estimator, X, y_true, **_kwargs)
  File "/common/ketrong/tpotexp/env/lib/python3.10/site-packages/sklearn/metrics/_scorer.py", line 371, in _score
    y_pred = method_caller(
  File "/common/ketrong/tpotexp/env/lib/python3.10/site-packages/sklearn/metrics/_scorer.py", line 89, in _cached_call
    result, _ = _get_response_values(
  File "/common/ketrong/tpotexp/env/lib/python3.10/site-packages/sklearn/utils/_response.py", line 211, in _get_response_values
    y_pred = prediction_method(X)
  File "/common/ketrong/tpotexp/env/lib/python3.10/site-packages/sklearn/pipeline.py", line 601, in predict
    return self.steps[-1][1].predict(Xt, **params)
  File "/common/ketrong/tpotexp/env/lib/python3.10/site-packages/sklearn/neighbors/_classification.py", line 259, in predict
    probabilities = self.predict_proba(X)
  File "/common/ketrong/tpotexp/env/lib/python3.10/site-packages/sklearn/neighbors/_classification.py", line 343, in predict_proba
    probabilities = ArgKminClassMode.compute(
  File "/common/ketrong/tpotexp/env/lib/python3.10/site-packages/sklearn/metrics/_pairwise_distances_reduction/_dispatcher.py", line 584, in compute
    return ArgKminClassMode64.compute(
TypeError: Argument 'metric' has incorrect type (expected str, got numpy.str_)

Generation:  7
Best f1_score score: 0.9559266953659854
Generation:  28%|██▊       | 7/25 [45:12<1:40:19, 334.41s/it]WARNING THIS INDIVIDUAL CAUSED AND EXCEPTION 
 <tpot2.search_spaces.pipelines.sequential.SequentialPipelineIndividual object at 0x155475d3e2c0> 
 Argument 'metric' has incorrect type (expected str, got numpy.str_) 
 Traceback (most recent call last):
  File "/common/ketrong/tpotexp/tpot2/tpot2/utils/eval_utils.py", line 53, in objective_nan_wrapper
    value = func_timeout.func_timeout(timeout, objective_function, args=[individual], kwargs=objective_kwargs)
  File "/common/ketrong/tpotexp/env/lib/python3.10/site-packages/func_timeout/dafunc.py", line 108, in func_timeout
    raise_exception(exception)
  File "/common/ketrong/tpotexp/env/lib/python3.10/site-packages/func_timeout/py3_raise.py", line 7, in raise_exception
    raise exception[0] from None
  File "/common/ketrong/tpotexp/tpot2/tpot2/tpot_estimator/estimator.py", line 623, in objective_function
    return objective_function_generator(
  File "/common/ketrong/tpotexp/tpot2/tpot2/tpot_estimator/estimator_utils.py", line 55, in objective_function_generator
    cv_obj_scores = cross_val_score_objective(sklearn.base.clone(pipeline),x,y,scorers=scorers, cv=cv , fold=step)
  File "/common/ketrong/tpotexp/tpot2/tpot2/tpot_estimator/cross_val_utils.py", line 31, in cross_val_score_objective
    this_fold_scores = [sklearn.metrics.get_scorer(scorer)(this_fold_pipeline, X_test, y_test) for scorer in scorers]
  File "/common/ketrong/tpotexp/tpot2/tpot2/tpot_estimator/cross_val_utils.py", line 31, in <listcomp>
    this_fold_scores = [sklearn.metrics.get_scorer(scorer)(this_fold_pipeline, X_test, y_test) for scorer in scorers]
  File "/common/ketrong/tpotexp/env/lib/python3.10/site-packages/sklearn/metrics/_scorer.py", line 279, in __call__
    return self._score(partial(_cached_call, None), estimator, X, y_true, **_kwargs)
  File "/common/ketrong/tpotexp/env/lib/python3.10/site-packages/sklearn/metrics/_scorer.py", line 371, in _score
    y_pred = method_caller(
  File "/common/ketrong/tpotexp/env/lib/python3.10/site-packages/sklearn/metrics/_scorer.py", line 89, in _cached_call
    result, _ = _get_response_values(
  File "/common/ketrong/tpotexp/env/lib/python3.10/site-packages/sklearn/utils/_response.py", line 211, in _get_response_values
    y_pred = prediction_method(X)
  File "/common/ketrong/tpotexp/env/lib/python3.10/site-packages/sklearn/pipeline.py", line 601, in predict
    return self.steps[-1][1].predict(Xt, **params)
  File "/common/ketrong/tpotexp/env/lib/python3.10/site-packages/sklearn/neighbors/_classification.py", line 259, in predict
    probabilities = self.predict_proba(X)
  File "/common/ketrong/tpotexp/env/lib/python3.10/site-packages/sklearn/neighbors/_classification.py", line 343, in predict_proba
    probabilities = ArgKminClassMode.compute(
  File "/common/ketrong/tpotexp/env/lib/python3.10/site-packages/sklearn/metrics/_pairwise_distances_reduction/_dispatcher.py", line 584, in compute
    return ArgKminClassMode64.compute(
TypeError: Argument 'metric' has incorrect type (expected str, got numpy.str_)

Generation:  8
Best f1_score score: 0.9559266953659854
Generation:  32%|███▏      | 8/25 [53:21<1:48:37, 383.39s/it]WARNING THIS INDIVIDUAL CAUSED AND EXCEPTION 
 <tpot2.search_spaces.pipelines.sequential.SequentialPipelineIndividual object at 0x155475d3f400> 
 The 'min_samples_split' parameter of DecisionTreeClassifier must be an int in the range [2, inf) or a float in the range (0.0, 1.0]. Got 1 instead. 
 Traceback (most recent call last):
  File "/common/ketrong/tpotexp/tpot2/tpot2/utils/eval_utils.py", line 53, in objective_nan_wrapper
    value = func_timeout.func_timeout(timeout, objective_function, args=[individual], kwargs=objective_kwargs)
  File "/common/ketrong/tpotexp/env/lib/python3.10/site-packages/func_timeout/dafunc.py", line 108, in func_timeout
    raise_exception(exception)
  File "/common/ketrong/tpotexp/env/lib/python3.10/site-packages/func_timeout/py3_raise.py", line 7, in raise_exception
    raise exception[0] from None
  File "/common/ketrong/tpotexp/tpot2/tpot2/tpot_estimator/estimator.py", line 623, in objective_function
    return objective_function_generator(
  File "/common/ketrong/tpotexp/tpot2/tpot2/tpot_estimator/estimator_utils.py", line 55, in objective_function_generator
    cv_obj_scores = cross_val_score_objective(sklearn.base.clone(pipeline),x,y,scorers=scorers, cv=cv , fold=step)
  File "/common/ketrong/tpotexp/tpot2/tpot2/tpot_estimator/cross_val_utils.py", line 28, in cross_val_score_objective
    this_fold_pipeline.fit(X_train,y_train)
  File "/common/ketrong/tpotexp/env/lib/python3.10/site-packages/sklearn/base.py", line 1473, in wrapper
    return fit_method(estimator, *args, **kwargs)
  File "/common/ketrong/tpotexp/env/lib/python3.10/site-packages/sklearn/pipeline.py", line 473, in fit
    self._final_estimator.fit(Xt, y, **last_step_params["fit"])
  File "/common/ketrong/tpotexp/env/lib/python3.10/site-packages/sklearn/base.py", line 1466, in wrapper
    estimator._validate_params()
  File "/common/ketrong/tpotexp/env/lib/python3.10/site-packages/sklearn/base.py", line 666, in _validate_params
    validate_parameter_constraints(
  File "/common/ketrong/tpotexp/env/lib/python3.10/site-packages/sklearn/utils/_param_validation.py", line 95, in validate_parameter_constraints
    raise InvalidParameterError(
sklearn.utils._param_validation.InvalidParameterError: The 'min_samples_split' parameter of DecisionTreeClassifier must be an int in the range [2, inf) or a float in the range (0.0, 1.0]. Got 1 instead.

WARNING AN INDIVIDUAL TIMED OUT: 
 <tpot2.search_spaces.pipelines.sequential.SequentialPipelineIndividual object at 0x1554758d42b0> 

WARNING AN INDIVIDUAL TIMED OUT: 
 <tpot2.search_spaces.pipelines.sequential.SequentialPipelineIndividual object at 0x1554758a1b10> 

Generation:  9
Best f1_score score: 0.9559266953659854
Generation:  36%|███▌      | 9/25 [1:03:27<2:00:48, 453.02s/it]Generation:  10
Best f1_score score: 0.9559266953659854
Generation:  40%|████      | 10/25 [1:10:30<1:50:59, 443.96s/it]WARNING THIS INDIVIDUAL CAUSED AND EXCEPTION 
 <tpot2.search_spaces.pipelines.sequential.SequentialPipelineIndividual object at 0x155475dcae00> 
 Argument 'metric' has incorrect type (expected str, got numpy.str_) 
 Traceback (most recent call last):
  File "/common/ketrong/tpotexp/tpot2/tpot2/utils/eval_utils.py", line 53, in objective_nan_wrapper
    value = func_timeout.func_timeout(timeout, objective_function, args=[individual], kwargs=objective_kwargs)
  File "/common/ketrong/tpotexp/env/lib/python3.10/site-packages/func_timeout/dafunc.py", line 108, in func_timeout
    raise_exception(exception)
  File "/common/ketrong/tpotexp/env/lib/python3.10/site-packages/func_timeout/py3_raise.py", line 7, in raise_exception
    raise exception[0] from None
  File "/common/ketrong/tpotexp/tpot2/tpot2/tpot_estimator/estimator.py", line 623, in objective_function
    return objective_function_generator(
  File "/common/ketrong/tpotexp/tpot2/tpot2/tpot_estimator/estimator_utils.py", line 55, in objective_function_generator
    cv_obj_scores = cross_val_score_objective(sklearn.base.clone(pipeline),x,y,scorers=scorers, cv=cv , fold=step)
  File "/common/ketrong/tpotexp/tpot2/tpot2/tpot_estimator/cross_val_utils.py", line 31, in cross_val_score_objective
    this_fold_scores = [sklearn.metrics.get_scorer(scorer)(this_fold_pipeline, X_test, y_test) for scorer in scorers]
  File "/common/ketrong/tpotexp/tpot2/tpot2/tpot_estimator/cross_val_utils.py", line 31, in <listcomp>
    this_fold_scores = [sklearn.metrics.get_scorer(scorer)(this_fold_pipeline, X_test, y_test) for scorer in scorers]
  File "/common/ketrong/tpotexp/env/lib/python3.10/site-packages/sklearn/metrics/_scorer.py", line 279, in __call__
    return self._score(partial(_cached_call, None), estimator, X, y_true, **_kwargs)
  File "/common/ketrong/tpotexp/en