Run: 29
/cm/local/apps/slurm/var/spool/job993214/slurm_script: line 26: 
pip install -e tpot2
pip install -r tpot2/ImputerExperiments/requirements_.txt
: No such file or directory
RunStart
Version 0.1.7a0 of tpot2 is outdated. Version 0.1.8a0 was released Tuesday September 17, 2024.
starting loops
../data/r/23515/23515.pkl
working on 
../data/r/23515/reg_full_MAR_0.01_2
0.6976239681243896
running experiment 1/3 - Does large hyperparameter space improve reconstruction accuracy over simple
[I 2024-10-08 05:59:23,379] A new study created in memory with name: no-name-17b72db9-c893-4b49-917a-90e7e130d363
running
running
running
running
running
running
running
running
running
running
running
running
running
running
running
running
[I 2024-10-08 05:59:23,620] Trial 11 finished with value: 0.5849215442561031 and parameters: {'model_name': 'SimpleImputer', 'strategy': 'constant'}. Best is trial 11 with value: 0.5849215442561031.
running
[I 2024-10-08 05:59:23,934] Trial 3 finished with value: 0.4864965461462646 and parameters: {'model_name': 'SimpleImputer', 'strategy': 'most_frequent'}. Best is trial 3 with value: 0.4864965461462646.
running
[I 2024-10-08 05:59:24,102] Trial 12 finished with value: 0.4864965461462646 and parameters: {'model_name': 'SimpleImputer', 'strategy': 'most_frequent'}. Best is trial 3 with value: 0.4864965461462646.
running
[I 2024-10-08 05:59:26,239] Trial 9 finished with value: 0.11373289634612789 and parameters: {'model_name': 'KNNImputer', 'n_neighbors': 1124, 'weights': 'uniform'}. Best is trial 9 with value: 0.11373289634612789.
running
[I 2024-10-08 05:59:26,517] Trial 5 finished with value: 0.1832276061594596 and parameters: {'model_name': 'KNNImputer', 'n_neighbors': 6896, 'weights': 'uniform'}. Best is trial 9 with value: 0.11373289634612789.
running
[I 2024-10-08 05:59:26,972] Trial 4 finished with value: 0.12486974474346382 and parameters: {'model_name': 'KNNImputer', 'n_neighbors': 3955, 'weights': 'distance'}. Best is trial 9 with value: 0.11373289634612789.
running
[I 2024-10-08 05:59:27,431] Trial 14 finished with value: 0.13606906427942536 and parameters: {'model_name': 'KNNImputer', 'n_neighbors': 6847, 'weights': 'distance'}. Best is trial 9 with value: 0.11373289634612789.
running
[I 2024-10-08 05:59:27,810] Trial 13 finished with value: 0.14694423814643187 and parameters: {'model_name': 'IterativeImputer', 'estimator': 'Ridge', 'initial_strategy': 'mean', 'n_nearest_features': 1, 'imputation_order': 'roman'}. Best is trial 9 with value: 0.11373289634612789.
running
[I 2024-10-08 05:59:27,972] Trial 17 finished with value: 0.13606906427942536 and parameters: {'model_name': 'KNNImputer', 'n_neighbors': 6422, 'weights': 'distance'}. Best is trial 9 with value: 0.11373289634612789.
running
[I 2024-10-08 05:59:29,490] Trial 19 finished with value: 0.16636632680421934 and parameters: {'model_name': 'KNNImputer', 'n_neighbors': 4297, 'weights': 'uniform'}. Best is trial 9 with value: 0.11373289634612789.
running
[I 2024-10-08 05:59:29,759] Trial 22 finished with value: 0.06654582127002792 and parameters: {'model_name': 'KNNImputer', 'n_neighbors': 21, 'weights': 'uniform'}. Best is trial 22 with value: 0.06654582127002792.
running
[I 2024-10-08 05:59:31,485] Trial 23 finished with value: inf and parameters: {'model_name': 'GAIN', 'batch_size': 2, 'hint_rate': 0.9585730091707854, 'alpha': 3, 'iterations': 1, 'learning_rate': 0.000558789521017314, 'p_miss': 0.024058589835757913}. Best is trial 22 with value: 0.06654582127002792.
running
[I 2024-10-08 05:59:33,047] Trial 18 finished with value: 0.19623733243761152 and parameters: {'model_name': 'VAE', 'batch_size': 78, 'iterations': 1, 'learning_rate': 0.0024360782691929756, 'p_miss': 0.229940760164958}. Best is trial 22 with value: 0.06654582127002792.
running
[I 2024-10-08 05:59:33,350] Trial 7 finished with value: 0.10065113036700861 and parameters: {'model_name': 'IterativeImputer', 'estimator': 'KNN', 'initial_strategy': 'most_frequent', 'n_nearest_features': 2, 'imputation_order': 'random'}. Best is trial 22 with value: 0.06654582127002792.
running
[I 2024-10-08 05:59:34,822] Trial 24 finished with value: 0.217018035252572 and parameters: {'model_name': 'IterativeImputer', 'estimator': 'Bayesian', 'initial_strategy': 'constant', 'n_nearest_features': 1, 'imputation_order': 'ascending', 'sample_posterior': True}. Best is trial 22 with value: 0.06654582127002792.
running
[I 2024-10-08 05:59:35,301] Trial 0 finished with value: 0.08977525204578528 and parameters: {'model_name': 'IterativeImputer', 'estimator': 'KNN', 'initial_strategy': 'constant', 'n_nearest_features': 3, 'imputation_order': 'arabic'}. Best is trial 22 with value: 0.06654582127002792.
running
[I 2024-10-08 05:59:37,247] Trial 1 finished with value: 0.18956800998283038 and parameters: {'model_name': 'VAE', 'batch_size': 132, 'iterations': 2, 'learning_rate': 0.03212727667402837, 'p_miss': 0.20364112913993151}. Best is trial 22 with value: 0.06654582127002792.
running
[I 2024-10-08 05:59:38,835] Trial 15 finished with value: 0.06857429424414764 and parameters: {'model_name': 'IterativeImputer', 'estimator': 'KNN', 'initial_strategy': 'median', 'n_nearest_features': 5, 'imputation_order': 'descending'}. Best is trial 22 with value: 0.06654582127002792.
running
[I 2024-10-08 05:59:39,239] Trial 8 finished with value: 0.11634830372083246 and parameters: {'model_name': 'IterativeImputer', 'estimator': 'Bayesian', 'initial_strategy': 'median', 'n_nearest_features': 4, 'imputation_order': 'random', 'sample_posterior': False}. Best is trial 22 with value: 0.06654582127002792.
running
[I 2024-10-08 05:59:47,083] Trial 29 finished with value: 0.08046514973821306 and parameters: {'model_name': 'IterativeImputer', 'estimator': 'KNN', 'initial_strategy': 'most_frequent', 'n_nearest_features': 4, 'imputation_order': 'random'}. Best is trial 22 with value: 0.06654582127002792.
running
[I 2024-10-08 05:59:47,933] Trial 30 finished with value: 0.06564269457902736 and parameters: {'model_name': 'IterativeImputer', 'estimator': 'KNN', 'initial_strategy': 'most_frequent', 'n_nearest_features': 6, 'imputation_order': 'random'}. Best is trial 30 with value: 0.06564269457902736.
running
[I 2024-10-08 05:59:53,335] Trial 2 finished with value: inf and parameters: {'model_name': 'GAIN', 'batch_size': 5, 'hint_rate': 0.3973690857463296, 'alpha': 56, 'iterations': 128, 'learning_rate': 0.007840231278676236, 'p_miss': 0.08655629449033841}. Best is trial 30 with value: 0.06564269457902736.
running
[I 2024-10-08 06:00:02,434] Trial 6 finished with value: 0.19178561368743657 and parameters: {'model_name': 'VAE', 'batch_size': 848, 'iterations': 4, 'learning_rate': 0.07411503280465656, 'p_miss': 0.1814726208692474}. Best is trial 30 with value: 0.06564269457902736.
running
[I 2024-10-08 06:00:06,569] Trial 26 finished with value: inf and parameters: {'model_name': 'GAIN', 'batch_size': 4, 'hint_rate': 0.5876810140606307, 'alpha': 98, 'iterations': 187, 'learning_rate': 0.004676500445770369, 'p_miss': 0.05280975285708853}. Best is trial 30 with value: 0.06564269457902736.
running
[I 2024-10-08 06:00:07,343] Trial 10 finished with value: 0.1909789188673165 and parameters: {'model_name': 'VAE', 'batch_size': 55, 'iterations': 12, 'learning_rate': 0.057135100534287296, 'p_miss': 0.23801004475757148}. Best is trial 30 with value: 0.06564269457902736.
running
[I 2024-10-08 06:00:14,231] Trial 38 finished with value: 0.06857429424414764 and parameters: {'model_name': 'IterativeImputer', 'estimator': 'KNN', 'initial_strategy': 'median', 'n_nearest_features': 6, 'imputation_order': 'descending'}. Best is trial 30 with value: 0.06564269457902736.
running
[I 2024-10-08 06:02:11,378] Trial 20 finished with value: inf and parameters: {'model_name': 'GAIN', 'batch_size': 2, 'hint_rate': 0.2317596649328758, 'alpha': 18, 'iterations': 666, 'learning_rate': 0.00037730355674041397, 'p_miss': 0.050252665661790985}. Best is trial 30 with value: 0.06564269457902736.
running
[I 2024-10-08 06:02:43,294] Trial 21 finished with value: 0.19188662362981887 and parameters: {'model_name': 'VAE', 'batch_size': 184, 'iterations': 79, 'learning_rate': 0.0013652489170436555, 'p_miss': 0.11353656668599178}. Best is trial 30 with value: 0.06564269457902736.
running
[I 2024-10-08 06:05:14,608] Trial 25 finished with value: 0.21172195985151818 and parameters: {'model_name': 'VAE', 'batch_size': 1, 'iterations': 148, 'learning_rate': 0.015160295244365435, 'p_miss': 0.2064600580997631}. Best is trial 30 with value: 0.06564269457902736.
running
[I 2024-10-08 06:27:00,315] Trial 37 finished with value: 0.06360477020357719 and parameters: {'model_name': 'IterativeImputer', 'estimator': 'RFR', 'initial_strategy': 'median', 'n_nearest_features': 6, 'imputation_order': 'descending'}. Best is trial 37 with value: 0.06360477020357719.
running
[I 2024-10-08 06:27:01,442] Trial 39 finished with value: 0.06569403322988115 and parameters: {'model_name': 'IterativeImputer', 'estimator': 'RFR', 'initial_strategy': 'median', 'n_nearest_features': 6, 'imputation_order': 'descending'}. Best is trial 37 with value: 0.06360477020357719.
running
[I 2024-10-08 06:27:02,162] Trial 40 finished with value: 0.06909451411308658 and parameters: {'model_name': 'IterativeImputer', 'estimator': 'RFR', 'initial_strategy': 'median', 'n_nearest_features': 6, 'imputation_order': 'descending'}. Best is trial 37 with value: 0.06360477020357719.
running
[I 2024-10-08 06:27:32,020] Trial 41 finished with value: 0.06314358540086398 and parameters: {'model_name': 'IterativeImputer', 'estimator': 'RFR', 'initial_strategy': 'median', 'n_nearest_features': 6, 'imputation_order': 'descending'}. Best is trial 41 with value: 0.06314358540086398.
running
[I 2024-10-08 06:28:42,977] Trial 42 finished with value: 0.0634951775179787 and parameters: {'model_name': 'IterativeImputer', 'estimator': 'RFR', 'initial_strategy': 'median', 'n_nearest_features': 6, 'imputation_order': 'descending'}. Best is trial 41 with value: 0.06314358540086398.
running
[I 2024-10-08 06:29:21,021] Trial 43 finished with value: 0.06800628676157057 and parameters: {'model_name': 'IterativeImputer', 'estimator': 'RFR', 'initial_strategy': 'median', 'n_nearest_features': 6, 'imputation_order': 'descending'}. Best is trial 41 with value: 0.06314358540086398.
running
[I 2024-10-08 06:31:32,890] Trial 44 finished with value: 0.06403572128261056 and parameters: {'model_name': 'IterativeImputer', 'estimator': 'RFR', 'initial_strategy': 'median', 'n_nearest_features': 6, 'imputation_order': 'descending'}. Best is trial 41 with value: 0.06314358540086398.
running
[I 2024-10-08 06:32:08,683] Trial 32 finished with value: inf and parameters: {'model_name': 'GAIN', 'batch_size': 1, 'hint_rate': 0.040067013485115544, 'alpha': 98, 'iterations': 9265, 'learning_rate': 0.00010331164375759336, 'p_miss': 0.051340611517337084}. Best is trial 41 with value: 0.06314358540086398.
running
[I 2024-10-08 06:53:20,665] Trial 47 finished with value: 0.06939742822894336 and parameters: {'model_name': 'IterativeImputer', 'estimator': 'RFR', 'initial_strategy': 'most_frequent', 'n_nearest_features': 6, 'imputation_order': 'descending'}. Best is trial 41 with value: 0.06314358540086398.
running
[I 2024-10-08 06:53:29,580] Trial 46 finished with value: 0.06584204816088333 and parameters: {'model_name': 'IterativeImputer', 'estimator': 'RFR', 'initial_strategy': 'median', 'n_nearest_features': 6, 'imputation_order': 'descending'}. Best is trial 41 with value: 0.06314358540086398.
running
[I 2024-10-08 06:53:35,390] Trial 45 finished with value: 0.06414132445705624 and parameters: {'model_name': 'IterativeImputer', 'estimator': 'RFR', 'initial_strategy': 'most_frequent', 'n_nearest_features': 6, 'imputation_order': 'descending'}. Best is trial 41 with value: 0.06314358540086398.
running
[I 2024-10-08 06:54:18,025] Trial 48 finished with value: 0.06361833019344101 and parameters: {'model_name': 'IterativeImputer', 'estimator': 'RFR', 'initial_strategy': 'median', 'n_nearest_features': 6, 'imputation_order': 'descending'}. Best is trial 41 with value: 0.06314358540086398.
running
[I 2024-10-08 06:54:55,111] Trial 49 finished with value: 0.06818318116375403 and parameters: {'model_name': 'IterativeImputer', 'estimator': 'RFR', 'initial_strategy': 'most_frequent', 'n_nearest_features': 5, 'imputation_order': 'descending'}. Best is trial 41 with value: 0.06314358540086398.
running
[I 2024-10-08 06:55:50,522] Trial 50 finished with value: 0.06634425234938993 and parameters: {'model_name': 'IterativeImputer', 'estimator': 'RFR', 'initial_strategy': 'most_frequent', 'n_nearest_features': 5, 'imputation_order': 'descending'}. Best is trial 41 with value: 0.06314358540086398.
running
[I 2024-10-08 06:57:44,248] Trial 51 finished with value: 0.06891355206929065 and parameters: {'model_name': 'IterativeImputer', 'estimator': 'RFR', 'initial_strategy': 'median', 'n_nearest_features': 5, 'imputation_order': 'descending'}. Best is trial 41 with value: 0.06314358540086398.
running
[I 2024-10-08 06:57:44,654] Trial 59 finished with value: 0.1832276061594596 and parameters: {'model_name': 'SimpleImputer', 'strategy': 'mean'}. Best is trial 41 with value: 0.06314358540086398.
running
[I 2024-10-08 06:58:11,652] Trial 52 finished with value: 0.06810033864940775 and parameters: {'model_name': 'IterativeImputer', 'estimator': 'RFR', 'initial_strategy': 'median', 'n_nearest_features': 5, 'imputation_order': 'descending'}. Best is trial 41 with value: 0.06314358540086398.
running
[I 2024-10-08 07:18:21,539] Trial 55 finished with value: 0.06766808736631444 and parameters: {'model_name': 'IterativeImputer', 'estimator': 'RFR', 'initial_strategy': 'median', 'n_nearest_features': 5, 'imputation_order': 'descending'}. Best is trial 41 with value: 0.06314358540086398.
running
[I 2024-10-08 07:18:34,574] Trial 62 finished with value: 0.11449486749609025 and parameters: {'model_name': 'IterativeImputer', 'estimator': 'Ridge', 'initial_strategy': 'median', 'n_nearest_features': 6, 'imputation_order': 'ascending'}. Best is trial 41 with value: 0.06314358540086398.
running
[I 2024-10-08 07:18:34,939] Trial 63 finished with value: 0.18359798964921453 and parameters: {'model_name': 'SimpleImputer', 'strategy': 'median'}. Best is trial 41 with value: 0.06314358540086398.
running
[I 2024-10-08 07:18:51,309] Trial 56 finished with value: 0.06259800775935223 and parameters: {'model_name': 'IterativeImputer', 'estimator': 'RFR', 'initial_strategy': 'median', 'n_nearest_features': 5, 'imputation_order': 'descending'}. Best is trial 56 with value: 0.06259800775935223.
running
[I 2024-10-08 07:19:01,858] Trial 53 finished with value: 0.06965708007322757 and parameters: {'model_name': 'IterativeImputer', 'estimator': 'RFR', 'initial_strategy': 'median', 'n_nearest_features': 5, 'imputation_order': 'descending'}. Best is trial 56 with value: 0.06259800775935223.
running
[I 2024-10-08 07:19:08,443] Trial 54 finished with value: 0.06377513250549523 and parameters: {'model_name': 'IterativeImputer', 'estimator': 'RFR', 'initial_strategy': 'median', 'n_nearest_features': 5, 'imputation_order': 'descending'}. Best is trial 56 with value: 0.06259800775935223.
running
[I 2024-10-08 07:20:23,540] Trial 57 finished with value: 0.062126204378123696 and parameters: {'model_name': 'IterativeImputer', 'estimator': 'RFR', 'initial_strategy': 'median', 'n_nearest_features': 5, 'imputation_order': 'descending'}. Best is trial 57 with value: 0.062126204378123696.
running
[I 2024-10-08 07:21:34,117] Trial 58 finished with value: 0.06999707160913592 and parameters: {'model_name': 'IterativeImputer', 'estimator': 'RFR', 'initial_strategy': 'median', 'n_nearest_features': 5, 'imputation_order': 'descending'}. Best is trial 57 with value: 0.062126204378123696.
running
[I 2024-10-08 07:23:25,315] Trial 60 finished with value: 0.06413879742464709 and parameters: {'model_name': 'IterativeImputer', 'estimator': 'RFR', 'initial_strategy': 'median', 'n_nearest_features': 5, 'imputation_order': 'ascending'}. Best is trial 57 with value: 0.062126204378123696.
running
[I 2024-10-08 07:23:34,046] Trial 61 finished with value: 0.07015316284393025 and parameters: {'model_name': 'IterativeImputer', 'estimator': 'RFR', 'initial_strategy': 'median', 'n_nearest_features': 5, 'imputation_order': 'arabic'}. Best is trial 57 with value: 0.062126204378123696.
running
[I 2024-10-08 07:23:34,546] Trial 71 finished with value: 0.18359798964921453 and parameters: {'model_name': 'SimpleImputer', 'strategy': 'median'}. Best is trial 57 with value: 0.062126204378123696.
running
[I 2024-10-08 07:26:07,954] Trial 34 finished with value: 0.5025736813925943 and parameters: {'model_name': 'GAIN', 'batch_size': 958, 'hint_rate': 0.018997681384539167, 'alpha': 97, 'iterations': 3887, 'learning_rate': 0.0986721682198745, 'p_miss': 0.02256467815691285}. Best is trial 57 with value: 0.062126204378123696.
running
[I 2024-10-08 07:34:22,336] Trial 16 finished with value: 0.4852802266142417 and parameters: {'model_name': 'GAIN', 'batch_size': 26, 'hint_rate': 0.700483057313121, 'alpha': 2, 'iterations': 5217, 'learning_rate': 0.03412577157294457, 'p_miss': 0.21361837428953037}. Best is trial 57 with value: 0.062126204378123696.
running
[I 2024-10-08 07:41:53,855] Trial 67 finished with value: 0.08333732892413992 and parameters: {'model_name': 'IterativeImputer', 'estimator': 'RFR', 'initial_strategy': 'mean', 'n_nearest_features': 4, 'imputation_order': 'arabic'}. Best is trial 57 with value: 0.062126204378123696.
running
[I 2024-10-08 07:42:29,255] Trial 75 finished with value: 0.20600329444142934 and parameters: {'model_name': 'VAE', 'batch_size': 14, 'iterations': 15, 'learning_rate': 0.00010488044149936796, 'p_miss': 0.28671919259117823}. Best is trial 57 with value: 0.062126204378123696.
running
[I 2024-10-08 07:42:56,171] Trial 68 finished with value: 0.07728212920125102 and parameters: {'model_name': 'IterativeImputer', 'estimator': 'RFR', 'initial_strategy': 'mean', 'n_nearest_features': 4, 'imputation_order': 'roman'}. Best is trial 57 with value: 0.062126204378123696.
running
[I 2024-10-08 07:43:32,676] Trial 65 finished with value: 0.06888566537488763 and parameters: {'model_name': 'IterativeImputer', 'estimator': 'RFR', 'initial_strategy': 'mean', 'n_nearest_features': 5, 'imputation_order': 'arabic'}. Best is trial 57 with value: 0.062126204378123696.
running
[I 2024-10-08 07:43:37,378] Trial 64 finished with value: 0.06936519103121075 and parameters: {'model_name': 'IterativeImputer', 'estimator': 'RFR', 'initial_strategy': 'mean', 'n_nearest_features': 6, 'imputation_order': 'arabic'}. Best is trial 57 with value: 0.062126204378123696.
running
[I 2024-10-08 07:44:11,496] Trial 78 finished with value: 0.17572022454520533 and parameters: {'model_name': 'IterativeImputer', 'estimator': 'Bayesian', 'initial_strategy': 'constant', 'n_nearest_features': 3, 'imputation_order': 'descending', 'sample_posterior': True}. Best is trial 57 with value: 0.062126204378123696.
running
[I 2024-10-08 07:44:14,955] Trial 79 finished with value: 0.11572387209392827 and parameters: {'model_name': 'IterativeImputer', 'estimator': 'Bayesian', 'initial_strategy': 'constant', 'n_nearest_features': 6, 'imputation_order': 'descending', 'sample_posterior': False}. Best is trial 57 with value: 0.062126204378123696.
running
[I 2024-10-08 07:44:19,250] Trial 81 finished with value: 0.114370071065887 and parameters: {'model_name': 'KNNImputer', 'n_neighbors': 2713, 'weights': 'distance'}. Best is trial 57 with value: 0.062126204378123696.
running
[I 2024-10-08 07:44:24,055] Trial 69 finished with value: 0.08243721973719959 and parameters: {'model_name': 'IterativeImputer', 'estimator': 'RFR', 'initial_strategy': 'mean', 'n_nearest_features': 4, 'imputation_order': 'arabic'}. Best is trial 57 with value: 0.062126204378123696.
running
[I 2024-10-08 07:44:27,975] Trial 80 finished with value: 0.11449437281006747 and parameters: {'model_name': 'IterativeImputer', 'estimator': 'Ridge', 'initial_strategy': 'median', 'n_nearest_features': 6, 'imputation_order': 'descending'}. Best is trial 57 with value: 0.062126204378123696.
running
[I 2024-10-08 07:44:36,651] Trial 82 finished with value: 0.117951891277237 and parameters: {'model_name': 'IterativeImputer', 'estimator': 'Ridge', 'initial_strategy': 'median', 'n_nearest_features': 4, 'imputation_order': 'roman'}. Best is trial 57 with value: 0.062126204378123696.
running
[I 2024-10-08 07:44:41,563] Trial 83 finished with value: 0.11445004069302009 and parameters: {'model_name': 'IterativeImputer', 'estimator': 'Ridge', 'initial_strategy': 'median', 'n_nearest_features': 6, 'imputation_order': 'roman'}. Best is trial 57 with value: 0.062126204378123696.
running
[I 2024-10-08 07:45:45,070] Trial 66 finished with value: 0.06700035684686612 and parameters: {'model_name': 'IterativeImputer', 'estimator': 'RFR', 'initial_strategy': 'mean', 'n_nearest_features': 6, 'imputation_order': 'roman'}. Best is trial 57 with value: 0.062126204378123696.
running
[I 2024-10-08 07:46:57,694] Trial 70 finished with value: 0.07980085478926872 and parameters: {'model_name': 'IterativeImputer', 'estimator': 'RFR', 'initial_strategy': 'mean', 'n_nearest_features': 4, 'imputation_order': 'arabic'}. Best is trial 57 with value: 0.062126204378123696.
running
[I 2024-10-08 07:47:19,312] Trial 72 finished with value: 0.07803111250515961 and parameters: {'model_name': 'IterativeImputer', 'estimator': 'RFR', 'initial_strategy': 'mean', 'n_nearest_features': 4, 'imputation_order': 'roman'}. Best is trial 57 with value: 0.062126204378123696.
running
