[I 2024-10-08 03:43:04,040] Trial 78 finished with value: 0.21444980570409164 and parameters: {'model_name': 'IterativeImputer', 'estimator': 'RFR', 'initial_strategy': 'mean', 'n_nearest_features': 9, 'imputation_order': 'random'}. Best is trial 74 with value: 0.2109144581903511.
running
[I 2024-10-08 03:43:39,770] Trial 77 finished with value: 0.21293057237555998 and parameters: {'model_name': 'IterativeImputer', 'estimator': 'RFR', 'initial_strategy': 'mean', 'n_nearest_features': 9, 'imputation_order': 'arabic'}. Best is trial 74 with value: 0.2109144581903511.
running
[I 2024-10-08 03:44:04,115] Trial 94 finished with value: 0.44769983999209506 and parameters: {'model_name': 'GAIN', 'batch_size': 4, 'hint_rate': 0.16059907374992105, 'alpha': 35, 'iterations': 16, 'learning_rate': 0.000570870796431164, 'p_miss': 0.23631709432847206}. Best is trial 74 with value: 0.2109144581903511.
running
[I 2024-10-08 03:46:36,614] Trial 95 finished with value: 0.3239458202559405 and parameters: {'model_name': 'IterativeImputer', 'estimator': 'Bayesian', 'initial_strategy': 'most_frequent', 'n_nearest_features': 10, 'imputation_order': 'descending', 'sample_posterior': True}. Best is trial 74 with value: 0.2109144581903511.
running
[I 2024-10-08 03:50:25,257] Trial 35 finished with value: 0.3015848286966093 and parameters: {'model_name': 'VAE', 'batch_size': 1, 'iterations': 7377, 'learning_rate': 0.00012418852511160915, 'p_miss': 0.29934430934835543}. Best is trial 74 with value: 0.2109144581903511.
running
[I 2024-10-08 03:59:36,778] Trial 80 finished with value: 0.2134339841522827 and parameters: {'model_name': 'IterativeImputer', 'estimator': 'RFR', 'initial_strategy': 'mean', 'n_nearest_features': 9, 'imputation_order': 'random'}. Best is trial 74 with value: 0.2109144581903511.
running
[I 2024-10-08 03:59:45,714] Trial 79 finished with value: 0.2125093694101794 and parameters: {'model_name': 'IterativeImputer', 'estimator': 'RFR', 'initial_strategy': 'mean', 'n_nearest_features': 9, 'imputation_order': 'random'}. Best is trial 74 with value: 0.2109144581903511.
running
[I 2024-10-08 04:04:27,510] Trial 81 finished with value: 0.21299921709664765 and parameters: {'model_name': 'IterativeImputer', 'estimator': 'RFR', 'initial_strategy': 'mean', 'n_nearest_features': 9, 'imputation_order': 'random'}. Best is trial 74 with value: 0.2109144581903511.
running
[I 2024-10-08 04:04:28,647] Trial 100 finished with value: 0.3012585316748705 and parameters: {'model_name': 'SimpleImputer', 'strategy': 'most_frequent'}. Best is trial 74 with value: 0.2109144581903511.
running
[I 2024-10-08 04:16:46,045] Trial 83 finished with value: 0.2137472697863773 and parameters: {'model_name': 'IterativeImputer', 'estimator': 'RFR', 'initial_strategy': 'mean', 'n_nearest_features': 9, 'imputation_order': 'random'}. Best is trial 74 with value: 0.2109144581903511.
running
[I 2024-10-08 04:18:28,099] Trial 86 finished with value: 0.21381127223154067 and parameters: {'model_name': 'IterativeImputer', 'estimator': 'RFR', 'initial_strategy': 'mean', 'n_nearest_features': 9, 'imputation_order': 'random'}. Best is trial 74 with value: 0.2109144581903511.
running
[I 2024-10-08 04:19:09,690] Trial 41 finished with value: 0.2930957847170509 and parameters: {'model_name': 'VAE', 'batch_size': 1, 'iterations': 8618, 'learning_rate': 0.00016227567805065517, 'p_miss': 0.2715190746458459}. Best is trial 74 with value: 0.2109144581903511.
running
[I 2024-10-08 04:20:17,512] Trial 87 finished with value: 0.21460446435351463 and parameters: {'model_name': 'IterativeImputer', 'estimator': 'RFR', 'initial_strategy': 'mean', 'n_nearest_features': 9, 'imputation_order': 'random'}. Best is trial 74 with value: 0.2109144581903511.
running
[I 2024-10-08 04:20:27,402] Trial 105 finished with value: 0.2322174134818301 and parameters: {'model_name': 'KNNImputer', 'n_neighbors': 2916, 'weights': 'distance'}. Best is trial 74 with value: 0.2109144581903511.
running
[I 2024-10-08 04:23:20,266] Trial 90 finished with value: 0.21127145183671714 and parameters: {'model_name': 'IterativeImputer', 'estimator': 'RFR', 'initial_strategy': 'median', 'n_nearest_features': 10, 'imputation_order': 'random'}. Best is trial 74 with value: 0.2109144581903511.
running
[I 2024-10-08 04:24:57,158] Trial 93 finished with value: 0.21053158027197147 and parameters: {'model_name': 'IterativeImputer', 'estimator': 'RFR', 'initial_strategy': 'most_frequent', 'n_nearest_features': 10, 'imputation_order': 'descending'}. Best is trial 93 with value: 0.21053158027197147.
running
[I 2024-10-08 04:26:49,412] Trial 92 finished with value: 0.20881006430412224 and parameters: {'model_name': 'IterativeImputer', 'estimator': 'RFR', 'initial_strategy': 'most_frequent', 'n_nearest_features': 11, 'imputation_order': 'random'}. Best is trial 92 with value: 0.20881006430412224.
running
[I 2024-10-08 04:27:47,584] Trial 96 finished with value: 0.2104762837504932 and parameters: {'model_name': 'IterativeImputer', 'estimator': 'RFR', 'initial_strategy': 'mean', 'n_nearest_features': 10, 'imputation_order': 'ascending'}. Best is trial 92 with value: 0.20881006430412224.
running
[I 2024-10-08 04:32:10,961] Trial 97 finished with value: 0.2109450829041323 and parameters: {'model_name': 'IterativeImputer', 'estimator': 'RFR', 'initial_strategy': 'mean', 'n_nearest_features': 10, 'imputation_order': 'ascending'}. Best is trial 92 with value: 0.20881006430412224.
running
[I 2024-10-08 04:37:16,311] Trial 34 finished with value: 0.2924281661774036 and parameters: {'model_name': 'VAE', 'batch_size': 1, 'iterations': 8439, 'learning_rate': 0.00010132978717787019, 'p_miss': 0.27091042995307385}. Best is trial 92 with value: 0.20881006430412224.
running
[I 2024-10-08 04:42:44,804] Trial 98 finished with value: 0.2098654185230766 and parameters: {'model_name': 'IterativeImputer', 'estimator': 'RFR', 'initial_strategy': 'mean', 'n_nearest_features': 11, 'imputation_order': 'ascending'}. Best is trial 92 with value: 0.20881006430412224.
running
[I 2024-10-08 04:43:27,303] Trial 99 finished with value: 0.20940093216481062 and parameters: {'model_name': 'IterativeImputer', 'estimator': 'RFR', 'initial_strategy': 'mean', 'n_nearest_features': 11, 'imputation_order': 'ascending'}. Best is trial 92 with value: 0.20881006430412224.
running
[I 2024-10-08 04:44:38,705] Trial 33 finished with value: 0.28800639365753444 and parameters: {'model_name': 'VAE', 'batch_size': 1, 'iterations': 9233, 'learning_rate': 0.00012432101809494093, 'p_miss': 0.2907915588583707}. Best is trial 92 with value: 0.20881006430412224.
running
[I 2024-10-08 04:46:43,730] Trial 101 finished with value: 0.20949686554470195 and parameters: {'model_name': 'IterativeImputer', 'estimator': 'RFR', 'initial_strategy': 'mean', 'n_nearest_features': 11, 'imputation_order': 'random'}. Best is trial 92 with value: 0.20881006430412224.
running
[I 2024-10-08 04:58:38,612] Trial 102 finished with value: 0.20901156949284266 and parameters: {'model_name': 'IterativeImputer', 'estimator': 'RFR', 'initial_strategy': 'median', 'n_nearest_features': 11, 'imputation_order': 'ascending'}. Best is trial 92 with value: 0.20881006430412224.
running
[I 2024-10-08 05:00:31,988] Trial 103 finished with value: 0.21008583098797948 and parameters: {'model_name': 'IterativeImputer', 'estimator': 'RFR', 'initial_strategy': 'median', 'n_nearest_features': 11, 'imputation_order': 'ascending'}. Best is trial 92 with value: 0.20881006430412224.
running
[I 2024-10-08 05:01:09,966] Trial 104 finished with value: 0.20932266471812486 and parameters: {'model_name': 'IterativeImputer', 'estimator': 'RFR', 'initial_strategy': 'median', 'n_nearest_features': 11, 'imputation_order': 'ascending'}. Best is trial 92 with value: 0.20881006430412224.
running
[I 2024-10-08 05:02:16,140] Trial 106 finished with value: 0.2094963649164105 and parameters: {'model_name': 'IterativeImputer', 'estimator': 'RFR', 'initial_strategy': 'mean', 'n_nearest_features': 11, 'imputation_order': 'ascending'}. Best is trial 92 with value: 0.20881006430412224.
running
[I 2024-10-08 05:04:19,888] Trial 107 finished with value: 0.2108348489452374 and parameters: {'model_name': 'IterativeImputer', 'estimator': 'RFR', 'initial_strategy': 'median', 'n_nearest_features': 11, 'imputation_order': 'ascending'}. Best is trial 92 with value: 0.20881006430412224.
running
[I 2024-10-08 05:04:53,220] Trial 108 finished with value: 0.2100979381208293 and parameters: {'model_name': 'IterativeImputer', 'estimator': 'RFR', 'initial_strategy': 'median', 'n_nearest_features': 11, 'imputation_order': 'descending'}. Best is trial 92 with value: 0.20881006430412224.
running
[I 2024-10-08 05:04:55,886] Trial 121 finished with value: 0.24276663329604 and parameters: {'model_name': 'IterativeImputer', 'estimator': 'KNN', 'initial_strategy': 'median', 'n_nearest_features': 12, 'imputation_order': 'ascending'}. Best is trial 92 with value: 0.20881006430412224.
running
[I 2024-10-08 05:05:06,724] Trial 123 finished with value: 0.2338750551097656 and parameters: {'model_name': 'KNNImputer', 'n_neighbors': 8370, 'weights': 'distance'}. Best is trial 92 with value: 0.20881006430412224.
running
[I 2024-10-08 05:05:07,913] Trial 124 finished with value: 0.3012585316748705 and parameters: {'model_name': 'SimpleImputer', 'strategy': 'most_frequent'}. Best is trial 92 with value: 0.20881006430412224.
running
[I 2024-10-08 05:05:26,820] Trial 122 finished with value: 0.2408702474611732 and parameters: {'model_name': 'IterativeImputer', 'estimator': 'KNN', 'initial_strategy': 'most_frequent', 'n_nearest_features': 12, 'imputation_order': 'ascending'}. Best is trial 92 with value: 0.20881006430412224.
running
[I 2024-10-08 05:08:08,370] Trial 109 finished with value: 0.2090858593710383 and parameters: {'model_name': 'IterativeImputer', 'estimator': 'RFR', 'initial_strategy': 'most_frequent', 'n_nearest_features': 11, 'imputation_order': 'descending'}. Best is trial 92 with value: 0.20881006430412224.
running
[I 2024-10-08 05:09:11,149] Trial 110 finished with value: 0.20986448767539626 and parameters: {'model_name': 'IterativeImputer', 'estimator': 'RFR', 'initial_strategy': 'most_frequent', 'n_nearest_features': 11, 'imputation_order': 'ascending'}. Best is trial 92 with value: 0.20881006430412224.
running
[I 2024-10-08 05:13:44,678] Trial 111 finished with value: 0.21084922680549711 and parameters: {'model_name': 'IterativeImputer', 'estimator': 'RFR', 'initial_strategy': 'most_frequent', 'n_nearest_features': 11, 'imputation_order': 'ascending'}. Best is trial 92 with value: 0.20881006430412224.
running
[I 2024-10-08 05:14:53,673] Trial 43 finished with value: 0.2963808873752814 and parameters: {'model_name': 'VAE', 'batch_size': 1, 'iterations': 8575, 'learning_rate': 0.00010089866771222994, 'p_miss': 0.29858904229886407}. Best is trial 92 with value: 0.20881006430412224.
running
[I 2024-10-08 05:15:06,720] Trial 37 finished with value: 0.2892534583971019 and parameters: {'model_name': 'VAE', 'batch_size': 1, 'iterations': 9759, 'learning_rate': 0.00020426122798212432, 'p_miss': 0.2800480842604811}. Best is trial 92 with value: 0.20881006430412224.
running
[I 2024-10-08 05:17:16,278] Trial 112 finished with value: 0.21040633972967315 and parameters: {'model_name': 'IterativeImputer', 'estimator': 'RFR', 'initial_strategy': 'most_frequent', 'n_nearest_features': 11, 'imputation_order': 'ascending'}. Best is trial 92 with value: 0.20881006430412224.
running
[I 2024-10-08 05:21:56,668] Trial 113 finished with value: 0.20953840846217453 and parameters: {'model_name': 'IterativeImputer', 'estimator': 'RFR', 'initial_strategy': 'most_frequent', 'n_nearest_features': 11, 'imputation_order': 'ascending'}. Best is trial 92 with value: 0.20881006430412224.
running
[I 2024-10-08 05:22:11,746] Trial 114 finished with value: 0.20898835605604216 and parameters: {'model_name': 'IterativeImputer', 'estimator': 'RFR', 'initial_strategy': 'most_frequent', 'n_nearest_features': 11, 'imputation_order': 'ascending'}. Best is trial 92 with value: 0.20881006430412224.
running
[I 2024-10-08 05:24:14,624] Trial 134 finished with value: 0.23215623659369938 and parameters: {'model_name': 'IterativeImputer', 'estimator': 'Bayesian', 'initial_strategy': 'most_frequent', 'n_nearest_features': 11, 'imputation_order': 'ascending', 'sample_posterior': False}. Best is trial 92 with value: 0.20881006430412224.
running
[I 2024-10-08 05:24:16,493] Trial 135 finished with value: 0.4175431552997971 and parameters: {'model_name': 'GAIN', 'batch_size': 45, 'hint_rate': 0.7218966093710819, 'alpha': 42, 'iterations': 1, 'learning_rate': 0.09154380456048455, 'p_miss': 0.04818677906239403}. Best is trial 92 with value: 0.20881006430412224.
running
[I 2024-10-08 05:24:40,775] Trial 115 finished with value: 0.20983400942622926 and parameters: {'model_name': 'IterativeImputer', 'estimator': 'RFR', 'initial_strategy': 'most_frequent', 'n_nearest_features': 11, 'imputation_order': 'ascending'}. Best is trial 92 with value: 0.20881006430412224.
running
[I 2024-10-08 05:26:25,868] Trial 116 finished with value: 0.20938224822048834 and parameters: {'model_name': 'IterativeImputer', 'estimator': 'RFR', 'initial_strategy': 'most_frequent', 'n_nearest_features': 11, 'imputation_order': 'ascending'}. Best is trial 92 with value: 0.20881006430412224.
running
[I 2024-10-08 05:36:32,481] Trial 117 finished with value: 0.20947351794294405 and parameters: {'model_name': 'IterativeImputer', 'estimator': 'RFR', 'initial_strategy': 'median', 'n_nearest_features': 11, 'imputation_order': 'ascending'}. Best is trial 92 with value: 0.20881006430412224.
running
[I 2024-10-08 05:37:29,282] Trial 118 finished with value: 0.2101285906881835 and parameters: {'model_name': 'IterativeImputer', 'estimator': 'RFR', 'initial_strategy': 'most_frequent', 'n_nearest_features': 11, 'imputation_order': 'ascending'}. Best is trial 92 with value: 0.20881006430412224.
running
[I 2024-10-08 05:38:35,501] Trial 119 finished with value: 0.20871443621425181 and parameters: {'model_name': 'IterativeImputer', 'estimator': 'RFR', 'initial_strategy': 'most_frequent', 'n_nearest_features': 12, 'imputation_order': 'ascending'}. Best is trial 119 with value: 0.20871443621425181.
running
[I 2024-10-08 05:39:05,437] Trial 120 finished with value: 0.2081664703314216 and parameters: {'model_name': 'IterativeImputer', 'estimator': 'RFR', 'initial_strategy': 'most_frequent', 'n_nearest_features': 12, 'imputation_order': 'ascending'}. Best is trial 120 with value: 0.2081664703314216.
running
[I 2024-10-08 05:40:54,309] Trial 125 finished with value: 0.20792024123872607 and parameters: {'model_name': 'IterativeImputer', 'estimator': 'RFR', 'initial_strategy': 'most_frequent', 'n_nearest_features': 11, 'imputation_order': 'ascending'}. Best is trial 125 with value: 0.20792024123872607.
running
[I 2024-10-08 05:41:07,776] Trial 126 finished with value: 0.2095987887669557 and parameters: {'model_name': 'IterativeImputer', 'estimator': 'RFR', 'initial_strategy': 'median', 'n_nearest_features': 11, 'imputation_order': 'ascending'}. Best is trial 125 with value: 0.20792024123872607.
running
[I 2024-10-08 05:43:55,819] Trial 127 finished with value: 0.20922260261085998 and parameters: {'model_name': 'IterativeImputer', 'estimator': 'RFR', 'initial_strategy': 'most_frequent', 'n_nearest_features': 11, 'imputation_order': 'descending'}. Best is trial 125 with value: 0.20792024123872607.
running
[I 2024-10-08 05:44:56,227] Trial 128 finished with value: 0.20972549893203282 and parameters: {'model_name': 'IterativeImputer', 'estimator': 'RFR', 'initial_strategy': 'median', 'n_nearest_features': 11, 'imputation_order': 'ascending'}. Best is trial 125 with value: 0.20792024123872607.
running
[I 2024-10-08 05:48:18,885] Trial 129 finished with value: 0.20998384530610284 and parameters: {'model_name': 'IterativeImputer', 'estimator': 'RFR', 'initial_strategy': 'median', 'n_nearest_features': 11, 'imputation_order': 'ascending'}. Best is trial 125 with value: 0.20792024123872607.
running
[I 2024-10-08 05:48:56,878] Trial 130 finished with value: 0.21086521256315288 and parameters: {'model_name': 'IterativeImputer', 'estimator': 'RFR', 'initial_strategy': 'median', 'n_nearest_features': 11, 'imputation_order': 'ascending'}. Best is trial 125 with value: 0.20792024123872607.
running
[I 2024-10-08 05:51:01,783] Trial 131 finished with value: 0.21066832238518315 and parameters: {'model_name': 'IterativeImputer', 'estimator': 'RFR', 'initial_strategy': 'median', 'n_nearest_features': 11, 'imputation_order': 'ascending'}. Best is trial 125 with value: 0.20792024123872607.
running
[I 2024-10-08 05:52:43,970] Trial 132 finished with value: 0.20985872411609532 and parameters: {'model_name': 'IterativeImputer', 'estimator': 'RFR', 'initial_strategy': 'median', 'n_nearest_features': 11, 'imputation_order': 'ascending'}. Best is trial 125 with value: 0.20792024123872607.
running
[I 2024-10-08 05:57:01,652] Trial 133 finished with value: 0.20979526036029164 and parameters: {'model_name': 'IterativeImputer', 'estimator': 'RFR', 'initial_strategy': 'median', 'n_nearest_features': 11, 'imputation_order': 'ascending'}. Best is trial 125 with value: 0.20792024123872607.
running
[I 2024-10-08 05:58:31,707] Trial 137 finished with value: 0.20925185218420625 and parameters: {'model_name': 'IterativeImputer', 'estimator': 'RFR', 'initial_strategy': 'most_frequent', 'n_nearest_features': 12, 'imputation_order': 'ascending'}. Best is trial 125 with value: 0.20792024123872607.
running
[I 2024-10-08 05:58:37,209] Trial 136 finished with value: 0.21072085151337244 and parameters: {'model_name': 'IterativeImputer', 'estimator': 'RFR', 'initial_strategy': 'median', 'n_nearest_features': 11, 'imputation_order': 'ascending'}. Best is trial 125 with value: 0.20792024123872607.
running
[I 2024-10-08 06:00:06,960] Trial 138 finished with value: 0.21019032575647664 and parameters: {'model_name': 'IterativeImputer', 'estimator': 'RFR', 'initial_strategy': 'most_frequent', 'n_nearest_features': 12, 'imputation_order': 'ascending'}. Best is trial 125 with value: 0.20792024123872607.
running
[I 2024-10-08 06:10:28,935] Trial 139 finished with value: 0.20838939851292904 and parameters: {'model_name': 'IterativeImputer', 'estimator': 'RFR', 'initial_strategy': 'most_frequent', 'n_nearest_features': 12, 'imputation_order': 'ascending'}. Best is trial 125 with value: 0.20792024123872607.
running
[I 2024-10-08 06:10:34,797] Trial 155 finished with value: 0.23258575997061182 and parameters: {'model_name': 'KNNImputer', 'n_neighbors': 3415, 'weights': 'distance'}. Best is trial 125 with value: 0.20792024123872607.
running
[I 2024-10-08 06:12:08,734] Trial 140 finished with value: 0.20957388671831145 and parameters: {'model_name': 'IterativeImputer', 'estimator': 'RFR', 'initial_strategy': 'most_frequent', 'n_nearest_features': 12, 'imputation_order': 'ascending'}. Best is trial 125 with value: 0.20792024123872607.
running
[I 2024-10-08 06:13:06,475] Trial 141 finished with value: 0.20858956910738047 and parameters: {'model_name': 'IterativeImputer', 'estimator': 'RFR', 'initial_strategy': 'most_frequent', 'n_nearest_features': 12, 'imputation_order': 'ascending'}. Best is trial 125 with value: 0.20792024123872607.
running
[I 2024-10-08 06:14:07,740] Trial 142 finished with value: 0.20879419157202034 and parameters: {'model_name': 'IterativeImputer', 'estimator': 'RFR', 'initial_strategy': 'most_frequent', 'n_nearest_features': 12, 'imputation_order': 'ascending'}. Best is trial 125 with value: 0.20792024123872607.
running
[I 2024-10-08 06:14:51,181] Trial 143 finished with value: 0.21001416094149325 and parameters: {'model_name': 'IterativeImputer', 'estimator': 'RFR', 'initial_strategy': 'most_frequent', 'n_nearest_features': 12, 'imputation_order': 'ascending'}. Best is trial 125 with value: 0.20792024123872607.
running
[I 2024-10-08 06:15:33,429] Trial 160 finished with value: 0.23273305692973248 and parameters: {'model_name': 'IterativeImputer', 'estimator': 'Ridge', 'initial_strategy': 'most_frequent', 'n_nearest_features': 12, 'imputation_order': 'descending'}. Best is trial 125 with value: 0.20792024123872607.
running
[I 2024-10-08 06:15:35,933] Trial 144 finished with value: 0.20909495607669754 and parameters: {'model_name': 'IterativeImputer', 'estimator': 'RFR', 'initial_strategy': 'most_frequent', 'n_nearest_features': 12, 'imputation_order': 'roman'}. Best is trial 125 with value: 0.20792024123872607.
running
[I 2024-10-08 06:15:36,468] Trial 162 finished with value: 0.24489932239395867 and parameters: {'model_name': 'SimpleImputer', 'strategy': 'mean'}. Best is trial 125 with value: 0.20792024123872607.
running
[I 2024-10-08 06:18:49,168] Trial 145 finished with value: 0.20960159747943802 and parameters: {'model_name': 'IterativeImputer', 'estimator': 'RFR', 'initial_strategy': 'most_frequent', 'n_nearest_features': 12, 'imputation_order': 'descending'}. Best is trial 125 with value: 0.20792024123872607.
running
[I 2024-10-08 06:20:48,544] Trial 146 finished with value: 0.2086305828136798 and parameters: {'model_name': 'IterativeImputer', 'estimator': 'RFR', 'initial_strategy': 'most_frequent', 'n_nearest_features': 12, 'imputation_order': 'descending'}. Best is trial 125 with value: 0.20792024123872607.
running
[I 2024-10-08 06:20:54,526] Trial 165 finished with value: 0.4282828416462204 and parameters: {'model_name': 'GAIN', 'batch_size': 216, 'hint_rate': 0.3587303942575057, 'alpha': 100, 'iterations': 4, 'learning_rate': 0.010396305101274142, 'p_miss': 0.09419178591932001}. Best is trial 125 with value: 0.20792024123872607.
running
