Run: 47
/cm/local/apps/slurm/var/spool/job986073/slurm_script: line 26: 
pip install -e tpot2
pip install -r tpot2/ImputerExperiments/requirements_.txt
: No such file or directory
RunStart
Version 0.1.7a0 of tpot2 is outdated. Version 0.1.8a0 was released Tuesday September 17, 2024.
starting loops
../data/r/1213/1213.pkl
working on 
../data/r/1213/reg_simple_MNAR_0.3_2
1.9734845161437988
running experiment 1/3 - Does large hyperparameter space improve reconstruction accuracy over simple
[I 2024-10-02 20:44:56,123] A new study created in memory with name: no-name-da941b35-b99e-4f67-9549-2166f1448d6c
running
running
running
running
running
running
running
running
running
running
running
running
running
running
running
running
[I 2024-10-02 20:44:56,664] Trial 5 finished with value: 0.4898859373437852 and parameters: {'model_name': 'SimpleImputer', 'strategy': 'constant'}. Best is trial 5 with value: 0.4898859373437852.
running
[I 2024-10-02 20:44:56,976] Trial 12 finished with value: 0.4898859373437852 and parameters: {'model_name': 'SimpleImputer', 'strategy': 'constant'}. Best is trial 5 with value: 0.4898859373437852.
[I 2024-10-02 20:44:57,104] Trial 11 finished with value: 0.4898859373437852 and parameters: {'model_name': 'SimpleImputer', 'strategy': 'constant'}. Best is trial 5 with value: 0.4898859373437852.
running
running
[I 2024-10-02 20:44:57,325] Trial 1 finished with value: 0.4898859373437852 and parameters: {'model_name': 'SimpleImputer', 'strategy': 'constant'}. Best is trial 5 with value: 0.4898859373437852.
running
[I 2024-10-02 20:44:57,473] Trial 3 finished with value: 0.4898859373437852 and parameters: {'model_name': 'SimpleImputer', 'strategy': 'constant'}. Best is trial 5 with value: 0.4898859373437852.
running
[I 2024-10-02 20:44:57,687] Trial 7 finished with value: 0.28437434244972926 and parameters: {'model_name': 'SimpleImputer', 'strategy': 'mean'}. Best is trial 7 with value: 0.28437434244972926.
running
[I 2024-10-02 20:44:57,858] Trial 10 finished with value: 0.28437434244972926 and parameters: {'model_name': 'SimpleImputer', 'strategy': 'mean'}. Best is trial 7 with value: 0.28437434244972926.
running
[I 2024-10-02 20:44:58,146] Trial 0 finished with value: 0.30408887453608185 and parameters: {'model_name': 'SimpleImputer', 'strategy': 'median'}. Best is trial 7 with value: 0.28437434244972926.
running
[I 2024-10-02 20:44:58,443] Trial 9 finished with value: 0.30408887453608185 and parameters: {'model_name': 'SimpleImputer', 'strategy': 'median'}. Best is trial 7 with value: 0.28437434244972926.
running
[I 2024-10-02 20:44:58,615] Trial 13 finished with value: 0.30408887453608185 and parameters: {'model_name': 'SimpleImputer', 'strategy': 'median'}. Best is trial 7 with value: 0.28437434244972926.
running
[I 2024-10-02 20:44:58,765] Trial 18 finished with value: 0.4898859373437852 and parameters: {'model_name': 'SimpleImputer', 'strategy': 'constant'}. Best is trial 7 with value: 0.28437434244972926.
running
[I 2024-10-02 20:44:58,981] Trial 6 finished with value: 0.30408887453608185 and parameters: {'model_name': 'SimpleImputer', 'strategy': 'median'}. Best is trial 7 with value: 0.28437434244972926.
running
[I 2024-10-02 20:44:59,359] Trial 20 finished with value: 0.28437434244972926 and parameters: {'model_name': 'SimpleImputer', 'strategy': 'mean'}. Best is trial 7 with value: 0.28437434244972926.
running
[I 2024-10-02 20:44:59,523] Trial 16 finished with value: 0.30408887453608185 and parameters: {'model_name': 'SimpleImputer', 'strategy': 'median'}. Best is trial 7 with value: 0.28437434244972926.
[I 2024-10-02 20:44:59,675] Trial 2 finished with value: 0.4478806506521889 and parameters: {'model_name': 'SimpleImputer', 'strategy': 'most_frequent'}. Best is trial 7 with value: 0.28437434244972926.
running
running
[I 2024-10-02 20:44:59,858] Trial 4 finished with value: 0.4478806506521889 and parameters: {'model_name': 'SimpleImputer', 'strategy': 'most_frequent'}. Best is trial 7 with value: 0.28437434244972926.
running
[I 2024-10-02 20:45:00,170] Trial 17 finished with value: 0.30408887453608185 and parameters: {'model_name': 'SimpleImputer', 'strategy': 'median'}. Best is trial 7 with value: 0.28437434244972926.
running
[I 2024-10-02 20:45:00,382] Trial 14 finished with value: 0.4478806506521889 and parameters: {'model_name': 'SimpleImputer', 'strategy': 'most_frequent'}. Best is trial 7 with value: 0.28437434244972926.
running
[I 2024-10-02 20:45:00,584] Trial 23 finished with value: 0.28437434244972926 and parameters: {'model_name': 'SimpleImputer', 'strategy': 'mean'}. Best is trial 7 with value: 0.28437434244972926.
running
[I 2024-10-02 20:45:00,788] Trial 24 finished with value: 0.28437434244972926 and parameters: {'model_name': 'SimpleImputer', 'strategy': 'mean'}. Best is trial 7 with value: 0.28437434244972926.
[I 2024-10-02 20:45:00,917] Trial 8 finished with value: 0.4478806506521889 and parameters: {'model_name': 'SimpleImputer', 'strategy': 'most_frequent'}. Best is trial 7 with value: 0.28437434244972926.
running
running
[I 2024-10-02 20:45:01,123] Trial 26 finished with value: 0.28437434244972926 and parameters: {'model_name': 'SimpleImputer', 'strategy': 'mean'}. Best is trial 7 with value: 0.28437434244972926.
running
[I 2024-10-02 20:45:01,272] Trial 27 finished with value: 0.28437434244972926 and parameters: {'model_name': 'SimpleImputer', 'strategy': 'mean'}. Best is trial 7 with value: 0.28437434244972926.
[I 2024-10-02 20:45:01,392] Trial 25 finished with value: 0.28437434244972926 and parameters: {'model_name': 'SimpleImputer', 'strategy': 'mean'}. Best is trial 7 with value: 0.28437434244972926.
running
running
[I 2024-10-02 20:45:01,668] Trial 28 finished with value: 0.28437434244972926 and parameters: {'model_name': 'SimpleImputer', 'strategy': 'mean'}. Best is trial 7 with value: 0.28437434244972926.
running
[I 2024-10-02 20:45:01,849] Trial 30 finished with value: 0.28437434244972926 and parameters: {'model_name': 'SimpleImputer', 'strategy': 'mean'}. Best is trial 7 with value: 0.28437434244972926.
running
[I 2024-10-02 20:45:02,051] Trial 29 finished with value: 0.28437434244972926 and parameters: {'model_name': 'SimpleImputer', 'strategy': 'mean'}. Best is trial 7 with value: 0.28437434244972926.
running
[I 2024-10-02 20:45:02,228] Trial 15 finished with value: 0.4478806506521889 and parameters: {'model_name': 'SimpleImputer', 'strategy': 'most_frequent'}. Best is trial 7 with value: 0.28437434244972926.
running
[I 2024-10-02 20:45:02,418] Trial 31 finished with value: 0.28437434244972926 and parameters: {'model_name': 'SimpleImputer', 'strategy': 'mean'}. Best is trial 7 with value: 0.28437434244972926.
running
[I 2024-10-02 20:45:02,737] Trial 19 finished with value: 0.4478806506521889 and parameters: {'model_name': 'SimpleImputer', 'strategy': 'most_frequent'}. Best is trial 7 with value: 0.28437434244972926.
running
[I 2024-10-02 20:45:02,895] Trial 33 finished with value: 0.28437434244972926 and parameters: {'model_name': 'SimpleImputer', 'strategy': 'mean'}. Best is trial 7 with value: 0.28437434244972926.
running
[I 2024-10-02 20:45:03,070] Trial 32 finished with value: 0.28437434244972926 and parameters: {'model_name': 'SimpleImputer', 'strategy': 'mean'}. Best is trial 7 with value: 0.28437434244972926.
running
[I 2024-10-02 20:45:03,231] Trial 34 finished with value: 0.28437434244972926 and parameters: {'model_name': 'SimpleImputer', 'strategy': 'mean'}. Best is trial 7 with value: 0.28437434244972926.
running
[I 2024-10-02 20:45:03,368] Trial 22 finished with value: 0.4478806506521889 and parameters: {'model_name': 'SimpleImputer', 'strategy': 'most_frequent'}. Best is trial 7 with value: 0.28437434244972926.
running
[I 2024-10-02 20:45:03,513] Trial 21 finished with value: 0.4478806506521889 and parameters: {'model_name': 'SimpleImputer', 'strategy': 'most_frequent'}. Best is trial 7 with value: 0.28437434244972926.
running
[I 2024-10-02 20:45:03,649] Trial 36 finished with value: 0.28437434244972926 and parameters: {'model_name': 'SimpleImputer', 'strategy': 'mean'}. Best is trial 7 with value: 0.28437434244972926.
running
[I 2024-10-02 20:45:03,797] Trial 35 finished with value: 0.28437434244972926 and parameters: {'model_name': 'SimpleImputer', 'strategy': 'mean'}. Best is trial 7 with value: 0.28437434244972926.
running
[I 2024-10-02 20:45:03,965] Trial 37 finished with value: 0.28437434244972926 and parameters: {'model_name': 'SimpleImputer', 'strategy': 'mean'}. Best is trial 7 with value: 0.28437434244972926.
running
[I 2024-10-02 20:45:04,127] Trial 39 finished with value: 0.28437434244972926 and parameters: {'model_name': 'SimpleImputer', 'strategy': 'mean'}. Best is trial 7 with value: 0.28437434244972926.
running
[I 2024-10-02 20:45:04,430] Trial 38 finished with value: 0.28437434244972926 and parameters: {'model_name': 'SimpleImputer', 'strategy': 'mean'}. Best is trial 7 with value: 0.28437434244972926.
running
[I 2024-10-02 20:45:04,617] Trial 40 finished with value: 0.28437434244972926 and parameters: {'model_name': 'SimpleImputer', 'strategy': 'mean'}. Best is trial 7 with value: 0.28437434244972926.
running
[I 2024-10-02 20:45:04,771] Trial 41 finished with value: 0.28437434244972926 and parameters: {'model_name': 'SimpleImputer', 'strategy': 'mean'}. Best is trial 7 with value: 0.28437434244972926.
[I 2024-10-02 20:45:04,887] Trial 42 finished with value: 0.28437434244972926 and parameters: {'model_name': 'SimpleImputer', 'strategy': 'mean'}. Best is trial 7 with value: 0.28437434244972926.
running
running
[I 2024-10-02 20:45:05,036] Trial 44 finished with value: 0.28437434244972926 and parameters: {'model_name': 'SimpleImputer', 'strategy': 'mean'}. Best is trial 7 with value: 0.28437434244972926.
[I 2024-10-02 20:45:05,167] Trial 43 finished with value: 0.28437434244972926 and parameters: {'model_name': 'SimpleImputer', 'strategy': 'mean'}. Best is trial 7 with value: 0.28437434244972926.
running
running
[I 2024-10-02 20:45:05,492] Trial 45 finished with value: 0.28437434244972926 and parameters: {'model_name': 'SimpleImputer', 'strategy': 'mean'}. Best is trial 7 with value: 0.28437434244972926.
running
[I 2024-10-02 20:45:05,708] Trial 47 finished with value: 0.28437434244972926 and parameters: {'model_name': 'SimpleImputer', 'strategy': 'mean'}. Best is trial 7 with value: 0.28437434244972926.
running
[I 2024-10-02 20:45:05,843] Trial 50 finished with value: 0.28437434244972926 and parameters: {'model_name': 'SimpleImputer', 'strategy': 'mean'}. Best is trial 7 with value: 0.28437434244972926.
running
[I 2024-10-02 20:45:06,065] Trial 46 finished with value: 0.28437434244972926 and parameters: {'model_name': 'SimpleImputer', 'strategy': 'mean'}. Best is trial 7 with value: 0.28437434244972926.
running
[I 2024-10-02 20:45:06,244] Trial 51 finished with value: 0.28437434244972926 and parameters: {'model_name': 'SimpleImputer', 'strategy': 'mean'}. Best is trial 7 with value: 0.28437434244972926.
running
[I 2024-10-02 20:45:06,427] Trial 49 finished with value: 0.28437434244972926 and parameters: {'model_name': 'SimpleImputer', 'strategy': 'mean'}. Best is trial 7 with value: 0.28437434244972926.
running
[I 2024-10-02 20:45:06,615] Trial 54 finished with value: 0.28437434244972926 and parameters: {'model_name': 'SimpleImputer', 'strategy': 'mean'}. Best is trial 7 with value: 0.28437434244972926.
running
[I 2024-10-02 20:45:06,761] Trial 48 finished with value: 0.28437434244972926 and parameters: {'model_name': 'SimpleImputer', 'strategy': 'mean'}. Best is trial 7 with value: 0.28437434244972926.
running
[I 2024-10-02 20:45:06,957] Trial 56 finished with value: 0.28437434244972926 and parameters: {'model_name': 'SimpleImputer', 'strategy': 'mean'}. Best is trial 7 with value: 0.28437434244972926.
running
[I 2024-10-02 20:45:07,129] Trial 52 finished with value: 0.28437434244972926 and parameters: {'model_name': 'SimpleImputer', 'strategy': 'mean'}. Best is trial 7 with value: 0.28437434244972926.
running
[I 2024-10-02 20:45:07,270] Trial 59 finished with value: 0.4898859373437852 and parameters: {'model_name': 'SimpleImputer', 'strategy': 'constant'}. Best is trial 7 with value: 0.28437434244972926.
[I 2024-10-02 20:45:07,430] Trial 53 finished with value: 0.28437434244972926 and parameters: {'model_name': 'SimpleImputer', 'strategy': 'mean'}. Best is trial 7 with value: 0.28437434244972926.
running
[I 2024-10-02 20:45:07,560] Trial 55 finished with value: 0.28437434244972926 and parameters: {'model_name': 'SimpleImputer', 'strategy': 'mean'}. Best is trial 7 with value: 0.28437434244972926.
running
running
[I 2024-10-02 20:45:07,722] Trial 60 finished with value: 0.4898859373437852 and parameters: {'model_name': 'SimpleImputer', 'strategy': 'constant'}. Best is trial 7 with value: 0.28437434244972926.
running
[I 2024-10-02 20:45:07,928] Trial 58 finished with value: 0.28437434244972926 and parameters: {'model_name': 'SimpleImputer', 'strategy': 'mean'}. Best is trial 7 with value: 0.28437434244972926.
running
[I 2024-10-02 20:45:08,112] Trial 66 finished with value: 0.4898859373437852 and parameters: {'model_name': 'SimpleImputer', 'strategy': 'constant'}. Best is trial 7 with value: 0.28437434244972926.
[I 2024-10-02 20:45:08,272] Trial 57 finished with value: 0.28437434244972926 and parameters: {'model_name': 'SimpleImputer', 'strategy': 'mean'}. Best is trial 7 with value: 0.28437434244972926.
running
running
[I 2024-10-02 20:45:08,446] Trial 61 finished with value: 0.4898859373437852 and parameters: {'model_name': 'SimpleImputer', 'strategy': 'constant'}. Best is trial 7 with value: 0.28437434244972926.
running
[I 2024-10-02 20:45:08,601] Trial 63 finished with value: 0.4898859373437852 and parameters: {'model_name': 'SimpleImputer', 'strategy': 'constant'}. Best is trial 7 with value: 0.28437434244972926.
running
[I 2024-10-02 20:45:08,787] Trial 62 finished with value: 0.4898859373437852 and parameters: {'model_name': 'SimpleImputer', 'strategy': 'constant'}. Best is trial 7 with value: 0.28437434244972926.
running
[I 2024-10-02 20:45:09,064] Trial 65 finished with value: 0.4898859373437852 and parameters: {'model_name': 'SimpleImputer', 'strategy': 'constant'}. Best is trial 7 with value: 0.28437434244972926.
running
[I 2024-10-02 20:45:09,218] Trial 67 finished with value: 0.4898859373437852 and parameters: {'model_name': 'SimpleImputer', 'strategy': 'constant'}. Best is trial 7 with value: 0.28437434244972926.
running
[I 2024-10-02 20:45:09,461] Trial 69 finished with value: 0.4898859373437852 and parameters: {'model_name': 'SimpleImputer', 'strategy': 'constant'}. Best is trial 7 with value: 0.28437434244972926.
running
[I 2024-10-02 20:45:09,690] Trial 70 finished with value: 0.4898859373437852 and parameters: {'model_name': 'SimpleImputer', 'strategy': 'constant'}. Best is trial 7 with value: 0.28437434244972926.
running
[I 2024-10-02 20:45:09,899] Trial 64 finished with value: 0.30408887453608185 and parameters: {'model_name': 'SimpleImputer', 'strategy': 'median'}. Best is trial 7 with value: 0.28437434244972926.
running
[I 2024-10-02 20:45:10,097] Trial 68 finished with value: 0.30408887453608185 and parameters: {'model_name': 'SimpleImputer', 'strategy': 'median'}. Best is trial 7 with value: 0.28437434244972926.
running
[I 2024-10-02 20:45:10,334] Trial 71 finished with value: 0.30408887453608185 and parameters: {'model_name': 'SimpleImputer', 'strategy': 'median'}. Best is trial 7 with value: 0.28437434244972926.
running
[I 2024-10-02 20:45:10,576] Trial 75 finished with value: 0.30408887453608185 and parameters: {'model_name': 'SimpleImputer', 'strategy': 'median'}. Best is trial 7 with value: 0.28437434244972926.
running
[I 2024-10-02 20:45:10,823] Trial 73 finished with value: 0.30408887453608185 and parameters: {'model_name': 'SimpleImputer', 'strategy': 'median'}. Best is trial 7 with value: 0.28437434244972926.
[I 2024-10-02 20:45:10,931] Trial 76 finished with value: 0.30408887453608185 and parameters: {'model_name': 'SimpleImputer', 'strategy': 'median'}. Best is trial 7 with value: 0.28437434244972926.
running
running
[I 2024-10-02 20:45:11,092] Trial 74 finished with value: 0.30408887453608185 and parameters: {'model_name': 'SimpleImputer', 'strategy': 'median'}. Best is trial 7 with value: 0.28437434244972926.
running
[I 2024-10-02 20:45:11,206] Trial 78 finished with value: 0.30408887453608185 and parameters: {'model_name': 'SimpleImputer', 'strategy': 'median'}. Best is trial 7 with value: 0.28437434244972926.
[I 2024-10-02 20:45:11,302] Trial 79 finished with value: 0.30408887453608185 and parameters: {'model_name': 'SimpleImputer', 'strategy': 'median'}. Best is trial 7 with value: 0.28437434244972926.
running
running
[I 2024-10-02 20:45:11,473] Trial 77 finished with value: 0.30408887453608185 and parameters: {'model_name': 'SimpleImputer', 'strategy': 'median'}. Best is trial 7 with value: 0.28437434244972926.
running
[I 2024-10-02 20:45:11,689] Trial 72 finished with value: 0.30408887453608185 and parameters: {'model_name': 'SimpleImputer', 'strategy': 'median'}. Best is trial 7 with value: 0.28437434244972926.
running
[I 2024-10-02 20:45:11,896] Trial 80 finished with value: 0.30408887453608185 and parameters: {'model_name': 'SimpleImputer', 'strategy': 'median'}. Best is trial 7 with value: 0.28437434244972926.
running
[I 2024-10-02 20:45:12,176] Trial 81 finished with value: 0.30408887453608185 and parameters: {'model_name': 'SimpleImputer', 'strategy': 'median'}. Best is trial 7 with value: 0.28437434244972926.
running
[I 2024-10-02 20:45:12,446] Trial 82 finished with value: 0.30408887453608185 and parameters: {'model_name': 'SimpleImputer', 'strategy': 'median'}. Best is trial 7 with value: 0.28437434244972926.
running
[I 2024-10-02 20:45:12,644] Trial 87 finished with value: 0.28437434244972926 and parameters: {'model_name': 'SimpleImputer', 'strategy': 'mean'}. Best is trial 7 with value: 0.28437434244972926.
[I 2024-10-02 20:45:12,752] Trial 83 finished with value: 0.30408887453608185 and parameters: {'model_name': 'SimpleImputer', 'strategy': 'median'}. Best is trial 7 with value: 0.28437434244972926.
running
[I 2024-10-02 20:45:12,854] Trial 84 finished with value: 0.30408887453608185 and parameters: {'model_name': 'SimpleImputer', 'strategy': 'median'}. Best is trial 7 with value: 0.28437434244972926.
running
running
[I 2024-10-02 20:45:13,017] Trial 85 finished with value: 0.30408887453608185 and parameters: {'model_name': 'SimpleImputer', 'strategy': 'median'}. Best is trial 7 with value: 0.28437434244972926.
running
[I 2024-10-02 20:45:13,518] Trial 97 finished with value: 0.28437434244972926 and parameters: {'model_name': 'SimpleImputer', 'strategy': 'mean'}. Best is trial 7 with value: 0.28437434244972926.
running
[I 2024-10-02 20:45:13,826] Trial 96 finished with value: 0.28437434244972926 and parameters: {'model_name': 'SimpleImputer', 'strategy': 'mean'}. Best is trial 7 with value: 0.28437434244972926.
running
[I 2024-10-02 20:45:14,015] Trial 86 finished with value: 0.4478806506521889 and parameters: {'model_name': 'SimpleImputer', 'strategy': 'most_frequent'}. Best is trial 7 with value: 0.28437434244972926.
running
[I 2024-10-02 20:45:14,239] Trial 99 finished with value: 0.28437434244972926 and parameters: {'model_name': 'SimpleImputer', 'strategy': 'mean'}. Best is trial 7 with value: 0.28437434244972926.
running
[I 2024-10-02 20:45:14,499] Trial 98 finished with value: 0.28437434244972926 and parameters: {'model_name': 'SimpleImputer', 'strategy': 'mean'}. Best is trial 7 with value: 0.28437434244972926.
running
[I 2024-10-02 20:45:14,676] Trial 102 finished with value: 0.28437434244972926 and parameters: {'model_name': 'SimpleImputer', 'strategy': 'mean'}. Best is trial 7 with value: 0.28437434244972926.
running
[I 2024-10-02 20:45:14,805] Trial 100 finished with value: 0.28437434244972926 and parameters: {'model_name': 'SimpleImputer', 'strategy': 'mean'}. Best is trial 7 with value: 0.28437434244972926.
running
[I 2024-10-02 20:45:14,968] Trial 101 finished with value: 0.28437434244972926 and parameters: {'model_name': 'SimpleImputer', 'strategy': 'mean'}. Best is trial 7 with value: 0.28437434244972926.
running
[I 2024-10-02 20:45:15,170] Trial 88 finished with value: 0.4478806506521889 and parameters: {'model_name': 'SimpleImputer', 'strategy': 'most_frequent'}. Best is trial 7 with value: 0.28437434244972926.
running
[I 2024-10-02 20:45:15,363] Trial 93 finished with value: 0.4478806506521889 and parameters: {'model_name': 'SimpleImputer', 'strategy': 'most_frequent'}. Best is trial 7 with value: 0.28437434244972926.
running
[I 2024-10-02 20:45:15,658] Trial 94 finished with value: 0.4478806506521889 and parameters: {'model_name': 'SimpleImputer', 'strategy': 'most_frequent'}. Best is trial 7 with value: 0.28437434244972926.
[I 2024-10-02 20:45:15,814] Trial 103 finished with value: 0.28437434244972926 and parameters: {'model_name': 'SimpleImputer', 'strategy': 'mean'}. Best is trial 7 with value: 0.28437434244972926.
running
running
[I 2024-10-02 20:45:16,048] Trial 92 finished with value: 0.4478806506521889 and parameters: {'model_name': 'SimpleImputer', 'strategy': 'most_frequent'}. Best is trial 7 with value: 0.28437434244972926.
running
[I 2024-10-02 20:45:16,229] Trial 90 finished with value: 0.4478806506521889 and parameters: {'model_name': 'SimpleImputer', 'strategy': 'most_frequent'}. Best is trial 7 with value: 0.28437434244972926.
running
[I 2024-10-02 20:45:16,460] Trial 95 finished with value: 0.4478806506521889 and parameters: {'model_name': 'SimpleImputer', 'strategy': 'most_frequent'}. Best is trial 7 with value: 0.28437434244972926.
running
[I 2024-10-02 20:45:16,644] Trial 91 finished with value: 0.4478806506521889 and parameters: {'model_name': 'SimpleImputer', 'strategy': 'most_frequent'}. Best is trial 7 with value: 0.28437434244972926.
running
