Run: 57
/cm/local/apps/slurm/var/spool/job992713/slurm_script: line 26: 
pip install -e tpot2
pip install -r tpot2/ImputerExperiments/requirements_.txt
: No such file or directory
RunStart
Version 0.1.7a0 of tpot2 is outdated. Version 0.1.8a0 was released Tuesday September 17, 2024.
starting loops
../data/r/42688/42688.pkl
working on 
../data/r/42688/reg_full_MNAR_0.01_3
0.47905611991882324
running experiment 1/3 - Does large hyperparameter space improve reconstruction accuracy over simple
[I 2024-10-07 22:01:55,244] A new study created in memory with name: no-name-6d1bfe7b-728f-4973-8eb0-7da380cdbde7
running
running
running
running
running
running
running
running
running
running
running
running
running
running
running
running
[I 2024-10-07 22:01:55,496] Trial 9 finished with value: 0.24489932239395867 and parameters: {'model_name': 'SimpleImputer', 'strategy': 'mean'}. Best is trial 9 with value: 0.24489932239395867.
[I 2024-10-07 22:01:55,502] Trial 1 finished with value: 0.41507327462767724 and parameters: {'model_name': 'SimpleImputer', 'strategy': 'constant'}. Best is trial 9 with value: 0.24489932239395867.
running
[I 2024-10-07 22:01:55,770] Trial 10 finished with value: 0.41507327462767724 and parameters: {'model_name': 'SimpleImputer', 'strategy': 'constant'}. Best is trial 9 with value: 0.24489932239395867.
running
running
[I 2024-10-07 22:01:55,926] Trial 4 finished with value: 0.24489932239395867 and parameters: {'model_name': 'SimpleImputer', 'strategy': 'mean'}. Best is trial 9 with value: 0.24489932239395867.
running
[I 2024-10-07 22:01:56,166] Trial 6 finished with value: 0.24489932239395867 and parameters: {'model_name': 'SimpleImputer', 'strategy': 'mean'}. Best is trial 9 with value: 0.24489932239395867.
running
[I 2024-10-07 22:01:56,421] Trial 14 finished with value: 0.41507327462767724 and parameters: {'model_name': 'SimpleImputer', 'strategy': 'constant'}. Best is trial 9 with value: 0.24489932239395867.
running
[I 2024-10-07 22:01:56,667] Trial 13 finished with value: 0.2761027957490906 and parameters: {'model_name': 'SimpleImputer', 'strategy': 'median'}. Best is trial 9 with value: 0.24489932239395867.
running
[I 2024-10-07 22:01:56,903] Trial 11 finished with value: 0.3012585316748705 and parameters: {'model_name': 'SimpleImputer', 'strategy': 'most_frequent'}. Best is trial 9 with value: 0.24489932239395867.
running
[I 2024-10-07 22:01:57,220] Trial 16 finished with value: 0.2761027957490906 and parameters: {'model_name': 'SimpleImputer', 'strategy': 'median'}. Best is trial 9 with value: 0.24489932239395867.
[I 2024-10-07 22:01:57,392] Trial 19 finished with value: 0.2761027957490906 and parameters: {'model_name': 'SimpleImputer', 'strategy': 'median'}. Best is trial 9 with value: 0.24489932239395867.
running
running
[I 2024-10-07 22:02:06,141] Trial 7 finished with value: 0.2385937499548037 and parameters: {'model_name': 'KNNImputer', 'n_neighbors': 551, 'weights': 'uniform'}. Best is trial 7 with value: 0.2385937499548037.
running
[I 2024-10-07 22:02:06,766] Trial 0 finished with value: 0.24489932239395867 and parameters: {'model_name': 'KNNImputer', 'n_neighbors': 7075, 'weights': 'uniform'}. Best is trial 7 with value: 0.2385937499548037.
running
[I 2024-10-07 22:02:10,203] Trial 21 finished with value: 0.24443799054192733 and parameters: {'model_name': 'KNNImputer', 'n_neighbors': 5765, 'weights': 'uniform'}. Best is trial 7 with value: 0.2385937499548037.
running
[I 2024-10-07 22:02:11,643] Trial 3 finished with value: 0.44080570470579056 and parameters: {'model_name': 'GAIN', 'batch_size': 89, 'hint_rate': 0.4852012458141449, 'alpha': 81, 'iterations': 3, 'learning_rate': 0.003466555356434523, 'p_miss': 0.14678382026585735}. Best is trial 7 with value: 0.2385937499548037.
running
[I 2024-10-07 22:02:13,758] Trial 17 finished with value: 0.2334695652460837 and parameters: {'model_name': 'KNNImputer', 'n_neighbors': 5540, 'weights': 'distance'}. Best is trial 17 with value: 0.2334695652460837.
running
[I 2024-10-07 22:02:14,142] Trial 25 finished with value: 0.23345418462428807 and parameters: {'model_name': 'KNNImputer', 'n_neighbors': 5482, 'weights': 'distance'}. Best is trial 25 with value: 0.23345418462428807.
running
[I 2024-10-07 22:02:16,142] Trial 20 finished with value: 0.23821695243265836 and parameters: {'model_name': 'IterativeImputer', 'estimator': 'Ridge', 'initial_strategy': 'median', 'n_nearest_features': 2, 'imputation_order': 'roman'}. Best is trial 25 with value: 0.23345418462428807.
running
[I 2024-10-07 22:02:16,345] Trial 26 finished with value: 0.23877578143823114 and parameters: {'model_name': 'KNNImputer', 'n_neighbors': 569, 'weights': 'uniform'}. Best is trial 25 with value: 0.23345418462428807.
running
[I 2024-10-07 22:02:18,232] Trial 5 finished with value: inf and parameters: {'model_name': 'GAIN', 'batch_size': 26, 'hint_rate': 0.5060684744560418, 'alpha': 81, 'iterations': 64, 'learning_rate': 0.026456827696013607, 'p_miss': 0.010323952493589791}. Best is trial 25 with value: 0.23345418462428807.
running
[I 2024-10-07 22:02:18,760] Trial 27 finished with value: 0.24473909632061686 and parameters: {'model_name': 'KNNImputer', 'n_neighbors': 6280, 'weights': 'uniform'}. Best is trial 25 with value: 0.23345418462428807.
running
[I 2024-10-07 22:02:19,979] Trial 28 finished with value: 0.23506421338704192 and parameters: {'model_name': 'KNNImputer', 'n_neighbors': 244, 'weights': 'uniform'}. Best is trial 25 with value: 0.23345418462428807.
running
[I 2024-10-07 22:02:20,222] Trial 29 finished with value: 0.23168336546203344 and parameters: {'model_name': 'KNNImputer', 'n_neighbors': 101, 'weights': 'uniform'}. Best is trial 29 with value: 0.23168336546203344.
running
[I 2024-10-07 22:02:23,192] Trial 12 finished with value: 0.23269619099366406 and parameters: {'model_name': 'IterativeImputer', 'estimator': 'Ridge', 'initial_strategy': 'most_frequent', 'n_nearest_features': 10, 'imputation_order': 'descending'}. Best is trial 29 with value: 0.23168336546203344.
running
[I 2024-10-07 22:02:50,694] Trial 2 finished with value: 0.2385846180487627 and parameters: {'model_name': 'IterativeImputer', 'estimator': 'KNN', 'initial_strategy': 'median', 'n_nearest_features': 9, 'imputation_order': 'random'}. Best is trial 29 with value: 0.23168336546203344.
running
[I 2024-10-07 22:03:12,353] Trial 38 finished with value: 0.24063640102182574 and parameters: {'model_name': 'IterativeImputer', 'estimator': 'KNN', 'initial_strategy': 'most_frequent', 'n_nearest_features': 12, 'imputation_order': 'descending'}. Best is trial 29 with value: 0.23168336546203344.
running
[I 2024-10-07 22:11:14,196] Trial 15 finished with value: 0.25127266118804553 and parameters: {'model_name': 'VAE', 'batch_size': 656, 'iterations': 122, 'learning_rate': 0.0017148723138663935, 'p_miss': 0.02006132480772787}. Best is trial 29 with value: 0.23168336546203344.
running
[I 2024-10-07 22:11:19,691] Trial 18 finished with value: 0.4576548308737246 and parameters: {'model_name': 'GAIN', 'batch_size': 422, 'hint_rate': 0.11247862413427867, 'alpha': 74, 'iterations': 283, 'learning_rate': 0.0027021472487281897, 'p_miss': 0.15072368541507103}. Best is trial 29 with value: 0.23168336546203344.
running
[I 2024-10-07 22:34:11,928] Trial 23 finished with value: 0.5592656103750395 and parameters: {'model_name': 'GAIN', 'batch_size': 840, 'hint_rate': 0.2619348780008614, 'alpha': 58, 'iterations': 927, 'learning_rate': 0.0013884400467541822, 'p_miss': 0.29357253020132124}. Best is trial 29 with value: 0.23168336546203344.
running
[I 2024-10-07 22:44:18,954] Trial 22 finished with value: 0.22357568247526216 and parameters: {'model_name': 'IterativeImputer', 'estimator': 'RFR', 'initial_strategy': 'constant', 'n_nearest_features': 6, 'imputation_order': 'roman'}. Best is trial 22 with value: 0.22357568247526216.
running
[I 2024-10-07 23:00:39,965] Trial 24 finished with value: 0.2889437279587944 and parameters: {'model_name': 'VAE', 'batch_size': 2, 'iterations': 1286, 'learning_rate': 0.00017121748354827508, 'p_miss': 0.19415309324968552}. Best is trial 22 with value: 0.22357568247526216.
running
[I 2024-10-07 23:01:33,268] Trial 8 finished with value: 0.44520090357977454 and parameters: {'model_name': 'GAIN', 'batch_size': 14, 'hint_rate': 0.8839754614765926, 'alpha': 93, 'iterations': 2326, 'learning_rate': 0.0036196697727232776, 'p_miss': 0.11002797601756953}. Best is trial 22 with value: 0.22357568247526216.
running
[I 2024-10-07 23:21:11,892] Trial 44 finished with value: 0.22408154399069513 and parameters: {'model_name': 'IterativeImputer', 'estimator': 'RFR', 'initial_strategy': 'constant', 'n_nearest_features': 6, 'imputation_order': 'ascending'}. Best is trial 22 with value: 0.22357568247526216.
running
[I 2024-10-07 23:38:38,766] Trial 45 finished with value: 0.21767748896951494 and parameters: {'model_name': 'IterativeImputer', 'estimator': 'RFR', 'initial_strategy': 'constant', 'n_nearest_features': 6, 'imputation_order': 'arabic'}. Best is trial 45 with value: 0.21767748896951494.
running
[I 2024-10-07 23:39:52,423] Trial 46 finished with value: 0.2192030738570007 and parameters: {'model_name': 'IterativeImputer', 'estimator': 'RFR', 'initial_strategy': 'constant', 'n_nearest_features': 6, 'imputation_order': 'arabic'}. Best is trial 45 with value: 0.21767748896951494.
running
[I 2024-10-07 23:59:51,738] Trial 47 finished with value: 0.22463561004181104 and parameters: {'model_name': 'IterativeImputer', 'estimator': 'RFR', 'initial_strategy': 'constant', 'n_nearest_features': 6, 'imputation_order': 'ascending'}. Best is trial 45 with value: 0.21767748896951494.
running
[I 2024-10-08 00:14:49,048] Trial 48 finished with value: 0.2289232362632218 and parameters: {'model_name': 'IterativeImputer', 'estimator': 'RFR', 'initial_strategy': 'constant', 'n_nearest_features': 5, 'imputation_order': 'arabic'}. Best is trial 45 with value: 0.21767748896951494.
running
[I 2024-10-08 00:17:27,945] Trial 49 finished with value: 0.22825924841516615 and parameters: {'model_name': 'IterativeImputer', 'estimator': 'RFR', 'initial_strategy': 'constant', 'n_nearest_features': 5, 'imputation_order': 'arabic'}. Best is trial 45 with value: 0.21767748896951494.
running
[I 2024-10-08 00:25:38,205] Trial 39 finished with value: 0.27291993369259215 and parameters: {'model_name': 'VAE', 'batch_size': 1, 'iterations': 2505, 'learning_rate': 0.0001070916909040183, 'p_miss': 0.2843457423286876}. Best is trial 45 with value: 0.21767748896951494.
running
[I 2024-10-08 00:34:36,808] Trial 50 finished with value: 0.2178100085160251 and parameters: {'model_name': 'IterativeImputer', 'estimator': 'RFR', 'initial_strategy': 'constant', 'n_nearest_features': 6, 'imputation_order': 'arabic'}. Best is trial 45 with value: 0.21767748896951494.
running
[I 2024-10-08 00:48:39,626] Trial 51 finished with value: 0.21690382476395859 and parameters: {'model_name': 'IterativeImputer', 'estimator': 'RFR', 'initial_strategy': 'constant', 'n_nearest_features': 6, 'imputation_order': 'arabic'}. Best is trial 51 with value: 0.21690382476395859.
running
[I 2024-10-08 00:50:02,907] Trial 55 finished with value: 0.233063906849093 and parameters: {'model_name': 'IterativeImputer', 'estimator': 'Bayesian', 'initial_strategy': 'mean', 'n_nearest_features': 8, 'imputation_order': 'arabic', 'sample_posterior': False}. Best is trial 51 with value: 0.21690382476395859.
running
[I 2024-10-08 00:54:57,854] Trial 52 finished with value: 0.2203089747772585 and parameters: {'model_name': 'IterativeImputer', 'estimator': 'RFR', 'initial_strategy': 'constant', 'n_nearest_features': 7, 'imputation_order': 'roman'}. Best is trial 51 with value: 0.21690382476395859.
running
[I 2024-10-08 01:03:42,497] Trial 53 finished with value: 0.21919171856318806 and parameters: {'model_name': 'IterativeImputer', 'estimator': 'RFR', 'initial_strategy': 'constant', 'n_nearest_features': 7, 'imputation_order': 'roman'}. Best is trial 51 with value: 0.21690382476395859.
running
[I 2024-10-08 01:12:50,138] Trial 54 finished with value: 0.21312441679768884 and parameters: {'model_name': 'IterativeImputer', 'estimator': 'RFR', 'initial_strategy': 'mean', 'n_nearest_features': 8, 'imputation_order': 'arabic'}. Best is trial 54 with value: 0.21312441679768884.
running
[I 2024-10-08 01:27:54,627] Trial 56 finished with value: 0.21425601529052996 and parameters: {'model_name': 'IterativeImputer', 'estimator': 'RFR', 'initial_strategy': 'constant', 'n_nearest_features': 7, 'imputation_order': 'arabic'}. Best is trial 54 with value: 0.21312441679768884.
running
[I 2024-10-08 01:32:07,828] Trial 57 finished with value: 0.21480651805769857 and parameters: {'model_name': 'IterativeImputer', 'estimator': 'RFR', 'initial_strategy': 'constant', 'n_nearest_features': 7, 'imputation_order': 'arabic'}. Best is trial 54 with value: 0.21312441679768884.
running
[I 2024-10-08 01:34:50,978] Trial 58 finished with value: 0.2393625878869118 and parameters: {'model_name': 'IterativeImputer', 'estimator': 'RFR', 'initial_strategy': 'constant', 'n_nearest_features': 4, 'imputation_order': 'arabic'}. Best is trial 54 with value: 0.21312441679768884.
running
[I 2024-10-08 01:40:37,030] Trial 40 finished with value: 0.2796574126336022 and parameters: {'model_name': 'VAE', 'batch_size': 1, 'iterations': 4787, 'learning_rate': 0.00021331652532924776, 'p_miss': 0.2994117066498856}. Best is trial 54 with value: 0.21312441679768884.
running
[I 2024-10-08 01:43:03,445] Trial 59 finished with value: 0.22985527832717195 and parameters: {'model_name': 'IterativeImputer', 'estimator': 'RFR', 'initial_strategy': 'mean', 'n_nearest_features': 4, 'imputation_order': 'arabic'}. Best is trial 54 with value: 0.21312441679768884.
running
[I 2024-10-08 01:44:30,188] Trial 64 finished with value: 0.32137217070359175 and parameters: {'model_name': 'IterativeImputer', 'estimator': 'Bayesian', 'initial_strategy': 'mean', 'n_nearest_features': 8, 'imputation_order': 'arabic', 'sample_posterior': True}. Best is trial 54 with value: 0.21312441679768884.
running
[I 2024-10-08 01:59:22,852] Trial 60 finished with value: 0.2297052194555748 and parameters: {'model_name': 'IterativeImputer', 'estimator': 'RFR', 'initial_strategy': 'mean', 'n_nearest_features': 4, 'imputation_order': 'arabic'}. Best is trial 54 with value: 0.21312441679768884.
running
[I 2024-10-08 02:13:03,413] Trial 61 finished with value: 0.21359040755338699 and parameters: {'model_name': 'IterativeImputer', 'estimator': 'RFR', 'initial_strategy': 'mean', 'n_nearest_features': 8, 'imputation_order': 'arabic'}. Best is trial 54 with value: 0.21312441679768884.
running
[I 2024-10-08 02:16:02,130] Trial 62 finished with value: 0.21292811819633845 and parameters: {'model_name': 'IterativeImputer', 'estimator': 'RFR', 'initial_strategy': 'mean', 'n_nearest_features': 8, 'imputation_order': 'arabic'}. Best is trial 62 with value: 0.21292811819633845.
running
[I 2024-10-08 02:20:49,022] Trial 63 finished with value: 0.21259464124877522 and parameters: {'model_name': 'IterativeImputer', 'estimator': 'RFR', 'initial_strategy': 'mean', 'n_nearest_features': 8, 'imputation_order': 'arabic'}. Best is trial 63 with value: 0.21259464124877522.
running
[I 2024-10-08 02:22:54,289] Trial 65 finished with value: 0.21442921430786566 and parameters: {'model_name': 'IterativeImputer', 'estimator': 'RFR', 'initial_strategy': 'mean', 'n_nearest_features': 8, 'imputation_order': 'arabic'}. Best is trial 63 with value: 0.21259464124877522.
running
[I 2024-10-08 02:39:13,304] Trial 66 finished with value: 0.21674150382638283 and parameters: {'model_name': 'IterativeImputer', 'estimator': 'RFR', 'initial_strategy': 'constant', 'n_nearest_features': 8, 'imputation_order': 'arabic'}. Best is trial 63 with value: 0.21259464124877522.
running
[I 2024-10-08 02:39:18,930] Trial 71 finished with value: 0.42885168297334647 and parameters: {'model_name': 'GAIN', 'batch_size': 9, 'hint_rate': 0.9756901528071878, 'alpha': 0, 'iterations': 1, 'learning_rate': 0.0913570058337084, 'p_miss': 0.07802421326302772}. Best is trial 63 with value: 0.21259464124877522.
running
[I 2024-10-08 02:52:40,125] Trial 67 finished with value: 0.21310449270282078 and parameters: {'model_name': 'IterativeImputer', 'estimator': 'RFR', 'initial_strategy': 'mean', 'n_nearest_features': 8, 'imputation_order': 'arabic'}. Best is trial 63 with value: 0.21259464124877522.
running
[I 2024-10-08 02:55:38,858] Trial 30 finished with value: 0.29165895192291796 and parameters: {'model_name': 'VAE', 'batch_size': 1, 'iterations': 6206, 'learning_rate': 0.00010204469732135868, 'p_miss': 0.28099970835222304}. Best is trial 63 with value: 0.21259464124877522.
running
[I 2024-10-08 02:55:53,530] Trial 68 finished with value: 0.21340353401960305 and parameters: {'model_name': 'IterativeImputer', 'estimator': 'RFR', 'initial_strategy': 'mean', 'n_nearest_features': 8, 'imputation_order': 'arabic'}. Best is trial 63 with value: 0.21259464124877522.
running
[I 2024-10-08 02:56:33,915] Trial 75 finished with value: 0.23947710034798392 and parameters: {'model_name': 'IterativeImputer', 'estimator': 'KNN', 'initial_strategy': 'mean', 'n_nearest_features': 10, 'imputation_order': 'random'}. Best is trial 63 with value: 0.21259464124877522.
running
[I 2024-10-08 03:01:55,726] Trial 69 finished with value: 0.2135730370593866 and parameters: {'model_name': 'IterativeImputer', 'estimator': 'RFR', 'initial_strategy': 'mean', 'n_nearest_features': 9, 'imputation_order': 'arabic'}. Best is trial 63 with value: 0.21259464124877522.
running
[I 2024-10-08 03:02:23,536] Trial 70 finished with value: 0.21236206588014278 and parameters: {'model_name': 'IterativeImputer', 'estimator': 'RFR', 'initial_strategy': 'mean', 'n_nearest_features': 9, 'imputation_order': 'arabic'}. Best is trial 70 with value: 0.21236206588014278.
running
[I 2024-10-08 03:15:51,851] Trial 36 finished with value: 0.2842184135488851 and parameters: {'model_name': 'VAE', 'batch_size': 1, 'iterations': 6418, 'learning_rate': 0.00012203553939523503, 'p_miss': 0.2987059018377557}. Best is trial 70 with value: 0.21236206588014278.
running
[I 2024-10-08 03:15:55,226] Trial 32 finished with value: 0.28391487960064377 and parameters: {'model_name': 'VAE', 'batch_size': 1, 'iterations': 6503, 'learning_rate': 0.00015152764472844317, 'p_miss': 0.2990642336085093}. Best is trial 70 with value: 0.21236206588014278.
running
[I 2024-10-08 03:21:14,550] Trial 72 finished with value: 0.21310870923061417 and parameters: {'model_name': 'IterativeImputer', 'estimator': 'RFR', 'initial_strategy': 'mean', 'n_nearest_features': 9, 'imputation_order': 'arabic'}. Best is trial 70 with value: 0.21236206588014278.
running
[I 2024-10-08 03:33:27,171] Trial 31 finished with value: 0.2855419552290426 and parameters: {'model_name': 'VAE', 'batch_size': 1, 'iterations': 6026, 'learning_rate': 0.00015222917894523977, 'p_miss': 0.2783128614039892}. Best is trial 70 with value: 0.21236206588014278.
running
[I 2024-10-08 03:33:50,852] Trial 82 finished with value: 0.4404776306568099 and parameters: {'model_name': 'GAIN', 'batch_size': 140, 'hint_rate': 0.6648427290128198, 'alpha': 15, 'iterations': 14, 'learning_rate': 0.012065319661419242, 'p_miss': 0.1979766302329543}. Best is trial 70 with value: 0.21236206588014278.
running
[I 2024-10-08 03:36:02,856] Trial 73 finished with value: 0.2111678601311277 and parameters: {'model_name': 'IterativeImputer', 'estimator': 'RFR', 'initial_strategy': 'mean', 'n_nearest_features': 10, 'imputation_order': 'random'}. Best is trial 73 with value: 0.2111678601311277.
running
[I 2024-10-08 03:36:46,673] Trial 84 finished with value: 0.23272823696922126 and parameters: {'model_name': 'IterativeImputer', 'estimator': 'Ridge', 'initial_strategy': 'mean', 'n_nearest_features': 10, 'imputation_order': 'random'}. Best is trial 73 with value: 0.2111678601311277.
running
[I 2024-10-08 03:36:47,744] Trial 85 finished with value: 0.3012585316748705 and parameters: {'model_name': 'SimpleImputer', 'strategy': 'most_frequent'}. Best is trial 73 with value: 0.2111678601311277.
running
[I 2024-10-08 03:38:10,500] Trial 76 finished with value: 0.21267756052597683 and parameters: {'model_name': 'IterativeImputer', 'estimator': 'RFR', 'initial_strategy': 'mean', 'n_nearest_features': 9, 'imputation_order': 'arabic'}. Best is trial 73 with value: 0.2111678601311277.
running
[I 2024-10-08 03:39:36,944] Trial 74 finished with value: 0.2109144581903511 and parameters: {'model_name': 'IterativeImputer', 'estimator': 'RFR', 'initial_strategy': 'mean', 'n_nearest_features': 10, 'imputation_order': 'random'}. Best is trial 74 with value: 0.2109144581903511.
running
[I 2024-10-08 03:40:05,506] Trial 42 finished with value: 0.2850488529447587 and parameters: {'model_name': 'VAE', 'batch_size': 1, 'iterations': 6768, 'learning_rate': 0.0001246944495690547, 'p_miss': 0.28268149288698485}. Best is trial 74 with value: 0.2109144581903511.
running
[I 2024-10-08 03:40:18,632] Trial 88 finished with value: 0.2327196333475236 and parameters: {'model_name': 'IterativeImputer', 'estimator': 'Ridge', 'initial_strategy': 'mean', 'n_nearest_features': 9, 'imputation_order': 'random'}. Best is trial 74 with value: 0.2109144581903511.
running
[I 2024-10-08 03:40:46,037] Trial 89 finished with value: 0.2327196333475236 and parameters: {'model_name': 'IterativeImputer', 'estimator': 'Ridge', 'initial_strategy': 'mean', 'n_nearest_features': 9, 'imputation_order': 'random'}. Best is trial 74 with value: 0.2109144581903511.
running
[I 2024-10-08 03:41:25,996] Trial 91 finished with value: 0.24037729969718225 and parameters: {'model_name': 'IterativeImputer', 'estimator': 'KNN', 'initial_strategy': 'median', 'n_nearest_features': 11, 'imputation_order': 'random'}. Best is trial 74 with value: 0.2109144581903511.
running
