Run: 13
/cm/local/apps/slurm/var/spool/job1046008/slurm_script: line 26: 
pip install -e tpot2
pip install -r tpot2/ImputerExperiments/requirements_.txt
: No such file or directory
RunStart
Version 0.1.7a0 of tpot2 is outdated. Version 0.1.8a0 was released Tuesday September 17, 2024.
starting loops
../data/c/1489/1489.pkl
working on 
../data/c/1489/class_simple_MCAR_0.01_1
0.399029016494751
running experiment 1/3 - Does large hyperparameter space improve reconstruction accuracy over simple
[I 2024-11-12 02:01:48,066] A new study created in memory with name: no-name-e6628f72-0e0b-40c1-82bf-c091b98de294
running
running
running
running
running
running
running
[I 2024-11-12 02:01:48,138] Trial 1 finished with value: 0.1627821640205836 and parameters: {'model_name': 'SimpleImputer', 'strategy': 'mean'}. Best is trial 1 with value: 0.1627821640205836.
running
running
running
running
running
running
running
running
running
[I 2024-11-12 02:01:48,402] Trial 3 finished with value: 0.47036206447321405 and parameters: {'model_name': 'SimpleImputer', 'strategy': 'constant'}. Best is trial 1 with value: 0.1627821640205836.
running
running
[I 2024-11-12 02:01:48,673] Trial 9 finished with value: 0.1627821640205836 and parameters: {'model_name': 'SimpleImputer', 'strategy': 'mean'}. Best is trial 1 with value: 0.1627821640205836.
running
[I 2024-11-12 02:01:48,792] Trial 7 finished with value: 0.47036206447321405 and parameters: {'model_name': 'SimpleImputer', 'strategy': 'constant'}. Best is trial 1 with value: 0.1627821640205836.
[I 2024-11-12 02:01:48,889] Trial 13 finished with value: 0.47036206447321405 and parameters: {'model_name': 'SimpleImputer', 'strategy': 'constant'}. Best is trial 1 with value: 0.1627821640205836.
[I 2024-11-12 02:01:48,977] Trial 4 finished with value: 0.1627821640205836 and parameters: {'model_name': 'SimpleImputer', 'strategy': 'mean'}. Best is trial 1 with value: 0.1627821640205836.
[I 2024-11-12 02:01:49,150] Trial 8 finished with value: 0.1627821640205836 and parameters: {'model_name': 'SimpleImputer', 'strategy': 'mean'}. Best is trial 1 with value: 0.1627821640205836.
running
running
running
running
[I 2024-11-12 02:01:49,309] Trial 2 finished with value: 0.16731433976716184 and parameters: {'model_name': 'SimpleImputer', 'strategy': 'median'}. Best is trial 1 with value: 0.1627821640205836.
[I 2024-11-12 02:01:49,401] Trial 14 finished with value: 0.1627821640205836 and parameters: {'model_name': 'SimpleImputer', 'strategy': 'mean'}. Best is trial 1 with value: 0.1627821640205836.
[I 2024-11-12 02:01:49,497] Trial 15 finished with value: 0.47036206447321405 and parameters: {'model_name': 'SimpleImputer', 'strategy': 'constant'}. Best is trial 1 with value: 0.1627821640205836.
[I 2024-11-12 02:01:49,584] Trial 6 finished with value: 0.1627821640205836 and parameters: {'model_name': 'SimpleImputer', 'strategy': 'mean'}. Best is trial 1 with value: 0.1627821640205836.
running
running
running
running
[I 2024-11-12 02:01:49,791] Trial 0 finished with value: 0.4414247844256929 and parameters: {'model_name': 'SimpleImputer', 'strategy': 'most_frequent'}. Best is trial 1 with value: 0.1627821640205836.
[I 2024-11-12 02:01:49,903] Trial 18 finished with value: 0.1627821640205836 and parameters: {'model_name': 'SimpleImputer', 'strategy': 'mean'}. Best is trial 1 with value: 0.1627821640205836.
running
[I 2024-11-12 02:01:50,023] Trial 17 finished with value: 0.47036206447321405 and parameters: {'model_name': 'SimpleImputer', 'strategy': 'constant'}. Best is trial 1 with value: 0.1627821640205836.
[I 2024-11-12 02:01:50,123] Trial 16 finished with value: 0.1627821640205836 and parameters: {'model_name': 'SimpleImputer', 'strategy': 'mean'}. Best is trial 1 with value: 0.1627821640205836.
running
running
[I 2024-11-12 02:01:50,233] Trial 12 finished with value: 0.1627821640205836 and parameters: {'model_name': 'SimpleImputer', 'strategy': 'mean'}. Best is trial 1 with value: 0.1627821640205836.
[I 2024-11-12 02:01:50,330] Trial 5 finished with value: 0.16731433976716184 and parameters: {'model_name': 'SimpleImputer', 'strategy': 'median'}. Best is trial 1 with value: 0.1627821640205836.
running
running
running
[I 2024-11-12 02:01:50,442] Trial 21 finished with value: 0.47036206447321405 and parameters: {'model_name': 'SimpleImputer', 'strategy': 'constant'}. Best is trial 1 with value: 0.1627821640205836.
running
[I 2024-11-12 02:01:50,581] Trial 22 finished with value: 0.47036206447321405 and parameters: {'model_name': 'SimpleImputer', 'strategy': 'constant'}. Best is trial 1 with value: 0.1627821640205836.
running
[I 2024-11-12 02:01:50,823] Trial 10 finished with value: 0.4414247844256929 and parameters: {'model_name': 'SimpleImputer', 'strategy': 'most_frequent'}. Best is trial 1 with value: 0.1627821640205836.
running
[I 2024-11-12 02:01:51,203] Trial 29 finished with value: 0.16731433976716184 and parameters: {'model_name': 'SimpleImputer', 'strategy': 'median'}. Best is trial 1 with value: 0.1627821640205836.
running
[I 2024-11-12 02:01:51,327] Trial 20 finished with value: 0.16731433976716184 and parameters: {'model_name': 'SimpleImputer', 'strategy': 'median'}. Best is trial 1 with value: 0.1627821640205836.
[I 2024-11-12 02:01:51,431] Trial 24 finished with value: 0.4414247844256929 and parameters: {'model_name': 'SimpleImputer', 'strategy': 'most_frequent'}. Best is trial 1 with value: 0.1627821640205836.
[I 2024-11-12 02:01:51,530] Trial 28 finished with value: 0.16731433976716184 and parameters: {'model_name': 'SimpleImputer', 'strategy': 'median'}. Best is trial 1 with value: 0.1627821640205836.
[I 2024-11-12 02:01:51,627] Trial 27 finished with value: 0.16731433976716184 and parameters: {'model_name': 'SimpleImputer', 'strategy': 'median'}. Best is trial 1 with value: 0.1627821640205836.
running
[I 2024-11-12 02:01:51,716] Trial 19 finished with value: 0.4414247844256929 and parameters: {'model_name': 'SimpleImputer', 'strategy': 'most_frequent'}. Best is trial 1 with value: 0.1627821640205836.
running
[I 2024-11-12 02:01:51,822] Trial 23 finished with value: 0.4414247844256929 and parameters: {'model_name': 'SimpleImputer', 'strategy': 'most_frequent'}. Best is trial 1 with value: 0.1627821640205836.
[I 2024-11-12 02:01:51,924] Trial 31 finished with value: 0.4414247844256929 and parameters: {'model_name': 'SimpleImputer', 'strategy': 'most_frequent'}. Best is trial 1 with value: 0.1627821640205836.
running
[I 2024-11-12 02:01:52,021] Trial 25 finished with value: 0.4414247844256929 and parameters: {'model_name': 'SimpleImputer', 'strategy': 'most_frequent'}. Best is trial 1 with value: 0.1627821640205836.
running
[I 2024-11-12 02:01:52,138] Trial 26 finished with value: 0.4414247844256929 and parameters: {'model_name': 'SimpleImputer', 'strategy': 'most_frequent'}. Best is trial 1 with value: 0.1627821640205836.
running
running
running
running
[I 2024-11-12 02:01:52,274] Trial 32 finished with value: 0.4414247844256929 and parameters: {'model_name': 'SimpleImputer', 'strategy': 'most_frequent'}. Best is trial 1 with value: 0.1627821640205836.
running
running
[I 2024-11-12 02:01:52,504] Trial 35 finished with value: 0.1627821640205836 and parameters: {'model_name': 'SimpleImputer', 'strategy': 'mean'}. Best is trial 1 with value: 0.1627821640205836.
[I 2024-11-12 02:01:52,605] Trial 11 finished with value: 0.4414247844256929 and parameters: {'model_name': 'SimpleImputer', 'strategy': 'most_frequent'}. Best is trial 1 with value: 0.1627821640205836.
[I 2024-11-12 02:01:52,699] Trial 30 finished with value: 0.4414247844256929 and parameters: {'model_name': 'SimpleImputer', 'strategy': 'most_frequent'}. Best is trial 1 with value: 0.1627821640205836.
[I 2024-11-12 02:01:52,794] Trial 38 finished with value: 0.1627821640205836 and parameters: {'model_name': 'SimpleImputer', 'strategy': 'mean'}. Best is trial 1 with value: 0.1627821640205836.
[I 2024-11-12 02:01:52,884] Trial 34 finished with value: 0.4414247844256929 and parameters: {'model_name': 'SimpleImputer', 'strategy': 'most_frequent'}. Best is trial 1 with value: 0.1627821640205836.
running
running
running
running
[I 2024-11-12 02:01:53,007] Trial 37 finished with value: 0.1627821640205836 and parameters: {'model_name': 'SimpleImputer', 'strategy': 'mean'}. Best is trial 1 with value: 0.1627821640205836.
running
running
[I 2024-11-12 02:01:53,179] Trial 36 finished with value: 0.1627821640205836 and parameters: {'model_name': 'SimpleImputer', 'strategy': 'mean'}. Best is trial 1 with value: 0.1627821640205836.
[I 2024-11-12 02:01:53,282] Trial 40 finished with value: 0.1627821640205836 and parameters: {'model_name': 'SimpleImputer', 'strategy': 'mean'}. Best is trial 1 with value: 0.1627821640205836.
[I 2024-11-12 02:01:53,387] Trial 39 finished with value: 0.1627821640205836 and parameters: {'model_name': 'SimpleImputer', 'strategy': 'mean'}. Best is trial 1 with value: 0.1627821640205836.
running
[I 2024-11-12 02:01:53,495] Trial 42 finished with value: 0.1627821640205836 and parameters: {'model_name': 'SimpleImputer', 'strategy': 'mean'}. Best is trial 1 with value: 0.1627821640205836.
[I 2024-11-12 02:01:53,598] Trial 41 finished with value: 0.1627821640205836 and parameters: {'model_name': 'SimpleImputer', 'strategy': 'mean'}. Best is trial 1 with value: 0.1627821640205836.
[I 2024-11-12 02:01:53,691] Trial 46 finished with value: 0.1627821640205836 and parameters: {'model_name': 'SimpleImputer', 'strategy': 'mean'}. Best is trial 1 with value: 0.1627821640205836.
running
[I 2024-11-12 02:01:53,795] Trial 33 finished with value: 0.4414247844256929 and parameters: {'model_name': 'SimpleImputer', 'strategy': 'most_frequent'}. Best is trial 1 with value: 0.1627821640205836.
running
running
[I 2024-11-12 02:01:53,949] Trial 44 finished with value: 0.1627821640205836 and parameters: {'model_name': 'SimpleImputer', 'strategy': 'mean'}. Best is trial 1 with value: 0.1627821640205836.
[I 2024-11-12 02:01:54,038] Trial 43 finished with value: 0.1627821640205836 and parameters: {'model_name': 'SimpleImputer', 'strategy': 'mean'}. Best is trial 1 with value: 0.1627821640205836.
[I 2024-11-12 02:01:54,140] Trial 51 finished with value: 0.1627821640205836 and parameters: {'model_name': 'SimpleImputer', 'strategy': 'mean'}. Best is trial 1 with value: 0.1627821640205836.
running
running
running
running
[I 2024-11-12 02:01:54,286] Trial 49 finished with value: 0.1627821640205836 and parameters: {'model_name': 'SimpleImputer', 'strategy': 'mean'}. Best is trial 1 with value: 0.1627821640205836.
running
[I 2024-11-12 02:01:54,419] Trial 50 finished with value: 0.1627821640205836 and parameters: {'model_name': 'SimpleImputer', 'strategy': 'mean'}. Best is trial 1 with value: 0.1627821640205836.
running
running
[I 2024-11-12 02:01:54,563] Trial 47 finished with value: 0.1627821640205836 and parameters: {'model_name': 'SimpleImputer', 'strategy': 'mean'}. Best is trial 1 with value: 0.1627821640205836.
[I 2024-11-12 02:01:54,666] Trial 48 finished with value: 0.1627821640205836 and parameters: {'model_name': 'SimpleImputer', 'strategy': 'mean'}. Best is trial 1 with value: 0.1627821640205836.
running
[I 2024-11-12 02:01:54,763] Trial 54 finished with value: 0.1627821640205836 and parameters: {'model_name': 'SimpleImputer', 'strategy': 'mean'}. Best is trial 1 with value: 0.1627821640205836.
[I 2024-11-12 02:01:54,852] Trial 45 finished with value: 0.1627821640205836 and parameters: {'model_name': 'SimpleImputer', 'strategy': 'mean'}. Best is trial 1 with value: 0.1627821640205836.
running
running
[I 2024-11-12 02:01:54,990] Trial 52 finished with value: 0.1627821640205836 and parameters: {'model_name': 'SimpleImputer', 'strategy': 'mean'}. Best is trial 1 with value: 0.1627821640205836.
[I 2024-11-12 02:01:55,081] Trial 53 finished with value: 0.1627821640205836 and parameters: {'model_name': 'SimpleImputer', 'strategy': 'mean'}. Best is trial 1 with value: 0.1627821640205836.
[I 2024-11-12 02:01:55,203] Trial 60 finished with value: 0.1627821640205836 and parameters: {'model_name': 'SimpleImputer', 'strategy': 'mean'}. Best is trial 1 with value: 0.1627821640205836.
running
running
running
[I 2024-11-12 02:01:55,336] Trial 55 finished with value: 0.1627821640205836 and parameters: {'model_name': 'SimpleImputer', 'strategy': 'mean'}. Best is trial 1 with value: 0.1627821640205836.
[I 2024-11-12 02:01:55,428] Trial 58 finished with value: 0.1627821640205836 and parameters: {'model_name': 'SimpleImputer', 'strategy': 'mean'}. Best is trial 1 with value: 0.1627821640205836.
running
[I 2024-11-12 02:01:55,543] Trial 61 finished with value: 0.1627821640205836 and parameters: {'model_name': 'SimpleImputer', 'strategy': 'mean'}. Best is trial 1 with value: 0.1627821640205836.
[I 2024-11-12 02:01:55,632] Trial 56 finished with value: 0.1627821640205836 and parameters: {'model_name': 'SimpleImputer', 'strategy': 'mean'}. Best is trial 1 with value: 0.1627821640205836.
running
[I 2024-11-12 02:01:55,749] Trial 59 finished with value: 0.1627821640205836 and parameters: {'model_name': 'SimpleImputer', 'strategy': 'mean'}. Best is trial 1 with value: 0.1627821640205836.
[I 2024-11-12 02:01:55,863] Trial 62 finished with value: 0.1627821640205836 and parameters: {'model_name': 'SimpleImputer', 'strategy': 'mean'}. Best is trial 1 with value: 0.1627821640205836.
running
running
running
[I 2024-11-12 02:01:55,993] Trial 63 finished with value: 0.1627821640205836 and parameters: {'model_name': 'SimpleImputer', 'strategy': 'mean'}. Best is trial 1 with value: 0.1627821640205836.
[I 2024-11-12 02:01:56,080] Trial 57 finished with value: 0.1627821640205836 and parameters: {'model_name': 'SimpleImputer', 'strategy': 'mean'}. Best is trial 1 with value: 0.1627821640205836.
running
[I 2024-11-12 02:01:56,185] Trial 67 finished with value: 0.47036206447321405 and parameters: {'model_name': 'SimpleImputer', 'strategy': 'constant'}. Best is trial 1 with value: 0.1627821640205836.
running
[I 2024-11-12 02:01:56,305] Trial 68 finished with value: 0.47036206447321405 and parameters: {'model_name': 'SimpleImputer', 'strategy': 'constant'}. Best is trial 1 with value: 0.1627821640205836.
running
[I 2024-11-12 02:01:56,406] Trial 65 finished with value: 0.1627821640205836 and parameters: {'model_name': 'SimpleImputer', 'strategy': 'mean'}. Best is trial 1 with value: 0.1627821640205836.
running
[I 2024-11-12 02:01:56,521] Trial 66 finished with value: 0.1627821640205836 and parameters: {'model_name': 'SimpleImputer', 'strategy': 'mean'}. Best is trial 1 with value: 0.1627821640205836.
running
[I 2024-11-12 02:01:56,618] Trial 64 finished with value: 0.1627821640205836 and parameters: {'model_name': 'SimpleImputer', 'strategy': 'mean'}. Best is trial 1 with value: 0.1627821640205836.
running
running
[I 2024-11-12 02:01:56,788] Trial 74 finished with value: 0.47036206447321405 and parameters: {'model_name': 'SimpleImputer', 'strategy': 'constant'}. Best is trial 1 with value: 0.1627821640205836.
running
running
[I 2024-11-12 02:01:56,894] Trial 72 finished with value: 0.47036206447321405 and parameters: {'model_name': 'SimpleImputer', 'strategy': 'constant'}. Best is trial 1 with value: 0.1627821640205836.
[I 2024-11-12 02:01:56,996] Trial 71 finished with value: 0.47036206447321405 and parameters: {'model_name': 'SimpleImputer', 'strategy': 'constant'}. Best is trial 1 with value: 0.1627821640205836.
running
running
[I 2024-11-12 02:01:57,130] Trial 75 finished with value: 0.47036206447321405 and parameters: {'model_name': 'SimpleImputer', 'strategy': 'constant'}. Best is trial 1 with value: 0.1627821640205836.
running
[I 2024-11-12 02:01:57,239] Trial 69 finished with value: 0.47036206447321405 and parameters: {'model_name': 'SimpleImputer', 'strategy': 'constant'}. Best is trial 1 with value: 0.1627821640205836.
[I 2024-11-12 02:01:57,329] Trial 70 finished with value: 0.16731433976716184 and parameters: {'model_name': 'SimpleImputer', 'strategy': 'median'}. Best is trial 1 with value: 0.1627821640205836.
running
running
running
[I 2024-11-12 02:01:57,461] Trial 73 finished with value: 0.47036206447321405 and parameters: {'model_name': 'SimpleImputer', 'strategy': 'constant'}. Best is trial 1 with value: 0.1627821640205836.
running
running
[I 2024-11-12 02:01:57,735] Trial 76 finished with value: 0.16731433976716184 and parameters: {'model_name': 'SimpleImputer', 'strategy': 'median'}. Best is trial 1 with value: 0.1627821640205836.
running
[I 2024-11-12 02:01:57,890] Trial 89 finished with value: 0.1627821640205836 and parameters: {'model_name': 'SimpleImputer', 'strategy': 'mean'}. Best is trial 1 with value: 0.1627821640205836.
[I 2024-11-12 02:01:57,992] Trial 77 finished with value: 0.16731433976716184 and parameters: {'model_name': 'SimpleImputer', 'strategy': 'median'}. Best is trial 1 with value: 0.1627821640205836.
running
running
[I 2024-11-12 02:01:58,166] Trial 83 finished with value: 0.1627821640205836 and parameters: {'model_name': 'SimpleImputer', 'strategy': 'mean'}. Best is trial 1 with value: 0.1627821640205836.
[I 2024-11-12 02:01:58,280] Trial 88 finished with value: 0.16731433976716184 and parameters: {'model_name': 'SimpleImputer', 'strategy': 'median'}. Best is trial 1 with value: 0.1627821640205836.
running
running
[I 2024-11-12 02:01:58,416] Trial 80 finished with value: 0.16731433976716184 and parameters: {'model_name': 'SimpleImputer', 'strategy': 'median'}. Best is trial 1 with value: 0.1627821640205836.
[I 2024-11-12 02:01:58,516] Trial 81 finished with value: 0.16731433976716184 and parameters: {'model_name': 'SimpleImputer', 'strategy': 'median'}. Best is trial 1 with value: 0.1627821640205836.
[I 2024-11-12 02:01:58,619] Trial 82 finished with value: 0.16731433976716184 and parameters: {'model_name': 'SimpleImputer', 'strategy': 'median'}. Best is trial 1 with value: 0.1627821640205836.
running
[I 2024-11-12 02:01:58,729] Trial 78 finished with value: 0.16731433976716184 and parameters: {'model_name': 'SimpleImputer', 'strategy': 'median'}. Best is trial 1 with value: 0.1627821640205836.
running
[I 2024-11-12 02:01:58,825] Trial 84 finished with value: 0.16731433976716184 and parameters: {'model_name': 'SimpleImputer', 'strategy': 'median'}. Best is trial 1 with value: 0.1627821640205836.
running
[I 2024-11-12 02:01:58,958] Trial 86 finished with value: 0.16731433976716184 and parameters: {'model_name': 'SimpleImputer', 'strategy': 'median'}. Best is trial 1 with value: 0.1627821640205836.
[I 2024-11-12 02:01:59,065] Trial 91 finished with value: 0.16731433976716184 and parameters: {'model_name': 'SimpleImputer', 'strategy': 'median'}. Best is trial 1 with value: 0.1627821640205836.
running
running
[I 2024-11-12 02:01:59,194] Trial 90 finished with value: 0.16731433976716184 and parameters: {'model_name': 'SimpleImputer', 'strategy': 'median'}. Best is trial 1 with value: 0.1627821640205836.
running
running
[I 2024-11-12 02:01:59,339] Trial 87 finished with value: 0.16731433976716184 and parameters: {'model_name': 'SimpleImputer', 'strategy': 'median'}. Best is trial 1 with value: 0.1627821640205836.
[I 2024-11-12 02:01:59,427] Trial 79 finished with value: 0.16731433976716184 and parameters: {'model_name': 'SimpleImputer', 'strategy': 'median'}. Best is trial 1 with value: 0.1627821640205836.
running
[I 2024-11-12 02:01:59,524] Trial 92 finished with value: 0.1627821640205836 and parameters: {'model_name': 'SimpleImputer', 'strategy': 'mean'}. Best is trial 1 with value: 0.1627821640205836.
[I 2024-11-12 02:01:59,610] Trial 95 finished with value: 0.1627821640205836 and parameters: {'model_name': 'SimpleImputer', 'strategy': 'mean'}. Best is trial 1 with value: 0.1627821640205836.
running
running
[I 2024-11-12 02:01:59,728] Trial 98 finished with value: 0.1627821640205836 and parameters: {'model_name': 'SimpleImputer', 'strategy': 'mean'}. Best is trial 1 with value: 0.1627821640205836.
[I 2024-11-12 02:01:59,831] Trial 99 finished with value: 0.1627821640205836 and parameters: {'model_name': 'SimpleImputer', 'strategy': 'mean'}. Best is trial 1 with value: 0.1627821640205836.
running
[I 2024-11-12 02:01:59,951] Trial 93 finished with value: 0.1627821640205836 and parameters: {'model_name': 'SimpleImputer', 'strategy': 'mean'}. Best is trial 1 with value: 0.1627821640205836.
[I 2024-11-12 02:02:00,064] Trial 94 finished with value: 0.1627821640205836 and parameters: {'model_name': 'SimpleImputer', 'strategy': 'mean'}. Best is trial 1 with value: 0.1627821640205836.
running
[I 2024-11-12 02:02:00,189] Trial 97 finished with value: 0.1627821640205836 and parameters: {'model_name': 'SimpleImputer', 'strategy': 'mean'}. Best is trial 1 with value: 0.1627821640205836.
running
[I 2024-11-12 02:02:00,285] Trial 103 finished with value: 0.1627821640205836 and parameters: {'model_name': 'SimpleImputer', 'strategy': 'mean'}. Best is trial 1 with value: 0.1627821640205836.
[I 2024-11-12 02:02:00,385] Trial 100 finished with value: 0.1627821640205836 and parameters: {'model_name': 'SimpleImputer', 'strategy': 'mean'}. Best is trial 1 with value: 0.1627821640205836.
running
running
[I 2024-11-12 02:02:00,394] Trial 96 finished with value: 0.1627821640205836 and parameters: {'model_name': 'SimpleImputer', 'strategy': 'mean'}. Best is trial 1 with value: 0.1627821640205836.
[I 2024-11-12 02:02:00,603] Trial 85 finished with value: 0.16731433976716184 and parameters: {'model_name': 'SimpleImputer', 'strategy': 'median'}. Best is trial 1 with value: 0.1627821640205836.
running
running
[I 2024-11-12 02:02:00,716] Trial 101 finished with value: 0.1627821640205836 and parameters: {'model_name': 'SimpleImputer', 'strategy': 'mean'}. Best is trial 1 with value: 0.1627821640205836.
running
[I 2024-11-12 02:02:00,855] Trial 102 finished with value: 0.1627821640205836 and parameters: {'model_name': 'SimpleImputer', 'strategy': 'mean'}. Best is trial 1 with value: 0.1627821640205836.
