[I 2024-08-12 13:18:45,999] Trial 100 finished with value: 0.04129786097871689 and parameters: {'model_name': 'SimpleImputer', 'strategy': 'mean'}. Best is trial 3 with value: 0.04129786097871689.
running
running
[I 2024-08-12 13:18:46,366] Trial 108 finished with value: 0.04129786097871689 and parameters: {'model_name': 'SimpleImputer', 'strategy': 'mean'}. Best is trial 3 with value: 0.04129786097871689.
running
[I 2024-08-12 13:18:46,555] Trial 106 finished with value: 0.04129786097871689 and parameters: {'model_name': 'SimpleImputer', 'strategy': 'mean'}. Best is trial 3 with value: 0.04129786097871689.
[I 2024-08-12 13:18:46,674] Trial 107 finished with value: 0.04129786097871689 and parameters: {'model_name': 'SimpleImputer', 'strategy': 'mean'}. Best is trial 3 with value: 0.04129786097871689.
running
running
[I 2024-08-12 13:18:46,827] Trial 104 finished with value: 0.04129786097871689 and parameters: {'model_name': 'SimpleImputer', 'strategy': 'mean'}. Best is trial 3 with value: 0.04129786097871689.
running
[I 2024-08-12 13:18:46,960] Trial 105 finished with value: 0.04129786097871689 and parameters: {'model_name': 'SimpleImputer', 'strategy': 'mean'}. Best is trial 3 with value: 0.04129786097871689.
running
[I 2024-08-12 13:18:47,175] Trial 109 finished with value: 0.04129786097871689 and parameters: {'model_name': 'SimpleImputer', 'strategy': 'mean'}. Best is trial 3 with value: 0.04129786097871689.
running
[I 2024-08-12 13:18:47,391] Trial 112 finished with value: 0.04129786097871689 and parameters: {'model_name': 'SimpleImputer', 'strategy': 'mean'}. Best is trial 3 with value: 0.04129786097871689.
running
[I 2024-08-12 13:18:47,566] Trial 118 finished with value: 0.04129786097871689 and parameters: {'model_name': 'SimpleImputer', 'strategy': 'mean'}. Best is trial 3 with value: 0.04129786097871689.
running
[I 2024-08-12 13:18:47,713] Trial 111 finished with value: 0.04129786097871689 and parameters: {'model_name': 'SimpleImputer', 'strategy': 'mean'}. Best is trial 3 with value: 0.04129786097871689.
[I 2024-08-12 13:18:47,816] Trial 113 finished with value: 0.04129786097871689 and parameters: {'model_name': 'SimpleImputer', 'strategy': 'mean'}. Best is trial 3 with value: 0.04129786097871689.
running
[I 2024-08-12 13:18:47,921] Trial 115 finished with value: 0.04129786097871689 and parameters: {'model_name': 'SimpleImputer', 'strategy': 'mean'}. Best is trial 3 with value: 0.04129786097871689.
running
running
[I 2024-08-12 13:18:48,073] Trial 117 finished with value: 0.04129786097871689 and parameters: {'model_name': 'SimpleImputer', 'strategy': 'mean'}. Best is trial 3 with value: 0.04129786097871689.
running
[I 2024-08-12 13:18:48,206] Trial 114 finished with value: 0.04129786097871689 and parameters: {'model_name': 'SimpleImputer', 'strategy': 'mean'}. Best is trial 3 with value: 0.04129786097871689.
[I 2024-08-12 13:18:48,303] Trial 116 finished with value: 0.04129786097871689 and parameters: {'model_name': 'SimpleImputer', 'strategy': 'mean'}. Best is trial 3 with value: 0.04129786097871689.
[I 2024-08-12 13:18:48,399] Trial 110 finished with value: 0.04129786097871689 and parameters: {'model_name': 'SimpleImputer', 'strategy': 'mean'}. Best is trial 3 with value: 0.04129786097871689.
running
running
running
[I 2024-08-12 13:18:48,591] Trial 119 finished with value: 0.04129786097871689 and parameters: {'model_name': 'SimpleImputer', 'strategy': 'mean'}. Best is trial 3 with value: 0.04129786097871689.
running
[I 2024-08-12 13:18:48,884] Trial 122 finished with value: 0.04129786097871689 and parameters: {'model_name': 'SimpleImputer', 'strategy': 'mean'}. Best is trial 3 with value: 0.04129786097871689.
running
[I 2024-08-12 13:18:49,039] Trial 121 finished with value: 0.04129786097871689 and parameters: {'model_name': 'SimpleImputer', 'strategy': 'mean'}. Best is trial 3 with value: 0.04129786097871689.
running
[I 2024-08-12 13:18:49,214] Trial 120 finished with value: 0.04129786097871689 and parameters: {'model_name': 'SimpleImputer', 'strategy': 'mean'}. Best is trial 3 with value: 0.04129786097871689.
running
[I 2024-08-12 13:18:49,455] Trial 123 finished with value: 0.04129786097871689 and parameters: {'model_name': 'SimpleImputer', 'strategy': 'mean'}. Best is trial 3 with value: 0.04129786097871689.
running
[I 2024-08-12 13:18:49,562] Trial 125 finished with value: 0.04129786097871689 and parameters: {'model_name': 'SimpleImputer', 'strategy': 'mean'}. Best is trial 3 with value: 0.04129786097871689.
running
[I 2024-08-12 13:18:49,780] Trial 126 finished with value: 0.04129786097871689 and parameters: {'model_name': 'SimpleImputer', 'strategy': 'mean'}. Best is trial 3 with value: 0.04129786097871689.
running
[I 2024-08-12 13:18:49,902] Trial 124 finished with value: 0.04129786097871689 and parameters: {'model_name': 'SimpleImputer', 'strategy': 'mean'}. Best is trial 3 with value: 0.04129786097871689.
[I 2024-08-12 13:18:49,996] Trial 129 finished with value: 0.04129786097871689 and parameters: {'model_name': 'SimpleImputer', 'strategy': 'mean'}. Best is trial 3 with value: 0.04129786097871689.
running
running
[I 2024-08-12 13:18:50,236] Trial 128 finished with value: 0.04129786097871689 and parameters: {'model_name': 'SimpleImputer', 'strategy': 'mean'}. Best is trial 3 with value: 0.04129786097871689.
running
[I 2024-08-12 13:18:50,391] Trial 131 finished with value: 0.04129786097871689 and parameters: {'model_name': 'SimpleImputer', 'strategy': 'mean'}. Best is trial 3 with value: 0.04129786097871689.
[I 2024-08-12 13:18:50,493] Trial 134 finished with value: 0.04129786097871689 and parameters: {'model_name': 'SimpleImputer', 'strategy': 'mean'}. Best is trial 3 with value: 0.04129786097871689.
running
[I 2024-08-12 13:18:50,605] Trial 132 finished with value: 0.04129786097871689 and parameters: {'model_name': 'SimpleImputer', 'strategy': 'mean'}. Best is trial 3 with value: 0.04129786097871689.
running
[I 2024-08-12 13:18:50,610] Trial 127 finished with value: 0.04129786097871689 and parameters: {'model_name': 'SimpleImputer', 'strategy': 'mean'}. Best is trial 3 with value: 0.04129786097871689.
running
running
[I 2024-08-12 13:18:50,958] Trial 130 finished with value: 0.04129786097871689 and parameters: {'model_name': 'SimpleImputer', 'strategy': 'mean'}. Best is trial 3 with value: 0.04129786097871689.
running
[I 2024-08-12 13:18:51,089] Trial 135 finished with value: 0.04129786097871689 and parameters: {'model_name': 'SimpleImputer', 'strategy': 'mean'}. Best is trial 3 with value: 0.04129786097871689.
running
[I 2024-08-12 13:18:51,411] Trial 136 finished with value: 0.04129786097871689 and parameters: {'model_name': 'SimpleImputer', 'strategy': 'mean'}. Best is trial 3 with value: 0.04129786097871689.
[I 2024-08-12 13:18:51,525] Trial 133 finished with value: 0.04129786097871689 and parameters: {'model_name': 'SimpleImputer', 'strategy': 'mean'}. Best is trial 3 with value: 0.04129786097871689.
running
[I 2024-08-12 13:18:51,526] Trial 137 finished with value: 0.04129786097871689 and parameters: {'model_name': 'SimpleImputer', 'strategy': 'mean'}. Best is trial 3 with value: 0.04129786097871689.
running
running
[I 2024-08-12 13:18:51,776] Trial 138 finished with value: 0.04129786097871689 and parameters: {'model_name': 'SimpleImputer', 'strategy': 'mean'}. Best is trial 3 with value: 0.04129786097871689.
running
[I 2024-08-12 13:18:51,986] Trial 140 finished with value: 0.04129786097871689 and parameters: {'model_name': 'SimpleImputer', 'strategy': 'mean'}. Best is trial 3 with value: 0.04129786097871689.
[I 2024-08-12 13:18:52,101] Trial 142 finished with value: 0.04129786097871689 and parameters: {'model_name': 'SimpleImputer', 'strategy': 'mean'}. Best is trial 3 with value: 0.04129786097871689.
running
running
[I 2024-08-12 13:18:52,440] Trial 139 finished with value: 0.04129786097871689 and parameters: {'model_name': 'SimpleImputer', 'strategy': 'mean'}. Best is trial 3 with value: 0.04129786097871689.
running
[I 2024-08-12 13:18:52,750] Trial 145 finished with value: 0.04129786097871689 and parameters: {'model_name': 'SimpleImputer', 'strategy': 'mean'}. Best is trial 3 with value: 0.04129786097871689.
running
[I 2024-08-12 13:18:53,281] Trial 150 finished with value: 0.04129786097871689 and parameters: {'model_name': 'SimpleImputer', 'strategy': 'mean'}. Best is trial 3 with value: 0.04129786097871689.
running
[I 2024-08-12 13:18:53,473] Trial 151 finished with value: 0.04129786097871689 and parameters: {'model_name': 'SimpleImputer', 'strategy': 'mean'}. Best is trial 3 with value: 0.04129786097871689.
running
[I 2024-08-12 13:18:54,747] Trial 160 finished with value: 0.04129786097871689 and parameters: {'model_name': 'SimpleImputer', 'strategy': 'mean'}. Best is trial 3 with value: 0.04129786097871689.
running
[I 2024-08-12 13:18:56,661] Trial 147 finished with value: 0.05219747793155246 and parameters: {'model_name': 'SimpleImputer', 'strategy': 'most_frequent'}. Best is trial 3 with value: 0.04129786097871689.
running
[I 2024-08-12 13:18:57,558] Trial 141 finished with value: 0.05219747793155246 and parameters: {'model_name': 'SimpleImputer', 'strategy': 'most_frequent'}. Best is trial 3 with value: 0.04129786097871689.
running
[I 2024-08-12 13:18:57,772] Trial 157 finished with value: 0.05219747793155246 and parameters: {'model_name': 'SimpleImputer', 'strategy': 'most_frequent'}. Best is trial 3 with value: 0.04129786097871689.
running
[I 2024-08-12 13:18:57,905] Trial 146 finished with value: 0.05219747793155246 and parameters: {'model_name': 'SimpleImputer', 'strategy': 'most_frequent'}. Best is trial 3 with value: 0.04129786097871689.
[I 2024-08-12 13:18:57,996] Trial 143 finished with value: 0.05219747793155246 and parameters: {'model_name': 'SimpleImputer', 'strategy': 'most_frequent'}. Best is trial 3 with value: 0.04129786097871689.
running
running
[I 2024-08-12 13:18:58,257] Trial 149 finished with value: 0.05219747793155246 and parameters: {'model_name': 'SimpleImputer', 'strategy': 'most_frequent'}. Best is trial 3 with value: 0.04129786097871689.
running
[I 2024-08-12 13:18:58,413] Trial 144 finished with value: 0.05219747793155246 and parameters: {'model_name': 'SimpleImputer', 'strategy': 'most_frequent'}. Best is trial 3 with value: 0.04129786097871689.
[I 2024-08-12 13:18:58,518] Trial 153 finished with value: 0.05219747793155246 and parameters: {'model_name': 'SimpleImputer', 'strategy': 'most_frequent'}. Best is trial 3 with value: 0.04129786097871689.
running
running
[I 2024-08-12 13:18:58,678] Trial 156 finished with value: 0.05219747793155246 and parameters: {'model_name': 'SimpleImputer', 'strategy': 'most_frequent'}. Best is trial 3 with value: 0.04129786097871689.
running
[I 2024-08-12 13:18:58,937] Trial 155 finished with value: 0.05219747793155246 and parameters: {'model_name': 'SimpleImputer', 'strategy': 'most_frequent'}. Best is trial 3 with value: 0.04129786097871689.
running
[I 2024-08-12 13:18:59,047] Trial 154 finished with value: 0.05219747793155246 and parameters: {'model_name': 'SimpleImputer', 'strategy': 'most_frequent'}. Best is trial 3 with value: 0.04129786097871689.
running
[I 2024-08-12 13:18:59,214] Trial 152 finished with value: 0.05219747793155246 and parameters: {'model_name': 'SimpleImputer', 'strategy': 'most_frequent'}. Best is trial 3 with value: 0.04129786097871689.
[I 2024-08-12 13:18:59,315] Trial 148 finished with value: 0.05219747793155246 and parameters: {'model_name': 'SimpleImputer', 'strategy': 'most_frequent'}. Best is trial 3 with value: 0.04129786097871689.
running
running
[I 2024-08-12 13:18:59,579] Trial 158 finished with value: 0.05219747793155246 and parameters: {'model_name': 'SimpleImputer', 'strategy': 'most_frequent'}. Best is trial 3 with value: 0.04129786097871689.
running
[I 2024-08-12 13:18:59,962] Trial 164 finished with value: 0.04129786097871689 and parameters: {'model_name': 'SimpleImputer', 'strategy': 'mean'}. Best is trial 3 with value: 0.04129786097871689.
[I 2024-08-12 13:19:00,091] Trial 165 finished with value: 0.04129786097871689 and parameters: {'model_name': 'SimpleImputer', 'strategy': 'mean'}. Best is trial 3 with value: 0.04129786097871689.
running
running
[I 2024-08-12 13:19:00,221] Trial 163 finished with value: 0.04129786097871689 and parameters: {'model_name': 'SimpleImputer', 'strategy': 'mean'}. Best is trial 3 with value: 0.04129786097871689.
running
[I 2024-08-12 13:19:00,374] Trial 166 finished with value: 0.04129786097871689 and parameters: {'model_name': 'SimpleImputer', 'strategy': 'mean'}. Best is trial 3 with value: 0.04129786097871689.
running
[I 2024-08-12 13:19:00,612] Trial 159 finished with value: 0.05219747793155246 and parameters: {'model_name': 'SimpleImputer', 'strategy': 'most_frequent'}. Best is trial 3 with value: 0.04129786097871689.
[I 2024-08-12 13:19:00,718] Trial 167 finished with value: 0.04129786097871689 and parameters: {'model_name': 'SimpleImputer', 'strategy': 'mean'}. Best is trial 3 with value: 0.04129786097871689.
running
running
[I 2024-08-12 13:19:00,894] Trial 169 finished with value: 0.04129786097871689 and parameters: {'model_name': 'SimpleImputer', 'strategy': 'mean'}. Best is trial 3 with value: 0.04129786097871689.
running
[I 2024-08-12 13:19:01,073] Trial 172 finished with value: 0.04129786097871689 and parameters: {'model_name': 'SimpleImputer', 'strategy': 'mean'}. Best is trial 3 with value: 0.04129786097871689.
[I 2024-08-12 13:19:01,202] Trial 168 finished with value: 0.04129786097871689 and parameters: {'model_name': 'SimpleImputer', 'strategy': 'mean'}. Best is trial 3 with value: 0.04129786097871689.
running
running
[I 2024-08-12 13:19:01,315] Trial 170 finished with value: 0.04129786097871689 and parameters: {'model_name': 'SimpleImputer', 'strategy': 'mean'}. Best is trial 3 with value: 0.04129786097871689.
running
[I 2024-08-12 13:19:01,638] Trial 171 finished with value: 0.04129786097871689 and parameters: {'model_name': 'SimpleImputer', 'strategy': 'mean'}. Best is trial 3 with value: 0.04129786097871689.
running
[I 2024-08-12 13:19:01,801] Trial 174 finished with value: 0.04129786097871689 and parameters: {'model_name': 'SimpleImputer', 'strategy': 'mean'}. Best is trial 3 with value: 0.04129786097871689.
running
[I 2024-08-12 13:19:01,940] Trial 175 finished with value: 0.04129786097871689 and parameters: {'model_name': 'SimpleImputer', 'strategy': 'mean'}. Best is trial 3 with value: 0.04129786097871689.
running
[I 2024-08-12 13:19:02,087] Trial 173 finished with value: 0.04129786097871689 and parameters: {'model_name': 'SimpleImputer', 'strategy': 'mean'}. Best is trial 3 with value: 0.04129786097871689.
running
[I 2024-08-12 13:19:02,266] Trial 161 finished with value: 0.05219747793155246 and parameters: {'model_name': 'SimpleImputer', 'strategy': 'most_frequent'}. Best is trial 3 with value: 0.04129786097871689.
running
[I 2024-08-12 13:19:02,499] Trial 176 finished with value: 0.04129786097871689 and parameters: {'model_name': 'SimpleImputer', 'strategy': 'mean'}. Best is trial 3 with value: 0.04129786097871689.
running
[I 2024-08-12 13:19:02,637] Trial 179 finished with value: 0.04129786097871689 and parameters: {'model_name': 'SimpleImputer', 'strategy': 'mean'}. Best is trial 3 with value: 0.04129786097871689.
running
[I 2024-08-12 13:19:02,646] Trial 178 finished with value: 0.04129786097871689 and parameters: {'model_name': 'SimpleImputer', 'strategy': 'mean'}. Best is trial 3 with value: 0.04129786097871689.
running
[I 2024-08-12 13:19:02,895] Trial 177 finished with value: 0.04129786097871689 and parameters: {'model_name': 'SimpleImputer', 'strategy': 'mean'}. Best is trial 3 with value: 0.04129786097871689.
running
[I 2024-08-12 13:19:03,166] Trial 181 finished with value: 0.04129786097871689 and parameters: {'model_name': 'SimpleImputer', 'strategy': 'mean'}. Best is trial 3 with value: 0.04129786097871689.
[I 2024-08-12 13:19:03,172] Trial 182 finished with value: 0.04129786097871689 and parameters: {'model_name': 'SimpleImputer', 'strategy': 'mean'}. Best is trial 3 with value: 0.04129786097871689.
[I 2024-08-12 13:19:03,174] Trial 183 finished with value: 0.04129786097871689 and parameters: {'model_name': 'SimpleImputer', 'strategy': 'mean'}. Best is trial 3 with value: 0.04129786097871689.
[I 2024-08-12 13:19:03,470] Trial 180 finished with value: 0.04129786097871689 and parameters: {'model_name': 'SimpleImputer', 'strategy': 'mean'}. Best is trial 3 with value: 0.04129786097871689.
running
[I 2024-08-12 13:19:03,569] Trial 185 finished with value: 0.04129786097871689 and parameters: {'model_name': 'SimpleImputer', 'strategy': 'mean'}. Best is trial 3 with value: 0.04129786097871689.
running
running
[I 2024-08-12 13:19:03,675] Trial 184 finished with value: 0.04129786097871689 and parameters: {'model_name': 'SimpleImputer', 'strategy': 'mean'}. Best is trial 3 with value: 0.04129786097871689.
running
running
[I 2024-08-12 13:19:04,056] Trial 186 finished with value: 0.04129786097871689 and parameters: {'model_name': 'SimpleImputer', 'strategy': 'mean'}. Best is trial 3 with value: 0.04129786097871689.
[I 2024-08-12 13:19:04,300] Trial 189 finished with value: 0.04129786097871689 and parameters: {'model_name': 'SimpleImputer', 'strategy': 'mean'}. Best is trial 3 with value: 0.04129786097871689.
[I 2024-08-12 13:19:04,403] Trial 188 finished with value: 0.04129786097871689 and parameters: {'model_name': 'SimpleImputer', 'strategy': 'mean'}. Best is trial 3 with value: 0.04129786097871689.
[I 2024-08-12 13:19:04,576] Trial 187 finished with value: 0.04129786097871689 and parameters: {'model_name': 'SimpleImputer', 'strategy': 'mean'}. Best is trial 3 with value: 0.04129786097871689.
[I 2024-08-12 13:19:04,727] Trial 191 finished with value: 0.04129786097871689 and parameters: {'model_name': 'SimpleImputer', 'strategy': 'mean'}. Best is trial 3 with value: 0.04129786097871689.
[I 2024-08-12 13:19:04,846] Trial 192 finished with value: 0.04129786097871689 and parameters: {'model_name': 'SimpleImputer', 'strategy': 'mean'}. Best is trial 3 with value: 0.04129786097871689.
[I 2024-08-12 13:19:04,959] Trial 196 finished with value: 0.04129786097871689 and parameters: {'model_name': 'SimpleImputer', 'strategy': 'mean'}. Best is trial 3 with value: 0.04129786097871689.
[I 2024-08-12 13:19:05,055] Trial 190 finished with value: 0.04129786097871689 and parameters: {'model_name': 'SimpleImputer', 'strategy': 'mean'}. Best is trial 3 with value: 0.04129786097871689.
[I 2024-08-12 13:19:05,165] Trial 195 finished with value: 0.04129786097871689 and parameters: {'model_name': 'SimpleImputer', 'strategy': 'mean'}. Best is trial 3 with value: 0.04129786097871689.
[I 2024-08-12 13:19:05,264] Trial 193 finished with value: 0.04129786097871689 and parameters: {'model_name': 'SimpleImputer', 'strategy': 'mean'}. Best is trial 3 with value: 0.04129786097871689.
[I 2024-08-12 13:19:05,367] Trial 198 finished with value: 0.04129786097871689 and parameters: {'model_name': 'SimpleImputer', 'strategy': 'mean'}. Best is trial 3 with value: 0.04129786097871689.
[I 2024-08-12 13:19:05,488] Trial 197 finished with value: 0.04129786097871689 and parameters: {'model_name': 'SimpleImputer', 'strategy': 'mean'}. Best is trial 3 with value: 0.04129786097871689.
[I 2024-08-12 13:19:05,590] Trial 194 finished with value: 0.04129786097871689 and parameters: {'model_name': 'SimpleImputer', 'strategy': 'mean'}. Best is trial 3 with value: 0.04129786097871689.
[I 2024-08-12 13:19:05,684] Trial 199 finished with value: 0.04129786097871689 and parameters: {'model_name': 'SimpleImputer', 'strategy': 'mean'}. Best is trial 3 with value: 0.04129786097871689.
