[I 2024-11-24 18:48:55,011] Trial 40 finished with value: 0.1719485324247959 and parameters: {'model_name': 'VAE', 'batch_size': 31, 'iterations': 7231, 'learning_rate': 0.0072205879341509125, 'p_miss': 0.04057944416854805}. Best is trial 24 with value: 0.08405233435168191.
[I 2024-11-24 18:58:25,138] Trial 73 finished with value: 0.15784807846069276 and parameters: {'model_name': 'IterativeImputer', 'estimator': 'RFR', 'initial_strategy': 'most_frequent', 'n_nearest_features': 6, 'imputation_order': 'ascending'}. Best is trial 24 with value: 0.08405233435168191.
[I 2024-11-24 18:59:33,402] Trial 74 finished with value: 0.1584986747689388 and parameters: {'model_name': 'IterativeImputer', 'estimator': 'RFR', 'initial_strategy': 'most_frequent', 'n_nearest_features': 6, 'imputation_order': 'ascending'}. Best is trial 24 with value: 0.08405233435168191.
[I 2024-11-24 19:01:13,413] Trial 37 finished with value: 0.16666744798499228 and parameters: {'model_name': 'VAE', 'batch_size': 745, 'iterations': 5420, 'learning_rate': 0.008143333248724212, 'p_miss': 0.028268357081649365}. Best is trial 24 with value: 0.08405233435168191.
[I 2024-11-24 19:02:46,797] Trial 75 finished with value: 0.15769229286700537 and parameters: {'model_name': 'IterativeImputer', 'estimator': 'RFR', 'initial_strategy': 'most_frequent', 'n_nearest_features': 6, 'imputation_order': 'ascending'}. Best is trial 24 with value: 0.08405233435168191.
[I 2024-11-24 19:10:13,287] Trial 105 finished with value: 0.3994653530204162 and parameters: {'model_name': 'GAIN', 'batch_size': 67, 'hint_rate': 0.4821073387223312, 'alpha': 40, 'iterations': 8256, 'learning_rate': 0.045275755994577116, 'p_miss': 0.29283727943905025}. Best is trial 24 with value: 0.08405233435168191.
[I 2024-11-24 19:16:02,338] Trial 34 finished with value: 0.16669691862523384 and parameters: {'model_name': 'VAE', 'batch_size': 823, 'iterations': 5726, 'learning_rate': 0.0015972918351437617, 'p_miss': 0.11456440298304968}. Best is trial 24 with value: 0.08405233435168191.
[I 2024-11-24 19:20:14,543] Trial 78 finished with value: 0.15760936161926545 and parameters: {'model_name': 'IterativeImputer', 'estimator': 'RFR', 'initial_strategy': 'most_frequent', 'n_nearest_features': 6, 'imputation_order': 'ascending'}. Best is trial 24 with value: 0.08405233435168191.
[I 2024-11-24 19:21:57,636] Trial 81 finished with value: 0.41162889067422836 and parameters: {'model_name': 'GAIN', 'batch_size': 50, 'hint_rate': 0.9846503838904246, 'alpha': 46, 'iterations': 9501, 'learning_rate': 0.00013348170394716655, 'p_miss': 0.12846433663832144}. Best is trial 24 with value: 0.08405233435168191.
[I 2024-11-24 19:23:48,024] Trial 112 finished with value: 0.3986805398263196 and parameters: {'model_name': 'GAIN', 'batch_size': 59, 'hint_rate': 0.4652692877699818, 'alpha': 40, 'iterations': 6625, 'learning_rate': 0.04485741377005906, 'p_miss': 0.29461977389409083}. Best is trial 24 with value: 0.08405233435168191.
[I 2024-11-24 19:26:04,217] Trial 110 finished with value: 0.41109760182045063 and parameters: {'model_name': 'GAIN', 'batch_size': 64, 'hint_rate': 0.5123770053803672, 'alpha': 44, 'iterations': 9195, 'learning_rate': 0.030610646568541275, 'p_miss': 0.13546221569362013}. Best is trial 24 with value: 0.08405233435168191.
[I 2024-11-24 19:28:23,078] Trial 39 finished with value: 0.16640632947477435 and parameters: {'model_name': 'VAE', 'batch_size': 790, 'iterations': 7107, 'learning_rate': 0.00825803339720237, 'p_miss': 0.01841872956752412}. Best is trial 24 with value: 0.08405233435168191.
[I 2024-11-24 19:28:59,646] Trial 180 finished with value: 0.41666389117340963 and parameters: {'model_name': 'GAIN', 'batch_size': 59, 'hint_rate': 0.2511457037741988, 'alpha': 3, 'iterations': 8613, 'learning_rate': 0.049073894798880656, 'p_miss': 0.14519126756207373}. Best is trial 24 with value: 0.08405233435168191.
