Run: 19
/cm/local/apps/slurm/var/spool/job1011628/slurm_script: line 26: 
pip install -e tpot2
pip install -r tpot2/ImputerExperiments/requirements_.txt
: No such file or directory
RunStart
Version 0.1.7a0 of tpot2 is outdated. Version 0.1.8a0 was released Tuesday September 17, 2024.
starting loops
../data/c/725/725.pkl
working on 
../data/c/725/class_simple_MAR_0.3_1
0.7272391319274902
running experiment 1/3 - Does large hyperparameter space improve reconstruction accuracy over simple
[I 2024-10-23 11:58:01,599] A new study created in memory with name: no-name-3a015455-6090-4556-a73f-ff560afdb5e0
running
running
running
running
running
running
running
running
running
running
running
running
running
running
running
running
[I 2024-10-23 11:58:01,836] Trial 4 finished with value: 0.22829013333538378 and parameters: {'model_name': 'SimpleImputer', 'strategy': 'mean'}. Best is trial 4 with value: 0.22829013333538378.
[I 2024-10-23 11:58:01,955] Trial 3 finished with value: 0.39944846007980644 and parameters: {'model_name': 'SimpleImputer', 'strategy': 'constant'}. Best is trial 4 with value: 0.22829013333538378.
running
[I 2024-10-23 11:58:02,063] Trial 2 finished with value: 0.39944846007980644 and parameters: {'model_name': 'SimpleImputer', 'strategy': 'constant'}. Best is trial 4 with value: 0.22829013333538378.
running
running
[I 2024-10-23 11:58:02,198] Trial 8 finished with value: 0.39944846007980644 and parameters: {'model_name': 'SimpleImputer', 'strategy': 'constant'}. Best is trial 4 with value: 0.22829013333538378.
[I 2024-10-23 11:58:02,285] Trial 11 finished with value: 0.39944846007980644 and parameters: {'model_name': 'SimpleImputer', 'strategy': 'constant'}. Best is trial 4 with value: 0.22829013333538378.
running
running
[I 2024-10-23 11:58:02,430] Trial 6 finished with value: 0.39944846007980644 and parameters: {'model_name': 'SimpleImputer', 'strategy': 'constant'}. Best is trial 4 with value: 0.22829013333538378.
running
[I 2024-10-23 11:58:02,572] Trial 9 finished with value: 0.22829013333538378 and parameters: {'model_name': 'SimpleImputer', 'strategy': 'mean'}. Best is trial 4 with value: 0.22829013333538378.
running
[I 2024-10-23 11:58:02,687] Trial 14 finished with value: 0.39944846007980644 and parameters: {'model_name': 'SimpleImputer', 'strategy': 'constant'}. Best is trial 4 with value: 0.22829013333538378.
[I 2024-10-23 11:58:02,766] Trial 13 finished with value: 0.39944846007980644 and parameters: {'model_name': 'SimpleImputer', 'strategy': 'constant'}. Best is trial 4 with value: 0.22829013333538378.
running
running
[I 2024-10-23 11:58:02,914] Trial 16 finished with value: 0.22829013333538378 and parameters: {'model_name': 'SimpleImputer', 'strategy': 'mean'}. Best is trial 4 with value: 0.22829013333538378.
[I 2024-10-23 11:58:02,922] Trial 10 finished with value: 0.22829013333538378 and parameters: {'model_name': 'SimpleImputer', 'strategy': 'mean'}. Best is trial 4 with value: 0.22829013333538378.
running
[I 2024-10-23 11:58:03,128] Trial 7 finished with value: 0.2335353458314729 and parameters: {'model_name': 'SimpleImputer', 'strategy': 'median'}. Best is trial 4 with value: 0.22829013333538378.
running
[I 2024-10-23 11:58:03,223] Trial 19 finished with value: 0.22829013333538378 and parameters: {'model_name': 'SimpleImputer', 'strategy': 'mean'}. Best is trial 4 with value: 0.22829013333538378.
running
[I 2024-10-23 11:58:03,311] Trial 0 finished with value: 0.2335353458314729 and parameters: {'model_name': 'SimpleImputer', 'strategy': 'median'}. Best is trial 4 with value: 0.22829013333538378.
running
[I 2024-10-23 11:58:03,406] Trial 17 finished with value: 0.22829013333538378 and parameters: {'model_name': 'SimpleImputer', 'strategy': 'mean'}. Best is trial 4 with value: 0.22829013333538378.
running
running
[I 2024-10-23 11:58:03,507] Trial 5 finished with value: 0.2335353458314729 and parameters: {'model_name': 'SimpleImputer', 'strategy': 'median'}. Best is trial 4 with value: 0.22829013333538378.
running
[I 2024-10-23 11:58:03,719] Trial 18 finished with value: 0.22829013333538378 and parameters: {'model_name': 'SimpleImputer', 'strategy': 'mean'}. Best is trial 4 with value: 0.22829013333538378.
running
[I 2024-10-23 11:58:03,835] Trial 15 finished with value: 0.2335353458314729 and parameters: {'model_name': 'SimpleImputer', 'strategy': 'median'}. Best is trial 4 with value: 0.22829013333538378.
running
[I 2024-10-23 11:58:03,998] Trial 24 finished with value: 0.22829013333538378 and parameters: {'model_name': 'SimpleImputer', 'strategy': 'mean'}. Best is trial 4 with value: 0.22829013333538378.
[I 2024-10-23 11:58:04,104] Trial 25 finished with value: 0.22829013333538378 and parameters: {'model_name': 'SimpleImputer', 'strategy': 'mean'}. Best is trial 4 with value: 0.22829013333538378.
running
running
[I 2024-10-23 11:58:04,208] Trial 1 finished with value: 0.3771968311098218 and parameters: {'model_name': 'SimpleImputer', 'strategy': 'most_frequent'}. Best is trial 4 with value: 0.22829013333538378.
running
[I 2024-10-23 11:58:04,337] Trial 21 finished with value: 0.39944846007980644 and parameters: {'model_name': 'SimpleImputer', 'strategy': 'constant'}. Best is trial 4 with value: 0.22829013333538378.
running
[I 2024-10-23 11:58:04,533] Trial 20 finished with value: 0.2335353458314729 and parameters: {'model_name': 'SimpleImputer', 'strategy': 'median'}. Best is trial 4 with value: 0.22829013333538378.
running
[I 2024-10-23 11:58:04,787] Trial 22 finished with value: 0.2335353458314729 and parameters: {'model_name': 'SimpleImputer', 'strategy': 'median'}. Best is trial 4 with value: 0.22829013333538378.
[I 2024-10-23 11:58:04,916] Trial 23 finished with value: 0.2335353458314729 and parameters: {'model_name': 'SimpleImputer', 'strategy': 'median'}. Best is trial 4 with value: 0.22829013333538378.
running
[I 2024-10-23 11:58:05,084] Trial 12 finished with value: 0.3771968311098218 and parameters: {'model_name': 'SimpleImputer', 'strategy': 'most_frequent'}. Best is trial 4 with value: 0.22829013333538378.
running
running
[I 2024-10-23 11:58:05,431] Trial 38 finished with value: 0.22829013333538378 and parameters: {'model_name': 'SimpleImputer', 'strategy': 'mean'}. Best is trial 4 with value: 0.22829013333538378.
[I 2024-10-23 11:58:05,534] Trial 36 finished with value: 0.22829013333538378 and parameters: {'model_name': 'SimpleImputer', 'strategy': 'mean'}. Best is trial 4 with value: 0.22829013333538378.
running
[I 2024-10-23 11:58:05,657] Trial 26 finished with value: 0.3771968311098218 and parameters: {'model_name': 'SimpleImputer', 'strategy': 'most_frequent'}. Best is trial 4 with value: 0.22829013333538378.
running
[I 2024-10-23 11:58:05,794] Trial 30 finished with value: 0.3771968311098218 and parameters: {'model_name': 'SimpleImputer', 'strategy': 'most_frequent'}. Best is trial 4 with value: 0.22829013333538378.
running
running
[I 2024-10-23 11:58:05,939] Trial 29 finished with value: 0.3771968311098218 and parameters: {'model_name': 'SimpleImputer', 'strategy': 'most_frequent'}. Best is trial 4 with value: 0.22829013333538378.
running
[I 2024-10-23 11:58:06,049] Trial 37 finished with value: 0.22829013333538378 and parameters: {'model_name': 'SimpleImputer', 'strategy': 'mean'}. Best is trial 4 with value: 0.22829013333538378.
[I 2024-10-23 11:58:06,146] Trial 27 finished with value: 0.3771968311098218 and parameters: {'model_name': 'SimpleImputer', 'strategy': 'most_frequent'}. Best is trial 4 with value: 0.22829013333538378.
running
[I 2024-10-23 11:58:06,249] Trial 33 finished with value: 0.3771968311098218 and parameters: {'model_name': 'SimpleImputer', 'strategy': 'most_frequent'}. Best is trial 4 with value: 0.22829013333538378.
running
running
[I 2024-10-23 11:58:06,388] Trial 28 finished with value: 0.3771968311098218 and parameters: {'model_name': 'SimpleImputer', 'strategy': 'most_frequent'}. Best is trial 4 with value: 0.22829013333538378.
[I 2024-10-23 11:58:06,503] Trial 40 finished with value: 0.22829013333538378 and parameters: {'model_name': 'SimpleImputer', 'strategy': 'mean'}. Best is trial 4 with value: 0.22829013333538378.
[I 2024-10-23 11:58:06,617] Trial 31 finished with value: 0.3771968311098218 and parameters: {'model_name': 'SimpleImputer', 'strategy': 'most_frequent'}. Best is trial 4 with value: 0.22829013333538378.
running
running
[I 2024-10-23 11:58:06,753] Trial 41 finished with value: 0.22829013333538378 and parameters: {'model_name': 'SimpleImputer', 'strategy': 'mean'}. Best is trial 4 with value: 0.22829013333538378.
running
[I 2024-10-23 11:58:06,874] Trial 42 finished with value: 0.22829013333538378 and parameters: {'model_name': 'SimpleImputer', 'strategy': 'mean'}. Best is trial 4 with value: 0.22829013333538378.
running
[I 2024-10-23 11:58:06,963] Trial 39 finished with value: 0.22829013333538378 and parameters: {'model_name': 'SimpleImputer', 'strategy': 'mean'}. Best is trial 4 with value: 0.22829013333538378.
running
[I 2024-10-23 11:58:07,128] Trial 32 finished with value: 0.3771968311098218 and parameters: {'model_name': 'SimpleImputer', 'strategy': 'most_frequent'}. Best is trial 4 with value: 0.22829013333538378.
[I 2024-10-23 11:58:07,229] Trial 34 finished with value: 0.3771968311098218 and parameters: {'model_name': 'SimpleImputer', 'strategy': 'most_frequent'}. Best is trial 4 with value: 0.22829013333538378.
running
[I 2024-10-23 11:58:07,329] Trial 45 finished with value: 0.22829013333538378 and parameters: {'model_name': 'SimpleImputer', 'strategy': 'mean'}. Best is trial 4 with value: 0.22829013333538378.
[I 2024-10-23 11:58:07,426] Trial 35 finished with value: 0.3771968311098218 and parameters: {'model_name': 'SimpleImputer', 'strategy': 'most_frequent'}. Best is trial 4 with value: 0.22829013333538378.
running
running
running
running
[I 2024-10-23 11:58:07,624] Trial 43 finished with value: 0.22829013333538378 and parameters: {'model_name': 'SimpleImputer', 'strategy': 'mean'}. Best is trial 4 with value: 0.22829013333538378.
running
[I 2024-10-23 11:58:07,760] Trial 44 finished with value: 0.22829013333538378 and parameters: {'model_name': 'SimpleImputer', 'strategy': 'mean'}. Best is trial 4 with value: 0.22829013333538378.
[I 2024-10-23 11:58:07,902] Trial 49 finished with value: 0.22829013333538378 and parameters: {'model_name': 'SimpleImputer', 'strategy': 'mean'}. Best is trial 4 with value: 0.22829013333538378.
running
running
[I 2024-10-23 11:58:08,046] Trial 46 finished with value: 0.22829013333538378 and parameters: {'model_name': 'SimpleImputer', 'strategy': 'mean'}. Best is trial 4 with value: 0.22829013333538378.
running
[I 2024-10-23 11:58:08,201] Trial 52 finished with value: 0.22829013333538378 and parameters: {'model_name': 'SimpleImputer', 'strategy': 'mean'}. Best is trial 4 with value: 0.22829013333538378.
[I 2024-10-23 11:58:08,309] Trial 53 finished with value: 0.22829013333538378 and parameters: {'model_name': 'SimpleImputer', 'strategy': 'mean'}. Best is trial 4 with value: 0.22829013333538378.
running
running
[I 2024-10-23 11:58:08,459] Trial 48 finished with value: 0.22829013333538378 and parameters: {'model_name': 'SimpleImputer', 'strategy': 'mean'}. Best is trial 4 with value: 0.22829013333538378.
[I 2024-10-23 11:58:08,572] Trial 47 finished with value: 0.22829013333538378 and parameters: {'model_name': 'SimpleImputer', 'strategy': 'mean'}. Best is trial 4 with value: 0.22829013333538378.
[I 2024-10-23 11:58:08,668] Trial 51 finished with value: 0.22829013333538378 and parameters: {'model_name': 'SimpleImputer', 'strategy': 'mean'}. Best is trial 4 with value: 0.22829013333538378.
[I 2024-10-23 11:58:08,779] Trial 50 finished with value: 0.22829013333538378 and parameters: {'model_name': 'SimpleImputer', 'strategy': 'mean'}. Best is trial 4 with value: 0.22829013333538378.
[I 2024-10-23 11:58:08,889] Trial 59 finished with value: 0.22829013333538378 and parameters: {'model_name': 'SimpleImputer', 'strategy': 'mean'}. Best is trial 4 with value: 0.22829013333538378.
[I 2024-10-23 11:58:08,983] Trial 58 finished with value: 0.22829013333538378 and parameters: {'model_name': 'SimpleImputer', 'strategy': 'mean'}. Best is trial 4 with value: 0.22829013333538378.
running
running
[I 2024-10-23 11:58:09,114] Trial 54 finished with value: 0.22829013333538378 and parameters: {'model_name': 'SimpleImputer', 'strategy': 'mean'}. Best is trial 4 with value: 0.22829013333538378.
running
[I 2024-10-23 11:58:09,214] Trial 55 finished with value: 0.22829013333538378 and parameters: {'model_name': 'SimpleImputer', 'strategy': 'mean'}. Best is trial 4 with value: 0.22829013333538378.
running
running
[I 2024-10-23 11:58:09,324] Trial 60 finished with value: 0.22829013333538378 and parameters: {'model_name': 'SimpleImputer', 'strategy': 'mean'}. Best is trial 4 with value: 0.22829013333538378.
running
[I 2024-10-23 11:58:09,451] Trial 56 finished with value: 0.22829013333538378 and parameters: {'model_name': 'SimpleImputer', 'strategy': 'mean'}. Best is trial 4 with value: 0.22829013333538378.
[I 2024-10-23 11:58:09,562] Trial 57 finished with value: 0.22829013333538378 and parameters: {'model_name': 'SimpleImputer', 'strategy': 'mean'}. Best is trial 4 with value: 0.22829013333538378.
running
running
running
running
running
[I 2024-10-23 11:58:09,746] Trial 62 finished with value: 0.22829013333538378 and parameters: {'model_name': 'SimpleImputer', 'strategy': 'mean'}. Best is trial 4 with value: 0.22829013333538378.
[I 2024-10-23 11:58:09,867] Trial 63 finished with value: 0.22829013333538378 and parameters: {'model_name': 'SimpleImputer', 'strategy': 'mean'}. Best is trial 4 with value: 0.22829013333538378.
[I 2024-10-23 11:58:09,868] Trial 61 finished with value: 0.22829013333538378 and parameters: {'model_name': 'SimpleImputer', 'strategy': 'mean'}. Best is trial 4 with value: 0.22829013333538378.
[I 2024-10-23 11:58:10,090] Trial 64 finished with value: 0.22829013333538378 and parameters: {'model_name': 'SimpleImputer', 'strategy': 'mean'}. Best is trial 4 with value: 0.22829013333538378.
running
running
running
running
[I 2024-10-23 11:58:10,264] Trial 71 finished with value: 0.39944846007980644 and parameters: {'model_name': 'SimpleImputer', 'strategy': 'constant'}. Best is trial 4 with value: 0.22829013333538378.
[I 2024-10-23 11:58:10,377] Trial 72 finished with value: 0.39944846007980644 and parameters: {'model_name': 'SimpleImputer', 'strategy': 'constant'}. Best is trial 4 with value: 0.22829013333538378.
[I 2024-10-23 11:58:10,489] Trial 67 finished with value: 0.39944846007980644 and parameters: {'model_name': 'SimpleImputer', 'strategy': 'constant'}. Best is trial 4 with value: 0.22829013333538378.
running
running
running
[I 2024-10-23 11:58:10,663] Trial 66 finished with value: 0.39944846007980644 and parameters: {'model_name': 'SimpleImputer', 'strategy': 'constant'}. Best is trial 4 with value: 0.22829013333538378.
running
[I 2024-10-23 11:58:10,800] Trial 68 finished with value: 0.39944846007980644 and parameters: {'model_name': 'SimpleImputer', 'strategy': 'constant'}. Best is trial 4 with value: 0.22829013333538378.
running
[I 2024-10-23 11:58:10,936] Trial 73 finished with value: 0.39944846007980644 and parameters: {'model_name': 'SimpleImputer', 'strategy': 'constant'}. Best is trial 4 with value: 0.22829013333538378.
running
[I 2024-10-23 11:58:11,068] Trial 65 finished with value: 0.22829013333538378 and parameters: {'model_name': 'SimpleImputer', 'strategy': 'mean'}. Best is trial 4 with value: 0.22829013333538378.
running
[I 2024-10-23 11:58:11,238] Trial 76 finished with value: 0.39944846007980644 and parameters: {'model_name': 'SimpleImputer', 'strategy': 'constant'}. Best is trial 4 with value: 0.22829013333538378.
[I 2024-10-23 11:58:11,337] Trial 69 finished with value: 0.2335353458314729 and parameters: {'model_name': 'SimpleImputer', 'strategy': 'median'}. Best is trial 4 with value: 0.22829013333538378.
[I 2024-10-23 11:58:11,422] Trial 74 finished with value: 0.39944846007980644 and parameters: {'model_name': 'SimpleImputer', 'strategy': 'constant'}. Best is trial 4 with value: 0.22829013333538378.
[I 2024-10-23 11:58:11,500] Trial 78 finished with value: 0.39944846007980644 and parameters: {'model_name': 'SimpleImputer', 'strategy': 'constant'}. Best is trial 4 with value: 0.22829013333538378.
running
[I 2024-10-23 11:58:11,595] Trial 75 finished with value: 0.39944846007980644 and parameters: {'model_name': 'SimpleImputer', 'strategy': 'constant'}. Best is trial 4 with value: 0.22829013333538378.
running
running
running
running
[I 2024-10-23 11:58:11,735] Trial 79 finished with value: 0.39944846007980644 and parameters: {'model_name': 'SimpleImputer', 'strategy': 'constant'}. Best is trial 4 with value: 0.22829013333538378.
running
[I 2024-10-23 11:58:11,848] Trial 77 finished with value: 0.39944846007980644 and parameters: {'model_name': 'SimpleImputer', 'strategy': 'constant'}. Best is trial 4 with value: 0.22829013333538378.
running
[I 2024-10-23 11:58:11,980] Trial 70 finished with value: 0.39944846007980644 and parameters: {'model_name': 'SimpleImputer', 'strategy': 'constant'}. Best is trial 4 with value: 0.22829013333538378.
[I 2024-10-23 11:58:12,086] Trial 80 finished with value: 0.39944846007980644 and parameters: {'model_name': 'SimpleImputer', 'strategy': 'constant'}. Best is trial 4 with value: 0.22829013333538378.
running
running
[I 2024-10-23 11:58:12,311] Trial 83 finished with value: 0.2335353458314729 and parameters: {'model_name': 'SimpleImputer', 'strategy': 'median'}. Best is trial 4 with value: 0.22829013333538378.
running
[I 2024-10-23 11:58:12,463] Trial 81 finished with value: 0.2335353458314729 and parameters: {'model_name': 'SimpleImputer', 'strategy': 'median'}. Best is trial 4 with value: 0.22829013333538378.
running
[I 2024-10-23 11:58:12,571] Trial 86 finished with value: 0.2335353458314729 and parameters: {'model_name': 'SimpleImputer', 'strategy': 'median'}. Best is trial 4 with value: 0.22829013333538378.
[I 2024-10-23 11:58:12,657] Trial 85 finished with value: 0.2335353458314729 and parameters: {'model_name': 'SimpleImputer', 'strategy': 'median'}. Best is trial 4 with value: 0.22829013333538378.
running
[I 2024-10-23 11:58:12,776] Trial 84 finished with value: 0.2335353458314729 and parameters: {'model_name': 'SimpleImputer', 'strategy': 'median'}. Best is trial 4 with value: 0.22829013333538378.
running
running
[I 2024-10-23 11:58:12,959] Trial 87 finished with value: 0.2335353458314729 and parameters: {'model_name': 'SimpleImputer', 'strategy': 'median'}. Best is trial 4 with value: 0.22829013333538378.
running
[I 2024-10-23 11:58:13,084] Trial 82 finished with value: 0.2335353458314729 and parameters: {'model_name': 'SimpleImputer', 'strategy': 'median'}. Best is trial 4 with value: 0.22829013333538378.
running
[I 2024-10-23 11:58:13,205] Trial 89 finished with value: 0.2335353458314729 and parameters: {'model_name': 'SimpleImputer', 'strategy': 'median'}. Best is trial 4 with value: 0.22829013333538378.
running
[I 2024-10-23 11:58:13,326] Trial 96 finished with value: 0.22829013333538378 and parameters: {'model_name': 'SimpleImputer', 'strategy': 'mean'}. Best is trial 4 with value: 0.22829013333538378.
running
[I 2024-10-23 11:58:13,426] Trial 88 finished with value: 0.2335353458314729 and parameters: {'model_name': 'SimpleImputer', 'strategy': 'median'}. Best is trial 4 with value: 0.22829013333538378.
running
[I 2024-10-23 11:58:13,537] Trial 95 finished with value: 0.22829013333538378 and parameters: {'model_name': 'SimpleImputer', 'strategy': 'mean'}. Best is trial 4 with value: 0.22829013333538378.
running
[I 2024-10-23 11:58:13,710] Trial 91 finished with value: 0.2335353458314729 and parameters: {'model_name': 'SimpleImputer', 'strategy': 'median'}. Best is trial 4 with value: 0.22829013333538378.
[I 2024-10-23 11:58:13,714] Trial 93 finished with value: 0.2335353458314729 and parameters: {'model_name': 'SimpleImputer', 'strategy': 'median'}. Best is trial 4 with value: 0.22829013333538378.
running
[I 2024-10-23 11:58:13,903] Trial 90 finished with value: 0.2335353458314729 and parameters: {'model_name': 'SimpleImputer', 'strategy': 'median'}. Best is trial 4 with value: 0.22829013333538378.
running
running
[I 2024-10-23 11:58:14,010] Trial 98 finished with value: 0.22829013333538378 and parameters: {'model_name': 'SimpleImputer', 'strategy': 'mean'}. Best is trial 4 with value: 0.22829013333538378.
[I 2024-10-23 11:58:14,111] Trial 94 finished with value: 0.2335353458314729 and parameters: {'model_name': 'SimpleImputer', 'strategy': 'median'}. Best is trial 4 with value: 0.22829013333538378.
running
running
[I 2024-10-23 11:58:14,300] Trial 101 finished with value: 0.22829013333538378 and parameters: {'model_name': 'SimpleImputer', 'strategy': 'mean'}. Best is trial 4 with value: 0.22829013333538378.
running
[I 2024-10-23 11:58:14,404] Trial 97 finished with value: 0.22829013333538378 and parameters: {'model_name': 'SimpleImputer', 'strategy': 'mean'}. Best is trial 4 with value: 0.22829013333538378.
[I 2024-10-23 11:58:14,491] Trial 92 finished with value: 0.2335353458314729 and parameters: {'model_name': 'SimpleImputer', 'strategy': 'median'}. Best is trial 4 with value: 0.22829013333538378.
running
running
[I 2024-10-23 11:58:14,621] Trial 103 finished with value: 0.22829013333538378 and parameters: {'model_name': 'SimpleImputer', 'strategy': 'mean'}. Best is trial 4 with value: 0.22829013333538378.
running
[I 2024-10-23 11:58:14,774] Trial 99 finished with value: 0.22829013333538378 and parameters: {'model_name': 'SimpleImputer', 'strategy': 'mean'}. Best is trial 4 with value: 0.22829013333538378.
running
[I 2024-10-23 11:58:14,889] Trial 104 finished with value: 0.22829013333538378 and parameters: {'model_name': 'SimpleImputer', 'strategy': 'mean'}. Best is trial 4 with value: 0.22829013333538378.
running
