[I 2024-10-15 09:28:21,659] Trial 198 finished with value: 0.34689599756520667 and parameters: {'model_name': 'SimpleImputer', 'strategy': 'mean'}. Best is trial 9 with value: 0.34689599756520667.
fit
simple fit
simple transform
0    0
1    0
2    0
3    0
4    0
5    0
6    0
7    0
8    0
dtype: int64
0    0
1    0
2    0
3    0
4    0
5    0
6    0
7    0
8    0
dtype: int64
0.34689599756520667
{'model_name': 'SimpleImputer', 'strategy': 'mean'}
running experiment 2/3 - Does reconstruction give good automl predictions
Start est fit
Version 0.1.7a0 of tpot2 is outdated. Version 0.1.8a0 was released Tuesday September 17, 2024.
Version 0.1.7a0 of tpot2 is outdated. Version 0.1.8a0 was released Tuesday September 17, 2024.
Version 0.1.7a0 of tpot2 is outdated. Version 0.1.8a0 was released Tuesday September 17, 2024.
Version 0.1.7a0 of tpot2 is outdated. Version 0.1.8a0 was released Tuesday September 17, 2024.
Version 0.1.7a0 of tpot2 is outdated. Version 0.1.8a0 was released Tuesday September 17, 2024.
Version 0.1.7a0 of tpot2 is outdated. Version 0.1.8a0 was released Tuesday September 17, 2024.
Version 0.1.7a0 of tpot2 is outdated. Version 0.1.8a0 was released Tuesday September 17, 2024.
Version 0.1.7a0 of tpot2 is outdated. Version 0.1.8a0 was released Tuesday September 17, 2024.
Version 0.1.7a0 of tpot2 is outdated. Version 0.1.8a0 was released Tuesday September 17, 2024.
Version 0.1.7a0 of tpot2 is outdated. Version 0.1.8a0 was released Tuesday September 17, 2024.
Version 0.1.7a0 of tpot2 is outdated. Version 0.1.8a0 was released Tuesday September 17, 2024.
Version 0.1.7a0 of tpot2 is outdated. Version 0.1.8a0 was released Tuesday September 17, 2024.
Version 0.1.7a0 of tpot2 is outdated. Version 0.1.8a0 was released Tuesday September 17, 2024.
Version 0.1.7a0 of tpot2 is outdated. Version 0.1.8a0 was released Tuesday September 17, 2024.
Version 0.1.7a0 of tpot2 is outdated. Version 0.1.8a0 was released Tuesday September 17, 2024.
Version 0.1.7a0 of tpot2 is outdated. Version 0.1.8a0 was released Tuesday September 17, 2024.
  0%|          | 0/25 [00:00<?, ?it/s]Generation:   0%|          | 0/25 [00:00<?, ?it/s]Generation:  1
Best f1_score score: 0.6434469125652631
Generation:   4%|▍         | 1/25 [01:35<38:13, 95.55s/it]Generation:  2
Best f1_score score: 0.6434469125652631
Generation:   8%|▊         | 2/25 [03:11<36:42, 95.77s/it]Generation:  3
Best f1_score score: 0.6434469125652631
Generation:  12%|█▏        | 3/25 [05:01<37:25, 102.05s/it]WARNING AN INDIVIDUAL TIMED OUT: 
 <tpot2.search_spaces.pipelines.sequential.SequentialPipelineIndividual object at 0x155474d658d0> 

Generation:  4
Best f1_score score: 0.6468033358355132
Generation:  16%|█▌        | 4/25 [15:06<1:45:14, 300.68s/it]Generation:  5
Best f1_score score: 0.651420126804062
Generation:  20%|██        | 5/25 [16:53<1:16:55, 230.78s/it]Generation:  6
Best f1_score score: 0.6546764718574155
Generation:  24%|██▍       | 6/25 [17:13<50:26, 159.30s/it]  Generation:  7
Best f1_score score: 0.6546764718574155
Generation:  28%|██▊       | 7/25 [18:51<41:47, 139.29s/it]Generation:  8
Best f1_score score: 0.6546764718574155
Generation:  32%|███▏      | 8/25 [19:06<28:14, 99.70s/it] Generation:  9
Best f1_score score: 0.6546764718574155
Generation:  36%|███▌      | 9/25 [19:20<19:26, 72.88s/it]Generation:  10
Best f1_score score: 0.6546764718574155
Generation:  40%|████      | 10/25 [19:36<13:49, 55.27s/it]Generation:  11
Best f1_score score: 0.6546764718574155
Generation:  44%|████▍     | 11/25 [19:48<09:48, 42.06s/it]Generation:  12
Best f1_score score: 0.6546764718574155
Generation:  48%|████▊     | 12/25 [21:50<14:22, 66.34s/it]Generation:  13
Best f1_score score: 0.6546764718574155
Generation:  52%|█████▏    | 13/25 [22:21<11:09, 55.82s/it]Generation:  14
Best f1_score score: 0.6546764718574155
Generation:  56%|█████▌    | 14/25 [25:19<16:59, 92.68s/it]Generation:  15
Best f1_score score: 0.6546764718574155
Generation:  60%|██████    | 15/25 [25:36<11:37, 69.79s/it]Generation:  16
Best f1_score score: 0.6546764718574155
Generation:  64%|██████▍   | 16/25 [27:55<13:36, 90.76s/it]Generation:  17
Best f1_score score: 0.6546764718574155
Generation:  68%|██████▊   | 17/25 [30:36<14:52, 111.62s/it]Generation:  18
Best f1_score score: 0.6546764718574155
Generation:  72%|███████▏  | 18/25 [34:30<17:19, 148.49s/it]Generation:  19
Best f1_score score: 0.6546764718574155
Generation:  76%|███████▌  | 19/25 [35:02<11:21, 113.52s/it]Generation:  20
Best f1_score score: 0.6546764718574155
Generation:  80%|████████  | 20/25 [35:23<07:08, 85.77s/it] Generation:  21
Best f1_score score: 0.6546764718574155
Generation:  84%|████████▍ | 21/25 [35:39<04:18, 64.68s/it]Generation:  22
Best f1_score score: 0.6548952196599784
Generation:  88%|████████▊ | 22/25 [36:09<02:43, 54.35s/it]Generation:  23
Best f1_score score: 0.6548952196599784
Generation:  92%|█████████▏| 23/25 [38:00<02:22, 71.47s/it]Generation:  24
Best f1_score score: 0.6548952196599784
Generation:  96%|█████████▌| 24/25 [38:16<00:54, 54.84s/it]Generation:  25
Best f1_score score: 0.6548952196599784
Generation: 100%|██████████| 25/25 [38:39<00:00, 45.28s/it]Generation: 100%|██████████| 25/25 [38:43<00:00, 92.93s/it]
2024-10-15 10:07:10,868 - distributed.scheduler - ERROR - Removing worker 'tcp://127.0.0.1:40951' caused the cluster to lose scattered data, which can't be recovered: {'ndarray-53d697fd49d3e13ce179ef1b16c4d251', 'ndarray-c938fa3c4f35cd553b43e5a52d557e44'} (stimulus_id='handle-worker-cleanup-1729012030.8681467')
Fitted
Pipeline(steps=[('lgbmclassifier',
                 LGBMClassifier(class_weight='balanced', max_depth=6,
                                n_estimators=93, n_jobs=1, verbose=-1))])
score start
train score: {'auroc': 0.7605416934326155, 'accuracy': 0.6883652991235869, 'balanced_accuracy': 0.6899823281445439, 'logloss': 0.5836544579208107, 'f1': 0.6745962498030337}
original test score: {'auroc': 0.8397640614438655, 'accuracy': 0.7693675387350775, 'balanced_accuracy': 0.7596259681162459, 'logloss': 0.48691724669811354, 'f1': 0.7520665478876286}
imputed test score: {'auroc': 0.7160616533976051, 'accuracy': 0.6586233172466345, 'balanced_accuracy': 0.6611925693254824, 'logloss': 0.6170774577318625, 'f1': 0.6453010497526445}
score end
check intended
EXP2 Finished
running experiment 3/3 - What is the best automl settings?
<tpot2.search_spaces.pipelines.sequential.SequentialPipeline object at 0x15543504f9d0>
Start tpot fit
Version 0.1.7a0 of tpot2 is outdated. Version 0.1.8a0 was released Tuesday September 17, 2024.
Version 0.1.7a0 of tpot2 is outdated. Version 0.1.8a0 was released Tuesday September 17, 2024.
Version 0.1.7a0 of tpot2 is outdated. Version 0.1.8a0 was released Tuesday September 17, 2024.
Version 0.1.7a0 of tpot2 is outdated. Version 0.1.8a0 was released Tuesday September 17, 2024.
Version 0.1.7a0 of tpot2 is outdated. Version 0.1.8a0 was released Tuesday September 17, 2024.
Version 0.1.7a0 of tpot2 is outdated. Version 0.1.8a0 was released Tuesday September 17, 2024.
Version 0.1.7a0 of tpot2 is outdated. Version 0.1.8a0 was released Tuesday September 17, 2024.
Version 0.1.7a0 of tpot2 is outdated. Version 0.1.8a0 was released Tuesday September 17, 2024.
Version 0.1.7a0 of tpot2 is outdated. Version 0.1.8a0 was released Tuesday September 17, 2024.
Version 0.1.7a0 of tpot2 is outdated. Version 0.1.8a0 was released Tuesday September 17, 2024.
Version 0.1.7a0 of tpot2 is outdated. Version 0.1.8a0 was released Tuesday September 17, 2024.
Version 0.1.7a0 of tpot2 is outdated. Version 0.1.8a0 was released Tuesday September 17, 2024.
Version 0.1.7a0 of tpot2 is outdated. Version 0.1.8a0 was released Tuesday September 17, 2024.
Version 0.1.7a0 of tpot2 is outdated. Version 0.1.8a0 was released Tuesday September 17, 2024.
Version 0.1.7a0 of tpot2 is outdated. Version 0.1.8a0 was released Tuesday September 17, 2024.
Version 0.1.7a0 of tpot2 is outdated. Version 0.1.8a0 was released Tuesday September 17, 2024.
  0%|          | 0/25 [00:00<?, ?it/s]Generation:   0%|          | 0/25 [00:00<?, ?it/s]Generation:  1
Best f1_score score: 0.6167038105145407
Generation:   4%|▍         | 1/25 [00:49<19:38, 49.10s/it]Generation:  2
Best f1_score score: 0.6460603079900116
Generation:   8%|▊         | 2/25 [01:13<13:11, 34.42s/it]Generation:  3
Best f1_score score: 0.6460603079900116
Generation:  12%|█▏        | 3/25 [01:24<08:49, 24.06s/it]Generation:  4
Best f1_score score: 0.6473854658835146
Generation:  16%|█▌        | 4/25 [08:29<1:03:41, 181.99s/it]Generation:  5
Best f1_score score: 0.6473854658835146
Generation:  20%|██        | 5/25 [12:25<1:07:11, 201.56s/it]Generation:  6
Best f1_score score: 0.6482514851289449
Generation:  24%|██▍       | 6/25 [12:38<43:30, 137.37s/it]  Generation:  7
Best f1_score score: 0.6491072494408943
Generation:  28%|██▊       | 7/25 [12:51<29:01, 96.77s/it] Generation:  8
Best f1_score score: 0.6491072494408943
Generation:  32%|███▏      | 8/25 [18:26<48:57, 172.82s/it]Generation:  9
Best f1_score score: 0.6491072494408943
Generation:  36%|███▌      | 9/25 [18:38<32:39, 122.44s/it]Generation:  10
Best f1_score score: 0.6512030598483198
Generation:  40%|████      | 10/25 [19:33<25:22, 101.49s/it]Generation:  11
Best f1_score score: 0.6512030598483198
Generation:  44%|████▍     | 11/25 [20:15<19:28, 83.46s/it] Generation:  12
Best f1_score score: 0.6512030598483198
Generation:  48%|████▊     | 12/25 [23:25<25:04, 115.70s/it]Generation:  13
Best f1_score score: 0.6512030598483198
Generation:  52%|█████▏    | 13/25 [25:27<23:31, 117.64s/it]Generation:  14
Best f1_score score: 0.651300416548171
Generation:  56%|█████▌    | 14/25 [25:38<15:41, 85.57s/it] Generation:  15
Best f1_score score: 0.651300416548171
Generation:  60%|██████    | 15/25 [29:25<21:20, 128.03s/it]Generation:  16
Best f1_score score: 0.651300416548171
Generation:  64%|██████▍   | 16/25 [31:30<19:04, 127.22s/it]Generation:  17
Best f1_score score: 0.651300416548171
Generation:  68%|██████▊   | 17/25 [31:43<12:23, 92.98s/it] Generation:  18
Best f1_score score: 0.651300416548171
Generation:  72%|███████▏  | 18/25 [31:58<08:06, 69.47s/it]Generation:  19
Best f1_score score: 0.651300416548171
Generation:  76%|███████▌  | 19/25 [32:07<05:07, 51.28s/it]Generation:  20
Best f1_score score: 0.651300416548171
Generation:  80%|████████  | 20/25 [32:45<03:55, 47.18s/it]Generation:  21
Best f1_score score: 0.651300416548171
Generation:  84%|████████▍ | 21/25 [33:16<02:49, 42.39s/it]Generation:  22
Best f1_score score: 0.651300416548171
Generation:  88%|████████▊ | 22/25 [33:44<01:54, 38.19s/it]Generation:  23
Best f1_score score: 0.651300416548171
Generation:  92%|█████████▏| 23/25 [34:19<01:14, 37.22s/it]Generation:  24
Best f1_score score: 0.651300416548171
Generation:  96%|█████████▌| 24/25 [35:41<00:50, 50.65s/it]Generation:  25
Best f1_score score: 0.651300416548171
Generation: 100%|██████████| 25/25 [37:23<00:00, 65.97s/it]Generation: 100%|██████████| 25/25 [37:23<00:00, 89.74s/it]
2024-10-15 10:44:44,734 - distributed.scheduler - ERROR - Removing worker 'tcp://127.0.0.1:46613' caused the cluster to lose scattered data, which can't be recovered: {'ndarray-53d697fd49d3e13ce179ef1b16c4d251', 'DataFrame-0ae18abdab58c733b890ca0514e6dc2c'} (stimulus_id='handle-worker-cleanup-1729014284.7343707')
Fitted
Pipeline(steps=[('simpleimputer', SimpleImputer()),
                ('extratreesclassifier',
                 ExtraTreesClassifier(bootstrap=True, class_weight='balanced',
                                      max_features=0.404571452219,
                                      min_samples_leaf=6, min_samples_split=9,
                                      n_jobs=1))])
transform worked
try transform
transform worked
score start
train score: {'auroc': 0.8038495545302361, 'accuracy': 0.7251682967102756, 'balanced_accuracy': 0.7226228608277012, 'logloss': 0.5577852661849911, 'f1': 0.7099166399943266}
test score: {'auroc': 0.7030021594475242, 'accuracy': 0.6576073152146305, 'balanced_accuracy': 0.6492745769447927, 'logloss': 0.6197873419842709, 'f1': 0.6392112170189252}
original test score: {'auroc': 0.8199052721308853, 'accuracy': 0.7641605283210566, 'balanced_accuracy': 0.7348153103341959, 'logloss': 0.5230565506528198, 'f1': 0.7371287210680824}
score end
137
lvl
0.5
type
MNAR
num_run
2
class_simple
finished
all finished
full run takes
1.2864925522274442
hours
DONE
