[I 2024-10-23 17:52:24,665] Trial 101 finished with value: 0.48718920258567844 and parameters: {'model_name': 'SimpleImputer', 'strategy': 'constant'}. Best is trial 5 with value: 0.24911941107400004.
running
running
[I 2024-10-23 17:52:24,861] Trial 105 finished with value: 0.24911941107400004 and parameters: {'model_name': 'SimpleImputer', 'strategy': 'mean'}. Best is trial 5 with value: 0.24911941107400004.
[I 2024-10-23 17:52:24,967] Trial 112 finished with value: 0.24911941107400004 and parameters: {'model_name': 'SimpleImputer', 'strategy': 'mean'}. Best is trial 5 with value: 0.24911941107400004.
[I 2024-10-23 17:52:25,070] Trial 108 finished with value: 0.24911941107400004 and parameters: {'model_name': 'SimpleImputer', 'strategy': 'mean'}. Best is trial 5 with value: 0.24911941107400004.
[I 2024-10-23 17:52:25,223] Trial 103 finished with value: 0.24911941107400004 and parameters: {'model_name': 'SimpleImputer', 'strategy': 'mean'}. Best is trial 5 with value: 0.24911941107400004.
running
running
running
running
[I 2024-10-23 17:52:25,403] Trial 114 finished with value: 0.24911941107400004 and parameters: {'model_name': 'SimpleImputer', 'strategy': 'mean'}. Best is trial 5 with value: 0.24911941107400004.
running
[I 2024-10-23 17:52:25,537] Trial 104 finished with value: 0.24911941107400004 and parameters: {'model_name': 'SimpleImputer', 'strategy': 'mean'}. Best is trial 5 with value: 0.24911941107400004.
running
[I 2024-10-23 17:52:25,660] Trial 109 finished with value: 0.24911941107400004 and parameters: {'model_name': 'SimpleImputer', 'strategy': 'mean'}. Best is trial 5 with value: 0.24911941107400004.
running
[I 2024-10-23 17:52:25,823] Trial 107 finished with value: 0.24911941107400004 and parameters: {'model_name': 'SimpleImputer', 'strategy': 'mean'}. Best is trial 5 with value: 0.24911941107400004.
running
[I 2024-10-23 17:52:25,946] Trial 106 finished with value: 0.24911941107400004 and parameters: {'model_name': 'SimpleImputer', 'strategy': 'mean'}. Best is trial 5 with value: 0.24911941107400004.
running
[I 2024-10-23 17:52:26,109] Trial 116 finished with value: 0.24911941107400004 and parameters: {'model_name': 'SimpleImputer', 'strategy': 'mean'}. Best is trial 5 with value: 0.24911941107400004.
running
[I 2024-10-23 17:52:26,291] Trial 110 finished with value: 0.24911941107400004 and parameters: {'model_name': 'SimpleImputer', 'strategy': 'mean'}. Best is trial 5 with value: 0.24911941107400004.
running
[I 2024-10-23 17:52:26,446] Trial 115 finished with value: 0.24911941107400004 and parameters: {'model_name': 'SimpleImputer', 'strategy': 'mean'}. Best is trial 5 with value: 0.24911941107400004.
running
[I 2024-10-23 17:52:26,598] Trial 113 finished with value: 0.24911941107400004 and parameters: {'model_name': 'SimpleImputer', 'strategy': 'mean'}. Best is trial 5 with value: 0.24911941107400004.
running
[I 2024-10-23 17:52:26,786] Trial 120 finished with value: 0.24911941107400004 and parameters: {'model_name': 'SimpleImputer', 'strategy': 'mean'}. Best is trial 5 with value: 0.24911941107400004.
[I 2024-10-23 17:52:26,924] Trial 119 finished with value: 0.24911941107400004 and parameters: {'model_name': 'SimpleImputer', 'strategy': 'mean'}. Best is trial 5 with value: 0.24911941107400004.
running
running
[I 2024-10-23 17:52:27,148] Trial 123 finished with value: 0.24911941107400004 and parameters: {'model_name': 'SimpleImputer', 'strategy': 'mean'}. Best is trial 5 with value: 0.24911941107400004.
[I 2024-10-23 17:52:27,288] Trial 118 finished with value: 0.24911941107400004 and parameters: {'model_name': 'SimpleImputer', 'strategy': 'mean'}. Best is trial 5 with value: 0.24911941107400004.
running
[I 2024-10-23 17:52:27,428] Trial 117 finished with value: 0.24911941107400004 and parameters: {'model_name': 'SimpleImputer', 'strategy': 'mean'}. Best is trial 5 with value: 0.24911941107400004.
running
running
[I 2024-10-23 17:52:27,591] Trial 126 finished with value: 0.24911941107400004 and parameters: {'model_name': 'SimpleImputer', 'strategy': 'mean'}. Best is trial 5 with value: 0.24911941107400004.
[I 2024-10-23 17:52:27,745] Trial 122 finished with value: 0.24911941107400004 and parameters: {'model_name': 'SimpleImputer', 'strategy': 'mean'}. Best is trial 5 with value: 0.24911941107400004.
[I 2024-10-23 17:52:27,873] Trial 125 finished with value: 0.24911941107400004 and parameters: {'model_name': 'SimpleImputer', 'strategy': 'mean'}. Best is trial 5 with value: 0.24911941107400004.
running
running
[I 2024-10-23 17:52:28,015] Trial 121 finished with value: 0.24911941107400004 and parameters: {'model_name': 'SimpleImputer', 'strategy': 'mean'}. Best is trial 5 with value: 0.24911941107400004.
running
running
[I 2024-10-23 17:52:28,197] Trial 128 finished with value: 0.24911941107400004 and parameters: {'model_name': 'SimpleImputer', 'strategy': 'mean'}. Best is trial 5 with value: 0.24911941107400004.
running
[I 2024-10-23 17:52:28,353] Trial 124 finished with value: 0.24911941107400004 and parameters: {'model_name': 'SimpleImputer', 'strategy': 'mean'}. Best is trial 5 with value: 0.24911941107400004.
[I 2024-10-23 17:52:28,462] Trial 127 finished with value: 0.24911941107400004 and parameters: {'model_name': 'SimpleImputer', 'strategy': 'mean'}. Best is trial 5 with value: 0.24911941107400004.
[I 2024-10-23 17:52:28,561] Trial 129 finished with value: 0.24911941107400004 and parameters: {'model_name': 'SimpleImputer', 'strategy': 'mean'}. Best is trial 5 with value: 0.24911941107400004.
running
running
running
[I 2024-10-23 17:52:28,842] Trial 132 finished with value: 0.24911941107400004 and parameters: {'model_name': 'SimpleImputer', 'strategy': 'mean'}. Best is trial 5 with value: 0.24911941107400004.
running
[I 2024-10-23 17:52:29,035] Trial 135 finished with value: 0.24911941107400004 and parameters: {'model_name': 'SimpleImputer', 'strategy': 'mean'}. Best is trial 5 with value: 0.24911941107400004.
running
[I 2024-10-23 17:52:29,168] Trial 130 finished with value: 0.24911941107400004 and parameters: {'model_name': 'SimpleImputer', 'strategy': 'mean'}. Best is trial 5 with value: 0.24911941107400004.
running
[I 2024-10-23 17:52:29,382] Trial 131 finished with value: 0.24911941107400004 and parameters: {'model_name': 'SimpleImputer', 'strategy': 'mean'}. Best is trial 5 with value: 0.24911941107400004.
[I 2024-10-23 17:52:29,532] Trial 133 finished with value: 0.24911941107400004 and parameters: {'model_name': 'SimpleImputer', 'strategy': 'mean'}. Best is trial 5 with value: 0.24911941107400004.
[I 2024-10-23 17:52:29,707] Trial 137 finished with value: 0.24911941107400004 and parameters: {'model_name': 'SimpleImputer', 'strategy': 'mean'}. Best is trial 5 with value: 0.24911941107400004.
running
running
running
[I 2024-10-23 17:52:29,913] Trial 136 finished with value: 0.24911941107400004 and parameters: {'model_name': 'SimpleImputer', 'strategy': 'mean'}. Best is trial 5 with value: 0.24911941107400004.
running
[I 2024-10-23 17:52:30,058] Trial 143 finished with value: 0.24911941107400004 and parameters: {'model_name': 'SimpleImputer', 'strategy': 'mean'}. Best is trial 5 with value: 0.24911941107400004.
running
[I 2024-10-23 17:52:30,208] Trial 134 finished with value: 0.24911941107400004 and parameters: {'model_name': 'SimpleImputer', 'strategy': 'mean'}. Best is trial 5 with value: 0.24911941107400004.
running
[I 2024-10-23 17:52:30,585] Trial 148 finished with value: 0.24911941107400004 and parameters: {'model_name': 'SimpleImputer', 'strategy': 'mean'}. Best is trial 5 with value: 0.24911941107400004.
running
[I 2024-10-23 17:52:30,960] Trial 141 finished with value: 0.48718920258567844 and parameters: {'model_name': 'SimpleImputer', 'strategy': 'most_frequent'}. Best is trial 5 with value: 0.24911941107400004.
[I 2024-10-23 17:52:31,130] Trial 139 finished with value: 0.48718920258567844 and parameters: {'model_name': 'SimpleImputer', 'strategy': 'most_frequent'}. Best is trial 5 with value: 0.24911941107400004.
running
running
[I 2024-10-23 17:52:31,391] Trial 138 finished with value: 0.48718920258567844 and parameters: {'model_name': 'SimpleImputer', 'strategy': 'most_frequent'}. Best is trial 5 with value: 0.24911941107400004.
running
[I 2024-10-23 17:52:31,636] Trial 145 finished with value: 0.48718920258567844 and parameters: {'model_name': 'SimpleImputer', 'strategy': 'most_frequent'}. Best is trial 5 with value: 0.24911941107400004.
[I 2024-10-23 17:52:31,766] Trial 144 finished with value: 0.48718920258567844 and parameters: {'model_name': 'SimpleImputer', 'strategy': 'most_frequent'}. Best is trial 5 with value: 0.24911941107400004.
[I 2024-10-23 17:52:31,908] Trial 146 finished with value: 0.48718920258567844 and parameters: {'model_name': 'SimpleImputer', 'strategy': 'most_frequent'}. Best is trial 5 with value: 0.24911941107400004.
running
running
running
[I 2024-10-23 17:52:32,052] Trial 142 finished with value: 0.48718920258567844 and parameters: {'model_name': 'SimpleImputer', 'strategy': 'most_frequent'}. Best is trial 5 with value: 0.24911941107400004.
running
[I 2024-10-23 17:52:32,216] Trial 140 finished with value: 0.48718920258567844 and parameters: {'model_name': 'SimpleImputer', 'strategy': 'most_frequent'}. Best is trial 5 with value: 0.24911941107400004.
running
[I 2024-10-23 17:52:32,377] Trial 147 finished with value: 0.48718920258567844 and parameters: {'model_name': 'SimpleImputer', 'strategy': 'most_frequent'}. Best is trial 5 with value: 0.24911941107400004.
[I 2024-10-23 17:52:32,515] Trial 153 finished with value: 0.48718920258567844 and parameters: {'model_name': 'SimpleImputer', 'strategy': 'most_frequent'}. Best is trial 5 with value: 0.24911941107400004.
running
running
[I 2024-10-23 17:52:32,693] Trial 155 finished with value: 0.24911941107400004 and parameters: {'model_name': 'SimpleImputer', 'strategy': 'mean'}. Best is trial 5 with value: 0.24911941107400004.
running
[I 2024-10-23 17:52:32,878] Trial 151 finished with value: 0.48718920258567844 and parameters: {'model_name': 'SimpleImputer', 'strategy': 'most_frequent'}. Best is trial 5 with value: 0.24911941107400004.
running
[I 2024-10-23 17:52:33,079] Trial 157 finished with value: 0.24911941107400004 and parameters: {'model_name': 'SimpleImputer', 'strategy': 'mean'}. Best is trial 5 with value: 0.24911941107400004.
running
[I 2024-10-23 17:52:33,289] Trial 156 finished with value: 0.24911941107400004 and parameters: {'model_name': 'SimpleImputer', 'strategy': 'mean'}. Best is trial 5 with value: 0.24911941107400004.
running
[I 2024-10-23 17:52:33,463] Trial 158 finished with value: 0.24911941107400004 and parameters: {'model_name': 'SimpleImputer', 'strategy': 'mean'}. Best is trial 5 with value: 0.24911941107400004.
[I 2024-10-23 17:52:33,584] Trial 150 finished with value: 0.48718920258567844 and parameters: {'model_name': 'SimpleImputer', 'strategy': 'most_frequent'}. Best is trial 5 with value: 0.24911941107400004.
[I 2024-10-23 17:52:33,735] Trial 152 finished with value: 0.48718920258567844 and parameters: {'model_name': 'SimpleImputer', 'strategy': 'most_frequent'}. Best is trial 5 with value: 0.24911941107400004.
running
running
[I 2024-10-23 17:52:33,872] Trial 161 finished with value: 0.24911941107400004 and parameters: {'model_name': 'SimpleImputer', 'strategy': 'mean'}. Best is trial 5 with value: 0.24911941107400004.
running
running
[I 2024-10-23 17:52:34,058] Trial 160 finished with value: 0.24911941107400004 and parameters: {'model_name': 'SimpleImputer', 'strategy': 'mean'}. Best is trial 5 with value: 0.24911941107400004.
running
[I 2024-10-23 17:52:34,233] Trial 163 finished with value: 0.24911941107400004 and parameters: {'model_name': 'SimpleImputer', 'strategy': 'mean'}. Best is trial 5 with value: 0.24911941107400004.
[I 2024-10-23 17:52:34,403] Trial 162 finished with value: 0.24911941107400004 and parameters: {'model_name': 'SimpleImputer', 'strategy': 'mean'}. Best is trial 5 with value: 0.24911941107400004.
running
running
[I 2024-10-23 17:52:34,562] Trial 149 finished with value: 0.48718920258567844 and parameters: {'model_name': 'SimpleImputer', 'strategy': 'most_frequent'}. Best is trial 5 with value: 0.24911941107400004.
[I 2024-10-23 17:52:34,669] Trial 165 finished with value: 0.24911941107400004 and parameters: {'model_name': 'SimpleImputer', 'strategy': 'mean'}. Best is trial 5 with value: 0.24911941107400004.
[I 2024-10-23 17:52:34,822] Trial 167 finished with value: 0.24911941107400004 and parameters: {'model_name': 'SimpleImputer', 'strategy': 'mean'}. Best is trial 5 with value: 0.24911941107400004.
running
running
running
[I 2024-10-23 17:52:34,991] Trial 166 finished with value: 0.24911941107400004 and parameters: {'model_name': 'SimpleImputer', 'strategy': 'mean'}. Best is trial 5 with value: 0.24911941107400004.
[I 2024-10-23 17:52:35,091] Trial 169 finished with value: 0.24911941107400004 and parameters: {'model_name': 'SimpleImputer', 'strategy': 'mean'}. Best is trial 5 with value: 0.24911941107400004.
[I 2024-10-23 17:52:35,235] Trial 154 finished with value: 0.48718920258567844 and parameters: {'model_name': 'SimpleImputer', 'strategy': 'most_frequent'}. Best is trial 5 with value: 0.24911941107400004.
running
running
[I 2024-10-23 17:52:35,355] Trial 164 finished with value: 0.24911941107400004 and parameters: {'model_name': 'SimpleImputer', 'strategy': 'mean'}. Best is trial 5 with value: 0.24911941107400004.
running
running
[I 2024-10-23 17:52:35,463] Trial 168 finished with value: 0.24911941107400004 and parameters: {'model_name': 'SimpleImputer', 'strategy': 'mean'}. Best is trial 5 with value: 0.24911941107400004.
[I 2024-10-23 17:52:35,612] Trial 159 finished with value: 0.24911941107400004 and parameters: {'model_name': 'SimpleImputer', 'strategy': 'mean'}. Best is trial 5 with value: 0.24911941107400004.
running
running
[I 2024-10-23 17:52:35,891] Trial 170 finished with value: 0.24911941107400004 and parameters: {'model_name': 'SimpleImputer', 'strategy': 'mean'}. Best is trial 5 with value: 0.24911941107400004.
running
[I 2024-10-23 17:52:36,049] Trial 180 finished with value: 0.24911941107400004 and parameters: {'model_name': 'SimpleImputer', 'strategy': 'mean'}. Best is trial 5 with value: 0.24911941107400004.
running
[I 2024-10-23 17:52:36,216] Trial 172 finished with value: 0.24911941107400004 and parameters: {'model_name': 'SimpleImputer', 'strategy': 'mean'}. Best is trial 5 with value: 0.24911941107400004.
[I 2024-10-23 17:52:36,376] Trial 171 finished with value: 0.24911941107400004 and parameters: {'model_name': 'SimpleImputer', 'strategy': 'mean'}. Best is trial 5 with value: 0.24911941107400004.
running
[I 2024-10-23 17:52:36,497] Trial 174 finished with value: 0.24911941107400004 and parameters: {'model_name': 'SimpleImputer', 'strategy': 'mean'}. Best is trial 5 with value: 0.24911941107400004.
[I 2024-10-23 17:52:36,604] Trial 173 finished with value: 0.24911941107400004 and parameters: {'model_name': 'SimpleImputer', 'strategy': 'mean'}. Best is trial 5 with value: 0.24911941107400004.
[I 2024-10-23 17:52:36,758] Trial 182 finished with value: 0.24911941107400004 and parameters: {'model_name': 'SimpleImputer', 'strategy': 'mean'}. Best is trial 5 with value: 0.24911941107400004.
running
running
[I 2024-10-23 17:52:36,905] Trial 177 finished with value: 0.24911941107400004 and parameters: {'model_name': 'SimpleImputer', 'strategy': 'mean'}. Best is trial 5 with value: 0.24911941107400004.
running
running
running
[I 2024-10-23 17:52:37,114] Trial 178 finished with value: 0.24911941107400004 and parameters: {'model_name': 'SimpleImputer', 'strategy': 'mean'}. Best is trial 5 with value: 0.24911941107400004.
[I 2024-10-23 17:52:37,270] Trial 183 finished with value: 0.24911941107400004 and parameters: {'model_name': 'SimpleImputer', 'strategy': 'mean'}. Best is trial 5 with value: 0.24911941107400004.
running
[I 2024-10-23 17:52:37,419] Trial 175 finished with value: 0.24911941107400004 and parameters: {'model_name': 'SimpleImputer', 'strategy': 'mean'}. Best is trial 5 with value: 0.24911941107400004.
running
[I 2024-10-23 17:52:37,552] Trial 186 finished with value: 0.24911941107400004 and parameters: {'model_name': 'SimpleImputer', 'strategy': 'mean'}. Best is trial 5 with value: 0.24911941107400004.
[I 2024-10-23 17:52:37,651] Trial 184 finished with value: 0.24911941107400004 and parameters: {'model_name': 'SimpleImputer', 'strategy': 'mean'}. Best is trial 5 with value: 0.24911941107400004.
running
running
running
[I 2024-10-23 17:52:37,841] Trial 176 finished with value: 0.24911941107400004 and parameters: {'model_name': 'SimpleImputer', 'strategy': 'mean'}. Best is trial 5 with value: 0.24911941107400004.
running
[I 2024-10-23 17:52:38,020] Trial 181 finished with value: 0.24911941107400004 and parameters: {'model_name': 'SimpleImputer', 'strategy': 'mean'}. Best is trial 5 with value: 0.24911941107400004.
[I 2024-10-23 17:52:38,155] Trial 179 finished with value: 0.24911941107400004 and parameters: {'model_name': 'SimpleImputer', 'strategy': 'mean'}. Best is trial 5 with value: 0.24911941107400004.
[I 2024-10-23 17:52:38,258] Trial 185 finished with value: 0.24911941107400004 and parameters: {'model_name': 'SimpleImputer', 'strategy': 'mean'}. Best is trial 5 with value: 0.24911941107400004.
[I 2024-10-23 17:52:38,358] Trial 187 finished with value: 0.24911941107400004 and parameters: {'model_name': 'SimpleImputer', 'strategy': 'mean'}. Best is trial 5 with value: 0.24911941107400004.
[I 2024-10-23 17:52:38,617] Trial 189 finished with value: 0.24911941107400004 and parameters: {'model_name': 'SimpleImputer', 'strategy': 'mean'}. Best is trial 5 with value: 0.24911941107400004.
[I 2024-10-23 17:52:38,733] Trial 193 finished with value: 0.24911941107400004 and parameters: {'model_name': 'SimpleImputer', 'strategy': 'mean'}. Best is trial 5 with value: 0.24911941107400004.
[I 2024-10-23 17:52:38,834] Trial 188 finished with value: 0.24911941107400004 and parameters: {'model_name': 'SimpleImputer', 'strategy': 'mean'}. Best is trial 5 with value: 0.24911941107400004.
[I 2024-10-23 17:52:38,997] Trial 190 finished with value: 0.24911941107400004 and parameters: {'model_name': 'SimpleImputer', 'strategy': 'mean'}. Best is trial 5 with value: 0.24911941107400004.
[I 2024-10-23 17:52:39,109] Trial 192 finished with value: 0.24911941107400004 and parameters: {'model_name': 'SimpleImputer', 'strategy': 'mean'}. Best is trial 5 with value: 0.24911941107400004.
[I 2024-10-23 17:52:39,208] Trial 196 finished with value: 0.24911941107400004 and parameters: {'model_name': 'SimpleImputer', 'strategy': 'mean'}. Best is trial 5 with value: 0.24911941107400004.
[I 2024-10-23 17:52:39,374] Trial 191 finished with value: 0.24911941107400004 and parameters: {'model_name': 'SimpleImputer', 'strategy': 'mean'}. Best is trial 5 with value: 0.24911941107400004.
[I 2024-10-23 17:52:39,586] Trial 197 finished with value: 0.24911941107400004 and parameters: {'model_name': 'SimpleImputer', 'strategy': 'mean'}. Best is trial 5 with value: 0.24911941107400004.
[I 2024-10-23 17:52:39,715] Trial 195 finished with value: 0.24911941107400004 and parameters: {'model_name': 'SimpleImputer', 'strategy': 'mean'}. Best is trial 5 with value: 0.24911941107400004.
[I 2024-10-23 17:52:39,834] Trial 199 finished with value: 0.24911941107400004 and parameters: {'model_name': 'SimpleImputer', 'strategy': 'mean'}. Best is trial 5 with value: 0.24911941107400004.
[I 2024-10-23 17:52:39,835] Trial 198 finished with value: 0.24911941107400004 and parameters: {'model_name': 'SimpleImputer', 'strategy': 'mean'}. Best is trial 5 with value: 0.24911941107400004.
