[I 2024-11-05 03:46:32,319] Trial 101 finished with value: 0.34891118703530627 and parameters: {'model_name': 'SimpleImputer', 'strategy': 'mean'}. Best is trial 1 with value: 0.34891118703530627.
[I 2024-11-05 03:46:32,449] Trial 109 finished with value: 0.34891118703530627 and parameters: {'model_name': 'SimpleImputer', 'strategy': 'mean'}. Best is trial 1 with value: 0.34891118703530627.
[I 2024-11-05 03:46:32,609] Trial 106 finished with value: 0.34891118703530627 and parameters: {'model_name': 'SimpleImputer', 'strategy': 'mean'}. Best is trial 1 with value: 0.34891118703530627.
running
running
[I 2024-11-05 03:46:32,805] Trial 103 finished with value: 0.34891118703530627 and parameters: {'model_name': 'SimpleImputer', 'strategy': 'mean'}. Best is trial 1 with value: 0.34891118703530627.
running
[I 2024-11-05 03:46:32,922] Trial 105 finished with value: 0.34891118703530627 and parameters: {'model_name': 'SimpleImputer', 'strategy': 'mean'}. Best is trial 1 with value: 0.34891118703530627.
running
running
[I 2024-11-05 03:46:33,159] Trial 113 finished with value: 0.34891118703530627 and parameters: {'model_name': 'SimpleImputer', 'strategy': 'mean'}. Best is trial 1 with value: 0.34891118703530627.
[I 2024-11-05 03:46:33,265] Trial 110 finished with value: 0.34891118703530627 and parameters: {'model_name': 'SimpleImputer', 'strategy': 'mean'}. Best is trial 1 with value: 0.34891118703530627.
running
[I 2024-11-05 03:46:33,379] Trial 111 finished with value: 0.34891118703530627 and parameters: {'model_name': 'SimpleImputer', 'strategy': 'mean'}. Best is trial 1 with value: 0.34891118703530627.
running
[I 2024-11-05 03:46:33,488] Trial 112 finished with value: 0.34891118703530627 and parameters: {'model_name': 'SimpleImputer', 'strategy': 'mean'}. Best is trial 1 with value: 0.34891118703530627.
[I 2024-11-05 03:46:33,585] Trial 104 finished with value: 0.34891118703530627 and parameters: {'model_name': 'SimpleImputer', 'strategy': 'mean'}. Best is trial 1 with value: 0.34891118703530627.
running
running
[I 2024-11-05 03:46:33,754] Trial 114 finished with value: 0.34891118703530627 and parameters: {'model_name': 'SimpleImputer', 'strategy': 'mean'}. Best is trial 1 with value: 0.34891118703530627.
[I 2024-11-05 03:46:33,920] Trial 108 finished with value: 0.34891118703530627 and parameters: {'model_name': 'SimpleImputer', 'strategy': 'mean'}. Best is trial 1 with value: 0.34891118703530627.
running
running
running
[I 2024-11-05 03:46:34,136] Trial 119 finished with value: 0.34891118703530627 and parameters: {'model_name': 'SimpleImputer', 'strategy': 'mean'}. Best is trial 1 with value: 0.34891118703530627.
[I 2024-11-05 03:46:34,244] Trial 117 finished with value: 0.34891118703530627 and parameters: {'model_name': 'SimpleImputer', 'strategy': 'mean'}. Best is trial 1 with value: 0.34891118703530627.
running
running
[I 2024-11-05 03:46:34,442] Trial 116 finished with value: 0.34891118703530627 and parameters: {'model_name': 'SimpleImputer', 'strategy': 'mean'}. Best is trial 1 with value: 0.34891118703530627.
running
[I 2024-11-05 03:46:34,593] Trial 121 finished with value: 0.34891118703530627 and parameters: {'model_name': 'SimpleImputer', 'strategy': 'mean'}. Best is trial 1 with value: 0.34891118703530627.
[I 2024-11-05 03:46:34,708] Trial 123 finished with value: 0.34891118703530627 and parameters: {'model_name': 'SimpleImputer', 'strategy': 'mean'}. Best is trial 1 with value: 0.34891118703530627.
running
[I 2024-11-05 03:46:34,810] Trial 115 finished with value: 0.34891118703530627 and parameters: {'model_name': 'SimpleImputer', 'strategy': 'mean'}. Best is trial 1 with value: 0.34891118703530627.
[I 2024-11-05 03:46:34,975] Trial 118 finished with value: 0.34891118703530627 and parameters: {'model_name': 'SimpleImputer', 'strategy': 'mean'}. Best is trial 1 with value: 0.34891118703530627.
running
[I 2024-11-05 03:46:35,114] Trial 127 finished with value: 0.34891118703530627 and parameters: {'model_name': 'SimpleImputer', 'strategy': 'mean'}. Best is trial 1 with value: 0.34891118703530627.
[I 2024-11-05 03:46:35,219] Trial 124 finished with value: 0.34891118703530627 and parameters: {'model_name': 'SimpleImputer', 'strategy': 'mean'}. Best is trial 1 with value: 0.34891118703530627.
running
[I 2024-11-05 03:46:35,405] Trial 120 finished with value: 0.34891118703530627 and parameters: {'model_name': 'SimpleImputer', 'strategy': 'mean'}. Best is trial 1 with value: 0.34891118703530627.
running
running
[I 2024-11-05 03:46:35,575] Trial 128 finished with value: 0.34891118703530627 and parameters: {'model_name': 'SimpleImputer', 'strategy': 'mean'}. Best is trial 1 with value: 0.34891118703530627.
running
running
[I 2024-11-05 03:46:35,695] Trial 129 finished with value: 0.34891118703530627 and parameters: {'model_name': 'SimpleImputer', 'strategy': 'mean'}. Best is trial 1 with value: 0.34891118703530627.
running
[I 2024-11-05 03:46:35,895] Trial 130 finished with value: 0.34891118703530627 and parameters: {'model_name': 'SimpleImputer', 'strategy': 'mean'}. Best is trial 1 with value: 0.34891118703530627.
[I 2024-11-05 03:46:36,000] Trial 134 finished with value: 0.34891118703530627 and parameters: {'model_name': 'SimpleImputer', 'strategy': 'mean'}. Best is trial 1 with value: 0.34891118703530627.
running
[I 2024-11-05 03:46:36,119] Trial 125 finished with value: 0.34891118703530627 and parameters: {'model_name': 'SimpleImputer', 'strategy': 'mean'}. Best is trial 1 with value: 0.34891118703530627.
[I 2024-11-05 03:46:36,233] Trial 122 finished with value: 0.34891118703530627 and parameters: {'model_name': 'SimpleImputer', 'strategy': 'mean'}. Best is trial 1 with value: 0.34891118703530627.
running
running
running
running
[I 2024-11-05 03:46:36,440] Trial 132 finished with value: 0.34891118703530627 and parameters: {'model_name': 'SimpleImputer', 'strategy': 'mean'}. Best is trial 1 with value: 0.34891118703530627.
running
[I 2024-11-05 03:46:36,646] Trial 126 finished with value: 0.34891118703530627 and parameters: {'model_name': 'SimpleImputer', 'strategy': 'mean'}. Best is trial 1 with value: 0.34891118703530627.
running
[I 2024-11-05 03:46:36,771] Trial 131 finished with value: 0.34891118703530627 and parameters: {'model_name': 'SimpleImputer', 'strategy': 'mean'}. Best is trial 1 with value: 0.34891118703530627.
running
[I 2024-11-05 03:46:36,917] Trial 136 finished with value: 0.34891118703530627 and parameters: {'model_name': 'SimpleImputer', 'strategy': 'mean'}. Best is trial 1 with value: 0.34891118703530627.
[I 2024-11-05 03:46:37,012] Trial 139 finished with value: 0.34891118703530627 and parameters: {'model_name': 'SimpleImputer', 'strategy': 'mean'}. Best is trial 1 with value: 0.34891118703530627.
running
running
[I 2024-11-05 03:46:37,153] Trial 141 finished with value: 0.34891118703530627 and parameters: {'model_name': 'SimpleImputer', 'strategy': 'mean'}. Best is trial 1 with value: 0.34891118703530627.
running
[I 2024-11-05 03:46:37,336] Trial 133 finished with value: 0.34891118703530627 and parameters: {'model_name': 'SimpleImputer', 'strategy': 'mean'}. Best is trial 1 with value: 0.34891118703530627.
running
[I 2024-11-05 03:46:37,501] Trial 135 finished with value: 0.34891118703530627 and parameters: {'model_name': 'SimpleImputer', 'strategy': 'mean'}. Best is trial 1 with value: 0.34891118703530627.
[I 2024-11-05 03:46:37,611] Trial 145 finished with value: 0.34891118703530627 and parameters: {'model_name': 'SimpleImputer', 'strategy': 'mean'}. Best is trial 1 with value: 0.34891118703530627.
running
running
[I 2024-11-05 03:46:37,735] Trial 142 finished with value: 0.34891118703530627 and parameters: {'model_name': 'SimpleImputer', 'strategy': 'mean'}. Best is trial 1 with value: 0.34891118703530627.
running
[I 2024-11-05 03:46:37,848] Trial 144 finished with value: 0.34891118703530627 and parameters: {'model_name': 'SimpleImputer', 'strategy': 'mean'}. Best is trial 1 with value: 0.34891118703530627.
running
[I 2024-11-05 03:46:37,983] Trial 140 finished with value: 0.34891118703530627 and parameters: {'model_name': 'SimpleImputer', 'strategy': 'mean'}. Best is trial 1 with value: 0.34891118703530627.
running
[I 2024-11-05 03:46:38,110] Trial 138 finished with value: 0.34891118703530627 and parameters: {'model_name': 'SimpleImputer', 'strategy': 'mean'}. Best is trial 1 with value: 0.34891118703530627.
[I 2024-11-05 03:46:38,256] Trial 151 finished with value: 0.34891118703530627 and parameters: {'model_name': 'SimpleImputer', 'strategy': 'mean'}. Best is trial 1 with value: 0.34891118703530627.
running
running
[I 2024-11-05 03:46:38,478] Trial 137 finished with value: 0.34891118703530627 and parameters: {'model_name': 'SimpleImputer', 'strategy': 'mean'}. Best is trial 1 with value: 0.34891118703530627.
[I 2024-11-05 03:46:38,652] Trial 155 finished with value: 0.34891118703530627 and parameters: {'model_name': 'SimpleImputer', 'strategy': 'mean'}. Best is trial 1 with value: 0.34891118703530627.
[I 2024-11-05 03:46:38,758] Trial 152 finished with value: 0.34891118703530627 and parameters: {'model_name': 'SimpleImputer', 'strategy': 'mean'}. Best is trial 1 with value: 0.34891118703530627.
[I 2024-11-05 03:46:38,914] Trial 146 finished with value: 0.34891118703530627 and parameters: {'model_name': 'SimpleImputer', 'strategy': 'mean'}. Best is trial 1 with value: 0.34891118703530627.
running
[I 2024-11-05 03:46:39,028] Trial 148 finished with value: 0.34891118703530627 and parameters: {'model_name': 'SimpleImputer', 'strategy': 'mean'}. Best is trial 1 with value: 0.34891118703530627.
running
running
running
[I 2024-11-05 03:46:39,146] Trial 143 finished with value: 0.34891118703530627 and parameters: {'model_name': 'SimpleImputer', 'strategy': 'mean'}. Best is trial 1 with value: 0.34891118703530627.
running
[I 2024-11-05 03:46:39,258] Trial 147 finished with value: 0.34891118703530627 and parameters: {'model_name': 'SimpleImputer', 'strategy': 'mean'}. Best is trial 1 with value: 0.34891118703530627.
[I 2024-11-05 03:46:39,349] Trial 150 finished with value: 0.34891118703530627 and parameters: {'model_name': 'SimpleImputer', 'strategy': 'mean'}. Best is trial 1 with value: 0.34891118703530627.
running
running
running
[I 2024-11-05 03:46:39,544] Trial 157 finished with value: 0.34891118703530627 and parameters: {'model_name': 'SimpleImputer', 'strategy': 'mean'}. Best is trial 1 with value: 0.34891118703530627.
running
[I 2024-11-05 03:46:39,781] Trial 149 finished with value: 0.34891118703530627 and parameters: {'model_name': 'SimpleImputer', 'strategy': 'mean'}. Best is trial 1 with value: 0.34891118703530627.
running
[I 2024-11-05 03:46:39,990] Trial 154 finished with value: 0.34891118703530627 and parameters: {'model_name': 'SimpleImputer', 'strategy': 'mean'}. Best is trial 1 with value: 0.34891118703530627.
running
[I 2024-11-05 03:46:40,141] Trial 156 finished with value: 0.34891118703530627 and parameters: {'model_name': 'SimpleImputer', 'strategy': 'mean'}. Best is trial 1 with value: 0.34891118703530627.
running
[I 2024-11-05 03:46:40,259] Trial 153 finished with value: 0.34891118703530627 and parameters: {'model_name': 'SimpleImputer', 'strategy': 'mean'}. Best is trial 1 with value: 0.34891118703530627.
[I 2024-11-05 03:46:40,418] Trial 160 finished with value: 0.34891118703530627 and parameters: {'model_name': 'SimpleImputer', 'strategy': 'mean'}. Best is trial 1 with value: 0.34891118703530627.
[I 2024-11-05 03:46:40,526] Trial 159 finished with value: 0.34891118703530627 and parameters: {'model_name': 'SimpleImputer', 'strategy': 'mean'}. Best is trial 1 with value: 0.34891118703530627.
running
running
running
[I 2024-11-05 03:46:40,668] Trial 161 finished with value: 0.34891118703530627 and parameters: {'model_name': 'SimpleImputer', 'strategy': 'mean'}. Best is trial 1 with value: 0.34891118703530627.
running
[I 2024-11-05 03:46:40,874] Trial 165 finished with value: 0.34891118703530627 and parameters: {'model_name': 'SimpleImputer', 'strategy': 'mean'}. Best is trial 1 with value: 0.34891118703530627.
[I 2024-11-05 03:46:41,042] Trial 167 finished with value: 0.34891118703530627 and parameters: {'model_name': 'SimpleImputer', 'strategy': 'mean'}. Best is trial 1 with value: 0.34891118703530627.
[I 2024-11-05 03:46:41,152] Trial 169 finished with value: 0.34891118703530627 and parameters: {'model_name': 'SimpleImputer', 'strategy': 'mean'}. Best is trial 1 with value: 0.34891118703530627.
[I 2024-11-05 03:46:41,293] Trial 163 finished with value: 0.34891118703530627 and parameters: {'model_name': 'SimpleImputer', 'strategy': 'mean'}. Best is trial 1 with value: 0.34891118703530627.
running
running
[I 2024-11-05 03:46:41,411] Trial 158 finished with value: 0.34891118703530627 and parameters: {'model_name': 'SimpleImputer', 'strategy': 'mean'}. Best is trial 1 with value: 0.34891118703530627.
running
running
[I 2024-11-05 03:46:41,597] Trial 171 finished with value: 0.5243961098230672 and parameters: {'model_name': 'SimpleImputer', 'strategy': 'constant'}. Best is trial 1 with value: 0.34891118703530627.
running
[I 2024-11-05 03:46:41,779] Trial 168 finished with value: 0.34891118703530627 and parameters: {'model_name': 'SimpleImputer', 'strategy': 'mean'}. Best is trial 1 with value: 0.34891118703530627.
running
[I 2024-11-05 03:46:41,780] Trial 166 finished with value: 0.34891118703530627 and parameters: {'model_name': 'SimpleImputer', 'strategy': 'mean'}. Best is trial 1 with value: 0.34891118703530627.
running
running
[I 2024-11-05 03:46:42,152] Trial 172 finished with value: 0.34891118703530627 and parameters: {'model_name': 'SimpleImputer', 'strategy': 'mean'}. Best is trial 1 with value: 0.34891118703530627.
[I 2024-11-05 03:46:42,309] Trial 175 finished with value: 0.34891118703530627 and parameters: {'model_name': 'SimpleImputer', 'strategy': 'mean'}. Best is trial 1 with value: 0.34891118703530627.
[I 2024-11-05 03:46:42,413] Trial 174 finished with value: 0.5243961098230672 and parameters: {'model_name': 'SimpleImputer', 'strategy': 'constant'}. Best is trial 1 with value: 0.34891118703530627.
running
[I 2024-11-05 03:46:42,512] Trial 164 finished with value: 0.34891118703530627 and parameters: {'model_name': 'SimpleImputer', 'strategy': 'mean'}. Best is trial 1 with value: 0.34891118703530627.
[I 2024-11-05 03:46:42,610] Trial 170 finished with value: 0.34891118703530627 and parameters: {'model_name': 'SimpleImputer', 'strategy': 'mean'}. Best is trial 1 with value: 0.34891118703530627.
running
[I 2024-11-05 03:46:42,714] Trial 162 finished with value: 0.34891118703530627 and parameters: {'model_name': 'SimpleImputer', 'strategy': 'mean'}. Best is trial 1 with value: 0.34891118703530627.
running
running
running
running
[I 2024-11-05 03:46:42,928] Trial 176 finished with value: 0.34891118703530627 and parameters: {'model_name': 'SimpleImputer', 'strategy': 'mean'}. Best is trial 1 with value: 0.34891118703530627.
running
[I 2024-11-05 03:46:43,055] Trial 173 finished with value: 0.5243961098230672 and parameters: {'model_name': 'SimpleImputer', 'strategy': 'constant'}. Best is trial 1 with value: 0.34891118703530627.
[I 2024-11-05 03:46:43,227] Trial 179 finished with value: 0.5243961098230672 and parameters: {'model_name': 'SimpleImputer', 'strategy': 'constant'}. Best is trial 1 with value: 0.34891118703530627.
running
running
[I 2024-11-05 03:46:43,390] Trial 178 finished with value: 0.5243961098230672 and parameters: {'model_name': 'SimpleImputer', 'strategy': 'constant'}. Best is trial 1 with value: 0.34891118703530627.
[I 2024-11-05 03:46:43,523] Trial 180 finished with value: 0.5243961098230672 and parameters: {'model_name': 'SimpleImputer', 'strategy': 'constant'}. Best is trial 1 with value: 0.34891118703530627.
running
running
[I 2024-11-05 03:46:43,742] Trial 183 finished with value: 0.34891118703530627 and parameters: {'model_name': 'SimpleImputer', 'strategy': 'mean'}. Best is trial 1 with value: 0.34891118703530627.
running
[I 2024-11-05 03:46:43,925] Trial 189 finished with value: 0.34891118703530627 and parameters: {'model_name': 'SimpleImputer', 'strategy': 'mean'}. Best is trial 1 with value: 0.34891118703530627.
running
[I 2024-11-05 03:46:44,049] Trial 188 finished with value: 0.34891118703530627 and parameters: {'model_name': 'SimpleImputer', 'strategy': 'mean'}. Best is trial 1 with value: 0.34891118703530627.
[I 2024-11-05 03:46:44,152] Trial 190 finished with value: 0.34891118703530627 and parameters: {'model_name': 'SimpleImputer', 'strategy': 'mean'}. Best is trial 1 with value: 0.34891118703530627.
running
[I 2024-11-05 03:46:44,249] Trial 182 finished with value: 0.34891118703530627 and parameters: {'model_name': 'SimpleImputer', 'strategy': 'mean'}. Best is trial 1 with value: 0.34891118703530627.
[I 2024-11-05 03:46:44,351] Trial 184 finished with value: 0.34891118703530627 and parameters: {'model_name': 'SimpleImputer', 'strategy': 'mean'}. Best is trial 1 with value: 0.34891118703530627.
[I 2024-11-05 03:46:44,465] Trial 186 finished with value: 0.34891118703530627 and parameters: {'model_name': 'SimpleImputer', 'strategy': 'mean'}. Best is trial 1 with value: 0.34891118703530627.
[I 2024-11-05 03:46:44,576] Trial 177 finished with value: 0.5243961098230672 and parameters: {'model_name': 'SimpleImputer', 'strategy': 'constant'}. Best is trial 1 with value: 0.34891118703530627.
running
[I 2024-11-05 03:46:44,775] Trial 181 finished with value: 0.34891118703530627 and parameters: {'model_name': 'SimpleImputer', 'strategy': 'mean'}. Best is trial 1 with value: 0.34891118703530627.
[I 2024-11-05 03:46:44,957] Trial 185 finished with value: 0.34891118703530627 and parameters: {'model_name': 'SimpleImputer', 'strategy': 'mean'}. Best is trial 1 with value: 0.34891118703530627.
[I 2024-11-05 03:46:45,100] Trial 195 finished with value: 0.34891118703530627 and parameters: {'model_name': 'SimpleImputer', 'strategy': 'mean'}. Best is trial 1 with value: 0.34891118703530627.
[I 2024-11-05 03:46:45,106] Trial 187 finished with value: 0.34891118703530627 and parameters: {'model_name': 'SimpleImputer', 'strategy': 'mean'}. Best is trial 1 with value: 0.34891118703530627.
[I 2024-11-05 03:46:45,220] Trial 193 finished with value: 0.34891118703530627 and parameters: {'model_name': 'SimpleImputer', 'strategy': 'mean'}. Best is trial 1 with value: 0.34891118703530627.
[I 2024-11-05 03:46:45,521] Trial 191 finished with value: 0.34891118703530627 and parameters: {'model_name': 'SimpleImputer', 'strategy': 'mean'}. Best is trial 1 with value: 0.34891118703530627.
[I 2024-11-05 03:46:45,675] Trial 194 finished with value: 0.34891118703530627 and parameters: {'model_name': 'SimpleImputer', 'strategy': 'mean'}. Best is trial 1 with value: 0.34891118703530627.
[I 2024-11-05 03:46:45,795] Trial 192 finished with value: 0.34891118703530627 and parameters: {'model_name': 'SimpleImputer', 'strategy': 'mean'}. Best is trial 1 with value: 0.34891118703530627.
[I 2024-11-05 03:46:45,904] Trial 196 finished with value: 0.34891118703530627 and parameters: {'model_name': 'SimpleImputer', 'strategy': 'mean'}. Best is trial 1 with value: 0.34891118703530627.
[I 2024-11-05 03:46:45,998] Trial 198 finished with value: 0.34891118703530627 and parameters: {'model_name': 'SimpleImputer', 'strategy': 'mean'}. Best is trial 1 with value: 0.34891118703530627.
[I 2024-11-05 03:46:46,095] Trial 197 finished with value: 0.34891118703530627 and parameters: {'model_name': 'SimpleImputer', 'strategy': 'mean'}. Best is trial 1 with value: 0.34891118703530627.
