[I 2024-10-23 20:28:02,553] Trial 171 finished with value: 0.258273887040863 and parameters: {'model_name': 'IterativeImputer', 'estimator': 'Bayesian', 'initial_strategy': 'median', 'n_nearest_features': 1, 'imputation_order': 'ascending', 'sample_posterior': False}. Best is trial 138 with value: 0.2581758140556432.
running
[I 2024-10-23 20:28:20,868] Trial 172 finished with value: 0.258273887040863 and parameters: {'model_name': 'IterativeImputer', 'estimator': 'Bayesian', 'initial_strategy': 'median', 'n_nearest_features': 1, 'imputation_order': 'ascending', 'sample_posterior': False}. Best is trial 138 with value: 0.2581758140556432.
running
[I 2024-10-23 20:28:39,511] Trial 173 finished with value: 0.258273887040863 and parameters: {'model_name': 'IterativeImputer', 'estimator': 'Bayesian', 'initial_strategy': 'median', 'n_nearest_features': 1, 'imputation_order': 'ascending', 'sample_posterior': False}. Best is trial 138 with value: 0.2581758140556432.
running
[I 2024-10-23 20:29:07,996] Trial 174 finished with value: 0.25835659974972985 and parameters: {'model_name': 'IterativeImputer', 'estimator': 'Bayesian', 'initial_strategy': 'median', 'n_nearest_features': 4, 'imputation_order': 'ascending', 'sample_posterior': False}. Best is trial 138 with value: 0.2581758140556432.
running
[I 2024-10-23 20:29:25,875] Trial 175 finished with value: 0.258273887040863 and parameters: {'model_name': 'IterativeImputer', 'estimator': 'Bayesian', 'initial_strategy': 'median', 'n_nearest_features': 1, 'imputation_order': 'ascending', 'sample_posterior': False}. Best is trial 138 with value: 0.2581758140556432.
running
[I 2024-10-23 20:29:43,233] Trial 176 finished with value: 0.258273887040863 and parameters: {'model_name': 'IterativeImputer', 'estimator': 'Bayesian', 'initial_strategy': 'median', 'n_nearest_features': 1, 'imputation_order': 'ascending', 'sample_posterior': False}. Best is trial 138 with value: 0.2581758140556432.
running
[I 2024-10-23 20:30:01,837] Trial 177 finished with value: 0.258273887040863 and parameters: {'model_name': 'IterativeImputer', 'estimator': 'Bayesian', 'initial_strategy': 'median', 'n_nearest_features': 1, 'imputation_order': 'ascending', 'sample_posterior': False}. Best is trial 138 with value: 0.2581758140556432.
running
[I 2024-10-23 20:30:18,771] Trial 178 finished with value: 0.25830350240727257 and parameters: {'model_name': 'IterativeImputer', 'estimator': 'Bayesian', 'initial_strategy': 'mean', 'n_nearest_features': 1, 'imputation_order': 'random', 'sample_posterior': False}. Best is trial 138 with value: 0.2581758140556432.
running
[I 2024-10-23 20:30:35,027] Trial 179 finished with value: 0.25825453813561944 and parameters: {'model_name': 'IterativeImputer', 'estimator': 'Bayesian', 'initial_strategy': 'constant', 'n_nearest_features': 1, 'imputation_order': 'ascending', 'sample_posterior': False}. Best is trial 138 with value: 0.2581758140556432.
running
[I 2024-10-23 20:30:53,346] Trial 180 finished with value: 0.258273887040863 and parameters: {'model_name': 'IterativeImputer', 'estimator': 'Bayesian', 'initial_strategy': 'median', 'n_nearest_features': 1, 'imputation_order': 'ascending', 'sample_posterior': False}. Best is trial 138 with value: 0.2581758140556432.
running
[I 2024-10-23 20:30:57,785] Trial 181 finished with value: 0.25837464715753866 and parameters: {'model_name': 'KNNImputer', 'n_neighbors': 2538, 'weights': 'uniform'}. Best is trial 138 with value: 0.2581758140556432.
running
[I 2024-10-23 20:31:15,527] Trial 182 finished with value: 0.258273887040863 and parameters: {'model_name': 'IterativeImputer', 'estimator': 'Bayesian', 'initial_strategy': 'median', 'n_nearest_features': 1, 'imputation_order': 'ascending', 'sample_posterior': False}. Best is trial 138 with value: 0.2581758140556432.
running
[I 2024-10-23 20:31:33,288] Trial 183 finished with value: 0.25825453813561944 and parameters: {'model_name': 'IterativeImputer', 'estimator': 'Bayesian', 'initial_strategy': 'constant', 'n_nearest_features': 1, 'imputation_order': 'ascending', 'sample_posterior': False}. Best is trial 138 with value: 0.2581758140556432.
running
[I 2024-10-23 20:32:09,534] Trial 184 finished with value: 0.4803972593941087 and parameters: {'model_name': 'GAIN', 'batch_size': 250, 'hint_rate': 0.7170555271461821, 'alpha': 96, 'iterations': 16, 'learning_rate': 0.0062017886843196155, 'p_miss': 0.22997074798004044}. Best is trial 138 with value: 0.2581758140556432.
running
[I 2024-10-23 20:32:20,584] Trial 101 finished with value: 0.25949298053020325 and parameters: {'model_name': 'VAE', 'batch_size': 299, 'iterations': 607, 'learning_rate': 0.02591624133808086, 'p_miss': 0.23469857006200082}. Best is trial 138 with value: 0.2581758140556432.
running
[I 2024-10-23 20:32:28,337] Trial 185 finished with value: 0.25825453813561944 and parameters: {'model_name': 'IterativeImputer', 'estimator': 'Bayesian', 'initial_strategy': 'constant', 'n_nearest_features': 1, 'imputation_order': 'ascending', 'sample_posterior': False}. Best is trial 138 with value: 0.2581758140556432.
running
[I 2024-10-23 20:32:34,041] Trial 186 finished with value: 0.25825453813561944 and parameters: {'model_name': 'IterativeImputer', 'estimator': 'Bayesian', 'initial_strategy': 'constant', 'n_nearest_features': 1, 'imputation_order': 'ascending', 'sample_posterior': False}. Best is trial 138 with value: 0.2581758140556432.
running
[I 2024-10-23 20:32:48,717] Trial 102 finished with value: 0.26003927415393213 and parameters: {'model_name': 'VAE', 'batch_size': 305, 'iterations': 612, 'learning_rate': 0.024726416941407623, 'p_miss': 0.23354872021415285}. Best is trial 138 with value: 0.2581758140556432.
running
[I 2024-10-23 20:32:51,741] Trial 188 finished with value: 0.3684149742335249 and parameters: {'model_name': 'IterativeImputer', 'estimator': 'Bayesian', 'initial_strategy': 'constant', 'n_nearest_features': 1, 'imputation_order': 'ascending', 'sample_posterior': True}. Best is trial 138 with value: 0.2581758140556432.
running
[I 2024-10-23 20:33:02,248] Trial 187 finished with value: 0.2583622813214712 and parameters: {'model_name': 'IterativeImputer', 'estimator': 'Bayesian', 'initial_strategy': 'constant', 'n_nearest_features': 5, 'imputation_order': 'ascending', 'sample_posterior': False}. Best is trial 138 with value: 0.2581758140556432.
running
[I 2024-10-23 20:33:02,957] Trial 190 finished with value: 0.25825453813561944 and parameters: {'model_name': 'IterativeImputer', 'estimator': 'Bayesian', 'initial_strategy': 'constant', 'n_nearest_features': 1, 'imputation_order': 'ascending', 'sample_posterior': False}. Best is trial 138 with value: 0.2581758140556432.
running
[I 2024-10-23 20:33:05,909] Trial 189 finished with value: 0.3684149742335249 and parameters: {'model_name': 'IterativeImputer', 'estimator': 'Bayesian', 'initial_strategy': 'constant', 'n_nearest_features': 1, 'imputation_order': 'ascending', 'sample_posterior': True}. Best is trial 138 with value: 0.2581758140556432.
running
[I 2024-10-23 20:33:22,084] Trial 191 finished with value: 0.25825453813561944 and parameters: {'model_name': 'IterativeImputer', 'estimator': 'Bayesian', 'initial_strategy': 'constant', 'n_nearest_features': 1, 'imputation_order': 'ascending', 'sample_posterior': False}. Best is trial 138 with value: 0.2581758140556432.
running
[I 2024-10-23 20:33:23,379] Trial 192 finished with value: 0.25825453813561944 and parameters: {'model_name': 'IterativeImputer', 'estimator': 'Bayesian', 'initial_strategy': 'constant', 'n_nearest_features': 1, 'imputation_order': 'ascending', 'sample_posterior': False}. Best is trial 138 with value: 0.2581758140556432.
running
[I 2024-10-23 20:33:24,248] Trial 193 finished with value: 0.28734796227734183 and parameters: {'model_name': 'IterativeImputer', 'estimator': 'KNN', 'initial_strategy': 'constant', 'n_nearest_features': 1, 'imputation_order': 'ascending'}. Best is trial 138 with value: 0.2581758140556432.
running
[I 2024-10-23 20:33:39,847] Trial 194 finished with value: 0.28734796227734183 and parameters: {'model_name': 'IterativeImputer', 'estimator': 'KNN', 'initial_strategy': 'constant', 'n_nearest_features': 1, 'imputation_order': 'ascending'}. Best is trial 138 with value: 0.2581758140556432.
running
[I 2024-10-23 20:33:43,578] Trial 196 finished with value: 0.25825453813561944 and parameters: {'model_name': 'IterativeImputer', 'estimator': 'Bayesian', 'initial_strategy': 'constant', 'n_nearest_features': 1, 'imputation_order': 'ascending', 'sample_posterior': False}. Best is trial 138 with value: 0.2581758140556432.
running
[I 2024-10-23 20:33:50,757] Trial 195 finished with value: 0.2834419153796369 and parameters: {'model_name': 'IterativeImputer', 'estimator': 'KNN', 'initial_strategy': 'constant', 'n_nearest_features': 7, 'imputation_order': 'arabic'}. Best is trial 138 with value: 0.2581758140556432.
running
[I 2024-10-23 20:33:52,393] Trial 197 finished with value: 0.2582993684917546 and parameters: {'model_name': 'IterativeImputer', 'estimator': 'Bayesian', 'initial_strategy': 'constant', 'n_nearest_features': 1, 'imputation_order': 'arabic', 'sample_posterior': False}. Best is trial 138 with value: 0.2581758140556432.
[I 2024-10-23 20:33:59,901] Trial 198 finished with value: 0.25834485392169027 and parameters: {'model_name': 'IterativeImputer', 'estimator': 'Bayesian', 'initial_strategy': 'constant', 'n_nearest_features': 7, 'imputation_order': 'arabic', 'sample_posterior': False}. Best is trial 138 with value: 0.2581758140556432.
[I 2024-10-23 20:34:00,505] Trial 199 finished with value: 0.25825453813561944 and parameters: {'model_name': 'IterativeImputer', 'estimator': 'Bayesian', 'initial_strategy': 'constant', 'n_nearest_features': 1, 'imputation_order': 'ascending', 'sample_posterior': False}. Best is trial 138 with value: 0.2581758140556432.
[I 2024-10-23 20:40:37,390] Trial 25 finished with value: 0.4971676366391269 and parameters: {'model_name': 'GAIN', 'batch_size': 881, 'hint_rate': 0.8456698304725552, 'alpha': 92, 'iterations': 9663, 'learning_rate': 0.00013503980617559115, 'p_miss': 0.022333623780883466}. Best is trial 138 with value: 0.2581758140556432.
[I 2024-10-23 20:53:08,905] Trial 85 finished with value: 0.2602205347290952 and parameters: {'model_name': 'VAE', 'batch_size': 259, 'iterations': 1044, 'learning_rate': 0.09380056840255717, 'p_miss': 0.2376943769057716}. Best is trial 138 with value: 0.2581758140556432.
[I 2024-10-23 20:56:27,152] Trial 68 finished with value: 0.2760875502941839 and parameters: {'model_name': 'VAE', 'batch_size': 5, 'iterations': 4585, 'learning_rate': 0.09960484009827186, 'p_miss': 0.2963643814815742}. Best is trial 138 with value: 0.2581758140556432.
[I 2024-10-23 20:56:49,559] Trial 0 finished with value: 0.2912577087666145 and parameters: {'model_name': 'VAE', 'batch_size': 2, 'iterations': 6846, 'learning_rate': 0.00039092061982724146, 'p_miss': 0.09316245773769834}. Best is trial 138 with value: 0.2581758140556432.
[I 2024-10-23 21:29:30,003] Trial 64 finished with value: 0.27391631404019146 and parameters: {'model_name': 'VAE', 'batch_size': 6, 'iterations': 7198, 'learning_rate': 0.06730290513093634, 'p_miss': 0.2743701941971334}. Best is trial 138 with value: 0.2581758140556432.
[I 2024-10-23 21:30:06,903] Trial 54 finished with value: 0.2598609201269185 and parameters: {'model_name': 'VAE', 'batch_size': 187, 'iterations': 6744, 'learning_rate': 0.00017347577895445685, 'p_miss': 0.2963459703886303}. Best is trial 138 with value: 0.2581758140556432.
[I 2024-10-23 21:38:53,166] Trial 62 finished with value: 0.2827308551794091 and parameters: {'model_name': 'VAE', 'batch_size': 5, 'iterations': 8003, 'learning_rate': 0.08771677730554522, 'p_miss': 0.2961259986618705}. Best is trial 138 with value: 0.2581758140556432.
[I 2024-10-23 21:44:23,231] Trial 74 finished with value: 0.27079841577193453 and parameters: {'model_name': 'VAE', 'batch_size': 6, 'iterations': 7090, 'learning_rate': 0.08704864947650241, 'p_miss': 0.11820681236245076}. Best is trial 138 with value: 0.2581758140556432.
[I 2024-10-23 21:50:26,196] Trial 69 finished with value: 0.2766057459090156 and parameters: {'model_name': 'VAE', 'batch_size': 8, 'iterations': 9271, 'learning_rate': 0.08608623393722972, 'p_miss': 0.29132033844467653}. Best is trial 138 with value: 0.2581758140556432.
[I 2024-10-23 21:53:20,140] Trial 55 finished with value: 0.2613701740692373 and parameters: {'model_name': 'VAE', 'batch_size': 90, 'iterations': 8270, 'learning_rate': 0.00011080878503422406, 'p_miss': 0.29691979907433863}. Best is trial 138 with value: 0.2581758140556432.
[I 2024-10-23 21:56:32,774] Trial 65 finished with value: 0.27299134786484386 and parameters: {'model_name': 'VAE', 'batch_size': 7, 'iterations': 8921, 'learning_rate': 0.05906977053851548, 'p_miss': 0.2938800816970341}. Best is trial 138 with value: 0.2581758140556432.
[I 2024-10-23 21:58:55,937] Trial 52 finished with value: 0.2600224168977325 and parameters: {'model_name': 'VAE', 'batch_size': 580, 'iterations': 7871, 'learning_rate': 0.00015923376523853763, 'p_miss': 0.2990073833264874}. Best is trial 138 with value: 0.2581758140556432.
