[I 2024-10-08 10:20:51,220] Trial 161 finished with value: 0.15867026588377722 and parameters: {'model_name': 'IterativeImputer', 'estimator': 'Bayesian', 'initial_strategy': 'median', 'n_nearest_features': 6, 'imputation_order': 'descending', 'sample_posterior': True}. Best is trial 57 with value: 0.062126204378123696.
running
[I 2024-10-08 10:21:08,452] Trial 164 finished with value: 0.11449437281006747 and parameters: {'model_name': 'IterativeImputer', 'estimator': 'Ridge', 'initial_strategy': 'median', 'n_nearest_features': 6, 'imputation_order': 'descending'}. Best is trial 57 with value: 0.062126204378123696.
running
[I 2024-10-08 10:21:33,047] Trial 165 finished with value: 0.45982434050426696 and parameters: {'model_name': 'GAIN', 'batch_size': 44, 'hint_rate': 0.7850883416362284, 'alpha': 68, 'iterations': 31, 'learning_rate': 0.00020991360923291024, 'p_miss': 0.26704023315750014}. Best is trial 57 with value: 0.062126204378123696.
running
[I 2024-10-08 10:21:37,616] Trial 148 finished with value: 0.0658927127395637 and parameters: {'model_name': 'IterativeImputer', 'estimator': 'RFR', 'initial_strategy': 'median', 'n_nearest_features': 5, 'imputation_order': 'descending'}. Best is trial 57 with value: 0.062126204378123696.
running
[I 2024-10-08 10:22:00,775] Trial 149 finished with value: 0.06708361780744823 and parameters: {'model_name': 'IterativeImputer', 'estimator': 'RFR', 'initial_strategy': 'median', 'n_nearest_features': 6, 'imputation_order': 'descending'}. Best is trial 57 with value: 0.062126204378123696.
running
[I 2024-10-08 10:22:40,318] Trial 150 finished with value: 0.06461221518603119 and parameters: {'model_name': 'IterativeImputer', 'estimator': 'RFR', 'initial_strategy': 'median', 'n_nearest_features': 6, 'imputation_order': 'descending'}. Best is trial 57 with value: 0.062126204378123696.
running
slurmstepd: error: *** STEP 993214.0 ON esplhpc-cp001 CANCELLED AT 2024-10-08T10:24:13 ***
slurmstepd: error: *** JOB 993214 ON esplhpc-cp001 CANCELLED AT 2024-10-08T10:24:13 ***
