Run: 51
/cm/local/apps/slurm/var/spool/job924541/slurm_script: line 26: 
pip install -e tpot2
pip install -r tpot2/ImputerExperiments/requirements_.txt
: No such file or directory
RunStart
starting loops
../data/c/6/6.pkl
working on 
../data/c/6/class_full_MCAR_0.3_3
4.734449625015259
running experiment 1/3 - Does large hyperparameter space improve reconstruction accuracy over simple
[I 2024-08-15 20:25:06,667] A new study created in memory with name: no-name-cc65d8c5-4ad7-42e4-b06c-2077010d8f27
running
running
running
running
running
running
running
running
running
running
running
running
running
running
running
running
[I 2024-08-15 20:25:07,442] Trial 14 finished with value: 0.20835393386139786 and parameters: {'model_name': 'SimpleImputer', 'strategy': 'constant'}. Best is trial 14 with value: 0.20835393386139786.
running
[I 2024-08-15 20:25:07,891] Trial 16 finished with value: 0.20835393386139786 and parameters: {'model_name': 'SimpleImputer', 'strategy': 'constant'}. Best is trial 14 with value: 0.20835393386139786.
running
[I 2024-08-15 20:25:08,130] Trial 6 finished with value: 0.07906713047117861 and parameters: {'model_name': 'SimpleImputer', 'strategy': 'median'}. Best is trial 6 with value: 0.07906713047117861.
running
[I 2024-08-15 20:25:08,737] Trial 1 finished with value: 0.20835393386139786 and parameters: {'model_name': 'SimpleImputer', 'strategy': 'most_frequent'}. Best is trial 6 with value: 0.07906713047117861.
running
[I 2024-08-15 20:25:09,474] Trial 17 finished with value: 0.07906713047117861 and parameters: {'model_name': 'SimpleImputer', 'strategy': 'median'}. Best is trial 6 with value: 0.07906713047117861.
running
[I 2024-08-15 20:25:27,323] Trial 0 finished with value: 0.1952040440536305 and parameters: {'model_name': 'GAIN', 'batch_size': 1, 'hint_rate': 0.11756400090012872, 'alpha': 66, 'iterations': 1, 'learning_rate': 0.0406176151520145, 'p_miss': 0.22275915998004966}. Best is trial 6 with value: 0.07906713047117861.
running
[I 2024-08-15 20:25:28,938] Trial 11 finished with value: 0.19517544981162932 and parameters: {'model_name': 'GAIN', 'batch_size': 25, 'hint_rate': 0.860297022173421, 'alpha': 81, 'iterations': 1, 'learning_rate': 0.010956737534512623, 'p_miss': 0.22866840148232487}. Best is trial 6 with value: 0.07906713047117861.
running
[I 2024-08-15 20:25:30,800] Trial 3 finished with value: 0.19479800196564684 and parameters: {'model_name': 'GAIN', 'batch_size': 655, 'hint_rate': 0.09684544528698547, 'alpha': 76, 'iterations': 1, 'learning_rate': 0.00582717669338554, 'p_miss': 0.24662006703252873}. Best is trial 6 with value: 0.07906713047117861.
running
[I 2024-08-15 20:25:45,984] Trial 8 finished with value: 0.08595256260523423 and parameters: {'model_name': 'KNNImputer', 'n_neighbors': 3472, 'weights': 'distance'}. Best is trial 6 with value: 0.07906713047117861.
running
[I 2024-08-15 20:25:51,024] Trial 4 finished with value: inf and parameters: {'model_name': 'GAIN', 'batch_size': 1, 'hint_rate': 0.8744810538032636, 'alpha': 23, 'iterations': 219, 'learning_rate': 0.0010291896643037821, 'p_miss': 0.18766768841884804}. Best is trial 6 with value: 0.07906713047117861.
running
[I 2024-08-15 20:25:53,888] Trial 7 finished with value: 0.20267280787861583 and parameters: {'model_name': 'GAIN', 'batch_size': 634, 'hint_rate': 0.5784284069771684, 'alpha': 32, 'iterations': 6, 'learning_rate': 0.00012949868321802222, 'p_miss': 0.08039580970185622}. Best is trial 6 with value: 0.07906713047117861.
running
[I 2024-08-15 20:25:57,149] Trial 24 finished with value: inf and parameters: {'model_name': 'GAIN', 'batch_size': 1, 'hint_rate': 0.36654807965693803, 'alpha': 27, 'iterations': 3, 'learning_rate': 0.00015951142097832177, 'p_miss': 0.17362488883767213}. Best is trial 6 with value: 0.07906713047117861.
running
[I 2024-08-15 20:25:57,968] Trial 9 finished with value: 0.09021248551335123 and parameters: {'model_name': 'KNNImputer', 'n_neighbors': 17749, 'weights': 'distance'}. Best is trial 6 with value: 0.07906713047117861.
running
[I 2024-08-15 20:26:00,148] Trial 20 finished with value: 0.08777093166378595 and parameters: {'model_name': 'KNNImputer', 'n_neighbors': 8435, 'weights': 'distance'}. Best is trial 6 with value: 0.07906713047117861.
running
[I 2024-08-15 20:26:14,271] Trial 19 finished with value: 0.08657799268014747 and parameters: {'model_name': 'IterativeImputer', 'estimator': 'Ridge', 'initial_strategy': 'most_frequent', 'n_nearest_features': 16, 'imputation_order': 'descending'}. Best is trial 6 with value: 0.07906713047117861.
running
[I 2024-08-15 20:26:16,584] Trial 30 finished with value: 0.07906713047117861 and parameters: {'model_name': 'SimpleImputer', 'strategy': 'median'}. Best is trial 6 with value: 0.07906713047117861.
running
[I 2024-08-15 20:26:17,900] Trial 21 finished with value: 0.08765461831103324 and parameters: {'model_name': 'KNNImputer', 'n_neighbors': 8052, 'weights': 'distance'}. Best is trial 6 with value: 0.07906713047117861.
running
[I 2024-08-15 20:26:18,922] Trial 31 finished with value: 0.07906713047117861 and parameters: {'model_name': 'SimpleImputer', 'strategy': 'median'}. Best is trial 6 with value: 0.07906713047117861.
running
[I 2024-08-15 20:26:19,927] Trial 32 finished with value: 0.07906713047117861 and parameters: {'model_name': 'SimpleImputer', 'strategy': 'median'}. Best is trial 6 with value: 0.07906713047117861.
running
[I 2024-08-15 20:26:32,851] Trial 5 finished with value: 0.20420884382722368 and parameters: {'model_name': 'GAIN', 'batch_size': 70, 'hint_rate': 0.18442119030138088, 'alpha': 59, 'iterations': 41, 'learning_rate': 0.008486704116108471, 'p_miss': 0.07859652252690359}. Best is trial 6 with value: 0.07906713047117861.
running
[I 2024-08-15 20:26:33,865] Trial 2 finished with value: 0.08929425283068228 and parameters: {'model_name': 'IterativeImputer', 'estimator': 'Ridge', 'initial_strategy': 'constant', 'n_nearest_features': 2, 'imputation_order': 'ascending'}. Best is trial 6 with value: 0.07906713047117861.
running
[I 2024-08-15 20:26:34,190] Trial 18 finished with value: 0.18899441334061076 and parameters: {'model_name': 'GAIN', 'batch_size': 12, 'hint_rate': 0.3467554830210295, 'alpha': 11, 'iterations': 43, 'learning_rate': 0.0010414422474578154, 'p_miss': 0.28666516759961347}. Best is trial 6 with value: 0.07906713047117861.
running
[I 2024-08-15 20:26:36,079] Trial 36 finished with value: 0.07906713047117861 and parameters: {'model_name': 'SimpleImputer', 'strategy': 'median'}. Best is trial 6 with value: 0.07906713047117861.
running
[I 2024-08-15 20:26:36,441] Trial 37 finished with value: 0.07906713047117861 and parameters: {'model_name': 'SimpleImputer', 'strategy': 'median'}. Best is trial 6 with value: 0.07906713047117861.
running
[I 2024-08-15 20:26:37,288] Trial 38 finished with value: 0.09083261660032763 and parameters: {'model_name': 'SimpleImputer', 'strategy': 'mean'}. Best is trial 6 with value: 0.07906713047117861.
running
[I 2024-08-15 20:26:37,975] Trial 39 finished with value: 0.09083261660032763 and parameters: {'model_name': 'SimpleImputer', 'strategy': 'mean'}. Best is trial 6 with value: 0.07906713047117861.
running
[I 2024-08-15 20:26:39,625] Trial 40 finished with value: 0.07906713047117861 and parameters: {'model_name': 'SimpleImputer', 'strategy': 'median'}. Best is trial 6 with value: 0.07906713047117861.
running
[I 2024-08-15 20:26:40,220] Trial 41 finished with value: 0.07906713047117861 and parameters: {'model_name': 'SimpleImputer', 'strategy': 'median'}. Best is trial 6 with value: 0.07906713047117861.
running
[I 2024-08-15 20:27:02,694] Trial 12 finished with value: 0.08692976771434395 and parameters: {'model_name': 'IterativeImputer', 'estimator': 'Ridge', 'initial_strategy': 'most_frequent', 'n_nearest_features': 10, 'imputation_order': 'ascending'}. Best is trial 6 with value: 0.07906713047117861.
running
[I 2024-08-15 20:27:05,003] Trial 44 finished with value: 0.07906713047117861 and parameters: {'model_name': 'SimpleImputer', 'strategy': 'median'}. Best is trial 6 with value: 0.07906713047117861.
running
[I 2024-08-15 20:27:10,008] Trial 45 finished with value: 0.20835393386139786 and parameters: {'model_name': 'SimpleImputer', 'strategy': 'most_frequent'}. Best is trial 6 with value: 0.07906713047117861.
running
[I 2024-08-15 20:27:12,501] Trial 46 finished with value: 0.07906713047117861 and parameters: {'model_name': 'SimpleImputer', 'strategy': 'median'}. Best is trial 6 with value: 0.07906713047117861.
running
[I 2024-08-15 20:27:15,010] Trial 47 finished with value: 0.07906713047117861 and parameters: {'model_name': 'SimpleImputer', 'strategy': 'median'}. Best is trial 6 with value: 0.07906713047117861.
running
[I 2024-08-15 20:27:17,131] Trial 48 finished with value: 0.07906713047117861 and parameters: {'model_name': 'SimpleImputer', 'strategy': 'median'}. Best is trial 6 with value: 0.07906713047117861.
running
[I 2024-08-15 20:27:19,514] Trial 49 finished with value: 0.07906713047117861 and parameters: {'model_name': 'SimpleImputer', 'strategy': 'median'}. Best is trial 6 with value: 0.07906713047117861.
running
[I 2024-08-15 20:27:54,913] Trial 28 finished with value: 0.08889201313202155 and parameters: {'model_name': 'IterativeImputer', 'estimator': 'Ridge', 'initial_strategy': 'most_frequent', 'n_nearest_features': 3, 'imputation_order': 'descending'}. Best is trial 6 with value: 0.07906713047117861.
running
[I 2024-08-15 20:27:57,229] Trial 51 finished with value: 0.07906713047117861 and parameters: {'model_name': 'SimpleImputer', 'strategy': 'median'}. Best is trial 6 with value: 0.07906713047117861.
running
[I 2024-08-15 20:27:59,547] Trial 52 finished with value: 0.07906713047117861 and parameters: {'model_name': 'SimpleImputer', 'strategy': 'median'}. Best is trial 6 with value: 0.07906713047117861.
running
[I 2024-08-15 20:28:02,371] Trial 53 finished with value: 0.07906713047117861 and parameters: {'model_name': 'SimpleImputer', 'strategy': 'median'}. Best is trial 6 with value: 0.07906713047117861.
running
[I 2024-08-15 20:28:03,737] Trial 10 finished with value: 0.09458851198244075 and parameters: {'model_name': 'IterativeImputer', 'estimator': 'KNN', 'initial_strategy': 'mean', 'n_nearest_features': 3, 'imputation_order': 'ascending'}. Best is trial 6 with value: 0.07906713047117861.
running
[I 2024-08-15 20:28:05,134] Trial 55 finished with value: 0.20835393386139786 and parameters: {'model_name': 'SimpleImputer', 'strategy': 'constant'}. Best is trial 6 with value: 0.07906713047117861.
running
[I 2024-08-15 20:28:07,874] Trial 56 finished with value: 0.07906713047117861 and parameters: {'model_name': 'SimpleImputer', 'strategy': 'median'}. Best is trial 6 with value: 0.07906713047117861.
running
[I 2024-08-15 20:28:10,595] Trial 57 finished with value: 0.07906713047117861 and parameters: {'model_name': 'SimpleImputer', 'strategy': 'median'}. Best is trial 6 with value: 0.07906713047117861.
running
[I 2024-08-15 20:28:12,661] Trial 58 finished with value: 0.07906713047117861 and parameters: {'model_name': 'SimpleImputer', 'strategy': 'median'}. Best is trial 6 with value: 0.07906713047117861.
running
[I 2024-08-15 20:28:50,398] Trial 26 finished with value: 0.08669198566149539 and parameters: {'model_name': 'IterativeImputer', 'estimator': 'Ridge', 'initial_strategy': 'constant', 'n_nearest_features': 12, 'imputation_order': 'roman'}. Best is trial 6 with value: 0.07906713047117861.
running
[I 2024-08-15 20:28:54,456] Trial 59 finished with value: 0.09083261660032761 and parameters: {'model_name': 'KNNImputer', 'n_neighbors': 17400, 'weights': 'uniform'}. Best is trial 6 with value: 0.07906713047117861.
running
[I 2024-08-15 20:28:56,634] Trial 61 finished with value: 0.07906713047117861 and parameters: {'model_name': 'SimpleImputer', 'strategy': 'median'}. Best is trial 6 with value: 0.07906713047117861.
running
[I 2024-08-15 20:28:57,733] Trial 62 finished with value: 0.09083261660032763 and parameters: {'model_name': 'SimpleImputer', 'strategy': 'mean'}. Best is trial 6 with value: 0.07906713047117861.
running
[I 2024-08-15 20:29:01,639] Trial 63 finished with value: 0.20835393386139786 and parameters: {'model_name': 'SimpleImputer', 'strategy': 'most_frequent'}. Best is trial 6 with value: 0.07906713047117861.
running
[I 2024-08-15 20:29:32,994] Trial 60 finished with value: 0.09083261660032761 and parameters: {'model_name': 'KNNImputer', 'n_neighbors': 17719, 'weights': 'uniform'}. Best is trial 6 with value: 0.07906713047117861.
running
[I 2024-08-15 20:29:48,720] Trial 34 finished with value: 0.09892256935533071 and parameters: {'model_name': 'IterativeImputer', 'estimator': 'KNN', 'initial_strategy': 'constant', 'n_nearest_features': 1, 'imputation_order': 'ascending'}. Best is trial 6 with value: 0.07906713047117861.
running
[I 2024-08-15 20:29:50,561] Trial 66 finished with value: 0.07906713047117861 and parameters: {'model_name': 'SimpleImputer', 'strategy': 'median'}. Best is trial 6 with value: 0.07906713047117861.
running
[I 2024-08-15 20:31:12,768] Trial 35 finished with value: 0.08929787502153222 and parameters: {'model_name': 'IterativeImputer', 'estimator': 'Bayesian', 'initial_strategy': 'median', 'n_nearest_features': 2, 'imputation_order': 'arabic', 'sample_posterior': False}. Best is trial 6 with value: 0.07906713047117861.
running
[I 2024-08-15 20:31:34,916] Trial 33 finished with value: 0.14141593273635827 and parameters: {'model_name': 'IterativeImputer', 'estimator': 'Bayesian', 'initial_strategy': 'mean', 'n_nearest_features': 1, 'imputation_order': 'arabic', 'sample_posterior': True}. Best is trial 6 with value: 0.07906713047117861.
running
[I 2024-08-15 20:31:51,917] Trial 50 finished with value: 0.0894233651952637 and parameters: {'model_name': 'IterativeImputer', 'estimator': 'Bayesian', 'initial_strategy': 'median', 'n_nearest_features': 2, 'imputation_order': 'random', 'sample_posterior': False}. Best is trial 6 with value: 0.07906713047117861.
running
[I 2024-08-15 20:32:15,262] Trial 23 finished with value: 0.13721052341481876 and parameters: {'model_name': 'IterativeImputer', 'estimator': 'Bayesian', 'initial_strategy': 'constant', 'n_nearest_features': 9, 'imputation_order': 'ascending', 'sample_posterior': True}. Best is trial 6 with value: 0.07906713047117861.
running
[I 2024-08-15 20:32:45,093] Trial 43 finished with value: 0.08672631414211755 and parameters: {'model_name': 'IterativeImputer', 'estimator': 'Bayesian', 'initial_strategy': 'mean', 'n_nearest_features': 11, 'imputation_order': 'random', 'sample_posterior': False}. Best is trial 6 with value: 0.07906713047117861.
running
[I 2024-08-15 20:35:04,888] Trial 42 finished with value: 0.09175817599846103 and parameters: {'model_name': 'IterativeImputer', 'estimator': 'KNN', 'initial_strategy': 'median', 'n_nearest_features': 11, 'imputation_order': 'roman'}. Best is trial 6 with value: 0.07906713047117861.
running
[I 2024-08-15 20:35:06,317] Trial 54 finished with value: 0.1366823953601316 and parameters: {'model_name': 'IterativeImputer', 'estimator': 'Bayesian', 'initial_strategy': 'median', 'n_nearest_features': 16, 'imputation_order': 'arabic', 'sample_posterior': True}. Best is trial 6 with value: 0.07906713047117861.
running
[I 2024-08-15 20:35:07,086] Trial 73 finished with value: 0.07906713047117861 and parameters: {'model_name': 'SimpleImputer', 'strategy': 'median'}. Best is trial 6 with value: 0.07906713047117861.
running
[I 2024-08-15 20:36:55,338] Trial 15 finished with value: 0.09306460113951592 and parameters: {'model_name': 'IterativeImputer', 'estimator': 'KNN', 'initial_strategy': 'mean', 'n_nearest_features': 15, 'imputation_order': 'descending'}. Best is trial 6 with value: 0.07906713047117861.
running
[I 2024-08-15 20:37:08,731] Trial 25 finished with value: 0.09330420809251065 and parameters: {'model_name': 'IterativeImputer', 'estimator': 'KNN', 'initial_strategy': 'constant', 'n_nearest_features': 16, 'imputation_order': 'arabic'}. Best is trial 6 with value: 0.07906713047117861.
running
[I 2024-08-15 20:39:54,831] Trial 74 finished with value: inf and parameters: {'model_name': 'GAIN', 'batch_size': 5, 'hint_rate': 0.644655017223103, 'alpha': 100, 'iterations': 1112, 'learning_rate': 0.08760014732491696, 'p_miss': 0.010377079287305108}. Best is trial 6 with value: 0.07906713047117861.
running
[I 2024-08-15 20:39:56,705] Trial 78 finished with value: 0.07906713047117861 and parameters: {'model_name': 'SimpleImputer', 'strategy': 'median'}. Best is trial 6 with value: 0.07906713047117861.
running
[I 2024-08-15 20:39:58,544] Trial 79 finished with value: 0.07906713047117861 and parameters: {'model_name': 'SimpleImputer', 'strategy': 'median'}. Best is trial 6 with value: 0.07906713047117861.
running
[I 2024-08-15 20:40:00,092] Trial 80 finished with value: 0.07906713047117861 and parameters: {'model_name': 'SimpleImputer', 'strategy': 'median'}. Best is trial 6 with value: 0.07906713047117861.
running
[I 2024-08-15 20:40:01,659] Trial 81 finished with value: 0.07906713047117861 and parameters: {'model_name': 'SimpleImputer', 'strategy': 'median'}. Best is trial 6 with value: 0.07906713047117861.
running
[I 2024-08-15 20:40:12,495] Trial 64 finished with value: inf and parameters: {'model_name': 'GAIN', 'batch_size': 8, 'hint_rate': 0.6629721152189594, 'alpha': 95, 'iterations': 4703, 'learning_rate': 0.09475550901749862, 'p_miss': 0.030880134806525378}. Best is trial 6 with value: 0.07906713047117861.
running
[I 2024-08-15 20:40:14,294] Trial 83 finished with value: 0.07906713047117861 and parameters: {'model_name': 'SimpleImputer', 'strategy': 'median'}. Best is trial 6 with value: 0.07906713047117861.
running
[I 2024-08-15 20:40:15,090] Trial 84 finished with value: 0.20835393386139786 and parameters: {'model_name': 'SimpleImputer', 'strategy': 'constant'}. Best is trial 6 with value: 0.07906713047117861.
running
[I 2024-08-15 20:40:18,764] Trial 85 finished with value: 0.20835393386139786 and parameters: {'model_name': 'SimpleImputer', 'strategy': 'most_frequent'}. Best is trial 6 with value: 0.07906713047117861.
running
[I 2024-08-15 20:40:20,402] Trial 86 finished with value: 0.07906713047117861 and parameters: {'model_name': 'SimpleImputer', 'strategy': 'median'}. Best is trial 6 with value: 0.07906713047117861.
running
[I 2024-08-15 20:40:21,992] Trial 87 finished with value: 0.07906713047117861 and parameters: {'model_name': 'SimpleImputer', 'strategy': 'median'}. Best is trial 6 with value: 0.07906713047117861.
running
[I 2024-08-15 20:40:23,624] Trial 88 finished with value: 0.07906713047117861 and parameters: {'model_name': 'SimpleImputer', 'strategy': 'median'}. Best is trial 6 with value: 0.07906713047117861.
running
[I 2024-08-15 20:40:24,672] Trial 89 finished with value: 0.09083261660032763 and parameters: {'model_name': 'SimpleImputer', 'strategy': 'mean'}. Best is trial 6 with value: 0.07906713047117861.
running
[I 2024-08-15 20:40:41,682] Trial 90 finished with value: 0.08297371347001865 and parameters: {'model_name': 'KNNImputer', 'n_neighbors': 270, 'weights': 'uniform'}. Best is trial 6 with value: 0.07906713047117861.
running
[I 2024-08-15 20:40:43,400] Trial 91 finished with value: 0.07906713047117861 and parameters: {'model_name': 'SimpleImputer', 'strategy': 'median'}. Best is trial 6 with value: 0.07906713047117861.
running
[I 2024-08-15 20:40:45,114] Trial 92 finished with value: 0.07906713047117861 and parameters: {'model_name': 'SimpleImputer', 'strategy': 'median'}. Best is trial 6 with value: 0.07906713047117861.
running
[I 2024-08-15 20:40:46,995] Trial 93 finished with value: 0.07906713047117861 and parameters: {'model_name': 'SimpleImputer', 'strategy': 'median'}. Best is trial 6 with value: 0.07906713047117861.
running
[I 2024-08-15 20:41:11,624] Trial 65 finished with value: inf and parameters: {'model_name': 'GAIN', 'batch_size': 6, 'hint_rate': 0.6523251199959954, 'alpha': 94, 'iterations': 4749, 'learning_rate': 0.06145155613358753, 'p_miss': 0.012467236188986736}. Best is trial 6 with value: 0.07906713047117861.
running
[I 2024-08-15 20:41:12,455] Trial 95 finished with value: 0.20835393386139786 and parameters: {'model_name': 'SimpleImputer', 'strategy': 'constant'}. Best is trial 6 with value: 0.07906713047117861.
running
[I 2024-08-15 20:41:14,103] Trial 96 finished with value: 0.07906713047117861 and parameters: {'model_name': 'SimpleImputer', 'strategy': 'median'}. Best is trial 6 with value: 0.07906713047117861.
running
[I 2024-08-15 20:41:15,941] Trial 97 finished with value: 0.07906713047117861 and parameters: {'model_name': 'SimpleImputer', 'strategy': 'median'}. Best is trial 6 with value: 0.07906713047117861.
running
[I 2024-08-15 20:41:17,598] Trial 98 finished with value: 0.07906713047117861 and parameters: {'model_name': 'SimpleImputer', 'strategy': 'median'}. Best is trial 6 with value: 0.07906713047117861.
running
[I 2024-08-15 20:41:19,157] Trial 99 finished with value: 0.07906713047117861 and parameters: {'model_name': 'SimpleImputer', 'strategy': 'median'}. Best is trial 6 with value: 0.07906713047117861.
running
[I 2024-08-15 20:41:20,902] Trial 100 finished with value: 0.07906713047117861 and parameters: {'model_name': 'SimpleImputer', 'strategy': 'median'}. Best is trial 6 with value: 0.07906713047117861.
running
[I 2024-08-15 20:41:22,444] Trial 101 finished with value: 0.07906713047117861 and parameters: {'model_name': 'SimpleImputer', 'strategy': 'median'}. Best is trial 6 with value: 0.07906713047117861.
running
[I 2024-08-15 20:41:24,186] Trial 102 finished with value: 0.07906713047117861 and parameters: {'model_name': 'SimpleImputer', 'strategy': 'median'}. Best is trial 6 with value: 0.07906713047117861.
running
