Run: 18
/cm/local/apps/slurm/var/spool/job1042006/slurm_script: line 26: 
pip install -e tpot2
pip install -r tpot2/ImputerExperiments/requirements_.txt
: No such file or directory
RunStart
Version 0.1.7a0 of tpot2 is outdated. Version 0.1.8a0 was released Tuesday September 17, 2024.
starting loops
../data/c/1046/1046.pkl
working on 
../data/c/1046/class_simple_MAR_0.1_1
2.0204243659973145
running experiment 1/3 - Does large hyperparameter space improve reconstruction accuracy over simple
[I 2024-11-05 20:13:40,858] A new study created in memory with name: no-name-2414bdd7-d1a8-4bca-984a-25d29497071f
running
running
running
running
running
running
running
running
running
running
running
running
running
running
running
running
[I 2024-11-05 20:13:41,172] Trial 0 finished with value: 0.4027684591544901 and parameters: {'model_name': 'SimpleImputer', 'strategy': 'constant'}. Best is trial 0 with value: 0.4027684591544901.
running
[I 2024-11-05 20:13:41,381] Trial 1 finished with value: 0.22408387266657082 and parameters: {'model_name': 'SimpleImputer', 'strategy': 'mean'}. Best is trial 1 with value: 0.22408387266657082.
[I 2024-11-05 20:13:41,513] Trial 5 finished with value: 0.22408387266657082 and parameters: {'model_name': 'SimpleImputer', 'strategy': 'mean'}. Best is trial 1 with value: 0.22408387266657082.
[I 2024-11-05 20:13:41,628] Trial 13 finished with value: 0.22408387266657082 and parameters: {'model_name': 'SimpleImputer', 'strategy': 'mean'}. Best is trial 1 with value: 0.22408387266657082.
[I 2024-11-05 20:13:41,712] Trial 3 finished with value: 0.4027684591544901 and parameters: {'model_name': 'SimpleImputer', 'strategy': 'constant'}. Best is trial 1 with value: 0.22408387266657082.
[I 2024-11-05 20:13:41,794] Trial 9 finished with value: 0.22408387266657082 and parameters: {'model_name': 'SimpleImputer', 'strategy': 'mean'}. Best is trial 1 with value: 0.22408387266657082.
running
running
running
running
running
[I 2024-11-05 20:13:41,954] Trial 14 finished with value: 0.4027684591544901 and parameters: {'model_name': 'SimpleImputer', 'strategy': 'constant'}. Best is trial 1 with value: 0.22408387266657082.
[I 2024-11-05 20:13:42,070] Trial 15 finished with value: 0.22408387266657082 and parameters: {'model_name': 'SimpleImputer', 'strategy': 'mean'}. Best is trial 1 with value: 0.22408387266657082.
running
[I 2024-11-05 20:13:42,190] Trial 4 finished with value: 0.22408387266657082 and parameters: {'model_name': 'SimpleImputer', 'strategy': 'mean'}. Best is trial 1 with value: 0.22408387266657082.
running
running
[I 2024-11-05 20:13:42,340] Trial 7 finished with value: 0.23072739848771917 and parameters: {'model_name': 'SimpleImputer', 'strategy': 'median'}. Best is trial 1 with value: 0.22408387266657082.
[I 2024-11-05 20:13:42,442] Trial 16 finished with value: 0.4027684591544901 and parameters: {'model_name': 'SimpleImputer', 'strategy': 'constant'}. Best is trial 1 with value: 0.22408387266657082.
running
running
[I 2024-11-05 20:13:42,621] Trial 2 finished with value: 0.23072739848771917 and parameters: {'model_name': 'SimpleImputer', 'strategy': 'median'}. Best is trial 1 with value: 0.22408387266657082.
running
[I 2024-11-05 20:13:42,746] Trial 12 finished with value: 0.23072739848771917 and parameters: {'model_name': 'SimpleImputer', 'strategy': 'median'}. Best is trial 1 with value: 0.22408387266657082.
running
[I 2024-11-05 20:13:42,892] Trial 18 finished with value: 0.4027684591544901 and parameters: {'model_name': 'SimpleImputer', 'strategy': 'constant'}. Best is trial 1 with value: 0.22408387266657082.
[I 2024-11-05 20:13:42,983] Trial 17 finished with value: 0.4027684591544901 and parameters: {'model_name': 'SimpleImputer', 'strategy': 'constant'}. Best is trial 1 with value: 0.22408387266657082.
[I 2024-11-05 20:13:43,074] Trial 6 finished with value: 0.4027684591544901 and parameters: {'model_name': 'SimpleImputer', 'strategy': 'most_frequent'}. Best is trial 1 with value: 0.22408387266657082.
running
[I 2024-11-05 20:13:43,165] Trial 8 finished with value: 0.4027684591544901 and parameters: {'model_name': 'SimpleImputer', 'strategy': 'most_frequent'}. Best is trial 1 with value: 0.22408387266657082.
[I 2024-11-05 20:13:43,252] Trial 22 finished with value: 0.22408387266657082 and parameters: {'model_name': 'SimpleImputer', 'strategy': 'mean'}. Best is trial 1 with value: 0.22408387266657082.
running
running
running
[I 2024-11-05 20:13:43,393] Trial 11 finished with value: 0.4027684591544901 and parameters: {'model_name': 'SimpleImputer', 'strategy': 'most_frequent'}. Best is trial 1 with value: 0.22408387266657082.
[I 2024-11-05 20:13:43,486] Trial 10 finished with value: 0.23072739848771917 and parameters: {'model_name': 'SimpleImputer', 'strategy': 'median'}. Best is trial 1 with value: 0.22408387266657082.
running
running
running
[I 2024-11-05 20:13:43,733] Trial 23 finished with value: 0.22408387266657082 and parameters: {'model_name': 'SimpleImputer', 'strategy': 'mean'}. Best is trial 1 with value: 0.22408387266657082.
running
[I 2024-11-05 20:13:44,042] Trial 20 finished with value: 0.4027684591544901 and parameters: {'model_name': 'SimpleImputer', 'strategy': 'most_frequent'}. Best is trial 1 with value: 0.22408387266657082.
[I 2024-11-05 20:13:44,147] Trial 21 finished with value: 0.23072739848771917 and parameters: {'model_name': 'SimpleImputer', 'strategy': 'median'}. Best is trial 1 with value: 0.22408387266657082.
running
running
[I 2024-11-05 20:13:44,259] Trial 19 finished with value: 0.23072739848771917 and parameters: {'model_name': 'SimpleImputer', 'strategy': 'median'}. Best is trial 1 with value: 0.22408387266657082.
running
[I 2024-11-05 20:13:44,407] Trial 29 finished with value: 0.22408387266657082 and parameters: {'model_name': 'SimpleImputer', 'strategy': 'mean'}. Best is trial 1 with value: 0.22408387266657082.
running
[I 2024-11-05 20:13:44,540] Trial 33 finished with value: 0.22408387266657082 and parameters: {'model_name': 'SimpleImputer', 'strategy': 'mean'}. Best is trial 1 with value: 0.22408387266657082.
[I 2024-11-05 20:13:44,635] Trial 32 finished with value: 0.22408387266657082 and parameters: {'model_name': 'SimpleImputer', 'strategy': 'mean'}. Best is trial 1 with value: 0.22408387266657082.
running
[I 2024-11-05 20:13:44,743] Trial 25 finished with value: 0.4027684591544901 and parameters: {'model_name': 'SimpleImputer', 'strategy': 'most_frequent'}. Best is trial 1 with value: 0.22408387266657082.
running
running
[I 2024-11-05 20:13:44,851] Trial 35 finished with value: 0.22408387266657082 and parameters: {'model_name': 'SimpleImputer', 'strategy': 'mean'}. Best is trial 1 with value: 0.22408387266657082.
[I 2024-11-05 20:13:44,934] Trial 30 finished with value: 0.22408387266657082 and parameters: {'model_name': 'SimpleImputer', 'strategy': 'mean'}. Best is trial 1 with value: 0.22408387266657082.
[I 2024-11-05 20:13:45,022] Trial 31 finished with value: 0.22408387266657082 and parameters: {'model_name': 'SimpleImputer', 'strategy': 'mean'}. Best is trial 1 with value: 0.22408387266657082.
running
[I 2024-11-05 20:13:45,125] Trial 34 finished with value: 0.22408387266657082 and parameters: {'model_name': 'SimpleImputer', 'strategy': 'mean'}. Best is trial 1 with value: 0.22408387266657082.
running
running
running
[I 2024-11-05 20:13:45,231] Trial 24 finished with value: 0.4027684591544901 and parameters: {'model_name': 'SimpleImputer', 'strategy': 'most_frequent'}. Best is trial 1 with value: 0.22408387266657082.
running
[I 2024-11-05 20:13:45,339] Trial 36 finished with value: 0.22408387266657082 and parameters: {'model_name': 'SimpleImputer', 'strategy': 'mean'}. Best is trial 1 with value: 0.22408387266657082.
[I 2024-11-05 20:13:45,422] Trial 26 finished with value: 0.4027684591544901 and parameters: {'model_name': 'SimpleImputer', 'strategy': 'most_frequent'}. Best is trial 1 with value: 0.22408387266657082.
running
running
[I 2024-11-05 20:13:45,540] Trial 27 finished with value: 0.4027684591544901 and parameters: {'model_name': 'SimpleImputer', 'strategy': 'most_frequent'}. Best is trial 1 with value: 0.22408387266657082.
running
[I 2024-11-05 20:13:45,678] Trial 28 finished with value: 0.4027684591544901 and parameters: {'model_name': 'SimpleImputer', 'strategy': 'most_frequent'}. Best is trial 1 with value: 0.22408387266657082.
running
[I 2024-11-05 20:13:45,969] Trial 39 finished with value: 0.22408387266657082 and parameters: {'model_name': 'SimpleImputer', 'strategy': 'mean'}. Best is trial 1 with value: 0.22408387266657082.
running
[I 2024-11-05 20:13:46,096] Trial 40 finished with value: 0.22408387266657082 and parameters: {'model_name': 'SimpleImputer', 'strategy': 'mean'}. Best is trial 1 with value: 0.22408387266657082.
[I 2024-11-05 20:13:46,199] Trial 43 finished with value: 0.22408387266657082 and parameters: {'model_name': 'SimpleImputer', 'strategy': 'mean'}. Best is trial 1 with value: 0.22408387266657082.
running
[I 2024-11-05 20:13:46,293] Trial 38 finished with value: 0.22408387266657082 and parameters: {'model_name': 'SimpleImputer', 'strategy': 'mean'}. Best is trial 1 with value: 0.22408387266657082.
[I 2024-11-05 20:13:46,380] Trial 37 finished with value: 0.22408387266657082 and parameters: {'model_name': 'SimpleImputer', 'strategy': 'mean'}. Best is trial 1 with value: 0.22408387266657082.
[I 2024-11-05 20:13:46,461] Trial 51 finished with value: 0.22408387266657082 and parameters: {'model_name': 'SimpleImputer', 'strategy': 'mean'}. Best is trial 1 with value: 0.22408387266657082.
running
[I 2024-11-05 20:13:46,575] Trial 48 finished with value: 0.22408387266657082 and parameters: {'model_name': 'SimpleImputer', 'strategy': 'mean'}. Best is trial 1 with value: 0.22408387266657082.
running
running
running
[I 2024-11-05 20:13:46,700] Trial 46 finished with value: 0.22408387266657082 and parameters: {'model_name': 'SimpleImputer', 'strategy': 'mean'}. Best is trial 1 with value: 0.22408387266657082.
[I 2024-11-05 20:13:46,795] Trial 41 finished with value: 0.22408387266657082 and parameters: {'model_name': 'SimpleImputer', 'strategy': 'mean'}. Best is trial 1 with value: 0.22408387266657082.
running
running
running
[I 2024-11-05 20:13:46,966] Trial 42 finished with value: 0.22408387266657082 and parameters: {'model_name': 'SimpleImputer', 'strategy': 'mean'}. Best is trial 1 with value: 0.22408387266657082.
[I 2024-11-05 20:13:47,064] Trial 45 finished with value: 0.22408387266657082 and parameters: {'model_name': 'SimpleImputer', 'strategy': 'mean'}. Best is trial 1 with value: 0.22408387266657082.
running
[I 2024-11-05 20:13:47,151] Trial 44 finished with value: 0.22408387266657082 and parameters: {'model_name': 'SimpleImputer', 'strategy': 'mean'}. Best is trial 1 with value: 0.22408387266657082.
running
running
[I 2024-11-05 20:13:47,251] Trial 49 finished with value: 0.22408387266657082 and parameters: {'model_name': 'SimpleImputer', 'strategy': 'mean'}. Best is trial 1 with value: 0.22408387266657082.
[I 2024-11-05 20:13:47,357] Trial 50 finished with value: 0.22408387266657082 and parameters: {'model_name': 'SimpleImputer', 'strategy': 'mean'}. Best is trial 1 with value: 0.22408387266657082.
running
[I 2024-11-05 20:13:47,461] Trial 52 finished with value: 0.22408387266657082 and parameters: {'model_name': 'SimpleImputer', 'strategy': 'mean'}. Best is trial 1 with value: 0.22408387266657082.
running
[I 2024-11-05 20:13:47,559] Trial 47 finished with value: 0.22408387266657082 and parameters: {'model_name': 'SimpleImputer', 'strategy': 'mean'}. Best is trial 1 with value: 0.22408387266657082.
running
running
[I 2024-11-05 20:13:47,771] Trial 55 finished with value: 0.22408387266657082 and parameters: {'model_name': 'SimpleImputer', 'strategy': 'mean'}. Best is trial 1 with value: 0.22408387266657082.
running
[I 2024-11-05 20:13:47,920] Trial 53 finished with value: 0.22408387266657082 and parameters: {'model_name': 'SimpleImputer', 'strategy': 'mean'}. Best is trial 1 with value: 0.22408387266657082.
running
[I 2024-11-05 20:13:48,057] Trial 60 finished with value: 0.22408387266657082 and parameters: {'model_name': 'SimpleImputer', 'strategy': 'mean'}. Best is trial 1 with value: 0.22408387266657082.
running
[I 2024-11-05 20:13:48,274] Trial 58 finished with value: 0.22408387266657082 and parameters: {'model_name': 'SimpleImputer', 'strategy': 'mean'}. Best is trial 1 with value: 0.22408387266657082.
[I 2024-11-05 20:13:48,389] Trial 57 finished with value: 0.22408387266657082 and parameters: {'model_name': 'SimpleImputer', 'strategy': 'mean'}. Best is trial 1 with value: 0.22408387266657082.
[I 2024-11-05 20:13:48,477] Trial 64 finished with value: 0.4027684591544901 and parameters: {'model_name': 'SimpleImputer', 'strategy': 'constant'}. Best is trial 1 with value: 0.22408387266657082.
running
[I 2024-11-05 20:13:48,566] Trial 63 finished with value: 0.4027684591544901 and parameters: {'model_name': 'SimpleImputer', 'strategy': 'constant'}. Best is trial 1 with value: 0.22408387266657082.
[I 2024-11-05 20:13:48,676] Trial 54 finished with value: 0.22408387266657082 and parameters: {'model_name': 'SimpleImputer', 'strategy': 'mean'}. Best is trial 1 with value: 0.22408387266657082.
[I 2024-11-05 20:13:48,766] Trial 62 finished with value: 0.4027684591544901 and parameters: {'model_name': 'SimpleImputer', 'strategy': 'constant'}. Best is trial 1 with value: 0.22408387266657082.
running
[I 2024-11-05 20:13:48,852] Trial 59 finished with value: 0.22408387266657082 and parameters: {'model_name': 'SimpleImputer', 'strategy': 'mean'}. Best is trial 1 with value: 0.22408387266657082.
[I 2024-11-05 20:13:48,933] Trial 68 finished with value: 0.4027684591544901 and parameters: {'model_name': 'SimpleImputer', 'strategy': 'constant'}. Best is trial 1 with value: 0.22408387266657082.
[I 2024-11-05 20:13:49,016] Trial 69 finished with value: 0.4027684591544901 and parameters: {'model_name': 'SimpleImputer', 'strategy': 'constant'}. Best is trial 1 with value: 0.22408387266657082.
[I 2024-11-05 20:13:49,103] Trial 66 finished with value: 0.4027684591544901 and parameters: {'model_name': 'SimpleImputer', 'strategy': 'constant'}. Best is trial 1 with value: 0.22408387266657082.
running
[I 2024-11-05 20:13:49,189] Trial 56 finished with value: 0.22408387266657082 and parameters: {'model_name': 'SimpleImputer', 'strategy': 'mean'}. Best is trial 1 with value: 0.22408387266657082.
running
[I 2024-11-05 20:13:49,275] Trial 65 finished with value: 0.4027684591544901 and parameters: {'model_name': 'SimpleImputer', 'strategy': 'constant'}. Best is trial 1 with value: 0.22408387266657082.
[I 2024-11-05 20:13:49,381] Trial 67 finished with value: 0.4027684591544901 and parameters: {'model_name': 'SimpleImputer', 'strategy': 'constant'}. Best is trial 1 with value: 0.22408387266657082.
running
[I 2024-11-05 20:13:49,474] Trial 61 finished with value: 0.22408387266657082 and parameters: {'model_name': 'SimpleImputer', 'strategy': 'mean'}. Best is trial 1 with value: 0.22408387266657082.
running
running
running
running
running
running
running
running
[I 2024-11-05 20:13:49,665] Trial 71 finished with value: 0.4027684591544901 and parameters: {'model_name': 'SimpleImputer', 'strategy': 'constant'}. Best is trial 1 with value: 0.22408387266657082.
[I 2024-11-05 20:13:49,766] Trial 70 finished with value: 0.4027684591544901 and parameters: {'model_name': 'SimpleImputer', 'strategy': 'constant'}. Best is trial 1 with value: 0.22408387266657082.
running
running
running
[I 2024-11-05 20:13:50,189] Trial 72 finished with value: 0.23072739848771917 and parameters: {'model_name': 'SimpleImputer', 'strategy': 'median'}. Best is trial 1 with value: 0.22408387266657082.
running
[I 2024-11-05 20:13:50,384] Trial 74 finished with value: 0.23072739848771917 and parameters: {'model_name': 'SimpleImputer', 'strategy': 'median'}. Best is trial 1 with value: 0.22408387266657082.
[I 2024-11-05 20:13:50,484] Trial 87 finished with value: 0.23072739848771917 and parameters: {'model_name': 'SimpleImputer', 'strategy': 'median'}. Best is trial 1 with value: 0.22408387266657082.
running
[I 2024-11-05 20:13:50,602] Trial 86 finished with value: 0.23072739848771917 and parameters: {'model_name': 'SimpleImputer', 'strategy': 'median'}. Best is trial 1 with value: 0.22408387266657082.
[I 2024-11-05 20:13:50,693] Trial 78 finished with value: 0.23072739848771917 and parameters: {'model_name': 'SimpleImputer', 'strategy': 'median'}. Best is trial 1 with value: 0.22408387266657082.
running
running
running
[I 2024-11-05 20:13:50,821] Trial 75 finished with value: 0.23072739848771917 and parameters: {'model_name': 'SimpleImputer', 'strategy': 'median'}. Best is trial 1 with value: 0.22408387266657082.
running
[I 2024-11-05 20:13:50,940] Trial 73 finished with value: 0.23072739848771917 and parameters: {'model_name': 'SimpleImputer', 'strategy': 'median'}. Best is trial 1 with value: 0.22408387266657082.
running
[I 2024-11-05 20:13:51,050] Trial 77 finished with value: 0.23072739848771917 and parameters: {'model_name': 'SimpleImputer', 'strategy': 'median'}. Best is trial 1 with value: 0.22408387266657082.
[I 2024-11-05 20:13:51,135] Trial 82 finished with value: 0.23072739848771917 and parameters: {'model_name': 'SimpleImputer', 'strategy': 'median'}. Best is trial 1 with value: 0.22408387266657082.
running
running
[I 2024-11-05 20:13:51,245] Trial 80 finished with value: 0.23072739848771917 and parameters: {'model_name': 'SimpleImputer', 'strategy': 'median'}. Best is trial 1 with value: 0.22408387266657082.
[I 2024-11-05 20:13:51,359] Trial 85 finished with value: 0.23072739848771917 and parameters: {'model_name': 'SimpleImputer', 'strategy': 'median'}. Best is trial 1 with value: 0.22408387266657082.
[I 2024-11-05 20:13:51,444] Trial 81 finished with value: 0.23072739848771917 and parameters: {'model_name': 'SimpleImputer', 'strategy': 'median'}. Best is trial 1 with value: 0.22408387266657082.
running
running
[I 2024-11-05 20:13:51,538] Trial 79 finished with value: 0.23072739848771917 and parameters: {'model_name': 'SimpleImputer', 'strategy': 'median'}. Best is trial 1 with value: 0.22408387266657082.
[I 2024-11-05 20:13:51,620] Trial 84 finished with value: 0.23072739848771917 and parameters: {'model_name': 'SimpleImputer', 'strategy': 'median'}. Best is trial 1 with value: 0.22408387266657082.
running
running
running
[I 2024-11-05 20:13:51,767] Trial 76 finished with value: 0.23072739848771917 and parameters: {'model_name': 'SimpleImputer', 'strategy': 'median'}. Best is trial 1 with value: 0.22408387266657082.
running
[I 2024-11-05 20:13:51,910] Trial 83 finished with value: 0.23072739848771917 and parameters: {'model_name': 'SimpleImputer', 'strategy': 'median'}. Best is trial 1 with value: 0.22408387266657082.
running
[I 2024-11-05 20:13:52,265] Trial 89 finished with value: 0.22408387266657082 and parameters: {'model_name': 'SimpleImputer', 'strategy': 'mean'}. Best is trial 1 with value: 0.22408387266657082.
running
[I 2024-11-05 20:13:52,383] Trial 95 finished with value: 0.22408387266657082 and parameters: {'model_name': 'SimpleImputer', 'strategy': 'mean'}. Best is trial 1 with value: 0.22408387266657082.
running
[I 2024-11-05 20:13:52,507] Trial 97 finished with value: 0.22408387266657082 and parameters: {'model_name': 'SimpleImputer', 'strategy': 'mean'}. Best is trial 1 with value: 0.22408387266657082.
running
[I 2024-11-05 20:13:52,623] Trial 96 finished with value: 0.22408387266657082 and parameters: {'model_name': 'SimpleImputer', 'strategy': 'mean'}. Best is trial 1 with value: 0.22408387266657082.
[I 2024-11-05 20:13:52,717] Trial 88 finished with value: 0.23072739848771917 and parameters: {'model_name': 'SimpleImputer', 'strategy': 'median'}. Best is trial 1 with value: 0.22408387266657082.
running
running
[I 2024-11-05 20:13:52,850] Trial 103 finished with value: 0.22408387266657082 and parameters: {'model_name': 'SimpleImputer', 'strategy': 'mean'}. Best is trial 1 with value: 0.22408387266657082.
[I 2024-11-05 20:13:52,948] Trial 99 finished with value: 0.22408387266657082 and parameters: {'model_name': 'SimpleImputer', 'strategy': 'mean'}. Best is trial 1 with value: 0.22408387266657082.
running
[I 2024-11-05 20:13:53,056] Trial 101 finished with value: 0.22408387266657082 and parameters: {'model_name': 'SimpleImputer', 'strategy': 'mean'}. Best is trial 1 with value: 0.22408387266657082.
running
running
[I 2024-11-05 20:13:53,216] Trial 98 finished with value: 0.22408387266657082 and parameters: {'model_name': 'SimpleImputer', 'strategy': 'mean'}. Best is trial 1 with value: 0.22408387266657082.
[I 2024-11-05 20:13:53,324] Trial 100 finished with value: 0.22408387266657082 and parameters: {'model_name': 'SimpleImputer', 'strategy': 'mean'}. Best is trial 1 with value: 0.22408387266657082.
running
[I 2024-11-05 20:13:53,447] Trial 102 finished with value: 0.22408387266657082 and parameters: {'model_name': 'SimpleImputer', 'strategy': 'mean'}. Best is trial 1 with value: 0.22408387266657082.
running
running
[I 2024-11-05 20:13:53,596] Trial 94 finished with value: 0.4027684591544901 and parameters: {'model_name': 'SimpleImputer', 'strategy': 'most_frequent'}. Best is trial 1 with value: 0.22408387266657082.
[I 2024-11-05 20:13:53,694] Trial 90 finished with value: 0.4027684591544901 and parameters: {'model_name': 'SimpleImputer', 'strategy': 'most_frequent'}. Best is trial 1 with value: 0.22408387266657082.
running
running
[I 2024-11-05 20:13:53,831] Trial 91 finished with value: 0.4027684591544901 and parameters: {'model_name': 'SimpleImputer', 'strategy': 'most_frequent'}. Best is trial 1 with value: 0.22408387266657082.
running
[I 2024-11-05 20:13:53,946] Trial 92 finished with value: 0.4027684591544901 and parameters: {'model_name': 'SimpleImputer', 'strategy': 'most_frequent'}. Best is trial 1 with value: 0.22408387266657082.
