[I 2024-11-06 05:53:27,129] Trial 105 finished with value: 0.2612869777929152 and parameters: {'model_name': 'SimpleImputer', 'strategy': 'mean'}. Best is trial 3 with value: 0.2612869777929152.
running
running
running
[I 2024-11-06 05:53:27,207] Trial 98 finished with value: 0.3566244763222259 and parameters: {'model_name': 'SimpleImputer', 'strategy': 'median'}. Best is trial 3 with value: 0.2612869777929152.
running
[I 2024-11-06 05:53:27,328] Trial 107 finished with value: 0.2612869777929152 and parameters: {'model_name': 'SimpleImputer', 'strategy': 'mean'}. Best is trial 3 with value: 0.2612869777929152.
running
[I 2024-11-06 05:53:27,427] Trial 106 finished with value: 0.2612869777929152 and parameters: {'model_name': 'SimpleImputer', 'strategy': 'mean'}. Best is trial 3 with value: 0.2612869777929152.
[I 2024-11-06 05:53:27,502] Trial 108 finished with value: 0.2612869777929152 and parameters: {'model_name': 'SimpleImputer', 'strategy': 'mean'}. Best is trial 3 with value: 0.2612869777929152.
running
[I 2024-11-06 05:53:27,577] Trial 109 finished with value: 0.2612869777929152 and parameters: {'model_name': 'SimpleImputer', 'strategy': 'mean'}. Best is trial 3 with value: 0.2612869777929152.
running
running
[I 2024-11-06 05:53:27,671] Trial 110 finished with value: 0.2612869777929152 and parameters: {'model_name': 'SimpleImputer', 'strategy': 'mean'}. Best is trial 3 with value: 0.2612869777929152.
running
[I 2024-11-06 05:53:27,748] Trial 111 finished with value: 0.2612869777929152 and parameters: {'model_name': 'SimpleImputer', 'strategy': 'mean'}. Best is trial 3 with value: 0.2612869777929152.
running
[I 2024-11-06 05:53:27,837] Trial 113 finished with value: 0.2612869777929152 and parameters: {'model_name': 'SimpleImputer', 'strategy': 'mean'}. Best is trial 3 with value: 0.2612869777929152.
[I 2024-11-06 05:53:27,905] Trial 112 finished with value: 0.2612869777929152 and parameters: {'model_name': 'SimpleImputer', 'strategy': 'mean'}. Best is trial 3 with value: 0.2612869777929152.
running
running
[I 2024-11-06 05:53:28,005] Trial 117 finished with value: 0.2612869777929152 and parameters: {'model_name': 'SimpleImputer', 'strategy': 'mean'}. Best is trial 3 with value: 0.2612869777929152.
[I 2024-11-06 05:53:28,081] Trial 116 finished with value: 0.2612869777929152 and parameters: {'model_name': 'SimpleImputer', 'strategy': 'mean'}. Best is trial 3 with value: 0.2612869777929152.
running
running
[I 2024-11-06 05:53:28,153] Trial 114 finished with value: 0.2612869777929152 and parameters: {'model_name': 'SimpleImputer', 'strategy': 'mean'}. Best is trial 3 with value: 0.2612869777929152.
[I 2024-11-06 05:53:28,216] Trial 119 finished with value: 0.2612869777929152 and parameters: {'model_name': 'SimpleImputer', 'strategy': 'mean'}. Best is trial 3 with value: 0.2612869777929152.
[I 2024-11-06 05:53:28,276] Trial 120 finished with value: 0.2612869777929152 and parameters: {'model_name': 'SimpleImputer', 'strategy': 'mean'}. Best is trial 3 with value: 0.2612869777929152.
running
running
running
[I 2024-11-06 05:53:28,345] Trial 115 finished with value: 0.2612869777929152 and parameters: {'model_name': 'SimpleImputer', 'strategy': 'mean'}. Best is trial 3 with value: 0.2612869777929152.
running
[I 2024-11-06 05:53:28,416] Trial 121 finished with value: 0.2612869777929152 and parameters: {'model_name': 'SimpleImputer', 'strategy': 'mean'}. Best is trial 3 with value: 0.2612869777929152.
[I 2024-11-06 05:53:28,417] Trial 118 finished with value: 0.2612869777929152 and parameters: {'model_name': 'SimpleImputer', 'strategy': 'mean'}. Best is trial 3 with value: 0.2612869777929152.
running
running
[I 2024-11-06 05:53:28,606] Trial 122 finished with value: 0.2612869777929152 and parameters: {'model_name': 'SimpleImputer', 'strategy': 'mean'}. Best is trial 3 with value: 0.2612869777929152.
[I 2024-11-06 05:53:28,694] Trial 124 finished with value: 0.2612869777929152 and parameters: {'model_name': 'SimpleImputer', 'strategy': 'mean'}. Best is trial 3 with value: 0.2612869777929152.
running
running
[I 2024-11-06 05:53:28,782] Trial 123 finished with value: 0.2612869777929152 and parameters: {'model_name': 'SimpleImputer', 'strategy': 'mean'}. Best is trial 3 with value: 0.2612869777929152.
[I 2024-11-06 05:53:28,850] Trial 125 finished with value: 0.2612869777929152 and parameters: {'model_name': 'SimpleImputer', 'strategy': 'mean'}. Best is trial 3 with value: 0.2612869777929152.
running
running
[I 2024-11-06 05:53:28,939] Trial 126 finished with value: 0.2612869777929152 and parameters: {'model_name': 'SimpleImputer', 'strategy': 'mean'}. Best is trial 3 with value: 0.2612869777929152.
running
[I 2024-11-06 05:53:29,017] Trial 127 finished with value: 0.2612869777929152 and parameters: {'model_name': 'SimpleImputer', 'strategy': 'mean'}. Best is trial 3 with value: 0.2612869777929152.
running
[I 2024-11-06 05:53:29,099] Trial 129 finished with value: 0.2612869777929152 and parameters: {'model_name': 'SimpleImputer', 'strategy': 'mean'}. Best is trial 3 with value: 0.2612869777929152.
running
[I 2024-11-06 05:53:29,179] Trial 128 finished with value: 0.2612869777929152 and parameters: {'model_name': 'SimpleImputer', 'strategy': 'mean'}. Best is trial 3 with value: 0.2612869777929152.
running
[I 2024-11-06 05:53:29,282] Trial 131 finished with value: 0.2612869777929152 and parameters: {'model_name': 'SimpleImputer', 'strategy': 'mean'}. Best is trial 3 with value: 0.2612869777929152.
running
[I 2024-11-06 05:53:29,382] Trial 130 finished with value: 0.2612869777929152 and parameters: {'model_name': 'SimpleImputer', 'strategy': 'mean'}. Best is trial 3 with value: 0.2612869777929152.
running
[I 2024-11-06 05:53:29,463] Trial 135 finished with value: 0.2612869777929152 and parameters: {'model_name': 'SimpleImputer', 'strategy': 'mean'}. Best is trial 3 with value: 0.2612869777929152.
running
[I 2024-11-06 05:53:29,641] Trial 141 finished with value: 0.2612869777929152 and parameters: {'model_name': 'SimpleImputer', 'strategy': 'mean'}. Best is trial 3 with value: 0.2612869777929152.
[I 2024-11-06 05:53:29,731] Trial 134 finished with value: 0.3572865821841743 and parameters: {'model_name': 'SimpleImputer', 'strategy': 'most_frequent'}. Best is trial 3 with value: 0.2612869777929152.
running
running
[I 2024-11-06 05:53:29,810] Trial 133 finished with value: 0.3572865821841743 and parameters: {'model_name': 'SimpleImputer', 'strategy': 'most_frequent'}. Best is trial 3 with value: 0.2612869777929152.
[I 2024-11-06 05:53:29,886] Trial 137 finished with value: 0.3572865821841743 and parameters: {'model_name': 'SimpleImputer', 'strategy': 'most_frequent'}. Best is trial 3 with value: 0.2612869777929152.
running
[I 2024-11-06 05:53:29,955] Trial 136 finished with value: 0.3572865821841743 and parameters: {'model_name': 'SimpleImputer', 'strategy': 'most_frequent'}. Best is trial 3 with value: 0.2612869777929152.
running
running
[I 2024-11-06 05:53:30,047] Trial 132 finished with value: 0.3572865821841743 and parameters: {'model_name': 'SimpleImputer', 'strategy': 'most_frequent'}. Best is trial 3 with value: 0.2612869777929152.
running
[I 2024-11-06 05:53:30,127] Trial 138 finished with value: 0.3572865821841743 and parameters: {'model_name': 'SimpleImputer', 'strategy': 'most_frequent'}. Best is trial 3 with value: 0.2612869777929152.
running
[I 2024-11-06 05:53:30,228] Trial 140 finished with value: 0.3572865821841743 and parameters: {'model_name': 'SimpleImputer', 'strategy': 'most_frequent'}. Best is trial 3 with value: 0.2612869777929152.
[I 2024-11-06 05:53:30,293] Trial 139 finished with value: 0.3572865821841743 and parameters: {'model_name': 'SimpleImputer', 'strategy': 'most_frequent'}. Best is trial 3 with value: 0.2612869777929152.
running
running
[I 2024-11-06 05:53:30,389] Trial 142 finished with value: 0.3572865821841743 and parameters: {'model_name': 'SimpleImputer', 'strategy': 'most_frequent'}. Best is trial 3 with value: 0.2612869777929152.
running
[I 2024-11-06 05:53:30,500] Trial 143 finished with value: 0.3572865821841743 and parameters: {'model_name': 'SimpleImputer', 'strategy': 'most_frequent'}. Best is trial 3 with value: 0.2612869777929152.
running
[I 2024-11-06 05:53:30,587] Trial 145 finished with value: 0.3572865821841743 and parameters: {'model_name': 'SimpleImputer', 'strategy': 'most_frequent'}. Best is trial 3 with value: 0.2612869777929152.
[I 2024-11-06 05:53:30,655] Trial 144 finished with value: 0.3572865821841743 and parameters: {'model_name': 'SimpleImputer', 'strategy': 'most_frequent'}. Best is trial 3 with value: 0.2612869777929152.
running
running
[I 2024-11-06 05:53:30,747] Trial 147 finished with value: 0.3572865821841743 and parameters: {'model_name': 'SimpleImputer', 'strategy': 'most_frequent'}. Best is trial 3 with value: 0.2612869777929152.
running
[I 2024-11-06 05:53:30,845] Trial 146 finished with value: 0.3572865821841743 and parameters: {'model_name': 'SimpleImputer', 'strategy': 'most_frequent'}. Best is trial 3 with value: 0.2612869777929152.
[I 2024-11-06 05:53:30,917] Trial 148 finished with value: 0.3572865821841743 and parameters: {'model_name': 'SimpleImputer', 'strategy': 'most_frequent'}. Best is trial 3 with value: 0.2612869777929152.
running
running
[I 2024-11-06 05:53:30,992] Trial 149 finished with value: 0.2612869777929152 and parameters: {'model_name': 'SimpleImputer', 'strategy': 'mean'}. Best is trial 3 with value: 0.2612869777929152.
[I 2024-11-06 05:53:31,059] Trial 152 finished with value: 0.2612869777929152 and parameters: {'model_name': 'SimpleImputer', 'strategy': 'mean'}. Best is trial 3 with value: 0.2612869777929152.
[I 2024-11-06 05:53:31,059] Trial 151 finished with value: 0.2612869777929152 and parameters: {'model_name': 'SimpleImputer', 'strategy': 'mean'}. Best is trial 3 with value: 0.2612869777929152.
running
[I 2024-11-06 05:53:31,060] Trial 150 finished with value: 0.2612869777929152 and parameters: {'model_name': 'SimpleImputer', 'strategy': 'mean'}. Best is trial 3 with value: 0.2612869777929152.
[I 2024-11-06 05:53:31,249] Trial 153 finished with value: 0.2612869777929152 and parameters: {'model_name': 'SimpleImputer', 'strategy': 'mean'}. Best is trial 3 with value: 0.2612869777929152.
running
running
running
running
[I 2024-11-06 05:53:31,336] Trial 154 finished with value: 0.2612869777929152 and parameters: {'model_name': 'SimpleImputer', 'strategy': 'mean'}. Best is trial 3 with value: 0.2612869777929152.
running
[I 2024-11-06 05:53:31,413] Trial 155 finished with value: 0.2612869777929152 and parameters: {'model_name': 'SimpleImputer', 'strategy': 'mean'}. Best is trial 3 with value: 0.2612869777929152.
running
[I 2024-11-06 05:53:31,493] Trial 157 finished with value: 0.2612869777929152 and parameters: {'model_name': 'SimpleImputer', 'strategy': 'mean'}. Best is trial 3 with value: 0.2612869777929152.
running
[I 2024-11-06 05:53:31,574] Trial 156 finished with value: 0.2612869777929152 and parameters: {'model_name': 'SimpleImputer', 'strategy': 'mean'}. Best is trial 3 with value: 0.2612869777929152.
running
[I 2024-11-06 05:53:31,696] Trial 158 finished with value: 0.2612869777929152 and parameters: {'model_name': 'SimpleImputer', 'strategy': 'mean'}. Best is trial 3 with value: 0.2612869777929152.
running
[I 2024-11-06 05:53:31,794] Trial 159 finished with value: 0.2612869777929152 and parameters: {'model_name': 'SimpleImputer', 'strategy': 'mean'}. Best is trial 3 with value: 0.2612869777929152.
running
[I 2024-11-06 05:53:31,881] Trial 160 finished with value: 0.2612869777929152 and parameters: {'model_name': 'SimpleImputer', 'strategy': 'mean'}. Best is trial 3 with value: 0.2612869777929152.
running
[I 2024-11-06 05:53:31,957] Trial 161 finished with value: 0.2612869777929152 and parameters: {'model_name': 'SimpleImputer', 'strategy': 'mean'}. Best is trial 3 with value: 0.2612869777929152.
running
[I 2024-11-06 05:53:32,030] Trial 162 finished with value: 0.2612869777929152 and parameters: {'model_name': 'SimpleImputer', 'strategy': 'mean'}. Best is trial 3 with value: 0.2612869777929152.
running
[I 2024-11-06 05:53:32,131] Trial 164 finished with value: 0.2612869777929152 and parameters: {'model_name': 'SimpleImputer', 'strategy': 'mean'}. Best is trial 3 with value: 0.2612869777929152.
running
[I 2024-11-06 05:53:32,213] Trial 163 finished with value: 0.2612869777929152 and parameters: {'model_name': 'SimpleImputer', 'strategy': 'mean'}. Best is trial 3 with value: 0.2612869777929152.
running
[I 2024-11-06 05:53:32,293] Trial 166 finished with value: 0.2612869777929152 and parameters: {'model_name': 'SimpleImputer', 'strategy': 'mean'}. Best is trial 3 with value: 0.2612869777929152.
[I 2024-11-06 05:53:32,366] Trial 167 finished with value: 0.2612869777929152 and parameters: {'model_name': 'SimpleImputer', 'strategy': 'mean'}. Best is trial 3 with value: 0.2612869777929152.
[I 2024-11-06 05:53:32,434] Trial 170 finished with value: 0.2612869777929152 and parameters: {'model_name': 'SimpleImputer', 'strategy': 'mean'}. Best is trial 3 with value: 0.2612869777929152.
running
running
[I 2024-11-06 05:53:32,514] Trial 169 finished with value: 0.2612869777929152 and parameters: {'model_name': 'SimpleImputer', 'strategy': 'mean'}. Best is trial 3 with value: 0.2612869777929152.
running
running
[I 2024-11-06 05:53:32,583] Trial 168 finished with value: 0.2612869777929152 and parameters: {'model_name': 'SimpleImputer', 'strategy': 'mean'}. Best is trial 3 with value: 0.2612869777929152.
[I 2024-11-06 05:53:32,651] Trial 165 finished with value: 0.2612869777929152 and parameters: {'model_name': 'SimpleImputer', 'strategy': 'mean'}. Best is trial 3 with value: 0.2612869777929152.
running
running
[I 2024-11-06 05:53:32,727] Trial 171 finished with value: 0.2612869777929152 and parameters: {'model_name': 'SimpleImputer', 'strategy': 'mean'}. Best is trial 3 with value: 0.2612869777929152.
running
[I 2024-11-06 05:53:32,803] Trial 172 finished with value: 0.2612869777929152 and parameters: {'model_name': 'SimpleImputer', 'strategy': 'mean'}. Best is trial 3 with value: 0.2612869777929152.
running
[I 2024-11-06 05:53:32,881] Trial 173 finished with value: 0.2612869777929152 and parameters: {'model_name': 'SimpleImputer', 'strategy': 'mean'}. Best is trial 3 with value: 0.2612869777929152.
running
[I 2024-11-06 05:53:33,005] Trial 175 finished with value: 0.2612869777929152 and parameters: {'model_name': 'SimpleImputer', 'strategy': 'mean'}. Best is trial 3 with value: 0.2612869777929152.
running
[I 2024-11-06 05:53:33,097] Trial 174 finished with value: 0.2612869777929152 and parameters: {'model_name': 'SimpleImputer', 'strategy': 'mean'}. Best is trial 3 with value: 0.2612869777929152.
running
[I 2024-11-06 05:53:33,172] Trial 176 finished with value: 0.2612869777929152 and parameters: {'model_name': 'SimpleImputer', 'strategy': 'mean'}. Best is trial 3 with value: 0.2612869777929152.
running
[I 2024-11-06 05:53:33,248] Trial 177 finished with value: 0.2612869777929152 and parameters: {'model_name': 'SimpleImputer', 'strategy': 'mean'}. Best is trial 3 with value: 0.2612869777929152.
running
[I 2024-11-06 05:53:33,324] Trial 178 finished with value: 0.2612869777929152 and parameters: {'model_name': 'SimpleImputer', 'strategy': 'mean'}. Best is trial 3 with value: 0.2612869777929152.
running
[I 2024-11-06 05:53:33,451] Trial 179 finished with value: 0.2612869777929152 and parameters: {'model_name': 'SimpleImputer', 'strategy': 'mean'}. Best is trial 3 with value: 0.2612869777929152.
running
[I 2024-11-06 05:53:33,530] Trial 182 finished with value: 0.2612869777929152 and parameters: {'model_name': 'SimpleImputer', 'strategy': 'mean'}. Best is trial 3 with value: 0.2612869777929152.
running
[I 2024-11-06 05:53:33,622] Trial 181 finished with value: 0.2612869777929152 and parameters: {'model_name': 'SimpleImputer', 'strategy': 'mean'}. Best is trial 3 with value: 0.2612869777929152.
[I 2024-11-06 05:53:33,623] Trial 186 finished with value: 0.2612869777929152 and parameters: {'model_name': 'SimpleImputer', 'strategy': 'mean'}. Best is trial 3 with value: 0.2612869777929152.
[I 2024-11-06 05:53:33,789] Trial 187 finished with value: 0.2612869777929152 and parameters: {'model_name': 'SimpleImputer', 'strategy': 'mean'}. Best is trial 3 with value: 0.2612869777929152.
running
running
running
[I 2024-11-06 05:53:33,884] Trial 185 finished with value: 0.2612869777929152 and parameters: {'model_name': 'SimpleImputer', 'strategy': 'mean'}. Best is trial 3 with value: 0.2612869777929152.
[I 2024-11-06 05:53:33,961] Trial 180 finished with value: 0.2612869777929152 and parameters: {'model_name': 'SimpleImputer', 'strategy': 'mean'}. Best is trial 3 with value: 0.2612869777929152.
[I 2024-11-06 05:53:34,044] Trial 188 finished with value: 0.2612869777929152 and parameters: {'model_name': 'SimpleImputer', 'strategy': 'mean'}. Best is trial 3 with value: 0.2612869777929152.
[I 2024-11-06 05:53:34,128] Trial 183 finished with value: 0.2612869777929152 and parameters: {'model_name': 'SimpleImputer', 'strategy': 'mean'}. Best is trial 3 with value: 0.2612869777929152.
[I 2024-11-06 05:53:34,224] Trial 184 finished with value: 0.2612869777929152 and parameters: {'model_name': 'SimpleImputer', 'strategy': 'mean'}. Best is trial 3 with value: 0.2612869777929152.
[I 2024-11-06 05:53:34,316] Trial 189 finished with value: 0.2612869777929152 and parameters: {'model_name': 'SimpleImputer', 'strategy': 'mean'}. Best is trial 3 with value: 0.2612869777929152.
[I 2024-11-06 05:53:34,431] Trial 190 finished with value: 0.2612869777929152 and parameters: {'model_name': 'SimpleImputer', 'strategy': 'mean'}. Best is trial 3 with value: 0.2612869777929152.
[I 2024-11-06 05:53:34,535] Trial 191 finished with value: 0.2612869777929152 and parameters: {'model_name': 'SimpleImputer', 'strategy': 'mean'}. Best is trial 3 with value: 0.2612869777929152.
[I 2024-11-06 05:53:34,633] Trial 194 finished with value: 0.2612869777929152 and parameters: {'model_name': 'SimpleImputer', 'strategy': 'mean'}. Best is trial 3 with value: 0.2612869777929152.
[I 2024-11-06 05:53:34,724] Trial 192 finished with value: 0.2612869777929152 and parameters: {'model_name': 'SimpleImputer', 'strategy': 'mean'}. Best is trial 3 with value: 0.2612869777929152.
[I 2024-11-06 05:53:34,810] Trial 193 finished with value: 0.2612869777929152 and parameters: {'model_name': 'SimpleImputer', 'strategy': 'mean'}. Best is trial 3 with value: 0.2612869777929152.
[I 2024-11-06 05:53:34,910] Trial 195 finished with value: 0.2612869777929152 and parameters: {'model_name': 'SimpleImputer', 'strategy': 'mean'}. Best is trial 3 with value: 0.2612869777929152.
[I 2024-11-06 05:53:35,004] Trial 196 finished with value: 0.2612869777929152 and parameters: {'model_name': 'SimpleImputer', 'strategy': 'mean'}. Best is trial 3 with value: 0.2612869777929152.
[I 2024-11-06 05:53:35,089] Trial 197 finished with value: 0.2612869777929152 and parameters: {'model_name': 'SimpleImputer', 'strategy': 'mean'}. Best is trial 3 with value: 0.2612869777929152.
[I 2024-11-06 05:53:35,168] Trial 199 finished with value: 0.2612869777929152 and parameters: {'model_name': 'SimpleImputer', 'strategy': 'mean'}. Best is trial 3 with value: 0.2612869777929152.
