Run: 11
/cm/local/apps/slurm/var/spool/job991332/slurm_script: line 26: 
pip install -e tpot2
pip install -r tpot2/ImputerExperiments/requirements_.txt
: No such file or directory
RunStart
Version 0.1.7a0 of tpot2 is outdated. Version 0.1.8a0 was released Tuesday September 17, 2024.
starting loops
../data/r/42688/42688.pkl
working on 
../data/r/42688/reg_full_MNAR_0.3_1
3.2477707862854004
running experiment 1/3 - Does large hyperparameter space improve reconstruction accuracy over simple
[I 2024-10-07 12:33:26,953] A new study created in memory with name: no-name-1961c022-3bbc-44f5-adfb-1001ed4fd703
running
running
running
running
running
running
running
running
running
running
running
running
running
running
running
running
[I 2024-10-07 12:33:27,249] Trial 0 finished with value: 0.21414397437670143 and parameters: {'model_name': 'SimpleImputer', 'strategy': 'mean'}. Best is trial 0 with value: 0.21414397437670143.
running
[I 2024-10-07 12:33:27,475] Trial 13 finished with value: 0.24941245488372904 and parameters: {'model_name': 'SimpleImputer', 'strategy': 'median'}. Best is trial 0 with value: 0.21414397437670143.
running
[I 2024-10-07 12:33:34,818] Trial 9 finished with value: 0.21413142861467951 and parameters: {'model_name': 'KNNImputer', 'n_neighbors': 5624, 'weights': 'uniform'}. Best is trial 9 with value: 0.21413142861467951.
running
[I 2024-10-07 12:33:35,633] Trial 15 finished with value: 0.3559534554465859 and parameters: {'model_name': 'GAIN', 'batch_size': 34, 'hint_rate': 0.22530892313308468, 'alpha': 14, 'iterations': 1, 'learning_rate': 0.06305640470775105, 'p_miss': 0.17446296059349545}. Best is trial 9 with value: 0.21413142861467951.
running
[I 2024-10-07 12:33:35,821] Trial 10 finished with value: 0.3273466652298476 and parameters: {'model_name': 'VAE', 'batch_size': 92, 'iterations': 1, 'learning_rate': 0.037184565709194616, 'p_miss': 0.04316825173587582}. Best is trial 9 with value: 0.21413142861467951.
running
[I 2024-10-07 12:33:36,482] Trial 19 finished with value: 0.24941245488372904 and parameters: {'model_name': 'SimpleImputer', 'strategy': 'median'}. Best is trial 9 with value: 0.21413142861467951.
running
[I 2024-10-07 12:33:36,936] Trial 4 finished with value: 0.2112158012934356 and parameters: {'model_name': 'KNNImputer', 'n_neighbors': 3363, 'weights': 'distance'}. Best is trial 4 with value: 0.2112158012934356.
running
[I 2024-10-07 12:33:37,192] Trial 3 finished with value: 0.35586672874136344 and parameters: {'model_name': 'GAIN', 'batch_size': 7, 'hint_rate': 0.45386360368803186, 'alpha': 10, 'iterations': 3, 'learning_rate': 0.009070507385113459, 'p_miss': 0.20180617842965648}. Best is trial 4 with value: 0.2112158012934356.
running
[I 2024-10-07 12:33:38,671] Trial 7 finished with value: 0.21140077575603602 and parameters: {'model_name': 'KNNImputer', 'n_neighbors': 4129, 'weights': 'distance'}. Best is trial 4 with value: 0.2112158012934356.
running
[I 2024-10-07 12:33:39,214] Trial 8 finished with value: inf and parameters: {'model_name': 'GAIN', 'batch_size': 2, 'hint_rate': 0.24289239657155184, 'alpha': 72, 'iterations': 47, 'learning_rate': 0.0016157083331231298, 'p_miss': 0.03812587961071272}. Best is trial 4 with value: 0.2112158012934356.
running
[I 2024-10-07 12:33:39,912] Trial 11 finished with value: 0.21174359306097273 and parameters: {'model_name': 'KNNImputer', 'n_neighbors': 6032, 'weights': 'distance'}. Best is trial 4 with value: 0.2112158012934356.
running
[I 2024-10-07 12:33:45,391] Trial 17 finished with value: 0.20641920738092095 and parameters: {'model_name': 'IterativeImputer', 'estimator': 'Ridge', 'initial_strategy': 'constant', 'n_nearest_features': 8, 'imputation_order': 'random'}. Best is trial 17 with value: 0.20641920738092095.
running
[I 2024-10-07 12:33:46,594] Trial 21 finished with value: 0.21009375611912376 and parameters: {'model_name': 'KNNImputer', 'n_neighbors': 752, 'weights': 'distance'}. Best is trial 17 with value: 0.20641920738092095.
running
[I 2024-10-07 12:33:50,367] Trial 1 finished with value: inf and parameters: {'model_name': 'GAIN', 'batch_size': 1, 'hint_rate': 0.6584046622083846, 'alpha': 88, 'iterations': 140, 'learning_rate': 0.015897436946662832, 'p_miss': 0.18575426581784968}. Best is trial 17 with value: 0.20641920738092095.
running
[I 2024-10-07 12:33:50,931] Trial 18 finished with value: 0.21126401357149777 and parameters: {'model_name': 'KNNImputer', 'n_neighbors': 3592, 'weights': 'distance'}. Best is trial 17 with value: 0.20641920738092095.
running
[I 2024-10-07 12:33:52,135] Trial 23 finished with value: 0.2112297186194024 and parameters: {'model_name': 'KNNImputer', 'n_neighbors': 3448, 'weights': 'distance'}. Best is trial 17 with value: 0.20641920738092095.
running
[I 2024-10-07 12:33:55,197] Trial 20 finished with value: 0.2117062022528231 and parameters: {'model_name': 'KNNImputer', 'n_neighbors': 5779, 'weights': 'distance'}. Best is trial 17 with value: 0.20641920738092095.
running
[I 2024-10-07 12:34:08,433] Trial 27 finished with value: 0.20641920738092095 and parameters: {'model_name': 'IterativeImputer', 'estimator': 'Ridge', 'initial_strategy': 'constant', 'n_nearest_features': 8, 'imputation_order': 'random'}. Best is trial 17 with value: 0.20641920738092095.
running
[I 2024-10-07 12:34:09,650] Trial 28 finished with value: 0.20641920738092095 and parameters: {'model_name': 'IterativeImputer', 'estimator': 'Ridge', 'initial_strategy': 'constant', 'n_nearest_features': 8, 'imputation_order': 'random'}. Best is trial 17 with value: 0.20641920738092095.
running
[I 2024-10-07 12:34:11,827] Trial 29 finished with value: 0.20641920738092095 and parameters: {'model_name': 'IterativeImputer', 'estimator': 'Ridge', 'initial_strategy': 'constant', 'n_nearest_features': 8, 'imputation_order': 'random'}. Best is trial 17 with value: 0.20641920738092095.
running
[I 2024-10-07 12:34:13,187] Trial 30 finished with value: 0.20641920738092095 and parameters: {'model_name': 'IterativeImputer', 'estimator': 'Ridge', 'initial_strategy': 'constant', 'n_nearest_features': 8, 'imputation_order': 'random'}. Best is trial 17 with value: 0.20641920738092095.
running
[I 2024-10-07 12:34:15,618] Trial 31 finished with value: 0.20641920738092095 and parameters: {'model_name': 'IterativeImputer', 'estimator': 'Ridge', 'initial_strategy': 'constant', 'n_nearest_features': 8, 'imputation_order': 'random'}. Best is trial 17 with value: 0.20641920738092095.
running
[I 2024-10-07 12:34:17,652] Trial 32 finished with value: 0.20641920738092095 and parameters: {'model_name': 'IterativeImputer', 'estimator': 'Ridge', 'initial_strategy': 'constant', 'n_nearest_features': 8, 'imputation_order': 'random'}. Best is trial 17 with value: 0.20641920738092095.
running
[I 2024-10-07 12:34:21,376] Trial 16 finished with value: 0.21720998385855078 and parameters: {'model_name': 'IterativeImputer', 'estimator': 'KNN', 'initial_strategy': 'median', 'n_nearest_features': 6, 'imputation_order': 'ascending'}. Best is trial 17 with value: 0.20641920738092095.
running
[I 2024-10-07 12:34:34,258] Trial 33 finished with value: 0.20641920738092095 and parameters: {'model_name': 'IterativeImputer', 'estimator': 'Ridge', 'initial_strategy': 'constant', 'n_nearest_features': 8, 'imputation_order': 'random'}. Best is trial 17 with value: 0.20641920738092095.
running
[I 2024-10-07 12:34:35,183] Trial 34 finished with value: 0.20641920738092095 and parameters: {'model_name': 'IterativeImputer', 'estimator': 'Ridge', 'initial_strategy': 'constant', 'n_nearest_features': 8, 'imputation_order': 'random'}. Best is trial 17 with value: 0.20641920738092095.
running
[I 2024-10-07 12:34:37,348] Trial 36 finished with value: 0.20641920738092095 and parameters: {'model_name': 'IterativeImputer', 'estimator': 'Ridge', 'initial_strategy': 'constant', 'n_nearest_features': 8, 'imputation_order': 'random'}. Best is trial 17 with value: 0.20641920738092095.
running
[I 2024-10-07 12:34:37,983] Trial 35 finished with value: 0.20667743091531782 and parameters: {'model_name': 'IterativeImputer', 'estimator': 'Ridge', 'initial_strategy': 'constant', 'n_nearest_features': 9, 'imputation_order': 'descending'}. Best is trial 17 with value: 0.20641920738092095.
running
[I 2024-10-07 12:34:43,032] Trial 22 finished with value: 0.2632559779395703 and parameters: {'model_name': 'VAE', 'batch_size': 4, 'iterations': 82, 'learning_rate': 0.001898634620607221, 'p_miss': 0.12266008947941491}. Best is trial 17 with value: 0.20641920738092095.
running
[I 2024-10-07 12:34:46,139] Trial 37 finished with value: 0.20638354017734253 and parameters: {'model_name': 'IterativeImputer', 'estimator': 'Ridge', 'initial_strategy': 'constant', 'n_nearest_features': 10, 'imputation_order': 'random'}. Best is trial 37 with value: 0.20638354017734253.
running
[I 2024-10-07 12:34:53,832] Trial 24 finished with value: 0.2180033539508393 and parameters: {'model_name': 'IterativeImputer', 'estimator': 'KNN', 'initial_strategy': 'median', 'n_nearest_features': 8, 'imputation_order': 'ascending'}. Best is trial 37 with value: 0.20638354017734253.
running
[I 2024-10-07 12:35:01,241] Trial 26 finished with value: 0.2211854156440492 and parameters: {'model_name': 'IterativeImputer', 'estimator': 'KNN', 'initial_strategy': 'mean', 'n_nearest_features': 9, 'imputation_order': 'arabic'}. Best is trial 37 with value: 0.20638354017734253.
running
[I 2024-10-07 12:35:02,203] Trial 38 finished with value: 0.22796311406176378 and parameters: {'model_name': 'IterativeImputer', 'estimator': 'KNN', 'initial_strategy': 'median', 'n_nearest_features': 3, 'imputation_order': 'descending'}. Best is trial 37 with value: 0.20638354017734253.
running
[I 2024-10-07 12:36:12,898] Trial 39 finished with value: 0.20629932270808893 and parameters: {'model_name': 'IterativeImputer', 'estimator': 'Bayesian', 'initial_strategy': 'mean', 'n_nearest_features': 12, 'imputation_order': 'descending', 'sample_posterior': False}. Best is trial 39 with value: 0.20629932270808893.
running
[I 2024-10-07 12:36:31,873] Trial 14 finished with value: 0.23240587111510363 and parameters: {'model_name': 'VAE', 'batch_size': 9, 'iterations': 234, 'learning_rate': 0.000977637882135234, 'p_miss': 0.2611959996335402}. Best is trial 39 with value: 0.20629932270808893.
running
[I 2024-10-07 12:36:32,422] Trial 50 finished with value: 0.3321430796780372 and parameters: {'model_name': 'SimpleImputer', 'strategy': 'constant'}. Best is trial 39 with value: 0.20629932270808893.
running
[I 2024-10-07 12:36:41,448] Trial 46 finished with value: 0.20629957559517936 and parameters: {'model_name': 'IterativeImputer', 'estimator': 'Bayesian', 'initial_strategy': 'most_frequent', 'n_nearest_features': 12, 'imputation_order': 'roman', 'sample_posterior': False}. Best is trial 39 with value: 0.20629932270808893.
running
[I 2024-10-07 12:36:48,015] Trial 48 finished with value: 0.20629957559517936 and parameters: {'model_name': 'IterativeImputer', 'estimator': 'Bayesian', 'initial_strategy': 'most_frequent', 'n_nearest_features': 12, 'imputation_order': 'roman', 'sample_posterior': False}. Best is trial 39 with value: 0.20629932270808893.
running
[I 2024-10-07 12:36:48,648] Trial 44 finished with value: 0.2863655315180197 and parameters: {'model_name': 'IterativeImputer', 'estimator': 'Bayesian', 'initial_strategy': 'most_frequent', 'n_nearest_features': 12, 'imputation_order': 'arabic', 'sample_posterior': True}. Best is trial 39 with value: 0.20629932270808893.
running
[I 2024-10-07 12:37:05,706] Trial 47 finished with value: 0.29431974619443846 and parameters: {'model_name': 'IterativeImputer', 'estimator': 'Bayesian', 'initial_strategy': 'most_frequent', 'n_nearest_features': 11, 'imputation_order': 'roman', 'sample_posterior': True}. Best is trial 39 with value: 0.20629932270808893.
running
[I 2024-10-07 12:37:11,726] Trial 2 finished with value: 0.4361147358618167 and parameters: {'model_name': 'GAIN', 'batch_size': 55, 'hint_rate': 0.8634389605886128, 'alpha': 3, 'iterations': 459, 'learning_rate': 0.003009555098012922, 'p_miss': 0.2697628261469588}. Best is trial 39 with value: 0.20629932270808893.
running
[I 2024-10-07 12:38:25,299] Trial 51 finished with value: 0.20629957107279054 and parameters: {'model_name': 'IterativeImputer', 'estimator': 'Bayesian', 'initial_strategy': 'mean', 'n_nearest_features': 12, 'imputation_order': 'roman', 'sample_posterior': False}. Best is trial 39 with value: 0.20629932270808893.
running
[I 2024-10-07 12:39:03,829] Trial 56 finished with value: 0.20629957107279054 and parameters: {'model_name': 'IterativeImputer', 'estimator': 'Bayesian', 'initial_strategy': 'mean', 'n_nearest_features': 12, 'imputation_order': 'roman', 'sample_posterior': False}. Best is trial 39 with value: 0.20629932270808893.
running
[I 2024-10-07 13:20:06,837] Trial 25 finished with value: 0.20650841171358453 and parameters: {'model_name': 'IterativeImputer', 'estimator': 'RFR', 'initial_strategy': 'median', 'n_nearest_features': 8, 'imputation_order': 'arabic'}. Best is trial 39 with value: 0.20629932270808893.
running
[I 2024-10-07 13:20:44,595] Trial 5 finished with value: 0.21768498968706732 and parameters: {'model_name': 'VAE', 'batch_size': 590, 'iterations': 824, 'learning_rate': 0.008281798144568732, 'p_miss': 0.24374143966760392}. Best is trial 39 with value: 0.20629932270808893.
running
[I 2024-10-07 13:23:35,031] Trial 12 finished with value: 0.3210998739189259 and parameters: {'model_name': 'GAIN', 'batch_size': 23, 'hint_rate': 0.057313785430843846, 'alpha': 70, 'iterations': 2390, 'learning_rate': 0.09006655977045436, 'p_miss': 0.2958271527272559}. Best is trial 39 with value: 0.20629932270808893.
running
[I 2024-10-07 13:23:58,483] Trial 61 finished with value: 0.3563410883269148 and parameters: {'model_name': 'GAIN', 'batch_size': 951, 'hint_rate': 0.9246974276493196, 'alpha': 42, 'iterations': 10, 'learning_rate': 0.00010498576912787503, 'p_miss': 0.11410951163164962}. Best is trial 39 with value: 0.20629932270808893.
running
[I 2024-10-07 13:23:59,557] Trial 62 finished with value: 0.26721967294989646 and parameters: {'model_name': 'SimpleImputer', 'strategy': 'most_frequent'}. Best is trial 39 with value: 0.20629932270808893.
running
[I 2024-10-07 13:25:20,766] Trial 40 finished with value: 0.19948849453044265 and parameters: {'model_name': 'IterativeImputer', 'estimator': 'RFR', 'initial_strategy': 'most_frequent', 'n_nearest_features': 12, 'imputation_order': 'arabic'}. Best is trial 40 with value: 0.19948849453044265.
running
[I 2024-10-07 15:41:39,931] Trial 59 finished with value: 0.36857501614368093 and parameters: {'model_name': 'GAIN', 'batch_size': 516, 'hint_rate': 0.018191557015857618, 'alpha': 45, 'iterations': 4895, 'learning_rate': 0.00011158724516493816, 'p_miss': 0.10485292234809274}. Best is trial 40 with value: 0.19948849453044265.
running
[I 2024-10-07 15:42:24,397] Trial 65 finished with value: 0.38137581569914475 and parameters: {'model_name': 'VAE', 'batch_size': 168, 'iterations': 9, 'learning_rate': 0.000586452162854892, 'p_miss': 0.06995001999334}. Best is trial 40 with value: 0.19948849453044265.
running
[I 2024-10-07 15:43:52,089] Trial 66 finished with value: 0.20629957107279054 and parameters: {'model_name': 'IterativeImputer', 'estimator': 'Bayesian', 'initial_strategy': 'mean', 'n_nearest_features': 12, 'imputation_order': 'roman', 'sample_posterior': False}. Best is trial 40 with value: 0.19948849453044265.
running
[I 2024-10-07 15:44:36,543] Trial 54 finished with value: 0.3742136381389468 and parameters: {'model_name': 'GAIN', 'batch_size': 587, 'hint_rate': 0.9207968012208927, 'alpha': 47, 'iterations': 6487, 'learning_rate': 0.00011323106610158666, 'p_miss': 0.10357964705285003}. Best is trial 40 with value: 0.19948849453044265.
running
[I 2024-10-07 15:44:45,378] Trial 55 finished with value: 0.4618304505344325 and parameters: {'model_name': 'GAIN', 'batch_size': 992, 'hint_rate': 0.9468406044221221, 'alpha': 44, 'iterations': 5506, 'learning_rate': 0.0001264211956347087, 'p_miss': 0.29834374483673093}. Best is trial 40 with value: 0.19948849453044265.
running
[I 2024-10-07 15:45:24,010] Trial 67 finished with value: 0.20629957107279054 and parameters: {'model_name': 'IterativeImputer', 'estimator': 'Bayesian', 'initial_strategy': 'mean', 'n_nearest_features': 12, 'imputation_order': 'roman', 'sample_posterior': False}. Best is trial 40 with value: 0.19948849453044265.
running
[I 2024-10-07 15:46:10,144] Trial 68 finished with value: 0.20629957107279054 and parameters: {'model_name': 'IterativeImputer', 'estimator': 'Bayesian', 'initial_strategy': 'mean', 'n_nearest_features': 12, 'imputation_order': 'roman', 'sample_posterior': False}. Best is trial 40 with value: 0.19948849453044265.
running
[I 2024-10-07 15:46:19,493] Trial 69 finished with value: 0.20629957107279054 and parameters: {'model_name': 'IterativeImputer', 'estimator': 'Bayesian', 'initial_strategy': 'mean', 'n_nearest_features': 12, 'imputation_order': 'roman', 'sample_posterior': False}. Best is trial 40 with value: 0.19948849453044265.
running
[I 2024-10-07 15:47:04,466] Trial 70 finished with value: 0.20629957107279057 and parameters: {'model_name': 'IterativeImputer', 'estimator': 'Bayesian', 'initial_strategy': 'mean', 'n_nearest_features': 11, 'imputation_order': 'roman', 'sample_posterior': False}. Best is trial 40 with value: 0.19948849453044265.
running
[I 2024-10-07 15:47:51,220] Trial 71 finished with value: 0.20629957107279057 and parameters: {'model_name': 'IterativeImputer', 'estimator': 'Bayesian', 'initial_strategy': 'mean', 'n_nearest_features': 11, 'imputation_order': 'roman', 'sample_posterior': False}. Best is trial 40 with value: 0.19948849453044265.
running
[I 2024-10-07 15:48:07,447] Trial 73 finished with value: 0.36658829801072806 and parameters: {'model_name': 'VAE', 'batch_size': 187, 'iterations': 39, 'learning_rate': 0.0004259499344153575, 'p_miss': 0.14693282503906835}. Best is trial 40 with value: 0.19948849453044265.
running
[I 2024-10-07 15:48:07,975] Trial 75 finished with value: 0.3321430796780372 and parameters: {'model_name': 'SimpleImputer', 'strategy': 'constant'}. Best is trial 40 with value: 0.19948849453044265.
running
[I 2024-10-07 15:49:06,318] Trial 74 finished with value: 0.3758211550842592 and parameters: {'model_name': 'VAE', 'batch_size': 176, 'iterations': 21, 'learning_rate': 0.000412650267443037, 'p_miss': 0.23040336755350693}. Best is trial 40 with value: 0.19948849453044265.
running
[I 2024-10-07 16:02:56,590] Trial 6 finished with value: 0.4564345619539097 and parameters: {'model_name': 'GAIN', 'batch_size': 23, 'hint_rate': 0.4466177536011157, 'alpha': 17, 'iterations': 9738, 'learning_rate': 0.003027886741641901, 'p_miss': 0.26564338290069545}. Best is trial 40 with value: 0.19948849453044265.
running
[I 2024-10-07 16:16:38,421] Trial 52 finished with value: 0.4563307330927885 and parameters: {'model_name': 'GAIN', 'batch_size': 871, 'hint_rate': 0.9520782504146039, 'alpha': 46, 'iterations': 7470, 'learning_rate': 0.000163243641736792, 'p_miss': 0.28322639621939716}. Best is trial 40 with value: 0.19948849453044265.
running
[I 2024-10-07 16:34:45,017] Trial 72 finished with value: 0.20111240419769771 and parameters: {'model_name': 'IterativeImputer', 'estimator': 'RFR', 'initial_strategy': 'mean', 'n_nearest_features': 11, 'imputation_order': 'roman'}. Best is trial 40 with value: 0.19948849453044265.
running
[I 2024-10-07 16:35:47,767] Trial 76 finished with value: 0.1999183426483137 and parameters: {'model_name': 'IterativeImputer', 'estimator': 'RFR', 'initial_strategy': 'mean', 'n_nearest_features': 11, 'imputation_order': 'roman'}. Best is trial 40 with value: 0.19948849453044265.
running
[I 2024-10-07 16:36:56,702] Trial 77 finished with value: 0.2007338669421618 and parameters: {'model_name': 'IterativeImputer', 'estimator': 'RFR', 'initial_strategy': 'mean', 'n_nearest_features': 11, 'imputation_order': 'roman'}. Best is trial 40 with value: 0.19948849453044265.
running
[I 2024-10-07 16:48:09,723] Trial 42 finished with value: 0.21661158622463073 and parameters: {'model_name': 'VAE', 'batch_size': 976, 'iterations': 3583, 'learning_rate': 0.0002196079556858198, 'p_miss': 0.28529286987663427}. Best is trial 40 with value: 0.19948849453044265.
running
[I 2024-10-07 16:50:00,795] Trial 78 finished with value: 0.19987660088156914 and parameters: {'model_name': 'IterativeImputer', 'estimator': 'RFR', 'initial_strategy': 'mean', 'n_nearest_features': 11, 'imputation_order': 'roman'}. Best is trial 40 with value: 0.19948849453044265.
running
[I 2024-10-07 16:54:36,700] Trial 60 finished with value: 0.36544244919679186 and parameters: {'model_name': 'GAIN', 'batch_size': 325, 'hint_rate': 0.02043177699111104, 'alpha': 45, 'iterations': 8322, 'learning_rate': 0.00012100164024571567, 'p_miss': 0.10678574006076288}. Best is trial 40 with value: 0.19948849453044265.
running
[I 2024-10-07 17:04:14,752] Trial 79 finished with value: 0.19914052959834713 and parameters: {'model_name': 'IterativeImputer', 'estimator': 'RFR', 'initial_strategy': 'mean', 'n_nearest_features': 11, 'imputation_order': 'roman'}. Best is trial 79 with value: 0.19914052959834713.
running
[I 2024-10-07 17:11:40,901] Trial 53 finished with value: 0.43773503728765145 and parameters: {'model_name': 'GAIN', 'batch_size': 996, 'hint_rate': 0.981036771025262, 'alpha': 47, 'iterations': 8161, 'learning_rate': 0.00011844748915173499, 'p_miss': 0.27907531358274357}. Best is trial 79 with value: 0.19914052959834713.
running
[I 2024-10-07 17:13:07,970] Trial 57 finished with value: 0.36818483550818815 and parameters: {'model_name': 'GAIN', 'batch_size': 516, 'hint_rate': 0.022944824379124484, 'alpha': 45, 'iterations': 9933, 'learning_rate': 0.00017969663609770372, 'p_miss': 0.10489305121161811}. Best is trial 79 with value: 0.19914052959834713.
running
