[I 2024-10-08 04:37:14,534] Trial 160 finished with value: 0.05818403366682016 and parameters: {'model_name': 'IterativeImputer', 'estimator': 'KNN', 'initial_strategy': 'most_frequent', 'n_nearest_features': 5, 'imputation_order': 'descending'}. Best is trial 44 with value: 0.05796834839449868.
running
[I 2024-10-08 04:37:15,162] Trial 161 finished with value: 0.05818403366682016 and parameters: {'model_name': 'IterativeImputer', 'estimator': 'KNN', 'initial_strategy': 'most_frequent', 'n_nearest_features': 5, 'imputation_order': 'descending'}. Best is trial 44 with value: 0.05796834839449868.
running
[I 2024-10-08 04:38:56,239] Trial 112 finished with value: 0.06422890669702559 and parameters: {'model_name': 'IterativeImputer', 'estimator': 'RFR', 'initial_strategy': 'median', 'n_nearest_features': 5, 'imputation_order': 'ascending'}. Best is trial 44 with value: 0.05796834839449868.
running
[I 2024-10-08 04:38:57,174] Trial 165 finished with value: 0.5180219868975705 and parameters: {'model_name': 'SimpleImputer', 'strategy': 'most_frequent'}. Best is trial 44 with value: 0.05796834839449868.
running
[I 2024-10-08 04:39:11,538] Trial 166 finished with value: 0.05818403366682016 and parameters: {'model_name': 'IterativeImputer', 'estimator': 'KNN', 'initial_strategy': 'constant', 'n_nearest_features': 6, 'imputation_order': 'descending'}. Best is trial 44 with value: 0.05796834839449868.
running
[I 2024-10-08 04:39:25,583] Trial 167 finished with value: 0.05818403366682016 and parameters: {'model_name': 'IterativeImputer', 'estimator': 'KNN', 'initial_strategy': 'constant', 'n_nearest_features': 6, 'imputation_order': 'descending'}. Best is trial 44 with value: 0.05796834839449868.
running
[I 2024-10-08 04:39:37,642] Trial 168 finished with value: 0.05818403366682016 and parameters: {'model_name': 'IterativeImputer', 'estimator': 'KNN', 'initial_strategy': 'constant', 'n_nearest_features': 6, 'imputation_order': 'descending'}. Best is trial 44 with value: 0.05796834839449868.
running
[I 2024-10-08 04:42:19,798] Trial 116 finished with value: 0.0598600160039726 and parameters: {'model_name': 'IterativeImputer', 'estimator': 'RFR', 'initial_strategy': 'most_frequent', 'n_nearest_features': 6, 'imputation_order': 'descending'}. Best is trial 44 with value: 0.05796834839449868.
running
[I 2024-10-08 04:42:28,313] Trial 115 finished with value: 0.059023227443495786 and parameters: {'model_name': 'IterativeImputer', 'estimator': 'RFR', 'initial_strategy': 'most_frequent', 'n_nearest_features': 5, 'imputation_order': 'random'}. Best is trial 44 with value: 0.05796834839449868.
running
[I 2024-10-08 04:42:32,895] Trial 170 finished with value: 0.05818403366682016 and parameters: {'model_name': 'IterativeImputer', 'estimator': 'KNN', 'initial_strategy': 'constant', 'n_nearest_features': 6, 'imputation_order': 'descending'}. Best is trial 44 with value: 0.05796834839449868.
running
[I 2024-10-08 04:42:44,660] Trial 171 finished with value: 0.06433526476801676 and parameters: {'model_name': 'IterativeImputer', 'estimator': 'KNN', 'initial_strategy': 'constant', 'n_nearest_features': 6, 'imputation_order': 'roman'}. Best is trial 44 with value: 0.05796834839449868.
running
[I 2024-10-08 04:42:48,428] Trial 172 finished with value: 0.07546721738566442 and parameters: {'model_name': 'IterativeImputer', 'estimator': 'KNN', 'initial_strategy': 'constant', 'n_nearest_features': 3, 'imputation_order': 'descending'}. Best is trial 44 with value: 0.05796834839449868.
running
[I 2024-10-08 04:42:50,158] Trial 4 finished with value: 0.19973105070776398 and parameters: {'model_name': 'VAE', 'batch_size': 42, 'iterations': 3692, 'learning_rate': 0.0003787146747969425, 'p_miss': 0.28550470133414946}. Best is trial 44 with value: 0.05796834839449868.
running
[I 2024-10-08 04:42:59,690] Trial 173 finished with value: 0.07546721738566442 and parameters: {'model_name': 'IterativeImputer', 'estimator': 'KNN', 'initial_strategy': 'constant', 'n_nearest_features': 3, 'imputation_order': 'descending'}. Best is trial 44 with value: 0.05796834839449868.
running
[I 2024-10-08 04:43:13,805] Trial 176 finished with value: 0.05818403366682016 and parameters: {'model_name': 'IterativeImputer', 'estimator': 'KNN', 'initial_strategy': 'most_frequent', 'n_nearest_features': 6, 'imputation_order': 'descending'}. Best is trial 44 with value: 0.05796834839449868.
running
[I 2024-10-08 04:43:28,716] Trial 177 finished with value: 0.05818403366682016 and parameters: {'model_name': 'IterativeImputer', 'estimator': 'KNN', 'initial_strategy': 'most_frequent', 'n_nearest_features': 6, 'imputation_order': 'descending'}. Best is trial 44 with value: 0.05796834839449868.
running
[I 2024-10-08 04:46:28,292] Trial 117 finished with value: 0.05866062487749102 and parameters: {'model_name': 'IterativeImputer', 'estimator': 'RFR', 'initial_strategy': 'most_frequent', 'n_nearest_features': 6, 'imputation_order': 'random'}. Best is trial 44 with value: 0.05796834839449868.
running
[I 2024-10-08 04:46:43,071] Trial 179 finished with value: 0.05818403366682016 and parameters: {'model_name': 'IterativeImputer', 'estimator': 'KNN', 'initial_strategy': 'most_frequent', 'n_nearest_features': 6, 'imputation_order': 'descending'}. Best is trial 44 with value: 0.05796834839449868.
running
[I 2024-10-08 04:49:24,011] Trial 118 finished with value: 0.059709882115915866 and parameters: {'model_name': 'IterativeImputer', 'estimator': 'RFR', 'initial_strategy': 'most_frequent', 'n_nearest_features': 6, 'imputation_order': 'descending'}. Best is trial 44 with value: 0.05796834839449868.
running
[I 2024-10-08 04:49:33,896] Trial 181 finished with value: 0.05818403366682016 and parameters: {'model_name': 'IterativeImputer', 'estimator': 'KNN', 'initial_strategy': 'constant', 'n_nearest_features': 6, 'imputation_order': 'descending'}. Best is trial 44 with value: 0.05796834839449868.
running
[I 2024-10-08 04:49:44,555] Trial 182 finished with value: 0.05818403366682016 and parameters: {'model_name': 'IterativeImputer', 'estimator': 'KNN', 'initial_strategy': 'most_frequent', 'n_nearest_features': 6, 'imputation_order': 'descending'}. Best is trial 44 with value: 0.05796834839449868.
running
[I 2024-10-08 04:51:30,707] Trial 119 finished with value: 0.05726106811664076 and parameters: {'model_name': 'IterativeImputer', 'estimator': 'RFR', 'initial_strategy': 'most_frequent', 'n_nearest_features': 6, 'imputation_order': 'descending'}. Best is trial 119 with value: 0.05726106811664076.
running
[I 2024-10-08 04:51:34,529] Trial 184 finished with value: 0.20025504907207595 and parameters: {'model_name': 'KNNImputer', 'n_neighbors': 5768, 'weights': 'uniform'}. Best is trial 119 with value: 0.05726106811664076.
running
[I 2024-10-08 04:53:40,416] Trial 121 finished with value: 0.05672535455131069 and parameters: {'model_name': 'IterativeImputer', 'estimator': 'RFR', 'initial_strategy': 'most_frequent', 'n_nearest_features': 6, 'imputation_order': 'descending'}. Best is trial 121 with value: 0.05672535455131069.
running
[I 2024-10-08 04:57:09,254] Trial 164 finished with value: 0.07022873395357443 and parameters: {'model_name': 'IterativeImputer', 'estimator': 'RFR', 'initial_strategy': 'constant', 'n_nearest_features': 3, 'imputation_order': 'descending'}. Best is trial 121 with value: 0.05672535455131069.
running
[I 2024-10-08 05:02:15,803] Trial 162 finished with value: 0.05910097655499924 and parameters: {'model_name': 'IterativeImputer', 'estimator': 'RFR', 'initial_strategy': 'most_frequent', 'n_nearest_features': 5, 'imputation_order': 'descending'}. Best is trial 121 with value: 0.05672535455131069.
running
[I 2024-10-08 05:03:23,640] Trial 163 finished with value: 0.059066519754713984 and parameters: {'model_name': 'IterativeImputer', 'estimator': 'RFR', 'initial_strategy': 'constant', 'n_nearest_features': 5, 'imputation_order': 'descending'}. Best is trial 121 with value: 0.05672535455131069.
running
[I 2024-10-08 05:04:55,240] Trial 169 finished with value: 0.0606523039905183 and parameters: {'model_name': 'IterativeImputer', 'estimator': 'RFR', 'initial_strategy': 'constant', 'n_nearest_features': 6, 'imputation_order': 'descending'}. Best is trial 121 with value: 0.05672535455131069.
running
[I 2024-10-08 05:07:51,774] Trial 174 finished with value: 0.0568003632581197 and parameters: {'model_name': 'IterativeImputer', 'estimator': 'RFR', 'initial_strategy': 'constant', 'n_nearest_features': 6, 'imputation_order': 'descending'}. Best is trial 121 with value: 0.05672535455131069.
running
[I 2024-10-08 05:08:36,774] Trial 178 finished with value: 0.05979637994309074 and parameters: {'model_name': 'IterativeImputer', 'estimator': 'RFR', 'initial_strategy': 'most_frequent', 'n_nearest_features': 6, 'imputation_order': 'descending'}. Best is trial 121 with value: 0.05672535455131069.
running
[I 2024-10-08 05:09:36,622] Trial 175 finished with value: 0.0582053220088213 and parameters: {'model_name': 'IterativeImputer', 'estimator': 'RFR', 'initial_strategy': 'constant', 'n_nearest_features': 6, 'imputation_order': 'descending'}. Best is trial 121 with value: 0.05672535455131069.
running
[I 2024-10-08 05:11:55,906] Trial 29 finished with value: 0.4529768161103423 and parameters: {'model_name': 'GAIN', 'batch_size': 860, 'hint_rate': 0.2896133527464024, 'alpha': 66, 'iterations': 7200, 'learning_rate': 0.00015878528680498554, 'p_miss': 0.08488484504417841}. Best is trial 121 with value: 0.05672535455131069.
running
[I 2024-10-08 05:12:55,020] Trial 180 finished with value: 0.06109140896259472 and parameters: {'model_name': 'IterativeImputer', 'estimator': 'RFR', 'initial_strategy': 'most_frequent', 'n_nearest_features': 6, 'imputation_order': 'descending'}. Best is trial 121 with value: 0.05672535455131069.
running
[I 2024-10-08 05:14:44,957] Trial 183 finished with value: 0.058489127047132494 and parameters: {'model_name': 'IterativeImputer', 'estimator': 'RFR', 'initial_strategy': 'constant', 'n_nearest_features': 6, 'imputation_order': 'descending'}. Best is trial 121 with value: 0.05672535455131069.
running
[I 2024-10-08 05:17:39,281] Trial 185 finished with value: 0.06076124781805423 and parameters: {'model_name': 'IterativeImputer', 'estimator': 'RFR', 'initial_strategy': 'constant', 'n_nearest_features': 5, 'imputation_order': 'descending'}. Best is trial 121 with value: 0.05672535455131069.
running
[I 2024-10-08 05:19:34,668] Trial 186 finished with value: 0.06033113469813271 and parameters: {'model_name': 'IterativeImputer', 'estimator': 'RFR', 'initial_strategy': 'most_frequent', 'n_nearest_features': 6, 'imputation_order': 'descending'}. Best is trial 121 with value: 0.05672535455131069.
running
[I 2024-10-08 05:22:08,897] Trial 187 finished with value: 0.05844116659200667 and parameters: {'model_name': 'IterativeImputer', 'estimator': 'RFR', 'initial_strategy': 'most_frequent', 'n_nearest_features': 6, 'imputation_order': 'descending'}. Best is trial 121 with value: 0.05672535455131069.
running
[I 2024-10-08 05:25:52,989] Trial 30 finished with value: 0.4499815566351755 and parameters: {'model_name': 'GAIN', 'batch_size': 606, 'hint_rate': 0.41470483099632416, 'alpha': 59, 'iterations': 7977, 'learning_rate': 0.08045498256204908, 'p_miss': 0.09081397101671139}. Best is trial 121 with value: 0.05672535455131069.
[I 2024-10-08 05:27:10,724] Trial 188 finished with value: 0.060367209339147895 and parameters: {'model_name': 'IterativeImputer', 'estimator': 'RFR', 'initial_strategy': 'most_frequent', 'n_nearest_features': 6, 'imputation_order': 'descending'}. Best is trial 121 with value: 0.05672535455131069.
[I 2024-10-08 05:28:37,886] Trial 189 finished with value: 0.05878610601629612 and parameters: {'model_name': 'IterativeImputer', 'estimator': 'RFR', 'initial_strategy': 'most_frequent', 'n_nearest_features': 6, 'imputation_order': 'descending'}. Best is trial 121 with value: 0.05672535455131069.
[I 2024-10-08 05:29:29,271] Trial 190 finished with value: 0.058737929899875904 and parameters: {'model_name': 'IterativeImputer', 'estimator': 'RFR', 'initial_strategy': 'most_frequent', 'n_nearest_features': 6, 'imputation_order': 'descending'}. Best is trial 121 with value: 0.05672535455131069.
[I 2024-10-08 05:30:37,202] Trial 32 finished with value: 0.45068575438654523 and parameters: {'model_name': 'GAIN', 'batch_size': 525, 'hint_rate': 0.6429455325866085, 'alpha': 15, 'iterations': 8723, 'learning_rate': 0.08418084240720923, 'p_miss': 0.08580123679716999}. Best is trial 121 with value: 0.05672535455131069.
[I 2024-10-08 05:32:05,556] Trial 191 finished with value: 0.06093487750757072 and parameters: {'model_name': 'IterativeImputer', 'estimator': 'RFR', 'initial_strategy': 'most_frequent', 'n_nearest_features': 6, 'imputation_order': 'descending'}. Best is trial 121 with value: 0.05672535455131069.
[I 2024-10-08 05:32:36,313] Trial 192 finished with value: 0.058735911574719454 and parameters: {'model_name': 'IterativeImputer', 'estimator': 'RFR', 'initial_strategy': 'most_frequent', 'n_nearest_features': 6, 'imputation_order': 'descending'}. Best is trial 121 with value: 0.05672535455131069.
[I 2024-10-08 05:33:42,137] Trial 3 finished with value: 0.2170882169332443 and parameters: {'model_name': 'VAE', 'batch_size': 5, 'iterations': 7159, 'learning_rate': 0.011555699391476056, 'p_miss': 0.15540917423267053}. Best is trial 121 with value: 0.05672535455131069.
[I 2024-10-08 05:33:58,121] Trial 193 finished with value: 0.06190704636842015 and parameters: {'model_name': 'IterativeImputer', 'estimator': 'RFR', 'initial_strategy': 'most_frequent', 'n_nearest_features': 6, 'imputation_order': 'descending'}. Best is trial 121 with value: 0.05672535455131069.
[I 2024-10-08 05:34:15,417] Trial 72 finished with value: 0.4659603237560278 and parameters: {'model_name': 'GAIN', 'batch_size': 820, 'hint_rate': 0.6767906439051292, 'alpha': 39, 'iterations': 9834, 'learning_rate': 0.011390668559592691, 'p_miss': 0.2147216156395338}. Best is trial 121 with value: 0.05672535455131069.
[I 2024-10-08 05:34:44,024] Trial 194 finished with value: 0.05940684899591353 and parameters: {'model_name': 'IterativeImputer', 'estimator': 'RFR', 'initial_strategy': 'most_frequent', 'n_nearest_features': 6, 'imputation_order': 'descending'}. Best is trial 121 with value: 0.05672535455131069.
[I 2024-10-08 05:35:58,298] Trial 195 finished with value: 0.06070502003691638 and parameters: {'model_name': 'IterativeImputer', 'estimator': 'RFR', 'initial_strategy': 'most_frequent', 'n_nearest_features': 6, 'imputation_order': 'descending'}. Best is trial 121 with value: 0.05672535455131069.
[I 2024-10-08 05:36:30,758] Trial 196 finished with value: 0.06034177592865721 and parameters: {'model_name': 'IterativeImputer', 'estimator': 'RFR', 'initial_strategy': 'most_frequent', 'n_nearest_features': 6, 'imputation_order': 'descending'}. Best is trial 121 with value: 0.05672535455131069.
[I 2024-10-08 05:38:49,203] Trial 197 finished with value: 0.05715141334892637 and parameters: {'model_name': 'IterativeImputer', 'estimator': 'RFR', 'initial_strategy': 'most_frequent', 'n_nearest_features': 6, 'imputation_order': 'descending'}. Best is trial 121 with value: 0.05672535455131069.
[I 2024-10-08 05:39:59,673] Trial 198 finished with value: 0.06025937920345896 and parameters: {'model_name': 'IterativeImputer', 'estimator': 'RFR', 'initial_strategy': 'most_frequent', 'n_nearest_features': 6, 'imputation_order': 'descending'}. Best is trial 121 with value: 0.05672535455131069.
