Run: 25
/cm/local/apps/slurm/var/spool/job1047379/slurm_script: line 27: 
pip install -e tpot2
pip install -r tpot2/ImputerExperiments/requirements_.txt
: No such file or directory
RunStart
Version 0.1.7a0 of tpot2 is outdated. Version 0.1.8a0 was released Tuesday September 17, 2024.
starting loops
../data/c/1481/1481.pkl
working on 
../data/c/1481/class_full_MCAR_0.01_2
4.453521966934204
running experiment 1/3 - Does large hyperparameter space improve reconstruction accuracy over simple
[I 2024-11-13 05:20:08,605] A new study created in memory with name: no-name-39d83229-82e3-46b7-bd9e-0acc8f1f5a54
running
running
running
running
running
running
running
running
running
running
running
running
running
running
running
running
[I 2024-11-13 05:20:08,909] Trial 15 finished with value: 0.6108937070107694 and parameters: {'model_name': 'SimpleImputer', 'strategy': 'constant'}. Best is trial 15 with value: 0.6108937070107694.
running
[I 2024-11-13 05:20:09,076] Trial 6 finished with value: 0.3213671969548344 and parameters: {'model_name': 'SimpleImputer', 'strategy': 'mean'}. Best is trial 6 with value: 0.3213671969548344.
running
[I 2024-11-13 05:20:09,317] Trial 13 finished with value: 0.6108937070107694 and parameters: {'model_name': 'SimpleImputer', 'strategy': 'constant'}. Best is trial 6 with value: 0.3213671969548344.
[I 2024-11-13 05:20:09,373] Trial 4 finished with value: 0.3213671969548344 and parameters: {'model_name': 'SimpleImputer', 'strategy': 'mean'}. Best is trial 6 with value: 0.3213671969548344.
running
running
[I 2024-11-13 05:20:09,971] Trial 8 finished with value: 0.3213671969548344 and parameters: {'model_name': 'SimpleImputer', 'strategy': 'mean'}. Best is trial 6 with value: 0.3213671969548344.
running
[I 2024-11-13 05:20:10,340] Trial 19 finished with value: 0.3253480359321758 and parameters: {'model_name': 'SimpleImputer', 'strategy': 'median'}. Best is trial 6 with value: 0.3213671969548344.
[I 2024-11-13 05:20:10,478] Trial 12 finished with value: 0.532062439624534 and parameters: {'model_name': 'SimpleImputer', 'strategy': 'most_frequent'}. Best is trial 6 with value: 0.3213671969548344.
running
running
[I 2024-11-13 05:20:28,573] Trial 20 finished with value: 0.316502205105636 and parameters: {'model_name': 'KNNImputer', 'n_neighbors': 10715, 'weights': 'uniform'}. Best is trial 20 with value: 0.316502205105636.
running
[I 2024-11-13 05:20:30,605] Trial 7 finished with value: 0.35615960325877516 and parameters: {'model_name': 'KNNImputer', 'n_neighbors': 8925, 'weights': 'distance'}. Best is trial 20 with value: 0.316502205105636.
running
[I 2024-11-13 05:20:32,204] Trial 17 finished with value: 0.3561947115644452 and parameters: {'model_name': 'KNNImputer', 'n_neighbors': 11431, 'weights': 'distance'}. Best is trial 20 with value: 0.316502205105636.
running
[I 2024-11-13 05:20:34,439] Trial 16 finished with value: 0.35620603513192656 and parameters: {'model_name': 'KNNImputer', 'n_neighbors': 12389, 'weights': 'distance'}. Best is trial 20 with value: 0.316502205105636.
running
[I 2024-11-13 05:20:39,243] Trial 11 finished with value: 0.3125093917714117 and parameters: {'model_name': 'IterativeImputer', 'estimator': 'Bayesian', 'initial_strategy': 'mean', 'n_nearest_features': 1, 'imputation_order': 'roman', 'sample_posterior': False}. Best is trial 11 with value: 0.3125093917714117.
running
[I 2024-11-13 05:20:44,263] Trial 14 finished with value: 0.3071020662779782 and parameters: {'model_name': 'IterativeImputer', 'estimator': 'Bayesian', 'initial_strategy': 'constant', 'n_nearest_features': 3, 'imputation_order': 'descending', 'sample_posterior': False}. Best is trial 14 with value: 0.3071020662779782.
running
[I 2024-11-13 05:20:48,328] Trial 21 finished with value: 0.3275265267527537 and parameters: {'model_name': 'IterativeImputer', 'estimator': 'KNN', 'initial_strategy': 'constant', 'n_nearest_features': 3, 'imputation_order': 'random'}. Best is trial 14 with value: 0.3071020662779782.
running
[I 2024-11-13 05:20:50,296] Trial 3 finished with value: 0.44179533781780167 and parameters: {'model_name': 'IterativeImputer', 'estimator': 'Bayesian', 'initial_strategy': 'constant', 'n_nearest_features': 2, 'imputation_order': 'ascending', 'sample_posterior': True}. Best is trial 14 with value: 0.3071020662779782.
running
[I 2024-11-13 05:20:50,850] Trial 23 finished with value: 0.35619060111854334 and parameters: {'model_name': 'KNNImputer', 'n_neighbors': 11165, 'weights': 'distance'}. Best is trial 14 with value: 0.3071020662779782.
running
[I 2024-11-13 05:20:53,028] Trial 31 finished with value: 0.34482590721290174 and parameters: {'model_name': 'VAE', 'batch_size': 1, 'iterations': 1, 'learning_rate': 0.026971344510545853, 'p_miss': 0.287007907785905}. Best is trial 14 with value: 0.3071020662779782.
running
[I 2024-11-13 05:21:01,768] Trial 25 finished with value: 0.30964478151429187 and parameters: {'model_name': 'IterativeImputer', 'estimator': 'Bayesian', 'initial_strategy': 'median', 'n_nearest_features': 2, 'imputation_order': 'arabic', 'sample_posterior': False}. Best is trial 14 with value: 0.3071020662779782.
running
[I 2024-11-13 05:21:04,326] Trial 27 finished with value: 0.3125093917714117 and parameters: {'model_name': 'IterativeImputer', 'estimator': 'Bayesian', 'initial_strategy': 'mean', 'n_nearest_features': 1, 'imputation_order': 'roman', 'sample_posterior': False}. Best is trial 14 with value: 0.3071020662779782.
running
[I 2024-11-13 05:21:04,853] Trial 26 finished with value: 0.30904846254179397 and parameters: {'model_name': 'IterativeImputer', 'estimator': 'Bayesian', 'initial_strategy': 'constant', 'n_nearest_features': 2, 'imputation_order': 'arabic', 'sample_posterior': False}. Best is trial 14 with value: 0.3071020662779782.
running
[I 2024-11-13 05:21:05,709] Trial 30 finished with value: 0.34481213534920657 and parameters: {'model_name': 'VAE', 'batch_size': 3, 'iterations': 23, 'learning_rate': 0.0009997310185973828, 'p_miss': 0.01553069845870339}. Best is trial 14 with value: 0.3071020662779782.
running
[I 2024-11-13 05:21:06,274] Trial 2 finished with value: 0.3466430739853733 and parameters: {'model_name': 'IterativeImputer', 'estimator': 'KNN', 'initial_strategy': 'median', 'n_nearest_features': 1, 'imputation_order': 'random'}. Best is trial 14 with value: 0.3071020662779782.
running
[I 2024-11-13 05:21:09,391] Trial 28 finished with value: 0.31358801247989765 and parameters: {'model_name': 'IterativeImputer', 'estimator': 'Bayesian', 'initial_strategy': 'mean', 'n_nearest_features': 1, 'imputation_order': 'descending', 'sample_posterior': False}. Best is trial 14 with value: 0.3071020662779782.
running
[I 2024-11-13 05:21:12,255] Trial 29 finished with value: 0.31358801247989765 and parameters: {'model_name': 'IterativeImputer', 'estimator': 'Bayesian', 'initial_strategy': 'mean', 'n_nearest_features': 1, 'imputation_order': 'descending', 'sample_posterior': False}. Best is trial 14 with value: 0.3071020662779782.
running
[I 2024-11-13 05:22:19,039] Trial 5 finished with value: 0.3234082716559873 and parameters: {'model_name': 'VAE', 'batch_size': 54, 'iterations': 63, 'learning_rate': 0.010399538455105297, 'p_miss': 0.02057479654337182}. Best is trial 14 with value: 0.3071020662779782.
running
[I 2024-11-13 05:34:44,231] Trial 0 finished with value: 0.3120730467982174 and parameters: {'model_name': 'IterativeImputer', 'estimator': 'RFR', 'initial_strategy': 'mean', 'n_nearest_features': 2, 'imputation_order': 'arabic'}. Best is trial 14 with value: 0.3071020662779782.
running
[I 2024-11-13 05:34:59,528] Trial 22 finished with value: 0.31214914229146384 and parameters: {'model_name': 'IterativeImputer', 'estimator': 'RFR', 'initial_strategy': 'mean', 'n_nearest_features': 2, 'imputation_order': 'ascending'}. Best is trial 14 with value: 0.3071020662779782.
running
[I 2024-11-13 05:35:17,775] Trial 24 finished with value: 0.3111292607178582 and parameters: {'model_name': 'IterativeImputer', 'estimator': 'RFR', 'initial_strategy': 'constant', 'n_nearest_features': 2, 'imputation_order': 'roman'}. Best is trial 14 with value: 0.3071020662779782.
running
[I 2024-11-13 05:47:49,729] Trial 1 finished with value: 0.36102667749328754 and parameters: {'model_name': 'IterativeImputer', 'estimator': 'RFR', 'initial_strategy': 'median', 'n_nearest_features': 6, 'imputation_order': 'descending'}. Best is trial 14 with value: 0.3071020662779782.
running
[I 2024-11-13 06:07:08,998] Trial 9 finished with value: 0.32252619003619026 and parameters: {'model_name': 'VAE', 'batch_size': 294, 'iterations': 766, 'learning_rate': 0.0004960267454521509, 'p_miss': 0.1584874037428795}. Best is trial 14 with value: 0.3071020662779782.
running
[I 2024-11-13 06:14:47,786] Trial 18 finished with value: 0.3226955311406073 and parameters: {'model_name': 'VAE', 'batch_size': 166, 'iterations': 1136, 'learning_rate': 0.000843907402118556, 'p_miss': 0.15710579274377828}. Best is trial 14 with value: 0.3071020662779782.
running
[I 2024-11-13 07:09:15,957] Trial 42 finished with value: 0.6070865107022483 and parameters: {'model_name': 'GAIN', 'batch_size': 677, 'hint_rate': 0.27503472790191, 'alpha': 9, 'iterations': 3884, 'learning_rate': 0.00012154644974709279, 'p_miss': 0.21419068006057526}. Best is trial 14 with value: 0.3071020662779782.
running
[I 2024-11-13 07:09:20,851] Trial 47 finished with value: 0.6055969730558941 and parameters: {'model_name': 'GAIN', 'batch_size': 10, 'hint_rate': 0.9673948502388415, 'alpha': 90, 'iterations': 1, 'learning_rate': 0.08307524169527213, 'p_miss': 0.08322101702743241}. Best is trial 14 with value: 0.3071020662779782.
running
[I 2024-11-13 07:09:31,973] Trial 48 finished with value: 0.30725640415906663 and parameters: {'model_name': 'IterativeImputer', 'estimator': 'Ridge', 'initial_strategy': 'constant', 'n_nearest_features': 3, 'imputation_order': 'arabic'}. Best is trial 14 with value: 0.3071020662779782.
running
[I 2024-11-13 07:09:42,897] Trial 49 finished with value: 0.306616209131712 and parameters: {'model_name': 'IterativeImputer', 'estimator': 'Ridge', 'initial_strategy': 'constant', 'n_nearest_features': 4, 'imputation_order': 'arabic'}. Best is trial 49 with value: 0.306616209131712.
running
[I 2024-11-13 07:09:53,560] Trial 50 finished with value: 0.306616209131712 and parameters: {'model_name': 'IterativeImputer', 'estimator': 'Ridge', 'initial_strategy': 'constant', 'n_nearest_features': 4, 'imputation_order': 'arabic'}. Best is trial 49 with value: 0.306616209131712.
running
[I 2024-11-13 07:10:04,061] Trial 51 finished with value: 0.306616209131712 and parameters: {'model_name': 'IterativeImputer', 'estimator': 'Ridge', 'initial_strategy': 'constant', 'n_nearest_features': 4, 'imputation_order': 'arabic'}. Best is trial 49 with value: 0.306616209131712.
running
[I 2024-11-13 07:10:12,023] Trial 52 finished with value: 0.3065156809650062 and parameters: {'model_name': 'IterativeImputer', 'estimator': 'Ridge', 'initial_strategy': 'most_frequent', 'n_nearest_features': 5, 'imputation_order': 'arabic'}. Best is trial 52 with value: 0.3065156809650062.
running
[I 2024-11-13 07:10:19,892] Trial 53 finished with value: 0.3065156809650062 and parameters: {'model_name': 'IterativeImputer', 'estimator': 'Ridge', 'initial_strategy': 'most_frequent', 'n_nearest_features': 5, 'imputation_order': 'arabic'}. Best is trial 52 with value: 0.3065156809650062.
running
[I 2024-11-13 07:10:32,664] Trial 54 finished with value: 0.6038528193263529 and parameters: {'model_name': 'GAIN', 'batch_size': 18, 'hint_rate': 0.0777915204303416, 'alpha': 98, 'iterations': 7, 'learning_rate': 0.004978640053703992, 'p_miss': 0.28416851172694463}. Best is trial 52 with value: 0.3065156809650062.
running
[I 2024-11-13 07:10:40,898] Trial 55 finished with value: 0.3065156809650062 and parameters: {'model_name': 'IterativeImputer', 'estimator': 'Ridge', 'initial_strategy': 'most_frequent', 'n_nearest_features': 5, 'imputation_order': 'arabic'}. Best is trial 52 with value: 0.3065156809650062.
running
[I 2024-11-13 07:10:48,917] Trial 56 finished with value: 0.3065156809650062 and parameters: {'model_name': 'IterativeImputer', 'estimator': 'Ridge', 'initial_strategy': 'most_frequent', 'n_nearest_features': 5, 'imputation_order': 'arabic'}. Best is trial 52 with value: 0.3065156809650062.
running
[I 2024-11-13 07:10:55,810] Trial 57 finished with value: 0.3065156809650062 and parameters: {'model_name': 'IterativeImputer', 'estimator': 'Ridge', 'initial_strategy': 'most_frequent', 'n_nearest_features': 5, 'imputation_order': 'arabic'}. Best is trial 52 with value: 0.3065156809650062.
running
[I 2024-11-13 07:11:02,964] Trial 58 finished with value: 0.3065156809650062 and parameters: {'model_name': 'IterativeImputer', 'estimator': 'Ridge', 'initial_strategy': 'most_frequent', 'n_nearest_features': 5, 'imputation_order': 'arabic'}. Best is trial 52 with value: 0.3065156809650062.
running
[I 2024-11-13 07:11:10,685] Trial 59 finished with value: 0.3065156809650062 and parameters: {'model_name': 'IterativeImputer', 'estimator': 'Ridge', 'initial_strategy': 'most_frequent', 'n_nearest_features': 5, 'imputation_order': 'arabic'}. Best is trial 52 with value: 0.3065156809650062.
running
[I 2024-11-13 07:11:17,736] Trial 60 finished with value: 0.3065156809650062 and parameters: {'model_name': 'IterativeImputer', 'estimator': 'Ridge', 'initial_strategy': 'most_frequent', 'n_nearest_features': 5, 'imputation_order': 'arabic'}. Best is trial 52 with value: 0.3065156809650062.
running
[I 2024-11-13 07:11:24,922] Trial 61 finished with value: 0.3065156809650062 and parameters: {'model_name': 'IterativeImputer', 'estimator': 'Ridge', 'initial_strategy': 'most_frequent', 'n_nearest_features': 6, 'imputation_order': 'arabic'}. Best is trial 52 with value: 0.3065156809650062.
running
[I 2024-11-13 07:11:32,248] Trial 62 finished with value: 0.3065156809650062 and parameters: {'model_name': 'IterativeImputer', 'estimator': 'Ridge', 'initial_strategy': 'most_frequent', 'n_nearest_features': 5, 'imputation_order': 'arabic'}. Best is trial 52 with value: 0.3065156809650062.
running
[I 2024-11-13 07:11:40,760] Trial 63 finished with value: 0.3065156809650062 and parameters: {'model_name': 'IterativeImputer', 'estimator': 'Ridge', 'initial_strategy': 'most_frequent', 'n_nearest_features': 5, 'imputation_order': 'arabic'}. Best is trial 52 with value: 0.3065156809650062.
running
[I 2024-11-13 07:16:19,426] Trial 32 finished with value: 0.6064186567436977 and parameters: {'model_name': 'GAIN', 'batch_size': 535, 'hint_rate': 0.6092498829571596, 'alpha': 59, 'iterations': 5210, 'learning_rate': 0.00024069629382648296, 'p_miss': 0.01728643055739884}. Best is trial 52 with value: 0.3065156809650062.
running
[I 2024-11-13 07:16:25,842] Trial 65 finished with value: 0.3065156809650062 and parameters: {'model_name': 'IterativeImputer', 'estimator': 'Ridge', 'initial_strategy': 'most_frequent', 'n_nearest_features': 6, 'imputation_order': 'arabic'}. Best is trial 52 with value: 0.3065156809650062.
running
[I 2024-11-13 07:16:33,387] Trial 66 finished with value: 0.3065156809650062 and parameters: {'model_name': 'IterativeImputer', 'estimator': 'Ridge', 'initial_strategy': 'most_frequent', 'n_nearest_features': 5, 'imputation_order': 'arabic'}. Best is trial 52 with value: 0.3065156809650062.
running
[I 2024-11-13 07:16:40,455] Trial 67 finished with value: 0.3065156809650062 and parameters: {'model_name': 'IterativeImputer', 'estimator': 'Ridge', 'initial_strategy': 'most_frequent', 'n_nearest_features': 5, 'imputation_order': 'arabic'}. Best is trial 52 with value: 0.3065156809650062.
running
[I 2024-11-13 07:16:47,541] Trial 68 finished with value: 0.3065156809650062 and parameters: {'model_name': 'IterativeImputer', 'estimator': 'Ridge', 'initial_strategy': 'most_frequent', 'n_nearest_features': 5, 'imputation_order': 'arabic'}. Best is trial 52 with value: 0.3065156809650062.
running
[I 2024-11-13 07:16:55,025] Trial 69 finished with value: 0.3065156809650062 and parameters: {'model_name': 'IterativeImputer', 'estimator': 'Ridge', 'initial_strategy': 'most_frequent', 'n_nearest_features': 6, 'imputation_order': 'arabic'}. Best is trial 52 with value: 0.3065156809650062.
running
[I 2024-11-13 07:17:06,979] Trial 70 finished with value: 0.3064972547572687 and parameters: {'model_name': 'IterativeImputer', 'estimator': 'Ridge', 'initial_strategy': 'most_frequent', 'n_nearest_features': 4, 'imputation_order': 'arabic'}. Best is trial 70 with value: 0.3064972547572687.
running
[I 2024-11-13 07:17:07,694] Trial 71 finished with value: 0.532062439624534 and parameters: {'model_name': 'SimpleImputer', 'strategy': 'most_frequent'}. Best is trial 70 with value: 0.3064972547572687.
running
[I 2024-11-13 07:17:19,670] Trial 72 finished with value: 0.3066947051889795 and parameters: {'model_name': 'IterativeImputer', 'estimator': 'Ridge', 'initial_strategy': 'most_frequent', 'n_nearest_features': 4, 'imputation_order': 'random'}. Best is trial 70 with value: 0.3064972547572687.
running
[I 2024-11-13 07:17:26,529] Trial 73 finished with value: 0.30271037755929664 and parameters: {'model_name': 'KNNImputer', 'n_neighbors': 122, 'weights': 'uniform'}. Best is trial 73 with value: 0.30271037755929664.
running
[I 2024-11-13 07:17:34,380] Trial 74 finished with value: 0.3072905335799222 and parameters: {'model_name': 'KNNImputer', 'n_neighbors': 1106, 'weights': 'uniform'}. Best is trial 73 with value: 0.30271037755929664.
running
[I 2024-11-13 07:17:42,159] Trial 75 finished with value: 0.3213671969548344 and parameters: {'model_name': 'KNNImputer', 'n_neighbors': 21498, 'weights': 'uniform'}. Best is trial 73 with value: 0.30271037755929664.
running
[I 2024-11-13 07:17:45,814] Trial 40 finished with value: 0.6136210491893186 and parameters: {'model_name': 'GAIN', 'batch_size': 781, 'hint_rate': 0.277711048233383, 'alpha': 67, 'iterations': 5018, 'learning_rate': 0.0001164315026963367, 'p_miss': 0.19704974784682855}. Best is trial 73 with value: 0.30271037755929664.
running
[I 2024-11-13 07:17:50,218] Trial 76 finished with value: 0.30730875360595045 and parameters: {'model_name': 'KNNImputer', 'n_neighbors': 1122, 'weights': 'uniform'}. Best is trial 73 with value: 0.30271037755929664.
running
[I 2024-11-13 07:17:53,471] Trial 77 finished with value: 0.3032854733020431 and parameters: {'model_name': 'KNNImputer', 'n_neighbors': 199, 'weights': 'uniform'}. Best is trial 73 with value: 0.30271037755929664.
running
[I 2024-11-13 07:17:59,747] Trial 78 finished with value: 0.3128235062954691 and parameters: {'model_name': 'KNNImputer', 'n_neighbors': 5931, 'weights': 'uniform'}. Best is trial 73 with value: 0.30271037755929664.
running
[I 2024-11-13 07:18:03,380] Trial 79 finished with value: 0.3118429016022053 and parameters: {'model_name': 'KNNImputer', 'n_neighbors': 4777, 'weights': 'uniform'}. Best is trial 73 with value: 0.30271037755929664.
running
[I 2024-11-13 07:18:08,938] Trial 80 finished with value: 0.3117531594120261 and parameters: {'model_name': 'KNNImputer', 'n_neighbors': 4698, 'weights': 'uniform'}. Best is trial 73 with value: 0.30271037755929664.
running
[I 2024-11-13 07:18:12,445] Trial 81 finished with value: 0.3213671969548344 and parameters: {'model_name': 'KNNImputer', 'n_neighbors': 18051, 'weights': 'uniform'}. Best is trial 73 with value: 0.30271037755929664.
running
[I 2024-11-13 07:18:16,143] Trial 82 finished with value: 0.30312933020259825 and parameters: {'model_name': 'KNNImputer', 'n_neighbors': 176, 'weights': 'uniform'}. Best is trial 73 with value: 0.30271037755929664.
running
[I 2024-11-13 07:18:22,648] Trial 84 finished with value: 0.30339961455064807 and parameters: {'model_name': 'KNNImputer', 'n_neighbors': 94, 'weights': 'uniform'}. Best is trial 73 with value: 0.30271037755929664.
running
[I 2024-11-13 07:18:29,776] Trial 85 finished with value: 0.3032007261764367 and parameters: {'model_name': 'KNNImputer', 'n_neighbors': 193, 'weights': 'uniform'}. Best is trial 73 with value: 0.30271037755929664.
running
[I 2024-11-13 07:18:36,812] Trial 86 finished with value: 0.30437257881780544 and parameters: {'model_name': 'KNNImputer', 'n_neighbors': 333, 'weights': 'uniform'}. Best is trial 73 with value: 0.30271037755929664.
running
[I 2024-11-13 07:18:44,236] Trial 87 finished with value: 0.3046537776088567 and parameters: {'model_name': 'KNNImputer', 'n_neighbors': 378, 'weights': 'uniform'}. Best is trial 73 with value: 0.30271037755929664.
running
[I 2024-11-13 07:18:50,912] Trial 88 finished with value: 0.3033700743179464 and parameters: {'model_name': 'KNNImputer', 'n_neighbors': 207, 'weights': 'uniform'}. Best is trial 73 with value: 0.30271037755929664.
running
[I 2024-11-13 07:18:57,857] Trial 89 finished with value: 0.30366151821710397 and parameters: {'model_name': 'KNNImputer', 'n_neighbors': 251, 'weights': 'uniform'}. Best is trial 73 with value: 0.30271037755929664.
running
[I 2024-11-13 07:19:04,774] Trial 90 finished with value: 0.3039801704012274 and parameters: {'model_name': 'KNNImputer', 'n_neighbors': 288, 'weights': 'uniform'}. Best is trial 73 with value: 0.30271037755929664.
running
[I 2024-11-13 07:19:11,404] Trial 91 finished with value: 0.30294285647056396 and parameters: {'model_name': 'KNNImputer', 'n_neighbors': 112, 'weights': 'uniform'}. Best is trial 73 with value: 0.30271037755929664.
running
[I 2024-11-13 07:19:19,405] Trial 92 finished with value: 0.30961176527703177 and parameters: {'model_name': 'KNNImputer', 'n_neighbors': 2634, 'weights': 'uniform'}. Best is trial 73 with value: 0.30271037755929664.
running
[I 2024-11-13 07:19:27,650] Trial 93 finished with value: 0.3096121777263289 and parameters: {'model_name': 'KNNImputer', 'n_neighbors': 2639, 'weights': 'uniform'}. Best is trial 73 with value: 0.30271037755929664.
running
