Run: 59
/cm/local/apps/slurm/var/spool/job1069655/slurm_script: line 27: 
pip install -e tpot2
pip install -r tpot2/ImputerExperiments/requirements_.txt
: No such file or directory
RunStart
Version 0.1.7a0 of tpot2 is outdated. Version 0.1.8a0 was released Tuesday September 17, 2024.
starting loops
../data/c/40922/40922.pkl
working on 
../data/c/40922/class_full_MNAR_0.3_3
2.08476185798645
running experiment 1/3 - Does large hyperparameter space improve reconstruction accuracy over simple
[I 2024-11-24 14:09:06,046] A new study created in memory with name: no-name-0a5f9ed6-9a9e-494d-8876-9b18aa9ac902
running
running
running
running
running
running
running
running
running
running
running
running
running
running
running
running
[I 2024-11-24 14:09:07,083] Trial 14 finished with value: 0.43724576911834967 and parameters: {'model_name': 'SimpleImputer', 'strategy': 'constant'}. Best is trial 14 with value: 0.43724576911834967.
[I 2024-11-24 14:09:07,418] Trial 8 finished with value: 0.1543014748757539 and parameters: {'model_name': 'SimpleImputer', 'strategy': 'mean'}. Best is trial 8 with value: 0.1543014748757539.
running
running
[I 2024-11-24 14:09:07,874] Trial 6 finished with value: 0.43724576911834967 and parameters: {'model_name': 'SimpleImputer', 'strategy': 'constant'}. Best is trial 8 with value: 0.1543014748757539.
running
[I 2024-11-24 14:09:08,454] Trial 13 finished with value: 0.43724576911834967 and parameters: {'model_name': 'SimpleImputer', 'strategy': 'most_frequent'}. Best is trial 8 with value: 0.1543014748757539.
running
[I 2024-11-24 14:09:08,956] Trial 18 finished with value: 0.43724576911834967 and parameters: {'model_name': 'SimpleImputer', 'strategy': 'most_frequent'}. Best is trial 8 with value: 0.1543014748757539.
running
[I 2024-11-24 14:09:16,084] Trial 9 finished with value: 0.15193062521370387 and parameters: {'model_name': 'IterativeImputer', 'estimator': 'Ridge', 'initial_strategy': 'mean', 'n_nearest_features': 1, 'imputation_order': 'descending'}. Best is trial 9 with value: 0.15193062521370387.
running
[I 2024-11-24 14:09:16,398] Trial 21 finished with value: 0.43724576911834967 and parameters: {'model_name': 'SimpleImputer', 'strategy': 'constant'}. Best is trial 9 with value: 0.15193062521370387.
running
[I 2024-11-24 14:09:21,823] Trial 4 finished with value: 0.1080209414616851 and parameters: {'model_name': 'VAE', 'batch_size': 4, 'iterations': 1, 'learning_rate': 0.012705326814376491, 'p_miss': 0.04481337305754637}. Best is trial 4 with value: 0.1080209414616851.
running
[I 2024-11-24 14:09:24,761] Trial 2 finished with value: 0.10338572442572355 and parameters: {'model_name': 'VAE', 'batch_size': 20, 'iterations': 2, 'learning_rate': 0.00967520198352846, 'p_miss': 0.18716837753985308}. Best is trial 2 with value: 0.10338572442572355.
running
[I 2024-11-24 14:09:26,157] Trial 24 finished with value: 0.08405233435168191 and parameters: {'model_name': 'SimpleImputer', 'strategy': 'median'}. Best is trial 24 with value: 0.08405233435168191.
running
[I 2024-11-24 14:09:27,735] Trial 19 finished with value: inf and parameters: {'model_name': 'GAIN', 'batch_size': 2, 'hint_rate': 0.11754513737272397, 'alpha': 91, 'iterations': 49, 'learning_rate': 0.08976226057435495, 'p_miss': 0.15632900027259292}. Best is trial 24 with value: 0.08405233435168191.
running
[I 2024-11-24 14:09:30,076] Trial 15 finished with value: 0.381640137486687 and parameters: {'model_name': 'GAIN', 'batch_size': 8, 'hint_rate': 0.3840611028180116, 'alpha': 66, 'iterations': 8, 'learning_rate': 0.00010197439052592717, 'p_miss': 0.276791427020225}. Best is trial 24 with value: 0.08405233435168191.
running
[I 2024-11-24 14:09:30,403] Trial 23 finished with value: 0.11768730451121359 and parameters: {'model_name': 'VAE', 'batch_size': 110, 'iterations': 1, 'learning_rate': 0.0010920871935266015, 'p_miss': 0.22587239783337074}. Best is trial 24 with value: 0.08405233435168191.
running
[I 2024-11-24 14:09:39,301] Trial 20 finished with value: 0.14887871241133888 and parameters: {'model_name': 'VAE', 'batch_size': 2, 'iterations': 10, 'learning_rate': 0.020046712130591192, 'p_miss': 0.27154717591882954}. Best is trial 24 with value: 0.08405233435168191.
running
[I 2024-11-24 14:09:54,826] Trial 16 finished with value: 0.15327612398750928 and parameters: {'model_name': 'IterativeImputer', 'estimator': 'Bayesian', 'initial_strategy': 'constant', 'n_nearest_features': 1, 'imputation_order': 'arabic', 'sample_posterior': False}. Best is trial 24 with value: 0.08405233435168191.
running
[I 2024-11-24 14:10:12,463] Trial 7 finished with value: 0.17109496983247316 and parameters: {'model_name': 'IterativeImputer', 'estimator': 'KNN', 'initial_strategy': 'median', 'n_nearest_features': 3, 'imputation_order': 'random'}. Best is trial 24 with value: 0.08405233435168191.
running
[I 2024-11-24 14:10:20,724] Trial 5 finished with value: 0.16949868439223398 and parameters: {'model_name': 'IterativeImputer', 'estimator': 'KNN', 'initial_strategy': 'constant', 'n_nearest_features': 4, 'imputation_order': 'random'}. Best is trial 24 with value: 0.08405233435168191.
running
[I 2024-11-24 14:10:46,734] Trial 0 finished with value: 0.15430147487575394 and parameters: {'model_name': 'KNNImputer', 'n_neighbors': 70236, 'weights': 'uniform'}. Best is trial 24 with value: 0.08405233435168191.
running
[I 2024-11-24 14:10:49,093] Trial 22 finished with value: 0.1513596018038015 and parameters: {'model_name': 'KNNImputer', 'n_neighbors': 9517, 'weights': 'uniform'}. Best is trial 24 with value: 0.08405233435168191.
running
[I 2024-11-24 14:11:16,925] Trial 28 finished with value: 0.1766026468748456 and parameters: {'model_name': 'KNNImputer', 'n_neighbors': 11834, 'weights': 'distance'}. Best is trial 24 with value: 0.08405233435168191.
running
[I 2024-11-24 14:11:20,527] Trial 26 finished with value: 0.1767534816572887 and parameters: {'model_name': 'KNNImputer', 'n_neighbors': 15747, 'weights': 'distance'}. Best is trial 24 with value: 0.08405233435168191.
running
[I 2024-11-24 14:11:25,100] Trial 36 finished with value: 0.11261698900488766 and parameters: {'model_name': 'VAE', 'batch_size': 26, 'iterations': 1, 'learning_rate': 0.005536277893355611, 'p_miss': 0.017946015538871173}. Best is trial 24 with value: 0.08405233435168191.
running
[I 2024-11-24 14:11:31,146] Trial 25 finished with value: 0.15428266229630822 and parameters: {'model_name': 'KNNImputer', 'n_neighbors': 53557, 'weights': 'uniform'}. Best is trial 24 with value: 0.08405233435168191.
running
[I 2024-11-24 14:11:34,966] Trial 12 finished with value: 0.17741155595711952 and parameters: {'model_name': 'KNNImputer', 'n_neighbors': 49565, 'weights': 'distance'}. Best is trial 24 with value: 0.08405233435168191.
running
[I 2024-11-24 14:11:44,281] Trial 30 finished with value: 0.1540842651271088 and parameters: {'model_name': 'KNNImputer', 'n_neighbors': 43541, 'weights': 'uniform'}. Best is trial 24 with value: 0.08405233435168191.
running
[I 2024-11-24 14:11:47,233] Trial 29 finished with value: 0.17730930987333335 and parameters: {'model_name': 'KNNImputer', 'n_neighbors': 33575, 'weights': 'distance'}. Best is trial 24 with value: 0.08405233435168191.
running
[I 2024-11-24 14:12:00,978] Trial 31 finished with value: 0.15422887544798078 and parameters: {'model_name': 'KNNImputer', 'n_neighbors': 52098, 'weights': 'uniform'}. Best is trial 24 with value: 0.08405233435168191.
running
[I 2024-11-24 14:12:04,148] Trial 33 finished with value: 0.1760378704519822 and parameters: {'model_name': 'KNNImputer', 'n_neighbors': 5130, 'weights': 'distance'}. Best is trial 24 with value: 0.08405233435168191.
running
[I 2024-11-24 14:12:13,998] Trial 32 finished with value: 0.1772778116931349 and parameters: {'model_name': 'KNNImputer', 'n_neighbors': 31900, 'weights': 'distance'}. Best is trial 24 with value: 0.08405233435168191.
running
[I 2024-11-24 14:25:14,905] Trial 11 finished with value: 0.4075949709356258 and parameters: {'model_name': 'GAIN', 'batch_size': 28, 'hint_rate': 0.15747878400496956, 'alpha': 9, 'iterations': 696, 'learning_rate': 0.06960663833325374, 'p_miss': 0.16579309786926655}. Best is trial 24 with value: 0.08405233435168191.
running
[I 2024-11-24 14:25:32,076] Trial 45 finished with value: 0.11175884213470759 and parameters: {'model_name': 'VAE', 'batch_size': 997, 'iterations': 1, 'learning_rate': 0.005512863475572503, 'p_miss': 0.032577949773328285}. Best is trial 24 with value: 0.08405233435168191.
running
[I 2024-11-24 14:25:43,858] Trial 46 finished with value: 0.10622658882110499 and parameters: {'model_name': 'VAE', 'batch_size': 348, 'iterations': 1, 'learning_rate': 0.005769489419289594, 'p_miss': 0.02922285184328005}. Best is trial 24 with value: 0.08405233435168191.
running
[I 2024-11-24 14:26:23,215] Trial 47 finished with value: 0.14377801433531676 and parameters: {'model_name': 'VAE', 'batch_size': 183, 'iterations': 6, 'learning_rate': 0.012184723073322487, 'p_miss': 0.07857299519804042}. Best is trial 24 with value: 0.08405233435168191.
running
[I 2024-11-24 14:26:28,982] Trial 48 finished with value: 0.12364450978564326 and parameters: {'model_name': 'VAE', 'batch_size': 7, 'iterations': 1, 'learning_rate': 0.001345363841057585, 'p_miss': 0.08789537648497202}. Best is trial 24 with value: 0.08405233435168191.
running
[I 2024-11-24 14:43:08,012] Trial 44 finished with value: 0.17335738377970694 and parameters: {'model_name': 'VAE', 'batch_size': 21, 'iterations': 532, 'learning_rate': 0.007285897606205921, 'p_miss': 0.018555597556967316}. Best is trial 24 with value: 0.08405233435168191.
running
[I 2024-11-24 14:43:37,556] Trial 50 finished with value: 0.1818608525328785 and parameters: {'model_name': 'VAE', 'batch_size': 116, 'iterations': 4, 'learning_rate': 0.026206648083779052, 'p_miss': 0.0925494224166483}. Best is trial 24 with value: 0.08405233435168191.
running
[I 2024-11-24 14:45:48,928] Trial 51 finished with value: 0.11415358853684823 and parameters: {'model_name': 'VAE', 'batch_size': 1, 'iterations': 38, 'learning_rate': 0.0013982604646620626, 'p_miss': 0.2038801881505451}. Best is trial 24 with value: 0.08405233435168191.
running
[I 2024-11-24 15:11:04,788] Trial 1 finished with value: 0.4059910544286026 and parameters: {'model_name': 'GAIN', 'batch_size': 198, 'hint_rate': 0.834499926658602, 'alpha': 20, 'iterations': 2408, 'learning_rate': 0.020585585481278132, 'p_miss': 0.28841781780924625}. Best is trial 24 with value: 0.08405233435168191.
running
[I 2024-11-24 15:11:16,642] Trial 53 finished with value: 0.11223810304426933 and parameters: {'model_name': 'VAE', 'batch_size': 7, 'iterations': 3, 'learning_rate': 0.002574562981950279, 'p_miss': 0.1219698910916364}. Best is trial 24 with value: 0.08405233435168191.
running
[I 2024-11-24 15:13:25,782] Trial 54 finished with value: 0.12426760199722846 and parameters: {'model_name': 'VAE', 'batch_size': 913, 'iterations': 21, 'learning_rate': 0.0031227258565867406, 'p_miss': 0.050579132598310775}. Best is trial 24 with value: 0.08405233435168191.
running
[I 2024-11-24 15:13:27,343] Trial 55 finished with value: 0.08405233435168191 and parameters: {'model_name': 'SimpleImputer', 'strategy': 'median'}. Best is trial 24 with value: 0.08405233435168191.
running
[I 2024-11-24 15:13:28,785] Trial 56 finished with value: 0.08405233435168191 and parameters: {'model_name': 'SimpleImputer', 'strategy': 'median'}. Best is trial 24 with value: 0.08405233435168191.
running
[I 2024-11-24 15:13:30,177] Trial 57 finished with value: 0.08405233435168191 and parameters: {'model_name': 'SimpleImputer', 'strategy': 'median'}. Best is trial 24 with value: 0.08405233435168191.
running
[I 2024-11-24 15:13:31,754] Trial 58 finished with value: 0.08405233435168191 and parameters: {'model_name': 'SimpleImputer', 'strategy': 'median'}. Best is trial 24 with value: 0.08405233435168191.
running
[I 2024-11-24 15:13:33,217] Trial 59 finished with value: 0.08405233435168191 and parameters: {'model_name': 'SimpleImputer', 'strategy': 'median'}. Best is trial 24 with value: 0.08405233435168191.
running
[I 2024-11-24 15:13:34,708] Trial 60 finished with value: 0.08405233435168191 and parameters: {'model_name': 'SimpleImputer', 'strategy': 'median'}. Best is trial 24 with value: 0.08405233435168191.
running
[I 2024-11-24 15:13:36,091] Trial 61 finished with value: 0.08405233435168191 and parameters: {'model_name': 'SimpleImputer', 'strategy': 'median'}. Best is trial 24 with value: 0.08405233435168191.
running
[I 2024-11-24 15:13:37,449] Trial 62 finished with value: 0.08405233435168191 and parameters: {'model_name': 'SimpleImputer', 'strategy': 'median'}. Best is trial 24 with value: 0.08405233435168191.
running
[I 2024-11-24 15:13:38,680] Trial 63 finished with value: 0.08405233435168191 and parameters: {'model_name': 'SimpleImputer', 'strategy': 'median'}. Best is trial 24 with value: 0.08405233435168191.
running
[I 2024-11-24 15:13:40,240] Trial 64 finished with value: 0.08405233435168191 and parameters: {'model_name': 'SimpleImputer', 'strategy': 'median'}. Best is trial 24 with value: 0.08405233435168191.
running
[I 2024-11-24 15:13:41,669] Trial 65 finished with value: 0.08405233435168191 and parameters: {'model_name': 'SimpleImputer', 'strategy': 'median'}. Best is trial 24 with value: 0.08405233435168191.
running
[I 2024-11-24 15:13:43,153] Trial 66 finished with value: 0.08405233435168191 and parameters: {'model_name': 'SimpleImputer', 'strategy': 'median'}. Best is trial 24 with value: 0.08405233435168191.
running
[I 2024-11-24 15:13:44,667] Trial 67 finished with value: 0.08405233435168191 and parameters: {'model_name': 'SimpleImputer', 'strategy': 'median'}. Best is trial 24 with value: 0.08405233435168191.
running
[I 2024-11-24 15:13:46,082] Trial 68 finished with value: 0.08405233435168191 and parameters: {'model_name': 'SimpleImputer', 'strategy': 'median'}. Best is trial 24 with value: 0.08405233435168191.
running
[I 2024-11-24 15:13:47,539] Trial 69 finished with value: 0.08405233435168191 and parameters: {'model_name': 'SimpleImputer', 'strategy': 'median'}. Best is trial 24 with value: 0.08405233435168191.
running
[I 2024-11-24 15:13:48,950] Trial 70 finished with value: 0.08405233435168191 and parameters: {'model_name': 'SimpleImputer', 'strategy': 'median'}. Best is trial 24 with value: 0.08405233435168191.
running
[I 2024-11-24 15:36:22,742] Trial 42 finished with value: 0.16720310550735135 and parameters: {'model_name': 'VAE', 'batch_size': 20, 'iterations': 1272, 'learning_rate': 0.010695272176890624, 'p_miss': 0.06553652242224244}. Best is trial 24 with value: 0.08405233435168191.
running
[I 2024-11-24 16:17:01,169] Trial 43 finished with value: 0.16667262523149282 and parameters: {'model_name': 'VAE', 'batch_size': 711, 'iterations': 1889, 'learning_rate': 0.008561232463599891, 'p_miss': 0.018488745998840518}. Best is trial 24 with value: 0.08405233435168191.
running
[I 2024-11-24 16:18:21,458] Trial 27 finished with value: 0.16734096870117182 and parameters: {'model_name': 'VAE', 'batch_size': 432, 'iterations': 2185, 'learning_rate': 0.0018690214503762257, 'p_miss': 0.20108696552257882}. Best is trial 24 with value: 0.08405233435168191.
running
[I 2024-11-24 16:21:46,927] Trial 3 finished with value: 0.18699173414940046 and parameters: {'model_name': 'VAE', 'batch_size': 8, 'iterations': 2747, 'learning_rate': 0.0007541749532637894, 'p_miss': 0.17946938427632658}. Best is trial 24 with value: 0.08405233435168191.
running
[I 2024-11-24 16:41:54,710] Trial 49 finished with value: 0.1865056694321785 and parameters: {'model_name': 'VAE', 'batch_size': 7, 'iterations': 2839, 'learning_rate': 0.01875362428347679, 'p_miss': 0.08981650746479757}. Best is trial 24 with value: 0.08405233435168191.
running
[I 2024-11-24 16:41:55,897] Trial 76 finished with value: 0.08405233435168191 and parameters: {'model_name': 'SimpleImputer', 'strategy': 'median'}. Best is trial 24 with value: 0.08405233435168191.
running
[I 2024-11-24 16:41:57,129] Trial 77 finished with value: 0.08405233435168191 and parameters: {'model_name': 'SimpleImputer', 'strategy': 'median'}. Best is trial 24 with value: 0.08405233435168191.
running
[I 2024-11-24 16:52:03,717] Trial 10 finished with value: 0.15785743093687568 and parameters: {'model_name': 'IterativeImputer', 'estimator': 'RFR', 'initial_strategy': 'constant', 'n_nearest_features': 6, 'imputation_order': 'roman'}. Best is trial 24 with value: 0.08405233435168191.
running
[I 2024-11-24 16:52:04,674] Trial 79 finished with value: 0.08405233435168191 and parameters: {'model_name': 'SimpleImputer', 'strategy': 'median'}. Best is trial 24 with value: 0.08405233435168191.
running
[I 2024-11-24 16:54:18,715] Trial 17 finished with value: 0.1770354733841894 and parameters: {'model_name': 'VAE', 'batch_size': 11, 'iterations': 3377, 'learning_rate': 0.0004584379967824181, 'p_miss': 0.22703574955372088}. Best is trial 24 with value: 0.08405233435168191.
running
[I 2024-11-24 16:54:31,023] Trial 80 finished with value: 0.40383921365176906 and parameters: {'model_name': 'GAIN', 'batch_size': 48, 'hint_rate': 0.987621915092022, 'alpha': 46, 'iterations': 131, 'learning_rate': 0.00038927345913334407, 'p_miss': 0.12588288722499968}. Best is trial 24 with value: 0.08405233435168191.
running
[I 2024-11-24 16:54:42,177] Trial 82 finished with value: 0.15023572077238162 and parameters: {'model_name': 'IterativeImputer', 'estimator': 'Ridge', 'initial_strategy': 'most_frequent', 'n_nearest_features': 6, 'imputation_order': 'ascending'}. Best is trial 24 with value: 0.08405233435168191.
running
[I 2024-11-24 16:54:43,271] Trial 83 finished with value: 0.08405233435168191 and parameters: {'model_name': 'SimpleImputer', 'strategy': 'median'}. Best is trial 24 with value: 0.08405233435168191.
running
[I 2024-11-24 16:54:44,106] Trial 84 finished with value: 0.1543014748757539 and parameters: {'model_name': 'SimpleImputer', 'strategy': 'mean'}. Best is trial 24 with value: 0.08405233435168191.
running
[I 2024-11-24 16:54:45,320] Trial 85 finished with value: 0.08405233435168191 and parameters: {'model_name': 'SimpleImputer', 'strategy': 'median'}. Best is trial 24 with value: 0.08405233435168191.
running
[I 2024-11-24 16:54:46,358] Trial 86 finished with value: 0.08405233435168191 and parameters: {'model_name': 'SimpleImputer', 'strategy': 'median'}. Best is trial 24 with value: 0.08405233435168191.
running
[I 2024-11-24 16:54:47,419] Trial 87 finished with value: 0.08405233435168191 and parameters: {'model_name': 'SimpleImputer', 'strategy': 'median'}. Best is trial 24 with value: 0.08405233435168191.
running
[I 2024-11-24 16:54:48,502] Trial 88 finished with value: 0.08405233435168191 and parameters: {'model_name': 'SimpleImputer', 'strategy': 'median'}. Best is trial 24 with value: 0.08405233435168191.
running
[I 2024-11-24 16:54:49,602] Trial 89 finished with value: 0.08405233435168191 and parameters: {'model_name': 'SimpleImputer', 'strategy': 'median'}. Best is trial 24 with value: 0.08405233435168191.
running
[I 2024-11-24 16:54:50,640] Trial 90 finished with value: 0.08405233435168191 and parameters: {'model_name': 'SimpleImputer', 'strategy': 'median'}. Best is trial 24 with value: 0.08405233435168191.
running
[I 2024-11-24 16:54:51,701] Trial 91 finished with value: 0.08405233435168191 and parameters: {'model_name': 'SimpleImputer', 'strategy': 'median'}. Best is trial 24 with value: 0.08405233435168191.
running
[I 2024-11-24 16:55:23,537] Trial 92 finished with value: inf and parameters: {'model_name': 'GAIN', 'batch_size': 1, 'hint_rate': 0.6243193471838436, 'alpha': 100, 'iterations': 155, 'learning_rate': 0.00017086308094140448, 'p_miss': 0.24881597893509208}. Best is trial 24 with value: 0.08405233435168191.
running
[I 2024-11-24 16:56:15,269] Trial 93 finished with value: 0.25002874521063245 and parameters: {'model_name': 'IterativeImputer', 'estimator': 'Bayesian', 'initial_strategy': 'most_frequent', 'n_nearest_features': 4, 'imputation_order': 'descending', 'sample_posterior': True}. Best is trial 24 with value: 0.08405233435168191.
running
[I 2024-11-24 16:56:16,386] Trial 94 finished with value: 0.08405233435168191 and parameters: {'model_name': 'SimpleImputer', 'strategy': 'median'}. Best is trial 24 with value: 0.08405233435168191.
running
[I 2024-11-24 16:56:17,123] Trial 95 finished with value: 0.1543014748757539 and parameters: {'model_name': 'SimpleImputer', 'strategy': 'mean'}. Best is trial 24 with value: 0.08405233435168191.
running
[I 2024-11-24 16:56:18,114] Trial 96 finished with value: 0.08405233435168191 and parameters: {'model_name': 'SimpleImputer', 'strategy': 'median'}. Best is trial 24 with value: 0.08405233435168191.
running
[I 2024-11-24 16:56:19,285] Trial 97 finished with value: 0.08405233435168191 and parameters: {'model_name': 'SimpleImputer', 'strategy': 'median'}. Best is trial 24 with value: 0.08405233435168191.
running
[I 2024-11-24 16:56:20,677] Trial 98 finished with value: 0.43724576911834967 and parameters: {'model_name': 'SimpleImputer', 'strategy': 'most_frequent'}. Best is trial 24 with value: 0.08405233435168191.
running
[I 2024-11-24 16:56:21,304] Trial 99 finished with value: 0.43724576911834967 and parameters: {'model_name': 'SimpleImputer', 'strategy': 'constant'}. Best is trial 24 with value: 0.08405233435168191.
running
[I 2024-11-24 16:56:22,291] Trial 100 finished with value: 0.08405233435168191 and parameters: {'model_name': 'SimpleImputer', 'strategy': 'median'}. Best is trial 24 with value: 0.08405233435168191.
running
[I 2024-11-24 16:56:23,521] Trial 101 finished with value: 0.08405233435168191 and parameters: {'model_name': 'SimpleImputer', 'strategy': 'median'}. Best is trial 24 with value: 0.08405233435168191.
running
