Run: 19
/cm/local/apps/slurm/var/spool/job924612/slurm_script: line 26: 
pip install -e tpot2
pip install -r tpot2/ImputerExperiments/requirements_.txt
: No such file or directory
RunStart
starting loops
../data/c/26/26.pkl
working on 
../data/c/26/class_simple_MAR_0.3_1
1.6464033126831055
running experiment 1/3 - Does large hyperparameter space improve reconstruction accuracy over simple
[I 2024-08-16 10:57:19,992] A new study created in memory with name: no-name-cd0ef30a-301f-4d2b-a23a-4eb99e17af43
running
running
running
running
running
running
running
running
running
running
running
running
running
running
running
running
[I 2024-08-16 10:57:21,043] Trial 12 finished with value: 0.1710077841200535 and parameters: {'model_name': 'SimpleImputer', 'strategy': 'constant'}. Best is trial 12 with value: 0.1710077841200535.
running
[I 2024-08-16 10:57:21,276] Trial 7 finished with value: 0.1710077841200535 and parameters: {'model_name': 'SimpleImputer', 'strategy': 'constant'}. Best is trial 12 with value: 0.1710077841200535.
running
[I 2024-08-16 10:57:21,385] Trial 4 finished with value: 0.1431743055927738 and parameters: {'model_name': 'SimpleImputer', 'strategy': 'mean'}. Best is trial 4 with value: 0.1431743055927738.
running
[I 2024-08-16 10:57:21,533] Trial 15 finished with value: 0.1431743055927738 and parameters: {'model_name': 'SimpleImputer', 'strategy': 'mean'}. Best is trial 4 with value: 0.1431743055927738.
running
[I 2024-08-16 10:57:21,723] Trial 5 finished with value: 0.1431743055927738 and parameters: {'model_name': 'SimpleImputer', 'strategy': 'mean'}. Best is trial 4 with value: 0.1431743055927738.
running
[I 2024-08-16 10:57:22,020] Trial 2 finished with value: 0.1431743055927738 and parameters: {'model_name': 'SimpleImputer', 'strategy': 'mean'}. Best is trial 4 with value: 0.1431743055927738.
running
[I 2024-08-16 10:57:22,572] Trial 11 finished with value: 0.1710077841200535 and parameters: {'model_name': 'SimpleImputer', 'strategy': 'median'}. Best is trial 4 with value: 0.1431743055927738.
[I 2024-08-16 10:57:22,666] Trial 6 finished with value: 0.1710077841200535 and parameters: {'model_name': 'SimpleImputer', 'strategy': 'median'}. Best is trial 4 with value: 0.1431743055927738.
running
[I 2024-08-16 10:57:22,749] Trial 10 finished with value: 0.1710077841200535 and parameters: {'model_name': 'SimpleImputer', 'strategy': 'median'}. Best is trial 4 with value: 0.1431743055927738.
running
[I 2024-08-16 10:57:22,835] Trial 0 finished with value: 0.1710077841200535 and parameters: {'model_name': 'SimpleImputer', 'strategy': 'median'}. Best is trial 4 with value: 0.1431743055927738.
running
running
[I 2024-08-16 10:57:23,087] Trial 8 finished with value: 0.1710077841200535 and parameters: {'model_name': 'SimpleImputer', 'strategy': 'median'}. Best is trial 4 with value: 0.1431743055927738.
running
[I 2024-08-16 10:57:23,542] Trial 17 finished with value: 0.1431743055927738 and parameters: {'model_name': 'SimpleImputer', 'strategy': 'mean'}. Best is trial 4 with value: 0.1431743055927738.
running
[I 2024-08-16 10:57:23,709] Trial 21 finished with value: 0.1710077841200535 and parameters: {'model_name': 'SimpleImputer', 'strategy': 'constant'}. Best is trial 4 with value: 0.1431743055927738.
running
[I 2024-08-16 10:57:24,312] Trial 16 finished with value: 0.1710077841200535 and parameters: {'model_name': 'SimpleImputer', 'strategy': 'median'}. Best is trial 4 with value: 0.1431743055927738.
running
[I 2024-08-16 10:57:24,627] Trial 22 finished with value: 0.1710077841200535 and parameters: {'model_name': 'SimpleImputer', 'strategy': 'constant'}. Best is trial 4 with value: 0.1431743055927738.
running
[I 2024-08-16 10:57:24,739] Trial 19 finished with value: 0.1710077841200535 and parameters: {'model_name': 'SimpleImputer', 'strategy': 'median'}. Best is trial 4 with value: 0.1431743055927738.
running
[I 2024-08-16 10:57:24,855] Trial 18 finished with value: 0.1710077841200535 and parameters: {'model_name': 'SimpleImputer', 'strategy': 'median'}. Best is trial 4 with value: 0.1431743055927738.
running
[I 2024-08-16 10:57:25,199] Trial 20 finished with value: 0.1710077841200535 and parameters: {'model_name': 'SimpleImputer', 'strategy': 'median'}. Best is trial 4 with value: 0.1431743055927738.
running
[I 2024-08-16 10:57:25,444] Trial 26 finished with value: 0.1431743055927738 and parameters: {'model_name': 'SimpleImputer', 'strategy': 'mean'}. Best is trial 4 with value: 0.1431743055927738.
running
[I 2024-08-16 10:57:25,699] Trial 14 finished with value: 0.1710077841200535 and parameters: {'model_name': 'SimpleImputer', 'strategy': 'most_frequent'}. Best is trial 4 with value: 0.1431743055927738.
running
[I 2024-08-16 10:57:26,457] Trial 3 finished with value: 0.1710077841200535 and parameters: {'model_name': 'SimpleImputer', 'strategy': 'most_frequent'}. Best is trial 4 with value: 0.1431743055927738.
running
[I 2024-08-16 10:57:26,632] Trial 9 finished with value: 0.1710077841200535 and parameters: {'model_name': 'SimpleImputer', 'strategy': 'most_frequent'}. Best is trial 4 with value: 0.1431743055927738.
running
[I 2024-08-16 10:57:26,861] Trial 1 finished with value: 0.1710077841200535 and parameters: {'model_name': 'SimpleImputer', 'strategy': 'most_frequent'}. Best is trial 4 with value: 0.1431743055927738.
running
[I 2024-08-16 10:57:27,571] Trial 13 finished with value: 0.1710077841200535 and parameters: {'model_name': 'SimpleImputer', 'strategy': 'most_frequent'}. Best is trial 4 with value: 0.1431743055927738.
running
[I 2024-08-16 10:57:27,803] Trial 34 finished with value: 0.1431743055927738 and parameters: {'model_name': 'SimpleImputer', 'strategy': 'mean'}. Best is trial 4 with value: 0.1431743055927738.
running
[I 2024-08-16 10:57:28,141] Trial 35 finished with value: 0.1431743055927738 and parameters: {'model_name': 'SimpleImputer', 'strategy': 'mean'}. Best is trial 4 with value: 0.1431743055927738.
running
[I 2024-08-16 10:57:28,592] Trial 37 finished with value: 0.1431743055927738 and parameters: {'model_name': 'SimpleImputer', 'strategy': 'mean'}. Best is trial 4 with value: 0.1431743055927738.
running
[I 2024-08-16 10:57:28,723] Trial 36 finished with value: 0.1431743055927738 and parameters: {'model_name': 'SimpleImputer', 'strategy': 'mean'}. Best is trial 4 with value: 0.1431743055927738.
running
[I 2024-08-16 10:57:29,025] Trial 38 finished with value: 0.1431743055927738 and parameters: {'model_name': 'SimpleImputer', 'strategy': 'mean'}. Best is trial 4 with value: 0.1431743055927738.
running
[I 2024-08-16 10:57:30,003] Trial 24 finished with value: 0.1710077841200535 and parameters: {'model_name': 'SimpleImputer', 'strategy': 'most_frequent'}. Best is trial 4 with value: 0.1431743055927738.
running
[I 2024-08-16 10:57:30,131] Trial 39 finished with value: 0.1431743055927738 and parameters: {'model_name': 'SimpleImputer', 'strategy': 'mean'}. Best is trial 4 with value: 0.1431743055927738.
[I 2024-08-16 10:57:30,226] Trial 25 finished with value: 0.1710077841200535 and parameters: {'model_name': 'SimpleImputer', 'strategy': 'most_frequent'}. Best is trial 4 with value: 0.1431743055927738.
running
running
[I 2024-08-16 10:57:30,329] Trial 23 finished with value: 0.1710077841200535 and parameters: {'model_name': 'SimpleImputer', 'strategy': 'most_frequent'}. Best is trial 4 with value: 0.1431743055927738.
running
[I 2024-08-16 10:57:30,561] Trial 40 finished with value: 0.1431743055927738 and parameters: {'model_name': 'SimpleImputer', 'strategy': 'mean'}. Best is trial 4 with value: 0.1431743055927738.
running
[I 2024-08-16 10:57:30,721] Trial 29 finished with value: 0.1710077841200535 and parameters: {'model_name': 'SimpleImputer', 'strategy': 'most_frequent'}. Best is trial 4 with value: 0.1431743055927738.
running
[I 2024-08-16 10:57:30,831] Trial 41 finished with value: 0.1431743055927738 and parameters: {'model_name': 'SimpleImputer', 'strategy': 'mean'}. Best is trial 4 with value: 0.1431743055927738.
running
[I 2024-08-16 10:57:31,125] Trial 28 finished with value: 0.1710077841200535 and parameters: {'model_name': 'SimpleImputer', 'strategy': 'most_frequent'}. Best is trial 4 with value: 0.1431743055927738.
running
[I 2024-08-16 10:57:31,262] Trial 44 finished with value: 0.1431743055927738 and parameters: {'model_name': 'SimpleImputer', 'strategy': 'mean'}. Best is trial 4 with value: 0.1431743055927738.
running
[I 2024-08-16 10:57:31,504] Trial 42 finished with value: 0.1431743055927738 and parameters: {'model_name': 'SimpleImputer', 'strategy': 'mean'}. Best is trial 4 with value: 0.1431743055927738.
running
[I 2024-08-16 10:57:31,635] Trial 32 finished with value: 0.1710077841200535 and parameters: {'model_name': 'SimpleImputer', 'strategy': 'most_frequent'}. Best is trial 4 with value: 0.1431743055927738.
running
[I 2024-08-16 10:57:31,875] Trial 43 finished with value: 0.1431743055927738 and parameters: {'model_name': 'SimpleImputer', 'strategy': 'mean'}. Best is trial 4 with value: 0.1431743055927738.
running
[I 2024-08-16 10:57:32,047] Trial 27 finished with value: 0.1710077841200535 and parameters: {'model_name': 'SimpleImputer', 'strategy': 'most_frequent'}. Best is trial 4 with value: 0.1431743055927738.
[I 2024-08-16 10:57:32,166] Trial 31 finished with value: 0.1710077841200535 and parameters: {'model_name': 'SimpleImputer', 'strategy': 'most_frequent'}. Best is trial 4 with value: 0.1431743055927738.
running
running
[I 2024-08-16 10:57:32,534] Trial 46 finished with value: 0.1431743055927738 and parameters: {'model_name': 'SimpleImputer', 'strategy': 'mean'}. Best is trial 4 with value: 0.1431743055927738.
running
[I 2024-08-16 10:57:32,675] Trial 30 finished with value: 0.1710077841200535 and parameters: {'model_name': 'SimpleImputer', 'strategy': 'most_frequent'}. Best is trial 4 with value: 0.1431743055927738.
running
[I 2024-08-16 10:57:32,803] Trial 51 finished with value: 0.1431743055927738 and parameters: {'model_name': 'SimpleImputer', 'strategy': 'mean'}. Best is trial 4 with value: 0.1431743055927738.
[I 2024-08-16 10:57:32,898] Trial 48 finished with value: 0.1431743055927738 and parameters: {'model_name': 'SimpleImputer', 'strategy': 'mean'}. Best is trial 4 with value: 0.1431743055927738.
running
running
[I 2024-08-16 10:57:33,025] Trial 49 finished with value: 0.1431743055927738 and parameters: {'model_name': 'SimpleImputer', 'strategy': 'mean'}. Best is trial 4 with value: 0.1431743055927738.
running
[I 2024-08-16 10:57:33,207] Trial 47 finished with value: 0.1431743055927738 and parameters: {'model_name': 'SimpleImputer', 'strategy': 'mean'}. Best is trial 4 with value: 0.1431743055927738.
running
[I 2024-08-16 10:57:33,373] Trial 45 finished with value: 0.1431743055927738 and parameters: {'model_name': 'SimpleImputer', 'strategy': 'mean'}. Best is trial 4 with value: 0.1431743055927738.
running
[I 2024-08-16 10:57:33,498] Trial 50 finished with value: 0.1431743055927738 and parameters: {'model_name': 'SimpleImputer', 'strategy': 'mean'}. Best is trial 4 with value: 0.1431743055927738.
running
[I 2024-08-16 10:57:33,603] Trial 33 finished with value: 0.1710077841200535 and parameters: {'model_name': 'SimpleImputer', 'strategy': 'most_frequent'}. Best is trial 4 with value: 0.1431743055927738.
running
[I 2024-08-16 10:57:33,863] Trial 52 finished with value: 0.1431743055927738 and parameters: {'model_name': 'SimpleImputer', 'strategy': 'mean'}. Best is trial 4 with value: 0.1431743055927738.
running
[I 2024-08-16 10:57:33,990] Trial 54 finished with value: 0.1431743055927738 and parameters: {'model_name': 'SimpleImputer', 'strategy': 'mean'}. Best is trial 4 with value: 0.1431743055927738.
running
[I 2024-08-16 10:57:34,142] Trial 55 finished with value: 0.1431743055927738 and parameters: {'model_name': 'SimpleImputer', 'strategy': 'mean'}. Best is trial 4 with value: 0.1431743055927738.
running
[I 2024-08-16 10:57:34,296] Trial 53 finished with value: 0.1431743055927738 and parameters: {'model_name': 'SimpleImputer', 'strategy': 'mean'}. Best is trial 4 with value: 0.1431743055927738.
running
[I 2024-08-16 10:57:34,431] Trial 58 finished with value: 0.1431743055927738 and parameters: {'model_name': 'SimpleImputer', 'strategy': 'mean'}. Best is trial 4 with value: 0.1431743055927738.
running
[I 2024-08-16 10:57:34,551] Trial 57 finished with value: 0.1431743055927738 and parameters: {'model_name': 'SimpleImputer', 'strategy': 'mean'}. Best is trial 4 with value: 0.1431743055927738.
running
[I 2024-08-16 10:57:35,010] Trial 56 finished with value: 0.1431743055927738 and parameters: {'model_name': 'SimpleImputer', 'strategy': 'mean'}. Best is trial 4 with value: 0.1431743055927738.
[I 2024-08-16 10:57:35,110] Trial 63 finished with value: 0.1431743055927738 and parameters: {'model_name': 'SimpleImputer', 'strategy': 'mean'}. Best is trial 4 with value: 0.1431743055927738.
[I 2024-08-16 10:57:35,200] Trial 64 finished with value: 0.1431743055927738 and parameters: {'model_name': 'SimpleImputer', 'strategy': 'mean'}. Best is trial 4 with value: 0.1431743055927738.
[I 2024-08-16 10:57:35,290] Trial 59 finished with value: 0.1431743055927738 and parameters: {'model_name': 'SimpleImputer', 'strategy': 'mean'}. Best is trial 4 with value: 0.1431743055927738.
running
running
running
running
[I 2024-08-16 10:57:35,401] Trial 60 finished with value: 0.1431743055927738 and parameters: {'model_name': 'SimpleImputer', 'strategy': 'mean'}. Best is trial 4 with value: 0.1431743055927738.
running
[I 2024-08-16 10:57:35,533] Trial 62 finished with value: 0.1431743055927738 and parameters: {'model_name': 'SimpleImputer', 'strategy': 'mean'}. Best is trial 4 with value: 0.1431743055927738.
running
[I 2024-08-16 10:57:35,753] Trial 61 finished with value: 0.1431743055927738 and parameters: {'model_name': 'SimpleImputer', 'strategy': 'mean'}. Best is trial 4 with value: 0.1431743055927738.
running
[I 2024-08-16 10:57:35,956] Trial 68 finished with value: 0.1710077841200535 and parameters: {'model_name': 'SimpleImputer', 'strategy': 'constant'}. Best is trial 4 with value: 0.1431743055927738.
[I 2024-08-16 10:57:36,053] Trial 66 finished with value: 0.1431743055927738 and parameters: {'model_name': 'SimpleImputer', 'strategy': 'mean'}. Best is trial 4 with value: 0.1431743055927738.
running
running
[I 2024-08-16 10:57:36,175] Trial 69 finished with value: 0.1710077841200535 and parameters: {'model_name': 'SimpleImputer', 'strategy': 'constant'}. Best is trial 4 with value: 0.1431743055927738.
[I 2024-08-16 10:57:36,269] Trial 67 finished with value: 0.1431743055927738 and parameters: {'model_name': 'SimpleImputer', 'strategy': 'mean'}. Best is trial 4 with value: 0.1431743055927738.
running
[I 2024-08-16 10:57:36,367] Trial 70 finished with value: 0.1710077841200535 and parameters: {'model_name': 'SimpleImputer', 'strategy': 'constant'}. Best is trial 4 with value: 0.1431743055927738.
running
running
[I 2024-08-16 10:57:36,517] Trial 73 finished with value: 0.1710077841200535 and parameters: {'model_name': 'SimpleImputer', 'strategy': 'constant'}. Best is trial 4 with value: 0.1431743055927738.
running
[I 2024-08-16 10:57:36,635] Trial 71 finished with value: 0.1710077841200535 and parameters: {'model_name': 'SimpleImputer', 'strategy': 'constant'}. Best is trial 4 with value: 0.1431743055927738.
running
[I 2024-08-16 10:57:36,637] Trial 65 finished with value: 0.1431743055927738 and parameters: {'model_name': 'SimpleImputer', 'strategy': 'mean'}. Best is trial 4 with value: 0.1431743055927738.
running
[I 2024-08-16 10:57:36,838] Trial 72 finished with value: 0.1710077841200535 and parameters: {'model_name': 'SimpleImputer', 'strategy': 'constant'}. Best is trial 4 with value: 0.1431743055927738.
running
[I 2024-08-16 10:57:37,218] Trial 75 finished with value: 0.1710077841200535 and parameters: {'model_name': 'SimpleImputer', 'strategy': 'constant'}. Best is trial 4 with value: 0.1431743055927738.
running
[I 2024-08-16 10:57:37,354] Trial 76 finished with value: 0.1710077841200535 and parameters: {'model_name': 'SimpleImputer', 'strategy': 'constant'}. Best is trial 4 with value: 0.1431743055927738.
running
[I 2024-08-16 10:57:37,495] Trial 80 finished with value: 0.1710077841200535 and parameters: {'model_name': 'SimpleImputer', 'strategy': 'constant'}. Best is trial 4 with value: 0.1431743055927738.
[I 2024-08-16 10:57:37,588] Trial 74 finished with value: 0.1710077841200535 and parameters: {'model_name': 'SimpleImputer', 'strategy': 'constant'}. Best is trial 4 with value: 0.1431743055927738.
running
running
[I 2024-08-16 10:57:37,697] Trial 77 finished with value: 0.1710077841200535 and parameters: {'model_name': 'SimpleImputer', 'strategy': 'constant'}. Best is trial 4 with value: 0.1431743055927738.
running
[I 2024-08-16 10:57:37,843] Trial 79 finished with value: 0.1710077841200535 and parameters: {'model_name': 'SimpleImputer', 'strategy': 'constant'}. Best is trial 4 with value: 0.1431743055927738.
running
[I 2024-08-16 10:57:38,003] Trial 78 finished with value: 0.1710077841200535 and parameters: {'model_name': 'SimpleImputer', 'strategy': 'constant'}. Best is trial 4 with value: 0.1431743055927738.
running
[I 2024-08-16 10:57:38,673] Trial 85 finished with value: 0.1710077841200535 and parameters: {'model_name': 'SimpleImputer', 'strategy': 'median'}. Best is trial 4 with value: 0.1431743055927738.
running
[I 2024-08-16 10:57:38,990] Trial 88 finished with value: 0.1710077841200535 and parameters: {'model_name': 'SimpleImputer', 'strategy': 'median'}. Best is trial 4 with value: 0.1431743055927738.
running
[I 2024-08-16 10:57:39,122] Trial 81 finished with value: 0.1710077841200535 and parameters: {'model_name': 'SimpleImputer', 'strategy': 'median'}. Best is trial 4 with value: 0.1431743055927738.
running
[I 2024-08-16 10:57:39,249] Trial 84 finished with value: 0.1710077841200535 and parameters: {'model_name': 'SimpleImputer', 'strategy': 'median'}. Best is trial 4 with value: 0.1431743055927738.
running
[I 2024-08-16 10:57:39,361] Trial 86 finished with value: 0.1710077841200535 and parameters: {'model_name': 'SimpleImputer', 'strategy': 'median'}. Best is trial 4 with value: 0.1431743055927738.
running
[I 2024-08-16 10:57:39,483] Trial 82 finished with value: 0.1710077841200535 and parameters: {'model_name': 'SimpleImputer', 'strategy': 'median'}. Best is trial 4 with value: 0.1431743055927738.
running
[I 2024-08-16 10:57:39,604] Trial 83 finished with value: 0.1710077841200535 and parameters: {'model_name': 'SimpleImputer', 'strategy': 'median'}. Best is trial 4 with value: 0.1431743055927738.
running
[I 2024-08-16 10:57:39,775] Trial 89 finished with value: 0.1710077841200535 and parameters: {'model_name': 'SimpleImputer', 'strategy': 'median'}. Best is trial 4 with value: 0.1431743055927738.
running
[I 2024-08-16 10:57:39,891] Trial 87 finished with value: 0.1710077841200535 and parameters: {'model_name': 'SimpleImputer', 'strategy': 'median'}. Best is trial 4 with value: 0.1431743055927738.
running
[I 2024-08-16 10:57:40,010] Trial 90 finished with value: 0.1710077841200535 and parameters: {'model_name': 'SimpleImputer', 'strategy': 'median'}. Best is trial 4 with value: 0.1431743055927738.
running
[I 2024-08-16 10:57:40,133] Trial 93 finished with value: 0.1710077841200535 and parameters: {'model_name': 'SimpleImputer', 'strategy': 'median'}. Best is trial 4 with value: 0.1431743055927738.
running
[I 2024-08-16 10:57:40,245] Trial 94 finished with value: 0.1710077841200535 and parameters: {'model_name': 'SimpleImputer', 'strategy': 'median'}. Best is trial 4 with value: 0.1431743055927738.
running
[I 2024-08-16 10:57:40,498] Trial 95 finished with value: 0.1710077841200535 and parameters: {'model_name': 'SimpleImputer', 'strategy': 'median'}. Best is trial 4 with value: 0.1431743055927738.
running
[I 2024-08-16 10:57:40,605] Trial 91 finished with value: 0.1710077841200535 and parameters: {'model_name': 'SimpleImputer', 'strategy': 'median'}. Best is trial 4 with value: 0.1431743055927738.
running
[I 2024-08-16 10:57:40,816] Trial 92 finished with value: 0.1710077841200535 and parameters: {'model_name': 'SimpleImputer', 'strategy': 'median'}. Best is trial 4 with value: 0.1431743055927738.
running
[I 2024-08-16 10:57:41,096] Trial 97 finished with value: 0.1431743055927738 and parameters: {'model_name': 'SimpleImputer', 'strategy': 'mean'}. Best is trial 4 with value: 0.1431743055927738.
running
[I 2024-08-16 10:57:41,226] Trial 96 finished with value: 0.1710077841200535 and parameters: {'model_name': 'SimpleImputer', 'strategy': 'median'}. Best is trial 4 with value: 0.1431743055927738.
running
[I 2024-08-16 10:57:41,492] Trial 99 finished with value: 0.1431743055927738 and parameters: {'model_name': 'SimpleImputer', 'strategy': 'mean'}. Best is trial 4 with value: 0.1431743055927738.
running
[I 2024-08-16 10:57:41,626] Trial 100 finished with value: 0.1431743055927738 and parameters: {'model_name': 'SimpleImputer', 'strategy': 'mean'}. Best is trial 4 with value: 0.1431743055927738.
[I 2024-08-16 10:57:41,726] Trial 98 finished with value: 0.1431743055927738 and parameters: {'model_name': 'SimpleImputer', 'strategy': 'mean'}. Best is trial 4 with value: 0.1431743055927738.
running
running
[I 2024-08-16 10:57:41,864] Trial 102 finished with value: 0.1431743055927738 and parameters: {'model_name': 'SimpleImputer', 'strategy': 'mean'}. Best is trial 4 with value: 0.1431743055927738.
running
[I 2024-08-16 10:57:42,043] Trial 101 finished with value: 0.1431743055927738 and parameters: {'model_name': 'SimpleImputer', 'strategy': 'mean'}. Best is trial 4 with value: 0.1431743055927738.
running
[I 2024-08-16 10:57:42,176] Trial 107 finished with value: 0.1431743055927738 and parameters: {'model_name': 'SimpleImputer', 'strategy': 'mean'}. Best is trial 4 with value: 0.1431743055927738.
running
