[I 2024-10-16 00:24:53,264] Trial 199 finished with value: 0.38969972723503693 and parameters: {'model_name': 'SimpleImputer', 'strategy': 'most_frequent'}. Best is trial 2 with value: 0.21080759083096906.
fit
simple fit
simple transform
0    0
1    0
2    0
3    0
4    0
5    0
6    0
7    0
dtype: int64
0    0
1    0
2    0
3    0
4    0
5    0
6    0
7    0
dtype: int64
0.21080759083096906
{'model_name': 'SimpleImputer', 'strategy': 'median'}
running experiment 2/3 - Does reconstruction give good automl predictions
Start est fit
Version 0.1.7a0 of tpot2 is outdated. Version 0.1.8a0 was released Tuesday September 17, 2024.
Version 0.1.7a0 of tpot2 is outdated. Version 0.1.8a0 was released Tuesday September 17, 2024.
Version 0.1.7a0 of tpot2 is outdated. Version 0.1.8a0 was released Tuesday September 17, 2024.
Version 0.1.7a0 of tpot2 is outdated. Version 0.1.8a0 was released Tuesday September 17, 2024.
Version 0.1.7a0 of tpot2 is outdated. Version 0.1.8a0 was released Tuesday September 17, 2024.
Version 0.1.7a0 of tpot2 is outdated. Version 0.1.8a0 was released Tuesday September 17, 2024.
Version 0.1.7a0 of tpot2 is outdated. Version 0.1.8a0 was released Tuesday September 17, 2024.
Version 0.1.7a0 of tpot2 is outdated. Version 0.1.8a0 was released Tuesday September 17, 2024.
Version 0.1.7a0 of tpot2 is outdated. Version 0.1.8a0 was released Tuesday September 17, 2024.
Version 0.1.7a0 of tpot2 is outdated. Version 0.1.8a0 was released Tuesday September 17, 2024.
Version 0.1.7a0 of tpot2 is outdated. Version 0.1.8a0 was released Tuesday September 17, 2024.
Version 0.1.7a0 of tpot2 is outdated. Version 0.1.8a0 was released Tuesday September 17, 2024.
Version 0.1.7a0 of tpot2 is outdated. Version 0.1.8a0 was released Tuesday September 17, 2024.
Version 0.1.7a0 of tpot2 is outdated. Version 0.1.8a0 was released Tuesday September 17, 2024.
Version 0.1.7a0 of tpot2 is outdated. Version 0.1.8a0 was released Tuesday September 17, 2024.
Version 0.1.7a0 of tpot2 is outdated. Version 0.1.8a0 was released Tuesday September 17, 2024.
  0%|          | 0/25 [00:00<?, ?it/s]Generation:   0%|          | 0/25 [00:00<?, ?it/s]Generation:  1
Best f1_score score: 0.8597611187676957
Generation:   4%|▍         | 1/25 [04:19<1:43:45, 259.41s/it]WARNING THIS INDIVIDUAL CAUSED AND EXCEPTION 
 <tpot2.search_spaces.pipelines.sequential.SequentialPipelineIndividual object at 0x155474cd17e0> 
 The 'min_samples_split' parameter of DecisionTreeClassifier must be an int in the range [2, inf) or a float in the range (0.0, 1.0]. Got 1 instead. 
 Traceback (most recent call last):
  File "/common/ketrong/tpotexp/tpot2/tpot2/utils/eval_utils.py", line 53, in objective_nan_wrapper
    value = func_timeout.func_timeout(timeout, objective_function, args=[individual], kwargs=objective_kwargs)
  File "/common/ketrong/tpotexp/env/lib/python3.10/site-packages/func_timeout/dafunc.py", line 108, in func_timeout
    raise_exception(exception)
  File "/common/ketrong/tpotexp/env/lib/python3.10/site-packages/func_timeout/py3_raise.py", line 7, in raise_exception
    raise exception[0] from None
  File "/common/ketrong/tpotexp/tpot2/tpot2/tpot_estimator/estimator.py", line 623, in objective_function
    return objective_function_generator(
  File "/common/ketrong/tpotexp/tpot2/tpot2/tpot_estimator/estimator_utils.py", line 55, in objective_function_generator
    cv_obj_scores = cross_val_score_objective(sklearn.base.clone(pipeline),x,y,scorers=scorers, cv=cv , fold=step)
  File "/common/ketrong/tpotexp/tpot2/tpot2/tpot_estimator/cross_val_utils.py", line 28, in cross_val_score_objective
    this_fold_pipeline.fit(X_train,y_train)
  File "/common/ketrong/tpotexp/env/lib/python3.10/site-packages/sklearn/base.py", line 1473, in wrapper
    return fit_method(estimator, *args, **kwargs)
  File "/common/ketrong/tpotexp/env/lib/python3.10/site-packages/sklearn/pipeline.py", line 473, in fit
    self._final_estimator.fit(Xt, y, **last_step_params["fit"])
  File "/common/ketrong/tpotexp/env/lib/python3.10/site-packages/sklearn/base.py", line 1466, in wrapper
    estimator._validate_params()
  File "/common/ketrong/tpotexp/env/lib/python3.10/site-packages/sklearn/base.py", line 666, in _validate_params
    validate_parameter_constraints(
  File "/common/ketrong/tpotexp/env/lib/python3.10/site-packages/sklearn/utils/_param_validation.py", line 95, in validate_parameter_constraints
    raise InvalidParameterError(
sklearn.utils._param_validation.InvalidParameterError: The 'min_samples_split' parameter of DecisionTreeClassifier must be an int in the range [2, inf) or a float in the range (0.0, 1.0]. Got 1 instead.

Generation:  2
Best f1_score score: 0.8627336877739488
Generation:   8%|▊         | 2/25 [05:36<58:13, 151.88s/it]  Generation:  3
Best f1_score score: 0.8694490544485916
Generation:  12%|█▏        | 3/25 [07:10<46:08, 125.82s/it]Generation:  4
Best f1_score score: 0.8752424425204623
Generation:  16%|█▌        | 4/25 [08:48<40:06, 114.58s/it]Generation:  5
Best f1_score score: 0.8752424425204623
Generation:  20%|██        | 5/25 [10:07<33:55, 101.79s/it]Generation:  6
Best f1_score score: 0.8752424425204623
Generation:  24%|██▍       | 6/25 [11:53<32:43, 103.35s/it]Generation:  7
Best f1_score score: 0.8752424425204623
Generation:  28%|██▊       | 7/25 [12:41<25:36, 85.35s/it] Generation:  8
Best f1_score score: 0.8752424425204623
Generation:  32%|███▏      | 8/25 [13:52<22:51, 80.66s/it]Generation:  9
Best f1_score score: 0.8752424425204623
Generation:  36%|███▌      | 9/25 [14:54<19:54, 74.69s/it]Generation:  10
Best f1_score score: 0.8752424425204623
Generation:  40%|████      | 10/25 [15:53<17:30, 70.00s/it]Generation:  11
Best f1_score score: 0.8761458062696041
Generation:  44%|████▍     | 11/25 [16:48<15:14, 65.34s/it]Generation:  12
Best f1_score score: 0.8761458062696041
Generation:  48%|████▊     | 12/25 [17:51<13:59, 64.55s/it]Generation:  13
Best f1_score score: 0.8761458062696041
Generation:  52%|█████▏    | 13/25 [19:47<16:03, 80.27s/it]Generation:  14
Best f1_score score: 0.8761458062696041
Generation:  56%|█████▌    | 14/25 [20:40<13:11, 71.92s/it]Generation:  15
Best f1_score score: 0.8761458062696041
Generation:  60%|██████    | 15/25 [21:55<12:08, 72.81s/it]Generation:  16
Best f1_score score: 0.8761458062696041
Generation:  64%|██████▍   | 16/25 [24:25<14:25, 96.21s/it]Generation:  17
Best f1_score score: 0.8761458062696041
Generation:  68%|██████▊   | 17/25 [25:54<12:32, 94.12s/it]Generation:  18
Best f1_score score: 0.878783871194423
Generation:  72%|███████▏  | 18/25 [28:37<13:22, 114.59s/it]Generation:  19
Best f1_score score: 0.878783871194423
Generation:  76%|███████▌  | 19/25 [30:36<11:35, 115.95s/it]Generation:  20
Best f1_score score: 0.878783871194423
Generation:  80%|████████  | 20/25 [34:00<11:52, 142.43s/it]Generation:  21
Best f1_score score: 0.878783871194423
Generation:  84%|████████▍ | 21/25 [37:27<10:47, 161.75s/it]Generation:  22
Best f1_score score: 0.878783871194423
Generation:  88%|████████▊ | 22/25 [38:27<06:34, 131.40s/it]Generation:  23
Best f1_score score: 0.878783871194423
Generation:  92%|█████████▏| 23/25 [40:30<04:17, 128.74s/it]Generation:  24
Best f1_score score: 0.878783871194423
Generation:  96%|█████████▌| 24/25 [43:40<02:27, 147.07s/it]Generation:  25
Best f1_score score: 0.878783871194423
Generation: 100%|██████████| 25/25 [48:52<00:00, 196.66s/it]Generation: 100%|██████████| 25/25 [48:55<00:00, 117.44s/it]
2024-10-16 01:14:08,489 - distributed.scheduler - ERROR - Removing worker 'tcp://127.0.0.1:38123' caused the cluster to lose scattered data, which can't be recovered: {'ndarray-b74dc7c66dec5ac2b4700b93e84a6dd3', 'ndarray-4ea881bbe6fa0141b49406db56259194'} (stimulus_id='handle-worker-cleanup-1729066448.4893367')
Fitted
Pipeline(steps=[('baggingclassifier',
                 BaggingClassifier(bootstrap=False,
                                   max_features=0.8420773515698,
                                   max_samples=0.9016481469322, n_estimators=91,
                                   n_jobs=1))])
score start
train score: {'auroc': 1.0, 'accuracy': 1.0, 'balanced_accuracy': 1.0, 'logloss': 0.024205953054647362, 'f1': 1.0}
original test score: {'auroc': 0.9718132266789985, 'accuracy': 0.919011364890213, 'balanced_accuracy': 0.9154910321856631, 'logloss': 0.24087910505122634, 'f1': 0.91684448033441}
imputed test score: {'auroc': 0.9585286924213099, 'accuracy': 0.8921990510868366, 'balanced_accuracy': 0.8869134991618213, 'logloss': 0.2849355013941032, 'f1': 0.8890366386765409}
score end
check intended
EXP2 Finished
running experiment 3/3 - What is the best automl settings?
<tpot2.search_spaces.pipelines.sequential.SequentialPipeline object at 0x15543504f9d0>
Start tpot fit
Version 0.1.7a0 of tpot2 is outdated. Version 0.1.8a0 was released Tuesday September 17, 2024.
Version 0.1.7a0 of tpot2 is outdated. Version 0.1.8a0 was released Tuesday September 17, 2024.
Version 0.1.7a0 of tpot2 is outdated. Version 0.1.8a0 was released Tuesday September 17, 2024.
Version 0.1.7a0 of tpot2 is outdated. Version 0.1.8a0 was released Tuesday September 17, 2024.
Version 0.1.7a0 of tpot2 is outdated. Version 0.1.8a0 was released Tuesday September 17, 2024.
Version 0.1.7a0 of tpot2 is outdated. Version 0.1.8a0 was released Tuesday September 17, 2024.
Version 0.1.7a0 of tpot2 is outdated. Version 0.1.8a0 was released Tuesday September 17, 2024.
Version 0.1.7a0 of tpot2 is outdated. Version 0.1.8a0 was released Tuesday September 17, 2024.
Version 0.1.7a0 of tpot2 is outdated. Version 0.1.8a0 was released Tuesday September 17, 2024.
Version 0.1.7a0 of tpot2 is outdated. Version 0.1.8a0 was released Tuesday September 17, 2024.
Version 0.1.7a0 of tpot2 is outdated. Version 0.1.8a0 was released Tuesday September 17, 2024.
Version 0.1.7a0 of tpot2 is outdated. Version 0.1.8a0 was released Tuesday September 17, 2024.
Version 0.1.7a0 of tpot2 is outdated. Version 0.1.8a0 was released Tuesday September 17, 2024.
Version 0.1.7a0 of tpot2 is outdated. Version 0.1.8a0 was released Tuesday September 17, 2024.
Version 0.1.7a0 of tpot2 is outdated. Version 0.1.8a0 was released Tuesday September 17, 2024.
Version 0.1.7a0 of tpot2 is outdated. Version 0.1.8a0 was released Tuesday September 17, 2024.
  0%|          | 0/25 [00:00<?, ?it/s]Generation:   0%|          | 0/25 [00:00<?, ?it/s]Generation:  1
Best f1_score score: 0.8599164231249864
Generation:   4%|▍         | 1/25 [00:29<11:59, 29.99s/it]Generation:  2
Best f1_score score: 0.8651581827374086
Generation:   8%|▊         | 2/25 [00:58<11:15, 29.38s/it]Generation:  3
Best f1_score score: 0.8651581827374086
Generation:  12%|█▏        | 3/25 [02:33<21:40, 59.12s/it]WARNING THIS INDIVIDUAL CAUSED AND EXCEPTION 
 <tpot2.search_spaces.pipelines.sequential.SequentialPipelineIndividual object at 0x155474d51870> 
 The 'min_samples_split' parameter of DecisionTreeClassifier must be an int in the range [2, inf) or a float in the range (0.0, 1.0]. Got 1 instead. 
 Traceback (most recent call last):
  File "/common/ketrong/tpotexp/tpot2/tpot2/utils/eval_utils.py", line 53, in objective_nan_wrapper
    value = func_timeout.func_timeout(timeout, objective_function, args=[individual], kwargs=objective_kwargs)
  File "/common/ketrong/tpotexp/env/lib/python3.10/site-packages/func_timeout/dafunc.py", line 108, in func_timeout
    raise_exception(exception)
  File "/common/ketrong/tpotexp/env/lib/python3.10/site-packages/func_timeout/py3_raise.py", line 7, in raise_exception
    raise exception[0] from None
  File "/common/ketrong/tpotexp/tpot2/tpot2/tpot_estimator/estimator.py", line 623, in objective_function
    return objective_function_generator(
  File "/common/ketrong/tpotexp/tpot2/tpot2/tpot_estimator/estimator_utils.py", line 55, in objective_function_generator
    cv_obj_scores = cross_val_score_objective(sklearn.base.clone(pipeline),x,y,scorers=scorers, cv=cv , fold=step)
  File "/common/ketrong/tpotexp/tpot2/tpot2/tpot_estimator/cross_val_utils.py", line 28, in cross_val_score_objective
    this_fold_pipeline.fit(X_train,y_train)
  File "/common/ketrong/tpotexp/env/lib/python3.10/site-packages/sklearn/base.py", line 1473, in wrapper
    return fit_method(estimator, *args, **kwargs)
  File "/common/ketrong/tpotexp/env/lib/python3.10/site-packages/sklearn/pipeline.py", line 473, in fit
    self._final_estimator.fit(Xt, y, **last_step_params["fit"])
  File "/common/ketrong/tpotexp/env/lib/python3.10/site-packages/sklearn/base.py", line 1466, in wrapper
    estimator._validate_params()
  File "/common/ketrong/tpotexp/env/lib/python3.10/site-packages/sklearn/base.py", line 666, in _validate_params
    validate_parameter_constraints(
  File "/common/ketrong/tpotexp/env/lib/python3.10/site-packages/sklearn/utils/_param_validation.py", line 95, in validate_parameter_constraints
    raise InvalidParameterError(
sklearn.utils._param_validation.InvalidParameterError: The 'min_samples_split' parameter of DecisionTreeClassifier must be an int in the range [2, inf) or a float in the range (0.0, 1.0]. Got 1 instead.

Generation:  4
Best f1_score score: 0.8651581827374086
Generation:  16%|█▌        | 4/25 [05:30<36:59, 105.68s/it]Generation:  5
Best f1_score score: 0.8651581827374086
Generation:  20%|██        | 5/25 [07:37<37:45, 113.27s/it]Generation:  6
Best f1_score score: 0.8651581827374086
Generation:  24%|██▍       | 6/25 [12:10<53:03, 167.54s/it]Generation:  7
Best f1_score score: 0.8731208309499342
Generation:  28%|██▊       | 7/25 [14:18<46:25, 154.72s/it]Generation:  8
Best f1_score score: 0.8731208309499342
Generation:  32%|███▏      | 8/25 [15:15<34:59, 123.52s/it]Generation:  9
Best f1_score score: 0.8768895330005154
Generation:  36%|███▌      | 9/25 [16:52<30:46, 115.43s/it]Generation:  10
Best f1_score score: 0.8768895330005154
Generation:  40%|████      | 10/25 [17:56<24:52, 99.48s/it]Generation:  11
Best f1_score score: 0.8768895330005154
Generation:  44%|████▍     | 11/25 [18:34<18:50, 80.73s/it]Generation:  12
Best f1_score score: 0.8768895330005154
Generation:  48%|████▊     | 12/25 [19:04<14:09, 65.35s/it]Generation:  13
Best f1_score score: 0.8768895330005154
Generation:  52%|█████▏    | 13/25 [22:45<22:27, 112.28s/it]Generation:  14
Best f1_score score: 0.8768895330005154
Generation:  56%|█████▌    | 14/25 [24:36<20:30, 111.84s/it]Generation:  15
Best f1_score score: 0.8768895330005154
Generation:  60%|██████    | 15/25 [27:02<20:22, 122.28s/it]WARNING AN INDIVIDUAL TIMED OUT: 
 <tpot2.search_spaces.pipelines.sequential.SequentialPipelineIndividual object at 0x15545f7ebaf0> 

Generation:  16
Best f1_score score: 0.8768895330005154
Generation:  64%|██████▍   | 16/25 [37:07<40:08, 267.58s/it]Generation:  17
Best f1_score score: 0.8768895330005154
Generation:  68%|██████▊   | 17/25 [38:52<29:09, 218.75s/it]Generation:  18
Best f1_score score: 0.8768895330005154
Generation:  72%|███████▏  | 18/25 [43:27<27:28, 235.57s/it]Generation:  19
Best f1_score score: 0.8768895330005154
Generation:  76%|███████▌  | 19/25 [46:08<21:18, 213.06s/it]WARNING AN INDIVIDUAL TIMED OUT: 
 <tpot2.search_spaces.pipelines.sequential.SequentialPipelineIndividual object at 0x15545fd66b30> 

Generation:  20
Best f1_score score: 0.8768895330005154
Generation:  80%|████████  | 20/25 [56:11<27:31, 330.24s/it]Generation:  21
Best f1_score score: 0.8768895330005154
Generation:  84%|████████▍ | 21/25 [57:33<17:03, 255.86s/it]WARNING THIS INDIVIDUAL CAUSED AND EXCEPTION 
 <tpot2.search_spaces.pipelines.sequential.SequentialPipelineIndividual object at 0x15545cadba30> 
 The 'min_samples_split' parameter of DecisionTreeClassifier must be an int in the range [2, inf) or a float in the range (0.0, 1.0]. Got 1 instead. 
 Traceback (most recent call last):
  File "/common/ketrong/tpotexp/tpot2/tpot2/utils/eval_utils.py", line 53, in objective_nan_wrapper
    value = func_timeout.func_timeout(timeout, objective_function, args=[individual], kwargs=objective_kwargs)
  File "/common/ketrong/tpotexp/env/lib/python3.10/site-packages/func_timeout/dafunc.py", line 108, in func_timeout
    raise_exception(exception)
  File "/common/ketrong/tpotexp/env/lib/python3.10/site-packages/func_timeout/py3_raise.py", line 7, in raise_exception
    raise exception[0] from None
  File "/common/ketrong/tpotexp/tpot2/tpot2/tpot_estimator/estimator.py", line 623, in objective_function
    return objective_function_generator(
  File "/common/ketrong/tpotexp/tpot2/tpot2/tpot_estimator/estimator_utils.py", line 55, in objective_function_generator
    cv_obj_scores = cross_val_score_objective(sklearn.base.clone(pipeline),x,y,scorers=scorers, cv=cv , fold=step)
  File "/common/ketrong/tpotexp/tpot2/tpot2/tpot_estimator/cross_val_utils.py", line 28, in cross_val_score_objective
    this_fold_pipeline.fit(X_train,y_train)
  File "/common/ketrong/tpotexp/env/lib/python3.10/site-packages/sklearn/base.py", line 1473, in wrapper
    return fit_method(estimator, *args, **kwargs)
  File "/common/ketrong/tpotexp/env/lib/python3.10/site-packages/sklearn/pipeline.py", line 473, in fit
    self._final_estimator.fit(Xt, y, **last_step_params["fit"])
  File "/common/ketrong/tpotexp/env/lib/python3.10/site-packages/sklearn/base.py", line 1466, in wrapper
    estimator._validate_params()
  File "/common/ketrong/tpotexp/env/lib/python3.10/site-packages/sklearn/base.py", line 666, in _validate_params
    validate_parameter_constraints(
  File "/common/ketrong/tpotexp/env/lib/python3.10/site-packages/sklearn/utils/_param_validation.py", line 95, in validate_parameter_constraints
    raise InvalidParameterError(
sklearn.utils._param_validation.InvalidParameterError: The 'min_samples_split' parameter of DecisionTreeClassifier must be an int in the range [2, inf) or a float in the range (0.0, 1.0]. Got 1 instead.

Generation:  22
Best f1_score score: 0.8768895330005154
Generation:  88%|████████▊ | 22/25 [58:09<09:29, 189.86s/it]WARNING AN INDIVIDUAL TIMED OUT: 
 <tpot2.search_spaces.pipelines.sequential.SequentialPipelineIndividual object at 0x155474d1bac0> 

Generation:  23
Best f1_score score: 0.8768895330005154
Generation:  92%|█████████▏| 23/25 [1:08:13<10:28, 314.03s/it]Generation:  24
Best f1_score score: 0.8768895330005154
Generation:  96%|█████████▌| 24/25 [1:09:03<03:54, 234.72s/it]Generation:  25
Best f1_score score: 0.8768895330005154
Generation: 100%|██████████| 25/25 [1:10:38<00:00, 193.03s/it]Generation: 100%|██████████| 25/25 [1:10:38<00:00, 169.56s/it]
2024-10-16 02:25:09,577 - distributed.scheduler - ERROR - Removing worker 'tcp://127.0.0.1:35051' caused the cluster to lose scattered data, which can't be recovered: {'ndarray-b74dc7c66dec5ac2b4700b93e84a6dd3', 'DataFrame-3627e92bc42ff6315c9d87cbcefc5b22'} (stimulus_id='handle-worker-cleanup-1729070709.5775452')
Fitted
Pipeline(steps=[('simpleimputer', SimpleImputer()),
                ('histgradientboostingclassifier',
                 HistGradientBoostingClassifier(early_stopping=False,
                                                l2_regularization=2.7075e-09,
                                                learning_rate=0.2072185071474,
                                                max_features=0.8183830449292,
                                                max_leaf_nodes=742,
                                                min_samples_leaf=7, tol=0.0001,
                                                validation_fraction=None))])
transform worked
try transform
transform worked
score start
train score: {'auroc': 1.0, 'accuracy': 1.0, 'balanced_accuracy': 1.0, 'logloss': 0.0035805384775628524, 'f1': 1.0}
test score: {'auroc': 0.9595144742795749, 'accuracy': 0.8882268564492993, 'balanced_accuracy': 0.884313426008057, 'logloss': 0.3145137254800701, 'f1': 0.8853155015763152}
original test score: {'auroc': 0.9766644474698166, 'accuracy': 0.9236455919673398, 'balanced_accuracy': 0.921118714407305, 'logloss': 0.22923125161923572, 'f1': 0.9217488833774639}
score end
151
lvl
0.1
type
MCAR
num_run
1
class_simple
finished
all finished
full run takes
2.017605277299881
hours
DONE
