[I 2024-11-01 08:22:47,665] Trial 87 finished with value: 0.3056156734149681 and parameters: {'model_name': 'IterativeImputer', 'estimator': 'Bayesian', 'initial_strategy': 'most_frequent', 'n_nearest_features': 6, 'imputation_order': 'roman', 'sample_posterior': False}. Best is trial 26 with value: 0.3055858048714794.
running
[I 2024-11-01 09:27:10,027] Trial 25 finished with value: 0.28418316530322224 and parameters: {'model_name': 'IterativeImputer', 'estimator': 'RFR', 'initial_strategy': 'mean', 'n_nearest_features': 6, 'imputation_order': 'ascending'}. Best is trial 25 with value: 0.28418316530322224.
running
[I 2024-11-01 09:57:40,061] Trial 55 finished with value: 0.28188543729411164 and parameters: {'model_name': 'IterativeImputer', 'estimator': 'RFR', 'initial_strategy': 'median', 'n_nearest_features': 8, 'imputation_order': 'arabic'}. Best is trial 55 with value: 0.28188543729411164.
running
[I 2024-11-01 10:13:55,497] Trial 6 finished with value: 0.28364726443036714 and parameters: {'model_name': 'IterativeImputer', 'estimator': 'RFR', 'initial_strategy': 'constant', 'n_nearest_features': 10, 'imputation_order': 'random'}. Best is trial 55 with value: 0.28188543729411164.
running
[I 2024-11-01 10:14:59,505] Trial 48 finished with value: 0.2813505533348094 and parameters: {'model_name': 'IterativeImputer', 'estimator': 'RFR', 'initial_strategy': 'median', 'n_nearest_features': 10, 'imputation_order': 'ascending'}. Best is trial 48 with value: 0.2813505533348094.
running
[I 2024-11-01 10:15:16,890] Trial 42 finished with value: 0.2802908883983585 and parameters: {'model_name': 'IterativeImputer', 'estimator': 'RFR', 'initial_strategy': 'median', 'n_nearest_features': 10, 'imputation_order': 'ascending'}. Best is trial 42 with value: 0.2802908883983585.
running
[I 2024-11-01 10:15:23,163] Trial 40 finished with value: 0.2813433484324498 and parameters: {'model_name': 'IterativeImputer', 'estimator': 'RFR', 'initial_strategy': 'median', 'n_nearest_features': 10, 'imputation_order': 'ascending'}. Best is trial 42 with value: 0.2802908883983585.
running
[I 2024-11-01 10:15:24,240] Trial 38 finished with value: 0.2811763428078943 and parameters: {'model_name': 'IterativeImputer', 'estimator': 'RFR', 'initial_strategy': 'median', 'n_nearest_features': 10, 'imputation_order': 'random'}. Best is trial 42 with value: 0.2802908883983585.
running
[I 2024-11-01 10:16:26,464] Trial 52 finished with value: 0.28080505819932683 and parameters: {'model_name': 'IterativeImputer', 'estimator': 'RFR', 'initial_strategy': 'median', 'n_nearest_features': 10, 'imputation_order': 'ascending'}. Best is trial 42 with value: 0.2802908883983585.
running
[I 2024-11-01 10:16:41,753] Trial 60 finished with value: 0.28149931658653204 and parameters: {'model_name': 'IterativeImputer', 'estimator': 'RFR', 'initial_strategy': 'median', 'n_nearest_features': 9, 'imputation_order': 'arabic'}. Best is trial 42 with value: 0.2802908883983585.
running
[I 2024-11-01 10:16:49,450] Trial 59 finished with value: 0.28100538559055455 and parameters: {'model_name': 'IterativeImputer', 'estimator': 'RFR', 'initial_strategy': 'median', 'n_nearest_features': 9, 'imputation_order': 'roman'}. Best is trial 42 with value: 0.2802908883983585.
running
[I 2024-11-01 10:24:12,844] Trial 88 finished with value: 0.2866992810002523 and parameters: {'model_name': 'IterativeImputer', 'estimator': 'RFR', 'initial_strategy': 'most_frequent', 'n_nearest_features': 6, 'imputation_order': 'roman'}. Best is trial 42 with value: 0.2802908883983585.
running
[I 2024-11-01 10:38:15,061] Trial 73 finished with value: 0.28115177826997023 and parameters: {'model_name': 'IterativeImputer', 'estimator': 'RFR', 'initial_strategy': 'median', 'n_nearest_features': 8, 'imputation_order': 'roman'}. Best is trial 42 with value: 0.2802908883983585.
running
[I 2024-11-01 10:40:04,213] Trial 64 finished with value: 0.2815870161518528 and parameters: {'model_name': 'IterativeImputer', 'estimator': 'RFR', 'initial_strategy': 'median', 'n_nearest_features': 9, 'imputation_order': 'roman'}. Best is trial 42 with value: 0.2802908883983585.
running
[I 2024-11-01 10:43:31,515] Trial 65 finished with value: 0.2808414965818532 and parameters: {'model_name': 'IterativeImputer', 'estimator': 'RFR', 'initial_strategy': 'median', 'n_nearest_features': 9, 'imputation_order': 'roman'}. Best is trial 42 with value: 0.2802908883983585.
running
[I 2024-11-01 10:44:43,479] Trial 67 finished with value: 0.28079061841202346 and parameters: {'model_name': 'IterativeImputer', 'estimator': 'RFR', 'initial_strategy': 'median', 'n_nearest_features': 9, 'imputation_order': 'roman'}. Best is trial 42 with value: 0.2802908883983585.
running
[I 2024-11-01 10:44:44,296] Trial 103 finished with value: 0.36222390752643807 and parameters: {'model_name': 'VAE', 'batch_size': 72, 'iterations': 4, 'learning_rate': 0.003869308612606246, 'p_miss': 0.2227567991494588}. Best is trial 42 with value: 0.2802908883983585.
running
[I 2024-11-01 10:44:51,977] Trial 66 finished with value: 0.2811374388065134 and parameters: {'model_name': 'IterativeImputer', 'estimator': 'RFR', 'initial_strategy': 'median', 'n_nearest_features': 9, 'imputation_order': 'roman'}. Best is trial 42 with value: 0.2802908883983585.
running
[I 2024-11-01 10:44:52,226] Trial 105 finished with value: 0.3706745655003177 and parameters: {'model_name': 'SimpleImputer', 'strategy': 'median'}. Best is trial 42 with value: 0.2802908883983585.
running
[I 2024-11-01 11:28:29,202] Trial 89 finished with value: 0.2865784194973275 and parameters: {'model_name': 'IterativeImputer', 'estimator': 'RFR', 'initial_strategy': 'most_frequent', 'n_nearest_features': 6, 'imputation_order': 'roman'}. Best is trial 42 with value: 0.2802908883983585.
running
[I 2024-11-01 11:57:38,715] Trial 90 finished with value: 0.28472988095215024 and parameters: {'model_name': 'IterativeImputer', 'estimator': 'RFR', 'initial_strategy': 'most_frequent', 'n_nearest_features': 6, 'imputation_order': 'arabic'}. Best is trial 42 with value: 0.2802908883983585.
running
[I 2024-11-01 11:59:15,828] Trial 92 finished with value: 0.2867619168107142 and parameters: {'model_name': 'IterativeImputer', 'estimator': 'RFR', 'initial_strategy': 'constant', 'n_nearest_features': 5, 'imputation_order': 'arabic'}. Best is trial 42 with value: 0.2802908883983585.
running
[I 2024-11-01 12:00:00,069] Trial 94 finished with value: 0.286736166884399 and parameters: {'model_name': 'IterativeImputer', 'estimator': 'RFR', 'initial_strategy': 'constant', 'n_nearest_features': 5, 'imputation_order': 'arabic'}. Best is trial 42 with value: 0.2802908883983585.
running
[I 2024-11-01 12:00:04,014] Trial 93 finished with value: 0.2862437917682255 and parameters: {'model_name': 'IterativeImputer', 'estimator': 'RFR', 'initial_strategy': 'constant', 'n_nearest_features': 5, 'imputation_order': 'arabic'}. Best is trial 42 with value: 0.2802908883983585.
running
[I 2024-11-01 12:00:28,579] Trial 111 finished with value: 0.33096155277295947 and parameters: {'model_name': 'KNNImputer', 'n_neighbors': 31210, 'weights': 'distance'}. Best is trial 42 with value: 0.2802908883983585.
running
[I 2024-11-01 12:14:14,665] Trial 91 finished with value: 0.28414117727385524 and parameters: {'model_name': 'IterativeImputer', 'estimator': 'RFR', 'initial_strategy': 'most_frequent', 'n_nearest_features': 6, 'imputation_order': 'arabic'}. Best is trial 42 with value: 0.2802908883983585.
running
[I 2024-11-01 13:09:54,860] Trial 95 finished with value: 0.2810105944403035 and parameters: {'model_name': 'IterativeImputer', 'estimator': 'RFR', 'initial_strategy': 'constant', 'n_nearest_features': 10, 'imputation_order': 'arabic'}. Best is trial 42 with value: 0.2802908883983585.
running
[I 2024-11-01 13:10:38,058] Trial 98 finished with value: 0.28133519547844166 and parameters: {'model_name': 'IterativeImputer', 'estimator': 'RFR', 'initial_strategy': 'constant', 'n_nearest_features': 10, 'imputation_order': 'arabic'}. Best is trial 42 with value: 0.2802908883983585.
running
[I 2024-11-01 13:11:09,385] Trial 96 finished with value: 0.2811116597408363 and parameters: {'model_name': 'IterativeImputer', 'estimator': 'RFR', 'initial_strategy': 'constant', 'n_nearest_features': 10, 'imputation_order': 'arabic'}. Best is trial 42 with value: 0.2802908883983585.
running
[I 2024-11-01 13:11:25,273] Trial 97 finished with value: 0.2808737259605817 and parameters: {'model_name': 'IterativeImputer', 'estimator': 'RFR', 'initial_strategy': 'median', 'n_nearest_features': 10, 'imputation_order': 'arabic'}. Best is trial 42 with value: 0.2802908883983585.
running
[I 2024-11-01 13:18:24,056] Trial 99 finished with value: 0.2812248191549132 and parameters: {'model_name': 'IterativeImputer', 'estimator': 'RFR', 'initial_strategy': 'constant', 'n_nearest_features': 10, 'imputation_order': 'arabic'}. Best is trial 42 with value: 0.2802908883983585.
running
[I 2024-11-01 13:33:04,685] Trial 100 finished with value: 0.28147455324532455 and parameters: {'model_name': 'IterativeImputer', 'estimator': 'RFR', 'initial_strategy': 'constant', 'n_nearest_features': 10, 'imputation_order': 'arabic'}. Best is trial 42 with value: 0.2802908883983585.
running
[I 2024-11-01 13:35:54,772] Trial 101 finished with value: 0.28556907443244584 and parameters: {'model_name': 'IterativeImputer', 'estimator': 'RFR', 'initial_strategy': 'constant', 'n_nearest_features': 10, 'imputation_order': 'ascending'}. Best is trial 42 with value: 0.2802908883983585.
running
[I 2024-11-01 13:36:33,709] Trial 120 finished with value: 0.6058351078034352 and parameters: {'model_name': 'GAIN', 'batch_size': 147, 'hint_rate': 0.08114059228139653, 'alpha': 52, 'iterations': 1895, 'learning_rate': 0.0002422938677022202, 'p_miss': 0.2985760819051224}. Best is trial 42 with value: 0.2802908883983585.
running
[I 2024-11-01 13:38:23,240] Trial 102 finished with value: 0.2851024900941766 and parameters: {'model_name': 'IterativeImputer', 'estimator': 'RFR', 'initial_strategy': 'constant', 'n_nearest_features': 10, 'imputation_order': 'ascending'}. Best is trial 42 with value: 0.2802908883983585.
running
[I 2024-11-01 13:40:11,117] Trial 104 finished with value: 0.28596181254443415 and parameters: {'model_name': 'IterativeImputer', 'estimator': 'RFR', 'initial_strategy': 'constant', 'n_nearest_features': 10, 'imputation_order': 'ascending'}. Best is trial 42 with value: 0.2802908883983585.
running
[I 2024-11-01 13:40:15,081] Trial 106 finished with value: 0.2858639291905808 and parameters: {'model_name': 'IterativeImputer', 'estimator': 'RFR', 'initial_strategy': 'constant', 'n_nearest_features': 10, 'imputation_order': 'ascending'}. Best is trial 42 with value: 0.2802908883983585.
running
[I 2024-11-01 14:23:02,268] Trial 107 finished with value: 0.28113308071888 and parameters: {'model_name': 'IterativeImputer', 'estimator': 'RFR', 'initial_strategy': 'median', 'n_nearest_features': 10, 'imputation_order': 'ascending'}. Best is trial 42 with value: 0.2802908883983585.
running
[I 2024-11-01 14:53:05,456] Trial 108 finished with value: 0.2854091001032558 and parameters: {'model_name': 'IterativeImputer', 'estimator': 'RFR', 'initial_strategy': 'constant', 'n_nearest_features': 10, 'imputation_order': 'ascending'}. Best is trial 42 with value: 0.2802908883983585.
running
[I 2024-11-01 14:53:41,578] Trial 109 finished with value: 0.28096697626822875 and parameters: {'model_name': 'IterativeImputer', 'estimator': 'RFR', 'initial_strategy': 'median', 'n_nearest_features': 10, 'imputation_order': 'ascending'}. Best is trial 42 with value: 0.2802908883983585.
running
[I 2024-11-01 14:54:42,828] Trial 110 finished with value: 0.28151739340215515 and parameters: {'model_name': 'IterativeImputer', 'estimator': 'RFR', 'initial_strategy': 'median', 'n_nearest_features': 10, 'imputation_order': 'ascending'}. Best is trial 42 with value: 0.2802908883983585.
running
[I 2024-11-01 14:55:00,020] Trial 112 finished with value: 0.2815163875957751 and parameters: {'model_name': 'IterativeImputer', 'estimator': 'RFR', 'initial_strategy': 'median', 'n_nearest_features': 10, 'imputation_order': 'ascending'}. Best is trial 42 with value: 0.2802908883983585.
running
[I 2024-11-01 15:09:31,815] Trial 113 finished with value: 0.28172683126033676 and parameters: {'model_name': 'IterativeImputer', 'estimator': 'RFR', 'initial_strategy': 'median', 'n_nearest_features': 10, 'imputation_order': 'ascending'}. Best is trial 42 with value: 0.2802908883983585.
running
[I 2024-11-01 16:04:21,185] Trial 114 finished with value: 0.28080131342737297 and parameters: {'model_name': 'IterativeImputer', 'estimator': 'RFR', 'initial_strategy': 'constant', 'n_nearest_features': 10, 'imputation_order': 'descending'}. Best is trial 42 with value: 0.2802908883983585.
running
[I 2024-11-01 16:05:33,195] Trial 115 finished with value: 0.2839924326363565 and parameters: {'model_name': 'IterativeImputer', 'estimator': 'RFR', 'initial_strategy': 'constant', 'n_nearest_features': 10, 'imputation_order': 'random'}. Best is trial 42 with value: 0.2802908883983585.
running
[I 2024-11-01 16:05:48,131] Trial 116 finished with value: 0.28115391527316297 and parameters: {'model_name': 'IterativeImputer', 'estimator': 'RFR', 'initial_strategy': 'constant', 'n_nearest_features': 10, 'imputation_order': 'descending'}. Best is trial 42 with value: 0.2802908883983585.
running
[I 2024-11-01 16:06:07,233] Trial 117 finished with value: 0.2810208941714011 and parameters: {'model_name': 'IterativeImputer', 'estimator': 'RFR', 'initial_strategy': 'constant', 'n_nearest_features': 10, 'imputation_order': 'descending'}. Best is trial 42 with value: 0.2802908883983585.
running
[I 2024-11-01 16:06:07,507] Trial 134 finished with value: 0.5544180086659619 and parameters: {'model_name': 'SimpleImputer', 'strategy': 'most_frequent'}. Best is trial 42 with value: 0.2802908883983585.
running
[I 2024-11-01 16:06:08,218] Trial 135 finished with value: 0.36930976211508126 and parameters: {'model_name': 'VAE', 'batch_size': 2, 'iterations': 3, 'learning_rate': 0.0010762325115698532, 'p_miss': 0.15392720614486108}. Best is trial 42 with value: 0.2802908883983585.
running
[I 2024-11-01 16:06:32,790] Trial 133 finished with value: 0.316656441476419 and parameters: {'model_name': 'IterativeImputer', 'estimator': 'KNN', 'initial_strategy': 'median', 'n_nearest_features': 9, 'imputation_order': 'descending'}. Best is trial 42 with value: 0.2802908883983585.
running
[I 2024-11-01 16:06:52,263] Trial 136 finished with value: 0.316656441476419 and parameters: {'model_name': 'IterativeImputer', 'estimator': 'KNN', 'initial_strategy': 'median', 'n_nearest_features': 9, 'imputation_order': 'descending'}. Best is trial 42 with value: 0.2802908883983585.
running
[I 2024-11-01 16:13:36,803] Trial 118 finished with value: 0.28101901514227834 and parameters: {'model_name': 'IterativeImputer', 'estimator': 'RFR', 'initial_strategy': 'constant', 'n_nearest_features': 10, 'imputation_order': 'descending'}. Best is trial 42 with value: 0.2802908883983585.
running
[I 2024-11-01 16:28:02,442] Trial 119 finished with value: 0.2813236041933179 and parameters: {'model_name': 'IterativeImputer', 'estimator': 'RFR', 'initial_strategy': 'median', 'n_nearest_features': 10, 'imputation_order': 'descending'}. Best is trial 42 with value: 0.2802908883983585.
running
[I 2024-11-01 16:31:42,623] Trial 121 finished with value: 0.2813436508978918 and parameters: {'model_name': 'IterativeImputer', 'estimator': 'RFR', 'initial_strategy': 'median', 'n_nearest_features': 10, 'imputation_order': 'descending'}. Best is trial 42 with value: 0.2802908883983585.
running
[I 2024-11-01 16:34:19,893] Trial 122 finished with value: 0.28120983870002597 and parameters: {'model_name': 'IterativeImputer', 'estimator': 'RFR', 'initial_strategy': 'median', 'n_nearest_features': 10, 'imputation_order': 'descending'}. Best is trial 42 with value: 0.2802908883983585.
running
[I 2024-11-01 16:34:46,802] Trial 142 finished with value: 0.32708572849284945 and parameters: {'model_name': 'KNNImputer', 'n_neighbors': 18702, 'weights': 'distance'}. Best is trial 42 with value: 0.2802908883983585.
running
[I 2024-11-01 16:36:03,857] Trial 123 finished with value: 0.28172160576451216 and parameters: {'model_name': 'IterativeImputer', 'estimator': 'RFR', 'initial_strategy': 'median', 'n_nearest_features': 9, 'imputation_order': 'descending'}. Best is trial 42 with value: 0.2802908883983585.
running
[I 2024-11-01 16:36:04,285] Trial 144 finished with value: 0.5988557277649651 and parameters: {'model_name': 'GAIN', 'batch_size': 32, 'hint_rate': 0.5882393659925144, 'alpha': 31, 'iterations': 1, 'learning_rate': 0.0036897924333166884, 'p_miss': 0.0743214218329366}. Best is trial 42 with value: 0.2802908883983585.
running
[I 2024-11-01 16:36:57,786] Trial 124 finished with value: 0.28048234029483265 and parameters: {'model_name': 'IterativeImputer', 'estimator': 'RFR', 'initial_strategy': 'median', 'n_nearest_features': 9, 'imputation_order': 'descending'}. Best is trial 42 with value: 0.2802908883983585.
running
[I 2024-11-01 17:20:07,652] Trial 125 finished with value: 0.28183327127652963 and parameters: {'model_name': 'IterativeImputer', 'estimator': 'RFR', 'initial_strategy': 'median', 'n_nearest_features': 9, 'imputation_order': 'descending'}. Best is trial 42 with value: 0.2802908883983585.
running
[I 2024-11-01 17:49:56,846] Trial 126 finished with value: 0.2813093976430593 and parameters: {'model_name': 'IterativeImputer', 'estimator': 'RFR', 'initial_strategy': 'median', 'n_nearest_features': 9, 'imputation_order': 'descending'}. Best is trial 42 with value: 0.2802908883983585.
running
[I 2024-11-01 17:50:01,228] Trial 127 finished with value: 0.2812035682909572 and parameters: {'model_name': 'IterativeImputer', 'estimator': 'RFR', 'initial_strategy': 'median', 'n_nearest_features': 9, 'imputation_order': 'descending'}. Best is trial 42 with value: 0.2802908883983585.
running
[I 2024-11-01 17:51:58,662] Trial 128 finished with value: 0.28102775489231446 and parameters: {'model_name': 'IterativeImputer', 'estimator': 'RFR', 'initial_strategy': 'median', 'n_nearest_features': 9, 'imputation_order': 'ascending'}. Best is trial 42 with value: 0.2802908883983585.
running
[I 2024-11-01 17:52:23,909] Trial 129 finished with value: 0.28080743553969756 and parameters: {'model_name': 'IterativeImputer', 'estimator': 'RFR', 'initial_strategy': 'median', 'n_nearest_features': 9, 'imputation_order': 'ascending'}. Best is trial 42 with value: 0.2802908883983585.
running
[I 2024-11-01 18:06:39,665] Trial 130 finished with value: 0.28182975334112037 and parameters: {'model_name': 'IterativeImputer', 'estimator': 'RFR', 'initial_strategy': 'median', 'n_nearest_features': 9, 'imputation_order': 'descending'}. Best is trial 42 with value: 0.2802908883983585.
running
[I 2024-11-01 19:02:05,908] Trial 131 finished with value: 0.2811645012870419 and parameters: {'model_name': 'IterativeImputer', 'estimator': 'RFR', 'initial_strategy': 'median', 'n_nearest_features': 9, 'imputation_order': 'descending'}. Best is trial 42 with value: 0.2802908883983585.
running
[I 2024-11-01 19:03:06,343] Trial 132 finished with value: 0.2811078556165294 and parameters: {'model_name': 'IterativeImputer', 'estimator': 'RFR', 'initial_strategy': 'median', 'n_nearest_features': 9, 'imputation_order': 'descending'}. Best is trial 42 with value: 0.2802908883983585.
running
[I 2024-11-01 19:03:16,405] Trial 154 finished with value: 0.3056727089238059 and parameters: {'model_name': 'IterativeImputer', 'estimator': 'Ridge', 'initial_strategy': 'mean', 'n_nearest_features': 9, 'imputation_order': 'ascending'}. Best is trial 42 with value: 0.2802908883983585.
running
[I 2024-11-01 19:03:54,722] Trial 138 finished with value: 0.2805308583551295 and parameters: {'model_name': 'IterativeImputer', 'estimator': 'RFR', 'initial_strategy': 'median', 'n_nearest_features': 9, 'imputation_order': 'descending'}. Best is trial 42 with value: 0.2802908883983585.
running
[I 2024-11-01 19:04:15,582] Trial 137 finished with value: 0.2808600500154447 and parameters: {'model_name': 'IterativeImputer', 'estimator': 'RFR', 'initial_strategy': 'median', 'n_nearest_features': 9, 'imputation_order': 'descending'}. Best is trial 42 with value: 0.2802908883983585.
running
[I 2024-11-01 19:10:51,279] Trial 139 finished with value: 0.2811923321131314 and parameters: {'model_name': 'IterativeImputer', 'estimator': 'RFR', 'initial_strategy': 'constant', 'n_nearest_features': 10, 'imputation_order': 'descending'}. Best is trial 42 with value: 0.2802908883983585.
running
[I 2024-11-01 19:24:40,065] Trial 140 finished with value: 0.2808742687820661 and parameters: {'model_name': 'IterativeImputer', 'estimator': 'RFR', 'initial_strategy': 'constant', 'n_nearest_features': 9, 'imputation_order': 'descending'}. Best is trial 42 with value: 0.2802908883983585.
running
[I 2024-11-01 19:28:58,372] Trial 141 finished with value: 0.2802742625010633 and parameters: {'model_name': 'IterativeImputer', 'estimator': 'RFR', 'initial_strategy': 'constant', 'n_nearest_features': 9, 'imputation_order': 'descending'}. Best is trial 141 with value: 0.2802742625010633.
running
[I 2024-11-01 19:31:53,484] Trial 143 finished with value: 0.2808888764440416 and parameters: {'model_name': 'IterativeImputer', 'estimator': 'RFR', 'initial_strategy': 'constant', 'n_nearest_features': 9, 'imputation_order': 'descending'}. Best is trial 141 with value: 0.2802742625010633.
running
[I 2024-11-01 19:33:01,071] Trial 145 finished with value: 0.28079528884202165 and parameters: {'model_name': 'IterativeImputer', 'estimator': 'RFR', 'initial_strategy': 'constant', 'n_nearest_features': 9, 'imputation_order': 'descending'}. Best is trial 141 with value: 0.2802742625010633.
running
