[I 2024-11-23 18:51:59,752] Trial 105 finished with value: 0.13480086029808153 and parameters: {'model_name': 'SimpleImputer', 'strategy': 'mean'}. Best is trial 8 with value: 0.13480086029808153.
[I 2024-11-23 18:51:59,845] Trial 94 finished with value: 0.22798445989836907 and parameters: {'model_name': 'SimpleImputer', 'strategy': 'most_frequent'}. Best is trial 8 with value: 0.13480086029808153.
running
running
[I 2024-11-23 18:52:00,007] Trial 95 finished with value: 0.22798445989836907 and parameters: {'model_name': 'SimpleImputer', 'strategy': 'most_frequent'}. Best is trial 8 with value: 0.13480086029808153.
running
[I 2024-11-23 18:52:00,133] Trial 108 finished with value: 0.13480086029808153 and parameters: {'model_name': 'SimpleImputer', 'strategy': 'mean'}. Best is trial 8 with value: 0.13480086029808153.
running
[I 2024-11-23 18:52:00,239] Trial 106 finished with value: 0.13480086029808153 and parameters: {'model_name': 'SimpleImputer', 'strategy': 'mean'}. Best is trial 8 with value: 0.13480086029808153.
[I 2024-11-23 18:52:00,332] Trial 110 finished with value: 0.13480086029808153 and parameters: {'model_name': 'SimpleImputer', 'strategy': 'mean'}. Best is trial 8 with value: 0.13480086029808153.
running
running
[I 2024-11-23 18:52:00,476] Trial 107 finished with value: 0.13480086029808153 and parameters: {'model_name': 'SimpleImputer', 'strategy': 'mean'}. Best is trial 8 with value: 0.13480086029808153.
running
[I 2024-11-23 18:52:00,688] Trial 113 finished with value: 0.13480086029808153 and parameters: {'model_name': 'SimpleImputer', 'strategy': 'mean'}. Best is trial 8 with value: 0.13480086029808153.
running
[I 2024-11-23 18:52:00,809] Trial 111 finished with value: 0.13480086029808153 and parameters: {'model_name': 'SimpleImputer', 'strategy': 'mean'}. Best is trial 8 with value: 0.13480086029808153.
running
[I 2024-11-23 18:52:00,935] Trial 109 finished with value: 0.13480086029808153 and parameters: {'model_name': 'SimpleImputer', 'strategy': 'mean'}. Best is trial 8 with value: 0.13480086029808153.
running
[I 2024-11-23 18:52:01,066] Trial 112 finished with value: 0.13480086029808153 and parameters: {'model_name': 'SimpleImputer', 'strategy': 'mean'}. Best is trial 8 with value: 0.13480086029808153.
running
[I 2024-11-23 18:52:01,202] Trial 115 finished with value: 0.13480086029808153 and parameters: {'model_name': 'SimpleImputer', 'strategy': 'mean'}. Best is trial 8 with value: 0.13480086029808153.
running
[I 2024-11-23 18:52:01,386] Trial 118 finished with value: 0.13480086029808153 and parameters: {'model_name': 'SimpleImputer', 'strategy': 'mean'}. Best is trial 8 with value: 0.13480086029808153.
running
[I 2024-11-23 18:52:01,498] Trial 114 finished with value: 0.13480086029808153 and parameters: {'model_name': 'SimpleImputer', 'strategy': 'mean'}. Best is trial 8 with value: 0.13480086029808153.
running
[I 2024-11-23 18:52:01,610] Trial 117 finished with value: 0.13480086029808153 and parameters: {'model_name': 'SimpleImputer', 'strategy': 'mean'}. Best is trial 8 with value: 0.13480086029808153.
running
[I 2024-11-23 18:52:01,717] Trial 116 finished with value: 0.13480086029808153 and parameters: {'model_name': 'SimpleImputer', 'strategy': 'mean'}. Best is trial 8 with value: 0.13480086029808153.
running
[I 2024-11-23 18:52:01,828] Trial 120 finished with value: 0.13480086029808153 and parameters: {'model_name': 'SimpleImputer', 'strategy': 'mean'}. Best is trial 8 with value: 0.13480086029808153.
running
[I 2024-11-23 18:52:02,026] Trial 125 finished with value: 0.13480086029808153 and parameters: {'model_name': 'SimpleImputer', 'strategy': 'mean'}. Best is trial 8 with value: 0.13480086029808153.
running
[I 2024-11-23 18:52:02,154] Trial 122 finished with value: 0.13480086029808153 and parameters: {'model_name': 'SimpleImputer', 'strategy': 'mean'}. Best is trial 8 with value: 0.13480086029808153.
running
[I 2024-11-23 18:52:02,259] Trial 124 finished with value: 0.13480086029808153 and parameters: {'model_name': 'SimpleImputer', 'strategy': 'mean'}. Best is trial 8 with value: 0.13480086029808153.
[I 2024-11-23 18:52:02,351] Trial 123 finished with value: 0.13480086029808153 and parameters: {'model_name': 'SimpleImputer', 'strategy': 'mean'}. Best is trial 8 with value: 0.13480086029808153.
running
running
[I 2024-11-23 18:52:02,451] Trial 121 finished with value: 0.13480086029808153 and parameters: {'model_name': 'SimpleImputer', 'strategy': 'mean'}. Best is trial 8 with value: 0.13480086029808153.
[I 2024-11-23 18:52:02,554] Trial 119 finished with value: 0.13480086029808153 and parameters: {'model_name': 'SimpleImputer', 'strategy': 'mean'}. Best is trial 8 with value: 0.13480086029808153.
running
running
[I 2024-11-23 18:52:02,770] Trial 127 finished with value: 0.13480086029808153 and parameters: {'model_name': 'SimpleImputer', 'strategy': 'mean'}. Best is trial 8 with value: 0.13480086029808153.
running
[I 2024-11-23 18:52:02,890] Trial 126 finished with value: 0.13480086029808153 and parameters: {'model_name': 'SimpleImputer', 'strategy': 'mean'}. Best is trial 8 with value: 0.13480086029808153.
running
[I 2024-11-23 18:52:03,055] Trial 128 finished with value: 0.13480086029808153 and parameters: {'model_name': 'SimpleImputer', 'strategy': 'mean'}. Best is trial 8 with value: 0.13480086029808153.
running
[I 2024-11-23 18:52:03,238] Trial 129 finished with value: 0.13480086029808153 and parameters: {'model_name': 'SimpleImputer', 'strategy': 'mean'}. Best is trial 8 with value: 0.13480086029808153.
running
[I 2024-11-23 18:52:03,380] Trial 130 finished with value: 0.13480086029808153 and parameters: {'model_name': 'SimpleImputer', 'strategy': 'mean'}. Best is trial 8 with value: 0.13480086029808153.
running
[I 2024-11-23 18:52:03,485] Trial 131 finished with value: 0.13480086029808153 and parameters: {'model_name': 'SimpleImputer', 'strategy': 'mean'}. Best is trial 8 with value: 0.13480086029808153.
running
[I 2024-11-23 18:52:03,606] Trial 134 finished with value: 0.13480086029808153 and parameters: {'model_name': 'SimpleImputer', 'strategy': 'mean'}. Best is trial 8 with value: 0.13480086029808153.
running
[I 2024-11-23 18:52:03,704] Trial 132 finished with value: 0.13480086029808153 and parameters: {'model_name': 'SimpleImputer', 'strategy': 'mean'}. Best is trial 8 with value: 0.13480086029808153.
running
[I 2024-11-23 18:52:03,805] Trial 133 finished with value: 0.13480086029808153 and parameters: {'model_name': 'SimpleImputer', 'strategy': 'mean'}. Best is trial 8 with value: 0.13480086029808153.
running
[I 2024-11-23 18:52:03,924] Trial 135 finished with value: 0.13480086029808153 and parameters: {'model_name': 'SimpleImputer', 'strategy': 'mean'}. Best is trial 8 with value: 0.13480086029808153.
running
[I 2024-11-23 18:52:04,023] Trial 137 finished with value: 0.13480086029808153 and parameters: {'model_name': 'SimpleImputer', 'strategy': 'mean'}. Best is trial 8 with value: 0.13480086029808153.
running
[I 2024-11-23 18:52:04,193] Trial 142 finished with value: 0.13480086029808153 and parameters: {'model_name': 'SimpleImputer', 'strategy': 'mean'}. Best is trial 8 with value: 0.13480086029808153.
running
[I 2024-11-23 18:52:04,368] Trial 139 finished with value: 0.13480086029808153 and parameters: {'model_name': 'SimpleImputer', 'strategy': 'mean'}. Best is trial 8 with value: 0.13480086029808153.
running
[I 2024-11-23 18:52:04,488] Trial 136 finished with value: 0.13480086029808153 and parameters: {'model_name': 'SimpleImputer', 'strategy': 'mean'}. Best is trial 8 with value: 0.13480086029808153.
running
[I 2024-11-23 18:52:04,633] Trial 140 finished with value: 0.13480086029808153 and parameters: {'model_name': 'SimpleImputer', 'strategy': 'mean'}. Best is trial 8 with value: 0.13480086029808153.
running
[I 2024-11-23 18:52:04,782] Trial 141 finished with value: 0.13480086029808153 and parameters: {'model_name': 'SimpleImputer', 'strategy': 'mean'}. Best is trial 8 with value: 0.13480086029808153.
[I 2024-11-23 18:52:04,893] Trial 138 finished with value: 0.13480086029808153 and parameters: {'model_name': 'SimpleImputer', 'strategy': 'mean'}. Best is trial 8 with value: 0.13480086029808153.
running
running
[I 2024-11-23 18:52:05,030] Trial 143 finished with value: 0.13480086029808153 and parameters: {'model_name': 'SimpleImputer', 'strategy': 'mean'}. Best is trial 8 with value: 0.13480086029808153.
running
[I 2024-11-23 18:52:05,231] Trial 145 finished with value: 0.13480086029808153 and parameters: {'model_name': 'SimpleImputer', 'strategy': 'mean'}. Best is trial 8 with value: 0.13480086029808153.
running
[I 2024-11-23 18:52:05,409] Trial 144 finished with value: 0.13480086029808153 and parameters: {'model_name': 'SimpleImputer', 'strategy': 'mean'}. Best is trial 8 with value: 0.13480086029808153.
running
[I 2024-11-23 18:52:05,524] Trial 147 finished with value: 0.13480086029808153 and parameters: {'model_name': 'SimpleImputer', 'strategy': 'mean'}. Best is trial 8 with value: 0.13480086029808153.
running
[I 2024-11-23 18:52:05,651] Trial 146 finished with value: 0.13480086029808153 and parameters: {'model_name': 'SimpleImputer', 'strategy': 'mean'}. Best is trial 8 with value: 0.13480086029808153.
[I 2024-11-23 18:52:05,742] Trial 153 finished with value: 0.13480086029808153 and parameters: {'model_name': 'SimpleImputer', 'strategy': 'mean'}. Best is trial 8 with value: 0.13480086029808153.
running
running
[I 2024-11-23 18:52:05,893] Trial 149 finished with value: 0.13480086029808153 and parameters: {'model_name': 'SimpleImputer', 'strategy': 'mean'}. Best is trial 8 with value: 0.13480086029808153.
[I 2024-11-23 18:52:05,987] Trial 152 finished with value: 0.13480086029808153 and parameters: {'model_name': 'SimpleImputer', 'strategy': 'mean'}. Best is trial 8 with value: 0.13480086029808153.
running
running
[I 2024-11-23 18:52:06,091] Trial 148 finished with value: 0.13480086029808153 and parameters: {'model_name': 'SimpleImputer', 'strategy': 'mean'}. Best is trial 8 with value: 0.13480086029808153.
running
[I 2024-11-23 18:52:06,204] Trial 151 finished with value: 0.13480086029808153 and parameters: {'model_name': 'SimpleImputer', 'strategy': 'mean'}. Best is trial 8 with value: 0.13480086029808153.
running
[I 2024-11-23 18:52:06,344] Trial 150 finished with value: 0.13480086029808153 and parameters: {'model_name': 'SimpleImputer', 'strategy': 'mean'}. Best is trial 8 with value: 0.13480086029808153.
running
[I 2024-11-23 18:52:06,460] Trial 154 finished with value: 0.13480086029808153 and parameters: {'model_name': 'SimpleImputer', 'strategy': 'mean'}. Best is trial 8 with value: 0.13480086029808153.
running
[I 2024-11-23 18:52:06,590] Trial 155 finished with value: 0.13480086029808153 and parameters: {'model_name': 'SimpleImputer', 'strategy': 'mean'}. Best is trial 8 with value: 0.13480086029808153.
running
[I 2024-11-23 18:52:06,720] Trial 158 finished with value: 0.13480086029808153 and parameters: {'model_name': 'SimpleImputer', 'strategy': 'mean'}. Best is trial 8 with value: 0.13480086029808153.
[I 2024-11-23 18:52:06,816] Trial 156 finished with value: 0.13480086029808153 and parameters: {'model_name': 'SimpleImputer', 'strategy': 'mean'}. Best is trial 8 with value: 0.13480086029808153.
running
running
[I 2024-11-23 18:52:07,004] Trial 157 finished with value: 0.13480086029808153 and parameters: {'model_name': 'SimpleImputer', 'strategy': 'mean'}. Best is trial 8 with value: 0.13480086029808153.
running
[I 2024-11-23 18:52:07,113] Trial 159 finished with value: 0.13480086029808153 and parameters: {'model_name': 'SimpleImputer', 'strategy': 'mean'}. Best is trial 8 with value: 0.13480086029808153.
running
[I 2024-11-23 18:52:07,388] Trial 160 finished with value: 0.13480086029808153 and parameters: {'model_name': 'SimpleImputer', 'strategy': 'mean'}. Best is trial 8 with value: 0.13480086029808153.
running
[I 2024-11-23 18:52:07,542] Trial 161 finished with value: 0.13480086029808153 and parameters: {'model_name': 'SimpleImputer', 'strategy': 'mean'}. Best is trial 8 with value: 0.13480086029808153.
[I 2024-11-23 18:52:07,636] Trial 163 finished with value: 0.13480086029808153 and parameters: {'model_name': 'SimpleImputer', 'strategy': 'mean'}. Best is trial 8 with value: 0.13480086029808153.
running
running
[I 2024-11-23 18:52:07,749] Trial 165 finished with value: 0.13480086029808153 and parameters: {'model_name': 'SimpleImputer', 'strategy': 'mean'}. Best is trial 8 with value: 0.13480086029808153.
running
[I 2024-11-23 18:52:07,858] Trial 162 finished with value: 0.13480086029808153 and parameters: {'model_name': 'SimpleImputer', 'strategy': 'mean'}. Best is trial 8 with value: 0.13480086029808153.
running
[I 2024-11-23 18:52:07,987] Trial 164 finished with value: 0.13480086029808153 and parameters: {'model_name': 'SimpleImputer', 'strategy': 'mean'}. Best is trial 8 with value: 0.13480086029808153.
running
[I 2024-11-23 18:52:08,115] Trial 167 finished with value: 0.13480086029808153 and parameters: {'model_name': 'SimpleImputer', 'strategy': 'mean'}. Best is trial 8 with value: 0.13480086029808153.
[I 2024-11-23 18:52:08,215] Trial 166 finished with value: 0.13480086029808153 and parameters: {'model_name': 'SimpleImputer', 'strategy': 'mean'}. Best is trial 8 with value: 0.13480086029808153.
running
[I 2024-11-23 18:52:08,320] Trial 171 finished with value: 0.13480086029808153 and parameters: {'model_name': 'SimpleImputer', 'strategy': 'mean'}. Best is trial 8 with value: 0.13480086029808153.
running
running
[I 2024-11-23 18:52:08,438] Trial 168 finished with value: 0.13480086029808153 and parameters: {'model_name': 'SimpleImputer', 'strategy': 'mean'}. Best is trial 8 with value: 0.13480086029808153.
running
[I 2024-11-23 18:52:08,563] Trial 173 finished with value: 0.13480086029808153 and parameters: {'model_name': 'SimpleImputer', 'strategy': 'mean'}. Best is trial 8 with value: 0.13480086029808153.
running
[I 2024-11-23 18:52:08,676] Trial 170 finished with value: 0.13480086029808153 and parameters: {'model_name': 'SimpleImputer', 'strategy': 'mean'}. Best is trial 8 with value: 0.13480086029808153.
running
[I 2024-11-23 18:52:08,801] Trial 172 finished with value: 0.13480086029808153 and parameters: {'model_name': 'SimpleImputer', 'strategy': 'mean'}. Best is trial 8 with value: 0.13480086029808153.
running
[I 2024-11-23 18:52:08,921] Trial 169 finished with value: 0.13480086029808153 and parameters: {'model_name': 'SimpleImputer', 'strategy': 'mean'}. Best is trial 8 with value: 0.13480086029808153.
running
[I 2024-11-23 18:52:09,085] Trial 174 finished with value: 0.13480086029808153 and parameters: {'model_name': 'SimpleImputer', 'strategy': 'mean'}. Best is trial 8 with value: 0.13480086029808153.
running
[I 2024-11-23 18:52:09,184] Trial 175 finished with value: 0.13480086029808153 and parameters: {'model_name': 'SimpleImputer', 'strategy': 'mean'}. Best is trial 8 with value: 0.13480086029808153.
running
[I 2024-11-23 18:52:09,525] Trial 183 finished with value: 0.13480086029808153 and parameters: {'model_name': 'SimpleImputer', 'strategy': 'mean'}. Best is trial 8 with value: 0.13480086029808153.
running
[I 2024-11-23 18:52:09,633] Trial 182 finished with value: 0.13480086029808153 and parameters: {'model_name': 'SimpleImputer', 'strategy': 'mean'}. Best is trial 8 with value: 0.13480086029808153.
running
[I 2024-11-23 18:52:09,734] Trial 177 finished with value: 0.13480086029808153 and parameters: {'model_name': 'SimpleImputer', 'strategy': 'mean'}. Best is trial 8 with value: 0.13480086029808153.
running
[I 2024-11-23 18:52:09,823] Trial 178 finished with value: 0.13480086029808153 and parameters: {'model_name': 'SimpleImputer', 'strategy': 'mean'}. Best is trial 8 with value: 0.13480086029808153.
[I 2024-11-23 18:52:09,917] Trial 176 finished with value: 0.13480086029808153 and parameters: {'model_name': 'SimpleImputer', 'strategy': 'mean'}. Best is trial 8 with value: 0.13480086029808153.
running
running
[I 2024-11-23 18:52:10,137] Trial 179 finished with value: 0.13480086029808153 and parameters: {'model_name': 'SimpleImputer', 'strategy': 'mean'}. Best is trial 8 with value: 0.13480086029808153.
[I 2024-11-23 18:52:10,237] Trial 180 finished with value: 0.13480086029808153 and parameters: {'model_name': 'SimpleImputer', 'strategy': 'mean'}. Best is trial 8 with value: 0.13480086029808153.
running
[I 2024-11-23 18:52:10,335] Trial 187 finished with value: 0.13480086029808153 and parameters: {'model_name': 'SimpleImputer', 'strategy': 'mean'}. Best is trial 8 with value: 0.13480086029808153.
running
running
[I 2024-11-23 18:52:10,466] Trial 184 finished with value: 0.13480086029808153 and parameters: {'model_name': 'SimpleImputer', 'strategy': 'mean'}. Best is trial 8 with value: 0.13480086029808153.
[I 2024-11-23 18:52:10,560] Trial 181 finished with value: 0.13480086029808153 and parameters: {'model_name': 'SimpleImputer', 'strategy': 'mean'}. Best is trial 8 with value: 0.13480086029808153.
[I 2024-11-23 18:52:10,654] Trial 188 finished with value: 0.13480086029808153 and parameters: {'model_name': 'SimpleImputer', 'strategy': 'mean'}. Best is trial 8 with value: 0.13480086029808153.
[I 2024-11-23 18:52:10,766] Trial 185 finished with value: 0.13480086029808153 and parameters: {'model_name': 'SimpleImputer', 'strategy': 'mean'}. Best is trial 8 with value: 0.13480086029808153.
[I 2024-11-23 18:52:10,869] Trial 191 finished with value: 0.13480086029808153 and parameters: {'model_name': 'SimpleImputer', 'strategy': 'mean'}. Best is trial 8 with value: 0.13480086029808153.
[I 2024-11-23 18:52:10,994] Trial 186 finished with value: 0.13480086029808153 and parameters: {'model_name': 'SimpleImputer', 'strategy': 'mean'}. Best is trial 8 with value: 0.13480086029808153.
[I 2024-11-23 18:52:11,100] Trial 189 finished with value: 0.13480086029808153 and parameters: {'model_name': 'SimpleImputer', 'strategy': 'mean'}. Best is trial 8 with value: 0.13480086029808153.
[I 2024-11-23 18:52:11,213] Trial 190 finished with value: 0.13480086029808153 and parameters: {'model_name': 'SimpleImputer', 'strategy': 'mean'}. Best is trial 8 with value: 0.13480086029808153.
[I 2024-11-23 18:52:11,392] Trial 194 finished with value: 0.13480086029808153 and parameters: {'model_name': 'SimpleImputer', 'strategy': 'mean'}. Best is trial 8 with value: 0.13480086029808153.
[I 2024-11-23 18:52:11,519] Trial 196 finished with value: 0.13480086029808153 and parameters: {'model_name': 'SimpleImputer', 'strategy': 'mean'}. Best is trial 8 with value: 0.13480086029808153.
[I 2024-11-23 18:52:11,620] Trial 192 finished with value: 0.13480086029808153 and parameters: {'model_name': 'SimpleImputer', 'strategy': 'mean'}. Best is trial 8 with value: 0.13480086029808153.
[I 2024-11-23 18:52:11,720] Trial 195 finished with value: 0.13480086029808153 and parameters: {'model_name': 'SimpleImputer', 'strategy': 'mean'}. Best is trial 8 with value: 0.13480086029808153.
[I 2024-11-23 18:52:11,818] Trial 193 finished with value: 0.13480086029808153 and parameters: {'model_name': 'SimpleImputer', 'strategy': 'mean'}. Best is trial 8 with value: 0.13480086029808153.
[I 2024-11-23 18:52:11,918] Trial 198 finished with value: 0.13480086029808153 and parameters: {'model_name': 'SimpleImputer', 'strategy': 'mean'}. Best is trial 8 with value: 0.13480086029808153.
[I 2024-11-23 18:52:12,008] Trial 197 finished with value: 0.13480086029808153 and parameters: {'model_name': 'SimpleImputer', 'strategy': 'mean'}. Best is trial 8 with value: 0.13480086029808153.
