[I 2024-11-23 18:52:12,091] Trial 199 finished with value: 0.13480086029808153 and parameters: {'model_name': 'SimpleImputer', 'strategy': 'mean'}. Best is trial 8 with value: 0.13480086029808153.
fit
simple fit
simple transform
0    0
1    0
2    0
3    0
4    0
5    0
dtype: int64
0    0
1    0
2    0
3    0
4    0
5    0
dtype: int64
0.13480086029808153
{'model_name': 'SimpleImputer', 'strategy': 'mean'}
running experiment 2/3 - Does reconstruction give good automl predictions
Start est fit
Version 0.1.7a0 of tpot2 is outdated. Version 0.1.8a0 was released Tuesday September 17, 2024.
Version 0.1.7a0 of tpot2 is outdated. Version 0.1.8a0 was released Tuesday September 17, 2024.
Version 0.1.7a0 of tpot2 is outdated. Version 0.1.8a0 was released Tuesday September 17, 2024.
Version 0.1.7a0 of tpot2 is outdated. Version 0.1.8a0 was released Tuesday September 17, 2024.
Version 0.1.7a0 of tpot2 is outdated. Version 0.1.8a0 was released Tuesday September 17, 2024.
Version 0.1.7a0 of tpot2 is outdated. Version 0.1.8a0 was released Tuesday September 17, 2024.
Version 0.1.7a0 of tpot2 is outdated. Version 0.1.8a0 was released Tuesday September 17, 2024.
Version 0.1.7a0 of tpot2 is outdated. Version 0.1.8a0 was released Tuesday September 17, 2024.
Version 0.1.7a0 of tpot2 is outdated. Version 0.1.8a0 was released Tuesday September 17, 2024.
Version 0.1.7a0 of tpot2 is outdated. Version 0.1.8a0 was released Tuesday September 17, 2024.
Version 0.1.7a0 of tpot2 is outdated. Version 0.1.8a0 was released Tuesday September 17, 2024.
Version 0.1.7a0 of tpot2 is outdated. Version 0.1.8a0 was released Tuesday September 17, 2024.
Version 0.1.7a0 of tpot2 is outdated. Version 0.1.8a0 was released Tuesday September 17, 2024.
Version 0.1.7a0 of tpot2 is outdated. Version 0.1.8a0 was released Tuesday September 17, 2024.
Version 0.1.7a0 of tpot2 is outdated. Version 0.1.8a0 was released Tuesday September 17, 2024.
Version 0.1.7a0 of tpot2 is outdated. Version 0.1.8a0 was released Tuesday September 17, 2024.
  0%|          | 0/25 [00:00<?, ?it/s]Generation:   0%|          | 0/25 [00:00<?, ?it/s]Generation:  1
Best f1_score score: 0.9821643674963051
Generation:   4%|▍         | 1/25 [02:07<51:08, 127.86s/it]Generation:  2
Best f1_score score: 0.9821643674963051
Generation:   8%|▊         | 2/25 [03:30<38:52, 101.40s/it]Generation:  3
Best f1_score score: 0.9821643674963051
Generation:  12%|█▏        | 3/25 [05:09<36:41, 100.09s/it]WARNING AN INDIVIDUAL TIMED OUT: 
 <tpot2.search_spaces.pipelines.sequential.SequentialPipelineIndividual object at 0x155474cd3d60> 

Generation:  4
Best f1_score score: 0.9821643674963051
Generation:  16%|█▌        | 4/25 [15:14<1:44:48, 299.46s/it]Generation:  5
Best f1_score score: 0.9824183584296465
Generation:  20%|██        | 5/25 [19:04<1:31:31, 274.57s/it]Generation:  6
Best f1_score score: 0.9824183584296465
Generation:  24%|██▍       | 6/25 [20:55<1:09:15, 218.72s/it]Generation:  7
Best f1_score score: 0.9824183584296465
Generation:  28%|██▊       | 7/25 [24:37<1:05:57, 219.84s/it]Generation:  8
Best f1_score score: 0.9824183584296465
Generation:  32%|███▏      | 8/25 [25:34<47:34, 167.92s/it]  Generation:  9
Best f1_score score: 0.9824183584296465
Generation:  36%|███▌      | 9/25 [26:44<36:40, 137.55s/it]Generation:  10
Best f1_score score: 0.9824183584296465
Generation:  40%|████      | 10/25 [32:33<50:41, 202.76s/it]Generation:  11
Best f1_score score: 0.9824183584296465
Generation:  44%|████▍     | 11/25 [36:57<51:39, 221.38s/it]Generation:  12
Best f1_score score: 0.9824183584296465
Generation:  48%|████▊     | 12/25 [37:30<35:35, 164.28s/it]Generation:  13
Best f1_score score: 0.9824183845473303
Generation:  52%|█████▏    | 13/25 [41:01<35:39, 178.30s/it]Generation:  14
Best f1_score score: 0.9825876916353652
Generation:  56%|█████▌    | 14/25 [41:48<25:24, 138.61s/it]WARNING AN INDIVIDUAL TIMED OUT: 
 <tpot2.search_spaces.pipelines.sequential.SequentialPipelineIndividual object at 0x1554742d7250> 

Generation:  15
Best f1_score score: 0.9828981538366035
Generation:  60%|██████    | 15/25 [51:57<46:45, 280.51s/it]Generation:  16
Best f1_score score: 0.9828981538366035
Generation:  64%|██████▍   | 16/25 [52:45<31:34, 210.45s/it]Generation:  17
Best f1_score score: 0.9828981538366035
Generation:  68%|██████▊   | 17/25 [53:20<21:00, 157.62s/it]Generation:  18
Best f1_score score: 0.9828981538366035
Generation:  72%|███████▏  | 18/25 [55:19<17:02, 146.02s/it]Generation:  19
Best f1_score score: 0.9828981538366035
Generation:  76%|███████▌  | 19/25 [56:29<12:20, 123.38s/it]Generation:  20
Best f1_score score: 0.9828981538366035
Generation:  80%|████████  | 20/25 [56:59<07:55, 95.17s/it] Generation:  21
Best f1_score score: 0.9828981538366035
Generation:  84%|████████▍ | 21/25 [59:31<07:29, 112.28s/it]Generation:  22
Best f1_score score: 0.9828981538366035
Generation:  88%|████████▊ | 22/25 [59:59<04:20, 86.94s/it] Generation:  23
Best f1_score score: 0.9828981538366035
Generation:  92%|█████████▏| 23/25 [1:00:56<02:35, 77.95s/it]Generation:  24
Best f1_score score: 0.9828981538366035
Generation:  96%|█████████▌| 24/25 [1:07:28<02:52, 172.17s/it]WARNING AN INDIVIDUAL TIMED OUT: 
 <tpot2.search_spaces.pipelines.sequential.SequentialPipelineIndividual object at 0x15546713a680> 

Generation:  25
Best f1_score score: 0.9828981538366035
Generation: 100%|██████████| 25/25 [1:17:40<00:00, 304.34s/it]Generation: 100%|██████████| 25/25 [1:17:43<00:00, 186.56s/it]
2024-11-23 20:10:04,360 - distributed.scheduler - ERROR - Removing worker 'tcp://127.0.0.1:37297' caused the cluster to lose scattered data, which can't be recovered: {'ndarray-a5178c1bce7fde7389cb01aeb5b3f67c', 'ndarray-89eccf6bf6a2f74b785b9e31bcffba6d'} (stimulus_id='handle-worker-cleanup-1732421404.360033')
Fitted
Pipeline(steps=[('histgradientboostingclassifier',
                 HistGradientBoostingClassifier(early_stopping=True,
                                                l2_regularization=1.33063e-08,
                                                learning_rate=0.1062228430042,
                                                max_features=0.6377446352997,
                                                max_leaf_nodes=476,
                                                min_samples_leaf=198,
                                                n_iter_no_change=11, tol=0.0001,
                                                validation_fraction=None))])
score start
train score: {'auroc': 0.999795403281755, 'accuracy': 0.99247918724425, 'balanced_accuracy': 0.9924837300138014, 'logloss': 0.02263008656447194, 'f1': 0.992479175910358}
original test score: {'auroc': 0.9993402027492146, 'accuracy': 0.9906874365052489, 'balanced_accuracy': 0.9906921404656386, 'logloss': 0.02794692698986247, 'f1': 0.9906874179647791}
imputed test score: {'auroc': 0.9981878447181658, 'accuracy': 0.9836324641607405, 'balanced_accuracy': 0.9836395587072322, 'logloss': 0.047808384001725455, 'f1': 0.9836323231785241}
score end
check intended
EXP2 Finished
running experiment 3/3 - What is the best automl settings?
<tpot2.search_spaces.pipelines.sequential.SequentialPipeline object at 0x15543504f9d0>
Start tpot fit
Version 0.1.7a0 of tpot2 is outdated. Version 0.1.8a0 was released Tuesday September 17, 2024.
Version 0.1.7a0 of tpot2 is outdated. Version 0.1.8a0 was released Tuesday September 17, 2024.
Version 0.1.7a0 of tpot2 is outdated. Version 0.1.8a0 was released Tuesday September 17, 2024.
Version 0.1.7a0 of tpot2 is outdated. Version 0.1.8a0 was released Tuesday September 17, 2024.
Version 0.1.7a0 of tpot2 is outdated. Version 0.1.8a0 was released Tuesday September 17, 2024.
Version 0.1.7a0 of tpot2 is outdated. Version 0.1.8a0 was released Tuesday September 17, 2024.
Version 0.1.7a0 of tpot2 is outdated. Version 0.1.8a0 was released Tuesday September 17, 2024.
Version 0.1.7a0 of tpot2 is outdated. Version 0.1.8a0 was released Tuesday September 17, 2024.
Version 0.1.7a0 of tpot2 is outdated. Version 0.1.8a0 was released Tuesday September 17, 2024.
Version 0.1.7a0 of tpot2 is outdated. Version 0.1.8a0 was released Tuesday September 17, 2024.
Version 0.1.7a0 of tpot2 is outdated. Version 0.1.8a0 was released Tuesday September 17, 2024.
Version 0.1.7a0 of tpot2 is outdated. Version 0.1.8a0 was released Tuesday September 17, 2024.
Version 0.1.7a0 of tpot2 is outdated. Version 0.1.8a0 was released Tuesday September 17, 2024.
Version 0.1.7a0 of tpot2 is outdated. Version 0.1.8a0 was released Tuesday September 17, 2024.
Version 0.1.7a0 of tpot2 is outdated. Version 0.1.8a0 was released Tuesday September 17, 2024.
Version 0.1.7a0 of tpot2 is outdated. Version 0.1.8a0 was released Tuesday September 17, 2024.
  0%|          | 0/25 [00:00<?, ?it/s]Generation:   0%|          | 0/25 [00:00<?, ?it/s]WARNING AN INDIVIDUAL TIMED OUT: 
 <tpot2.search_spaces.pipelines.sequential.SequentialPipelineIndividual object at 0x1554746a0a90> 

Generation:  1
Best f1_score score: 0.9788907136403575
Generation:   4%|▍         | 1/25 [10:01<4:00:39, 601.65s/it]WARNING AN INDIVIDUAL TIMED OUT: 
 <tpot2.search_spaces.pipelines.sequential.SequentialPipelineIndividual object at 0x1554746f6ec0> 

Generation:  2
Best f1_score score: 0.9788907136403575
Generation:   8%|▊         | 2/25 [20:04<3:50:59, 602.57s/it]Generation:  3
Best f1_score score: 0.9817551995704896
Generation:  12%|█▏        | 3/25 [23:32<2:34:50, 422.32s/it]Generation:  4
Best f1_score score: 0.982361970658636
Generation:  16%|█▌        | 4/25 [27:10<1:59:32, 341.53s/it]Generation:  5
Best f1_score score: 0.9826723868097066
Generation:  20%|██        | 5/25 [29:27<1:29:16, 267.81s/it]Generation:  6
Best f1_score score: 0.9826723868097066
Generation:  24%|██▍       | 6/25 [30:33<1:03:02, 199.05s/it]Generation:  7
Best f1_score score: 0.9826723868097066
Generation:  28%|██▊       | 7/25 [30:48<41:40, 138.93s/it]  Generation:  8
Best f1_score score: 0.9826723868097066
Generation:  32%|███▏      | 8/25 [33:20<40:31, 143.04s/it]Generation:  9
Best f1_score score: 0.9826723868097066
Generation:  36%|███▌      | 9/25 [37:35<47:32, 178.27s/it]WARNING AN INDIVIDUAL TIMED OUT: 
 <tpot2.search_spaces.pipelines.sequential.SequentialPipelineIndividual object at 0x155467842320> 

Generation:  10
Best f1_score score: 0.9826723868097066
Generation:  40%|████      | 10/25 [47:40<1:17:27, 309.84s/it]Generation:  11
Best f1_score score: 0.9826723868097066
Generation:  44%|████▍     | 11/25 [51:06<1:04:53, 278.09s/it]Generation:  12
Best f1_score score: 0.9828275776150365
Generation:  48%|████▊     | 12/25 [52:34<47:42, 220.17s/it]  WARNING AN INDIVIDUAL TIMED OUT: 
 <tpot2.search_spaces.pipelines.sequential.SequentialPipelineIndividual object at 0x155474743f70> 

Generation:  13
Best f1_score score: 0.9828275776150365
Generation:  52%|█████▏    | 13/25 [1:02:37<1:07:16, 336.34s/it]Generation:  14
Best f1_score score: 0.9828275776150365
Generation:  56%|█████▌    | 14/25 [1:03:25<45:42, 249.31s/it]  Generation:  15
Best f1_score score: 0.9828275776150365
Generation:  60%|██████    | 15/25 [1:04:43<32:55, 197.51s/it]Generation:  16
Best f1_score score: 0.9828275776150365
Generation:  64%|██████▍   | 16/25 [1:09:05<32:32, 216.90s/it]Generation:  17
Best f1_score score: 0.9829686726514456
Generation:  68%|██████▊   | 17/25 [1:13:22<30:32, 229.09s/it]WARNING AN INDIVIDUAL TIMED OUT: 
 <tpot2.search_spaces.pipelines.sequential.SequentialPipelineIndividual object at 0x155466e46dd0> 

Generation:  18
Best f1_score score: 0.9829686726514456
Generation:  72%|███████▏  | 18/25 [1:23:27<39:53, 341.94s/it]Generation:  19
Best f1_score score: 0.9829686726514456
Generation:  76%|███████▌  | 19/25 [1:26:16<28:59, 289.95s/it]WARNING AN INDIVIDUAL TIMED OUT: 
 <tpot2.search_spaces.pipelines.sequential.SequentialPipelineIndividual object at 0x1554646c70d0> 

Generation:  20
Best f1_score score: 0.9829686726514456
Generation:  80%|████████  | 20/25 [1:36:21<32:03, 384.77s/it]Generation:  21
Best f1_score score: 0.9829686726514456
Generation:  84%|████████▍ | 21/25 [1:39:29<21:42, 325.60s/it]Generation:  22
Best f1_score score: 0.9829686726514456
Generation:  88%|████████▊ | 22/25 [1:40:33<12:21, 247.10s/it]Generation:  23
Best f1_score score: 0.9829686726514456
Generation:  92%|█████████▏| 23/25 [1:44:56<08:23, 251.73s/it]Generation:  24
Best f1_score score: 0.9829686726514456
Generation:  96%|█████████▌| 24/25 [1:50:50<04:42, 282.39s/it]Generation:  25
Best f1_score score: 0.9829686726514456
Generation: 100%|██████████| 25/25 [1:51:23<00:00, 207.67s/it]Generation: 100%|██████████| 25/25 [1:51:23<00:00, 267.34s/it]
2024-11-23 22:01:41,054 - distributed.scheduler - ERROR - Removing worker 'tcp://127.0.0.1:45265' caused the cluster to lose scattered data, which can't be recovered: {'ndarray-89eccf6bf6a2f74b785b9e31bcffba6d', 'DataFrame-b36cd3bf7a25f6857cadbbc22df68d68'} (stimulus_id='handle-worker-cleanup-1732428101.0540543')
Fitted
Pipeline(steps=[('simpleimputer', SimpleImputer(strategy='median')),
                ('histgradientboostingclassifier',
                 HistGradientBoostingClassifier(early_stopping=True,
                                                l2_regularization=0.0001497090235,
                                                learning_rate=0.1115869510503,
                                                max_features=0.8224720648783,
                                                max_leaf_nodes=1321,
                                                min_samples_leaf=166,
                                                tol=0.0001,
                                                validation_fraction=None))])
transform worked
try transform
transform worked
score start
train score: {'auroc': 0.9999066536781039, 'accuracy': 0.9946521800479752, 'balanced_accuracy': 0.9946557297431242, 'logloss': 0.017918792009554898, 'f1': 0.9946521780792323}
test score: {'auroc': 0.9982021665309557, 'accuracy': 0.9824472288068631, 'balanced_accuracy': 0.9824540528149975, 'logloss': 0.04922827126089604, 'f1': 0.9824470945576408}
original test score: {'auroc': 0.9993400498472989, 'accuracy': 0.9910260751777853, 'balanced_accuracy': 0.9910297096704792, 'logloss': 0.028032608137273388, 'f1': 0.9910260703467526}
score end
40922
lvl
0.5
type
MAR
num_run
1
class_simple
finished
all finished
full run takes
3.17020061439938
hours
DONE
