Run: 18
/cm/local/apps/slurm/var/spool/job919823/slurm_script: line 26: 
pip install -e tpot2
pip install -r tpot2/ImputerExperiments/requirements_.txt
: No such file or directory
RunStart
starting loops
../data/r/197/197.pkl
working on 
../data/r/197/reg_simple_MAR_0.1_1
0.5509123802185059
running experiment 1/3 - Does large hyperparameter space improve reconstruction accuracy over simple
[I 2024-08-12 13:18:24,754] A new study created in memory with name: no-name-103dee90-83c2-4af2-82b8-fc9a6f2c768d
running
running
running
running
running
running
running
running
running
running
running
running
running
running
running
running
[I 2024-08-12 13:18:25,420] Trial 12 finished with value: 0.05343410315382848 and parameters: {'model_name': 'SimpleImputer', 'strategy': 'constant'}. Best is trial 12 with value: 0.05343410315382848.
running
[I 2024-08-12 13:18:25,674] Trial 0 finished with value: 0.05343410315382848 and parameters: {'model_name': 'SimpleImputer', 'strategy': 'constant'}. Best is trial 12 with value: 0.05343410315382848.
running
[I 2024-08-12 13:18:25,785] Trial 4 finished with value: 0.05343410315382848 and parameters: {'model_name': 'SimpleImputer', 'strategy': 'constant'}. Best is trial 12 with value: 0.05343410315382848.
running
[I 2024-08-12 13:18:25,960] Trial 15 finished with value: 0.05343410315382848 and parameters: {'model_name': 'SimpleImputer', 'strategy': 'constant'}. Best is trial 12 with value: 0.05343410315382848.
[I 2024-08-12 13:18:26,065] Trial 8 finished with value: 0.05343410315382848 and parameters: {'model_name': 'SimpleImputer', 'strategy': 'constant'}. Best is trial 12 with value: 0.05343410315382848.
running
[I 2024-08-12 13:18:26,166] Trial 3 finished with value: 0.04129786097871689 and parameters: {'model_name': 'SimpleImputer', 'strategy': 'mean'}. Best is trial 3 with value: 0.04129786097871689.
running
running
[I 2024-08-12 13:18:26,263] Trial 2 finished with value: 0.04129786097871689 and parameters: {'model_name': 'SimpleImputer', 'strategy': 'mean'}. Best is trial 3 with value: 0.04129786097871689.
running
[I 2024-08-12 13:18:26,463] Trial 1 finished with value: 0.04129786097871689 and parameters: {'model_name': 'SimpleImputer', 'strategy': 'mean'}. Best is trial 3 with value: 0.04129786097871689.
running
[I 2024-08-12 13:18:26,640] Trial 7 finished with value: 0.04129786097871689 and parameters: {'model_name': 'SimpleImputer', 'strategy': 'mean'}. Best is trial 3 with value: 0.04129786097871689.
running
[I 2024-08-12 13:18:27,243] Trial 16 finished with value: 0.04129786097871689 and parameters: {'model_name': 'SimpleImputer', 'strategy': 'mean'}. Best is trial 3 with value: 0.04129786097871689.
running
[I 2024-08-12 13:18:27,368] Trial 5 finished with value: 0.04144358319703702 and parameters: {'model_name': 'SimpleImputer', 'strategy': 'median'}. Best is trial 3 with value: 0.04129786097871689.
running
[I 2024-08-12 13:18:27,503] Trial 17 finished with value: 0.05343410315382848 and parameters: {'model_name': 'SimpleImputer', 'strategy': 'constant'}. Best is trial 3 with value: 0.04129786097871689.
running
[I 2024-08-12 13:18:27,799] Trial 9 finished with value: 0.04144358319703702 and parameters: {'model_name': 'SimpleImputer', 'strategy': 'median'}. Best is trial 3 with value: 0.04129786097871689.
running
[I 2024-08-12 13:18:27,984] Trial 19 finished with value: 0.04129786097871689 and parameters: {'model_name': 'SimpleImputer', 'strategy': 'mean'}. Best is trial 3 with value: 0.04129786097871689.
running
[I 2024-08-12 13:18:28,646] Trial 18 finished with value: 0.04144358319703702 and parameters: {'model_name': 'SimpleImputer', 'strategy': 'median'}. Best is trial 3 with value: 0.04129786097871689.
running
[I 2024-08-12 13:18:29,000] Trial 24 finished with value: 0.04144358319703702 and parameters: {'model_name': 'SimpleImputer', 'strategy': 'median'}. Best is trial 3 with value: 0.04129786097871689.
running
[I 2024-08-12 13:18:29,735] Trial 25 finished with value: 0.04144358319703702 and parameters: {'model_name': 'SimpleImputer', 'strategy': 'median'}. Best is trial 3 with value: 0.04129786097871689.
running
[I 2024-08-12 13:18:31,022] Trial 14 finished with value: 0.05219747793155246 and parameters: {'model_name': 'SimpleImputer', 'strategy': 'most_frequent'}. Best is trial 3 with value: 0.04129786097871689.
running
[I 2024-08-12 13:18:31,494] Trial 6 finished with value: 0.05219747793155246 and parameters: {'model_name': 'SimpleImputer', 'strategy': 'most_frequent'}. Best is trial 3 with value: 0.04129786097871689.
running
[I 2024-08-12 13:18:31,681] Trial 10 finished with value: 0.05219747793155246 and parameters: {'model_name': 'SimpleImputer', 'strategy': 'most_frequent'}. Best is trial 3 with value: 0.04129786097871689.
[I 2024-08-12 13:18:31,776] Trial 13 finished with value: 0.05219747793155246 and parameters: {'model_name': 'SimpleImputer', 'strategy': 'most_frequent'}. Best is trial 3 with value: 0.04129786097871689.
running
[I 2024-08-12 13:18:31,925] Trial 11 finished with value: 0.05219747793155246 and parameters: {'model_name': 'SimpleImputer', 'strategy': 'most_frequent'}. Best is trial 3 with value: 0.04129786097871689.
running
running
[I 2024-08-12 13:18:32,626] Trial 33 finished with value: 0.04129786097871689 and parameters: {'model_name': 'SimpleImputer', 'strategy': 'mean'}. Best is trial 3 with value: 0.04129786097871689.
[I 2024-08-12 13:18:32,635] Trial 20 finished with value: 0.05219747793155246 and parameters: {'model_name': 'SimpleImputer', 'strategy': 'most_frequent'}. Best is trial 3 with value: 0.04129786097871689.
running
running
[I 2024-08-12 13:18:32,918] Trial 21 finished with value: 0.05219747793155246 and parameters: {'model_name': 'SimpleImputer', 'strategy': 'most_frequent'}. Best is trial 3 with value: 0.04129786097871689.
running
[I 2024-08-12 13:18:33,079] Trial 22 finished with value: 0.05219747793155246 and parameters: {'model_name': 'SimpleImputer', 'strategy': 'most_frequent'}. Best is trial 3 with value: 0.04129786097871689.
running
[I 2024-08-12 13:18:33,297] Trial 23 finished with value: 0.05219747793155246 and parameters: {'model_name': 'SimpleImputer', 'strategy': 'most_frequent'}. Best is trial 3 with value: 0.04129786097871689.
running
[I 2024-08-12 13:18:33,532] Trial 36 finished with value: 0.04129786097871689 and parameters: {'model_name': 'SimpleImputer', 'strategy': 'mean'}. Best is trial 3 with value: 0.04129786097871689.
running
[I 2024-08-12 13:18:33,756] Trial 26 finished with value: 0.05219747793155246 and parameters: {'model_name': 'SimpleImputer', 'strategy': 'most_frequent'}. Best is trial 3 with value: 0.04129786097871689.
[I 2024-08-12 13:18:33,894] Trial 34 finished with value: 0.04129786097871689 and parameters: {'model_name': 'SimpleImputer', 'strategy': 'mean'}. Best is trial 3 with value: 0.04129786097871689.
running
[I 2024-08-12 13:18:33,989] Trial 35 finished with value: 0.04129786097871689 and parameters: {'model_name': 'SimpleImputer', 'strategy': 'mean'}. Best is trial 3 with value: 0.04129786097871689.
running
running
[I 2024-08-12 13:18:34,139] Trial 37 finished with value: 0.04129786097871689 and parameters: {'model_name': 'SimpleImputer', 'strategy': 'mean'}. Best is trial 3 with value: 0.04129786097871689.
running
[I 2024-08-12 13:18:34,631] Trial 27 finished with value: 0.05219747793155246 and parameters: {'model_name': 'SimpleImputer', 'strategy': 'most_frequent'}. Best is trial 3 with value: 0.04129786097871689.
running
[I 2024-08-12 13:18:34,760] Trial 40 finished with value: 0.04129786097871689 and parameters: {'model_name': 'SimpleImputer', 'strategy': 'mean'}. Best is trial 3 with value: 0.04129786097871689.
running
[I 2024-08-12 13:18:34,888] Trial 29 finished with value: 0.05219747793155246 and parameters: {'model_name': 'SimpleImputer', 'strategy': 'most_frequent'}. Best is trial 3 with value: 0.04129786097871689.
running
[I 2024-08-12 13:18:35,075] Trial 38 finished with value: 0.04129786097871689 and parameters: {'model_name': 'SimpleImputer', 'strategy': 'mean'}. Best is trial 3 with value: 0.04129786097871689.
running
[I 2024-08-12 13:18:35,239] Trial 39 finished with value: 0.04129786097871689 and parameters: {'model_name': 'SimpleImputer', 'strategy': 'mean'}. Best is trial 3 with value: 0.04129786097871689.
running
[I 2024-08-12 13:18:35,385] Trial 41 finished with value: 0.04129786097871689 and parameters: {'model_name': 'SimpleImputer', 'strategy': 'mean'}. Best is trial 3 with value: 0.04129786097871689.
running
[I 2024-08-12 13:18:35,687] Trial 42 finished with value: 0.04129786097871689 and parameters: {'model_name': 'SimpleImputer', 'strategy': 'mean'}. Best is trial 3 with value: 0.04129786097871689.
running
[I 2024-08-12 13:18:35,895] Trial 44 finished with value: 0.04129786097871689 and parameters: {'model_name': 'SimpleImputer', 'strategy': 'mean'}. Best is trial 3 with value: 0.04129786097871689.
running
[I 2024-08-12 13:18:36,017] Trial 45 finished with value: 0.04129786097871689 and parameters: {'model_name': 'SimpleImputer', 'strategy': 'mean'}. Best is trial 3 with value: 0.04129786097871689.
running
[I 2024-08-12 13:18:36,138] Trial 43 finished with value: 0.04129786097871689 and parameters: {'model_name': 'SimpleImputer', 'strategy': 'mean'}. Best is trial 3 with value: 0.04129786097871689.
running
[I 2024-08-12 13:18:36,422] Trial 47 finished with value: 0.04129786097871689 and parameters: {'model_name': 'SimpleImputer', 'strategy': 'mean'}. Best is trial 3 with value: 0.04129786097871689.
[I 2024-08-12 13:18:36,525] Trial 46 finished with value: 0.04129786097871689 and parameters: {'model_name': 'SimpleImputer', 'strategy': 'mean'}. Best is trial 3 with value: 0.04129786097871689.
running
running
[I 2024-08-12 13:18:36,653] Trial 28 finished with value: 0.05219747793155246 and parameters: {'model_name': 'SimpleImputer', 'strategy': 'most_frequent'}. Best is trial 3 with value: 0.04129786097871689.
running
[I 2024-08-12 13:18:36,851] Trial 53 finished with value: 0.04129786097871689 and parameters: {'model_name': 'SimpleImputer', 'strategy': 'mean'}. Best is trial 3 with value: 0.04129786097871689.
running
[I 2024-08-12 13:18:36,986] Trial 51 finished with value: 0.04129786097871689 and parameters: {'model_name': 'SimpleImputer', 'strategy': 'mean'}. Best is trial 3 with value: 0.04129786097871689.
[I 2024-08-12 13:18:37,085] Trial 48 finished with value: 0.04129786097871689 and parameters: {'model_name': 'SimpleImputer', 'strategy': 'mean'}. Best is trial 3 with value: 0.04129786097871689.
running
running
[I 2024-08-12 13:18:37,319] Trial 52 finished with value: 0.04129786097871689 and parameters: {'model_name': 'SimpleImputer', 'strategy': 'mean'}. Best is trial 3 with value: 0.04129786097871689.
running
[I 2024-08-12 13:18:37,501] Trial 30 finished with value: 0.05219747793155246 and parameters: {'model_name': 'SimpleImputer', 'strategy': 'most_frequent'}. Best is trial 3 with value: 0.04129786097871689.
[I 2024-08-12 13:18:37,593] Trial 31 finished with value: 0.05219747793155246 and parameters: {'model_name': 'SimpleImputer', 'strategy': 'most_frequent'}. Best is trial 3 with value: 0.04129786097871689.
[I 2024-08-12 13:18:37,691] Trial 49 finished with value: 0.04129786097871689 and parameters: {'model_name': 'SimpleImputer', 'strategy': 'mean'}. Best is trial 3 with value: 0.04129786097871689.
running
running
running
[I 2024-08-12 13:18:37,928] Trial 50 finished with value: 0.04129786097871689 and parameters: {'model_name': 'SimpleImputer', 'strategy': 'mean'}. Best is trial 3 with value: 0.04129786097871689.
running
[I 2024-08-12 13:18:38,148] Trial 32 finished with value: 0.05219747793155246 and parameters: {'model_name': 'SimpleImputer', 'strategy': 'most_frequent'}. Best is trial 3 with value: 0.04129786097871689.
running
[I 2024-08-12 13:18:38,268] Trial 54 finished with value: 0.04129786097871689 and parameters: {'model_name': 'SimpleImputer', 'strategy': 'mean'}. Best is trial 3 with value: 0.04129786097871689.
running
[I 2024-08-12 13:18:38,483] Trial 56 finished with value: 0.04129786097871689 and parameters: {'model_name': 'SimpleImputer', 'strategy': 'mean'}. Best is trial 3 with value: 0.04129786097871689.
[I 2024-08-12 13:18:38,583] Trial 55 finished with value: 0.04129786097871689 and parameters: {'model_name': 'SimpleImputer', 'strategy': 'mean'}. Best is trial 3 with value: 0.04129786097871689.
running
running
[I 2024-08-12 13:18:38,814] Trial 57 finished with value: 0.04129786097871689 and parameters: {'model_name': 'SimpleImputer', 'strategy': 'mean'}. Best is trial 3 with value: 0.04129786097871689.
running
[I 2024-08-12 13:18:39,012] Trial 62 finished with value: 0.05343410315382848 and parameters: {'model_name': 'SimpleImputer', 'strategy': 'constant'}. Best is trial 3 with value: 0.04129786097871689.
[I 2024-08-12 13:18:39,129] Trial 65 finished with value: 0.05343410315382848 and parameters: {'model_name': 'SimpleImputer', 'strategy': 'constant'}. Best is trial 3 with value: 0.04129786097871689.
running
running
[I 2024-08-12 13:18:39,239] Trial 64 finished with value: 0.05343410315382848 and parameters: {'model_name': 'SimpleImputer', 'strategy': 'constant'}. Best is trial 3 with value: 0.04129786097871689.
running
[I 2024-08-12 13:18:39,362] Trial 66 finished with value: 0.05343410315382848 and parameters: {'model_name': 'SimpleImputer', 'strategy': 'constant'}. Best is trial 3 with value: 0.04129786097871689.
[I 2024-08-12 13:18:39,490] Trial 63 finished with value: 0.05343410315382848 and parameters: {'model_name': 'SimpleImputer', 'strategy': 'constant'}. Best is trial 3 with value: 0.04129786097871689.
running
[I 2024-08-12 13:18:39,605] Trial 61 finished with value: 0.05343410315382848 and parameters: {'model_name': 'SimpleImputer', 'strategy': 'constant'}. Best is trial 3 with value: 0.04129786097871689.
running
[I 2024-08-12 13:18:39,701] Trial 68 finished with value: 0.05343410315382848 and parameters: {'model_name': 'SimpleImputer', 'strategy': 'constant'}. Best is trial 3 with value: 0.04129786097871689.
[I 2024-08-12 13:18:39,788] Trial 60 finished with value: 0.04129786097871689 and parameters: {'model_name': 'SimpleImputer', 'strategy': 'mean'}. Best is trial 3 with value: 0.04129786097871689.
running
running
running
[I 2024-08-12 13:18:39,906] Trial 59 finished with value: 0.04129786097871689 and parameters: {'model_name': 'SimpleImputer', 'strategy': 'mean'}. Best is trial 3 with value: 0.04129786097871689.
running
[I 2024-08-12 13:18:40,013] Trial 58 finished with value: 0.04129786097871689 and parameters: {'model_name': 'SimpleImputer', 'strategy': 'mean'}. Best is trial 3 with value: 0.04129786097871689.
running
[I 2024-08-12 13:18:40,231] Trial 67 finished with value: 0.05343410315382848 and parameters: {'model_name': 'SimpleImputer', 'strategy': 'constant'}. Best is trial 3 with value: 0.04129786097871689.
running
[I 2024-08-12 13:18:40,430] Trial 70 finished with value: 0.05343410315382848 and parameters: {'model_name': 'SimpleImputer', 'strategy': 'constant'}. Best is trial 3 with value: 0.04129786097871689.
running
[I 2024-08-12 13:18:40,548] Trial 69 finished with value: 0.05343410315382848 and parameters: {'model_name': 'SimpleImputer', 'strategy': 'constant'}. Best is trial 3 with value: 0.04129786097871689.
running
[I 2024-08-12 13:18:40,767] Trial 73 finished with value: 0.05343410315382848 and parameters: {'model_name': 'SimpleImputer', 'strategy': 'constant'}. Best is trial 3 with value: 0.04129786097871689.
running
[I 2024-08-12 13:18:40,908] Trial 71 finished with value: 0.05343410315382848 and parameters: {'model_name': 'SimpleImputer', 'strategy': 'constant'}. Best is trial 3 with value: 0.04129786097871689.
running
[I 2024-08-12 13:18:41,504] Trial 75 finished with value: 0.04144358319703702 and parameters: {'model_name': 'SimpleImputer', 'strategy': 'median'}. Best is trial 3 with value: 0.04129786097871689.
[I 2024-08-12 13:18:41,624] Trial 72 finished with value: 0.04144358319703702 and parameters: {'model_name': 'SimpleImputer', 'strategy': 'median'}. Best is trial 3 with value: 0.04129786097871689.
running
running
[I 2024-08-12 13:18:41,908] Trial 77 finished with value: 0.04144358319703702 and parameters: {'model_name': 'SimpleImputer', 'strategy': 'median'}. Best is trial 3 with value: 0.04129786097871689.
[I 2024-08-12 13:18:42,012] Trial 78 finished with value: 0.04144358319703702 and parameters: {'model_name': 'SimpleImputer', 'strategy': 'median'}. Best is trial 3 with value: 0.04129786097871689.
running
[I 2024-08-12 13:18:42,144] Trial 83 finished with value: 0.04144358319703702 and parameters: {'model_name': 'SimpleImputer', 'strategy': 'median'}. Best is trial 3 with value: 0.04129786097871689.
running
running
[I 2024-08-12 13:18:42,333] Trial 79 finished with value: 0.04144358319703702 and parameters: {'model_name': 'SimpleImputer', 'strategy': 'median'}. Best is trial 3 with value: 0.04129786097871689.
running
[I 2024-08-12 13:18:42,479] Trial 85 finished with value: 0.04144358319703702 and parameters: {'model_name': 'SimpleImputer', 'strategy': 'median'}. Best is trial 3 with value: 0.04129786097871689.
[I 2024-08-12 13:18:42,594] Trial 81 finished with value: 0.04144358319703702 and parameters: {'model_name': 'SimpleImputer', 'strategy': 'median'}. Best is trial 3 with value: 0.04129786097871689.
running
running
[I 2024-08-12 13:18:42,718] Trial 80 finished with value: 0.04144358319703702 and parameters: {'model_name': 'SimpleImputer', 'strategy': 'median'}. Best is trial 3 with value: 0.04129786097871689.
running
[I 2024-08-12 13:18:42,829] Trial 82 finished with value: 0.04144358319703702 and parameters: {'model_name': 'SimpleImputer', 'strategy': 'median'}. Best is trial 3 with value: 0.04129786097871689.
[I 2024-08-12 13:18:42,923] Trial 84 finished with value: 0.04144358319703702 and parameters: {'model_name': 'SimpleImputer', 'strategy': 'median'}. Best is trial 3 with value: 0.04129786097871689.
running
running
[I 2024-08-12 13:18:43,043] Trial 76 finished with value: 0.04144358319703702 and parameters: {'model_name': 'SimpleImputer', 'strategy': 'median'}. Best is trial 3 with value: 0.04129786097871689.
running
[I 2024-08-12 13:18:43,180] Trial 74 finished with value: 0.04144358319703702 and parameters: {'model_name': 'SimpleImputer', 'strategy': 'median'}. Best is trial 3 with value: 0.04129786097871689.
running
[I 2024-08-12 13:18:43,498] Trial 88 finished with value: 0.04144358319703702 and parameters: {'model_name': 'SimpleImputer', 'strategy': 'median'}. Best is trial 3 with value: 0.04129786097871689.
[I 2024-08-12 13:18:43,599] Trial 87 finished with value: 0.04144358319703702 and parameters: {'model_name': 'SimpleImputer', 'strategy': 'median'}. Best is trial 3 with value: 0.04129786097871689.
running
running
[I 2024-08-12 13:18:43,823] Trial 86 finished with value: 0.04144358319703702 and parameters: {'model_name': 'SimpleImputer', 'strategy': 'median'}. Best is trial 3 with value: 0.04129786097871689.
running
[I 2024-08-12 13:18:44,022] Trial 90 finished with value: 0.04129786097871689 and parameters: {'model_name': 'SimpleImputer', 'strategy': 'mean'}. Best is trial 3 with value: 0.04129786097871689.
running
[I 2024-08-12 13:18:44,164] Trial 89 finished with value: 0.04129786097871689 and parameters: {'model_name': 'SimpleImputer', 'strategy': 'mean'}. Best is trial 3 with value: 0.04129786097871689.
running
[I 2024-08-12 13:18:44,272] Trial 92 finished with value: 0.04129786097871689 and parameters: {'model_name': 'SimpleImputer', 'strategy': 'mean'}. Best is trial 3 with value: 0.04129786097871689.
running
[I 2024-08-12 13:18:44,452] Trial 95 finished with value: 0.04129786097871689 and parameters: {'model_name': 'SimpleImputer', 'strategy': 'mean'}. Best is trial 3 with value: 0.04129786097871689.
running
[I 2024-08-12 13:18:44,735] Trial 91 finished with value: 0.04129786097871689 and parameters: {'model_name': 'SimpleImputer', 'strategy': 'mean'}. Best is trial 3 with value: 0.04129786097871689.
running
[I 2024-08-12 13:18:44,859] Trial 93 finished with value: 0.04129786097871689 and parameters: {'model_name': 'SimpleImputer', 'strategy': 'mean'}. Best is trial 3 with value: 0.04129786097871689.
running
[I 2024-08-12 13:18:44,989] Trial 94 finished with value: 0.04129786097871689 and parameters: {'model_name': 'SimpleImputer', 'strategy': 'mean'}. Best is trial 3 with value: 0.04129786097871689.
[I 2024-08-12 13:18:45,086] Trial 97 finished with value: 0.04129786097871689 and parameters: {'model_name': 'SimpleImputer', 'strategy': 'mean'}. Best is trial 3 with value: 0.04129786097871689.
running
[I 2024-08-12 13:18:45,235] Trial 99 finished with value: 0.04129786097871689 and parameters: {'model_name': 'SimpleImputer', 'strategy': 'mean'}. Best is trial 3 with value: 0.04129786097871689.
running
running
[I 2024-08-12 13:18:45,383] Trial 96 finished with value: 0.04129786097871689 and parameters: {'model_name': 'SimpleImputer', 'strategy': 'mean'}. Best is trial 3 with value: 0.04129786097871689.
[I 2024-08-12 13:18:45,500] Trial 98 finished with value: 0.04129786097871689 and parameters: {'model_name': 'SimpleImputer', 'strategy': 'mean'}. Best is trial 3 with value: 0.04129786097871689.
running
running
[I 2024-08-12 13:18:45,663] Trial 102 finished with value: 0.04129786097871689 and parameters: {'model_name': 'SimpleImputer', 'strategy': 'mean'}. Best is trial 3 with value: 0.04129786097871689.
running
[I 2024-08-12 13:18:45,811] Trial 101 finished with value: 0.04129786097871689 and parameters: {'model_name': 'SimpleImputer', 'strategy': 'mean'}. Best is trial 3 with value: 0.04129786097871689.
[I 2024-08-12 13:18:45,908] Trial 103 finished with value: 0.04129786097871689 and parameters: {'model_name': 'SimpleImputer', 'strategy': 'mean'}. Best is trial 3 with value: 0.04129786097871689.
running
