[I 2024-09-24 17:15:19,578] Trial 141 finished with value: 0.039929032419717805 and parameters: {'model_name': 'IterativeImputer', 'estimator': 'RFR', 'initial_strategy': 'constant', 'n_nearest_features': 18, 'imputation_order': 'roman'}. Best is trial 80 with value: 0.039066720511836725.
running
[I 2024-09-24 17:18:06,396] Trial 143 finished with value: 0.03914478925878027 and parameters: {'model_name': 'IterativeImputer', 'estimator': 'RFR', 'initial_strategy': 'constant', 'n_nearest_features': 18, 'imputation_order': 'roman'}. Best is trial 80 with value: 0.039066720511836725.
running
[I 2024-09-24 17:18:06,843] Trial 163 finished with value: 0.17675017307085134 and parameters: {'model_name': 'SimpleImputer', 'strategy': 'most_frequent'}. Best is trial 80 with value: 0.039066720511836725.
running
[I 2024-09-24 17:27:14,965] Trial 147 finished with value: 0.03955547721332691 and parameters: {'model_name': 'IterativeImputer', 'estimator': 'RFR', 'initial_strategy': 'most_frequent', 'n_nearest_features': 20, 'imputation_order': 'random'}. Best is trial 80 with value: 0.039066720511836725.
running
[I 2024-09-24 17:27:35,339] Trial 146 finished with value: 0.039110085982482945 and parameters: {'model_name': 'IterativeImputer', 'estimator': 'RFR', 'initial_strategy': 'mean', 'n_nearest_features': 20, 'imputation_order': 'random'}. Best is trial 80 with value: 0.039066720511836725.
running
[I 2024-09-24 17:29:32,110] Trial 148 finished with value: 0.03942806099969666 and parameters: {'model_name': 'IterativeImputer', 'estimator': 'RFR', 'initial_strategy': 'median', 'n_nearest_features': 20, 'imputation_order': 'random'}. Best is trial 80 with value: 0.039066720511836725.
running
[I 2024-09-24 17:46:23,923] Trial 149 finished with value: 0.03917939519848557 and parameters: {'model_name': 'IterativeImputer', 'estimator': 'RFR', 'initial_strategy': 'median', 'n_nearest_features': 20, 'imputation_order': 'random'}. Best is trial 80 with value: 0.039066720511836725.
running
[I 2024-09-24 18:03:17,761] Trial 151 finished with value: 0.039622366230411044 and parameters: {'model_name': 'IterativeImputer', 'estimator': 'RFR', 'initial_strategy': 'median', 'n_nearest_features': 20, 'imputation_order': 'descending'}. Best is trial 80 with value: 0.039066720511836725.
running
[I 2024-09-24 18:08:33,059] Trial 153 finished with value: 0.039368602829092124 and parameters: {'model_name': 'IterativeImputer', 'estimator': 'RFR', 'initial_strategy': 'median', 'n_nearest_features': 20, 'imputation_order': 'random'}. Best is trial 80 with value: 0.039066720511836725.
running
[I 2024-09-24 18:18:34,194] Trial 154 finished with value: 0.039061290688899956 and parameters: {'model_name': 'IterativeImputer', 'estimator': 'RFR', 'initial_strategy': 'median', 'n_nearest_features': 20, 'imputation_order': 'random'}. Best is trial 154 with value: 0.039061290688899956.
running
[I 2024-09-24 18:18:46,871] Trial 171 finished with value: 0.08617863405946442 and parameters: {'model_name': 'IterativeImputer', 'estimator': 'Bayesian', 'initial_strategy': 'constant', 'n_nearest_features': 20, 'imputation_order': 'roman', 'sample_posterior': True}. Best is trial 154 with value: 0.039061290688899956.
running
[I 2024-09-24 18:19:22,093] Trial 155 finished with value: 0.038810564802275724 and parameters: {'model_name': 'IterativeImputer', 'estimator': 'RFR', 'initial_strategy': 'median', 'n_nearest_features': 20, 'imputation_order': 'random'}. Best is trial 155 with value: 0.038810564802275724.
running
[I 2024-09-24 18:19:22,760] Trial 173 finished with value: 0.4307181537574036 and parameters: {'model_name': 'VAE', 'batch_size': 20, 'iterations': 2, 'learning_rate': 0.006777615544224889, 'p_miss': 0.02714794148103447}. Best is trial 155 with value: 0.038810564802275724.
running
[I 2024-09-24 18:22:36,309] Trial 156 finished with value: 0.039466003238158055 and parameters: {'model_name': 'IterativeImputer', 'estimator': 'RFR', 'initial_strategy': 'median', 'n_nearest_features': 20, 'imputation_order': 'ascending'}. Best is trial 155 with value: 0.038810564802275724.
running
[I 2024-09-24 18:36:10,808] Trial 157 finished with value: 0.039721989413478556 and parameters: {'model_name': 'IterativeImputer', 'estimator': 'RFR', 'initial_strategy': 'median', 'n_nearest_features': 20, 'imputation_order': 'arabic'}. Best is trial 155 with value: 0.038810564802275724.
running
[I 2024-09-24 18:36:11,438] Trial 158 finished with value: 0.039294389330707516 and parameters: {'model_name': 'IterativeImputer', 'estimator': 'RFR', 'initial_strategy': 'median', 'n_nearest_features': 20, 'imputation_order': 'ascending'}. Best is trial 155 with value: 0.038810564802275724.
running
[I 2024-09-24 18:45:03,269] Trial 159 finished with value: 0.039466021148298704 and parameters: {'model_name': 'IterativeImputer', 'estimator': 'RFR', 'initial_strategy': 'most_frequent', 'n_nearest_features': 20, 'imputation_order': 'arabic'}. Best is trial 155 with value: 0.038810564802275724.
running
[I 2024-09-24 18:56:59,474] Trial 162 finished with value: 0.03916141458224541 and parameters: {'model_name': 'IterativeImputer', 'estimator': 'RFR', 'initial_strategy': 'most_frequent', 'n_nearest_features': 20, 'imputation_order': 'arabic'}. Best is trial 155 with value: 0.038810564802275724.
running
[I 2024-09-24 18:57:33,128] Trial 161 finished with value: 0.039315506392279695 and parameters: {'model_name': 'IterativeImputer', 'estimator': 'RFR', 'initial_strategy': 'most_frequent', 'n_nearest_features': 20, 'imputation_order': 'arabic'}. Best is trial 155 with value: 0.038810564802275724.
running
[I 2024-09-24 18:57:37,470] Trial 180 finished with value: 0.06048674556637643 and parameters: {'model_name': 'IterativeImputer', 'estimator': 'Ridge', 'initial_strategy': 'constant', 'n_nearest_features': 15, 'imputation_order': 'roman'}. Best is trial 155 with value: 0.038810564802275724.
running
[I 2024-09-24 18:58:17,736] Trial 160 finished with value: 0.039310590988732616 and parameters: {'model_name': 'IterativeImputer', 'estimator': 'RFR', 'initial_strategy': 'most_frequent', 'n_nearest_features': 20, 'imputation_order': 'arabic'}. Best is trial 155 with value: 0.038810564802275724.
running
[I 2024-09-24 19:00:17,893] Trial 164 finished with value: 0.039960913054199736 and parameters: {'model_name': 'IterativeImputer', 'estimator': 'RFR', 'initial_strategy': 'constant', 'n_nearest_features': 20, 'imputation_order': 'roman'}. Best is trial 155 with value: 0.038810564802275724.
running
[I 2024-09-24 19:09:04,430] Trial 165 finished with value: 0.03957392973494257 and parameters: {'model_name': 'IterativeImputer', 'estimator': 'RFR', 'initial_strategy': 'constant', 'n_nearest_features': 20, 'imputation_order': 'roman'}. Best is trial 155 with value: 0.038810564802275724.
running
[I 2024-09-24 19:09:06,412] Trial 184 finished with value: 0.08202219126451227 and parameters: {'model_name': 'KNNImputer', 'n_neighbors': 1524, 'weights': 'uniform'}. Best is trial 155 with value: 0.038810564802275724.
running
[I 2024-09-24 19:09:16,453] Trial 166 finished with value: 0.03919916310829105 and parameters: {'model_name': 'IterativeImputer', 'estimator': 'RFR', 'initial_strategy': 'constant', 'n_nearest_features': 20, 'imputation_order': 'roman'}. Best is trial 155 with value: 0.038810564802275724.
running
[I 2024-09-24 19:11:11,397] Trial 167 finished with value: 0.03950093821625225 and parameters: {'model_name': 'IterativeImputer', 'estimator': 'RFR', 'initial_strategy': 'constant', 'n_nearest_features': 20, 'imputation_order': 'roman'}. Best is trial 155 with value: 0.038810564802275724.
running
[I 2024-09-24 19:29:12,945] Trial 168 finished with value: 0.039110574066803634 and parameters: {'model_name': 'IterativeImputer', 'estimator': 'RFR', 'initial_strategy': 'constant', 'n_nearest_features': 20, 'imputation_order': 'roman'}. Best is trial 155 with value: 0.038810564802275724.
running
[I 2024-09-24 19:46:11,127] Trial 169 finished with value: 0.03953324235574972 and parameters: {'model_name': 'IterativeImputer', 'estimator': 'RFR', 'initial_strategy': 'constant', 'n_nearest_features': 20, 'imputation_order': 'roman'}. Best is trial 155 with value: 0.038810564802275724.
running
[I 2024-09-24 19:53:21,610] Trial 170 finished with value: 0.04013782478980386 and parameters: {'model_name': 'IterativeImputer', 'estimator': 'RFR', 'initial_strategy': 'constant', 'n_nearest_features': 20, 'imputation_order': 'roman'}. Best is trial 155 with value: 0.038810564802275724.
running
[I 2024-09-24 19:57:30,307] Trial 177 finished with value: 0.03992834907671681 and parameters: {'model_name': 'IterativeImputer', 'estimator': 'RFR', 'initial_strategy': 'constant', 'n_nearest_features': 15, 'imputation_order': 'roman'}. Best is trial 155 with value: 0.038810564802275724.
running
[I 2024-09-24 20:03:21,483] Trial 172 finished with value: 0.03939968139046734 and parameters: {'model_name': 'IterativeImputer', 'estimator': 'RFR', 'initial_strategy': 'constant', 'n_nearest_features': 20, 'imputation_order': 'roman'}. Best is trial 155 with value: 0.038810564802275724.
running
[I 2024-09-24 20:04:11,241] Trial 174 finished with value: 0.03904463193338907 and parameters: {'model_name': 'IterativeImputer', 'estimator': 'RFR', 'initial_strategy': 'median', 'n_nearest_features': 20, 'imputation_order': 'roman'}. Best is trial 155 with value: 0.038810564802275724.
running
[I 2024-09-24 20:04:56,557] Trial 175 finished with value: 0.03937530959397514 and parameters: {'model_name': 'IterativeImputer', 'estimator': 'RFR', 'initial_strategy': 'median', 'n_nearest_features': 20, 'imputation_order': 'roman'}. Best is trial 155 with value: 0.038810564802275724.
running
[I 2024-09-24 20:21:02,299] Trial 176 finished with value: 0.0394743917023071 and parameters: {'model_name': 'IterativeImputer', 'estimator': 'RFR', 'initial_strategy': 'constant', 'n_nearest_features': 20, 'imputation_order': 'roman'}. Best is trial 155 with value: 0.038810564802275724.
running
[I 2024-09-24 20:25:45,783] Trial 178 finished with value: 0.039490884067342566 and parameters: {'model_name': 'IterativeImputer', 'estimator': 'RFR', 'initial_strategy': 'constant', 'n_nearest_features': 19, 'imputation_order': 'roman'}. Best is trial 155 with value: 0.038810564802275724.
running
[I 2024-09-24 20:37:19,462] Trial 181 finished with value: 0.039296735975887634 and parameters: {'model_name': 'IterativeImputer', 'estimator': 'RFR', 'initial_strategy': 'median', 'n_nearest_features': 19, 'imputation_order': 'roman'}. Best is trial 155 with value: 0.038810564802275724.
running
[I 2024-09-24 20:39:00,470] Trial 182 finished with value: 0.03974699300727271 and parameters: {'model_name': 'IterativeImputer', 'estimator': 'RFR', 'initial_strategy': 'median', 'n_nearest_features': 19, 'imputation_order': 'roman'}. Best is trial 155 with value: 0.038810564802275724.
running
[I 2024-09-24 20:39:47,976] Trial 183 finished with value: 0.03938812240170406 and parameters: {'model_name': 'IterativeImputer', 'estimator': 'RFR', 'initial_strategy': 'median', 'n_nearest_features': 19, 'imputation_order': 'random'}. Best is trial 155 with value: 0.038810564802275724.
running
[I 2024-09-24 20:40:30,720] Trial 179 finished with value: 0.03969391957410939 and parameters: {'model_name': 'IterativeImputer', 'estimator': 'RFR', 'initial_strategy': 'constant', 'n_nearest_features': 20, 'imputation_order': 'roman'}. Best is trial 155 with value: 0.038810564802275724.
[I 2024-09-24 20:48:20,484] Trial 186 finished with value: 0.03949587072488056 and parameters: {'model_name': 'IterativeImputer', 'estimator': 'RFR', 'initial_strategy': 'constant', 'n_nearest_features': 19, 'imputation_order': 'roman'}. Best is trial 155 with value: 0.038810564802275724.
[I 2024-09-24 20:48:23,936] Trial 185 finished with value: 0.03954068909528581 and parameters: {'model_name': 'IterativeImputer', 'estimator': 'RFR', 'initial_strategy': 'median', 'n_nearest_features': 19, 'imputation_order': 'random'}. Best is trial 155 with value: 0.038810564802275724.
[I 2024-09-24 20:50:33,815] Trial 187 finished with value: 0.03944703212634927 and parameters: {'model_name': 'IterativeImputer', 'estimator': 'RFR', 'initial_strategy': 'median', 'n_nearest_features': 19, 'imputation_order': 'random'}. Best is trial 155 with value: 0.038810564802275724.
[I 2024-09-24 21:08:38,107] Trial 188 finished with value: 0.039552644731051176 and parameters: {'model_name': 'IterativeImputer', 'estimator': 'RFR', 'initial_strategy': 'constant', 'n_nearest_features': 19, 'imputation_order': 'random'}. Best is trial 155 with value: 0.038810564802275724.
[I 2024-09-24 21:24:42,444] Trial 189 finished with value: 0.03997853969961668 and parameters: {'model_name': 'IterativeImputer', 'estimator': 'RFR', 'initial_strategy': 'constant', 'n_nearest_features': 19, 'imputation_order': 'random'}. Best is trial 155 with value: 0.038810564802275724.
[I 2024-09-24 21:32:15,449] Trial 190 finished with value: 0.03948903845401423 and parameters: {'model_name': 'IterativeImputer', 'estimator': 'RFR', 'initial_strategy': 'median', 'n_nearest_features': 19, 'imputation_order': 'random'}. Best is trial 155 with value: 0.038810564802275724.
[I 2024-09-24 21:35:44,056] Trial 191 finished with value: 0.03913430641816674 and parameters: {'model_name': 'IterativeImputer', 'estimator': 'RFR', 'initial_strategy': 'median', 'n_nearest_features': 19, 'imputation_order': 'random'}. Best is trial 155 with value: 0.038810564802275724.
[I 2024-09-24 21:42:05,316] Trial 192 finished with value: 0.03969244161935149 and parameters: {'model_name': 'IterativeImputer', 'estimator': 'RFR', 'initial_strategy': 'median', 'n_nearest_features': 19, 'imputation_order': 'random'}. Best is trial 155 with value: 0.038810564802275724.
[I 2024-09-24 21:42:22,865] Trial 193 finished with value: 0.039586954056134924 and parameters: {'model_name': 'IterativeImputer', 'estimator': 'RFR', 'initial_strategy': 'median', 'n_nearest_features': 19, 'imputation_order': 'arabic'}. Best is trial 155 with value: 0.038810564802275724.
[I 2024-09-24 21:43:16,571] Trial 194 finished with value: 0.039588504480288174 and parameters: {'model_name': 'IterativeImputer', 'estimator': 'RFR', 'initial_strategy': 'median', 'n_nearest_features': 19, 'imputation_order': 'arabic'}. Best is trial 155 with value: 0.038810564802275724.
[I 2024-09-24 21:58:47,044] Trial 195 finished with value: 0.04008190891040879 and parameters: {'model_name': 'IterativeImputer', 'estimator': 'RFR', 'initial_strategy': 'median', 'n_nearest_features': 19, 'imputation_order': 'arabic'}. Best is trial 155 with value: 0.038810564802275724.
[I 2024-09-24 22:02:55,510] Trial 196 finished with value: 0.039388939899198415 and parameters: {'model_name': 'IterativeImputer', 'estimator': 'RFR', 'initial_strategy': 'median', 'n_nearest_features': 19, 'imputation_order': 'random'}. Best is trial 155 with value: 0.038810564802275724.
[I 2024-09-24 22:17:00,312] Trial 197 finished with value: 0.03972864025104722 and parameters: {'model_name': 'IterativeImputer', 'estimator': 'RFR', 'initial_strategy': 'median', 'n_nearest_features': 21, 'imputation_order': 'random'}. Best is trial 155 with value: 0.038810564802275724.
[I 2024-09-24 22:18:44,462] Trial 198 finished with value: 0.03948067055936632 and parameters: {'model_name': 'IterativeImputer', 'estimator': 'RFR', 'initial_strategy': 'median', 'n_nearest_features': 21, 'imputation_order': 'random'}. Best is trial 155 with value: 0.038810564802275724.
