[I 2024-08-19 09:59:00,263] Trial 60 finished with value: 0.5745135302203297 and parameters: {'model_name': 'GAIN', 'batch_size': 824, 'hint_rate': 0.08537798958176446, 'alpha': 3, 'iterations': 4374, 'learning_rate': 0.00019354027680099772, 'p_miss': 0.29066641277100247}. Best is trial 165 with value: 0.3498432987020502.
[I 2024-08-19 09:59:23,516] Trial 110 finished with value: 0.35632937921347124 and parameters: {'model_name': 'IterativeImputer', 'estimator': 'RFR', 'initial_strategy': 'mean', 'n_nearest_features': 8, 'imputation_order': 'roman'}. Best is trial 165 with value: 0.3498432987020502.
[I 2024-08-19 10:09:34,050] Trial 123 finished with value: 0.3580846564431833 and parameters: {'model_name': 'IterativeImputer', 'estimator': 'RFR', 'initial_strategy': 'mean', 'n_nearest_features': 8, 'imputation_order': 'roman'}. Best is trial 165 with value: 0.3498432987020502.
[I 2024-08-19 10:19:15,605] Trial 195 finished with value: 0.3558789964186787 and parameters: {'model_name': 'IterativeImputer', 'estimator': 'RFR', 'initial_strategy': 'mean', 'n_nearest_features': 8, 'imputation_order': 'roman'}. Best is trial 165 with value: 0.3498432987020502.
[I 2024-08-19 10:19:20,582] Trial 198 finished with value: 0.35637579450212764 and parameters: {'model_name': 'IterativeImputer', 'estimator': 'RFR', 'initial_strategy': 'mean', 'n_nearest_features': 8, 'imputation_order': 'roman'}. Best is trial 165 with value: 0.3498432987020502.
[I 2024-08-19 10:20:57,001] Trial 199 finished with value: 0.356830018734404 and parameters: {'model_name': 'IterativeImputer', 'estimator': 'RFR', 'initial_strategy': 'mean', 'n_nearest_features': 8, 'imputation_order': 'roman'}. Best is trial 165 with value: 0.3498432987020502.
[I 2024-08-19 10:22:25,293] Trial 55 finished with value: 0.5689380486802771 and parameters: {'model_name': 'GAIN', 'batch_size': 894, 'hint_rate': 0.14396963122187184, 'alpha': 6, 'iterations': 5415, 'learning_rate': 0.00011717731640518111, 'p_miss': 0.2975959342263953}. Best is trial 165 with value: 0.3498432987020502.
[I 2024-08-19 10:36:26,751] Trial 42 finished with value: 0.5676841322527313 and parameters: {'model_name': 'GAIN', 'batch_size': 777, 'hint_rate': 0.09078304841568552, 'alpha': 6, 'iterations': 6180, 'learning_rate': 0.0001684691465211342, 'p_miss': 0.28318005965224835}. Best is trial 165 with value: 0.3498432987020502.
[I 2024-08-19 10:38:51,674] Trial 59 finished with value: 0.5822196209530166 and parameters: {'model_name': 'GAIN', 'batch_size': 860, 'hint_rate': 0.014891417019024245, 'alpha': 0, 'iterations': 6321, 'learning_rate': 0.00013711845097008884, 'p_miss': 0.2914970228059346}. Best is trial 165 with value: 0.3498432987020502.
[I 2024-08-19 10:42:37,729] Trial 49 finished with value: 0.5696914883624655 and parameters: {'model_name': 'GAIN', 'batch_size': 759, 'hint_rate': 0.038505128503103, 'alpha': 8, 'iterations': 7172, 'learning_rate': 0.00012516258667932776, 'p_miss': 0.2970681531931324}. Best is trial 165 with value: 0.3498432987020502.
[I 2024-08-19 10:45:00,361] Trial 54 finished with value: 0.5947769609546876 and parameters: {'model_name': 'GAIN', 'batch_size': 526, 'hint_rate': 0.032125021293430145, 'alpha': 1, 'iterations': 8524, 'learning_rate': 0.0001120783063344513, 'p_miss': 0.28813927758528424}. Best is trial 165 with value: 0.3498432987020502.
[I 2024-08-19 10:45:32,341] Trial 62 finished with value: 0.5755042096779734 and parameters: {'model_name': 'GAIN', 'batch_size': 327, 'hint_rate': 0.029045495808603217, 'alpha': 7, 'iterations': 9090, 'learning_rate': 0.00013439364429777213, 'p_miss': 0.2811428853161154}. Best is trial 165 with value: 0.3498432987020502.
[I 2024-08-19 10:46:36,329] Trial 44 finished with value: 0.5753342250464601 and parameters: {'model_name': 'GAIN', 'batch_size': 794, 'hint_rate': 0.05504486428515615, 'alpha': 14, 'iterations': 9769, 'learning_rate': 0.00013519369097642888, 'p_miss': 0.29950887861041253}. Best is trial 165 with value: 0.3498432987020502.
