Run: 17
/cm/local/apps/slurm/var/spool/job1061447/slurm_script: line 27: 
pip install -e tpot2
pip install -r tpot2/ImputerExperiments/requirements_.txt
: No such file or directory
RunStart
Version 0.1.7a0 of tpot2 is outdated. Version 0.1.8a0 was released Tuesday September 17, 2024.
starting loops
../data/c/40498/40498.pkl
working on 
../data/c/40498/class_simple_MAR_0.01_1
2.269056558609009
running experiment 1/3 - Does large hyperparameter space improve reconstruction accuracy over simple
[I 2024-11-16 20:54:11,559] A new study created in memory with name: no-name-55d876f7-a212-4c00-bb68-56cf71a1d83c
running
running
running
running
running
running
running
running
running
running
running
running
running
[I 2024-11-16 20:54:11,756] Trial 6 finished with value: 0.3217958001009661 and parameters: {'model_name': 'SimpleImputer', 'strategy': 'constant'}. Best is trial 6 with value: 0.3217958001009661.
running
[I 2024-11-16 20:54:11,892] Trial 2 finished with value: 0.3217958001009661 and parameters: {'model_name': 'SimpleImputer', 'strategy': 'constant'}. Best is trial 6 with value: 0.3217958001009661.
running
[I 2024-11-16 20:54:12,028] Trial 3 finished with value: 0.3217958001009661 and parameters: {'model_name': 'SimpleImputer', 'strategy': 'constant'}. Best is trial 6 with value: 0.3217958001009661.
running
running
running
running
[I 2024-11-16 20:54:12,187] Trial 4 finished with value: 0.11673540380339838 and parameters: {'model_name': 'SimpleImputer', 'strategy': 'mean'}. Best is trial 4 with value: 0.11673540380339838.
running
[I 2024-11-16 20:54:12,451] Trial 18 finished with value: 0.3217958001009661 and parameters: {'model_name': 'SimpleImputer', 'strategy': 'constant'}. Best is trial 4 with value: 0.11673540380339838.
running
[I 2024-11-16 20:54:12,589] Trial 16 finished with value: 0.3217958001009661 and parameters: {'model_name': 'SimpleImputer', 'strategy': 'constant'}. Best is trial 4 with value: 0.11673540380339838.
running
[I 2024-11-16 20:54:12,694] Trial 9 finished with value: 0.11673540380339838 and parameters: {'model_name': 'SimpleImputer', 'strategy': 'mean'}. Best is trial 4 with value: 0.11673540380339838.
running
[I 2024-11-16 20:54:12,798] Trial 7 finished with value: 0.1163213134132115 and parameters: {'model_name': 'SimpleImputer', 'strategy': 'median'}. Best is trial 7 with value: 0.1163213134132115.
[I 2024-11-16 20:54:12,884] Trial 5 finished with value: 0.1163213134132115 and parameters: {'model_name': 'SimpleImputer', 'strategy': 'median'}. Best is trial 7 with value: 0.1163213134132115.
[I 2024-11-16 20:54:12,980] Trial 17 finished with value: 0.11673540380339838 and parameters: {'model_name': 'SimpleImputer', 'strategy': 'mean'}. Best is trial 7 with value: 0.1163213134132115.
running
running
running
[I 2024-11-16 20:54:13,126] Trial 12 finished with value: 0.3217958001009661 and parameters: {'model_name': 'SimpleImputer', 'strategy': 'constant'}. Best is trial 7 with value: 0.1163213134132115.
running
[I 2024-11-16 20:54:13,249] Trial 15 finished with value: 0.11673540380339838 and parameters: {'model_name': 'SimpleImputer', 'strategy': 'mean'}. Best is trial 7 with value: 0.1163213134132115.
[I 2024-11-16 20:54:13,331] Trial 20 finished with value: 0.3217958001009661 and parameters: {'model_name': 'SimpleImputer', 'strategy': 'constant'}. Best is trial 7 with value: 0.1163213134132115.
running
running
[I 2024-11-16 20:54:13,435] Trial 14 finished with value: 0.11673540380339838 and parameters: {'model_name': 'SimpleImputer', 'strategy': 'mean'}. Best is trial 7 with value: 0.1163213134132115.
[I 2024-11-16 20:54:13,549] Trial 10 finished with value: 0.1163213134132115 and parameters: {'model_name': 'SimpleImputer', 'strategy': 'median'}. Best is trial 7 with value: 0.1163213134132115.
[I 2024-11-16 20:54:13,639] Trial 8 finished with value: 0.1163213134132115 and parameters: {'model_name': 'SimpleImputer', 'strategy': 'median'}. Best is trial 7 with value: 0.1163213134132115.
[I 2024-11-16 20:54:13,741] Trial 0 finished with value: 0.1357679416256818 and parameters: {'model_name': 'SimpleImputer', 'strategy': 'most_frequent'}. Best is trial 7 with value: 0.1163213134132115.
running
running
running
running
[I 2024-11-16 20:54:13,885] Trial 11 finished with value: 0.1163213134132115 and parameters: {'model_name': 'SimpleImputer', 'strategy': 'median'}. Best is trial 7 with value: 0.1163213134132115.
[I 2024-11-16 20:54:14,003] Trial 22 finished with value: 0.11673540380339838 and parameters: {'model_name': 'SimpleImputer', 'strategy': 'mean'}. Best is trial 7 with value: 0.1163213134132115.
[I 2024-11-16 20:54:14,091] Trial 13 finished with value: 0.1163213134132115 and parameters: {'model_name': 'SimpleImputer', 'strategy': 'median'}. Best is trial 7 with value: 0.1163213134132115.
running
running
running
[I 2024-11-16 20:54:14,271] Trial 1 finished with value: 0.1357679416256818 and parameters: {'model_name': 'SimpleImputer', 'strategy': 'most_frequent'}. Best is trial 7 with value: 0.1163213134132115.
running
[I 2024-11-16 20:54:14,499] Trial 25 finished with value: 0.1163213134132115 and parameters: {'model_name': 'SimpleImputer', 'strategy': 'median'}. Best is trial 7 with value: 0.1163213134132115.
running
[I 2024-11-16 20:54:14,653] Trial 26 finished with value: 0.1163213134132115 and parameters: {'model_name': 'SimpleImputer', 'strategy': 'median'}. Best is trial 7 with value: 0.1163213134132115.
running
[I 2024-11-16 20:54:14,791] Trial 21 finished with value: 0.1163213134132115 and parameters: {'model_name': 'SimpleImputer', 'strategy': 'median'}. Best is trial 7 with value: 0.1163213134132115.
running
[I 2024-11-16 20:54:14,932] Trial 27 finished with value: 0.1163213134132115 and parameters: {'model_name': 'SimpleImputer', 'strategy': 'median'}. Best is trial 7 with value: 0.1163213134132115.
running
[I 2024-11-16 20:54:15,058] Trial 29 finished with value: 0.1163213134132115 and parameters: {'model_name': 'SimpleImputer', 'strategy': 'median'}. Best is trial 7 with value: 0.1163213134132115.
[I 2024-11-16 20:54:15,144] Trial 24 finished with value: 0.1163213134132115 and parameters: {'model_name': 'SimpleImputer', 'strategy': 'median'}. Best is trial 7 with value: 0.1163213134132115.
[I 2024-11-16 20:54:15,228] Trial 33 finished with value: 0.1163213134132115 and parameters: {'model_name': 'SimpleImputer', 'strategy': 'median'}. Best is trial 7 with value: 0.1163213134132115.
[I 2024-11-16 20:54:15,310] Trial 34 finished with value: 0.1163213134132115 and parameters: {'model_name': 'SimpleImputer', 'strategy': 'median'}. Best is trial 7 with value: 0.1163213134132115.
running
running
[I 2024-11-16 20:54:15,434] Trial 19 finished with value: 0.1357679416256818 and parameters: {'model_name': 'SimpleImputer', 'strategy': 'most_frequent'}. Best is trial 7 with value: 0.1163213134132115.
running
[I 2024-11-16 20:54:15,527] Trial 28 finished with value: 0.1163213134132115 and parameters: {'model_name': 'SimpleImputer', 'strategy': 'median'}. Best is trial 7 with value: 0.1163213134132115.
running
running
[I 2024-11-16 20:54:15,650] Trial 23 finished with value: 0.1163213134132115 and parameters: {'model_name': 'SimpleImputer', 'strategy': 'median'}. Best is trial 7 with value: 0.1163213134132115.
running
running
[I 2024-11-16 20:54:15,784] Trial 30 finished with value: 0.1163213134132115 and parameters: {'model_name': 'SimpleImputer', 'strategy': 'median'}. Best is trial 7 with value: 0.1163213134132115.
running
[I 2024-11-16 20:54:15,920] Trial 31 finished with value: 0.1163213134132115 and parameters: {'model_name': 'SimpleImputer', 'strategy': 'median'}. Best is trial 7 with value: 0.1163213134132115.
running
[I 2024-11-16 20:54:16,058] Trial 36 finished with value: 0.1163213134132115 and parameters: {'model_name': 'SimpleImputer', 'strategy': 'median'}. Best is trial 7 with value: 0.1163213134132115.
[I 2024-11-16 20:54:16,059] Trial 35 finished with value: 0.1163213134132115 and parameters: {'model_name': 'SimpleImputer', 'strategy': 'median'}. Best is trial 7 with value: 0.1163213134132115.
running
running
[I 2024-11-16 20:54:16,293] Trial 38 finished with value: 0.1163213134132115 and parameters: {'model_name': 'SimpleImputer', 'strategy': 'median'}. Best is trial 7 with value: 0.1163213134132115.
running
[I 2024-11-16 20:54:16,415] Trial 32 finished with value: 0.1163213134132115 and parameters: {'model_name': 'SimpleImputer', 'strategy': 'median'}. Best is trial 7 with value: 0.1163213134132115.
running
[I 2024-11-16 20:54:16,587] Trial 39 finished with value: 0.1163213134132115 and parameters: {'model_name': 'SimpleImputer', 'strategy': 'median'}. Best is trial 7 with value: 0.1163213134132115.
[I 2024-11-16 20:54:16,721] Trial 37 finished with value: 0.1163213134132115 and parameters: {'model_name': 'SimpleImputer', 'strategy': 'median'}. Best is trial 7 with value: 0.1163213134132115.
running
running
[I 2024-11-16 20:54:16,950] Trial 45 finished with value: 0.1163213134132115 and parameters: {'model_name': 'SimpleImputer', 'strategy': 'median'}. Best is trial 7 with value: 0.1163213134132115.
running
[I 2024-11-16 20:54:17,121] Trial 44 finished with value: 0.1163213134132115 and parameters: {'model_name': 'SimpleImputer', 'strategy': 'median'}. Best is trial 7 with value: 0.1163213134132115.
[I 2024-11-16 20:54:17,211] Trial 40 finished with value: 0.1163213134132115 and parameters: {'model_name': 'SimpleImputer', 'strategy': 'median'}. Best is trial 7 with value: 0.1163213134132115.
running
running
[I 2024-11-16 20:54:17,804] Trial 43 finished with value: 0.1357679416256818 and parameters: {'model_name': 'SimpleImputer', 'strategy': 'most_frequent'}. Best is trial 7 with value: 0.1163213134132115.
[I 2024-11-16 20:54:17,932] Trial 46 finished with value: 0.1357679416256818 and parameters: {'model_name': 'SimpleImputer', 'strategy': 'most_frequent'}. Best is trial 7 with value: 0.1163213134132115.
running
running
[I 2024-11-16 20:54:18,142] Trial 47 finished with value: 0.1357679416256818 and parameters: {'model_name': 'SimpleImputer', 'strategy': 'most_frequent'}. Best is trial 7 with value: 0.1163213134132115.
running
[I 2024-11-16 20:54:18,289] Trial 55 finished with value: 0.1163213134132115 and parameters: {'model_name': 'SimpleImputer', 'strategy': 'median'}. Best is trial 7 with value: 0.1163213134132115.
running
[I 2024-11-16 20:54:18,474] Trial 42 finished with value: 0.1357679416256818 and parameters: {'model_name': 'SimpleImputer', 'strategy': 'most_frequent'}. Best is trial 7 with value: 0.1163213134132115.
[I 2024-11-16 20:54:18,560] Trial 48 finished with value: 0.1357679416256818 and parameters: {'model_name': 'SimpleImputer', 'strategy': 'most_frequent'}. Best is trial 7 with value: 0.1163213134132115.
[I 2024-11-16 20:54:18,645] Trial 51 finished with value: 0.1357679416256818 and parameters: {'model_name': 'SimpleImputer', 'strategy': 'most_frequent'}. Best is trial 7 with value: 0.1163213134132115.
running
running
[I 2024-11-16 20:54:18,780] Trial 41 finished with value: 0.1357679416256818 and parameters: {'model_name': 'SimpleImputer', 'strategy': 'most_frequent'}. Best is trial 7 with value: 0.1163213134132115.
running
running
[I 2024-11-16 20:54:18,919] Trial 52 finished with value: 0.1357679416256818 and parameters: {'model_name': 'SimpleImputer', 'strategy': 'most_frequent'}. Best is trial 7 with value: 0.1163213134132115.
[I 2024-11-16 20:54:19,071] Trial 53 finished with value: 0.1357679416256818 and parameters: {'model_name': 'SimpleImputer', 'strategy': 'most_frequent'}. Best is trial 7 with value: 0.1163213134132115.
[I 2024-11-16 20:54:19,165] Trial 49 finished with value: 0.1357679416256818 and parameters: {'model_name': 'SimpleImputer', 'strategy': 'most_frequent'}. Best is trial 7 with value: 0.1163213134132115.
running
running
[I 2024-11-16 20:54:19,303] Trial 63 finished with value: 0.3217958001009661 and parameters: {'model_name': 'SimpleImputer', 'strategy': 'constant'}. Best is trial 7 with value: 0.1163213134132115.
running
running
[I 2024-11-16 20:54:19,449] Trial 50 finished with value: 0.1357679416256818 and parameters: {'model_name': 'SimpleImputer', 'strategy': 'most_frequent'}. Best is trial 7 with value: 0.1163213134132115.
[I 2024-11-16 20:54:19,542] Trial 56 finished with value: 0.1357679416256818 and parameters: {'model_name': 'SimpleImputer', 'strategy': 'most_frequent'}. Best is trial 7 with value: 0.1163213134132115.
running
running
[I 2024-11-16 20:54:19,748] Trial 62 finished with value: 0.3217958001009661 and parameters: {'model_name': 'SimpleImputer', 'strategy': 'constant'}. Best is trial 7 with value: 0.1163213134132115.
[I 2024-11-16 20:54:19,855] Trial 64 finished with value: 0.3217958001009661 and parameters: {'model_name': 'SimpleImputer', 'strategy': 'constant'}. Best is trial 7 with value: 0.1163213134132115.
running
[I 2024-11-16 20:54:19,860] Trial 67 finished with value: 0.3217958001009661 and parameters: {'model_name': 'SimpleImputer', 'strategy': 'constant'}. Best is trial 7 with value: 0.1163213134132115.
[I 2024-11-16 20:54:19,878] Trial 58 finished with value: 0.1357679416256818 and parameters: {'model_name': 'SimpleImputer', 'strategy': 'most_frequent'}. Best is trial 7 with value: 0.1163213134132115.
running
[I 2024-11-16 20:54:20,144] Trial 69 finished with value: 0.11673540380339838 and parameters: {'model_name': 'SimpleImputer', 'strategy': 'mean'}. Best is trial 7 with value: 0.1163213134132115.
running
running
running
[I 2024-11-16 20:54:20,265] Trial 54 finished with value: 0.1357679416256818 and parameters: {'model_name': 'SimpleImputer', 'strategy': 'most_frequent'}. Best is trial 7 with value: 0.1163213134132115.
running
[I 2024-11-16 20:54:20,399] Trial 72 finished with value: 0.11673540380339838 and parameters: {'model_name': 'SimpleImputer', 'strategy': 'mean'}. Best is trial 7 with value: 0.1163213134132115.
running
[I 2024-11-16 20:54:20,540] Trial 68 finished with value: 0.11673540380339838 and parameters: {'model_name': 'SimpleImputer', 'strategy': 'mean'}. Best is trial 7 with value: 0.1163213134132115.
[I 2024-11-16 20:54:20,646] Trial 71 finished with value: 0.11673540380339838 and parameters: {'model_name': 'SimpleImputer', 'strategy': 'mean'}. Best is trial 7 with value: 0.1163213134132115.
running
[I 2024-11-16 20:54:20,739] Trial 57 finished with value: 0.1357679416256818 and parameters: {'model_name': 'SimpleImputer', 'strategy': 'most_frequent'}. Best is trial 7 with value: 0.1163213134132115.
running
running
[I 2024-11-16 20:54:20,846] Trial 61 finished with value: 0.1163213134132115 and parameters: {'model_name': 'SimpleImputer', 'strategy': 'median'}. Best is trial 7 with value: 0.1163213134132115.
[I 2024-11-16 20:54:20,933] Trial 66 finished with value: 0.1163213134132115 and parameters: {'model_name': 'SimpleImputer', 'strategy': 'median'}. Best is trial 7 with value: 0.1163213134132115.
running
[I 2024-11-16 20:54:21,064] Trial 70 finished with value: 0.11673540380339838 and parameters: {'model_name': 'SimpleImputer', 'strategy': 'mean'}. Best is trial 7 with value: 0.1163213134132115.
running
[I 2024-11-16 20:54:21,169] Trial 59 finished with value: 0.1357679416256818 and parameters: {'model_name': 'SimpleImputer', 'strategy': 'most_frequent'}. Best is trial 7 with value: 0.1163213134132115.
running
running
[I 2024-11-16 20:54:21,323] Trial 73 finished with value: 0.11673540380339838 and parameters: {'model_name': 'SimpleImputer', 'strategy': 'mean'}. Best is trial 7 with value: 0.1163213134132115.
running
[I 2024-11-16 20:54:21,424] Trial 65 finished with value: 0.1163213134132115 and parameters: {'model_name': 'SimpleImputer', 'strategy': 'median'}. Best is trial 7 with value: 0.1163213134132115.
running
[I 2024-11-16 20:54:21,707] Trial 75 finished with value: 0.1163213134132115 and parameters: {'model_name': 'SimpleImputer', 'strategy': 'median'}. Best is trial 7 with value: 0.1163213134132115.
[I 2024-11-16 20:54:21,803] Trial 77 finished with value: 0.1163213134132115 and parameters: {'model_name': 'SimpleImputer', 'strategy': 'median'}. Best is trial 7 with value: 0.1163213134132115.
[I 2024-11-16 20:54:21,885] Trial 60 finished with value: 0.1357679416256818 and parameters: {'model_name': 'SimpleImputer', 'strategy': 'most_frequent'}. Best is trial 7 with value: 0.1163213134132115.
running
running
[I 2024-11-16 20:54:22,051] Trial 76 finished with value: 0.1163213134132115 and parameters: {'model_name': 'SimpleImputer', 'strategy': 'median'}. Best is trial 7 with value: 0.1163213134132115.
[I 2024-11-16 20:54:22,163] Trial 74 finished with value: 0.1163213134132115 and parameters: {'model_name': 'SimpleImputer', 'strategy': 'median'}. Best is trial 7 with value: 0.1163213134132115.
running
running
[I 2024-11-16 20:54:22,292] Trial 78 finished with value: 0.1163213134132115 and parameters: {'model_name': 'SimpleImputer', 'strategy': 'median'}. Best is trial 7 with value: 0.1163213134132115.
running
running
[I 2024-11-16 20:54:22,397] Trial 82 finished with value: 0.1163213134132115 and parameters: {'model_name': 'SimpleImputer', 'strategy': 'median'}. Best is trial 7 with value: 0.1163213134132115.
[I 2024-11-16 20:54:22,494] Trial 87 finished with value: 0.1163213134132115 and parameters: {'model_name': 'SimpleImputer', 'strategy': 'median'}. Best is trial 7 with value: 0.1163213134132115.
[I 2024-11-16 20:54:22,589] Trial 79 finished with value: 0.1163213134132115 and parameters: {'model_name': 'SimpleImputer', 'strategy': 'median'}. Best is trial 7 with value: 0.1163213134132115.
[I 2024-11-16 20:54:22,673] Trial 80 finished with value: 0.1163213134132115 and parameters: {'model_name': 'SimpleImputer', 'strategy': 'median'}. Best is trial 7 with value: 0.1163213134132115.
[I 2024-11-16 20:54:22,754] Trial 81 finished with value: 0.1163213134132115 and parameters: {'model_name': 'SimpleImputer', 'strategy': 'median'}. Best is trial 7 with value: 0.1163213134132115.
running
running
running
[I 2024-11-16 20:54:22,899] Trial 83 finished with value: 0.1163213134132115 and parameters: {'model_name': 'SimpleImputer', 'strategy': 'median'}. Best is trial 7 with value: 0.1163213134132115.
running
[I 2024-11-16 20:54:23,019] Trial 88 finished with value: 0.1163213134132115 and parameters: {'model_name': 'SimpleImputer', 'strategy': 'median'}. Best is trial 7 with value: 0.1163213134132115.
running
running
running
[I 2024-11-16 20:54:23,151] Trial 86 finished with value: 0.1163213134132115 and parameters: {'model_name': 'SimpleImputer', 'strategy': 'median'}. Best is trial 7 with value: 0.1163213134132115.
running
[I 2024-11-16 20:54:23,257] Trial 84 finished with value: 0.1163213134132115 and parameters: {'model_name': 'SimpleImputer', 'strategy': 'median'}. Best is trial 7 with value: 0.1163213134132115.
[I 2024-11-16 20:54:23,346] Trial 85 finished with value: 0.1163213134132115 and parameters: {'model_name': 'SimpleImputer', 'strategy': 'median'}. Best is trial 7 with value: 0.1163213134132115.
running
running
[I 2024-11-16 20:54:23,584] Trial 93 finished with value: 0.1163213134132115 and parameters: {'model_name': 'SimpleImputer', 'strategy': 'median'}. Best is trial 7 with value: 0.1163213134132115.
[I 2024-11-16 20:54:23,680] Trial 90 finished with value: 0.1163213134132115 and parameters: {'model_name': 'SimpleImputer', 'strategy': 'median'}. Best is trial 7 with value: 0.1163213134132115.
[I 2024-11-16 20:54:23,765] Trial 91 finished with value: 0.1163213134132115 and parameters: {'model_name': 'SimpleImputer', 'strategy': 'median'}. Best is trial 7 with value: 0.1163213134132115.
running
running
running
[I 2024-11-16 20:54:23,925] Trial 89 finished with value: 0.1163213134132115 and parameters: {'model_name': 'SimpleImputer', 'strategy': 'median'}. Best is trial 7 with value: 0.1163213134132115.
[I 2024-11-16 20:54:24,045] Trial 92 finished with value: 0.1163213134132115 and parameters: {'model_name': 'SimpleImputer', 'strategy': 'median'}. Best is trial 7 with value: 0.1163213134132115.
running
running
[I 2024-11-16 20:54:24,172] Trial 97 finished with value: 0.1163213134132115 and parameters: {'model_name': 'SimpleImputer', 'strategy': 'median'}. Best is trial 7 with value: 0.1163213134132115.
running
[I 2024-11-16 20:54:24,271] Trial 94 finished with value: 0.1163213134132115 and parameters: {'model_name': 'SimpleImputer', 'strategy': 'median'}. Best is trial 7 with value: 0.1163213134132115.
running
[I 2024-11-16 20:54:24,435] Trial 96 finished with value: 0.1163213134132115 and parameters: {'model_name': 'SimpleImputer', 'strategy': 'median'}. Best is trial 7 with value: 0.1163213134132115.
running
[I 2024-11-16 20:54:24,555] Trial 95 finished with value: 0.1163213134132115 and parameters: {'model_name': 'SimpleImputer', 'strategy': 'median'}. Best is trial 7 with value: 0.1163213134132115.
running
[I 2024-11-16 20:54:24,663] Trial 100 finished with value: 0.1163213134132115 and parameters: {'model_name': 'SimpleImputer', 'strategy': 'median'}. Best is trial 7 with value: 0.1163213134132115.
[I 2024-11-16 20:54:24,762] Trial 101 finished with value: 0.1163213134132115 and parameters: {'model_name': 'SimpleImputer', 'strategy': 'median'}. Best is trial 7 with value: 0.1163213134132115.
running
[I 2024-11-16 20:54:24,865] Trial 98 finished with value: 0.1163213134132115 and parameters: {'model_name': 'SimpleImputer', 'strategy': 'median'}. Best is trial 7 with value: 0.1163213134132115.
running
[I 2024-11-16 20:54:24,974] Trial 103 finished with value: 0.1163213134132115 and parameters: {'model_name': 'SimpleImputer', 'strategy': 'median'}. Best is trial 7 with value: 0.1163213134132115.
running
running
[I 2024-11-16 20:54:25,119] Trial 104 finished with value: 0.1163213134132115 and parameters: {'model_name': 'SimpleImputer', 'strategy': 'median'}. Best is trial 7 with value: 0.1163213134132115.
