[I 2024-11-12 02:02:00,949] Trial 107 finished with value: 0.1627821640205836 and parameters: {'model_name': 'SimpleImputer', 'strategy': 'mean'}. Best is trial 1 with value: 0.1627821640205836.
[I 2024-11-12 02:02:01,055] Trial 104 finished with value: 0.1627821640205836 and parameters: {'model_name': 'SimpleImputer', 'strategy': 'mean'}. Best is trial 1 with value: 0.1627821640205836.
running
running
running
[I 2024-11-12 02:02:01,170] Trial 105 finished with value: 0.1627821640205836 and parameters: {'model_name': 'SimpleImputer', 'strategy': 'mean'}. Best is trial 1 with value: 0.1627821640205836.
[I 2024-11-12 02:02:01,265] Trial 106 finished with value: 0.1627821640205836 and parameters: {'model_name': 'SimpleImputer', 'strategy': 'mean'}. Best is trial 1 with value: 0.1627821640205836.
running
[I 2024-11-12 02:02:01,406] Trial 113 finished with value: 0.1627821640205836 and parameters: {'model_name': 'SimpleImputer', 'strategy': 'mean'}. Best is trial 1 with value: 0.1627821640205836.
running
running
running
running
running
[I 2024-11-12 02:02:01,592] Trial 109 finished with value: 0.1627821640205836 and parameters: {'model_name': 'SimpleImputer', 'strategy': 'mean'}. Best is trial 1 with value: 0.1627821640205836.
running
[I 2024-11-12 02:02:01,599] Trial 108 finished with value: 0.1627821640205836 and parameters: {'model_name': 'SimpleImputer', 'strategy': 'mean'}. Best is trial 1 with value: 0.1627821640205836.
[I 2024-11-12 02:02:01,802] Trial 112 finished with value: 0.1627821640205836 and parameters: {'model_name': 'SimpleImputer', 'strategy': 'mean'}. Best is trial 1 with value: 0.1627821640205836.
[I 2024-11-12 02:02:01,946] Trial 116 finished with value: 0.1627821640205836 and parameters: {'model_name': 'SimpleImputer', 'strategy': 'mean'}. Best is trial 1 with value: 0.1627821640205836.
running
[I 2024-11-12 02:02:02,060] Trial 110 finished with value: 0.1627821640205836 and parameters: {'model_name': 'SimpleImputer', 'strategy': 'mean'}. Best is trial 1 with value: 0.1627821640205836.
[I 2024-11-12 02:02:02,167] Trial 111 finished with value: 0.1627821640205836 and parameters: {'model_name': 'SimpleImputer', 'strategy': 'mean'}. Best is trial 1 with value: 0.1627821640205836.
running
[I 2024-11-12 02:02:02,293] Trial 115 finished with value: 0.1627821640205836 and parameters: {'model_name': 'SimpleImputer', 'strategy': 'mean'}. Best is trial 1 with value: 0.1627821640205836.
running
running
[I 2024-11-12 02:02:02,410] Trial 114 finished with value: 0.1627821640205836 and parameters: {'model_name': 'SimpleImputer', 'strategy': 'mean'}. Best is trial 1 with value: 0.1627821640205836.
running
[I 2024-11-12 02:02:02,535] Trial 117 finished with value: 0.1627821640205836 and parameters: {'model_name': 'SimpleImputer', 'strategy': 'mean'}. Best is trial 1 with value: 0.1627821640205836.
running
running
running
[I 2024-11-12 02:02:02,720] Trial 124 finished with value: 0.1627821640205836 and parameters: {'model_name': 'SimpleImputer', 'strategy': 'mean'}. Best is trial 1 with value: 0.1627821640205836.
[I 2024-11-12 02:02:02,829] Trial 118 finished with value: 0.1627821640205836 and parameters: {'model_name': 'SimpleImputer', 'strategy': 'mean'}. Best is trial 1 with value: 0.1627821640205836.
running
[I 2024-11-12 02:02:02,956] Trial 121 finished with value: 0.4414247844256929 and parameters: {'model_name': 'SimpleImputer', 'strategy': 'most_frequent'}. Best is trial 1 with value: 0.1627821640205836.
running
running
running
[I 2024-11-12 02:02:03,140] Trial 120 finished with value: 0.4414247844256929 and parameters: {'model_name': 'SimpleImputer', 'strategy': 'most_frequent'}. Best is trial 1 with value: 0.1627821640205836.
running
[I 2024-11-12 02:02:03,526] Trial 134 finished with value: 0.1627821640205836 and parameters: {'model_name': 'SimpleImputer', 'strategy': 'mean'}. Best is trial 1 with value: 0.1627821640205836.
running
[I 2024-11-12 02:02:03,678] Trial 128 finished with value: 0.1627821640205836 and parameters: {'model_name': 'SimpleImputer', 'strategy': 'mean'}. Best is trial 1 with value: 0.1627821640205836.
[I 2024-11-12 02:02:03,783] Trial 133 finished with value: 0.1627821640205836 and parameters: {'model_name': 'SimpleImputer', 'strategy': 'mean'}. Best is trial 1 with value: 0.1627821640205836.
running
[I 2024-11-12 02:02:03,912] Trial 137 finished with value: 0.1627821640205836 and parameters: {'model_name': 'SimpleImputer', 'strategy': 'mean'}. Best is trial 1 with value: 0.1627821640205836.
[I 2024-11-12 02:02:04,020] Trial 135 finished with value: 0.1627821640205836 and parameters: {'model_name': 'SimpleImputer', 'strategy': 'mean'}. Best is trial 1 with value: 0.1627821640205836.
running
[I 2024-11-12 02:02:04,147] Trial 136 finished with value: 0.1627821640205836 and parameters: {'model_name': 'SimpleImputer', 'strategy': 'mean'}. Best is trial 1 with value: 0.1627821640205836.
running
running
running
[I 2024-11-12 02:02:04,308] Trial 125 finished with value: 0.4414247844256929 and parameters: {'model_name': 'SimpleImputer', 'strategy': 'most_frequent'}. Best is trial 1 with value: 0.1627821640205836.
[I 2024-11-12 02:02:04,403] Trial 127 finished with value: 0.4414247844256929 and parameters: {'model_name': 'SimpleImputer', 'strategy': 'most_frequent'}. Best is trial 1 with value: 0.1627821640205836.
running
[I 2024-11-12 02:02:04,519] Trial 119 finished with value: 0.4414247844256929 and parameters: {'model_name': 'SimpleImputer', 'strategy': 'most_frequent'}. Best is trial 1 with value: 0.1627821640205836.
[I 2024-11-12 02:02:04,607] Trial 131 finished with value: 0.4414247844256929 and parameters: {'model_name': 'SimpleImputer', 'strategy': 'most_frequent'}. Best is trial 1 with value: 0.1627821640205836.
running
[I 2024-11-12 02:02:04,714] Trial 129 finished with value: 0.4414247844256929 and parameters: {'model_name': 'SimpleImputer', 'strategy': 'most_frequent'}. Best is trial 1 with value: 0.1627821640205836.
running
running
running
[I 2024-11-12 02:02:04,940] Trial 138 finished with value: 0.1627821640205836 and parameters: {'model_name': 'SimpleImputer', 'strategy': 'mean'}. Best is trial 1 with value: 0.1627821640205836.
[I 2024-11-12 02:02:05,028] Trial 126 finished with value: 0.4414247844256929 and parameters: {'model_name': 'SimpleImputer', 'strategy': 'most_frequent'}. Best is trial 1 with value: 0.1627821640205836.
running
running
[I 2024-11-12 02:02:05,054] Trial 123 finished with value: 0.4414247844256929 and parameters: {'model_name': 'SimpleImputer', 'strategy': 'most_frequent'}. Best is trial 1 with value: 0.1627821640205836.
[I 2024-11-12 02:02:05,065] Trial 143 finished with value: 0.1627821640205836 and parameters: {'model_name': 'SimpleImputer', 'strategy': 'mean'}. Best is trial 1 with value: 0.1627821640205836.
running
[I 2024-11-12 02:02:05,072] Trial 140 finished with value: 0.1627821640205836 and parameters: {'model_name': 'SimpleImputer', 'strategy': 'mean'}. Best is trial 1 with value: 0.1627821640205836.
running
running
[I 2024-11-12 02:02:05,080] Trial 122 finished with value: 0.4414247844256929 and parameters: {'model_name': 'SimpleImputer', 'strategy': 'most_frequent'}. Best is trial 1 with value: 0.1627821640205836.
[I 2024-11-12 02:02:05,396] Trial 132 finished with value: 0.4414247844256929 and parameters: {'model_name': 'SimpleImputer', 'strategy': 'most_frequent'}. Best is trial 1 with value: 0.1627821640205836.
running
[I 2024-11-12 02:02:05,488] Trial 144 finished with value: 0.1627821640205836 and parameters: {'model_name': 'SimpleImputer', 'strategy': 'mean'}. Best is trial 1 with value: 0.1627821640205836.
[I 2024-11-12 02:02:05,773] Trial 142 finished with value: 0.1627821640205836 and parameters: {'model_name': 'SimpleImputer', 'strategy': 'mean'}. Best is trial 1 with value: 0.1627821640205836.
running
running
[I 2024-11-12 02:02:05,916] Trial 141 finished with value: 0.1627821640205836 and parameters: {'model_name': 'SimpleImputer', 'strategy': 'mean'}. Best is trial 1 with value: 0.1627821640205836.
running
[I 2024-11-12 02:02:06,039] Trial 139 finished with value: 0.1627821640205836 and parameters: {'model_name': 'SimpleImputer', 'strategy': 'mean'}. Best is trial 1 with value: 0.1627821640205836.
[I 2024-11-12 02:02:06,166] Trial 130 finished with value: 0.4414247844256929 and parameters: {'model_name': 'SimpleImputer', 'strategy': 'most_frequent'}. Best is trial 1 with value: 0.1627821640205836.
running
running
running
[I 2024-11-12 02:02:06,308] Trial 149 finished with value: 0.1627821640205836 and parameters: {'model_name': 'SimpleImputer', 'strategy': 'mean'}. Best is trial 1 with value: 0.1627821640205836.
running
[I 2024-11-12 02:02:06,443] Trial 151 finished with value: 0.1627821640205836 and parameters: {'model_name': 'SimpleImputer', 'strategy': 'mean'}. Best is trial 1 with value: 0.1627821640205836.
[I 2024-11-12 02:02:06,541] Trial 145 finished with value: 0.1627821640205836 and parameters: {'model_name': 'SimpleImputer', 'strategy': 'mean'}. Best is trial 1 with value: 0.1627821640205836.
[I 2024-11-12 02:02:06,631] Trial 146 finished with value: 0.1627821640205836 and parameters: {'model_name': 'SimpleImputer', 'strategy': 'mean'}. Best is trial 1 with value: 0.1627821640205836.
[I 2024-11-12 02:02:06,717] Trial 148 finished with value: 0.1627821640205836 and parameters: {'model_name': 'SimpleImputer', 'strategy': 'mean'}. Best is trial 1 with value: 0.1627821640205836.
[I 2024-11-12 02:02:06,814] Trial 153 finished with value: 0.1627821640205836 and parameters: {'model_name': 'SimpleImputer', 'strategy': 'mean'}. Best is trial 1 with value: 0.1627821640205836.
running
running
[I 2024-11-12 02:02:06,944] Trial 155 finished with value: 0.1627821640205836 and parameters: {'model_name': 'SimpleImputer', 'strategy': 'mean'}. Best is trial 1 with value: 0.1627821640205836.
running
running
[I 2024-11-12 02:02:07,045] Trial 152 finished with value: 0.1627821640205836 and parameters: {'model_name': 'SimpleImputer', 'strategy': 'mean'}. Best is trial 1 with value: 0.1627821640205836.
running
[I 2024-11-12 02:02:07,155] Trial 150 finished with value: 0.1627821640205836 and parameters: {'model_name': 'SimpleImputer', 'strategy': 'mean'}. Best is trial 1 with value: 0.1627821640205836.
running
running
[I 2024-11-12 02:02:07,266] Trial 147 finished with value: 0.1627821640205836 and parameters: {'model_name': 'SimpleImputer', 'strategy': 'mean'}. Best is trial 1 with value: 0.1627821640205836.
[I 2024-11-12 02:02:07,357] Trial 154 finished with value: 0.1627821640205836 and parameters: {'model_name': 'SimpleImputer', 'strategy': 'mean'}. Best is trial 1 with value: 0.1627821640205836.
running
[I 2024-11-12 02:02:07,477] Trial 157 finished with value: 0.1627821640205836 and parameters: {'model_name': 'SimpleImputer', 'strategy': 'mean'}. Best is trial 1 with value: 0.1627821640205836.
running
running
[I 2024-11-12 02:02:07,621] Trial 161 finished with value: 0.1627821640205836 and parameters: {'model_name': 'SimpleImputer', 'strategy': 'mean'}. Best is trial 1 with value: 0.1627821640205836.
[I 2024-11-12 02:02:07,712] Trial 156 finished with value: 0.1627821640205836 and parameters: {'model_name': 'SimpleImputer', 'strategy': 'mean'}. Best is trial 1 with value: 0.1627821640205836.
running
[I 2024-11-12 02:02:07,844] Trial 160 finished with value: 0.1627821640205836 and parameters: {'model_name': 'SimpleImputer', 'strategy': 'mean'}. Best is trial 1 with value: 0.1627821640205836.
running
[I 2024-11-12 02:02:07,944] Trial 159 finished with value: 0.1627821640205836 and parameters: {'model_name': 'SimpleImputer', 'strategy': 'mean'}. Best is trial 1 with value: 0.1627821640205836.
running
[I 2024-11-12 02:02:08,049] Trial 162 finished with value: 0.1627821640205836 and parameters: {'model_name': 'SimpleImputer', 'strategy': 'mean'}. Best is trial 1 with value: 0.1627821640205836.
running
running
[I 2024-11-12 02:02:08,241] Trial 158 finished with value: 0.1627821640205836 and parameters: {'model_name': 'SimpleImputer', 'strategy': 'mean'}. Best is trial 1 with value: 0.1627821640205836.
[I 2024-11-12 02:02:08,350] Trial 166 finished with value: 0.1627821640205836 and parameters: {'model_name': 'SimpleImputer', 'strategy': 'mean'}. Best is trial 1 with value: 0.1627821640205836.
[I 2024-11-12 02:02:08,436] Trial 164 finished with value: 0.1627821640205836 and parameters: {'model_name': 'SimpleImputer', 'strategy': 'mean'}. Best is trial 1 with value: 0.1627821640205836.
running
running
running
[I 2024-11-12 02:02:08,543] Trial 163 finished with value: 0.1627821640205836 and parameters: {'model_name': 'SimpleImputer', 'strategy': 'mean'}. Best is trial 1 with value: 0.1627821640205836.
running
running
[I 2024-11-12 02:02:08,701] Trial 172 finished with value: 0.1627821640205836 and parameters: {'model_name': 'SimpleImputer', 'strategy': 'mean'}. Best is trial 1 with value: 0.1627821640205836.
[I 2024-11-12 02:02:08,799] Trial 168 finished with value: 0.1627821640205836 and parameters: {'model_name': 'SimpleImputer', 'strategy': 'mean'}. Best is trial 1 with value: 0.1627821640205836.
[I 2024-11-12 02:02:08,901] Trial 167 finished with value: 0.1627821640205836 and parameters: {'model_name': 'SimpleImputer', 'strategy': 'mean'}. Best is trial 1 with value: 0.1627821640205836.
running
running
[I 2024-11-12 02:02:09,021] Trial 169 finished with value: 0.1627821640205836 and parameters: {'model_name': 'SimpleImputer', 'strategy': 'mean'}. Best is trial 1 with value: 0.1627821640205836.
running
running
[I 2024-11-12 02:02:09,133] Trial 165 finished with value: 0.1627821640205836 and parameters: {'model_name': 'SimpleImputer', 'strategy': 'mean'}. Best is trial 1 with value: 0.1627821640205836.
[I 2024-11-12 02:02:09,139] Trial 173 finished with value: 0.1627821640205836 and parameters: {'model_name': 'SimpleImputer', 'strategy': 'mean'}. Best is trial 1 with value: 0.1627821640205836.
running
running
[I 2024-11-12 02:02:09,142] Trial 174 finished with value: 0.1627821640205836 and parameters: {'model_name': 'SimpleImputer', 'strategy': 'mean'}. Best is trial 1 with value: 0.1627821640205836.
[I 2024-11-12 02:02:09,152] Trial 171 finished with value: 0.1627821640205836 and parameters: {'model_name': 'SimpleImputer', 'strategy': 'mean'}. Best is trial 1 with value: 0.1627821640205836.
running
running
[I 2024-11-12 02:02:09,592] Trial 170 finished with value: 0.1627821640205836 and parameters: {'model_name': 'SimpleImputer', 'strategy': 'mean'}. Best is trial 1 with value: 0.1627821640205836.
[I 2024-11-12 02:02:09,684] Trial 177 finished with value: 0.1627821640205836 and parameters: {'model_name': 'SimpleImputer', 'strategy': 'mean'}. Best is trial 1 with value: 0.1627821640205836.
[I 2024-11-12 02:02:09,775] Trial 176 finished with value: 0.1627821640205836 and parameters: {'model_name': 'SimpleImputer', 'strategy': 'mean'}. Best is trial 1 with value: 0.1627821640205836.
running
running
[I 2024-11-12 02:02:09,884] Trial 178 finished with value: 0.1627821640205836 and parameters: {'model_name': 'SimpleImputer', 'strategy': 'mean'}. Best is trial 1 with value: 0.1627821640205836.
running
running
[I 2024-11-12 02:02:10,030] Trial 175 finished with value: 0.1627821640205836 and parameters: {'model_name': 'SimpleImputer', 'strategy': 'mean'}. Best is trial 1 with value: 0.1627821640205836.
running
[I 2024-11-12 02:02:10,243] Trial 187 finished with value: 0.1627821640205836 and parameters: {'model_name': 'SimpleImputer', 'strategy': 'mean'}. Best is trial 1 with value: 0.1627821640205836.
running
[I 2024-11-12 02:02:10,345] Trial 190 finished with value: 0.47036206447321405 and parameters: {'model_name': 'SimpleImputer', 'strategy': 'constant'}. Best is trial 1 with value: 0.1627821640205836.
[I 2024-11-12 02:02:10,436] Trial 182 finished with value: 0.1627821640205836 and parameters: {'model_name': 'SimpleImputer', 'strategy': 'mean'}. Best is trial 1 with value: 0.1627821640205836.
[I 2024-11-12 02:02:10,524] Trial 180 finished with value: 0.1627821640205836 and parameters: {'model_name': 'SimpleImputer', 'strategy': 'mean'}. Best is trial 1 with value: 0.1627821640205836.
running
running
running
[I 2024-11-12 02:02:10,634] Trial 184 finished with value: 0.1627821640205836 and parameters: {'model_name': 'SimpleImputer', 'strategy': 'mean'}. Best is trial 1 with value: 0.1627821640205836.
[I 2024-11-12 02:02:10,635] Trial 192 finished with value: 0.47036206447321405 and parameters: {'model_name': 'SimpleImputer', 'strategy': 'constant'}. Best is trial 1 with value: 0.1627821640205836.
running
[I 2024-11-12 02:02:10,726] Trial 179 finished with value: 0.1627821640205836 and parameters: {'model_name': 'SimpleImputer', 'strategy': 'mean'}. Best is trial 1 with value: 0.1627821640205836.
[I 2024-11-12 02:02:10,754] Trial 188 finished with value: 0.1627821640205836 and parameters: {'model_name': 'SimpleImputer', 'strategy': 'mean'}. Best is trial 1 with value: 0.1627821640205836.
[I 2024-11-12 02:02:10,865] Trial 181 finished with value: 0.1627821640205836 and parameters: {'model_name': 'SimpleImputer', 'strategy': 'mean'}. Best is trial 1 with value: 0.1627821640205836.
[I 2024-11-12 02:02:10,866] Trial 186 finished with value: 0.1627821640205836 and parameters: {'model_name': 'SimpleImputer', 'strategy': 'mean'}. Best is trial 1 with value: 0.1627821640205836.
[I 2024-11-12 02:02:10,871] Trial 183 finished with value: 0.1627821640205836 and parameters: {'model_name': 'SimpleImputer', 'strategy': 'mean'}. Best is trial 1 with value: 0.1627821640205836.
[I 2024-11-12 02:02:10,964] Trial 193 finished with value: 0.47036206447321405 and parameters: {'model_name': 'SimpleImputer', 'strategy': 'constant'}. Best is trial 1 with value: 0.1627821640205836.
[I 2024-11-12 02:02:11,161] Trial 189 finished with value: 0.1627821640205836 and parameters: {'model_name': 'SimpleImputer', 'strategy': 'mean'}. Best is trial 1 with value: 0.1627821640205836.
[I 2024-11-12 02:02:11,177] Trial 185 finished with value: 0.1627821640205836 and parameters: {'model_name': 'SimpleImputer', 'strategy': 'mean'}. Best is trial 1 with value: 0.1627821640205836.
[I 2024-11-12 02:02:11,631] Trial 196 finished with value: 0.1627821640205836 and parameters: {'model_name': 'SimpleImputer', 'strategy': 'mean'}. Best is trial 1 with value: 0.1627821640205836.
[I 2024-11-12 02:02:11,730] Trial 191 finished with value: 0.47036206447321405 and parameters: {'model_name': 'SimpleImputer', 'strategy': 'constant'}. Best is trial 1 with value: 0.1627821640205836.
[I 2024-11-12 02:02:11,818] Trial 195 finished with value: 0.47036206447321405 and parameters: {'model_name': 'SimpleImputer', 'strategy': 'constant'}. Best is trial 1 with value: 0.1627821640205836.
[I 2024-11-12 02:02:11,918] Trial 197 finished with value: 0.1627821640205836 and parameters: {'model_name': 'SimpleImputer', 'strategy': 'mean'}. Best is trial 1 with value: 0.1627821640205836.
[I 2024-11-12 02:02:12,003] Trial 194 finished with value: 0.1627821640205836 and parameters: {'model_name': 'SimpleImputer', 'strategy': 'mean'}. Best is trial 1 with value: 0.1627821640205836.
[I 2024-11-12 02:02:12,090] Trial 198 finished with value: 0.1627821640205836 and parameters: {'model_name': 'SimpleImputer', 'strategy': 'mean'}. Best is trial 1 with value: 0.1627821640205836.
