[I 2024-10-08 07:50:00,713] Trial 73 finished with value: 0.07914954510713776 and parameters: {'model_name': 'IterativeImputer', 'estimator': 'RFR', 'initial_strategy': 'mean', 'n_nearest_features': 4, 'imputation_order': 'roman'}. Best is trial 57 with value: 0.062126204378123696.
running
[I 2024-10-08 07:59:06,135] Trial 74 finished with value: 0.07655882323051787 and parameters: {'model_name': 'IterativeImputer', 'estimator': 'RFR', 'initial_strategy': 'mean', 'n_nearest_features': 4, 'imputation_order': 'roman'}. Best is trial 57 with value: 0.062126204378123696.
running
[I 2024-10-08 08:02:12,251] Trial 86 finished with value: 0.12080819630619707 and parameters: {'model_name': 'IterativeImputer', 'estimator': 'RFR', 'initial_strategy': 'median', 'n_nearest_features': 2, 'imputation_order': 'descending'}. Best is trial 57 with value: 0.062126204378123696.
running
[I 2024-10-08 08:04:02,177] Trial 77 finished with value: 0.0825708006037039 and parameters: {'model_name': 'IterativeImputer', 'estimator': 'RFR', 'initial_strategy': 'constant', 'n_nearest_features': 3, 'imputation_order': 'descending'}. Best is trial 57 with value: 0.062126204378123696.
running
[I 2024-10-08 08:08:04,300] Trial 76 finished with value: 0.0731005132474346 and parameters: {'model_name': 'IterativeImputer', 'estimator': 'RFR', 'initial_strategy': 'constant', 'n_nearest_features': 4, 'imputation_order': 'roman'}. Best is trial 57 with value: 0.062126204378123696.
running
[I 2024-10-08 08:16:35,768] Trial 33 finished with value: 0.5027394014067847 and parameters: {'model_name': 'GAIN', 'batch_size': 848, 'hint_rate': 0.028689402292313038, 'alpha': 97, 'iterations': 5864, 'learning_rate': 0.00012446779188506716, 'p_miss': 0.040933900811837426}. Best is trial 57 with value: 0.062126204378123696.
running
[I 2024-10-08 08:28:27,176] Trial 28 finished with value: 0.47329192143325577 and parameters: {'model_name': 'GAIN', 'batch_size': 653, 'hint_rate': 0.041964977914083434, 'alpha': 98, 'iterations': 6587, 'learning_rate': 0.0900246632381592, 'p_miss': 0.29859783855467525}. Best is trial 57 with value: 0.062126204378123696.
running
[I 2024-10-08 08:35:55,405] Trial 87 finished with value: 0.19001178543500113 and parameters: {'model_name': 'VAE', 'batch_size': 296, 'iterations': 917, 'learning_rate': 0.00041051886352761586, 'p_miss': 0.1348814874669276}. Best is trial 57 with value: 0.062126204378123696.
running
[I 2024-10-08 08:35:58,961] Trial 97 finished with value: 0.13242719278890325 and parameters: {'model_name': 'KNNImputer', 'n_neighbors': 5266, 'weights': 'distance'}. Best is trial 57 with value: 0.062126204378123696.
running
[I 2024-10-08 08:36:11,793] Trial 98 finished with value: 0.0740793358203863 and parameters: {'model_name': 'IterativeImputer', 'estimator': 'KNN', 'initial_strategy': 'median', 'n_nearest_features': 6, 'imputation_order': 'ascending'}. Best is trial 57 with value: 0.062126204378123696.
running
[I 2024-10-08 08:38:29,099] Trial 88 finished with value: 0.18935251236912695 and parameters: {'model_name': 'VAE', 'batch_size': 284, 'iterations': 905, 'learning_rate': 0.0005074389929781557, 'p_miss': 0.14649101105448478}. Best is trial 57 with value: 0.062126204378123696.
running
[I 2024-10-08 08:39:40,520] Trial 85 finished with value: 0.18949747077178186 and parameters: {'model_name': 'VAE', 'batch_size': 326, 'iterations': 1012, 'learning_rate': 0.0006113920319173072, 'p_miss': 0.13804738016561943}. Best is trial 57 with value: 0.062126204378123696.
running
[I 2024-10-08 08:41:55,453] Trial 84 finished with value: 0.18988053207282973 and parameters: {'model_name': 'VAE', 'batch_size': 303, 'iterations': 1020, 'learning_rate': 0.00041583463694601147, 'p_miss': 0.13615969069700434}. Best is trial 57 with value: 0.062126204378123696.
running
[I 2024-10-08 08:50:15,966] Trial 92 finished with value: 0.18909907135644383 and parameters: {'model_name': 'VAE', 'batch_size': 332, 'iterations': 718, 'learning_rate': 0.0005136743516750262, 'p_miss': 0.14070261579200388}. Best is trial 57 with value: 0.062126204378123696.
running
[I 2024-10-08 09:01:02,070] Trial 95 finished with value: 0.20487786472931124 and parameters: {'model_name': 'VAE', 'batch_size': 14, 'iterations': 885, 'learning_rate': 0.0006801801313865802, 'p_miss': 0.1339392858679695}. Best is trial 57 with value: 0.062126204378123696.
running
[I 2024-10-08 09:01:11,658] Trial 93 finished with value: 0.18812867689728724 and parameters: {'model_name': 'VAE', 'batch_size': 318, 'iterations': 1147, 'learning_rate': 0.00037692980777615637, 'p_miss': 0.13480597887229723}. Best is trial 57 with value: 0.062126204378123696.
running
[I 2024-10-08 09:01:36,707] Trial 96 finished with value: 0.18908241873082374 and parameters: {'model_name': 'VAE', 'batch_size': 289, 'iterations': 668, 'learning_rate': 0.0008483707423998938, 'p_miss': 0.1342122223817336}. Best is trial 57 with value: 0.062126204378123696.
running
[I 2024-10-08 09:03:08,699] Trial 91 finished with value: 0.1894435854592344 and parameters: {'model_name': 'VAE', 'batch_size': 428, 'iterations': 1095, 'learning_rate': 0.0003784241583594453, 'p_miss': 0.1350701050267308}. Best is trial 57 with value: 0.062126204378123696.
running
[I 2024-10-08 09:03:10,349] Trial 94 finished with value: 0.1895844036640742 and parameters: {'model_name': 'VAE', 'batch_size': 382, 'iterations': 947, 'learning_rate': 0.00035170425241636704, 'p_miss': 0.13989586905079396}. Best is trial 57 with value: 0.062126204378123696.
running
[I 2024-10-08 09:04:41,480] Trial 99 finished with value: 0.06643810051244323 and parameters: {'model_name': 'IterativeImputer', 'estimator': 'RFR', 'initial_strategy': 'median', 'n_nearest_features': 5, 'imputation_order': 'ascending'}. Best is trial 57 with value: 0.062126204378123696.
running
[I 2024-10-08 09:04:54,968] Trial 89 finished with value: 0.18962743641106164 and parameters: {'model_name': 'VAE', 'batch_size': 410, 'iterations': 1426, 'learning_rate': 0.000393342492405577, 'p_miss': 0.11996327551676059}. Best is trial 57 with value: 0.062126204378123696.
running
[I 2024-10-08 09:06:16,236] Trial 100 finished with value: 0.0669743516540487 and parameters: {'model_name': 'IterativeImputer', 'estimator': 'RFR', 'initial_strategy': 'median', 'n_nearest_features': 5, 'imputation_order': 'ascending'}. Best is trial 57 with value: 0.062126204378123696.
running
[I 2024-10-08 09:06:21,357] Trial 101 finished with value: 0.06707861195943975 and parameters: {'model_name': 'IterativeImputer', 'estimator': 'RFR', 'initial_strategy': 'median', 'n_nearest_features': 5, 'imputation_order': 'ascending'}. Best is trial 57 with value: 0.062126204378123696.
running
[I 2024-10-08 09:06:43,174] Trial 90 finished with value: 0.1904316516215045 and parameters: {'model_name': 'VAE', 'batch_size': 422, 'iterations': 1316, 'learning_rate': 0.0004628966132863876, 'p_miss': 0.29092140456217574}. Best is trial 57 with value: 0.062126204378123696.
running
[I 2024-10-08 09:07:41,414] Trial 102 finished with value: 0.06847722830156786 and parameters: {'model_name': 'IterativeImputer', 'estimator': 'RFR', 'initial_strategy': 'median', 'n_nearest_features': 5, 'imputation_order': 'ascending'}. Best is trial 57 with value: 0.062126204378123696.
running
[I 2024-10-08 09:13:11,637] Trial 36 finished with value: 0.50218589868681 and parameters: {'model_name': 'GAIN', 'batch_size': 992, 'hint_rate': 0.03390739294014766, 'alpha': 90, 'iterations': 7948, 'learning_rate': 0.00010730317403520972, 'p_miss': 0.05427720256905878}. Best is trial 57 with value: 0.062126204378123696.
running
[I 2024-10-08 09:16:51,753] Trial 103 finished with value: 0.0677715343983983 and parameters: {'model_name': 'IterativeImputer', 'estimator': 'RFR', 'initial_strategy': 'median', 'n_nearest_features': 5, 'imputation_order': 'ascending'}. Best is trial 57 with value: 0.062126204378123696.
running
[I 2024-10-08 09:16:59,917] Trial 116 finished with value: 0.06691039640021204 and parameters: {'model_name': 'IterativeImputer', 'estimator': 'KNN', 'initial_strategy': 'most_frequent', 'n_nearest_features': 6, 'imputation_order': 'descending'}. Best is trial 57 with value: 0.062126204378123696.
running
[I 2024-10-08 09:17:07,484] Trial 117 finished with value: 0.06564269457902736 and parameters: {'model_name': 'IterativeImputer', 'estimator': 'KNN', 'initial_strategy': 'most_frequent', 'n_nearest_features': 6, 'imputation_order': 'random'}. Best is trial 57 with value: 0.062126204378123696.
running
[I 2024-10-08 09:17:16,643] Trial 118 finished with value: 0.06564269457902736 and parameters: {'model_name': 'IterativeImputer', 'estimator': 'KNN', 'initial_strategy': 'most_frequent', 'n_nearest_features': 6, 'imputation_order': 'random'}. Best is trial 57 with value: 0.062126204378123696.
running
[I 2024-10-08 09:17:16,972] Trial 119 finished with value: 0.5849215442561031 and parameters: {'model_name': 'SimpleImputer', 'strategy': 'constant'}. Best is trial 57 with value: 0.062126204378123696.
running
[I 2024-10-08 09:19:15,093] Trial 35 finished with value: 0.49972892998791557 and parameters: {'model_name': 'GAIN', 'batch_size': 903, 'hint_rate': 0.06382018383109306, 'alpha': 100, 'iterations': 8321, 'learning_rate': 0.07601138721415289, 'p_miss': 0.07073689536820853}. Best is trial 57 with value: 0.062126204378123696.
running
[I 2024-10-08 09:26:36,450] Trial 104 finished with value: 0.06369034504273993 and parameters: {'model_name': 'IterativeImputer', 'estimator': 'RFR', 'initial_strategy': 'median', 'n_nearest_features': 5, 'imputation_order': 'ascending'}. Best is trial 57 with value: 0.062126204378123696.
running
[I 2024-10-08 09:26:44,525] Trial 105 finished with value: 0.06503018174360767 and parameters: {'model_name': 'IterativeImputer', 'estimator': 'RFR', 'initial_strategy': 'median', 'n_nearest_features': 5, 'imputation_order': 'ascending'}. Best is trial 57 with value: 0.062126204378123696.
running
[I 2024-10-08 09:26:49,529] Trial 106 finished with value: 0.06881739229559555 and parameters: {'model_name': 'IterativeImputer', 'estimator': 'RFR', 'initial_strategy': 'median', 'n_nearest_features': 6, 'imputation_order': 'ascending'}. Best is trial 57 with value: 0.062126204378123696.
running
[I 2024-10-08 09:28:32,517] Trial 107 finished with value: 0.06968736779936532 and parameters: {'model_name': 'IterativeImputer', 'estimator': 'RFR', 'initial_strategy': 'median', 'n_nearest_features': 6, 'imputation_order': 'ascending'}. Best is trial 57 with value: 0.062126204378123696.
running
[I 2024-10-08 09:28:33,968] Trial 108 finished with value: 0.06660848412854961 and parameters: {'model_name': 'IterativeImputer', 'estimator': 'RFR', 'initial_strategy': 'median', 'n_nearest_features': 6, 'imputation_order': 'ascending'}. Best is trial 57 with value: 0.062126204378123696.
running
[I 2024-10-08 09:29:54,974] Trial 109 finished with value: 0.06647559478735035 and parameters: {'model_name': 'IterativeImputer', 'estimator': 'RFR', 'initial_strategy': 'median', 'n_nearest_features': 6, 'imputation_order': 'descending'}. Best is trial 57 with value: 0.062126204378123696.
running
[I 2024-10-08 09:30:02,549] Trial 110 finished with value: 0.06621312531534884 and parameters: {'model_name': 'IterativeImputer', 'estimator': 'RFR', 'initial_strategy': 'median', 'n_nearest_features': 6, 'imputation_order': 'descending'}. Best is trial 57 with value: 0.062126204378123696.
running
[I 2024-10-08 09:30:55,124] Trial 112 finished with value: 0.06711412111317455 and parameters: {'model_name': 'IterativeImputer', 'estimator': 'RFR', 'initial_strategy': 'most_frequent', 'n_nearest_features': 6, 'imputation_order': 'descending'}. Best is trial 57 with value: 0.062126204378123696.
running
[I 2024-10-08 09:31:21,687] Trial 111 finished with value: 0.06535370449702513 and parameters: {'model_name': 'IterativeImputer', 'estimator': 'RFR', 'initial_strategy': 'median', 'n_nearest_features': 6, 'imputation_order': 'descending'}. Best is trial 57 with value: 0.062126204378123696.
running
[I 2024-10-08 09:31:39,365] Trial 114 finished with value: 0.06602203219397333 and parameters: {'model_name': 'IterativeImputer', 'estimator': 'RFR', 'initial_strategy': 'most_frequent', 'n_nearest_features': 6, 'imputation_order': 'descending'}. Best is trial 57 with value: 0.062126204378123696.
running
[I 2024-10-08 09:31:54,400] Trial 113 finished with value: 0.06521558288663352 and parameters: {'model_name': 'IterativeImputer', 'estimator': 'RFR', 'initial_strategy': 'most_frequent', 'n_nearest_features': 6, 'imputation_order': 'descending'}. Best is trial 57 with value: 0.062126204378123696.
running
[I 2024-10-08 09:38:06,009] Trial 115 finished with value: 0.06663744990238592 and parameters: {'model_name': 'IterativeImputer', 'estimator': 'RFR', 'initial_strategy': 'most_frequent', 'n_nearest_features': 6, 'imputation_order': 'descending'}. Best is trial 57 with value: 0.062126204378123696.
running
[I 2024-10-08 09:38:07,996] Trial 133 finished with value: 0.1832276061594596 and parameters: {'model_name': 'KNNImputer', 'n_neighbors': 7885, 'weights': 'uniform'}. Best is trial 57 with value: 0.062126204378123696.
running
[I 2024-10-08 09:42:22,776] Trial 120 finished with value: 0.06398425138920963 and parameters: {'model_name': 'IterativeImputer', 'estimator': 'RFR', 'initial_strategy': 'median', 'n_nearest_features': 6, 'imputation_order': 'descending'}. Best is trial 57 with value: 0.062126204378123696.
running
[I 2024-10-08 09:43:39,791] Trial 121 finished with value: 0.06573573814501943 and parameters: {'model_name': 'IterativeImputer', 'estimator': 'RFR', 'initial_strategy': 'median', 'n_nearest_features': 6, 'imputation_order': 'descending'}. Best is trial 57 with value: 0.062126204378123696.
running
[I 2024-10-08 09:51:33,342] Trial 122 finished with value: 0.0641390493363167 and parameters: {'model_name': 'IterativeImputer', 'estimator': 'RFR', 'initial_strategy': 'median', 'n_nearest_features': 6, 'imputation_order': 'descending'}. Best is trial 57 with value: 0.062126204378123696.
running
[I 2024-10-08 09:51:45,061] Trial 123 finished with value: 0.06756499509312308 and parameters: {'model_name': 'IterativeImputer', 'estimator': 'RFR', 'initial_strategy': 'median', 'n_nearest_features': 6, 'imputation_order': 'descending'}. Best is trial 57 with value: 0.062126204378123696.
running
[I 2024-10-08 09:51:49,881] Trial 124 finished with value: 0.06794484442767978 and parameters: {'model_name': 'IterativeImputer', 'estimator': 'RFR', 'initial_strategy': 'median', 'n_nearest_features': 6, 'imputation_order': 'descending'}. Best is trial 57 with value: 0.062126204378123696.
running
[I 2024-10-08 09:52:19,061] Trial 139 finished with value: 0.11486875940709625 and parameters: {'model_name': 'IterativeImputer', 'estimator': 'Bayesian', 'initial_strategy': 'median', 'n_nearest_features': 5, 'imputation_order': 'descending', 'sample_posterior': False}. Best is trial 57 with value: 0.062126204378123696.
running
[I 2024-10-08 09:53:54,139] Trial 125 finished with value: 0.062263460875522716 and parameters: {'model_name': 'IterativeImputer', 'estimator': 'RFR', 'initial_strategy': 'median', 'n_nearest_features': 6, 'imputation_order': 'descending'}. Best is trial 57 with value: 0.062126204378123696.
running
[I 2024-10-08 09:53:57,934] Trial 126 finished with value: 0.06397786105885749 and parameters: {'model_name': 'IterativeImputer', 'estimator': 'RFR', 'initial_strategy': 'median', 'n_nearest_features': 5, 'imputation_order': 'descending'}. Best is trial 57 with value: 0.062126204378123696.
running
[I 2024-10-08 09:53:58,304] Trial 142 finished with value: 0.1832276061594596 and parameters: {'model_name': 'SimpleImputer', 'strategy': 'mean'}. Best is trial 57 with value: 0.062126204378123696.
running
[I 2024-10-08 09:54:04,000] Trial 143 finished with value: 0.468781692387953 and parameters: {'model_name': 'GAIN', 'batch_size': 7, 'hint_rate': 0.9891512079598508, 'alpha': 49, 'iterations': 7, 'learning_rate': 0.008065379903634299, 'p_miss': 0.18136792952963343}. Best is trial 57 with value: 0.062126204378123696.
running
[I 2024-10-08 09:55:11,715] Trial 127 finished with value: 0.06548059711658949 and parameters: {'model_name': 'IterativeImputer', 'estimator': 'RFR', 'initial_strategy': 'median', 'n_nearest_features': 5, 'imputation_order': 'descending'}. Best is trial 57 with value: 0.062126204378123696.
running
[I 2024-10-08 09:55:24,172] Trial 128 finished with value: 0.06468092140674354 and parameters: {'model_name': 'IterativeImputer', 'estimator': 'RFR', 'initial_strategy': 'median', 'n_nearest_features': 5, 'imputation_order': 'descending'}. Best is trial 57 with value: 0.062126204378123696.
running
[I 2024-10-08 09:55:54,891] Trial 131 finished with value: 0.06605712029150813 and parameters: {'model_name': 'IterativeImputer', 'estimator': 'RFR', 'initial_strategy': 'median', 'n_nearest_features': 5, 'imputation_order': 'descending'}. Best is trial 57 with value: 0.062126204378123696.
running
[I 2024-10-08 09:56:03,550] Trial 129 finished with value: 0.06944561757126044 and parameters: {'model_name': 'IterativeImputer', 'estimator': 'RFR', 'initial_strategy': 'median', 'n_nearest_features': 5, 'imputation_order': 'descending'}. Best is trial 57 with value: 0.062126204378123696.
running
[I 2024-10-08 09:56:35,063] Trial 130 finished with value: 0.06630498621672176 and parameters: {'model_name': 'IterativeImputer', 'estimator': 'RFR', 'initial_strategy': 'median', 'n_nearest_features': 5, 'imputation_order': 'descending'}. Best is trial 57 with value: 0.062126204378123696.
running
[I 2024-10-08 09:57:05,943] Trial 132 finished with value: 0.06554493580348983 and parameters: {'model_name': 'IterativeImputer', 'estimator': 'RFR', 'initial_strategy': 'median', 'n_nearest_features': 5, 'imputation_order': 'descending'}. Best is trial 57 with value: 0.062126204378123696.
running
[I 2024-10-08 10:03:18,222] Trial 134 finished with value: 0.06614057630261916 and parameters: {'model_name': 'IterativeImputer', 'estimator': 'RFR', 'initial_strategy': 'median', 'n_nearest_features': 5, 'imputation_order': 'descending'}. Best is trial 57 with value: 0.062126204378123696.
running
[I 2024-10-08 10:07:54,297] Trial 135 finished with value: 0.06635904249260702 and parameters: {'model_name': 'IterativeImputer', 'estimator': 'RFR', 'initial_strategy': 'median', 'n_nearest_features': 5, 'imputation_order': 'descending'}. Best is trial 57 with value: 0.062126204378123696.
running
[I 2024-10-08 10:08:17,920] Trial 136 finished with value: 0.06604254832318848 and parameters: {'model_name': 'IterativeImputer', 'estimator': 'RFR', 'initial_strategy': 'median', 'n_nearest_features': 5, 'imputation_order': 'descending'}. Best is trial 57 with value: 0.062126204378123696.
running
[I 2024-10-08 10:16:51,566] Trial 138 finished with value: 0.06381785648966476 and parameters: {'model_name': 'IterativeImputer', 'estimator': 'RFR', 'initial_strategy': 'median', 'n_nearest_features': 5, 'imputation_order': 'descending'}. Best is trial 57 with value: 0.062126204378123696.
running
[I 2024-10-08 10:16:55,283] Trial 137 finished with value: 0.06918258014604092 and parameters: {'model_name': 'IterativeImputer', 'estimator': 'RFR', 'initial_strategy': 'median', 'n_nearest_features': 5, 'imputation_order': 'descending'}. Best is trial 57 with value: 0.062126204378123696.
running
[I 2024-10-08 10:17:08,198] Trial 140 finished with value: 0.06787189804165498 and parameters: {'model_name': 'IterativeImputer', 'estimator': 'RFR', 'initial_strategy': 'median', 'n_nearest_features': 5, 'imputation_order': 'descending'}. Best is trial 57 with value: 0.062126204378123696.
running
[I 2024-10-08 10:18:49,933] Trial 141 finished with value: 0.06483339317697448 and parameters: {'model_name': 'IterativeImputer', 'estimator': 'RFR', 'initial_strategy': 'median', 'n_nearest_features': 5, 'imputation_order': 'descending'}. Best is trial 57 with value: 0.062126204378123696.
running
[I 2024-10-08 10:18:59,671] Trial 144 finished with value: 0.06317600758401212 and parameters: {'model_name': 'IterativeImputer', 'estimator': 'RFR', 'initial_strategy': 'median', 'n_nearest_features': 5, 'imputation_order': 'descending'}. Best is trial 57 with value: 0.062126204378123696.
running
[I 2024-10-08 10:19:44,434] Trial 147 finished with value: 0.06700668246033245 and parameters: {'model_name': 'IterativeImputer', 'estimator': 'RFR', 'initial_strategy': 'median', 'n_nearest_features': 5, 'imputation_order': 'descending'}. Best is trial 57 with value: 0.062126204378123696.
running
[I 2024-10-08 10:20:06,459] Trial 145 finished with value: 0.06462219016927599 and parameters: {'model_name': 'IterativeImputer', 'estimator': 'RFR', 'initial_strategy': 'median', 'n_nearest_features': 5, 'imputation_order': 'descending'}. Best is trial 57 with value: 0.062126204378123696.
running
[I 2024-10-08 10:20:08,880] Trial 160 finished with value: 0.11038413179772551 and parameters: {'model_name': 'KNNImputer', 'n_neighbors': 2308, 'weights': 'distance'}. Best is trial 57 with value: 0.062126204378123696.
running
[I 2024-10-08 10:20:16,159] Trial 146 finished with value: 0.06907403111028003 and parameters: {'model_name': 'IterativeImputer', 'estimator': 'RFR', 'initial_strategy': 'median', 'n_nearest_features': 5, 'imputation_order': 'descending'}. Best is trial 57 with value: 0.062126204378123696.
running
[I 2024-10-08 10:20:25,585] Trial 162 finished with value: 0.2017958854452781 and parameters: {'model_name': 'IterativeImputer', 'estimator': 'Bayesian', 'initial_strategy': 'median', 'n_nearest_features': 1, 'imputation_order': 'descending', 'sample_posterior': True}. Best is trial 57 with value: 0.062126204378123696.
running
