Run: 66
/cm/local/apps/slurm/var/spool/job961859/slurm_script: line 26: 
pip install -e tpot2
pip install -r tpot2/ImputerExperiments/requirements_.txt
: No such file or directory
RunStart
Version 0.1.7a0 of tpot2 is outdated. Version 0.1.8a0 was released 3 days ago.
starting loops
../data/c/6/6.pkl
working on 
../data/c/6/class_simple_MAR_0.1_3
1.666898250579834
running experiment 1/3 - Does large hyperparameter space improve reconstruction accuracy over simple
[I 2024-09-20 15:51:15,657] A new study created in memory with name: no-name-43d839b7-b1ea-42af-a4a0-ef11fb672b3d
running
running
running
running
running
running
running
running
running
running
running
running
running
running
running
running
[I 2024-09-20 15:51:16,070] Trial 1 finished with value: 0.4081632875489706 and parameters: {'model_name': 'SimpleImputer', 'strategy': 'constant'}. Best is trial 1 with value: 0.4081632875489706.
running
[I 2024-09-20 15:51:16,302] Trial 2 finished with value: 0.4081632875489706 and parameters: {'model_name': 'SimpleImputer', 'strategy': 'constant'}. Best is trial 1 with value: 0.4081632875489706.
[I 2024-09-20 15:51:16,399] Trial 10 finished with value: 0.4081632875489706 and parameters: {'model_name': 'SimpleImputer', 'strategy': 'constant'}. Best is trial 1 with value: 0.4081632875489706.
running
[I 2024-09-20 15:51:16,522] Trial 11 finished with value: 0.4081632875489706 and parameters: {'model_name': 'SimpleImputer', 'strategy': 'constant'}. Best is trial 1 with value: 0.4081632875489706.
running
running
[I 2024-09-20 15:51:16,753] Trial 4 finished with value: 0.165990265495031 and parameters: {'model_name': 'SimpleImputer', 'strategy': 'mean'}. Best is trial 4 with value: 0.165990265495031.
[I 2024-09-20 15:51:16,863] Trial 5 finished with value: 0.165990265495031 and parameters: {'model_name': 'SimpleImputer', 'strategy': 'mean'}. Best is trial 4 with value: 0.165990265495031.
running
running
[I 2024-09-20 15:51:17,010] Trial 6 finished with value: 0.4081632875489706 and parameters: {'model_name': 'SimpleImputer', 'strategy': 'constant'}. Best is trial 4 with value: 0.165990265495031.
running
[I 2024-09-20 15:51:17,213] Trial 9 finished with value: 0.165990265495031 and parameters: {'model_name': 'SimpleImputer', 'strategy': 'mean'}. Best is trial 4 with value: 0.165990265495031.
running
[I 2024-09-20 15:51:17,412] Trial 17 finished with value: 0.4081632875489706 and parameters: {'model_name': 'SimpleImputer', 'strategy': 'constant'}. Best is trial 4 with value: 0.165990265495031.
[I 2024-09-20 15:51:17,526] Trial 0 finished with value: 0.16631327770198437 and parameters: {'model_name': 'SimpleImputer', 'strategy': 'median'}. Best is trial 4 with value: 0.165990265495031.
running
[I 2024-09-20 15:51:17,638] Trial 18 finished with value: 0.4081632875489706 and parameters: {'model_name': 'SimpleImputer', 'strategy': 'constant'}. Best is trial 4 with value: 0.165990265495031.
running
running
[I 2024-09-20 15:51:17,752] Trial 3 finished with value: 0.16631327770198437 and parameters: {'model_name': 'SimpleImputer', 'strategy': 'median'}. Best is trial 4 with value: 0.165990265495031.
running
[I 2024-09-20 15:51:17,896] Trial 15 finished with value: 0.16631327770198437 and parameters: {'model_name': 'SimpleImputer', 'strategy': 'median'}. Best is trial 4 with value: 0.165990265495031.
running
[I 2024-09-20 15:51:18,151] Trial 8 finished with value: 0.16631327770198437 and parameters: {'model_name': 'SimpleImputer', 'strategy': 'median'}. Best is trial 4 with value: 0.165990265495031.
running
[I 2024-09-20 15:51:18,309] Trial 14 finished with value: 0.16631327770198437 and parameters: {'model_name': 'SimpleImputer', 'strategy': 'median'}. Best is trial 4 with value: 0.165990265495031.
running
[I 2024-09-20 15:51:18,574] Trial 12 finished with value: 0.1775486089972503 and parameters: {'model_name': 'SimpleImputer', 'strategy': 'most_frequent'}. Best is trial 4 with value: 0.165990265495031.
[I 2024-09-20 15:51:18,670] Trial 23 finished with value: 0.165990265495031 and parameters: {'model_name': 'SimpleImputer', 'strategy': 'mean'}. Best is trial 4 with value: 0.165990265495031.
running
[I 2024-09-20 15:51:18,766] Trial 20 finished with value: 0.4081632875489706 and parameters: {'model_name': 'SimpleImputer', 'strategy': 'constant'}. Best is trial 4 with value: 0.165990265495031.
running
running
[I 2024-09-20 15:51:18,878] Trial 7 finished with value: 0.1775486089972503 and parameters: {'model_name': 'SimpleImputer', 'strategy': 'most_frequent'}. Best is trial 4 with value: 0.165990265495031.
running
[I 2024-09-20 15:51:19,017] Trial 13 finished with value: 0.1775486089972503 and parameters: {'model_name': 'SimpleImputer', 'strategy': 'most_frequent'}. Best is trial 4 with value: 0.165990265495031.
running
[I 2024-09-20 15:51:19,161] Trial 19 finished with value: 0.16631327770198437 and parameters: {'model_name': 'SimpleImputer', 'strategy': 'median'}. Best is trial 4 with value: 0.165990265495031.
[I 2024-09-20 15:51:19,259] Trial 22 finished with value: 0.4081632875489706 and parameters: {'model_name': 'SimpleImputer', 'strategy': 'constant'}. Best is trial 4 with value: 0.165990265495031.
[I 2024-09-20 15:51:19,347] Trial 16 finished with value: 0.16631327770198437 and parameters: {'model_name': 'SimpleImputer', 'strategy': 'median'}. Best is trial 4 with value: 0.165990265495031.
running
running
running
[I 2024-09-20 15:51:19,473] Trial 27 finished with value: 0.165990265495031 and parameters: {'model_name': 'SimpleImputer', 'strategy': 'mean'}. Best is trial 4 with value: 0.165990265495031.
running
[I 2024-09-20 15:51:19,722] Trial 26 finished with value: 0.165990265495031 and parameters: {'model_name': 'SimpleImputer', 'strategy': 'mean'}. Best is trial 4 with value: 0.165990265495031.
running
[I 2024-09-20 15:51:19,837] Trial 21 finished with value: 0.16631327770198437 and parameters: {'model_name': 'SimpleImputer', 'strategy': 'median'}. Best is trial 4 with value: 0.165990265495031.
[I 2024-09-20 15:51:19,948] Trial 25 finished with value: 0.165990265495031 and parameters: {'model_name': 'SimpleImputer', 'strategy': 'mean'}. Best is trial 4 with value: 0.165990265495031.
running
[I 2024-09-20 15:51:20,052] Trial 28 finished with value: 0.165990265495031 and parameters: {'model_name': 'SimpleImputer', 'strategy': 'mean'}. Best is trial 4 with value: 0.165990265495031.
[I 2024-09-20 15:51:20,168] Trial 30 finished with value: 0.165990265495031 and parameters: {'model_name': 'SimpleImputer', 'strategy': 'mean'}. Best is trial 4 with value: 0.165990265495031.
running
running
running
[I 2024-09-20 15:51:20,381] Trial 29 finished with value: 0.165990265495031 and parameters: {'model_name': 'SimpleImputer', 'strategy': 'mean'}. Best is trial 4 with value: 0.165990265495031.
running
[I 2024-09-20 15:51:20,591] Trial 33 finished with value: 0.165990265495031 and parameters: {'model_name': 'SimpleImputer', 'strategy': 'mean'}. Best is trial 4 with value: 0.165990265495031.
[I 2024-09-20 15:51:20,692] Trial 32 finished with value: 0.165990265495031 and parameters: {'model_name': 'SimpleImputer', 'strategy': 'mean'}. Best is trial 4 with value: 0.165990265495031.
running
running
[I 2024-09-20 15:51:20,876] Trial 37 finished with value: 0.165990265495031 and parameters: {'model_name': 'SimpleImputer', 'strategy': 'mean'}. Best is trial 4 with value: 0.165990265495031.
running
[I 2024-09-20 15:51:21,002] Trial 35 finished with value: 0.165990265495031 and parameters: {'model_name': 'SimpleImputer', 'strategy': 'mean'}. Best is trial 4 with value: 0.165990265495031.
running
[I 2024-09-20 15:51:21,119] Trial 36 finished with value: 0.165990265495031 and parameters: {'model_name': 'SimpleImputer', 'strategy': 'mean'}. Best is trial 4 with value: 0.165990265495031.
[I 2024-09-20 15:51:21,213] Trial 38 finished with value: 0.165990265495031 and parameters: {'model_name': 'SimpleImputer', 'strategy': 'mean'}. Best is trial 4 with value: 0.165990265495031.
[I 2024-09-20 15:51:21,293] Trial 34 finished with value: 0.165990265495031 and parameters: {'model_name': 'SimpleImputer', 'strategy': 'mean'}. Best is trial 4 with value: 0.165990265495031.
[I 2024-09-20 15:51:21,380] Trial 31 finished with value: 0.165990265495031 and parameters: {'model_name': 'SimpleImputer', 'strategy': 'mean'}. Best is trial 4 with value: 0.165990265495031.
running
running
running
running
[I 2024-09-20 15:51:21,626] Trial 39 finished with value: 0.165990265495031 and parameters: {'model_name': 'SimpleImputer', 'strategy': 'mean'}. Best is trial 4 with value: 0.165990265495031.
running
[I 2024-09-20 15:51:21,807] Trial 41 finished with value: 0.165990265495031 and parameters: {'model_name': 'SimpleImputer', 'strategy': 'mean'}. Best is trial 4 with value: 0.165990265495031.
running
[I 2024-09-20 15:51:21,931] Trial 42 finished with value: 0.165990265495031 and parameters: {'model_name': 'SimpleImputer', 'strategy': 'mean'}. Best is trial 4 with value: 0.165990265495031.
running
[I 2024-09-20 15:51:22,102] Trial 24 finished with value: 0.1775486089972503 and parameters: {'model_name': 'SimpleImputer', 'strategy': 'most_frequent'}. Best is trial 4 with value: 0.165990265495031.
[I 2024-09-20 15:51:22,218] Trial 40 finished with value: 0.165990265495031 and parameters: {'model_name': 'SimpleImputer', 'strategy': 'mean'}. Best is trial 4 with value: 0.165990265495031.
[I 2024-09-20 15:51:22,322] Trial 43 finished with value: 0.165990265495031 and parameters: {'model_name': 'SimpleImputer', 'strategy': 'mean'}. Best is trial 4 with value: 0.165990265495031.
running
running
[I 2024-09-20 15:51:22,446] Trial 44 finished with value: 0.165990265495031 and parameters: {'model_name': 'SimpleImputer', 'strategy': 'mean'}. Best is trial 4 with value: 0.165990265495031.
running
running
[I 2024-09-20 15:51:22,592] Trial 45 finished with value: 0.165990265495031 and parameters: {'model_name': 'SimpleImputer', 'strategy': 'mean'}. Best is trial 4 with value: 0.165990265495031.
running
[I 2024-09-20 15:51:22,886] Trial 51 finished with value: 0.165990265495031 and parameters: {'model_name': 'SimpleImputer', 'strategy': 'mean'}. Best is trial 4 with value: 0.165990265495031.
[I 2024-09-20 15:51:22,995] Trial 50 finished with value: 0.165990265495031 and parameters: {'model_name': 'SimpleImputer', 'strategy': 'mean'}. Best is trial 4 with value: 0.165990265495031.
[I 2024-09-20 15:51:23,086] Trial 53 finished with value: 0.165990265495031 and parameters: {'model_name': 'SimpleImputer', 'strategy': 'mean'}. Best is trial 4 with value: 0.165990265495031.
running
[I 2024-09-20 15:51:23,194] Trial 47 finished with value: 0.165990265495031 and parameters: {'model_name': 'SimpleImputer', 'strategy': 'mean'}. Best is trial 4 with value: 0.165990265495031.
running
[I 2024-09-20 15:51:23,297] Trial 46 finished with value: 0.165990265495031 and parameters: {'model_name': 'SimpleImputer', 'strategy': 'mean'}. Best is trial 4 with value: 0.165990265495031.
running
running
running
[I 2024-09-20 15:51:23,464] Trial 56 finished with value: 0.165990265495031 and parameters: {'model_name': 'SimpleImputer', 'strategy': 'mean'}. Best is trial 4 with value: 0.165990265495031.
[I 2024-09-20 15:51:23,575] Trial 52 finished with value: 0.165990265495031 and parameters: {'model_name': 'SimpleImputer', 'strategy': 'mean'}. Best is trial 4 with value: 0.165990265495031.
running
[I 2024-09-20 15:51:23,695] Trial 48 finished with value: 0.165990265495031 and parameters: {'model_name': 'SimpleImputer', 'strategy': 'mean'}. Best is trial 4 with value: 0.165990265495031.
running
running
[I 2024-09-20 15:51:23,913] Trial 49 finished with value: 0.165990265495031 and parameters: {'model_name': 'SimpleImputer', 'strategy': 'mean'}. Best is trial 4 with value: 0.165990265495031.
running
[I 2024-09-20 15:51:24,607] Trial 58 finished with value: 0.165990265495031 and parameters: {'model_name': 'SimpleImputer', 'strategy': 'mean'}. Best is trial 4 with value: 0.165990265495031.
[I 2024-09-20 15:51:24,609] Trial 57 finished with value: 0.165990265495031 and parameters: {'model_name': 'SimpleImputer', 'strategy': 'mean'}. Best is trial 4 with value: 0.165990265495031.
running
running
[I 2024-09-20 15:51:25,524] Trial 54 finished with value: 0.1775486089972503 and parameters: {'model_name': 'SimpleImputer', 'strategy': 'most_frequent'}. Best is trial 4 with value: 0.165990265495031.
running
[I 2024-09-20 15:51:25,916] Trial 59 finished with value: 0.1775486089972503 and parameters: {'model_name': 'SimpleImputer', 'strategy': 'most_frequent'}. Best is trial 4 with value: 0.165990265495031.
running
[I 2024-09-20 15:51:26,090] Trial 62 finished with value: 0.1775486089972503 and parameters: {'model_name': 'SimpleImputer', 'strategy': 'most_frequent'}. Best is trial 4 with value: 0.165990265495031.
[I 2024-09-20 15:51:26,189] Trial 55 finished with value: 0.1775486089972503 and parameters: {'model_name': 'SimpleImputer', 'strategy': 'most_frequent'}. Best is trial 4 with value: 0.165990265495031.
running
running
[I 2024-09-20 15:51:26,378] Trial 63 finished with value: 0.1775486089972503 and parameters: {'model_name': 'SimpleImputer', 'strategy': 'most_frequent'}. Best is trial 4 with value: 0.165990265495031.
running
[I 2024-09-20 15:51:26,584] Trial 61 finished with value: 0.1775486089972503 and parameters: {'model_name': 'SimpleImputer', 'strategy': 'most_frequent'}. Best is trial 4 with value: 0.165990265495031.
running
[I 2024-09-20 15:51:26,737] Trial 69 finished with value: 0.1775486089972503 and parameters: {'model_name': 'SimpleImputer', 'strategy': 'most_frequent'}. Best is trial 4 with value: 0.165990265495031.
running
[I 2024-09-20 15:51:26,861] Trial 64 finished with value: 0.1775486089972503 and parameters: {'model_name': 'SimpleImputer', 'strategy': 'most_frequent'}. Best is trial 4 with value: 0.165990265495031.
running
[I 2024-09-20 15:51:27,036] Trial 67 finished with value: 0.1775486089972503 and parameters: {'model_name': 'SimpleImputer', 'strategy': 'most_frequent'}. Best is trial 4 with value: 0.165990265495031.
running
[I 2024-09-20 15:51:27,207] Trial 65 finished with value: 0.1775486089972503 and parameters: {'model_name': 'SimpleImputer', 'strategy': 'most_frequent'}. Best is trial 4 with value: 0.165990265495031.
running
[I 2024-09-20 15:51:27,372] Trial 60 finished with value: 0.1775486089972503 and parameters: {'model_name': 'SimpleImputer', 'strategy': 'most_frequent'}. Best is trial 4 with value: 0.165990265495031.
running
[I 2024-09-20 15:51:27,488] Trial 68 finished with value: 0.1775486089972503 and parameters: {'model_name': 'SimpleImputer', 'strategy': 'most_frequent'}. Best is trial 4 with value: 0.165990265495031.
running
[I 2024-09-20 15:51:27,681] Trial 66 finished with value: 0.1775486089972503 and parameters: {'model_name': 'SimpleImputer', 'strategy': 'most_frequent'}. Best is trial 4 with value: 0.165990265495031.
running
[I 2024-09-20 15:51:27,875] Trial 70 finished with value: 0.1775486089972503 and parameters: {'model_name': 'SimpleImputer', 'strategy': 'most_frequent'}. Best is trial 4 with value: 0.165990265495031.
running
[I 2024-09-20 15:51:28,248] Trial 71 finished with value: 0.1775486089972503 and parameters: {'model_name': 'SimpleImputer', 'strategy': 'most_frequent'}. Best is trial 4 with value: 0.165990265495031.
running
[I 2024-09-20 15:51:28,402] Trial 74 finished with value: 0.16631327770198437 and parameters: {'model_name': 'SimpleImputer', 'strategy': 'median'}. Best is trial 4 with value: 0.165990265495031.
running
[I 2024-09-20 15:51:28,568] Trial 73 finished with value: 0.1775486089972503 and parameters: {'model_name': 'SimpleImputer', 'strategy': 'most_frequent'}. Best is trial 4 with value: 0.165990265495031.
running
[I 2024-09-20 15:51:28,693] Trial 75 finished with value: 0.16631327770198437 and parameters: {'model_name': 'SimpleImputer', 'strategy': 'median'}. Best is trial 4 with value: 0.165990265495031.
[I 2024-09-20 15:51:28,790] Trial 76 finished with value: 0.16631327770198437 and parameters: {'model_name': 'SimpleImputer', 'strategy': 'median'}. Best is trial 4 with value: 0.165990265495031.
running
running
[I 2024-09-20 15:51:29,000] Trial 72 finished with value: 0.1775486089972503 and parameters: {'model_name': 'SimpleImputer', 'strategy': 'most_frequent'}. Best is trial 4 with value: 0.165990265495031.
[I 2024-09-20 15:51:29,103] Trial 81 finished with value: 0.16631327770198437 and parameters: {'model_name': 'SimpleImputer', 'strategy': 'median'}. Best is trial 4 with value: 0.165990265495031.
running
running
[I 2024-09-20 15:51:29,228] Trial 78 finished with value: 0.16631327770198437 and parameters: {'model_name': 'SimpleImputer', 'strategy': 'median'}. Best is trial 4 with value: 0.165990265495031.
running
[I 2024-09-20 15:51:29,348] Trial 83 finished with value: 0.16631327770198437 and parameters: {'model_name': 'SimpleImputer', 'strategy': 'median'}. Best is trial 4 with value: 0.165990265495031.
[I 2024-09-20 15:51:29,448] Trial 79 finished with value: 0.16631327770198437 and parameters: {'model_name': 'SimpleImputer', 'strategy': 'median'}. Best is trial 4 with value: 0.165990265495031.
running
running
[I 2024-09-20 15:51:29,560] Trial 77 finished with value: 0.16631327770198437 and parameters: {'model_name': 'SimpleImputer', 'strategy': 'median'}. Best is trial 4 with value: 0.165990265495031.
running
[I 2024-09-20 15:51:29,694] Trial 84 finished with value: 0.16631327770198437 and parameters: {'model_name': 'SimpleImputer', 'strategy': 'median'}. Best is trial 4 with value: 0.165990265495031.
running
[I 2024-09-20 15:51:29,881] Trial 88 finished with value: 0.4081632875489706 and parameters: {'model_name': 'SimpleImputer', 'strategy': 'constant'}. Best is trial 4 with value: 0.165990265495031.
[I 2024-09-20 15:51:29,983] Trial 82 finished with value: 0.16631327770198437 and parameters: {'model_name': 'SimpleImputer', 'strategy': 'median'}. Best is trial 4 with value: 0.165990265495031.
running
running
[I 2024-09-20 15:51:30,082] Trial 80 finished with value: 0.16631327770198437 and parameters: {'model_name': 'SimpleImputer', 'strategy': 'median'}. Best is trial 4 with value: 0.165990265495031.
[I 2024-09-20 15:51:30,201] Trial 85 finished with value: 0.16631327770198437 and parameters: {'model_name': 'SimpleImputer', 'strategy': 'median'}. Best is trial 4 with value: 0.165990265495031.
running
running
[I 2024-09-20 15:51:30,391] Trial 91 finished with value: 0.4081632875489706 and parameters: {'model_name': 'SimpleImputer', 'strategy': 'constant'}. Best is trial 4 with value: 0.165990265495031.
running
[I 2024-09-20 15:51:30,514] Trial 90 finished with value: 0.4081632875489706 and parameters: {'model_name': 'SimpleImputer', 'strategy': 'constant'}. Best is trial 4 with value: 0.165990265495031.
running
[I 2024-09-20 15:51:30,701] Trial 93 finished with value: 0.4081632875489706 and parameters: {'model_name': 'SimpleImputer', 'strategy': 'constant'}. Best is trial 4 with value: 0.165990265495031.
[I 2024-09-20 15:51:30,806] Trial 86 finished with value: 0.16631327770198437 and parameters: {'model_name': 'SimpleImputer', 'strategy': 'median'}. Best is trial 4 with value: 0.165990265495031.
running
running
[I 2024-09-20 15:51:30,922] Trial 89 finished with value: 0.4081632875489706 and parameters: {'model_name': 'SimpleImputer', 'strategy': 'constant'}. Best is trial 4 with value: 0.165990265495031.
running
[I 2024-09-20 15:51:31,095] Trial 92 finished with value: 0.4081632875489706 and parameters: {'model_name': 'SimpleImputer', 'strategy': 'constant'}. Best is trial 4 with value: 0.165990265495031.
running
[I 2024-09-20 15:51:31,257] Trial 94 finished with value: 0.4081632875489706 and parameters: {'model_name': 'SimpleImputer', 'strategy': 'constant'}. Best is trial 4 with value: 0.165990265495031.
running
[I 2024-09-20 15:51:31,389] Trial 98 finished with value: 0.165990265495031 and parameters: {'model_name': 'SimpleImputer', 'strategy': 'mean'}. Best is trial 4 with value: 0.165990265495031.
running
[I 2024-09-20 15:51:31,547] Trial 87 finished with value: 0.16631327770198437 and parameters: {'model_name': 'SimpleImputer', 'strategy': 'median'}. Best is trial 4 with value: 0.165990265495031.
[I 2024-09-20 15:51:31,662] Trial 102 finished with value: 0.165990265495031 and parameters: {'model_name': 'SimpleImputer', 'strategy': 'mean'}. Best is trial 4 with value: 0.165990265495031.
running
running
[I 2024-09-20 15:51:31,786] Trial 95 finished with value: 0.165990265495031 and parameters: {'model_name': 'SimpleImputer', 'strategy': 'mean'}. Best is trial 4 with value: 0.165990265495031.
running
[I 2024-09-20 15:51:31,928] Trial 99 finished with value: 0.165990265495031 and parameters: {'model_name': 'SimpleImputer', 'strategy': 'mean'}. Best is trial 4 with value: 0.165990265495031.
running
[I 2024-09-20 15:51:32,075] Trial 96 finished with value: 0.165990265495031 and parameters: {'model_name': 'SimpleImputer', 'strategy': 'mean'}. Best is trial 4 with value: 0.165990265495031.
[I 2024-09-20 15:51:32,181] Trial 97 finished with value: 0.165990265495031 and parameters: {'model_name': 'SimpleImputer', 'strategy': 'mean'}. Best is trial 4 with value: 0.165990265495031.
running
running
[I 2024-09-20 15:51:32,369] Trial 100 finished with value: 0.165990265495031 and parameters: {'model_name': 'SimpleImputer', 'strategy': 'mean'}. Best is trial 4 with value: 0.165990265495031.
[I 2024-09-20 15:51:32,468] Trial 101 finished with value: 0.165990265495031 and parameters: {'model_name': 'SimpleImputer', 'strategy': 'mean'}. Best is trial 4 with value: 0.165990265495031.
running
[I 2024-09-20 15:51:32,576] Trial 103 finished with value: 0.165990265495031 and parameters: {'model_name': 'SimpleImputer', 'strategy': 'mean'}. Best is trial 4 with value: 0.165990265495031.
running
running
