[I 2024-10-23 19:55:27,466] Trial 27 finished with value: 0.5005656371225676 and parameters: {'model_name': 'GAIN', 'batch_size': 882, 'hint_rate': 0.9813760731998387, 'alpha': 1, 'iterations': 8020, 'learning_rate': 0.00016443341254133474, 'p_miss': 0.028878881703190362}. Best is trial 2 with value: 0.25832735412355706.
running
[I 2024-10-23 19:56:34,734] Trial 63 finished with value: 0.2749491878057437 and parameters: {'model_name': 'VAE', 'batch_size': 7, 'iterations': 4760, 'learning_rate': 0.046681819415906566, 'p_miss': 0.28428575164216796}. Best is trial 2 with value: 0.25832735412355706.
running
[I 2024-10-23 19:56:47,312] Trial 103 finished with value: 0.25832630330695594 and parameters: {'model_name': 'IterativeImputer', 'estimator': 'Ridge', 'initial_strategy': 'most_frequent', 'n_nearest_features': 2, 'imputation_order': 'descending'}. Best is trial 103 with value: 0.25832630330695594.
running
[I 2024-10-23 19:57:00,145] Trial 104 finished with value: 0.25832630330695594 and parameters: {'model_name': 'IterativeImputer', 'estimator': 'Ridge', 'initial_strategy': 'most_frequent', 'n_nearest_features': 2, 'imputation_order': 'descending'}. Best is trial 103 with value: 0.25832630330695594.
running
[I 2024-10-23 19:57:12,862] Trial 105 finished with value: 0.25832630330695594 and parameters: {'model_name': 'IterativeImputer', 'estimator': 'Ridge', 'initial_strategy': 'most_frequent', 'n_nearest_features': 2, 'imputation_order': 'descending'}. Best is trial 103 with value: 0.25832630330695594.
running
[I 2024-10-23 19:57:24,263] Trial 106 finished with value: 0.25832630330695594 and parameters: {'model_name': 'IterativeImputer', 'estimator': 'Ridge', 'initial_strategy': 'most_frequent', 'n_nearest_features': 2, 'imputation_order': 'descending'}. Best is trial 103 with value: 0.25832630330695594.
running
[I 2024-10-23 19:57:37,640] Trial 107 finished with value: 0.25832630330695594 and parameters: {'model_name': 'IterativeImputer', 'estimator': 'Ridge', 'initial_strategy': 'most_frequent', 'n_nearest_features': 2, 'imputation_order': 'descending'}. Best is trial 103 with value: 0.25832630330695594.
running
[I 2024-10-23 19:57:48,954] Trial 108 finished with value: 0.25832630330695594 and parameters: {'model_name': 'IterativeImputer', 'estimator': 'Ridge', 'initial_strategy': 'most_frequent', 'n_nearest_features': 2, 'imputation_order': 'descending'}. Best is trial 103 with value: 0.25832630330695594.
running
[I 2024-10-23 19:58:03,084] Trial 109 finished with value: 0.25832630330695594 and parameters: {'model_name': 'IterativeImputer', 'estimator': 'Ridge', 'initial_strategy': 'most_frequent', 'n_nearest_features': 2, 'imputation_order': 'descending'}. Best is trial 103 with value: 0.25832630330695594.
running
[I 2024-10-23 19:58:17,506] Trial 110 finished with value: 0.25832630330695594 and parameters: {'model_name': 'IterativeImputer', 'estimator': 'Ridge', 'initial_strategy': 'most_frequent', 'n_nearest_features': 2, 'imputation_order': 'descending'}. Best is trial 103 with value: 0.25832630330695594.
running
[I 2024-10-23 19:58:28,174] Trial 111 finished with value: 0.25832630330695594 and parameters: {'model_name': 'IterativeImputer', 'estimator': 'Ridge', 'initial_strategy': 'most_frequent', 'n_nearest_features': 2, 'imputation_order': 'descending'}. Best is trial 103 with value: 0.25832630330695594.
running
[I 2024-10-23 19:58:40,756] Trial 112 finished with value: 0.25832630330695594 and parameters: {'model_name': 'IterativeImputer', 'estimator': 'Ridge', 'initial_strategy': 'most_frequent', 'n_nearest_features': 2, 'imputation_order': 'descending'}. Best is trial 103 with value: 0.25832630330695594.
running
[I 2024-10-23 19:58:54,261] Trial 113 finished with value: 0.25832630330695594 and parameters: {'model_name': 'IterativeImputer', 'estimator': 'Ridge', 'initial_strategy': 'most_frequent', 'n_nearest_features': 2, 'imputation_order': 'descending'}. Best is trial 103 with value: 0.25832630330695594.
running
[I 2024-10-23 19:59:01,628] Trial 114 finished with value: 0.25832630330695594 and parameters: {'model_name': 'IterativeImputer', 'estimator': 'Ridge', 'initial_strategy': 'most_frequent', 'n_nearest_features': 2, 'imputation_order': 'descending'}. Best is trial 103 with value: 0.25832630330695594.
running
[I 2024-10-23 19:59:15,274] Trial 115 finished with value: 0.25832630330695594 and parameters: {'model_name': 'IterativeImputer', 'estimator': 'Ridge', 'initial_strategy': 'most_frequent', 'n_nearest_features': 2, 'imputation_order': 'descending'}. Best is trial 103 with value: 0.25832630330695594.
running
[I 2024-10-23 19:59:28,388] Trial 116 finished with value: 0.25832630330695594 and parameters: {'model_name': 'IterativeImputer', 'estimator': 'Ridge', 'initial_strategy': 'most_frequent', 'n_nearest_features': 2, 'imputation_order': 'descending'}. Best is trial 103 with value: 0.25832630330695594.
running
[I 2024-10-23 19:59:42,612] Trial 117 finished with value: 0.25832630330695594 and parameters: {'model_name': 'IterativeImputer', 'estimator': 'Ridge', 'initial_strategy': 'most_frequent', 'n_nearest_features': 2, 'imputation_order': 'descending'}. Best is trial 103 with value: 0.25832630330695594.
running
[I 2024-10-23 19:59:57,447] Trial 118 finished with value: 0.25832630330695594 and parameters: {'model_name': 'IterativeImputer', 'estimator': 'Ridge', 'initial_strategy': 'most_frequent', 'n_nearest_features': 2, 'imputation_order': 'descending'}. Best is trial 103 with value: 0.25832630330695594.
running
[I 2024-10-23 20:00:11,748] Trial 119 finished with value: 0.258395900837811 and parameters: {'model_name': 'IterativeImputer', 'estimator': 'Ridge', 'initial_strategy': 'most_frequent', 'n_nearest_features': 3, 'imputation_order': 'descending'}. Best is trial 103 with value: 0.25832630330695594.
running
[I 2024-10-23 20:00:23,572] Trial 120 finished with value: 0.25827565048682916 and parameters: {'model_name': 'IterativeImputer', 'estimator': 'Ridge', 'initial_strategy': 'most_frequent', 'n_nearest_features': 1, 'imputation_order': 'descending'}. Best is trial 120 with value: 0.25827565048682916.
running
[I 2024-10-23 20:00:34,358] Trial 121 finished with value: 0.25827565048682916 and parameters: {'model_name': 'IterativeImputer', 'estimator': 'Ridge', 'initial_strategy': 'most_frequent', 'n_nearest_features': 1, 'imputation_order': 'descending'}. Best is trial 120 with value: 0.25827565048682916.
running
[I 2024-10-23 20:00:45,836] Trial 122 finished with value: 0.25827565048682916 and parameters: {'model_name': 'IterativeImputer', 'estimator': 'Ridge', 'initial_strategy': 'most_frequent', 'n_nearest_features': 1, 'imputation_order': 'descending'}. Best is trial 120 with value: 0.25827565048682916.
running
[I 2024-10-23 20:00:56,092] Trial 123 finished with value: 0.25827565048682916 and parameters: {'model_name': 'IterativeImputer', 'estimator': 'Ridge', 'initial_strategy': 'most_frequent', 'n_nearest_features': 1, 'imputation_order': 'descending'}. Best is trial 120 with value: 0.25827565048682916.
running
[I 2024-10-23 20:01:07,293] Trial 124 finished with value: 0.25827565048682916 and parameters: {'model_name': 'IterativeImputer', 'estimator': 'Ridge', 'initial_strategy': 'most_frequent', 'n_nearest_features': 1, 'imputation_order': 'descending'}. Best is trial 120 with value: 0.25827565048682916.
running
[I 2024-10-23 20:01:18,108] Trial 125 finished with value: 0.25827565048682916 and parameters: {'model_name': 'IterativeImputer', 'estimator': 'Ridge', 'initial_strategy': 'most_frequent', 'n_nearest_features': 1, 'imputation_order': 'descending'}. Best is trial 120 with value: 0.25827565048682916.
running
[I 2024-10-23 20:01:30,076] Trial 126 finished with value: 0.25827565048682916 and parameters: {'model_name': 'IterativeImputer', 'estimator': 'Ridge', 'initial_strategy': 'most_frequent', 'n_nearest_features': 1, 'imputation_order': 'descending'}. Best is trial 120 with value: 0.25827565048682916.
running
[I 2024-10-23 20:01:41,841] Trial 127 finished with value: 0.25827565048682916 and parameters: {'model_name': 'IterativeImputer', 'estimator': 'Ridge', 'initial_strategy': 'most_frequent', 'n_nearest_features': 1, 'imputation_order': 'descending'}. Best is trial 120 with value: 0.25827565048682916.
running
[I 2024-10-23 20:01:52,725] Trial 128 finished with value: 0.25827565048682916 and parameters: {'model_name': 'IterativeImputer', 'estimator': 'Ridge', 'initial_strategy': 'most_frequent', 'n_nearest_features': 1, 'imputation_order': 'descending'}. Best is trial 120 with value: 0.25827565048682916.
running
[I 2024-10-23 20:02:04,777] Trial 129 finished with value: 0.25827565048682916 and parameters: {'model_name': 'IterativeImputer', 'estimator': 'Ridge', 'initial_strategy': 'most_frequent', 'n_nearest_features': 1, 'imputation_order': 'descending'}. Best is trial 120 with value: 0.25827565048682916.
running
[I 2024-10-23 20:02:15,566] Trial 130 finished with value: 0.25827565048682916 and parameters: {'model_name': 'IterativeImputer', 'estimator': 'Ridge', 'initial_strategy': 'most_frequent', 'n_nearest_features': 1, 'imputation_order': 'descending'}. Best is trial 120 with value: 0.25827565048682916.
running
[I 2024-10-23 20:02:28,226] Trial 131 finished with value: 0.25827565048682916 and parameters: {'model_name': 'IterativeImputer', 'estimator': 'Ridge', 'initial_strategy': 'most_frequent', 'n_nearest_features': 1, 'imputation_order': 'descending'}. Best is trial 120 with value: 0.25827565048682916.
running
[I 2024-10-23 20:02:38,041] Trial 132 finished with value: 0.25827565048682916 and parameters: {'model_name': 'IterativeImputer', 'estimator': 'Ridge', 'initial_strategy': 'most_frequent', 'n_nearest_features': 1, 'imputation_order': 'descending'}. Best is trial 120 with value: 0.25827565048682916.
running
[I 2024-10-23 20:02:48,548] Trial 133 finished with value: 0.25827565048682916 and parameters: {'model_name': 'IterativeImputer', 'estimator': 'Ridge', 'initial_strategy': 'most_frequent', 'n_nearest_features': 1, 'imputation_order': 'descending'}. Best is trial 120 with value: 0.25827565048682916.
running
[I 2024-10-23 20:03:00,005] Trial 134 finished with value: 0.25827565048682916 and parameters: {'model_name': 'IterativeImputer', 'estimator': 'Ridge', 'initial_strategy': 'most_frequent', 'n_nearest_features': 1, 'imputation_order': 'descending'}. Best is trial 120 with value: 0.25827565048682916.
running
[I 2024-10-23 20:03:10,210] Trial 135 finished with value: 0.25827565048682916 and parameters: {'model_name': 'IterativeImputer', 'estimator': 'Ridge', 'initial_strategy': 'most_frequent', 'n_nearest_features': 1, 'imputation_order': 'descending'}. Best is trial 120 with value: 0.25827565048682916.
running
[I 2024-10-23 20:03:20,781] Trial 136 finished with value: 0.25827565048682916 and parameters: {'model_name': 'IterativeImputer', 'estimator': 'Ridge', 'initial_strategy': 'most_frequent', 'n_nearest_features': 1, 'imputation_order': 'descending'}. Best is trial 120 with value: 0.25827565048682916.
running
[I 2024-10-23 20:03:31,156] Trial 137 finished with value: 0.25832357342935536 and parameters: {'model_name': 'IterativeImputer', 'estimator': 'Ridge', 'initial_strategy': 'most_frequent', 'n_nearest_features': 1, 'imputation_order': 'arabic'}. Best is trial 120 with value: 0.25827565048682916.
running
[I 2024-10-23 20:03:41,817] Trial 138 finished with value: 0.2581758140556432 and parameters: {'model_name': 'IterativeImputer', 'estimator': 'Ridge', 'initial_strategy': 'most_frequent', 'n_nearest_features': 1, 'imputation_order': 'ascending'}. Best is trial 138 with value: 0.2581758140556432.
running
[I 2024-10-23 20:03:52,315] Trial 139 finished with value: 0.2581758140556432 and parameters: {'model_name': 'IterativeImputer', 'estimator': 'Ridge', 'initial_strategy': 'most_frequent', 'n_nearest_features': 1, 'imputation_order': 'ascending'}. Best is trial 138 with value: 0.2581758140556432.
running
[I 2024-10-23 20:04:06,983] Trial 140 finished with value: 0.2873076970825512 and parameters: {'model_name': 'IterativeImputer', 'estimator': 'KNN', 'initial_strategy': 'most_frequent', 'n_nearest_features': 1, 'imputation_order': 'ascending'}. Best is trial 138 with value: 0.2581758140556432.
running
[I 2024-10-23 20:04:21,578] Trial 141 finished with value: 0.258254538135657 and parameters: {'model_name': 'IterativeImputer', 'estimator': 'Bayesian', 'initial_strategy': 'most_frequent', 'n_nearest_features': 1, 'imputation_order': 'ascending', 'sample_posterior': False}. Best is trial 138 with value: 0.2581758140556432.
running
[I 2024-10-23 20:04:36,671] Trial 142 finished with value: 0.258273887040863 and parameters: {'model_name': 'IterativeImputer', 'estimator': 'Bayesian', 'initial_strategy': 'median', 'n_nearest_features': 1, 'imputation_order': 'ascending', 'sample_posterior': False}. Best is trial 138 with value: 0.2581758140556432.
running
[I 2024-10-23 20:04:53,723] Trial 143 finished with value: 0.258273887040863 and parameters: {'model_name': 'IterativeImputer', 'estimator': 'Bayesian', 'initial_strategy': 'median', 'n_nearest_features': 1, 'imputation_order': 'ascending', 'sample_posterior': False}. Best is trial 138 with value: 0.2581758140556432.
running
[I 2024-10-23 20:05:13,762] Trial 144 finished with value: 0.258273887040863 and parameters: {'model_name': 'IterativeImputer', 'estimator': 'Bayesian', 'initial_strategy': 'median', 'n_nearest_features': 1, 'imputation_order': 'ascending', 'sample_posterior': False}. Best is trial 138 with value: 0.2581758140556432.
running
[I 2024-10-23 20:05:33,188] Trial 145 finished with value: 0.258273887040863 and parameters: {'model_name': 'IterativeImputer', 'estimator': 'Bayesian', 'initial_strategy': 'median', 'n_nearest_features': 1, 'imputation_order': 'ascending', 'sample_posterior': False}. Best is trial 138 with value: 0.2581758140556432.
running
[I 2024-10-23 20:05:52,739] Trial 146 finished with value: 0.258273887040863 and parameters: {'model_name': 'IterativeImputer', 'estimator': 'Bayesian', 'initial_strategy': 'median', 'n_nearest_features': 1, 'imputation_order': 'ascending', 'sample_posterior': False}. Best is trial 138 with value: 0.2581758140556432.
running
[I 2024-10-23 20:06:12,196] Trial 147 finished with value: 0.258273887040863 and parameters: {'model_name': 'IterativeImputer', 'estimator': 'Bayesian', 'initial_strategy': 'median', 'n_nearest_features': 1, 'imputation_order': 'ascending', 'sample_posterior': False}. Best is trial 138 with value: 0.2581758140556432.
running
[I 2024-10-23 20:06:30,393] Trial 148 finished with value: 0.258273887040863 and parameters: {'model_name': 'IterativeImputer', 'estimator': 'Bayesian', 'initial_strategy': 'median', 'n_nearest_features': 1, 'imputation_order': 'ascending', 'sample_posterior': False}. Best is trial 138 with value: 0.2581758140556432.
running
[I 2024-10-23 20:06:47,593] Trial 149 finished with value: 0.258273887040863 and parameters: {'model_name': 'IterativeImputer', 'estimator': 'Bayesian', 'initial_strategy': 'median', 'n_nearest_features': 1, 'imputation_order': 'ascending', 'sample_posterior': False}. Best is trial 138 with value: 0.2581758140556432.
running
[I 2024-10-23 20:07:04,437] Trial 150 finished with value: 0.258273887040863 and parameters: {'model_name': 'IterativeImputer', 'estimator': 'Bayesian', 'initial_strategy': 'median', 'n_nearest_features': 1, 'imputation_order': 'ascending', 'sample_posterior': False}. Best is trial 138 with value: 0.2581758140556432.
running
[I 2024-10-23 20:07:22,119] Trial 151 finished with value: 0.258273887040863 and parameters: {'model_name': 'IterativeImputer', 'estimator': 'Bayesian', 'initial_strategy': 'median', 'n_nearest_features': 1, 'imputation_order': 'ascending', 'sample_posterior': False}. Best is trial 138 with value: 0.2581758140556432.
running
[I 2024-10-23 20:07:40,641] Trial 152 finished with value: 0.258273887040863 and parameters: {'model_name': 'IterativeImputer', 'estimator': 'Bayesian', 'initial_strategy': 'median', 'n_nearest_features': 1, 'imputation_order': 'ascending', 'sample_posterior': False}. Best is trial 138 with value: 0.2581758140556432.
running
[I 2024-10-23 20:07:57,551] Trial 153 finished with value: 0.258273887040863 and parameters: {'model_name': 'IterativeImputer', 'estimator': 'Bayesian', 'initial_strategy': 'median', 'n_nearest_features': 1, 'imputation_order': 'ascending', 'sample_posterior': False}. Best is trial 138 with value: 0.2581758140556432.
running
[I 2024-10-23 20:08:15,475] Trial 154 finished with value: 0.258273887040863 and parameters: {'model_name': 'IterativeImputer', 'estimator': 'Bayesian', 'initial_strategy': 'median', 'n_nearest_features': 1, 'imputation_order': 'ascending', 'sample_posterior': False}. Best is trial 138 with value: 0.2581758140556432.
running
[I 2024-10-23 20:08:22,099] Trial 155 finished with value: 0.2583646346267404 and parameters: {'model_name': 'KNNImputer', 'n_neighbors': 6520, 'weights': 'distance'}. Best is trial 138 with value: 0.2581758140556432.
running
[I 2024-10-23 20:08:36,943] Trial 156 finished with value: 0.258273887040863 and parameters: {'model_name': 'IterativeImputer', 'estimator': 'Bayesian', 'initial_strategy': 'median', 'n_nearest_features': 1, 'imputation_order': 'ascending', 'sample_posterior': False}. Best is trial 138 with value: 0.2581758140556432.
running
[I 2024-10-23 20:08:52,773] Trial 157 finished with value: 0.258273887040863 and parameters: {'model_name': 'IterativeImputer', 'estimator': 'Bayesian', 'initial_strategy': 'median', 'n_nearest_features': 1, 'imputation_order': 'ascending', 'sample_posterior': False}. Best is trial 138 with value: 0.2581758140556432.
running
[I 2024-10-23 20:09:09,363] Trial 158 finished with value: 0.258273887040863 and parameters: {'model_name': 'IterativeImputer', 'estimator': 'Bayesian', 'initial_strategy': 'median', 'n_nearest_features': 1, 'imputation_order': 'ascending', 'sample_posterior': False}. Best is trial 138 with value: 0.2581758140556432.
running
[I 2024-10-23 20:09:25,716] Trial 159 finished with value: 0.258273887040863 and parameters: {'model_name': 'IterativeImputer', 'estimator': 'Bayesian', 'initial_strategy': 'median', 'n_nearest_features': 1, 'imputation_order': 'ascending', 'sample_posterior': False}. Best is trial 138 with value: 0.2581758140556432.
running
[I 2024-10-23 20:24:58,000] Trial 160 finished with value: 0.507360671765347 and parameters: {'model_name': 'GAIN', 'batch_size': 254, 'hint_rate': 0.3197673557577435, 'alpha': 33, 'iterations': 471, 'learning_rate': 0.025551698255368578, 'p_miss': 0.2543542812089564}. Best is trial 138 with value: 0.2581758140556432.
running
[I 2024-10-23 20:25:16,420] Trial 161 finished with value: 0.258273887040863 and parameters: {'model_name': 'IterativeImputer', 'estimator': 'Bayesian', 'initial_strategy': 'median', 'n_nearest_features': 1, 'imputation_order': 'ascending', 'sample_posterior': False}. Best is trial 138 with value: 0.2581758140556432.
running
[I 2024-10-23 20:25:34,232] Trial 162 finished with value: 0.258273887040863 and parameters: {'model_name': 'IterativeImputer', 'estimator': 'Bayesian', 'initial_strategy': 'median', 'n_nearest_features': 1, 'imputation_order': 'ascending', 'sample_posterior': False}. Best is trial 138 with value: 0.2581758140556432.
running
[I 2024-10-23 20:25:40,359] Trial 163 finished with value: 0.33639787766474266 and parameters: {'model_name': 'VAE', 'batch_size': 43, 'iterations': 1, 'learning_rate': 0.0005549861861469074, 'p_miss': 0.1053652195554585}. Best is trial 138 with value: 0.2581758140556432.
running
[I 2024-10-23 20:25:58,392] Trial 164 finished with value: 0.258273887040863 and parameters: {'model_name': 'IterativeImputer', 'estimator': 'Bayesian', 'initial_strategy': 'median', 'n_nearest_features': 1, 'imputation_order': 'ascending', 'sample_posterior': False}. Best is trial 138 with value: 0.2581758140556432.
running
[I 2024-10-23 20:26:15,890] Trial 165 finished with value: 0.258273887040863 and parameters: {'model_name': 'IterativeImputer', 'estimator': 'Bayesian', 'initial_strategy': 'median', 'n_nearest_features': 1, 'imputation_order': 'ascending', 'sample_posterior': False}. Best is trial 138 with value: 0.2581758140556432.
running
[I 2024-10-23 20:26:33,662] Trial 166 finished with value: 0.258273887040863 and parameters: {'model_name': 'IterativeImputer', 'estimator': 'Bayesian', 'initial_strategy': 'median', 'n_nearest_features': 1, 'imputation_order': 'ascending', 'sample_posterior': False}. Best is trial 138 with value: 0.2581758140556432.
running
[I 2024-10-23 20:26:51,161] Trial 167 finished with value: 0.258273887040863 and parameters: {'model_name': 'IterativeImputer', 'estimator': 'Bayesian', 'initial_strategy': 'median', 'n_nearest_features': 1, 'imputation_order': 'ascending', 'sample_posterior': False}. Best is trial 138 with value: 0.2581758140556432.
running
[I 2024-10-23 20:27:09,211] Trial 168 finished with value: 0.258273887040863 and parameters: {'model_name': 'IterativeImputer', 'estimator': 'Bayesian', 'initial_strategy': 'median', 'n_nearest_features': 1, 'imputation_order': 'ascending', 'sample_posterior': False}. Best is trial 138 with value: 0.2581758140556432.
running
[I 2024-10-23 20:27:26,928] Trial 169 finished with value: 0.258273887040863 and parameters: {'model_name': 'IterativeImputer', 'estimator': 'Bayesian', 'initial_strategy': 'median', 'n_nearest_features': 1, 'imputation_order': 'ascending', 'sample_posterior': False}. Best is trial 138 with value: 0.2581758140556432.
running
[I 2024-10-23 20:27:44,686] Trial 170 finished with value: 0.258273887040863 and parameters: {'model_name': 'IterativeImputer', 'estimator': 'Bayesian', 'initial_strategy': 'median', 'n_nearest_features': 1, 'imputation_order': 'ascending', 'sample_posterior': False}. Best is trial 138 with value: 0.2581758140556432.
running
