Run: 48
/cm/local/apps/slurm/var/spool/job1001856/slurm_script: line 26: 
pip install -e tpot2
pip install -r tpot2/ImputerExperiments/requirements_.txt
: No such file or directory
RunStart
Version 0.1.7a0 of tpot2 is outdated. Version 0.1.8a0 was released Tuesday September 17, 2024.
starting loops
../data/c/137/137.pkl
working on 
../data/c/137/class_simple_MNAR_0.5_2
4.209917783737183
running experiment 1/3 - Does large hyperparameter space improve reconstruction accuracy over simple
[I 2024-10-15 09:27:53,803] A new study created in memory with name: no-name-27f40201-7e9a-4e6c-942a-120ff440103c
running
running
running
running
running
running
running
running
running
running
running
running
running
running
running
running
[I 2024-10-15 09:27:54,336] Trial 10 finished with value: 0.5040131968124747 and parameters: {'model_name': 'SimpleImputer', 'strategy': 'constant'}. Best is trial 10 with value: 0.5040131968124747.
running
[I 2024-10-15 09:27:54,538] Trial 3 finished with value: 0.5040131968124747 and parameters: {'model_name': 'SimpleImputer', 'strategy': 'constant'}. Best is trial 10 with value: 0.5040131968124747.
[I 2024-10-15 09:27:54,637] Trial 9 finished with value: 0.34689599756520667 and parameters: {'model_name': 'SimpleImputer', 'strategy': 'mean'}. Best is trial 9 with value: 0.34689599756520667.
running
running
[I 2024-10-15 09:27:54,790] Trial 8 finished with value: 0.34689599756520667 and parameters: {'model_name': 'SimpleImputer', 'strategy': 'mean'}. Best is trial 9 with value: 0.34689599756520667.
running
[I 2024-10-15 09:27:54,926] Trial 13 finished with value: 0.34689599756520667 and parameters: {'model_name': 'SimpleImputer', 'strategy': 'mean'}. Best is trial 9 with value: 0.34689599756520667.
running
[I 2024-10-15 09:27:55,099] Trial 2 finished with value: 0.5040131968124747 and parameters: {'model_name': 'SimpleImputer', 'strategy': 'constant'}. Best is trial 9 with value: 0.34689599756520667.
running
[I 2024-10-15 09:27:55,272] Trial 12 finished with value: 0.34689599756520667 and parameters: {'model_name': 'SimpleImputer', 'strategy': 'mean'}. Best is trial 9 with value: 0.34689599756520667.
running
[I 2024-10-15 09:27:55,511] Trial 11 finished with value: 0.5040131968124747 and parameters: {'model_name': 'SimpleImputer', 'strategy': 'median'}. Best is trial 9 with value: 0.34689599756520667.
running
[I 2024-10-15 09:27:55,715] Trial 0 finished with value: 0.5040131968124747 and parameters: {'model_name': 'SimpleImputer', 'strategy': 'most_frequent'}. Best is trial 9 with value: 0.34689599756520667.
[I 2024-10-15 09:27:55,809] Trial 7 finished with value: 0.5040131968124747 and parameters: {'model_name': 'SimpleImputer', 'strategy': 'most_frequent'}. Best is trial 9 with value: 0.34689599756520667.
running
running
[I 2024-10-15 09:27:55,911] Trial 14 finished with value: 0.5040131968124747 and parameters: {'model_name': 'SimpleImputer', 'strategy': 'median'}. Best is trial 9 with value: 0.34689599756520667.
running
[I 2024-10-15 09:27:56,054] Trial 5 finished with value: 0.5040131968124747 and parameters: {'model_name': 'SimpleImputer', 'strategy': 'most_frequent'}. Best is trial 9 with value: 0.34689599756520667.
running
[I 2024-10-15 09:27:56,178] Trial 18 finished with value: 0.34689599756520667 and parameters: {'model_name': 'SimpleImputer', 'strategy': 'mean'}. Best is trial 9 with value: 0.34689599756520667.
[I 2024-10-15 09:27:56,273] Trial 4 finished with value: 0.5040131968124747 and parameters: {'model_name': 'SimpleImputer', 'strategy': 'most_frequent'}. Best is trial 9 with value: 0.34689599756520667.
running
running
[I 2024-10-15 09:27:56,391] Trial 6 finished with value: 0.5040131968124747 and parameters: {'model_name': 'SimpleImputer', 'strategy': 'median'}. Best is trial 9 with value: 0.34689599756520667.
[I 2024-10-15 09:27:56,493] Trial 16 finished with value: 0.34689599756520667 and parameters: {'model_name': 'SimpleImputer', 'strategy': 'mean'}. Best is trial 9 with value: 0.34689599756520667.
running
running
[I 2024-10-15 09:27:56,617] Trial 15 finished with value: 0.5040131968124747 and parameters: {'model_name': 'SimpleImputer', 'strategy': 'most_frequent'}. Best is trial 9 with value: 0.34689599756520667.
running
[I 2024-10-15 09:27:56,805] Trial 1 finished with value: 0.5040131968124747 and parameters: {'model_name': 'SimpleImputer', 'strategy': 'most_frequent'}. Best is trial 9 with value: 0.34689599756520667.
running
[I 2024-10-15 09:27:56,969] Trial 19 finished with value: 0.34689599756520667 and parameters: {'model_name': 'SimpleImputer', 'strategy': 'mean'}. Best is trial 9 with value: 0.34689599756520667.
running
[I 2024-10-15 09:27:57,124] Trial 23 finished with value: 0.5040131968124747 and parameters: {'model_name': 'SimpleImputer', 'strategy': 'constant'}. Best is trial 9 with value: 0.34689599756520667.
running
[I 2024-10-15 09:27:57,309] Trial 17 finished with value: 0.5040131968124747 and parameters: {'model_name': 'SimpleImputer', 'strategy': 'median'}. Best is trial 9 with value: 0.34689599756520667.
running
[I 2024-10-15 09:27:57,513] Trial 26 finished with value: 0.34689599756520667 and parameters: {'model_name': 'SimpleImputer', 'strategy': 'mean'}. Best is trial 9 with value: 0.34689599756520667.
running
[I 2024-10-15 09:27:57,640] Trial 27 finished with value: 0.34689599756520667 and parameters: {'model_name': 'SimpleImputer', 'strategy': 'mean'}. Best is trial 9 with value: 0.34689599756520667.
[I 2024-10-15 09:27:57,742] Trial 22 finished with value: 0.5040131968124747 and parameters: {'model_name': 'SimpleImputer', 'strategy': 'median'}. Best is trial 9 with value: 0.34689599756520667.
running
running
[I 2024-10-15 09:27:57,861] Trial 21 finished with value: 0.5040131968124747 and parameters: {'model_name': 'SimpleImputer', 'strategy': 'most_frequent'}. Best is trial 9 with value: 0.34689599756520667.
[I 2024-10-15 09:27:57,963] Trial 28 finished with value: 0.34689599756520667 and parameters: {'model_name': 'SimpleImputer', 'strategy': 'mean'}. Best is trial 9 with value: 0.34689599756520667.
running
running
[I 2024-10-15 09:27:58,149] Trial 29 finished with value: 0.34689599756520667 and parameters: {'model_name': 'SimpleImputer', 'strategy': 'mean'}. Best is trial 9 with value: 0.34689599756520667.
[I 2024-10-15 09:27:58,246] Trial 32 finished with value: 0.34689599756520667 and parameters: {'model_name': 'SimpleImputer', 'strategy': 'mean'}. Best is trial 9 with value: 0.34689599756520667.
running
running
[I 2024-10-15 09:27:58,357] Trial 24 finished with value: 0.5040131968124747 and parameters: {'model_name': 'SimpleImputer', 'strategy': 'median'}. Best is trial 9 with value: 0.34689599756520667.
[I 2024-10-15 09:27:58,458] Trial 20 finished with value: 0.5040131968124747 and parameters: {'model_name': 'SimpleImputer', 'strategy': 'most_frequent'}. Best is trial 9 with value: 0.34689599756520667.
running
running
[I 2024-10-15 09:27:58,645] Trial 30 finished with value: 0.34689599756520667 and parameters: {'model_name': 'SimpleImputer', 'strategy': 'mean'}. Best is trial 9 with value: 0.34689599756520667.
[I 2024-10-15 09:27:58,744] Trial 31 finished with value: 0.34689599756520667 and parameters: {'model_name': 'SimpleImputer', 'strategy': 'mean'}. Best is trial 9 with value: 0.34689599756520667.
running
running
[I 2024-10-15 09:27:58,842] Trial 33 finished with value: 0.34689599756520667 and parameters: {'model_name': 'SimpleImputer', 'strategy': 'mean'}. Best is trial 9 with value: 0.34689599756520667.
running
[I 2024-10-15 09:27:59,004] Trial 25 finished with value: 0.5040131968124747 and parameters: {'model_name': 'SimpleImputer', 'strategy': 'median'}. Best is trial 9 with value: 0.34689599756520667.
running
[I 2024-10-15 09:27:59,132] Trial 34 finished with value: 0.34689599756520667 and parameters: {'model_name': 'SimpleImputer', 'strategy': 'mean'}. Best is trial 9 with value: 0.34689599756520667.
running
[I 2024-10-15 09:27:59,262] Trial 36 finished with value: 0.34689599756520667 and parameters: {'model_name': 'SimpleImputer', 'strategy': 'mean'}. Best is trial 9 with value: 0.34689599756520667.
running
[I 2024-10-15 09:27:59,376] Trial 35 finished with value: 0.34689599756520667 and parameters: {'model_name': 'SimpleImputer', 'strategy': 'mean'}. Best is trial 9 with value: 0.34689599756520667.
running
[I 2024-10-15 09:27:59,612] Trial 38 finished with value: 0.34689599756520667 and parameters: {'model_name': 'SimpleImputer', 'strategy': 'mean'}. Best is trial 9 with value: 0.34689599756520667.
running
[I 2024-10-15 09:27:59,736] Trial 37 finished with value: 0.34689599756520667 and parameters: {'model_name': 'SimpleImputer', 'strategy': 'mean'}. Best is trial 9 with value: 0.34689599756520667.
[I 2024-10-15 09:27:59,832] Trial 41 finished with value: 0.34689599756520667 and parameters: {'model_name': 'SimpleImputer', 'strategy': 'mean'}. Best is trial 9 with value: 0.34689599756520667.
running
running
[I 2024-10-15 09:27:59,946] Trial 39 finished with value: 0.34689599756520667 and parameters: {'model_name': 'SimpleImputer', 'strategy': 'mean'}. Best is trial 9 with value: 0.34689599756520667.
running
[I 2024-10-15 09:28:00,051] Trial 40 finished with value: 0.34689599756520667 and parameters: {'model_name': 'SimpleImputer', 'strategy': 'mean'}. Best is trial 9 with value: 0.34689599756520667.
running
[I 2024-10-15 09:28:00,178] Trial 42 finished with value: 0.34689599756520667 and parameters: {'model_name': 'SimpleImputer', 'strategy': 'mean'}. Best is trial 9 with value: 0.34689599756520667.
running
[I 2024-10-15 09:28:00,361] Trial 47 finished with value: 0.34689599756520667 and parameters: {'model_name': 'SimpleImputer', 'strategy': 'mean'}. Best is trial 9 with value: 0.34689599756520667.
[I 2024-10-15 09:28:00,454] Trial 45 finished with value: 0.34689599756520667 and parameters: {'model_name': 'SimpleImputer', 'strategy': 'mean'}. Best is trial 9 with value: 0.34689599756520667.
running
running
[I 2024-10-15 09:28:00,565] Trial 43 finished with value: 0.34689599756520667 and parameters: {'model_name': 'SimpleImputer', 'strategy': 'mean'}. Best is trial 9 with value: 0.34689599756520667.
running
[I 2024-10-15 09:28:00,683] Trial 44 finished with value: 0.34689599756520667 and parameters: {'model_name': 'SimpleImputer', 'strategy': 'mean'}. Best is trial 9 with value: 0.34689599756520667.
running
[I 2024-10-15 09:28:00,888] Trial 48 finished with value: 0.34689599756520667 and parameters: {'model_name': 'SimpleImputer', 'strategy': 'mean'}. Best is trial 9 with value: 0.34689599756520667.
[I 2024-10-15 09:28:00,996] Trial 51 finished with value: 0.34689599756520667 and parameters: {'model_name': 'SimpleImputer', 'strategy': 'mean'}. Best is trial 9 with value: 0.34689599756520667.
running
running
[I 2024-10-15 09:28:01,095] Trial 52 finished with value: 0.34689599756520667 and parameters: {'model_name': 'SimpleImputer', 'strategy': 'mean'}. Best is trial 9 with value: 0.34689599756520667.
running
[I 2024-10-15 09:28:01,235] Trial 49 finished with value: 0.34689599756520667 and parameters: {'model_name': 'SimpleImputer', 'strategy': 'mean'}. Best is trial 9 with value: 0.34689599756520667.
running
[I 2024-10-15 09:28:01,364] Trial 50 finished with value: 0.34689599756520667 and parameters: {'model_name': 'SimpleImputer', 'strategy': 'mean'}. Best is trial 9 with value: 0.34689599756520667.
running
[I 2024-10-15 09:28:01,493] Trial 46 finished with value: 0.34689599756520667 and parameters: {'model_name': 'SimpleImputer', 'strategy': 'mean'}. Best is trial 9 with value: 0.34689599756520667.
running
[I 2024-10-15 09:28:01,608] Trial 53 finished with value: 0.5040131968124747 and parameters: {'model_name': 'SimpleImputer', 'strategy': 'constant'}. Best is trial 9 with value: 0.34689599756520667.
running
[I 2024-10-15 09:28:01,755] Trial 54 finished with value: 0.5040131968124747 and parameters: {'model_name': 'SimpleImputer', 'strategy': 'constant'}. Best is trial 9 with value: 0.34689599756520667.
running
[I 2024-10-15 09:28:01,891] Trial 57 finished with value: 0.5040131968124747 and parameters: {'model_name': 'SimpleImputer', 'strategy': 'constant'}. Best is trial 9 with value: 0.34689599756520667.
[I 2024-10-15 09:28:01,998] Trial 60 finished with value: 0.5040131968124747 and parameters: {'model_name': 'SimpleImputer', 'strategy': 'constant'}. Best is trial 9 with value: 0.34689599756520667.
[I 2024-10-15 09:28:02,094] Trial 55 finished with value: 0.34689599756520667 and parameters: {'model_name': 'SimpleImputer', 'strategy': 'mean'}. Best is trial 9 with value: 0.34689599756520667.
[I 2024-10-15 09:28:02,180] Trial 56 finished with value: 0.5040131968124747 and parameters: {'model_name': 'SimpleImputer', 'strategy': 'constant'}. Best is trial 9 with value: 0.34689599756520667.
running
running
running
running
[I 2024-10-15 09:28:02,309] Trial 59 finished with value: 0.5040131968124747 and parameters: {'model_name': 'SimpleImputer', 'strategy': 'constant'}. Best is trial 9 with value: 0.34689599756520667.
running
[I 2024-10-15 09:28:02,475] Trial 62 finished with value: 0.5040131968124747 and parameters: {'model_name': 'SimpleImputer', 'strategy': 'constant'}. Best is trial 9 with value: 0.34689599756520667.
running
[I 2024-10-15 09:28:02,595] Trial 58 finished with value: 0.5040131968124747 and parameters: {'model_name': 'SimpleImputer', 'strategy': 'constant'}. Best is trial 9 with value: 0.34689599756520667.
running
[I 2024-10-15 09:28:02,758] Trial 61 finished with value: 0.5040131968124747 and parameters: {'model_name': 'SimpleImputer', 'strategy': 'constant'}. Best is trial 9 with value: 0.34689599756520667.
running
[I 2024-10-15 09:28:02,874] Trial 63 finished with value: 0.5040131968124747 and parameters: {'model_name': 'SimpleImputer', 'strategy': 'constant'}. Best is trial 9 with value: 0.34689599756520667.
running
[I 2024-10-15 09:28:03,021] Trial 64 finished with value: 0.5040131968124747 and parameters: {'model_name': 'SimpleImputer', 'strategy': 'constant'}. Best is trial 9 with value: 0.34689599756520667.
running
[I 2024-10-15 09:28:03,238] Trial 65 finished with value: 0.5040131968124747 and parameters: {'model_name': 'SimpleImputer', 'strategy': 'constant'}. Best is trial 9 with value: 0.34689599756520667.
running
[I 2024-10-15 09:28:03,363] Trial 67 finished with value: 0.5040131968124747 and parameters: {'model_name': 'SimpleImputer', 'strategy': 'constant'}. Best is trial 9 with value: 0.34689599756520667.
[I 2024-10-15 09:28:03,466] Trial 66 finished with value: 0.5040131968124747 and parameters: {'model_name': 'SimpleImputer', 'strategy': 'constant'}. Best is trial 9 with value: 0.34689599756520667.
running
running
[I 2024-10-15 09:28:03,580] Trial 69 finished with value: 0.5040131968124747 and parameters: {'model_name': 'SimpleImputer', 'strategy': 'constant'}. Best is trial 9 with value: 0.34689599756520667.
running
[I 2024-10-15 09:28:03,735] Trial 68 finished with value: 0.5040131968124747 and parameters: {'model_name': 'SimpleImputer', 'strategy': 'constant'}. Best is trial 9 with value: 0.34689599756520667.
running
[I 2024-10-15 09:28:04,124] Trial 71 finished with value: 0.34689599756520667 and parameters: {'model_name': 'SimpleImputer', 'strategy': 'mean'}. Best is trial 9 with value: 0.34689599756520667.
running
[I 2024-10-15 09:28:04,702] Trial 76 finished with value: 0.5040131968124747 and parameters: {'model_name': 'SimpleImputer', 'strategy': 'most_frequent'}. Best is trial 9 with value: 0.34689599756520667.
running
[I 2024-10-15 09:28:04,829] Trial 73 finished with value: 0.5040131968124747 and parameters: {'model_name': 'SimpleImputer', 'strategy': 'most_frequent'}. Best is trial 9 with value: 0.34689599756520667.
running
[I 2024-10-15 09:28:05,013] Trial 72 finished with value: 0.5040131968124747 and parameters: {'model_name': 'SimpleImputer', 'strategy': 'most_frequent'}. Best is trial 9 with value: 0.34689599756520667.
running
[I 2024-10-15 09:28:05,150] Trial 70 finished with value: 0.5040131968124747 and parameters: {'model_name': 'SimpleImputer', 'strategy': 'most_frequent'}. Best is trial 9 with value: 0.34689599756520667.
running
[I 2024-10-15 09:28:05,261] Trial 77 finished with value: 0.5040131968124747 and parameters: {'model_name': 'SimpleImputer', 'strategy': 'most_frequent'}. Best is trial 9 with value: 0.34689599756520667.
[I 2024-10-15 09:28:05,355] Trial 78 finished with value: 0.5040131968124747 and parameters: {'model_name': 'SimpleImputer', 'strategy': 'most_frequent'}. Best is trial 9 with value: 0.34689599756520667.
running
running
[I 2024-10-15 09:28:05,613] Trial 85 finished with value: 0.5040131968124747 and parameters: {'model_name': 'SimpleImputer', 'strategy': 'median'}. Best is trial 9 with value: 0.34689599756520667.
running
[I 2024-10-15 09:28:05,755] Trial 74 finished with value: 0.5040131968124747 and parameters: {'model_name': 'SimpleImputer', 'strategy': 'most_frequent'}. Best is trial 9 with value: 0.34689599756520667.
[I 2024-10-15 09:28:05,848] Trial 80 finished with value: 0.5040131968124747 and parameters: {'model_name': 'SimpleImputer', 'strategy': 'most_frequent'}. Best is trial 9 with value: 0.34689599756520667.
running
running
[I 2024-10-15 09:28:06,027] Trial 81 finished with value: 0.5040131968124747 and parameters: {'model_name': 'SimpleImputer', 'strategy': 'most_frequent'}. Best is trial 9 with value: 0.34689599756520667.
[I 2024-10-15 09:28:06,127] Trial 79 finished with value: 0.5040131968124747 and parameters: {'model_name': 'SimpleImputer', 'strategy': 'most_frequent'}. Best is trial 9 with value: 0.34689599756520667.
running
running
[I 2024-10-15 09:28:06,240] Trial 75 finished with value: 0.5040131968124747 and parameters: {'model_name': 'SimpleImputer', 'strategy': 'most_frequent'}. Best is trial 9 with value: 0.34689599756520667.
[I 2024-10-15 09:28:06,348] Trial 84 finished with value: 0.5040131968124747 and parameters: {'model_name': 'SimpleImputer', 'strategy': 'most_frequent'}. Best is trial 9 with value: 0.34689599756520667.
running
running
[I 2024-10-15 09:28:06,573] Trial 82 finished with value: 0.5040131968124747 and parameters: {'model_name': 'SimpleImputer', 'strategy': 'most_frequent'}. Best is trial 9 with value: 0.34689599756520667.
running
[I 2024-10-15 09:28:06,692] Trial 87 finished with value: 0.34689599756520667 and parameters: {'model_name': 'SimpleImputer', 'strategy': 'mean'}. Best is trial 9 with value: 0.34689599756520667.
[I 2024-10-15 09:28:06,788] Trial 83 finished with value: 0.5040131968124747 and parameters: {'model_name': 'SimpleImputer', 'strategy': 'most_frequent'}. Best is trial 9 with value: 0.34689599756520667.
running
running
[I 2024-10-15 09:28:06,935] Trial 88 finished with value: 0.34689599756520667 and parameters: {'model_name': 'SimpleImputer', 'strategy': 'mean'}. Best is trial 9 with value: 0.34689599756520667.
running
[I 2024-10-15 09:28:07,061] Trial 86 finished with value: 0.5040131968124747 and parameters: {'model_name': 'SimpleImputer', 'strategy': 'most_frequent'}. Best is trial 9 with value: 0.34689599756520667.
running
[I 2024-10-15 09:28:07,202] Trial 92 finished with value: 0.34689599756520667 and parameters: {'model_name': 'SimpleImputer', 'strategy': 'mean'}. Best is trial 9 with value: 0.34689599756520667.
[I 2024-10-15 09:28:07,305] Trial 89 finished with value: 0.34689599756520667 and parameters: {'model_name': 'SimpleImputer', 'strategy': 'mean'}. Best is trial 9 with value: 0.34689599756520667.
running
running
[I 2024-10-15 09:28:07,415] Trial 90 finished with value: 0.34689599756520667 and parameters: {'model_name': 'SimpleImputer', 'strategy': 'mean'}. Best is trial 9 with value: 0.34689599756520667.
[I 2024-10-15 09:28:07,511] Trial 91 finished with value: 0.34689599756520667 and parameters: {'model_name': 'SimpleImputer', 'strategy': 'mean'}. Best is trial 9 with value: 0.34689599756520667.
running
running
[I 2024-10-15 09:28:07,736] Trial 93 finished with value: 0.34689599756520667 and parameters: {'model_name': 'SimpleImputer', 'strategy': 'mean'}. Best is trial 9 with value: 0.34689599756520667.
running
[I 2024-10-15 09:28:07,904] Trial 96 finished with value: 0.34689599756520667 and parameters: {'model_name': 'SimpleImputer', 'strategy': 'mean'}. Best is trial 9 with value: 0.34689599756520667.
[I 2024-10-15 09:28:07,999] Trial 94 finished with value: 0.34689599756520667 and parameters: {'model_name': 'SimpleImputer', 'strategy': 'mean'}. Best is trial 9 with value: 0.34689599756520667.
running
running
[I 2024-10-15 09:28:08,111] Trial 98 finished with value: 0.34689599756520667 and parameters: {'model_name': 'SimpleImputer', 'strategy': 'mean'}. Best is trial 9 with value: 0.34689599756520667.
[I 2024-10-15 09:28:08,220] Trial 95 finished with value: 0.34689599756520667 and parameters: {'model_name': 'SimpleImputer', 'strategy': 'mean'}. Best is trial 9 with value: 0.34689599756520667.
running
running
[I 2024-10-15 09:28:08,378] Trial 99 finished with value: 0.34689599756520667 and parameters: {'model_name': 'SimpleImputer', 'strategy': 'mean'}. Best is trial 9 with value: 0.34689599756520667.
running
[I 2024-10-15 09:28:08,503] Trial 100 finished with value: 0.34689599756520667 and parameters: {'model_name': 'SimpleImputer', 'strategy': 'mean'}. Best is trial 9 with value: 0.34689599756520667.
[I 2024-10-15 09:28:08,598] Trial 97 finished with value: 0.34689599756520667 and parameters: {'model_name': 'SimpleImputer', 'strategy': 'mean'}. Best is trial 9 with value: 0.34689599756520667.
running
running
[I 2024-10-15 09:28:08,798] Trial 102 finished with value: 0.34689599756520667 and parameters: {'model_name': 'SimpleImputer', 'strategy': 'mean'}. Best is trial 9 with value: 0.34689599756520667.
running
[I 2024-10-15 09:28:08,895] Trial 101 finished with value: 0.34689599756520667 and parameters: {'model_name': 'SimpleImputer', 'strategy': 'mean'}. Best is trial 9 with value: 0.34689599756520667.
running
