[I 2024-11-21 20:34:52,291] Trial 54 finished with value: 0.07519102523057097 and parameters: {'model_name': 'VAE', 'batch_size': 25, 'iterations': 9044, 'learning_rate': 0.011826173109173404, 'p_miss': 0.15964119095606993}. Best is trial 129 with value: 0.05187520716833951.
fit
auto fit
auto transform
0    0
1    0
2    0
3    0
4    0
dtype: int64
0    0
1    0
2    0
3    0
4    0
dtype: int64
0.05187520716833951
{'model_name': 'IterativeImputer', 'estimator': 'RFR', 'initial_strategy': 'mean', 'n_nearest_features': 4, 'imputation_order': 'arabic'}
running experiment 2/3 - Does reconstruction give good automl predictions
Start est fit
Version 0.1.7a0 of tpot2 is outdated. Version 0.1.8a0 was released Tuesday September 17, 2024.
Version 0.1.7a0 of tpot2 is outdated. Version 0.1.8a0 was released Tuesday September 17, 2024.
Version 0.1.7a0 of tpot2 is outdated. Version 0.1.8a0 was released Tuesday September 17, 2024.
Version 0.1.7a0 of tpot2 is outdated. Version 0.1.8a0 was released Tuesday September 17, 2024.
Version 0.1.7a0 of tpot2 is outdated. Version 0.1.8a0 was released Tuesday September 17, 2024.
Version 0.1.7a0 of tpot2 is outdated. Version 0.1.8a0 was released Tuesday September 17, 2024.
Version 0.1.7a0 of tpot2 is outdated. Version 0.1.8a0 was released Tuesday September 17, 2024.
Version 0.1.7a0 of tpot2 is outdated. Version 0.1.8a0 was released Tuesday September 17, 2024.
Version 0.1.7a0 of tpot2 is outdated. Version 0.1.8a0 was released Tuesday September 17, 2024.
Version 0.1.7a0 of tpot2 is outdated. Version 0.1.8a0 was released Tuesday September 17, 2024.
Version 0.1.7a0 of tpot2 is outdated. Version 0.1.8a0 was released Tuesday September 17, 2024.
Version 0.1.7a0 of tpot2 is outdated. Version 0.1.8a0 was released Tuesday September 17, 2024.
Version 0.1.7a0 of tpot2 is outdated. Version 0.1.8a0 was released Tuesday September 17, 2024.
Version 0.1.7a0 of tpot2 is outdated. Version 0.1.8a0 was released Tuesday September 17, 2024.
Version 0.1.7a0 of tpot2 is outdated. Version 0.1.8a0 was released Tuesday September 17, 2024.
Version 0.1.7a0 of tpot2 is outdated. Version 0.1.8a0 was released Tuesday September 17, 2024.
  0%|          | 0/25 [00:00<?, ?it/s]Generation:   0%|          | 0/25 [00:00<?, ?it/s]WARNING THIS INDIVIDUAL CAUSED AND EXCEPTION 
 <tpot2.search_spaces.pipelines.sequential.SequentialPipelineIndividual object at 0x15547469c310> 
 The 'min_samples_split' parameter of DecisionTreeClassifier must be an int in the range [2, inf) or a float in the range (0.0, 1.0]. Got 1 instead. 
 Traceback (most recent call last):
  File "/common/ketrong/tpotexp/tpot2/tpot2/utils/eval_utils.py", line 53, in objective_nan_wrapper
    value = func_timeout.func_timeout(timeout, objective_function, args=[individual], kwargs=objective_kwargs)
  File "/common/ketrong/tpotexp/env/lib/python3.10/site-packages/func_timeout/dafunc.py", line 108, in func_timeout
    raise_exception(exception)
  File "/common/ketrong/tpotexp/env/lib/python3.10/site-packages/func_timeout/py3_raise.py", line 7, in raise_exception
    raise exception[0] from None
  File "/common/ketrong/tpotexp/tpot2/tpot2/tpot_estimator/estimator.py", line 623, in objective_function
    return objective_function_generator(
  File "/common/ketrong/tpotexp/tpot2/tpot2/tpot_estimator/estimator_utils.py", line 55, in objective_function_generator
    cv_obj_scores = cross_val_score_objective(sklearn.base.clone(pipeline),x,y,scorers=scorers, cv=cv , fold=step)
  File "/common/ketrong/tpotexp/tpot2/tpot2/tpot_estimator/cross_val_utils.py", line 28, in cross_val_score_objective
    this_fold_pipeline.fit(X_train,y_train)
  File "/common/ketrong/tpotexp/env/lib/python3.10/site-packages/sklearn/base.py", line 1473, in wrapper
    return fit_method(estimator, *args, **kwargs)
  File "/common/ketrong/tpotexp/env/lib/python3.10/site-packages/sklearn/pipeline.py", line 473, in fit
    self._final_estimator.fit(Xt, y, **last_step_params["fit"])
  File "/common/ketrong/tpotexp/env/lib/python3.10/site-packages/sklearn/base.py", line 1466, in wrapper
    estimator._validate_params()
  File "/common/ketrong/tpotexp/env/lib/python3.10/site-packages/sklearn/base.py", line 666, in _validate_params
    validate_parameter_constraints(
  File "/common/ketrong/tpotexp/env/lib/python3.10/site-packages/sklearn/utils/_param_validation.py", line 95, in validate_parameter_constraints
    raise InvalidParameterError(
sklearn.utils._param_validation.InvalidParameterError: The 'min_samples_split' parameter of DecisionTreeClassifier must be an int in the range [2, inf) or a float in the range (0.0, 1.0]. Got 1 instead.

Generation:  1
Best f1_score score: 0.9112166941951818
Generation:   4%|▍         | 1/25 [00:09<03:40,  9.19s/it]Generation:  2
Best f1_score score: 0.9234657615779278
Generation:   8%|▊         | 2/25 [00:21<04:15, 11.11s/it]Generation:  3
Best f1_score score: 0.9234657615779278
Generation:  12%|█▏        | 3/25 [00:35<04:29, 12.23s/it]Generation:  4
Best f1_score score: 0.9247680828810511
Generation:  16%|█▌        | 4/25 [00:48<04:28, 12.79s/it]Generation:  5
Best f1_score score: 0.9312974359384821
Generation:  20%|██        | 5/25 [01:03<04:27, 13.36s/it]Generation:  6
Best f1_score score: 0.9312974359384821
Generation:  24%|██▍       | 6/25 [01:14<03:59, 12.58s/it]Generation:  7
Best f1_score score: 0.9312974359384821
Generation:  28%|██▊       | 7/25 [01:28<03:53, 12.98s/it]Generation:  8
Best f1_score score: 0.9312974359384821
Generation:  32%|███▏      | 8/25 [01:40<03:38, 12.85s/it]Generation:  9
Best f1_score score: 0.9312974359384821
Generation:  36%|███▌      | 9/25 [01:50<03:10, 11.92s/it]Generation:  10
Best f1_score score: 0.9312974359384821
Generation:  40%|████      | 10/25 [04:55<16:19, 65.32s/it]Generation:  11
Best f1_score score: 0.9312974359384821
Generation:  44%|████▍     | 11/25 [05:07<11:25, 48.96s/it]WARNING THIS INDIVIDUAL CAUSED AND EXCEPTION 
 <tpot2.search_spaces.pipelines.sequential.SequentialPipelineIndividual object at 0x155467fef7c0> 
 The 'min_samples_split' parameter of DecisionTreeClassifier must be an int in the range [2, inf) or a float in the range (0.0, 1.0]. Got 1 instead. 
 Traceback (most recent call last):
  File "/common/ketrong/tpotexp/tpot2/tpot2/utils/eval_utils.py", line 53, in objective_nan_wrapper
    value = func_timeout.func_timeout(timeout, objective_function, args=[individual], kwargs=objective_kwargs)
  File "/common/ketrong/tpotexp/env/lib/python3.10/site-packages/func_timeout/dafunc.py", line 108, in func_timeout
    raise_exception(exception)
  File "/common/ketrong/tpotexp/env/lib/python3.10/site-packages/func_timeout/py3_raise.py", line 7, in raise_exception
    raise exception[0] from None
  File "/common/ketrong/tpotexp/tpot2/tpot2/tpot_estimator/estimator.py", line 623, in objective_function
    return objective_function_generator(
  File "/common/ketrong/tpotexp/tpot2/tpot2/tpot_estimator/estimator_utils.py", line 55, in objective_function_generator
    cv_obj_scores = cross_val_score_objective(sklearn.base.clone(pipeline),x,y,scorers=scorers, cv=cv , fold=step)
  File "/common/ketrong/tpotexp/tpot2/tpot2/tpot_estimator/cross_val_utils.py", line 28, in cross_val_score_objective
    this_fold_pipeline.fit(X_train,y_train)
  File "/common/ketrong/tpotexp/env/lib/python3.10/site-packages/sklearn/base.py", line 1473, in wrapper
    return fit_method(estimator, *args, **kwargs)
  File "/common/ketrong/tpotexp/env/lib/python3.10/site-packages/sklearn/pipeline.py", line 473, in fit
    self._final_estimator.fit(Xt, y, **last_step_params["fit"])
  File "/common/ketrong/tpotexp/env/lib/python3.10/site-packages/sklearn/base.py", line 1466, in wrapper
    estimator._validate_params()
  File "/common/ketrong/tpotexp/env/lib/python3.10/site-packages/sklearn/base.py", line 666, in _validate_params
    validate_parameter_constraints(
  File "/common/ketrong/tpotexp/env/lib/python3.10/site-packages/sklearn/utils/_param_validation.py", line 95, in validate_parameter_constraints
    raise InvalidParameterError(
sklearn.utils._param_validation.InvalidParameterError: The 'min_samples_split' parameter of DecisionTreeClassifier must be an int in the range [2, inf) or a float in the range (0.0, 1.0]. Got 1 instead.

Generation:  12
Best f1_score score: 0.9312974359384821
Generation:  48%|████▊     | 12/25 [05:18<08:06, 37.42s/it]Generation:  13
Best f1_score score: 0.9312974359384821
Generation:  52%|█████▏    | 13/25 [05:36<06:19, 31.59s/it]Generation:  14
Best f1_score score: 0.9312974359384821
Generation:  56%|█████▌    | 14/25 [05:48<04:42, 25.66s/it]Generation:  15
Best f1_score score: 0.9312974359384821
Generation:  60%|██████    | 15/25 [05:58<03:30, 21.08s/it]Generation:  16
Best f1_score score: 0.9312974359384821
Generation:  64%|██████▍   | 16/25 [06:19<03:07, 20.81s/it]Generation:  17
Best f1_score score: 0.9312974359384821
Generation:  68%|██████▊   | 17/25 [06:36<02:37, 19.68s/it]Generation:  18
Best f1_score score: 0.9312974359384821
Generation:  72%|███████▏  | 18/25 [10:10<09:07, 78.21s/it]Generation:  19
Best f1_score score: 0.9312974359384821
Generation:  76%|███████▌  | 19/25 [10:23<05:51, 58.58s/it]Generation:  20
Best f1_score score: 0.9312974359384821
Generation:  80%|████████  | 20/25 [10:39<03:48, 45.65s/it]Generation:  21
Best f1_score score: 0.9312974359384821
Generation:  84%|████████▍ | 21/25 [11:00<02:33, 38.35s/it]Generation:  22
Best f1_score score: 0.9312974359384821
Generation:  88%|████████▊ | 22/25 [11:17<01:36, 32.02s/it]Generation:  23
Best f1_score score: 0.9312974359384821
Generation:  92%|█████████▏| 23/25 [11:35<00:55, 27.73s/it]Generation:  24
Best f1_score score: 0.9312974359384821
Generation:  96%|█████████▌| 24/25 [12:14<00:31, 31.17s/it]Generation:  25
Best f1_score score: 0.9312974359384821
Generation: 100%|██████████| 25/25 [12:28<00:00, 26.12s/it]Generation: 100%|██████████| 25/25 [12:31<00:00, 30.08s/it]
2024-11-21 20:48:50,495 - distributed.scheduler - ERROR - Removing worker 'tcp://127.0.0.1:35069' caused the cluster to lose scattered data, which can't be recovered: {'ndarray-ebd5ec05bb0f66b412969f9be33321b3', 'ndarray-eca715ede6c70d8369f990edee4bd280'} (stimulus_id='handle-worker-cleanup-1732250930.4956632')
Fitted
Pipeline(steps=[('histgradientboostingclassifier',
                 HistGradientBoostingClassifier(early_stopping=True,
                                                l2_regularization=0.0020070679239,
                                                learning_rate=0.1868441540709,
                                                max_features=0.4256071120711,
                                                max_leaf_nodes=1142,
                                                min_samples_leaf=146,
                                                n_iter_no_change=11, tol=0.0001,
                                                validation_fraction=None))])
score start
train score: {'auroc': 0.9999934671095095, 'accuracy': 0.9992250064582795, 'balanced_accuracy': 0.992822966507177, 'logloss': 0.004240545929658174, 'f1': 0.9961808199085409}
original test score: {'auroc': 0.9835404769902586, 'accuracy': 0.981404958677686, 'balanced_accuracy': 0.881340275445079, 'logloss': 0.06851507567367332, 'f1': 0.9032666385378961}
imputed test score: {'auroc': 0.9676268055089016, 'accuracy': 0.9803719008264463, 'balanced_accuracy': 0.8717248908296944, 'logloss': 0.09225195824584616, 'f1': 0.8968960046641217}
score end
check intended
EXP2 Finished
running experiment 3/3 - What is the best automl settings?
<tpot2.search_spaces.pipelines.sequential.SequentialPipeline object at 0x155435014670>
Start tpot fit
Version 0.1.7a0 of tpot2 is outdated. Version 0.1.8a0 was released Tuesday September 17, 2024.
Version 0.1.7a0 of tpot2 is outdated. Version 0.1.8a0 was released Tuesday September 17, 2024.
Version 0.1.7a0 of tpot2 is outdated. Version 0.1.8a0 was released Tuesday September 17, 2024.
Version 0.1.7a0 of tpot2 is outdated. Version 0.1.8a0 was released Tuesday September 17, 2024.
Version 0.1.7a0 of tpot2 is outdated. Version 0.1.8a0 was released Tuesday September 17, 2024.
Version 0.1.7a0 of tpot2 is outdated. Version 0.1.8a0 was released Tuesday September 17, 2024.
Version 0.1.7a0 of tpot2 is outdated. Version 0.1.8a0 was released Tuesday September 17, 2024.
Version 0.1.7a0 of tpot2 is outdated. Version 0.1.8a0 was released Tuesday September 17, 2024.
Version 0.1.7a0 of tpot2 is outdated. Version 0.1.8a0 was released Tuesday September 17, 2024.
Version 0.1.7a0 of tpot2 is outdated. Version 0.1.8a0 was released Tuesday September 17, 2024.
Version 0.1.7a0 of tpot2 is outdated. Version 0.1.8a0 was released Tuesday September 17, 2024.
Version 0.1.7a0 of tpot2 is outdated. Version 0.1.8a0 was released Tuesday September 17, 2024.
Version 0.1.7a0 of tpot2 is outdated. Version 0.1.8a0 was released Tuesday September 17, 2024.
Version 0.1.7a0 of tpot2 is outdated. Version 0.1.8a0 was released Tuesday September 17, 2024.
Version 0.1.7a0 of tpot2 is outdated. Version 0.1.8a0 was released Tuesday September 17, 2024.
Version 0.1.7a0 of tpot2 is outdated. Version 0.1.8a0 was released Tuesday September 17, 2024.
  0%|          | 0/25 [00:00<?, ?it/s]Generation:   0%|          | 0/25 [00:00<?, ?it/s]WARNING THIS INDIVIDUAL CAUSED AND EXCEPTION 
 <tpot2.search_spaces.pipelines.sequential.SequentialPipelineIndividual object at 0x155474559240> 
 Input X contains NaN.
AdaBoostClassifier does not accept missing values encoded as NaN natively. For supervised learning, you might want to consider sklearn.ensemble.HistGradientBoostingClassifier and Regressor which accept missing values encoded as NaNs natively. Alternatively, it is possible to preprocess the data, for instance by using an imputer transformer in a pipeline or drop samples with missing values. See https://scikit-learn.org/stable/modules/impute.html You can find a list of all estimators that handle NaN values at the following page: https://scikit-learn.org/stable/modules/impute.html#estimators-that-handle-nan-values 
 Traceback (most recent call last):
  File "/common/ketrong/tpotexp/tpot2/tpot2/utils/eval_utils.py", line 53, in objective_nan_wrapper
    value = func_timeout.func_timeout(timeout, objective_function, args=[individual], kwargs=objective_kwargs)
  File "/common/ketrong/tpotexp/env/lib/python3.10/site-packages/func_timeout/dafunc.py", line 108, in func_timeout
    raise_exception(exception)
  File "/common/ketrong/tpotexp/env/lib/python3.10/site-packages/func_timeout/py3_raise.py", line 7, in raise_exception
    raise exception[0] from None
  File "/common/ketrong/tpotexp/tpot2/tpot2/tpot_estimator/estimator.py", line 623, in objective_function
    return objective_function_generator(
  File "/common/ketrong/tpotexp/tpot2/tpot2/tpot_estimator/estimator_utils.py", line 55, in objective_function_generator
    cv_obj_scores = cross_val_score_objective(sklearn.base.clone(pipeline),x,y,scorers=scorers, cv=cv , fold=step)
  File "/common/ketrong/tpotexp/tpot2/tpot2/tpot_estimator/cross_val_utils.py", line 28, in cross_val_score_objective
    this_fold_pipeline.fit(X_train,y_train)
  File "/common/ketrong/tpotexp/env/lib/python3.10/site-packages/sklearn/base.py", line 1473, in wrapper
    return fit_method(estimator, *args, **kwargs)
  File "/common/ketrong/tpotexp/env/lib/python3.10/site-packages/sklearn/pipeline.py", line 473, in fit
    self._final_estimator.fit(Xt, y, **last_step_params["fit"])
  File "/common/ketrong/tpotexp/env/lib/python3.10/site-packages/sklearn/base.py", line 1473, in wrapper
    return fit_method(estimator, *args, **kwargs)
  File "/common/ketrong/tpotexp/env/lib/python3.10/site-packages/sklearn/ensemble/_weight_boosting.py", line 133, in fit
    X, y = self._validate_data(
  File "/common/ketrong/tpotexp/env/lib/python3.10/site-packages/sklearn/base.py", line 650, in _validate_data
    X, y = check_X_y(X, y, **check_params)
  File "/common/ketrong/tpotexp/env/lib/python3.10/site-packages/sklearn/utils/validation.py", line 1301, in check_X_y
    X = check_array(
  File "/common/ketrong/tpotexp/env/lib/python3.10/site-packages/sklearn/utils/validation.py", line 1064, in check_array
    _assert_all_finite(
  File "/common/ketrong/tpotexp/env/lib/python3.10/site-packages/sklearn/utils/validation.py", line 123, in _assert_all_finite
    _assert_all_finite_element_wise(
  File "/common/ketrong/tpotexp/env/lib/python3.10/site-packages/sklearn/utils/validation.py", line 172, in _assert_all_finite_element_wise
    raise ValueError(msg_err)
ValueError: Input X contains NaN.
AdaBoostClassifier does not accept missing values encoded as NaN natively. For supervised learning, you might want to consider sklearn.ensemble.HistGradientBoostingClassifier and Regressor which accept missing values encoded as NaNs natively. Alternatively, it is possible to preprocess the data, for instance by using an imputer transformer in a pipeline or drop samples with missing values. See https://scikit-learn.org/stable/modules/impute.html You can find a list of all estimators that handle NaN values at the following page: https://scikit-learn.org/stable/modules/impute.html#estimators-that-handle-nan-values

WARNING THIS INDIVIDUAL CAUSED AND EXCEPTION 
 <tpot2.search_spaces.pipelines.sequential.SequentialPipelineIndividual object at 0x155474cd0c10> 
 Negative values in data passed to MultinomialNB (input X) 
 Traceback (most recent call last):
  File "/common/ketrong/tpotexp/tpot2/tpot2/utils/eval_utils.py", line 53, in objective_nan_wrapper
    value = func_timeout.func_timeout(timeout, objective_function, args=[individual], kwargs=objective_kwargs)
  File "/common/ketrong/tpotexp/env/lib/python3.10/site-packages/func_timeout/dafunc.py", line 108, in func_timeout
    raise_exception(exception)
  File "/common/ketrong/tpotexp/env/lib/python3.10/site-packages/func_timeout/py3_raise.py", line 7, in raise_exception
    raise exception[0] from None
  File "/common/ketrong/tpotexp/tpot2/tpot2/tpot_estimator/estimator.py", line 623, in objective_function
    return objective_function_generator(
  File "/common/ketrong/tpotexp/tpot2/tpot2/tpot_estimator/estimator_utils.py", line 55, in objective_function_generator
    cv_obj_scores = cross_val_score_objective(sklearn.base.clone(pipeline),x,y,scorers=scorers, cv=cv , fold=step)
  File "/common/ketrong/tpotexp/tpot2/tpot2/tpot_estimator/cross_val_utils.py", line 28, in cross_val_score_objective
    this_fold_pipeline.fit(X_train,y_train)
  File "/common/ketrong/tpotexp/env/lib/python3.10/site-packages/sklearn/base.py", line 1473, in wrapper
    return fit_method(estimator, *args, **kwargs)
  File "/common/ketrong/tpotexp/env/lib/python3.10/site-packages/sklearn/pipeline.py", line 473, in fit
    self._final_estimator.fit(Xt, y, **last_step_params["fit"])
  File "/common/ketrong/tpotexp/env/lib/python3.10/site-packages/sklearn/base.py", line 1473, in wrapper
    return fit_method(estimator, *args, **kwargs)
  File "/common/ketrong/tpotexp/env/lib/python3.10/site-packages/sklearn/naive_bayes.py", line 759, in fit
    self._count(X, Y)
  File "/common/ketrong/tpotexp/env/lib/python3.10/site-packages/sklearn/naive_bayes.py", line 881, in _count
    check_non_negative(X, "MultinomialNB (input X)")
  File "/common/ketrong/tpotexp/env/lib/python3.10/site-packages/sklearn/utils/validation.py", line 1689, in check_non_negative
    raise ValueError("Negative values in data passed to %s" % whom)
ValueError: Negative values in data passed to MultinomialNB (input X)

Generation:  1
Best f1_score score: 0.9029892519375202
Generation:   4%|▍         | 1/25 [05:15<2:06:18, 315.76s/it]Generation:  2
Best f1_score score: 0.9029892519375202
Generation:   8%|▊         | 2/25 [10:31<2:01:04, 315.84s/it]Generation:  3
Best f1_score score: 0.9261225540326791
Generation:  12%|█▏        | 3/25 [11:32<1:13:02, 199.22s/it]Generation:  4
Best f1_score score: 0.9261225540326791
Generation:  16%|█▌        | 4/25 [16:49<1:26:02, 245.82s/it]Generation:  5
Best f1_score score: 0.9261225540326791
Generation:  20%|██        | 5/25 [22:07<1:30:40, 272.04s/it]WARNING AN INDIVIDUAL TIMED OUT: 
 <tpot2.search_spaces.pipelines.sequential.SequentialPipelineIndividual object at 0x15545738f520> 

Generation:  6
Best f1_score score: 0.937158384598364
Generation:  24%|██▍       | 6/25 [32:14<2:02:07, 385.65s/it]Generation:  7
Best f1_score score: 0.9376258204916343
Generation:  28%|██▊       | 7/25 [37:30<1:48:52, 362.92s/it]Generation:  8
Best f1_score score: 0.9376258204916343
Generation:  32%|███▏      | 8/25 [43:33<1:42:50, 362.95s/it]Generation:  9
Best f1_score score: 0.9376258204916343
Generation:  36%|███▌      | 9/25 [49:34<1:36:40, 362.54s/it]WARNING THIS INDIVIDUAL CAUSED AND EXCEPTION 
 <tpot2.search_spaces.pipelines.sequential.SequentialPipelineIndividual object at 0x1554740ab070> 
 Input X contains NaN.
QuadraticDiscriminantAnalysis does not accept missing values encoded as NaN natively. For supervised learning, you might want to consider sklearn.ensemble.HistGradientBoostingClassifier and Regressor which accept missing values encoded as NaNs natively. Alternatively, it is possible to preprocess the data, for instance by using an imputer transformer in a pipeline or drop samples with missing values. See https://scikit-learn.org/stable/modules/impute.html You can find a list of all estimators that handle NaN values at the following page: https://scikit-learn.org/stable/modules/impute.html#estimators-that-handle-nan-values 
 Traceback (most recent call last):
  File "/common/ketrong/tpotexp/tpot2/tpot2/utils/eval_utils.py", line 53, in objective_nan_wrapper
    value = func_timeout.func_timeout(timeout, objective_function, args=[individual], kwargs=objective_kwargs)
  File "/common/ketrong/tpotexp/env/lib/python3.10/site-packages/func_timeout/dafunc.py", line 108, in func_timeout
    raise_exception(exception)
  File "/common/ketrong/tpotexp/env/lib/python3.10/site-pa