[I 2024-11-07 07:51:54,392] Trial 77 finished with value: 0.2614439862613184 and parameters: {'model_name': 'VAE', 'batch_size': 39, 'iterations': 9858, 'learning_rate': 0.0019086504396273072, 'p_miss': 0.1978615492875442}. Best is trial 142 with value: 0.2220855877448483.
running
[I 2024-11-07 07:53:06,466] Trial 148 finished with value: 0.224351710235745 and parameters: {'model_name': 'IterativeImputer', 'estimator': 'RFR', 'initial_strategy': 'constant', 'n_nearest_features': 16, 'imputation_order': 'arabic'}. Best is trial 142 with value: 0.2220855877448483.
running
[I 2024-11-07 07:54:29,426] Trial 150 finished with value: 0.22489773076505665 and parameters: {'model_name': 'IterativeImputer', 'estimator': 'RFR', 'initial_strategy': 'constant', 'n_nearest_features': 16, 'imputation_order': 'arabic'}. Best is trial 142 with value: 0.2220855877448483.
running
[I 2024-11-07 07:54:48,424] Trial 162 finished with value: 0.4454932356597512 and parameters: {'model_name': 'GAIN', 'batch_size': 8, 'hint_rate': 0.9899012277549606, 'alpha': 39, 'iterations': 106, 'learning_rate': 0.0038452319826133598, 'p_miss': 0.1334509224457091}. Best is trial 142 with value: 0.2220855877448483.
running
[I 2024-11-07 07:54:57,087] Trial 164 finished with value: 0.4758855040267658 and parameters: {'model_name': 'GAIN', 'batch_size': 9, 'hint_rate': 0.26239953149901335, 'alpha': 0, 'iterations': 103, 'learning_rate': 0.003940659439218484, 'p_miss': 0.1338572216162721}. Best is trial 142 with value: 0.2220855877448483.
running
[I 2024-11-07 07:58:06,700] Trial 166 finished with value: 0.4745283253373308 and parameters: {'model_name': 'GAIN', 'batch_size': 7, 'hint_rate': 0.9343525950642618, 'alpha': 0, 'iterations': 101, 'learning_rate': 0.005439853863500384, 'p_miss': 0.1285747431725492}. Best is trial 142 with value: 0.2220855877448483.
running
[I 2024-11-07 07:59:41,560] Trial 151 finished with value: 0.2238246007726946 and parameters: {'model_name': 'IterativeImputer', 'estimator': 'RFR', 'initial_strategy': 'constant', 'n_nearest_features': 16, 'imputation_order': 'arabic'}. Best is trial 142 with value: 0.2220855877448483.
running
[I 2024-11-07 08:05:52,082] Trial 154 finished with value: 0.4787616828761866 and parameters: {'model_name': 'GAIN', 'batch_size': 8, 'hint_rate': 0.9834854587392785, 'alpha': 1, 'iterations': 1052, 'learning_rate': 0.0058083783700209855, 'p_miss': 0.1324673546067582}. Best is trial 142 with value: 0.2220855877448483.
running
[I 2024-11-07 08:07:55,285] Trial 152 finished with value: 0.22389200295737863 and parameters: {'model_name': 'IterativeImputer', 'estimator': 'RFR', 'initial_strategy': 'constant', 'n_nearest_features': 15, 'imputation_order': 'arabic'}. Best is trial 142 with value: 0.2220855877448483.
running
[I 2024-11-07 08:10:53,575] Trial 153 finished with value: 0.246626710807613 and parameters: {'model_name': 'IterativeImputer', 'estimator': 'RFR', 'initial_strategy': 'constant', 'n_nearest_features': 6, 'imputation_order': 'arabic'}. Best is trial 142 with value: 0.2220855877448483.
running
[I 2024-11-07 08:13:21,599] Trial 81 finished with value: 0.2622716733393383 and parameters: {'model_name': 'VAE', 'batch_size': 28, 'iterations': 9246, 'learning_rate': 0.0017378161126336386, 'p_miss': 0.2008662575246323}. Best is trial 142 with value: 0.2220855877448483.
running
[I 2024-11-07 08:21:13,132] Trial 155 finished with value: 0.47953989154930265 and parameters: {'model_name': 'GAIN', 'batch_size': 7, 'hint_rate': 0.9633646908921725, 'alpha': 1, 'iterations': 1575, 'learning_rate': 0.004199507485792966, 'p_miss': 0.13290169218106934}. Best is trial 142 with value: 0.2220855877448483.
running
[I 2024-11-07 08:24:06,237] Trial 158 finished with value: 0.24547766540037141 and parameters: {'model_name': 'IterativeImputer', 'estimator': 'RFR', 'initial_strategy': 'constant', 'n_nearest_features': 4, 'imputation_order': 'arabic'}. Best is trial 142 with value: 0.2220855877448483.
running
[I 2024-11-07 08:25:40,320] Trial 156 finished with value: 0.22554064306710853 and parameters: {'model_name': 'IterativeImputer', 'estimator': 'RFR', 'initial_strategy': 'constant', 'n_nearest_features': 15, 'imputation_order': 'arabic'}. Best is trial 142 with value: 0.2220855877448483.
running
[I 2024-11-07 08:32:43,804] Trial 157 finished with value: 0.22395027322908162 and parameters: {'model_name': 'IterativeImputer', 'estimator': 'RFR', 'initial_strategy': 'constant', 'n_nearest_features': 15, 'imputation_order': 'arabic'}. Best is trial 142 with value: 0.2220855877448483.
running
[I 2024-11-07 08:32:48,187] Trial 165 finished with value: 0.4654083621043227 and parameters: {'model_name': 'GAIN', 'batch_size': 11, 'hint_rate': 0.9312649024506291, 'alpha': 38, 'iterations': 1230, 'learning_rate': 0.004533282092182589, 'p_miss': 0.1400281786308506}. Best is trial 142 with value: 0.2220855877448483.
running
[I 2024-11-07 08:33:59,197] Trial 168 finished with value: 0.24463558811322833 and parameters: {'model_name': 'IterativeImputer', 'estimator': 'RFR', 'initial_strategy': 'constant', 'n_nearest_features': 4, 'imputation_order': 'arabic'}. Best is trial 142 with value: 0.2220855877448483.
running
[I 2024-11-07 08:34:28,500] Trial 163 finished with value: 0.24992909380909345 and parameters: {'model_name': 'IterativeImputer', 'estimator': 'RFR', 'initial_strategy': 'constant', 'n_nearest_features': 6, 'imputation_order': 'arabic'}. Best is trial 142 with value: 0.2220855877448483.
running
[I 2024-11-07 08:34:50,192] Trial 159 finished with value: 0.5218223842859766 and parameters: {'model_name': 'GAIN', 'batch_size': 8, 'hint_rate': 0.9895750193935636, 'alpha': 1, 'iterations': 1663, 'learning_rate': 0.004448741274010872, 'p_miss': 0.2469229667369437}. Best is trial 142 with value: 0.2220855877448483.
running
[I 2024-11-07 08:42:10,307] Trial 160 finished with value: 0.22466273579360174 and parameters: {'model_name': 'IterativeImputer', 'estimator': 'RFR', 'initial_strategy': 'constant', 'n_nearest_features': 15, 'imputation_order': 'arabic'}. Best is trial 142 with value: 0.2220855877448483.
running
[I 2024-11-07 08:42:13,838] Trial 169 finished with value: 0.24912210958591868 and parameters: {'model_name': 'IterativeImputer', 'estimator': 'RFR', 'initial_strategy': 'constant', 'n_nearest_features': 7, 'imputation_order': 'arabic'}. Best is trial 142 with value: 0.2220855877448483.
running
[I 2024-11-07 08:42:37,692] Trial 170 finished with value: 0.24843199485168377 and parameters: {'model_name': 'IterativeImputer', 'estimator': 'RFR', 'initial_strategy': 'constant', 'n_nearest_features': 6, 'imputation_order': 'arabic'}. Best is trial 142 with value: 0.2220855877448483.
running
[I 2024-11-07 08:42:38,330] Trial 183 finished with value: 0.24166088143740364 and parameters: {'model_name': 'IterativeImputer', 'estimator': 'Ridge', 'initial_strategy': 'constant', 'n_nearest_features': 15, 'imputation_order': 'arabic'}. Best is trial 142 with value: 0.2220855877448483.
running
[I 2024-11-07 08:42:44,902] Trial 184 finished with value: 0.24166095689476097 and parameters: {'model_name': 'IterativeImputer', 'estimator': 'Ridge', 'initial_strategy': 'constant', 'n_nearest_features': 15, 'imputation_order': 'random'}. Best is trial 142 with value: 0.2220855877448483.
running
[I 2024-11-07 08:43:17,110] Trial 185 finished with value: 0.24166095689476097 and parameters: {'model_name': 'IterativeImputer', 'estimator': 'Ridge', 'initial_strategy': 'constant', 'n_nearest_features': 15, 'imputation_order': 'random'}. Best is trial 142 with value: 0.2220855877448483.
running
[I 2024-11-07 08:45:02,160] Trial 167 finished with value: 0.22524333520289813 and parameters: {'model_name': 'IterativeImputer', 'estimator': 'RFR', 'initial_strategy': 'constant', 'n_nearest_features': 15, 'imputation_order': 'arabic'}. Best is trial 142 with value: 0.2220855877448483.
running
[I 2024-11-07 08:46:24,220] Trial 171 finished with value: 0.2453529547702419 and parameters: {'model_name': 'IterativeImputer', 'estimator': 'RFR', 'initial_strategy': 'constant', 'n_nearest_features': 5, 'imputation_order': 'arabic'}. Best is trial 142 with value: 0.2220855877448483.
running
[I 2024-11-07 08:55:31,401] Trial 172 finished with value: 0.22211445901414667 and parameters: {'model_name': 'IterativeImputer', 'estimator': 'RFR', 'initial_strategy': 'constant', 'n_nearest_features': 15, 'imputation_order': 'arabic'}. Best is trial 142 with value: 0.2220855877448483.
running
[I 2024-11-07 08:59:44,440] Trial 174 finished with value: 0.22398831385469328 and parameters: {'model_name': 'IterativeImputer', 'estimator': 'RFR', 'initial_strategy': 'constant', 'n_nearest_features': 15, 'imputation_order': 'arabic'}. Best is trial 142 with value: 0.2220855877448483.
running
[I 2024-11-07 09:00:29,028] Trial 192 finished with value: 0.2677501995612328 and parameters: {'model_name': 'IterativeImputer', 'estimator': 'KNN', 'initial_strategy': 'constant', 'n_nearest_features': 16, 'imputation_order': 'arabic'}. Best is trial 142 with value: 0.2220855877448483.
running
[I 2024-11-07 09:00:31,735] Trial 173 finished with value: 0.22443260608493887 and parameters: {'model_name': 'IterativeImputer', 'estimator': 'RFR', 'initial_strategy': 'constant', 'n_nearest_features': 15, 'imputation_order': 'arabic'}. Best is trial 142 with value: 0.2220855877448483.
running
[I 2024-11-07 09:00:40,728] Trial 194 finished with value: 0.25785678167987364 and parameters: {'model_name': 'KNNImputer', 'n_neighbors': 2721, 'weights': 'uniform'}. Best is trial 142 with value: 0.2220855877448483.
running
[I 2024-11-07 09:07:44,435] Trial 175 finished with value: 0.22369926734934448 and parameters: {'model_name': 'IterativeImputer', 'estimator': 'RFR', 'initial_strategy': 'constant', 'n_nearest_features': 15, 'imputation_order': 'arabic'}. Best is trial 142 with value: 0.2220855877448483.
running
[I 2024-11-07 09:10:01,754] Trial 176 finished with value: 0.22338534135624974 and parameters: {'model_name': 'IterativeImputer', 'estimator': 'RFR', 'initial_strategy': 'constant', 'n_nearest_features': 15, 'imputation_order': 'arabic'}. Best is trial 142 with value: 0.2220855877448483.
running
[I 2024-11-07 09:10:15,528] Trial 177 finished with value: 0.2225532965539318 and parameters: {'model_name': 'IterativeImputer', 'estimator': 'RFR', 'initial_strategy': 'constant', 'n_nearest_features': 15, 'imputation_order': 'arabic'}. Best is trial 142 with value: 0.2220855877448483.
running
[I 2024-11-07 09:16:01,855] Trial 179 finished with value: 0.22665717888137915 and parameters: {'model_name': 'IterativeImputer', 'estimator': 'RFR', 'initial_strategy': 'constant', 'n_nearest_features': 15, 'imputation_order': 'arabic'}. Best is trial 142 with value: 0.2220855877448483.
running
[I 2024-11-07 09:17:24,156] Trial 178 finished with value: 0.22285211640423466 and parameters: {'model_name': 'IterativeImputer', 'estimator': 'RFR', 'initial_strategy': 'constant', 'n_nearest_features': 15, 'imputation_order': 'arabic'}. Best is trial 142 with value: 0.2220855877448483.
[I 2024-11-07 09:17:50,597] Trial 180 finished with value: 0.22342795220993134 and parameters: {'model_name': 'IterativeImputer', 'estimator': 'RFR', 'initial_strategy': 'constant', 'n_nearest_features': 15, 'imputation_order': 'arabic'}. Best is trial 142 with value: 0.2220855877448483.
[I 2024-11-07 09:18:30,691] Trial 182 finished with value: 0.22407345806970008 and parameters: {'model_name': 'IterativeImputer', 'estimator': 'RFR', 'initial_strategy': 'constant', 'n_nearest_features': 15, 'imputation_order': 'arabic'}. Best is trial 142 with value: 0.2220855877448483.
[I 2024-11-07 09:18:52,567] Trial 181 finished with value: 0.22395072036278707 and parameters: {'model_name': 'IterativeImputer', 'estimator': 'RFR', 'initial_strategy': 'constant', 'n_nearest_features': 15, 'imputation_order': 'arabic'}. Best is trial 142 with value: 0.2220855877448483.
[I 2024-11-07 09:22:28,593] Trial 186 finished with value: 0.22318077477172168 and parameters: {'model_name': 'IterativeImputer', 'estimator': 'RFR', 'initial_strategy': 'most_frequent', 'n_nearest_features': 15, 'imputation_order': 'random'}. Best is trial 142 with value: 0.2220855877448483.
[I 2024-11-07 09:22:52,837] Trial 188 finished with value: 0.2245739645655364 and parameters: {'model_name': 'IterativeImputer', 'estimator': 'RFR', 'initial_strategy': 'most_frequent', 'n_nearest_features': 16, 'imputation_order': 'arabic'}. Best is trial 142 with value: 0.2220855877448483.
[I 2024-11-07 09:22:56,848] Trial 187 finished with value: 0.22397190918572846 and parameters: {'model_name': 'IterativeImputer', 'estimator': 'RFR', 'initial_strategy': 'most_frequent', 'n_nearest_features': 16, 'imputation_order': 'arabic'}. Best is trial 142 with value: 0.2220855877448483.
[I 2024-11-07 09:22:58,438] Trial 189 finished with value: 0.22369625468551427 and parameters: {'model_name': 'IterativeImputer', 'estimator': 'RFR', 'initial_strategy': 'most_frequent', 'n_nearest_features': 16, 'imputation_order': 'arabic'}. Best is trial 142 with value: 0.2220855877448483.
[I 2024-11-07 09:23:44,455] Trial 190 finished with value: 0.22350142274839033 and parameters: {'model_name': 'IterativeImputer', 'estimator': 'RFR', 'initial_strategy': 'most_frequent', 'n_nearest_features': 16, 'imputation_order': 'arabic'}. Best is trial 142 with value: 0.2220855877448483.
[I 2024-11-07 09:26:37,472] Trial 191 finished with value: 0.22362218264314282 and parameters: {'model_name': 'IterativeImputer', 'estimator': 'RFR', 'initial_strategy': 'constant', 'n_nearest_features': 16, 'imputation_order': 'arabic'}. Best is trial 142 with value: 0.2220855877448483.
[I 2024-11-07 09:28:38,530] Trial 193 finished with value: 0.22391915995680356 and parameters: {'model_name': 'IterativeImputer', 'estimator': 'RFR', 'initial_strategy': 'constant', 'n_nearest_features': 16, 'imputation_order': 'arabic'}. Best is trial 142 with value: 0.2220855877448483.
[I 2024-11-07 09:28:57,495] Trial 195 finished with value: 0.22220973521090442 and parameters: {'model_name': 'IterativeImputer', 'estimator': 'RFR', 'initial_strategy': 'constant', 'n_nearest_features': 16, 'imputation_order': 'arabic'}. Best is trial 142 with value: 0.2220855877448483.
[I 2024-11-07 09:31:03,274] Trial 196 finished with value: 0.22441222843340217 and parameters: {'model_name': 'IterativeImputer', 'estimator': 'RFR', 'initial_strategy': 'most_frequent', 'n_nearest_features': 16, 'imputation_order': 'arabic'}. Best is trial 142 with value: 0.2220855877448483.
[I 2024-11-07 09:31:45,130] Trial 198 finished with value: 0.22431629284271812 and parameters: {'model_name': 'IterativeImputer', 'estimator': 'RFR', 'initial_strategy': 'constant', 'n_nearest_features': 16, 'imputation_order': 'arabic'}. Best is trial 142 with value: 0.2220855877448483.
[I 2024-11-07 09:31:55,164] Trial 197 finished with value: 0.2231314405403698 and parameters: {'model_name': 'IterativeImputer', 'estimator': 'RFR', 'initial_strategy': 'constant', 'n_nearest_features': 16, 'imputation_order': 'arabic'}. Best is trial 142 with value: 0.2220855877448483.
