Run: 3
/cm/local/apps/slurm/var/spool/job979724/slurm_script: line 26: 
pip install -e tpot2
pip install -r tpot2/ImputerExperiments/requirements_.txt
: No such file or directory
RunStart
Version 0.1.7a0 of tpot2 is outdated. Version 0.1.8a0 was released Tuesday September 17, 2024.
starting loops
../data/r/1199/1199.pkl
working on 
../data/r/1199/reg_full_MCAR_0.3_1
1.4075801372528076
running experiment 1/3 - Does large hyperparameter space improve reconstruction accuracy over simple
[I 2024-09-30 15:12:21,115] A new study created in memory with name: no-name-9142a7bb-3a5f-4bc8-aff4-c38e2e15f8f5
running
running
running
running
running
running
running
running
running
running
running
running
running
running
running
running
[I 2024-09-30 15:12:21,514] Trial 15 finished with value: 0.37277237724555967 and parameters: {'model_name': 'SimpleImputer', 'strategy': 'constant'}. Best is trial 15 with value: 0.37277237724555967.
running
[I 2024-09-30 15:12:21,686] Trial 10 finished with value: 0.37277237724555967 and parameters: {'model_name': 'SimpleImputer', 'strategy': 'constant'}. Best is trial 15 with value: 0.37277237724555967.
running
[I 2024-09-30 15:12:22,964] Trial 16 finished with value: 0.2488890344613197 and parameters: {'model_name': 'SimpleImputer', 'strategy': 'mean'}. Best is trial 16 with value: 0.2488890344613197.
running
[I 2024-09-30 15:12:23,396] Trial 1 finished with value: 0.37277237724555967 and parameters: {'model_name': 'SimpleImputer', 'strategy': 'most_frequent'}. Best is trial 16 with value: 0.2488890344613197.
running
[I 2024-09-30 15:12:23,602] Trial 18 finished with value: 0.37277237724555967 and parameters: {'model_name': 'SimpleImputer', 'strategy': 'constant'}. Best is trial 16 with value: 0.2488890344613197.
running
[I 2024-09-30 15:12:24,313] Trial 19 finished with value: 0.37277237724555967 and parameters: {'model_name': 'SimpleImputer', 'strategy': 'most_frequent'}. Best is trial 16 with value: 0.2488890344613197.
running
[I 2024-09-30 15:12:30,337] Trial 14 finished with value: 0.24043579418128616 and parameters: {'model_name': 'IterativeImputer', 'estimator': 'Ridge', 'initial_strategy': 'most_frequent', 'n_nearest_features': 1, 'imputation_order': 'descending'}. Best is trial 14 with value: 0.24043579418128616.
running
[I 2024-09-30 15:12:30,668] Trial 22 finished with value: 0.2488890344613197 and parameters: {'model_name': 'SimpleImputer', 'strategy': 'mean'}. Best is trial 14 with value: 0.24043579418128616.
running
[I 2024-09-30 15:12:31,927] Trial 6 finished with value: 0.23492534545647628 and parameters: {'model_name': 'IterativeImputer', 'estimator': 'Ridge', 'initial_strategy': 'median', 'n_nearest_features': 2, 'imputation_order': 'random'}. Best is trial 6 with value: 0.23492534545647628.
running
[I 2024-09-30 15:12:32,545] Trial 20 finished with value: 0.23706974269096662 and parameters: {'model_name': 'IterativeImputer', 'estimator': 'Ridge', 'initial_strategy': 'most_frequent', 'n_nearest_features': 3, 'imputation_order': 'roman'}. Best is trial 6 with value: 0.23492534545647628.
running
[I 2024-09-30 15:12:33,186] Trial 13 finished with value: 0.2488890344613197 and parameters: {'model_name': 'KNNImputer', 'n_neighbors': 12907, 'weights': 'uniform'}. Best is trial 6 with value: 0.23492534545647628.
running
[I 2024-09-30 15:12:36,389] Trial 5 finished with value: 0.24918300751469177 and parameters: {'model_name': 'KNNImputer', 'n_neighbors': 9377, 'weights': 'uniform'}. Best is trial 6 with value: 0.23492534545647628.
[I 2024-09-30 15:12:36,533] Trial 4 finished with value: 0.2547714885064874 and parameters: {'model_name': 'KNNImputer', 'n_neighbors': 13084, 'weights': 'distance'}. Best is trial 6 with value: 0.23492534545647628.
running
running
[I 2024-09-30 15:12:38,232] Trial 17 finished with value: 0.2350513856182362 and parameters: {'model_name': 'IterativeImputer', 'estimator': 'Bayesian', 'initial_strategy': 'mean', 'n_nearest_features': 3, 'imputation_order': 'random', 'sample_posterior': False}. Best is trial 6 with value: 0.23492534545647628.
running
[I 2024-09-30 15:12:38,872] Trial 26 finished with value: 0.23448927322063734 and parameters: {'model_name': 'IterativeImputer', 'estimator': 'Ridge', 'initial_strategy': 'median', 'n_nearest_features': 3, 'imputation_order': 'roman'}. Best is trial 26 with value: 0.23448927322063734.
running
[I 2024-09-30 15:12:40,993] Trial 28 finished with value: 0.23448927322063734 and parameters: {'model_name': 'IterativeImputer', 'estimator': 'Ridge', 'initial_strategy': 'median', 'n_nearest_features': 3, 'imputation_order': 'roman'}. Best is trial 26 with value: 0.23448927322063734.
running
[I 2024-09-30 15:12:41,158] Trial 27 finished with value: 0.23448927322063734 and parameters: {'model_name': 'IterativeImputer', 'estimator': 'Ridge', 'initial_strategy': 'median', 'n_nearest_features': 3, 'imputation_order': 'roman'}. Best is trial 26 with value: 0.23448927322063734.
running
[I 2024-09-30 15:12:42,568] Trial 24 finished with value: 0.3274374840106633 and parameters: {'model_name': 'IterativeImputer', 'estimator': 'Bayesian', 'initial_strategy': 'constant', 'n_nearest_features': 4, 'imputation_order': 'roman', 'sample_posterior': True}. Best is trial 26 with value: 0.23448927322063734.
running
[I 2024-09-30 15:12:48,022] Trial 9 finished with value: 0.25864017587148813 and parameters: {'model_name': 'IterativeImputer', 'estimator': 'KNN', 'initial_strategy': 'constant', 'n_nearest_features': 1, 'imputation_order': 'random'}. Best is trial 26 with value: 0.23448927322063734.
running
[I 2024-09-30 15:12:51,161] Trial 7 finished with value: 0.254718344907391 and parameters: {'model_name': 'IterativeImputer', 'estimator': 'KNN', 'initial_strategy': 'mean', 'n_nearest_features': 9, 'imputation_order': 'roman'}. Best is trial 26 with value: 0.23448927322063734.
running
[I 2024-09-30 15:13:59,695] Trial 3 finished with value: inf and parameters: {'model_name': 'GAIN', 'batch_size': 5, 'hint_rate': 0.35618037767054017, 'alpha': 50, 'iterations': 1, 'learning_rate': 0.034611992035101895, 'p_miss': 0.017894200836336867}. Best is trial 26 with value: 0.23448927322063734.
running
[I 2024-09-30 15:14:00,087] Trial 21 finished with value: 0.3644898181839237 and parameters: {'model_name': 'GAIN', 'batch_size': 21, 'hint_rate': 0.1637789878380649, 'alpha': 66, 'iterations': 1, 'learning_rate': 0.0840476079821708, 'p_miss': 0.18118274374071178}. Best is trial 26 with value: 0.23448927322063734.
running
[I 2024-09-30 15:14:00,235] Trial 32 finished with value: inf and parameters: {'model_name': 'GAIN', 'batch_size': 1, 'hint_rate': 0.18295495916380705, 'alpha': 64, 'iterations': 1, 'learning_rate': 0.0007464038955993115, 'p_miss': 0.1384383716250364}. Best is trial 26 with value: 0.23448927322063734.
running
[I 2024-09-30 15:14:00,388] Trial 31 finished with value: inf and parameters: {'model_name': 'GAIN', 'batch_size': 1, 'hint_rate': 0.8089831098277103, 'alpha': 33, 'iterations': 18, 'learning_rate': 0.0804250071666779, 'p_miss': 0.19384904455246998}. Best is trial 26 with value: 0.23448927322063734.
running
[I 2024-09-30 15:14:00,648] Trial 34 finished with value: 0.35938785246082555 and parameters: {'model_name': 'GAIN', 'batch_size': 43, 'hint_rate': 0.03380618035342858, 'alpha': 47, 'iterations': 2, 'learning_rate': 0.002932775871478098, 'p_miss': 0.195733348321236}. Best is trial 26 with value: 0.23448927322063734.
running
[I 2024-09-30 15:14:02,483] Trial 30 finished with value: 0.26885797038884124 and parameters: {'model_name': 'VAE', 'batch_size': 526, 'iterations': 1, 'learning_rate': 0.04194301812750495, 'p_miss': 0.055722099852034856}. Best is trial 26 with value: 0.23448927322063734.
running
[I 2024-09-30 15:14:02,669] Trial 23 finished with value: 0.3682081909838692 and parameters: {'model_name': 'GAIN', 'batch_size': 27, 'hint_rate': 0.33808172782157847, 'alpha': 19, 'iterations': 9, 'learning_rate': 0.004080265065474529, 'p_miss': 0.12383195456473998}. Best is trial 26 with value: 0.23448927322063734.
running
[I 2024-09-30 15:14:02,809] Trial 2 finished with value: inf and parameters: {'model_name': 'GAIN', 'batch_size': 1, 'hint_rate': 0.6034105778836717, 'alpha': 9, 'iterations': 57, 'learning_rate': 0.030312829525894834, 'p_miss': 0.16098317460940012}. Best is trial 26 with value: 0.23448927322063734.
running
[I 2024-09-30 15:14:04,419] Trial 33 finished with value: 0.28333399060891323 and parameters: {'model_name': 'VAE', 'batch_size': 171, 'iterations': 3, 'learning_rate': 0.0011029162634965497, 'p_miss': 0.06939541284326509}. Best is trial 26 with value: 0.23448927322063734.
running
[I 2024-09-30 15:14:08,527] Trial 8 finished with value: 0.2855788534117152 and parameters: {'model_name': 'VAE', 'batch_size': 558, 'iterations': 2, 'learning_rate': 0.0016260432814652714, 'p_miss': 0.08227921444877945}. Best is trial 26 with value: 0.23448927322063734.
running
[I 2024-09-30 15:14:16,070] Trial 40 finished with value: 0.23407864405802759 and parameters: {'model_name': 'IterativeImputer', 'estimator': 'Ridge', 'initial_strategy': 'median', 'n_nearest_features': 6, 'imputation_order': 'roman'}. Best is trial 40 with value: 0.23407864405802759.
running
[I 2024-09-30 15:14:20,532] Trial 35 finished with value: 0.2558630401005926 and parameters: {'model_name': 'VAE', 'batch_size': 329, 'iterations': 9, 'learning_rate': 0.09473216178554529, 'p_miss': 0.19137778543288414}. Best is trial 40 with value: 0.23407864405802759.
running
[I 2024-09-30 15:14:21,273] Trial 11 finished with value: 0.28023084542761706 and parameters: {'model_name': 'VAE', 'batch_size': 16, 'iterations': 45, 'learning_rate': 0.0004679540961025605, 'p_miss': 0.13399294383196808}. Best is trial 40 with value: 0.23407864405802759.
running
[I 2024-09-30 15:14:31,321] Trial 46 finished with value: 0.23407864405802759 and parameters: {'model_name': 'IterativeImputer', 'estimator': 'Ridge', 'initial_strategy': 'median', 'n_nearest_features': 6, 'imputation_order': 'roman'}. Best is trial 40 with value: 0.23407864405802759.
running
[I 2024-09-30 15:14:33,779] Trial 29 finished with value: 0.254880643427947 and parameters: {'model_name': 'VAE', 'batch_size': 96, 'iterations': 51, 'learning_rate': 0.011791746563707697, 'p_miss': 0.2636502580076321}. Best is trial 40 with value: 0.23407864405802759.
running
[I 2024-09-30 15:14:37,277] Trial 47 finished with value: 0.23407864405802759 and parameters: {'model_name': 'IterativeImputer', 'estimator': 'Ridge', 'initial_strategy': 'median', 'n_nearest_features': 6, 'imputation_order': 'roman'}. Best is trial 40 with value: 0.23407864405802759.
running
[I 2024-09-30 15:14:37,815] Trial 48 finished with value: 0.23407864405802759 and parameters: {'model_name': 'IterativeImputer', 'estimator': 'Ridge', 'initial_strategy': 'median', 'n_nearest_features': 6, 'imputation_order': 'roman'}. Best is trial 40 with value: 0.23407864405802759.
running
[I 2024-09-30 15:14:49,599] Trial 49 finished with value: 0.23424299966097442 and parameters: {'model_name': 'IterativeImputer', 'estimator': 'Ridge', 'initial_strategy': 'median', 'n_nearest_features': 6, 'imputation_order': 'ascending'}. Best is trial 40 with value: 0.23407864405802759.
running
[I 2024-09-30 15:14:50,983] Trial 50 finished with value: 0.23427832686236946 and parameters: {'model_name': 'IterativeImputer', 'estimator': 'Ridge', 'initial_strategy': 'median', 'n_nearest_features': 6, 'imputation_order': 'arabic'}. Best is trial 40 with value: 0.23407864405802759.
running
[I 2024-09-30 15:16:01,664] Trial 25 finished with value: 0.3975241425091377 and parameters: {'model_name': 'GAIN', 'batch_size': 418, 'hint_rate': 0.6769107826873669, 'alpha': 78, 'iterations': 681, 'learning_rate': 0.0913862719781631, 'p_miss': 0.28426210629156307}. Best is trial 40 with value: 0.23407864405802759.
running
[I 2024-09-30 15:16:16,221] Trial 0 finished with value: 0.35987774083747137 and parameters: {'model_name': 'GAIN', 'batch_size': 6, 'hint_rate': 0.2734041406517045, 'alpha': 75, 'iterations': 926, 'learning_rate': 0.0001505583280001728, 'p_miss': 0.17380884025927287}. Best is trial 40 with value: 0.23407864405802759.
running
[I 2024-09-30 15:21:06,192] Trial 12 finished with value: 0.25448583280793813 and parameters: {'model_name': 'VAE', 'batch_size': 186, 'iterations': 542, 'learning_rate': 0.04825309079561301, 'p_miss': 0.25044357431218833}. Best is trial 40 with value: 0.23407864405802759.
running
[I 2024-09-30 15:49:49,656] Trial 44 finished with value: 0.24340219069616742 and parameters: {'model_name': 'IterativeImputer', 'estimator': 'RFR', 'initial_strategy': 'median', 'n_nearest_features': 6, 'imputation_order': 'roman'}. Best is trial 40 with value: 0.23407864405802759.
running
[I 2024-09-30 15:49:50,373] Trial 45 finished with value: 0.24329876785405555 and parameters: {'model_name': 'IterativeImputer', 'estimator': 'RFR', 'initial_strategy': 'median', 'n_nearest_features': 6, 'imputation_order': 'roman'}. Best is trial 40 with value: 0.23407864405802759.
running
[I 2024-09-30 15:50:12,064] Trial 58 finished with value: 0.23424299966097442 and parameters: {'model_name': 'IterativeImputer', 'estimator': 'Ridge', 'initial_strategy': 'median', 'n_nearest_features': 6, 'imputation_order': 'ascending'}. Best is trial 40 with value: 0.23407864405802759.
running
[I 2024-09-30 15:50:15,849] Trial 59 finished with value: 0.2342524167946874 and parameters: {'model_name': 'IterativeImputer', 'estimator': 'Ridge', 'initial_strategy': 'median', 'n_nearest_features': 7, 'imputation_order': 'ascending'}. Best is trial 40 with value: 0.23407864405802759.
running
[I 2024-09-30 15:50:19,200] Trial 60 finished with value: 0.2458334672958445 and parameters: {'model_name': 'KNNImputer', 'n_neighbors': 634, 'weights': 'distance'}. Best is trial 40 with value: 0.23407864405802759.
running
[I 2024-09-30 15:50:22,274] Trial 61 finished with value: 0.24565564414795577 and parameters: {'model_name': 'KNNImputer', 'n_neighbors': 407, 'weights': 'distance'}. Best is trial 40 with value: 0.23407864405802759.
running
[I 2024-09-30 15:50:34,645] Trial 52 finished with value: 0.24394554426841447 and parameters: {'model_name': 'IterativeImputer', 'estimator': 'RFR', 'initial_strategy': 'median', 'n_nearest_features': 6, 'imputation_order': 'ascending'}. Best is trial 40 with value: 0.23407864405802759.
running
[I 2024-09-30 15:50:39,778] Trial 62 finished with value: 0.2342524167946874 and parameters: {'model_name': 'IterativeImputer', 'estimator': 'Ridge', 'initial_strategy': 'median', 'n_nearest_features': 7, 'imputation_order': 'ascending'}. Best is trial 40 with value: 0.23407864405802759.
running
[I 2024-09-30 15:50:46,402] Trial 63 finished with value: 0.2342524167946874 and parameters: {'model_name': 'IterativeImputer', 'estimator': 'Ridge', 'initial_strategy': 'median', 'n_nearest_features': 7, 'imputation_order': 'ascending'}. Best is trial 40 with value: 0.23407864405802759.
running
[I 2024-09-30 15:51:00,186] Trial 64 finished with value: 0.23436247045113978 and parameters: {'model_name': 'IterativeImputer', 'estimator': 'Ridge', 'initial_strategy': 'median', 'n_nearest_features': 7, 'imputation_order': 'roman'}. Best is trial 40 with value: 0.23407864405802759.
running
[I 2024-09-30 15:51:00,898] Trial 51 finished with value: 0.24242070521608747 and parameters: {'model_name': 'IterativeImputer', 'estimator': 'RFR', 'initial_strategy': 'median', 'n_nearest_features': 6, 'imputation_order': 'arabic'}. Best is trial 40 with value: 0.23407864405802759.
running
[I 2024-09-30 15:51:04,370] Trial 65 finished with value: 0.2344287755513609 and parameters: {'model_name': 'IterativeImputer', 'estimator': 'Ridge', 'initial_strategy': 'median', 'n_nearest_features': 5, 'imputation_order': 'roman'}. Best is trial 40 with value: 0.23407864405802759.
running
[I 2024-09-30 15:51:10,399] Trial 66 finished with value: 0.23408834435909479 and parameters: {'model_name': 'IterativeImputer', 'estimator': 'Ridge', 'initial_strategy': 'median', 'n_nearest_features': 5, 'imputation_order': 'ascending'}. Best is trial 40 with value: 0.23407864405802759.
running
[I 2024-09-30 15:51:17,559] Trial 53 finished with value: 0.2409690552805087 and parameters: {'model_name': 'IterativeImputer', 'estimator': 'RFR', 'initial_strategy': 'median', 'n_nearest_features': 6, 'imputation_order': 'arabic'}. Best is trial 40 with value: 0.23407864405802759.
running
[I 2024-09-30 15:51:23,532] Trial 67 finished with value: 0.23408834435909479 and parameters: {'model_name': 'IterativeImputer', 'estimator': 'Ridge', 'initial_strategy': 'median', 'n_nearest_features': 5, 'imputation_order': 'ascending'}. Best is trial 40 with value: 0.23407864405802759.
running
[I 2024-09-30 15:51:24,946] Trial 68 finished with value: 0.23424299966097442 and parameters: {'model_name': 'IterativeImputer', 'estimator': 'Ridge', 'initial_strategy': 'median', 'n_nearest_features': 6, 'imputation_order': 'ascending'}. Best is trial 40 with value: 0.23407864405802759.
running
[I 2024-09-30 15:51:26,009] Trial 69 finished with value: 0.23408834435909479 and parameters: {'model_name': 'IterativeImputer', 'estimator': 'Ridge', 'initial_strategy': 'median', 'n_nearest_features': 5, 'imputation_order': 'ascending'}. Best is trial 40 with value: 0.23407864405802759.
running
[I 2024-09-30 15:51:32,055] Trial 70 finished with value: 0.23408834435909479 and parameters: {'model_name': 'IterativeImputer', 'estimator': 'Ridge', 'initial_strategy': 'median', 'n_nearest_features': 5, 'imputation_order': 'ascending'}. Best is trial 40 with value: 0.23407864405802759.
running
[I 2024-09-30 15:51:40,442] Trial 71 finished with value: 0.23435684570891552 and parameters: {'model_name': 'IterativeImputer', 'estimator': 'Ridge', 'initial_strategy': 'median', 'n_nearest_features': 5, 'imputation_order': 'descending'}. Best is trial 40 with value: 0.23407864405802759.
running
[I 2024-09-30 15:51:43,534] Trial 75 finished with value: 0.24731835719842604 and parameters: {'model_name': 'KNNImputer', 'n_neighbors': 5248, 'weights': 'uniform'}. Best is trial 40 with value: 0.23407864405802759.
running
[I 2024-09-30 15:51:46,419] Trial 72 finished with value: 0.23435684570891552 and parameters: {'model_name': 'IterativeImputer', 'estimator': 'Ridge', 'initial_strategy': 'median', 'n_nearest_features': 5, 'imputation_order': 'descending'}. Best is trial 40 with value: 0.23407864405802759.
running
[I 2024-09-30 15:51:47,205] Trial 73 finished with value: 0.23430426442749855 and parameters: {'model_name': 'IterativeImputer', 'estimator': 'Ridge', 'initial_strategy': 'constant', 'n_nearest_features': 5, 'imputation_order': 'descending'}. Best is trial 40 with value: 0.23407864405802759.
running
[I 2024-09-30 15:51:49,495] Trial 74 finished with value: 0.23430426442749855 and parameters: {'model_name': 'IterativeImputer', 'estimator': 'Ridge', 'initial_strategy': 'most_frequent', 'n_nearest_features': 5, 'imputation_order': 'descending'}. Best is trial 40 with value: 0.23407864405802759.
running
[I 2024-09-30 15:52:03,498] Trial 76 finished with value: 0.2344287755513609 and parameters: {'model_name': 'IterativeImputer', 'estimator': 'Ridge', 'initial_strategy': 'median', 'n_nearest_features': 5, 'imputation_order': 'roman'}. Best is trial 40 with value: 0.23407864405802759.
running
[I 2024-09-30 15:52:06,766] Trial 77 finished with value: 0.2344287755513609 and parameters: {'model_name': 'IterativeImputer', 'estimator': 'Ridge', 'initial_strategy': 'median', 'n_nearest_features': 5, 'imputation_order': 'roman'}. Best is trial 40 with value: 0.23407864405802759.
running
[I 2024-09-30 15:52:07,432] Trial 82 finished with value: 0.2730432611036446 and parameters: {'model_name': 'SimpleImputer', 'strategy': 'median'}. Best is trial 40 with value: 0.23407864405802759.
running
[I 2024-09-30 15:52:10,996] Trial 78 finished with value: 0.2343956625889303 and parameters: {'model_name': 'IterativeImputer', 'estimator': 'Ridge', 'initial_strategy': 'mean', 'n_nearest_features': 4, 'imputation_order': 'roman'}. Best is trial 40 with value: 0.23407864405802759.
running
[I 2024-09-30 15:52:18,721] Trial 79 finished with value: 0.2535807311273856 and parameters: {'model_name': 'IterativeImputer', 'estimator': 'KNN', 'initial_strategy': 'mean', 'n_nearest_features': 4, 'imputation_order': 'roman'}. Best is trial 40 with value: 0.23407864405802759.
running
[I 2024-09-30 15:52:20,849] Trial 80 finished with value: 0.2511264912552266 and parameters: {'model_name': 'IterativeImputer', 'estimator': 'KNN', 'initial_strategy': 'median', 'n_nearest_features': 4, 'imputation_order': 'roman'}. Best is trial 40 with value: 0.23407864405802759.
running
[I 2024-09-30 15:52:35,257] Trial 81 finished with value: 0.25373547624657755 and parameters: {'model_name': 'IterativeImputer', 'estimator': 'KNN', 'initial_strategy': 'mean', 'n_nearest_features': 4, 'imputation_order': 'ascending'}. Best is trial 40 with value: 0.23407864405802759.
running
[I 2024-09-30 15:52:38,555] Trial 83 finished with value: 0.2533098948353153 and parameters: {'model_name': 'IterativeImputer', 'estimator': 'KNN', 'initial_strategy': 'mean', 'n_nearest_features': 4, 'imputation_order': 'random'}. Best is trial 40 with value: 0.23407864405802759.
running
[I 2024-09-30 15:52:41,294] Trial 84 finished with value: 0.2533098948353153 and parameters: {'model_name': 'IterativeImputer', 'estimator': 'KNN', 'initial_strategy': 'mean', 'n_nearest_features': 4, 'imputation_order': 'random'}. Best is trial 40 with value: 0.23407864405802759.
running
[I 2024-09-30 15:52:52,389] Trial 86 finished with value: 0.2342822953940739 and parameters: {'model_name': 'IterativeImputer', 'estimator': 'Bayesian', 'initial_strategy': 'median', 'n_nearest_features': 8, 'imputation_order': 'ascending', 'sample_posterior': False}. Best is trial 40 with value: 0.23407864405802759.
running
