[I 2024-11-16 20:54:36,648] Trial 197 finished with value: 0.1163213134132115 and parameters: {'model_name': 'SimpleImputer', 'strategy': 'median'}. Best is trial 7 with value: 0.1163213134132115.
fit
simple fit
simple transform
0     0
1     0
2     0
3     0
4     0
5     0
6     0
7     0
8     0
9     0
10    0
dtype: int64
0     0
1     0
2     0
3     0
4     0
5     0
6     0
7     0
8     0
9     0
10    0
dtype: int64
0.1163213134132115
{'model_name': 'SimpleImputer', 'strategy': 'median'}
running experiment 2/3 - Does reconstruction give good automl predictions
Start est fit
Version 0.1.7a0 of tpot2 is outdated. Version 0.1.8a0 was released Tuesday September 17, 2024.
Version 0.1.7a0 of tpot2 is outdated. Version 0.1.8a0 was released Tuesday September 17, 2024.
Version 0.1.7a0 of tpot2 is outdated. Version 0.1.8a0 was released Tuesday September 17, 2024.
Version 0.1.7a0 of tpot2 is outdated. Version 0.1.8a0 was released Tuesday September 17, 2024.
Version 0.1.7a0 of tpot2 is outdated. Version 0.1.8a0 was released Tuesday September 17, 2024.
Version 0.1.7a0 of tpot2 is outdated. Version 0.1.8a0 was released Tuesday September 17, 2024.
Version 0.1.7a0 of tpot2 is outdated. Version 0.1.8a0 was released Tuesday September 17, 2024.
Version 0.1.7a0 of tpot2 is outdated. Version 0.1.8a0 was released Tuesday September 17, 2024.
Version 0.1.7a0 of tpot2 is outdated. Version 0.1.8a0 was released Tuesday September 17, 2024.
Version 0.1.7a0 of tpot2 is outdated. Version 0.1.8a0 was released Tuesday September 17, 2024.
Version 0.1.7a0 of tpot2 is outdated. Version 0.1.8a0 was released Tuesday September 17, 2024.
Version 0.1.7a0 of tpot2 is outdated. Version 0.1.8a0 was released Tuesday September 17, 2024.
Version 0.1.7a0 of tpot2 is outdated. Version 0.1.8a0 was released Tuesday September 17, 2024.
Version 0.1.7a0 of tpot2 is outdated. Version 0.1.8a0 was released Tuesday September 17, 2024.
Version 0.1.7a0 of tpot2 is outdated. Version 0.1.8a0 was released Tuesday September 17, 2024.
Version 0.1.7a0 of tpot2 is outdated. Version 0.1.8a0 was released Tuesday September 17, 2024.
  0%|          | 0/25 [00:00<?, ?it/s]Generation:   0%|          | 0/25 [00:00<?, ?it/s]Generation:  1
Best f1_score score: 0.4867028186046218
Generation:   4%|▍         | 1/25 [00:16<06:44, 16.85s/it]Generation:  2
Best f1_score score: 0.4867028186046218
Generation:   8%|▊         | 2/25 [00:47<09:37, 25.12s/it]Generation:  3
Best f1_score score: 0.4867028186046218
Generation:  12%|█▏        | 3/25 [01:01<07:15, 19.80s/it]Generation:  4
Best f1_score score: 0.4867028186046218
Generation:  16%|█▌        | 4/25 [01:15<06:13, 17.79s/it]Generation:  5
Best f1_score score: 0.4867028186046218
Generation:  20%|██        | 5/25 [01:45<07:22, 22.11s/it]Generation:  6
Best f1_score score: 0.4867028186046218
Generation:  24%|██▍       | 6/25 [02:04<06:41, 21.13s/it]Generation:  7
Best f1_score score: 0.4867028186046218
Generation:  28%|██▊       | 7/25 [03:26<12:15, 40.84s/it]Generation:  8
Best f1_score score: 0.4867028186046218
Generation:  32%|███▏      | 8/25 [03:38<09:00, 31.77s/it]Generation:  9
Best f1_score score: 0.4867028186046218
Generation:  36%|███▌      | 9/25 [03:52<06:59, 26.23s/it]Generation:  10
Best f1_score score: 0.4867028186046218
Generation:  40%|████      | 10/25 [04:10<05:55, 23.72s/it]Generation:  11
Best f1_score score: 0.4867028186046218
Generation:  44%|████▍     | 11/25 [04:25<04:54, 21.03s/it]Generation:  12
Best f1_score score: 0.4867028186046218
Generation:  48%|████▊     | 12/25 [04:52<04:55, 22.76s/it]Generation:  13
Best f1_score score: 0.4867028186046218
Generation:  52%|█████▏    | 13/25 [05:29<05:26, 27.20s/it]Generation:  14
Best f1_score score: 0.4867028186046218
Generation:  56%|█████▌    | 14/25 [05:45<04:22, 23.84s/it]Generation:  15
Best f1_score score: 0.4867028186046218
Generation:  60%|██████    | 15/25 [07:53<09:10, 55.07s/it]Generation:  16
Best f1_score score: 0.4867028186046218
Generation:  64%|██████▍   | 16/25 [08:11<06:34, 43.83s/it]Generation:  17
Best f1_score score: 0.4867028186046218
Generation:  68%|██████▊   | 17/25 [13:31<16:54, 126.85s/it]Generation:  18
Best f1_score score: 0.4867028186046218
Generation:  72%|███████▏  | 18/25 [14:10<11:44, 100.58s/it]Generation:  19
Best f1_score score: 0.4867028186046218
Generation:  76%|███████▌  | 19/25 [14:29<07:36, 76.06s/it] Generation:  20
Best f1_score score: 0.4867028186046218
Generation:  80%|████████  | 20/25 [16:22<07:16, 87.25s/it]Generation:  21
Best f1_score score: 0.4867028186046218
Generation:  84%|████████▍ | 21/25 [16:46<04:33, 68.33s/it]Generation:  22
Best f1_score score: 0.4867028186046218
Generation:  88%|████████▊ | 22/25 [17:15<02:49, 56.38s/it]Generation:  23
Best f1_score score: 0.49193531421316655
Generation:  92%|█████████▏| 23/25 [17:34<01:30, 45.02s/it]Generation:  24
Best f1_score score: 0.49193531421316655
Generation:  96%|█████████▌| 24/25 [18:09<00:42, 42.23s/it]Generation:  25
Best f1_score score: 0.49193531421316655
Generation: 100%|██████████| 25/25 [18:34<00:00, 36.99s/it]Generation: 100%|██████████| 25/25 [18:37<00:00, 44.72s/it]
2024-11-16 21:13:20,503 - distributed.scheduler - ERROR - Removing worker 'tcp://127.0.0.1:39885' caused the cluster to lose scattered data, which can't be recovered: {'ndarray-89a389fc658f037c692236478240a7b8', 'ndarray-453a6c1882b0f66cb296036f202f3e20'} (stimulus_id='handle-worker-cleanup-1731820400.5032942')
Fitted
Pipeline(steps=[('extratreesclassifier',
                 ExtraTreesClassifier(class_weight='balanced',
                                      criterion='entropy',
                                      max_features=0.7020631419279,
                                      min_samples_split=12, n_jobs=1))])
score start
train score: {'auroc': 0.9972857882482647, 'accuracy': 0.9435936702399184, 'balanced_accuracy': 0.9789596196781947, 'logloss': 0.5274696052731004, 'f1': 0.9281748164056552}
original test score: {'auroc': 0.8595400066695617, 'accuracy': 0.65, 'balanced_accuracy': 0.41600249284343543, 'logloss': 0.9928203896963097, 'f1': 0.4106545482436824}
imputed test score: {'auroc': 0.8594435307809982, 'accuracy': 0.6520408163265307, 'balanced_accuracy': 0.416818086184802, 'logloss': 0.9941959011419162, 'f1': 0.4121871897206809}
score end
check intended
EXP2 Finished
running experiment 3/3 - What is the best automl settings?
<tpot2.search_spaces.pipelines.sequential.SequentialPipeline object at 0x15543504f9d0>
Start tpot fit
Version 0.1.7a0 of tpot2 is outdated. Version 0.1.8a0 was released Tuesday September 17, 2024.
Version 0.1.7a0 of tpot2 is outdated. Version 0.1.8a0 was released Tuesday September 17, 2024.
Version 0.1.7a0 of tpot2 is outdated. Version 0.1.8a0 was released Tuesday September 17, 2024.
Version 0.1.7a0 of tpot2 is outdated. Version 0.1.8a0 was released Tuesday September 17, 2024.
Version 0.1.7a0 of tpot2 is outdated. Version 0.1.8a0 was released Tuesday September 17, 2024.
Version 0.1.7a0 of tpot2 is outdated. Version 0.1.8a0 was released Tuesday September 17, 2024.
Version 0.1.7a0 of tpot2 is outdated. Version 0.1.8a0 was released Tuesday September 17, 2024.
Version 0.1.7a0 of tpot2 is outdated. Version 0.1.8a0 was released Tuesday September 17, 2024.
Version 0.1.7a0 of tpot2 is outdated. Version 0.1.8a0 was released Tuesday September 17, 2024.
Version 0.1.7a0 of tpot2 is outdated. Version 0.1.8a0 was released Tuesday September 17, 2024.
Version 0.1.7a0 of tpot2 is outdated. Version 0.1.8a0 was released Tuesday September 17, 2024.
Version 0.1.7a0 of tpot2 is outdated. Version 0.1.8a0 was released Tuesday September 17, 2024.
Version 0.1.7a0 of tpot2 is outdated. Version 0.1.8a0 was released Tuesday September 17, 2024.
Version 0.1.7a0 of tpot2 is outdated. Version 0.1.8a0 was released Tuesday September 17, 2024.
Version 0.1.7a0 of tpot2 is outdated. Version 0.1.8a0 was released Tuesday September 17, 2024.
Version 0.1.7a0 of tpot2 is outdated. Version 0.1.8a0 was released Tuesday September 17, 2024.
  0%|          | 0/25 [00:00<?, ?it/s]Generation:   0%|          | 0/25 [00:00<?, ?it/s]Generation:  1
Best f1_score score: 0.44822240326575213
Generation:   4%|▍         | 1/25 [00:13<05:32, 13.86s/it]Generation:  2
Best f1_score score: 0.4547358543796259
Generation:   8%|▊         | 2/25 [00:22<04:10, 10.90s/it]Generation:  3
Best f1_score score: 0.5126620397612831
Generation:  12%|█▏        | 3/25 [00:50<06:54, 18.84s/it]Generation:  4
Best f1_score score: 0.5126620397612831
Generation:  16%|█▌        | 4/25 [01:00<05:21, 15.29s/it]Generation:  5
Best f1_score score: 0.5126620397612831
Generation:  20%|██        | 5/25 [02:02<10:43, 32.19s/it]Generation:  6
Best f1_score score: 0.5126620397612831
Generation:  24%|██▍       | 6/25 [02:14<07:58, 25.20s/it]Generation:  7
Best f1_score score: 0.5126620397612831
Generation:  28%|██▊       | 7/25 [02:29<06:31, 21.76s/it]Generation:  8
Best f1_score score: 0.5126620397612831
Generation:  32%|███▏      | 8/25 [02:39<05:09, 18.18s/it]Generation:  9
Best f1_score score: 0.5126620397612831
Generation:  36%|███▌      | 9/25 [02:56<04:45, 17.86s/it]Generation:  10
Best f1_score score: 0.5126620397612831
Generation:  40%|████      | 10/25 [03:09<04:01, 16.07s/it]Generation:  11
Best f1_score score: 0.5126620397612831
Generation:  44%|████▍     | 11/25 [03:18<03:15, 13.96s/it]Generation:  12
Best f1_score score: 0.5133912496992565
Generation:  48%|████▊     | 12/25 [03:40<03:34, 16.46s/it]Generation:  13
Best f1_score score: 0.5133912496992565
Generation:  52%|█████▏    | 13/25 [03:52<03:00, 15.06s/it]Generation:  14
Best f1_score score: 0.5133912496992565
Generation:  56%|█████▌    | 14/25 [04:02<02:30, 13.66s/it]Generation:  15
Best f1_score score: 0.5133912496992565
Generation:  60%|██████    | 15/25 [06:33<09:09, 54.94s/it]Generation:  16
Best f1_score score: 0.5133912496992565
Generation:  64%|██████▍   | 16/25 [06:44<06:15, 41.75s/it]Generation:  17
Best f1_score score: 0.5133912496992565
Generation:  68%|██████▊   | 17/25 [07:05<04:44, 35.50s/it]Generation:  18
Best f1_score score: 0.5133912496992565
Generation:  72%|███████▏  | 18/25 [07:19<03:23, 29.12s/it]Generation:  19
Best f1_score score: 0.5133912496992565
Generation:  76%|███████▌  | 19/25 [07:34<02:29, 24.86s/it]Generation:  20
Best f1_score score: 0.5133912496992565
Generation:  80%|████████  | 20/25 [07:53<01:55, 23.14s/it]Generation:  21
Best f1_score score: 0.5133912496992565
Generation:  84%|████████▍ | 21/25 [08:10<01:24, 21.20s/it]Generation:  22
Best f1_score score: 0.5133912496992565
Generation:  88%|████████▊ | 22/25 [08:28<01:01, 20.38s/it]Generation:  23
Best f1_score score: 0.5133912496992565
Generation:  92%|█████████▏| 23/25 [08:39<00:35, 17.57s/it]Generation:  24
Best f1_score score: 0.5133912496992565
Generation:  96%|█████████▌| 24/25 [08:51<00:15, 15.69s/it]Generation:  25
Best f1_score score: 0.5133912496992565
Generation: 100%|██████████| 25/25 [09:11<00:00, 17.15s/it]Generation: 100%|██████████| 25/25 [09:11<00:00, 22.07s/it]
2024-11-16 21:22:41,187 - distributed.scheduler - ERROR - Removing worker 'tcp://127.0.0.1:46423' caused the cluster to lose scattered data, which can't be recovered: {'ndarray-453a6c1882b0f66cb296036f202f3e20', 'DataFrame-36d7b1c5937a6d7701ba8ef24e515ab0'} (stimulus_id='handle-worker-cleanup-1731820961.1876874')
Fitted
Pipeline(steps=[('simpleimputer', SimpleImputer(strategy='constant')),
                ('extratreesclassifier',
                 ExtraTreesClassifier(class_weight='balanced',
                                      criterion='entropy',
                                      max_features=0.3842194725501,
                                      min_samples_split=6, n_jobs=1))])
transform worked
try transform
transform worked
score start
train score: {'auroc': 0.9999545548691638, 'accuracy': 0.9941296579887697, 'balanced_accuracy': 0.9978030430218675, 'logloss': 0.28793789219701926, 'f1': 0.9930073509245895}
test score: {'auroc': 0.889927752472082, 'accuracy': 0.686734693877551, 'balanced_accuracy': 0.39153987274384916, 'logloss': 0.8769738718931145, 'f1': 0.41385339259102744}
original test score: {'auroc': 0.8911417023992553, 'accuracy': 0.6877551020408164, 'balanced_accuracy': 0.3965221327518824, 'logloss': 0.8708571943207254, 'f1': 0.41859775135518207}
score end
40498
lvl
0.01
type
MAR
num_run
1
class_simple
finished
all finished
full run takes
0.4797450467613008
hours
DONE
