[I 2024-10-02 20:45:16,824] Trial 89 finished with value: 0.4478806506521889 and parameters: {'model_name': 'SimpleImputer', 'strategy': 'most_frequent'}. Best is trial 7 with value: 0.28437434244972926.
running
[I 2024-10-02 20:45:17,026] Trial 105 finished with value: 0.28437434244972926 and parameters: {'model_name': 'SimpleImputer', 'strategy': 'mean'}. Best is trial 7 with value: 0.28437434244972926.
running
[I 2024-10-02 20:45:17,214] Trial 106 finished with value: 0.28437434244972926 and parameters: {'model_name': 'SimpleImputer', 'strategy': 'mean'}. Best is trial 7 with value: 0.28437434244972926.
running
[I 2024-10-02 20:45:17,527] Trial 107 finished with value: 0.28437434244972926 and parameters: {'model_name': 'SimpleImputer', 'strategy': 'mean'}. Best is trial 7 with value: 0.28437434244972926.
running
[I 2024-10-02 20:45:17,674] Trial 108 finished with value: 0.28437434244972926 and parameters: {'model_name': 'SimpleImputer', 'strategy': 'mean'}. Best is trial 7 with value: 0.28437434244972926.
[I 2024-10-02 20:45:17,787] Trial 110 finished with value: 0.28437434244972926 and parameters: {'model_name': 'SimpleImputer', 'strategy': 'mean'}. Best is trial 7 with value: 0.28437434244972926.
running
[I 2024-10-02 20:45:17,978] Trial 112 finished with value: 0.28437434244972926 and parameters: {'model_name': 'SimpleImputer', 'strategy': 'mean'}. Best is trial 7 with value: 0.28437434244972926.
running
running
[I 2024-10-02 20:45:18,144] Trial 111 finished with value: 0.28437434244972926 and parameters: {'model_name': 'SimpleImputer', 'strategy': 'mean'}. Best is trial 7 with value: 0.28437434244972926.
running
[I 2024-10-02 20:45:18,273] Trial 109 finished with value: 0.28437434244972926 and parameters: {'model_name': 'SimpleImputer', 'strategy': 'mean'}. Best is trial 7 with value: 0.28437434244972926.
running
[I 2024-10-02 20:45:18,495] Trial 115 finished with value: 0.28437434244972926 and parameters: {'model_name': 'SimpleImputer', 'strategy': 'mean'}. Best is trial 7 with value: 0.28437434244972926.
running
[I 2024-10-02 20:45:18,738] Trial 114 finished with value: 0.28437434244972926 and parameters: {'model_name': 'SimpleImputer', 'strategy': 'mean'}. Best is trial 7 with value: 0.28437434244972926.
running
[I 2024-10-02 20:45:18,903] Trial 116 finished with value: 0.28437434244972926 and parameters: {'model_name': 'SimpleImputer', 'strategy': 'mean'}. Best is trial 7 with value: 0.28437434244972926.
[I 2024-10-02 20:45:19,023] Trial 113 finished with value: 0.28437434244972926 and parameters: {'model_name': 'SimpleImputer', 'strategy': 'mean'}. Best is trial 7 with value: 0.28437434244972926.
running
running
[I 2024-10-02 20:45:19,243] Trial 118 finished with value: 0.28437434244972926 and parameters: {'model_name': 'SimpleImputer', 'strategy': 'mean'}. Best is trial 7 with value: 0.28437434244972926.
[I 2024-10-02 20:45:19,400] Trial 121 finished with value: 0.28437434244972926 and parameters: {'model_name': 'SimpleImputer', 'strategy': 'mean'}. Best is trial 7 with value: 0.28437434244972926.
running
running
[I 2024-10-02 20:45:19,702] Trial 117 finished with value: 0.28437434244972926 and parameters: {'model_name': 'SimpleImputer', 'strategy': 'mean'}. Best is trial 7 with value: 0.28437434244972926.
running
[I 2024-10-02 20:45:19,867] Trial 119 finished with value: 0.28437434244972926 and parameters: {'model_name': 'SimpleImputer', 'strategy': 'mean'}. Best is trial 7 with value: 0.28437434244972926.
running
[I 2024-10-02 20:45:19,994] Trial 120 finished with value: 0.28437434244972926 and parameters: {'model_name': 'SimpleImputer', 'strategy': 'mean'}. Best is trial 7 with value: 0.28437434244972926.
running
[I 2024-10-02 20:45:20,180] Trial 127 finished with value: 0.28437434244972926 and parameters: {'model_name': 'SimpleImputer', 'strategy': 'mean'}. Best is trial 7 with value: 0.28437434244972926.
running
[I 2024-10-02 20:45:20,342] Trial 123 finished with value: 0.28437434244972926 and parameters: {'model_name': 'SimpleImputer', 'strategy': 'mean'}. Best is trial 7 with value: 0.28437434244972926.
running
[I 2024-10-02 20:45:20,507] Trial 104 finished with value: 0.4478806506521889 and parameters: {'model_name': 'SimpleImputer', 'strategy': 'most_frequent'}. Best is trial 7 with value: 0.28437434244972926.
running
[I 2024-10-02 20:45:20,684] Trial 122 finished with value: 0.28437434244972926 and parameters: {'model_name': 'SimpleImputer', 'strategy': 'mean'}. Best is trial 7 with value: 0.28437434244972926.
[I 2024-10-02 20:45:20,849] Trial 124 finished with value: 0.28437434244972926 and parameters: {'model_name': 'SimpleImputer', 'strategy': 'mean'}. Best is trial 7 with value: 0.28437434244972926.
running
running
[I 2024-10-02 20:45:21,003] Trial 125 finished with value: 0.28437434244972926 and parameters: {'model_name': 'SimpleImputer', 'strategy': 'mean'}. Best is trial 7 with value: 0.28437434244972926.
running
[I 2024-10-02 20:45:21,199] Trial 126 finished with value: 0.28437434244972926 and parameters: {'model_name': 'SimpleImputer', 'strategy': 'mean'}. Best is trial 7 with value: 0.28437434244972926.
running
[I 2024-10-02 20:45:21,365] Trial 129 finished with value: 0.28437434244972926 and parameters: {'model_name': 'SimpleImputer', 'strategy': 'mean'}. Best is trial 7 with value: 0.28437434244972926.
running
[I 2024-10-02 20:45:21,693] Trial 128 finished with value: 0.28437434244972926 and parameters: {'model_name': 'SimpleImputer', 'strategy': 'mean'}. Best is trial 7 with value: 0.28437434244972926.
running
[I 2024-10-02 20:45:21,909] Trial 130 finished with value: 0.28437434244972926 and parameters: {'model_name': 'SimpleImputer', 'strategy': 'mean'}. Best is trial 7 with value: 0.28437434244972926.
[I 2024-10-02 20:45:22,021] Trial 132 finished with value: 0.28437434244972926 and parameters: {'model_name': 'SimpleImputer', 'strategy': 'mean'}. Best is trial 7 with value: 0.28437434244972926.
running
running
[I 2024-10-02 20:45:22,221] Trial 131 finished with value: 0.28437434244972926 and parameters: {'model_name': 'SimpleImputer', 'strategy': 'mean'}. Best is trial 7 with value: 0.28437434244972926.
running
[I 2024-10-02 20:45:22,448] Trial 133 finished with value: 0.28437434244972926 and parameters: {'model_name': 'SimpleImputer', 'strategy': 'mean'}. Best is trial 7 with value: 0.28437434244972926.
running
[I 2024-10-02 20:45:22,726] Trial 136 finished with value: 0.28437434244972926 and parameters: {'model_name': 'SimpleImputer', 'strategy': 'mean'}. Best is trial 7 with value: 0.28437434244972926.
running
[I 2024-10-02 20:45:22,910] Trial 134 finished with value: 0.28437434244972926 and parameters: {'model_name': 'SimpleImputer', 'strategy': 'mean'}. Best is trial 7 with value: 0.28437434244972926.
[I 2024-10-02 20:45:23,022] Trial 135 finished with value: 0.28437434244972926 and parameters: {'model_name': 'SimpleImputer', 'strategy': 'mean'}. Best is trial 7 with value: 0.28437434244972926.
running
running
[I 2024-10-02 20:45:23,216] Trial 140 finished with value: 0.28437434244972926 and parameters: {'model_name': 'SimpleImputer', 'strategy': 'mean'}. Best is trial 7 with value: 0.28437434244972926.
running
[I 2024-10-02 20:45:23,380] Trial 138 finished with value: 0.28437434244972926 and parameters: {'model_name': 'SimpleImputer', 'strategy': 'mean'}. Best is trial 7 with value: 0.28437434244972926.
[I 2024-10-02 20:45:23,491] Trial 137 finished with value: 0.28437434244972926 and parameters: {'model_name': 'SimpleImputer', 'strategy': 'mean'}. Best is trial 7 with value: 0.28437434244972926.
running
running
[I 2024-10-02 20:45:23,722] Trial 144 finished with value: 0.28437434244972926 and parameters: {'model_name': 'SimpleImputer', 'strategy': 'mean'}. Best is trial 7 with value: 0.28437434244972926.
running
[I 2024-10-02 20:45:23,881] Trial 141 finished with value: 0.28437434244972926 and parameters: {'model_name': 'SimpleImputer', 'strategy': 'mean'}. Best is trial 7 with value: 0.28437434244972926.
[I 2024-10-02 20:45:23,991] Trial 142 finished with value: 0.28437434244972926 and parameters: {'model_name': 'SimpleImputer', 'strategy': 'mean'}. Best is trial 7 with value: 0.28437434244972926.
running
running
[I 2024-10-02 20:45:24,106] Trial 139 finished with value: 0.28437434244972926 and parameters: {'model_name': 'SimpleImputer', 'strategy': 'mean'}. Best is trial 7 with value: 0.28437434244972926.
running
[I 2024-10-02 20:45:24,267] Trial 143 finished with value: 0.28437434244972926 and parameters: {'model_name': 'SimpleImputer', 'strategy': 'mean'}. Best is trial 7 with value: 0.28437434244972926.
running
[I 2024-10-02 20:45:24,468] Trial 145 finished with value: 0.28437434244972926 and parameters: {'model_name': 'SimpleImputer', 'strategy': 'mean'}. Best is trial 7 with value: 0.28437434244972926.
running
[I 2024-10-02 20:45:24,697] Trial 146 finished with value: 0.28437434244972926 and parameters: {'model_name': 'SimpleImputer', 'strategy': 'mean'}. Best is trial 7 with value: 0.28437434244972926.
running
[I 2024-10-02 20:45:24,869] Trial 148 finished with value: 0.28437434244972926 and parameters: {'model_name': 'SimpleImputer', 'strategy': 'mean'}. Best is trial 7 with value: 0.28437434244972926.
running
[I 2024-10-02 20:45:25,113] Trial 147 finished with value: 0.28437434244972926 and parameters: {'model_name': 'SimpleImputer', 'strategy': 'mean'}. Best is trial 7 with value: 0.28437434244972926.
running
[I 2024-10-02 20:45:25,298] Trial 149 finished with value: 0.28437434244972926 and parameters: {'model_name': 'SimpleImputer', 'strategy': 'mean'}. Best is trial 7 with value: 0.28437434244972926.
running
[I 2024-10-02 20:45:25,543] Trial 152 finished with value: 0.28437434244972926 and parameters: {'model_name': 'SimpleImputer', 'strategy': 'mean'}. Best is trial 7 with value: 0.28437434244972926.
running
[I 2024-10-02 20:45:25,790] Trial 150 finished with value: 0.28437434244972926 and parameters: {'model_name': 'SimpleImputer', 'strategy': 'mean'}. Best is trial 7 with value: 0.28437434244972926.
running
[I 2024-10-02 20:45:25,962] Trial 155 finished with value: 0.28437434244972926 and parameters: {'model_name': 'SimpleImputer', 'strategy': 'mean'}. Best is trial 7 with value: 0.28437434244972926.
running
[I 2024-10-02 20:45:26,144] Trial 151 finished with value: 0.28437434244972926 and parameters: {'model_name': 'SimpleImputer', 'strategy': 'mean'}. Best is trial 7 with value: 0.28437434244972926.
running
[I 2024-10-02 20:45:26,304] Trial 153 finished with value: 0.28437434244972926 and parameters: {'model_name': 'SimpleImputer', 'strategy': 'mean'}. Best is trial 7 with value: 0.28437434244972926.
running
[I 2024-10-02 20:45:26,499] Trial 159 finished with value: 0.28437434244972926 and parameters: {'model_name': 'SimpleImputer', 'strategy': 'mean'}. Best is trial 7 with value: 0.28437434244972926.
running
[I 2024-10-02 20:45:26,683] Trial 161 finished with value: 0.28437434244972926 and parameters: {'model_name': 'SimpleImputer', 'strategy': 'mean'}. Best is trial 7 with value: 0.28437434244972926.
[I 2024-10-02 20:45:26,867] Trial 154 finished with value: 0.28437434244972926 and parameters: {'model_name': 'SimpleImputer', 'strategy': 'mean'}. Best is trial 7 with value: 0.28437434244972926.
running
running
[I 2024-10-02 20:45:27,082] Trial 157 finished with value: 0.28437434244972926 and parameters: {'model_name': 'SimpleImputer', 'strategy': 'mean'}. Best is trial 7 with value: 0.28437434244972926.
[I 2024-10-02 20:45:27,196] Trial 162 finished with value: 0.28437434244972926 and parameters: {'model_name': 'SimpleImputer', 'strategy': 'mean'}. Best is trial 7 with value: 0.28437434244972926.
running
running
[I 2024-10-02 20:45:27,329] Trial 160 finished with value: 0.28437434244972926 and parameters: {'model_name': 'SimpleImputer', 'strategy': 'mean'}. Best is trial 7 with value: 0.28437434244972926.
running
[I 2024-10-02 20:45:27,462] Trial 158 finished with value: 0.28437434244972926 and parameters: {'model_name': 'SimpleImputer', 'strategy': 'mean'}. Best is trial 7 with value: 0.28437434244972926.
running
[I 2024-10-02 20:45:27,648] Trial 156 finished with value: 0.28437434244972926 and parameters: {'model_name': 'SimpleImputer', 'strategy': 'mean'}. Best is trial 7 with value: 0.28437434244972926.
running
[I 2024-10-02 20:45:27,845] Trial 163 finished with value: 0.28437434244972926 and parameters: {'model_name': 'SimpleImputer', 'strategy': 'mean'}. Best is trial 7 with value: 0.28437434244972926.
running
[I 2024-10-02 20:45:28,030] Trial 165 finished with value: 0.28437434244972926 and parameters: {'model_name': 'SimpleImputer', 'strategy': 'mean'}. Best is trial 7 with value: 0.28437434244972926.
running
[I 2024-10-02 20:45:28,211] Trial 164 finished with value: 0.28437434244972926 and parameters: {'model_name': 'SimpleImputer', 'strategy': 'mean'}. Best is trial 7 with value: 0.28437434244972926.
running
[I 2024-10-02 20:45:28,514] Trial 166 finished with value: 0.28437434244972926 and parameters: {'model_name': 'SimpleImputer', 'strategy': 'mean'}. Best is trial 7 with value: 0.28437434244972926.
running
[I 2024-10-02 20:45:28,733] Trial 168 finished with value: 0.28437434244972926 and parameters: {'model_name': 'SimpleImputer', 'strategy': 'mean'}. Best is trial 7 with value: 0.28437434244972926.
running
[I 2024-10-02 20:45:28,899] Trial 167 finished with value: 0.28437434244972926 and parameters: {'model_name': 'SimpleImputer', 'strategy': 'mean'}. Best is trial 7 with value: 0.28437434244972926.
running
[I 2024-10-02 20:45:29,100] Trial 169 finished with value: 0.28437434244972926 and parameters: {'model_name': 'SimpleImputer', 'strategy': 'mean'}. Best is trial 7 with value: 0.28437434244972926.
running
[I 2024-10-02 20:45:29,250] Trial 173 finished with value: 0.28437434244972926 and parameters: {'model_name': 'SimpleImputer', 'strategy': 'mean'}. Best is trial 7 with value: 0.28437434244972926.
[I 2024-10-02 20:45:29,355] Trial 170 finished with value: 0.28437434244972926 and parameters: {'model_name': 'SimpleImputer', 'strategy': 'mean'}. Best is trial 7 with value: 0.28437434244972926.
running
running
[I 2024-10-02 20:45:29,514] Trial 171 finished with value: 0.28437434244972926 and parameters: {'model_name': 'SimpleImputer', 'strategy': 'mean'}. Best is trial 7 with value: 0.28437434244972926.
running
[I 2024-10-02 20:45:29,630] Trial 178 finished with value: 0.28437434244972926 and parameters: {'model_name': 'SimpleImputer', 'strategy': 'mean'}. Best is trial 7 with value: 0.28437434244972926.
running
[I 2024-10-02 20:45:29,800] Trial 175 finished with value: 0.28437434244972926 and parameters: {'model_name': 'SimpleImputer', 'strategy': 'mean'}. Best is trial 7 with value: 0.28437434244972926.
running
[I 2024-10-02 20:45:29,998] Trial 174 finished with value: 0.28437434244972926 and parameters: {'model_name': 'SimpleImputer', 'strategy': 'mean'}. Best is trial 7 with value: 0.28437434244972926.
running
[I 2024-10-02 20:45:30,132] Trial 176 finished with value: 0.28437434244972926 and parameters: {'model_name': 'SimpleImputer', 'strategy': 'mean'}. Best is trial 7 with value: 0.28437434244972926.
[I 2024-10-02 20:45:30,237] Trial 179 finished with value: 0.28437434244972926 and parameters: {'model_name': 'SimpleImputer', 'strategy': 'mean'}. Best is trial 7 with value: 0.28437434244972926.
running
[I 2024-10-02 20:45:30,395] Trial 177 finished with value: 0.28437434244972926 and parameters: {'model_name': 'SimpleImputer', 'strategy': 'mean'}. Best is trial 7 with value: 0.28437434244972926.
running
running
[I 2024-10-02 20:45:30,526] Trial 172 finished with value: 0.28437434244972926 and parameters: {'model_name': 'SimpleImputer', 'strategy': 'mean'}. Best is trial 7 with value: 0.28437434244972926.
running
[I 2024-10-02 20:45:30,670] Trial 180 finished with value: 0.28437434244972926 and parameters: {'model_name': 'SimpleImputer', 'strategy': 'mean'}. Best is trial 7 with value: 0.28437434244972926.
running
[I 2024-10-02 20:45:30,794] Trial 181 finished with value: 0.28437434244972926 and parameters: {'model_name': 'SimpleImputer', 'strategy': 'mean'}. Best is trial 7 with value: 0.28437434244972926.
running
[I 2024-10-02 20:45:31,118] Trial 182 finished with value: 0.28437434244972926 and parameters: {'model_name': 'SimpleImputer', 'strategy': 'mean'}. Best is trial 7 with value: 0.28437434244972926.
running
[I 2024-10-02 20:45:31,421] Trial 183 finished with value: 0.28437434244972926 and parameters: {'model_name': 'SimpleImputer', 'strategy': 'mean'}. Best is trial 7 with value: 0.28437434244972926.
running
[I 2024-10-02 20:45:31,614] Trial 184 finished with value: 0.28437434244972926 and parameters: {'model_name': 'SimpleImputer', 'strategy': 'mean'}. Best is trial 7 with value: 0.28437434244972926.
[I 2024-10-02 20:45:31,732] Trial 190 finished with value: 0.4898859373437852 and parameters: {'model_name': 'SimpleImputer', 'strategy': 'constant'}. Best is trial 7 with value: 0.28437434244972926.
[I 2024-10-02 20:45:31,888] Trial 185 finished with value: 0.28437434244972926 and parameters: {'model_name': 'SimpleImputer', 'strategy': 'mean'}. Best is trial 7 with value: 0.28437434244972926.
[I 2024-10-02 20:45:32,010] Trial 189 finished with value: 0.28437434244972926 and parameters: {'model_name': 'SimpleImputer', 'strategy': 'mean'}. Best is trial 7 with value: 0.28437434244972926.
[I 2024-10-02 20:45:32,166] Trial 195 finished with value: 0.4898859373437852 and parameters: {'model_name': 'SimpleImputer', 'strategy': 'constant'}. Best is trial 7 with value: 0.28437434244972926.
[I 2024-10-02 20:45:32,344] Trial 191 finished with value: 0.4898859373437852 and parameters: {'model_name': 'SimpleImputer', 'strategy': 'constant'}. Best is trial 7 with value: 0.28437434244972926.
[I 2024-10-02 20:45:32,474] Trial 187 finished with value: 0.28437434244972926 and parameters: {'model_name': 'SimpleImputer', 'strategy': 'mean'}. Best is trial 7 with value: 0.28437434244972926.
[I 2024-10-02 20:45:32,590] Trial 197 finished with value: 0.4898859373437852 and parameters: {'model_name': 'SimpleImputer', 'strategy': 'constant'}. Best is trial 7 with value: 0.28437434244972926.
[I 2024-10-02 20:45:32,763] Trial 196 finished with value: 0.4898859373437852 and parameters: {'model_name': 'SimpleImputer', 'strategy': 'constant'}. Best is trial 7 with value: 0.28437434244972926.
[I 2024-10-02 20:45:32,930] Trial 194 finished with value: 0.4898859373437852 and parameters: {'model_name': 'SimpleImputer', 'strategy': 'constant'}. Best is trial 7 with value: 0.28437434244972926.
[I 2024-10-02 20:45:33,054] Trial 186 finished with value: 0.28437434244972926 and parameters: {'model_name': 'SimpleImputer', 'strategy': 'mean'}. Best is trial 7 with value: 0.28437434244972926.
[I 2024-10-02 20:45:33,219] Trial 192 finished with value: 0.28437434244972926 and parameters: {'model_name': 'SimpleImputer', 'strategy': 'mean'}. Best is trial 7 with value: 0.28437434244972926.
[I 2024-10-02 20:45:33,351] Trial 188 finished with value: 0.28437434244972926 and parameters: {'model_name': 'SimpleImputer', 'strategy': 'mean'}. Best is trial 7 with value: 0.28437434244972926.
[I 2024-10-02 20:45:33,493] Trial 193 finished with value: 0.28437434244972926 and parameters: {'model_name': 'SimpleImputer', 'strategy': 'mean'}. Best is trial 7 with value: 0.28437434244972926.
[I 2024-10-02 20:45:33,624] Trial 198 finished with value: 0.28437434244972926 and parameters: {'model_name': 'SimpleImputer', 'strategy': 'mean'}. Best is trial 7 with value: 0.28437434244972926.
