[I 2024-11-24 19:29:02,679] Trial 52 finished with value: 0.18258634894034767 and parameters: {'model_name': 'VAE', 'batch_size': 7, 'iterations': 9402, 'learning_rate': 0.002745031406372193, 'p_miss': 0.057162052858999765}. Best is trial 24 with value: 0.08405233435168191.
fit
auto fit
auto transform
0    0
1    0
2    0
3    0
4    0
5    0
dtype: int64
0    0
1    0
2    0
3    0
4    0
5    0
dtype: int64
0.08405233435168191
{'model_name': 'SimpleImputer', 'strategy': 'median'}
running experiment 2/3 - Does reconstruction give good automl predictions
Start est fit
Version 0.1.7a0 of tpot2 is outdated. Version 0.1.8a0 was released Tuesday September 17, 2024.
Version 0.1.7a0 of tpot2 is outdated. Version 0.1.8a0 was released Tuesday September 17, 2024.
Version 0.1.7a0 of tpot2 is outdated. Version 0.1.8a0 was released Tuesday September 17, 2024.
Version 0.1.7a0 of tpot2 is outdated. Version 0.1.8a0 was released Tuesday September 17, 2024.
Version 0.1.7a0 of tpot2 is outdated. Version 0.1.8a0 was released Tuesday September 17, 2024.
Version 0.1.7a0 of tpot2 is outdated. Version 0.1.8a0 was released Tuesday September 17, 2024.
Version 0.1.7a0 of tpot2 is outdated. Version 0.1.8a0 was released Tuesday September 17, 2024.
Version 0.1.7a0 of tpot2 is outdated. Version 0.1.8a0 was released Tuesday September 17, 2024.
Version 0.1.7a0 of tpot2 is outdated. Version 0.1.8a0 was released Tuesday September 17, 2024.
Version 0.1.7a0 of tpot2 is outdated. Version 0.1.8a0 was released Tuesday September 17, 2024.
Version 0.1.7a0 of tpot2 is outdated. Version 0.1.8a0 was released Tuesday September 17, 2024.
Version 0.1.7a0 of tpot2 is outdated. Version 0.1.8a0 was released Tuesday September 17, 2024.
Version 0.1.7a0 of tpot2 is outdated. Version 0.1.8a0 was released Tuesday September 17, 2024.
Version 0.1.7a0 of tpot2 is outdated. Version 0.1.8a0 was released Tuesday September 17, 2024.
Version 0.1.7a0 of tpot2 is outdated. Version 0.1.8a0 was released Tuesday September 17, 2024.
Version 0.1.7a0 of tpot2 is outdated. Version 0.1.8a0 was released Tuesday September 17, 2024.
  0%|          | 0/25 [00:00<?, ?it/s]Generation:   0%|          | 0/25 [00:00<?, ?it/s]Generation:  1
Best f1_score score: 0.9392550818651196
Generation:   4%|▍         | 1/25 [02:46<1:06:33, 166.38s/it]WARNING AN INDIVIDUAL TIMED OUT: 
 <tpot2.search_spaces.pipelines.sequential.SequentialPipelineIndividual object at 0x155467f03c70> 

WARNING AN INDIVIDUAL TIMED OUT: 
 <tpot2.search_spaces.pipelines.sequential.SequentialPipelineIndividual object at 0x155467f036d0> 

Generation:  2
Best f1_score score: 0.9392550818651196
Generation:   8%|▊         | 2/25 [12:49<2:42:22, 423.57s/it]Generation:  3
Best f1_score score: 0.9392550818651196
Generation:  12%|█▏        | 3/25 [16:05<1:57:07, 319.44s/it]Generation:  4
Best f1_score score: 0.9397885631851842
Generation:  16%|█▌        | 4/25 [19:00<1:31:50, 262.40s/it]WARNING THIS INDIVIDUAL CAUSED AND EXCEPTION 
 <tpot2.search_spaces.pipelines.sequential.SequentialPipelineIndividual object at 0x155467f053c0> 
 The 'min_samples_split' parameter of DecisionTreeClassifier must be an int in the range [2, inf) or a float in the range (0.0, 1.0]. Got 1 instead. 
 Traceback (most recent call last):
  File "/common/ketrong/tpotexp/tpot2/tpot2/utils/eval_utils.py", line 53, in objective_nan_wrapper
    value = func_timeout.func_timeout(timeout, objective_function, args=[individual], kwargs=objective_kwargs)
  File "/common/ketrong/tpotexp/env/lib/python3.10/site-packages/func_timeout/dafunc.py", line 108, in func_timeout
    raise_exception(exception)
  File "/common/ketrong/tpotexp/env/lib/python3.10/site-packages/func_timeout/py3_raise.py", line 7, in raise_exception
    raise exception[0] from None
  File "/common/ketrong/tpotexp/tpot2/tpot2/tpot_estimator/estimator.py", line 623, in objective_function
    return objective_function_generator(
  File "/common/ketrong/tpotexp/tpot2/tpot2/tpot_estimator/estimator_utils.py", line 55, in objective_function_generator
    cv_obj_scores = cross_val_score_objective(sklearn.base.clone(pipeline),x,y,scorers=scorers, cv=cv , fold=step)
  File "/common/ketrong/tpotexp/tpot2/tpot2/tpot_estimator/cross_val_utils.py", line 28, in cross_val_score_objective
    this_fold_pipeline.fit(X_train,y_train)
  File "/common/ketrong/tpotexp/env/lib/python3.10/site-packages/sklearn/base.py", line 1473, in wrapper
    return fit_method(estimator, *args, **kwargs)
  File "/common/ketrong/tpotexp/env/lib/python3.10/site-packages/sklearn/pipeline.py", line 473, in fit
    self._final_estimator.fit(Xt, y, **last_step_params["fit"])
  File "/common/ketrong/tpotexp/env/lib/python3.10/site-packages/sklearn/base.py", line 1466, in wrapper
    estimator._validate_params()
  File "/common/ketrong/tpotexp/env/lib/python3.10/site-packages/sklearn/base.py", line 666, in _validate_params
    validate_parameter_constraints(
  File "/common/ketrong/tpotexp/env/lib/python3.10/site-packages/sklearn/utils/_param_validation.py", line 95, in validate_parameter_constraints
    raise InvalidParameterError(
sklearn.utils._param_validation.InvalidParameterError: The 'min_samples_split' parameter of DecisionTreeClassifier must be an int in the range [2, inf) or a float in the range (0.0, 1.0]. Got 1 instead.

Generation:  5
Best f1_score score: 0.9397885631851842
Generation:  20%|██        | 5/25 [23:03<1:25:06, 255.34s/it]WARNING AN INDIVIDUAL TIMED OUT: 
 <tpot2.search_spaces.pipelines.sequential.SequentialPipelineIndividual object at 0x155474731db0> 

WARNING AN INDIVIDUAL TIMED OUT: 
 <tpot2.search_spaces.pipelines.sequential.SequentialPipelineIndividual object at 0x155474736770> 

Generation:  6
Best f1_score score: 0.9405949905100593
Generation:  24%|██▍       | 6/25 [33:09<1:58:39, 374.70s/it]Generation:  7
Best f1_score score: 0.9405949905100593
Generation:  28%|██▊       | 7/25 [35:44<1:30:49, 302.73s/it]WARNING AN INDIVIDUAL TIMED OUT: 
 <tpot2.search_spaces.pipelines.sequential.SequentialPipelineIndividual object at 0x1554746f8670> 

Generation:  8
Best f1_score score: 0.9405949905100593
Generation:  32%|███▏      | 8/25 [45:50<1:53:10, 399.43s/it]Generation:  9
Best f1_score score: 0.9405949905100593
Generation:  36%|███▌      | 9/25 [49:36<1:31:59, 344.99s/it]WARNING AN INDIVIDUAL TIMED OUT: 
 <tpot2.search_spaces.pipelines.sequential.SequentialPipelineIndividual object at 0x15546503f3d0> 

WARNING AN INDIVIDUAL TIMED OUT: 
 <tpot2.search_spaces.pipelines.sequential.SequentialPipelineIndividual object at 0x155474736ad0> 

Generation:  10
Best f1_score score: 0.9405949905100593
Generation:  40%|████      | 10/25 [59:43<1:46:30, 426.00s/it]Generation:  11
Best f1_score score: 0.9405949905100593
Generation:  44%|████▍     | 11/25 [1:03:22<1:24:38, 362.73s/it]Generation:  12
Best f1_score score: 0.9405949905100593
Generation:  48%|████▊     | 12/25 [1:08:08<1:13:32, 339.45s/it]Generation:  13
Best f1_score score: 0.9407503262742001
Generation:  52%|█████▏    | 13/25 [1:11:36<59:55, 299.64s/it]  Generation:  14
Best f1_score score: 0.9407503262742001
Generation:  56%|█████▌    | 14/25 [1:15:38<51:44, 282.23s/it]Generation:  15
Best f1_score score: 0.9415272230404147
Generation:  60%|██████    | 15/25 [1:25:42<1:03:09, 378.98s/it]Generation:  16
Best f1_score score: 0.9415272230404147
Generation:  64%|██████▍   | 16/25 [1:27:53<45:41, 304.56s/it]  Generation:  17
Best f1_score score: 0.9415272230404147
Generation:  68%|██████▊   | 17/25 [1:34:39<44:40, 335.10s/it]Generation:  18
Best f1_score score: 0.9415272230404147
Generation:  72%|███████▏  | 18/25 [1:36:06<30:22, 260.30s/it]Generation:  19
Best f1_score score: 0.9415272230404147
Generation:  76%|███████▌  | 19/25 [1:37:27<20:39, 206.65s/it]Generation:  20
Best f1_score score: 0.9415272230404147
Generation:  80%|████████  | 20/25 [1:38:32<13:39, 163.91s/it]Generation:  21
Best f1_score score: 0.9415272230404147
Generation:  84%|████████▍ | 21/25 [1:42:07<11:57, 179.47s/it]WARNING AN INDIVIDUAL TIMED OUT: 
 <tpot2.search_spaces.pipelines.sequential.SequentialPipelineIndividual object at 0x155467f07d30> 

Generation:  22
Best f1_score score: 0.9415272230404147
Generation:  88%|████████▊ | 22/25 [1:52:18<15:26, 308.92s/it]WARNING THIS INDIVIDUAL CAUSED AND EXCEPTION 
 <tpot2.search_spaces.pipelines.sequential.SequentialPipelineIndividual object at 0x155467e78ca0> 
 The 'min_samples_split' parameter of DecisionTreeClassifier must be an int in the range [2, inf) or a float in the range (0.0, 1.0]. Got 1 instead. 
 Traceback (most recent call last):
  File "/common/ketrong/tpotexp/tpot2/tpot2/utils/eval_utils.py", line 53, in objective_nan_wrapper
    value = func_timeout.func_timeout(timeout, objective_function, args=[individual], kwargs=objective_kwargs)
  File "/common/ketrong/tpotexp/env/lib/python3.10/site-packages/func_timeout/dafunc.py", line 108, in func_timeout
    raise_exception(exception)
  File "/common/ketrong/tpotexp/env/lib/python3.10/site-packages/func_timeout/py3_raise.py", line 7, in raise_exception
    raise exception[0] from None
  File "/common/ketrong/tpotexp/tpot2/tpot2/tpot_estimator/estimator.py", line 623, in objective_function
    return objective_function_generator(
  File "/common/ketrong/tpotexp/tpot2/tpot2/tpot_estimator/estimator_utils.py", line 55, in objective_function_generator
    cv_obj_scores = cross_val_score_objective(sklearn.base.clone(pipeline),x,y,scorers=scorers, cv=cv , fold=step)
  File "/common/ketrong/tpotexp/tpot2/tpot2/tpot_estimator/cross_val_utils.py", line 28, in cross_val_score_objective
    this_fold_pipeline.fit(X_train,y_train)
  File "/common/ketrong/tpotexp/env/lib/python3.10/site-packages/sklearn/base.py", line 1473, in wrapper
    return fit_method(estimator, *args, **kwargs)
  File "/common/ketrong/tpotexp/env/lib/python3.10/site-packages/sklearn/pipeline.py", line 473, in fit
    self._final_estimator.fit(Xt, y, **last_step_params["fit"])
  File "/common/ketrong/tpotexp/env/lib/python3.10/site-packages/sklearn/base.py", line 1466, in wrapper
    estimator._validate_params()
  File "/common/ketrong/tpotexp/env/lib/python3.10/site-packages/sklearn/base.py", line 666, in _validate_params
    validate_parameter_constraints(
  File "/common/ketrong/tpotexp/env/lib/python3.10/site-packages/sklearn/utils/_param_validation.py", line 95, in validate_parameter_constraints
    raise InvalidParameterError(
sklearn.utils._param_validation.InvalidParameterError: The 'min_samples_split' parameter of DecisionTreeClassifier must be an int in the range [2, inf) or a float in the range (0.0, 1.0]. Got 1 instead.

Generation:  23
Best f1_score score: 0.9415272230404147
Generation:  92%|█████████▏| 23/25 [1:53:51<08:08, 244.16s/it]Generation:  24
Best f1_score score: 0.9415272230404147
Generation:  96%|█████████▌| 24/25 [1:56:41<03:41, 221.84s/it]Generation:  25
Best f1_score score: 0.9415272230404147
Generation: 100%|██████████| 25/25 [1:57:58<00:00, 178.33s/it]Generation: 100%|██████████| 25/25 [1:58:01<00:00, 283.27s/it]
2024-11-24 21:27:13,279 - distributed.scheduler - ERROR - Removing worker 'tcp://127.0.0.1:37497' caused the cluster to lose scattered data, which can't be recovered: {'ndarray-89eccf6bf6a2f74b785b9e31bcffba6d', 'ndarray-539c1249a36fffc01bd6829f91e58019'} (stimulus_id='handle-worker-cleanup-1732512433.2796118')
Fitted
Pipeline(steps=[('xgbclassifier',
                 XGBClassifier(base_score=None, booster=None, callbacks=None,
                               colsample_bylevel=None, colsample_bynode=None,
                               colsample_bytree=None, device=None,
                               early_stopping_rounds=None,
                               enable_categorical=False, eval_metric=None,
                               feature_types=None, gamma=1.228195680997,
                               grow_policy=None, importance_type=None,
                               interaction_constraints=None,
                               learning_rate=0.1530061365507, max_bin=None,
                               max_cat_threshold=None, max_cat_to_onehot=None,
                               max_delta_step=None, max_depth=10,
                               max_leaves=None, min_child_weight=3, missing=nan,
                               monotone_constraints=None, multi_strategy=None,
                               n_estimators=100, n_jobs=1, nthread=1,
                               num_parallel_tree=None, ...))])
score start
train score: {'auroc': 0.9940588501424078, 'accuracy': 0.9587413574149852, 'balanced_accuracy': 0.958775433334669, 'logloss': 0.10148346405360281, 'f1': 0.9587254340034161}
original test score: {'auroc': 0.9993266072205254, 'accuracy': 0.990743876284005, 'balanced_accuracy': 0.9907470641080145, 'logloss': 0.029575379805695082, 'f1': 0.9907438743969705}
imputed test score: {'auroc': 0.9863709857911435, 'accuracy': 0.9409075516423976, 'balanced_accuracy': 0.9409433487571017, 'logloss': 0.14388323927954488, 'f1': 0.9408810690977892}
score end
check intended
EXP2 Finished
running experiment 3/3 - What is the best automl settings?
<tpot2.search_spaces.pipelines.sequential.SequentialPipeline object at 0x1554350185b0>
Start tpot fit
Version 0.1.7a0 of tpot2 is outdated. Version 0.1.8a0 was released Tuesday September 17, 2024.
Version 0.1.7a0 of tpot2 is outdated. Version 0.1.8a0 was released Tuesday September 17, 2024.
Version 0.1.7a0 of tpot2 is outdated. Version 0.1.8a0 was released Tuesday September 17, 2024.
Version 0.1.7a0 of tpot2 is outdated. Version 0.1.8a0 was released Tuesday September 17, 2024.
Version 0.1.7a0 of tpot2 is outdated. Version 0.1.8a0 was released Tuesday September 17, 2024.
Version 0.1.7a0 of tpot2 is outdated. Version 0.1.8a0 was released Tuesday September 17, 2024.
Version 0.1.7a0 of tpot2 is outdated. Version 0.1.8a0 was released Tuesday September 17, 2024.
Version 0.1.7a0 of tpot2 is outdated. Version 0.1.8a0 was released Tuesday September 17, 2024.
Version 0.1.7a0 of tpot2 is outdated. Version 0.1.8a0 was released Tuesday September 17, 2024.
Version 0.1.7a0 of tpot2 is outdated. Version 0.1.8a0 was released Tuesday September 17, 2024.
Version 0.1.7a0 of tpot2 is outdated. Version 0.1.8a0 was released Tuesday September 17, 2024.
Version 0.1.7a0 of tpot2 is outdated. Version 0.1.8a0 was released Tuesday September 17, 2024.
Version 0.1.7a0 of tpot2 is outdated. Version 0.1.8a0 was released Tuesday September 17, 2024.
Version 0.1.7a0 of tpot2 is outdated. Version 0.1.8a0 was released Tuesday September 17, 2024.
Version 0.1.7a0 of tpot2 is outdated. Version 0.1.8a0 was released Tuesday September 17, 2024.
Version 0.1.7a0 of tpot2 is outdated. Version 0.1.8a0 was released Tuesday September 17, 2024.
  0%|          | 0/25 [00:00<?, ?it/s]Generation:   0%|          | 0/25 [00:00<?, ?it/s]WARNING AN INDIVIDUAL TIMED OUT: 
 <tpot2.search_spaces.pipelines.sequential.SequentialPipelineIndividual object at 0x1554746a0df0> 

WARNING AN INDIVIDUAL TIMED OUT: 
 <tpot2.search_spaces.pipelines.sequential.SequentialPipelineIndividual object at 0x1554746a0eb0> 

WARNING AN INDIVIDUAL TIMED OUT: 
 <tpot2.search_spaces.pipelines.sequential.SequentialPipelineIndividual object at 0x1554746a03a0> 

WARNING AN INDIVIDUAL TIMED OUT: 
 <tpot2.search_spaces.pipelines.sequential.SequentialPipelineIndividual object at 0x1554746a0370> 

WARNING AN INDIVIDUAL TIMED OUT: 
 <tpot2.search_spaces.pipelines.sequential.SequentialPipelineIndividual object at 0x1554746a0fd0> 

Generation:  1
Best f1_score score: 0.9384049038370754
Generation:   4%|▍         | 1/25 [10:03<4:01:12, 603.04s/it]WARNING AN INDIVIDUAL TIMED OUT: 
 <tpot2.search_spaces.pipelines.sequential.SequentialPipelineIndividual object at 0x1554747362c0> 

WARNING AN INDIVIDUAL TIMED OUT: 
 <tpot2.search_spaces.pipelines.sequential.SequentialPipelineIndividual object at 0x155467893280> 

Generation:  2
Best f1_score score: 0.9388857880013232
Generation:   8%|▊         | 2/25 [20:07<3:51:28, 603.86s/it]WARNING AN INDIVIDUAL TIMED OUT: 
 <tpot2.search_spaces.pipelines.sequential.SequentialPipelineIndividual object at 0x155467c01990> 

WARNING AN INDIVIDUAL TIMED OUT: 
 <tpot2.search_spaces.pipelines.sequential.SequentialPipelineIndividual object at 0x155467613af0> 

WARNING AN INDIVIDUAL TIMED OUT: 
 <tpot2.search_spaces.pipelines.sequential.SequentialPipelineIndividual object at 0x155467d3dc60> 

Generation:  3
Best f1_score score: 0.9388857880013232
Generation:  12%|█▏        | 3/25 [30:12<3:41:39, 604.51s/it]Generation:  4
Best f1_score score: 0.9388857880013232
Generation:  16%|█▌        | 4/25 [33:10<2:32:32, 435.85s/it]Generation:  5
Best f1_score score: 0.9388857880013232
Generation:  20%|██        | 5/25 [35:29<1:49:42, 329.11s/it]WARNING THIS INDIVIDUAL CAUSED AND EXCEPTION 
 <tpot2.search_spaces.pipelines.sequential.SequentialPipelineIndividual object at 0x155464b311b0> 
 The 'min_samples_split' parameter of DecisionTreeClassifier must be an int in the range [2, inf) or a float in the range (0.0, 1.0]. Got 1 instead. 
 Traceback (most recent call last):
  File "/common/ketrong/tpotexp/tpot2/tpot2/utils/eval_utils.py", line 53, in objective_nan_wrapper
    value = func_timeout.func_timeout(timeout, objective_function, args=[individual], kwargs=objective_kwargs)
  File "/common/ketrong/tpotexp/env/lib/python3.10/site-packages/func_timeout/dafunc.py", line 108, in func_timeout
    raise_exception(exception)
  File "/common/ketrong/tpotexp/env/lib/python3.10/site-packages/func_timeout/py3_raise.py", line 7, in raise_exception
    raise exception[0] from None
  File "/common/ketrong/tpotexp/tpot2/tpot2/tpot_estimator/estimator.py", line 623, in objective_function
    return objective_function_generator(
  File "/common/ketrong/tpotexp/tpot2/tpot2/tpot_estimator/estimator_utils.py", line 55, in objective_function_generator
    cv_obj_scores = cross_val_score_objective(sklearn.base.clone(pipeline),x,y,scorers=scorers, cv=cv , fold=step)
  File "/common/ketrong/tpotexp/tpot2/tpot2/tpot_estimator/cross_val_utils.py", line 28, in cross_val_score_objective
    this_fold_pipeline.fit(X_train,y_train)
  File "/common/ketrong/tpotexp/env/lib/python3.10/site-packages/sklearn/base.py", line 1473, in wrapper
    return fit_method(estimator, *args, **kwargs)
  File "/common/ketrong/tpotexp/env/lib/python3.10/site-packages/sklearn/pipeline.py", line 473, in fit
    self._final_estimator.fit(Xt, y, **last_step_params["fit"])
  File "/common/ketrong/tpotexp/env/lib/python3.10/site-packages/sklearn/base.py", line 1466, in wrapper
    estimator._validate_params()
  File "/common/ketrong/tpotexp/env/lib/python3.10/site-packages/sklearn/base.py", line 666, in _validate_params
    validate_parameter_constraints(
  File "/common/ketrong/tpotexp/env/lib/python3.10/site-packages/sklearn/utils/_param_validation.py", line 95, in validate_parameter_constraints
    raise InvalidParameterError(
sklearn.utils._param_validation.InvalidParameterError: The 'min_samples_split' parameter of DecisionTreeClassifier must be an int in the range [2, inf) or a float in the range (0.0, 1.0]. Got 1 instead.

WARNING AN INDIVIDUAL TIMED OUT: 
 <tpot2.search_spaces.pipelines.sequential.SequentialPipelineIndividual object at 0x155467f25300> 

Generation:  6
Best f1_score score: 0.9388880991237322
Generation:  24%|██▍       | 6/25 [45:35<2:13:58, 423.08s/it]WARNING AN INDIVIDUAL TIMED OUT: 
 <tpot2.search_spaces.pipelines.sequential.SequentialPipelineIndividual object at 0x15546561e770> 

WARNING AN INDIVIDUAL TIMED OUT: 
 <tpot2.search_spaces.pipelines.sequential.SequentialPipelineIndividual object at 0x155464ad8dc0> 

WARNING AN INDIVIDUAL TIMED OUT: 
 <tpot2.search_spaces.pipelines.sequential.SequentialPipelineIndividual object at 0x155467906650> 

Generation:  7
Best f1_score score: 0.9408769532623757
Generation:  28%|██▊       | 7/25 [55:41<2:24:49, 482.78s/it]WARNING AN INDIVIDUAL TIMED OUT: 
 <tpot2.search_spaces.pipelines.sequential.SequentialPipelineIndividual object at 0x1554675cb190> 

WARNING AN INDIVIDUAL TIMED OUT: 
 <tpot2.search_spaces.pipelines.sequential.SequentialPipelineIndividual object at 0x1554746fc730> 

WARNING AN INDIVIDUAL TIMED OUT: 
 <tpot2.search_spaces.pipelines.sequential.SequentialPipelineIndividual object at 0x155467db21d0> 

WARNING AN INDIVIDUAL TIMED OUT: 
 <tpot2.search_spaces.pipelines.sequential.SequentialPipelineIndividual object at 0x1554746553c0> 

WARNING AN INDIVIDUAL TIMED OUT: 
 <tpot2.search_spaces.pipelines.sequential.SequentialPipelineIndividual object at 0x155467f025f0> 

Generation:  8
Best f1_score score: 0.940877231378303
Generation:  32%|███▏      | 8/25 [1:05:45<2:27:44, 521.44s/it]Generation:  9
Best f1_score score: 0.940877231378303
Generation:  36%|███▌      | 9/25 [1:06:35<1:39:46, 374.15s/it]Generation:  10
Best f1_score score: 0.940877231378303
Generation:  40%|████      | 10/25 [1:08:31<1:13:37, 294.52s/it]WARNING AN INDIVIDUAL TIMED OUT: 
 <tpot2.search_spaces.pipelines.sequential.SequentialPipelineIndividual object at 0x155464eca8c0> 

Generation:  11
Best f1_score score: 0.940877231378303
Generation:  44%|████▍     | 11/25 [1:18:37<1:30:58, 389.88s/it]WARNING AN INDIVIDUAL TIMED OUT: 
 <tpot2.search_spaces.pipelines.sequential.SequentialPipelineIndividual object at 0x155466978490> 

Generation:  12
Best f1_score score: 0.940877231378303
Generation:  48%|████▊     | 12/25 [1:28:42<1:38:37, 455.19s/it]WARNING AN INDIVIDUAL TIMED OUT: 
 <tpot2.search_spaces.pipelines.sequential.SequentialPipelineIndividual object at 0x1554537d8100> 

Generation:  13
Best f1_score score: 0.940877231378303
Generation:  52%|█████▏    | 13/25 [1:38:48<1:40:09, 500.83s/it]WARNING AN INDIVIDUAL TIMED OUT: 
 <tpot2.search_spaces.pipelines.sequential.SequentialPipelineIndividual object at 0x1554678ec340> 

WARNING AN INDIVIDUAL TIMED OUT: 
 <tpot2.search_spaces.pipelines.sequential.SequentialPipelineIndividual object at 0x1554746a2080> 

Generation:  14
Best f1_score score: