Run: 63
/cm/local/apps/slurm/var/spool/job1068159/slurm_script: line 27: 
pip install -e tpot2
pip install -r tpot2/ImputerExperiments/requirements_.txt
: No such file or directory
RunStart
Version 0.1.7a0 of tpot2 is outdated. Version 0.1.8a0 was released Tuesday September 17, 2024.
starting loops
../data/c/40677/40677.pkl
working on 
../data/c/40677/class_simple_MCAR_0.3_3
0.4567720890045166
running experiment 1/3 - Does large hyperparameter space improve reconstruction accuracy over simple
[I 2024-11-20 22:46:33,604] A new study created in memory with name: no-name-9bf3592a-87ae-440a-81d0-33f116359c00
running
running
running
running
running
running
running
running
running
running
running
running
running
running
running
running
[I 2024-11-20 22:46:33,906] Trial 2 finished with value: 0.6201151885589505 and parameters: {'model_name': 'SimpleImputer', 'strategy': 'constant'}. Best is trial 2 with value: 0.6201151885589505.
running
[I 2024-11-20 22:46:34,114] Trial 4 finished with value: 0.6201151885589505 and parameters: {'model_name': 'SimpleImputer', 'strategy': 'constant'}. Best is trial 2 with value: 0.6201151885589505.
running
[I 2024-11-20 22:46:34,247] Trial 0 finished with value: 0.6201151885589505 and parameters: {'model_name': 'SimpleImputer', 'strategy': 'constant'}. Best is trial 2 with value: 0.6201151885589505.
[I 2024-11-20 22:46:34,338] Trial 9 finished with value: 0.43223081596941393 and parameters: {'model_name': 'SimpleImputer', 'strategy': 'mean'}. Best is trial 9 with value: 0.43223081596941393.
running
running
[I 2024-11-20 22:46:34,478] Trial 6 finished with value: 0.43223081596941393 and parameters: {'model_name': 'SimpleImputer', 'strategy': 'mean'}. Best is trial 9 with value: 0.43223081596941393.
running
[I 2024-11-20 22:46:34,839] Trial 8 finished with value: 0.5864889703340403 and parameters: {'model_name': 'SimpleImputer', 'strategy': 'median'}. Best is trial 9 with value: 0.43223081596941393.
running
[I 2024-11-20 22:46:34,942] Trial 15 finished with value: 0.6201151885589505 and parameters: {'model_name': 'SimpleImputer', 'strategy': 'constant'}. Best is trial 9 with value: 0.43223081596941393.
running
[I 2024-11-20 22:46:35,100] Trial 3 finished with value: 0.5864889703340403 and parameters: {'model_name': 'SimpleImputer', 'strategy': 'median'}. Best is trial 9 with value: 0.43223081596941393.
running
[I 2024-11-20 22:46:35,200] Trial 14 finished with value: 0.5864889703340403 and parameters: {'model_name': 'SimpleImputer', 'strategy': 'median'}. Best is trial 9 with value: 0.43223081596941393.
running
[I 2024-11-20 22:46:35,406] Trial 5 finished with value: 0.5864889703340403 and parameters: {'model_name': 'SimpleImputer', 'strategy': 'median'}. Best is trial 9 with value: 0.43223081596941393.
running
[I 2024-11-20 22:46:35,615] Trial 16 finished with value: 0.5864889703340403 and parameters: {'model_name': 'SimpleImputer', 'strategy': 'median'}. Best is trial 9 with value: 0.43223081596941393.
running
[I 2024-11-20 22:46:35,801] Trial 17 finished with value: 0.43223081596941393 and parameters: {'model_name': 'SimpleImputer', 'strategy': 'mean'}. Best is trial 9 with value: 0.43223081596941393.
[I 2024-11-20 22:46:35,919] Trial 23 finished with value: 0.6201151885589505 and parameters: {'model_name': 'SimpleImputer', 'strategy': 'constant'}. Best is trial 9 with value: 0.43223081596941393.
[I 2024-11-20 22:46:36,010] Trial 13 finished with value: 0.5864889703340403 and parameters: {'model_name': 'SimpleImputer', 'strategy': 'median'}. Best is trial 9 with value: 0.43223081596941393.
running
running
running
[I 2024-11-20 22:46:36,166] Trial 22 finished with value: 0.6201151885589505 and parameters: {'model_name': 'SimpleImputer', 'strategy': 'constant'}. Best is trial 9 with value: 0.43223081596941393.
running
[I 2024-11-20 22:46:36,344] Trial 19 finished with value: 0.5864889703340403 and parameters: {'model_name': 'SimpleImputer', 'strategy': 'median'}. Best is trial 9 with value: 0.43223081596941393.
[I 2024-11-20 22:46:36,493] Trial 1 finished with value: 0.5864889703340403 and parameters: {'model_name': 'SimpleImputer', 'strategy': 'most_frequent'}. Best is trial 9 with value: 0.43223081596941393.
[I 2024-11-20 22:46:36,578] Trial 18 finished with value: 0.5864889703340403 and parameters: {'model_name': 'SimpleImputer', 'strategy': 'median'}. Best is trial 9 with value: 0.43223081596941393.
running
[I 2024-11-20 22:46:36,703] Trial 20 finished with value: 0.5864889703340403 and parameters: {'model_name': 'SimpleImputer', 'strategy': 'median'}. Best is trial 9 with value: 0.43223081596941393.
running
running
running
[I 2024-11-20 22:46:36,877] Trial 25 finished with value: 0.43223081596941393 and parameters: {'model_name': 'SimpleImputer', 'strategy': 'mean'}. Best is trial 9 with value: 0.43223081596941393.
[I 2024-11-20 22:46:36,984] Trial 10 finished with value: 0.5864889703340403 and parameters: {'model_name': 'SimpleImputer', 'strategy': 'most_frequent'}. Best is trial 9 with value: 0.43223081596941393.
running
running
[I 2024-11-20 22:46:37,233] Trial 27 finished with value: 0.43223081596941393 and parameters: {'model_name': 'SimpleImputer', 'strategy': 'mean'}. Best is trial 9 with value: 0.43223081596941393.
running
[I 2024-11-20 22:46:37,357] Trial 26 finished with value: 0.43223081596941393 and parameters: {'model_name': 'SimpleImputer', 'strategy': 'mean'}. Best is trial 9 with value: 0.43223081596941393.
running
[I 2024-11-20 22:46:37,523] Trial 11 finished with value: 0.5864889703340403 and parameters: {'model_name': 'SimpleImputer', 'strategy': 'most_frequent'}. Best is trial 9 with value: 0.43223081596941393.
running
[I 2024-11-20 22:46:37,659] Trial 30 finished with value: 0.43223081596941393 and parameters: {'model_name': 'SimpleImputer', 'strategy': 'mean'}. Best is trial 9 with value: 0.43223081596941393.
[I 2024-11-20 22:46:37,749] Trial 7 finished with value: 0.5864889703340403 and parameters: {'model_name': 'SimpleImputer', 'strategy': 'most_frequent'}. Best is trial 9 with value: 0.43223081596941393.
[I 2024-11-20 22:46:37,835] Trial 12 finished with value: 0.5864889703340403 and parameters: {'model_name': 'SimpleImputer', 'strategy': 'most_frequent'}. Best is trial 9 with value: 0.43223081596941393.
running
running
[I 2024-11-20 22:46:37,943] Trial 24 finished with value: 0.5864889703340403 and parameters: {'model_name': 'SimpleImputer', 'strategy': 'median'}. Best is trial 9 with value: 0.43223081596941393.
running
running
[I 2024-11-20 22:46:38,100] Trial 34 finished with value: 0.43223081596941393 and parameters: {'model_name': 'SimpleImputer', 'strategy': 'mean'}. Best is trial 9 with value: 0.43223081596941393.
[I 2024-11-20 22:46:38,205] Trial 28 finished with value: 0.43223081596941393 and parameters: {'model_name': 'SimpleImputer', 'strategy': 'mean'}. Best is trial 9 with value: 0.43223081596941393.
running
running
[I 2024-11-20 22:46:38,324] Trial 31 finished with value: 0.43223081596941393 and parameters: {'model_name': 'SimpleImputer', 'strategy': 'mean'}. Best is trial 9 with value: 0.43223081596941393.
[I 2024-11-20 22:46:38,413] Trial 33 finished with value: 0.43223081596941393 and parameters: {'model_name': 'SimpleImputer', 'strategy': 'mean'}. Best is trial 9 with value: 0.43223081596941393.
[I 2024-11-20 22:46:38,536] Trial 35 finished with value: 0.43223081596941393 and parameters: {'model_name': 'SimpleImputer', 'strategy': 'mean'}. Best is trial 9 with value: 0.43223081596941393.
running
running
[I 2024-11-20 22:46:38,662] Trial 29 finished with value: 0.43223081596941393 and parameters: {'model_name': 'SimpleImputer', 'strategy': 'mean'}. Best is trial 9 with value: 0.43223081596941393.
running
running
[I 2024-11-20 22:46:38,806] Trial 32 finished with value: 0.43223081596941393 and parameters: {'model_name': 'SimpleImputer', 'strategy': 'mean'}. Best is trial 9 with value: 0.43223081596941393.
running
[I 2024-11-20 22:46:38,936] Trial 21 finished with value: 0.5864889703340403 and parameters: {'model_name': 'SimpleImputer', 'strategy': 'most_frequent'}. Best is trial 9 with value: 0.43223081596941393.
[I 2024-11-20 22:46:39,026] Trial 38 finished with value: 0.43223081596941393 and parameters: {'model_name': 'SimpleImputer', 'strategy': 'mean'}. Best is trial 9 with value: 0.43223081596941393.
[I 2024-11-20 22:46:39,126] Trial 37 finished with value: 0.43223081596941393 and parameters: {'model_name': 'SimpleImputer', 'strategy': 'mean'}. Best is trial 9 with value: 0.43223081596941393.
running
running
running
[I 2024-11-20 22:46:39,302] Trial 43 finished with value: 0.43223081596941393 and parameters: {'model_name': 'SimpleImputer', 'strategy': 'mean'}. Best is trial 9 with value: 0.43223081596941393.
running
[I 2024-11-20 22:46:39,409] Trial 36 finished with value: 0.43223081596941393 and parameters: {'model_name': 'SimpleImputer', 'strategy': 'mean'}. Best is trial 9 with value: 0.43223081596941393.
[I 2024-11-20 22:46:39,518] Trial 41 finished with value: 0.43223081596941393 and parameters: {'model_name': 'SimpleImputer', 'strategy': 'mean'}. Best is trial 9 with value: 0.43223081596941393.
running
[I 2024-11-20 22:46:39,613] Trial 39 finished with value: 0.43223081596941393 and parameters: {'model_name': 'SimpleImputer', 'strategy': 'mean'}. Best is trial 9 with value: 0.43223081596941393.
running
running
[I 2024-11-20 22:46:39,833] Trial 40 finished with value: 0.43223081596941393 and parameters: {'model_name': 'SimpleImputer', 'strategy': 'mean'}. Best is trial 9 with value: 0.43223081596941393.
[I 2024-11-20 22:46:39,941] Trial 44 finished with value: 0.43223081596941393 and parameters: {'model_name': 'SimpleImputer', 'strategy': 'mean'}. Best is trial 9 with value: 0.43223081596941393.
running
[I 2024-11-20 22:46:40,056] Trial 46 finished with value: 0.43223081596941393 and parameters: {'model_name': 'SimpleImputer', 'strategy': 'mean'}. Best is trial 9 with value: 0.43223081596941393.
running
[I 2024-11-20 22:46:40,156] Trial 42 finished with value: 0.43223081596941393 and parameters: {'model_name': 'SimpleImputer', 'strategy': 'mean'}. Best is trial 9 with value: 0.43223081596941393.
running
running
[I 2024-11-20 22:46:40,272] Trial 50 finished with value: 0.43223081596941393 and parameters: {'model_name': 'SimpleImputer', 'strategy': 'mean'}. Best is trial 9 with value: 0.43223081596941393.
running
[I 2024-11-20 22:46:40,380] Trial 48 finished with value: 0.43223081596941393 and parameters: {'model_name': 'SimpleImputer', 'strategy': 'mean'}. Best is trial 9 with value: 0.43223081596941393.
running
[I 2024-11-20 22:46:40,503] Trial 49 finished with value: 0.43223081596941393 and parameters: {'model_name': 'SimpleImputer', 'strategy': 'mean'}. Best is trial 9 with value: 0.43223081596941393.
[I 2024-11-20 22:46:40,505] Trial 47 finished with value: 0.43223081596941393 and parameters: {'model_name': 'SimpleImputer', 'strategy': 'mean'}. Best is trial 9 with value: 0.43223081596941393.
running
[I 2024-11-20 22:46:40,723] Trial 52 finished with value: 0.43223081596941393 and parameters: {'model_name': 'SimpleImputer', 'strategy': 'mean'}. Best is trial 9 with value: 0.43223081596941393.
running
running
[I 2024-11-20 22:46:40,876] Trial 45 finished with value: 0.43223081596941393 and parameters: {'model_name': 'SimpleImputer', 'strategy': 'mean'}. Best is trial 9 with value: 0.43223081596941393.
[I 2024-11-20 22:46:40,972] Trial 53 finished with value: 0.43223081596941393 and parameters: {'model_name': 'SimpleImputer', 'strategy': 'mean'}. Best is trial 9 with value: 0.43223081596941393.
running
[I 2024-11-20 22:46:41,095] Trial 51 finished with value: 0.43223081596941393 and parameters: {'model_name': 'SimpleImputer', 'strategy': 'mean'}. Best is trial 9 with value: 0.43223081596941393.
running
[I 2024-11-20 22:46:41,205] Trial 54 finished with value: 0.43223081596941393 and parameters: {'model_name': 'SimpleImputer', 'strategy': 'mean'}. Best is trial 9 with value: 0.43223081596941393.
[I 2024-11-20 22:46:41,300] Trial 59 finished with value: 0.43223081596941393 and parameters: {'model_name': 'SimpleImputer', 'strategy': 'mean'}. Best is trial 9 with value: 0.43223081596941393.
running
running
running
[I 2024-11-20 22:46:41,466] Trial 57 finished with value: 0.43223081596941393 and parameters: {'model_name': 'SimpleImputer', 'strategy': 'mean'}. Best is trial 9 with value: 0.43223081596941393.
[I 2024-11-20 22:46:41,559] Trial 56 finished with value: 0.43223081596941393 and parameters: {'model_name': 'SimpleImputer', 'strategy': 'mean'}. Best is trial 9 with value: 0.43223081596941393.
running
running
[I 2024-11-20 22:46:41,807] Trial 55 finished with value: 0.43223081596941393 and parameters: {'model_name': 'SimpleImputer', 'strategy': 'mean'}. Best is trial 9 with value: 0.43223081596941393.
[I 2024-11-20 22:46:41,906] Trial 61 finished with value: 0.43223081596941393 and parameters: {'model_name': 'SimpleImputer', 'strategy': 'mean'}. Best is trial 9 with value: 0.43223081596941393.
running
[I 2024-11-20 22:46:42,085] Trial 60 finished with value: 0.43223081596941393 and parameters: {'model_name': 'SimpleImputer', 'strategy': 'mean'}. Best is trial 9 with value: 0.43223081596941393.
running
running
[I 2024-11-20 22:46:42,240] Trial 66 finished with value: 0.6201151885589505 and parameters: {'model_name': 'SimpleImputer', 'strategy': 'constant'}. Best is trial 9 with value: 0.43223081596941393.
running
[I 2024-11-20 22:46:42,354] Trial 58 finished with value: 0.43223081596941393 and parameters: {'model_name': 'SimpleImputer', 'strategy': 'mean'}. Best is trial 9 with value: 0.43223081596941393.
running
[I 2024-11-20 22:46:42,504] Trial 62 finished with value: 0.43223081596941393 and parameters: {'model_name': 'SimpleImputer', 'strategy': 'mean'}. Best is trial 9 with value: 0.43223081596941393.
running
[I 2024-11-20 22:46:44,102] Trial 64 finished with value: 0.5864889703340403 and parameters: {'model_name': 'SimpleImputer', 'strategy': 'most_frequent'}. Best is trial 9 with value: 0.43223081596941393.
running
[I 2024-11-20 22:46:44,332] Trial 68 finished with value: 0.5864889703340403 and parameters: {'model_name': 'SimpleImputer', 'strategy': 'most_frequent'}. Best is trial 9 with value: 0.43223081596941393.
running
[I 2024-11-20 22:46:44,540] Trial 67 finished with value: 0.5864889703340403 and parameters: {'model_name': 'SimpleImputer', 'strategy': 'most_frequent'}. Best is trial 9 with value: 0.43223081596941393.
running
[I 2024-11-20 22:46:44,698] Trial 70 finished with value: 0.5864889703340403 and parameters: {'model_name': 'SimpleImputer', 'strategy': 'most_frequent'}. Best is trial 9 with value: 0.43223081596941393.
[I 2024-11-20 22:46:44,823] Trial 63 finished with value: 0.5864889703340403 and parameters: {'model_name': 'SimpleImputer', 'strategy': 'most_frequent'}. Best is trial 9 with value: 0.43223081596941393.
[I 2024-11-20 22:46:44,961] Trial 76 finished with value: 0.5864889703340403 and parameters: {'model_name': 'SimpleImputer', 'strategy': 'most_frequent'}. Best is trial 9 with value: 0.43223081596941393.
running
running
running
[I 2024-11-20 22:46:45,220] Trial 75 finished with value: 0.5864889703340403 and parameters: {'model_name': 'SimpleImputer', 'strategy': 'most_frequent'}. Best is trial 9 with value: 0.43223081596941393.
running
[I 2024-11-20 22:46:45,330] Trial 71 finished with value: 0.5864889703340403 and parameters: {'model_name': 'SimpleImputer', 'strategy': 'most_frequent'}. Best is trial 9 with value: 0.43223081596941393.
[I 2024-11-20 22:46:45,418] Trial 69 finished with value: 0.5864889703340403 and parameters: {'model_name': 'SimpleImputer', 'strategy': 'most_frequent'}. Best is trial 9 with value: 0.43223081596941393.
running
running
[I 2024-11-20 22:46:45,556] Trial 65 finished with value: 0.5864889703340403 and parameters: {'model_name': 'SimpleImputer', 'strategy': 'most_frequent'}. Best is trial 9 with value: 0.43223081596941393.
running
[I 2024-11-20 22:46:45,753] Trial 81 finished with value: 0.6201151885589505 and parameters: {'model_name': 'SimpleImputer', 'strategy': 'constant'}. Best is trial 9 with value: 0.43223081596941393.
running
[I 2024-11-20 22:46:45,940] Trial 85 finished with value: 0.6201151885589505 and parameters: {'model_name': 'SimpleImputer', 'strategy': 'constant'}. Best is trial 9 with value: 0.43223081596941393.
running
[I 2024-11-20 22:46:46,085] Trial 74 finished with value: 0.5864889703340403 and parameters: {'model_name': 'SimpleImputer', 'strategy': 'most_frequent'}. Best is trial 9 with value: 0.43223081596941393.
[I 2024-11-20 22:46:46,177] Trial 83 finished with value: 0.6201151885589505 and parameters: {'model_name': 'SimpleImputer', 'strategy': 'constant'}. Best is trial 9 with value: 0.43223081596941393.
[I 2024-11-20 22:46:46,259] Trial 82 finished with value: 0.6201151885589505 and parameters: {'model_name': 'SimpleImputer', 'strategy': 'constant'}. Best is trial 9 with value: 0.43223081596941393.
running
running
[I 2024-11-20 22:46:46,371] Trial 72 finished with value: 0.5864889703340403 and parameters: {'model_name': 'SimpleImputer', 'strategy': 'most_frequent'}. Best is trial 9 with value: 0.43223081596941393.
running
running
[I 2024-11-20 22:46:46,519] Trial 87 finished with value: 0.6201151885589505 and parameters: {'model_name': 'SimpleImputer', 'strategy': 'constant'}. Best is trial 9 with value: 0.43223081596941393.
running
[I 2024-11-20 22:46:46,640] Trial 77 finished with value: 0.5864889703340403 and parameters: {'model_name': 'SimpleImputer', 'strategy': 'most_frequent'}. Best is trial 9 with value: 0.43223081596941393.
[I 2024-11-20 22:46:46,744] Trial 73 finished with value: 0.5864889703340403 and parameters: {'model_name': 'SimpleImputer', 'strategy': 'most_frequent'}. Best is trial 9 with value: 0.43223081596941393.
running
[I 2024-11-20 22:46:46,858] Trial 86 finished with value: 0.6201151885589505 and parameters: {'model_name': 'SimpleImputer', 'strategy': 'constant'}. Best is trial 9 with value: 0.43223081596941393.
running
[I 2024-11-20 22:46:46,954] Trial 84 finished with value: 0.6201151885589505 and parameters: {'model_name': 'SimpleImputer', 'strategy': 'constant'}. Best is trial 9 with value: 0.43223081596941393.
running
running
[I 2024-11-20 22:46:47,090] Trial 89 finished with value: 0.6201151885589505 and parameters: {'model_name': 'SimpleImputer', 'strategy': 'constant'}. Best is trial 9 with value: 0.43223081596941393.
[I 2024-11-20 22:46:47,185] Trial 88 finished with value: 0.6201151885589505 and parameters: {'model_name': 'SimpleImputer', 'strategy': 'constant'}. Best is trial 9 with value: 0.43223081596941393.
running
[I 2024-11-20 22:46:47,277] Trial 78 finished with value: 0.5864889703340403 and parameters: {'model_name': 'SimpleImputer', 'strategy': 'most_frequent'}. Best is trial 9 with value: 0.43223081596941393.
running
running
[I 2024-11-20 22:46:47,490] Trial 80 finished with value: 0.5864889703340403 and parameters: {'model_name': 'SimpleImputer', 'strategy': 'most_frequent'}. Best is trial 9 with value: 0.43223081596941393.
running
[I 2024-11-20 22:46:47,647] Trial 90 finished with value: 0.43223081596941393 and parameters: {'model_name': 'SimpleImputer', 'strategy': 'mean'}. Best is trial 9 with value: 0.43223081596941393.
running
[I 2024-11-20 22:46:47,805] Trial 79 finished with value: 0.5864889703340403 and parameters: {'model_name': 'SimpleImputer', 'strategy': 'most_frequent'}. Best is trial 9 with value: 0.43223081596941393.
running
[I 2024-11-20 22:46:47,927] Trial 91 finished with value: 0.43223081596941393 and parameters: {'model_name': 'SimpleImputer', 'strategy': 'mean'}. Best is trial 9 with value: 0.43223081596941393.
running
[I 2024-11-20 22:46:48,050] Trial 102 finished with value: 0.43223081596941393 and parameters: {'model_name': 'SimpleImputer', 'strategy': 'mean'}. Best is trial 9 with value: 0.43223081596941393.
running
[I 2024-11-20 22:46:48,184] Trial 96 finished with value: 0.43223081596941393 and parameters: {'model_name': 'SimpleImputer', 'strategy': 'mean'}. Best is trial 9 with value: 0.43223081596941393.
running
[I 2024-11-20 22:46:48,339] Trial 97 finished with value: 0.43223081596941393 and parameters: {'model_name': 'SimpleImputer', 'strategy': 'mean'}. Best is trial 9 with value: 0.43223081596941393.
[I 2024-11-20 22:46:48,433] Trial 100 finished with value: 0.43223081596941393 and parameters: {'model_name': 'SimpleImputer', 'strategy': 'mean'}. Best is trial 9 with value: 0.43223081596941393.
running
running
[I 2024-11-20 22:46:48,589] Trial 98 finished with value: 0.43223081596941393 and parameters: {'model_name': 'SimpleImputer', 'strategy': 'mean'}. Best is trial 9 with value: 0.43223081596941393.
[I 2024-11-20 22:46:48,687] Trial 101 finished with value: 0.43223081596941393 and parameters: {'model_name': 'SimpleImputer', 'strategy': 'mean'}. Best is trial 9 with value: 0.43223081596941393.
running
running
[I 2024-11-20 22:46:48,802] Trial 94 finished with value: 0.5864889703340403 and parameters: {'model_name': 'SimpleImputer', 'strategy': 'median'}. Best is trial 9 with value: 0.43223081596941393.
[I 2024-11-20 22:46:48,895] Trial 103 finished with value: 0.43223081596941393 and parameters: {'model_name': 'SimpleImputer', 'strategy': 'mean'}. Best is trial 9 with value: 0.43223081596941393.
running
running
[I 2024-11-20 22:46:49,032] Trial 95 finished with value: 0.5864889703340403 and parameters: {'model_name': 'SimpleImputer', 'strategy': 'median'}. Best is trial 9 with value: 0.43223081596941393.
running
[I 2024-11-20 22:46:49,150] Trial 104 finished with value: 0.43223081596941393 and parameters: {'model_name': 'SimpleImputer', 'strategy': 'mean'}. Best is trial 9 with value: 0.43223081596941393.
[I 2024-11-20 22:46:49,240] Trial 99 finished with value: 0.43223081596941393 and parameters: {'model_name': 'SimpleImputer', 'strategy': 'mean'}. Best is trial 9 with value: 0.43223081596941393.
running
running
