Run: 9
/cm/local/apps/slurm/var/spool/job993018/slurm_script: line 26: 
pip install -e tpot2
pip install -r tpot2/ImputerExperiments/requirements_.txt
: No such file or directory
RunStart
Version 0.1.7a0 of tpot2 is outdated. Version 0.1.8a0 was released Tuesday September 17, 2024.
starting loops
../data/r/23515/23515.pkl
working on 
../data/r/23515/reg_full_MNAR_0.01_1
3.8234457969665527
running experiment 1/3 - Does large hyperparameter space improve reconstruction accuracy over simple
[I 2024-10-08 02:18:36,817] A new study created in memory with name: no-name-2294466f-e577-44f5-8f8f-579784dc59bb
running
running
running
running
running
running
running
running
running
running
running
running
running
running
running
running
[I 2024-10-08 02:18:37,163] Trial 2 finished with value: 0.21969836972412468 and parameters: {'model_name': 'SimpleImputer', 'strategy': 'median'}. Best is trial 2 with value: 0.21969836972412468.
running
[I 2024-10-08 02:18:37,383] Trial 10 finished with value: 0.21969836972412468 and parameters: {'model_name': 'SimpleImputer', 'strategy': 'median'}. Best is trial 2 with value: 0.21969836972412468.
[I 2024-10-08 02:18:37,389] Trial 11 finished with value: 0.21969836972412468 and parameters: {'model_name': 'SimpleImputer', 'strategy': 'median'}. Best is trial 2 with value: 0.21969836972412468.
running
running
[I 2024-10-08 02:18:37,771] Trial 18 finished with value: 0.20492140525175268 and parameters: {'model_name': 'SimpleImputer', 'strategy': 'mean'}. Best is trial 18 with value: 0.20492140525175268.
running
[I 2024-10-08 02:18:40,591] Trial 16 finished with value: 0.12019966139574781 and parameters: {'model_name': 'KNNImputer', 'n_neighbors': 976, 'weights': 'uniform'}. Best is trial 16 with value: 0.12019966139574781.
running
[I 2024-10-08 02:18:41,439] Trial 7 finished with value: 0.11995007497883572 and parameters: {'model_name': 'KNNImputer', 'n_neighbors': 3071, 'weights': 'distance'}. Best is trial 7 with value: 0.11995007497883572.
running
[I 2024-10-08 02:18:50,275] Trial 13 finished with value: 0.10769528869681352 and parameters: {'model_name': 'IterativeImputer', 'estimator': 'Bayesian', 'initial_strategy': 'mean', 'n_nearest_features': 5, 'imputation_order': 'ascending', 'sample_posterior': False}. Best is trial 13 with value: 0.10769528869681352.
running
[I 2024-10-08 02:18:51,036] Trial 17 finished with value: 0.2634459731032218 and parameters: {'model_name': 'VAE', 'batch_size': 17, 'iterations': 8, 'learning_rate': 0.002586545442399045, 'p_miss': 0.26278398658283275}. Best is trial 13 with value: 0.10769528869681352.
running
[I 2024-10-08 02:18:53,576] Trial 12 finished with value: 0.06814403334723926 and parameters: {'model_name': 'IterativeImputer', 'estimator': 'KNN', 'initial_strategy': 'median', 'n_nearest_features': 5, 'imputation_order': 'descending'}. Best is trial 12 with value: 0.06814403334723926.
running
[I 2024-10-08 02:18:55,421] Trial 23 finished with value: 0.13813944467498152 and parameters: {'model_name': 'KNNImputer', 'n_neighbors': 1671, 'weights': 'uniform'}. Best is trial 12 with value: 0.06814403334723926.
running
[I 2024-10-08 02:18:55,664] Trial 22 finished with value: 0.16118890960553617 and parameters: {'model_name': 'KNNImputer', 'n_neighbors': 3083, 'weights': 'uniform'}. Best is trial 12 with value: 0.06814403334723926.
running
[I 2024-10-08 02:18:58,411] Trial 19 finished with value: 0.24624629943673568 and parameters: {'model_name': 'VAE', 'batch_size': 1, 'iterations': 12, 'learning_rate': 0.003518909247223527, 'p_miss': 0.01746886222021479}. Best is trial 12 with value: 0.06814403334723926.
running
[I 2024-10-08 02:18:59,602] Trial 6 finished with value: 0.15817501337908008 and parameters: {'model_name': 'IterativeImputer', 'estimator': 'Bayesian', 'initial_strategy': 'median', 'n_nearest_features': 5, 'imputation_order': 'arabic', 'sample_posterior': True}. Best is trial 12 with value: 0.06814403334723926.
running
[I 2024-10-08 02:19:15,647] Trial 25 finished with value: 0.06814403334723926 and parameters: {'model_name': 'IterativeImputer', 'estimator': 'KNN', 'initial_strategy': 'median', 'n_nearest_features': 6, 'imputation_order': 'descending'}. Best is trial 12 with value: 0.06814403334723926.
running
[I 2024-10-08 02:19:18,110] Trial 26 finished with value: 0.06814403334723926 and parameters: {'model_name': 'IterativeImputer', 'estimator': 'KNN', 'initial_strategy': 'median', 'n_nearest_features': 5, 'imputation_order': 'descending'}. Best is trial 12 with value: 0.06814403334723926.
running
[I 2024-10-08 02:19:19,695] Trial 27 finished with value: 0.06739459834185656 and parameters: {'model_name': 'IterativeImputer', 'estimator': 'KNN', 'initial_strategy': 'median', 'n_nearest_features': 5, 'imputation_order': 'ascending'}. Best is trial 27 with value: 0.06739459834185656.
running
[I 2024-10-08 02:19:20,682] Trial 28 finished with value: 0.0639902920074974 and parameters: {'model_name': 'IterativeImputer', 'estimator': 'KNN', 'initial_strategy': 'mean', 'n_nearest_features': 5, 'imputation_order': 'descending'}. Best is trial 28 with value: 0.0639902920074974.
running
[I 2024-10-08 02:19:25,784] Trial 24 finished with value: 0.21499552860181925 and parameters: {'model_name': 'VAE', 'batch_size': 126, 'iterations': 7, 'learning_rate': 0.016978057316767263, 'p_miss': 0.08895424225684741}. Best is trial 28 with value: 0.0639902920074974.
running
[I 2024-10-08 02:19:38,402] Trial 5 finished with value: 0.4456278003046494 and parameters: {'model_name': 'GAIN', 'batch_size': 519, 'hint_rate': 0.270993979258898, 'alpha': 56, 'iterations': 32, 'learning_rate': 0.016114814131149645, 'p_miss': 0.05895614901485307}. Best is trial 28 with value: 0.0639902920074974.
running
[I 2024-10-08 02:20:46,950] Trial 9 finished with value: inf and parameters: {'model_name': 'GAIN', 'batch_size': 13, 'hint_rate': 0.03988689443108922, 'alpha': 90, 'iterations': 458, 'learning_rate': 0.00020158479366699995, 'p_miss': 0.02510849728584121}. Best is trial 28 with value: 0.0639902920074974.
running
[I 2024-10-08 02:20:56,731] Trial 35 finished with value: 0.15891644520664408 and parameters: {'model_name': 'IterativeImputer', 'estimator': 'Ridge', 'initial_strategy': 'most_frequent', 'n_nearest_features': 1, 'imputation_order': 'roman'}. Best is trial 28 with value: 0.0639902920074974.
running
[I 2024-10-08 02:21:10,914] Trial 20 finished with value: 0.4377595417055679 and parameters: {'model_name': 'GAIN', 'batch_size': 79, 'hint_rate': 0.4590816564210839, 'alpha': 93, 'iterations': 104, 'learning_rate': 0.058397006830713374, 'p_miss': 0.27325613815613603}. Best is trial 28 with value: 0.0639902920074974.
running
[I 2024-10-08 02:21:13,854] Trial 36 finished with value: 0.05909545158371941 and parameters: {'model_name': 'IterativeImputer', 'estimator': 'KNN', 'initial_strategy': 'constant', 'n_nearest_features': 4, 'imputation_order': 'descending'}. Best is trial 36 with value: 0.05909545158371941.
running
[I 2024-10-08 02:21:27,458] Trial 37 finished with value: 0.05909545158371941 and parameters: {'model_name': 'IterativeImputer', 'estimator': 'KNN', 'initial_strategy': 'constant', 'n_nearest_features': 4, 'imputation_order': 'descending'}. Best is trial 36 with value: 0.05909545158371941.
running
[I 2024-10-08 02:21:29,478] Trial 38 finished with value: 0.07582463363206507 and parameters: {'model_name': 'IterativeImputer', 'estimator': 'KNN', 'initial_strategy': 'constant', 'n_nearest_features': 3, 'imputation_order': 'ascending'}. Best is trial 36 with value: 0.05909545158371941.
running
[I 2024-10-08 02:23:36,225] Trial 8 finished with value: 0.20783360027810366 and parameters: {'model_name': 'VAE', 'batch_size': 267, 'iterations': 70, 'learning_rate': 0.002239554663608924, 'p_miss': 0.2073841442062092}. Best is trial 36 with value: 0.05909545158371941.
running
[I 2024-10-08 02:39:13,934] Trial 21 finished with value: 0.10799792435233979 and parameters: {'model_name': 'IterativeImputer', 'estimator': 'RFR', 'initial_strategy': 'most_frequent', 'n_nearest_features': 2, 'imputation_order': 'ascending'}. Best is trial 36 with value: 0.05909545158371941.
running
[I 2024-10-08 02:39:33,821] Trial 42 finished with value: 0.05909545158371941 and parameters: {'model_name': 'IterativeImputer', 'estimator': 'KNN', 'initial_strategy': 'constant', 'n_nearest_features': 4, 'imputation_order': 'descending'}. Best is trial 36 with value: 0.05909545158371941.
running
[I 2024-10-08 02:39:52,962] Trial 43 finished with value: 0.07098472264876186 and parameters: {'model_name': 'IterativeImputer', 'estimator': 'KNN', 'initial_strategy': 'constant', 'n_nearest_features': 3, 'imputation_order': 'random'}. Best is trial 36 with value: 0.05909545158371941.
running
[I 2024-10-08 02:42:09,221] Trial 15 finished with value: 0.0627241637912883 and parameters: {'model_name': 'IterativeImputer', 'estimator': 'RFR', 'initial_strategy': 'median', 'n_nearest_features': 3, 'imputation_order': 'arabic'}. Best is trial 36 with value: 0.05909545158371941.
running
[I 2024-10-08 02:42:26,614] Trial 45 finished with value: 0.1094374205957627 and parameters: {'model_name': 'IterativeImputer', 'estimator': 'Ridge', 'initial_strategy': 'constant', 'n_nearest_features': 4, 'imputation_order': 'descending'}. Best is trial 36 with value: 0.05909545158371941.
running
[I 2024-10-08 02:44:00,092] Trial 39 finished with value: 0.06910909810611308 and parameters: {'model_name': 'IterativeImputer', 'estimator': 'RFR', 'initial_strategy': 'constant', 'n_nearest_features': 3, 'imputation_order': 'descending'}. Best is trial 36 with value: 0.05909545158371941.
running
[I 2024-10-08 02:44:21,083] Trial 14 finished with value: 0.06461944982542463 and parameters: {'model_name': 'IterativeImputer', 'estimator': 'RFR', 'initial_strategy': 'mean', 'n_nearest_features': 4, 'imputation_order': 'ascending'}. Best is trial 36 with value: 0.05909545158371941.
running
[I 2024-10-08 02:44:22,058] Trial 40 finished with value: 0.06909385820506882 and parameters: {'model_name': 'IterativeImputer', 'estimator': 'RFR', 'initial_strategy': 'constant', 'n_nearest_features': 3, 'imputation_order': 'random'}. Best is trial 36 with value: 0.05909545158371941.
running
[I 2024-10-08 02:46:17,786] Trial 41 finished with value: 0.0667901625478331 and parameters: {'model_name': 'IterativeImputer', 'estimator': 'RFR', 'initial_strategy': 'constant', 'n_nearest_features': 3, 'imputation_order': 'random'}. Best is trial 36 with value: 0.05909545158371941.
running
[I 2024-10-08 02:47:47,908] Trial 1 finished with value: 0.06307954619483822 and parameters: {'model_name': 'IterativeImputer', 'estimator': 'RFR', 'initial_strategy': 'most_frequent', 'n_nearest_features': 5, 'imputation_order': 'ascending'}. Best is trial 36 with value: 0.05909545158371941.
running
[I 2024-10-08 02:48:03,510] Trial 51 finished with value: 0.06544571729725471 and parameters: {'model_name': 'IterativeImputer', 'estimator': 'KNN', 'initial_strategy': 'constant', 'n_nearest_features': 4, 'imputation_order': 'arabic'}. Best is trial 36 with value: 0.05909545158371941.
running
[I 2024-10-08 02:56:48,368] Trial 34 finished with value: inf and parameters: {'model_name': 'GAIN', 'batch_size': 1, 'hint_rate': 0.951768492466724, 'alpha': 0, 'iterations': 7915, 'learning_rate': 0.0001487345183187445, 'p_miss': 0.2690759236462408}. Best is trial 36 with value: 0.05909545158371941.
running
[I 2024-10-08 02:57:04,309] Trial 53 finished with value: 0.06544571729725471 and parameters: {'model_name': 'IterativeImputer', 'estimator': 'KNN', 'initial_strategy': 'constant', 'n_nearest_features': 4, 'imputation_order': 'arabic'}. Best is trial 36 with value: 0.05909545158371941.
running
[I 2024-10-08 02:57:04,663] Trial 54 finished with value: 0.5180219868975705 and parameters: {'model_name': 'SimpleImputer', 'strategy': 'constant'}. Best is trial 36 with value: 0.05909545158371941.
running
[I 2024-10-08 02:57:08,794] Trial 55 finished with value: 0.4351999714147957 and parameters: {'model_name': 'GAIN', 'batch_size': 6, 'hint_rate': 0.8501215553439385, 'alpha': 3, 'iterations': 1, 'learning_rate': 0.0005988992301933441, 'p_miss': 0.14232210975854}. Best is trial 36 with value: 0.05909545158371941.
running
[I 2024-10-08 02:57:48,001] Trial 0 finished with value: 0.20035404940362705 and parameters: {'model_name': 'VAE', 'batch_size': 33, 'iterations': 886, 'learning_rate': 0.06485650767604327, 'p_miss': 0.29306113420828883}. Best is trial 36 with value: 0.05909545158371941.
running
[I 2024-10-08 03:05:51,387] Trial 44 finished with value: 0.05796834839449868 and parameters: {'model_name': 'IterativeImputer', 'estimator': 'RFR', 'initial_strategy': 'constant', 'n_nearest_features': 4, 'imputation_order': 'descending'}. Best is trial 44 with value: 0.05796834839449868.
running
[I 2024-10-08 03:08:34,001] Trial 46 finished with value: 0.06346862162312505 and parameters: {'model_name': 'IterativeImputer', 'estimator': 'RFR', 'initial_strategy': 'constant', 'n_nearest_features': 4, 'imputation_order': 'arabic'}. Best is trial 44 with value: 0.05796834839449868.
running
[I 2024-10-08 03:08:47,557] Trial 59 finished with value: 0.05909545158371941 and parameters: {'model_name': 'IterativeImputer', 'estimator': 'KNN', 'initial_strategy': 'constant', 'n_nearest_features': 4, 'imputation_order': 'descending'}. Best is trial 44 with value: 0.05796834839449868.
running
[I 2024-10-08 03:09:00,577] Trial 60 finished with value: 0.05909545158371941 and parameters: {'model_name': 'IterativeImputer', 'estimator': 'KNN', 'initial_strategy': 'constant', 'n_nearest_features': 4, 'imputation_order': 'descending'}. Best is trial 44 with value: 0.05796834839449868.
running
[I 2024-10-08 03:09:12,924] Trial 61 finished with value: 0.05909545158371941 and parameters: {'model_name': 'IterativeImputer', 'estimator': 'KNN', 'initial_strategy': 'constant', 'n_nearest_features': 4, 'imputation_order': 'descending'}. Best is trial 44 with value: 0.05796834839449868.
running
[I 2024-10-08 03:09:15,247] Trial 47 finished with value: 0.0631876919279679 and parameters: {'model_name': 'IterativeImputer', 'estimator': 'RFR', 'initial_strategy': 'constant', 'n_nearest_features': 4, 'imputation_order': 'arabic'}. Best is trial 44 with value: 0.05796834839449868.
running
[I 2024-10-08 03:09:16,152] Trial 63 finished with value: 0.5180219868975705 and parameters: {'model_name': 'SimpleImputer', 'strategy': 'most_frequent'}. Best is trial 44 with value: 0.05796834839449868.
running
[I 2024-10-08 03:09:17,532] Trial 48 finished with value: 0.06293230597471039 and parameters: {'model_name': 'IterativeImputer', 'estimator': 'RFR', 'initial_strategy': 'constant', 'n_nearest_features': 4, 'imputation_order': 'arabic'}. Best is trial 44 with value: 0.05796834839449868.
running
[I 2024-10-08 03:09:22,325] Trial 64 finished with value: 0.14788261463849847 and parameters: {'model_name': 'KNNImputer', 'n_neighbors': 7882, 'weights': 'distance'}. Best is trial 44 with value: 0.05796834839449868.
running
[I 2024-10-08 03:09:23,441] Trial 65 finished with value: 0.14788261463849847 and parameters: {'model_name': 'KNNImputer', 'n_neighbors': 7860, 'weights': 'distance'}. Best is trial 44 with value: 0.05796834839449868.
running
[I 2024-10-08 03:09:28,247] Trial 62 finished with value: 0.05909545158371941 and parameters: {'model_name': 'IterativeImputer', 'estimator': 'KNN', 'initial_strategy': 'constant', 'n_nearest_features': 4, 'imputation_order': 'descending'}. Best is trial 44 with value: 0.05796834839449868.
running
[I 2024-10-08 03:09:38,389] Trial 67 finished with value: 0.05909545158371941 and parameters: {'model_name': 'IterativeImputer', 'estimator': 'KNN', 'initial_strategy': 'constant', 'n_nearest_features': 4, 'imputation_order': 'descending'}. Best is trial 44 with value: 0.05796834839449868.
running
[I 2024-10-08 03:09:38,800] Trial 66 finished with value: 0.05909545158371941 and parameters: {'model_name': 'IterativeImputer', 'estimator': 'KNN', 'initial_strategy': 'constant', 'n_nearest_features': 4, 'imputation_order': 'descending'}. Best is trial 44 with value: 0.05796834839449868.
running
[I 2024-10-08 03:09:43,500] Trial 69 finished with value: 0.26309193125321956 and parameters: {'model_name': 'VAE', 'batch_size': 5, 'iterations': 1, 'learning_rate': 0.0007441504494675185, 'p_miss': 0.15996539706884474}. Best is trial 44 with value: 0.05796834839449868.
running
[I 2024-10-08 03:09:44,601] Trial 68 finished with value: 0.05909545158371941 and parameters: {'model_name': 'IterativeImputer', 'estimator': 'KNN', 'initial_strategy': 'constant', 'n_nearest_features': 4, 'imputation_order': 'descending'}. Best is trial 44 with value: 0.05796834839449868.
running
[I 2024-10-08 03:09:46,863] Trial 70 finished with value: 0.2741616912917476 and parameters: {'model_name': 'VAE', 'batch_size': 946, 'iterations': 1, 'learning_rate': 0.0006107214885563839, 'p_miss': 0.1713842267407424}. Best is trial 44 with value: 0.05796834839449868.
running
[I 2024-10-08 03:09:57,276] Trial 71 finished with value: 0.05909545158371941 and parameters: {'model_name': 'IterativeImputer', 'estimator': 'KNN', 'initial_strategy': 'constant', 'n_nearest_features': 4, 'imputation_order': 'descending'}. Best is trial 44 with value: 0.05796834839449868.
running
[I 2024-10-08 03:17:05,377] Trial 50 finished with value: inf and parameters: {'model_name': 'GAIN', 'batch_size': 1, 'hint_rate': 0.9786342033251818, 'alpha': 1, 'iterations': 7131, 'learning_rate': 0.00011404331757210954, 'p_miss': 0.14314625671260792}. Best is trial 44 with value: 0.05796834839449868.
running
[I 2024-10-08 03:17:25,140] Trial 75 finished with value: 0.10728972724379686 and parameters: {'model_name': 'IterativeImputer', 'estimator': 'Bayesian', 'initial_strategy': 'constant', 'n_nearest_features': 5, 'imputation_order': 'roman', 'sample_posterior': False}. Best is trial 44 with value: 0.05796834839449868.
running
[I 2024-10-08 03:17:38,767] Trial 76 finished with value: 0.05909545158371941 and parameters: {'model_name': 'IterativeImputer', 'estimator': 'KNN', 'initial_strategy': 'constant', 'n_nearest_features': 4, 'imputation_order': 'descending'}. Best is trial 44 with value: 0.05796834839449868.
running
[I 2024-10-08 03:17:51,565] Trial 77 finished with value: 0.05909545158371941 and parameters: {'model_name': 'IterativeImputer', 'estimator': 'KNN', 'initial_strategy': 'constant', 'n_nearest_features': 4, 'imputation_order': 'descending'}. Best is trial 44 with value: 0.05796834839449868.
running
[I 2024-10-08 03:18:05,979] Trial 78 finished with value: 0.05818403366682016 and parameters: {'model_name': 'IterativeImputer', 'estimator': 'KNN', 'initial_strategy': 'constant', 'n_nearest_features': 5, 'imputation_order': 'descending'}. Best is trial 44 with value: 0.05796834839449868.
running
[I 2024-10-08 03:18:25,169] Trial 79 finished with value: 0.16051407237766818 and parameters: {'model_name': 'IterativeImputer', 'estimator': 'Bayesian', 'initial_strategy': 'most_frequent', 'n_nearest_features': 6, 'imputation_order': 'descending', 'sample_posterior': True}. Best is trial 44 with value: 0.05796834839449868.
running
[I 2024-10-08 03:18:25,835] Trial 80 finished with value: 0.5180219868975705 and parameters: {'model_name': 'SimpleImputer', 'strategy': 'most_frequent'}. Best is trial 44 with value: 0.05796834839449868.
running
[I 2024-10-08 03:18:40,385] Trial 81 finished with value: 0.0639902920074974 and parameters: {'model_name': 'IterativeImputer', 'estimator': 'KNN', 'initial_strategy': 'mean', 'n_nearest_features': 5, 'imputation_order': 'descending'}. Best is trial 44 with value: 0.05796834839449868.
running
[I 2024-10-08 03:18:50,444] Trial 82 finished with value: 0.10731447724525467 and parameters: {'model_name': 'IterativeImputer', 'estimator': 'Ridge', 'initial_strategy': 'constant', 'n_nearest_features': 5, 'imputation_order': 'descending'}. Best is trial 44 with value: 0.05796834839449868.
running
[I 2024-10-08 03:19:03,180] Trial 83 finished with value: 0.07546721738566442 and parameters: {'model_name': 'IterativeImputer', 'estimator': 'KNN', 'initial_strategy': 'constant', 'n_nearest_features': 3, 'imputation_order': 'descending'}. Best is trial 44 with value: 0.05796834839449868.
running
[I 2024-10-08 03:19:17,428] Trial 84 finished with value: 0.05818403366682016 and parameters: {'model_name': 'IterativeImputer', 'estimator': 'KNN', 'initial_strategy': 'constant', 'n_nearest_features': 5, 'imputation_order': 'descending'}. Best is trial 44 with value: 0.05796834839449868.
running
[I 2024-10-08 03:20:55,258] Trial 49 finished with value: inf and parameters: {'model_name': 'GAIN', 'batch_size': 1, 'hint_rate': 0.9880279528068985, 'alpha': 2, 'iterations': 8916, 'learning_rate': 0.00011378029392039944, 'p_miss': 0.14165666820755596}. Best is trial 44 with value: 0.05796834839449868.
running
[I 2024-10-08 03:21:08,742] Trial 86 finished with value: 0.05818403366682016 and parameters: {'model_name': 'IterativeImputer', 'estimator': 'KNN', 'initial_strategy': 'constant', 'n_nearest_features': 5, 'imputation_order': 'descending'}. Best is trial 44 with value: 0.05796834839449868.
running
[I 2024-10-08 03:21:21,725] Trial 87 finished with value: 0.05818403366682016 and parameters: {'model_name': 'IterativeImputer', 'estimator': 'KNN', 'initial_strategy': 'constant', 'n_nearest_features': 6, 'imputation_order': 'descending'}. Best is trial 44 with value: 0.05796834839449868.
running
[I 2024-10-08 03:21:35,252] Trial 88 finished with value: 0.05818403366682016 and parameters: {'model_name': 'IterativeImputer', 'estimator': 'KNN', 'initial_strategy': 'constant', 'n_nearest_features': 6, 'imputation_order': 'descending'}. Best is trial 44 with value: 0.05796834839449868.
running
