Run: 33
/cm/local/apps/slurm/var/spool/job1068774/slurm_script: line 26: 
pip install -e tpot2
pip install -r tpot2/ImputerExperiments/requirements_.txt
: No such file or directory
RunStart
Version 0.1.7a0 of tpot2 is outdated. Version 0.1.8a0 was released Tuesday September 17, 2024.
starting loops
../data/c/40983/40983.pkl
working on 
../data/c/40983/class_full_MNAR_0.01_2
1.909759521484375
running experiment 1/3 - Does large hyperparameter space improve reconstruction accuracy over simple
[I 2024-11-21 16:05:40,572] A new study created in memory with name: no-name-78a62a4d-f90e-450f-96c8-ce374bbd2ed0
running
running
running
running
running
running
running
running
running
running
running
running
running
running
running
running
[I 2024-11-21 16:05:40,746] Trial 6 finished with value: 0.07270054619150003 and parameters: {'model_name': 'SimpleImputer', 'strategy': 'mean'}. Best is trial 6 with value: 0.07270054619150003.
[I 2024-11-21 16:05:40,917] Trial 3 finished with value: 0.35086793386477944 and parameters: {'model_name': 'SimpleImputer', 'strategy': 'constant'}. Best is trial 6 with value: 0.07270054619150003.
running
running
[I 2024-11-21 16:05:41,077] Trial 4 finished with value: 0.07318252697756407 and parameters: {'model_name': 'SimpleImputer', 'strategy': 'median'}. Best is trial 6 with value: 0.07270054619150003.
running
[I 2024-11-21 16:05:41,320] Trial 9 finished with value: 0.35086793386477944 and parameters: {'model_name': 'SimpleImputer', 'strategy': 'most_frequent'}. Best is trial 6 with value: 0.07270054619150003.
running
[I 2024-11-21 16:05:42,601] Trial 0 finished with value: 0.06932930282275537 and parameters: {'model_name': 'KNNImputer', 'n_neighbors': 1072, 'weights': 'distance'}. Best is trial 0 with value: 0.06932930282275537.
running
[I 2024-11-21 16:05:42,816] Trial 16 finished with value: 0.07251026286402888 and parameters: {'model_name': 'KNNImputer', 'n_neighbors': 2335, 'weights': 'uniform'}. Best is trial 0 with value: 0.06932930282275537.
running
[I 2024-11-21 16:05:43,050] Trial 17 finished with value: 0.07263815282277028 and parameters: {'model_name': 'KNNImputer', 'n_neighbors': 2511, 'weights': 'uniform'}. Best is trial 0 with value: 0.06932930282275537.
running
[I 2024-11-21 16:05:43,231] Trial 10 finished with value: 0.0726070528255344 and parameters: {'model_name': 'KNNImputer', 'n_neighbors': 2462, 'weights': 'uniform'}. Best is trial 0 with value: 0.06932930282275537.
running
[I 2024-11-21 16:05:43,440] Trial 19 finished with value: 0.06924079480329613 and parameters: {'model_name': 'KNNImputer', 'n_neighbors': 1020, 'weights': 'distance'}. Best is trial 19 with value: 0.06924079480329613.
running
[I 2024-11-21 16:05:43,643] Trial 21 finished with value: 0.35086793386477944 and parameters: {'model_name': 'SimpleImputer', 'strategy': 'most_frequent'}. Best is trial 19 with value: 0.06924079480329613.
running
[I 2024-11-21 16:05:44,446] Trial 14 finished with value: 0.06442594607597721 and parameters: {'model_name': 'IterativeImputer', 'estimator': 'Ridge', 'initial_strategy': 'mean', 'n_nearest_features': 1, 'imputation_order': 'arabic'}. Best is trial 14 with value: 0.06442594607597721.
running
[I 2024-11-21 16:05:44,652] Trial 20 finished with value: 0.06940933169829261 and parameters: {'model_name': 'KNNImputer', 'n_neighbors': 1124, 'weights': 'distance'}. Best is trial 14 with value: 0.06442594607597721.
running
[I 2024-11-21 16:05:45,475] Trial 7 finished with value: 0.06198992473354897 and parameters: {'model_name': 'IterativeImputer', 'estimator': 'Ridge', 'initial_strategy': 'most_frequent', 'n_nearest_features': 5, 'imputation_order': 'roman'}. Best is trial 7 with value: 0.06198992473354897.
running
[I 2024-11-21 16:05:46,737] Trial 26 finished with value: 0.06442594607597721 and parameters: {'model_name': 'IterativeImputer', 'estimator': 'Ridge', 'initial_strategy': 'mean', 'n_nearest_features': 1, 'imputation_order': 'arabic'}. Best is trial 7 with value: 0.06198992473354897.
running
[I 2024-11-21 16:05:46,956] Trial 27 finished with value: 0.06442594607597721 and parameters: {'model_name': 'IterativeImputer', 'estimator': 'Ridge', 'initial_strategy': 'mean', 'n_nearest_features': 1, 'imputation_order': 'arabic'}. Best is trial 7 with value: 0.06198992473354897.
running
[I 2024-11-21 16:05:47,945] Trial 28 finished with value: 0.061991136154398 and parameters: {'model_name': 'IterativeImputer', 'estimator': 'Ridge', 'initial_strategy': 'mean', 'n_nearest_features': 4, 'imputation_order': 'roman'}. Best is trial 7 with value: 0.06198992473354897.
running
[I 2024-11-21 16:05:48,819] Trial 29 finished with value: 0.06198992473354897 and parameters: {'model_name': 'IterativeImputer', 'estimator': 'Ridge', 'initial_strategy': 'most_frequent', 'n_nearest_features': 5, 'imputation_order': 'roman'}. Best is trial 7 with value: 0.06198992473354897.
running
[I 2024-11-21 16:05:49,844] Trial 31 finished with value: 0.318613655884329 and parameters: {'model_name': 'GAIN', 'batch_size': 2, 'hint_rate': 0.8042720814411747, 'alpha': 64, 'iterations': 1, 'learning_rate': 0.000831534670127249, 'p_miss': 0.20978524132311197}. Best is trial 7 with value: 0.06198992473354897.
running
[I 2024-11-21 16:05:50,553] Trial 15 finished with value: 0.34573693455193866 and parameters: {'model_name': 'VAE', 'batch_size': 1, 'iterations': 2, 'learning_rate': 0.0028105147411958114, 'p_miss': 0.2319124393106286}. Best is trial 7 with value: 0.06198992473354897.
running
[I 2024-11-21 16:05:50,760] Trial 1 finished with value: inf and parameters: {'model_name': 'GAIN', 'batch_size': 1, 'hint_rate': 0.6801672012887237, 'alpha': 43, 'iterations': 17, 'learning_rate': 0.030895424460646713, 'p_miss': 0.08331863456669096}. Best is trial 7 with value: 0.06198992473354897.
running
[I 2024-11-21 16:05:52,388] Trial 24 finished with value: 0.32555896835906506 and parameters: {'model_name': 'GAIN', 'batch_size': 672, 'hint_rate': 0.8953816480852632, 'alpha': 85, 'iterations': 3, 'learning_rate': 0.06630738847631097, 'p_miss': 0.0804924287968164}. Best is trial 7 with value: 0.06198992473354897.
running
[I 2024-11-21 16:05:53,218] Trial 2 finished with value: inf and parameters: {'model_name': 'GAIN', 'batch_size': 4, 'hint_rate': 0.10157580184724306, 'alpha': 60, 'iterations': 30, 'learning_rate': 0.0012779832542455668, 'p_miss': 0.0681105109931452}. Best is trial 7 with value: 0.06198992473354897.
running
[I 2024-11-21 16:05:58,030] Trial 25 finished with value: 0.061187886510266354 and parameters: {'model_name': 'IterativeImputer', 'estimator': 'Bayesian', 'initial_strategy': 'most_frequent', 'n_nearest_features': 5, 'imputation_order': 'random', 'sample_posterior': False}. Best is trial 25 with value: 0.061187886510266354.
running
[I 2024-11-21 16:05:58,451] Trial 18 finished with value: 0.32483629339970643 and parameters: {'model_name': 'GAIN', 'batch_size': 145, 'hint_rate': 0.3283355437175619, 'alpha': 47, 'iterations': 15, 'learning_rate': 0.0006877449251235049, 'p_miss': 0.07611509908650453}. Best is trial 25 with value: 0.061187886510266354.
running
[I 2024-11-21 16:06:01,047] Trial 36 finished with value: 0.06198992473354897 and parameters: {'model_name': 'IterativeImputer', 'estimator': 'Ridge', 'initial_strategy': 'most_frequent', 'n_nearest_features': 5, 'imputation_order': 'roman'}. Best is trial 25 with value: 0.061187886510266354.
running
[I 2024-11-21 16:06:16,738] Trial 38 finished with value: 0.061187886510266354 and parameters: {'model_name': 'IterativeImputer', 'estimator': 'Bayesian', 'initial_strategy': 'most_frequent', 'n_nearest_features': 5, 'imputation_order': 'random', 'sample_posterior': False}. Best is trial 25 with value: 0.061187886510266354.
running
[I 2024-11-21 16:06:18,310] Trial 37 finished with value: 0.09256990482351611 and parameters: {'model_name': 'IterativeImputer', 'estimator': 'Bayesian', 'initial_strategy': 'most_frequent', 'n_nearest_features': 5, 'imputation_order': 'roman', 'sample_posterior': True}. Best is trial 25 with value: 0.061187886510266354.
running
[I 2024-11-21 16:06:19,731] Trial 39 finished with value: 0.061187886510266354 and parameters: {'model_name': 'IterativeImputer', 'estimator': 'Bayesian', 'initial_strategy': 'most_frequent', 'n_nearest_features': 5, 'imputation_order': 'random', 'sample_posterior': False}. Best is trial 25 with value: 0.061187886510266354.
running
[I 2024-11-21 16:06:20,755] Trial 40 finished with value: 0.061187886510266354 and parameters: {'model_name': 'IterativeImputer', 'estimator': 'Bayesian', 'initial_strategy': 'most_frequent', 'n_nearest_features': 5, 'imputation_order': 'random', 'sample_posterior': False}. Best is trial 25 with value: 0.061187886510266354.
running
[I 2024-11-21 16:06:37,773] Trial 41 finished with value: 0.061187886510266354 and parameters: {'model_name': 'IterativeImputer', 'estimator': 'Bayesian', 'initial_strategy': 'most_frequent', 'n_nearest_features': 5, 'imputation_order': 'random', 'sample_posterior': False}. Best is trial 25 with value: 0.061187886510266354.
running
[I 2024-11-21 16:07:58,606] Trial 8 finished with value: 0.3372498499320672 and parameters: {'model_name': 'VAE', 'batch_size': 1, 'iterations': 84, 'learning_rate': 0.0002607410835890585, 'p_miss': 0.08688993853953392}. Best is trial 25 with value: 0.061187886510266354.
running
[I 2024-11-21 16:08:10,331] Trial 30 finished with value: 0.34577321955650203 and parameters: {'model_name': 'VAE', 'batch_size': 149, 'iterations': 50, 'learning_rate': 0.000225099343927534, 'p_miss': 0.2779610907778829}. Best is trial 25 with value: 0.061187886510266354.
running
[I 2024-11-21 16:08:19,568] Trial 46 finished with value: 0.06118074623786548 and parameters: {'model_name': 'IterativeImputer', 'estimator': 'Bayesian', 'initial_strategy': 'median', 'n_nearest_features': 4, 'imputation_order': 'random', 'sample_posterior': False}. Best is trial 46 with value: 0.06118074623786548.
running
[I 2024-11-21 16:08:36,779] Trial 47 finished with value: 0.06118914854292534 and parameters: {'model_name': 'IterativeImputer', 'estimator': 'Bayesian', 'initial_strategy': 'constant', 'n_nearest_features': 4, 'imputation_order': 'random', 'sample_posterior': False}. Best is trial 46 with value: 0.06118074623786548.
running
[I 2024-11-21 16:08:39,233] Trial 48 finished with value: 0.06118074623786548 and parameters: {'model_name': 'IterativeImputer', 'estimator': 'Bayesian', 'initial_strategy': 'median', 'n_nearest_features': 4, 'imputation_order': 'random', 'sample_posterior': False}. Best is trial 46 with value: 0.06118074623786548.
running
[I 2024-11-21 16:08:50,003] Trial 50 finished with value: 0.058855435105523476 and parameters: {'model_name': 'IterativeImputer', 'estimator': 'KNN', 'initial_strategy': 'median', 'n_nearest_features': 4, 'imputation_order': 'descending'}. Best is trial 50 with value: 0.058855435105523476.
running
[I 2024-11-21 16:08:57,485] Trial 49 finished with value: 0.06118074623786548 and parameters: {'model_name': 'IterativeImputer', 'estimator': 'Bayesian', 'initial_strategy': 'median', 'n_nearest_features': 4, 'imputation_order': 'random', 'sample_posterior': False}. Best is trial 50 with value: 0.058855435105523476.
running
[I 2024-11-21 16:09:00,539] Trial 51 finished with value: 0.05811886195502778 and parameters: {'model_name': 'IterativeImputer', 'estimator': 'KNN', 'initial_strategy': 'median', 'n_nearest_features': 3, 'imputation_order': 'descending'}. Best is trial 51 with value: 0.05811886195502778.
running
[I 2024-11-21 16:09:07,665] Trial 52 finished with value: 0.05811886195502778 and parameters: {'model_name': 'IterativeImputer', 'estimator': 'KNN', 'initial_strategy': 'median', 'n_nearest_features': 3, 'imputation_order': 'descending'}. Best is trial 51 with value: 0.05811886195502778.
running
[I 2024-11-21 16:09:12,014] Trial 53 finished with value: 0.05811886195502778 and parameters: {'model_name': 'IterativeImputer', 'estimator': 'KNN', 'initial_strategy': 'median', 'n_nearest_features': 3, 'imputation_order': 'descending'}. Best is trial 51 with value: 0.05811886195502778.
running
[I 2024-11-21 16:16:58,057] Trial 12 finished with value: 0.07287847690936669 and parameters: {'model_name': 'IterativeImputer', 'estimator': 'RFR', 'initial_strategy': 'most_frequent', 'n_nearest_features': 1, 'imputation_order': 'descending'}. Best is trial 51 with value: 0.05811886195502778.
running
[I 2024-11-21 16:17:08,123] Trial 56 finished with value: 0.05811886195502778 and parameters: {'model_name': 'IterativeImputer', 'estimator': 'KNN', 'initial_strategy': 'median', 'n_nearest_features': 3, 'imputation_order': 'descending'}. Best is trial 51 with value: 0.05811886195502778.
running
[I 2024-11-21 16:17:17,998] Trial 57 finished with value: 0.05811886195502778 and parameters: {'model_name': 'IterativeImputer', 'estimator': 'KNN', 'initial_strategy': 'median', 'n_nearest_features': 3, 'imputation_order': 'descending'}. Best is trial 51 with value: 0.05811886195502778.
running
[I 2024-11-21 16:18:19,309] Trial 32 finished with value: 0.0760280975359519 and parameters: {'model_name': 'VAE', 'batch_size': 32, 'iterations': 361, 'learning_rate': 0.002155252369743777, 'p_miss': 0.18328547951262775}. Best is trial 51 with value: 0.05811886195502778.
running
[I 2024-11-21 16:18:19,799] Trial 59 finished with value: 0.07270054619150003 and parameters: {'model_name': 'SimpleImputer', 'strategy': 'mean'}. Best is trial 51 with value: 0.05811886195502778.
running
[I 2024-11-21 16:18:29,770] Trial 60 finished with value: 0.05811886195502778 and parameters: {'model_name': 'IterativeImputer', 'estimator': 'KNN', 'initial_strategy': 'median', 'n_nearest_features': 3, 'imputation_order': 'descending'}. Best is trial 51 with value: 0.05811886195502778.
running
[I 2024-11-21 16:18:39,658] Trial 61 finished with value: 0.05811886195502778 and parameters: {'model_name': 'IterativeImputer', 'estimator': 'KNN', 'initial_strategy': 'median', 'n_nearest_features': 3, 'imputation_order': 'descending'}. Best is trial 51 with value: 0.05811886195502778.
running
[I 2024-11-21 16:18:42,337] Trial 13 finished with value: inf and parameters: {'model_name': 'GAIN', 'batch_size': 2, 'hint_rate': 0.35633186480603324, 'alpha': 75, 'iterations': 3323, 'learning_rate': 0.013800136561734186, 'p_miss': 0.07562456296035958}. Best is trial 51 with value: 0.05811886195502778.
running
[I 2024-11-21 16:18:50,838] Trial 62 finished with value: 0.05811886195502778 and parameters: {'model_name': 'IterativeImputer', 'estimator': 'KNN', 'initial_strategy': 'median', 'n_nearest_features': 3, 'imputation_order': 'descending'}. Best is trial 51 with value: 0.05811886195502778.
running
[I 2024-11-21 16:18:52,628] Trial 63 finished with value: 0.05811886195502778 and parameters: {'model_name': 'IterativeImputer', 'estimator': 'KNN', 'initial_strategy': 'median', 'n_nearest_features': 3, 'imputation_order': 'descending'}. Best is trial 51 with value: 0.05811886195502778.
running
[I 2024-11-21 16:19:50,387] Trial 5 finished with value: 0.05648041729995039 and parameters: {'model_name': 'IterativeImputer', 'estimator': 'RFR', 'initial_strategy': 'mean', 'n_nearest_features': 3, 'imputation_order': 'random'}. Best is trial 5 with value: 0.05648041729995039.
running
[I 2024-11-21 16:19:59,485] Trial 66 finished with value: 0.06083466614387432 and parameters: {'model_name': 'IterativeImputer', 'estimator': 'KNN', 'initial_strategy': 'median', 'n_nearest_features': 2, 'imputation_order': 'ascending'}. Best is trial 5 with value: 0.05648041729995039.
running
[I 2024-11-21 16:20:04,056] Trial 23 finished with value: 0.08047415458122184 and parameters: {'model_name': 'VAE', 'batch_size': 4, 'iterations': 427, 'learning_rate': 0.03897973609945294, 'p_miss': 0.15909657940288524}. Best is trial 5 with value: 0.05648041729995039.
running
[I 2024-11-21 16:20:45,421] Trial 11 finished with value: 0.053613819718639 and parameters: {'model_name': 'IterativeImputer', 'estimator': 'RFR', 'initial_strategy': 'constant', 'n_nearest_features': 4, 'imputation_order': 'roman'}. Best is trial 11 with value: 0.053613819718639.
running
[I 2024-11-21 16:20:45,862] Trial 69 finished with value: 0.35086793386477944 and parameters: {'model_name': 'SimpleImputer', 'strategy': 'constant'}. Best is trial 11 with value: 0.053613819718639.
running
[I 2024-11-21 16:21:22,117] Trial 34 finished with value: 0.052853982359621056 and parameters: {'model_name': 'IterativeImputer', 'estimator': 'RFR', 'initial_strategy': 'most_frequent', 'n_nearest_features': 5, 'imputation_order': 'roman'}. Best is trial 34 with value: 0.052853982359621056.
running
[I 2024-11-21 16:21:25,353] Trial 35 finished with value: 0.053885072930060465 and parameters: {'model_name': 'IterativeImputer', 'estimator': 'RFR', 'initial_strategy': 'most_frequent', 'n_nearest_features': 5, 'imputation_order': 'roman'}. Best is trial 34 with value: 0.052853982359621056.
running
[I 2024-11-21 16:21:25,659] Trial 71 finished with value: 0.07088140610704731 and parameters: {'model_name': 'KNNImputer', 'n_neighbors': 3557, 'weights': 'distance'}. Best is trial 34 with value: 0.052853982359621056.
running
[I 2024-11-21 16:21:27,552] Trial 72 finished with value: 0.062096744302017635 and parameters: {'model_name': 'KNNImputer', 'n_neighbors': 22, 'weights': 'distance'}. Best is trial 34 with value: 0.052853982359621056.
running
[I 2024-11-21 16:33:03,881] Trial 70 finished with value: 0.05550362200100628 and parameters: {'model_name': 'IterativeImputer', 'estimator': 'RFR', 'initial_strategy': 'constant', 'n_nearest_features': 3, 'imputation_order': 'descending'}. Best is trial 34 with value: 0.052853982359621056.
running
[I 2024-11-21 16:33:09,312] Trial 67 finished with value: 0.05672012522801205 and parameters: {'model_name': 'IterativeImputer', 'estimator': 'RFR', 'initial_strategy': 'median', 'n_nearest_features': 3, 'imputation_order': 'descending'}. Best is trial 34 with value: 0.052853982359621056.
running
[I 2024-11-21 16:33:19,378] Trial 68 finished with value: 0.05710038113347267 and parameters: {'model_name': 'IterativeImputer', 'estimator': 'RFR', 'initial_strategy': 'median', 'n_nearest_features': 3, 'imputation_order': 'descending'}. Best is trial 34 with value: 0.052853982359621056.
running
[I 2024-11-21 16:35:51,759] Trial 73 finished with value: inf and parameters: {'model_name': 'GAIN', 'batch_size': 12, 'hint_rate': 0.06442581207206433, 'alpha': 0, 'iterations': 3050, 'learning_rate': 0.00718326346658573, 'p_miss': 0.02254990702963164}. Best is trial 34 with value: 0.052853982359621056.
running
[I 2024-11-21 16:39:55,360] Trial 74 finished with value: inf and parameters: {'model_name': 'GAIN', 'batch_size': 21, 'hint_rate': 0.022665104619072673, 'alpha': 0, 'iterations': 3886, 'learning_rate': 0.00770000852859112, 'p_miss': 0.015016175623291939}. Best is trial 34 with value: 0.052853982359621056.
running
[I 2024-11-21 16:46:55,021] Trial 22 finished with value: inf and parameters: {'model_name': 'GAIN', 'batch_size': 1, 'hint_rate': 0.5651644641106242, 'alpha': 78, 'iterations': 9362, 'learning_rate': 0.00017796136796513912, 'p_miss': 0.05463164494991358}. Best is trial 34 with value: 0.052853982359621056.
running
[I 2024-11-21 16:46:55,874] Trial 78 finished with value: 0.06398759146885369 and parameters: {'model_name': 'IterativeImputer', 'estimator': 'RFR', 'initial_strategy': 'constant', 'n_nearest_features': 2, 'imputation_order': 'roman'}. Best is trial 34 with value: 0.052853982359621056.
running
[I 2024-11-21 16:51:35,128] Trial 79 finished with value: 0.06261543738485753 and parameters: {'model_name': 'IterativeImputer', 'estimator': 'RFR', 'initial_strategy': 'constant', 'n_nearest_features': 2, 'imputation_order': 'roman'}. Best is trial 34 with value: 0.052853982359621056.
running
[I 2024-11-21 16:58:49,846] Trial 80 finished with value: 0.06194142290123732 and parameters: {'model_name': 'IterativeImputer', 'estimator': 'RFR', 'initial_strategy': 'constant', 'n_nearest_features': 2, 'imputation_order': 'roman'}. Best is trial 34 with value: 0.052853982359621056.
running
[I 2024-11-21 17:00:56,015] Trial 75 finished with value: inf and parameters: {'model_name': 'GAIN', 'batch_size': 18, 'hint_rate': 0.05260776341017903, 'alpha': 1, 'iterations': 5716, 'learning_rate': 0.007064165507201029, 'p_miss': 0.016030272691180847}. Best is trial 34 with value: 0.052853982359621056.
running
[I 2024-11-21 17:00:56,511] Trial 84 finished with value: 0.07318252697756407 and parameters: {'model_name': 'SimpleImputer', 'strategy': 'median'}. Best is trial 34 with value: 0.052853982359621056.
running
[I 2024-11-21 17:02:17,947] Trial 76 finished with value: inf and parameters: {'model_name': 'GAIN', 'batch_size': 16, 'hint_rate': 0.06497963255960681, 'alpha': 4, 'iterations': 5996, 'learning_rate': 0.007683346527386664, 'p_miss': 0.022472556856663328}. Best is trial 34 with value: 0.052853982359621056.
running
[I 2024-11-21 17:13:08,972] Trial 77 finished with value: inf and parameters: {'model_name': 'GAIN', 'batch_size': 14, 'hint_rate': 0.5726641486756221, 'alpha': 11, 'iterations': 8068, 'learning_rate': 0.007770568676997662, 'p_miss': 0.010977671253406596}. Best is trial 34 with value: 0.052853982359621056.
running
[I 2024-11-21 17:14:47,372] Trial 82 finished with value: 0.07468326953661594 and parameters: {'model_name': 'VAE', 'batch_size': 933, 'iterations': 295, 'learning_rate': 0.09468933655480691, 'p_miss': 0.13250273840068982}. Best is trial 34 with value: 0.052853982359621056.
running
[I 2024-11-21 17:15:59,728] Trial 86 finished with value: 0.05580033063603632 and parameters: {'model_name': 'IterativeImputer', 'estimator': 'RFR', 'initial_strategy': 'constant', 'n_nearest_features': 3, 'imputation_order': 'ascending'}. Best is trial 34 with value: 0.052853982359621056.
running
