Run: 25
/cm/local/apps/slurm/var/spool/job969392/slurm_script: line 26: 
pip install -e tpot2
pip install -r tpot2/ImputerExperiments/requirements_.txt
: No such file or directory
RunStart
Version 0.1.7a0 of tpot2 is outdated. Version 0.1.8a0 was released 6 days ago.
starting loops
../data/r/197/197.pkl
working on 
../data/r/197/reg_full_MCAR_0.01_2
3.58609676361084
running experiment 1/3 - Does large hyperparameter space improve reconstruction accuracy over simple
[I 2024-09-24 06:34:04,001] A new study created in memory with name: no-name-0781eaa0-44d9-4511-a531-7795c8cda741
running
running
running
running
running
running
running
running
running
running
running
running
running
running
running
running
[I 2024-09-24 06:34:04,232] Trial 13 finished with value: 0.178024056996342 and parameters: {'model_name': 'SimpleImputer', 'strategy': 'constant'}. Best is trial 13 with value: 0.178024056996342.
running
[I 2024-09-24 06:34:08,801] Trial 9 finished with value: 0.09964454268947594 and parameters: {'model_name': 'KNNImputer', 'n_neighbors': 5723, 'weights': 'uniform'}. Best is trial 9 with value: 0.09964454268947594.
running
[I 2024-09-24 06:34:09,135] Trial 6 finished with value: 0.08408390922075595 and parameters: {'model_name': 'KNNImputer', 'n_neighbors': 1865, 'weights': 'uniform'}. Best is trial 6 with value: 0.08408390922075595.
running
[I 2024-09-24 06:34:09,979] Trial 0 finished with value: 0.4449653156759723 and parameters: {'model_name': 'VAE', 'batch_size': 7, 'iterations': 1, 'learning_rate': 0.0052387752951411, 'p_miss': 0.19496496271779312}. Best is trial 6 with value: 0.08408390922075595.
running
[I 2024-09-24 06:34:10,599] Trial 17 finished with value: 0.17675017307085134 and parameters: {'model_name': 'SimpleImputer', 'strategy': 'most_frequent'}. Best is trial 6 with value: 0.08408390922075595.
running
[I 2024-09-24 06:34:10,845] Trial 19 finished with value: 0.10754797919449854 and parameters: {'model_name': 'SimpleImputer', 'strategy': 'median'}. Best is trial 6 with value: 0.08408390922075595.
running
[I 2024-09-24 06:34:12,986] Trial 15 finished with value: 0.1959439207244639 and parameters: {'model_name': 'GAIN', 'batch_size': 8, 'hint_rate': 0.25804191983316094, 'alpha': 95, 'iterations': 1, 'learning_rate': 0.0004045626610464805, 'p_miss': 0.1372477567264012}. Best is trial 6 with value: 0.08408390922075595.
running
[I 2024-09-24 06:34:18,758] Trial 12 finished with value: 0.19117393662929305 and parameters: {'model_name': 'GAIN', 'batch_size': 644, 'hint_rate': 0.6660705482378267, 'alpha': 13, 'iterations': 4, 'learning_rate': 0.0006230351386533008, 'p_miss': 0.08812085538102359}. Best is trial 6 with value: 0.08408390922075595.
running
[I 2024-09-24 06:34:21,628] Trial 20 finished with value: 0.0978597345185369 and parameters: {'model_name': 'KNNImputer', 'n_neighbors': 4642, 'weights': 'uniform'}. Best is trial 6 with value: 0.08408390922075595.
running
[I 2024-09-24 06:34:22,878] Trial 22 finished with value: 0.08464651073828047 and parameters: {'model_name': 'KNNImputer', 'n_neighbors': 1964, 'weights': 'uniform'}. Best is trial 6 with value: 0.08408390922075595.
running
[I 2024-09-24 06:34:32,283] Trial 23 finished with value: 0.08962339214825046 and parameters: {'model_name': 'KNNImputer', 'n_neighbors': 4665, 'weights': 'distance'}. Best is trial 6 with value: 0.08408390922075595.
running
[I 2024-09-24 06:34:48,673] Trial 4 finished with value: 0.11462764092473166 and parameters: {'model_name': 'VAE', 'batch_size': 1, 'iterations': 36, 'learning_rate': 0.008849965065559927, 'p_miss': 0.05727360091953351}. Best is trial 6 with value: 0.08408390922075595.
running
[I 2024-09-24 06:34:57,385] Trial 25 finished with value: 0.08060992760294987 and parameters: {'model_name': 'IterativeImputer', 'estimator': 'Ridge', 'initial_strategy': 'mean', 'n_nearest_features': 2, 'imputation_order': 'ascending'}. Best is trial 25 with value: 0.08060992760294987.
running
[I 2024-09-24 06:35:00,960] Trial 21 finished with value: 0.444595072741372 and parameters: {'model_name': 'VAE', 'batch_size': 87, 'iterations': 37, 'learning_rate': 0.0001598300904535792, 'p_miss': 0.15362418364096744}. Best is trial 25 with value: 0.08060992760294987.
running
[I 2024-09-24 06:35:15,490] Trial 1 finished with value: 0.10475515613402901 and parameters: {'model_name': 'VAE', 'batch_size': 327, 'iterations': 12, 'learning_rate': 0.028813627621763104, 'p_miss': 0.22170275164793446}. Best is trial 25 with value: 0.08060992760294987.
running
[I 2024-09-24 06:35:17,278] Trial 7 finished with value: 0.10212818020494915 and parameters: {'model_name': 'VAE', 'batch_size': 15, 'iterations': 72, 'learning_rate': 0.01765515720049614, 'p_miss': 0.010002888282309153}. Best is trial 25 with value: 0.08060992760294987.
running
[I 2024-09-24 06:35:23,029] Trial 29 finished with value: 0.08945415923239106 and parameters: {'model_name': 'IterativeImputer', 'estimator': 'Ridge', 'initial_strategy': 'mean', 'n_nearest_features': 1, 'imputation_order': 'ascending'}. Best is trial 25 with value: 0.08060992760294987.
running
[I 2024-09-24 06:35:40,351] Trial 30 finished with value: 0.08945415923239106 and parameters: {'model_name': 'IterativeImputer', 'estimator': 'Ridge', 'initial_strategy': 'mean', 'n_nearest_features': 1, 'imputation_order': 'ascending'}. Best is trial 25 with value: 0.08060992760294987.
running
[I 2024-09-24 06:35:41,912] Trial 31 finished with value: 0.08945415923239106 and parameters: {'model_name': 'IterativeImputer', 'estimator': 'Ridge', 'initial_strategy': 'mean', 'n_nearest_features': 1, 'imputation_order': 'ascending'}. Best is trial 25 with value: 0.08060992760294987.
running
[I 2024-09-24 06:35:42,586] Trial 28 finished with value: 0.0763146707951741 and parameters: {'model_name': 'IterativeImputer', 'estimator': 'Ridge', 'initial_strategy': 'mean', 'n_nearest_features': 3, 'imputation_order': 'ascending'}. Best is trial 28 with value: 0.0763146707951741.
running
[I 2024-09-24 06:36:00,140] Trial 26 finished with value: 0.07737479384149844 and parameters: {'model_name': 'IterativeImputer', 'estimator': 'Bayesian', 'initial_strategy': 'median', 'n_nearest_features': 3, 'imputation_order': 'descending', 'sample_posterior': False}. Best is trial 28 with value: 0.0763146707951741.
running
[I 2024-09-24 06:36:14,303] Trial 24 finished with value: 0.0626371744605772 and parameters: {'model_name': 'IterativeImputer', 'estimator': 'Bayesian', 'initial_strategy': 'mean', 'n_nearest_features': 11, 'imputation_order': 'descending', 'sample_posterior': False}. Best is trial 24 with value: 0.0626371744605772.
running
[I 2024-09-24 06:36:17,444] Trial 27 finished with value: 0.0535721894943574 and parameters: {'model_name': 'IterativeImputer', 'estimator': 'KNN', 'initial_strategy': 'median', 'n_nearest_features': 10, 'imputation_order': 'arabic'}. Best is trial 27 with value: 0.0535721894943574.
running
[I 2024-09-24 06:36:18,384] Trial 32 finished with value: 0.06760885425013233 and parameters: {'model_name': 'IterativeImputer', 'estimator': 'Ridge', 'initial_strategy': 'most_frequent', 'n_nearest_features': 6, 'imputation_order': 'random'}. Best is trial 27 with value: 0.0535721894943574.
running
[I 2024-09-24 06:36:58,588] Trial 35 finished with value: 0.05486536401915134 and parameters: {'model_name': 'IterativeImputer', 'estimator': 'KNN', 'initial_strategy': 'most_frequent', 'n_nearest_features': 12, 'imputation_order': 'random'}. Best is trial 27 with value: 0.0535721894943574.
running
[I 2024-09-24 06:37:06,447] Trial 3 finished with value: 0.11550258509386932 and parameters: {'model_name': 'VAE', 'batch_size': 1, 'iterations': 116, 'learning_rate': 0.0975127396117347, 'p_miss': 0.04482174175958407}. Best is trial 27 with value: 0.0535721894943574.
running
[I 2024-09-24 06:37:29,912] Trial 36 finished with value: 0.06490583890494572 and parameters: {'model_name': 'IterativeImputer', 'estimator': 'Bayesian', 'initial_strategy': 'median', 'n_nearest_features': 8, 'imputation_order': 'descending', 'sample_posterior': False}. Best is trial 27 with value: 0.0535721894943574.
running
[I 2024-09-24 06:37:35,377] Trial 39 finished with value: 0.051216485330443116 and parameters: {'model_name': 'IterativeImputer', 'estimator': 'KNN', 'initial_strategy': 'most_frequent', 'n_nearest_features': 11, 'imputation_order': 'random'}. Best is trial 39 with value: 0.051216485330443116.
running
[I 2024-09-24 06:37:41,936] Trial 38 finished with value: 0.05157914686663323 and parameters: {'model_name': 'IterativeImputer', 'estimator': 'KNN', 'initial_strategy': 'most_frequent', 'n_nearest_features': 13, 'imputation_order': 'arabic'}. Best is trial 39 with value: 0.051216485330443116.
running
[I 2024-09-24 06:38:05,535] Trial 37 finished with value: 0.060533527213978824 and parameters: {'model_name': 'IterativeImputer', 'estimator': 'Bayesian', 'initial_strategy': 'median', 'n_nearest_features': 14, 'imputation_order': 'descending', 'sample_posterior': False}. Best is trial 39 with value: 0.051216485330443116.
running
[I 2024-09-24 06:38:17,336] Trial 40 finished with value: 0.05359355366636305 and parameters: {'model_name': 'IterativeImputer', 'estimator': 'KNN', 'initial_strategy': 'constant', 'n_nearest_features': 13, 'imputation_order': 'arabic'}. Best is trial 39 with value: 0.051216485330443116.
running
[I 2024-09-24 06:38:29,588] Trial 41 finished with value: 0.0527373466256605 and parameters: {'model_name': 'IterativeImputer', 'estimator': 'KNN', 'initial_strategy': 'constant', 'n_nearest_features': 14, 'imputation_order': 'arabic'}. Best is trial 39 with value: 0.051216485330443116.
running
[I 2024-09-24 06:38:32,424] Trial 33 finished with value: 0.052662773972334 and parameters: {'model_name': 'IterativeImputer', 'estimator': 'KNN', 'initial_strategy': 'most_frequent', 'n_nearest_features': 21, 'imputation_order': 'roman'}. Best is trial 39 with value: 0.051216485330443116.
running
[I 2024-09-24 06:38:34,098] Trial 34 finished with value: 0.05331767350307185 and parameters: {'model_name': 'IterativeImputer', 'estimator': 'KNN', 'initial_strategy': 'constant', 'n_nearest_features': 17, 'imputation_order': 'random'}. Best is trial 39 with value: 0.051216485330443116.
running
[I 2024-09-24 06:38:47,007] Trial 42 finished with value: 0.0527373466256605 and parameters: {'model_name': 'IterativeImputer', 'estimator': 'KNN', 'initial_strategy': 'constant', 'n_nearest_features': 14, 'imputation_order': 'arabic'}. Best is trial 39 with value: 0.051216485330443116.
running
[I 2024-09-24 06:39:49,793] Trial 43 finished with value: 0.052028838769022735 and parameters: {'model_name': 'IterativeImputer', 'estimator': 'KNN', 'initial_strategy': 'most_frequent', 'n_nearest_features': 17, 'imputation_order': 'arabic'}. Best is trial 39 with value: 0.051216485330443116.
running
[I 2024-09-24 06:39:57,317] Trial 5 finished with value: 0.10546801866580668 and parameters: {'model_name': 'VAE', 'batch_size': 6, 'iterations': 149, 'learning_rate': 0.0023790354372704176, 'p_miss': 0.193276152853302}. Best is trial 39 with value: 0.051216485330443116.
running
[I 2024-09-24 06:40:20,660] Trial 46 finished with value: 0.05321800407418855 and parameters: {'model_name': 'IterativeImputer', 'estimator': 'KNN', 'initial_strategy': 'constant', 'n_nearest_features': 19, 'imputation_order': 'arabic'}. Best is trial 39 with value: 0.051216485330443116.
running
[I 2024-09-24 06:40:33,909] Trial 47 finished with value: 0.05177389268275595 and parameters: {'model_name': 'IterativeImputer', 'estimator': 'KNN', 'initial_strategy': 'most_frequent', 'n_nearest_features': 18, 'imputation_order': 'arabic'}. Best is trial 39 with value: 0.051216485330443116.
running
[I 2024-09-24 06:49:56,721] Trial 18 finished with value: 0.1631913687134204 and parameters: {'model_name': 'GAIN', 'batch_size': 2, 'hint_rate': 0.8192083866727178, 'alpha': 48, 'iterations': 680, 'learning_rate': 0.06986315044696295, 'p_miss': 0.2897428188547601}. Best is trial 39 with value: 0.051216485330443116.
running
[I 2024-09-24 07:21:11,388] Trial 10 finished with value: 0.07803309001846444 and parameters: {'model_name': 'IterativeImputer', 'estimator': 'RFR', 'initial_strategy': 'constant', 'n_nearest_features': 2, 'imputation_order': 'descending'}. Best is trial 39 with value: 0.051216485330443116.
running
[I 2024-09-24 07:23:32,608] Trial 56 finished with value: 0.052662773972334 and parameters: {'model_name': 'IterativeImputer', 'estimator': 'KNN', 'initial_strategy': 'most_frequent', 'n_nearest_features': 21, 'imputation_order': 'roman'}. Best is trial 39 with value: 0.051216485330443116.
running
[I 2024-09-24 07:58:34,575] Trial 16 finished with value: 0.1090111879780539 and parameters: {'model_name': 'VAE', 'batch_size': 3, 'iterations': 1748, 'learning_rate': 0.003881405183503449, 'p_miss': 0.15628842511761726}. Best is trial 39 with value: 0.051216485330443116.
running
[I 2024-09-24 08:04:18,182] Trial 2 finished with value: 0.23708807769469337 and parameters: {'model_name': 'GAIN', 'batch_size': 609, 'hint_rate': 0.9491691330374973, 'alpha': 39, 'iterations': 2317, 'learning_rate': 0.006909929720715851, 'p_miss': 0.17619550552955393}. Best is trial 39 with value: 0.051216485330443116.
running
[I 2024-09-24 08:06:15,225] Trial 59 finished with value: 0.051656924688563775 and parameters: {'model_name': 'IterativeImputer', 'estimator': 'KNN', 'initial_strategy': 'most_frequent', 'n_nearest_features': 17, 'imputation_order': 'roman'}. Best is trial 39 with value: 0.051216485330443116.
running
[I 2024-09-24 08:15:10,360] Trial 55 finished with value: 0.10120289406567858 and parameters: {'model_name': 'VAE', 'batch_size': 63, 'iterations': 1978, 'learning_rate': 0.0024328248539626776, 'p_miss': 0.2768233498118075}. Best is trial 39 with value: 0.051216485330443116.
running
[I 2024-09-24 08:28:31,576] Trial 44 finished with value: 0.31533581806665395 and parameters: {'model_name': 'GAIN', 'batch_size': 82, 'hint_rate': 0.9528657897394357, 'alpha': 69, 'iterations': 4327, 'learning_rate': 0.001671217062338415, 'p_miss': 0.29533132278129776}. Best is trial 39 with value: 0.051216485330443116.
running
[I 2024-09-24 08:28:32,236] Trial 62 finished with value: 0.09964454268947594 and parameters: {'model_name': 'SimpleImputer', 'strategy': 'mean'}. Best is trial 39 with value: 0.051216485330443116.
running
[I 2024-09-24 08:30:27,421] Trial 63 finished with value: 0.05212490864345026 and parameters: {'model_name': 'IterativeImputer', 'estimator': 'KNN', 'initial_strategy': 'most_frequent', 'n_nearest_features': 16, 'imputation_order': 'roman'}. Best is trial 39 with value: 0.051216485330443116.
running
[I 2024-09-24 08:32:25,425] Trial 64 finished with value: 0.052028838769022735 and parameters: {'model_name': 'IterativeImputer', 'estimator': 'KNN', 'initial_strategy': 'most_frequent', 'n_nearest_features': 17, 'imputation_order': 'arabic'}. Best is trial 39 with value: 0.051216485330443116.
running
[I 2024-09-24 08:32:25,874] Trial 65 finished with value: 0.09964454268947594 and parameters: {'model_name': 'SimpleImputer', 'strategy': 'mean'}. Best is trial 39 with value: 0.051216485330443116.
running
[I 2024-09-24 08:34:22,884] Trial 66 finished with value: 0.052028838769022735 and parameters: {'model_name': 'IterativeImputer', 'estimator': 'KNN', 'initial_strategy': 'most_frequent', 'n_nearest_features': 17, 'imputation_order': 'arabic'}. Best is trial 39 with value: 0.051216485330443116.
running
[I 2024-09-24 08:34:42,721] Trial 14 finished with value: 0.10028707432615244 and parameters: {'model_name': 'VAE', 'batch_size': 686, 'iterations': 1894, 'learning_rate': 0.00032101249034144623, 'p_miss': 0.12347254139497349}. Best is trial 39 with value: 0.051216485330443116.
running
[I 2024-09-24 08:36:09,098] Trial 67 finished with value: 0.05177389268275595 and parameters: {'model_name': 'IterativeImputer', 'estimator': 'KNN', 'initial_strategy': 'most_frequent', 'n_nearest_features': 18, 'imputation_order': 'arabic'}. Best is trial 39 with value: 0.051216485330443116.
running
[I 2024-09-24 08:36:27,387] Trial 68 finished with value: 0.0519780273689993 and parameters: {'model_name': 'IterativeImputer', 'estimator': 'KNN', 'initial_strategy': 'most_frequent', 'n_nearest_features': 19, 'imputation_order': 'arabic'}. Best is trial 39 with value: 0.051216485330443116.
running
[I 2024-09-24 08:44:02,336] Trial 69 finished with value: 0.27779460466374706 and parameters: {'model_name': 'GAIN', 'batch_size': 30, 'hint_rate': 0.02667045766417825, 'alpha': 4, 'iterations': 357, 'learning_rate': 0.0009402546243333945, 'p_miss': 0.23095145611260118}. Best is trial 39 with value: 0.051216485330443116.
running
[I 2024-09-24 09:02:10,880] Trial 53 finished with value: 0.3052894269666156 and parameters: {'model_name': 'GAIN', 'batch_size': 80, 'hint_rate': 0.9623432632808244, 'alpha': 72, 'iterations': 5833, 'learning_rate': 0.001255238837747813, 'p_miss': 0.2956544384638795}. Best is trial 39 with value: 0.051216485330443116.
running
[I 2024-09-24 09:02:15,119] Trial 72 finished with value: 0.056715454948192176 and parameters: {'model_name': 'KNNImputer', 'n_neighbors': 36, 'weights': 'distance'}. Best is trial 39 with value: 0.051216485330443116.
running
[I 2024-09-24 09:24:18,696] Trial 51 finished with value: 0.30999466186485203 and parameters: {'model_name': 'GAIN', 'batch_size': 111, 'hint_rate': 0.9394431564301398, 'alpha': 70, 'iterations': 6605, 'learning_rate': 0.0023255573470687685, 'p_miss': 0.29634473734220745}. Best is trial 39 with value: 0.051216485330443116.
running
[I 2024-09-24 09:37:49,010] Trial 54 finished with value: 0.3002109444584856 and parameters: {'model_name': 'GAIN', 'batch_size': 100, 'hint_rate': 0.9785763338009335, 'alpha': 74, 'iterations': 7191, 'learning_rate': 0.0008319116494821282, 'p_miss': 0.296122590218855}. Best is trial 39 with value: 0.051216485330443116.
running
[I 2024-09-24 09:42:51,298] Trial 50 finished with value: 0.3012954787702401 and parameters: {'model_name': 'GAIN', 'batch_size': 75, 'hint_rate': 0.9083007622792982, 'alpha': 71, 'iterations': 7785, 'learning_rate': 0.0018382838054225767, 'p_miss': 0.2637957861945075}. Best is trial 39 with value: 0.051216485330443116.
running
[I 2024-09-24 09:44:58,781] Trial 76 finished with value: 0.0519780273689993 and parameters: {'model_name': 'IterativeImputer', 'estimator': 'KNN', 'initial_strategy': 'most_frequent', 'n_nearest_features': 19, 'imputation_order': 'arabic'}. Best is trial 39 with value: 0.051216485330443116.
running
[I 2024-09-24 09:47:09,854] Trial 77 finished with value: 0.0519780273689993 and parameters: {'model_name': 'IterativeImputer', 'estimator': 'KNN', 'initial_strategy': 'most_frequent', 'n_nearest_features': 19, 'imputation_order': 'arabic'}. Best is trial 39 with value: 0.051216485330443116.
running
[I 2024-09-24 09:50:40,199] Trial 48 finished with value: 0.30342080757417256 and parameters: {'model_name': 'GAIN', 'batch_size': 75, 'hint_rate': 0.9768172893947555, 'alpha': 71, 'iterations': 8408, 'learning_rate': 0.0014726829202756078, 'p_miss': 0.2828808573835305}. Best is trial 39 with value: 0.051216485330443116.
running
[I 2024-09-24 09:55:03,229] Trial 49 finished with value: 0.31138370361684625 and parameters: {'model_name': 'GAIN', 'batch_size': 75, 'hint_rate': 0.9159024709497494, 'alpha': 72, 'iterations': 8433, 'learning_rate': 0.0014930082629138362, 'p_miss': 0.2953575971434178}. Best is trial 39 with value: 0.051216485330443116.
running
[I 2024-09-24 10:02:47,605] Trial 45 finished with value: 0.31404715643853215 and parameters: {'model_name': 'GAIN', 'batch_size': 87, 'hint_rate': 0.9898739139369623, 'alpha': 71, 'iterations': 8740, 'learning_rate': 0.0017991522361881548, 'p_miss': 0.29407605354406774}. Best is trial 39 with value: 0.051216485330443116.
running
[I 2024-09-24 10:10:31,412] Trial 52 finished with value: 0.29490737389171534 and parameters: {'model_name': 'GAIN', 'batch_size': 80, 'hint_rate': 0.9816531545930403, 'alpha': 73, 'iterations': 9409, 'learning_rate': 0.001529548025020824, 'p_miss': 0.28850125776858}. Best is trial 39 with value: 0.051216485330443116.
running
[I 2024-09-24 10:36:25,039] Trial 70 finished with value: 0.039658407530270126 and parameters: {'model_name': 'IterativeImputer', 'estimator': 'RFR', 'initial_strategy': 'most_frequent', 'n_nearest_features': 19, 'imputation_order': 'arabic'}. Best is trial 70 with value: 0.039658407530270126.
running
[I 2024-09-24 10:41:45,740] Trial 8 finished with value: 0.12098493463213333 and parameters: {'model_name': 'VAE', 'batch_size': 1, 'iterations': 6393, 'learning_rate': 0.06152056571801423, 'p_miss': 0.19357942075883264}. Best is trial 70 with value: 0.039658407530270126.
running
[I 2024-09-24 10:44:13,531] Trial 71 finished with value: 0.03949394053020468 and parameters: {'model_name': 'IterativeImputer', 'estimator': 'RFR', 'initial_strategy': 'most_frequent', 'n_nearest_features': 19, 'imputation_order': 'arabic'}. Best is trial 71 with value: 0.03949394053020468.
running
[I 2024-09-24 10:46:35,880] Trial 11 finished with value: 0.10039844517075451 and parameters: {'model_name': 'VAE', 'batch_size': 80, 'iterations': 6669, 'learning_rate': 0.010523508438084802, 'p_miss': 0.25225055595926044}. Best is trial 71 with value: 0.03949394053020468.
running
[I 2024-09-24 10:49:35,308] Trial 61 finished with value: 0.28475086283847856 and parameters: {'model_name': 'GAIN', 'batch_size': 66, 'hint_rate': 0.01406005860854359, 'alpha': 97, 'iterations': 8049, 'learning_rate': 0.00010251191195702268, 'p_miss': 0.24564994860042189}. Best is trial 71 with value: 0.03949394053020468.
running
