[I 2024-11-06 05:53:35,244] Trial 198 finished with value: 0.2612869777929152 and parameters: {'model_name': 'SimpleImputer', 'strategy': 'mean'}. Best is trial 3 with value: 0.2612869777929152.
fit
simple fit
simple transform
0    0
1    0
2    0
3    0
4    0
dtype: int64
0    0
1    0
2    0
3    0
4    0
dtype: int64
0.2612869777929152
{'model_name': 'SimpleImputer', 'strategy': 'mean'}
running experiment 2/3 - Does reconstruction give good automl predictions
Start est fit
Version 0.1.7a0 of tpot2 is outdated. Version 0.1.8a0 was released Tuesday September 17, 2024.
Version 0.1.7a0 of tpot2 is outdated. Version 0.1.8a0 was released Tuesday September 17, 2024.
Version 0.1.7a0 of tpot2 is outdated. Version 0.1.8a0 was released Tuesday September 17, 2024.
Version 0.1.7a0 of tpot2 is outdated. Version 0.1.8a0 was released Tuesday September 17, 2024.
Version 0.1.7a0 of tpot2 is outdated. Version 0.1.8a0 was released Tuesday September 17, 2024.
Version 0.1.7a0 of tpot2 is outdated. Version 0.1.8a0 was released Tuesday September 17, 2024.
Version 0.1.7a0 of tpot2 is outdated. Version 0.1.8a0 was released Tuesday September 17, 2024.
Version 0.1.7a0 of tpot2 is outdated. Version 0.1.8a0 was released Tuesday September 17, 2024.
Version 0.1.7a0 of tpot2 is outdated. Version 0.1.8a0 was released Tuesday September 17, 2024.
Version 0.1.7a0 of tpot2 is outdated. Version 0.1.8a0 was released Tuesday September 17, 2024.
Version 0.1.7a0 of tpot2 is outdated. Version 0.1.8a0 was released Tuesday September 17, 2024.
Version 0.1.7a0 of tpot2 is outdated. Version 0.1.8a0 was released Tuesday September 17, 2024.
Version 0.1.7a0 of tpot2 is outdated. Version 0.1.8a0 was released Tuesday September 17, 2024.
Version 0.1.7a0 of tpot2 is outdated. Version 0.1.8a0 was released Tuesday September 17, 2024.
Version 0.1.7a0 of tpot2 is outdated. Version 0.1.8a0 was released Tuesday September 17, 2024.
Version 0.1.7a0 of tpot2 is outdated. Version 0.1.8a0 was released Tuesday September 17, 2024.
  0%|          | 0/25 [00:00<?, ?it/s]Generation:   0%|          | 0/25 [00:00<?, ?it/s]Generation:  1
Best f1_score score: 0.7915147043575519
Generation:   4%|▍         | 1/25 [00:46<18:46, 46.94s/it]Generation:  2
Best f1_score score: 0.7915147043575519
Generation:   8%|▊         | 2/25 [00:59<10:08, 26.45s/it]Generation:  3
Best f1_score score: 0.7915147043575519
Generation:  12%|█▏        | 3/25 [04:45<43:06, 117.58s/it]Generation:  4
Best f1_score score: 0.7936440543496619
Generation:  16%|█▌        | 4/25 [04:58<26:42, 76.31s/it] Generation:  5
Best f1_score score: 0.801466876583475
Generation:  20%|██        | 5/25 [07:43<36:12, 108.60s/it]Generation:  6
Best f1_score score: 0.801466876583475
Generation:  24%|██▍       | 6/25 [07:57<24:06, 76.11s/it] Generation:  7
Best f1_score score: 0.801466876583475
Generation:  28%|██▊       | 7/25 [08:21<17:43, 59.07s/it]Generation:  8
Best f1_score score: 0.801466876583475
Generation:  32%|███▏      | 8/25 [09:28<17:32, 61.91s/it]Generation:  9
Best f1_score score: 0.801466876583475
Generation:  36%|███▌      | 9/25 [10:07<14:31, 54.50s/it]Generation:  10
Best f1_score score: 0.801466876583475
Generation:  40%|████      | 10/25 [10:23<10:41, 42.75s/it]Generation:  11
Best f1_score score: 0.801466876583475
Generation:  44%|████▍     | 11/25 [10:54<09:06, 39.07s/it]Generation:  12
Best f1_score score: 0.801466876583475
Generation:  48%|████▊     | 12/25 [11:08<06:48, 31.45s/it]Generation:  13
Best f1_score score: 0.801466876583475
Generation:  52%|█████▏    | 13/25 [11:43<06:32, 32.71s/it]Generation:  14
Best f1_score score: 0.801466876583475
Generation:  56%|█████▌    | 14/25 [12:03<05:14, 28.62s/it]Generation:  15
Best f1_score score: 0.8019613125608872
Generation:  60%|██████    | 15/25 [14:10<09:45, 58.52s/it]WARNING THIS INDIVIDUAL CAUSED AND EXCEPTION 
 <tpot2.search_spaces.pipelines.sequential.SequentialPipelineIndividual object at 0x1554742e0d00> 
 Out of bag estimation only available if bootstrap=True 
 Traceback (most recent call last):
  File "/common/ketrong/tpotexp/tpot2/tpot2/utils/eval_utils.py", line 53, in objective_nan_wrapper
    value = func_timeout.func_timeout(timeout, objective_function, args=[individual], kwargs=objective_kwargs)
  File "/common/ketrong/tpotexp/env/lib/python3.10/site-packages/func_timeout/dafunc.py", line 108, in func_timeout
    raise_exception(exception)
  File "/common/ketrong/tpotexp/env/lib/python3.10/site-packages/func_timeout/py3_raise.py", line 7, in raise_exception
    raise exception[0] from None
  File "/common/ketrong/tpotexp/tpot2/tpot2/tpot_estimator/estimator.py", line 623, in objective_function
    return objective_function_generator(
  File "/common/ketrong/tpotexp/tpot2/tpot2/tpot_estimator/estimator_utils.py", line 55, in objective_function_generator
    cv_obj_scores = cross_val_score_objective(sklearn.base.clone(pipeline),x,y,scorers=scorers, cv=cv , fold=step)
  File "/common/ketrong/tpotexp/tpot2/tpot2/tpot_estimator/cross_val_utils.py", line 28, in cross_val_score_objective
    this_fold_pipeline.fit(X_train,y_train)
  File "/common/ketrong/tpotexp/env/lib/python3.10/site-packages/sklearn/base.py", line 1473, in wrapper
    return fit_method(estimator, *args, **kwargs)
  File "/common/ketrong/tpotexp/env/lib/python3.10/site-packages/sklearn/pipeline.py", line 473, in fit
    self._final_estimator.fit(Xt, y, **last_step_params["fit"])
  File "/common/ketrong/tpotexp/env/lib/python3.10/site-packages/sklearn/utils/validation.py", line 66, in inner_f
    return f(*args, **kwargs)
  File "/common/ketrong/tpotexp/env/lib/python3.10/site-packages/sklearn/base.py", line 1473, in wrapper
    return fit_method(estimator, *args, **kwargs)
  File "/common/ketrong/tpotexp/env/lib/python3.10/site-packages/sklearn/ensemble/_bagging.py", line 402, in fit
    return self._fit(X, y, max_samples=self.max_samples, **fit_params)
  File "/common/ketrong/tpotexp/env/lib/python3.10/site-packages/sklearn/ensemble/_bagging.py", line 502, in _fit
    raise ValueError("Out of bag estimation only available if bootstrap=True")
ValueError: Out of bag estimation only available if bootstrap=True

WARNING THIS INDIVIDUAL CAUSED AND EXCEPTION 
 <tpot2.search_spaces.pipelines.sequential.SequentialPipelineIndividual object at 0x1554745cc0a0> 
 Out of bag estimation only available if bootstrap=True 
 Traceback (most recent call last):
  File "/common/ketrong/tpotexp/tpot2/tpot2/utils/eval_utils.py", line 53, in objective_nan_wrapper
    value = func_timeout.func_timeout(timeout, objective_function, args=[individual], kwargs=objective_kwargs)
  File "/common/ketrong/tpotexp/env/lib/python3.10/site-packages/func_timeout/dafunc.py", line 108, in func_timeout
    raise_exception(exception)
  File "/common/ketrong/tpotexp/env/lib/python3.10/site-packages/func_timeout/py3_raise.py", line 7, in raise_exception
    raise exception[0] from None
  File "/common/ketrong/tpotexp/tpot2/tpot2/tpot_estimator/estimator.py", line 623, in objective_function
    return objective_function_generator(
  File "/common/ketrong/tpotexp/tpot2/tpot2/tpot_estimator/estimator_utils.py", line 55, in objective_function_generator
    cv_obj_scores = cross_val_score_objective(sklearn.base.clone(pipeline),x,y,scorers=scorers, cv=cv , fold=step)
  File "/common/ketrong/tpotexp/tpot2/tpot2/tpot_estimator/cross_val_utils.py", line 28, in cross_val_score_objective
    this_fold_pipeline.fit(X_train,y_train)
  File "/common/ketrong/tpotexp/env/lib/python3.10/site-packages/sklearn/base.py", line 1473, in wrapper
    return fit_method(estimator, *args, **kwargs)
  File "/common/ketrong/tpotexp/env/lib/python3.10/site-packages/sklearn/pipeline.py", line 473, in fit
    self._final_estimator.fit(Xt, y, **last_step_params["fit"])
  File "/common/ketrong/tpotexp/env/lib/python3.10/site-packages/sklearn/utils/validation.py", line 66, in inner_f
    return f(*args, **kwargs)
  File "/common/ketrong/tpotexp/env/lib/python3.10/site-packages/sklearn/base.py", line 1473, in wrapper
    return fit_method(estimator, *args, **kwargs)
  File "/common/ketrong/tpotexp/env/lib/python3.10/site-packages/sklearn/ensemble/_bagging.py", line 402, in fit
    return self._fit(X, y, max_samples=self.max_samples, **fit_params)
  File "/common/ketrong/tpotexp/env/lib/python3.10/site-packages/sklearn/ensemble/_bagging.py", line 502, in _fit
    raise ValueError("Out of bag estimation only available if bootstrap=True")
ValueError: Out of bag estimation only available if bootstrap=True

Generation:  16
Best f1_score score: 0.8019613125608872
Generation:  64%|██████▍   | 16/25 [14:31<07:05, 47.23s/it]Generation:  17
Best f1_score score: 0.8019613125608872
Generation:  68%|██████▊   | 17/25 [15:26<06:35, 49.38s/it]Generation:  18
Best f1_score score: 0.8019613125608872
Generation:  72%|███████▏  | 18/25 [16:05<05:23, 46.22s/it]Generation:  19
Best f1_score score: 0.8019613125608872
Generation:  76%|███████▌  | 19/25 [16:53<04:41, 46.92s/it]Generation:  20
Best f1_score score: 0.8019613125608872
Generation:  80%|████████  | 20/25 [17:48<04:06, 49.34s/it]Generation:  21
Best f1_score score: 0.8019613125608872
Generation:  84%|████████▍ | 21/25 [18:31<03:08, 47.24s/it]Generation:  22
Best f1_score score: 0.8019613125608872
Generation:  88%|████████▊ | 22/25 [18:47<01:54, 38.02s/it]WARNING THIS INDIVIDUAL CAUSED AND EXCEPTION 
 <tpot2.search_spaces.pipelines.sequential.SequentialPipelineIndividual object at 0x155486027130> 
 Out of bag estimation only available if bootstrap=True 
 Traceback (most recent call last):
  File "/common/ketrong/tpotexp/tpot2/tpot2/utils/eval_utils.py", line 53, in objective_nan_wrapper
    value = func_timeout.func_timeout(timeout, objective_function, args=[individual], kwargs=objective_kwargs)
  File "/common/ketrong/tpotexp/env/lib/python3.10/site-packages/func_timeout/dafunc.py", line 108, in func_timeout
    raise_exception(exception)
  File "/common/ketrong/tpotexp/env/lib/python3.10/site-packages/func_timeout/py3_raise.py", line 7, in raise_exception
    raise exception[0] from None
  File "/common/ketrong/tpotexp/tpot2/tpot2/tpot_estimator/estimator.py", line 623, in objective_function
    return objective_function_generator(
  File "/common/ketrong/tpotexp/tpot2/tpot2/tpot_estimator/estimator_utils.py", line 55, in objective_function_generator
    cv_obj_scores = cross_val_score_objective(sklearn.base.clone(pipeline),x,y,scorers=scorers, cv=cv , fold=step)
  File "/common/ketrong/tpotexp/tpot2/tpot2/tpot_estimator/cross_val_utils.py", line 28, in cross_val_score_objective
    this_fold_pipeline.fit(X_train,y_train)
  File "/common/ketrong/tpotexp/env/lib/python3.10/site-packages/sklearn/base.py", line 1473, in wrapper
    return fit_method(estimator, *args, **kwargs)
  File "/common/ketrong/tpotexp/env/lib/python3.10/site-packages/sklearn/pipeline.py", line 473, in fit
    self._final_estimator.fit(Xt, y, **last_step_params["fit"])
  File "/common/ketrong/tpotexp/env/lib/python3.10/site-packages/sklearn/utils/validation.py", line 66, in inner_f
    return f(*args, **kwargs)
  File "/common/ketrong/tpotexp/env/lib/python3.10/site-packages/sklearn/base.py", line 1473, in wrapper
    return fit_method(estimator, *args, **kwargs)
  File "/common/ketrong/tpotexp/env/lib/python3.10/site-packages/sklearn/ensemble/_bagging.py", line 402, in fit
    return self._fit(X, y, max_samples=self.max_samples, **fit_params)
  File "/common/ketrong/tpotexp/env/lib/python3.10/site-packages/sklearn/ensemble/_bagging.py", line 502, in _fit
    raise ValueError("Out of bag estimation only available if bootstrap=True")
ValueError: Out of bag estimation only available if bootstrap=True

Generation:  23
Best f1_score score: 0.8019613125608872
Generation:  92%|█████████▏| 23/25 [20:55<02:09, 64.85s/it]WARNING THIS INDIVIDUAL CAUSED AND EXCEPTION 
 <tpot2.search_spaces.pipelines.sequential.SequentialPipelineIndividual object at 0x1554652d98a0> 
 Out of bag estimation only available if bootstrap=True 
 Traceback (most recent call last):
  File "/common/ketrong/tpotexp/tpot2/tpot2/utils/eval_utils.py", line 53, in objective_nan_wrapper
    value = func_timeout.func_timeout(timeout, objective_function, args=[individual], kwargs=objective_kwargs)
  File "/common/ketrong/tpotexp/env/lib/python3.10/site-packages/func_timeout/dafunc.py", line 108, in func_timeout
    raise_exception(exception)
  File "/common/ketrong/tpotexp/env/lib/python3.10/site-packages/func_timeout/py3_raise.py", line 7, in raise_exception
    raise exception[0] from None
  File "/common/ketrong/tpotexp/tpot2/tpot2/tpot_estimator/estimator.py", line 623, in objective_function
    return objective_function_generator(
  File "/common/ketrong/tpotexp/tpot2/tpot2/tpot_estimator/estimator_utils.py", line 55, in objective_function_generator
    cv_obj_scores = cross_val_score_objective(sklearn.base.clone(pipeline),x,y,scorers=scorers, cv=cv , fold=step)
  File "/common/ketrong/tpotexp/tpot2/tpot2/tpot_estimator/cross_val_utils.py", line 28, in cross_val_score_objective
    this_fold_pipeline.fit(X_train,y_train)
  File "/common/ketrong/tpotexp/env/lib/python3.10/site-packages/sklearn/base.py", line 1473, in wrapper
    return fit_method(estimator, *args, **kwargs)
  File "/common/ketrong/tpotexp/env/lib/python3.10/site-packages/sklearn/pipeline.py", line 473, in fit
    self._final_estimator.fit(Xt, y, **last_step_params["fit"])
  File "/common/ketrong/tpotexp/env/lib/python3.10/site-packages/sklearn/utils/validation.py", line 66, in inner_f
    return f(*args, **kwargs)
  File "/common/ketrong/tpotexp/env/lib/python3.10/site-packages/sklearn/base.py", line 1473, in wrapper
    return fit_method(estimator, *args, **kwargs)
  File "/common/ketrong/tpotexp/env/lib/python3.10/site-packages/sklearn/ensemble/_bagging.py", line 402, in fit
    return self._fit(X, y, max_samples=self.max_samples, **fit_params)
  File "/common/ketrong/tpotexp/env/lib/python3.10/site-packages/sklearn/ensemble/_bagging.py", line 502, in _fit
    raise ValueError("Out of bag estimation only available if bootstrap=True")
ValueError: Out of bag estimation only available if bootstrap=True

Generation:  24
Best f1_score score: 0.8019613125608872
Generation:  96%|█████████▌| 24/25 [21:14<00:51, 51.09s/it]Generation:  25
Best f1_score score: 0.8019613125608872
Generation: 100%|██████████| 25/25 [21:37<00:00, 42.92s/it]Generation: 100%|██████████| 25/25 [21:40<00:00, 52.03s/it]
2024-11-06 06:15:21,332 - distributed.scheduler - ERROR - Removing worker 'tcp://127.0.0.1:46809' caused the cluster to lose scattered data, which can't be recovered: {'ndarray-1214c04637e40778daf40f9a317a4824', 'ndarray-579345a51609ee95c00b98330f72c2da'} (stimulus_id='handle-worker-cleanup-1730902521.3326972')
Fitted
Pipeline(steps=[('baggingclassifier',
                 BaggingClassifier(bootstrap=False, bootstrap_features=True,
                                   max_features=0.9359585255932,
                                   max_samples=0.7606953355016, n_estimators=51,
                                   n_jobs=1))])
score start
train score: {'auroc': 0.9962908983794525, 'accuracy': 0.9637343197169508, 'balanced_accuracy': 0.94637377227923, 'logloss': 0.19008404435668352, 'f1': 0.9577954922464746}
original test score: {'auroc': 0.975468771830463, 'accuracy': 0.9501447410743005, 'balanced_accuracy': 0.9319077093591209, 'logloss': 0.22345937646549674, 'f1': 0.9421141375944049}
imputed test score: {'auroc': 0.8878695999932487, 'accuracy': 0.8311354133161788, 'balanced_accuracy': 0.770363455816784, 'logloss': 0.3959520639053391, 'f1': 0.7902967008274044}
score end
check intended
EXP2 Finished
running experiment 3/3 - What is the best automl settings?
<tpot2.search_spaces.pipelines.sequential.SequentialPipeline object at 0x155434d239d0>
Start tpot fit
Version 0.1.7a0 of tpot2 is outdated. Version 0.1.8a0 was released Tuesday September 17, 2024.
Version 0.1.7a0 of tpot2 is outdated. Version 0.1.8a0 was released Tuesday September 17, 2024.
Version 0.1.7a0 of tpot2 is outdated. Version 0.1.8a0 was released Tuesday September 17, 2024.
Version 0.1.7a0 of tpot2 is outdated. Version 0.1.8a0 was released Tuesday September 17, 2024.
Version 0.1.7a0 of tpot2 is outdated. Version 0.1.8a0 was released Tuesday September 17, 2024.
Version 0.1.7a0 of tpot2 is outdated. Version 0.1.8a0 was released Tuesday September 17, 2024.
Version 0.1.7a0 of tpot2 is outdated. Version 0.1.8a0 was released Tuesday September 17, 2024.
Version 0.1.7a0 of tpot2 is outdated. Version 0.1.8a0 was released Tuesday September 17, 2024.
Version 0.1.7a0 of tpot2 is outdated. Version 0.1.8a0 was released Tuesday September 17, 2024.
Version 0.1.7a0 of tpot2 is outdated. Version 0.1.8a0 was released Tuesday September 17, 2024.
Version 0.1.7a0 of tpot2 is outdated. Version 0.1.8a0 was released Tuesday September 17, 2024.
Version 0.1.7a0 of tpot2 is outdated. Version 0.1.8a0 was released Tuesday September 17, 2024.
Version 0.1.7a0 of tpot2 is outdated. Version 0.1.8a0 was released Tuesday September 17, 2024.
Version 0.1.7a0 of tpot2 is outdated. Version 0.1.8a0 was released Tuesday September 17, 2024.
Version 0.1.7a0 of tpot2 is outdated. Version 0.1.8a0 was released Tuesday September 17, 2024.
Version 0.1.7a0 of tpot2 is outdated. Version 0.1.8a0 was released Tuesday September 17, 2024.
  0%|          | 0/25 [00:00<?, ?it/s]Generation:   0%|          | 0/25 [00:00<?, ?it/s]Generation:  1
Best f1_score score: 0.7757419489847491
Generation:   4%|▍         | 1/25 [00:05<02:04,  5.20s/it]Generation:  2
Best f1_score score: 0.7869559896368019
Generation:   8%|▊         | 2/25 [01:40<22:14, 58.03s/it]Generation:  3
Best f1_score score: 0.7875411175978118
Generation:  12%|█▏        | 3/25 [01:53<13:47, 37.63s/it]Generation:  4
Best f1_score score: 0.7875411175978118
Generation:  16%|█▌        | 4/25 [02:40<14:23, 41.11s/it]Generation:  5
Best f1_score score: 0.7875411175978118
Generation:  20%|██        | 5/25 [02:54<10:32, 31.60s/it]Generation:  6
Best f1_score score: 0.7875411175978118
Generation:  24%|██▍       | 6/25 [03:01<07:19, 23.13s/it]Generation:  7
Best f1_score score: 0.7912551928307262
Generation:  28%|██▊       | 7/25 [03:09<05:24, 18.05s/it]Generation:  8
Best f1_score score: 0.7912551928307262
Generation:  32%|███▏      | 8/25 [03:15<04:01, 14.22s/it]Generation:  9
Best f1_score score: 0.7912551928307262
Generation:  36%|███▌      | 9/25 [05:57<16:07, 60.46s/it]Generation:  10
Best f1_score score: 0.7912551928307262
Generation:  40%|████      | 10/25 [06:02<10:50, 43.38s/it]Generation:  11
Best f1_score score: 0.7912551928307262
Generation:  44%|████▍     | 11/25 [06:52<10:35, 45.39s/it]Generation:  12
Best f1_score score: 0.7933454424850982
Generation:  48%|████▊     | 12/25 [07:00<07:22, 34.03s/it]Generation:  13
Best f1_score score: 0.7955793832088125
Generation:  52%|█████▏    | 13/25 [07:05<05:02, 25.22s/it]Generation:  14
Best f1_score score: 0.7955793832088125
Generation:  56%|█████▌    | 14/25 [07:10<03:32, 19.31s/it]Generation:  15
Best f1_score score: 0.7955793832088125
Generation:  60%|██████    | 15/25 [07:40<03:43, 22.31s/it]Generation:  16
Best f1_score score: 0.7964350775891862
Generation:  64%|██████▍   | 16/25 [08:29<04:33, 30.44s/it]Generation:  17
Best f1_score score: 0.7964350775891862
Generation:  68%|██████▊   | 17/25 [08:41<03:19, 24.89s/it]Generation:  18
Best f1_score score: 0.7964350775891862
Generation:  72%|███████▏  | 18/25 [08:55<02:30, 21.50s/it]Generation:  19
Best f1_score score: 0.7964350775891862
Generation:  76%|███████▌  | 19/25 [09:22<02:20, 23.41s/it]Generation:  20
Best f1_score score: 0.7964350775891862
Generation:  80%|████████  | 20/25 [10:03<02:23, 28.61s/it]Generation:  21
Best f1_score score: 0.7964350775891862
Generation:  84%|████████▍ | 21/25 [10:57<02:24, 36.12s/it]Generation:  22
Best f1_score score: 0.7964350775891862
Generation:  88%|████████▊ | 22/25 [11:05<01:23, 27.89s/it]Generation:  23
Best f1_score score: 0.7964350775891862
Generation:  92%|█████████▏| 23/25 [11:11<00:42, 21.04s/it]Generation:  24
Best f1_score score: 0.7964350775891862
Generation:  96%|█████████▌| 24/25 [11:24<00:18, 18.80s/it]Generation:  25
Best f1_score score: 0.7964350775891862
Generation: 100%|██████████| 25/25 [14:14<00:00, 64.07s/it]Generation: 100%|██████████| 25/25 [14:14<00:00, 34.17s/it]
2024-11-06 06:29:43,352 - distributed.scheduler - ERROR - Removing worker 'tcp://127.0.0.1:40261' caused the cluster to lose scattered data, which can't be recovered: {'DataFrame-04f9fc0214f380cd5334e08d900f5fc4', 'ndarray-579345a51609ee95c00b98330f72c2da'} (stimulus_id='handle-worker-cleanup-1730903383.3526483')
Fitted
Pipeline(steps=[('simpleimputer', SimpleImputer(strategy='median')),
                ('lgbmclassifier',
                 LGBMClassifier(max_depth=10, n_estimators=86, n_jobs=1,
                                num_leaves=215, verbose=-1))])
transform worked
try transform
transform worked
score start
train score: {'auroc': 0.942528965563733, 'accuracy': 0.8682856223866194, 'balanced_accuracy': 0.814056878900056, 'logloss': 0.28261645755569, 'f1': 0.8371458166583057}
test score: {'auroc': 0.8836111066831575, 'accuracy': 0.8279189449983918, 'balanced_accuracy': 0.7642227956682736, 'logloss': 0.367214413409721, 'f1': 0.7847737712333905}
original test score: {'auroc': 0.971890099647712, 'accuracy': 0.9424252171116114, 'balanced_accuracy': 0.9211646601785164, 'logloss': 0.15973487231723144, 'f1': 0.9328502021995498}
score end
1046
lvl
0.5
type
MCAR
num_run
2
class_simple
finished
all finished
full run takes
0.611125035683314
hours
DONE
