[I 2024-09-30 17:20:37,796] Trial 165 finished with value: 0.2513188059535433 and parameters: {'model_name': 'KNNImputer', 'n_neighbors': 4119, 'weights': 'distance'}. Best is trial 40 with value: 0.23407864405802759.
running
[I 2024-09-30 17:20:41,460] Trial 164 finished with value: 0.23436247045113978 and parameters: {'model_name': 'IterativeImputer', 'estimator': 'Ridge', 'initial_strategy': 'median', 'n_nearest_features': 7, 'imputation_order': 'roman'}. Best is trial 40 with value: 0.23407864405802759.
running
[I 2024-09-30 17:21:05,773] Trial 166 finished with value: 0.23436247045113978 and parameters: {'model_name': 'IterativeImputer', 'estimator': 'Ridge', 'initial_strategy': 'median', 'n_nearest_features': 7, 'imputation_order': 'roman'}. Best is trial 40 with value: 0.23407864405802759.
running
[I 2024-09-30 17:21:07,410] Trial 167 finished with value: 0.23407864405802759 and parameters: {'model_name': 'IterativeImputer', 'estimator': 'Ridge', 'initial_strategy': 'median', 'n_nearest_features': 6, 'imputation_order': 'roman'}. Best is trial 40 with value: 0.23407864405802759.
running
[I 2024-09-30 17:21:34,143] Trial 169 finished with value: 0.23407864405802759 and parameters: {'model_name': 'IterativeImputer', 'estimator': 'Ridge', 'initial_strategy': 'median', 'n_nearest_features': 6, 'imputation_order': 'roman'}. Best is trial 40 with value: 0.23407864405802759.
running
[I 2024-09-30 17:21:35,246] Trial 168 finished with value: 0.23407864405802759 and parameters: {'model_name': 'IterativeImputer', 'estimator': 'Ridge', 'initial_strategy': 'median', 'n_nearest_features': 6, 'imputation_order': 'roman'}. Best is trial 40 with value: 0.23407864405802759.
running
[I 2024-09-30 17:21:59,321] Trial 170 finished with value: 0.23407864405802759 and parameters: {'model_name': 'IterativeImputer', 'estimator': 'Ridge', 'initial_strategy': 'median', 'n_nearest_features': 6, 'imputation_order': 'roman'}. Best is trial 40 with value: 0.23407864405802759.
running
[I 2024-09-30 17:22:02,899] Trial 171 finished with value: 0.23407864405802759 and parameters: {'model_name': 'IterativeImputer', 'estimator': 'Ridge', 'initial_strategy': 'median', 'n_nearest_features': 6, 'imputation_order': 'roman'}. Best is trial 40 with value: 0.23407864405802759.
running
[I 2024-09-30 17:22:26,603] Trial 172 finished with value: 0.23407864405802759 and parameters: {'model_name': 'IterativeImputer', 'estimator': 'Ridge', 'initial_strategy': 'median', 'n_nearest_features': 6, 'imputation_order': 'roman'}. Best is trial 40 with value: 0.23407864405802759.
running
[I 2024-09-30 17:22:31,899] Trial 173 finished with value: 0.23430135819366743 and parameters: {'model_name': 'IterativeImputer', 'estimator': 'Ridge', 'initial_strategy': 'constant', 'n_nearest_features': 6, 'imputation_order': 'descending'}. Best is trial 40 with value: 0.23407864405802759.
running
[I 2024-09-30 17:22:54,008] Trial 174 finished with value: 0.23430135819366743 and parameters: {'model_name': 'IterativeImputer', 'estimator': 'Ridge', 'initial_strategy': 'constant', 'n_nearest_features': 6, 'imputation_order': 'descending'}. Best is trial 40 with value: 0.23407864405802759.
running
[I 2024-09-30 17:23:03,500] Trial 175 finished with value: 0.23407864405802759 and parameters: {'model_name': 'IterativeImputer', 'estimator': 'Ridge', 'initial_strategy': 'median', 'n_nearest_features': 6, 'imputation_order': 'roman'}. Best is trial 40 with value: 0.23407864405802759.
running
[I 2024-09-30 17:23:21,029] Trial 176 finished with value: 0.23407864405802759 and parameters: {'model_name': 'IterativeImputer', 'estimator': 'Ridge', 'initial_strategy': 'median', 'n_nearest_features': 6, 'imputation_order': 'roman'}. Best is trial 40 with value: 0.23407864405802759.
running
[I 2024-09-30 17:23:31,123] Trial 177 finished with value: 0.23407864405802759 and parameters: {'model_name': 'IterativeImputer', 'estimator': 'Ridge', 'initial_strategy': 'median', 'n_nearest_features': 6, 'imputation_order': 'roman'}. Best is trial 40 with value: 0.23407864405802759.
running
[I 2024-09-30 17:23:45,802] Trial 178 finished with value: 0.23407864405802759 and parameters: {'model_name': 'IterativeImputer', 'estimator': 'Ridge', 'initial_strategy': 'median', 'n_nearest_features': 6, 'imputation_order': 'roman'}. Best is trial 40 with value: 0.23407864405802759.
running
[I 2024-09-30 17:23:58,769] Trial 179 finished with value: 0.23407864405802759 and parameters: {'model_name': 'IterativeImputer', 'estimator': 'Ridge', 'initial_strategy': 'median', 'n_nearest_features': 6, 'imputation_order': 'roman'}. Best is trial 40 with value: 0.23407864405802759.
running
[I 2024-09-30 17:24:12,177] Trial 180 finished with value: 0.2344287755513609 and parameters: {'model_name': 'IterativeImputer', 'estimator': 'Ridge', 'initial_strategy': 'median', 'n_nearest_features': 5, 'imputation_order': 'roman'}. Best is trial 40 with value: 0.23407864405802759.
running
[I 2024-09-30 17:24:25,821] Trial 181 finished with value: 0.2341848347338682 and parameters: {'model_name': 'IterativeImputer', 'estimator': 'Ridge', 'initial_strategy': 'mean', 'n_nearest_features': 5, 'imputation_order': 'roman'}. Best is trial 40 with value: 0.23407864405802759.
running
[I 2024-09-30 17:24:26,060] Trial 183 finished with value: 0.2730432611036446 and parameters: {'model_name': 'SimpleImputer', 'strategy': 'median'}. Best is trial 40 with value: 0.23407864405802759.
running
[I 2024-09-30 17:24:38,599] Trial 182 finished with value: 0.2545737352186103 and parameters: {'model_name': 'IterativeImputer', 'estimator': 'KNN', 'initial_strategy': 'most_frequent', 'n_nearest_features': 7, 'imputation_order': 'roman'}. Best is trial 40 with value: 0.23407864405802759.
running
[I 2024-09-30 17:24:40,447] Trial 184 finished with value: 0.2557919155123799 and parameters: {'model_name': 'IterativeImputer', 'estimator': 'KNN', 'initial_strategy': 'most_frequent', 'n_nearest_features': 6, 'imputation_order': 'roman'}. Best is trial 40 with value: 0.23407864405802759.
running
[I 2024-09-30 17:24:47,192] Trial 154 finished with value: 0.2570245646177434 and parameters: {'model_name': 'IterativeImputer', 'estimator': 'RFR', 'initial_strategy': 'median', 'n_nearest_features': 2, 'imputation_order': 'roman'}. Best is trial 40 with value: 0.23407864405802759.
running
[I 2024-09-30 17:25:06,077] Trial 186 finished with value: 0.23407864405802759 and parameters: {'model_name': 'IterativeImputer', 'estimator': 'Ridge', 'initial_strategy': 'median', 'n_nearest_features': 6, 'imputation_order': 'roman'}. Best is trial 40 with value: 0.23407864405802759.
running
[I 2024-09-30 17:25:13,778] Trial 187 finished with value: 0.23407864405802759 and parameters: {'model_name': 'IterativeImputer', 'estimator': 'Ridge', 'initial_strategy': 'median', 'n_nearest_features': 6, 'imputation_order': 'roman'}. Best is trial 40 with value: 0.23407864405802759.
running
[I 2024-09-30 17:25:33,997] Trial 188 finished with value: 0.23407864405802759 and parameters: {'model_name': 'IterativeImputer', 'estimator': 'Ridge', 'initial_strategy': 'median', 'n_nearest_features': 6, 'imputation_order': 'roman'}. Best is trial 40 with value: 0.23407864405802759.
running
[I 2024-09-30 17:25:39,866] Trial 189 finished with value: 0.23407864405802759 and parameters: {'model_name': 'IterativeImputer', 'estimator': 'Ridge', 'initial_strategy': 'median', 'n_nearest_features': 6, 'imputation_order': 'roman'}. Best is trial 40 with value: 0.23407864405802759.
running
[I 2024-09-30 17:26:01,425] Trial 190 finished with value: 0.23413664593159905 and parameters: {'model_name': 'IterativeImputer', 'estimator': 'Ridge', 'initial_strategy': 'median', 'n_nearest_features': 6, 'imputation_order': 'random'}. Best is trial 40 with value: 0.23407864405802759.
running
[I 2024-09-30 17:26:06,064] Trial 191 finished with value: 0.23407864405802759 and parameters: {'model_name': 'IterativeImputer', 'estimator': 'Ridge', 'initial_strategy': 'median', 'n_nearest_features': 6, 'imputation_order': 'roman'}. Best is trial 40 with value: 0.23407864405802759.
running
[I 2024-09-30 17:26:09,017] Trial 192 finished with value: inf and parameters: {'model_name': 'GAIN', 'batch_size': 8, 'hint_rate': 0.49096031894263065, 'alpha': 26, 'iterations': 135, 'learning_rate': 0.002834777136201892, 'p_miss': 0.039535934785214666}. Best is trial 40 with value: 0.23407864405802759.
running
[I 2024-09-30 17:26:13,724] Trial 193 finished with value: 0.2490665336492201 and parameters: {'model_name': 'KNNImputer', 'n_neighbors': 9935, 'weights': 'uniform'}. Best is trial 40 with value: 0.23407864405802759.
running
[I 2024-09-30 17:26:33,746] Trial 194 finished with value: 0.23407864405802759 and parameters: {'model_name': 'IterativeImputer', 'estimator': 'Ridge', 'initial_strategy': 'median', 'n_nearest_features': 6, 'imputation_order': 'roman'}. Best is trial 40 with value: 0.23407864405802759.
running
[I 2024-09-30 17:26:59,220] Trial 196 finished with value: 0.23407864405802759 and parameters: {'model_name': 'IterativeImputer', 'estimator': 'Ridge', 'initial_strategy': 'median', 'n_nearest_features': 6, 'imputation_order': 'roman'}. Best is trial 40 with value: 0.23407864405802759.
running
[I 2024-09-30 17:27:28,140] Trial 197 finished with value: 0.23407864405802759 and parameters: {'model_name': 'IterativeImputer', 'estimator': 'Ridge', 'initial_strategy': 'median', 'n_nearest_features': 6, 'imputation_order': 'roman'}. Best is trial 40 with value: 0.23407864405802759.
running
[I 2024-09-30 17:27:40,316] Trial 195 finished with value: 0.3284155337670843 and parameters: {'model_name': 'IterativeImputer', 'estimator': 'Bayesian', 'initial_strategy': 'median', 'n_nearest_features': 6, 'imputation_order': 'roman', 'sample_posterior': True}. Best is trial 40 with value: 0.23407864405802759.
running
[I 2024-09-30 17:28:06,094] Trial 199 finished with value: 0.23407864405802759 and parameters: {'model_name': 'IterativeImputer', 'estimator': 'Ridge', 'initial_strategy': 'median', 'n_nearest_features': 6, 'imputation_order': 'roman'}. Best is trial 40 with value: 0.23407864405802759.
[I 2024-09-30 17:28:47,455] Trial 198 finished with value: 0.3284155337670843 and parameters: {'model_name': 'IterativeImputer', 'estimator': 'Bayesian', 'initial_strategy': 'median', 'n_nearest_features': 6, 'imputation_order': 'roman', 'sample_posterior': True}. Best is trial 40 with value: 0.23407864405802759.
[I 2024-09-30 17:32:44,927] Trial 150 finished with value: 0.24309689314784966 and parameters: {'model_name': 'IterativeImputer', 'estimator': 'RFR', 'initial_strategy': 'median', 'n_nearest_features': 6, 'imputation_order': 'roman'}. Best is trial 40 with value: 0.23407864405802759.
[I 2024-09-30 17:34:09,755] Trial 37 finished with value: 0.2537161498911599 and parameters: {'model_name': 'VAE', 'batch_size': 436, 'iterations': 5053, 'learning_rate': 0.00011985305582494283, 'p_miss': 0.29571874130521536}. Best is trial 40 with value: 0.23407864405802759.
[I 2024-09-30 17:41:04,325] Trial 151 finished with value: 0.24333786293656817 and parameters: {'model_name': 'IterativeImputer', 'estimator': 'RFR', 'initial_strategy': 'median', 'n_nearest_features': 6, 'imputation_order': 'roman'}. Best is trial 40 with value: 0.23407864405802759.
[I 2024-09-30 17:42:13,004] Trial 152 finished with value: 0.2435484222493995 and parameters: {'model_name': 'IterativeImputer', 'estimator': 'RFR', 'initial_strategy': 'median', 'n_nearest_features': 6, 'imputation_order': 'roman'}. Best is trial 40 with value: 0.23407864405802759.
[I 2024-09-30 17:53:13,592] Trial 155 finished with value: 0.24430338603236718 and parameters: {'model_name': 'IterativeImputer', 'estimator': 'RFR', 'initial_strategy': 'median', 'n_nearest_features': 6, 'imputation_order': 'roman'}. Best is trial 40 with value: 0.23407864405802759.
[I 2024-09-30 18:03:27,121] Trial 185 finished with value: 0.24229239448368167 and parameters: {'model_name': 'IterativeImputer', 'estimator': 'RFR', 'initial_strategy': 'median', 'n_nearest_features': 6, 'imputation_order': 'roman'}. Best is trial 40 with value: 0.23407864405802759.
[I 2024-09-30 18:41:17,384] Trial 41 finished with value: 0.25296499912228226 and parameters: {'model_name': 'VAE', 'batch_size': 653, 'iterations': 6695, 'learning_rate': 0.0001373018722508429, 'p_miss': 0.2891502078035486}. Best is trial 40 with value: 0.23407864405802759.
[I 2024-09-30 19:16:00,723] Trial 36 finished with value: 0.2531592574648882 and parameters: {'model_name': 'VAE', 'batch_size': 612, 'iterations': 8740, 'learning_rate': 0.00010904407032861321, 'p_miss': 0.29447763750932077}. Best is trial 40 with value: 0.23407864405802759.
[I 2024-09-30 19:35:02,939] Trial 39 finished with value: 0.2530977830671378 and parameters: {'model_name': 'VAE', 'batch_size': 744, 'iterations': 8631, 'learning_rate': 0.0001418134159590534, 'p_miss': 0.28333031400631525}. Best is trial 40 with value: 0.23407864405802759.
[I 2024-09-30 19:40:59,068] Trial 42 finished with value: 0.2530453308141588 and parameters: {'model_name': 'VAE', 'batch_size': 982, 'iterations': 6772, 'learning_rate': 0.00012811486180790306, 'p_miss': 0.28719749693581437}. Best is trial 40 with value: 0.23407864405802759.
[I 2024-09-30 19:50:14,956] Trial 106 finished with value: 0.25293114378505666 and parameters: {'model_name': 'VAE', 'batch_size': 950, 'iterations': 6135, 'learning_rate': 0.010574079874841385, 'p_miss': 0.017553899163231856}. Best is trial 40 with value: 0.23407864405802759.
[I 2024-09-30 19:51:54,283] Trial 112 finished with value: 0.252994845624849 and parameters: {'model_name': 'VAE', 'batch_size': 922, 'iterations': 5234, 'learning_rate': 0.009261841999134721, 'p_miss': 0.29313211240276765}. Best is trial 40 with value: 0.23407864405802759.
[I 2024-09-30 19:58:57,197] Trial 38 finished with value: 0.2528670810066883 and parameters: {'model_name': 'VAE', 'batch_size': 950, 'iterations': 8025, 'learning_rate': 0.00011542811686255247, 'p_miss': 0.29304037557233376}. Best is trial 40 with value: 0.23407864405802759.
