[I 2024-09-21 06:27:57,893] Trial 69 finished with value: 0.07110593420457398 and parameters: {'model_name': 'IterativeImputer', 'estimator': 'RFR', 'initial_strategy': 'median', 'n_nearest_features': 19, 'imputation_order': 'arabic'}. Best is trial 52 with value: 0.07008405044821016.
running
[I 2024-09-21 06:38:02,711] Trial 72 finished with value: 0.0717348065997782 and parameters: {'model_name': 'IterativeImputer', 'estimator': 'RFR', 'initial_strategy': 'median', 'n_nearest_features': 19, 'imputation_order': 'arabic'}. Best is trial 52 with value: 0.07008405044821016.
running
[I 2024-09-21 06:39:24,989] Trial 74 finished with value: 0.07113689556979583 and parameters: {'model_name': 'IterativeImputer', 'estimator': 'RFR', 'initial_strategy': 'median', 'n_nearest_features': 19, 'imputation_order': 'arabic'}. Best is trial 52 with value: 0.07008405044821016.
running
[I 2024-09-21 06:39:25,640] Trial 93 finished with value: 0.12154076887083318 and parameters: {'model_name': 'SimpleImputer', 'strategy': 'most_frequent'}. Best is trial 52 with value: 0.07008405044821016.
running
[I 2024-09-21 06:39:52,609] Trial 92 finished with value: 0.07617821557210747 and parameters: {'model_name': 'IterativeImputer', 'estimator': 'Bayesian', 'initial_strategy': 'mean', 'n_nearest_features': 17, 'imputation_order': 'random', 'sample_posterior': False}. Best is trial 52 with value: 0.07008405044821016.
running
[I 2024-09-21 06:41:19,457] Trial 94 finished with value: 0.07622517102102563 and parameters: {'model_name': 'IterativeImputer', 'estimator': 'Bayesian', 'initial_strategy': 'constant', 'n_nearest_features': 17, 'imputation_order': 'random', 'sample_posterior': False}. Best is trial 52 with value: 0.07008405044821016.
running
[I 2024-09-21 06:47:28,824] Trial 75 finished with value: 0.071471735005347 and parameters: {'model_name': 'IterativeImputer', 'estimator': 'RFR', 'initial_strategy': 'median', 'n_nearest_features': 19, 'imputation_order': 'arabic'}. Best is trial 52 with value: 0.07008405044821016.
running
[I 2024-09-21 06:48:29,557] Trial 76 finished with value: 0.07076774723686229 and parameters: {'model_name': 'IterativeImputer', 'estimator': 'RFR', 'initial_strategy': 'median', 'n_nearest_features': 19, 'imputation_order': 'random'}. Best is trial 52 with value: 0.07008405044821016.
running
[I 2024-09-21 06:55:37,926] Trial 77 finished with value: 0.0716771885405104 and parameters: {'model_name': 'IterativeImputer', 'estimator': 'RFR', 'initial_strategy': 'median', 'n_nearest_features': 19, 'imputation_order': 'random'}. Best is trial 52 with value: 0.07008405044821016.
running
[I 2024-09-21 06:55:50,440] Trial 99 finished with value: 0.0841255480651564 and parameters: {'model_name': 'IterativeImputer', 'estimator': 'KNN', 'initial_strategy': 'mean', 'n_nearest_features': 3, 'imputation_order': 'random'}. Best is trial 52 with value: 0.07008405044821016.
running
[I 2024-09-21 06:59:07,825] Trial 78 finished with value: 0.0709437473358686 and parameters: {'model_name': 'IterativeImputer', 'estimator': 'RFR', 'initial_strategy': 'median', 'n_nearest_features': 19, 'imputation_order': 'arabic'}. Best is trial 52 with value: 0.07008405044821016.
running
[I 2024-09-21 07:01:37,434] Trial 79 finished with value: 0.07072590681580625 and parameters: {'model_name': 'IterativeImputer', 'estimator': 'RFR', 'initial_strategy': 'median', 'n_nearest_features': 19, 'imputation_order': 'arabic'}. Best is trial 52 with value: 0.07008405044821016.
running
[I 2024-09-21 07:01:43,830] Trial 102 finished with value: 0.13526716347650267 and parameters: {'model_name': 'GAIN', 'batch_size': 347, 'hint_rate': 0.8645130466753124, 'alpha': 1, 'iterations': 49, 'learning_rate': 0.00011084022867944615, 'p_miss': 0.2412207202180498}. Best is trial 52 with value: 0.07008405044821016.
running
[I 2024-09-21 07:08:22,670] Trial 95 finished with value: 0.07669033471475223 and parameters: {'model_name': 'IterativeImputer', 'estimator': 'RFR', 'initial_strategy': 'constant', 'n_nearest_features': 6, 'imputation_order': 'random'}. Best is trial 52 with value: 0.07008405044821016.
running
[I 2024-09-21 07:08:25,625] Trial 104 finished with value: 0.08212333893546227 and parameters: {'model_name': 'KNNImputer', 'n_neighbors': 2014, 'weights': 'uniform'}. Best is trial 52 with value: 0.07008405044821016.
running
[I 2024-09-21 07:09:11,874] Trial 80 finished with value: 0.0713770536815012 and parameters: {'model_name': 'IterativeImputer', 'estimator': 'RFR', 'initial_strategy': 'median', 'n_nearest_features': 19, 'imputation_order': 'arabic'}. Best is trial 52 with value: 0.07008405044821016.
running
[I 2024-09-21 07:14:45,097] Trial 97 finished with value: 0.07844911278937415 and parameters: {'model_name': 'IterativeImputer', 'estimator': 'RFR', 'initial_strategy': 'mean', 'n_nearest_features': 6, 'imputation_order': 'roman'}. Best is trial 52 with value: 0.07008405044821016.
running
[I 2024-09-21 07:20:25,082] Trial 98 finished with value: 0.07427863570805772 and parameters: {'model_name': 'IterativeImputer', 'estimator': 'RFR', 'initial_strategy': 'mean', 'n_nearest_features': 7, 'imputation_order': 'random'}. Best is trial 52 with value: 0.07008405044821016.
running
[I 2024-09-21 07:26:14,571] Trial 81 finished with value: 0.07167815547040395 and parameters: {'model_name': 'IterativeImputer', 'estimator': 'RFR', 'initial_strategy': 'median', 'n_nearest_features': 19, 'imputation_order': 'arabic'}. Best is trial 52 with value: 0.07008405044821016.
running
[I 2024-09-21 07:32:58,470] Trial 82 finished with value: 0.07128024564150057 and parameters: {'model_name': 'IterativeImputer', 'estimator': 'RFR', 'initial_strategy': 'mean', 'n_nearest_features': 19, 'imputation_order': 'random'}. Best is trial 52 with value: 0.07008405044821016.
running
[I 2024-09-21 07:39:38,921] Trial 83 finished with value: 0.07103964083441257 and parameters: {'model_name': 'IterativeImputer', 'estimator': 'RFR', 'initial_strategy': 'mean', 'n_nearest_features': 19, 'imputation_order': 'random'}. Best is trial 52 with value: 0.07008405044821016.
running
[I 2024-09-21 07:40:54,653] Trial 85 finished with value: 0.07150119997984224 and parameters: {'model_name': 'IterativeImputer', 'estimator': 'RFR', 'initial_strategy': 'mean', 'n_nearest_features': 19, 'imputation_order': 'random'}. Best is trial 52 with value: 0.07008405044821016.
running
[I 2024-09-21 07:41:18,731] Trial 90 finished with value: 0.07092275876815643 and parameters: {'model_name': 'IterativeImputer', 'estimator': 'RFR', 'initial_strategy': 'mean', 'n_nearest_features': 16, 'imputation_order': 'random'}. Best is trial 52 with value: 0.07008405044821016.
running
[I 2024-09-21 07:45:14,372] Trial 86 finished with value: 0.07079030592609034 and parameters: {'model_name': 'IterativeImputer', 'estimator': 'RFR', 'initial_strategy': 'mean', 'n_nearest_features': 19, 'imputation_order': 'random'}. Best is trial 52 with value: 0.07008405044821016.
running
[I 2024-09-21 07:45:26,863] Trial 114 finished with value: 0.07824416528204974 and parameters: {'model_name': 'IterativeImputer', 'estimator': 'KNN', 'initial_strategy': 'most_frequent', 'n_nearest_features': 20, 'imputation_order': 'descending'}. Best is trial 52 with value: 0.07008405044821016.
running
[I 2024-09-21 07:47:00,858] Trial 91 finished with value: 0.07184963452894257 and parameters: {'model_name': 'IterativeImputer', 'estimator': 'RFR', 'initial_strategy': 'mean', 'n_nearest_features': 17, 'imputation_order': 'random'}. Best is trial 52 with value: 0.07008405044821016.
running
[I 2024-09-21 07:47:37,123] Trial 87 finished with value: 0.07052954721029848 and parameters: {'model_name': 'IterativeImputer', 'estimator': 'RFR', 'initial_strategy': 'mean', 'n_nearest_features': 19, 'imputation_order': 'random'}. Best is trial 52 with value: 0.07008405044821016.
running
[I 2024-09-21 07:53:50,871] Trial 96 finished with value: 0.07140442673681095 and parameters: {'model_name': 'IterativeImputer', 'estimator': 'RFR', 'initial_strategy': 'mean', 'n_nearest_features': 16, 'imputation_order': 'random'}. Best is trial 52 with value: 0.07008405044821016.
running
[I 2024-09-21 08:23:55,189] Trial 100 finished with value: 0.07093382567449473 and parameters: {'model_name': 'IterativeImputer', 'estimator': 'RFR', 'initial_strategy': 'constant', 'n_nearest_features': 20, 'imputation_order': 'roman'}. Best is trial 52 with value: 0.07008405044821016.
running
[I 2024-09-21 08:27:04,763] Trial 101 finished with value: 0.07082659414206982 and parameters: {'model_name': 'IterativeImputer', 'estimator': 'RFR', 'initial_strategy': 'constant', 'n_nearest_features': 20, 'imputation_order': 'roman'}. Best is trial 52 with value: 0.07008405044821016.
running
[I 2024-09-21 08:29:45,531] Trial 103 finished with value: 0.07102286784753908 and parameters: {'model_name': 'IterativeImputer', 'estimator': 'RFR', 'initial_strategy': 'most_frequent', 'n_nearest_features': 20, 'imputation_order': 'roman'}. Best is trial 52 with value: 0.07008405044821016.
running
[I 2024-09-21 08:29:45,925] Trial 121 finished with value: 0.12154076887083318 and parameters: {'model_name': 'SimpleImputer', 'strategy': 'most_frequent'}. Best is trial 52 with value: 0.07008405044821016.
running
[I 2024-09-21 08:36:13,716] Trial 105 finished with value: 0.07111822247843866 and parameters: {'model_name': 'IterativeImputer', 'estimator': 'RFR', 'initial_strategy': 'most_frequent', 'n_nearest_features': 20, 'imputation_order': 'roman'}. Best is trial 52 with value: 0.07008405044821016.
running
[I 2024-09-21 08:37:49,502] Trial 106 finished with value: 0.07021233756077135 and parameters: {'model_name': 'IterativeImputer', 'estimator': 'RFR', 'initial_strategy': 'most_frequent', 'n_nearest_features': 20, 'imputation_order': 'roman'}. Best is trial 52 with value: 0.07008405044821016.
running
[I 2024-09-21 08:38:13,295] Trial 123 finished with value: 0.07614828372439825 and parameters: {'model_name': 'IterativeImputer', 'estimator': 'Bayesian', 'initial_strategy': 'mean', 'n_nearest_features': 18, 'imputation_order': 'descending', 'sample_posterior': False}. Best is trial 52 with value: 0.07008405044821016.
running
[I 2024-09-21 08:38:56,196] Trial 124 finished with value: 0.07622674680193256 and parameters: {'model_name': 'IterativeImputer', 'estimator': 'Bayesian', 'initial_strategy': 'most_frequent', 'n_nearest_features': 20, 'imputation_order': 'descending', 'sample_posterior': False}. Best is trial 52 with value: 0.07008405044821016.
running
[I 2024-09-21 08:44:03,657] Trial 107 finished with value: 0.07049844187403433 and parameters: {'model_name': 'IterativeImputer', 'estimator': 'RFR', 'initial_strategy': 'mean', 'n_nearest_features': 20, 'imputation_order': 'random'}. Best is trial 52 with value: 0.07008405044821016.
running
[I 2024-09-21 08:49:36,149] Trial 108 finished with value: 0.07057341113756053 and parameters: {'model_name': 'IterativeImputer', 'estimator': 'RFR', 'initial_strategy': 'most_frequent', 'n_nearest_features': 20, 'imputation_order': 'random'}. Best is trial 52 with value: 0.07008405044821016.
running
[I 2024-09-21 08:55:40,152] Trial 109 finished with value: 0.07078471326153854 and parameters: {'model_name': 'IterativeImputer', 'estimator': 'RFR', 'initial_strategy': 'most_frequent', 'n_nearest_features': 20, 'imputation_order': 'descending'}. Best is trial 52 with value: 0.07008405044821016.
running
[I 2024-09-21 09:02:04,068] Trial 110 finished with value: 0.07158407105827101 and parameters: {'model_name': 'IterativeImputer', 'estimator': 'RFR', 'initial_strategy': 'most_frequent', 'n_nearest_features': 20, 'imputation_order': 'descending'}. Best is trial 52 with value: 0.07008405044821016.
running
[I 2024-09-21 09:08:40,332] Trial 111 finished with value: 0.0709011657794929 and parameters: {'model_name': 'IterativeImputer', 'estimator': 'RFR', 'initial_strategy': 'most_frequent', 'n_nearest_features': 20, 'imputation_order': 'descending'}. Best is trial 52 with value: 0.07008405044821016.
running
[I 2024-09-21 09:10:00,826] Trial 112 finished with value: 0.0707726335204732 and parameters: {'model_name': 'IterativeImputer', 'estimator': 'RFR', 'initial_strategy': 'most_frequent', 'n_nearest_features': 20, 'imputation_order': 'descending'}. Best is trial 52 with value: 0.07008405044821016.
running
[I 2024-09-21 09:10:02,303] Trial 132 finished with value: inf and parameters: {'model_name': 'GAIN', 'batch_size': 3, 'hint_rate': 0.7125405981933246, 'alpha': 29, 'iterations': 206, 'learning_rate': 0.020569949438252716, 'p_miss': 0.06080870304444051}. Best is trial 52 with value: 0.07008405044821016.
running
[I 2024-09-21 09:10:12,757] Trial 113 finished with value: 0.07089519755519993 and parameters: {'model_name': 'IterativeImputer', 'estimator': 'RFR', 'initial_strategy': 'most_frequent', 'n_nearest_features': 20, 'imputation_order': 'descending'}. Best is trial 52 with value: 0.07008405044821016.
running
[I 2024-09-21 09:10:15,787] Trial 134 finished with value: 0.08125452415954208 and parameters: {'model_name': 'KNNImputer', 'n_neighbors': 6529, 'weights': 'distance'}. Best is trial 52 with value: 0.07008405044821016.
running
[I 2024-09-21 09:14:35,825] Trial 115 finished with value: 0.07166430031727303 and parameters: {'model_name': 'IterativeImputer', 'estimator': 'RFR', 'initial_strategy': 'constant', 'n_nearest_features': 20, 'imputation_order': 'roman'}. Best is trial 52 with value: 0.07008405044821016.
running
[I 2024-09-21 09:16:02,694] Trial 116 finished with value: 0.07057808774259743 and parameters: {'model_name': 'IterativeImputer', 'estimator': 'RFR', 'initial_strategy': 'most_frequent', 'n_nearest_features': 20, 'imputation_order': 'roman'}. Best is trial 52 with value: 0.07008405044821016.
running
[I 2024-09-21 09:16:41,401] Trial 117 finished with value: 0.07140001835383525 and parameters: {'model_name': 'IterativeImputer', 'estimator': 'RFR', 'initial_strategy': 'mean', 'n_nearest_features': 20, 'imputation_order': 'random'}. Best is trial 52 with value: 0.07008405044821016.
running
[I 2024-09-21 09:22:43,735] Trial 118 finished with value: 0.07030655437451576 and parameters: {'model_name': 'IterativeImputer', 'estimator': 'RFR', 'initial_strategy': 'most_frequent', 'n_nearest_features': 20, 'imputation_order': 'roman'}. Best is trial 52 with value: 0.07008405044821016.
running
[I 2024-09-21 09:52:51,735] Trial 119 finished with value: 0.07063879399886173 and parameters: {'model_name': 'IterativeImputer', 'estimator': 'RFR', 'initial_strategy': 'most_frequent', 'n_nearest_features': 20, 'imputation_order': 'descending'}. Best is trial 52 with value: 0.07008405044821016.
running
[I 2024-09-21 09:56:18,683] Trial 120 finished with value: 0.07090553456780294 and parameters: {'model_name': 'IterativeImputer', 'estimator': 'RFR', 'initial_strategy': 'mean', 'n_nearest_features': 20, 'imputation_order': 'descending'}. Best is trial 52 with value: 0.07008405044821016.
running
[I 2024-09-21 09:57:57,345] Trial 126 finished with value: 0.07088485572651648 and parameters: {'model_name': 'IterativeImputer', 'estimator': 'RFR', 'initial_strategy': 'most_frequent', 'n_nearest_features': 18, 'imputation_order': 'ascending'}. Best is trial 52 with value: 0.07008405044821016.
running
[I 2024-09-21 09:58:43,366] Trial 122 finished with value: 0.07101310890161515 and parameters: {'model_name': 'IterativeImputer', 'estimator': 'RFR', 'initial_strategy': 'mean', 'n_nearest_features': 20, 'imputation_order': 'descending'}. Best is trial 52 with value: 0.07008405044821016.
running
[I 2024-09-21 10:05:34,495] Trial 125 finished with value: 0.07095621001161424 and parameters: {'model_name': 'IterativeImputer', 'estimator': 'RFR', 'initial_strategy': 'most_frequent', 'n_nearest_features': 20, 'imputation_order': 'ascending'}. Best is trial 52 with value: 0.07008405044821016.
running
[I 2024-09-21 10:05:34,826] Trial 144 finished with value: 0.1210790281216935 and parameters: {'model_name': 'SimpleImputer', 'strategy': 'median'}. Best is trial 52 with value: 0.07008405044821016.
running
[I 2024-09-21 10:10:40,943] Trial 127 finished with value: 0.07089180424831196 and parameters: {'model_name': 'IterativeImputer', 'estimator': 'RFR', 'initial_strategy': 'most_frequent', 'n_nearest_features': 21, 'imputation_order': 'ascending'}. Best is trial 52 with value: 0.07008405044821016.
running
[I 2024-09-21 10:16:14,091] Trial 128 finished with value: 0.07106396183314416 and parameters: {'model_name': 'IterativeImputer', 'estimator': 'RFR', 'initial_strategy': 'most_frequent', 'n_nearest_features': 21, 'imputation_order': 'ascending'}. Best is trial 52 with value: 0.07008405044821016.
running
[I 2024-09-21 10:22:21,560] Trial 129 finished with value: 0.07062060310380665 and parameters: {'model_name': 'IterativeImputer', 'estimator': 'RFR', 'initial_strategy': 'most_frequent', 'n_nearest_features': 21, 'imputation_order': 'ascending'}. Best is trial 52 with value: 0.07008405044821016.
running
[I 2024-09-21 10:28:43,506] Trial 130 finished with value: 0.070481359911538 and parameters: {'model_name': 'IterativeImputer', 'estimator': 'RFR', 'initial_strategy': 'most_frequent', 'n_nearest_features': 21, 'imputation_order': 'ascending'}. Best is trial 52 with value: 0.07008405044821016.
running
[I 2024-09-21 10:35:19,758] Trial 131 finished with value: 0.07035738587051235 and parameters: {'model_name': 'IterativeImputer', 'estimator': 'RFR', 'initial_strategy': 'most_frequent', 'n_nearest_features': 21, 'imputation_order': 'ascending'}. Best is trial 52 with value: 0.07008405044821016.
running
[I 2024-09-21 10:36:45,018] Trial 133 finished with value: 0.07027558161590458 and parameters: {'model_name': 'IterativeImputer', 'estimator': 'RFR', 'initial_strategy': 'most_frequent', 'n_nearest_features': 21, 'imputation_order': 'ascending'}. Best is trial 52 with value: 0.07008405044821016.
running
[I 2024-09-21 10:36:53,046] Trial 135 finished with value: 0.07066236872892416 and parameters: {'model_name': 'IterativeImputer', 'estimator': 'RFR', 'initial_strategy': 'most_frequent', 'n_nearest_features': 21, 'imputation_order': 'ascending'}. Best is trial 52 with value: 0.07008405044821016.
running
[I 2024-09-21 10:41:09,846] Trial 136 finished with value: 0.0709834795883318 and parameters: {'model_name': 'IterativeImputer', 'estimator': 'RFR', 'initial_strategy': 'most_frequent', 'n_nearest_features': 21, 'imputation_order': 'ascending'}. Best is trial 52 with value: 0.07008405044821016.
running
[I 2024-09-21 10:41:22,287] Trial 153 finished with value: 0.07619662291446752 and parameters: {'model_name': 'IterativeImputer', 'estimator': 'Ridge', 'initial_strategy': 'most_frequent', 'n_nearest_features': 21, 'imputation_order': 'roman'}. Best is trial 52 with value: 0.07008405044821016.
running
[I 2024-09-21 10:42:52,018] Trial 137 finished with value: 0.07141151185117717 and parameters: {'model_name': 'IterativeImputer', 'estimator': 'RFR', 'initial_strategy': 'most_frequent', 'n_nearest_features': 21, 'imputation_order': 'ascending'}. Best is trial 52 with value: 0.07008405044821016.
running
[I 2024-09-21 10:43:21,266] Trial 138 finished with value: 0.07125454408058653 and parameters: {'model_name': 'IterativeImputer', 'estimator': 'RFR', 'initial_strategy': 'most_frequent', 'n_nearest_features': 21, 'imputation_order': 'ascending'}. Best is trial 52 with value: 0.07008405044821016.
running
[I 2024-09-21 10:49:25,763] Trial 139 finished with value: 0.07132014312639598 and parameters: {'model_name': 'IterativeImputer', 'estimator': 'RFR', 'initial_strategy': 'most_frequent', 'n_nearest_features': 21, 'imputation_order': 'roman'}. Best is trial 52 with value: 0.07008405044821016.
running
[I 2024-09-21 11:19:46,716] Trial 140 finished with value: 0.07112482976382402 and parameters: {'model_name': 'IterativeImputer', 'estimator': 'RFR', 'initial_strategy': 'most_frequent', 'n_nearest_features': 21, 'imputation_order': 'roman'}. Best is trial 52 with value: 0.07008405044821016.
running
[I 2024-09-21 11:23:24,218] Trial 141 finished with value: 0.0711218514775244 and parameters: {'model_name': 'IterativeImputer', 'estimator': 'RFR', 'initial_strategy': 'most_frequent', 'n_nearest_features': 21, 'imputation_order': 'ascending'}. Best is trial 52 with value: 0.07008405044821016.
running
[I 2024-09-21 11:24:35,277] Trial 142 finished with value: 0.07106693256805079 and parameters: {'model_name': 'IterativeImputer', 'estimator': 'RFR', 'initial_strategy': 'most_frequent', 'n_nearest_features': 21, 'imputation_order': 'roman'}. Best is trial 52 with value: 0.07008405044821016.
running
[I 2024-09-21 11:24:36,191] Trial 160 finished with value: 0.3070361625887032 and parameters: {'model_name': 'VAE', 'batch_size': 312, 'iterations': 1, 'learning_rate': 0.004524624045113168, 'p_miss': 0.1329798138569284}. Best is trial 52 with value: 0.07008405044821016.
running
[I 2024-09-21 11:25:26,052] Trial 143 finished with value: 0.07055750405166532 and parameters: {'model_name': 'IterativeImputer', 'estimator': 'RFR', 'initial_strategy': 'most_frequent', 'n_nearest_features': 21, 'imputation_order': 'roman'}. Best is trial 52 with value: 0.07008405044821016.
running
[I 2024-09-21 11:25:50,358] Trial 162 finished with value: 0.0774581358081908 and parameters: {'model_name': 'IterativeImputer', 'estimator': 'KNN', 'initial_strategy': 'most_frequent', 'n_nearest_features': 13, 'imputation_order': 'ascending'}. Best is trial 52 with value: 0.07008405044821016.
running
[I 2024-09-21 11:32:24,781] Trial 145 finished with value: 0.07070257937928348 and parameters: {'model_name': 'IterativeImputer', 'estimator': 'RFR', 'initial_strategy': 'most_frequent', 'n_nearest_features': 21, 'imputation_order': 'roman'}. Best is trial 52 with value: 0.07008405044821016.
running
