[I 2024-10-22 20:18:17,458] Trial 148 finished with value: 0.07305315324917179 and parameters: {'model_name': 'IterativeImputer', 'estimator': 'RFR', 'initial_strategy': 'constant', 'n_nearest_features': 5, 'imputation_order': 'random'}. Best is trial 135 with value: 0.07126462084779589.
running
[I 2024-10-22 20:18:43,475] Trial 149 finished with value: 0.07296787984888242 and parameters: {'model_name': 'IterativeImputer', 'estimator': 'RFR', 'initial_strategy': 'constant', 'n_nearest_features': 5, 'imputation_order': 'random'}. Best is trial 135 with value: 0.07126462084779589.
running
[I 2024-10-22 20:21:01,933] Trial 150 finished with value: 0.07416031455089547 and parameters: {'model_name': 'IterativeImputer', 'estimator': 'RFR', 'initial_strategy': 'constant', 'n_nearest_features': 5, 'imputation_order': 'random'}. Best is trial 135 with value: 0.07126462084779589.
running
[I 2024-10-22 20:21:58,183] Trial 151 finished with value: 0.07283997920228283 and parameters: {'model_name': 'IterativeImputer', 'estimator': 'RFR', 'initial_strategy': 'constant', 'n_nearest_features': 5, 'imputation_order': 'random'}. Best is trial 135 with value: 0.07126462084779589.
running
[I 2024-10-22 20:22:33,735] Trial 152 finished with value: 0.07499621824239655 and parameters: {'model_name': 'IterativeImputer', 'estimator': 'RFR', 'initial_strategy': 'constant', 'n_nearest_features': 5, 'imputation_order': 'random'}. Best is trial 135 with value: 0.07126462084779589.
running
[I 2024-10-22 20:25:20,236] Trial 156 finished with value: 0.07447186107093574 and parameters: {'model_name': 'IterativeImputer', 'estimator': 'RFR', 'initial_strategy': 'constant', 'n_nearest_features': 5, 'imputation_order': 'random'}. Best is trial 135 with value: 0.07126462084779589.
running
[I 2024-10-22 20:25:39,601] Trial 157 finished with value: 0.07329157429433154 and parameters: {'model_name': 'IterativeImputer', 'estimator': 'RFR', 'initial_strategy': 'constant', 'n_nearest_features': 5, 'imputation_order': 'random'}. Best is trial 135 with value: 0.07126462084779589.
running
[I 2024-10-22 20:26:06,592] Trial 158 finished with value: 0.07333270928736514 and parameters: {'model_name': 'IterativeImputer', 'estimator': 'RFR', 'initial_strategy': 'constant', 'n_nearest_features': 5, 'imputation_order': 'random'}. Best is trial 135 with value: 0.07126462084779589.
running
[I 2024-10-22 20:27:57,647] Trial 159 finished with value: 0.07228864948146012 and parameters: {'model_name': 'IterativeImputer', 'estimator': 'RFR', 'initial_strategy': 'constant', 'n_nearest_features': 5, 'imputation_order': 'random'}. Best is trial 135 with value: 0.07126462084779589.
running
[I 2024-10-22 20:29:18,836] Trial 160 finished with value: 0.07248125296721591 and parameters: {'model_name': 'IterativeImputer', 'estimator': 'RFR', 'initial_strategy': 'constant', 'n_nearest_features': 5, 'imputation_order': 'random'}. Best is trial 135 with value: 0.07126462084779589.
running
[I 2024-10-22 20:30:45,147] Trial 162 finished with value: 0.07417358092587421 and parameters: {'model_name': 'IterativeImputer', 'estimator': 'RFR', 'initial_strategy': 'constant', 'n_nearest_features': 5, 'imputation_order': 'random'}. Best is trial 135 with value: 0.07126462084779589.
running
[I 2024-10-22 20:31:33,319] Trial 164 finished with value: 0.07387446261695028 and parameters: {'model_name': 'IterativeImputer', 'estimator': 'RFR', 'initial_strategy': 'constant', 'n_nearest_features': 5, 'imputation_order': 'random'}. Best is trial 135 with value: 0.07126462084779589.
running
[I 2024-10-22 20:33:34,952] Trial 165 finished with value: 0.07412796005717234 and parameters: {'model_name': 'IterativeImputer', 'estimator': 'RFR', 'initial_strategy': 'constant', 'n_nearest_features': 5, 'imputation_order': 'random'}. Best is trial 135 with value: 0.07126462084779589.
running
[I 2024-10-22 20:36:00,750] Trial 166 finished with value: 0.07421596252177846 and parameters: {'model_name': 'IterativeImputer', 'estimator': 'RFR', 'initial_strategy': 'constant', 'n_nearest_features': 5, 'imputation_order': 'random'}. Best is trial 135 with value: 0.07126462084779589.
running
[I 2024-10-22 20:36:35,075] Trial 167 finished with value: 0.0738980172688353 and parameters: {'model_name': 'IterativeImputer', 'estimator': 'RFR', 'initial_strategy': 'constant', 'n_nearest_features': 5, 'imputation_order': 'random'}. Best is trial 135 with value: 0.07126462084779589.
running
[I 2024-10-22 20:36:48,890] Trial 168 finished with value: 0.07439181155239624 and parameters: {'model_name': 'IterativeImputer', 'estimator': 'RFR', 'initial_strategy': 'constant', 'n_nearest_features': 5, 'imputation_order': 'random'}. Best is trial 135 with value: 0.07126462084779589.
running
[I 2024-10-22 20:39:04,139] Trial 169 finished with value: 0.0754649840531919 and parameters: {'model_name': 'IterativeImputer', 'estimator': 'RFR', 'initial_strategy': 'constant', 'n_nearest_features': 5, 'imputation_order': 'random'}. Best is trial 135 with value: 0.07126462084779589.
running
[I 2024-10-22 20:39:27,377] Trial 183 finished with value: 0.13602940414479 and parameters: {'model_name': 'IterativeImputer', 'estimator': 'Ridge', 'initial_strategy': 'constant', 'n_nearest_features': 5, 'imputation_order': 'random'}. Best is trial 135 with value: 0.07126462084779589.
running
[I 2024-10-22 20:40:19,768] Trial 170 finished with value: 0.07419867584806052 and parameters: {'model_name': 'IterativeImputer', 'estimator': 'RFR', 'initial_strategy': 'constant', 'n_nearest_features': 5, 'imputation_order': 'random'}. Best is trial 135 with value: 0.07126462084779589.
running
[I 2024-10-22 20:41:00,204] Trial 171 finished with value: 0.07206744521230975 and parameters: {'model_name': 'IterativeImputer', 'estimator': 'RFR', 'initial_strategy': 'constant', 'n_nearest_features': 5, 'imputation_order': 'random'}. Best is trial 135 with value: 0.07126462084779589.
running
[I 2024-10-22 20:43:45,834] Trial 172 finished with value: 0.07276568486074722 and parameters: {'model_name': 'IterativeImputer', 'estimator': 'RFR', 'initial_strategy': 'constant', 'n_nearest_features': 5, 'imputation_order': 'random'}. Best is trial 135 with value: 0.07126462084779589.
running
[I 2024-10-22 20:44:00,193] Trial 173 finished with value: 0.07335115036976961 and parameters: {'model_name': 'IterativeImputer', 'estimator': 'RFR', 'initial_strategy': 'constant', 'n_nearest_features': 5, 'imputation_order': 'random'}. Best is trial 135 with value: 0.07126462084779589.
running
[I 2024-10-22 20:44:34,512] Trial 174 finished with value: 0.07314934176175335 and parameters: {'model_name': 'IterativeImputer', 'estimator': 'RFR', 'initial_strategy': 'constant', 'n_nearest_features': 5, 'imputation_order': 'random'}. Best is trial 135 with value: 0.07126462084779589.
running
[I 2024-10-22 20:46:35,515] Trial 175 finished with value: 0.07380628670034958 and parameters: {'model_name': 'IterativeImputer', 'estimator': 'RFR', 'initial_strategy': 'constant', 'n_nearest_features': 5, 'imputation_order': 'random'}. Best is trial 135 with value: 0.07126462084779589.
running
[I 2024-10-22 20:47:59,657] Trial 176 finished with value: 0.07442180934534558 and parameters: {'model_name': 'IterativeImputer', 'estimator': 'RFR', 'initial_strategy': 'constant', 'n_nearest_features': 5, 'imputation_order': 'random'}. Best is trial 135 with value: 0.07126462084779589.
running
[I 2024-10-22 20:48:17,375] Trial 191 finished with value: 0.0822291069352448 and parameters: {'model_name': 'IterativeImputer', 'estimator': 'KNN', 'initial_strategy': 'constant', 'n_nearest_features': 5, 'imputation_order': 'random'}. Best is trial 135 with value: 0.07126462084779589.
running
[I 2024-10-22 20:49:15,004] Trial 177 finished with value: 0.07445211900193902 and parameters: {'model_name': 'IterativeImputer', 'estimator': 'RFR', 'initial_strategy': 'constant', 'n_nearest_features': 5, 'imputation_order': 'random'}. Best is trial 135 with value: 0.07126462084779589.
running
[I 2024-10-22 20:49:21,891] Trial 193 finished with value: 0.13674206997031613 and parameters: {'model_name': 'KNNImputer', 'n_neighbors': 6917, 'weights': 'distance'}. Best is trial 135 with value: 0.07126462084779589.
running
[I 2024-10-22 20:49:58,944] Trial 178 finished with value: 0.07297868708777058 and parameters: {'model_name': 'IterativeImputer', 'estimator': 'RFR', 'initial_strategy': 'constant', 'n_nearest_features': 5, 'imputation_order': 'random'}. Best is trial 135 with value: 0.07126462084779589.
running
[I 2024-10-22 20:49:59,536] Trial 195 finished with value: 0.1674877303612149 and parameters: {'model_name': 'SimpleImputer', 'strategy': 'mean'}. Best is trial 135 with value: 0.07126462084779589.
running
[I 2024-10-22 20:50:35,937] Trial 180 finished with value: 0.10911887613289233 and parameters: {'model_name': 'IterativeImputer', 'estimator': 'RFR', 'initial_strategy': 'constant', 'n_nearest_features': 2, 'imputation_order': 'random'}. Best is trial 135 with value: 0.07126462084779589.
running
[I 2024-10-22 20:52:12,317] Trial 179 finished with value: 0.07201732095486371 and parameters: {'model_name': 'IterativeImputer', 'estimator': 'RFR', 'initial_strategy': 'constant', 'n_nearest_features': 5, 'imputation_order': 'random'}. Best is trial 135 with value: 0.07126462084779589.
running
[I 2024-10-22 20:53:48,621] Trial 184 finished with value: 0.10906107628523318 and parameters: {'model_name': 'IterativeImputer', 'estimator': 'RFR', 'initial_strategy': 'constant', 'n_nearest_features': 2, 'imputation_order': 'random'}. Best is trial 135 with value: 0.07126462084779589.
running
[I 2024-10-22 20:54:37,099] Trial 185 finished with value: 0.10853669577305373 and parameters: {'model_name': 'IterativeImputer', 'estimator': 'RFR', 'initial_strategy': 'constant', 'n_nearest_features': 2, 'imputation_order': 'random'}. Best is trial 135 with value: 0.07126462084779589.
[I 2024-10-22 20:55:08,980] Trial 182 finished with value: 0.07489551709521376 and parameters: {'model_name': 'IterativeImputer', 'estimator': 'RFR', 'initial_strategy': 'constant', 'n_nearest_features': 5, 'imputation_order': 'random'}. Best is trial 135 with value: 0.07126462084779589.
[I 2024-10-22 20:55:11,568] Trial 181 finished with value: 0.07497448922082896 and parameters: {'model_name': 'IterativeImputer', 'estimator': 'RFR', 'initial_strategy': 'constant', 'n_nearest_features': 5, 'imputation_order': 'random'}. Best is trial 135 with value: 0.07126462084779589.
[I 2024-10-22 20:58:38,773] Trial 186 finished with value: 0.07312770743609717 and parameters: {'model_name': 'IterativeImputer', 'estimator': 'RFR', 'initial_strategy': 'constant', 'n_nearest_features': 5, 'imputation_order': 'random'}. Best is trial 135 with value: 0.07126462084779589.
[I 2024-10-22 21:00:48,648] Trial 187 finished with value: 0.07249362922660056 and parameters: {'model_name': 'IterativeImputer', 'estimator': 'RFR', 'initial_strategy': 'constant', 'n_nearest_features': 5, 'imputation_order': 'random'}. Best is trial 135 with value: 0.07126462084779589.
[I 2024-10-22 21:01:16,778] Trial 188 finished with value: 0.07337782270276691 and parameters: {'model_name': 'IterativeImputer', 'estimator': 'RFR', 'initial_strategy': 'constant', 'n_nearest_features': 5, 'imputation_order': 'random'}. Best is trial 135 with value: 0.07126462084779589.
[I 2024-10-22 21:01:21,202] Trial 189 finished with value: 0.07261610498994915 and parameters: {'model_name': 'IterativeImputer', 'estimator': 'RFR', 'initial_strategy': 'constant', 'n_nearest_features': 5, 'imputation_order': 'random'}. Best is trial 135 with value: 0.07126462084779589.
[I 2024-10-22 21:02:36,359] Trial 190 finished with value: 0.07494720863082496 and parameters: {'model_name': 'IterativeImputer', 'estimator': 'RFR', 'initial_strategy': 'constant', 'n_nearest_features': 5, 'imputation_order': 'random'}. Best is trial 135 with value: 0.07126462084779589.
[I 2024-10-22 21:03:18,943] Trial 192 finished with value: 0.07167723210084236 and parameters: {'model_name': 'IterativeImputer', 'estimator': 'RFR', 'initial_strategy': 'constant', 'n_nearest_features': 5, 'imputation_order': 'ascending'}. Best is trial 135 with value: 0.07126462084779589.
[I 2024-10-22 21:03:47,688] Trial 194 finished with value: 0.07351276821877957 and parameters: {'model_name': 'IterativeImputer', 'estimator': 'RFR', 'initial_strategy': 'constant', 'n_nearest_features': 5, 'imputation_order': 'ascending'}. Best is trial 135 with value: 0.07126462084779589.
[I 2024-10-22 21:04:12,184] Trial 196 finished with value: 0.07522213518516488 and parameters: {'model_name': 'IterativeImputer', 'estimator': 'RFR', 'initial_strategy': 'constant', 'n_nearest_features': 5, 'imputation_order': 'random'}. Best is trial 135 with value: 0.07126462084779589.
[I 2024-10-22 21:04:27,521] Trial 197 finished with value: 0.07363456747633429 and parameters: {'model_name': 'IterativeImputer', 'estimator': 'RFR', 'initial_strategy': 'constant', 'n_nearest_features': 5, 'imputation_order': 'ascending'}. Best is trial 135 with value: 0.07126462084779589.
[I 2024-10-22 21:05:07,191] Trial 198 finished with value: 0.0722239073307636 and parameters: {'model_name': 'IterativeImputer', 'estimator': 'RFR', 'initial_strategy': 'constant', 'n_nearest_features': 5, 'imputation_order': 'ascending'}. Best is trial 135 with value: 0.07126462084779589.
[I 2024-10-22 21:05:47,727] Trial 199 finished with value: 0.07594031087798943 and parameters: {'model_name': 'IterativeImputer', 'estimator': 'RFR', 'initial_strategy': 'constant', 'n_nearest_features': 5, 'imputation_order': 'random'}. Best is trial 135 with value: 0.07126462084779589.
[I 2024-10-22 21:06:00,842] Trial 33 finished with value: 0.21633989902765216 and parameters: {'model_name': 'VAE', 'batch_size': 1, 'iterations': 7092, 'learning_rate': 0.00014697570665182615, 'p_miss': 0.28695370764318107}. Best is trial 135 with value: 0.07126462084779589.
