Run: 57
/cm/local/apps/slurm/var/spool/job1012365/slurm_script: line 26: 
pip install -e tpot2
pip install -r tpot2/ImputerExperiments/requirements_.txt
: No such file or directory
RunStart
Version 0.1.7a0 of tpot2 is outdated. Version 0.1.8a0 was released Tuesday September 17, 2024.
starting loops
../data/c/725/725.pkl
working on 
../data/c/725/class_full_MNAR_0.01_3
3.6549041271209717
running experiment 1/3 - Does large hyperparameter space improve reconstruction accuracy over simple
[I 2024-10-23 15:36:05,638] A new study created in memory with name: no-name-4ccc0ac7-155c-49a3-931c-ed125c9d7f5e
running
running
running
running
running
running
running
running
running
running
running
running
running
running
running
running
[I 2024-10-23 15:36:05,936] Trial 12 finished with value: 0.2583294229966542 and parameters: {'model_name': 'SimpleImputer', 'strategy': 'mean'}. Best is trial 12 with value: 0.2583294229966542.
running
[I 2024-10-23 15:36:06,232] Trial 16 finished with value: 0.2583294229966542 and parameters: {'model_name': 'SimpleImputer', 'strategy': 'mean'}. Best is trial 12 with value: 0.2583294229966542.
running
[I 2024-10-23 15:36:09,508] Trial 3 finished with value: 0.2583708677322961 and parameters: {'model_name': 'IterativeImputer', 'estimator': 'Ridge', 'initial_strategy': 'constant', 'n_nearest_features': 1, 'imputation_order': 'random'}. Best is trial 12 with value: 0.2583294229966542.
running
[I 2024-10-23 15:36:09,917] Trial 8 finished with value: 0.25834098399069116 and parameters: {'model_name': 'KNNImputer', 'n_neighbors': 3995, 'weights': 'uniform'}. Best is trial 12 with value: 0.2583294229966542.
running
[I 2024-10-23 15:36:12,212] Trial 4 finished with value: 0.25838450872892027 and parameters: {'model_name': 'IterativeImputer', 'estimator': 'Ridge', 'initial_strategy': 'mean', 'n_nearest_features': 4, 'imputation_order': 'arabic'}. Best is trial 12 with value: 0.2583294229966542.
running
[I 2024-10-23 15:36:12,531] Trial 2 finished with value: 0.25832735412355706 and parameters: {'model_name': 'IterativeImputer', 'estimator': 'Ridge', 'initial_strategy': 'most_frequent', 'n_nearest_features': 2, 'imputation_order': 'roman'}. Best is trial 2 with value: 0.25832735412355706.
running
[I 2024-10-23 15:36:12,728] Trial 1 finished with value: 0.33104092711142374 and parameters: {'model_name': 'VAE', 'batch_size': 19, 'iterations': 1, 'learning_rate': 0.010871618012222823, 'p_miss': 0.18908420081764254}. Best is trial 2 with value: 0.25832735412355706.
running
[I 2024-10-23 15:36:13,202] Trial 21 finished with value: 0.26683693680986503 and parameters: {'model_name': 'SimpleImputer', 'strategy': 'median'}. Best is trial 2 with value: 0.25832735412355706.
running
[I 2024-10-23 15:36:13,524] Trial 23 finished with value: 0.5186270748810315 and parameters: {'model_name': 'SimpleImputer', 'strategy': 'constant'}. Best is trial 2 with value: 0.25832735412355706.
running
[I 2024-10-23 15:36:15,754] Trial 11 finished with value: 0.33430677436015244 and parameters: {'model_name': 'VAE', 'batch_size': 1, 'iterations': 4, 'learning_rate': 0.003841212401650895, 'p_miss': 0.15570059663090866}. Best is trial 2 with value: 0.25832735412355706.
running
[I 2024-10-23 15:36:16,947] Trial 20 finished with value: 0.47408668089502176 and parameters: {'model_name': 'GAIN', 'batch_size': 128, 'hint_rate': 0.06283947273634789, 'alpha': 66, 'iterations': 7, 'learning_rate': 0.010330467001784036, 'p_miss': 0.2563357763592845}. Best is trial 2 with value: 0.25832735412355706.
running
[I 2024-10-23 15:36:17,525] Trial 14 finished with value: 0.2873076970825512 and parameters: {'model_name': 'IterativeImputer', 'estimator': 'KNN', 'initial_strategy': 'most_frequent', 'n_nearest_features': 1, 'imputation_order': 'ascending'}. Best is trial 2 with value: 0.25832735412355706.
running
[I 2024-10-23 15:36:18,596] Trial 17 finished with value: inf and parameters: {'model_name': 'GAIN', 'batch_size': 4, 'hint_rate': 0.47103271047833145, 'alpha': 7, 'iterations': 66, 'learning_rate': 0.03706638750022329, 'p_miss': 0.01573731258950623}. Best is trial 2 with value: 0.25832735412355706.
running
[I 2024-10-23 15:36:22,363] Trial 28 finished with value: 0.27022335113819895 and parameters: {'model_name': 'KNNImputer', 'n_neighbors': 16, 'weights': 'distance'}. Best is trial 2 with value: 0.25832735412355706.
running
[I 2024-10-23 15:36:22,796] Trial 29 finished with value: 0.2583294229966542 and parameters: {'model_name': 'SimpleImputer', 'strategy': 'mean'}. Best is trial 2 with value: 0.25832735412355706.
running
[I 2024-10-23 15:36:24,260] Trial 10 finished with value: 0.33263424535853564 and parameters: {'model_name': 'VAE', 'batch_size': 788, 'iterations': 2, 'learning_rate': 0.003119737974214414, 'p_miss': 0.17339989833967517}. Best is trial 2 with value: 0.25832735412355706.
running
[I 2024-10-23 15:36:26,841] Trial 18 finished with value: 0.2787559599014429 and parameters: {'model_name': 'IterativeImputer', 'estimator': 'KNN', 'initial_strategy': 'median', 'n_nearest_features': 3, 'imputation_order': 'ascending'}. Best is trial 2 with value: 0.25832735412355706.
running
[I 2024-10-23 15:36:29,786] Trial 24 finished with value: 0.28387098509123987 and parameters: {'model_name': 'IterativeImputer', 'estimator': 'KNN', 'initial_strategy': 'most_frequent', 'n_nearest_features': 2, 'imputation_order': 'arabic'}. Best is trial 2 with value: 0.25832735412355706.
running
[I 2024-10-23 15:36:30,330] Trial 33 finished with value: 0.517006838752084 and parameters: {'model_name': 'SimpleImputer', 'strategy': 'most_frequent'}. Best is trial 2 with value: 0.25832735412355706.
running
[I 2024-10-23 15:36:38,281] Trial 19 finished with value: 0.4900398843266792 and parameters: {'model_name': 'GAIN', 'batch_size': 20, 'hint_rate': 0.1682194448324977, 'alpha': 55, 'iterations': 58, 'learning_rate': 0.0009734115967253025, 'p_miss': 0.06595980744409803}. Best is trial 2 with value: 0.25832735412355706.
running
[I 2024-10-23 15:36:42,775] Trial 35 finished with value: 0.2583646346267404 and parameters: {'model_name': 'KNNImputer', 'n_neighbors': 6438, 'weights': 'distance'}. Best is trial 2 with value: 0.25832735412355706.
running
[I 2024-10-23 15:36:43,300] Trial 36 finished with value: 0.2583294229966542 and parameters: {'model_name': 'SimpleImputer', 'strategy': 'mean'}. Best is trial 2 with value: 0.25832735412355706.
running
[I 2024-10-23 15:36:43,845] Trial 37 finished with value: 0.2583294229966542 and parameters: {'model_name': 'SimpleImputer', 'strategy': 'mean'}. Best is trial 2 with value: 0.25832735412355706.
running
[I 2024-10-23 15:36:44,229] Trial 38 finished with value: 0.2583294229966542 and parameters: {'model_name': 'SimpleImputer', 'strategy': 'mean'}. Best is trial 2 with value: 0.25832735412355706.
running
[I 2024-10-23 15:36:44,429] Trial 31 finished with value: 0.25834485379953465 and parameters: {'model_name': 'IterativeImputer', 'estimator': 'Bayesian', 'initial_strategy': 'most_frequent', 'n_nearest_features': 8, 'imputation_order': 'roman', 'sample_posterior': False}. Best is trial 2 with value: 0.25832735412355706.
running
[I 2024-10-23 15:36:44,791] Trial 39 finished with value: 0.2583294229966542 and parameters: {'model_name': 'SimpleImputer', 'strategy': 'mean'}. Best is trial 2 with value: 0.25832735412355706.
running
[I 2024-10-23 15:36:45,012] Trial 40 finished with value: 0.2583294229966542 and parameters: {'model_name': 'SimpleImputer', 'strategy': 'mean'}. Best is trial 2 with value: 0.25832735412355706.
running
[I 2024-10-23 15:36:45,374] Trial 42 finished with value: 0.26683693680986503 and parameters: {'model_name': 'SimpleImputer', 'strategy': 'median'}. Best is trial 2 with value: 0.25832735412355706.
running
[I 2024-10-23 15:36:45,720] Trial 41 finished with value: 0.517006838752084 and parameters: {'model_name': 'SimpleImputer', 'strategy': 'most_frequent'}. Best is trial 2 with value: 0.25832735412355706.
running
[I 2024-10-23 15:36:52,873] Trial 9 finished with value: 0.2993384241133109 and parameters: {'model_name': 'VAE', 'batch_size': 2, 'iterations': 59, 'learning_rate': 0.0022075420321191687, 'p_miss': 0.22594629558818868}. Best is trial 2 with value: 0.25832735412355706.
running
[I 2024-10-23 15:36:57,779] Trial 15 finished with value: 0.37200721847225776 and parameters: {'model_name': 'IterativeImputer', 'estimator': 'Bayesian', 'initial_strategy': 'constant', 'n_nearest_features': 6, 'imputation_order': 'descending', 'sample_posterior': True}. Best is trial 2 with value: 0.25832735412355706.
running
[I 2024-10-23 15:36:58,163] Trial 13 finished with value: 0.37619452941107373 and parameters: {'model_name': 'IterativeImputer', 'estimator': 'Bayesian', 'initial_strategy': 'median', 'n_nearest_features': 7, 'imputation_order': 'descending', 'sample_posterior': True}. Best is trial 2 with value: 0.25832735412355706.
running
[I 2024-10-23 15:36:58,376] Trial 46 finished with value: 0.2583294229966542 and parameters: {'model_name': 'SimpleImputer', 'strategy': 'mean'}. Best is trial 2 with value: 0.25832735412355706.
running
[I 2024-10-23 15:36:58,712] Trial 47 finished with value: 0.2583294229966542 and parameters: {'model_name': 'SimpleImputer', 'strategy': 'mean'}. Best is trial 2 with value: 0.25832735412355706.
running
[I 2024-10-23 15:36:58,990] Trial 48 finished with value: 0.2583294229966542 and parameters: {'model_name': 'SimpleImputer', 'strategy': 'mean'}. Best is trial 2 with value: 0.25832735412355706.
running
[I 2024-10-23 15:36:59,188] Trial 49 finished with value: 0.5186270748810315 and parameters: {'model_name': 'SimpleImputer', 'strategy': 'constant'}. Best is trial 2 with value: 0.25832735412355706.
running
[I 2024-10-23 15:37:02,806] Trial 50 finished with value: 0.2587673113929728 and parameters: {'model_name': 'KNNImputer', 'n_neighbors': 348, 'weights': 'uniform'}. Best is trial 2 with value: 0.25832735412355706.
running
[I 2024-10-23 15:37:03,183] Trial 51 finished with value: 0.25875071512480763 and parameters: {'model_name': 'KNNImputer', 'n_neighbors': 473, 'weights': 'uniform'}. Best is trial 2 with value: 0.25832735412355706.
running
[I 2024-10-23 15:40:19,419] Trial 5 finished with value: 0.4912916063497825 and parameters: {'model_name': 'GAIN', 'batch_size': 973, 'hint_rate': 0.45589318772130727, 'alpha': 53, 'iterations': 194, 'learning_rate': 0.00038545620127762304, 'p_miss': 0.06050254337992675}. Best is trial 2 with value: 0.25832735412355706.
running
[I 2024-10-23 15:40:27,045] Trial 7 finished with value: 0.27224720517390616 and parameters: {'model_name': 'VAE', 'batch_size': 522, 'iterations': 68, 'learning_rate': 0.0016943346974653158, 'p_miss': 0.15100979567526593}. Best is trial 2 with value: 0.25832735412355706.
running
[I 2024-10-23 15:45:02,776] Trial 22 finished with value: 0.32328692620291666 and parameters: {'model_name': 'VAE', 'batch_size': 153, 'iterations': 172, 'learning_rate': 0.00013075995326874791, 'p_miss': 0.1935463465607504}. Best is trial 2 with value: 0.25832735412355706.
running
[I 2024-10-23 15:45:03,222] Trial 56 finished with value: 0.2583294229966542 and parameters: {'model_name': 'SimpleImputer', 'strategy': 'mean'}. Best is trial 2 with value: 0.25832735412355706.
running
[I 2024-10-23 15:45:03,601] Trial 57 finished with value: 0.2583294229966542 and parameters: {'model_name': 'SimpleImputer', 'strategy': 'mean'}. Best is trial 2 with value: 0.25832735412355706.
running
[I 2024-10-23 15:45:04,102] Trial 58 finished with value: 0.2583294229966542 and parameters: {'model_name': 'SimpleImputer', 'strategy': 'mean'}. Best is trial 2 with value: 0.25832735412355706.
running
[I 2024-10-23 15:54:39,216] Trial 6 finished with value: 0.49484588643395105 and parameters: {'model_name': 'GAIN', 'batch_size': 75, 'hint_rate': 0.09086964099769979, 'alpha': 81, 'iterations': 856, 'learning_rate': 0.001162024394851867, 'p_miss': 0.06386732707931286}. Best is trial 2 with value: 0.25832735412355706.
running
[I 2024-10-23 16:01:13,361] Trial 26 finished with value: 0.28472385508268216 and parameters: {'model_name': 'IterativeImputer', 'estimator': 'RFR', 'initial_strategy': 'most_frequent', 'n_nearest_features': 2, 'imputation_order': 'roman'}. Best is trial 2 with value: 0.25832735412355706.
running
[I 2024-10-23 16:01:13,771] Trial 61 finished with value: 0.2583294229966542 and parameters: {'model_name': 'SimpleImputer', 'strategy': 'mean'}. Best is trial 2 with value: 0.25832735412355706.
running
[I 2024-10-23 16:03:37,420] Trial 34 finished with value: inf and parameters: {'model_name': 'GAIN', 'batch_size': 58, 'hint_rate': 0.9593913512403087, 'alpha': 100, 'iterations': 6108, 'learning_rate': 0.00011369129211132408, 'p_miss': 0.019184480492428407}. Best is trial 2 with value: 0.25832735412355706.
running
[I 2024-10-23 16:15:47,860] Trial 43 finished with value: 0.2624098360386099 and parameters: {'model_name': 'IterativeImputer', 'estimator': 'RFR', 'initial_strategy': 'constant', 'n_nearest_features': 6, 'imputation_order': 'roman'}. Best is trial 2 with value: 0.25832735412355706.
running
[I 2024-10-23 16:16:12,923] Trial 45 finished with value: 0.2621123173946033 and parameters: {'model_name': 'IterativeImputer', 'estimator': 'RFR', 'initial_strategy': 'constant', 'n_nearest_features': 6, 'imputation_order': 'roman'}. Best is trial 2 with value: 0.25832735412355706.
running
[I 2024-10-23 16:18:58,633] Trial 59 finished with value: 0.2665879616427712 and parameters: {'model_name': 'IterativeImputer', 'estimator': 'RFR', 'initial_strategy': 'mean', 'n_nearest_features': 5, 'imputation_order': 'roman'}. Best is trial 2 with value: 0.25832735412355706.
running
[I 2024-10-23 16:18:59,147] Trial 66 finished with value: 0.2583294229966542 and parameters: {'model_name': 'SimpleImputer', 'strategy': 'mean'}. Best is trial 2 with value: 0.25832735412355706.
running
[I 2024-10-23 16:19:33,312] Trial 32 finished with value: 0.2616726577158272 and parameters: {'model_name': 'IterativeImputer', 'estimator': 'RFR', 'initial_strategy': 'most_frequent', 'n_nearest_features': 8, 'imputation_order': 'roman'}. Best is trial 2 with value: 0.25832735412355706.
running
[I 2024-10-23 16:19:54,742] Trial 30 finished with value: 0.2607230479365441 and parameters: {'model_name': 'IterativeImputer', 'estimator': 'RFR', 'initial_strategy': 'most_frequent', 'n_nearest_features': 7, 'imputation_order': 'roman'}. Best is trial 2 with value: 0.25832735412355706.
running
[I 2024-10-23 16:25:56,824] Trial 60 finished with value: 0.26622844212354935 and parameters: {'model_name': 'IterativeImputer', 'estimator': 'RFR', 'initial_strategy': 'mean', 'n_nearest_features': 4, 'imputation_order': 'roman'}. Best is trial 2 with value: 0.25832735412355706.
running
[I 2024-10-23 17:14:57,738] Trial 44 finished with value: 0.2623539708860488 and parameters: {'model_name': 'VAE', 'batch_size': 786, 'iterations': 1284, 'learning_rate': 0.00015103064622590444, 'p_miss': 0.2884445391492977}. Best is trial 2 with value: 0.25832735412355706.
running
[I 2024-10-23 17:14:58,126] Trial 71 finished with value: 0.2583294229966542 and parameters: {'model_name': 'SimpleImputer', 'strategy': 'mean'}. Best is trial 2 with value: 0.25832735412355706.
running
[I 2024-10-23 17:14:58,639] Trial 72 finished with value: 0.2583294229966542 and parameters: {'model_name': 'SimpleImputer', 'strategy': 'mean'}. Best is trial 2 with value: 0.25832735412355706.
running
[I 2024-10-23 17:14:59,184] Trial 73 finished with value: 0.2583294229966542 and parameters: {'model_name': 'SimpleImputer', 'strategy': 'mean'}. Best is trial 2 with value: 0.25832735412355706.
running
[I 2024-10-23 19:44:41,690] Trial 67 finished with value: 0.27031750999424903 and parameters: {'model_name': 'VAE', 'batch_size': 6, 'iterations': 4099, 'learning_rate': 0.08808583307526345, 'p_miss': 0.2926616159295368}. Best is trial 2 with value: 0.25832735412355706.
running
[I 2024-10-23 19:45:05,502] Trial 75 finished with value: 0.4823892990671073 and parameters: {'model_name': 'GAIN', 'batch_size': 7, 'hint_rate': 0.9734348569884703, 'alpha': 12, 'iterations': 11, 'learning_rate': 0.01449004381278752, 'p_miss': 0.11876783224317672}. Best is trial 2 with value: 0.25832735412355706.
running
[I 2024-10-23 19:45:06,054] Trial 76 finished with value: 0.2583294229966542 and parameters: {'model_name': 'SimpleImputer', 'strategy': 'mean'}. Best is trial 2 with value: 0.25832735412355706.
running
[I 2024-10-23 19:45:06,517] Trial 77 finished with value: 0.2583294229966542 and parameters: {'model_name': 'SimpleImputer', 'strategy': 'mean'}. Best is trial 2 with value: 0.25832735412355706.
running
[I 2024-10-23 19:45:06,943] Trial 78 finished with value: 0.2583294229966542 and parameters: {'model_name': 'SimpleImputer', 'strategy': 'mean'}. Best is trial 2 with value: 0.25832735412355706.
running
[I 2024-10-23 19:45:07,379] Trial 79 finished with value: 0.2583294229966542 and parameters: {'model_name': 'SimpleImputer', 'strategy': 'mean'}. Best is trial 2 with value: 0.25832735412355706.
running
[I 2024-10-23 19:45:07,871] Trial 80 finished with value: 0.2583294229966542 and parameters: {'model_name': 'SimpleImputer', 'strategy': 'mean'}. Best is trial 2 with value: 0.25832735412355706.
running
[I 2024-10-23 19:45:08,520] Trial 81 finished with value: 0.26683693680986503 and parameters: {'model_name': 'SimpleImputer', 'strategy': 'median'}. Best is trial 2 with value: 0.25832735412355706.
running
[I 2024-10-23 19:45:09,334] Trial 82 finished with value: 0.517006838752084 and parameters: {'model_name': 'SimpleImputer', 'strategy': 'most_frequent'}. Best is trial 2 with value: 0.25832735412355706.
running
[I 2024-10-23 19:45:09,778] Trial 83 finished with value: 0.5186270748810315 and parameters: {'model_name': 'SimpleImputer', 'strategy': 'constant'}. Best is trial 2 with value: 0.25832735412355706.
running
[I 2024-10-23 19:45:16,619] Trial 84 finished with value: inf and parameters: {'model_name': 'GAIN', 'batch_size': 1, 'hint_rate': 0.718492993197701, 'alpha': 26, 'iterations': 18, 'learning_rate': 0.00032544013472498884, 'p_miss': 0.11196292099358227}. Best is trial 2 with value: 0.25832735412355706.
running
[I 2024-10-23 19:49:04,101] Trial 70 finished with value: 0.27981236933749704 and parameters: {'model_name': 'VAE', 'batch_size': 4, 'iterations': 3690, 'learning_rate': 0.065464569595161, 'p_miss': 0.289199687753919}. Best is trial 2 with value: 0.25832735412355706.
running
[I 2024-10-23 19:49:04,563] Trial 86 finished with value: 0.2583294229966542 and parameters: {'model_name': 'SimpleImputer', 'strategy': 'mean'}. Best is trial 2 with value: 0.25832735412355706.
running
[I 2024-10-23 19:49:04,951] Trial 87 finished with value: 0.2583294229966542 and parameters: {'model_name': 'SimpleImputer', 'strategy': 'mean'}. Best is trial 2 with value: 0.25832735412355706.
running
[I 2024-10-23 19:49:05,299] Trial 88 finished with value: 0.2583294229966542 and parameters: {'model_name': 'SimpleImputer', 'strategy': 'mean'}. Best is trial 2 with value: 0.25832735412355706.
running
[I 2024-10-23 19:49:05,694] Trial 89 finished with value: 0.2583294229966542 and parameters: {'model_name': 'SimpleImputer', 'strategy': 'mean'}. Best is trial 2 with value: 0.25832735412355706.
running
[I 2024-10-23 19:49:06,154] Trial 90 finished with value: 0.26683693680986503 and parameters: {'model_name': 'SimpleImputer', 'strategy': 'median'}. Best is trial 2 with value: 0.25832735412355706.
running
[I 2024-10-23 19:49:12,626] Trial 91 finished with value: 0.2584267631650025 and parameters: {'model_name': 'KNNImputer', 'n_neighbors': 3149, 'weights': 'distance'}. Best is trial 2 with value: 0.25832735412355706.
running
[I 2024-10-23 19:49:13,141] Trial 92 finished with value: 0.2583294229966542 and parameters: {'model_name': 'SimpleImputer', 'strategy': 'mean'}. Best is trial 2 with value: 0.25832735412355706.
running
[I 2024-10-23 19:49:14,029] Trial 93 finished with value: 0.517006838752084 and parameters: {'model_name': 'SimpleImputer', 'strategy': 'most_frequent'}. Best is trial 2 with value: 0.25832735412355706.
running
[I 2024-10-23 19:49:29,998] Trial 94 finished with value: 0.25835422873520686 and parameters: {'model_name': 'IterativeImputer', 'estimator': 'Ridge', 'initial_strategy': 'median', 'n_nearest_features': 3, 'imputation_order': 'random'}. Best is trial 2 with value: 0.25832735412355706.
running
[I 2024-10-23 19:49:30,346] Trial 95 finished with value: 0.5186270748810315 and parameters: {'model_name': 'SimpleImputer', 'strategy': 'constant'}. Best is trial 2 with value: 0.25832735412355706.
running
[I 2024-10-23 19:49:31,097] Trial 96 finished with value: 0.2583294229966542 and parameters: {'model_name': 'SimpleImputer', 'strategy': 'mean'}. Best is trial 2 with value: 0.25832735412355706.
running
[I 2024-10-23 19:49:31,608] Trial 97 finished with value: 0.2583294229966542 and parameters: {'model_name': 'SimpleImputer', 'strategy': 'mean'}. Best is trial 2 with value: 0.25832735412355706.
running
[I 2024-10-23 19:49:32,011] Trial 98 finished with value: 0.2583294229966542 and parameters: {'model_name': 'SimpleImputer', 'strategy': 'mean'}. Best is trial 2 with value: 0.25832735412355706.
running
[I 2024-10-23 19:49:32,459] Trial 99 finished with value: 0.2583294229966542 and parameters: {'model_name': 'SimpleImputer', 'strategy': 'mean'}. Best is trial 2 with value: 0.25832735412355706.
running
[I 2024-10-23 19:49:32,864] Trial 100 finished with value: 0.2583294229966542 and parameters: {'model_name': 'SimpleImputer', 'strategy': 'mean'}. Best is trial 2 with value: 0.25832735412355706.
running
