[I 2024-10-23 22:18:47,114] Trial 44 finished with value: 0.31958356727229914 and parameters: {'model_name': 'VAE', 'batch_size': 913, 'iterations': 9763, 'learning_rate': 0.00013251716803765767, 'p_miss': 0.2942442768046126}. Best is trial 33 with value: 0.30327185042844984.
running
slurmstepd: error: Detected 1 oom-kill event(s) in StepId=1012830.0. Some of your processes may have been killed by the cgroup out-of-memory handler.
srun: error: esplhpc-cp009: task 0: Out Of Memory
slurmstepd: error: Detected 1 oom-kill event(s) in StepId=1012830.batch. Some of your processes may have been killed by the cgroup out-of-memory handler.
