Run: 10
/cm/local/apps/slurm/var/spool/job989744/slurm_script: line 26: 
pip install -e tpot2
pip install -r tpot2/ImputerExperiments/requirements_.txt
: No such file or directory
RunStart
Version 0.1.7a0 of tpot2 is outdated. Version 0.1.8a0 was released Tuesday September 17, 2024.
starting loops
../data/r/42225/42225.pkl
working on 
../data/r/42225/reg_full_MNAR_0.1_1
0.18202471733093262
running experiment 1/3 - Does large hyperparameter space improve reconstruction accuracy over simple
[I 2024-10-06 02:48:55,947] A new study created in memory with name: no-name-a93089ac-822c-4faf-8eb9-e79434479036
running
running
running
running
running
running
running
running
running
running
running
running
running
running
running
running
[I 2024-10-06 02:48:56,618] Trial 12 finished with value: 0.34997350584020426 and parameters: {'model_name': 'SimpleImputer', 'strategy': 'most_frequent'}. Best is trial 12 with value: 0.34997350584020426.
running
[I 2024-10-06 02:48:56,777] Trial 4 finished with value: 0.34997350584020426 and parameters: {'model_name': 'SimpleImputer', 'strategy': 'most_frequent'}. Best is trial 12 with value: 0.34997350584020426.
running
[I 2024-10-06 02:49:03,275] Trial 8 finished with value: inf and parameters: {'model_name': 'GAIN', 'batch_size': 1, 'hint_rate': 0.18007639891919489, 'alpha': 66, 'iterations': 2, 'learning_rate': 0.00010083017917582832, 'p_miss': 0.09249388860300625}. Best is trial 12 with value: 0.34997350584020426.
running
[I 2024-10-06 02:49:05,605] Trial 6 finished with value: 0.2740774306187591 and parameters: {'model_name': 'VAE', 'batch_size': 1, 'iterations': 1, 'learning_rate': 0.007175783111932249, 'p_miss': 0.07485814742506637}. Best is trial 6 with value: 0.2740774306187591.
running
[I 2024-10-06 02:49:09,291] Trial 7 finished with value: 0.42526562650713656 and parameters: {'model_name': 'GAIN', 'batch_size': 23, 'hint_rate': 0.12737983775264755, 'alpha': 43, 'iterations': 6, 'learning_rate': 0.00019415648919831065, 'p_miss': 0.13396126530255442}. Best is trial 6 with value: 0.2740774306187591.
running
[I 2024-10-06 02:49:11,054] Trial 16 finished with value: 0.4175756335112918 and parameters: {'model_name': 'GAIN', 'batch_size': 2, 'hint_rate': 0.11733566978530337, 'alpha': 87, 'iterations': 9, 'learning_rate': 0.00025999454106545014, 'p_miss': 0.2959968232113646}. Best is trial 6 with value: 0.2740774306187591.
running
[I 2024-10-06 02:49:12,029] Trial 21 finished with value: 0.17566643497536935 and parameters: {'model_name': 'SimpleImputer', 'strategy': 'mean'}. Best is trial 21 with value: 0.17566643497536935.
running
[I 2024-10-06 02:49:15,403] Trial 0 finished with value: 0.18897877456050147 and parameters: {'model_name': 'VAE', 'batch_size': 130, 'iterations': 3, 'learning_rate': 0.05179778612131098, 'p_miss': 0.15079548659117603}. Best is trial 21 with value: 0.17566643497536935.
running
[I 2024-10-06 02:49:16,634] Trial 23 finished with value: 0.18839171218210532 and parameters: {'model_name': 'SimpleImputer', 'strategy': 'median'}. Best is trial 21 with value: 0.17566643497536935.
running
[I 2024-10-06 02:49:17,148] Trial 24 finished with value: 0.4399569303515613 and parameters: {'model_name': 'SimpleImputer', 'strategy': 'constant'}. Best is trial 21 with value: 0.17566643497536935.
running
[I 2024-10-06 02:49:50,762] Trial 2 finished with value: inf and parameters: {'model_name': 'GAIN', 'batch_size': 1, 'hint_rate': 0.25839115874981333, 'alpha': 5, 'iterations': 350, 'learning_rate': 0.029944412123698923, 'p_miss': 0.18595567693555884}. Best is trial 21 with value: 0.17566643497536935.
running
[I 2024-10-06 02:50:13,303] Trial 11 finished with value: 0.17450396701295676 and parameters: {'model_name': 'KNNImputer', 'n_neighbors': 27602, 'weights': 'uniform'}. Best is trial 11 with value: 0.17450396701295676.
running
[I 2024-10-06 02:50:16,974] Trial 1 finished with value: 0.16092911022012898 and parameters: {'model_name': 'IterativeImputer', 'estimator': 'KNN', 'initial_strategy': 'median', 'n_nearest_features': 3, 'imputation_order': 'arabic'}. Best is trial 1 with value: 0.16092911022012898.
running
[I 2024-10-06 02:50:20,149] Trial 5 finished with value: 0.18327532836785254 and parameters: {'model_name': 'VAE', 'batch_size': 47, 'iterations': 60, 'learning_rate': 0.0037000293164333674, 'p_miss': 0.19685841785391592}. Best is trial 1 with value: 0.16092911022012898.
running
[I 2024-10-06 02:50:29,203] Trial 15 finished with value: 0.1616418184229779 and parameters: {'model_name': 'IterativeImputer', 'estimator': 'Bayesian', 'initial_strategy': 'constant', 'n_nearest_features': 3, 'imputation_order': 'random', 'sample_posterior': False}. Best is trial 1 with value: 0.16092911022012898.
running
[I 2024-10-06 02:50:32,079] Trial 22 finished with value: 0.17396125474950244 and parameters: {'model_name': 'KNNImputer', 'n_neighbors': 24538, 'weights': 'uniform'}. Best is trial 1 with value: 0.16092911022012898.
running
[I 2024-10-06 02:50:37,109] Trial 19 finished with value: 0.16974993164151223 and parameters: {'model_name': 'KNNImputer', 'n_neighbors': 16571, 'weights': 'distance'}. Best is trial 1 with value: 0.16092911022012898.
running
[I 2024-10-06 02:50:44,433] Trial 20 finished with value: 0.17013726794438444 and parameters: {'model_name': 'KNNImputer', 'n_neighbors': 18011, 'weights': 'distance'}. Best is trial 1 with value: 0.16092911022012898.
running
[I 2024-10-06 02:50:47,622] Trial 18 finished with value: 0.1777732335522068 and parameters: {'model_name': 'IterativeImputer', 'estimator': 'KNN', 'initial_strategy': 'mean', 'n_nearest_features': 1, 'imputation_order': 'ascending'}. Best is trial 1 with value: 0.16092911022012898.
running
[I 2024-10-06 02:50:52,952] Trial 25 finished with value: 0.16391722105423195 and parameters: {'model_name': 'IterativeImputer', 'estimator': 'KNN', 'initial_strategy': 'median', 'n_nearest_features': 3, 'imputation_order': 'ascending'}. Best is trial 1 with value: 0.16092911022012898.
running
[I 2024-10-06 02:51:07,138] Trial 17 finished with value: 0.155081993050656 and parameters: {'model_name': 'IterativeImputer', 'estimator': 'Bayesian', 'initial_strategy': 'median', 'n_nearest_features': 9, 'imputation_order': 'descending', 'sample_posterior': False}. Best is trial 17 with value: 0.155081993050656.
running
[I 2024-10-06 02:51:32,479] Trial 27 finished with value: 0.1748991632274821 and parameters: {'model_name': 'KNNImputer', 'n_neighbors': 29663, 'weights': 'uniform'}. Best is trial 17 with value: 0.155081993050656.
running
[I 2024-10-06 02:51:35,140] Trial 28 finished with value: 0.1747354453347208 and parameters: {'model_name': 'KNNImputer', 'n_neighbors': 28817, 'weights': 'uniform'}. Best is trial 17 with value: 0.155081993050656.
running
[I 2024-10-06 02:51:48,491] Trial 14 finished with value: 0.42469128384380833 and parameters: {'model_name': 'GAIN', 'batch_size': 8, 'hint_rate': 0.6651682003892673, 'alpha': 43, 'iterations': 212, 'learning_rate': 0.00010595247274485851, 'p_miss': 0.15837366342777232}. Best is trial 17 with value: 0.155081993050656.
running
[I 2024-10-06 02:51:58,070] Trial 29 finished with value: 0.16092911022012898 and parameters: {'model_name': 'IterativeImputer', 'estimator': 'KNN', 'initial_strategy': 'median', 'n_nearest_features': 3, 'imputation_order': 'arabic'}. Best is trial 17 with value: 0.155081993050656.
running
[I 2024-10-06 02:52:05,084] Trial 30 finished with value: 0.1651372174576058 and parameters: {'model_name': 'IterativeImputer', 'estimator': 'KNN', 'initial_strategy': 'constant', 'n_nearest_features': 3, 'imputation_order': 'arabic'}. Best is trial 17 with value: 0.155081993050656.
running
[I 2024-10-06 02:52:10,252] Trial 9 finished with value: 0.4206870039258462 and parameters: {'model_name': 'GAIN', 'batch_size': 8, 'hint_rate': 0.04248805581138319, 'alpha': 41, 'iterations': 245, 'learning_rate': 0.002031503622563139, 'p_miss': 0.17231132266670518}. Best is trial 17 with value: 0.155081993050656.
running
[I 2024-10-06 02:52:12,587] Trial 31 finished with value: 0.1616418184229779 and parameters: {'model_name': 'IterativeImputer', 'estimator': 'Bayesian', 'initial_strategy': 'constant', 'n_nearest_features': 3, 'imputation_order': 'random', 'sample_posterior': False}. Best is trial 17 with value: 0.155081993050656.
running
[I 2024-10-06 02:52:14,423] Trial 32 finished with value: 0.16299516975068645 and parameters: {'model_name': 'IterativeImputer', 'estimator': 'KNN', 'initial_strategy': 'median', 'n_nearest_features': 3, 'imputation_order': 'random'}. Best is trial 17 with value: 0.155081993050656.
running
[I 2024-10-06 02:52:20,924] Trial 33 finished with value: 0.1604072026824544 and parameters: {'model_name': 'IterativeImputer', 'estimator': 'Bayesian', 'initial_strategy': 'median', 'n_nearest_features': 3, 'imputation_order': 'random', 'sample_posterior': False}. Best is trial 17 with value: 0.155081993050656.
running
[I 2024-10-06 02:52:26,011] Trial 34 finished with value: 0.15890983872199743 and parameters: {'model_name': 'IterativeImputer', 'estimator': 'Bayesian', 'initial_strategy': 'median', 'n_nearest_features': 4, 'imputation_order': 'random', 'sample_posterior': False}. Best is trial 17 with value: 0.155081993050656.
running
[I 2024-10-06 02:52:51,388] Trial 35 finished with value: 0.15583587229662973 and parameters: {'model_name': 'IterativeImputer', 'estimator': 'Bayesian', 'initial_strategy': 'constant', 'n_nearest_features': 6, 'imputation_order': 'arabic', 'sample_posterior': False}. Best is trial 17 with value: 0.155081993050656.
running
[I 2024-10-06 02:52:59,928] Trial 43 finished with value: 0.15508772175410862 and parameters: {'model_name': 'IterativeImputer', 'estimator': 'Ridge', 'initial_strategy': 'median', 'n_nearest_features': 9, 'imputation_order': 'descending'}. Best is trial 17 with value: 0.155081993050656.
running
[I 2024-10-06 02:53:08,050] Trial 36 finished with value: 0.1550872357466709 and parameters: {'model_name': 'IterativeImputer', 'estimator': 'Bayesian', 'initial_strategy': 'constant', 'n_nearest_features': 9, 'imputation_order': 'random', 'sample_posterior': False}. Best is trial 17 with value: 0.155081993050656.
running
[I 2024-10-06 02:53:12,577] Trial 45 finished with value: 0.15508784415218912 and parameters: {'model_name': 'IterativeImputer', 'estimator': 'Ridge', 'initial_strategy': 'most_frequent', 'n_nearest_features': 9, 'imputation_order': 'descending'}. Best is trial 17 with value: 0.155081993050656.
running
[I 2024-10-06 02:53:30,021] Trial 37 finished with value: 0.15508218927542008 and parameters: {'model_name': 'IterativeImputer', 'estimator': 'Bayesian', 'initial_strategy': 'constant', 'n_nearest_features': 9, 'imputation_order': 'arabic', 'sample_posterior': False}. Best is trial 17 with value: 0.155081993050656.
running
[I 2024-10-06 02:53:32,542] Trial 38 finished with value: 0.1550872357466709 and parameters: {'model_name': 'IterativeImputer', 'estimator': 'Bayesian', 'initial_strategy': 'constant', 'n_nearest_features': 9, 'imputation_order': 'random', 'sample_posterior': False}. Best is trial 17 with value: 0.155081993050656.
running
[I 2024-10-06 02:53:42,512] Trial 39 finished with value: 0.15508218927542008 and parameters: {'model_name': 'IterativeImputer', 'estimator': 'Bayesian', 'initial_strategy': 'constant', 'n_nearest_features': 9, 'imputation_order': 'arabic', 'sample_posterior': False}. Best is trial 17 with value: 0.155081993050656.
running
[I 2024-10-06 02:53:50,612] Trial 48 finished with value: 0.15508784415218912 and parameters: {'model_name': 'IterativeImputer', 'estimator': 'Ridge', 'initial_strategy': 'most_frequent', 'n_nearest_features': 9, 'imputation_order': 'descending'}. Best is trial 17 with value: 0.155081993050656.
running
[I 2024-10-06 02:53:55,289] Trial 49 finished with value: 0.1550878404210281 and parameters: {'model_name': 'IterativeImputer', 'estimator': 'Ridge', 'initial_strategy': 'constant', 'n_nearest_features': 9, 'imputation_order': 'descending'}. Best is trial 17 with value: 0.155081993050656.
running
[I 2024-10-06 02:53:59,688] Trial 50 finished with value: 0.15508784415218912 and parameters: {'model_name': 'IterativeImputer', 'estimator': 'Ridge', 'initial_strategy': 'most_frequent', 'n_nearest_features': 9, 'imputation_order': 'descending'}. Best is trial 17 with value: 0.155081993050656.
running
[I 2024-10-06 02:54:12,398] Trial 46 finished with value: 0.155081993050656 and parameters: {'model_name': 'IterativeImputer', 'estimator': 'Bayesian', 'initial_strategy': 'median', 'n_nearest_features': 9, 'imputation_order': 'descending', 'sample_posterior': False}. Best is trial 17 with value: 0.155081993050656.
running
[I 2024-10-06 02:54:36,526] Trial 47 finished with value: 0.1550821198122981 and parameters: {'model_name': 'IterativeImputer', 'estimator': 'Bayesian', 'initial_strategy': 'most_frequent', 'n_nearest_features': 9, 'imputation_order': 'descending', 'sample_posterior': False}. Best is trial 17 with value: 0.155081993050656.
running
[I 2024-10-06 03:09:36,021] Trial 13 finished with value: 0.18111033390622253 and parameters: {'model_name': 'VAE', 'batch_size': 220, 'iterations': 566, 'learning_rate': 0.0022394573112994283, 'p_miss': 0.16540349597384157}. Best is trial 17 with value: 0.155081993050656.
running
[I 2024-10-06 04:01:07,796] Trial 26 finished with value: 0.16695963618463822 and parameters: {'model_name': 'IterativeImputer', 'estimator': 'RFR', 'initial_strategy': 'most_frequent', 'n_nearest_features': 3, 'imputation_order': 'random'}. Best is trial 17 with value: 0.155081993050656.
running
[I 2024-10-06 04:16:51,875] Trial 3 finished with value: 0.15673463586609496 and parameters: {'model_name': 'IterativeImputer', 'estimator': 'RFR', 'initial_strategy': 'constant', 'n_nearest_features': 4, 'imputation_order': 'random'}. Best is trial 17 with value: 0.155081993050656.
running
[I 2024-10-06 04:55:33,587] Trial 42 finished with value: 0.1336727666028467 and parameters: {'model_name': 'IterativeImputer', 'estimator': 'RFR', 'initial_strategy': 'median', 'n_nearest_features': 7, 'imputation_order': 'descending'}. Best is trial 42 with value: 0.1336727666028467.
running
[I 2024-10-06 04:56:21,612] Trial 54 finished with value: 0.13695369371772706 and parameters: {'model_name': 'IterativeImputer', 'estimator': 'RFR', 'initial_strategy': 'constant', 'n_nearest_features': 7, 'imputation_order': 'roman'}. Best is trial 42 with value: 0.1336727666028467.
running
[I 2024-10-06 05:04:07,712] Trial 44 finished with value: 0.13268275147528993 and parameters: {'model_name': 'IterativeImputer', 'estimator': 'RFR', 'initial_strategy': 'median', 'n_nearest_features': 9, 'imputation_order': 'descending'}. Best is trial 44 with value: 0.13268275147528993.
running
[I 2024-10-06 05:04:13,130] Trial 10 finished with value: 0.13231233979443696 and parameters: {'model_name': 'IterativeImputer', 'estimator': 'RFR', 'initial_strategy': 'most_frequent', 'n_nearest_features': 9, 'imputation_order': 'descending'}. Best is trial 10 with value: 0.13231233979443696.
running
[I 2024-10-06 05:05:26,347] Trial 41 finished with value: 0.1324765529378026 and parameters: {'model_name': 'IterativeImputer', 'estimator': 'RFR', 'initial_strategy': 'median', 'n_nearest_features': 9, 'imputation_order': 'descending'}. Best is trial 10 with value: 0.13231233979443696.
running
[I 2024-10-06 05:06:34,935] Trial 40 finished with value: 0.13221267284094734 and parameters: {'model_name': 'IterativeImputer', 'estimator': 'RFR', 'initial_strategy': 'median', 'n_nearest_features': 8, 'imputation_order': 'arabic'}. Best is trial 40 with value: 0.13221267284094734.
running
[I 2024-10-06 09:48:39,257] Trial 53 finished with value: 0.1805492274550215 and parameters: {'model_name': 'VAE', 'batch_size': 97, 'iterations': 6153, 'learning_rate': 0.001048477609104381, 'p_miss': 0.010958222596065964}. Best is trial 40 with value: 0.13221267284094734.
running
[I 2024-10-06 10:04:13,395] Trial 57 finished with value: 0.18114855452778883 and parameters: {'model_name': 'VAE', 'batch_size': 352, 'iterations': 6484, 'learning_rate': 0.0007909640041707279, 'p_miss': 0.29022202876600883}. Best is trial 40 with value: 0.13221267284094734.
running
[I 2024-10-06 10:05:48,487] Trial 69 finished with value: 0.4395326071191632 and parameters: {'model_name': 'GAIN', 'batch_size': 910, 'hint_rate': 0.9817415701175087, 'alpha': 1, 'iterations': 32, 'learning_rate': 0.01305511269382104, 'p_miss': 0.24995605836446488}. Best is trial 40 with value: 0.13221267284094734.
running
[I 2024-10-06 11:04:17,474] Trial 52 finished with value: 0.18133497300655205 and parameters: {'model_name': 'VAE', 'batch_size': 764, 'iterations': 6813, 'learning_rate': 0.000878163469531929, 'p_miss': 0.013315944396158047}. Best is trial 40 with value: 0.13221267284094734.
running
[I 2024-10-06 11:17:30,012] Trial 55 finished with value: 0.18106845825752588 and parameters: {'model_name': 'VAE', 'batch_size': 482, 'iterations': 7149, 'learning_rate': 0.0007482691054279417, 'p_miss': 0.017071445308755817}. Best is trial 40 with value: 0.13221267284094734.
running
[I 2024-10-06 12:07:37,085] Trial 58 finished with value: 0.18110303498984043 and parameters: {'model_name': 'VAE', 'batch_size': 593, 'iterations': 7115, 'learning_rate': 0.0008540528587967337, 'p_miss': 0.02654066638830546}. Best is trial 40 with value: 0.13221267284094734.
running
[I 2024-10-06 12:19:09,337] Trial 70 finished with value: 0.14015246876914533 and parameters: {'model_name': 'IterativeImputer', 'estimator': 'RFR', 'initial_strategy': 'mean', 'n_nearest_features': 7, 'imputation_order': 'roman'}. Best is trial 40 with value: 0.13221267284094734.
running
[I 2024-10-06 12:19:10,945] Trial 74 finished with value: 0.18839171218210532 and parameters: {'model_name': 'SimpleImputer', 'strategy': 'median'}. Best is trial 40 with value: 0.13221267284094734.
running
[I 2024-10-06 12:56:49,750] Trial 56 finished with value: 0.18108654597890644 and parameters: {'model_name': 'VAE', 'batch_size': 707, 'iterations': 8158, 'learning_rate': 0.0008418225037111416, 'p_miss': 0.012134134298837335}. Best is trial 40 with value: 0.13221267284094734.
running
[I 2024-10-06 13:00:36,146] Trial 61 finished with value: 0.1811650972660998 and parameters: {'model_name': 'VAE', 'batch_size': 350, 'iterations': 6784, 'learning_rate': 0.0006168232605722046, 'p_miss': 0.030727760466746468}. Best is trial 40 with value: 0.13221267284094734.
running
[I 2024-10-06 13:01:32,399] Trial 51 finished with value: 0.18098013723145176 and parameters: {'model_name': 'VAE', 'batch_size': 178, 'iterations': 7828, 'learning_rate': 0.000878884809054507, 'p_miss': 0.0157743080074379}. Best is trial 40 with value: 0.13221267284094734.
running
[I 2024-10-06 13:16:40,379] Trial 71 finished with value: 0.13427448757306312 and parameters: {'model_name': 'IterativeImputer', 'estimator': 'RFR', 'initial_strategy': 'median', 'n_nearest_features': 7, 'imputation_order': 'roman'}. Best is trial 40 with value: 0.13221267284094734.
running
[I 2024-10-06 13:18:55,177] Trial 59 finished with value: 0.18095459733473945 and parameters: {'model_name': 'VAE', 'batch_size': 442, 'iterations': 8661, 'learning_rate': 0.0004939689424060082, 'p_miss': 0.012304673143302497}. Best is trial 40 with value: 0.13221267284094734.
running
[I 2024-10-06 13:28:05,279] Trial 72 finished with value: 0.1396793458606887 and parameters: {'model_name': 'IterativeImputer', 'estimator': 'RFR', 'initial_strategy': 'mean', 'n_nearest_features': 7, 'imputation_order': 'roman'}. Best is trial 40 with value: 0.13221267284094734.
running
[I 2024-10-06 13:50:21,633] Trial 62 finished with value: 0.18137066624772094 and parameters: {'model_name': 'VAE', 'batch_size': 819, 'iterations': 6399, 'learning_rate': 0.0006818031551622287, 'p_miss': 0.018265911167133247}. Best is trial 40 with value: 0.13221267284094734.
running
[I 2024-10-06 14:14:44,151] Trial 73 finished with value: 0.14001580059470037 and parameters: {'model_name': 'IterativeImputer', 'estimator': 'RFR', 'initial_strategy': 'mean', 'n_nearest_features': 7, 'imputation_order': 'roman'}. Best is trial 40 with value: 0.13221267284094734.
running
[I 2024-10-06 14:21:04,155] Trial 65 finished with value: 0.1811861709762669 and parameters: {'model_name': 'VAE', 'batch_size': 926, 'iterations': 6176, 'learning_rate': 0.01591180384606039, 'p_miss': 0.021244279409813605}. Best is trial 40 with value: 0.13221267284094734.
running
[I 2024-10-06 14:24:33,512] Trial 75 finished with value: 0.13519472058055954 and parameters: {'model_name': 'IterativeImputer', 'estimator': 'RFR', 'initial_strategy': 'median', 'n_nearest_features': 7, 'imputation_order': 'roman'}. Best is trial 40 with value: 0.13221267284094734.
running
[I 2024-10-06 14:25:00,014] Trial 85 finished with value: 0.41515057479544126 and parameters: {'model_name': 'GAIN', 'batch_size': 4, 'hint_rate': 0.5204791087915132, 'alpha': 96, 'iterations': 22, 'learning_rate': 0.05670906122072202, 'p_miss': 0.24390317859427574}. Best is trial 40 with value: 0.13221267284094734.
running
[I 2024-10-06 14:48:43,051] Trial 60 finished with value: 0.181321017930716 and parameters: {'model_name': 'VAE', 'batch_size': 804, 'iterations': 9391, 'learning_rate': 0.0006049061754644023, 'p_miss': 0.011728865035668806}. Best is trial 40 with value: 0.13221267284094734.
running
[I 2024-10-06 14:57:10,365] Trial 66 finished with value: 0.18118983273439793 and parameters: {'model_name': 'VAE', 'batch_size': 989, 'iterations': 6844, 'learning_rate': 0.000522001529051164, 'p_miss': 0.012056924514475431}. Best is trial 40 with value: 0.13221267284094734.
running
