[I 2024-11-05 20:14:05,208] Trial 199 finished with value: 0.4027684591544901 and parameters: {'model_name': 'SimpleImputer', 'strategy': 'constant'}. Best is trial 1 with value: 0.22408387266657082.
fit
simple fit
simple transform
0    0
1    0
2    0
3    0
4    0
dtype: int64
0    0
1    0
2    0
3    0
4    0
dtype: int64
0.22408387266657082
{'model_name': 'SimpleImputer', 'strategy': 'mean'}
running experiment 2/3 - Does reconstruction give good automl predictions
Start est fit
Version 0.1.7a0 of tpot2 is outdated. Version 0.1.8a0 was released Tuesday September 17, 2024.
Version 0.1.7a0 of tpot2 is outdated. Version 0.1.8a0 was released Tuesday September 17, 2024.
Version 0.1.7a0 of tpot2 is outdated. Version 0.1.8a0 was released Tuesday September 17, 2024.
Version 0.1.7a0 of tpot2 is outdated. Version 0.1.8a0 was released Tuesday September 17, 2024.
Version 0.1.7a0 of tpot2 is outdated. Version 0.1.8a0 was released Tuesday September 17, 2024.
Version 0.1.7a0 of tpot2 is outdated. Version 0.1.8a0 was released Tuesday September 17, 2024.
Version 0.1.7a0 of tpot2 is outdated. Version 0.1.8a0 was released Tuesday September 17, 2024.
Version 0.1.7a0 of tpot2 is outdated. Version 0.1.8a0 was released Tuesday September 17, 2024.
Version 0.1.7a0 of tpot2 is outdated. Version 0.1.8a0 was released Tuesday September 17, 2024.
Version 0.1.7a0 of tpot2 is outdated. Version 0.1.8a0 was released Tuesday September 17, 2024.
Version 0.1.7a0 of tpot2 is outdated. Version 0.1.8a0 was released Tuesday September 17, 2024.
Version 0.1.7a0 of tpot2 is outdated. Version 0.1.8a0 was released Tuesday September 17, 2024.
Version 0.1.7a0 of tpot2 is outdated. Version 0.1.8a0 was released Tuesday September 17, 2024.
Version 0.1.7a0 of tpot2 is outdated. Version 0.1.8a0 was released Tuesday September 17, 2024.
Version 0.1.7a0 of tpot2 is outdated. Version 0.1.8a0 was released Tuesday September 17, 2024.
Version 0.1.7a0 of tpot2 is outdated. Version 0.1.8a0 was released Tuesday September 17, 2024.
  0%|          | 0/25 [00:00<?, ?it/s]Generation:   0%|          | 0/25 [00:00<?, ?it/s]Generation:  1
Best f1_score score: 0.9356987246798031
Generation:   4%|▍         | 1/25 [01:27<34:57, 87.42s/it]Generation:  2
Best f1_score score: 0.9382997738802908
Generation:   8%|▊         | 2/25 [04:15<51:41, 134.84s/it]Generation:  3
Best f1_score score: 0.9382997738802908
Generation:  12%|█▏        | 3/25 [04:38<30:39, 83.62s/it] Generation:  4
Best f1_score score: 0.9382997738802908
Generation:  16%|█▌        | 4/25 [05:00<20:49, 59.52s/it]Generation:  5
Best f1_score score: 0.9389566438479285
Generation:  20%|██        | 5/25 [05:56<19:23, 58.15s/it]WARNING THIS INDIVIDUAL CAUSED AND EXCEPTION 
 <tpot2.search_spaces.pipelines.sequential.SequentialPipelineIndividual object at 0x15545ff766e0> 
 The 'min_samples_split' parameter of DecisionTreeClassifier must be an int in the range [2, inf) or a float in the range (0.0, 1.0]. Got 1 instead. 
 Traceback (most recent call last):
  File "/common/ketrong/tpotexp/tpot2/tpot2/utils/eval_utils.py", line 53, in objective_nan_wrapper
    value = func_timeout.func_timeout(timeout, objective_function, args=[individual], kwargs=objective_kwargs)
  File "/common/ketrong/tpotexp/env/lib/python3.10/site-packages/func_timeout/dafunc.py", line 108, in func_timeout
    raise_exception(exception)
  File "/common/ketrong/tpotexp/env/lib/python3.10/site-packages/func_timeout/py3_raise.py", line 7, in raise_exception
    raise exception[0] from None
  File "/common/ketrong/tpotexp/tpot2/tpot2/tpot_estimator/estimator.py", line 623, in objective_function
    return objective_function_generator(
  File "/common/ketrong/tpotexp/tpot2/tpot2/tpot_estimator/estimator_utils.py", line 55, in objective_function_generator
    cv_obj_scores = cross_val_score_objective(sklearn.base.clone(pipeline),x,y,scorers=scorers, cv=cv , fold=step)
  File "/common/ketrong/tpotexp/tpot2/tpot2/tpot_estimator/cross_val_utils.py", line 28, in cross_val_score_objective
    this_fold_pipeline.fit(X_train,y_train)
  File "/common/ketrong/tpotexp/env/lib/python3.10/site-packages/sklearn/base.py", line 1473, in wrapper
    return fit_method(estimator, *args, **kwargs)
  File "/common/ketrong/tpotexp/env/lib/python3.10/site-packages/sklearn/pipeline.py", line 473, in fit
    self._final_estimator.fit(Xt, y, **last_step_params["fit"])
  File "/common/ketrong/tpotexp/env/lib/python3.10/site-packages/sklearn/base.py", line 1466, in wrapper
    estimator._validate_params()
  File "/common/ketrong/tpotexp/env/lib/python3.10/site-packages/sklearn/base.py", line 666, in _validate_params
    validate_parameter_constraints(
  File "/common/ketrong/tpotexp/env/lib/python3.10/site-packages/sklearn/utils/_param_validation.py", line 95, in validate_parameter_constraints
    raise InvalidParameterError(
sklearn.utils._param_validation.InvalidParameterError: The 'min_samples_split' parameter of DecisionTreeClassifier must be an int in the range [2, inf) or a float in the range (0.0, 1.0]. Got 1 instead.

Generation:  6
Best f1_score score: 0.9389566438479285
Generation:  24%|██▍       | 6/25 [06:17<14:28, 45.71s/it]Generation:  7
Best f1_score score: 0.9389566438479285
Generation:  28%|██▊       | 7/25 [06:43<11:45, 39.18s/it]Generation:  8
Best f1_score score: 0.9402088074238618
Generation:  32%|███▏      | 8/25 [07:37<12:27, 43.98s/it]Generation:  9
Best f1_score score: 0.9402088074238618
Generation:  36%|███▌      | 9/25 [08:00<09:58, 37.39s/it]Generation:  10
Best f1_score score: 0.9402088074238618
Generation:  40%|████      | 10/25 [08:46<09:56, 39.78s/it]Generation:  11
Best f1_score score: 0.94301657258321
Generation:  44%|████▍     | 11/25 [09:08<08:01, 34.37s/it]Generation:  12
Best f1_score score: 0.94301657258321
Generation:  48%|████▊     | 12/25 [09:36<07:01, 32.43s/it]Generation:  13
Best f1_score score: 0.94301657258321
Generation:  52%|█████▏    | 13/25 [09:58<05:51, 29.32s/it]Generation:  14
Best f1_score score: 0.94301657258321
Generation:  56%|█████▌    | 14/25 [10:26<05:20, 29.10s/it]Generation:  15
Best f1_score score: 0.94301657258321
Generation:  60%|██████    | 15/25 [11:36<06:54, 41.45s/it]Generation:  16
Best f1_score score: 0.94301657258321
Generation:  64%|██████▍   | 16/25 [16:52<18:34, 123.88s/it]Generation:  17
Best f1_score score: 0.94301657258321
Generation:  68%|██████▊   | 17/25 [17:12<12:20, 92.61s/it] Generation:  18
Best f1_score score: 0.94301657258321
Generation:  72%|███████▏  | 18/25 [17:40<08:33, 73.42s/it]WARNING THIS INDIVIDUAL CAUSED AND EXCEPTION 
 <tpot2.search_spaces.pipelines.sequential.SequentialPipelineIndividual object at 0x155474634f40> 
 Out of bag estimation only available if bootstrap=True 
 Traceback (most recent call last):
  File "/common/ketrong/tpotexp/tpot2/tpot2/utils/eval_utils.py", line 53, in objective_nan_wrapper
    value = func_timeout.func_timeout(timeout, objective_function, args=[individual], kwargs=objective_kwargs)
  File "/common/ketrong/tpotexp/env/lib/python3.10/site-packages/func_timeout/dafunc.py", line 108, in func_timeout
    raise_exception(exception)
  File "/common/ketrong/tpotexp/env/lib/python3.10/site-packages/func_timeout/py3_raise.py", line 7, in raise_exception
    raise exception[0] from None
  File "/common/ketrong/tpotexp/tpot2/tpot2/tpot_estimator/estimator.py", line 623, in objective_function
    return objective_function_generator(
  File "/common/ketrong/tpotexp/tpot2/tpot2/tpot_estimator/estimator_utils.py", line 55, in objective_function_generator
    cv_obj_scores = cross_val_score_objective(sklearn.base.clone(pipeline),x,y,scorers=scorers, cv=cv , fold=step)
  File "/common/ketrong/tpotexp/tpot2/tpot2/tpot_estimator/cross_val_utils.py", line 28, in cross_val_score_objective
    this_fold_pipeline.fit(X_train,y_train)
  File "/common/ketrong/tpotexp/env/lib/python3.10/site-packages/sklearn/base.py", line 1473, in wrapper
    return fit_method(estimator, *args, **kwargs)
  File "/common/ketrong/tpotexp/env/lib/python3.10/site-packages/sklearn/pipeline.py", line 473, in fit
    self._final_estimator.fit(Xt, y, **last_step_params["fit"])
  File "/common/ketrong/tpotexp/env/lib/python3.10/site-packages/sklearn/utils/validation.py", line 66, in inner_f
    return f(*args, **kwargs)
  File "/common/ketrong/tpotexp/env/lib/python3.10/site-packages/sklearn/base.py", line 1473, in wrapper
    return fit_method(estimator, *args, **kwargs)
  File "/common/ketrong/tpotexp/env/lib/python3.10/site-packages/sklearn/ensemble/_bagging.py", line 402, in fit
    return self._fit(X, y, max_samples=self.max_samples, **fit_params)
  File "/common/ketrong/tpotexp/env/lib/python3.10/site-packages/sklearn/ensemble/_bagging.py", line 502, in _fit
    raise ValueError("Out of bag estimation only available if bootstrap=True")
ValueError: Out of bag estimation only available if bootstrap=True

Generation:  19
Best f1_score score: 0.94301657258321
Generation:  76%|███████▌  | 19/25 [18:08<05:58, 59.69s/it]Generation:  20
Best f1_score score: 0.94301657258321
Generation:  80%|████████  | 20/25 [18:52<04:34, 54.86s/it]Generation:  21
Best f1_score score: 0.94301657258321
Generation:  84%|████████▍ | 21/25 [19:12<02:57, 44.48s/it]Generation:  22
Best f1_score score: 0.9431082746665803
Generation:  88%|████████▊ | 22/25 [19:30<01:49, 36.62s/it]WARNING THIS INDIVIDUAL CAUSED AND EXCEPTION 
 <tpot2.search_spaces.pipelines.sequential.SequentialPipelineIndividual object at 0x155474031db0> 
 The 'min_samples_split' parameter of DecisionTreeClassifier must be an int in the range [2, inf) or a float in the range (0.0, 1.0]. Got 1 instead. 
 Traceback (most recent call last):
  File "/common/ketrong/tpotexp/tpot2/tpot2/utils/eval_utils.py", line 53, in objective_nan_wrapper
    value = func_timeout.func_timeout(timeout, objective_function, args=[individual], kwargs=objective_kwargs)
  File "/common/ketrong/tpotexp/env/lib/python3.10/site-packages/func_timeout/dafunc.py", line 108, in func_timeout
    raise_exception(exception)
  File "/common/ketrong/tpotexp/env/lib/python3.10/site-packages/func_timeout/py3_raise.py", line 7, in raise_exception
    raise exception[0] from None
  File "/common/ketrong/tpotexp/tpot2/tpot2/tpot_estimator/estimator.py", line 623, in objective_function
    return objective_function_generator(
  File "/common/ketrong/tpotexp/tpot2/tpot2/tpot_estimator/estimator_utils.py", line 55, in objective_function_generator
    cv_obj_scores = cross_val_score_objective(sklearn.base.clone(pipeline),x,y,scorers=scorers, cv=cv , fold=step)
  File "/common/ketrong/tpotexp/tpot2/tpot2/tpot_estimator/cross_val_utils.py", line 28, in cross_val_score_objective
    this_fold_pipeline.fit(X_train,y_train)
  File "/common/ketrong/tpotexp/env/lib/python3.10/site-packages/sklearn/base.py", line 1473, in wrapper
    return fit_method(estimator, *args, **kwargs)
  File "/common/ketrong/tpotexp/env/lib/python3.10/site-packages/sklearn/pipeline.py", line 473, in fit
    self._final_estimator.fit(Xt, y, **last_step_params["fit"])
  File "/common/ketrong/tpotexp/env/lib/python3.10/site-packages/sklearn/base.py", line 1466, in wrapper
    estimator._validate_params()
  File "/common/ketrong/tpotexp/env/lib/python3.10/site-packages/sklearn/base.py", line 666, in _validate_params
    validate_parameter_constraints(
  File "/common/ketrong/tpotexp/env/lib/python3.10/site-packages/sklearn/utils/_param_validation.py", line 95, in validate_parameter_constraints
    raise InvalidParameterError(
sklearn.utils._param_validation.InvalidParameterError: The 'min_samples_split' parameter of DecisionTreeClassifier must be an int in the range [2, inf) or a float in the range (0.0, 1.0]. Got 1 instead.

Generation:  23
Best f1_score score: 0.9431082746665803
Generation:  92%|█████████▏| 23/25 [19:47<01:01, 30.53s/it]Generation:  24
Best f1_score score: 0.9431082746665803
Generation:  96%|█████████▌| 24/25 [20:13<00:29, 29.22s/it]Generation:  25
Best f1_score score: 0.9431082746665803
Generation: 100%|██████████| 25/25 [20:42<00:00, 29.08s/it]Generation: 100%|██████████| 25/25 [20:45<00:00, 49.81s/it]
2024-11-05 20:34:57,125 - distributed.scheduler - ERROR - Removing worker 'tcp://127.0.0.1:43111' caused the cluster to lose scattered data, which can't be recovered: {'ndarray-579345a51609ee95c00b98330f72c2da', 'ndarray-3582eafeb3c22fb974f09d7280b8e6ec'} (stimulus_id='handle-worker-cleanup-1730867697.1249907')
Fitted
Pipeline(steps=[('baggingclassifier',
                 BaggingClassifier(bootstrap=False, bootstrap_features=True,
                                   max_features=0.850248909641,
                                   max_samples=0.8842299829788, n_estimators=46,
                                   n_jobs=1))])
score start
train score: {'auroc': 1.0, 'accuracy': 1.0, 'balanced_accuracy': 1.0, 'logloss': 0.04171706626595536, 'f1': 1.0}
original test score: {'auroc': 0.9861128953159856, 'accuracy': 0.9581859118687681, 'balanced_accuracy': 0.9426406784333545, 'logloss': 0.1910304631430833, 'f1': 0.9516245402673607}
imputed test score: {'auroc': 0.9837096104202983, 'accuracy': 0.9565776777098746, 'balanced_accuracy': 0.9399448360318325, 'logloss': 0.20283225081184428, 'f1': 0.9496670794770025}
score end
check intended
EXP2 Finished
running experiment 3/3 - What is the best automl settings?
<tpot2.search_spaces.pipelines.sequential.SequentialPipeline object at 0x15543504f9d0>
Start tpot fit
Version 0.1.7a0 of tpot2 is outdated. Version 0.1.8a0 was released Tuesday September 17, 2024.
Version 0.1.7a0 of tpot2 is outdated. Version 0.1.8a0 was released Tuesday September 17, 2024.
Version 0.1.7a0 of tpot2 is outdated. Version 0.1.8a0 was released Tuesday September 17, 2024.
Version 0.1.7a0 of tpot2 is outdated. Version 0.1.8a0 was released Tuesday September 17, 2024.
Version 0.1.7a0 of tpot2 is outdated. Version 0.1.8a0 was released Tuesday September 17, 2024.
Version 0.1.7a0 of tpot2 is outdated. Version 0.1.8a0 was released Tuesday September 17, 2024.
Version 0.1.7a0 of tpot2 is outdated. Version 0.1.8a0 was released Tuesday September 17, 2024.
Version 0.1.7a0 of tpot2 is outdated. Version 0.1.8a0 was released Tuesday September 17, 2024.
Version 0.1.7a0 of tpot2 is outdated. Version 0.1.8a0 was released Tuesday September 17, 2024.
Version 0.1.7a0 of tpot2 is outdated. Version 0.1.8a0 was released Tuesday September 17, 2024.
Version 0.1.7a0 of tpot2 is outdated. Version 0.1.8a0 was released Tuesday September 17, 2024.
Version 0.1.7a0 of tpot2 is outdated. Version 0.1.8a0 was released Tuesday September 17, 2024.
Version 0.1.7a0 of tpot2 is outdated. Version 0.1.8a0 was released Tuesday September 17, 2024.
Version 0.1.7a0 of tpot2 is outdated. Version 0.1.8a0 was released Tuesday September 17, 2024.
Version 0.1.7a0 of tpot2 is outdated. Version 0.1.8a0 was released Tuesday September 17, 2024.
Version 0.1.7a0 of tpot2 is outdated. Version 0.1.8a0 was released Tuesday September 17, 2024.
  0%|          | 0/25 [00:00<?, ?it/s]Generation:   0%|          | 0/25 [00:00<?, ?it/s]WARNING AN INDIVIDUAL TIMED OUT: 
 <tpot2.search_spaces.pipelines.sequential.SequentialPipelineIndividual object at 0x155474cd0ee0> 

Generation:  1
Best f1_score score: 0.9357861419980636
Generation:   4%|▍         | 1/25 [10:01<4:00:41, 601.73s/it]Generation:  2
Best f1_score score: 0.9357861419980636
Generation:   8%|▊         | 2/25 [11:09<1:50:09, 287.38s/it]Generation:  3
Best f1_score score: 0.9357861419980636
Generation:  12%|█▏        | 3/25 [11:55<1:05:02, 177.40s/it]Generation:  4
Best f1_score score: 0.9375495907330226
Generation:  16%|█▌        | 4/25 [12:26<41:48, 119.43s/it]  Generation:  5
Best f1_score score: 0.9434752606475403
Generation:  20%|██        | 5/25 [12:42<27:28, 82.43s/it] Generation:  6
Best f1_score score: 0.9434752606475403
Generation:  24%|██▍       | 6/25 [12:58<18:54, 59.72s/it]Generation:  7
Best f1_score score: 0.9434752606475403
Generation:  28%|██▊       | 7/25 [13:14<13:39, 45.55s/it]Generation:  8
Best f1_score score: 0.9439076916693571
Generation:  32%|███▏      | 8/25 [13:31<10:19, 36.43s/it]Generation:  9
Best f1_score score: 0.9439076916693571
Generation:  36%|███▌      | 9/25 [13:44<07:43, 28.99s/it]Generation:  10
Best f1_score score: 0.9448895032525935
Generation:  40%|████      | 10/25 [14:00<06:14, 24.95s/it]Generation:  11
Best f1_score score: 0.9450512485471325
Generation:  44%|████▍     | 11/25 [15:32<10:38, 45.61s/it]Generation:  12
Best f1_score score: 0.9450512485471325
Generation:  48%|████▊     | 12/25 [15:45<07:43, 35.69s/it]Generation:  13
Best f1_score score: 0.9450512485471325
Generation:  52%|█████▏    | 13/25 [16:22<07:10, 35.85s/it]Generation:  14
Best f1_score score: 0.9450512485471325
Generation:  56%|█████▌    | 14/25 [16:36<05:22, 29.30s/it]Generation:  15
Best f1_score score: 0.9450512485471325
Generation:  60%|██████    | 15/25 [18:16<08:25, 50.59s/it]Generation:  16
Best f1_score score: 0.9450512485471325
Generation:  64%|██████▍   | 16/25 [22:17<16:10, 107.86s/it]Generation:  17
Best f1_score score: 0.9450512485471325
Generation:  68%|██████▊   | 17/25 [22:34<10:44, 80.59s/it] Generation:  18
Best f1_score score: 0.9450512485471325
Generation:  72%|███████▏  | 18/25 [22:50<07:09, 61.34s/it]Generation:  19
Best f1_score score: 0.9450512485471325
Generation:  76%|███████▌  | 19/25 [28:06<13:46, 137.80s/it]WARNING THIS INDIVIDUAL CAUSED AND EXCEPTION 
 <tpot2.search_spaces.pipelines.sequential.SequentialPipelineIndividual object at 0x155474cd1d20> 
 Out of bag estimation only available if bootstrap=True 
 Traceback (most recent call last):
  File "/common/ketrong/tpotexp/tpot2/tpot2/utils/eval_utils.py", line 53, in objective_nan_wrapper
    value = func_timeout.func_timeout(timeout, objective_function, args=[individual], kwargs=objective_kwargs)
  File "/common/ketrong/tpotexp/env/lib/python3.10/site-packages/func_timeout/dafunc.py", line 108, in func_timeout
    raise_exception(exception)
  File "/common/ketrong/tpotexp/env/lib/python3.10/site-packages/func_timeout/py3_raise.py", line 7, in raise_exception
    raise exception[0] from None
  File "/common/ketrong/tpotexp/tpot2/tpot2/tpot_estimator/estimator.py", line 623, in objective_function
    return objective_function_generator(
  File "/common/ketrong/tpotexp/tpot2/tpot2/tpot_estimator/estimator_utils.py", line 55, in objective_function_generator
    cv_obj_scores = cross_val_score_objective(sklearn.base.clone(pipeline),x,y,scorers=scorers, cv=cv , fold=step)
  File "/common/ketrong/tpotexp/tpot2/tpot2/tpot_estimator/cross_val_utils.py", line 28, in cross_val_score_objective
    this_fold_pipeline.fit(X_train,y_train)
  File "/common/ketrong/tpotexp/env/lib/python3.10/site-packages/sklearn/base.py", line 1473, in wrapper
    return fit_method(estimator, *args, **kwargs)
  File "/common/ketrong/tpotexp/env/lib/python3.10/site-packages/sklearn/pipeline.py", line 473, in fit
    self._final_estimator.fit(Xt, y, **last_step_params["fit"])
  File "/common/ketrong/tpotexp/env/lib/python3.10/site-packages/sklearn/utils/validation.py", line 66, in inner_f
    return f(*args, **kwargs)
  File "/common/ketrong/tpotexp/env/lib/python3.10/site-packages/sklearn/base.py", line 1473, in wrapper
    return fit_method(estimator, *args, **kwargs)
  File "/common/ketrong/tpotexp/env/lib/python3.10/site-packages/sklearn/ensemble/_bagging.py", line 402, in fit
    return self._fit(X, y, max_samples=self.max_samples, **fit_params)
  File "/common/ketrong/tpotexp/env/lib/python3.10/site-packages/sklearn/ensemble/_bagging.py", line 502, in _fit
    raise ValueError("Out of bag estimation only available if bootstrap=True")
ValueError: Out of bag estimation only available if bootstrap=True

Generation:  20
Best f1_score score: 0.9450512485471325
Generation:  80%|████████  | 20/25 [28:20<08:23, 100.71s/it]Generation:  21
Best f1_score score: 0.9450512485471325
Generation:  84%|████████▍ | 21/25 [28:33<04:56, 74.20s/it] Generation:  22
Best f1_score score: 0.9450512485471325
Generation:  88%|████████▊ | 22/25 [28:51<02:51, 57.33s/it]Generation:  23
Best f1_score score: 0.9450512485471325
Generation:  92%|█████████▏| 23/25 [29:09<01:31, 45.54s/it]Generation:  24
Best f1_score score: 0.9450512485471325
Generation:  96%|█████████▌| 24/25 [29:27<00:37, 37.38s/it]Generation:  25
Best f1_score score: 0.9450512485471325
Generation: 100%|██████████| 25/25 [30:00<00:00, 36.12s/it]Generation: 100%|██████████| 25/25 [30:00<00:00, 72.04s/it]
2024-11-05 21:05:12,789 - distributed.scheduler - ERROR - Removing worker 'tcp://127.0.0.1:43899' caused the cluster to lose scattered data, which can't be recovered: {'ndarray-579345a51609ee95c00b98330f72c2da', 'DataFrame-1c302c37106b0acd81ed70e910c8203d'} (stimulus_id='handle-worker-cleanup-1730869512.7892966')
Fitted
Pipeline(steps=[('simpleimputer', SimpleImputer()),
                ('baggingclassifier',
                 BaggingClassifier(bootstrap=False, bootstrap_features=True,
                                   max_features=0.8584021990409,
                                   max_samples=0.909497755633, n_estimators=85,
                                   n_jobs=1))])
transform worked
try transform
transform worked
score start
train score: {'auroc': 1.0, 'accuracy': 1.0, 'balanced_accuracy': 1.0, 'logloss': 0.04341366528015738, 'f1': 1.0}
test score: {'auroc': 0.9836751505217743, 'accuracy': 0.9543261498874236, 'balanced_accuracy': 0.9370194953945634, 'logloss': 0.20886604106955914, 'f1': 0.947013246508341}
original test score: {'auroc': 0.9856829670582122, 'accuracy': 0.9575426182052107, 'balanced_accuracy': 0.9421615217491188, 'logloss': 0.1962762350197081, 'f1': 0.9509071908234914}
score end
1046
lvl
0.1
type
MAR
num_run
1
class_simple
finished
all finished
full run takes
0.8638046820958455
hours
DONE
