[I 2024-10-23 17:52:40,059] Trial 194 finished with value: 0.24911941107400004 and parameters: {'model_name': 'SimpleImputer', 'strategy': 'mean'}. Best is trial 5 with value: 0.24911941107400004.
fit
simple fit
simple transform
0    0
1    0
2    0
3    0
4    0
5    0
6    0
7    0
dtype: int64
0    0
1    0
2    0
3    0
4    0
5    0
6    0
7    0
dtype: int64
0.24911941107400004
{'model_name': 'SimpleImputer', 'strategy': 'mean'}
running experiment 2/3 - Does reconstruction give good automl predictions
Start est fit
Version 0.1.7a0 of tpot2 is outdated. Version 0.1.8a0 was released Tuesday September 17, 2024.
Version 0.1.7a0 of tpot2 is outdated. Version 0.1.8a0 was released Tuesday September 17, 2024.
Version 0.1.7a0 of tpot2 is outdated. Version 0.1.8a0 was released Tuesday September 17, 2024.
Version 0.1.7a0 of tpot2 is outdated. Version 0.1.8a0 was released Tuesday September 17, 2024.
Version 0.1.7a0 of tpot2 is outdated. Version 0.1.8a0 was released Tuesday September 17, 2024.
Version 0.1.7a0 of tpot2 is outdated. Version 0.1.8a0 was released Tuesday September 17, 2024.
Version 0.1.7a0 of tpot2 is outdated. Version 0.1.8a0 was released Tuesday September 17, 2024.
Version 0.1.7a0 of tpot2 is outdated. Version 0.1.8a0 was released Tuesday September 17, 2024.
Version 0.1.7a0 of tpot2 is outdated. Version 0.1.8a0 was released Tuesday September 17, 2024.
Version 0.1.7a0 of tpot2 is outdated. Version 0.1.8a0 was released Tuesday September 17, 2024.
Version 0.1.7a0 of tpot2 is outdated. Version 0.1.8a0 was released Tuesday September 17, 2024.
Version 0.1.7a0 of tpot2 is outdated. Version 0.1.8a0 was released Tuesday September 17, 2024.
Version 0.1.7a0 of tpot2 is outdated. Version 0.1.8a0 was released Tuesday September 17, 2024.
Version 0.1.7a0 of tpot2 is outdated. Version 0.1.8a0 was released Tuesday September 17, 2024.
Version 0.1.7a0 of tpot2 is outdated. Version 0.1.8a0 was released Tuesday September 17, 2024.
Version 0.1.7a0 of tpot2 is outdated. Version 0.1.8a0 was released Tuesday September 17, 2024.
  0%|          | 0/25 [00:00<?, ?it/s]Generation:   0%|          | 0/25 [00:00<?, ?it/s]Generation:  1
Best f1_score score: 0.8991865279924394
Generation:   4%|▍         | 1/25 [00:24<09:46, 24.44s/it]Generation:  2
Best f1_score score: 0.8991865279924394
Generation:   8%|▊         | 2/25 [00:38<07:00, 18.28s/it]Generation:  3
Best f1_score score: 0.8991865279924394
Generation:  12%|█▏        | 3/25 [00:49<05:25, 14.78s/it]Generation:  4
Best f1_score score: 0.8992346938852259
Generation:  16%|█▌        | 4/25 [01:00<04:44, 13.53s/it]Generation:  5
Best f1_score score: 0.8999010050645057
Generation:  20%|██        | 5/25 [01:08<03:46, 11.33s/it]Generation:  6
Best f1_score score: 0.8999010050645057
Generation:  24%|██▍       | 6/25 [01:19<03:33, 11.26s/it]Generation:  7
Best f1_score score: 0.8999010050645057
Generation:  28%|██▊       | 7/25 [01:34<03:46, 12.56s/it]Generation:  8
Best f1_score score: 0.9006029906567836
Generation:  32%|███▏      | 8/25 [01:56<04:24, 15.56s/it]Generation:  9
Best f1_score score: 0.9006029906567836
Generation:  36%|███▌      | 9/25 [02:05<03:38, 13.64s/it]WARNING THIS INDIVIDUAL CAUSED AND EXCEPTION 
 <tpot2.search_spaces.pipelines.sequential.SequentialPipelineIndividual object at 0x15547406eb30> 
 Unsupported set of arguments: The combination of penalty='l1' and loss='hinge' is not supported, Parameters: penalty='l1', loss='hinge', dual=True 
 Traceback (most recent call last):
  File "/common/ketrong/tpotexp/tpot2/tpot2/utils/eval_utils.py", line 53, in objective_nan_wrapper
    value = func_timeout.func_timeout(timeout, objective_function, args=[individual], kwargs=objective_kwargs)
  File "/common/ketrong/tpotexp/env/lib/python3.10/site-packages/func_timeout/dafunc.py", line 108, in func_timeout
    raise_exception(exception)
  File "/common/ketrong/tpotexp/env/lib/python3.10/site-packages/func_timeout/py3_raise.py", line 7, in raise_exception
    raise exception[0] from None
  File "/common/ketrong/tpotexp/tpot2/tpot2/tpot_estimator/estimator.py", line 623, in objective_function
    return objective_function_generator(
  File "/common/ketrong/tpotexp/tpot2/tpot2/tpot_estimator/estimator_utils.py", line 55, in objective_function_generator
    cv_obj_scores = cross_val_score_objective(sklearn.base.clone(pipeline),x,y,scorers=scorers, cv=cv , fold=step)
  File "/common/ketrong/tpotexp/tpot2/tpot2/tpot_estimator/cross_val_utils.py", line 28, in cross_val_score_objective
    this_fold_pipeline.fit(X_train,y_train)
  File "/common/ketrong/tpotexp/env/lib/python3.10/site-packages/sklearn/base.py", line 1473, in wrapper
    return fit_method(estimator, *args, **kwargs)
  File "/common/ketrong/tpotexp/env/lib/python3.10/site-packages/sklearn/pipeline.py", line 473, in fit
    self._final_estimator.fit(Xt, y, **last_step_params["fit"])
  File "/common/ketrong/tpotexp/env/lib/python3.10/site-packages/sklearn/base.py", line 1473, in wrapper
    return fit_method(estimator, *args, **kwargs)
  File "/common/ketrong/tpotexp/env/lib/python3.10/site-packages/sklearn/svm/_classes.py", line 317, in fit
    self.coef_, self.intercept_, n_iter_ = _fit_liblinear(
  File "/common/ketrong/tpotexp/env/lib/python3.10/site-packages/sklearn/svm/_base.py", line 1214, in _fit_liblinear
    solver_type = _get_liblinear_solver_type(multi_class, penalty, loss, dual)
  File "/common/ketrong/tpotexp/env/lib/python3.10/site-packages/sklearn/svm/_base.py", line 1046, in _get_liblinear_solver_type
    raise ValueError(
ValueError: Unsupported set of arguments: The combination of penalty='l1' and loss='hinge' is not supported, Parameters: penalty='l1', loss='hinge', dual=True

Generation:  10
Best f1_score score: 0.9006029906567836
Generation:  40%|████      | 10/25 [02:21<03:31, 14.12s/it]Generation:  11
Best f1_score score: 0.9006029906567836
Generation:  44%|████▍     | 11/25 [02:33<03:08, 13.50s/it]Generation:  12
Best f1_score score: 0.9006029906567836
Generation:  48%|████▊     | 12/25 [09:14<28:29, 131.47s/it]Generation:  13
Best f1_score score: 0.9006029906567836
Generation:  52%|█████▏    | 13/25 [09:38<19:46, 98.88s/it] Generation:  14
Best f1_score score: 0.9006029906567836
Generation:  56%|█████▌    | 14/25 [10:02<14:01, 76.48s/it]Generation:  15
Best f1_score score: 0.9006029906567836
Generation:  60%|██████    | 15/25 [10:13<09:27, 56.73s/it]Generation:  16
Best f1_score score: 0.9006029906567836
Generation:  64%|██████▍   | 16/25 [10:37<07:00, 46.76s/it]Generation:  17
Best f1_score score: 0.9006029906567836
Generation:  68%|██████▊   | 17/25 [10:58<05:10, 38.86s/it]Generation:  18
Best f1_score score: 0.9006029906567836
Generation:  72%|███████▏  | 18/25 [11:23<04:03, 34.85s/it]Generation:  19
Best f1_score score: 0.9006029906567836
Generation:  76%|███████▌  | 19/25 [11:47<03:09, 31.60s/it]Generation:  20
Best f1_score score: 0.9006029906567836
Generation:  80%|████████  | 20/25 [16:05<08:18, 99.64s/it]Generation:  21
Best f1_score score: 0.9006029906567836
Generation:  84%|████████▍ | 21/25 [16:28<05:06, 76.59s/it]Generation:  22
Best f1_score score: 0.9006029906567836
Generation:  88%|████████▊ | 22/25 [17:56<03:59, 79.89s/it]Generation:  23
Best f1_score score: 0.9006029906567836
Generation:  92%|█████████▏| 23/25 [18:15<02:03, 61.74s/it]Generation:  24
Best f1_score score: 0.9006029906567836
Generation:  96%|█████████▌| 24/25 [18:35<00:49, 49.29s/it]Generation:  25
Best f1_score score: 0.9006029906567836
Generation: 100%|██████████| 25/25 [18:56<00:00, 40.58s/it]Generation: 100%|██████████| 25/25 [19:00<00:00, 45.60s/it]
2024-10-23 18:11:45,528 - distributed.scheduler - ERROR - Removing worker 'tcp://127.0.0.1:43713' caused the cluster to lose scattered data, which can't be recovered: {'ndarray-96968d06874f2004bb3dc9eb91efaf48', 'ndarray-422b2c53f5e51e71a00dd009dc06b86a'} (stimulus_id='handle-worker-cleanup-1729732305.528025')
Fitted
Pipeline(steps=[('linearsvc', LinearSVC(C=96.2432460374741, loss='hinge'))])
score start
failed on 
../data/c/725/class_simple_MNAR_0.1_3
local variable 'this_auroc_score' referenced before assignment
Traceback (most recent call last):
  File "/common/ketrong/tpotexp/tpot2/ImputerExperiments/Locally_run_code/utils.py", line 615, in loop_through_tasks
    train_score = score(est, impute_train, y_train, r_or_c=r_or_c)
  File "/common/ketrong/tpotexp/tpot2/ImputerExperiments/Locally_run_code/utils.py", line 50, in score
    return { "auroc": this_auroc_score,
UnboundLocalError: local variable 'this_auroc_score' referenced before assignment

full run takes
0.3318373340368271
hours
DONE
