Run: 57
/cm/local/apps/slurm/var/spool/job925495/slurm_script: line 26: 
pip install -e tpot2
pip install -r tpot2/ImputerExperiments/requirements_.txt
: No such file or directory
RunStart
starting loops
../data/r/189/189.pkl
working on 
../data/r/189/reg_full_MNAR_0.01_3
0.274059534072876
running experiment 1/3 - Does large hyperparameter space improve reconstruction accuracy over simple
[I 2024-08-19 07:03:03,487] A new study created in memory with name: no-name-52cd2083-adf0-49e8-ba5b-a05de2f67659
running
running
running
running
running
running
running
running
running
running
running
running
running
running
running
running
[I 2024-08-19 07:03:04,056] Trial 10 finished with value: 0.34986789326469747 and parameters: {'model_name': 'SimpleImputer', 'strategy': 'mean'}. Best is trial 10 with value: 0.34986789326469747.
running
[I 2024-08-19 07:03:04,363] Trial 6 finished with value: 0.3498888855878405 and parameters: {'model_name': 'SimpleImputer', 'strategy': 'median'}. Best is trial 10 with value: 0.34986789326469747.
running
[I 2024-08-19 07:03:04,809] Trial 15 finished with value: 0.3499044248182545 and parameters: {'model_name': 'SimpleImputer', 'strategy': 'most_frequent'}. Best is trial 10 with value: 0.34986789326469747.
running
[I 2024-08-19 07:03:05,324] Trial 18 finished with value: 0.3499044248182545 and parameters: {'model_name': 'SimpleImputer', 'strategy': 'constant'}. Best is trial 10 with value: 0.34986789326469747.
running
[I 2024-08-19 07:03:08,665] Trial 7 finished with value: 0.3549505749268011 and parameters: {'model_name': 'KNNImputer', 'n_neighbors': 50, 'weights': 'distance'}. Best is trial 10 with value: 0.34986789326469747.
running
[I 2024-08-19 07:03:09,633] Trial 2 finished with value: 0.3503205062707311 and parameters: {'model_name': 'KNNImputer', 'n_neighbors': 849, 'weights': 'uniform'}. Best is trial 10 with value: 0.34986789326469747.
running
[I 2024-08-19 07:03:09,819] Trial 14 finished with value: 0.35023676459530756 and parameters: {'model_name': 'KNNImputer', 'n_neighbors': 1582, 'weights': 'uniform'}. Best is trial 10 with value: 0.34986789326469747.
running
[I 2024-08-19 07:03:09,962] Trial 5 finished with value: 0.35076286388760336 and parameters: {'model_name': 'KNNImputer', 'n_neighbors': 448, 'weights': 'distance'}. Best is trial 10 with value: 0.34986789326469747.
running
[I 2024-08-19 07:03:10,342] Trial 11 finished with value: 0.35031268784955893 and parameters: {'model_name': 'KNNImputer', 'n_neighbors': 861, 'weights': 'distance'}. Best is trial 10 with value: 0.34986789326469747.
running
[I 2024-08-19 07:03:10,560] Trial 21 finished with value: 0.34986789326469747 and parameters: {'model_name': 'SimpleImputer', 'strategy': 'mean'}. Best is trial 10 with value: 0.34986789326469747.
running
[I 2024-08-19 07:03:11,032] Trial 24 finished with value: 0.34986789326469747 and parameters: {'model_name': 'SimpleImputer', 'strategy': 'mean'}. Best is trial 10 with value: 0.34986789326469747.
running
[I 2024-08-19 07:03:12,978] Trial 13 finished with value: 0.34989659878671653 and parameters: {'model_name': 'KNNImputer', 'n_neighbors': 6246, 'weights': 'distance'}. Best is trial 10 with value: 0.34986789326469747.
running
[I 2024-08-19 07:03:16,519] Trial 16 finished with value: inf and parameters: {'model_name': 'GAIN', 'batch_size': 1, 'hint_rate': 0.987598723813896, 'alpha': 98, 'iterations': 4, 'learning_rate': 0.016865822963024236, 'p_miss': 0.02204122787727448}. Best is trial 10 with value: 0.34986789326469747.
running
[I 2024-08-19 07:03:16,685] Trial 23 finished with value: 0.3499019201699182 and parameters: {'model_name': 'KNNImputer', 'n_neighbors': 6839, 'weights': 'distance'}. Best is trial 10 with value: 0.34986789326469747.
running
[I 2024-08-19 07:03:16,868] Trial 20 finished with value: 0.34997077304283347 and parameters: {'model_name': 'KNNImputer', 'n_neighbors': 4170, 'weights': 'distance'}. Best is trial 10 with value: 0.34986789326469747.
running
[I 2024-08-19 07:03:24,936] Trial 25 finished with value: 0.5325222421816223 and parameters: {'model_name': 'GAIN', 'batch_size': 7, 'hint_rate': 0.561076383920202, 'alpha': 87, 'iterations': 6, 'learning_rate': 0.0021457714172484037, 'p_miss': 0.22058485710326986}. Best is trial 10 with value: 0.34986789326469747.
running
[I 2024-08-19 07:03:26,610] Trial 30 finished with value: 0.35010535663124664 and parameters: {'model_name': 'IterativeImputer', 'estimator': 'Ridge', 'initial_strategy': 'most_frequent', 'n_nearest_features': 7, 'imputation_order': 'ascending'}. Best is trial 10 with value: 0.34986789326469747.
running
[I 2024-08-19 07:03:27,073] Trial 32 finished with value: 0.34986789326469747 and parameters: {'model_name': 'SimpleImputer', 'strategy': 'mean'}. Best is trial 10 with value: 0.34986789326469747.
running
[I 2024-08-19 07:03:30,431] Trial 19 finished with value: 0.38193128897926626 and parameters: {'model_name': 'IterativeImputer', 'estimator': 'KNN', 'initial_strategy': 'mean', 'n_nearest_features': 1, 'imputation_order': 'random'}. Best is trial 10 with value: 0.34986789326469747.
running
[I 2024-08-19 07:03:30,894] Trial 34 finished with value: 0.34986789326469747 and parameters: {'model_name': 'SimpleImputer', 'strategy': 'mean'}. Best is trial 10 with value: 0.34986789326469747.
running
[I 2024-08-19 07:03:31,494] Trial 35 finished with value: 0.34986789326469747 and parameters: {'model_name': 'SimpleImputer', 'strategy': 'mean'}. Best is trial 10 with value: 0.34986789326469747.
running
[I 2024-08-19 07:03:32,066] Trial 36 finished with value: 0.34986789326469747 and parameters: {'model_name': 'SimpleImputer', 'strategy': 'mean'}. Best is trial 10 with value: 0.34986789326469747.
running
[I 2024-08-19 07:03:32,663] Trial 37 finished with value: 0.34986789326469747 and parameters: {'model_name': 'SimpleImputer', 'strategy': 'mean'}. Best is trial 10 with value: 0.34986789326469747.
running
[I 2024-08-19 07:03:33,178] Trial 38 finished with value: 0.34986789326469747 and parameters: {'model_name': 'SimpleImputer', 'strategy': 'mean'}. Best is trial 10 with value: 0.34986789326469747.
running
[I 2024-08-19 07:03:33,877] Trial 39 finished with value: 0.34986789326469747 and parameters: {'model_name': 'SimpleImputer', 'strategy': 'mean'}. Best is trial 10 with value: 0.34986789326469747.
running
[I 2024-08-19 07:03:36,919] Trial 3 finished with value: 0.383595963047496 and parameters: {'model_name': 'IterativeImputer', 'estimator': 'KNN', 'initial_strategy': 'most_frequent', 'n_nearest_features': 2, 'imputation_order': 'random'}. Best is trial 10 with value: 0.34986789326469747.
running
[I 2024-08-19 07:03:37,286] Trial 22 finished with value: 0.35009272875801944 and parameters: {'model_name': 'IterativeImputer', 'estimator': 'Ridge', 'initial_strategy': 'constant', 'n_nearest_features': 5, 'imputation_order': 'descending'}. Best is trial 10 with value: 0.34986789326469747.
running
[I 2024-08-19 07:03:49,630] Trial 1 finished with value: 0.5442920764458097 and parameters: {'model_name': 'GAIN', 'batch_size': 67, 'hint_rate': 0.9642756333054436, 'alpha': 30, 'iterations': 32, 'learning_rate': 0.006814882180417606, 'p_miss': 0.14698380367521524}. Best is trial 10 with value: 0.34986789326469747.
running
[I 2024-08-19 07:03:50,585] Trial 33 finished with value: 0.3783389626585039 and parameters: {'model_name': 'IterativeImputer', 'estimator': 'KNN', 'initial_strategy': 'median', 'n_nearest_features': 1, 'imputation_order': 'descending'}. Best is trial 10 with value: 0.34986789326469747.
running
[I 2024-08-19 07:03:50,971] Trial 43 finished with value: 0.3499044248182545 and parameters: {'model_name': 'SimpleImputer', 'strategy': 'most_frequent'}. Best is trial 10 with value: 0.34986789326469747.
running
[I 2024-08-19 07:03:55,804] Trial 31 finished with value: 0.3882411721832893 and parameters: {'model_name': 'IterativeImputer', 'estimator': 'KNN', 'initial_strategy': 'median', 'n_nearest_features': 3, 'imputation_order': 'ascending'}. Best is trial 10 with value: 0.34986789326469747.
running
[I 2024-08-19 07:03:56,261] Trial 46 finished with value: 0.34986789326469747 and parameters: {'model_name': 'SimpleImputer', 'strategy': 'mean'}. Best is trial 10 with value: 0.34986789326469747.
running
[I 2024-08-19 07:03:56,745] Trial 47 finished with value: 0.34986789326469747 and parameters: {'model_name': 'SimpleImputer', 'strategy': 'mean'}. Best is trial 10 with value: 0.34986789326469747.
running
[I 2024-08-19 07:03:57,291] Trial 48 finished with value: 0.34986789326469747 and parameters: {'model_name': 'SimpleImputer', 'strategy': 'mean'}. Best is trial 10 with value: 0.34986789326469747.
running
[I 2024-08-19 07:04:12,399] Trial 9 finished with value: 0.5393594611878376 and parameters: {'model_name': 'GAIN', 'batch_size': 4, 'hint_rate': 0.04642017958314174, 'alpha': 54, 'iterations': 70, 'learning_rate': 0.0148214934474348, 'p_miss': 0.1673653502009394}. Best is trial 10 with value: 0.34986789326469747.
running
[I 2024-08-19 07:04:12,831] Trial 28 finished with value: 0.3499344262370097 and parameters: {'model_name': 'IterativeImputer', 'estimator': 'Bayesian', 'initial_strategy': 'constant', 'n_nearest_features': 6, 'imputation_order': 'descending', 'sample_posterior': False}. Best is trial 10 with value: 0.34986789326469747.
running
[I 2024-08-19 07:04:13,091] Trial 50 finished with value: 0.3498888855878405 and parameters: {'model_name': 'SimpleImputer', 'strategy': 'median'}. Best is trial 10 with value: 0.34986789326469747.
running
[I 2024-08-19 07:04:13,522] Trial 52 finished with value: 0.3499044248182545 and parameters: {'model_name': 'SimpleImputer', 'strategy': 'constant'}. Best is trial 10 with value: 0.34986789326469747.
running
[I 2024-08-19 07:04:13,832] Trial 51 finished with value: 0.3498888855878405 and parameters: {'model_name': 'SimpleImputer', 'strategy': 'median'}. Best is trial 10 with value: 0.34986789326469747.
running
[I 2024-08-19 07:04:14,284] Trial 53 finished with value: 0.34986789326469747 and parameters: {'model_name': 'SimpleImputer', 'strategy': 'mean'}. Best is trial 10 with value: 0.34986789326469747.
running
[I 2024-08-19 07:04:15,076] Trial 4 finished with value: 0.3499538899741045 and parameters: {'model_name': 'IterativeImputer', 'estimator': 'Bayesian', 'initial_strategy': 'median', 'n_nearest_features': 5, 'imputation_order': 'random', 'sample_posterior': False}. Best is trial 10 with value: 0.34986789326469747.
running
[I 2024-08-19 07:04:15,512] Trial 56 finished with value: 0.34986789326469747 and parameters: {'model_name': 'SimpleImputer', 'strategy': 'mean'}. Best is trial 10 with value: 0.34986789326469747.
running
[I 2024-08-19 07:04:15,977] Trial 57 finished with value: 0.34986789326469747 and parameters: {'model_name': 'SimpleImputer', 'strategy': 'mean'}. Best is trial 10 with value: 0.34986789326469747.
running
[I 2024-08-19 07:04:16,510] Trial 58 finished with value: 0.34986789326469747 and parameters: {'model_name': 'SimpleImputer', 'strategy': 'mean'}. Best is trial 10 with value: 0.34986789326469747.
running
[I 2024-08-19 07:04:16,932] Trial 8 finished with value: 0.3499603163143542 and parameters: {'model_name': 'IterativeImputer', 'estimator': 'Bayesian', 'initial_strategy': 'median', 'n_nearest_features': 5, 'imputation_order': 'arabic', 'sample_posterior': False}. Best is trial 10 with value: 0.34986789326469747.
running
[I 2024-08-19 07:04:29,878] Trial 0 finished with value: 0.4920831634736148 and parameters: {'model_name': 'IterativeImputer', 'estimator': 'Bayesian', 'initial_strategy': 'most_frequent', 'n_nearest_features': 6, 'imputation_order': 'descending', 'sample_posterior': True}. Best is trial 10 with value: 0.34986789326469747.
running
[I 2024-08-19 07:04:36,524] Trial 29 finished with value: 0.4990218844031625 and parameters: {'model_name': 'IterativeImputer', 'estimator': 'Bayesian', 'initial_strategy': 'median', 'n_nearest_features': 5, 'imputation_order': 'random', 'sample_posterior': True}. Best is trial 10 with value: 0.34986789326469747.
running
[I 2024-08-19 07:24:50,219] Trial 17 finished with value: inf and parameters: {'model_name': 'GAIN', 'batch_size': 2, 'hint_rate': 0.7064677704911376, 'alpha': 63, 'iterations': 6602, 'learning_rate': 0.001796847475459001, 'p_miss': 0.01871407432722543}. Best is trial 10 with value: 0.34986789326469747.
running
[I 2024-08-19 07:24:50,834] Trial 63 finished with value: 0.34986789326469747 and parameters: {'model_name': 'SimpleImputer', 'strategy': 'mean'}. Best is trial 10 with value: 0.34986789326469747.
running
[I 2024-08-19 07:24:51,362] Trial 64 finished with value: 0.34986789326469747 and parameters: {'model_name': 'SimpleImputer', 'strategy': 'mean'}. Best is trial 10 with value: 0.34986789326469747.
running
[I 2024-08-19 08:11:32,324] Trial 27 finished with value: inf and parameters: {'model_name': 'GAIN', 'batch_size': 8, 'hint_rate': 0.8738264407141534, 'alpha': 26, 'iterations': 2406, 'learning_rate': 0.005229283137215577, 'p_miss': 0.15843680465553667}. Best is trial 10 with value: 0.34986789326469747.
running
[I 2024-08-19 08:11:32,738] Trial 66 finished with value: 0.34986789326469747 and parameters: {'model_name': 'SimpleImputer', 'strategy': 'mean'}. Best is trial 10 with value: 0.34986789326469747.
running
[I 2024-08-19 08:11:33,181] Trial 67 finished with value: 0.34986789326469747 and parameters: {'model_name': 'SimpleImputer', 'strategy': 'mean'}. Best is trial 10 with value: 0.34986789326469747.
running
[I 2024-08-19 08:11:33,601] Trial 68 finished with value: 0.34986789326469747 and parameters: {'model_name': 'SimpleImputer', 'strategy': 'mean'}. Best is trial 10 with value: 0.34986789326469747.
running
[I 2024-08-19 08:11:34,034] Trial 69 finished with value: 0.34986789326469747 and parameters: {'model_name': 'SimpleImputer', 'strategy': 'mean'}. Best is trial 10 with value: 0.34986789326469747.
running
[I 2024-08-19 08:11:34,716] Trial 70 finished with value: 0.34986789326469747 and parameters: {'model_name': 'SimpleImputer', 'strategy': 'mean'}. Best is trial 10 with value: 0.34986789326469747.
running
[I 2024-08-19 08:11:35,086] Trial 71 finished with value: 0.3499044248182545 and parameters: {'model_name': 'SimpleImputer', 'strategy': 'constant'}. Best is trial 10 with value: 0.34986789326469747.
running
[I 2024-08-19 08:12:05,703] Trial 12 finished with value: 0.3601284564121057 and parameters: {'model_name': 'IterativeImputer', 'estimator': 'RFR', 'initial_strategy': 'most_frequent', 'n_nearest_features': 5, 'imputation_order': 'ascending'}. Best is trial 10 with value: 0.34986789326469747.
running
[I 2024-08-19 08:12:12,506] Trial 73 finished with value: 0.5300430920915213 and parameters: {'model_name': 'GAIN', 'batch_size': 630, 'hint_rate': 0.13348373047531553, 'alpha': 1, 'iterations': 1, 'learning_rate': 0.00012089141638564201, 'p_miss': 0.29525068165024554}. Best is trial 10 with value: 0.34986789326469747.
running
[I 2024-08-19 08:12:13,491] Trial 74 finished with value: 0.3499044248182545 and parameters: {'model_name': 'SimpleImputer', 'strategy': 'most_frequent'}. Best is trial 10 with value: 0.34986789326469747.
running
[I 2024-08-19 08:12:17,975] Trial 75 finished with value: 0.3499067607613834 and parameters: {'model_name': 'KNNImputer', 'n_neighbors': 3101, 'weights': 'uniform'}. Best is trial 10 with value: 0.34986789326469747.
running
[I 2024-08-19 08:12:18,560] Trial 76 finished with value: 0.34986789326469747 and parameters: {'model_name': 'SimpleImputer', 'strategy': 'mean'}. Best is trial 10 with value: 0.34986789326469747.
running
[I 2024-08-19 08:12:19,082] Trial 77 finished with value: 0.34986789326469747 and parameters: {'model_name': 'SimpleImputer', 'strategy': 'mean'}. Best is trial 10 with value: 0.34986789326469747.
running
[I 2024-08-19 08:12:19,673] Trial 78 finished with value: 0.34986789326469747 and parameters: {'model_name': 'SimpleImputer', 'strategy': 'mean'}. Best is trial 10 with value: 0.34986789326469747.
running
[I 2024-08-19 08:12:20,144] Trial 79 finished with value: 0.34986789326469747 and parameters: {'model_name': 'SimpleImputer', 'strategy': 'mean'}. Best is trial 10 with value: 0.34986789326469747.
running
[I 2024-08-19 08:12:20,870] Trial 80 finished with value: 0.3498888855878405 and parameters: {'model_name': 'SimpleImputer', 'strategy': 'median'}. Best is trial 10 with value: 0.34986789326469747.
running
[I 2024-08-19 08:12:21,575] Trial 81 finished with value: 0.34986789326469747 and parameters: {'model_name': 'SimpleImputer', 'strategy': 'mean'}. Best is trial 10 with value: 0.34986789326469747.
running
[I 2024-08-19 08:24:03,845] Trial 26 finished with value: 0.35663685417254654 and parameters: {'model_name': 'IterativeImputer', 'estimator': 'RFR', 'initial_strategy': 'constant', 'n_nearest_features': 8, 'imputation_order': 'roman'}. Best is trial 10 with value: 0.34986789326469747.
running
[I 2024-08-19 08:36:49,578] Trial 72 finished with value: 0.5305965929115173 and parameters: {'model_name': 'GAIN', 'batch_size': 970, 'hint_rate': 0.10804923159765384, 'alpha': 0, 'iterations': 554, 'learning_rate': 0.00010675248100046274, 'p_miss': 0.2965508737340872}. Best is trial 10 with value: 0.34986789326469747.
running
[I 2024-08-19 08:36:53,362] Trial 84 finished with value: 0.3498758984934368 and parameters: {'model_name': 'KNNImputer', 'n_neighbors': 5023, 'weights': 'uniform'}. Best is trial 10 with value: 0.34986789326469747.
running
[I 2024-08-19 08:36:54,402] Trial 85 finished with value: 0.3499044248182545 and parameters: {'model_name': 'SimpleImputer', 'strategy': 'most_frequent'}. Best is trial 10 with value: 0.34986789326469747.
running
[I 2024-08-19 08:36:54,821] Trial 86 finished with value: 0.34986789326469747 and parameters: {'model_name': 'SimpleImputer', 'strategy': 'mean'}. Best is trial 10 with value: 0.34986789326469747.
running
[I 2024-08-19 08:36:55,230] Trial 87 finished with value: 0.34986789326469747 and parameters: {'model_name': 'SimpleImputer', 'strategy': 'mean'}. Best is trial 10 with value: 0.34986789326469747.
running
[I 2024-08-19 08:36:55,668] Trial 88 finished with value: 0.34986789326469747 and parameters: {'model_name': 'SimpleImputer', 'strategy': 'mean'}. Best is trial 10 with value: 0.34986789326469747.
running
[I 2024-08-19 08:36:56,022] Trial 89 finished with value: 0.34986789326469747 and parameters: {'model_name': 'SimpleImputer', 'strategy': 'mean'}. Best is trial 10 with value: 0.34986789326469747.
running
[I 2024-08-19 08:36:56,451] Trial 90 finished with value: 0.34986789326469747 and parameters: {'model_name': 'SimpleImputer', 'strategy': 'mean'}. Best is trial 10 with value: 0.34986789326469747.
running
[I 2024-08-19 08:36:56,773] Trial 91 finished with value: 0.3499044248182545 and parameters: {'model_name': 'SimpleImputer', 'strategy': 'constant'}. Best is trial 10 with value: 0.34986789326469747.
running
[I 2024-08-19 08:36:57,206] Trial 92 finished with value: 0.34986789326469747 and parameters: {'model_name': 'SimpleImputer', 'strategy': 'mean'}. Best is trial 10 with value: 0.34986789326469747.
running
[I 2024-08-19 08:36:57,628] Trial 93 finished with value: 0.34986789326469747 and parameters: {'model_name': 'SimpleImputer', 'strategy': 'mean'}. Best is trial 10 with value: 0.34986789326469747.
running
[I 2024-08-19 08:36:58,560] Trial 94 finished with value: 0.3498888855878405 and parameters: {'model_name': 'SimpleImputer', 'strategy': 'median'}. Best is trial 10 with value: 0.34986789326469747.
running
[I 2024-08-19 08:39:50,485] Trial 82 finished with value: 0.5601880430523087 and parameters: {'model_name': 'GAIN', 'batch_size': 75, 'hint_rate': 0.2970918272894466, 'alpha': 1, 'iterations': 673, 'learning_rate': 0.09365889804564617, 'p_miss': 0.10413642772099807}. Best is trial 10 with value: 0.34986789326469747.
running
[I 2024-08-19 08:39:51,079] Trial 96 finished with value: 0.34986789326469747 and parameters: {'model_name': 'SimpleImputer', 'strategy': 'mean'}. Best is trial 10 with value: 0.34986789326469747.
running
[I 2024-08-19 08:39:51,634] Trial 97 finished with value: 0.34986789326469747 and parameters: {'model_name': 'SimpleImputer', 'strategy': 'mean'}. Best is trial 10 with value: 0.34986789326469747.
running
[I 2024-08-19 08:39:52,192] Trial 98 finished with value: 0.34986789326469747 and parameters: {'model_name': 'SimpleImputer', 'strategy': 'mean'}. Best is trial 10 with value: 0.34986789326469747.
running
[I 2024-08-19 08:39:52,694] Trial 99 finished with value: 0.34986789326469747 and parameters: {'model_name': 'SimpleImputer', 'strategy': 'mean'}. Best is trial 10 with value: 0.34986789326469747.
running
[I 2024-08-19 08:39:53,956] Trial 100 finished with value: 0.3499044248182545 and parameters: {'model_name': 'SimpleImputer', 'strategy': 'most_frequent'}. Best is trial 10 with value: 0.34986789326469747.
running
[I 2024-08-19 08:39:54,549] Trial 101 finished with value: 0.34986789326469747 and parameters: {'model_name': 'SimpleImputer', 'strategy': 'mean'}. Best is trial 10 with value: 0.34986789326469747.
running
[I 2024-08-19 08:39:58,718] Trial 102 finished with value: 0.34997132349223786 and parameters: {'model_name': 'KNNImputer', 'n_neighbors': 2285, 'weights': 'uniform'}. Best is trial 10 with value: 0.34986789326469747.
running
[I 2024-08-19 08:39:59,245] Trial 103 finished with value: 0.34986789326469747 and parameters: {'model_name': 'SimpleImputer', 'strategy': 'mean'}. Best is trial 10 with value: 0.34986789326469747.
running
[I 2024-08-19 08:39:59,811] Trial 104 finished with value: 0.34986789326469747 and parameters: {'model_name': 'SimpleImputer', 'strategy': 'mean'}. Best is trial 10 with value: 0.34986789326469747.
running
[I 2024-08-19 08:40:00,340] Trial 105 finished with value: 0.34986789326469747 and parameters: {'model_name': 'SimpleImputer', 'strategy': 'mean'}. Best is trial 10 with value: 0.34986789326469747.
running
