Run: 9
/cm/local/apps/slurm/var/spool/job967518/slurm_script: line 26: 
pip install -e tpot2
pip install -r tpot2/ImputerExperiments/requirements_.txt
: No such file or directory
RunStart
Version 0.1.7a0 of tpot2 is outdated. Version 0.1.8a0 was released 4 days ago.
starting loops
../data/r/198/198.pkl
working on 
../data/r/198/reg_full_MNAR_0.01_1
1.8042078018188477
running experiment 1/3 - Does large hyperparameter space improve reconstruction accuracy over simple
[I 2024-09-22 10:09:14,858] A new study created in memory with name: no-name-68802c34-d4c2-4fd7-a4bd-82b19de7b447
running
running
running
running
running
running
running
running
running
running
running
running
running
running
running
[I 2024-09-22 10:09:15,135] Trial 11 finished with value: 0.1428107407170946 and parameters: {'model_name': 'SimpleImputer', 'strategy': 'mean'}. Best is trial 11 with value: 0.1428107407170946.
running
running
[I 2024-09-22 10:09:15,285] Trial 7 finished with value: 0.1427272005741961 and parameters: {'model_name': 'SimpleImputer', 'strategy': 'median'}. Best is trial 7 with value: 0.1427272005741961.
[I 2024-09-22 10:09:15,391] Trial 5 finished with value: 0.1427272005741961 and parameters: {'model_name': 'SimpleImputer', 'strategy': 'median'}. Best is trial 7 with value: 0.1427272005741961.
running
running
[I 2024-09-22 10:09:18,366] Trial 6 finished with value: 0.15898082700798968 and parameters: {'model_name': 'KNNImputer', 'n_neighbors': 27, 'weights': 'distance'}. Best is trial 7 with value: 0.1427272005741961.
running
[I 2024-09-22 10:09:18,845] Trial 0 finished with value: 0.13636013851165904 and parameters: {'model_name': 'KNNImputer', 'n_neighbors': 1758, 'weights': 'uniform'}. Best is trial 0 with value: 0.13636013851165904.
[I 2024-09-22 10:09:18,960] Trial 12 finished with value: 0.15738475529133505 and parameters: {'model_name': 'KNNImputer', 'n_neighbors': 65, 'weights': 'distance'}. Best is trial 0 with value: 0.13636013851165904.
running
running
[I 2024-09-22 10:09:19,134] Trial 13 finished with value: 0.1316992340328043 and parameters: {'model_name': 'KNNImputer', 'n_neighbors': 200, 'weights': 'uniform'}. Best is trial 13 with value: 0.1316992340328043.
running
[I 2024-09-22 10:09:19,342] Trial 16 finished with value: 0.13620667686440685 and parameters: {'model_name': 'KNNImputer', 'n_neighbors': 1681, 'weights': 'uniform'}. Best is trial 13 with value: 0.1316992340328043.
[I 2024-09-22 10:09:19,461] Trial 2 finished with value: 0.13571395344566506 and parameters: {'model_name': 'KNNImputer', 'n_neighbors': 1464, 'weights': 'uniform'}. Best is trial 13 with value: 0.1316992340328043.
running
running
[I 2024-09-22 10:09:19,724] Trial 3 finished with value: 0.1589192449906168 and parameters: {'model_name': 'KNNImputer', 'n_neighbors': 1261, 'weights': 'distance'}. Best is trial 13 with value: 0.1316992340328043.
running
[I 2024-09-22 10:09:19,972] Trial 8 finished with value: 0.13653583215111123 and parameters: {'model_name': 'KNNImputer', 'n_neighbors': 1844, 'weights': 'uniform'}. Best is trial 13 with value: 0.1316992340328043.
running
[I 2024-09-22 10:09:20,740] Trial 14 finished with value: 0.13873703227268172 and parameters: {'model_name': 'IterativeImputer', 'estimator': 'Bayesian', 'initial_strategy': 'most_frequent', 'n_nearest_features': 1, 'imputation_order': 'ascending', 'sample_posterior': False}. Best is trial 13 with value: 0.1316992340328043.
running
[I 2024-09-22 10:09:20,891] Trial 1 finished with value: 0.1614311257988148 and parameters: {'model_name': 'KNNImputer', 'n_neighbors': 3882, 'weights': 'distance'}. Best is trial 13 with value: 0.1316992340328043.
running
[I 2024-09-22 10:09:21,043] Trial 4 finished with value: 0.16021678060604533 and parameters: {'model_name': 'KNNImputer', 'n_neighbors': 2467, 'weights': 'distance'}. Best is trial 13 with value: 0.1316992340328043.
[I 2024-09-22 10:09:21,171] Trial 17 finished with value: 0.16268200751222336 and parameters: {'model_name': 'KNNImputer', 'n_neighbors': 7431, 'weights': 'distance'}. Best is trial 13 with value: 0.1316992340328043.
running
running
[I 2024-09-22 10:09:22,098] Trial 20 finished with value: 0.13680628093200595 and parameters: {'model_name': 'IterativeImputer', 'estimator': 'Ridge', 'initial_strategy': 'constant', 'n_nearest_features': 2, 'imputation_order': 'arabic'}. Best is trial 13 with value: 0.1316992340328043.
[I 2024-09-22 10:09:22,220] Trial 21 finished with value: 0.1360573764248426 and parameters: {'model_name': 'IterativeImputer', 'estimator': 'Ridge', 'initial_strategy': 'mean', 'n_nearest_features': 2, 'imputation_order': 'descending'}. Best is trial 13 with value: 0.1316992340328043.
running
running
[I 2024-09-22 10:09:22,423] Trial 18 finished with value: 0.1367710430121804 and parameters: {'model_name': 'IterativeImputer', 'estimator': 'Bayesian', 'initial_strategy': 'most_frequent', 'n_nearest_features': 2, 'imputation_order': 'random', 'sample_posterior': False}. Best is trial 13 with value: 0.1316992340328043.
running
[I 2024-09-22 10:10:46,968] Trial 9 finished with value: 0.1651279368808634 and parameters: {'model_name': 'VAE', 'batch_size': 23, 'iterations': 1, 'learning_rate': 0.0010864152648037233, 'p_miss': 0.05100926769006338}. Best is trial 13 with value: 0.1316992340328043.
running
[I 2024-09-22 10:10:47,264] Trial 32 finished with value: 0.41838311722155996 and parameters: {'model_name': 'GAIN', 'batch_size': 862, 'hint_rate': 0.5960447736547124, 'alpha': 87, 'iterations': 1, 'learning_rate': 0.01852902177726215, 'p_miss': 0.1111950041755985}. Best is trial 13 with value: 0.1316992340328043.
running
[I 2024-09-22 10:10:47,816] Trial 10 finished with value: 0.4136761700329603 and parameters: {'model_name': 'GAIN', 'batch_size': 110, 'hint_rate': 0.5825448842288831, 'alpha': 37, 'iterations': 2, 'learning_rate': 0.039074198329893506, 'p_miss': 0.24439294026631916}. Best is trial 13 with value: 0.1316992340328043.
running
[I 2024-09-22 10:10:55,260] Trial 29 finished with value: 0.16062783632848365 and parameters: {'model_name': 'VAE', 'batch_size': 2, 'iterations': 4, 'learning_rate': 0.01359832480612058, 'p_miss': 0.24342357607532042}. Best is trial 13 with value: 0.1316992340328043.
running
[I 2024-09-22 10:10:55,972] Trial 24 finished with value: 0.4183441239790503 and parameters: {'model_name': 'GAIN', 'batch_size': 101, 'hint_rate': 0.7077220124054644, 'alpha': 61, 'iterations': 9, 'learning_rate': 0.00013792101445595103, 'p_miss': 0.23036866214090132}. Best is trial 13 with value: 0.1316992340328043.
running
[I 2024-09-22 10:10:56,567] Trial 23 finished with value: 0.16787953752630397 and parameters: {'model_name': 'VAE', 'batch_size': 456, 'iterations': 4, 'learning_rate': 0.0015847077370224596, 'p_miss': 0.2725407371496591}. Best is trial 13 with value: 0.1316992340328043.
running
[I 2024-09-22 10:10:56,975] Trial 26 finished with value: 0.42483330657942203 and parameters: {'model_name': 'GAIN', 'batch_size': 34, 'hint_rate': 0.6432452354809932, 'alpha': 60, 'iterations': 11, 'learning_rate': 0.0004240649056912964, 'p_miss': 0.023981440698627093}. Best is trial 13 with value: 0.1316992340328043.
running
[I 2024-09-22 10:10:59,605] Trial 37 finished with value: 0.13270690341272048 and parameters: {'model_name': 'IterativeImputer', 'estimator': 'Ridge', 'initial_strategy': 'mean', 'n_nearest_features': 6, 'imputation_order': 'descending'}. Best is trial 13 with value: 0.1316992340328043.
running
[I 2024-09-22 10:11:00,573] Trial 39 finished with value: 0.13270690341272048 and parameters: {'model_name': 'IterativeImputer', 'estimator': 'Ridge', 'initial_strategy': 'mean', 'n_nearest_features': 6, 'imputation_order': 'descending'}. Best is trial 13 with value: 0.1316992340328043.
running
[I 2024-09-22 10:11:01,296] Trial 38 finished with value: 0.13270690341272048 and parameters: {'model_name': 'IterativeImputer', 'estimator': 'Ridge', 'initial_strategy': 'mean', 'n_nearest_features': 5, 'imputation_order': 'descending'}. Best is trial 13 with value: 0.1316992340328043.
running
[I 2024-09-22 10:11:02,601] Trial 40 finished with value: 0.13270690341272048 and parameters: {'model_name': 'IterativeImputer', 'estimator': 'Ridge', 'initial_strategy': 'mean', 'n_nearest_features': 6, 'imputation_order': 'descending'}. Best is trial 13 with value: 0.1316992340328043.
running
[I 2024-09-22 10:11:05,759] Trial 22 finished with value: 0.146540197439135 and parameters: {'model_name': 'VAE', 'batch_size': 105, 'iterations': 9, 'learning_rate': 0.07710122689039194, 'p_miss': 0.08784003223901987}. Best is trial 13 with value: 0.1316992340328043.
running
[I 2024-09-22 10:11:17,680] Trial 42 finished with value: 0.14021717890120636 and parameters: {'model_name': 'IterativeImputer', 'estimator': 'KNN', 'initial_strategy': 'mean', 'n_nearest_features': 6, 'imputation_order': 'descending'}. Best is trial 13 with value: 0.1316992340328043.
running
[I 2024-09-22 10:11:17,904] Trial 41 finished with value: 0.14021717890120636 and parameters: {'model_name': 'IterativeImputer', 'estimator': 'KNN', 'initial_strategy': 'mean', 'n_nearest_features': 6, 'imputation_order': 'descending'}. Best is trial 13 with value: 0.1316992340328043.
running
[I 2024-09-22 10:11:19,231] Trial 44 finished with value: 0.14098043352996795 and parameters: {'model_name': 'IterativeImputer', 'estimator': 'KNN', 'initial_strategy': 'median', 'n_nearest_features': 5, 'imputation_order': 'roman'}. Best is trial 13 with value: 0.1316992340328043.
running
[I 2024-09-22 10:11:22,513] Trial 45 finished with value: 0.14098043352996795 and parameters: {'model_name': 'IterativeImputer', 'estimator': 'KNN', 'initial_strategy': 'median', 'n_nearest_features': 5, 'imputation_order': 'roman'}. Best is trial 13 with value: 0.1316992340328043.
running
[I 2024-09-22 10:11:25,759] Trial 28 finished with value: 0.16247333424659352 and parameters: {'model_name': 'VAE', 'batch_size': 4, 'iterations': 22, 'learning_rate': 0.05587035506966107, 'p_miss': 0.13928490909198873}. Best is trial 13 with value: 0.1316992340328043.
running
[I 2024-09-22 10:11:26,453] Trial 15 finished with value: 0.4190126986705714 and parameters: {'model_name': 'GAIN', 'batch_size': 43, 'hint_rate': 0.568709897076666, 'alpha': 28, 'iterations': 46, 'learning_rate': 0.001087844585838141, 'p_miss': 0.16105260749276348}. Best is trial 13 with value: 0.1316992340328043.
running
[I 2024-09-22 10:11:33,110] Trial 49 finished with value: 0.1331073668882979 and parameters: {'model_name': 'IterativeImputer', 'estimator': 'Ridge', 'initial_strategy': 'mean', 'n_nearest_features': 4, 'imputation_order': 'descending'}. Best is trial 13 with value: 0.1316992340328043.
running
[I 2024-09-22 10:11:37,219] Trial 50 finished with value: 0.1331073668882979 and parameters: {'model_name': 'IterativeImputer', 'estimator': 'Ridge', 'initial_strategy': 'mean', 'n_nearest_features': 4, 'imputation_order': 'descending'}. Best is trial 13 with value: 0.1316992340328043.
running
[I 2024-09-22 10:11:38,408] Trial 51 finished with value: 0.1331073668882979 and parameters: {'model_name': 'IterativeImputer', 'estimator': 'Ridge', 'initial_strategy': 'mean', 'n_nearest_features': 4, 'imputation_order': 'descending'}. Best is trial 13 with value: 0.1316992340328043.
running
[I 2024-09-22 10:11:38,956] Trial 54 finished with value: 0.2658062162069864 and parameters: {'model_name': 'SimpleImputer', 'strategy': 'most_frequent'}. Best is trial 13 with value: 0.1316992340328043.
running
[I 2024-09-22 10:11:43,166] Trial 55 finished with value: 0.14142725947653373 and parameters: {'model_name': 'KNNImputer', 'n_neighbors': 4757, 'weights': 'uniform'}. Best is trial 13 with value: 0.1316992340328043.
running
[I 2024-09-22 10:16:56,528] Trial 33 finished with value: 0.14681379923346824 and parameters: {'model_name': 'VAE', 'batch_size': 161, 'iterations': 111, 'learning_rate': 0.02105014787885053, 'p_miss': 0.028438993146874703}. Best is trial 13 with value: 0.1316992340328043.
running
[I 2024-09-22 10:21:12,621] Trial 25 finished with value: 0.42600871156311737 and parameters: {'model_name': 'GAIN', 'batch_size': 258, 'hint_rate': 0.5367651474526342, 'alpha': 42, 'iterations': 442, 'learning_rate': 0.0009267944134554777, 'p_miss': 0.1409282926101232}. Best is trial 13 with value: 0.1316992340328043.
running
[I 2024-09-22 10:27:45,888] Trial 48 finished with value: 0.1387777841771643 and parameters: {'model_name': 'IterativeImputer', 'estimator': 'RFR', 'initial_strategy': 'mean', 'n_nearest_features': 4, 'imputation_order': 'descending'}. Best is trial 13 with value: 0.1316992340328043.
running
[I 2024-09-22 10:27:53,255] Trial 59 finished with value: 0.13270690341272048 and parameters: {'model_name': 'IterativeImputer', 'estimator': 'Ridge', 'initial_strategy': 'mean', 'n_nearest_features': 6, 'imputation_order': 'descending'}. Best is trial 13 with value: 0.1316992340328043.
running
[I 2024-09-22 10:28:00,716] Trial 60 finished with value: 0.13270690341272048 and parameters: {'model_name': 'IterativeImputer', 'estimator': 'Ridge', 'initial_strategy': 'mean', 'n_nearest_features': 5, 'imputation_order': 'descending'}. Best is trial 13 with value: 0.1316992340328043.
running
[I 2024-09-22 10:28:08,722] Trial 61 finished with value: 0.13270698877175616 and parameters: {'model_name': 'IterativeImputer', 'estimator': 'Ridge', 'initial_strategy': 'constant', 'n_nearest_features': 6, 'imputation_order': 'arabic'}. Best is trial 13 with value: 0.1316992340328043.
running
[I 2024-09-22 10:28:13,291] Trial 62 finished with value: 0.1428107407170946 and parameters: {'model_name': 'KNNImputer', 'n_neighbors': 6745, 'weights': 'uniform'}. Best is trial 13 with value: 0.1316992340328043.
running
[I 2024-09-22 10:28:13,626] Trial 63 finished with value: 0.5364276143163089 and parameters: {'model_name': 'SimpleImputer', 'strategy': 'constant'}. Best is trial 13 with value: 0.1316992340328043.
running
[I 2024-09-22 10:28:21,601] Trial 64 finished with value: 0.1327068721896851 and parameters: {'model_name': 'IterativeImputer', 'estimator': 'Ridge', 'initial_strategy': 'mean', 'n_nearest_features': 6, 'imputation_order': 'ascending'}. Best is trial 13 with value: 0.1316992340328043.
running
[I 2024-09-22 10:28:26,718] Trial 65 finished with value: 0.1424018309917901 and parameters: {'model_name': 'KNNImputer', 'n_neighbors': 5451, 'weights': 'uniform'}. Best is trial 13 with value: 0.1316992340328043.
running
[I 2024-09-22 10:28:34,070] Trial 66 finished with value: 0.1327068721896851 and parameters: {'model_name': 'IterativeImputer', 'estimator': 'Ridge', 'initial_strategy': 'mean', 'n_nearest_features': 6, 'imputation_order': 'ascending'}. Best is trial 13 with value: 0.1316992340328043.
running
[I 2024-09-22 10:28:43,366] Trial 67 finished with value: 0.1327068721896851 and parameters: {'model_name': 'IterativeImputer', 'estimator': 'Ridge', 'initial_strategy': 'mean', 'n_nearest_features': 5, 'imputation_order': 'ascending'}. Best is trial 13 with value: 0.1316992340328043.
running
[I 2024-09-22 10:28:51,201] Trial 68 finished with value: 0.1327068721896851 and parameters: {'model_name': 'IterativeImputer', 'estimator': 'Ridge', 'initial_strategy': 'mean', 'n_nearest_features': 5, 'imputation_order': 'ascending'}. Best is trial 13 with value: 0.1316992340328043.
running
[I 2024-09-22 10:29:40,767] Trial 43 finished with value: 0.13506397814611978 and parameters: {'model_name': 'IterativeImputer', 'estimator': 'RFR', 'initial_strategy': 'median', 'n_nearest_features': 6, 'imputation_order': 'descending'}. Best is trial 13 with value: 0.1316992340328043.
running
[I 2024-09-22 10:29:49,201] Trial 70 finished with value: 0.1327068721896851 and parameters: {'model_name': 'IterativeImputer', 'estimator': 'Ridge', 'initial_strategy': 'mean', 'n_nearest_features': 5, 'imputation_order': 'ascending'}. Best is trial 13 with value: 0.1316992340328043.
running
[I 2024-09-22 10:29:53,519] Trial 71 finished with value: 0.1386887992495216 and parameters: {'model_name': 'KNNImputer', 'n_neighbors': 3039, 'weights': 'uniform'}. Best is trial 13 with value: 0.1316992340328043.
running
[I 2024-09-22 10:29:57,310] Trial 56 finished with value: 0.13554678080837296 and parameters: {'model_name': 'IterativeImputer', 'estimator': 'RFR', 'initial_strategy': 'mean', 'n_nearest_features': 6, 'imputation_order': 'descending'}. Best is trial 13 with value: 0.1316992340328043.
running
[I 2024-09-22 10:29:57,937] Trial 73 finished with value: 0.2658062162069864 and parameters: {'model_name': 'SimpleImputer', 'strategy': 'most_frequent'}. Best is trial 13 with value: 0.1316992340328043.
running
[I 2024-09-22 10:29:58,777] Trial 53 finished with value: 0.13496047973769304 and parameters: {'model_name': 'IterativeImputer', 'estimator': 'RFR', 'initial_strategy': 'mean', 'n_nearest_features': 5, 'imputation_order': 'descending'}. Best is trial 13 with value: 0.1316992340328043.
running
[I 2024-09-22 10:30:02,035] Trial 72 finished with value: 0.1327068721896851 and parameters: {'model_name': 'IterativeImputer', 'estimator': 'Ridge', 'initial_strategy': 'mean', 'n_nearest_features': 5, 'imputation_order': 'ascending'}. Best is trial 13 with value: 0.1316992340328043.
running
[I 2024-09-22 10:30:04,385] Trial 75 finished with value: 0.1397562409063331 and parameters: {'model_name': 'KNNImputer', 'n_neighbors': 3685, 'weights': 'uniform'}. Best is trial 13 with value: 0.1316992340328043.
running
[I 2024-09-22 10:30:05,742] Trial 74 finished with value: 0.1327068721896851 and parameters: {'model_name': 'IterativeImputer', 'estimator': 'Ridge', 'initial_strategy': 'mean', 'n_nearest_features': 5, 'imputation_order': 'ascending'}. Best is trial 13 with value: 0.1316992340328043.
running
[I 2024-09-22 10:30:09,072] Trial 76 finished with value: 0.1327068721896851 and parameters: {'model_name': 'IterativeImputer', 'estimator': 'Ridge', 'initial_strategy': 'mean', 'n_nearest_features': 5, 'imputation_order': 'ascending'}. Best is trial 13 with value: 0.1316992340328043.
running
[I 2024-09-22 10:30:09,351] Trial 47 finished with value: 0.1355583815568891 and parameters: {'model_name': 'IterativeImputer', 'estimator': 'RFR', 'initial_strategy': 'median', 'n_nearest_features': 5, 'imputation_order': 'roman'}. Best is trial 13 with value: 0.1316992340328043.
running
[I 2024-09-22 10:30:10,952] Trial 77 finished with value: 0.1327068721896851 and parameters: {'model_name': 'IterativeImputer', 'estimator': 'Ridge', 'initial_strategy': 'mean', 'n_nearest_features': 5, 'imputation_order': 'ascending'}. Best is trial 13 with value: 0.1316992340328043.
running
[I 2024-09-22 10:30:12,298] Trial 78 finished with value: 0.1327068721896851 and parameters: {'model_name': 'IterativeImputer', 'estimator': 'Ridge', 'initial_strategy': 'mean', 'n_nearest_features': 5, 'imputation_order': 'ascending'}. Best is trial 13 with value: 0.1316992340328043.
running
[I 2024-09-22 10:30:14,211] Trial 46 finished with value: 0.13566607872026462 and parameters: {'model_name': 'IterativeImputer', 'estimator': 'RFR', 'initial_strategy': 'median', 'n_nearest_features': 5, 'imputation_order': 'descending'}. Best is trial 13 with value: 0.1316992340328043.
running
[I 2024-09-22 10:30:15,175] Trial 80 finished with value: 0.1327068721896851 and parameters: {'model_name': 'IterativeImputer', 'estimator': 'Ridge', 'initial_strategy': 'mean', 'n_nearest_features': 5, 'imputation_order': 'ascending'}. Best is trial 13 with value: 0.1316992340328043.
running
[I 2024-09-22 10:30:15,524] Trial 79 finished with value: 0.1327068721896851 and parameters: {'model_name': 'IterativeImputer', 'estimator': 'Ridge', 'initial_strategy': 'mean', 'n_nearest_features': 5, 'imputation_order': 'ascending'}. Best is trial 13 with value: 0.1316992340328043.
running
[I 2024-09-22 10:30:18,750] Trial 83 finished with value: 0.14254956552031642 and parameters: {'model_name': 'KNNImputer', 'n_neighbors': 5566, 'weights': 'uniform'}. Best is trial 13 with value: 0.1316992340328043.
running
[I 2024-09-22 10:30:19,428] Trial 52 finished with value: 0.13571030678190327 and parameters: {'model_name': 'IterativeImputer', 'estimator': 'RFR', 'initial_strategy': 'mean', 'n_nearest_features': 5, 'imputation_order': 'descending'}. Best is trial 13 with value: 0.1316992340328043.
running
[I 2024-09-22 10:30:36,260] Trial 82 finished with value: 0.20015759360302954 and parameters: {'model_name': 'IterativeImputer', 'estimator': 'Bayesian', 'initial_strategy': 'most_frequent', 'n_nearest_features': 3, 'imputation_order': 'ascending', 'sample_posterior': True}. Best is trial 13 with value: 0.1316992340328043.
running
[I 2024-09-22 10:30:36,713] Trial 81 finished with value: 0.20015759360302954 and parameters: {'model_name': 'IterativeImputer', 'estimator': 'Bayesian', 'initial_strategy': 'most_frequent', 'n_nearest_features': 3, 'imputation_order': 'ascending', 'sample_posterior': True}. Best is trial 13 with value: 0.1316992340328043.
running
[I 2024-09-22 10:30:43,560] Trial 86 finished with value: 0.20015759360302954 and parameters: {'model_name': 'IterativeImputer', 'estimator': 'Bayesian', 'initial_strategy': 'most_frequent', 'n_nearest_features': 3, 'imputation_order': 'ascending', 'sample_posterior': True}. Best is trial 13 with value: 0.1316992340328043.
running
[I 2024-09-22 10:30:45,879] Trial 87 finished with value: 0.19170626669729124 and parameters: {'model_name': 'IterativeImputer', 'estimator': 'Bayesian', 'initial_strategy': 'most_frequent', 'n_nearest_features': 4, 'imputation_order': 'ascending', 'sample_posterior': True}. Best is trial 13 with value: 0.1316992340328043.
running
[I 2024-09-22 10:36:06,713] Trial 57 finished with value: 0.13551100624691476 and parameters: {'model_name': 'IterativeImputer', 'estimator': 'RFR', 'initial_strategy': 'mean', 'n_nearest_features': 6, 'imputation_order': 'descending'}. Best is trial 13 with value: 0.1316992340328043.
running
