[I 2024-11-07 09:33:37,841] Trial 199 finished with value: 0.22452921957425542 and parameters: {'model_name': 'IterativeImputer', 'estimator': 'RFR', 'initial_strategy': 'constant', 'n_nearest_features': 16, 'imputation_order': 'arabic'}. Best is trial 142 with value: 0.2220855877448483.
fit
auto fit
auto transform
0     0
1     0
2     0
3     0
4     0
5     0
6     0
7     0
8     0
9     0
10    0
11    0
12    0
13    0
14    0
15    0
dtype: int64
0     0
1     0
2     0
3     0
4     0
5     0
6     0
7     0
8     0
9     0
10    0
11    0
12    0
13    0
14    0
15    0
dtype: int64
0.2220855877448483
{'model_name': 'IterativeImputer', 'estimator': 'RFR', 'initial_strategy': 'constant', 'n_nearest_features': 16, 'imputation_order': 'arabic'}
running experiment 2/3 - Does reconstruction give good automl predictions
Start est fit
Version 0.1.7a0 of tpot2 is outdated. Version 0.1.8a0 was released Tuesday September 17, 2024.
Version 0.1.7a0 of tpot2 is outdated. Version 0.1.8a0 was released Tuesday September 17, 2024.
Version 0.1.7a0 of tpot2 is outdated. Version 0.1.8a0 was released Tuesday September 17, 2024.
Version 0.1.7a0 of tpot2 is outdated. Version 0.1.8a0 was released Tuesday September 17, 2024.
Version 0.1.7a0 of tpot2 is outdated. Version 0.1.8a0 was released Tuesday September 17, 2024.
Version 0.1.7a0 of tpot2 is outdated. Version 0.1.8a0 was released Tuesday September 17, 2024.
Version 0.1.7a0 of tpot2 is outdated. Version 0.1.8a0 was released Tuesday September 17, 2024.
Version 0.1.7a0 of tpot2 is outdated. Version 0.1.8a0 was released Tuesday September 17, 2024.
Version 0.1.7a0 of tpot2 is outdated. Version 0.1.8a0 was released Tuesday September 17, 2024.
Version 0.1.7a0 of tpot2 is outdated. Version 0.1.8a0 was released Tuesday September 17, 2024.
Version 0.1.7a0 of tpot2 is outdated. Version 0.1.8a0 was released Tuesday September 17, 2024.
Version 0.1.7a0 of tpot2 is outdated. Version 0.1.8a0 was released Tuesday September 17, 2024.
Version 0.1.7a0 of tpot2 is outdated. Version 0.1.8a0 was released Tuesday September 17, 2024.
Version 0.1.7a0 of tpot2 is outdated. Version 0.1.8a0 was released Tuesday September 17, 2024.
Version 0.1.7a0 of tpot2 is outdated. Version 0.1.8a0 was released Tuesday September 17, 2024.
Version 0.1.7a0 of tpot2 is outdated. Version 0.1.8a0 was released Tuesday September 17, 2024.
  0%|          | 0/25 [00:00<?, ?it/s]Generation:   0%|          | 0/25 [00:00<?, ?it/s]Generation:  1
Best f1_score score: 0.6661703152852861
Generation:   4%|▍         | 1/25 [03:10<1:16:15, 190.65s/it]Generation:  2
Best f1_score score: 0.6661703152852861
Generation:   8%|▊         | 2/25 [03:18<31:58, 83.41s/it]   Generation:  3
Best f1_score score: 0.710820204192338
Generation:  12%|█▏        | 3/25 [03:35<19:23, 52.87s/it]Generation:  4
Best f1_score score: 0.7173965317435649
Generation:  16%|█▌        | 4/25 [03:48<12:56, 37.00s/it]Generation:  5
Best f1_score score: 0.7173965317435649
Generation:  20%|██        | 5/25 [06:53<30:10, 90.51s/it]Generation:  6
Best f1_score score: 0.7173965317435649
Generation:  24%|██▍       | 6/25 [07:04<20:04, 63.38s/it]Generation:  7
Best f1_score score: 0.7173965317435649
Generation:  28%|██▊       | 7/25 [08:07<18:57, 63.22s/it]Generation:  8
Best f1_score score: 0.7173965317435649
Generation:  32%|███▏      | 8/25 [08:21<13:29, 47.63s/it]Generation:  9
Best f1_score score: 0.7173965317435649
Generation:  36%|███▌      | 9/25 [08:34<09:49, 36.82s/it]WARNING THIS INDIVIDUAL CAUSED AND EXCEPTION 
 <tpot2.search_spaces.pipelines.sequential.SequentialPipelineIndividual object at 0x1554658c8f40> 
 The 'min_samples_split' parameter of DecisionTreeClassifier must be an int in the range [2, inf) or a float in the range (0.0, 1.0]. Got 1 instead. 
 Traceback (most recent call last):
  File "/common/ketrong/tpotexp/tpot2/tpot2/utils/eval_utils.py", line 53, in objective_nan_wrapper
    value = func_timeout.func_timeout(timeout, objective_function, args=[individual], kwargs=objective_kwargs)
  File "/common/ketrong/tpotexp/env/lib/python3.10/site-packages/func_timeout/dafunc.py", line 108, in func_timeout
    raise_exception(exception)
  File "/common/ketrong/tpotexp/env/lib/python3.10/site-packages/func_timeout/py3_raise.py", line 7, in raise_exception
    raise exception[0] from None
  File "/common/ketrong/tpotexp/tpot2/tpot2/tpot_estimator/estimator.py", line 623, in objective_function
    return objective_function_generator(
  File "/common/ketrong/tpotexp/tpot2/tpot2/tpot_estimator/estimator_utils.py", line 55, in objective_function_generator
    cv_obj_scores = cross_val_score_objective(sklearn.base.clone(pipeline),x,y,scorers=scorers, cv=cv , fold=step)
  File "/common/ketrong/tpotexp/tpot2/tpot2/tpot_estimator/cross_val_utils.py", line 28, in cross_val_score_objective
    this_fold_pipeline.fit(X_train,y_train)
  File "/common/ketrong/tpotexp/env/lib/python3.10/site-packages/sklearn/base.py", line 1473, in wrapper
    return fit_method(estimator, *args, **kwargs)
  File "/common/ketrong/tpotexp/env/lib/python3.10/site-packages/sklearn/pipeline.py", line 473, in fit
    self._final_estimator.fit(Xt, y, **last_step_params["fit"])
  File "/common/ketrong/tpotexp/env/lib/python3.10/site-packages/sklearn/base.py", line 1466, in wrapper
    estimator._validate_params()
  File "/common/ketrong/tpotexp/env/lib/python3.10/site-packages/sklearn/base.py", line 666, in _validate_params
    validate_parameter_constraints(
  File "/common/ketrong/tpotexp/env/lib/python3.10/site-packages/sklearn/utils/_param_validation.py", line 95, in validate_parameter_constraints
    raise InvalidParameterError(
sklearn.utils._param_validation.InvalidParameterError: The 'min_samples_split' parameter of DecisionTreeClassifier must be an int in the range [2, inf) or a float in the range (0.0, 1.0]. Got 1 instead.

Generation:  10
Best f1_score score: 0.7173965317435649
Generation:  40%|████      | 10/25 [08:45<07:13, 28.91s/it]Generation:  11
Best f1_score score: 0.7173965317435649
Generation:  44%|████▍     | 11/25 [09:38<08:27, 36.27s/it]Generation:  12
Best f1_score score: 0.7173965317435649
Generation:  48%|████▊     | 12/25 [09:51<06:17, 29.02s/it]Generation:  13
Best f1_score score: 0.7173965317435649
Generation:  52%|█████▏    | 13/25 [10:02<04:42, 23.54s/it]Generation:  14
Best f1_score score: 0.7173965317435649
Generation:  56%|█████▌    | 14/25 [10:15<03:46, 20.61s/it]Generation:  15
Best f1_score score: 0.7173965317435649
Generation:  60%|██████    | 15/25 [10:31<03:11, 19.16s/it]Generation:  16
Best f1_score score: 0.7173965317435649
Generation:  64%|██████▍   | 16/25 [11:51<05:36, 37.34s/it]WARNING THIS INDIVIDUAL CAUSED AND EXCEPTION 
 <tpot2.search_spaces.pipelines.sequential.SequentialPipelineIndividual object at 0x1554653243d0> 
 Argument 'metric' has incorrect type (expected str, got numpy.str_) 
 Traceback (most recent call last):
  File "/common/ketrong/tpotexp/tpot2/tpot2/utils/eval_utils.py", line 53, in objective_nan_wrapper
    value = func_timeout.func_timeout(timeout, objective_function, args=[individual], kwargs=objective_kwargs)
  File "/common/ketrong/tpotexp/env/lib/python3.10/site-packages/func_timeout/dafunc.py", line 108, in func_timeout
    raise_exception(exception)
  File "/common/ketrong/tpotexp/env/lib/python3.10/site-packages/func_timeout/py3_raise.py", line 7, in raise_exception
    raise exception[0] from None
  File "/common/ketrong/tpotexp/tpot2/tpot2/tpot_estimator/estimator.py", line 623, in objective_function
    return objective_function_generator(
  File "/common/ketrong/tpotexp/tpot2/tpot2/tpot_estimator/estimator_utils.py", line 55, in objective_function_generator
    cv_obj_scores = cross_val_score_objective(sklearn.base.clone(pipeline),x,y,scorers=scorers, cv=cv , fold=step)
  File "/common/ketrong/tpotexp/tpot2/tpot2/tpot_estimator/cross_val_utils.py", line 31, in cross_val_score_objective
    this_fold_scores = [sklearn.metrics.get_scorer(scorer)(this_fold_pipeline, X_test, y_test) for scorer in scorers]
  File "/common/ketrong/tpotexp/tpot2/tpot2/tpot_estimator/cross_val_utils.py", line 31, in <listcomp>
    this_fold_scores = [sklearn.metrics.get_scorer(scorer)(this_fold_pipeline, X_test, y_test) for scorer in scorers]
  File "/common/ketrong/tpotexp/env/lib/python3.10/site-packages/sklearn/metrics/_scorer.py", line 279, in __call__
    return self._score(partial(_cached_call, None), estimator, X, y_true, **_kwargs)
  File "/common/ketrong/tpotexp/env/lib/python3.10/site-packages/sklearn/metrics/_scorer.py", line 371, in _score
    y_pred = method_caller(
  File "/common/ketrong/tpotexp/env/lib/python3.10/site-packages/sklearn/metrics/_scorer.py", line 89, in _cached_call
    result, _ = _get_response_values(
  File "/common/ketrong/tpotexp/env/lib/python3.10/site-packages/sklearn/utils/_response.py", line 211, in _get_response_values
    y_pred = prediction_method(X)
  File "/common/ketrong/tpotexp/env/lib/python3.10/site-packages/sklearn/pipeline.py", line 601, in predict
    return self.steps[-1][1].predict(Xt, **params)
  File "/common/ketrong/tpotexp/env/lib/python3.10/site-packages/sklearn/neighbors/_classification.py", line 259, in predict
    probabilities = self.predict_proba(X)
  File "/common/ketrong/tpotexp/env/lib/python3.10/site-packages/sklearn/neighbors/_classification.py", line 343, in predict_proba
    probabilities = ArgKminClassMode.compute(
  File "/common/ketrong/tpotexp/env/lib/python3.10/site-packages/sklearn/metrics/_pairwise_distances_reduction/_dispatcher.py", line 584, in compute
    return ArgKminClassMode64.compute(
TypeError: Argument 'metric' has incorrect type (expected str, got numpy.str_)

Generation:  17
Best f1_score score: 0.7173965317435649
Generation:  68%|██████▊   | 17/25 [12:06<04:06, 30.78s/it]Generation:  18
Best f1_score score: 0.7173965317435649
Generation:  72%|███████▏  | 18/25 [12:20<03:00, 25.73s/it]Generation:  19
Best f1_score score: 0.7173965317435649
Generation:  76%|███████▌  | 19/25 [12:36<02:16, 22.83s/it]Generation:  20
Best f1_score score: 0.7173965317435649
Generation:  80%|████████  | 20/25 [12:54<01:45, 21.15s/it]Generation:  21
Best f1_score score: 0.7173965317435649
Generation:  84%|████████▍ | 21/25 [13:09<01:18, 19.57s/it]Generation:  22
Best f1_score score: 0.7173965317435649
Generation:  88%|████████▊ | 22/25 [13:33<01:02, 20.71s/it]Generation:  23
Best f1_score score: 0.7173965317435649
Generation:  92%|█████████▏| 23/25 [13:48<00:37, 18.93s/it]Generation:  24
Best f1_score score: 0.7173965317435649
Generation:  96%|█████████▌| 24/25 [14:04<00:18, 18.32s/it]Generation:  25
Best f1_score score: 0.7173965317435649
Generation: 100%|██████████| 25/25 [14:25<00:00, 19.10s/it]Generation: 100%|██████████| 25/25 [14:29<00:00, 34.79s/it]
2024-11-07 09:51:12,724 - distributed.scheduler - ERROR - Removing worker 'tcp://127.0.0.1:33731' caused the cluster to lose scattered data, which can't be recovered: {'ndarray-027da1c9fdd4e8ae6c07d4d903bb4e53', 'ndarray-b6f1c60d1f9a0fafa76867fbe2747a6e'} (stimulus_id='handle-worker-cleanup-1731001872.7240136')
Fitted
Pipeline(steps=[('lgbmclassifier',
                 LGBMClassifier(class_weight='balanced', max_depth=10,
                                n_estimators=65, n_jobs=1, num_leaves=152,
                                verbose=-1))])
score start
train score: {'auroc': 0.999738377475575, 'accuracy': 0.9709623893805309, 'balanced_accuracy': 0.9835886214442013, 'logloss': 0.10364847858545552, 'f1': 0.9357468539769073}
original test score: {'auroc': 0.9023096129837702, 'accuracy': 0.8883977900552487, 'balanced_accuracy': 0.786348794775761, 'logloss': 0.2547255870372455, 'f1': 0.754815571846642}
imputed test score: {'auroc': 0.8986963411120714, 'accuracy': 0.8961325966850828, 'balanced_accuracy': 0.7865348602708153, 'logloss': 0.2574155668716576, 'f1': 0.764150420298534}
score end
check intended
EXP2 Finished
running experiment 3/3 - What is the best automl settings?
<tpot2.search_spaces.pipelines.sequential.SequentialPipeline object at 0x155435014610>
Start tpot fit
Version 0.1.7a0 of tpot2 is outdated. Version 0.1.8a0 was released Tuesday September 17, 2024.
Version 0.1.7a0 of tpot2 is outdated. Version 0.1.8a0 was released Tuesday September 17, 2024.
Version 0.1.7a0 of tpot2 is outdated. Version 0.1.8a0 was released Tuesday September 17, 2024.
Version 0.1.7a0 of tpot2 is outdated. Version 0.1.8a0 was released Tuesday September 17, 2024.
Version 0.1.7a0 of tpot2 is outdated. Version 0.1.8a0 was released Tuesday September 17, 2024.
Version 0.1.7a0 of tpot2 is outdated. Version 0.1.8a0 was released Tuesday September 17, 2024.
Version 0.1.7a0 of tpot2 is outdated. Version 0.1.8a0 was released Tuesday September 17, 2024.
Version 0.1.7a0 of tpot2 is outdated. Version 0.1.8a0 was released Tuesday September 17, 2024.
Version 0.1.7a0 of tpot2 is outdated. Version 0.1.8a0 was released Tuesday September 17, 2024.
Version 0.1.7a0 of tpot2 is outdated. Version 0.1.8a0 was released Tuesday September 17, 2024.
Version 0.1.7a0 of tpot2 is outdated. Version 0.1.8a0 was released Tuesday September 17, 2024.
Version 0.1.7a0 of tpot2 is outdated. Version 0.1.8a0 was released Tuesday September 17, 2024.
Version 0.1.7a0 of tpot2 is outdated. Version 0.1.8a0 was released Tuesday September 17, 2024.
Version 0.1.7a0 of tpot2 is outdated. Version 0.1.8a0 was released Tuesday September 17, 2024.
Version 0.1.7a0 of tpot2 is outdated. Version 0.1.8a0 was released Tuesday September 17, 2024.
Version 0.1.7a0 of tpot2 is outdated. Version 0.1.8a0 was released Tuesday September 17, 2024.
  0%|          | 0/25 [00:00<?, ?it/s]Generation:   0%|          | 0/25 [00:00<?, ?it/s]WARNING THIS INDIVIDUAL CAUSED AND EXCEPTION 
 <tpot2.search_spaces.pipelines.sequential.SequentialPipelineIndividual object at 0x155474d23940> 
 Negative values in data passed to MultinomialNB (input X) 
 Traceback (most recent call last):
  File "/common/ketrong/tpotexp/tpot2/tpot2/utils/eval_utils.py", line 53, in objective_nan_wrapper
    value = func_timeout.func_timeout(timeout, objective_function, args=[individual], kwargs=objective_kwargs)
  File "/common/ketrong/tpotexp/env/lib/python3.10/site-packages/func_timeout/dafunc.py", line 108, in func_timeout
    raise_exception(exception)
  File "/common/ketrong/tpotexp/env/lib/python3.10/site-packages/func_timeout/py3_raise.py", line 7, in raise_exception
    raise exception[0] from None
  File "/common/ketrong/tpotexp/tpot2/tpot2/tpot_estimator/estimator.py", line 623, in objective_function
    return objective_function_generator(
  File "/common/ketrong/tpotexp/tpot2/tpot2/tpot_estimator/estimator_utils.py", line 55, in objective_function_generator
    cv_obj_scores = cross_val_score_objective(sklearn.base.clone(pipeline),x,y,scorers=scorers, cv=cv , fold=step)
  File "/common/ketrong/tpotexp/tpot2/tpot2/tpot_estimator/cross_val_utils.py", line 28, in cross_val_score_objective
    this_fold_pipeline.fit(X_train,y_train)
  File "/common/ketrong/tpotexp/env/lib/python3.10/site-packages/sklearn/base.py", line 1473, in wrapper
    return fit_method(estimator, *args, **kwargs)
  File "/common/ketrong/tpotexp/env/lib/python3.10/site-packages/sklearn/pipeline.py", line 473, in fit
    self._final_estimator.fit(Xt, y, **last_step_params["fit"])
  File "/common/ketrong/tpotexp/env/lib/python3.10/site-packages/sklearn/base.py", line 1473, in wrapper
    return fit_method(estimator, *args, **kwargs)
  File "/common/ketrong/tpotexp/env/lib/python3.10/site-packages/sklearn/naive_bayes.py", line 759, in fit
    self._count(X, Y)
  File "/common/ketrong/tpotexp/env/lib/python3.10/site-packages/sklearn/naive_bayes.py", line 881, in _count
    check_non_negative(X, "MultinomialNB (input X)")
  File "/common/ketrong/tpotexp/env/lib/python3.10/site-packages/sklearn/utils/validation.py", line 1689, in check_non_negative
    raise ValueError("Negative values in data passed to %s" % whom)
ValueError: Negative values in data passed to MultinomialNB (input X)

WARNING AN INDIVIDUAL TIMED OUT: 
 <tpot2.search_spaces.pipelines.sequential.SequentialPipelineIndividual object at 0x155474cd4f40> 

WARNING AN INDIVIDUAL TIMED OUT: 
 <tpot2.search_spaces.pipelines.sequential.SequentialPipelineIndividual object at 0x155474cd5240> 

Generation:  1
Best f1_score score: 0.6476586286251587
Generation:   4%|▍         | 1/25 [10:03<4:01:35, 603.97s/it]WARNING THIS INDIVIDUAL CAUSED AND EXCEPTION 
 <tpot2.search_spaces.pipelines.sequential.SequentialPipelineIndividual object at 0x155474cd6170> 
 Input X contains NaN.
AdaBoostClassifier does not accept missing values encoded as NaN natively. For supervised learning, you might want to consider sklearn.ensemble.HistGradientBoostingClassifier and Regressor which accept missing values encoded as NaNs natively. Alternatively, it is possible to preprocess the data, for instance by using an imputer transformer in a pipeline or drop samples with missing values. See https://scikit-learn.org/stable/modules/impute.html You can find a list of all estimators that handle NaN values at the following page: https://scikit-learn.org/stable/modules/impute.html#estimators-that-handle-nan-values 
 Traceback (most recent call last):
  File "/common/ketrong/tpotexp/tpot2/tpot2/utils/eval_utils.py", line 53, in objective_nan_wrapper
    value = func_timeout.func_timeout(timeout, objective_function, args=[individual], kwargs=objective_kwargs)
  File "/common/ketrong/tpotexp/env/lib/python3.10/site-packages/func_timeout/dafunc.py", line 108, in func_timeout
    raise_exception(exception)
  File "/common/ketrong/tpotexp/env/lib/python3.10/site-packages/func_timeout/py3_raise.py", line 7, in raise_exception
    raise exception[0] from None
  File "/common/ketrong/tpotexp/tpot2/tpot2/tpot_estimator/estimator.py", line 623, in objective_function
    return objective_function_generator(
  File "/common/ketrong/tpotexp/tpot2/tpot2/tpot_estimator/estimator_utils.py", line 55, in objective_function_generator
    cv_obj_scores = cross_val_score_objective(sklearn.base.clone(pipeline),x,y,scorers=scorers, cv=cv , fold=step)
  File "/common/ketrong/tpotexp/tpot2/tpot2/tpot_estimator/cross_val_utils.py", line 28, in cross_val_score_objective
    this_fold_pipeline.fit(X_train,y_train)
  File "/common/ketrong/tpotexp/env/lib/python3.10/site-packages/sklearn/base.py", line 1473, in wrapper
    return fit_method(estimator, *args, **kwargs)
  File "/common/ketrong/tpotexp/env/lib/python3.10/site-packages/sklearn/pipeline.py", line 473, in fit
    self._final_estimator.fit(Xt, y, **last_step_params["fit"])
  File "/common/ketrong/tpotexp/env/lib/python3.10/site-packages/sklearn/base.py", line 1473, in wrapper
    return fit_method(estimator, *args, **kwargs)
  File "/common/ketrong/tpotexp/env/lib/python3.10/site-packages/sklearn/ensemble/_weight_boosting.py", line 133, in fit
    X, y = self._validate_data(
  File "/common/ketrong/tpotexp/env/lib/python3.10/site-packages/sklearn/base.py", line 650, in _validate_data
    X, y = check_X_y(X, y, **check_params)
  File "/common/ketrong/tpotexp/env/lib/python3.10/site-packages/sklearn/utils/validation.py", line 1301, in check_X_y
    X = check_array(
  File "/common/ketrong/tpotexp/env/lib/python3.10/site-packages/sklearn/utils/validation.py", line 1064, in check_array
    _assert_all_finite(
  File "/common/ketrong/tpotexp/env/lib/python3.10/site-packages/sklearn/utils/validation.py", line 123, in _assert_all_finite
    _assert_all_finite_element_wise(
  File "/common/ketrong/tpotexp/env/lib/python3.10/site-packages/sklearn/utils/validation.py", line 172, in _assert_all_finite_element_wise
    raise ValueError(msg_err)
ValueError: Input X contains NaN.
AdaBoostClassifier does not accept missing values encoded as NaN natively. For supervised learning, you might want to consider sklearn.ensemble.HistGradientBoostingClassifier and Regressor which accept missing values encoded as NaNs natively. Alternatively, it is possible to preprocess the data, for instance by using an imputer transformer in a pipeline or drop samples with missing values. See https://scikit-learn.org/stable/modules/impute.html You can find a list of all estimators that handle NaN values at the following page: https://scikit-learn.org/stable/modules/impute.html#estimators-that-handle-nan-values

Generation:  2
Best f1_score score: 0.6718397096840905
Generation:   8%|▊         | 2/25 [12:10<2:03:53, 323.21s/it]Generation:  3
Best f1_score score: 0.7166033954639042
Generation:  12%|█▏        | 3/25 [12:32<1:08:07, 185.81s/it]WARNING AN INDIVIDUAL TIMED OUT: 
 <tpot2.search_spaces.pipelines.sequential.SequentialPipelineIndividual object at 0x155474cd6920> 

Generation:  4
Best f1_score score: 0.7166033954639042
Generation:  16%|█▌        | 4/25 [22:38<2:03:01, 351.48s/it]Generation:  5
Best f1_score score: 0.7166033954639042
Generation:  20%|██        | 5/25 [24:01<1:24:50, 254.55s/it]WARNING AN INDIVIDUAL TIMED OUT: 
 <tpot2.search_spaces.pipelines.sequential.SequentialPipelineIndividual object at 0x15545e6bbee0> 

Generation:  6
Best f1_score score: 0.7166033954639042
Generation:  24%|██▍       | 6/25 [34:05<1:58:13, 373.36s/it]WARNING THIS INDIVIDUAL CAUSED AND EXCEPTION 
 <tpot2.search_spaces.pipelines.sequential.SequentialPipelineIndividual object at 0x155454dd0ca0> 
 Negative values in data passed to MultinomialNB (input X) 
 Traceback (most recent call last):
  File "/common/ketrong/tpotexp/tpot2/tpot2/utils/eval_utils.py", line 53, in objective_nan_wrapper
    value = func_timeout.func_timeout(timeout, objective_function, args=[individual], kwargs=objective_kwargs)
  File "/common/ketrong/tpotexp/env/lib/python3.10/site-packages/func_timeout/dafunc.py", line 108, in func_timeout
    raise_exception(exception)
  File "/common/ketrong/tpotexp/env/lib/python3.10/site-packages/func_timeout/py3_raise.py", line 7, in raise_exception
    raise exception[0] from None
  File "/common/