[I 2024-10-22 21:08:07,153] Trial 1 finished with value: 0.2178332938701327 and parameters: {'model_name': 'VAE', 'batch_size': 1, 'iterations': 9481, 'learning_rate': 0.0006263222821413553, 'p_miss': 0.29056621966232693}. Best is trial 135 with value: 0.07126462084779589.
fit
auto fit
auto transform
0    0
1    0
2    0
3    0
4    0
5    0
dtype: int64
0    0
1    0
2    0
3    0
4    0
5    0
dtype: int64
0.07126462084779589
{'model_name': 'IterativeImputer', 'estimator': 'RFR', 'initial_strategy': 'constant', 'n_nearest_features': 5, 'imputation_order': 'random'}
running experiment 2/3 - Does reconstruction give good automl predictions
Start est fit
Version 0.1.7a0 of tpot2 is outdated. Version 0.1.8a0 was released Tuesday September 17, 2024.
Version 0.1.7a0 of tpot2 is outdated. Version 0.1.8a0 was released Tuesday September 17, 2024.
Version 0.1.7a0 of tpot2 is outdated. Version 0.1.8a0 was released Tuesday September 17, 2024.
Version 0.1.7a0 of tpot2 is outdated. Version 0.1.8a0 was released Tuesday September 17, 2024.
Version 0.1.7a0 of tpot2 is outdated. Version 0.1.8a0 was released Tuesday September 17, 2024.
Version 0.1.7a0 of tpot2 is outdated. Version 0.1.8a0 was released Tuesday September 17, 2024.
Version 0.1.7a0 of tpot2 is outdated. Version 0.1.8a0 was released Tuesday September 17, 2024.
Version 0.1.7a0 of tpot2 is outdated. Version 0.1.8a0 was released Tuesday September 17, 2024.
Version 0.1.7a0 of tpot2 is outdated. Version 0.1.8a0 was released Tuesday September 17, 2024.
Version 0.1.7a0 of tpot2 is outdated. Version 0.1.8a0 was released Tuesday September 17, 2024.
Version 0.1.7a0 of tpot2 is outdated. Version 0.1.8a0 was released Tuesday September 17, 2024.
Version 0.1.7a0 of tpot2 is outdated. Version 0.1.8a0 was released Tuesday September 17, 2024.
Version 0.1.7a0 of tpot2 is outdated. Version 0.1.8a0 was released Tuesday September 17, 2024.
Version 0.1.7a0 of tpot2 is outdated. Version 0.1.8a0 was released Tuesday September 17, 2024.
Version 0.1.7a0 of tpot2 is outdated. Version 0.1.8a0 was released Tuesday September 17, 2024.
Version 0.1.7a0 of tpot2 is outdated. Version 0.1.8a0 was released Tuesday September 17, 2024.
  0%|          | 0/25 [00:00<?, ?it/s]Generation:   0%|          | 0/25 [00:00<?, ?it/s]Generation:  1
Best f1_score score: 0.8253951460299461
Generation:   4%|▍         | 1/25 [01:03<25:26, 63.61s/it]Generation:  2
Best f1_score score: 0.8305815241797754
Generation:   8%|▊         | 2/25 [01:52<21:04, 54.98s/it]Generation:  3
Best f1_score score: 0.8421074133817799
Generation:  12%|█▏        | 3/25 [02:20<15:37, 42.59s/it]Generation:  4
Best f1_score score: 0.8421074133817799
Generation:  16%|█▌        | 4/25 [02:33<10:48, 30.90s/it]Generation:  5
Best f1_score score: 0.8472109965157444
Generation:  20%|██        | 5/25 [03:04<10:21, 31.06s/it]Generation:  6
Best f1_score score: 0.8472109965157444
Generation:  24%|██▍       | 6/25 [05:26<21:45, 68.72s/it]WARNING THIS INDIVIDUAL CAUSED AND EXCEPTION 
 <tpot2.search_spaces.pipelines.sequential.SequentialPipelineIndividual object at 0x155467f194b0> 
 The 'min_samples_split' parameter of DecisionTreeClassifier must be an int in the range [2, inf) or a float in the range (0.0, 1.0]. Got 1 instead. 
 Traceback (most recent call last):
  File "/common/ketrong/tpotexp/tpot2/tpot2/utils/eval_utils.py", line 53, in objective_nan_wrapper
    value = func_timeout.func_timeout(timeout, objective_function, args=[individual], kwargs=objective_kwargs)
  File "/common/ketrong/tpotexp/env/lib/python3.10/site-packages/func_timeout/dafunc.py", line 108, in func_timeout
    raise_exception(exception)
  File "/common/ketrong/tpotexp/env/lib/python3.10/site-packages/func_timeout/py3_raise.py", line 7, in raise_exception
    raise exception[0] from None
  File "/common/ketrong/tpotexp/tpot2/tpot2/tpot_estimator/estimator.py", line 623, in objective_function
    return objective_function_generator(
  File "/common/ketrong/tpotexp/tpot2/tpot2/tpot_estimator/estimator_utils.py", line 55, in objective_function_generator
    cv_obj_scores = cross_val_score_objective(sklearn.base.clone(pipeline),x,y,scorers=scorers, cv=cv , fold=step)
  File "/common/ketrong/tpotexp/tpot2/tpot2/tpot_estimator/cross_val_utils.py", line 28, in cross_val_score_objective
    this_fold_pipeline.fit(X_train,y_train)
  File "/common/ketrong/tpotexp/env/lib/python3.10/site-packages/sklearn/base.py", line 1473, in wrapper
    return fit_method(estimator, *args, **kwargs)
  File "/common/ketrong/tpotexp/env/lib/python3.10/site-packages/sklearn/pipeline.py", line 473, in fit
    self._final_estimator.fit(Xt, y, **last_step_params["fit"])
  File "/common/ketrong/tpotexp/env/lib/python3.10/site-packages/sklearn/base.py", line 1466, in wrapper
    estimator._validate_params()
  File "/common/ketrong/tpotexp/env/lib/python3.10/site-packages/sklearn/base.py", line 666, in _validate_params
    validate_parameter_constraints(
  File "/common/ketrong/tpotexp/env/lib/python3.10/site-packages/sklearn/utils/_param_validation.py", line 95, in validate_parameter_constraints
    raise InvalidParameterError(
sklearn.utils._param_validation.InvalidParameterError: The 'min_samples_split' parameter of DecisionTreeClassifier must be an int in the range [2, inf) or a float in the range (0.0, 1.0]. Got 1 instead.

Generation:  7
Best f1_score score: 0.8472109965157444
Generation:  28%|██▊       | 7/25 [05:38<15:02, 50.16s/it]Generation:  8
Best f1_score score: 0.8472109965157444
Generation:  32%|███▏      | 8/25 [05:46<10:26, 36.86s/it]Generation:  9
Best f1_score score: 0.847624862698026
Generation:  36%|███▌      | 9/25 [06:03<08:09, 30.58s/it]Generation:  10
Best f1_score score: 0.847624862698026
Generation:  40%|████      | 10/25 [06:17<06:23, 25.53s/it]Generation:  11
Best f1_score score: 0.847624862698026
Generation:  44%|████▍     | 11/25 [06:34<05:20, 22.89s/it]Generation:  12
Best f1_score score: 0.847624862698026
Generation:  48%|████▊     | 12/25 [07:11<05:50, 27.00s/it]Generation:  13
Best f1_score score: 0.847624862698026
Generation:  52%|█████▏    | 13/25 [07:35<05:14, 26.22s/it]Generation:  14
Best f1_score score: 0.847624862698026
Generation:  56%|█████▌    | 14/25 [10:41<13:37, 74.35s/it]Generation:  15
Best f1_score score: 0.847624862698026
Generation:  60%|██████    | 15/25 [11:02<09:43, 58.32s/it]Generation:  16
Best f1_score score: 0.847624862698026
Generation:  64%|██████▍   | 16/25 [11:15<06:42, 44.71s/it]Generation:  17
Best f1_score score: 0.847624862698026
Generation:  68%|██████▊   | 17/25 [11:27<04:39, 34.89s/it]Generation:  18
Best f1_score score: 0.847624862698026
Generation:  72%|███████▏  | 18/25 [11:45<03:29, 29.90s/it]Generation:  19
Best f1_score score: 0.8481643263413503
Generation:  76%|███████▌  | 19/25 [12:07<02:45, 27.54s/it]Generation:  20
Best f1_score score: 0.8481643263413503
Generation:  80%|████████  | 20/25 [12:34<02:17, 27.40s/it]Generation:  21
Best f1_score score: 0.8481643263413503
Generation:  84%|████████▍ | 21/25 [16:16<05:42, 85.66s/it]Generation:  22
Best f1_score score: 0.8481643263413503
Generation:  88%|████████▊ | 22/25 [16:30<03:12, 64.25s/it]Generation:  23
Best f1_score score: 0.8481643263413503
Generation:  92%|█████████▏| 23/25 [17:51<02:18, 69.08s/it]Generation:  24
Best f1_score score: 0.8500545478216465
Generation:  96%|█████████▌| 24/25 [18:11<00:54, 54.60s/it]Generation:  25
Best f1_score score: 0.8500545478216465
Generation: 100%|██████████| 25/25 [18:37<00:00, 45.78s/it]Generation: 100%|██████████| 25/25 [18:40<00:00, 44.82s/it]
2024-10-22 21:28:46,314 - distributed.scheduler - ERROR - Removing worker 'tcp://127.0.0.1:34937' caused the cluster to lose scattered data, which can't be recovered: {'ndarray-b5f468972b7ffa9aa2eaa92c4caed8b0', 'ndarray-55a857140fc07f572307950c78239e74'} (stimulus_id='handle-worker-cleanup-1729657726.3146758')
Fitted
Pipeline(steps=[('lgbmclassifier',
                 LGBMClassifier(class_weight='balanced', max_depth=10,
                                n_estimators=81, n_jobs=1, num_leaves=94,
                                verbose=-1))])
score start
train score: {'auroc': 0.9960019345211895, 'accuracy': 0.9985468365750055, 'balanced_accuracy': 0.9875229985738683, 'logloss': 0.031108977612147, 'f1': 0.9841148709901824}
original test score: {'auroc': 0.8819926069353987, 'accuracy': 0.9812248547161377, 'balanced_accuracy': 0.8120445344129554, 'logloss': 0.08599474905128404, 'f1': 0.8007456609151524}
imputed test score: {'auroc': 0.8826527019890864, 'accuracy': 0.9798837729101475, 'balanced_accuracy': 0.8113580355571202, 'logloss': 0.08811852113400652, 'f1': 0.7921402952344965}
score end
check intended
EXP2 Finished
running experiment 3/3 - What is the best automl settings?
<tpot2.search_spaces.pipelines.sequential.SequentialPipeline object at 0x1554350145e0>
Start tpot fit
Version 0.1.7a0 of tpot2 is outdated. Version 0.1.8a0 was released Tuesday September 17, 2024.
Version 0.1.7a0 of tpot2 is outdated. Version 0.1.8a0 was released Tuesday September 17, 2024.
Version 0.1.7a0 of tpot2 is outdated. Version 0.1.8a0 was released Tuesday September 17, 2024.
Version 0.1.7a0 of tpot2 is outdated. Version 0.1.8a0 was released Tuesday September 17, 2024.
Version 0.1.7a0 of tpot2 is outdated. Version 0.1.8a0 was released Tuesday September 17, 2024.
Version 0.1.7a0 of tpot2 is outdated. Version 0.1.8a0 was released Tuesday September 17, 2024.
Version 0.1.7a0 of tpot2 is outdated. Version 0.1.8a0 was released Tuesday September 17, 2024.
Version 0.1.7a0 of tpot2 is outdated. Version 0.1.8a0 was released Tuesday September 17, 2024.
Version 0.1.7a0 of tpot2 is outdated. Version 0.1.8a0 was released Tuesday September 17, 2024.
Version 0.1.7a0 of tpot2 is outdated. Version 0.1.8a0 was released Tuesday September 17, 2024.
Version 0.1.7a0 of tpot2 is outdated. Version 0.1.8a0 was released Tuesday September 17, 2024.
Version 0.1.7a0 of tpot2 is outdated. Version 0.1.8a0 was released Tuesday September 17, 2024.
Version 0.1.7a0 of tpot2 is outdated. Version 0.1.8a0 was released Tuesday September 17, 2024.
Version 0.1.7a0 of tpot2 is outdated. Version 0.1.8a0 was released Tuesday September 17, 2024.
Version 0.1.7a0 of tpot2 is outdated. Version 0.1.8a0 was released Tuesday September 17, 2024.
Version 0.1.7a0 of tpot2 is outdated. Version 0.1.8a0 was released Tuesday September 17, 2024.
  0%|          | 0/25 [00:00<?, ?it/s]Generation:   0%|          | 0/25 [00:00<?, ?it/s]Generation:  1
Best f1_score score: 0.8102850985444757
Generation:   4%|▍         | 1/25 [07:19<2:55:49, 439.57s/it]Generation:  2
Best f1_score score: 0.8218526743705489
Generation:   8%|▊         | 2/25 [14:42<2:49:16, 441.57s/it]Generation:  3
Best f1_score score: 0.8218526743705489
Generation:  12%|█▏        | 3/25 [14:51<1:29:26, 243.95s/it]Generation:  4
Best f1_score score: 0.8237723782456857
Generation:  16%|█▌        | 4/25 [15:06<53:49, 153.80s/it]  Generation:  5
Best f1_score score: 0.8237723782456857
Generation:  20%|██        | 5/25 [22:34<1:26:33, 259.70s/it]Generation:  6
Best f1_score score: 0.8246351685641038
Generation:  24%|██▍       | 6/25 [29:57<1:42:00, 322.12s/it]Generation:  7
Best f1_score score: 0.8246351685641038
Generation:  28%|██▊       | 7/25 [30:05<1:05:48, 219.37s/it]WARNING THIS INDIVIDUAL CAUSED AND EXCEPTION 
 <tpot2.search_spaces.pipelines.sequential.SequentialPipelineIndividual object at 0x15545f5e3d90> 
 Input X contains NaN.
KNeighborsClassifier does not accept missing values encoded as NaN natively. For supervised learning, you might want to consider sklearn.ensemble.HistGradientBoostingClassifier and Regressor which accept missing values encoded as NaNs natively. Alternatively, it is possible to preprocess the data, for instance by using an imputer transformer in a pipeline or drop samples with missing values. See https://scikit-learn.org/stable/modules/impute.html You can find a list of all estimators that handle NaN values at the following page: https://scikit-learn.org/stable/modules/impute.html#estimators-that-handle-nan-values 
 Traceback (most recent call last):
  File "/common/ketrong/tpotexp/tpot2/tpot2/utils/eval_utils.py", line 53, in objective_nan_wrapper
    value = func_timeout.func_timeout(timeout, objective_function, args=[individual], kwargs=objective_kwargs)
  File "/common/ketrong/tpotexp/env/lib/python3.10/site-packages/func_timeout/dafunc.py", line 108, in func_timeout
    raise_exception(exception)
  File "/common/ketrong/tpotexp/env/lib/python3.10/site-packages/func_timeout/py3_raise.py", line 7, in raise_exception
    raise exception[0] from None
  File "/common/ketrong/tpotexp/tpot2/tpot2/tpot_estimator/estimator.py", line 623, in objective_function
    return objective_function_generator(
  File "/common/ketrong/tpotexp/tpot2/tpot2/tpot_estimator/estimator_utils.py", line 55, in objective_function_generator
    cv_obj_scores = cross_val_score_objective(sklearn.base.clone(pipeline),x,y,scorers=scorers, cv=cv , fold=step)
  File "/common/ketrong/tpotexp/tpot2/tpot2/tpot_estimator/cross_val_utils.py", line 28, in cross_val_score_objective
    this_fold_pipeline.fit(X_train,y_train)
  File "/common/ketrong/tpotexp/env/lib/python3.10/site-packages/sklearn/base.py", line 1473, in wrapper
    return fit_method(estimator, *args, **kwargs)
  File "/common/ketrong/tpotexp/env/lib/python3.10/site-packages/sklearn/pipeline.py", line 473, in fit
    self._final_estimator.fit(Xt, y, **last_step_params["fit"])
  File "/common/ketrong/tpotexp/env/lib/python3.10/site-packages/sklearn/base.py", line 1473, in wrapper
    return fit_method(estimator, *args, **kwargs)
  File "/common/ketrong/tpotexp/env/lib/python3.10/site-packages/sklearn/neighbors/_classification.py", line 238, in fit
    return self._fit(X, y)
  File "/common/ketrong/tpotexp/env/lib/python3.10/site-packages/sklearn/neighbors/_base.py", line 475, in _fit
    X, y = self._validate_data(
  File "/common/ketrong/tpotexp/env/lib/python3.10/site-packages/sklearn/base.py", line 650, in _validate_data
    X, y = check_X_y(X, y, **check_params)
  File "/common/ketrong/tpotexp/env/lib/python3.10/site-packages/sklearn/utils/validation.py", line 1301, in check_X_y
    X = check_array(
  File "/common/ketrong/tpotexp/env/lib/python3.10/site-packages/sklearn/utils/validation.py", line 1064, in check_array
    _assert_all_finite(
  File "/common/ketrong/tpotexp/env/lib/python3.10/site-packages/sklearn/utils/validation.py", line 123, in _assert_all_finite
    _assert_all_finite_element_wise(
  File "/common/ketrong/tpotexp/env/lib/python3.10/site-packages/sklearn/utils/validation.py", line 172, in _assert_all_finite_element_wise
    raise ValueError(msg_err)
ValueError: Input X contains NaN.
KNeighborsClassifier does not accept missing values encoded as NaN natively. For supervised learning, you might want to consider sklearn.ensemble.HistGradientBoostingClassifier and Regressor which accept missing values encoded as NaNs natively. Alternatively, it is possible to preprocess the data, for instance by using an imputer transformer in a pipeline or drop samples with missing values. See https://scikit-learn.org/stable/modules/impute.html You can find a list of all estimators that handle NaN values at the following page: https://scikit-learn.org/stable/modules/impute.html#estimators-that-handle-nan-values

Generation:  8
Best f1_score score: 0.8324953185923072
Generation:  32%|███▏      | 8/25 [37:31<1:22:35, 291.53s/it]Generation:  9
Best f1_score score: 0.8324953185923072
Generation:  36%|███▌      | 9/25 [44:58<1:30:42, 340.15s/it]Generation:  10
Best f1_score score: 0.8331918613229202
Generation:  40%|████      | 10/25 [52:24<1:33:11, 372.80s/it]Generation:  11
Best f1_score score: 0.8416766140596472
Generation:  44%|████▍     | 11/25 [59:51<1:32:16, 395.46s/it]Generation:  12
Best f1_score score: 0.8447300465355795
Generation:  48%|████▊     | 12/25 [1:07:21<1:29:15, 411.96s/it]WARNING AN INDIVIDUAL TIMED OUT: 
 <tpot2.search_spaces.pipelines.sequential.SequentialPipelineIndividual object at 0x155474d36cb0> 

Generation:  13
Best f1_score score: 0.8447300465355795
Generation:  52%|█████▏    | 13/25 [1:17:28<1:34:14, 471.24s/it]Generation:  14
Best f1_score score: 0.8449139008670823
Generation:  56%|█████▌    | 14/25 [1:26:52<1:31:31, 499.19s/it]Generation:  15
Best f1_score score: 0.8449139008670823
Generation:  60%|██████    | 15/25 [1:34:23<1:20:45, 484.57s/it]Generation:  16
Best f1_score score: 0.8449139008670823
Generation:  64%|██████▍   | 16/25 [1:42:04<1:11:37, 477.51s/it]Generation:  17
Best f1_score score: 0.8449139008670823
Generation:  68%|██████▊   | 17/25 [1:50:42<1:05:17, 489.65s/it]Generation:  18
Best f1_score score: 0.8464593020290498
Generation:  72%|███████▏  | 18/25 [1:58:15<55:50, 478.63s/it]  Generation:  19
Best f1_score score: 0.84698341813412
Generation:  76%|███████▌  | 19/25 [2:06:07<47:41, 476.89s/it]Generation:  20
Best f1_score score: 0.84698341813412
Generation:  80%|████████  | 20/25 [2:13:35<39:00, 468.11s/it]Generation:  21
Best f1_score score: 0.84698341813412
Generation:  84%|████████▍ | 21/25 [2:21:03<30:48, 462.18s/it]Generation:  22
Best f1_score score: 0.84698341813412
Generation:  88%|████████▊ | 22/25 [2:28:45<23:06, 462.01s/it]Generation:  23
Best f1_score score: 0.84698341813412
Generation:  92%|█████████▏| 23/25 [2:36:14<15:16, 458.04s/it]Generation:  24
Best f1_score score: 0.84698341813412
Generation:  96%|█████████▌| 24/25 [2:44:19<07:46, 466.20s/it]WARNING AN INDIVIDUAL TIMED OUT: 
 <tpot2.search_spaces.pipelines.sequential.SequentialPipelineIndividual object at 0x1554531e6110> 

Generation:  25
Best f1_score score: 0.84698341813412
Generation: 100%|██████████| 25/25 [2:54:24<00:00, 507.73s/it]Generation: 100%|██████████| 25/25 [2:54:24<00:00, 418.57s/it]
2024-10-23 00:25:10,973 - distributed.scheduler - ERROR - Removing worker 'tcp://127.0.0.1:37829' caused the cluster to lose scattered data, which can't be recovered: {'ndarray-b5f468972b7ffa9aa2eaa92c4caed8b0', 'DataFrame-5f1f68e47177474e4d437cd8cbedcb24'} (stimulus_id='handle-worker-cleanup-1729668310.9730818')
Fitted
Pipeline(steps=[('iterativeimputer',
                 IterativeImputer(estimator=RandomForestRegressor(),
                                  initial_strategy='constant',
                                  n_nearest_features=76)),
                ('lgbmclassifier',
                 LGBMClassifier(max_depth=10, n_estimators=82, n_jobs=1,
                                num_leaves=199, verbose=-1))])
transform worked
try transform
transform worked
score start
train score: {'auroc': 0.9951265581808898, 'accuracy': 0.9994410909903868, 'balanced_accuracy': 0.9879807692307692, 'logloss': 0.0055308608129809676, 'f1': 0.9937742625256953}
test score: {'auroc': 0.9341577187114944, 'accuracy': 0.9879302637460885, 'balanced_accuracy': 0.7967039253652526, 'logloss': 0.05670363642124536, 'f1': 0.8452359294325651}
original test score: {'auroc': 0.933849674353107, 'accuracy': 0.9883772910147519, 'balanced_accuracy': 0.7969327583171977, 'logloss': 0.05533411015871573, 'f1': 0.8493087509845376}
score end
310
lvl
0.01
type
MNAR
num_run
1
class_full
finished
all finished
full run takes
6.939026687145233
hours
DONE
