[I 2024-10-22 11:42:34,749] Trial 164 finished with value: 0.20395105841617758 and parameters: {'model_name': 'KNNImputer', 'n_neighbors': 7248, 'weights': 'distance'}. Best is trial 129 with value: 0.16022705138057977.
running
[I 2024-10-22 11:43:01,663] Trial 165 finished with value: 0.16673586908864374 and parameters: {'model_name': 'IterativeImputer', 'estimator': 'Bayesian', 'initial_strategy': 'median', 'n_nearest_features': 8, 'imputation_order': 'random', 'sample_posterior': False}. Best is trial 129 with value: 0.16022705138057977.
running
[I 2024-10-22 11:44:29,369] Trial 139 finished with value: 0.1609028951565263 and parameters: {'model_name': 'IterativeImputer', 'estimator': 'RFR', 'initial_strategy': 'median', 'n_nearest_features': 9, 'imputation_order': 'random'}. Best is trial 129 with value: 0.16022705138057977.
running
[I 2024-10-22 11:45:53,983] Trial 140 finished with value: 0.1604699962031219 and parameters: {'model_name': 'IterativeImputer', 'estimator': 'RFR', 'initial_strategy': 'median', 'n_nearest_features': 8, 'imputation_order': 'random'}. Best is trial 129 with value: 0.16022705138057977.
running
[I 2024-10-22 11:59:34,840] Trial 144 finished with value: 0.1606902425117651 and parameters: {'model_name': 'IterativeImputer', 'estimator': 'RFR', 'initial_strategy': 'median', 'n_nearest_features': 8, 'imputation_order': 'random'}. Best is trial 129 with value: 0.16022705138057977.
running
[I 2024-10-22 12:00:35,499] Trial 146 finished with value: 0.16071255930237174 and parameters: {'model_name': 'IterativeImputer', 'estimator': 'RFR', 'initial_strategy': 'median', 'n_nearest_features': 8, 'imputation_order': 'random'}. Best is trial 129 with value: 0.16022705138057977.
running
[I 2024-10-22 12:06:41,724] Trial 149 finished with value: 0.16027970197388788 and parameters: {'model_name': 'IterativeImputer', 'estimator': 'RFR', 'initial_strategy': 'median', 'n_nearest_features': 8, 'imputation_order': 'random'}. Best is trial 129 with value: 0.16022705138057977.
running
[I 2024-10-22 12:19:27,781] Trial 153 finished with value: 0.1609234932317194 and parameters: {'model_name': 'IterativeImputer', 'estimator': 'RFR', 'initial_strategy': 'median', 'n_nearest_features': 8, 'imputation_order': 'random'}. Best is trial 129 with value: 0.16022705138057977.
running
[I 2024-10-22 12:24:31,741] Trial 154 finished with value: 0.1610107433946299 and parameters: {'model_name': 'IterativeImputer', 'estimator': 'RFR', 'initial_strategy': 'median', 'n_nearest_features': 8, 'imputation_order': 'random'}. Best is trial 129 with value: 0.16022705138057977.
running
[I 2024-10-22 12:24:34,996] Trial 173 finished with value: 0.27300759843788686 and parameters: {'model_name': 'GAIN', 'batch_size': 70, 'hint_rate': 0.8158064358562279, 'alpha': 36, 'iterations': 87, 'learning_rate': 0.003686474469543996, 'p_miss': 0.19997827624633066}. Best is trial 129 with value: 0.16022705138057977.
running
[I 2024-10-22 12:25:12,892] Trial 155 finished with value: 0.16092256795613175 and parameters: {'model_name': 'IterativeImputer', 'estimator': 'RFR', 'initial_strategy': 'median', 'n_nearest_features': 8, 'imputation_order': 'random'}. Best is trial 129 with value: 0.16022705138057977.
running
[I 2024-10-22 12:26:37,269] Trial 156 finished with value: 0.16040906933492521 and parameters: {'model_name': 'IterativeImputer', 'estimator': 'RFR', 'initial_strategy': 'median', 'n_nearest_features': 8, 'imputation_order': 'random'}. Best is trial 129 with value: 0.16022705138057977.
running
[I 2024-10-22 12:29:59,500] Trial 157 finished with value: 0.1601283659114947 and parameters: {'model_name': 'IterativeImputer', 'estimator': 'RFR', 'initial_strategy': 'median', 'n_nearest_features': 8, 'imputation_order': 'random'}. Best is trial 157 with value: 0.1601283659114947.
running
[I 2024-10-22 12:33:17,785] Trial 158 finished with value: 0.16051650904988793 and parameters: {'model_name': 'IterativeImputer', 'estimator': 'RFR', 'initial_strategy': 'median', 'n_nearest_features': 8, 'imputation_order': 'random'}. Best is trial 157 with value: 0.1601283659114947.
running
[I 2024-10-22 12:37:08,351] Trial 159 finished with value: 0.1605708403077209 and parameters: {'model_name': 'IterativeImputer', 'estimator': 'RFR', 'initial_strategy': 'median', 'n_nearest_features': 8, 'imputation_order': 'random'}. Best is trial 157 with value: 0.1601283659114947.
running
[I 2024-10-22 12:39:16,404] Trial 160 finished with value: 0.16068545384406047 and parameters: {'model_name': 'IterativeImputer', 'estimator': 'RFR', 'initial_strategy': 'median', 'n_nearest_features': 8, 'imputation_order': 'random'}. Best is trial 157 with value: 0.1601283659114947.
running
[I 2024-10-22 12:43:44,415] Trial 161 finished with value: 0.16099180626408108 and parameters: {'model_name': 'IterativeImputer', 'estimator': 'RFR', 'initial_strategy': 'median', 'n_nearest_features': 8, 'imputation_order': 'descending'}. Best is trial 157 with value: 0.1601283659114947.
running
[I 2024-10-22 12:44:48,897] Trial 163 finished with value: 0.16039205695356187 and parameters: {'model_name': 'IterativeImputer', 'estimator': 'RFR', 'initial_strategy': 'median', 'n_nearest_features': 8, 'imputation_order': 'random'}. Best is trial 157 with value: 0.1601283659114947.
running
[I 2024-10-22 12:45:58,009] Trial 166 finished with value: 0.16081855409849294 and parameters: {'model_name': 'IterativeImputer', 'estimator': 'RFR', 'initial_strategy': 'median', 'n_nearest_features': 9, 'imputation_order': 'random'}. Best is trial 157 with value: 0.1601283659114947.
running
[I 2024-10-22 12:45:58,266] Trial 183 finished with value: 0.2497187674733902 and parameters: {'model_name': 'SimpleImputer', 'strategy': 'median'}. Best is trial 157 with value: 0.1601283659114947.
running
[I 2024-10-22 12:47:22,968] Trial 167 finished with value: 0.1604943351061038 and parameters: {'model_name': 'IterativeImputer', 'estimator': 'RFR', 'initial_strategy': 'median', 'n_nearest_features': 9, 'imputation_order': 'random'}. Best is trial 157 with value: 0.1601283659114947.
running
[I 2024-10-22 12:48:56,350] Trial 168 finished with value: 0.160350327600374 and parameters: {'model_name': 'IterativeImputer', 'estimator': 'RFR', 'initial_strategy': 'median', 'n_nearest_features': 8, 'imputation_order': 'random'}. Best is trial 157 with value: 0.1601283659114947.
running
[I 2024-10-22 13:02:43,761] Trial 169 finished with value: 0.16082864587101628 and parameters: {'model_name': 'IterativeImputer', 'estimator': 'RFR', 'initial_strategy': 'median', 'n_nearest_features': 8, 'imputation_order': 'random'}. Best is trial 157 with value: 0.1601283659114947.
running
[I 2024-10-22 13:03:48,978] Trial 170 finished with value: 0.16067095350088625 and parameters: {'model_name': 'IterativeImputer', 'estimator': 'RFR', 'initial_strategy': 'median', 'n_nearest_features': 8, 'imputation_order': 'random'}. Best is trial 157 with value: 0.1601283659114947.
running
[I 2024-10-22 13:09:43,717] Trial 171 finished with value: 0.1606362045287546 and parameters: {'model_name': 'IterativeImputer', 'estimator': 'RFR', 'initial_strategy': 'median', 'n_nearest_features': 8, 'imputation_order': 'random'}. Best is trial 157 with value: 0.1601283659114947.
running
[I 2024-10-22 13:19:08,428] Trial 174 finished with value: 0.1623489163427178 and parameters: {'model_name': 'IterativeImputer', 'estimator': 'RFR', 'initial_strategy': 'median', 'n_nearest_features': 7, 'imputation_order': 'random'}. Best is trial 157 with value: 0.1601283659114947.
running
[I 2024-10-22 13:21:17,972] Trial 176 finished with value: 0.16207354764832965 and parameters: {'model_name': 'IterativeImputer', 'estimator': 'RFR', 'initial_strategy': 'median', 'n_nearest_features': 7, 'imputation_order': 'random'}. Best is trial 157 with value: 0.1601283659114947.
running
[I 2024-10-22 13:22:30,946] Trial 172 finished with value: 0.16043567194915204 and parameters: {'model_name': 'IterativeImputer', 'estimator': 'RFR', 'initial_strategy': 'median', 'n_nearest_features': 8, 'imputation_order': 'random'}. Best is trial 157 with value: 0.1601283659114947.
running
[I 2024-10-22 13:24:35,566] Trial 177 finished with value: 0.1619190245300593 and parameters: {'model_name': 'IterativeImputer', 'estimator': 'RFR', 'initial_strategy': 'median', 'n_nearest_features': 7, 'imputation_order': 'random'}. Best is trial 157 with value: 0.1601283659114947.
running
[I 2024-10-22 13:27:48,815] Trial 178 finished with value: 0.16256653606848204 and parameters: {'model_name': 'IterativeImputer', 'estimator': 'RFR', 'initial_strategy': 'median', 'n_nearest_features': 7, 'imputation_order': 'random'}. Best is trial 157 with value: 0.1601283659114947.
running
[I 2024-10-22 13:28:20,909] Trial 175 finished with value: 0.16112072745473618 and parameters: {'model_name': 'IterativeImputer', 'estimator': 'RFR', 'initial_strategy': 'median', 'n_nearest_features': 8, 'imputation_order': 'random'}. Best is trial 157 with value: 0.1601283659114947.
running
[I 2024-10-22 13:31:45,397] Trial 179 finished with value: 0.16246131429925892 and parameters: {'model_name': 'IterativeImputer', 'estimator': 'RFR', 'initial_strategy': 'median', 'n_nearest_features': 7, 'imputation_order': 'random'}. Best is trial 157 with value: 0.1601283659114947.
running
[I 2024-10-22 13:38:19,191] Trial 181 finished with value: 0.16175946834520522 and parameters: {'model_name': 'IterativeImputer', 'estimator': 'RFR', 'initial_strategy': 'median', 'n_nearest_features': 7, 'imputation_order': 'random'}. Best is trial 157 with value: 0.1601283659114947.
running
[I 2024-10-22 13:39:21,320] Trial 182 finished with value: 0.16195394600718493 and parameters: {'model_name': 'IterativeImputer', 'estimator': 'RFR', 'initial_strategy': 'median', 'n_nearest_features': 7, 'imputation_order': 'random'}. Best is trial 157 with value: 0.1601283659114947.
running
[I 2024-10-22 13:40:34,194] Trial 184 finished with value: 0.16235468067888223 and parameters: {'model_name': 'IterativeImputer', 'estimator': 'RFR', 'initial_strategy': 'median', 'n_nearest_features': 7, 'imputation_order': 'random'}. Best is trial 157 with value: 0.1601283659114947.
running
[I 2024-10-22 13:41:53,191] Trial 185 finished with value: 0.1627199061520267 and parameters: {'model_name': 'IterativeImputer', 'estimator': 'RFR', 'initial_strategy': 'median', 'n_nearest_features': 7, 'imputation_order': 'random'}. Best is trial 157 with value: 0.1601283659114947.
[I 2024-10-22 13:42:26,751] Trial 180 finished with value: 0.1604251661444379 and parameters: {'model_name': 'IterativeImputer', 'estimator': 'RFR', 'initial_strategy': 'median', 'n_nearest_features': 8, 'imputation_order': 'random'}. Best is trial 157 with value: 0.1601283659114947.
[I 2024-10-22 13:43:24,962] Trial 186 finished with value: 0.16205159201915792 and parameters: {'model_name': 'IterativeImputer', 'estimator': 'RFR', 'initial_strategy': 'median', 'n_nearest_features': 7, 'imputation_order': 'random'}. Best is trial 157 with value: 0.1601283659114947.
[I 2024-10-22 13:57:08,229] Trial 187 finished with value: 0.16213666671678031 and parameters: {'model_name': 'IterativeImputer', 'estimator': 'RFR', 'initial_strategy': 'median', 'n_nearest_features': 7, 'imputation_order': 'random'}. Best is trial 157 with value: 0.1601283659114947.
[I 2024-10-22 13:58:22,650] Trial 188 finished with value: 0.1622814661146045 and parameters: {'model_name': 'IterativeImputer', 'estimator': 'RFR', 'initial_strategy': 'median', 'n_nearest_features': 7, 'imputation_order': 'random'}. Best is trial 157 with value: 0.1601283659114947.
[I 2024-10-22 14:03:55,282] Trial 189 finished with value: 0.16261043458899366 and parameters: {'model_name': 'IterativeImputer', 'estimator': 'RFR', 'initial_strategy': 'median', 'n_nearest_features': 7, 'imputation_order': 'random'}. Best is trial 157 with value: 0.1601283659114947.
[I 2024-10-22 14:13:05,966] Trial 190 finished with value: 0.16261899121410486 and parameters: {'model_name': 'IterativeImputer', 'estimator': 'RFR', 'initial_strategy': 'median', 'n_nearest_features': 7, 'imputation_order': 'random'}. Best is trial 157 with value: 0.1601283659114947.
[I 2024-10-22 14:15:04,980] Trial 191 finished with value: 0.16216700698357572 and parameters: {'model_name': 'IterativeImputer', 'estimator': 'RFR', 'initial_strategy': 'median', 'n_nearest_features': 7, 'imputation_order': 'random'}. Best is trial 157 with value: 0.1601283659114947.
[I 2024-10-22 14:16:13,222] Trial 192 finished with value: 0.1623558368698997 and parameters: {'model_name': 'IterativeImputer', 'estimator': 'RFR', 'initial_strategy': 'median', 'n_nearest_features': 7, 'imputation_order': 'random'}. Best is trial 157 with value: 0.1601283659114947.
[I 2024-10-22 14:26:36,614] Trial 193 finished with value: 0.160659910145414 and parameters: {'model_name': 'IterativeImputer', 'estimator': 'RFR', 'initial_strategy': 'median', 'n_nearest_features': 8, 'imputation_order': 'random'}. Best is trial 157 with value: 0.1601283659114947.
[I 2024-10-22 14:29:45,120] Trial 194 finished with value: 0.1609323101507441 and parameters: {'model_name': 'IterativeImputer', 'estimator': 'RFR', 'initial_strategy': 'median', 'n_nearest_features': 8, 'imputation_order': 'ascending'}. Best is trial 157 with value: 0.1601283659114947.
[I 2024-10-22 14:30:19,526] Trial 195 finished with value: 0.16092437408997268 and parameters: {'model_name': 'IterativeImputer', 'estimator': 'RFR', 'initial_strategy': 'median', 'n_nearest_features': 8, 'imputation_order': 'ascending'}. Best is trial 157 with value: 0.1601283659114947.
[I 2024-10-22 14:33:30,959] Trial 196 finished with value: 0.16021267443902612 and parameters: {'model_name': 'IterativeImputer', 'estimator': 'RFR', 'initial_strategy': 'median', 'n_nearest_features': 8, 'imputation_order': 'random'}. Best is trial 157 with value: 0.1601283659114947.
[I 2024-10-22 14:39:54,389] Trial 197 finished with value: 0.16066851743956678 and parameters: {'model_name': 'IterativeImputer', 'estimator': 'RFR', 'initial_strategy': 'median', 'n_nearest_features': 8, 'imputation_order': 'ascending'}. Best is trial 157 with value: 0.1601283659114947.
[I 2024-10-22 14:40:54,203] Trial 198 finished with value: 0.16064894608199926 and parameters: {'model_name': 'IterativeImputer', 'estimator': 'RFR', 'initial_strategy': 'median', 'n_nearest_features': 8, 'imputation_order': 'random'}. Best is trial 157 with value: 0.1601283659114947.
