[I 2024-10-22 18:32:40,084] Trial 91 finished with value: 0.4337115374548321 and parameters: {'model_name': 'VAE', 'batch_size': 11, 'iterations': 14, 'learning_rate': 0.0009676324400089393, 'p_miss': 0.12255712621654427}. Best is trial 45 with value: 0.07207007699634572.
running
[I 2024-10-22 18:32:43,114] Trial 79 finished with value: 0.07456037051018204 and parameters: {'model_name': 'IterativeImputer', 'estimator': 'RFR', 'initial_strategy': 'mean', 'n_nearest_features': 5, 'imputation_order': 'arabic'}. Best is trial 45 with value: 0.07207007699634572.
running
[I 2024-10-22 18:33:05,925] Trial 78 finished with value: 0.07754341021778133 and parameters: {'model_name': 'IterativeImputer', 'estimator': 'RFR', 'initial_strategy': 'mean', 'n_nearest_features': 5, 'imputation_order': 'arabic'}. Best is trial 45 with value: 0.07207007699634572.
running
[I 2024-10-22 18:33:24,152] Trial 94 finished with value: 0.1805829761208635 and parameters: {'model_name': 'IterativeImputer', 'estimator': 'Bayesian', 'initial_strategy': 'mean', 'n_nearest_features': 3, 'imputation_order': 'ascending', 'sample_posterior': True}. Best is trial 45 with value: 0.07207007699634572.
running
[I 2024-10-22 18:34:42,071] Trial 86 finished with value: 0.0788367365549479 and parameters: {'model_name': 'IterativeImputer', 'estimator': 'RFR', 'initial_strategy': 'most_frequent', 'n_nearest_features': 3, 'imputation_order': 'ascending'}. Best is trial 45 with value: 0.07207007699634572.
running
[I 2024-10-22 18:36:33,927] Trial 70 finished with value: inf and parameters: {'model_name': 'GAIN', 'batch_size': 1, 'hint_rate': 0.9837406657740622, 'alpha': 46, 'iterations': 8610, 'learning_rate': 0.017089784506184827, 'p_miss': 0.299965329679878}. Best is trial 45 with value: 0.07207007699634572.
running
[I 2024-10-22 18:42:11,542] Trial 80 finished with value: 0.172396445409575 and parameters: {'model_name': 'VAE', 'batch_size': 11, 'iterations': 642, 'learning_rate': 0.0009750620594221271, 'p_miss': 0.12055851210969268}. Best is trial 45 with value: 0.07207007699634572.
running
[I 2024-10-22 18:50:19,861] Trial 93 finished with value: 0.0840378053675578 and parameters: {'model_name': 'IterativeImputer', 'estimator': 'RFR', 'initial_strategy': 'mean', 'n_nearest_features': 3, 'imputation_order': 'ascending'}. Best is trial 45 with value: 0.07207007699634572.
running
[I 2024-10-22 18:51:02,713] Trial 82 finished with value: 0.17376134112759817 and parameters: {'model_name': 'VAE', 'batch_size': 8, 'iterations': 845, 'learning_rate': 0.0010892320210985403, 'p_miss': 0.12414276716634974}. Best is trial 45 with value: 0.07207007699634572.
running
[I 2024-10-22 18:51:55,829] Trial 84 finished with value: 0.17548650198381116 and parameters: {'model_name': 'VAE', 'batch_size': 11, 'iterations': 850, 'learning_rate': 0.0010591074899508502, 'p_miss': 0.12160039609457514}. Best is trial 45 with value: 0.07207007699634572.
running
[I 2024-10-22 18:55:34,763] Trial 83 finished with value: 0.17525148300963914 and parameters: {'model_name': 'VAE', 'batch_size': 13, 'iterations': 922, 'learning_rate': 0.0008783486449961093, 'p_miss': 0.12154356570513056}. Best is trial 45 with value: 0.07207007699634572.
running
[I 2024-10-22 18:57:25,590] Trial 85 finished with value: 0.1718581231748348 and parameters: {'model_name': 'VAE', 'batch_size': 16, 'iterations': 921, 'learning_rate': 0.0011252838130007205, 'p_miss': 0.11612209087411654}. Best is trial 45 with value: 0.07207007699634572.
running
[I 2024-10-22 18:58:37,416] Trial 81 finished with value: 0.1734625943029077 and parameters: {'model_name': 'VAE', 'batch_size': 14, 'iterations': 917, 'learning_rate': 0.0016546887796399996, 'p_miss': 0.13209869656835496}. Best is trial 45 with value: 0.07207007699634572.
running
[I 2024-10-22 19:02:36,013] Trial 98 finished with value: 0.07683333193634705 and parameters: {'model_name': 'IterativeImputer', 'estimator': 'RFR', 'initial_strategy': 'mean', 'n_nearest_features': 6, 'imputation_order': 'descending'}. Best is trial 45 with value: 0.07207007699634572.
running
[I 2024-10-22 19:06:07,052] Trial 87 finished with value: 0.1736439959196584 and parameters: {'model_name': 'VAE', 'batch_size': 9, 'iterations': 891, 'learning_rate': 0.0008443831831252601, 'p_miss': 0.10877094303028359}. Best is trial 45 with value: 0.07207007699634572.
running
[I 2024-10-22 19:08:09,968] Trial 88 finished with value: 0.17374955849719273 and parameters: {'model_name': 'VAE', 'batch_size': 11, 'iterations': 923, 'learning_rate': 0.0011558881361162358, 'p_miss': 0.1200322994409741}. Best is trial 45 with value: 0.07207007699634572.
running
[I 2024-10-22 19:09:37,953] Trial 90 finished with value: 0.17320550588398337 and parameters: {'model_name': 'VAE', 'batch_size': 13, 'iterations': 828, 'learning_rate': 0.0011450939002149814, 'p_miss': 0.12412873209570041}. Best is trial 45 with value: 0.07207007699634572.
running
[I 2024-10-22 19:10:52,789] Trial 99 finished with value: 0.07801441359315496 and parameters: {'model_name': 'IterativeImputer', 'estimator': 'RFR', 'initial_strategy': 'mean', 'n_nearest_features': 6, 'imputation_order': 'descending'}. Best is trial 45 with value: 0.07207007699634572.
running
[I 2024-10-22 19:10:58,018] Trial 100 finished with value: 0.07687639207698616 and parameters: {'model_name': 'IterativeImputer', 'estimator': 'RFR', 'initial_strategy': 'mean', 'n_nearest_features': 6, 'imputation_order': 'descending'}. Best is trial 45 with value: 0.07207007699634572.
running
[I 2024-10-22 19:12:11,497] Trial 101 finished with value: 0.07526357388838435 and parameters: {'model_name': 'IterativeImputer', 'estimator': 'RFR', 'initial_strategy': 'mean', 'n_nearest_features': 6, 'imputation_order': 'arabic'}. Best is trial 45 with value: 0.07207007699634572.
running
[I 2024-10-22 19:12:51,446] Trial 95 finished with value: 0.19766424149740697 and parameters: {'model_name': 'VAE', 'batch_size': 3, 'iterations': 829, 'learning_rate': 0.01745840415375303, 'p_miss': 0.158338728415389}. Best is trial 45 with value: 0.07207007699634572.
running
[I 2024-10-22 19:15:49,716] Trial 102 finished with value: 0.07784465347571934 and parameters: {'model_name': 'IterativeImputer', 'estimator': 'RFR', 'initial_strategy': 'mean', 'n_nearest_features': 6, 'imputation_order': 'descending'}. Best is trial 45 with value: 0.07207007699634572.
running
[I 2024-10-22 19:17:43,936] Trial 103 finished with value: 0.07651504806698076 and parameters: {'model_name': 'IterativeImputer', 'estimator': 'RFR', 'initial_strategy': 'mean', 'n_nearest_features': 6, 'imputation_order': 'descending'}. Best is trial 45 with value: 0.07207007699634572.
running
[I 2024-10-22 19:18:56,846] Trial 104 finished with value: 0.07709739526743555 and parameters: {'model_name': 'IterativeImputer', 'estimator': 'RFR', 'initial_strategy': 'mean', 'n_nearest_features': 6, 'imputation_order': 'arabic'}. Best is trial 45 with value: 0.07207007699634572.
running
[I 2024-10-22 19:19:54,479] Trial 92 finished with value: 0.17781781225631474 and parameters: {'model_name': 'VAE', 'batch_size': 4, 'iterations': 1034, 'learning_rate': 0.010595841280422964, 'p_miss': 0.15883994507612786}. Best is trial 45 with value: 0.07207007699634572.
running
[I 2024-10-22 19:22:46,323] Trial 105 finished with value: 0.0749688290910576 and parameters: {'model_name': 'IterativeImputer', 'estimator': 'RFR', 'initial_strategy': 'constant', 'n_nearest_features': 6, 'imputation_order': 'arabic'}. Best is trial 45 with value: 0.07207007699634572.
running
[I 2024-10-22 19:26:14,867] Trial 106 finished with value: 0.07782622205791222 and parameters: {'model_name': 'IterativeImputer', 'estimator': 'RFR', 'initial_strategy': 'most_frequent', 'n_nearest_features': 5, 'imputation_order': 'arabic'}. Best is trial 45 with value: 0.07207007699634572.
running
[I 2024-10-22 19:26:18,190] Trial 96 finished with value: 0.17837946367811025 and parameters: {'model_name': 'VAE', 'batch_size': 5, 'iterations': 1066, 'learning_rate': 0.012568198433160028, 'p_miss': 0.17721717705584322}. Best is trial 45 with value: 0.07207007699634572.
running
[I 2024-10-22 19:27:09,124] Trial 97 finished with value: 0.17695035775275653 and parameters: {'model_name': 'VAE', 'batch_size': 4, 'iterations': 1139, 'learning_rate': 0.0921340680904897, 'p_miss': 0.1707658424033659}. Best is trial 45 with value: 0.07207007699634572.
running
[I 2024-10-22 19:28:29,684] Trial 107 finished with value: 0.07614000384476954 and parameters: {'model_name': 'IterativeImputer', 'estimator': 'RFR', 'initial_strategy': 'most_frequent', 'n_nearest_features': 5, 'imputation_order': 'arabic'}. Best is trial 45 with value: 0.07207007699634572.
running
[I 2024-10-22 19:29:48,893] Trial 108 finished with value: 0.07552969553972232 and parameters: {'model_name': 'IterativeImputer', 'estimator': 'RFR', 'initial_strategy': 'most_frequent', 'n_nearest_features': 5, 'imputation_order': 'arabic'}. Best is trial 45 with value: 0.07207007699634572.
running
[I 2024-10-22 19:30:57,057] Trial 109 finished with value: 0.07490724998150268 and parameters: {'model_name': 'IterativeImputer', 'estimator': 'RFR', 'initial_strategy': 'most_frequent', 'n_nearest_features': 5, 'imputation_order': 'arabic'}. Best is trial 45 with value: 0.07207007699634572.
running
[I 2024-10-22 19:31:09,496] Trial 110 finished with value: 0.07251063517352667 and parameters: {'model_name': 'IterativeImputer', 'estimator': 'RFR', 'initial_strategy': 'most_frequent', 'n_nearest_features': 5, 'imputation_order': 'random'}. Best is trial 45 with value: 0.07207007699634572.
running
[I 2024-10-22 19:31:29,182] Trial 124 finished with value: 0.13600686950733426 and parameters: {'model_name': 'IterativeImputer', 'estimator': 'Ridge', 'initial_strategy': 'constant', 'n_nearest_features': 6, 'imputation_order': 'random'}. Best is trial 45 with value: 0.07207007699634572.
running
[I 2024-10-22 19:32:29,255] Trial 111 finished with value: 0.07585719411149416 and parameters: {'model_name': 'IterativeImputer', 'estimator': 'RFR', 'initial_strategy': 'constant', 'n_nearest_features': 6, 'imputation_order': 'arabic'}. Best is trial 45 with value: 0.07207007699634572.
running
[I 2024-10-22 19:33:12,557] Trial 112 finished with value: 0.07458431102095042 and parameters: {'model_name': 'IterativeImputer', 'estimator': 'RFR', 'initial_strategy': 'constant', 'n_nearest_features': 6, 'imputation_order': 'arabic'}. Best is trial 45 with value: 0.07207007699634572.
running
[I 2024-10-22 19:36:17,153] Trial 113 finished with value: 0.07409915643995965 and parameters: {'model_name': 'IterativeImputer', 'estimator': 'RFR', 'initial_strategy': 'constant', 'n_nearest_features': 5, 'imputation_order': 'arabic'}. Best is trial 45 with value: 0.07207007699634572.
running
[I 2024-10-22 19:38:19,630] Trial 114 finished with value: 0.07503083223953658 and parameters: {'model_name': 'IterativeImputer', 'estimator': 'RFR', 'initial_strategy': 'constant', 'n_nearest_features': 5, 'imputation_order': 'arabic'}. Best is trial 45 with value: 0.07207007699634572.
running
[I 2024-10-22 19:39:11,782] Trial 115 finished with value: 0.0739348451065609 and parameters: {'model_name': 'IterativeImputer', 'estimator': 'RFR', 'initial_strategy': 'constant', 'n_nearest_features': 5, 'imputation_order': 'random'}. Best is trial 45 with value: 0.07207007699634572.
running
[I 2024-10-22 19:39:52,069] Trial 116 finished with value: 0.07432959375971673 and parameters: {'model_name': 'IterativeImputer', 'estimator': 'RFR', 'initial_strategy': 'most_frequent', 'n_nearest_features': 5, 'imputation_order': 'random'}. Best is trial 45 with value: 0.07207007699634572.
running
[I 2024-10-22 19:39:59,151] Trial 131 finished with value: 0.13674206997031613 and parameters: {'model_name': 'KNNImputer', 'n_neighbors': 8383, 'weights': 'distance'}. Best is trial 45 with value: 0.07207007699634572.
running
[I 2024-10-22 19:40:42,754] Trial 132 finished with value: 0.1449788166240426 and parameters: {'model_name': 'IterativeImputer', 'estimator': 'Bayesian', 'initial_strategy': 'constant', 'n_nearest_features': 5, 'imputation_order': 'random', 'sample_posterior': False}. Best is trial 45 with value: 0.07207007699634572.
running
[I 2024-10-22 19:40:43,387] Trial 133 finished with value: 0.2405879455303827 and parameters: {'model_name': 'SimpleImputer', 'strategy': 'median'}. Best is trial 45 with value: 0.07207007699634572.
running
[I 2024-10-22 19:43:30,402] Trial 117 finished with value: 0.07528092804508149 and parameters: {'model_name': 'IterativeImputer', 'estimator': 'RFR', 'initial_strategy': 'constant', 'n_nearest_features': 5, 'imputation_order': 'arabic'}. Best is trial 45 with value: 0.07207007699634572.
running
[I 2024-10-22 19:46:46,275] Trial 118 finished with value: 0.07212323183070976 and parameters: {'model_name': 'IterativeImputer', 'estimator': 'RFR', 'initial_strategy': 'constant', 'n_nearest_features': 5, 'imputation_order': 'random'}. Best is trial 45 with value: 0.07207007699634572.
running
[I 2024-10-22 19:46:57,910] Trial 119 finished with value: 0.07229808278262903 and parameters: {'model_name': 'IterativeImputer', 'estimator': 'RFR', 'initial_strategy': 'constant', 'n_nearest_features': 5, 'imputation_order': 'random'}. Best is trial 45 with value: 0.07207007699634572.
running
[I 2024-10-22 19:47:47,112] Trial 120 finished with value: 0.07535088525059341 and parameters: {'model_name': 'IterativeImputer', 'estimator': 'RFR', 'initial_strategy': 'constant', 'n_nearest_features': 5, 'imputation_order': 'random'}. Best is trial 45 with value: 0.07207007699634572.
running
[I 2024-10-22 19:49:16,963] Trial 121 finished with value: 0.07501209213920754 and parameters: {'model_name': 'IterativeImputer', 'estimator': 'RFR', 'initial_strategy': 'constant', 'n_nearest_features': 6, 'imputation_order': 'random'}. Best is trial 45 with value: 0.07207007699634572.
running
[I 2024-10-22 19:50:15,922] Trial 122 finished with value: 0.07280312913153458 and parameters: {'model_name': 'IterativeImputer', 'estimator': 'RFR', 'initial_strategy': 'constant', 'n_nearest_features': 6, 'imputation_order': 'random'}. Best is trial 45 with value: 0.07207007699634572.
running
[I 2024-10-22 19:51:21,560] Trial 123 finished with value: 0.07627373217783115 and parameters: {'model_name': 'IterativeImputer', 'estimator': 'RFR', 'initial_strategy': 'constant', 'n_nearest_features': 6, 'imputation_order': 'arabic'}. Best is trial 45 with value: 0.07207007699634572.
running
[I 2024-10-22 19:51:53,635] Trial 125 finished with value: 0.07181838140531518 and parameters: {'model_name': 'IterativeImputer', 'estimator': 'RFR', 'initial_strategy': 'constant', 'n_nearest_features': 6, 'imputation_order': 'random'}. Best is trial 125 with value: 0.07181838140531518.
running
[I 2024-10-22 19:52:28,658] Trial 126 finished with value: 0.0736392257155066 and parameters: {'model_name': 'IterativeImputer', 'estimator': 'RFR', 'initial_strategy': 'constant', 'n_nearest_features': 5, 'imputation_order': 'random'}. Best is trial 125 with value: 0.07181838140531518.
running
[I 2024-10-22 19:52:38,358] Trial 143 finished with value: 0.15247826713537677 and parameters: {'model_name': 'IterativeImputer', 'estimator': 'Ridge', 'initial_strategy': 'constant', 'n_nearest_features': 1, 'imputation_order': 'random'}. Best is trial 125 with value: 0.07181838140531518.
running
[I 2024-10-22 19:53:39,016] Trial 127 finished with value: 0.0741708013844666 and parameters: {'model_name': 'IterativeImputer', 'estimator': 'RFR', 'initial_strategy': 'constant', 'n_nearest_features': 6, 'imputation_order': 'random'}. Best is trial 125 with value: 0.07181838140531518.
running
[I 2024-10-22 19:56:19,844] Trial 128 finished with value: 0.07519862434122207 and parameters: {'model_name': 'IterativeImputer', 'estimator': 'RFR', 'initial_strategy': 'constant', 'n_nearest_features': 5, 'imputation_order': 'random'}. Best is trial 125 with value: 0.07181838140531518.
running
[I 2024-10-22 19:58:34,099] Trial 129 finished with value: 0.07359564128567708 and parameters: {'model_name': 'IterativeImputer', 'estimator': 'RFR', 'initial_strategy': 'constant', 'n_nearest_features': 5, 'imputation_order': 'random'}. Best is trial 125 with value: 0.07181838140531518.
running
[I 2024-10-22 19:59:23,409] Trial 130 finished with value: 0.07306064094015606 and parameters: {'model_name': 'IterativeImputer', 'estimator': 'RFR', 'initial_strategy': 'constant', 'n_nearest_features': 5, 'imputation_order': 'random'}. Best is trial 125 with value: 0.07181838140531518.
running
[I 2024-10-22 20:00:05,308] Trial 134 finished with value: 0.07278560607339529 and parameters: {'model_name': 'IterativeImputer', 'estimator': 'RFR', 'initial_strategy': 'constant', 'n_nearest_features': 5, 'imputation_order': 'random'}. Best is trial 125 with value: 0.07181838140531518.
running
[I 2024-10-22 20:02:09,016] Trial 139 finished with value: 0.12670683696026983 and parameters: {'model_name': 'IterativeImputer', 'estimator': 'RFR', 'initial_strategy': 'constant', 'n_nearest_features': 1, 'imputation_order': 'random'}. Best is trial 125 with value: 0.07181838140531518.
running
[I 2024-10-22 20:03:10,031] Trial 135 finished with value: 0.07126462084779589 and parameters: {'model_name': 'IterativeImputer', 'estimator': 'RFR', 'initial_strategy': 'constant', 'n_nearest_features': 5, 'imputation_order': 'random'}. Best is trial 135 with value: 0.07126462084779589.
running
[I 2024-10-22 20:03:54,161] Trial 142 finished with value: 0.12802905166689169 and parameters: {'model_name': 'IterativeImputer', 'estimator': 'RFR', 'initial_strategy': 'constant', 'n_nearest_features': 1, 'imputation_order': 'random'}. Best is trial 135 with value: 0.07126462084779589.
running
[I 2024-10-22 20:06:26,444] Trial 136 finished with value: 0.07311309680567953 and parameters: {'model_name': 'IterativeImputer', 'estimator': 'RFR', 'initial_strategy': 'constant', 'n_nearest_features': 5, 'imputation_order': 'random'}. Best is trial 135 with value: 0.07126462084779589.
running
[I 2024-10-22 20:06:39,815] Trial 137 finished with value: 0.07346130146409616 and parameters: {'model_name': 'IterativeImputer', 'estimator': 'RFR', 'initial_strategy': 'constant', 'n_nearest_features': 5, 'imputation_order': 'random'}. Best is trial 135 with value: 0.07126462084779589.
running
[I 2024-10-22 20:06:48,925] Trial 153 finished with value: 0.2456363844171281 and parameters: {'model_name': 'GAIN', 'batch_size': 40, 'hint_rate': 0.6207021664171855, 'alpha': 100, 'iterations': 13, 'learning_rate': 0.00028415079148160497, 'p_miss': 0.2609173849049228}. Best is trial 135 with value: 0.07126462084779589.
running
[I 2024-10-22 20:06:54,523] Trial 155 finished with value: 0.13674206997031613 and parameters: {'model_name': 'KNNImputer', 'n_neighbors': 8923, 'weights': 'distance'}. Best is trial 135 with value: 0.07126462084779589.
running
[I 2024-10-22 20:06:55,286] Trial 154 finished with value: 0.2526948684397531 and parameters: {'model_name': 'GAIN', 'batch_size': 64, 'hint_rate': 0.6097199881635098, 'alpha': 100, 'iterations': 8, 'learning_rate': 0.0002890978432997588, 'p_miss': 0.2550655863821769}. Best is trial 135 with value: 0.07126462084779589.
running
[I 2024-10-22 20:07:17,528] Trial 138 finished with value: 0.07421420059622462 and parameters: {'model_name': 'IterativeImputer', 'estimator': 'RFR', 'initial_strategy': 'constant', 'n_nearest_features': 5, 'imputation_order': 'random'}. Best is trial 135 with value: 0.07126462084779589.
running
[I 2024-10-22 20:09:21,787] Trial 140 finished with value: 0.07305733701110523 and parameters: {'model_name': 'IterativeImputer', 'estimator': 'RFR', 'initial_strategy': 'constant', 'n_nearest_features': 5, 'imputation_order': 'random'}. Best is trial 135 with value: 0.07126462084779589.
running
[I 2024-10-22 20:10:31,146] Trial 141 finished with value: 0.07383279759056996 and parameters: {'model_name': 'IterativeImputer', 'estimator': 'RFR', 'initial_strategy': 'constant', 'n_nearest_features': 5, 'imputation_order': 'random'}. Best is trial 135 with value: 0.07126462084779589.
running
[I 2024-10-22 20:11:45,455] Trial 144 finished with value: 0.07405719809440546 and parameters: {'model_name': 'IterativeImputer', 'estimator': 'RFR', 'initial_strategy': 'constant', 'n_nearest_features': 5, 'imputation_order': 'random'}. Best is trial 135 with value: 0.07126462084779589.
running
[I 2024-10-22 20:12:35,793] Trial 161 finished with value: 0.1449788166240426 and parameters: {'model_name': 'IterativeImputer', 'estimator': 'Bayesian', 'initial_strategy': 'constant', 'n_nearest_features': 5, 'imputation_order': 'random', 'sample_posterior': False}. Best is trial 135 with value: 0.07126462084779589.
running
[I 2024-10-22 20:13:22,516] Trial 145 finished with value: 0.07350492652851179 and parameters: {'model_name': 'IterativeImputer', 'estimator': 'RFR', 'initial_strategy': 'constant', 'n_nearest_features': 5, 'imputation_order': 'random'}. Best is trial 135 with value: 0.07126462084779589.
running
[I 2024-10-22 20:13:22,964] Trial 163 finished with value: 0.24187547203057597 and parameters: {'model_name': 'SimpleImputer', 'strategy': 'constant'}. Best is trial 135 with value: 0.07126462084779589.
running
[I 2024-10-22 20:15:18,457] Trial 146 finished with value: 0.07345698099852611 and parameters: {'model_name': 'IterativeImputer', 'estimator': 'RFR', 'initial_strategy': 'constant', 'n_nearest_features': 5, 'imputation_order': 'random'}. Best is trial 135 with value: 0.07126462084779589.
running
[I 2024-10-22 20:17:43,697] Trial 147 finished with value: 0.07310097013036732 and parameters: {'model_name': 'IterativeImputer', 'estimator': 'RFR', 'initial_strategy': 'constant', 'n_nearest_features': 5, 'imputation_order': 'random'}. Best is trial 135 with value: 0.07126462084779589.
running
