[I 2024-09-21 10:10:44,259] Trial 101 finished with value: 0.10324322835046014 and parameters: {'model_name': 'SimpleImputer', 'strategy': 'median'}. Best is trial 0 with value: 0.09532088706378058.
running
[I 2024-09-21 10:10:44,383] Trial 104 finished with value: 0.10324322835046014 and parameters: {'model_name': 'SimpleImputer', 'strategy': 'median'}. Best is trial 0 with value: 0.09532088706378058.
[I 2024-09-21 10:10:44,494] Trial 103 finished with value: 0.10324322835046014 and parameters: {'model_name': 'SimpleImputer', 'strategy': 'median'}. Best is trial 0 with value: 0.09532088706378058.
[I 2024-09-21 10:10:44,597] Trial 108 finished with value: 0.09532088706378058 and parameters: {'model_name': 'SimpleImputer', 'strategy': 'mean'}. Best is trial 0 with value: 0.09532088706378058.
running
[I 2024-09-21 10:10:44,705] Trial 109 finished with value: 0.09532088706378058 and parameters: {'model_name': 'SimpleImputer', 'strategy': 'mean'}. Best is trial 0 with value: 0.09532088706378058.
running
running
running
[I 2024-09-21 10:10:44,865] Trial 107 finished with value: 0.10324322835046014 and parameters: {'model_name': 'SimpleImputer', 'strategy': 'median'}. Best is trial 0 with value: 0.09532088706378058.
running
[I 2024-09-21 10:10:45,021] Trial 106 finished with value: 0.10324322835046014 and parameters: {'model_name': 'SimpleImputer', 'strategy': 'median'}. Best is trial 0 with value: 0.09532088706378058.
running
[I 2024-09-21 10:10:45,310] Trial 110 finished with value: 0.09532088706378058 and parameters: {'model_name': 'SimpleImputer', 'strategy': 'mean'}. Best is trial 0 with value: 0.09532088706378058.
[I 2024-09-21 10:10:45,451] Trial 112 finished with value: 0.09532088706378058 and parameters: {'model_name': 'SimpleImputer', 'strategy': 'mean'}. Best is trial 0 with value: 0.09532088706378058.
running
running
[I 2024-09-21 10:10:45,595] Trial 116 finished with value: 0.09532088706378058 and parameters: {'model_name': 'SimpleImputer', 'strategy': 'mean'}. Best is trial 0 with value: 0.09532088706378058.
running
[I 2024-09-21 10:10:45,722] Trial 111 finished with value: 0.09532088706378058 and parameters: {'model_name': 'SimpleImputer', 'strategy': 'mean'}. Best is trial 0 with value: 0.09532088706378058.
[I 2024-09-21 10:10:45,822] Trial 115 finished with value: 0.09532088706378058 and parameters: {'model_name': 'SimpleImputer', 'strategy': 'mean'}. Best is trial 0 with value: 0.09532088706378058.
running
[I 2024-09-21 10:10:45,930] Trial 113 finished with value: 0.09532088706378058 and parameters: {'model_name': 'SimpleImputer', 'strategy': 'mean'}. Best is trial 0 with value: 0.09532088706378058.
[I 2024-09-21 10:10:46,055] Trial 114 finished with value: 0.09532088706378058 and parameters: {'model_name': 'SimpleImputer', 'strategy': 'mean'}. Best is trial 0 with value: 0.09532088706378058.
running
running
running
[I 2024-09-21 10:10:46,205] Trial 118 finished with value: 0.09532088706378058 and parameters: {'model_name': 'SimpleImputer', 'strategy': 'mean'}. Best is trial 0 with value: 0.09532088706378058.
[I 2024-09-21 10:10:46,309] Trial 117 finished with value: 0.09532088706378058 and parameters: {'model_name': 'SimpleImputer', 'strategy': 'mean'}. Best is trial 0 with value: 0.09532088706378058.
running
running
[I 2024-09-21 10:10:46,452] Trial 124 finished with value: 0.09532088706378058 and parameters: {'model_name': 'SimpleImputer', 'strategy': 'mean'}. Best is trial 0 with value: 0.09532088706378058.
running
[I 2024-09-21 10:10:46,613] Trial 122 finished with value: 0.09532088706378058 and parameters: {'model_name': 'SimpleImputer', 'strategy': 'mean'}. Best is trial 0 with value: 0.09532088706378058.
running
[I 2024-09-21 10:10:46,752] Trial 123 finished with value: 0.09532088706378058 and parameters: {'model_name': 'SimpleImputer', 'strategy': 'mean'}. Best is trial 0 with value: 0.09532088706378058.
[I 2024-09-21 10:10:46,757] Trial 121 finished with value: 0.09532088706378058 and parameters: {'model_name': 'SimpleImputer', 'strategy': 'mean'}. Best is trial 0 with value: 0.09532088706378058.
running
running
[I 2024-09-21 10:10:46,990] Trial 119 finished with value: 0.09532088706378058 and parameters: {'model_name': 'SimpleImputer', 'strategy': 'mean'}. Best is trial 0 with value: 0.09532088706378058.
running
[I 2024-09-21 10:10:47,130] Trial 120 finished with value: 0.09532088706378058 and parameters: {'model_name': 'SimpleImputer', 'strategy': 'mean'}. Best is trial 0 with value: 0.09532088706378058.
running
[I 2024-09-21 10:10:47,312] Trial 125 finished with value: 0.09532088706378058 and parameters: {'model_name': 'SimpleImputer', 'strategy': 'mean'}. Best is trial 0 with value: 0.09532088706378058.
running
[I 2024-09-21 10:10:47,484] Trial 128 finished with value: 0.09532088706378058 and parameters: {'model_name': 'SimpleImputer', 'strategy': 'mean'}. Best is trial 0 with value: 0.09532088706378058.
running
[I 2024-09-21 10:10:47,597] Trial 127 finished with value: 0.09532088706378058 and parameters: {'model_name': 'SimpleImputer', 'strategy': 'mean'}. Best is trial 0 with value: 0.09532088706378058.
running
[I 2024-09-21 10:10:47,735] Trial 132 finished with value: 0.09532088706378058 and parameters: {'model_name': 'SimpleImputer', 'strategy': 'mean'}. Best is trial 0 with value: 0.09532088706378058.
running
[I 2024-09-21 10:10:47,863] Trial 129 finished with value: 0.09532088706378058 and parameters: {'model_name': 'SimpleImputer', 'strategy': 'mean'}. Best is trial 0 with value: 0.09532088706378058.
running
[I 2024-09-21 10:10:48,000] Trial 126 finished with value: 0.09532088706378058 and parameters: {'model_name': 'SimpleImputer', 'strategy': 'mean'}. Best is trial 0 with value: 0.09532088706378058.
[I 2024-09-21 10:10:48,101] Trial 131 finished with value: 0.09532088706378058 and parameters: {'model_name': 'SimpleImputer', 'strategy': 'mean'}. Best is trial 0 with value: 0.09532088706378058.
running
[I 2024-09-21 10:10:48,204] Trial 130 finished with value: 0.09532088706378058 and parameters: {'model_name': 'SimpleImputer', 'strategy': 'mean'}. Best is trial 0 with value: 0.09532088706378058.
running
running
[I 2024-09-21 10:10:48,332] Trial 134 finished with value: 0.09532088706378058 and parameters: {'model_name': 'SimpleImputer', 'strategy': 'mean'}. Best is trial 0 with value: 0.09532088706378058.
running
[I 2024-09-21 10:10:48,438] Trial 133 finished with value: 0.09532088706378058 and parameters: {'model_name': 'SimpleImputer', 'strategy': 'mean'}. Best is trial 0 with value: 0.09532088706378058.
running
[I 2024-09-21 10:10:48,657] Trial 136 finished with value: 0.09532088706378058 and parameters: {'model_name': 'SimpleImputer', 'strategy': 'mean'}. Best is trial 0 with value: 0.09532088706378058.
running
[I 2024-09-21 10:10:48,769] Trial 137 finished with value: 0.09532088706378058 and parameters: {'model_name': 'SimpleImputer', 'strategy': 'mean'}. Best is trial 0 with value: 0.09532088706378058.
running
[I 2024-09-21 10:10:48,945] Trial 135 finished with value: 0.09532088706378058 and parameters: {'model_name': 'SimpleImputer', 'strategy': 'mean'}. Best is trial 0 with value: 0.09532088706378058.
running
[I 2024-09-21 10:10:49,106] Trial 140 finished with value: 0.09532088706378058 and parameters: {'model_name': 'SimpleImputer', 'strategy': 'mean'}. Best is trial 0 with value: 0.09532088706378058.
running
[I 2024-09-21 10:10:49,226] Trial 139 finished with value: 0.09532088706378058 and parameters: {'model_name': 'SimpleImputer', 'strategy': 'mean'}. Best is trial 0 with value: 0.09532088706378058.
running
[I 2024-09-21 10:10:49,347] Trial 143 finished with value: 0.09532088706378058 and parameters: {'model_name': 'SimpleImputer', 'strategy': 'mean'}. Best is trial 0 with value: 0.09532088706378058.
running
[I 2024-09-21 10:10:49,483] Trial 138 finished with value: 0.09532088706378058 and parameters: {'model_name': 'SimpleImputer', 'strategy': 'mean'}. Best is trial 0 with value: 0.09532088706378058.
[I 2024-09-21 10:10:49,615] Trial 145 finished with value: 0.09532088706378058 and parameters: {'model_name': 'SimpleImputer', 'strategy': 'mean'}. Best is trial 0 with value: 0.09532088706378058.
running
running
[I 2024-09-21 10:10:49,769] Trial 148 finished with value: 0.09532088706378058 and parameters: {'model_name': 'SimpleImputer', 'strategy': 'mean'}. Best is trial 0 with value: 0.09532088706378058.
running
[I 2024-09-21 10:10:49,927] Trial 141 finished with value: 0.09532088706378058 and parameters: {'model_name': 'SimpleImputer', 'strategy': 'mean'}. Best is trial 0 with value: 0.09532088706378058.
running
[I 2024-09-21 10:10:50,049] Trial 147 finished with value: 0.09532088706378058 and parameters: {'model_name': 'SimpleImputer', 'strategy': 'mean'}. Best is trial 0 with value: 0.09532088706378058.
[I 2024-09-21 10:10:50,149] Trial 144 finished with value: 0.09532088706378058 and parameters: {'model_name': 'SimpleImputer', 'strategy': 'mean'}. Best is trial 0 with value: 0.09532088706378058.
running
running
[I 2024-09-21 10:10:50,270] Trial 150 finished with value: 0.09532088706378058 and parameters: {'model_name': 'SimpleImputer', 'strategy': 'mean'}. Best is trial 0 with value: 0.09532088706378058.
running
[I 2024-09-21 10:10:50,397] Trial 146 finished with value: 0.09532088706378058 and parameters: {'model_name': 'SimpleImputer', 'strategy': 'mean'}. Best is trial 0 with value: 0.09532088706378058.
running
[I 2024-09-21 10:10:50,531] Trial 142 finished with value: 0.09532088706378058 and parameters: {'model_name': 'SimpleImputer', 'strategy': 'mean'}. Best is trial 0 with value: 0.09532088706378058.
[I 2024-09-21 10:10:50,634] Trial 152 finished with value: 0.09532088706378058 and parameters: {'model_name': 'SimpleImputer', 'strategy': 'mean'}. Best is trial 0 with value: 0.09532088706378058.
running
running
[I 2024-09-21 10:10:50,804] Trial 149 finished with value: 0.09532088706378058 and parameters: {'model_name': 'SimpleImputer', 'strategy': 'mean'}. Best is trial 0 with value: 0.09532088706378058.
running
[I 2024-09-21 10:10:50,946] Trial 154 finished with value: 0.09532088706378058 and parameters: {'model_name': 'SimpleImputer', 'strategy': 'mean'}. Best is trial 0 with value: 0.09532088706378058.
running
[I 2024-09-21 10:10:51,116] Trial 153 finished with value: 0.09532088706378058 and parameters: {'model_name': 'SimpleImputer', 'strategy': 'mean'}. Best is trial 0 with value: 0.09532088706378058.
running
[I 2024-09-21 10:10:51,228] Trial 151 finished with value: 0.09532088706378058 and parameters: {'model_name': 'SimpleImputer', 'strategy': 'mean'}. Best is trial 0 with value: 0.09532088706378058.
[I 2024-09-21 10:10:51,355] Trial 157 finished with value: 0.09532088706378058 and parameters: {'model_name': 'SimpleImputer', 'strategy': 'mean'}. Best is trial 0 with value: 0.09532088706378058.
running
running
[I 2024-09-21 10:10:51,485] Trial 156 finished with value: 0.09532088706378058 and parameters: {'model_name': 'SimpleImputer', 'strategy': 'mean'}. Best is trial 0 with value: 0.09532088706378058.
running
[I 2024-09-21 10:10:51,619] Trial 158 finished with value: 0.09532088706378058 and parameters: {'model_name': 'SimpleImputer', 'strategy': 'mean'}. Best is trial 0 with value: 0.09532088706378058.
[I 2024-09-21 10:10:51,730] Trial 155 finished with value: 0.09532088706378058 and parameters: {'model_name': 'SimpleImputer', 'strategy': 'mean'}. Best is trial 0 with value: 0.09532088706378058.
running
running
[I 2024-09-21 10:10:51,864] Trial 159 finished with value: 0.09532088706378058 and parameters: {'model_name': 'SimpleImputer', 'strategy': 'mean'}. Best is trial 0 with value: 0.09532088706378058.
running
[I 2024-09-21 10:10:52,112] Trial 161 finished with value: 0.09532088706378058 and parameters: {'model_name': 'SimpleImputer', 'strategy': 'mean'}. Best is trial 0 with value: 0.09532088706378058.
running
[I 2024-09-21 10:10:52,289] Trial 166 finished with value: 0.09532088706378058 and parameters: {'model_name': 'SimpleImputer', 'strategy': 'mean'}. Best is trial 0 with value: 0.09532088706378058.
[I 2024-09-21 10:10:52,400] Trial 162 finished with value: 0.09532088706378058 and parameters: {'model_name': 'SimpleImputer', 'strategy': 'mean'}. Best is trial 0 with value: 0.09532088706378058.
running
running
[I 2024-09-21 10:10:52,548] Trial 164 finished with value: 0.09532088706378058 and parameters: {'model_name': 'SimpleImputer', 'strategy': 'mean'}. Best is trial 0 with value: 0.09532088706378058.
[I 2024-09-21 10:10:52,675] Trial 167 finished with value: 0.09532088706378058 and parameters: {'model_name': 'SimpleImputer', 'strategy': 'mean'}. Best is trial 0 with value: 0.09532088706378058.
running
[I 2024-09-21 10:10:52,787] Trial 168 finished with value: 0.09532088706378058 and parameters: {'model_name': 'SimpleImputer', 'strategy': 'mean'}. Best is trial 0 with value: 0.09532088706378058.
running
[I 2024-09-21 10:10:52,935] Trial 163 finished with value: 0.09532088706378058 and parameters: {'model_name': 'SimpleImputer', 'strategy': 'mean'}. Best is trial 0 with value: 0.09532088706378058.
running
[I 2024-09-21 10:10:52,936] Trial 160 finished with value: 0.09532088706378058 and parameters: {'model_name': 'SimpleImputer', 'strategy': 'mean'}. Best is trial 0 with value: 0.09532088706378058.
running
[I 2024-09-21 10:10:53,057] Trial 165 finished with value: 0.09532088706378058 and parameters: {'model_name': 'SimpleImputer', 'strategy': 'mean'}. Best is trial 0 with value: 0.09532088706378058.
running
running
[I 2024-09-21 10:10:53,362] Trial 170 finished with value: 0.09532088706378058 and parameters: {'model_name': 'SimpleImputer', 'strategy': 'mean'}. Best is trial 0 with value: 0.09532088706378058.
running
[I 2024-09-21 10:10:53,521] Trial 171 finished with value: 0.09532088706378058 and parameters: {'model_name': 'SimpleImputer', 'strategy': 'mean'}. Best is trial 0 with value: 0.09532088706378058.
running
[I 2024-09-21 10:10:53,806] Trial 175 finished with value: 0.09532088706378058 and parameters: {'model_name': 'SimpleImputer', 'strategy': 'mean'}. Best is trial 0 with value: 0.09532088706378058.
running
[I 2024-09-21 10:10:54,048] Trial 169 finished with value: 0.09532088706378058 and parameters: {'model_name': 'SimpleImputer', 'strategy': 'mean'}. Best is trial 0 with value: 0.09532088706378058.
running
[I 2024-09-21 10:10:54,234] Trial 172 finished with value: 0.09532088706378058 and parameters: {'model_name': 'SimpleImputer', 'strategy': 'mean'}. Best is trial 0 with value: 0.09532088706378058.
[I 2024-09-21 10:10:54,352] Trial 176 finished with value: 0.09532088706378058 and parameters: {'model_name': 'SimpleImputer', 'strategy': 'mean'}. Best is trial 0 with value: 0.09532088706378058.
running
running
[I 2024-09-21 10:10:55,026] Trial 182 finished with value: 0.09532088706378058 and parameters: {'model_name': 'SimpleImputer', 'strategy': 'mean'}. Best is trial 0 with value: 0.09532088706378058.
running
[I 2024-09-21 10:10:55,245] Trial 186 finished with value: 0.09532088706378058 and parameters: {'model_name': 'SimpleImputer', 'strategy': 'mean'}. Best is trial 0 with value: 0.09532088706378058.
running
[I 2024-09-21 10:10:55,429] Trial 188 finished with value: 0.09532088706378058 and parameters: {'model_name': 'SimpleImputer', 'strategy': 'mean'}. Best is trial 0 with value: 0.09532088706378058.
running
[I 2024-09-21 10:10:56,410] Trial 185 finished with value: 0.17947147982334793 and parameters: {'model_name': 'SimpleImputer', 'strategy': 'most_frequent'}. Best is trial 0 with value: 0.09532088706378058.
running
[I 2024-09-21 10:10:56,595] Trial 181 finished with value: 0.17947147982334793 and parameters: {'model_name': 'SimpleImputer', 'strategy': 'most_frequent'}. Best is trial 0 with value: 0.09532088706378058.
running
[I 2024-09-21 10:10:56,734] Trial 173 finished with value: 0.17947147982334793 and parameters: {'model_name': 'SimpleImputer', 'strategy': 'most_frequent'}. Best is trial 0 with value: 0.09532088706378058.
running
[I 2024-09-21 10:10:56,915] Trial 184 finished with value: 0.17947147982334793 and parameters: {'model_name': 'SimpleImputer', 'strategy': 'most_frequent'}. Best is trial 0 with value: 0.09532088706378058.
running
[I 2024-09-21 10:10:57,095] Trial 193 finished with value: 0.09532088706378058 and parameters: {'model_name': 'SimpleImputer', 'strategy': 'mean'}. Best is trial 0 with value: 0.09532088706378058.
running
[I 2024-09-21 10:10:57,317] Trial 174 finished with value: 0.17947147982334793 and parameters: {'model_name': 'SimpleImputer', 'strategy': 'most_frequent'}. Best is trial 0 with value: 0.09532088706378058.
[I 2024-09-21 10:10:57,432] Trial 183 finished with value: 0.17947147982334793 and parameters: {'model_name': 'SimpleImputer', 'strategy': 'most_frequent'}. Best is trial 0 with value: 0.09532088706378058.
running
[I 2024-09-21 10:10:57,623] Trial 178 finished with value: 0.17947147982334793 and parameters: {'model_name': 'SimpleImputer', 'strategy': 'most_frequent'}. Best is trial 0 with value: 0.09532088706378058.
[I 2024-09-21 10:10:57,868] Trial 179 finished with value: 0.17947147982334793 and parameters: {'model_name': 'SimpleImputer', 'strategy': 'most_frequent'}. Best is trial 0 with value: 0.09532088706378058.
[I 2024-09-21 10:10:58,015] Trial 177 finished with value: 0.17947147982334793 and parameters: {'model_name': 'SimpleImputer', 'strategy': 'most_frequent'}. Best is trial 0 with value: 0.09532088706378058.
[I 2024-09-21 10:10:58,215] Trial 197 finished with value: 0.09532088706378058 and parameters: {'model_name': 'SimpleImputer', 'strategy': 'mean'}. Best is trial 0 with value: 0.09532088706378058.
[I 2024-09-21 10:10:58,356] Trial 180 finished with value: 0.17947147982334793 and parameters: {'model_name': 'SimpleImputer', 'strategy': 'most_frequent'}. Best is trial 0 with value: 0.09532088706378058.
[I 2024-09-21 10:10:58,463] Trial 196 finished with value: 0.09532088706378058 and parameters: {'model_name': 'SimpleImputer', 'strategy': 'mean'}. Best is trial 0 with value: 0.09532088706378058.
[I 2024-09-21 10:10:58,574] Trial 194 finished with value: 0.09532088706378058 and parameters: {'model_name': 'SimpleImputer', 'strategy': 'mean'}. Best is trial 0 with value: 0.09532088706378058.
[I 2024-09-21 10:10:58,706] Trial 195 finished with value: 0.09532088706378058 and parameters: {'model_name': 'SimpleImputer', 'strategy': 'mean'}. Best is trial 0 with value: 0.09532088706378058.
[I 2024-09-21 10:10:58,836] Trial 187 finished with value: 0.17947147982334793 and parameters: {'model_name': 'SimpleImputer', 'strategy': 'most_frequent'}. Best is trial 0 with value: 0.09532088706378058.
[I 2024-09-21 10:10:58,963] Trial 199 finished with value: 0.09532088706378058 and parameters: {'model_name': 'SimpleImputer', 'strategy': 'mean'}. Best is trial 0 with value: 0.09532088706378058.
[I 2024-09-21 10:10:59,088] Trial 198 finished with value: 0.09532088706378058 and parameters: {'model_name': 'SimpleImputer', 'strategy': 'mean'}. Best is trial 0 with value: 0.09532088706378058.
[I 2024-09-21 10:10:59,207] Trial 189 finished with value: 0.17947147982334793 and parameters: {'model_name': 'SimpleImputer', 'strategy': 'most_frequent'}. Best is trial 0 with value: 0.09532088706378058.
[I 2024-09-21 10:10:59,335] Trial 190 finished with value: 0.17947147982334793 and parameters: {'model_name': 'SimpleImputer', 'strategy': 'most_frequent'}. Best is trial 0 with value: 0.09532088706378058.
[I 2024-09-21 10:10:59,443] Trial 191 finished with value: 0.17947147982334793 and parameters: {'model_name': 'SimpleImputer', 'strategy': 'most_frequent'}. Best is trial 0 with value: 0.09532088706378058.
