[I 2024-10-14 16:40:50,805] Trial 101 finished with value: 0.28847883996802637 and parameters: {'model_name': 'KNNImputer', 'n_neighbors': 2799, 'weights': 'distance'}. Best is trial 41 with value: 0.2859474867690468.
running
[I 2024-10-14 16:40:57,708] Trial 102 finished with value: 0.28847360963497265 and parameters: {'model_name': 'KNNImputer', 'n_neighbors': 2780, 'weights': 'distance'}. Best is trial 41 with value: 0.2859474867690468.
running
[I 2024-10-14 16:41:08,042] Trial 103 finished with value: 0.2870447933408076 and parameters: {'model_name': 'KNNImputer', 'n_neighbors': 58, 'weights': 'distance'}. Best is trial 41 with value: 0.2859474867690468.
running
[I 2024-10-14 16:41:12,667] Trial 104 finished with value: inf and parameters: {'model_name': 'GAIN', 'batch_size': 2, 'hint_rate': 0.016322031685401195, 'alpha': 1, 'iterations': 100, 'learning_rate': 0.01928911243441521, 'p_miss': 0.09283921881971088}. Best is trial 41 with value: 0.2859474867690468.
running
[I 2024-10-14 16:41:28,718] Trial 105 finished with value: inf and parameters: {'model_name': 'GAIN', 'batch_size': 2, 'hint_rate': 0.7000539644740363, 'alpha': 1, 'iterations': 118, 'learning_rate': 0.0012485628960495197, 'p_miss': 0.0943257794404539}. Best is trial 41 with value: 0.2859474867690468.
running
[I 2024-10-14 16:42:30,028] Trial 106 finished with value: 0.28718324895150693 and parameters: {'model_name': 'KNNImputer', 'n_neighbors': 926, 'weights': 'distance'}. Best is trial 41 with value: 0.2859474867690468.
running
[I 2024-10-14 16:42:30,567] Trial 107 finished with value: 0.28614133796893654 and parameters: {'model_name': 'KNNImputer', 'n_neighbors': 167, 'weights': 'distance'}. Best is trial 41 with value: 0.2859474867690468.
running
[I 2024-10-14 16:42:49,436] Trial 108 finished with value: 0.2869941347661983 and parameters: {'model_name': 'KNNImputer', 'n_neighbors': 769, 'weights': 'distance'}. Best is trial 41 with value: 0.2859474867690468.
running
[I 2024-10-14 16:43:46,948] Trial 109 finished with value: 0.286150884604187 and parameters: {'model_name': 'KNNImputer', 'n_neighbors': 173, 'weights': 'distance'}. Best is trial 41 with value: 0.2859474867690468.
running
[I 2024-10-14 16:44:21,646] Trial 110 finished with value: 0.2929783498857425 and parameters: {'model_name': 'KNNImputer', 'n_neighbors': 39902, 'weights': 'uniform'}. Best is trial 41 with value: 0.2859474867690468.
running
[I 2024-10-14 16:44:35,785] Trial 111 finished with value: 0.2928649354624369 and parameters: {'model_name': 'KNNImputer', 'n_neighbors': 38196, 'weights': 'uniform'}. Best is trial 41 with value: 0.2859474867690468.
running
[I 2024-10-14 16:45:51,606] Trial 112 finished with value: 0.29247837112752895 and parameters: {'model_name': 'KNNImputer', 'n_neighbors': 37956, 'weights': 'distance'}. Best is trial 41 with value: 0.2859474867690468.
running
[I 2024-10-14 17:33:42,684] Trial 65 finished with value: 0.3138487182391643 and parameters: {'model_name': 'VAE', 'batch_size': 5, 'iterations': 5911, 'learning_rate': 0.006608276447131037, 'p_miss': 0.21319392206296053}. Best is trial 41 with value: 0.2859474867690468.
running
[I 2024-10-14 17:35:03,574] Trial 116 finished with value: 0.2891260127167289 and parameters: {'model_name': 'KNNImputer', 'n_neighbors': 4550, 'weights': 'distance'}. Best is trial 41 with value: 0.2859474867690468.
running
[I 2024-10-14 17:35:05,186] Trial 70 finished with value: 0.3157909938287294 and parameters: {'model_name': 'VAE', 'batch_size': 6, 'iterations': 6839, 'learning_rate': 0.0045340785171230046, 'p_miss': 0.20997073528421403}. Best is trial 41 with value: 0.2859474867690468.
running
[I 2024-10-14 17:36:23,439] Trial 118 finished with value: 0.28809335203388375 and parameters: {'model_name': 'KNNImputer', 'n_neighbors': 2084, 'weights': 'distance'}. Best is trial 41 with value: 0.2859474867690468.
running
[I 2024-10-14 17:36:24,635] Trial 117 finished with value: 0.2890581938084146 and parameters: {'model_name': 'KNNImputer', 'n_neighbors': 4318, 'weights': 'distance'}. Best is trial 41 with value: 0.2859474867690468.
running
[I 2024-10-14 17:37:30,802] Trial 120 finished with value: 0.28586420058143397 and parameters: {'model_name': 'KNNImputer', 'n_neighbors': 199, 'weights': 'uniform'}. Best is trial 120 with value: 0.28586420058143397.
running
[I 2024-10-14 17:37:39,828] Trial 72 finished with value: 0.3161351201022594 and parameters: {'model_name': 'VAE', 'batch_size': 7, 'iterations': 6351, 'learning_rate': 0.004525579708161897, 'p_miss': 0.20583450111497323}. Best is trial 120 with value: 0.28586420058143397.
running
[I 2024-10-14 17:38:43,727] Trial 121 finished with value: 0.289225238356136 and parameters: {'model_name': 'KNNImputer', 'n_neighbors': 4557, 'weights': 'uniform'}. Best is trial 120 with value: 0.28586420058143397.
running
[I 2024-10-14 18:07:24,434] Trial 69 finished with value: 0.30922479735771774 and parameters: {'model_name': 'VAE', 'batch_size': 8, 'iterations': 7319, 'learning_rate': 0.004010715051460089, 'p_miss': 0.21854925553268512}. Best is trial 120 with value: 0.28586420058143397.
running
[I 2024-10-14 18:14:29,170] Trial 71 finished with value: 0.3105517259612677 and parameters: {'model_name': 'VAE', 'batch_size': 8, 'iterations': 8018, 'learning_rate': 0.005050442542880131, 'p_miss': 0.011199467207444413}. Best is trial 120 with value: 0.28586420058143397.
running
[I 2024-10-14 18:15:34,135] Trial 125 finished with value: 0.28644550077598185 and parameters: {'model_name': 'KNNImputer', 'n_neighbors': 63, 'weights': 'uniform'}. Best is trial 120 with value: 0.28586420058143397.
running
[I 2024-10-14 18:22:20,022] Trial 75 finished with value: 0.3217707484718222 and parameters: {'model_name': 'VAE', 'batch_size': 6, 'iterations': 9097, 'learning_rate': 0.00497976051637336, 'p_miss': 0.21191676357528494}. Best is trial 120 with value: 0.28586420058143397.
running
[I 2024-10-14 18:22:53,949] Trial 13 finished with value: 0.2885571373546833 and parameters: {'model_name': 'IterativeImputer', 'estimator': 'RFR', 'initial_strategy': 'mean', 'n_nearest_features': 7, 'imputation_order': 'random'}. Best is trial 120 with value: 0.28586420058143397.
running
[I 2024-10-14 18:24:01,297] Trial 128 finished with value: 0.28796762255626046 and parameters: {'model_name': 'KNNImputer', 'n_neighbors': 1770, 'weights': 'uniform'}. Best is trial 120 with value: 0.28586420058143397.
running
[I 2024-10-14 18:25:08,314] Trial 129 finished with value: 0.28780998177090095 and parameters: {'model_name': 'KNNImputer', 'n_neighbors': 1573, 'weights': 'uniform'}. Best is trial 120 with value: 0.28586420058143397.
running
[I 2024-10-14 18:26:12,198] Trial 130 finished with value: 0.2889321875524893 and parameters: {'model_name': 'KNNImputer', 'n_neighbors': 28, 'weights': 'uniform'}. Best is trial 120 with value: 0.28586420058143397.
running
[I 2024-10-14 18:26:36,339] Trial 131 finished with value: 0.2892103450796518 and parameters: {'model_name': 'IterativeImputer', 'estimator': 'Ridge', 'initial_strategy': 'constant', 'n_nearest_features': 1, 'imputation_order': 'roman'}. Best is trial 120 with value: 0.28586420058143397.
running
[I 2024-10-14 18:27:52,290] Trial 132 finished with value: 0.28999077801461326 and parameters: {'model_name': 'KNNImputer', 'n_neighbors': 7499, 'weights': 'uniform'}. Best is trial 120 with value: 0.28586420058143397.
running
[I 2024-10-14 18:27:53,134] Trial 133 finished with value: 0.3309590620783004 and parameters: {'model_name': 'SimpleImputer', 'strategy': 'median'}. Best is trial 120 with value: 0.28586420058143397.
running
[I 2024-10-14 18:29:04,964] Trial 134 finished with value: 0.2890186415169632 and parameters: {'model_name': 'KNNImputer', 'n_neighbors': 3920, 'weights': 'uniform'}. Best is trial 120 with value: 0.28586420058143397.
running
[I 2024-10-14 18:30:13,574] Trial 135 finished with value: 0.28833901519306077 and parameters: {'model_name': 'KNNImputer', 'n_neighbors': 2388, 'weights': 'uniform'}. Best is trial 120 with value: 0.28586420058143397.
running
[I 2024-10-14 18:31:20,770] Trial 136 finished with value: 0.28746012064974913 and parameters: {'model_name': 'KNNImputer', 'n_neighbors': 1195, 'weights': 'uniform'}. Best is trial 120 with value: 0.28586420058143397.
running
[I 2024-10-14 18:32:25,367] Trial 137 finished with value: 0.2862108390172512 and parameters: {'model_name': 'KNNImputer', 'n_neighbors': 83, 'weights': 'uniform'}. Best is trial 120 with value: 0.28586420058143397.
running
[I 2024-10-14 18:33:29,909] Trial 138 finished with value: 0.28664842235239296 and parameters: {'model_name': 'KNNImputer', 'n_neighbors': 51, 'weights': 'uniform'}. Best is trial 120 with value: 0.28586420058143397.
running
[I 2024-10-14 18:34:41,093] Trial 139 finished with value: 0.28925376824792454 and parameters: {'model_name': 'KNNImputer', 'n_neighbors': 4636, 'weights': 'uniform'}. Best is trial 120 with value: 0.28586420058143397.
running
[I 2024-10-14 18:35:18,292] Trial 114 finished with value: 0.3364973986116116 and parameters: {'model_name': 'IterativeImputer', 'estimator': 'RFR', 'initial_strategy': 'median', 'n_nearest_features': 1, 'imputation_order': 'arabic'}. Best is trial 120 with value: 0.28586420058143397.
running
[I 2024-10-14 18:35:39,353] Trial 115 finished with value: 0.33346954767230663 and parameters: {'model_name': 'IterativeImputer', 'estimator': 'RFR', 'initial_strategy': 'constant', 'n_nearest_features': 1, 'imputation_order': 'random'}. Best is trial 120 with value: 0.28586420058143397.
running
[I 2024-10-14 18:35:57,216] Trial 113 finished with value: 0.33427707404786255 and parameters: {'model_name': 'IterativeImputer', 'estimator': 'RFR', 'initial_strategy': 'mean', 'n_nearest_features': 1, 'imputation_order': 'random'}. Best is trial 120 with value: 0.28586420058143397.
running
[I 2024-10-14 18:36:04,783] Trial 140 finished with value: 0.2936129512155716 and parameters: {'model_name': 'KNNImputer', 'n_neighbors': 50504, 'weights': 'uniform'}. Best is trial 120 with value: 0.28586420058143397.
running
[I 2024-10-14 18:36:39,718] Trial 141 finished with value: 0.28820391000186496 and parameters: {'model_name': 'KNNImputer', 'n_neighbors': 2162, 'weights': 'uniform'}. Best is trial 120 with value: 0.28586420058143397.
running
[I 2024-10-14 18:37:14,902] Trial 142 finished with value: 0.2936129512155716 and parameters: {'model_name': 'KNNImputer', 'n_neighbors': 52342, 'weights': 'uniform'}. Best is trial 120 with value: 0.28586420058143397.
running
[I 2024-10-14 18:37:19,808] Trial 143 finished with value: 0.28826338634507065 and parameters: {'model_name': 'KNNImputer', 'n_neighbors': 2234, 'weights': 'uniform'}. Best is trial 120 with value: 0.28586420058143397.
running
[I 2024-10-14 18:37:25,770] Trial 144 finished with value: 0.2884230821525791 and parameters: {'model_name': 'KNNImputer', 'n_neighbors': 2533, 'weights': 'uniform'}. Best is trial 120 with value: 0.28586420058143397.
running
[I 2024-10-14 18:38:07,881] Trial 145 finished with value: 0.2895509235701959 and parameters: {'model_name': 'KNNImputer', 'n_neighbors': 5656, 'weights': 'uniform'}. Best is trial 120 with value: 0.28586420058143397.
running
[I 2024-10-14 18:38:34,209] Trial 73 finished with value: 0.31303965598567807 and parameters: {'model_name': 'VAE', 'batch_size': 7, 'iterations': 9544, 'learning_rate': 0.005242095635598638, 'p_miss': 0.2102945046883445}. Best is trial 120 with value: 0.28586420058143397.
running
[I 2024-10-14 18:38:34,635] Trial 146 finished with value: 0.28589499270831986 and parameters: {'model_name': 'KNNImputer', 'n_neighbors': 146, 'weights': 'uniform'}. Best is trial 120 with value: 0.28586420058143397.
running
[I 2024-10-14 18:38:39,627] Trial 147 finished with value: 0.2863078471754463 and parameters: {'model_name': 'KNNImputer', 'n_neighbors': 71, 'weights': 'uniform'}. Best is trial 120 with value: 0.28586420058143397.
running
[I 2024-10-14 18:38:46,428] Trial 148 finished with value: 0.2862769937234966 and parameters: {'model_name': 'KNNImputer', 'n_neighbors': 414, 'weights': 'uniform'}. Best is trial 120 with value: 0.28586420058143397.
running
[I 2024-10-14 18:39:31,572] Trial 149 finished with value: 0.28605221527393987 and parameters: {'model_name': 'KNNImputer', 'n_neighbors': 87, 'weights': 'uniform'}. Best is trial 120 with value: 0.28586420058143397.
running
[I 2024-10-14 18:39:58,774] Trial 150 finished with value: 0.2874065049564874 and parameters: {'model_name': 'KNNImputer', 'n_neighbors': 40, 'weights': 'uniform'}. Best is trial 120 with value: 0.28586420058143397.
running
[I 2024-10-14 18:40:02,779] Trial 152 finished with value: 0.28864844931245914 and parameters: {'model_name': 'KNNImputer', 'n_neighbors': 30, 'weights': 'uniform'}. Best is trial 120 with value: 0.28586420058143397.
running
[I 2024-10-14 18:40:04,954] Trial 151 finished with value: 0.28894518940739444 and parameters: {'model_name': 'KNNImputer', 'n_neighbors': 3726, 'weights': 'uniform'}. Best is trial 120 with value: 0.28586420058143397.
running
[I 2024-10-14 18:40:15,594] Trial 153 finished with value: 0.2889408347916599 and parameters: {'model_name': 'KNNImputer', 'n_neighbors': 3716, 'weights': 'uniform'}. Best is trial 120 with value: 0.28586420058143397.
running
[I 2024-10-14 18:41:00,345] Trial 154 finished with value: 0.2888282368082632 and parameters: {'model_name': 'KNNImputer', 'n_neighbors': 3414, 'weights': 'uniform'}. Best is trial 120 with value: 0.28586420058143397.
running
[I 2024-10-14 18:41:30,723] Trial 155 finished with value: 0.28903805837243723 and parameters: {'model_name': 'KNNImputer', 'n_neighbors': 3981, 'weights': 'uniform'}. Best is trial 120 with value: 0.28586420058143397.
running
[I 2024-10-14 18:41:31,499] Trial 156 finished with value: 0.2889126466593005 and parameters: {'model_name': 'KNNImputer', 'n_neighbors': 3637, 'weights': 'uniform'}. Best is trial 120 with value: 0.28586420058143397.
running
[I 2024-10-14 18:41:33,221] Trial 157 finished with value: 0.2878656036821283 and parameters: {'model_name': 'KNNImputer', 'n_neighbors': 1644, 'weights': 'uniform'}. Best is trial 120 with value: 0.28586420058143397.
running
[I 2024-10-14 18:41:44,175] Trial 158 finished with value: 0.2879811881596374 and parameters: {'model_name': 'KNNImputer', 'n_neighbors': 1789, 'weights': 'uniform'}. Best is trial 120 with value: 0.28586420058143397.
running
[I 2024-10-14 18:41:44,708] Trial 163 finished with value: 0.2936129512155716 and parameters: {'model_name': 'SimpleImputer', 'strategy': 'mean'}. Best is trial 120 with value: 0.28586420058143397.
running
[I 2024-10-14 18:42:27,913] Trial 159 finished with value: 0.2878137594281454 and parameters: {'model_name': 'KNNImputer', 'n_neighbors': 1577, 'weights': 'uniform'}. Best is trial 120 with value: 0.28586420058143397.
running
[I 2024-10-14 18:42:57,753] Trial 160 finished with value: 0.2878158735345523 and parameters: {'model_name': 'KNNImputer', 'n_neighbors': 1585, 'weights': 'uniform'}. Best is trial 120 with value: 0.28586420058143397.
running
[I 2024-10-14 18:43:01,313] Trial 161 finished with value: 0.2879437725053909 and parameters: {'model_name': 'KNNImputer', 'n_neighbors': 1810, 'weights': 'distance'}. Best is trial 120 with value: 0.28586420058143397.
running
[I 2024-10-14 18:43:03,517] Trial 162 finished with value: 0.2876856100494217 and parameters: {'model_name': 'KNNImputer', 'n_neighbors': 1451, 'weights': 'distance'}. Best is trial 120 with value: 0.28586420058143397.
running
[I 2024-10-14 18:43:13,654] Trial 164 finished with value: 0.28751913658245887 and parameters: {'model_name': 'KNNImputer', 'n_neighbors': 1275, 'weights': 'distance'}. Best is trial 120 with value: 0.28586420058143397.
running
[I 2024-10-14 18:43:28,400] Trial 77 finished with value: 0.31229294736558716 and parameters: {'model_name': 'VAE', 'batch_size': 7, 'iterations': 9426, 'learning_rate': 0.0048302440572623425, 'p_miss': 0.21353986582294432}. Best is trial 120 with value: 0.28586420058143397.
running
[I 2024-10-14 18:44:14,962] Trial 165 finished with value: 0.28964391110098503 and parameters: {'model_name': 'KNNImputer', 'n_neighbors': 6513, 'weights': 'distance'}. Best is trial 120 with value: 0.28586420058143397.
running
[I 2024-10-14 18:44:26,806] Trial 166 finished with value: 0.293859777944378 and parameters: {'model_name': 'KNNImputer', 'n_neighbors': 17, 'weights': 'distance'}. Best is trial 120 with value: 0.28586420058143397.
running
[I 2024-10-14 18:44:30,350] Trial 167 finished with value: 0.2909504858797437 and parameters: {'model_name': 'KNNImputer', 'n_neighbors': 21, 'weights': 'uniform'}. Best is trial 120 with value: 0.28586420058143397.
running
[I 2024-10-14 18:44:33,434] Trial 168 finished with value: 0.28593367138872355 and parameters: {'model_name': 'KNNImputer', 'n_neighbors': 112, 'weights': 'uniform'}. Best is trial 120 with value: 0.28586420058143397.
running
[I 2024-10-14 18:44:35,494] Trial 173 finished with value: 0.5288086028926163 and parameters: {'model_name': 'GAIN', 'batch_size': 15, 'hint_rate': 0.6729618053046155, 'alpha': 75, 'iterations': 2, 'learning_rate': 0.00022055030981612967, 'p_miss': 0.16981059714224359}. Best is trial 120 with value: 0.28586420058143397.
running
[I 2024-10-14 18:44:46,654] Trial 169 finished with value: 0.2859488283751173 and parameters: {'model_name': 'KNNImputer', 'n_neighbors': 111, 'weights': 'uniform'}. Best is trial 120 with value: 0.28586420058143397.
running
[I 2024-10-14 18:45:09,604] Trial 170 finished with value: 0.2899079911170005 and parameters: {'model_name': 'KNNImputer', 'n_neighbors': 7111, 'weights': 'uniform'}. Best is trial 120 with value: 0.28586420058143397.
running
[I 2024-10-14 18:45:16,855] Trial 82 finished with value: 0.2983596874719413 and parameters: {'model_name': 'VAE', 'batch_size': 125, 'iterations': 9641, 'learning_rate': 0.002093839015321735, 'p_miss': 0.2150675036419164}. Best is trial 120 with value: 0.28586420058143397.
running
[I 2024-10-14 18:45:47,965] Trial 171 finished with value: 0.28631174792664205 and parameters: {'model_name': 'KNNImputer', 'n_neighbors': 75, 'weights': 'uniform'}. Best is trial 120 with value: 0.28586420058143397.
running
[I 2024-10-14 18:46:06,114] Trial 172 finished with value: 0.2895235000376271 and parameters: {'model_name': 'KNNImputer', 'n_neighbors': 5555, 'weights': 'uniform'}. Best is trial 120 with value: 0.28586420058143397.
running
[I 2024-10-14 18:46:13,304] Trial 174 finished with value: 0.28946506542471273 and parameters: {'model_name': 'KNNImputer', 'n_neighbors': 5361, 'weights': 'uniform'}. Best is trial 120 with value: 0.28586420058143397.
running
[I 2024-10-14 18:46:23,422] Trial 176 finished with value: 0.2886312630279044 and parameters: {'model_name': 'KNNImputer', 'n_neighbors': 2957, 'weights': 'uniform'}. Best is trial 120 with value: 0.28586420058143397.
running
[I 2024-10-14 18:46:49,247] Trial 175 finished with value: 0.29223240821142454 and parameters: {'model_name': 'KNNImputer', 'n_neighbors': 28509, 'weights': 'uniform'}. Best is trial 120 with value: 0.28586420058143397.
running
[I 2024-10-14 18:46:50,365] Trial 177 finished with value: 0.28848770286093345 and parameters: {'model_name': 'KNNImputer', 'n_neighbors': 2644, 'weights': 'uniform'}. Best is trial 120 with value: 0.28586420058143397.
running
[I 2024-10-14 18:46:57,795] Trial 178 finished with value: 0.28941781866627336 and parameters: {'model_name': 'KNNImputer', 'n_neighbors': 5211, 'weights': 'uniform'}. Best is trial 120 with value: 0.28586420058143397.
running
[I 2024-10-14 18:47:15,277] Trial 74 finished with value: 0.31444415067753884 and parameters: {'model_name': 'VAE', 'batch_size': 6, 'iterations': 9818, 'learning_rate': 0.004982574716273807, 'p_miss': 0.21180768544929413}. Best is trial 120 with value: 0.28586420058143397.
running
[I 2024-10-14 18:48:00,699] Trial 182 finished with value: 0.28754969614345116 and parameters: {'model_name': 'KNNImputer', 'n_neighbors': 1281, 'weights': 'uniform'}. Best is trial 120 with value: 0.28586420058143397.
running
[I 2024-10-14 18:48:04,883] Trial 179 finished with value: 0.2922090254496577 and parameters: {'model_name': 'KNNImputer', 'n_neighbors': 28165, 'weights': 'uniform'}. Best is trial 120 with value: 0.28586420058143397.
running
[I 2024-10-14 18:48:18,907] Trial 180 finished with value: 0.29185548384798066 and parameters: {'model_name': 'KNNImputer', 'n_neighbors': 23160, 'weights': 'uniform'}. Best is trial 120 with value: 0.28586420058143397.
running
[I 2024-10-14 18:48:22,985] Trial 181 finished with value: 0.29188694861423603 and parameters: {'model_name': 'KNNImputer', 'n_neighbors': 23568, 'weights': 'uniform'}. Best is trial 120 with value: 0.28586420058143397.
running
[I 2024-10-14 18:48:27,869] Trial 184 finished with value: 0.2873751915875826 and parameters: {'model_name': 'KNNImputer', 'n_neighbors': 1101, 'weights': 'uniform'}. Best is trial 120 with value: 0.28586420058143397.
running
[I 2024-10-14 18:48:30,083] Trial 183 finished with value: 0.2885719606366234 and parameters: {'model_name': 'KNNImputer', 'n_neighbors': 2854, 'weights': 'uniform'}. Best is trial 120 with value: 0.28586420058143397.
running
[I 2024-10-14 18:48:55,444] Trial 186 finished with value: 0.2873134747387488 and parameters: {'model_name': 'KNNImputer', 'n_neighbors': 1055, 'weights': 'uniform'}. Best is trial 120 with value: 0.28586420058143397.
running
[I 2024-10-14 18:49:09,010] Trial 185 finished with value: 0.2916944196641023 and parameters: {'model_name': 'KNNImputer', 'n_neighbors': 21391, 'weights': 'uniform'}. Best is trial 120 with value: 0.28586420058143397.
running
[I 2024-10-14 18:49:43,800] Trial 187 finished with value: 0.2872162983880485 and parameters: {'model_name': 'KNNImputer', 'n_neighbors': 948, 'weights': 'uniform'}. Best is trial 120 with value: 0.28586420058143397.
running
