Run: 69
/cm/local/apps/slurm/var/spool/job962917/slurm_script: line 26: 
pip install -e tpot2
pip install -r tpot2/ImputerExperiments/requirements_.txt
: No such file or directory
RunStart
Version 0.1.7a0 of tpot2 is outdated. Version 0.1.8a0 was released 3 days ago.
starting loops
../data/r/197/197.pkl
working on 
../data/r/197/reg_simple_MNAR_0.01_3
0.43834781646728516
running experiment 1/3 - Does large hyperparameter space improve reconstruction accuracy over simple
[I 2024-09-21 10:10:27,052] A new study created in memory with name: no-name-40e3e376-8115-4c07-8d8f-08bbf0364d43
running
running
running
running
running
running
running
running
running
running
running
running
running
running
running
running
[I 2024-09-21 10:10:27,336] Trial 3 finished with value: 0.18069887100397872 and parameters: {'model_name': 'SimpleImputer', 'strategy': 'constant'}. Best is trial 3 with value: 0.18069887100397872.
running
[I 2024-09-21 10:10:27,587] Trial 2 finished with value: 0.18069887100397872 and parameters: {'model_name': 'SimpleImputer', 'strategy': 'constant'}. Best is trial 3 with value: 0.18069887100397872.
running
[I 2024-09-21 10:10:27,729] Trial 7 finished with value: 0.18069887100397872 and parameters: {'model_name': 'SimpleImputer', 'strategy': 'constant'}. Best is trial 3 with value: 0.18069887100397872.
[I 2024-09-21 10:10:27,840] Trial 0 finished with value: 0.09532088706378058 and parameters: {'model_name': 'SimpleImputer', 'strategy': 'mean'}. Best is trial 0 with value: 0.09532088706378058.
running
[I 2024-09-21 10:10:27,964] Trial 1 finished with value: 0.09532088706378058 and parameters: {'model_name': 'SimpleImputer', 'strategy': 'mean'}. Best is trial 0 with value: 0.09532088706378058.
running
[I 2024-09-21 10:10:28,086] Trial 9 finished with value: 0.18069887100397872 and parameters: {'model_name': 'SimpleImputer', 'strategy': 'constant'}. Best is trial 0 with value: 0.09532088706378058.
running
running
[I 2024-09-21 10:10:28,254] Trial 11 finished with value: 0.09532088706378058 and parameters: {'model_name': 'SimpleImputer', 'strategy': 'mean'}. Best is trial 0 with value: 0.09532088706378058.
[I 2024-09-21 10:10:28,377] Trial 8 finished with value: 0.18069887100397872 and parameters: {'model_name': 'SimpleImputer', 'strategy': 'constant'}. Best is trial 0 with value: 0.09532088706378058.
running
[I 2024-09-21 10:10:28,500] Trial 10 finished with value: 0.09532088706378058 and parameters: {'model_name': 'SimpleImputer', 'strategy': 'mean'}. Best is trial 0 with value: 0.09532088706378058.
running
running
[I 2024-09-21 10:10:28,642] Trial 12 finished with value: 0.18069887100397872 and parameters: {'model_name': 'SimpleImputer', 'strategy': 'constant'}. Best is trial 0 with value: 0.09532088706378058.
[I 2024-09-21 10:10:28,762] Trial 14 finished with value: 0.18069887100397872 and parameters: {'model_name': 'SimpleImputer', 'strategy': 'constant'}. Best is trial 0 with value: 0.09532088706378058.
running
running
[I 2024-09-21 10:10:28,978] Trial 5 finished with value: 0.09532088706378058 and parameters: {'model_name': 'SimpleImputer', 'strategy': 'mean'}. Best is trial 0 with value: 0.09532088706378058.
running
[I 2024-09-21 10:10:29,109] Trial 17 finished with value: 0.18069887100397872 and parameters: {'model_name': 'SimpleImputer', 'strategy': 'constant'}. Best is trial 0 with value: 0.09532088706378058.
running
[I 2024-09-21 10:10:29,267] Trial 6 finished with value: 0.10324322835046014 and parameters: {'model_name': 'SimpleImputer', 'strategy': 'median'}. Best is trial 0 with value: 0.09532088706378058.
running
[I 2024-09-21 10:10:29,393] Trial 4 finished with value: 0.10324322835046014 and parameters: {'model_name': 'SimpleImputer', 'strategy': 'median'}. Best is trial 0 with value: 0.09532088706378058.
running
[I 2024-09-21 10:10:29,652] Trial 15 finished with value: 0.10324322835046014 and parameters: {'model_name': 'SimpleImputer', 'strategy': 'median'}. Best is trial 0 with value: 0.09532088706378058.
running
[I 2024-09-21 10:10:29,851] Trial 24 finished with value: 0.18069887100397872 and parameters: {'model_name': 'SimpleImputer', 'strategy': 'constant'}. Best is trial 0 with value: 0.09532088706378058.
running
[I 2024-09-21 10:10:30,046] Trial 22 finished with value: 0.09532088706378058 and parameters: {'model_name': 'SimpleImputer', 'strategy': 'mean'}. Best is trial 0 with value: 0.09532088706378058.
[I 2024-09-21 10:10:30,155] Trial 16 finished with value: 0.10324322835046014 and parameters: {'model_name': 'SimpleImputer', 'strategy': 'median'}. Best is trial 0 with value: 0.09532088706378058.
running
running
[I 2024-09-21 10:10:30,308] Trial 25 finished with value: 0.09532088706378058 and parameters: {'model_name': 'SimpleImputer', 'strategy': 'mean'}. Best is trial 0 with value: 0.09532088706378058.
running
[I 2024-09-21 10:10:30,511] Trial 26 finished with value: 0.09532088706378058 and parameters: {'model_name': 'SimpleImputer', 'strategy': 'mean'}. Best is trial 0 with value: 0.09532088706378058.
running
[I 2024-09-21 10:10:30,670] Trial 23 finished with value: 0.10324322835046014 and parameters: {'model_name': 'SimpleImputer', 'strategy': 'median'}. Best is trial 0 with value: 0.09532088706378058.
running
[I 2024-09-21 10:10:30,902] Trial 21 finished with value: 0.10324322835046014 and parameters: {'model_name': 'SimpleImputer', 'strategy': 'median'}. Best is trial 0 with value: 0.09532088706378058.
running
[I 2024-09-21 10:10:31,098] Trial 20 finished with value: 0.10324322835046014 and parameters: {'model_name': 'SimpleImputer', 'strategy': 'median'}. Best is trial 0 with value: 0.09532088706378058.
[I 2024-09-21 10:10:31,194] Trial 19 finished with value: 0.10324322835046014 and parameters: {'model_name': 'SimpleImputer', 'strategy': 'median'}. Best is trial 0 with value: 0.09532088706378058.
running
running
[I 2024-09-21 10:10:31,428] Trial 28 finished with value: 0.10324322835046014 and parameters: {'model_name': 'SimpleImputer', 'strategy': 'median'}. Best is trial 0 with value: 0.09532088706378058.
running
[I 2024-09-21 10:10:32,327] Trial 13 finished with value: 0.17947147982334793 and parameters: {'model_name': 'SimpleImputer', 'strategy': 'most_frequent'}. Best is trial 0 with value: 0.09532088706378058.
running
[I 2024-09-21 10:10:32,979] Trial 27 finished with value: 0.17947147982334793 and parameters: {'model_name': 'SimpleImputer', 'strategy': 'most_frequent'}. Best is trial 0 with value: 0.09532088706378058.
running
[I 2024-09-21 10:10:33,200] Trial 18 finished with value: 0.17947147982334793 and parameters: {'model_name': 'SimpleImputer', 'strategy': 'most_frequent'}. Best is trial 0 with value: 0.09532088706378058.
running
[I 2024-09-21 10:10:33,406] Trial 42 finished with value: 0.09532088706378058 and parameters: {'model_name': 'SimpleImputer', 'strategy': 'mean'}. Best is trial 0 with value: 0.09532088706378058.
running
[I 2024-09-21 10:10:33,523] Trial 29 finished with value: 0.17947147982334793 and parameters: {'model_name': 'SimpleImputer', 'strategy': 'most_frequent'}. Best is trial 0 with value: 0.09532088706378058.
running
[I 2024-09-21 10:10:33,910] Trial 33 finished with value: 0.17947147982334793 and parameters: {'model_name': 'SimpleImputer', 'strategy': 'most_frequent'}. Best is trial 0 with value: 0.09532088706378058.
running
[I 2024-09-21 10:10:34,074] Trial 30 finished with value: 0.17947147982334793 and parameters: {'model_name': 'SimpleImputer', 'strategy': 'most_frequent'}. Best is trial 0 with value: 0.09532088706378058.
running
[I 2024-09-21 10:10:34,212] Trial 31 finished with value: 0.17947147982334793 and parameters: {'model_name': 'SimpleImputer', 'strategy': 'most_frequent'}. Best is trial 0 with value: 0.09532088706378058.
running
[I 2024-09-21 10:10:34,429] Trial 36 finished with value: 0.17947147982334793 and parameters: {'model_name': 'SimpleImputer', 'strategy': 'most_frequent'}. Best is trial 0 with value: 0.09532088706378058.
running
[I 2024-09-21 10:10:34,562] Trial 35 finished with value: 0.17947147982334793 and parameters: {'model_name': 'SimpleImputer', 'strategy': 'most_frequent'}. Best is trial 0 with value: 0.09532088706378058.
[I 2024-09-21 10:10:34,667] Trial 37 finished with value: 0.17947147982334793 and parameters: {'model_name': 'SimpleImputer', 'strategy': 'most_frequent'}. Best is trial 0 with value: 0.09532088706378058.
running
running
[I 2024-09-21 10:10:34,868] Trial 34 finished with value: 0.17947147982334793 and parameters: {'model_name': 'SimpleImputer', 'strategy': 'most_frequent'}. Best is trial 0 with value: 0.09532088706378058.
running
[I 2024-09-21 10:10:34,981] Trial 38 finished with value: 0.17947147982334793 and parameters: {'model_name': 'SimpleImputer', 'strategy': 'most_frequent'}. Best is trial 0 with value: 0.09532088706378058.
running
[I 2024-09-21 10:10:35,114] Trial 43 finished with value: 0.09532088706378058 and parameters: {'model_name': 'SimpleImputer', 'strategy': 'mean'}. Best is trial 0 with value: 0.09532088706378058.
running
[I 2024-09-21 10:10:35,222] Trial 44 finished with value: 0.09532088706378058 and parameters: {'model_name': 'SimpleImputer', 'strategy': 'mean'}. Best is trial 0 with value: 0.09532088706378058.
running
[I 2024-09-21 10:10:35,440] Trial 46 finished with value: 0.09532088706378058 and parameters: {'model_name': 'SimpleImputer', 'strategy': 'mean'}. Best is trial 0 with value: 0.09532088706378058.
[I 2024-09-21 10:10:35,442] Trial 39 finished with value: 0.17947147982334793 and parameters: {'model_name': 'SimpleImputer', 'strategy': 'most_frequent'}. Best is trial 0 with value: 0.09532088706378058.
running
running
[I 2024-09-21 10:10:35,748] Trial 41 finished with value: 0.17947147982334793 and parameters: {'model_name': 'SimpleImputer', 'strategy': 'most_frequent'}. Best is trial 0 with value: 0.09532088706378058.
[I 2024-09-21 10:10:35,861] Trial 40 finished with value: 0.17947147982334793 and parameters: {'model_name': 'SimpleImputer', 'strategy': 'most_frequent'}. Best is trial 0 with value: 0.09532088706378058.
running
[I 2024-09-21 10:10:35,970] Trial 45 finished with value: 0.09532088706378058 and parameters: {'model_name': 'SimpleImputer', 'strategy': 'mean'}. Best is trial 0 with value: 0.09532088706378058.
[I 2024-09-21 10:10:36,068] Trial 49 finished with value: 0.09532088706378058 and parameters: {'model_name': 'SimpleImputer', 'strategy': 'mean'}. Best is trial 0 with value: 0.09532088706378058.
running
running
running
[I 2024-09-21 10:10:36,174] Trial 32 finished with value: 0.17947147982334793 and parameters: {'model_name': 'SimpleImputer', 'strategy': 'most_frequent'}. Best is trial 0 with value: 0.09532088706378058.
[I 2024-09-21 10:10:36,277] Trial 47 finished with value: 0.09532088706378058 and parameters: {'model_name': 'SimpleImputer', 'strategy': 'mean'}. Best is trial 0 with value: 0.09532088706378058.
running
running
[I 2024-09-21 10:10:36,406] Trial 48 finished with value: 0.09532088706378058 and parameters: {'model_name': 'SimpleImputer', 'strategy': 'mean'}. Best is trial 0 with value: 0.09532088706378058.
[I 2024-09-21 10:10:36,539] Trial 50 finished with value: 0.09532088706378058 and parameters: {'model_name': 'SimpleImputer', 'strategy': 'mean'}. Best is trial 0 with value: 0.09532088706378058.
running
running
[I 2024-09-21 10:10:36,674] Trial 52 finished with value: 0.09532088706378058 and parameters: {'model_name': 'SimpleImputer', 'strategy': 'mean'}. Best is trial 0 with value: 0.09532088706378058.
running
[I 2024-09-21 10:10:36,855] Trial 51 finished with value: 0.09532088706378058 and parameters: {'model_name': 'SimpleImputer', 'strategy': 'mean'}. Best is trial 0 with value: 0.09532088706378058.
running
[I 2024-09-21 10:10:37,094] Trial 55 finished with value: 0.09532088706378058 and parameters: {'model_name': 'SimpleImputer', 'strategy': 'mean'}. Best is trial 0 with value: 0.09532088706378058.
[I 2024-09-21 10:10:37,209] Trial 54 finished with value: 0.09532088706378058 and parameters: {'model_name': 'SimpleImputer', 'strategy': 'mean'}. Best is trial 0 with value: 0.09532088706378058.
running
[I 2024-09-21 10:10:37,328] Trial 53 finished with value: 0.09532088706378058 and parameters: {'model_name': 'SimpleImputer', 'strategy': 'mean'}. Best is trial 0 with value: 0.09532088706378058.
running
running
[I 2024-09-21 10:10:37,480] Trial 56 finished with value: 0.09532088706378058 and parameters: {'model_name': 'SimpleImputer', 'strategy': 'mean'}. Best is trial 0 with value: 0.09532088706378058.
running
[I 2024-09-21 10:10:37,610] Trial 59 finished with value: 0.09532088706378058 and parameters: {'model_name': 'SimpleImputer', 'strategy': 'mean'}. Best is trial 0 with value: 0.09532088706378058.
running
[I 2024-09-21 10:10:37,740] Trial 57 finished with value: 0.09532088706378058 and parameters: {'model_name': 'SimpleImputer', 'strategy': 'mean'}. Best is trial 0 with value: 0.09532088706378058.
running
[I 2024-09-21 10:10:37,885] Trial 62 finished with value: 0.09532088706378058 and parameters: {'model_name': 'SimpleImputer', 'strategy': 'mean'}. Best is trial 0 with value: 0.09532088706378058.
running
[I 2024-09-21 10:10:38,072] Trial 58 finished with value: 0.09532088706378058 and parameters: {'model_name': 'SimpleImputer', 'strategy': 'mean'}. Best is trial 0 with value: 0.09532088706378058.
running
[I 2024-09-21 10:10:38,256] Trial 60 finished with value: 0.09532088706378058 and parameters: {'model_name': 'SimpleImputer', 'strategy': 'mean'}. Best is trial 0 with value: 0.09532088706378058.
[I 2024-09-21 10:10:38,370] Trial 61 finished with value: 0.09532088706378058 and parameters: {'model_name': 'SimpleImputer', 'strategy': 'mean'}. Best is trial 0 with value: 0.09532088706378058.
running
running
[I 2024-09-21 10:10:38,506] Trial 65 finished with value: 0.09532088706378058 and parameters: {'model_name': 'SimpleImputer', 'strategy': 'mean'}. Best is trial 0 with value: 0.09532088706378058.
running
[I 2024-09-21 10:10:38,651] Trial 64 finished with value: 0.09532088706378058 and parameters: {'model_name': 'SimpleImputer', 'strategy': 'mean'}. Best is trial 0 with value: 0.09532088706378058.
[I 2024-09-21 10:10:38,777] Trial 68 finished with value: 0.09532088706378058 and parameters: {'model_name': 'SimpleImputer', 'strategy': 'mean'}. Best is trial 0 with value: 0.09532088706378058.
running
[I 2024-09-21 10:10:38,889] Trial 63 finished with value: 0.09532088706378058 and parameters: {'model_name': 'SimpleImputer', 'strategy': 'mean'}. Best is trial 0 with value: 0.09532088706378058.
running
running
[I 2024-09-21 10:10:39,014] Trial 67 finished with value: 0.09532088706378058 and parameters: {'model_name': 'SimpleImputer', 'strategy': 'mean'}. Best is trial 0 with value: 0.09532088706378058.
running
[I 2024-09-21 10:10:39,220] Trial 72 finished with value: 0.09532088706378058 and parameters: {'model_name': 'SimpleImputer', 'strategy': 'mean'}. Best is trial 0 with value: 0.09532088706378058.
[I 2024-09-21 10:10:39,344] Trial 69 finished with value: 0.09532088706378058 and parameters: {'model_name': 'SimpleImputer', 'strategy': 'mean'}. Best is trial 0 with value: 0.09532088706378058.
running
[I 2024-09-21 10:10:39,458] Trial 66 finished with value: 0.09532088706378058 and parameters: {'model_name': 'SimpleImputer', 'strategy': 'mean'}. Best is trial 0 with value: 0.09532088706378058.
running
[I 2024-09-21 10:10:39,577] Trial 71 finished with value: 0.09532088706378058 and parameters: {'model_name': 'SimpleImputer', 'strategy': 'mean'}. Best is trial 0 with value: 0.09532088706378058.
running
running
[I 2024-09-21 10:10:39,732] Trial 74 finished with value: 0.09532088706378058 and parameters: {'model_name': 'SimpleImputer', 'strategy': 'mean'}. Best is trial 0 with value: 0.09532088706378058.
running
[I 2024-09-21 10:10:39,864] Trial 75 finished with value: 0.18069887100397872 and parameters: {'model_name': 'SimpleImputer', 'strategy': 'constant'}. Best is trial 0 with value: 0.09532088706378058.
[I 2024-09-21 10:10:39,979] Trial 73 finished with value: 0.09532088706378058 and parameters: {'model_name': 'SimpleImputer', 'strategy': 'mean'}. Best is trial 0 with value: 0.09532088706378058.
running
[I 2024-09-21 10:10:40,128] Trial 70 finished with value: 0.09532088706378058 and parameters: {'model_name': 'SimpleImputer', 'strategy': 'mean'}. Best is trial 0 with value: 0.09532088706378058.
running
running
[I 2024-09-21 10:10:40,311] Trial 76 finished with value: 0.09532088706378058 and parameters: {'model_name': 'SimpleImputer', 'strategy': 'mean'}. Best is trial 0 with value: 0.09532088706378058.
running
[I 2024-09-21 10:10:40,425] Trial 78 finished with value: 0.18069887100397872 and parameters: {'model_name': 'SimpleImputer', 'strategy': 'constant'}. Best is trial 0 with value: 0.09532088706378058.
[I 2024-09-21 10:10:40,564] Trial 82 finished with value: 0.18069887100397872 and parameters: {'model_name': 'SimpleImputer', 'strategy': 'constant'}. Best is trial 0 with value: 0.09532088706378058.
running
running
[I 2024-09-21 10:10:40,728] Trial 83 finished with value: 0.18069887100397872 and parameters: {'model_name': 'SimpleImputer', 'strategy': 'constant'}. Best is trial 0 with value: 0.09532088706378058.
[I 2024-09-21 10:10:40,843] Trial 80 finished with value: 0.18069887100397872 and parameters: {'model_name': 'SimpleImputer', 'strategy': 'constant'}. Best is trial 0 with value: 0.09532088706378058.
running
running
[I 2024-09-21 10:10:41,018] Trial 77 finished with value: 0.09532088706378058 and parameters: {'model_name': 'SimpleImputer', 'strategy': 'mean'}. Best is trial 0 with value: 0.09532088706378058.
running
[I 2024-09-21 10:10:41,151] Trial 84 finished with value: 0.18069887100397872 and parameters: {'model_name': 'SimpleImputer', 'strategy': 'constant'}. Best is trial 0 with value: 0.09532088706378058.
[I 2024-09-21 10:10:41,262] Trial 87 finished with value: 0.18069887100397872 and parameters: {'model_name': 'SimpleImputer', 'strategy': 'constant'}. Best is trial 0 with value: 0.09532088706378058.
running
[I 2024-09-21 10:10:41,274] Trial 79 finished with value: 0.09532088706378058 and parameters: {'model_name': 'SimpleImputer', 'strategy': 'mean'}. Best is trial 0 with value: 0.09532088706378058.
[I 2024-09-21 10:10:41,385] Trial 86 finished with value: 0.18069887100397872 and parameters: {'model_name': 'SimpleImputer', 'strategy': 'constant'}. Best is trial 0 with value: 0.09532088706378058.
[I 2024-09-21 10:10:41,607] Trial 85 finished with value: 0.18069887100397872 and parameters: {'model_name': 'SimpleImputer', 'strategy': 'constant'}. Best is trial 0 with value: 0.09532088706378058.
[I 2024-09-21 10:10:41,717] Trial 81 finished with value: 0.18069887100397872 and parameters: {'model_name': 'SimpleImputer', 'strategy': 'constant'}. Best is trial 0 with value: 0.09532088706378058.
running
running
running
running
running
[I 2024-09-21 10:10:41,964] Trial 88 finished with value: 0.18069887100397872 and parameters: {'model_name': 'SimpleImputer', 'strategy': 'constant'}. Best is trial 0 with value: 0.09532088706378058.
running
[I 2024-09-21 10:10:42,088] Trial 89 finished with value: 0.18069887100397872 and parameters: {'model_name': 'SimpleImputer', 'strategy': 'constant'}. Best is trial 0 with value: 0.09532088706378058.
running
[I 2024-09-21 10:10:42,236] Trial 90 finished with value: 0.18069887100397872 and parameters: {'model_name': 'SimpleImputer', 'strategy': 'constant'}. Best is trial 0 with value: 0.09532088706378058.
[I 2024-09-21 10:10:42,348] Trial 91 finished with value: 0.18069887100397872 and parameters: {'model_name': 'SimpleImputer', 'strategy': 'constant'}. Best is trial 0 with value: 0.09532088706378058.
running
running
[I 2024-09-21 10:10:42,717] Trial 92 finished with value: 0.10324322835046014 and parameters: {'model_name': 'SimpleImputer', 'strategy': 'median'}. Best is trial 0 with value: 0.09532088706378058.
running
[I 2024-09-21 10:10:42,850] Trial 95 finished with value: 0.10324322835046014 and parameters: {'model_name': 'SimpleImputer', 'strategy': 'median'}. Best is trial 0 with value: 0.09532088706378058.
running
[I 2024-09-21 10:10:43,054] Trial 97 finished with value: 0.10324322835046014 and parameters: {'model_name': 'SimpleImputer', 'strategy': 'median'}. Best is trial 0 with value: 0.09532088706378058.
[I 2024-09-21 10:10:43,181] Trial 96 finished with value: 0.10324322835046014 and parameters: {'model_name': 'SimpleImputer', 'strategy': 'median'}. Best is trial 0 with value: 0.09532088706378058.
running
running
[I 2024-09-21 10:10:43,318] Trial 93 finished with value: 0.10324322835046014 and parameters: {'model_name': 'SimpleImputer', 'strategy': 'median'}. Best is trial 0 with value: 0.09532088706378058.
running
[I 2024-09-21 10:10:43,451] Trial 98 finished with value: 0.10324322835046014 and parameters: {'model_name': 'SimpleImputer', 'strategy': 'median'}. Best is trial 0 with value: 0.09532088706378058.
running
[I 2024-09-21 10:10:43,575] Trial 99 finished with value: 0.10324322835046014 and parameters: {'model_name': 'SimpleImputer', 'strategy': 'median'}. Best is trial 0 with value: 0.09532088706378058.
running
[I 2024-09-21 10:10:43,715] Trial 100 finished with value: 0.10324322835046014 and parameters: {'model_name': 'SimpleImputer', 'strategy': 'median'}. Best is trial 0 with value: 0.09532088706378058.
running
[I 2024-09-21 10:10:43,865] Trial 102 finished with value: 0.10324322835046014 and parameters: {'model_name': 'SimpleImputer', 'strategy': 'median'}. Best is trial 0 with value: 0.09532088706378058.
running
[I 2024-09-21 10:10:43,982] Trial 94 finished with value: 0.10324322835046014 and parameters: {'model_name': 'SimpleImputer', 'strategy': 'median'}. Best is trial 0 with value: 0.09532088706378058.
running
[I 2024-09-21 10:10:44,137] Trial 105 finished with value: 0.10324322835046014 and parameters: {'model_name': 'SimpleImputer', 'strategy': 'median'}. Best is trial 0 with value: 0.09532088706378058.
running
