[I 2024-10-07 18:16:13,599] Trial 162 finished with value: 0.07348025218009999 and parameters: {'model_name': 'IterativeImputer', 'estimator': 'Bayesian', 'initial_strategy': 'constant', 'n_nearest_features': 10, 'imputation_order': 'arabic', 'sample_posterior': False}. Best is trial 141 with value: 0.05203007935391997.
running
[I 2024-10-07 18:17:34,402] Trial 149 finished with value: 0.0520361638580296 and parameters: {'model_name': 'IterativeImputer', 'estimator': 'RFR', 'initial_strategy': 'most_frequent', 'n_nearest_features': 10, 'imputation_order': 'arabic'}. Best is trial 141 with value: 0.05203007935391997.
running
[I 2024-10-07 18:18:06,886] Trial 148 finished with value: 0.05266854574276432 and parameters: {'model_name': 'IterativeImputer', 'estimator': 'RFR', 'initial_strategy': 'most_frequent', 'n_nearest_features': 10, 'imputation_order': 'arabic'}. Best is trial 141 with value: 0.05203007935391997.
running
[I 2024-10-07 18:18:28,830] Trial 165 finished with value: 0.07173970369603436 and parameters: {'model_name': 'IterativeImputer', 'estimator': 'Ridge', 'initial_strategy': 'constant', 'n_nearest_features': 10, 'imputation_order': 'arabic'}. Best is trial 141 with value: 0.05203007935391997.
running
[I 2024-10-07 18:22:57,919] Trial 150 finished with value: 0.05251049595581401 and parameters: {'model_name': 'IterativeImputer', 'estimator': 'RFR', 'initial_strategy': 'constant', 'n_nearest_features': 10, 'imputation_order': 'arabic'}. Best is trial 141 with value: 0.05203007935391997.
running
[I 2024-10-07 18:25:10,218] Trial 151 finished with value: 0.05233404271894245 and parameters: {'model_name': 'IterativeImputer', 'estimator': 'RFR', 'initial_strategy': 'constant', 'n_nearest_features': 10, 'imputation_order': 'arabic'}. Best is trial 141 with value: 0.05203007935391997.
running
[I 2024-10-07 18:28:15,780] Trial 153 finished with value: 0.052468997833587015 and parameters: {'model_name': 'IterativeImputer', 'estimator': 'RFR', 'initial_strategy': 'most_frequent', 'n_nearest_features': 10, 'imputation_order': 'random'}. Best is trial 141 with value: 0.05203007935391997.
running
[I 2024-10-07 18:32:10,511] Trial 154 finished with value: 0.052908291117335124 and parameters: {'model_name': 'IterativeImputer', 'estimator': 'RFR', 'initial_strategy': 'constant', 'n_nearest_features': 10, 'imputation_order': 'random'}. Best is trial 141 with value: 0.05203007935391997.
running
[I 2024-10-07 18:35:35,587] Trial 155 finished with value: 0.05239457614013012 and parameters: {'model_name': 'IterativeImputer', 'estimator': 'RFR', 'initial_strategy': 'most_frequent', 'n_nearest_features': 10, 'imputation_order': 'arabic'}. Best is trial 141 with value: 0.05203007935391997.
running
[I 2024-10-07 18:38:58,927] Trial 156 finished with value: 0.05240987654609301 and parameters: {'model_name': 'IterativeImputer', 'estimator': 'RFR', 'initial_strategy': 'constant', 'n_nearest_features': 10, 'imputation_order': 'random'}. Best is trial 141 with value: 0.05203007935391997.
running
[I 2024-10-07 18:39:40,945] Trial 157 finished with value: 0.052579646807348904 and parameters: {'model_name': 'IterativeImputer', 'estimator': 'RFR', 'initial_strategy': 'constant', 'n_nearest_features': 10, 'imputation_order': 'random'}. Best is trial 141 with value: 0.05203007935391997.
running
[I 2024-10-07 18:39:41,296] Trial 173 finished with value: 0.09983845368176913 and parameters: {'model_name': 'SimpleImputer', 'strategy': 'mean'}. Best is trial 141 with value: 0.05203007935391997.
running
[I 2024-10-07 18:40:53,418] Trial 158 finished with value: 0.05288924954028549 and parameters: {'model_name': 'IterativeImputer', 'estimator': 'RFR', 'initial_strategy': 'constant', 'n_nearest_features': 10, 'imputation_order': 'random'}. Best is trial 141 with value: 0.05203007935391997.
running
[I 2024-10-07 18:42:43,503] Trial 159 finished with value: 0.05250098311391439 and parameters: {'model_name': 'IterativeImputer', 'estimator': 'RFR', 'initial_strategy': 'constant', 'n_nearest_features': 10, 'imputation_order': 'arabic'}. Best is trial 141 with value: 0.05203007935391997.
running
[I 2024-10-07 18:43:12,823] Trial 160 finished with value: 0.0525811928905958 and parameters: {'model_name': 'IterativeImputer', 'estimator': 'RFR', 'initial_strategy': 'constant', 'n_nearest_features': 10, 'imputation_order': 'arabic'}. Best is trial 141 with value: 0.05203007935391997.
running
[I 2024-10-07 18:47:10,804] Trial 161 finished with value: 0.05246721835044995 and parameters: {'model_name': 'IterativeImputer', 'estimator': 'RFR', 'initial_strategy': 'constant', 'n_nearest_features': 10, 'imputation_order': 'arabic'}. Best is trial 141 with value: 0.05203007935391997.
running
[I 2024-10-07 18:50:40,571] Trial 163 finished with value: 0.05266366257080114 and parameters: {'model_name': 'IterativeImputer', 'estimator': 'RFR', 'initial_strategy': 'constant', 'n_nearest_features': 10, 'imputation_order': 'random'}. Best is trial 141 with value: 0.05203007935391997.
running
[I 2024-10-07 18:51:43,170] Trial 164 finished with value: 0.05255398160561657 and parameters: {'model_name': 'IterativeImputer', 'estimator': 'RFR', 'initial_strategy': 'constant', 'n_nearest_features': 10, 'imputation_order': 'arabic'}. Best is trial 141 with value: 0.05203007935391997.
running
[I 2024-10-07 18:53:06,316] Trial 166 finished with value: 0.052907901464741024 and parameters: {'model_name': 'IterativeImputer', 'estimator': 'RFR', 'initial_strategy': 'most_frequent', 'n_nearest_features': 11, 'imputation_order': 'random'}. Best is trial 141 with value: 0.05203007935391997.
running
[I 2024-10-07 18:56:44,733] Trial 167 finished with value: 0.052719965837557406 and parameters: {'model_name': 'IterativeImputer', 'estimator': 'RFR', 'initial_strategy': 'most_frequent', 'n_nearest_features': 11, 'imputation_order': 'random'}. Best is trial 141 with value: 0.05203007935391997.
running
[I 2024-10-07 18:56:47,301] Trial 182 finished with value: 0.06671791676092372 and parameters: {'model_name': 'KNNImputer', 'n_neighbors': 85, 'weights': 'uniform'}. Best is trial 141 with value: 0.05203007935391997.
running
[I 2024-10-07 18:57:06,193] Trial 183 finished with value: 0.06060415656867665 and parameters: {'model_name': 'IterativeImputer', 'estimator': 'KNN', 'initial_strategy': 'most_frequent', 'n_nearest_features': 11, 'imputation_order': 'random'}. Best is trial 141 with value: 0.05203007935391997.
running
[I 2024-10-07 18:59:54,625] Trial 168 finished with value: 0.05263409295388214 and parameters: {'model_name': 'IterativeImputer', 'estimator': 'RFR', 'initial_strategy': 'constant', 'n_nearest_features': 10, 'imputation_order': 'arabic'}. Best is trial 141 with value: 0.05203007935391997.
running
[I 2024-10-07 19:01:30,767] Trial 28 finished with value: 0.0986251883808767 and parameters: {'model_name': 'VAE', 'batch_size': 805, 'iterations': 8993, 'learning_rate': 0.00011477444916597523, 'p_miss': 0.2573265262872815}. Best is trial 141 with value: 0.05203007935391997.
running
[I 2024-10-07 19:02:25,270] Trial 169 finished with value: 0.05292877161652616 and parameters: {'model_name': 'IterativeImputer', 'estimator': 'RFR', 'initial_strategy': 'constant', 'n_nearest_features': 10, 'imputation_order': 'arabic'}. Best is trial 141 with value: 0.05203007935391997.
running
[I 2024-10-07 19:06:38,933] Trial 170 finished with value: 0.05251481824416267 and parameters: {'model_name': 'IterativeImputer', 'estimator': 'RFR', 'initial_strategy': 'constant', 'n_nearest_features': 10, 'imputation_order': 'arabic'}. Best is trial 141 with value: 0.05203007935391997.
running
[I 2024-10-07 19:09:55,475] Trial 171 finished with value: 0.05231672627968633 and parameters: {'model_name': 'IterativeImputer', 'estimator': 'RFR', 'initial_strategy': 'constant', 'n_nearest_features': 11, 'imputation_order': 'arabic'}. Best is trial 141 with value: 0.05203007935391997.
running
[I 2024-10-07 19:12:31,126] Trial 172 finished with value: 0.052154588180384154 and parameters: {'model_name': 'IterativeImputer', 'estimator': 'RFR', 'initial_strategy': 'constant', 'n_nearest_features': 11, 'imputation_order': 'arabic'}. Best is trial 141 with value: 0.05203007935391997.
running
[I 2024-10-07 19:13:37,627] Trial 174 finished with value: 0.052363524882292435 and parameters: {'model_name': 'IterativeImputer', 'estimator': 'RFR', 'initial_strategy': 'mean', 'n_nearest_features': 11, 'imputation_order': 'arabic'}. Best is trial 141 with value: 0.05203007935391997.
running
[I 2024-10-07 19:14:58,227] Trial 175 finished with value: 0.05254319306512654 and parameters: {'model_name': 'IterativeImputer', 'estimator': 'RFR', 'initial_strategy': 'mean', 'n_nearest_features': 11, 'imputation_order': 'arabic'}. Best is trial 141 with value: 0.05203007935391997.
running
[I 2024-10-07 19:16:54,049] Trial 176 finished with value: 0.05283976023892811 and parameters: {'model_name': 'IterativeImputer', 'estimator': 'RFR', 'initial_strategy': 'most_frequent', 'n_nearest_features': 11, 'imputation_order': 'random'}. Best is trial 141 with value: 0.05203007935391997.
running
[I 2024-10-07 19:16:54,961] Trial 177 finished with value: 0.05246048046738613 and parameters: {'model_name': 'IterativeImputer', 'estimator': 'RFR', 'initial_strategy': 'most_frequent', 'n_nearest_features': 11, 'imputation_order': 'random'}. Best is trial 141 with value: 0.05203007935391997.
running
[I 2024-10-07 19:17:09,834] Trial 193 finished with value: 0.07173967735057464 and parameters: {'model_name': 'IterativeImputer', 'estimator': 'Ridge', 'initial_strategy': 'most_frequent', 'n_nearest_features': 11, 'imputation_order': 'roman'}. Best is trial 141 with value: 0.05203007935391997.
running
[I 2024-10-07 19:18:05,583] Trial 194 finished with value: 0.07348026830016198 and parameters: {'model_name': 'IterativeImputer', 'estimator': 'Bayesian', 'initial_strategy': 'most_frequent', 'n_nearest_features': 11, 'imputation_order': 'roman', 'sample_posterior': False}. Best is trial 141 with value: 0.05203007935391997.
running
[I 2024-10-07 19:18:08,056] Trial 44 finished with value: 0.09857134201577702 and parameters: {'model_name': 'VAE', 'batch_size': 881, 'iterations': 9984, 'learning_rate': 0.0007681577565320396, 'p_miss': 0.19578172289795587}. Best is trial 141 with value: 0.05203007935391997.
running
[I 2024-10-07 19:20:41,307] Trial 178 finished with value: 0.052427378948219694 and parameters: {'model_name': 'IterativeImputer', 'estimator': 'RFR', 'initial_strategy': 'most_frequent', 'n_nearest_features': 11, 'imputation_order': 'random'}. Best is trial 141 with value: 0.05203007935391997.
running
[I 2024-10-07 19:23:51,012] Trial 179 finished with value: 0.0533509296315378 and parameters: {'model_name': 'IterativeImputer', 'estimator': 'RFR', 'initial_strategy': 'most_frequent', 'n_nearest_features': 11, 'imputation_order': 'random'}. Best is trial 141 with value: 0.05203007935391997.
running
[I 2024-10-07 19:24:29,666] Trial 180 finished with value: 0.052317225790535785 and parameters: {'model_name': 'IterativeImputer', 'estimator': 'RFR', 'initial_strategy': 'most_frequent', 'n_nearest_features': 11, 'imputation_order': 'random'}. Best is trial 141 with value: 0.05203007935391997.
[I 2024-10-07 19:25:49,843] Trial 181 finished with value: 0.05233768415490923 and parameters: {'model_name': 'IterativeImputer', 'estimator': 'RFR', 'initial_strategy': 'most_frequent', 'n_nearest_features': 11, 'imputation_order': 'random'}. Best is trial 141 with value: 0.05203007935391997.
[I 2024-10-07 19:28:00,440] Trial 184 finished with value: 0.05249649189433429 and parameters: {'model_name': 'IterativeImputer', 'estimator': 'RFR', 'initial_strategy': 'mean', 'n_nearest_features': 11, 'imputation_order': 'random'}. Best is trial 141 with value: 0.05203007935391997.
[I 2024-10-07 19:30:16,811] Trial 185 finished with value: 0.052525112773317575 and parameters: {'model_name': 'IterativeImputer', 'estimator': 'RFR', 'initial_strategy': 'mean', 'n_nearest_features': 11, 'imputation_order': 'random'}. Best is trial 141 with value: 0.05203007935391997.
[I 2024-10-07 19:31:05,564] Trial 186 finished with value: 0.05263154080590504 and parameters: {'model_name': 'IterativeImputer', 'estimator': 'RFR', 'initial_strategy': 'most_frequent', 'n_nearest_features': 11, 'imputation_order': 'random'}. Best is trial 141 with value: 0.05203007935391997.
[I 2024-10-07 19:31:29,488] Trial 187 finished with value: 0.05259175925524588 and parameters: {'model_name': 'IterativeImputer', 'estimator': 'RFR', 'initial_strategy': 'most_frequent', 'n_nearest_features': 11, 'imputation_order': 'random'}. Best is trial 141 with value: 0.05203007935391997.
[I 2024-10-07 19:34:11,468] Trial 188 finished with value: 0.05202996510995702 and parameters: {'model_name': 'IterativeImputer', 'estimator': 'RFR', 'initial_strategy': 'most_frequent', 'n_nearest_features': 11, 'imputation_order': 'random'}. Best is trial 188 with value: 0.05202996510995702.
[I 2024-10-07 19:36:13,377] Trial 189 finished with value: 0.05237914827335095 and parameters: {'model_name': 'IterativeImputer', 'estimator': 'RFR', 'initial_strategy': 'mean', 'n_nearest_features': 11, 'imputation_order': 'random'}. Best is trial 188 with value: 0.05202996510995702.
[I 2024-10-07 19:37:32,594] Trial 190 finished with value: 0.05252366502051627 and parameters: {'model_name': 'IterativeImputer', 'estimator': 'RFR', 'initial_strategy': 'mean', 'n_nearest_features': 11, 'imputation_order': 'random'}. Best is trial 188 with value: 0.05202996510995702.
[I 2024-10-07 19:38:17,129] Trial 191 finished with value: 0.05266965795915679 and parameters: {'model_name': 'IterativeImputer', 'estimator': 'RFR', 'initial_strategy': 'most_frequent', 'n_nearest_features': 11, 'imputation_order': 'random'}. Best is trial 188 with value: 0.05202996510995702.
[I 2024-10-07 19:39:06,086] Trial 192 finished with value: 0.05266303493161063 and parameters: {'model_name': 'IterativeImputer', 'estimator': 'RFR', 'initial_strategy': 'most_frequent', 'n_nearest_features': 11, 'imputation_order': 'random'}. Best is trial 188 with value: 0.05202996510995702.
[I 2024-10-07 19:40:18,446] Trial 195 finished with value: 0.05256592329783334 and parameters: {'model_name': 'IterativeImputer', 'estimator': 'RFR', 'initial_strategy': 'most_frequent', 'n_nearest_features': 11, 'imputation_order': 'random'}. Best is trial 188 with value: 0.05202996510995702.
[I 2024-10-07 19:40:30,887] Trial 196 finished with value: 0.052596937176489014 and parameters: {'model_name': 'IterativeImputer', 'estimator': 'RFR', 'initial_strategy': 'mean', 'n_nearest_features': 11, 'imputation_order': 'arabic'}. Best is trial 188 with value: 0.05202996510995702.
[I 2024-10-07 19:40:32,969] Trial 197 finished with value: 0.05328771023268162 and parameters: {'model_name': 'IterativeImputer', 'estimator': 'RFR', 'initial_strategy': 'mean', 'n_nearest_features': 11, 'imputation_order': 'arabic'}. Best is trial 188 with value: 0.05202996510995702.
[I 2024-10-07 19:42:19,064] Trial 198 finished with value: 0.05284154435596132 and parameters: {'model_name': 'IterativeImputer', 'estimator': 'RFR', 'initial_strategy': 'most_frequent', 'n_nearest_features': 11, 'imputation_order': 'arabic'}. Best is trial 188 with value: 0.05202996510995702.
