Run: 13
/cm/local/apps/slurm/var/spool/job1068905/slurm_script: line 27: 
pip install -e tpot2
pip install -r tpot2/ImputerExperiments/requirements_.txt
: No such file or directory
RunStart
Version 0.1.7a0 of tpot2 is outdated. Version 0.1.8a0 was released Tuesday September 17, 2024.
starting loops
../data/c/41027/41027.pkl
working on 
../data/c/41027/class_simple_MCAR_0.01_1
0.886214017868042
running experiment 1/3 - Does large hyperparameter space improve reconstruction accuracy over simple
[I 2024-11-21 21:18:32,867] A new study created in memory with name: no-name-23050d29-f630-494d-ad3a-41b0ebea976d
running
running
running
running
running
running
running
running
running
running
running
running
running
running
running
running
[I 2024-11-21 21:18:33,294] Trial 0 finished with value: 0.6378569716386092 and parameters: {'model_name': 'SimpleImputer', 'strategy': 'constant'}. Best is trial 0 with value: 0.6378569716386092.
running
[I 2024-11-21 21:18:33,406] Trial 1 finished with value: 0.3604004952420291 and parameters: {'model_name': 'SimpleImputer', 'strategy': 'mean'}. Best is trial 1 with value: 0.3604004952420291.
running
[I 2024-11-21 21:18:33,575] Trial 10 finished with value: 0.6378569716386092 and parameters: {'model_name': 'SimpleImputer', 'strategy': 'constant'}. Best is trial 1 with value: 0.3604004952420291.
running
[I 2024-11-21 21:18:33,672] Trial 14 finished with value: 0.6378569716386092 and parameters: {'model_name': 'SimpleImputer', 'strategy': 'constant'}. Best is trial 1 with value: 0.3604004952420291.
[I 2024-11-21 21:18:33,753] Trial 8 finished with value: 0.3604004952420291 and parameters: {'model_name': 'SimpleImputer', 'strategy': 'mean'}. Best is trial 1 with value: 0.3604004952420291.
running
running
[I 2024-11-21 21:18:33,943] Trial 6 finished with value: 0.3604004952420291 and parameters: {'model_name': 'SimpleImputer', 'strategy': 'mean'}. Best is trial 1 with value: 0.3604004952420291.
[I 2024-11-21 21:18:34,043] Trial 2 finished with value: 0.3604004952420291 and parameters: {'model_name': 'SimpleImputer', 'strategy': 'mean'}. Best is trial 1 with value: 0.3604004952420291.
running
[I 2024-11-21 21:18:34,135] Trial 9 finished with value: 0.6378569716386092 and parameters: {'model_name': 'SimpleImputer', 'strategy': 'constant'}. Best is trial 1 with value: 0.3604004952420291.
[I 2024-11-21 21:18:34,227] Trial 12 finished with value: 0.3604004952420291 and parameters: {'model_name': 'SimpleImputer', 'strategy': 'mean'}. Best is trial 1 with value: 0.3604004952420291.
running
running
running
[I 2024-11-21 21:18:34,366] Trial 7 finished with value: 0.3604004952420291 and parameters: {'model_name': 'SimpleImputer', 'strategy': 'mean'}. Best is trial 1 with value: 0.3604004952420291.
running
[I 2024-11-21 21:18:34,567] Trial 4 finished with value: 0.5960220960369478 and parameters: {'model_name': 'SimpleImputer', 'strategy': 'most_frequent'}. Best is trial 1 with value: 0.3604004952420291.
running
[I 2024-11-21 21:18:34,692] Trial 3 finished with value: 0.3672367151158975 and parameters: {'model_name': 'SimpleImputer', 'strategy': 'median'}. Best is trial 1 with value: 0.3604004952420291.
[I 2024-11-21 21:18:34,784] Trial 11 finished with value: 0.5960220960369478 and parameters: {'model_name': 'SimpleImputer', 'strategy': 'most_frequent'}. Best is trial 1 with value: 0.3604004952420291.
running
running
[I 2024-11-21 21:18:34,987] Trial 15 finished with value: 0.5960220960369478 and parameters: {'model_name': 'SimpleImputer', 'strategy': 'most_frequent'}. Best is trial 1 with value: 0.3604004952420291.
running
[I 2024-11-21 21:18:35,108] Trial 5 finished with value: 0.5960220960369478 and parameters: {'model_name': 'SimpleImputer', 'strategy': 'most_frequent'}. Best is trial 1 with value: 0.3604004952420291.
running
[I 2024-11-21 21:18:35,249] Trial 17 finished with value: 0.3604004952420291 and parameters: {'model_name': 'SimpleImputer', 'strategy': 'mean'}. Best is trial 1 with value: 0.3604004952420291.
running
[I 2024-11-21 21:18:35,363] Trial 13 finished with value: 0.5960220960369478 and parameters: {'model_name': 'SimpleImputer', 'strategy': 'most_frequent'}. Best is trial 1 with value: 0.3604004952420291.
running
[I 2024-11-21 21:18:35,476] Trial 20 finished with value: 0.3604004952420291 and parameters: {'model_name': 'SimpleImputer', 'strategy': 'mean'}. Best is trial 1 with value: 0.3604004952420291.
running
[I 2024-11-21 21:18:35,612] Trial 22 finished with value: 0.6378569716386092 and parameters: {'model_name': 'SimpleImputer', 'strategy': 'constant'}. Best is trial 1 with value: 0.3604004952420291.
running
[I 2024-11-21 21:18:35,917] Trial 19 finished with value: 0.3672367151158975 and parameters: {'model_name': 'SimpleImputer', 'strategy': 'median'}. Best is trial 1 with value: 0.3604004952420291.
running
[I 2024-11-21 21:18:36,020] Trial 16 finished with value: 0.3672367151158975 and parameters: {'model_name': 'SimpleImputer', 'strategy': 'median'}. Best is trial 1 with value: 0.3604004952420291.
running
[I 2024-11-21 21:18:36,158] Trial 28 finished with value: 0.3604004952420291 and parameters: {'model_name': 'SimpleImputer', 'strategy': 'mean'}. Best is trial 1 with value: 0.3604004952420291.
[I 2024-11-21 21:18:36,252] Trial 27 finished with value: 0.3604004952420291 and parameters: {'model_name': 'SimpleImputer', 'strategy': 'mean'}. Best is trial 1 with value: 0.3604004952420291.
running
running
[I 2024-11-21 21:18:36,391] Trial 25 finished with value: 0.5960220960369478 and parameters: {'model_name': 'SimpleImputer', 'strategy': 'most_frequent'}. Best is trial 1 with value: 0.3604004952420291.
running
[I 2024-11-21 21:18:36,521] Trial 18 finished with value: 0.5960220960369478 and parameters: {'model_name': 'SimpleImputer', 'strategy': 'most_frequent'}. Best is trial 1 with value: 0.3604004952420291.
running
[I 2024-11-21 21:18:36,679] Trial 26 finished with value: 0.3672367151158975 and parameters: {'model_name': 'SimpleImputer', 'strategy': 'median'}. Best is trial 1 with value: 0.3604004952420291.
running
[I 2024-11-21 21:18:36,798] Trial 29 finished with value: 0.3604004952420291 and parameters: {'model_name': 'SimpleImputer', 'strategy': 'mean'}. Best is trial 1 with value: 0.3604004952420291.
[I 2024-11-21 21:18:36,889] Trial 30 finished with value: 0.3604004952420291 and parameters: {'model_name': 'SimpleImputer', 'strategy': 'mean'}. Best is trial 1 with value: 0.3604004952420291.
running
running
[I 2024-11-21 21:18:37,044] Trial 23 finished with value: 0.5960220960369478 and parameters: {'model_name': 'SimpleImputer', 'strategy': 'most_frequent'}. Best is trial 1 with value: 0.3604004952420291.
running
[I 2024-11-21 21:18:37,157] Trial 24 finished with value: 0.5960220960369478 and parameters: {'model_name': 'SimpleImputer', 'strategy': 'most_frequent'}. Best is trial 1 with value: 0.3604004952420291.
running
[I 2024-11-21 21:18:37,302] Trial 21 finished with value: 0.5960220960369478 and parameters: {'model_name': 'SimpleImputer', 'strategy': 'most_frequent'}. Best is trial 1 with value: 0.3604004952420291.
running
[I 2024-11-21 21:18:37,430] Trial 31 finished with value: 0.3672367151158975 and parameters: {'model_name': 'SimpleImputer', 'strategy': 'median'}. Best is trial 1 with value: 0.3604004952420291.
running
[I 2024-11-21 21:18:37,589] Trial 32 finished with value: 0.3672367151158975 and parameters: {'model_name': 'SimpleImputer', 'strategy': 'median'}. Best is trial 1 with value: 0.3604004952420291.
running
[I 2024-11-21 21:18:37,755] Trial 39 finished with value: 0.3604004952420291 and parameters: {'model_name': 'SimpleImputer', 'strategy': 'mean'}. Best is trial 1 with value: 0.3604004952420291.
[I 2024-11-21 21:18:37,849] Trial 34 finished with value: 0.3672367151158975 and parameters: {'model_name': 'SimpleImputer', 'strategy': 'median'}. Best is trial 1 with value: 0.3604004952420291.
running
running
[I 2024-11-21 21:18:37,962] Trial 38 finished with value: 0.3604004952420291 and parameters: {'model_name': 'SimpleImputer', 'strategy': 'mean'}. Best is trial 1 with value: 0.3604004952420291.
[I 2024-11-21 21:18:38,060] Trial 36 finished with value: 0.3604004952420291 and parameters: {'model_name': 'SimpleImputer', 'strategy': 'mean'}. Best is trial 1 with value: 0.3604004952420291.
running
running
[I 2024-11-21 21:18:38,171] Trial 37 finished with value: 0.3604004952420291 and parameters: {'model_name': 'SimpleImputer', 'strategy': 'mean'}. Best is trial 1 with value: 0.3604004952420291.
running
[I 2024-11-21 21:18:38,277] Trial 40 finished with value: 0.3604004952420291 and parameters: {'model_name': 'SimpleImputer', 'strategy': 'mean'}. Best is trial 1 with value: 0.3604004952420291.
[I 2024-11-21 21:18:38,375] Trial 33 finished with value: 0.3672367151158975 and parameters: {'model_name': 'SimpleImputer', 'strategy': 'median'}. Best is trial 1 with value: 0.3604004952420291.
running
running
[I 2024-11-21 21:18:38,491] Trial 42 finished with value: 0.3604004952420291 and parameters: {'model_name': 'SimpleImputer', 'strategy': 'mean'}. Best is trial 1 with value: 0.3604004952420291.
[I 2024-11-21 21:18:38,589] Trial 35 finished with value: 0.3604004952420291 and parameters: {'model_name': 'SimpleImputer', 'strategy': 'mean'}. Best is trial 1 with value: 0.3604004952420291.
running
running
[I 2024-11-21 21:18:38,746] Trial 41 finished with value: 0.3604004952420291 and parameters: {'model_name': 'SimpleImputer', 'strategy': 'mean'}. Best is trial 1 with value: 0.3604004952420291.
running
[I 2024-11-21 21:18:38,855] Trial 43 finished with value: 0.3604004952420291 and parameters: {'model_name': 'SimpleImputer', 'strategy': 'mean'}. Best is trial 1 with value: 0.3604004952420291.
running
[I 2024-11-21 21:18:38,986] Trial 47 finished with value: 0.3604004952420291 and parameters: {'model_name': 'SimpleImputer', 'strategy': 'mean'}. Best is trial 1 with value: 0.3604004952420291.
running
[I 2024-11-21 21:18:39,127] Trial 44 finished with value: 0.3604004952420291 and parameters: {'model_name': 'SimpleImputer', 'strategy': 'mean'}. Best is trial 1 with value: 0.3604004952420291.
running
[I 2024-11-21 21:18:39,236] Trial 45 finished with value: 0.3604004952420291 and parameters: {'model_name': 'SimpleImputer', 'strategy': 'mean'}. Best is trial 1 with value: 0.3604004952420291.
[I 2024-11-21 21:18:39,327] Trial 46 finished with value: 0.3604004952420291 and parameters: {'model_name': 'SimpleImputer', 'strategy': 'mean'}. Best is trial 1 with value: 0.3604004952420291.
running
running
[I 2024-11-21 21:18:39,580] Trial 48 finished with value: 0.3604004952420291 and parameters: {'model_name': 'SimpleImputer', 'strategy': 'mean'}. Best is trial 1 with value: 0.3604004952420291.
running
[I 2024-11-21 21:18:39,697] Trial 55 finished with value: 0.3604004952420291 and parameters: {'model_name': 'SimpleImputer', 'strategy': 'mean'}. Best is trial 1 with value: 0.3604004952420291.
running
[I 2024-11-21 21:18:39,810] Trial 49 finished with value: 0.3604004952420291 and parameters: {'model_name': 'SimpleImputer', 'strategy': 'mean'}. Best is trial 1 with value: 0.3604004952420291.
running
[I 2024-11-21 21:18:39,918] Trial 52 finished with value: 0.3604004952420291 and parameters: {'model_name': 'SimpleImputer', 'strategy': 'mean'}. Best is trial 1 with value: 0.3604004952420291.
running
[I 2024-11-21 21:18:40,073] Trial 53 finished with value: 0.3604004952420291 and parameters: {'model_name': 'SimpleImputer', 'strategy': 'mean'}. Best is trial 1 with value: 0.3604004952420291.
running
[I 2024-11-21 21:18:40,179] Trial 58 finished with value: 0.3604004952420291 and parameters: {'model_name': 'SimpleImputer', 'strategy': 'mean'}. Best is trial 1 with value: 0.3604004952420291.
[I 2024-11-21 21:18:40,275] Trial 54 finished with value: 0.3604004952420291 and parameters: {'model_name': 'SimpleImputer', 'strategy': 'mean'}. Best is trial 1 with value: 0.3604004952420291.
running
running
[I 2024-11-21 21:18:40,395] Trial 50 finished with value: 0.3604004952420291 and parameters: {'model_name': 'SimpleImputer', 'strategy': 'mean'}. Best is trial 1 with value: 0.3604004952420291.
[I 2024-11-21 21:18:40,487] Trial 56 finished with value: 0.3604004952420291 and parameters: {'model_name': 'SimpleImputer', 'strategy': 'mean'}. Best is trial 1 with value: 0.3604004952420291.
running
running
[I 2024-11-21 21:18:40,592] Trial 63 finished with value: 0.6378569716386092 and parameters: {'model_name': 'SimpleImputer', 'strategy': 'constant'}. Best is trial 1 with value: 0.3604004952420291.
[I 2024-11-21 21:18:40,679] Trial 51 finished with value: 0.3604004952420291 and parameters: {'model_name': 'SimpleImputer', 'strategy': 'mean'}. Best is trial 1 with value: 0.3604004952420291.
running
running
[I 2024-11-21 21:18:40,792] Trial 57 finished with value: 0.3604004952420291 and parameters: {'model_name': 'SimpleImputer', 'strategy': 'mean'}. Best is trial 1 with value: 0.3604004952420291.
running
[I 2024-11-21 21:18:40,919] Trial 60 finished with value: 0.3604004952420291 and parameters: {'model_name': 'SimpleImputer', 'strategy': 'mean'}. Best is trial 1 with value: 0.3604004952420291.
[I 2024-11-21 21:18:41,018] Trial 61 finished with value: 0.6378569716386092 and parameters: {'model_name': 'SimpleImputer', 'strategy': 'constant'}. Best is trial 1 with value: 0.3604004952420291.
running
[I 2024-11-21 21:18:41,115] Trial 59 finished with value: 0.3604004952420291 and parameters: {'model_name': 'SimpleImputer', 'strategy': 'mean'}. Best is trial 1 with value: 0.3604004952420291.
running
running
[I 2024-11-21 21:18:41,221] Trial 62 finished with value: 0.6378569716386092 and parameters: {'model_name': 'SimpleImputer', 'strategy': 'constant'}. Best is trial 1 with value: 0.3604004952420291.
running
[I 2024-11-21 21:18:41,462] Trial 65 finished with value: 0.6378569716386092 and parameters: {'model_name': 'SimpleImputer', 'strategy': 'constant'}. Best is trial 1 with value: 0.3604004952420291.
running
[I 2024-11-21 21:18:41,632] Trial 64 finished with value: 0.6378569716386092 and parameters: {'model_name': 'SimpleImputer', 'strategy': 'constant'}. Best is trial 1 with value: 0.3604004952420291.
running
[I 2024-11-21 21:18:41,736] Trial 69 finished with value: 0.6378569716386092 and parameters: {'model_name': 'SimpleImputer', 'strategy': 'constant'}. Best is trial 1 with value: 0.3604004952420291.
running
[I 2024-11-21 21:18:41,839] Trial 68 finished with value: 0.6378569716386092 and parameters: {'model_name': 'SimpleImputer', 'strategy': 'constant'}. Best is trial 1 with value: 0.3604004952420291.
[I 2024-11-21 21:18:41,941] Trial 66 finished with value: 0.6378569716386092 and parameters: {'model_name': 'SimpleImputer', 'strategy': 'constant'}. Best is trial 1 with value: 0.3604004952420291.
[I 2024-11-21 21:18:42,026] Trial 67 finished with value: 0.6378569716386092 and parameters: {'model_name': 'SimpleImputer', 'strategy': 'constant'}. Best is trial 1 with value: 0.3604004952420291.
running
running
running
[I 2024-11-21 21:18:42,155] Trial 70 finished with value: 0.3604004952420291 and parameters: {'model_name': 'SimpleImputer', 'strategy': 'mean'}. Best is trial 1 with value: 0.3604004952420291.
[I 2024-11-21 21:18:42,249] Trial 72 finished with value: 0.6378569716386092 and parameters: {'model_name': 'SimpleImputer', 'strategy': 'constant'}. Best is trial 1 with value: 0.3604004952420291.
running
[I 2024-11-21 21:18:42,348] Trial 71 finished with value: 0.6378569716386092 and parameters: {'model_name': 'SimpleImputer', 'strategy': 'constant'}. Best is trial 1 with value: 0.3604004952420291.
running
running
[I 2024-11-21 21:18:42,349] Trial 76 finished with value: 0.6378569716386092 and parameters: {'model_name': 'SimpleImputer', 'strategy': 'constant'}. Best is trial 1 with value: 0.3604004952420291.
running
[I 2024-11-21 21:18:42,576] Trial 75 finished with value: 0.6378569716386092 and parameters: {'model_name': 'SimpleImputer', 'strategy': 'constant'}. Best is trial 1 with value: 0.3604004952420291.
running
[I 2024-11-21 21:18:42,692] Trial 73 finished with value: 0.6378569716386092 and parameters: {'model_name': 'SimpleImputer', 'strategy': 'constant'}. Best is trial 1 with value: 0.3604004952420291.
running
[I 2024-11-21 21:18:42,856] Trial 78 finished with value: 0.6378569716386092 and parameters: {'model_name': 'SimpleImputer', 'strategy': 'constant'}. Best is trial 1 with value: 0.3604004952420291.
[I 2024-11-21 21:18:42,949] Trial 77 finished with value: 0.6378569716386092 and parameters: {'model_name': 'SimpleImputer', 'strategy': 'constant'}. Best is trial 1 with value: 0.3604004952420291.
running
running
[I 2024-11-21 21:18:43,061] Trial 74 finished with value: 0.6378569716386092 and parameters: {'model_name': 'SimpleImputer', 'strategy': 'constant'}. Best is trial 1 with value: 0.3604004952420291.
running
[I 2024-11-21 21:18:43,561] Trial 79 finished with value: 0.5960220960369478 and parameters: {'model_name': 'SimpleImputer', 'strategy': 'most_frequent'}. Best is trial 1 with value: 0.3604004952420291.
running
[I 2024-11-21 21:18:43,664] Trial 81 finished with value: 0.3604004952420291 and parameters: {'model_name': 'SimpleImputer', 'strategy': 'mean'}. Best is trial 1 with value: 0.3604004952420291.
running
[I 2024-11-21 21:18:43,777] Trial 88 finished with value: 0.3604004952420291 and parameters: {'model_name': 'SimpleImputer', 'strategy': 'mean'}. Best is trial 1 with value: 0.3604004952420291.
running
[I 2024-11-21 21:18:43,942] Trial 89 finished with value: 0.3604004952420291 and parameters: {'model_name': 'SimpleImputer', 'strategy': 'mean'}. Best is trial 1 with value: 0.3604004952420291.
running
[I 2024-11-21 21:18:44,105] Trial 90 finished with value: 0.3604004952420291 and parameters: {'model_name': 'SimpleImputer', 'strategy': 'mean'}. Best is trial 1 with value: 0.3604004952420291.
running
[I 2024-11-21 21:18:44,214] Trial 80 finished with value: 0.5960220960369478 and parameters: {'model_name': 'SimpleImputer', 'strategy': 'most_frequent'}. Best is trial 1 with value: 0.3604004952420291.
running
[I 2024-11-21 21:18:44,422] Trial 83 finished with value: 0.5960220960369478 and parameters: {'model_name': 'SimpleImputer', 'strategy': 'most_frequent'}. Best is trial 1 with value: 0.3604004952420291.
running
[I 2024-11-21 21:18:44,526] Trial 85 finished with value: 0.5960220960369478 and parameters: {'model_name': 'SimpleImputer', 'strategy': 'most_frequent'}. Best is trial 1 with value: 0.3604004952420291.
running
[I 2024-11-21 21:18:44,671] Trial 91 finished with value: 0.5960220960369478 and parameters: {'model_name': 'SimpleImputer', 'strategy': 'most_frequent'}. Best is trial 1 with value: 0.3604004952420291.
[I 2024-11-21 21:18:44,785] Trial 82 finished with value: 0.5960220960369478 and parameters: {'model_name': 'SimpleImputer', 'strategy': 'most_frequent'}. Best is trial 1 with value: 0.3604004952420291.
running
running
[I 2024-11-21 21:18:44,886] Trial 86 finished with value: 0.5960220960369478 and parameters: {'model_name': 'SimpleImputer', 'strategy': 'most_frequent'}. Best is trial 1 with value: 0.3604004952420291.
[I 2024-11-21 21:18:44,968] Trial 92 finished with value: 0.5960220960369478 and parameters: {'model_name': 'SimpleImputer', 'strategy': 'most_frequent'}. Best is trial 1 with value: 0.3604004952420291.
running
running
[I 2024-11-21 21:18:45,189] Trial 95 finished with value: 0.3604004952420291 and parameters: {'model_name': 'SimpleImputer', 'strategy': 'mean'}. Best is trial 1 with value: 0.3604004952420291.
[I 2024-11-21 21:18:45,284] Trial 87 finished with value: 0.5960220960369478 and parameters: {'model_name': 'SimpleImputer', 'strategy': 'most_frequent'}. Best is trial 1 with value: 0.3604004952420291.
running
running
[I 2024-11-21 21:18:45,389] Trial 96 finished with value: 0.3604004952420291 and parameters: {'model_name': 'SimpleImputer', 'strategy': 'mean'}. Best is trial 1 with value: 0.3604004952420291.
running
[I 2024-11-21 21:18:45,501] Trial 93 finished with value: 0.5960220960369478 and parameters: {'model_name': 'SimpleImputer', 'strategy': 'most_frequent'}. Best is trial 1 with value: 0.3604004952420291.
running
[I 2024-11-21 21:18:45,596] Trial 94 finished with value: 0.5960220960369478 and parameters: {'model_name': 'SimpleImputer', 'strategy': 'most_frequent'}. Best is trial 1 with value: 0.3604004952420291.
running
[I 2024-11-21 21:18:45,690] Trial 84 finished with value: 0.5960220960369478 and parameters: {'model_name': 'SimpleImputer', 'strategy': 'most_frequent'}. Best is trial 1 with value: 0.3604004952420291.
running
[I 2024-11-21 21:18:45,796] Trial 98 finished with value: 0.3604004952420291 and parameters: {'model_name': 'SimpleImputer', 'strategy': 'mean'}. Best is trial 1 with value: 0.3604004952420291.
running
[I 2024-11-21 21:18:45,999] Trial 99 finished with value: 0.3604004952420291 and parameters: {'model_name': 'SimpleImputer', 'strategy': 'mean'}. Best is trial 1 with value: 0.3604004952420291.
running
[I 2024-11-21 21:18:46,107] Trial 97 finished with value: 0.3604004952420291 and parameters: {'model_name': 'SimpleImputer', 'strategy': 'mean'}. Best is trial 1 with value: 0.3604004952420291.
running
[I 2024-11-21 21:18:46,258] Trial 100 finished with value: 0.3604004952420291 and parameters: {'model_name': 'SimpleImputer', 'strategy': 'mean'}. Best is trial 1 with value: 0.3604004952420291.
running
[I 2024-11-21 21:18:46,410] Trial 102 finished with value: 0.3604004952420291 and parameters: {'model_name': 'SimpleImputer', 'strategy': 'mean'}. Best is trial 1 with value: 0.3604004952420291.
running
[I 2024-11-21 21:18:46,519] Trial 104 finished with value: 0.3604004952420291 and parameters: {'model_name': 'SimpleImputer', 'strategy': 'mean'}. Best is trial 1 with value: 0.3604004952420291.
running
