[I 2024-11-13 07:19:34,415] Trial 94 finished with value: 0.30344498033616196 and parameters: {'model_name': 'KNNImputer', 'n_neighbors': 78, 'weights': 'uniform'}. Best is trial 73 with value: 0.30271037755929664.
running
[I 2024-11-13 07:19:42,515] Trial 95 finished with value: 0.30966898906789975 and parameters: {'model_name': 'KNNImputer', 'n_neighbors': 2674, 'weights': 'uniform'}. Best is trial 73 with value: 0.30271037755929664.
running
[I 2024-11-13 07:19:49,000] Trial 96 finished with value: 0.31383001488267254 and parameters: {'model_name': 'KNNImputer', 'n_neighbors': 19, 'weights': 'uniform'}. Best is trial 73 with value: 0.30271037755929664.
running
[I 2024-11-13 07:19:57,053] Trial 97 finished with value: 0.3084181462082989 and parameters: {'model_name': 'KNNImputer', 'n_neighbors': 1753, 'weights': 'uniform'}. Best is trial 73 with value: 0.30271037755929664.
running
[I 2024-11-13 07:20:03,883] Trial 98 finished with value: 0.3029525266448009 and parameters: {'model_name': 'KNNImputer', 'n_neighbors': 156, 'weights': 'uniform'}. Best is trial 73 with value: 0.30271037755929664.
running
[I 2024-11-13 07:20:11,950] Trial 99 finished with value: 0.3092416889873347 and parameters: {'model_name': 'KNNImputer', 'n_neighbors': 2345, 'weights': 'uniform'}. Best is trial 73 with value: 0.30271037755929664.
running
[I 2024-11-13 07:20:19,753] Trial 100 finished with value: 0.3083325489173873 and parameters: {'model_name': 'KNNImputer', 'n_neighbors': 1698, 'weights': 'uniform'}. Best is trial 73 with value: 0.30271037755929664.
running
[I 2024-11-13 07:20:26,560] Trial 101 finished with value: 0.30312933020259825 and parameters: {'model_name': 'KNNImputer', 'n_neighbors': 176, 'weights': 'uniform'}. Best is trial 73 with value: 0.30271037755929664.
running
[I 2024-11-13 07:20:32,834] Trial 102 finished with value: 0.32989570284889297 and parameters: {'model_name': 'KNNImputer', 'n_neighbors': 8, 'weights': 'uniform'}. Best is trial 73 with value: 0.30271037755929664.
running
[I 2024-11-13 07:29:35,754] Trial 103 finished with value: 0.38140371895089237 and parameters: {'model_name': 'VAE', 'batch_size': 1, 'iterations': 231, 'learning_rate': 0.002461507723041645, 'p_miss': 0.09501123257492936}. Best is trial 73 with value: 0.30271037755929664.
running
[I 2024-11-13 07:29:43,494] Trial 104 finished with value: 0.3086691204996962 and parameters: {'model_name': 'KNNImputer', 'n_neighbors': 1910, 'weights': 'uniform'}. Best is trial 73 with value: 0.30271037755929664.
running
[I 2024-11-13 07:29:50,095] Trial 83 finished with value: 0.38049730154861283 and parameters: {'model_name': 'VAE', 'batch_size': 1, 'iterations': 355, 'learning_rate': 0.002308799936051397, 'p_miss': 0.09620319048410657}. Best is trial 73 with value: 0.30271037755929664.
running
[I 2024-11-13 07:29:51,530] Trial 105 finished with value: 0.3108476533823888 and parameters: {'model_name': 'KNNImputer', 'n_neighbors': 3688, 'weights': 'uniform'}. Best is trial 73 with value: 0.30271037755929664.
running
[I 2024-11-13 07:29:57,203] Trial 106 finished with value: 0.32989570284889297 and parameters: {'model_name': 'KNNImputer', 'n_neighbors': 8, 'weights': 'uniform'}. Best is trial 73 with value: 0.30271037755929664.
running
[I 2024-11-13 07:29:58,899] Trial 107 finished with value: 0.3029525266448009 and parameters: {'model_name': 'KNNImputer', 'n_neighbors': 156, 'weights': 'uniform'}. Best is trial 73 with value: 0.30271037755929664.
running
[I 2024-11-13 07:30:05,625] Trial 108 finished with value: 0.30785740089302954 and parameters: {'model_name': 'KNNImputer', 'n_neighbors': 1391, 'weights': 'uniform'}. Best is trial 73 with value: 0.30271037755929664.
running
[I 2024-11-13 07:30:07,214] Trial 109 finished with value: 0.3081387463476769 and parameters: {'model_name': 'KNNImputer', 'n_neighbors': 1575, 'weights': 'uniform'}. Best is trial 73 with value: 0.30271037755929664.
running
[I 2024-11-13 07:30:14,328] Trial 110 finished with value: 0.3079402355947954 and parameters: {'model_name': 'KNNImputer', 'n_neighbors': 1438, 'weights': 'uniform'}. Best is trial 73 with value: 0.30271037755929664.
running
[I 2024-11-13 07:30:16,446] Trial 111 finished with value: 0.3560251325742661 and parameters: {'model_name': 'KNNImputer', 'n_neighbors': 1371, 'weights': 'distance'}. Best is trial 73 with value: 0.30271037755929664.
running
[I 2024-11-13 07:30:16,915] Trial 113 finished with value: 0.3253480359321758 and parameters: {'model_name': 'SimpleImputer', 'strategy': 'median'}. Best is trial 73 with value: 0.30271037755929664.
running
[I 2024-11-13 07:30:19,184] Trial 44 finished with value: 0.616517366818818 and parameters: {'model_name': 'GAIN', 'batch_size': 920, 'hint_rate': 0.7891082315261857, 'alpha': 61, 'iterations': 4621, 'learning_rate': 0.00017895087781340626, 'p_miss': 0.2089824359282261}. Best is trial 73 with value: 0.30271037755929664.
running
[I 2024-11-13 07:30:23,890] Trial 112 finished with value: 0.3560209316690268 and parameters: {'model_name': 'KNNImputer', 'n_neighbors': 1261, 'weights': 'distance'}. Best is trial 73 with value: 0.30271037755929664.
running
[I 2024-11-13 07:30:27,378] Trial 114 finished with value: 0.31910076299251405 and parameters: {'model_name': 'KNNImputer', 'n_neighbors': 14341, 'weights': 'uniform'}. Best is trial 73 with value: 0.30271037755929664.
running
[I 2024-11-13 07:30:29,099] Trial 115 finished with value: 0.31435305987227813 and parameters: {'model_name': 'KNNImputer', 'n_neighbors': 7817, 'weights': 'uniform'}. Best is trial 73 with value: 0.30271037755929664.
running
[I 2024-11-13 07:30:31,778] Trial 116 finished with value: 0.3028829408759386 and parameters: {'model_name': 'KNNImputer', 'n_neighbors': 141, 'weights': 'uniform'}. Best is trial 73 with value: 0.30271037755929664.
running
[I 2024-11-13 07:30:35,419] Trial 117 finished with value: 0.30503094089928773 and parameters: {'model_name': 'KNNImputer', 'n_neighbors': 53, 'weights': 'uniform'}. Best is trial 73 with value: 0.30271037755929664.
running
[I 2024-11-13 07:30:37,507] Trial 118 finished with value: 0.305022878602398 and parameters: {'model_name': 'KNNImputer', 'n_neighbors': 54, 'weights': 'uniform'}. Best is trial 73 with value: 0.30271037755929664.
running
[I 2024-11-13 07:30:39,663] Trial 119 finished with value: 0.31528590030588155 and parameters: {'model_name': 'KNNImputer', 'n_neighbors': 17, 'weights': 'uniform'}. Best is trial 73 with value: 0.30271037755929664.
running
[I 2024-11-13 07:30:44,366] Trial 120 finished with value: 0.30719217668557924 and parameters: {'model_name': 'KNNImputer', 'n_neighbors': 1059, 'weights': 'uniform'}. Best is trial 73 with value: 0.30271037755929664.
running
[I 2024-11-13 07:30:46,276] Trial 121 finished with value: 0.3070498692628219 and parameters: {'model_name': 'KNNImputer', 'n_neighbors': 1012, 'weights': 'uniform'}. Best is trial 73 with value: 0.30271037755929664.
running
[I 2024-11-13 07:30:49,193] Trial 122 finished with value: 0.31071850688677954 and parameters: {'model_name': 'KNNImputer', 'n_neighbors': 3547, 'weights': 'uniform'}. Best is trial 73 with value: 0.30271037755929664.
running
[I 2024-11-13 07:30:53,967] Trial 123 finished with value: 0.3102346655719136 and parameters: {'model_name': 'KNNImputer', 'n_neighbors': 3103, 'weights': 'uniform'}. Best is trial 73 with value: 0.30271037755929664.
running
[I 2024-11-13 07:30:55,723] Trial 124 finished with value: 0.3102156593590394 and parameters: {'model_name': 'KNNImputer', 'n_neighbors': 3091, 'weights': 'uniform'}. Best is trial 73 with value: 0.30271037755929664.
running
[I 2024-11-13 07:30:57,830] Trial 125 finished with value: 0.3072926475100447 and parameters: {'model_name': 'KNNImputer', 'n_neighbors': 1109, 'weights': 'uniform'}. Best is trial 73 with value: 0.30271037755929664.
running
[I 2024-11-13 07:31:02,472] Trial 126 finished with value: 0.30690104510406774 and parameters: {'model_name': 'KNNImputer', 'n_neighbors': 962, 'weights': 'uniform'}. Best is trial 73 with value: 0.30271037755929664.
running
[I 2024-11-13 07:31:04,495] Trial 127 finished with value: 0.3068440245826906 and parameters: {'model_name': 'KNNImputer', 'n_neighbors': 942, 'weights': 'uniform'}. Best is trial 73 with value: 0.30271037755929664.
running
[I 2024-11-13 07:31:06,141] Trial 128 finished with value: 0.30673041800931256 and parameters: {'model_name': 'KNNImputer', 'n_neighbors': 858, 'weights': 'uniform'}. Best is trial 73 with value: 0.30271037755929664.
running
[I 2024-11-13 07:31:10,426] Trial 129 finished with value: 0.30654346027020635 and parameters: {'model_name': 'KNNImputer', 'n_neighbors': 801, 'weights': 'uniform'}. Best is trial 73 with value: 0.30271037755929664.
[I 2024-11-13 07:31:10,564] Trial 130 finished with value: 0.6025697713162138 and parameters: {'model_name': 'GAIN', 'batch_size': 6, 'hint_rate': 0.5151731410988268, 'alpha': 3, 'iterations': 4, 'learning_rate': 0.08689565151316178, 'p_miss': 0.2482514175158854}. Best is trial 73 with value: 0.30271037755929664.
running
running
[I 2024-11-13 07:31:10,931] Trial 132 finished with value: 0.6108937070107694 and parameters: {'model_name': 'SimpleImputer', 'strategy': 'constant'}. Best is trial 73 with value: 0.30271037755929664.
running
[I 2024-11-13 07:31:11,167] Trial 133 finished with value: 0.6108937070107694 and parameters: {'model_name': 'SimpleImputer', 'strategy': 'constant'}. Best is trial 73 with value: 0.30271037755929664.
running
[I 2024-11-13 07:31:12,826] Trial 131 finished with value: 0.6155441491310856 and parameters: {'model_name': 'GAIN', 'batch_size': 70, 'hint_rate': 0.5275863563220125, 'alpha': 0, 'iterations': 5, 'learning_rate': 0.09728429138059388, 'p_miss': 0.2576961089851763}. Best is trial 73 with value: 0.30271037755929664.
running
[I 2024-11-13 07:31:21,039] Trial 136 finished with value: 0.3055942876228851 and parameters: {'model_name': 'KNNImputer', 'n_neighbors': 555, 'weights': 'uniform'}. Best is trial 73 with value: 0.30271037755929664.
running
[I 2024-11-13 07:31:21,040] Trial 134 finished with value: 0.3560418313388592 and parameters: {'model_name': 'KNNImputer', 'n_neighbors': 1871, 'weights': 'distance'}. Best is trial 73 with value: 0.30271037755929664.
running
[I 2024-11-13 07:31:21,448] Trial 135 finished with value: 0.3560424977816178 and parameters: {'model_name': 'KNNImputer', 'n_neighbors': 1896, 'weights': 'distance'}. Best is trial 73 with value: 0.30271037755929664.
running
[I 2024-11-13 07:31:28,731] Trial 138 finished with value: 0.31095566711490324 and parameters: {'model_name': 'KNNImputer', 'n_neighbors': 25, 'weights': 'uniform'}. Best is trial 73 with value: 0.30271037755929664.
running
[I 2024-11-13 07:31:29,651] Trial 139 finished with value: 0.3053444966731231 and parameters: {'model_name': 'KNNImputer', 'n_neighbors': 507, 'weights': 'uniform'}. Best is trial 73 with value: 0.30271037755929664.
running
[I 2024-11-13 07:31:29,806] Trial 137 finished with value: 0.30559154604432515 and parameters: {'model_name': 'KNNImputer', 'n_neighbors': 568, 'weights': 'uniform'}. Best is trial 73 with value: 0.30271037755929664.
running
[I 2024-11-13 07:33:22,095] Trial 142 finished with value: 0.32378092155726945 and parameters: {'model_name': 'VAE', 'batch_size': 44, 'iterations': 36, 'learning_rate': 0.015858841471252424, 'p_miss': 0.0612382455521642}. Best is trial 73 with value: 0.30271037755929664.
running
[I 2024-11-13 07:33:24,715] Trial 141 finished with value: 0.34222746698711515 and parameters: {'model_name': 'VAE', 'batch_size': 3, 'iterations': 45, 'learning_rate': 0.020389591947807775, 'p_miss': 0.06512578475309573}. Best is trial 73 with value: 0.30271037755929664.
running
[I 2024-11-13 07:33:30,443] Trial 143 finished with value: 0.3090571247032182 and parameters: {'model_name': 'KNNImputer', 'n_neighbors': 2198, 'weights': 'uniform'}. Best is trial 73 with value: 0.30271037755929664.
running
[I 2024-11-13 07:33:33,240] Trial 144 finished with value: 0.30907849195955345 and parameters: {'model_name': 'KNNImputer', 'n_neighbors': 2211, 'weights': 'uniform'}. Best is trial 73 with value: 0.30271037755929664.
running
[I 2024-11-13 07:33:39,246] Trial 140 finished with value: 0.33848202972264835 and parameters: {'model_name': 'VAE', 'batch_size': 3, 'iterations': 60, 'learning_rate': 0.023348007242796988, 'p_miss': 0.0690702235076638}. Best is trial 73 with value: 0.30271037755929664.
running
[I 2024-11-13 07:33:40,984] Trial 145 finished with value: 0.3178918676255641 and parameters: {'model_name': 'KNNImputer', 'n_neighbors': 12666, 'weights': 'uniform'}. Best is trial 73 with value: 0.30271037755929664.
running
[I 2024-11-13 07:33:41,672] Trial 146 finished with value: 0.306038323074585 and parameters: {'model_name': 'KNNImputer', 'n_neighbors': 670, 'weights': 'uniform'}. Best is trial 73 with value: 0.30271037755929664.
running
[I 2024-11-13 07:33:47,109] Trial 147 finished with value: 0.3114913740444665 and parameters: {'model_name': 'KNNImputer', 'n_neighbors': 24, 'weights': 'uniform'}. Best is trial 73 with value: 0.30271037755929664.
running
[I 2024-11-13 07:33:49,574] Trial 148 finished with value: 0.3056559635275377 and parameters: {'model_name': 'KNNImputer', 'n_neighbors': 579, 'weights': 'uniform'}. Best is trial 73 with value: 0.30271037755929664.
running
[I 2024-11-13 07:33:49,776] Trial 149 finished with value: 0.3042757958125245 and parameters: {'model_name': 'KNNImputer', 'n_neighbors': 68, 'weights': 'uniform'}. Best is trial 73 with value: 0.30271037755929664.
running
[I 2024-11-13 07:33:55,812] Trial 150 finished with value: 0.30618628952343085 and parameters: {'model_name': 'KNNImputer', 'n_neighbors': 703, 'weights': 'uniform'}. Best is trial 73 with value: 0.30271037755929664.
running
[I 2024-11-13 07:33:56,694] Trial 151 finished with value: 0.3662503197895816 and parameters: {'model_name': 'KNNImputer', 'n_neighbors': 3, 'weights': 'uniform'}. Best is trial 73 with value: 0.30271037755929664.
running
[I 2024-11-13 07:33:58,797] Trial 152 finished with value: 0.30777837195138025 and parameters: {'model_name': 'KNNImputer', 'n_neighbors': 1359, 'weights': 'uniform'}. Best is trial 73 with value: 0.30271037755929664.
running
[I 2024-11-13 07:34:04,662] Trial 153 finished with value: 0.3079343152788505 and parameters: {'model_name': 'KNNImputer', 'n_neighbors': 1436, 'weights': 'uniform'}. Best is trial 73 with value: 0.30271037755929664.
running
[I 2024-11-13 07:34:06,063] Trial 154 finished with value: 0.3082054321898161 and parameters: {'model_name': 'KNNImputer', 'n_neighbors': 1617, 'weights': 'uniform'}. Best is trial 73 with value: 0.30271037755929664.
running
[I 2024-11-13 07:34:07,757] Trial 155 finished with value: 0.3081594569133819 and parameters: {'model_name': 'KNNImputer', 'n_neighbors': 1589, 'weights': 'uniform'}. Best is trial 73 with value: 0.30271037755929664.
running
[I 2024-11-13 07:34:13,230] Trial 156 finished with value: 0.30587862122046044 and parameters: {'model_name': 'KNNImputer', 'n_neighbors': 626, 'weights': 'uniform'}. Best is trial 73 with value: 0.30271037755929664.
running
[I 2024-11-13 07:34:14,683] Trial 157 finished with value: 0.30536379482393833 and parameters: {'model_name': 'KNNImputer', 'n_neighbors': 510, 'weights': 'uniform'}. Best is trial 73 with value: 0.30271037755929664.
running
[I 2024-11-13 07:34:16,091] Trial 158 finished with value: 0.30565133316342374 and parameters: {'model_name': 'KNNImputer', 'n_neighbors': 576, 'weights': 'uniform'}. Best is trial 73 with value: 0.30271037755929664.
running
[I 2024-11-13 07:34:22,456] Trial 160 finished with value: 0.3537471807763316 and parameters: {'model_name': 'KNNImputer', 'n_neighbors': 4, 'weights': 'uniform'}. Best is trial 73 with value: 0.30271037755929664.
running
[I 2024-11-13 07:34:22,976] Trial 159 finished with value: 0.3213671969548344 and parameters: {'model_name': 'KNNImputer', 'n_neighbors': 20481, 'weights': 'uniform'}. Best is trial 73 with value: 0.30271037755929664.
running
[I 2024-11-13 07:34:26,074] Trial 161 finished with value: 0.31308254764606497 and parameters: {'model_name': 'KNNImputer', 'n_neighbors': 6221, 'weights': 'uniform'}. Best is trial 73 with value: 0.30271037755929664.
running
[I 2024-11-13 07:34:31,375] Trial 163 finished with value: 0.3072778396186061 and parameters: {'model_name': 'KNNImputer', 'n_neighbors': 1093, 'weights': 'uniform'}. Best is trial 73 with value: 0.30271037755929664.
running
[I 2024-11-13 07:34:32,732] Trial 162 finished with value: 0.3146554668236242 and parameters: {'model_name': 'KNNImputer', 'n_neighbors': 8170, 'weights': 'uniform'}. Best is trial 73 with value: 0.30271037755929664.
running
[I 2024-11-13 07:34:34,684] Trial 164 finished with value: 0.3071311678514455 and parameters: {'model_name': 'KNNImputer', 'n_neighbors': 1042, 'weights': 'uniform'}. Best is trial 73 with value: 0.30271037755929664.
running
[I 2024-11-13 07:34:39,820] Trial 165 finished with value: 0.30499768499742186 and parameters: {'model_name': 'KNNImputer', 'n_neighbors': 440, 'weights': 'uniform'}. Best is trial 73 with value: 0.30271037755929664.
running
[I 2024-11-13 07:34:41,313] Trial 166 finished with value: 0.304792523068941 and parameters: {'model_name': 'KNNImputer', 'n_neighbors': 416, 'weights': 'uniform'}. Best is trial 73 with value: 0.30271037755929664.
running
[I 2024-11-13 07:34:43,171] Trial 167 finished with value: 0.30467807006526604 and parameters: {'model_name': 'KNNImputer', 'n_neighbors': 381, 'weights': 'uniform'}. Best is trial 73 with value: 0.30271037755929664.
running
[I 2024-11-13 07:34:47,594] Trial 168 finished with value: 0.30398113510414254 and parameters: {'model_name': 'KNNImputer', 'n_neighbors': 289, 'weights': 'uniform'}. Best is trial 73 with value: 0.30271037755929664.
running
[I 2024-11-13 07:34:48,829] Trial 169 finished with value: 0.30609876515641243 and parameters: {'model_name': 'KNNImputer', 'n_neighbors': 42, 'weights': 'uniform'}. Best is trial 73 with value: 0.30271037755929664.
running
[I 2024-11-13 07:34:51,622] Trial 170 finished with value: 0.30740010899486264 and parameters: {'model_name': 'KNNImputer', 'n_neighbors': 1174, 'weights': 'uniform'}. Best is trial 73 with value: 0.30271037755929664.
running
[I 2024-11-13 07:34:56,056] Trial 171 finished with value: 0.30734744527672053 and parameters: {'model_name': 'KNNImputer', 'n_neighbors': 1148, 'weights': 'uniform'}. Best is trial 73 with value: 0.30271037755929664.
running
[I 2024-11-13 07:34:58,140] Trial 172 finished with value: 0.3073081529291332 and parameters: {'model_name': 'KNNImputer', 'n_neighbors': 1123, 'weights': 'uniform'}. Best is trial 73 with value: 0.30271037755929664.
running
[I 2024-11-13 07:35:00,291] Trial 173 finished with value: 0.30936755911265357 and parameters: {'model_name': 'KNNImputer', 'n_neighbors': 2449, 'weights': 'uniform'}. Best is trial 73 with value: 0.30271037755929664.
running
[I 2024-11-13 07:35:05,833] Trial 174 finished with value: 0.3560574765008121 and parameters: {'model_name': 'KNNImputer', 'n_neighbors': 2482, 'weights': 'distance'}. Best is trial 73 with value: 0.30271037755929664.
running
[I 2024-11-13 07:35:06,552] Trial 176 finished with value: 0.45965332099707573 and parameters: {'model_name': 'KNNImputer', 'n_neighbors': 1, 'weights': 'distance'}. Best is trial 73 with value: 0.30271037755929664.
running
[I 2024-11-13 07:35:13,396] Trial 177 finished with value: 0.31445039579647416 and parameters: {'model_name': 'KNNImputer', 'n_neighbors': 18, 'weights': 'uniform'}. Best is trial 73 with value: 0.30271037755929664.
running
[I 2024-11-13 07:35:14,570] Trial 178 finished with value: 0.3057253586541514 and parameters: {'model_name': 'KNNImputer', 'n_neighbors': 588, 'weights': 'uniform'}. Best is trial 73 with value: 0.30271037755929664.
running
[I 2024-11-13 07:35:22,488] Trial 180 finished with value: 0.3087689173829307 and parameters: {'model_name': 'KNNImputer', 'n_neighbors': 1987, 'weights': 'uniform'}. Best is trial 73 with value: 0.30271037755929664.
running
[I 2024-11-13 07:35:23,103] Trial 181 finished with value: 0.3253480359321758 and parameters: {'model_name': 'SimpleImputer', 'strategy': 'median'}. Best is trial 73 with value: 0.30271037755929664.
running
[I 2024-11-13 07:38:30,680] Trial 182 finished with value: 0.6110604316218956 and parameters: {'model_name': 'GAIN', 'batch_size': 138, 'hint_rate': 0.012066468645407669, 'alpha': 31, 'iterations': 150, 'learning_rate': 0.007352931879059797, 'p_miss': 0.11566997863364765}. Best is trial 73 with value: 0.30271037755929664.
running
[I 2024-11-13 07:38:37,999] Trial 183 finished with value: 0.3064860378229256 and parameters: {'model_name': 'KNNImputer', 'n_neighbors': 792, 'weights': 'uniform'}. Best is trial 73 with value: 0.30271037755929664.
running
[I 2024-11-13 07:38:47,299] Trial 184 finished with value: 0.31617888963935387 and parameters: {'model_name': 'KNNImputer', 'n_neighbors': 10273, 'weights': 'uniform'}. Best is trial 73 with value: 0.30271037755929664.
running
[I 2024-11-13 07:38:53,073] Trial 64 finished with value: inf and parameters: {'model_name': 'GAIN', 'batch_size': 1, 'hint_rate': 0.8393348014058856, 'alpha': 3, 'iterations': 9009, 'learning_rate': 0.0001260958653270712, 'p_miss': 0.0816607715558514}. Best is trial 73 with value: 0.30271037755929664.
running
[I 2024-11-13 07:38:55,163] Trial 185 finished with value: 0.3080105708744632 and parameters: {'model_name': 'KNNImputer', 'n_neighbors': 1501, 'weights': 'uniform'}. Best is trial 73 with value: 0.30271037755929664.
running
[I 2024-11-13 07:39:00,763] Trial 186 finished with value: 0.3048076382986881 and parameters: {'model_name': 'KNNImputer', 'n_neighbors': 417, 'weights': 'uniform'}. Best is trial 73 with value: 0.30271037755929664.
running
