[I 2024-10-06 15:02:18,767] Trial 77 finished with value: 0.1395783634574647 and parameters: {'model_name': 'IterativeImputer', 'estimator': 'RFR', 'initial_strategy': 'mean', 'n_nearest_features': 7, 'imputation_order': 'roman'}. Best is trial 40 with value: 0.13221267284094734.
running
[I 2024-10-06 15:03:52,119] Trial 78 finished with value: 0.14015359414903522 and parameters: {'model_name': 'IterativeImputer', 'estimator': 'RFR', 'initial_strategy': 'mean', 'n_nearest_features': 7, 'imputation_order': 'roman'}. Best is trial 40 with value: 0.13221267284094734.
running
[I 2024-10-06 15:10:27,314] Trial 76 finished with value: 0.13224604366396758 and parameters: {'model_name': 'IterativeImputer', 'estimator': 'RFR', 'initial_strategy': 'mean', 'n_nearest_features': 8, 'imputation_order': 'roman'}. Best is trial 40 with value: 0.13221267284094734.
running
[I 2024-10-06 15:18:21,705] Trial 79 finished with value: 0.1347448424369952 and parameters: {'model_name': 'IterativeImputer', 'estimator': 'RFR', 'initial_strategy': 'median', 'n_nearest_features': 7, 'imputation_order': 'roman'}. Best is trial 40 with value: 0.13221267284094734.
running
[I 2024-10-06 15:20:08,946] Trial 80 finished with value: 0.13429690555841345 and parameters: {'model_name': 'IterativeImputer', 'estimator': 'RFR', 'initial_strategy': 'median', 'n_nearest_features': 7, 'imputation_order': 'roman'}. Best is trial 40 with value: 0.13221267284094734.
running
[I 2024-10-06 15:32:30,414] Trial 67 finished with value: 0.18134167039516574 and parameters: {'model_name': 'VAE', 'batch_size': 903, 'iterations': 7523, 'learning_rate': 0.0007723938559451624, 'p_miss': 0.2949004476395677}. Best is trial 40 with value: 0.13221267284094734.
running
[I 2024-10-06 15:37:54,379] Trial 63 finished with value: 0.18131709678303182 and parameters: {'model_name': 'VAE', 'batch_size': 954, 'iterations': 9145, 'learning_rate': 0.0006219319957597123, 'p_miss': 0.2988135290885464}. Best is trial 40 with value: 0.13221267284094734.
running
[I 2024-10-06 15:39:20,017] Trial 81 finished with value: 0.13200873473124405 and parameters: {'model_name': 'IterativeImputer', 'estimator': 'RFR', 'initial_strategy': 'median', 'n_nearest_features': 8, 'imputation_order': 'roman'}. Best is trial 81 with value: 0.13200873473124405.
running
[I 2024-10-06 15:47:57,868] Trial 64 finished with value: 0.18125081339309013 and parameters: {'model_name': 'VAE', 'batch_size': 875, 'iterations': 9654, 'learning_rate': 0.0005772242587440443, 'p_miss': 0.01191120959673847}. Best is trial 81 with value: 0.13200873473124405.
running
[I 2024-10-06 15:48:09,084] Trial 68 finished with value: 0.18141488475599757 and parameters: {'model_name': 'VAE', 'batch_size': 939, 'iterations': 6558, 'learning_rate': 0.014651222773522262, 'p_miss': 0.2953630268879065}. Best is trial 81 with value: 0.13200873473124405.
running
[I 2024-10-06 15:57:39,445] Trial 82 finished with value: 0.13218438865532506 and parameters: {'model_name': 'IterativeImputer', 'estimator': 'RFR', 'initial_strategy': 'median', 'n_nearest_features': 8, 'imputation_order': 'roman'}. Best is trial 81 with value: 0.13200873473124405.
running
[I 2024-10-06 16:16:49,681] Trial 83 finished with value: 0.13225365846182155 and parameters: {'model_name': 'IterativeImputer', 'estimator': 'RFR', 'initial_strategy': 'median', 'n_nearest_features': 8, 'imputation_order': 'roman'}. Best is trial 81 with value: 0.13200873473124405.
running
[I 2024-10-06 16:21:55,222] Trial 84 finished with value: 0.131777543985339 and parameters: {'model_name': 'IterativeImputer', 'estimator': 'RFR', 'initial_strategy': 'median', 'n_nearest_features': 8, 'imputation_order': 'roman'}. Best is trial 84 with value: 0.131777543985339.
running
[I 2024-10-06 16:24:18,702] Trial 86 finished with value: 0.1326484805381457 and parameters: {'model_name': 'IterativeImputer', 'estimator': 'RFR', 'initial_strategy': 'median', 'n_nearest_features': 8, 'imputation_order': 'roman'}. Best is trial 84 with value: 0.131777543985339.
running
[I 2024-10-06 16:44:44,654] Trial 87 finished with value: 0.13236330668220755 and parameters: {'model_name': 'IterativeImputer', 'estimator': 'RFR', 'initial_strategy': 'median', 'n_nearest_features': 8, 'imputation_order': 'roman'}. Best is trial 84 with value: 0.131777543985339.
running
[I 2024-10-06 16:50:36,404] Trial 88 finished with value: 0.132020824209112 and parameters: {'model_name': 'IterativeImputer', 'estimator': 'RFR', 'initial_strategy': 'median', 'n_nearest_features': 8, 'imputation_order': 'roman'}. Best is trial 84 with value: 0.131777543985339.
running
[I 2024-10-06 16:51:02,505] Trial 104 finished with value: 0.15567285936111927 and parameters: {'model_name': 'KNNImputer', 'n_neighbors': 710, 'weights': 'distance'}. Best is trial 84 with value: 0.131777543985339.
running
[I 2024-10-06 16:54:32,948] Trial 89 finished with value: 0.13209395482029382 and parameters: {'model_name': 'IterativeImputer', 'estimator': 'RFR', 'initial_strategy': 'median', 'n_nearest_features': 8, 'imputation_order': 'roman'}. Best is trial 84 with value: 0.131777543985339.
running
[I 2024-10-06 16:56:04,536] Trial 90 finished with value: 0.13263377258365963 and parameters: {'model_name': 'IterativeImputer', 'estimator': 'RFR', 'initial_strategy': 'median', 'n_nearest_features': 8, 'imputation_order': 'roman'}. Best is trial 84 with value: 0.131777543985339.
running
[I 2024-10-06 17:01:16,440] Trial 91 finished with value: 0.13242636850936368 and parameters: {'model_name': 'IterativeImputer', 'estimator': 'RFR', 'initial_strategy': 'median', 'n_nearest_features': 8, 'imputation_order': 'descending'}. Best is trial 84 with value: 0.131777543985339.
running
[I 2024-10-06 17:08:06,463] Trial 92 finished with value: 0.13199449707002336 and parameters: {'model_name': 'IterativeImputer', 'estimator': 'RFR', 'initial_strategy': 'median', 'n_nearest_features': 8, 'imputation_order': 'descending'}. Best is trial 84 with value: 0.131777543985339.
running
[I 2024-10-06 17:09:29,662] Trial 93 finished with value: 0.1321854926638099 and parameters: {'model_name': 'IterativeImputer', 'estimator': 'RFR', 'initial_strategy': 'median', 'n_nearest_features': 8, 'imputation_order': 'descending'}. Best is trial 84 with value: 0.131777543985339.
running
[I 2024-10-06 17:19:33,484] Trial 94 finished with value: 0.13232836014877397 and parameters: {'model_name': 'IterativeImputer', 'estimator': 'RFR', 'initial_strategy': 'median', 'n_nearest_features': 8, 'imputation_order': 'descending'}. Best is trial 84 with value: 0.131777543985339.
running
[I 2024-10-06 17:19:33,704] Trial 111 finished with value: 0.4399569303515613 and parameters: {'model_name': 'SimpleImputer', 'strategy': 'constant'}. Best is trial 84 with value: 0.131777543985339.
running
[I 2024-10-06 17:24:22,526] Trial 95 finished with value: 0.13215325447251042 and parameters: {'model_name': 'IterativeImputer', 'estimator': 'RFR', 'initial_strategy': 'median', 'n_nearest_features': 8, 'imputation_order': 'descending'}. Best is trial 84 with value: 0.131777543985339.
running
[I 2024-10-06 17:25:38,062] Trial 96 finished with value: 0.13232904884934388 and parameters: {'model_name': 'IterativeImputer', 'estimator': 'RFR', 'initial_strategy': 'median', 'n_nearest_features': 8, 'imputation_order': 'descending'}. Best is trial 84 with value: 0.131777543985339.
running
[I 2024-10-06 17:33:17,551] Trial 97 finished with value: 0.1328411447424727 and parameters: {'model_name': 'IterativeImputer', 'estimator': 'RFR', 'initial_strategy': 'median', 'n_nearest_features': 8, 'imputation_order': 'descending'}. Best is trial 84 with value: 0.131777543985339.
running
[I 2024-10-06 17:33:40,423] Trial 98 finished with value: 0.13187775733387588 and parameters: {'model_name': 'IterativeImputer', 'estimator': 'RFR', 'initial_strategy': 'median', 'n_nearest_features': 8, 'imputation_order': 'descending'}. Best is trial 84 with value: 0.131777543985339.
running
[I 2024-10-06 17:43:06,357] Trial 99 finished with value: 0.13170416934163814 and parameters: {'model_name': 'IterativeImputer', 'estimator': 'RFR', 'initial_strategy': 'median', 'n_nearest_features': 8, 'imputation_order': 'descending'}. Best is trial 99 with value: 0.13170416934163814.
running
