[I 2024-11-23 06:36:58,039] Trial 199 finished with value: 0.21667956112523842 and parameters: {'model_name': 'IterativeImputer', 'estimator': 'RFR', 'initial_strategy': 'median', 'n_nearest_features': 4, 'imputation_order': 'roman'}. Best is trial 193 with value: 0.21574897698711828.
fit
auto fit
auto transform
0    0
1    0
2    0
3    0
dtype: int64
0    0
1    0
2    0
3    0
dtype: int64
0.21574897698711828
{'model_name': 'IterativeImputer', 'estimator': 'RFR', 'initial_strategy': 'median', 'n_nearest_features': 4, 'imputation_order': 'random'}
running experiment 2/3 - Does reconstruction give good automl predictions
Start est fit
Version 0.1.7a0 of tpot2 is outdated. Version 0.1.8a0 was released Tuesday September 17, 2024.
Version 0.1.7a0 of tpot2 is outdated. Version 0.1.8a0 was released Tuesday September 17, 2024.
Version 0.1.7a0 of tpot2 is outdated. Version 0.1.8a0 was released Tuesday September 17, 2024.
Version 0.1.7a0 of tpot2 is outdated. Version 0.1.8a0 was released Tuesday September 17, 2024.
Version 0.1.7a0 of tpot2 is outdated. Version 0.1.8a0 was released Tuesday September 17, 2024.
Version 0.1.7a0 of tpot2 is outdated. Version 0.1.8a0 was released Tuesday September 17, 2024.
Version 0.1.7a0 of tpot2 is outdated. Version 0.1.8a0 was released Tuesday September 17, 2024.
Version 0.1.7a0 of tpot2 is outdated. Version 0.1.8a0 was released Tuesday September 17, 2024.
Version 0.1.7a0 of tpot2 is outdated. Version 0.1.8a0 was released Tuesday September 17, 2024.
Version 0.1.7a0 of tpot2 is outdated. Version 0.1.8a0 was released Tuesday September 17, 2024.
Version 0.1.7a0 of tpot2 is outdated. Version 0.1.8a0 was released Tuesday September 17, 2024.
Version 0.1.7a0 of tpot2 is outdated. Version 0.1.8a0 was released Tuesday September 17, 2024.
Version 0.1.7a0 of tpot2 is outdated. Version 0.1.8a0 was released Tuesday September 17, 2024.
Version 0.1.7a0 of tpot2 is outdated. Version 0.1.8a0 was released Tuesday September 17, 2024.
Version 0.1.7a0 of tpot2 is outdated. Version 0.1.8a0 was released Tuesday September 17, 2024.
Version 0.1.7a0 of tpot2 is outdated. Version 0.1.8a0 was released Tuesday September 17, 2024.
  0%|          | 0/25 [00:00<?, ?it/s]Generation:   0%|          | 0/25 [00:00<?, ?it/s]WARNING AN INDIVIDUAL TIMED OUT: 
 <tpot2.search_spaces.pipelines.sequential.SequentialPipelineIndividual object at 0x1554746f8640> 

Generation:  1
Best f1_score score: 0.8865702214489796
Generation:   4%|▍         | 1/25 [10:02<4:00:54, 602.29s/it]WARNING THIS INDIVIDUAL CAUSED AND EXCEPTION 
 <tpot2.search_spaces.pipelines.sequential.SequentialPipelineIndividual object at 0x155467cf9de0> 
 The 'min_samples_split' parameter of DecisionTreeClassifier must be an int in the range [2, inf) or a float in the range (0.0, 1.0]. Got 1 instead. 
 Traceback (most recent call last):
  File "/common/ketrong/tpotexp/tpot2/tpot2/utils/eval_utils.py", line 53, in objective_nan_wrapper
    value = func_timeout.func_timeout(timeout, objective_function, args=[individual], kwargs=objective_kwargs)
  File "/common/ketrong/tpotexp/env/lib/python3.10/site-packages/func_timeout/dafunc.py", line 108, in func_timeout
    raise_exception(exception)
  File "/common/ketrong/tpotexp/env/lib/python3.10/site-packages/func_timeout/py3_raise.py", line 7, in raise_exception
    raise exception[0] from None
  File "/common/ketrong/tpotexp/tpot2/tpot2/tpot_estimator/estimator.py", line 623, in objective_function
    return objective_function_generator(
  File "/common/ketrong/tpotexp/tpot2/tpot2/tpot_estimator/estimator_utils.py", line 55, in objective_function_generator
    cv_obj_scores = cross_val_score_objective(sklearn.base.clone(pipeline),x,y,scorers=scorers, cv=cv , fold=step)
  File "/common/ketrong/tpotexp/tpot2/tpot2/tpot_estimator/cross_val_utils.py", line 28, in cross_val_score_objective
    this_fold_pipeline.fit(X_train,y_train)
  File "/common/ketrong/tpotexp/env/lib/python3.10/site-packages/sklearn/base.py", line 1473, in wrapper
    return fit_method(estimator, *args, **kwargs)
  File "/common/ketrong/tpotexp/env/lib/python3.10/site-packages/sklearn/pipeline.py", line 473, in fit
    self._final_estimator.fit(Xt, y, **last_step_params["fit"])
  File "/common/ketrong/tpotexp/env/lib/python3.10/site-packages/sklearn/base.py", line 1466, in wrapper
    estimator._validate_params()
  File "/common/ketrong/tpotexp/env/lib/python3.10/site-packages/sklearn/base.py", line 666, in _validate_params
    validate_parameter_constraints(
  File "/common/ketrong/tpotexp/env/lib/python3.10/site-packages/sklearn/utils/_param_validation.py", line 95, in validate_parameter_constraints
    raise InvalidParameterError(
sklearn.utils._param_validation.InvalidParameterError: The 'min_samples_split' parameter of DecisionTreeClassifier must be an int in the range [2, inf) or a float in the range (0.0, 1.0]. Got 1 instead.

Generation:  2
Best f1_score score: 0.900870939316728
Generation:   8%|▊         | 2/25 [10:44<1:44:37, 272.96s/it]Generation:  3
Best f1_score score: 0.900870939316728
Generation:  12%|█▏        | 3/25 [11:27<1:01:31, 167.82s/it]Generation:  4
Best f1_score score: 0.900870939316728
Generation:  16%|█▌        | 4/25 [12:13<41:51, 119.61s/it]  Generation:  5
Best f1_score score: 0.9030460086405814
Generation:  20%|██        | 5/25 [20:54<1:28:07, 264.35s/it]Generation:  6
Best f1_score score: 0.9030460086405814
Generation:  24%|██▍       | 6/25 [21:39<1:00:07, 189.89s/it]Generation:  7
Best f1_score score: 0.9030460086405814
Generation:  28%|██▊       | 7/25 [25:15<59:32, 198.48s/it]  Generation:  8
Best f1_score score: 0.9030460086405814
Generation:  32%|███▏      | 8/25 [25:33<39:55, 140.89s/it]Generation:  9
Best f1_score score: 0.9030460086405814
Generation:  36%|███▌      | 9/25 [25:58<27:53, 104.62s/it]Generation:  10
Best f1_score score: 0.9030460086405814
Generation:  40%|████      | 10/25 [27:15<24:01, 96.09s/it]Generation:  11
Best f1_score score: 0.9030460086405814
Generation:  44%|████▍     | 11/25 [29:50<26:41, 114.38s/it]Generation:  12
Best f1_score score: 0.9040605031266642
Generation:  48%|████▊     | 12/25 [30:06<18:18, 84.47s/it] Generation:  13
Best f1_score score: 0.9040605031266642
Generation:  52%|█████▏    | 13/25 [38:37<42:43, 213.63s/it]Generation:  14
Best f1_score score: 0.9040605031266642
Generation:  56%|█████▌    | 14/25 [41:55<38:18, 208.95s/it]Generation:  15
Best f1_score score: 0.9040605031266642
Generation:  60%|██████    | 15/25 [45:08<34:00, 204.02s/it]Generation:  16
Best f1_score score: 0.9040605031266642
Generation:  64%|██████▍   | 16/25 [45:30<22:22, 149.22s/it]Generation:  17
Best f1_score score: 0.9040605031266642
Generation:  68%|██████▊   | 17/25 [52:35<30:56, 232.11s/it]Generation:  18
Best f1_score score: 0.9040605031266642
Generation:  72%|███████▏  | 18/25 [52:53<19:33, 167.70s/it]Generation:  19
Best f1_score score: 0.9040605031266642
Generation:  76%|███████▌  | 19/25 [54:52<15:19, 153.28s/it]WARNING AN INDIVIDUAL TIMED OUT: 
 <tpot2.search_spaces.pipelines.sequential.SequentialPipelineIndividual object at 0x155467cb5900> 

Generation:  20
Best f1_score score: 0.906100331939012
Generation:  80%|████████  | 20/25 [1:05:04<24:14, 290.81s/it]Generation:  21
Best f1_score score: 0.906100331939012
Generation:  84%|████████▍ | 21/25 [1:05:30<14:06, 211.55s/it]Generation:  22
Best f1_score score: 0.906100331939012
Generation:  88%|████████▊ | 22/25 [1:05:57<07:47, 155.96s/it]Generation:  23
Best f1_score score: 0.906100331939012
Generation:  92%|█████████▏| 23/25 [1:06:26<03:56, 118.04s/it]Generation:  24
Best f1_score score: 0.906100331939012
Generation:  96%|█████████▌| 24/25 [1:15:29<04:05, 245.48s/it]Generation:  25
Best f1_score score: 0.906100331939012
Generation: 100%|██████████| 25/25 [1:16:00<00:00, 181.05s/it]Generation: 100%|██████████| 25/25 [1:16:03<00:00, 182.56s/it]
2024-11-23 07:57:31,049 - distributed.scheduler - ERROR - Removing worker 'tcp://127.0.0.1:35243' caused the cluster to lose scattered data, which can't be recovered: {'ndarray-5b9deb3458fdf023a24972dfc80c3add', 'ndarray-8f8c22aea6c70fbd60fa1f9e6d8850d2'} (stimulus_id='handle-worker-cleanup-1732377451.049021')
Fitted
Pipeline(steps=[('histgradientboostingclassifier',
                 HistGradientBoostingClassifier(early_stopping=True,
                                                l2_regularization=0.5246074567847,
                                                learning_rate=0.0778233830801,
                                                max_features=0.7583620919331,
                                                max_leaf_nodes=330,
                                                min_samples_leaf=44,
                                                n_iter_no_change=13, tol=0.0001,
                                                validation_fraction=None))])
score start
train score: {'auroc': 0.9997951538778784, 'accuracy': 0.9979919678714859, 'balanced_accuracy': 0.9832645888345806, 'logloss': 0.008503631880461559, 'f1': 0.9774948169460638}
original test score: {'auroc': 0.9985749388109321, 'accuracy': 0.9943105756358769, 'balanced_accuracy': 0.9596078701684366, 'logloss': 0.01465322866848769, 'f1': 0.9384016806940085}
imputed test score: {'auroc': 0.9912521667597026, 'accuracy': 0.9906849620705043, 'balanced_accuracy': 0.8924623317159381, 'logloss': 0.028901573373786606, 'f1': 0.8938910489081482}
score end
check intended
EXP2 Finished
running experiment 3/3 - What is the best automl settings?
<tpot2.search_spaces.pipelines.sequential.SequentialPipeline object at 0x155435014610>
Start tpot fit
Version 0.1.7a0 of tpot2 is outdated. Version 0.1.8a0 was released Tuesday September 17, 2024.
Version 0.1.7a0 of tpot2 is outdated. Version 0.1.8a0 was released Tuesday September 17, 2024.
Version 0.1.7a0 of tpot2 is outdated. Version 0.1.8a0 was released Tuesday September 17, 2024.
Version 0.1.7a0 of tpot2 is outdated. Version 0.1.8a0 was released Tuesday September 17, 2024.
Version 0.1.7a0 of tpot2 is outdated. Version 0.1.8a0 was released Tuesday September 17, 2024.
Version 0.1.7a0 of tpot2 is outdated. Version 0.1.8a0 was released Tuesday September 17, 2024.
Version 0.1.7a0 of tpot2 is outdated. Version 0.1.8a0 was released Tuesday September 17, 2024.
Version 0.1.7a0 of tpot2 is outdated. Version 0.1.8a0 was released Tuesday September 17, 2024.
Version 0.1.7a0 of tpot2 is outdated. Version 0.1.8a0 was released Tuesday September 17, 2024.
Version 0.1.7a0 of tpot2 is outdated. Version 0.1.8a0 was released Tuesday September 17, 2024.
Version 0.1.7a0 of tpot2 is outdated. Version 0.1.8a0 was released Tuesday September 17, 2024.
Version 0.1.7a0 of tpot2 is outdated. Version 0.1.8a0 was released Tuesday September 17, 2024.
Version 0.1.7a0 of tpot2 is outdated. Version 0.1.8a0 was released Tuesday September 17, 2024.
Version 0.1.7a0 of tpot2 is outdated. Version 0.1.8a0 was released Tuesday September 17, 2024.
Version 0.1.7a0 of tpot2 is outdated. Version 0.1.8a0 was released Tuesday September 17, 2024.
Version 0.1.7a0 of tpot2 is outdated. Version 0.1.8a0 was released Tuesday September 17, 2024.
  0%|          | 0/25 [00:00<?, ?it/s]Generation:   0%|          | 0/25 [00:00<?, ?it/s]WARNING THIS INDIVIDUAL CAUSED AND EXCEPTION 
 <tpot2.search_spaces.pipelines.sequential.SequentialPipelineIndividual object at 0x1554746a0f70> 
 float division by zero 
 Traceback (most recent call last):
  File "/common/ketrong/tpotexp/tpot2/tpot2/utils/eval_utils.py", line 53, in objective_nan_wrapper
    value = func_timeout.func_timeout(timeout, objective_function, args=[individual], kwargs=objective_kwargs)
  File "/common/ketrong/tpotexp/env/lib/python3.10/site-packages/func_timeout/dafunc.py", line 108, in func_timeout
    raise_exception(exception)
  File "/common/ketrong/tpotexp/env/lib/python3.10/site-packages/func_timeout/py3_raise.py", line 7, in raise_exception
    raise exception[0] from None
  File "/common/ketrong/tpotexp/tpot2/tpot2/tpot_estimator/estimator.py", line 623, in objective_function
    return objective_function_generator(
  File "/common/ketrong/tpotexp/tpot2/tpot2/tpot_estimator/estimator_utils.py", line 55, in objective_function_generator
    cv_obj_scores = cross_val_score_objective(sklearn.base.clone(pipeline),x,y,scorers=scorers, cv=cv , fold=step)
  File "/common/ketrong/tpotexp/tpot2/tpot2/tpot_estimator/cross_val_utils.py", line 28, in cross_val_score_objective
    this_fold_pipeline.fit(X_train,y_train)
  File "/common/ketrong/tpotexp/env/lib/python3.10/site-packages/sklearn/base.py", line 1473, in wrapper
    return fit_method(estimator, *args, **kwargs)
  File "/common/ketrong/tpotexp/env/lib/python3.10/site-packages/sklearn/pipeline.py", line 469, in fit
    Xt = self._fit(X, y, routed_params)
  File "/common/ketrong/tpotexp/env/lib/python3.10/site-packages/sklearn/pipeline.py", line 406, in _fit
    X, fitted_transformer = fit_transform_one_cached(
  File "/common/ketrong/tpotexp/env/lib/python3.10/site-packages/joblib/memory.py", line 312, in __call__
    return self.func(*args, **kwargs)
  File "/common/ketrong/tpotexp/env/lib/python3.10/site-packages/sklearn/pipeline.py", line 1310, in _fit_transform_one
    res = transformer.fit_transform(X, y, **params.get("fit_transform", {}))
  File "/common/ketrong/tpotexp/env/lib/python3.10/site-packages/sklearn/utils/_set_output.py", line 313, in wrapped
    data_to_wrap = f(self, X, *args, **kwargs)
  File "/common/ketrong/tpotexp/tpot2/tpot2/builtin_modules/imputer.py", line 682, in fit_transform
    self.fit(X)
  File "/common/ketrong/tpotexp/tpot2/tpot2/builtin_modules/imputer.py", line 617, in fit
    self.model = self.VAE(VAEImputer=self, input_size=features.shape[1])
  File "/common/ketrong/tpotexp/tpot2/tpot2/builtin_modules/imputer.py", line 568, in __init__
    self.encoder = VAEImputer.Encoder(VAEImputer, input_size)
  File "/common/ketrong/tpotexp/tpot2/tpot2/builtin_modules/imputer.py", line 499, in __init__
    self.E_W4 = torch.nn.init.xavier_normal_(torch.empty((VAEImputer.split_size, VAEImputer.code_size),requires_grad=True, device=VAEImputer.device))
  File "/common/ketrong/tpotexp/env/lib/python3.10/site-packages/torch/nn/init.py", line 392, in xavier_normal_
    std = gain * math.sqrt(2.0 / float(fan_in + fan_out))
ZeroDivisionError: float division by zero

WARNING THIS INDIVIDUAL CAUSED AND EXCEPTION 
 <tpot2.search_spaces.pipelines.sequential.SequentialPipelineIndividual object at 0x1554746a0b80> 
 float division by zero 
 Traceback (most recent call last):
  File "/common/ketrong/tpotexp/tpot2/tpot2/utils/eval_utils.py", line 53, in objective_nan_wrapper
    value = func_timeout.func_timeout(timeout, objective_function, args=[individual], kwargs=objective_kwargs)
  File "/common/ketrong/tpotexp/env/lib/python3.10/site-packages/func_timeout/dafunc.py", line 108, in func_timeout
    raise_exception(exception)
  File "/common/ketrong/tpotexp/env/lib/python3.10/site-packages/func_timeout/py3_raise.py", line 7, in raise_exception
    raise exception[0] from None
  File "/common/ketrong/tpotexp/tpot2/tpot2/tpot_estimator/estimator.py", line 623, in objective_function
    return objective_function_generator(
  File "/common/ketrong/tpotexp/tpot2/tpot2/tpot_estimator/estimator_utils.py", line 55, in objective_function_generator
    cv_obj_scores = cross_val_score_objective(sklearn.base.clone(pipeline),x,y,scorers=scorers, cv=cv , fold=step)
  File "/common/ketrong/tpotexp/tpot2/tpot2/tpot_estimator/cross_val_utils.py", line 28, in cross_val_score_objective
    this_fold_pipeline.fit(X_train,y_train)
  File "/common/ketrong/tpotexp/env/lib/python3.10/site-packages/sklearn/base.py", line 1473, in wrapper
    return fit_method(estimator, *args, **kwargs)
  File "/common/ketrong/tpotexp/env/lib/python3.10/site-packages/sklearn/pipeline.py", line 469, in fit
    Xt = self._fit(X, y, routed_params)
  File "/common/ketrong/tpotexp/env/lib/python3.10/site-packages/sklearn/pipeline.py", line 406, in _fit
    X, fitted_transformer = fit_transform_one_cached(
  File "/common/ketrong/tpotexp/env/lib/python3.10/site-packages/joblib/memory.py", line 312, in __call__
    return self.func(*args, **kwargs)
  File "/common/ketrong/tpotexp/env/lib/python3.10/site-packages/sklearn/pipeline.py", line 1310, in _fit_transform_one
    res = transformer.fit_transform(X, y, **params.get("fit_transform", {}))
  File "/common/ketrong/tpotexp/env/lib/python3.10/site-packages/sklearn/utils/_set_output.py", line 313, in wrapped
    data_to_wrap = f(self, X, *args, **kwargs)
  File "/common/ketrong/tpotexp/tpot2/tpot2/builtin_modules/imputer.py", line 682, in fit_transform
    self.fit(X)
  File "/common/ketrong/tpotexp/tpot2/tpot2/builtin_modules/imputer.py", line 617, in fit
    self.model = self.VAE(VAEImputer=self, input_size=features.shape[1])
  File "/common/ketrong/tpotexp/tpot2/tpot2/builtin_modules/imputer.py", line 568, in __init__
    self.encoder = VAEImputer.Encoder(VAEImputer, input_size)
  File "/common/ketrong/tpotexp/tpot2/tpot2/builtin_modules/imputer.py", line 499, in __init__
    self.E_W4 = torch.nn.init.xavier_normal_(torch.empty((VAEImputer.split_size, VAEImputer.code_size),requires_grad=True, device=VAEImputer.device))
  File "/common/ketrong/tpotexp/env/lib/python3.10/site-packages/torch/nn/init.py", line 392, in xavier_normal_
    std = gain * math.sqrt(2.0 / float(fan_in + fan_out))
ZeroDivisionError: float division by zero

WARNING THIS INDIVIDUAL CAUSED AND EXCEPTION 
 <tpot2.search_spaces.pipelines.sequential.SequentialPipelineIndividual object at 0x1554746a0f70> 
 Negative values in data passed to MultinomialNB (input X) 
 Traceback (most recent call last):
  File "/common/ketrong/tpotexp/tpot2/tpot2/utils/eval_utils.py", line 53, in objective_nan_wrapper
    value = func_timeout.func_timeout(timeout, objective_function, args=[individual], kwargs=objective_kwargs)
  File "/common/ketrong/tpotexp/env/lib/python3.10/site-packages/func_timeout/dafunc.py", line 108, in func_timeout
    raise_exception(exception)
  File "/common/ketrong/tpotexp/env/lib/python3.10/site-packages/func_timeout/py3_raise.py", line 7, in raise_exception
    raise exception[0] from None
  File "/common/ketrong/tpotexp/tpot2/tpot2/tpot_estimator/estimator.py", line 623, in objective_function
    return objective_function_generator(
  File "/common/ketrong/tpotexp/tpot2/tpot2/tpot_estimator/estimator_utils.py", line 55, in objective_function_generator
    cv_obj_scores = cross_val_score_objective(sklearn.base.clone(pipeline),x,y,scorers=scorers, cv=cv , fold=step)
  File "/common/ketrong/tpotexp/tpot2/tpot2/tpot_estimator/cross_val_utils.py", line 28, in cross_val_score_objective
    this_fold_pipeline.fit(X_train,y_train)
  File "/common/ketrong/tpotexp/env/lib/python3.10/site-packages/sklearn/base.py", line 1473, in wrapper
    return fit_method(estimator, *args, **kwargs)
  File "/common/ketrong/tpotexp/env/lib/python3.10/site-packages/sklearn/pipeline.py", line 473, in fit
    self._final_estimator.fit(Xt, y, **last_step_params["fit"])
  File "/common/ketrong/tpotexp/env/lib/python3.10/site-packages/sklearn/base.py", line 1473, in wrapper
    return fit_method(estimator, *args, **kwargs)
  File "/common/ketrong/tpotexp/env/lib/python3.10/site-packages/sklearn/naive_bayes.py", line 759, in fit
    self._count(X, Y)
  File "/common/ketrong/tpotexp/env/lib/python3.10/site-packages/sklearn/naive_bayes.py", line 881, in _count
    check_non_negative(X, "MultinomialNB (input X)")
  File "/common/ketrong/tpotexp/env/lib/python3.10/site-packages/sklearn/utils/validation.py", line 1689, in check_non_negative
    raise ValueError("Negative values in data passed to %s" % whom)
ValueError: Negative values in data passed to MultinomialNB (input X)

WARNING AN INDIVIDUAL TIMED OUT: 
 <tpot2.search_spaces.pipelines.sequential.SequentialPipelineIndividual object at 0x155474700ac0> 

WARNING AN INDIVIDUAL TIMED OUT: 
 <tpot2.search_spaces.pipelines.sequential.SequentialPipelineIndividual object at 0x1554746a0be0> 

Generation:  1
Best f1_score score: 0.8358480498651403
Generation:   4%|▍         | 1/25 [10:04<4:01:44, 604.35s/it]WARNING THIS INDIVIDUAL CAUSED AND EXCEPTION 
 <tpot2.search_spaces.pipelines.sequential.SequentialPipelineIndividual object at 0x1554746a0b80> 
 float division by zero 
 Traceback (most recent call last):
  File "/common/ketrong/tpotexp/tpot2/tpot2/utils/eval_utils.py", line 53, in objective_nan_wrapper
    value = func_timeout.func_timeout(timeout, objective_function, args=[individual], kwargs=objective_kwargs)
  File "/common/ketrong/tpotexp/env/lib/python3.10/site-packages/func_timeout/dafunc.py", line 108, in func_timeout
    raise_exception(exception)
  File "/common/ketrong/tpotexp/env/lib/python3.10/site-packages/func_timeout/py3_raise.py", line 7, in raise_exception
    raise exception[0] from None
  File "/common/ketrong/tpotexp/tpot2/tpot2/tpot_estimator/estimator.py", line 623, in objective_function
    return objective_function_generator(
  File "/common/ketrong/tpotexp/tpot2/tpot2/tpot_estimator/estimator_utils.py", line 55, in objective_function_generator
    cv_obj_scores = cross_val_score_objective(sklearn.base.clone(pipeline),x,y,scorers=scorers, cv=cv , fold=step)
  File "/common/ketrong/tpotexp/tpot2/tpot2/tpot_estimator/cross_val_utils.py", line 28, in cross_val_score_objective
    this_fold_pipeline.fit(X_train,y_train)
  File "/common/ketrong/tpotexp/env/lib/python3.10/site-packages/sklearn/base.py", line 1473, in wrapper
    return fit_method(estimator, *args, **kwargs)
  File "/common/ketrong/tpotexp/env/lib/python3.10/site-packages/sklearn/pipeline.py", line 469, in fit
    Xt = self._fit(X, y, routed_params)
  File "/common/ketrong/tpotexp/env/lib/python3.10/site-packages/sklearn/pipeline.py", line 406, in _fit
    X, fitted_transformer = fit_transform_one_cached(
  File "/common/ketrong/tpotexp/env/lib/python3.10/site-packages/joblib/memory.py", line 312, in __c