[I 2024-08-26 17:30:44,239] Trial 91 finished with value: 0.2237068928061158 and parameters: {'model_name': 'SimpleImputer', 'strategy': 'median'}. Best is trial 10 with value: 0.22370280050845212.
running
[I 2024-08-26 17:30:44,861] Trial 104 finished with value: 0.22370280050845212 and parameters: {'model_name': 'SimpleImputer', 'strategy': 'mean'}. Best is trial 10 with value: 0.22370280050845212.
[I 2024-08-26 17:30:44,966] Trial 109 finished with value: 0.22370280050845212 and parameters: {'model_name': 'SimpleImputer', 'strategy': 'mean'}. Best is trial 10 with value: 0.22370280050845212.
running
running
[I 2024-08-26 17:30:45,169] Trial 107 finished with value: 0.22370280050845212 and parameters: {'model_name': 'SimpleImputer', 'strategy': 'mean'}. Best is trial 10 with value: 0.22370280050845212.
running
[I 2024-08-26 17:30:45,309] Trial 106 finished with value: 0.22370280050845212 and parameters: {'model_name': 'SimpleImputer', 'strategy': 'mean'}. Best is trial 10 with value: 0.22370280050845212.
[I 2024-08-26 17:30:45,412] Trial 103 finished with value: 0.22370280050845212 and parameters: {'model_name': 'SimpleImputer', 'strategy': 'mean'}. Best is trial 10 with value: 0.22370280050845212.
running
[I 2024-08-26 17:30:45,543] Trial 108 finished with value: 0.22370280050845212 and parameters: {'model_name': 'SimpleImputer', 'strategy': 'mean'}. Best is trial 10 with value: 0.22370280050845212.
running
running
[I 2024-08-26 17:30:45,694] Trial 110 finished with value: 0.22370280050845212 and parameters: {'model_name': 'SimpleImputer', 'strategy': 'mean'}. Best is trial 10 with value: 0.22370280050845212.
running
[I 2024-08-26 17:30:45,838] Trial 105 finished with value: 0.22370280050845212 and parameters: {'model_name': 'SimpleImputer', 'strategy': 'mean'}. Best is trial 10 with value: 0.22370280050845212.
running
[I 2024-08-26 17:30:45,971] Trial 111 finished with value: 0.22370280050845212 and parameters: {'model_name': 'SimpleImputer', 'strategy': 'mean'}. Best is trial 10 with value: 0.22370280050845212.
running
[I 2024-08-26 17:30:46,101] Trial 112 finished with value: 0.22370280050845212 and parameters: {'model_name': 'SimpleImputer', 'strategy': 'mean'}. Best is trial 10 with value: 0.22370280050845212.
running
[I 2024-08-26 17:30:46,271] Trial 114 finished with value: 0.22370280050845212 and parameters: {'model_name': 'SimpleImputer', 'strategy': 'mean'}. Best is trial 10 with value: 0.22370280050845212.
running
[I 2024-08-26 17:30:46,430] Trial 113 finished with value: 0.22370280050845212 and parameters: {'model_name': 'SimpleImputer', 'strategy': 'mean'}. Best is trial 10 with value: 0.22370280050845212.
running
[I 2024-08-26 17:30:46,601] Trial 117 finished with value: 0.22370280050845212 and parameters: {'model_name': 'SimpleImputer', 'strategy': 'mean'}. Best is trial 10 with value: 0.22370280050845212.
running
[I 2024-08-26 17:30:46,786] Trial 115 finished with value: 0.22370280050845212 and parameters: {'model_name': 'SimpleImputer', 'strategy': 'mean'}. Best is trial 10 with value: 0.22370280050845212.
running
[I 2024-08-26 17:30:46,943] Trial 118 finished with value: 0.22370280050845212 and parameters: {'model_name': 'SimpleImputer', 'strategy': 'mean'}. Best is trial 10 with value: 0.22370280050845212.
running
[I 2024-08-26 17:30:47,130] Trial 116 finished with value: 0.22370280050845212 and parameters: {'model_name': 'SimpleImputer', 'strategy': 'mean'}. Best is trial 10 with value: 0.22370280050845212.
running
[I 2024-08-26 17:30:47,589] Trial 120 finished with value: 0.22370280050845212 and parameters: {'model_name': 'SimpleImputer', 'strategy': 'mean'}. Best is trial 10 with value: 0.22370280050845212.
running
[I 2024-08-26 17:30:47,696] Trial 121 finished with value: 0.22370280050845212 and parameters: {'model_name': 'SimpleImputer', 'strategy': 'mean'}. Best is trial 10 with value: 0.22370280050845212.
running
[I 2024-08-26 17:30:47,891] Trial 124 finished with value: 0.22370280050845212 and parameters: {'model_name': 'SimpleImputer', 'strategy': 'mean'}. Best is trial 10 with value: 0.22370280050845212.
running
[I 2024-08-26 17:30:48,028] Trial 123 finished with value: 0.22370280050845212 and parameters: {'model_name': 'SimpleImputer', 'strategy': 'mean'}. Best is trial 10 with value: 0.22370280050845212.
running
[I 2024-08-26 17:30:48,187] Trial 127 finished with value: 0.22370280050845212 and parameters: {'model_name': 'SimpleImputer', 'strategy': 'mean'}. Best is trial 10 with value: 0.22370280050845212.
[I 2024-08-26 17:30:48,297] Trial 122 finished with value: 0.22370280050845212 and parameters: {'model_name': 'SimpleImputer', 'strategy': 'mean'}. Best is trial 10 with value: 0.22370280050845212.
running
running
[I 2024-08-26 17:30:48,425] Trial 125 finished with value: 0.22370280050845212 and parameters: {'model_name': 'SimpleImputer', 'strategy': 'mean'}. Best is trial 10 with value: 0.22370280050845212.
[I 2024-08-26 17:30:48,529] Trial 119 finished with value: 0.22370280050845212 and parameters: {'model_name': 'SimpleImputer', 'strategy': 'mean'}. Best is trial 10 with value: 0.22370280050845212.
running
running
[I 2024-08-26 17:30:48,728] Trial 128 finished with value: 0.22370280050845212 and parameters: {'model_name': 'SimpleImputer', 'strategy': 'mean'}. Best is trial 10 with value: 0.22370280050845212.
running
[I 2024-08-26 17:30:48,932] Trial 130 finished with value: 0.22370280050845212 and parameters: {'model_name': 'SimpleImputer', 'strategy': 'mean'}. Best is trial 10 with value: 0.22370280050845212.
running
[I 2024-08-26 17:30:49,115] Trial 129 finished with value: 0.22370280050845212 and parameters: {'model_name': 'SimpleImputer', 'strategy': 'mean'}. Best is trial 10 with value: 0.22370280050845212.
running
[I 2024-08-26 17:30:49,241] Trial 126 finished with value: 0.22370280050845212 and parameters: {'model_name': 'SimpleImputer', 'strategy': 'mean'}. Best is trial 10 with value: 0.22370280050845212.
running
[I 2024-08-26 17:30:49,407] Trial 131 finished with value: 0.22370280050845212 and parameters: {'model_name': 'SimpleImputer', 'strategy': 'mean'}. Best is trial 10 with value: 0.22370280050845212.
running
[I 2024-08-26 17:30:49,570] Trial 132 finished with value: 0.22370280050845212 and parameters: {'model_name': 'SimpleImputer', 'strategy': 'mean'}. Best is trial 10 with value: 0.22370280050845212.
running
[I 2024-08-26 17:30:49,756] Trial 133 finished with value: 0.22370280050845212 and parameters: {'model_name': 'SimpleImputer', 'strategy': 'mean'}. Best is trial 10 with value: 0.22370280050845212.
running
[I 2024-08-26 17:30:49,980] Trial 134 finished with value: 0.22370280050845212 and parameters: {'model_name': 'SimpleImputer', 'strategy': 'mean'}. Best is trial 10 with value: 0.22370280050845212.
running
[I 2024-08-26 17:30:50,404] Trial 136 finished with value: 0.22370280050845212 and parameters: {'model_name': 'SimpleImputer', 'strategy': 'mean'}. Best is trial 10 with value: 0.22370280050845212.
running
[I 2024-08-26 17:30:50,534] Trial 140 finished with value: 0.22370280050845212 and parameters: {'model_name': 'SimpleImputer', 'strategy': 'mean'}. Best is trial 10 with value: 0.22370280050845212.
running
[I 2024-08-26 17:30:50,681] Trial 139 finished with value: 0.22370280050845212 and parameters: {'model_name': 'SimpleImputer', 'strategy': 'mean'}. Best is trial 10 with value: 0.22370280050845212.
running
[I 2024-08-26 17:30:50,840] Trial 137 finished with value: 0.22370280050845212 and parameters: {'model_name': 'SimpleImputer', 'strategy': 'mean'}. Best is trial 10 with value: 0.22370280050845212.
running
[I 2024-08-26 17:30:50,989] Trial 135 finished with value: 0.22370280050845212 and parameters: {'model_name': 'SimpleImputer', 'strategy': 'mean'}. Best is trial 10 with value: 0.22370280050845212.
[I 2024-08-26 17:30:51,093] Trial 138 finished with value: 0.22370280050845212 and parameters: {'model_name': 'SimpleImputer', 'strategy': 'mean'}. Best is trial 10 with value: 0.22370280050845212.
running
running
[I 2024-08-26 17:30:51,320] Trial 142 finished with value: 0.22370280050845212 and parameters: {'model_name': 'SimpleImputer', 'strategy': 'mean'}. Best is trial 10 with value: 0.22370280050845212.
running
[I 2024-08-26 17:30:51,438] Trial 143 finished with value: 0.22370280050845212 and parameters: {'model_name': 'SimpleImputer', 'strategy': 'mean'}. Best is trial 10 with value: 0.22370280050845212.
running
[I 2024-08-26 17:30:51,555] Trial 144 finished with value: 0.22370280050845212 and parameters: {'model_name': 'SimpleImputer', 'strategy': 'mean'}. Best is trial 10 with value: 0.22370280050845212.
running
[I 2024-08-26 17:30:51,688] Trial 141 finished with value: 0.22370280050845212 and parameters: {'model_name': 'SimpleImputer', 'strategy': 'mean'}. Best is trial 10 with value: 0.22370280050845212.
running
[I 2024-08-26 17:30:51,878] Trial 146 finished with value: 0.22370280050845212 and parameters: {'model_name': 'SimpleImputer', 'strategy': 'mean'}. Best is trial 10 with value: 0.22370280050845212.
running
[I 2024-08-26 17:30:52,066] Trial 147 finished with value: 0.22370280050845212 and parameters: {'model_name': 'SimpleImputer', 'strategy': 'mean'}. Best is trial 10 with value: 0.22370280050845212.
[I 2024-08-26 17:30:52,167] Trial 145 finished with value: 0.22370280050845212 and parameters: {'model_name': 'SimpleImputer', 'strategy': 'mean'}. Best is trial 10 with value: 0.22370280050845212.
running
running
[I 2024-08-26 17:30:52,381] Trial 148 finished with value: 0.22370280050845212 and parameters: {'model_name': 'SimpleImputer', 'strategy': 'mean'}. Best is trial 10 with value: 0.22370280050845212.
running
[I 2024-08-26 17:30:52,599] Trial 149 finished with value: 0.22370280050845212 and parameters: {'model_name': 'SimpleImputer', 'strategy': 'mean'}. Best is trial 10 with value: 0.22370280050845212.
[I 2024-08-26 17:30:52,704] Trial 150 finished with value: 0.22370280050845212 and parameters: {'model_name': 'SimpleImputer', 'strategy': 'mean'}. Best is trial 10 with value: 0.22370280050845212.
running
running
[I 2024-08-26 17:30:53,211] Trial 158 finished with value: 0.22370280050845212 and parameters: {'model_name': 'SimpleImputer', 'strategy': 'mean'}. Best is trial 10 with value: 0.22370280050845212.
running
[I 2024-08-26 17:30:53,339] Trial 159 finished with value: 0.22370280050845212 and parameters: {'model_name': 'SimpleImputer', 'strategy': 'mean'}. Best is trial 10 with value: 0.22370280050845212.
running
[I 2024-08-26 17:30:53,455] Trial 153 finished with value: 0.22370280050845212 and parameters: {'model_name': 'SimpleImputer', 'strategy': 'mean'}. Best is trial 10 with value: 0.22370280050845212.
running
[I 2024-08-26 17:30:53,608] Trial 160 finished with value: 0.22370280050845212 and parameters: {'model_name': 'SimpleImputer', 'strategy': 'mean'}. Best is trial 10 with value: 0.22370280050845212.
running
[I 2024-08-26 17:30:53,734] Trial 152 finished with value: 0.22370280050845212 and parameters: {'model_name': 'SimpleImputer', 'strategy': 'mean'}. Best is trial 10 with value: 0.22370280050845212.
[I 2024-08-26 17:30:53,844] Trial 151 finished with value: 0.22370280050845212 and parameters: {'model_name': 'SimpleImputer', 'strategy': 'mean'}. Best is trial 10 with value: 0.22370280050845212.
running
running
[I 2024-08-26 17:30:53,978] Trial 154 finished with value: 0.22370280050845212 and parameters: {'model_name': 'SimpleImputer', 'strategy': 'mean'}. Best is trial 10 with value: 0.22370280050845212.
[I 2024-08-26 17:30:54,073] Trial 157 finished with value: 0.22370280050845212 and parameters: {'model_name': 'SimpleImputer', 'strategy': 'mean'}. Best is trial 10 with value: 0.22370280050845212.
running
running
[I 2024-08-26 17:30:54,234] Trial 155 finished with value: 0.22370280050845212 and parameters: {'model_name': 'SimpleImputer', 'strategy': 'mean'}. Best is trial 10 with value: 0.22370280050845212.
running
[I 2024-08-26 17:30:54,351] Trial 156 finished with value: 0.22370280050845212 and parameters: {'model_name': 'SimpleImputer', 'strategy': 'mean'}. Best is trial 10 with value: 0.22370280050845212.
running
[I 2024-08-26 17:30:54,494] Trial 161 finished with value: 0.22370280050845212 and parameters: {'model_name': 'SimpleImputer', 'strategy': 'mean'}. Best is trial 10 with value: 0.22370280050845212.
[I 2024-08-26 17:30:54,610] Trial 162 finished with value: 0.22370280050845212 and parameters: {'model_name': 'SimpleImputer', 'strategy': 'mean'}. Best is trial 10 with value: 0.22370280050845212.
running
running
[I 2024-08-26 17:30:54,968] Trial 163 finished with value: 0.22370280050845212 and parameters: {'model_name': 'SimpleImputer', 'strategy': 'mean'}. Best is trial 10 with value: 0.22370280050845212.
running
[I 2024-08-26 17:30:55,247] Trial 166 finished with value: 0.22370280050845212 and parameters: {'model_name': 'SimpleImputer', 'strategy': 'mean'}. Best is trial 10 with value: 0.22370280050845212.
running
[I 2024-08-26 17:30:55,374] Trial 164 finished with value: 0.22370280050845212 and parameters: {'model_name': 'SimpleImputer', 'strategy': 'mean'}. Best is trial 10 with value: 0.22370280050845212.
running
[I 2024-08-26 17:30:55,636] Trial 165 finished with value: 0.22370280050845212 and parameters: {'model_name': 'SimpleImputer', 'strategy': 'mean'}. Best is trial 10 with value: 0.22370280050845212.
running
[I 2024-08-26 17:30:55,857] Trial 168 finished with value: 0.22370280050845212 and parameters: {'model_name': 'SimpleImputer', 'strategy': 'mean'}. Best is trial 10 with value: 0.22370280050845212.
running
[I 2024-08-26 17:30:55,971] Trial 170 finished with value: 0.22370280050845212 and parameters: {'model_name': 'SimpleImputer', 'strategy': 'mean'}. Best is trial 10 with value: 0.22370280050845212.
[I 2024-08-26 17:30:56,090] Trial 167 finished with value: 0.22370280050845212 and parameters: {'model_name': 'SimpleImputer', 'strategy': 'mean'}. Best is trial 10 with value: 0.22370280050845212.
running
running
[I 2024-08-26 17:30:56,274] Trial 169 finished with value: 0.22370280050845212 and parameters: {'model_name': 'SimpleImputer', 'strategy': 'mean'}. Best is trial 10 with value: 0.22370280050845212.
running
[I 2024-08-26 17:30:56,478] Trial 176 finished with value: 0.22370280050845212 and parameters: {'model_name': 'SimpleImputer', 'strategy': 'mean'}. Best is trial 10 with value: 0.22370280050845212.
running
[I 2024-08-26 17:30:56,628] Trial 171 finished with value: 0.22370280050845212 and parameters: {'model_name': 'SimpleImputer', 'strategy': 'mean'}. Best is trial 10 with value: 0.22370280050845212.
[I 2024-08-26 17:30:56,729] Trial 174 finished with value: 0.22370280050845212 and parameters: {'model_name': 'SimpleImputer', 'strategy': 'mean'}. Best is trial 10 with value: 0.22370280050845212.
running
running
[I 2024-08-26 17:30:56,865] Trial 173 finished with value: 0.22370280050845212 and parameters: {'model_name': 'SimpleImputer', 'strategy': 'mean'}. Best is trial 10 with value: 0.22370280050845212.
running
[I 2024-08-26 17:30:57,003] Trial 178 finished with value: 0.22370280050845212 and parameters: {'model_name': 'SimpleImputer', 'strategy': 'mean'}. Best is trial 10 with value: 0.22370280050845212.
running
[I 2024-08-26 17:30:57,132] Trial 175 finished with value: 0.22370280050845212 and parameters: {'model_name': 'SimpleImputer', 'strategy': 'mean'}. Best is trial 10 with value: 0.22370280050845212.
running
[I 2024-08-26 17:30:57,241] Trial 177 finished with value: 0.22370280050845212 and parameters: {'model_name': 'SimpleImputer', 'strategy': 'mean'}. Best is trial 10 with value: 0.22370280050845212.
running
[I 2024-08-26 17:30:57,371] Trial 172 finished with value: 0.22370280050845212 and parameters: {'model_name': 'SimpleImputer', 'strategy': 'mean'}. Best is trial 10 with value: 0.22370280050845212.
running
[I 2024-08-26 17:30:57,646] Trial 179 finished with value: 0.22370280050845212 and parameters: {'model_name': 'SimpleImputer', 'strategy': 'mean'}. Best is trial 10 with value: 0.22370280050845212.
running
[I 2024-08-26 17:30:57,837] Trial 181 finished with value: 0.22370280050845212 and parameters: {'model_name': 'SimpleImputer', 'strategy': 'mean'}. Best is trial 10 with value: 0.22370280050845212.
running
[I 2024-08-26 17:30:58,155] Trial 180 finished with value: 0.22370280050845212 and parameters: {'model_name': 'SimpleImputer', 'strategy': 'mean'}. Best is trial 10 with value: 0.22370280050845212.
running
[I 2024-08-26 17:30:58,331] Trial 184 finished with value: 0.22370280050845212 and parameters: {'model_name': 'SimpleImputer', 'strategy': 'mean'}. Best is trial 10 with value: 0.22370280050845212.
running
[I 2024-08-26 17:30:58,440] Trial 186 finished with value: 0.22370280050845212 and parameters: {'model_name': 'SimpleImputer', 'strategy': 'mean'}. Best is trial 10 with value: 0.22370280050845212.
running
[I 2024-08-26 17:30:58,440] Trial 182 finished with value: 0.22370280050845212 and parameters: {'model_name': 'SimpleImputer', 'strategy': 'mean'}. Best is trial 10 with value: 0.22370280050845212.
[I 2024-08-26 17:30:58,687] Trial 183 finished with value: 0.22370280050845212 and parameters: {'model_name': 'SimpleImputer', 'strategy': 'mean'}. Best is trial 10 with value: 0.22370280050845212.
[I 2024-08-26 17:30:58,793] Trial 185 finished with value: 0.22370280050845212 and parameters: {'model_name': 'SimpleImputer', 'strategy': 'mean'}. Best is trial 10 with value: 0.22370280050845212.
[I 2024-08-26 17:30:59,165] Trial 187 finished with value: 0.22370280050845212 and parameters: {'model_name': 'SimpleImputer', 'strategy': 'mean'}. Best is trial 10 with value: 0.22370280050845212.
[I 2024-08-26 17:30:59,269] Trial 190 finished with value: 0.22370280050845212 and parameters: {'model_name': 'SimpleImputer', 'strategy': 'mean'}. Best is trial 10 with value: 0.22370280050845212.
[I 2024-08-26 17:30:59,398] Trial 193 finished with value: 0.22370280050845212 and parameters: {'model_name': 'SimpleImputer', 'strategy': 'mean'}. Best is trial 10 with value: 0.22370280050845212.
[I 2024-08-26 17:30:59,518] Trial 188 finished with value: 0.22370280050845212 and parameters: {'model_name': 'SimpleImputer', 'strategy': 'mean'}. Best is trial 10 with value: 0.22370280050845212.
[I 2024-08-26 17:30:59,717] Trial 189 finished with value: 0.22370280050845212 and parameters: {'model_name': 'SimpleImputer', 'strategy': 'mean'}. Best is trial 10 with value: 0.22370280050845212.
[I 2024-08-26 17:30:59,836] Trial 195 finished with value: 0.22370280050845212 and parameters: {'model_name': 'SimpleImputer', 'strategy': 'mean'}. Best is trial 10 with value: 0.22370280050845212.
[I 2024-08-26 17:30:59,950] Trial 196 finished with value: 0.22370280050845212 and parameters: {'model_name': 'SimpleImputer', 'strategy': 'mean'}. Best is trial 10 with value: 0.22370280050845212.
[I 2024-08-26 17:31:00,051] Trial 192 finished with value: 0.22370280050845212 and parameters: {'model_name': 'SimpleImputer', 'strategy': 'mean'}. Best is trial 10 with value: 0.22370280050845212.
[I 2024-08-26 17:31:00,149] Trial 191 finished with value: 0.22370280050845212 and parameters: {'model_name': 'SimpleImputer', 'strategy': 'mean'}. Best is trial 10 with value: 0.22370280050845212.
[I 2024-08-26 17:31:00,251] Trial 194 finished with value: 0.22370280050845212 and parameters: {'model_name': 'SimpleImputer', 'strategy': 'mean'}. Best is trial 10 with value: 0.22370280050845212.
[I 2024-08-26 17:31:00,373] Trial 197 finished with value: 0.22370280050845212 and parameters: {'model_name': 'SimpleImputer', 'strategy': 'mean'}. Best is trial 10 with value: 0.22370280050845212.
[I 2024-08-26 17:31:00,473] Trial 198 finished with value: 0.22370280050845212 and parameters: {'model_name': 'SimpleImputer', 'strategy': 'mean'}. Best is trial 10 with value: 0.22370280050845212.
