Run: 40
/cm/local/apps/slurm/var/spool/job1042176/slurm_script: line 26: 
pip install -e tpot2
pip install -r tpot2/ImputerExperiments/requirements_.txt
: No such file or directory
RunStart
Version 0.1.7a0 of tpot2 is outdated. Version 0.1.8a0 was released Tuesday September 17, 2024.
starting loops
../data/c/1046/1046.pkl
working on 
../data/c/1046/class_simple_MCAR_0.5_2
0.9385819435119629
running experiment 1/3 - Does large hyperparameter space improve reconstruction accuracy over simple
[I 2024-11-06 05:53:17,657] A new study created in memory with name: no-name-242b0798-344c-4167-8d12-888f3ce25e2e
running
running
running
running
running
running
running
running
running
running
running
running
running
running
running
running
[I 2024-11-06 05:53:17,827] Trial 9 finished with value: 0.3572865821841743 and parameters: {'model_name': 'SimpleImputer', 'strategy': 'constant'}. Best is trial 9 with value: 0.3572865821841743.
[I 2024-11-06 05:53:17,923] Trial 0 finished with value: 0.3572865821841743 and parameters: {'model_name': 'SimpleImputer', 'strategy': 'constant'}. Best is trial 9 with value: 0.3572865821841743.
running
running
[I 2024-11-06 05:53:17,995] Trial 10 finished with value: 0.3572865821841743 and parameters: {'model_name': 'SimpleImputer', 'strategy': 'constant'}. Best is trial 9 with value: 0.3572865821841743.
running
[I 2024-11-06 05:53:18,075] Trial 11 finished with value: 0.3572865821841743 and parameters: {'model_name': 'SimpleImputer', 'strategy': 'constant'}. Best is trial 9 with value: 0.3572865821841743.
[I 2024-11-06 05:53:18,076] Trial 3 finished with value: 0.2612869777929152 and parameters: {'model_name': 'SimpleImputer', 'strategy': 'mean'}. Best is trial 3 with value: 0.2612869777929152.
[I 2024-11-06 05:53:18,077] Trial 4 finished with value: 0.3572865821841743 and parameters: {'model_name': 'SimpleImputer', 'strategy': 'constant'}. Best is trial 3 with value: 0.2612869777929152.
running
[I 2024-11-06 05:53:18,207] Trial 2 finished with value: 0.2612869777929152 and parameters: {'model_name': 'SimpleImputer', 'strategy': 'mean'}. Best is trial 3 with value: 0.2612869777929152.
running
[I 2024-11-06 05:53:18,209] Trial 14 finished with value: 0.3572865821841743 and parameters: {'model_name': 'SimpleImputer', 'strategy': 'constant'}. Best is trial 3 with value: 0.2612869777929152.
running
running
running
[I 2024-11-06 05:53:18,406] Trial 8 finished with value: 0.2612869777929152 and parameters: {'model_name': 'SimpleImputer', 'strategy': 'mean'}. Best is trial 3 with value: 0.2612869777929152.
running
[I 2024-11-06 05:53:18,476] Trial 7 finished with value: 0.2612869777929152 and parameters: {'model_name': 'SimpleImputer', 'strategy': 'mean'}. Best is trial 3 with value: 0.2612869777929152.
running
[I 2024-11-06 05:53:18,580] Trial 1 finished with value: 0.3566244763222259 and parameters: {'model_name': 'SimpleImputer', 'strategy': 'median'}. Best is trial 3 with value: 0.2612869777929152.
running
[I 2024-11-06 05:53:18,675] Trial 12 finished with value: 0.3566244763222259 and parameters: {'model_name': 'SimpleImputer', 'strategy': 'median'}. Best is trial 3 with value: 0.2612869777929152.
[I 2024-11-06 05:53:18,676] Trial 13 finished with value: 0.3566244763222259 and parameters: {'model_name': 'SimpleImputer', 'strategy': 'median'}. Best is trial 3 with value: 0.2612869777929152.
[I 2024-11-06 05:53:18,744] Trial 6 finished with value: 0.3566244763222259 and parameters: {'model_name': 'SimpleImputer', 'strategy': 'median'}. Best is trial 3 with value: 0.2612869777929152.
[I 2024-11-06 05:53:18,744] Trial 5 finished with value: 0.3566244763222259 and parameters: {'model_name': 'SimpleImputer', 'strategy': 'median'}. Best is trial 3 with value: 0.2612869777929152.
running
running
running
running
[I 2024-11-06 05:53:18,996] Trial 20 finished with value: 0.3572865821841743 and parameters: {'model_name': 'SimpleImputer', 'strategy': 'constant'}. Best is trial 3 with value: 0.2612869777929152.
running
[I 2024-11-06 05:53:19,094] Trial 17 finished with value: 0.2612869777929152 and parameters: {'model_name': 'SimpleImputer', 'strategy': 'mean'}. Best is trial 3 with value: 0.2612869777929152.
running
[I 2024-11-06 05:53:19,177] Trial 24 finished with value: 0.3572865821841743 and parameters: {'model_name': 'SimpleImputer', 'strategy': 'constant'}. Best is trial 3 with value: 0.2612869777929152.
running
[I 2024-11-06 05:53:19,252] Trial 15 finished with value: 0.3572865821841743 and parameters: {'model_name': 'SimpleImputer', 'strategy': 'most_frequent'}. Best is trial 3 with value: 0.2612869777929152.
running
[I 2024-11-06 05:53:19,327] Trial 18 finished with value: 0.2612869777929152 and parameters: {'model_name': 'SimpleImputer', 'strategy': 'mean'}. Best is trial 3 with value: 0.2612869777929152.
running
[I 2024-11-06 05:53:19,450] Trial 16 finished with value: 0.3566244763222259 and parameters: {'model_name': 'SimpleImputer', 'strategy': 'median'}. Best is trial 3 with value: 0.2612869777929152.
running
[I 2024-11-06 05:53:19,549] Trial 22 finished with value: 0.3566244763222259 and parameters: {'model_name': 'SimpleImputer', 'strategy': 'median'}. Best is trial 3 with value: 0.2612869777929152.
[I 2024-11-06 05:53:19,620] Trial 25 finished with value: 0.3566244763222259 and parameters: {'model_name': 'SimpleImputer', 'strategy': 'median'}. Best is trial 3 with value: 0.2612869777929152.
running
[I 2024-11-06 05:53:19,621] Trial 26 finished with value: 0.2612869777929152 and parameters: {'model_name': 'SimpleImputer', 'strategy': 'mean'}. Best is trial 3 with value: 0.2612869777929152.
running
running
[I 2024-11-06 05:53:19,842] Trial 19 finished with value: 0.3572865821841743 and parameters: {'model_name': 'SimpleImputer', 'strategy': 'most_frequent'}. Best is trial 3 with value: 0.2612869777929152.
[I 2024-11-06 05:53:19,842] Trial 23 finished with value: 0.3572865821841743 and parameters: {'model_name': 'SimpleImputer', 'strategy': 'most_frequent'}. Best is trial 3 with value: 0.2612869777929152.
running
running
[I 2024-11-06 05:53:20,005] Trial 21 finished with value: 0.3572865821841743 and parameters: {'model_name': 'SimpleImputer', 'strategy': 'most_frequent'}. Best is trial 3 with value: 0.2612869777929152.
running
[I 2024-11-06 05:53:20,122] Trial 34 finished with value: 0.2612869777929152 and parameters: {'model_name': 'SimpleImputer', 'strategy': 'mean'}. Best is trial 3 with value: 0.2612869777929152.
running
[I 2024-11-06 05:53:20,221] Trial 35 finished with value: 0.2612869777929152 and parameters: {'model_name': 'SimpleImputer', 'strategy': 'mean'}. Best is trial 3 with value: 0.2612869777929152.
running
[I 2024-11-06 05:53:20,323] Trial 27 finished with value: 0.3572865821841743 and parameters: {'model_name': 'SimpleImputer', 'strategy': 'most_frequent'}. Best is trial 3 with value: 0.2612869777929152.
[I 2024-11-06 05:53:20,412] Trial 29 finished with value: 0.3572865821841743 and parameters: {'model_name': 'SimpleImputer', 'strategy': 'most_frequent'}. Best is trial 3 with value: 0.2612869777929152.
running
running
[I 2024-11-06 05:53:20,504] Trial 28 finished with value: 0.3572865821841743 and parameters: {'model_name': 'SimpleImputer', 'strategy': 'most_frequent'}. Best is trial 3 with value: 0.2612869777929152.
running
[I 2024-11-06 05:53:20,604] Trial 30 finished with value: 0.3572865821841743 and parameters: {'model_name': 'SimpleImputer', 'strategy': 'most_frequent'}. Best is trial 3 with value: 0.2612869777929152.
[I 2024-11-06 05:53:20,696] Trial 37 finished with value: 0.2612869777929152 and parameters: {'model_name': 'SimpleImputer', 'strategy': 'mean'}. Best is trial 3 with value: 0.2612869777929152.
running
running
[I 2024-11-06 05:53:20,789] Trial 36 finished with value: 0.2612869777929152 and parameters: {'model_name': 'SimpleImputer', 'strategy': 'mean'}. Best is trial 3 with value: 0.2612869777929152.
[I 2024-11-06 05:53:20,870] Trial 38 finished with value: 0.2612869777929152 and parameters: {'model_name': 'SimpleImputer', 'strategy': 'mean'}. Best is trial 3 with value: 0.2612869777929152.
running
running
[I 2024-11-06 05:53:20,960] Trial 39 finished with value: 0.2612869777929152 and parameters: {'model_name': 'SimpleImputer', 'strategy': 'mean'}. Best is trial 3 with value: 0.2612869777929152.
running
[I 2024-11-06 05:53:21,057] Trial 31 finished with value: 0.3572865821841743 and parameters: {'model_name': 'SimpleImputer', 'strategy': 'most_frequent'}. Best is trial 3 with value: 0.2612869777929152.
running
[I 2024-11-06 05:53:21,183] Trial 33 finished with value: 0.3572865821841743 and parameters: {'model_name': 'SimpleImputer', 'strategy': 'most_frequent'}. Best is trial 3 with value: 0.2612869777929152.
[I 2024-11-06 05:53:21,288] Trial 32 finished with value: 0.3572865821841743 and parameters: {'model_name': 'SimpleImputer', 'strategy': 'most_frequent'}. Best is trial 3 with value: 0.2612869777929152.
running
running
[I 2024-11-06 05:53:21,389] Trial 41 finished with value: 0.2612869777929152 and parameters: {'model_name': 'SimpleImputer', 'strategy': 'mean'}. Best is trial 3 with value: 0.2612869777929152.
running
[I 2024-11-06 05:53:21,530] Trial 40 finished with value: 0.2612869777929152 and parameters: {'model_name': 'SimpleImputer', 'strategy': 'mean'}. Best is trial 3 with value: 0.2612869777929152.
[I 2024-11-06 05:53:21,629] Trial 42 finished with value: 0.2612869777929152 and parameters: {'model_name': 'SimpleImputer', 'strategy': 'mean'}. Best is trial 3 with value: 0.2612869777929152.
running
running
[I 2024-11-06 05:53:21,737] Trial 44 finished with value: 0.2612869777929152 and parameters: {'model_name': 'SimpleImputer', 'strategy': 'mean'}. Best is trial 3 with value: 0.2612869777929152.
running
[I 2024-11-06 05:53:21,824] Trial 43 finished with value: 0.2612869777929152 and parameters: {'model_name': 'SimpleImputer', 'strategy': 'mean'}. Best is trial 3 with value: 0.2612869777929152.
running
[I 2024-11-06 05:53:21,917] Trial 46 finished with value: 0.2612869777929152 and parameters: {'model_name': 'SimpleImputer', 'strategy': 'mean'}. Best is trial 3 with value: 0.2612869777929152.
[I 2024-11-06 05:53:21,988] Trial 45 finished with value: 0.2612869777929152 and parameters: {'model_name': 'SimpleImputer', 'strategy': 'mean'}. Best is trial 3 with value: 0.2612869777929152.
running
running
[I 2024-11-06 05:53:22,076] Trial 50 finished with value: 0.2612869777929152 and parameters: {'model_name': 'SimpleImputer', 'strategy': 'mean'}. Best is trial 3 with value: 0.2612869777929152.
[I 2024-11-06 05:53:22,144] Trial 48 finished with value: 0.2612869777929152 and parameters: {'model_name': 'SimpleImputer', 'strategy': 'mean'}. Best is trial 3 with value: 0.2612869777929152.
running
running
[I 2024-11-06 05:53:22,211] Trial 47 finished with value: 0.2612869777929152 and parameters: {'model_name': 'SimpleImputer', 'strategy': 'mean'}. Best is trial 3 with value: 0.2612869777929152.
running
[I 2024-11-06 05:53:22,290] Trial 51 finished with value: 0.2612869777929152 and parameters: {'model_name': 'SimpleImputer', 'strategy': 'mean'}. Best is trial 3 with value: 0.2612869777929152.
running
[I 2024-11-06 05:53:22,358] Trial 52 finished with value: 0.2612869777929152 and parameters: {'model_name': 'SimpleImputer', 'strategy': 'mean'}. Best is trial 3 with value: 0.2612869777929152.
[I 2024-11-06 05:53:22,424] Trial 49 finished with value: 0.2612869777929152 and parameters: {'model_name': 'SimpleImputer', 'strategy': 'mean'}. Best is trial 3 with value: 0.2612869777929152.
running
running
[I 2024-11-06 05:53:22,506] Trial 53 finished with value: 0.2612869777929152 and parameters: {'model_name': 'SimpleImputer', 'strategy': 'mean'}. Best is trial 3 with value: 0.2612869777929152.
running
[I 2024-11-06 05:53:22,593] Trial 54 finished with value: 0.2612869777929152 and parameters: {'model_name': 'SimpleImputer', 'strategy': 'mean'}. Best is trial 3 with value: 0.2612869777929152.
running
[I 2024-11-06 05:53:22,682] Trial 55 finished with value: 0.2612869777929152 and parameters: {'model_name': 'SimpleImputer', 'strategy': 'mean'}. Best is trial 3 with value: 0.2612869777929152.
running
[I 2024-11-06 05:53:22,760] Trial 56 finished with value: 0.2612869777929152 and parameters: {'model_name': 'SimpleImputer', 'strategy': 'mean'}. Best is trial 3 with value: 0.2612869777929152.
running
[I 2024-11-06 05:53:22,865] Trial 57 finished with value: 0.2612869777929152 and parameters: {'model_name': 'SimpleImputer', 'strategy': 'mean'}. Best is trial 3 with value: 0.2612869777929152.
running
[I 2024-11-06 05:53:22,967] Trial 58 finished with value: 0.2612869777929152 and parameters: {'model_name': 'SimpleImputer', 'strategy': 'mean'}. Best is trial 3 with value: 0.2612869777929152.
running
[I 2024-11-06 05:53:23,051] Trial 59 finished with value: 0.2612869777929152 and parameters: {'model_name': 'SimpleImputer', 'strategy': 'mean'}. Best is trial 3 with value: 0.2612869777929152.
running
[I 2024-11-06 05:53:23,144] Trial 61 finished with value: 0.2612869777929152 and parameters: {'model_name': 'SimpleImputer', 'strategy': 'mean'}. Best is trial 3 with value: 0.2612869777929152.
running
[I 2024-11-06 05:53:23,222] Trial 60 finished with value: 0.2612869777929152 and parameters: {'model_name': 'SimpleImputer', 'strategy': 'mean'}. Best is trial 3 with value: 0.2612869777929152.
running
[I 2024-11-06 05:53:23,312] Trial 63 finished with value: 0.2612869777929152 and parameters: {'model_name': 'SimpleImputer', 'strategy': 'mean'}. Best is trial 3 with value: 0.2612869777929152.
[I 2024-11-06 05:53:23,386] Trial 62 finished with value: 0.2612869777929152 and parameters: {'model_name': 'SimpleImputer', 'strategy': 'mean'}. Best is trial 3 with value: 0.2612869777929152.
running
running
[I 2024-11-06 05:53:23,467] Trial 65 finished with value: 0.2612869777929152 and parameters: {'model_name': 'SimpleImputer', 'strategy': 'mean'}. Best is trial 3 with value: 0.2612869777929152.
[I 2024-11-06 05:53:23,533] Trial 70 finished with value: 0.3572865821841743 and parameters: {'model_name': 'SimpleImputer', 'strategy': 'constant'}. Best is trial 3 with value: 0.2612869777929152.
running
[I 2024-11-06 05:53:23,601] Trial 66 finished with value: 0.2612869777929152 and parameters: {'model_name': 'SimpleImputer', 'strategy': 'mean'}. Best is trial 3 with value: 0.2612869777929152.
running
[I 2024-11-06 05:53:23,677] Trial 64 finished with value: 0.2612869777929152 and parameters: {'model_name': 'SimpleImputer', 'strategy': 'mean'}. Best is trial 3 with value: 0.2612869777929152.
running
running
[I 2024-11-06 05:53:23,782] Trial 67 finished with value: 0.2612869777929152 and parameters: {'model_name': 'SimpleImputer', 'strategy': 'mean'}. Best is trial 3 with value: 0.2612869777929152.
[I 2024-11-06 05:53:23,850] Trial 68 finished with value: 0.2612869777929152 and parameters: {'model_name': 'SimpleImputer', 'strategy': 'mean'}. Best is trial 3 with value: 0.2612869777929152.
running
[I 2024-11-06 05:53:23,918] Trial 69 finished with value: 0.2612869777929152 and parameters: {'model_name': 'SimpleImputer', 'strategy': 'mean'}. Best is trial 3 with value: 0.2612869777929152.
running
running
[I 2024-11-06 05:53:23,994] Trial 71 finished with value: 0.3572865821841743 and parameters: {'model_name': 'SimpleImputer', 'strategy': 'constant'}. Best is trial 3 with value: 0.2612869777929152.
running
[I 2024-11-06 05:53:24,096] Trial 72 finished with value: 0.3572865821841743 and parameters: {'model_name': 'SimpleImputer', 'strategy': 'constant'}. Best is trial 3 with value: 0.2612869777929152.
running
[I 2024-11-06 05:53:24,242] Trial 73 finished with value: 0.3572865821841743 and parameters: {'model_name': 'SimpleImputer', 'strategy': 'constant'}. Best is trial 3 with value: 0.2612869777929152.
[I 2024-11-06 05:53:24,243] Trial 74 finished with value: 0.3572865821841743 and parameters: {'model_name': 'SimpleImputer', 'strategy': 'constant'}. Best is trial 3 with value: 0.2612869777929152.
running
running
[I 2024-11-06 05:53:24,445] Trial 75 finished with value: 0.3572865821841743 and parameters: {'model_name': 'SimpleImputer', 'strategy': 'constant'}. Best is trial 3 with value: 0.2612869777929152.
running
[I 2024-11-06 05:53:24,571] Trial 77 finished with value: 0.3572865821841743 and parameters: {'model_name': 'SimpleImputer', 'strategy': 'constant'}. Best is trial 3 with value: 0.2612869777929152.
running
[I 2024-11-06 05:53:24,682] Trial 76 finished with value: 0.3572865821841743 and parameters: {'model_name': 'SimpleImputer', 'strategy': 'constant'}. Best is trial 3 with value: 0.2612869777929152.
running
[I 2024-11-06 05:53:24,790] Trial 79 finished with value: 0.3572865821841743 and parameters: {'model_name': 'SimpleImputer', 'strategy': 'constant'}. Best is trial 3 with value: 0.2612869777929152.
[I 2024-11-06 05:53:24,881] Trial 78 finished with value: 0.3572865821841743 and parameters: {'model_name': 'SimpleImputer', 'strategy': 'constant'}. Best is trial 3 with value: 0.2612869777929152.
running
running
[I 2024-11-06 05:53:24,988] Trial 80 finished with value: 0.3572865821841743 and parameters: {'model_name': 'SimpleImputer', 'strategy': 'constant'}. Best is trial 3 with value: 0.2612869777929152.
running
[I 2024-11-06 05:53:25,083] Trial 85 finished with value: 0.3572865821841743 and parameters: {'model_name': 'SimpleImputer', 'strategy': 'constant'}. Best is trial 3 with value: 0.2612869777929152.
running
[I 2024-11-06 05:53:25,218] Trial 81 finished with value: 0.3566244763222259 and parameters: {'model_name': 'SimpleImputer', 'strategy': 'median'}. Best is trial 3 with value: 0.2612869777929152.
running
[I 2024-11-06 05:53:25,343] Trial 86 finished with value: 0.3566244763222259 and parameters: {'model_name': 'SimpleImputer', 'strategy': 'median'}. Best is trial 3 with value: 0.2612869777929152.
running
[I 2024-11-06 05:53:25,444] Trial 84 finished with value: 0.3566244763222259 and parameters: {'model_name': 'SimpleImputer', 'strategy': 'median'}. Best is trial 3 with value: 0.2612869777929152.
[I 2024-11-06 05:53:25,525] Trial 82 finished with value: 0.3566244763222259 and parameters: {'model_name': 'SimpleImputer', 'strategy': 'median'}. Best is trial 3 with value: 0.2612869777929152.
running
running
[I 2024-11-06 05:53:25,615] Trial 87 finished with value: 0.3566244763222259 and parameters: {'model_name': 'SimpleImputer', 'strategy': 'median'}. Best is trial 3 with value: 0.2612869777929152.
[I 2024-11-06 05:53:25,689] Trial 83 finished with value: 0.3566244763222259 and parameters: {'model_name': 'SimpleImputer', 'strategy': 'median'}. Best is trial 3 with value: 0.2612869777929152.
[I 2024-11-06 05:53:25,752] Trial 88 finished with value: 0.3566244763222259 and parameters: {'model_name': 'SimpleImputer', 'strategy': 'median'}. Best is trial 3 with value: 0.2612869777929152.
running
running
running
[I 2024-11-06 05:53:25,842] Trial 89 finished with value: 0.2612869777929152 and parameters: {'model_name': 'SimpleImputer', 'strategy': 'mean'}. Best is trial 3 with value: 0.2612869777929152.
running
[I 2024-11-06 05:53:25,958] Trial 90 finished with value: 0.3566244763222259 and parameters: {'model_name': 'SimpleImputer', 'strategy': 'median'}. Best is trial 3 with value: 0.2612869777929152.
running
[I 2024-11-06 05:53:26,060] Trial 91 finished with value: 0.3566244763222259 and parameters: {'model_name': 'SimpleImputer', 'strategy': 'median'}. Best is trial 3 with value: 0.2612869777929152.
[I 2024-11-06 05:53:26,139] Trial 95 finished with value: 0.2612869777929152 and parameters: {'model_name': 'SimpleImputer', 'strategy': 'mean'}. Best is trial 3 with value: 0.2612869777929152.
running
running
[I 2024-11-06 05:53:26,220] Trial 92 finished with value: 0.3566244763222259 and parameters: {'model_name': 'SimpleImputer', 'strategy': 'median'}. Best is trial 3 with value: 0.2612869777929152.
running
[I 2024-11-06 05:53:26,304] Trial 97 finished with value: 0.2612869777929152 and parameters: {'model_name': 'SimpleImputer', 'strategy': 'mean'}. Best is trial 3 with value: 0.2612869777929152.
[I 2024-11-06 05:53:26,372] Trial 94 finished with value: 0.3566244763222259 and parameters: {'model_name': 'SimpleImputer', 'strategy': 'median'}. Best is trial 3 with value: 0.2612869777929152.
running
running
[I 2024-11-06 05:53:26,466] Trial 96 finished with value: 0.3566244763222259 and parameters: {'model_name': 'SimpleImputer', 'strategy': 'median'}. Best is trial 3 with value: 0.2612869777929152.
[I 2024-11-06 05:53:26,542] Trial 93 finished with value: 0.3566244763222259 and parameters: {'model_name': 'SimpleImputer', 'strategy': 'median'}. Best is trial 3 with value: 0.2612869777929152.
running
running
[I 2024-11-06 05:53:26,625] Trial 99 finished with value: 0.2612869777929152 and parameters: {'model_name': 'SimpleImputer', 'strategy': 'mean'}. Best is trial 3 with value: 0.2612869777929152.
running
[I 2024-11-06 05:53:26,731] Trial 101 finished with value: 0.2612869777929152 and parameters: {'model_name': 'SimpleImputer', 'strategy': 'mean'}. Best is trial 3 with value: 0.2612869777929152.
[I 2024-11-06 05:53:26,812] Trial 102 finished with value: 0.2612869777929152 and parameters: {'model_name': 'SimpleImputer', 'strategy': 'mean'}. Best is trial 3 with value: 0.2612869777929152.
running
running
[I 2024-11-06 05:53:26,889] Trial 100 finished with value: 0.2612869777929152 and parameters: {'model_name': 'SimpleImputer', 'strategy': 'mean'}. Best is trial 3 with value: 0.2612869777929152.
running
[I 2024-11-06 05:53:26,992] Trial 103 finished with value: 0.2612869777929152 and parameters: {'model_name': 'SimpleImputer', 'strategy': 'mean'}. Best is trial 3 with value: 0.2612869777929152.
[I 2024-11-06 05:53:27,057] Trial 104 finished with value: 0.2612869777929152 and parameters: {'model_name': 'SimpleImputer', 'strategy': 'mean'}. Best is trial 3 with value: 0.2612869777929152.
