[I 2024-11-23 05:52:23,819] Trial 156 finished with value: 0.22185165125249018 and parameters: {'model_name': 'IterativeImputer', 'estimator': 'RFR', 'initial_strategy': 'mean', 'n_nearest_features': 2, 'imputation_order': 'ascending'}. Best is trial 79 with value: 0.21719188260236483.
running
[I 2024-11-23 05:53:19,697] Trial 157 finished with value: 0.22264787991294357 and parameters: {'model_name': 'IterativeImputer', 'estimator': 'RFR', 'initial_strategy': 'mean', 'n_nearest_features': 2, 'imputation_order': 'ascending'}. Best is trial 79 with value: 0.21719188260236483.
running
[I 2024-11-23 05:55:43,810] Trial 160 finished with value: 0.21970190348794053 and parameters: {'model_name': 'IterativeImputer', 'estimator': 'RFR', 'initial_strategy': 'mean', 'n_nearest_features': 2, 'imputation_order': 'roman'}. Best is trial 79 with value: 0.21719188260236483.
running
[I 2024-11-23 05:56:04,248] Trial 161 finished with value: 0.22208882466155208 and parameters: {'model_name': 'IterativeImputer', 'estimator': 'RFR', 'initial_strategy': 'median', 'n_nearest_features': 2, 'imputation_order': 'descending'}. Best is trial 79 with value: 0.21719188260236483.
running
[I 2024-11-23 05:56:16,738] Trial 162 finished with value: 0.2222227469235401 and parameters: {'model_name': 'IterativeImputer', 'estimator': 'RFR', 'initial_strategy': 'mean', 'n_nearest_features': 2, 'imputation_order': 'ascending'}. Best is trial 79 with value: 0.21719188260236483.
running
[I 2024-11-23 05:57:00,840] Trial 167 finished with value: 0.22173991314299718 and parameters: {'model_name': 'IterativeImputer', 'estimator': 'RFR', 'initial_strategy': 'median', 'n_nearest_features': 2, 'imputation_order': 'ascending'}. Best is trial 79 with value: 0.21719188260236483.
running
[I 2024-11-23 05:57:05,868] Trial 181 finished with value: 0.24497879439596804 and parameters: {'model_name': 'IterativeImputer', 'estimator': 'Bayesian', 'initial_strategy': 'median', 'n_nearest_features': 4, 'imputation_order': 'arabic', 'sample_posterior': False}. Best is trial 79 with value: 0.21719188260236483.
running
[I 2024-11-23 05:57:08,803] Trial 169 finished with value: 0.22205382282601444 and parameters: {'model_name': 'IterativeImputer', 'estimator': 'RFR', 'initial_strategy': 'median', 'n_nearest_features': 2, 'imputation_order': 'ascending'}. Best is trial 79 with value: 0.21719188260236483.
running
[I 2024-11-23 05:57:09,043] Trial 183 finished with value: inf and parameters: {'model_name': 'VAE', 'batch_size': 5, 'iterations': 131, 'learning_rate': 0.0049550535144774355, 'p_miss': 0.07910450915407105}. Best is trial 79 with value: 0.21719188260236483.
running
[I 2024-11-23 05:57:11,994] Trial 168 finished with value: 0.22306663292345935 and parameters: {'model_name': 'IterativeImputer', 'estimator': 'RFR', 'initial_strategy': 'median', 'n_nearest_features': 2, 'imputation_order': 'ascending'}. Best is trial 79 with value: 0.21719188260236483.
running
[I 2024-11-23 05:57:12,318] Trial 166 finished with value: 0.22289204959214656 and parameters: {'model_name': 'IterativeImputer', 'estimator': 'RFR', 'initial_strategy': 'median', 'n_nearest_features': 2, 'imputation_order': 'ascending'}. Best is trial 79 with value: 0.21719188260236483.
running
[I 2024-11-23 05:57:12,493] Trial 185 finished with value: 0.4196034410582511 and parameters: {'model_name': 'SimpleImputer', 'strategy': 'most_frequent'}. Best is trial 79 with value: 0.21719188260236483.
running
[I 2024-11-23 05:57:16,192] Trial 170 finished with value: 0.22196528978658608 and parameters: {'model_name': 'IterativeImputer', 'estimator': 'RFR', 'initial_strategy': 'median', 'n_nearest_features': 2, 'imputation_order': 'ascending'}. Best is trial 79 with value: 0.21719188260236483.
running
[I 2024-11-23 05:57:33,468] Trial 172 finished with value: 0.22244293534882204 and parameters: {'model_name': 'IterativeImputer', 'estimator': 'RFR', 'initial_strategy': 'median', 'n_nearest_features': 2, 'imputation_order': 'ascending'}. Best is trial 79 with value: 0.21719188260236483.
running
[I 2024-11-23 05:57:55,452] Trial 158 finished with value: 0.21806144798981758 and parameters: {'model_name': 'IterativeImputer', 'estimator': 'RFR', 'initial_strategy': 'mean', 'n_nearest_features': 3, 'imputation_order': 'ascending'}. Best is trial 79 with value: 0.21719188260236483.
running
[I 2024-11-23 06:01:15,865] Trial 171 finished with value: 0.21620126468274609 and parameters: {'model_name': 'IterativeImputer', 'estimator': 'RFR', 'initial_strategy': 'median', 'n_nearest_features': 4, 'imputation_order': 'ascending'}. Best is trial 171 with value: 0.21620126468274609.
running
[I 2024-11-23 06:02:25,494] Trial 173 finished with value: 0.22197359559924873 and parameters: {'model_name': 'IterativeImputer', 'estimator': 'RFR', 'initial_strategy': 'median', 'n_nearest_features': 2, 'imputation_order': 'ascending'}. Best is trial 171 with value: 0.21620126468274609.
running
[I 2024-11-23 06:10:51,544] Trial 175 finished with value: 0.22139250118228837 and parameters: {'model_name': 'IterativeImputer', 'estimator': 'RFR', 'initial_strategy': 'median', 'n_nearest_features': 2, 'imputation_order': 'ascending'}. Best is trial 171 with value: 0.21620126468274609.
running
[I 2024-11-23 06:10:54,091] Trial 174 finished with value: 0.22135963494897942 and parameters: {'model_name': 'IterativeImputer', 'estimator': 'RFR', 'initial_strategy': 'median', 'n_nearest_features': 2, 'imputation_order': 'ascending'}. Best is trial 171 with value: 0.21620126468274609.
running
[I 2024-11-23 06:11:43,653] Trial 177 finished with value: 0.2189615778819672 and parameters: {'model_name': 'IterativeImputer', 'estimator': 'RFR', 'initial_strategy': 'median', 'n_nearest_features': 2, 'imputation_order': 'roman'}. Best is trial 171 with value: 0.21620126468274609.
running
[I 2024-11-23 06:14:33,627] Trial 178 finished with value: 0.22258391790142706 and parameters: {'model_name': 'IterativeImputer', 'estimator': 'RFR', 'initial_strategy': 'median', 'n_nearest_features': 2, 'imputation_order': 'arabic'}. Best is trial 171 with value: 0.21620126468274609.
running
[I 2024-11-23 06:14:50,637] Trial 179 finished with value: 0.22205785852205745 and parameters: {'model_name': 'IterativeImputer', 'estimator': 'RFR', 'initial_strategy': 'median', 'n_nearest_features': 2, 'imputation_order': 'arabic'}. Best is trial 171 with value: 0.21620126468274609.
running
[I 2024-11-23 06:14:54,013] Trial 176 finished with value: 0.21646730758073365 and parameters: {'model_name': 'IterativeImputer', 'estimator': 'RFR', 'initial_strategy': 'median', 'n_nearest_features': 4, 'imputation_order': 'roman'}. Best is trial 171 with value: 0.21620126468274609.
running
[I 2024-11-23 06:15:07,008] Trial 180 finished with value: 0.22212214332574137 and parameters: {'model_name': 'IterativeImputer', 'estimator': 'RFR', 'initial_strategy': 'median', 'n_nearest_features': 2, 'imputation_order': 'arabic'}. Best is trial 171 with value: 0.21620126468274609.
running
[I 2024-11-23 06:15:40,283] Trial 188 finished with value: 0.219348870550813 and parameters: {'model_name': 'IterativeImputer', 'estimator': 'RFR', 'initial_strategy': 'constant', 'n_nearest_features': 2, 'imputation_order': 'arabic'}. Best is trial 171 with value: 0.21620126468274609.
[I 2024-11-23 06:15:46,635] Trial 187 finished with value: 0.21918877328404168 and parameters: {'model_name': 'IterativeImputer', 'estimator': 'RFR', 'initial_strategy': 'constant', 'n_nearest_features': 2, 'imputation_order': 'arabic'}. Best is trial 171 with value: 0.21620126468274609.
[I 2024-11-23 06:16:00,263] Trial 189 finished with value: 0.21871726805144975 and parameters: {'model_name': 'IterativeImputer', 'estimator': 'RFR', 'initial_strategy': 'constant', 'n_nearest_features': 2, 'imputation_order': 'arabic'}. Best is trial 171 with value: 0.21620126468274609.
[I 2024-11-23 06:16:03,999] Trial 182 finished with value: 0.22232861377031554 and parameters: {'model_name': 'IterativeImputer', 'estimator': 'RFR', 'initial_strategy': 'median', 'n_nearest_features': 2, 'imputation_order': 'arabic'}. Best is trial 171 with value: 0.21620126468274609.
[I 2024-11-23 06:16:08,933] Trial 184 finished with value: 0.21842155922203985 and parameters: {'model_name': 'IterativeImputer', 'estimator': 'RFR', 'initial_strategy': 'median', 'n_nearest_features': 2, 'imputation_order': 'random'}. Best is trial 171 with value: 0.21620126468274609.
[I 2024-11-23 06:19:35,899] Trial 186 finished with value: 0.22988786093636646 and parameters: {'model_name': 'IterativeImputer', 'estimator': 'RFR', 'initial_strategy': 'constant', 'n_nearest_features': 3, 'imputation_order': 'arabic'}. Best is trial 171 with value: 0.21620126468274609.
[I 2024-11-23 06:20:17,771] Trial 190 finished with value: 0.21636726785384205 and parameters: {'model_name': 'IterativeImputer', 'estimator': 'RFR', 'initial_strategy': 'median', 'n_nearest_features': 3, 'imputation_order': 'random'}. Best is trial 171 with value: 0.21620126468274609.
[I 2024-11-23 06:23:26,981] Trial 191 finished with value: 0.21590439587430316 and parameters: {'model_name': 'IterativeImputer', 'estimator': 'RFR', 'initial_strategy': 'median', 'n_nearest_features': 4, 'imputation_order': 'random'}. Best is trial 191 with value: 0.21590439587430316.
[I 2024-11-23 06:24:42,017] Trial 192 finished with value: 0.21676976000394355 and parameters: {'model_name': 'IterativeImputer', 'estimator': 'RFR', 'initial_strategy': 'median', 'n_nearest_features': 3, 'imputation_order': 'random'}. Best is trial 191 with value: 0.21590439587430316.
[I 2024-11-23 06:32:44,053] Trial 193 finished with value: 0.21574897698711828 and parameters: {'model_name': 'IterativeImputer', 'estimator': 'RFR', 'initial_strategy': 'median', 'n_nearest_features': 4, 'imputation_order': 'random'}. Best is trial 193 with value: 0.21574897698711828.
[I 2024-11-23 06:32:55,402] Trial 194 finished with value: 0.2165042938661772 and parameters: {'model_name': 'IterativeImputer', 'estimator': 'RFR', 'initial_strategy': 'median', 'n_nearest_features': 3, 'imputation_order': 'random'}. Best is trial 193 with value: 0.21574897698711828.
[I 2024-11-23 06:33:38,674] Trial 195 finished with value: 0.2159565822835332 and parameters: {'model_name': 'IterativeImputer', 'estimator': 'RFR', 'initial_strategy': 'median', 'n_nearest_features': 3, 'imputation_order': 'roman'}. Best is trial 193 with value: 0.21574897698711828.
[I 2024-11-23 06:36:24,423] Trial 196 finished with value: 0.21627107978793805 and parameters: {'model_name': 'IterativeImputer', 'estimator': 'RFR', 'initial_strategy': 'median', 'n_nearest_features': 4, 'imputation_order': 'roman'}. Best is trial 193 with value: 0.21574897698711828.
[I 2024-11-23 06:36:39,596] Trial 197 finished with value: 0.2163164160989115 and parameters: {'model_name': 'IterativeImputer', 'estimator': 'RFR', 'initial_strategy': 'median', 'n_nearest_features': 3, 'imputation_order': 'random'}. Best is trial 193 with value: 0.21574897698711828.
[I 2024-11-23 06:36:45,399] Trial 198 finished with value: 0.21662134800030297 and parameters: {'model_name': 'IterativeImputer', 'estimator': 'RFR', 'initial_strategy': 'median', 'n_nearest_features': 4, 'imputation_order': 'roman'}. Best is trial 193 with value: 0.21574897698711828.
