[I 2024-11-24 16:56:24,998] Trial 102 finished with value: 0.43724576911834967 and parameters: {'model_name': 'SimpleImputer', 'strategy': 'most_frequent'}. Best is trial 24 with value: 0.08405233435168191.
running
[I 2024-11-24 16:56:26,121] Trial 103 finished with value: 0.08405233435168191 and parameters: {'model_name': 'SimpleImputer', 'strategy': 'median'}. Best is trial 24 with value: 0.08405233435168191.
running
[I 2024-11-24 16:56:26,860] Trial 104 finished with value: 0.43724576911834967 and parameters: {'model_name': 'SimpleImputer', 'strategy': 'constant'}. Best is trial 24 with value: 0.08405233435168191.
running
[I 2024-11-24 17:32:28,166] Trial 41 finished with value: 0.16694468567807755 and parameters: {'model_name': 'VAE', 'batch_size': 612, 'iterations': 3604, 'learning_rate': 0.007937831243090877, 'p_miss': 0.05309021463915242}. Best is trial 24 with value: 0.08405233435168191.
running
[I 2024-11-24 17:32:29,255] Trial 106 finished with value: 0.08405233435168191 and parameters: {'model_name': 'SimpleImputer', 'strategy': 'median'}. Best is trial 24 with value: 0.08405233435168191.
running
[I 2024-11-24 17:32:30,415] Trial 107 finished with value: 0.08405233435168191 and parameters: {'model_name': 'SimpleImputer', 'strategy': 'median'}. Best is trial 24 with value: 0.08405233435168191.
running
[I 2024-11-24 17:32:31,400] Trial 108 finished with value: 0.08405233435168191 and parameters: {'model_name': 'SimpleImputer', 'strategy': 'median'}. Best is trial 24 with value: 0.08405233435168191.
running
[I 2024-11-24 17:32:32,556] Trial 109 finished with value: 0.08405233435168191 and parameters: {'model_name': 'SimpleImputer', 'strategy': 'median'}. Best is trial 24 with value: 0.08405233435168191.
running
[I 2024-11-24 17:57:00,538] Trial 71 finished with value: 0.1580590956797972 and parameters: {'model_name': 'IterativeImputer', 'estimator': 'RFR', 'initial_strategy': 'most_frequent', 'n_nearest_features': 6, 'imputation_order': 'ascending'}. Best is trial 24 with value: 0.08405233435168191.
running
[I 2024-11-24 17:58:22,163] Trial 38 finished with value: 0.16672235996401136 and parameters: {'model_name': 'VAE', 'batch_size': 632, 'iterations': 4176, 'learning_rate': 0.012115375945195099, 'p_miss': 0.013381465876650851}. Best is trial 24 with value: 0.08405233435168191.
running
[I 2024-11-24 18:02:30,326] Trial 111 finished with value: 0.41342638695414935 and parameters: {'model_name': 'GAIN', 'batch_size': 53, 'hint_rate': 0.4609673084428823, 'alpha': 36, 'iterations': 291, 'learning_rate': 0.041003396400112, 'p_miss': 0.11690051019443443}. Best is trial 24 with value: 0.08405233435168191.
running
[I 2024-11-24 18:02:31,474] Trial 113 finished with value: 0.08405233435168191 and parameters: {'model_name': 'SimpleImputer', 'strategy': 'median'}. Best is trial 24 with value: 0.08405233435168191.
running
[I 2024-11-24 18:02:32,508] Trial 114 finished with value: 0.08405233435168191 and parameters: {'model_name': 'SimpleImputer', 'strategy': 'median'}. Best is trial 24 with value: 0.08405233435168191.
running
[I 2024-11-24 18:02:33,730] Trial 115 finished with value: 0.08405233435168191 and parameters: {'model_name': 'SimpleImputer', 'strategy': 'median'}. Best is trial 24 with value: 0.08405233435168191.
running
[I 2024-11-24 18:02:34,857] Trial 116 finished with value: 0.08405233435168191 and parameters: {'model_name': 'SimpleImputer', 'strategy': 'median'}. Best is trial 24 with value: 0.08405233435168191.
running
[I 2024-11-24 18:02:35,972] Trial 117 finished with value: 0.08405233435168191 and parameters: {'model_name': 'SimpleImputer', 'strategy': 'median'}. Best is trial 24 with value: 0.08405233435168191.
running
[I 2024-11-24 18:02:36,858] Trial 118 finished with value: 0.08405233435168191 and parameters: {'model_name': 'SimpleImputer', 'strategy': 'median'}. Best is trial 24 with value: 0.08405233435168191.
running
[I 2024-11-24 18:02:37,692] Trial 119 finished with value: 0.1543014748757539 and parameters: {'model_name': 'SimpleImputer', 'strategy': 'mean'}. Best is trial 24 with value: 0.08405233435168191.
running
[I 2024-11-24 18:02:38,801] Trial 120 finished with value: 0.08405233435168191 and parameters: {'model_name': 'SimpleImputer', 'strategy': 'median'}. Best is trial 24 with value: 0.08405233435168191.
running
[I 2024-11-24 18:02:39,824] Trial 121 finished with value: 0.08405233435168191 and parameters: {'model_name': 'SimpleImputer', 'strategy': 'median'}. Best is trial 24 with value: 0.08405233435168191.
running
[I 2024-11-24 18:02:41,035] Trial 122 finished with value: 0.08405233435168191 and parameters: {'model_name': 'SimpleImputer', 'strategy': 'median'}. Best is trial 24 with value: 0.08405233435168191.
running
[I 2024-11-24 18:02:42,243] Trial 123 finished with value: 0.08405233435168191 and parameters: {'model_name': 'SimpleImputer', 'strategy': 'median'}. Best is trial 24 with value: 0.08405233435168191.
running
[I 2024-11-24 18:02:43,312] Trial 124 finished with value: 0.08405233435168191 and parameters: {'model_name': 'SimpleImputer', 'strategy': 'median'}. Best is trial 24 with value: 0.08405233435168191.
running
[I 2024-11-24 18:18:59,290] Trial 72 finished with value: 0.15790642199929586 and parameters: {'model_name': 'IterativeImputer', 'estimator': 'RFR', 'initial_strategy': 'most_frequent', 'n_nearest_features': 6, 'imputation_order': 'roman'}. Best is trial 24 with value: 0.08405233435168191.
running
[I 2024-11-24 18:19:00,603] Trial 126 finished with value: 0.08405233435168191 and parameters: {'model_name': 'SimpleImputer', 'strategy': 'median'}. Best is trial 24 with value: 0.08405233435168191.
running
[I 2024-11-24 18:19:01,843] Trial 127 finished with value: 0.08405233435168191 and parameters: {'model_name': 'SimpleImputer', 'strategy': 'median'}. Best is trial 24 with value: 0.08405233435168191.
running
[I 2024-11-24 18:19:02,922] Trial 128 finished with value: 0.08405233435168191 and parameters: {'model_name': 'SimpleImputer', 'strategy': 'median'}. Best is trial 24 with value: 0.08405233435168191.
running
[I 2024-11-24 18:19:04,128] Trial 129 finished with value: 0.08405233435168191 and parameters: {'model_name': 'SimpleImputer', 'strategy': 'median'}. Best is trial 24 with value: 0.08405233435168191.
running
[I 2024-11-24 18:36:06,206] Trial 125 finished with value: inf and parameters: {'model_name': 'GAIN', 'batch_size': 3, 'hint_rate': 0.014077213321361082, 'alpha': 70, 'iterations': 9070, 'learning_rate': 0.00025944704801614477, 'p_miss': 0.1336066045656622}. Best is trial 24 with value: 0.08405233435168191.
running
[I 2024-11-24 18:36:07,387] Trial 131 finished with value: 0.08405233435168191 and parameters: {'model_name': 'SimpleImputer', 'strategy': 'median'}. Best is trial 24 with value: 0.08405233435168191.
running
[I 2024-11-24 18:36:08,509] Trial 132 finished with value: 0.08405233435168191 and parameters: {'model_name': 'SimpleImputer', 'strategy': 'median'}. Best is trial 24 with value: 0.08405233435168191.
running
[I 2024-11-24 18:37:14,552] Trial 133 finished with value: 0.15311915970379328 and parameters: {'model_name': 'KNNImputer', 'n_neighbors': 23999, 'weights': 'uniform'}. Best is trial 24 with value: 0.08405233435168191.
running
[I 2024-11-24 18:37:16,236] Trial 134 finished with value: 0.43724576911834967 and parameters: {'model_name': 'SimpleImputer', 'strategy': 'most_frequent'}. Best is trial 24 with value: 0.08405233435168191.
running
[I 2024-11-24 18:37:17,370] Trial 135 finished with value: 0.08405233435168191 and parameters: {'model_name': 'SimpleImputer', 'strategy': 'median'}. Best is trial 24 with value: 0.08405233435168191.
running
[I 2024-11-24 18:37:18,424] Trial 136 finished with value: 0.08405233435168191 and parameters: {'model_name': 'SimpleImputer', 'strategy': 'median'}. Best is trial 24 with value: 0.08405233435168191.
running
[I 2024-11-24 18:37:19,533] Trial 137 finished with value: 0.08405233435168191 and parameters: {'model_name': 'SimpleImputer', 'strategy': 'median'}. Best is trial 24 with value: 0.08405233435168191.
running
[I 2024-11-24 18:37:20,242] Trial 138 finished with value: 0.43724576911834967 and parameters: {'model_name': 'SimpleImputer', 'strategy': 'constant'}. Best is trial 24 with value: 0.08405233435168191.
running
[I 2024-11-24 18:38:02,559] Trial 139 finished with value: 0.17100496476753752 and parameters: {'model_name': 'IterativeImputer', 'estimator': 'KNN', 'initial_strategy': 'mean', 'n_nearest_features': 3, 'imputation_order': 'arabic'}. Best is trial 24 with value: 0.08405233435168191.
running
[I 2024-11-24 18:38:03,573] Trial 140 finished with value: 0.1543014748757539 and parameters: {'model_name': 'SimpleImputer', 'strategy': 'mean'}. Best is trial 24 with value: 0.08405233435168191.
running
[I 2024-11-24 18:38:04,727] Trial 141 finished with value: 0.08405233435168191 and parameters: {'model_name': 'SimpleImputer', 'strategy': 'median'}. Best is trial 24 with value: 0.08405233435168191.
running
[I 2024-11-24 18:38:05,867] Trial 142 finished with value: 0.08405233435168191 and parameters: {'model_name': 'SimpleImputer', 'strategy': 'median'}. Best is trial 24 with value: 0.08405233435168191.
running
[I 2024-11-24 18:38:07,103] Trial 143 finished with value: 0.08405233435168191 and parameters: {'model_name': 'SimpleImputer', 'strategy': 'median'}. Best is trial 24 with value: 0.08405233435168191.
running
[I 2024-11-24 18:38:08,318] Trial 144 finished with value: 0.08405233435168191 and parameters: {'model_name': 'SimpleImputer', 'strategy': 'median'}. Best is trial 24 with value: 0.08405233435168191.
running
[I 2024-11-24 18:38:09,547] Trial 145 finished with value: 0.08405233435168191 and parameters: {'model_name': 'SimpleImputer', 'strategy': 'median'}. Best is trial 24 with value: 0.08405233435168191.
running
[I 2024-11-24 18:38:10,668] Trial 146 finished with value: 0.08405233435168191 and parameters: {'model_name': 'SimpleImputer', 'strategy': 'median'}. Best is trial 24 with value: 0.08405233435168191.
running
[I 2024-11-24 18:38:11,915] Trial 147 finished with value: 0.08405233435168191 and parameters: {'model_name': 'SimpleImputer', 'strategy': 'median'}. Best is trial 24 with value: 0.08405233435168191.
running
[I 2024-11-24 18:38:12,992] Trial 148 finished with value: 0.08405233435168191 and parameters: {'model_name': 'SimpleImputer', 'strategy': 'median'}. Best is trial 24 with value: 0.08405233435168191.
running
[I 2024-11-24 18:38:14,276] Trial 149 finished with value: 0.08405233435168191 and parameters: {'model_name': 'SimpleImputer', 'strategy': 'median'}. Best is trial 24 with value: 0.08405233435168191.
running
[I 2024-11-24 18:38:15,493] Trial 150 finished with value: 0.08405233435168191 and parameters: {'model_name': 'SimpleImputer', 'strategy': 'median'}. Best is trial 24 with value: 0.08405233435168191.
running
[I 2024-11-24 18:38:17,110] Trial 151 finished with value: 0.43724576911834967 and parameters: {'model_name': 'SimpleImputer', 'strategy': 'most_frequent'}. Best is trial 24 with value: 0.08405233435168191.
running
[I 2024-11-24 18:38:46,832] Trial 152 finished with value: 0.3725864845085998 and parameters: {'model_name': 'GAIN', 'batch_size': 255, 'hint_rate': 0.6649618836684059, 'alpha': 71, 'iterations': 20, 'learning_rate': 0.0006500195127093574, 'p_miss': 0.29174626151843797}. Best is trial 24 with value: 0.08405233435168191.
running
[I 2024-11-24 18:38:48,026] Trial 153 finished with value: 0.08405233435168191 and parameters: {'model_name': 'SimpleImputer', 'strategy': 'median'}. Best is trial 24 with value: 0.08405233435168191.
running
[I 2024-11-24 18:38:49,182] Trial 154 finished with value: 0.08405233435168191 and parameters: {'model_name': 'SimpleImputer', 'strategy': 'median'}. Best is trial 24 with value: 0.08405233435168191.
running
[I 2024-11-24 18:39:49,118] Trial 155 finished with value: 0.15430147487575394 and parameters: {'model_name': 'KNNImputer', 'n_neighbors': 70671, 'weights': 'uniform'}. Best is trial 24 with value: 0.08405233435168191.
running
[I 2024-11-24 18:39:50,268] Trial 156 finished with value: 0.08405233435168191 and parameters: {'model_name': 'SimpleImputer', 'strategy': 'median'}. Best is trial 24 with value: 0.08405233435168191.
running
[I 2024-11-24 18:39:51,469] Trial 157 finished with value: 0.08405233435168191 and parameters: {'model_name': 'SimpleImputer', 'strategy': 'median'}. Best is trial 24 with value: 0.08405233435168191.
running
[I 2024-11-24 18:39:52,634] Trial 158 finished with value: 0.08405233435168191 and parameters: {'model_name': 'SimpleImputer', 'strategy': 'median'}. Best is trial 24 with value: 0.08405233435168191.
running
[I 2024-11-24 18:39:53,377] Trial 159 finished with value: 0.43724576911834967 and parameters: {'model_name': 'SimpleImputer', 'strategy': 'constant'}. Best is trial 24 with value: 0.08405233435168191.
running
[I 2024-11-24 18:39:54,570] Trial 160 finished with value: 0.08405233435168191 and parameters: {'model_name': 'SimpleImputer', 'strategy': 'median'}. Best is trial 24 with value: 0.08405233435168191.
running
[I 2024-11-24 18:40:13,885] Trial 161 finished with value: 0.15089658233559894 and parameters: {'model_name': 'IterativeImputer', 'estimator': 'Ridge', 'initial_strategy': 'median', 'n_nearest_features': 2, 'imputation_order': 'random'}. Best is trial 24 with value: 0.08405233435168191.
running
[I 2024-11-24 18:40:15,211] Trial 162 finished with value: 0.08405233435168191 and parameters: {'model_name': 'SimpleImputer', 'strategy': 'median'}. Best is trial 24 with value: 0.08405233435168191.
running
[I 2024-11-24 18:40:16,540] Trial 163 finished with value: 0.08405233435168191 and parameters: {'model_name': 'SimpleImputer', 'strategy': 'median'}. Best is trial 24 with value: 0.08405233435168191.
running
[I 2024-11-24 18:40:17,428] Trial 164 finished with value: 0.1543014748757539 and parameters: {'model_name': 'SimpleImputer', 'strategy': 'mean'}. Best is trial 24 with value: 0.08405233435168191.
running
[I 2024-11-24 18:40:18,656] Trial 165 finished with value: 0.08405233435168191 and parameters: {'model_name': 'SimpleImputer', 'strategy': 'median'}. Best is trial 24 with value: 0.08405233435168191.
running
[I 2024-11-24 18:40:19,947] Trial 166 finished with value: 0.08405233435168191 and parameters: {'model_name': 'SimpleImputer', 'strategy': 'median'}. Best is trial 24 with value: 0.08405233435168191.
running
[I 2024-11-24 18:40:21,090] Trial 167 finished with value: 0.08405233435168191 and parameters: {'model_name': 'SimpleImputer', 'strategy': 'median'}. Best is trial 24 with value: 0.08405233435168191.
running
[I 2024-11-24 18:40:22,164] Trial 168 finished with value: 0.08405233435168191 and parameters: {'model_name': 'SimpleImputer', 'strategy': 'median'}. Best is trial 24 with value: 0.08405233435168191.
running
[I 2024-11-24 18:40:23,386] Trial 169 finished with value: 0.08405233435168191 and parameters: {'model_name': 'SimpleImputer', 'strategy': 'median'}. Best is trial 24 with value: 0.08405233435168191.
running
[I 2024-11-24 18:40:24,600] Trial 170 finished with value: 0.08405233435168191 and parameters: {'model_name': 'SimpleImputer', 'strategy': 'median'}. Best is trial 24 with value: 0.08405233435168191.
running
[I 2024-11-24 18:40:25,705] Trial 171 finished with value: 0.08405233435168191 and parameters: {'model_name': 'SimpleImputer', 'strategy': 'median'}. Best is trial 24 with value: 0.08405233435168191.
running
[I 2024-11-24 18:40:26,958] Trial 172 finished with value: 0.08405233435168191 and parameters: {'model_name': 'SimpleImputer', 'strategy': 'median'}. Best is trial 24 with value: 0.08405233435168191.
running
[I 2024-11-24 18:40:28,238] Trial 173 finished with value: 0.08405233435168191 and parameters: {'model_name': 'SimpleImputer', 'strategy': 'median'}. Best is trial 24 with value: 0.08405233435168191.
running
[I 2024-11-24 18:40:29,353] Trial 174 finished with value: 0.08405233435168191 and parameters: {'model_name': 'SimpleImputer', 'strategy': 'median'}. Best is trial 24 with value: 0.08405233435168191.
running
[I 2024-11-24 18:40:30,585] Trial 175 finished with value: 0.08405233435168191 and parameters: {'model_name': 'SimpleImputer', 'strategy': 'median'}. Best is trial 24 with value: 0.08405233435168191.
running
[I 2024-11-24 18:40:31,754] Trial 176 finished with value: 0.08405233435168191 and parameters: {'model_name': 'SimpleImputer', 'strategy': 'median'}. Best is trial 24 with value: 0.08405233435168191.
running
[I 2024-11-24 18:40:32,937] Trial 177 finished with value: 0.08405233435168191 and parameters: {'model_name': 'SimpleImputer', 'strategy': 'median'}. Best is trial 24 with value: 0.08405233435168191.
running
[I 2024-11-24 18:40:34,273] Trial 178 finished with value: 0.08405233435168191 and parameters: {'model_name': 'SimpleImputer', 'strategy': 'median'}. Best is trial 24 with value: 0.08405233435168191.
running
[I 2024-11-24 18:40:35,490] Trial 179 finished with value: 0.08405233435168191 and parameters: {'model_name': 'SimpleImputer', 'strategy': 'median'}. Best is trial 24 with value: 0.08405233435168191.
running
[I 2024-11-24 18:43:50,747] Trial 130 finished with value: inf and parameters: {'model_name': 'GAIN', 'batch_size': 2, 'hint_rate': 0.6958008891230287, 'alpha': 70, 'iterations': 6431, 'learning_rate': 0.00024436152663903296, 'p_miss': 0.24591116682168668}. Best is trial 24 with value: 0.08405233435168191.
running
[I 2024-11-24 18:43:52,658] Trial 181 finished with value: 0.43724576911834967 and parameters: {'model_name': 'SimpleImputer', 'strategy': 'most_frequent'}. Best is trial 24 with value: 0.08405233435168191.
running
[I 2024-11-24 18:43:53,864] Trial 182 finished with value: 0.08405233435168191 and parameters: {'model_name': 'SimpleImputer', 'strategy': 'median'}. Best is trial 24 with value: 0.08405233435168191.
running
[I 2024-11-24 18:43:55,251] Trial 183 finished with value: 0.08405233435168191 and parameters: {'model_name': 'SimpleImputer', 'strategy': 'median'}. Best is trial 24 with value: 0.08405233435168191.
running
[I 2024-11-24 18:43:56,091] Trial 184 finished with value: 0.43724576911834967 and parameters: {'model_name': 'SimpleImputer', 'strategy': 'constant'}. Best is trial 24 with value: 0.08405233435168191.
running
[I 2024-11-24 18:44:53,451] Trial 185 finished with value: 0.2496002923182666 and parameters: {'model_name': 'IterativeImputer', 'estimator': 'Bayesian', 'initial_strategy': 'mean', 'n_nearest_features': 5, 'imputation_order': 'roman', 'sample_posterior': True}. Best is trial 24 with value: 0.08405233435168191.
running
[I 2024-11-24 18:44:54,747] Trial 186 finished with value: 0.08405233435168191 and parameters: {'model_name': 'SimpleImputer', 'strategy': 'median'}. Best is trial 24 with value: 0.08405233435168191.
running
[I 2024-11-24 18:44:55,996] Trial 187 finished with value: 0.08405233435168191 and parameters: {'model_name': 'SimpleImputer', 'strategy': 'median'}. Best is trial 24 with value: 0.08405233435168191.
running
[I 2024-11-24 18:44:57,363] Trial 188 finished with value: 0.08405233435168191 and parameters: {'model_name': 'SimpleImputer', 'strategy': 'median'}. Best is trial 24 with value: 0.08405233435168191.
running
[I 2024-11-24 18:46:10,869] Trial 35 finished with value: 0.1662905226058839 and parameters: {'model_name': 'VAE', 'batch_size': 250, 'iterations': 5781, 'learning_rate': 0.0016897011879576068, 'p_miss': 0.1264152184439072}. Best is trial 24 with value: 0.08405233435168191.
running
[I 2024-11-24 18:46:11,348] Trial 189 finished with value: 0.17702547905007096 and parameters: {'model_name': 'KNNImputer', 'n_neighbors': 21881, 'weights': 'distance'}. Best is trial 24 with value: 0.08405233435168191.
running
[I 2024-11-24 18:46:12,419] Trial 191 finished with value: 0.08405233435168191 and parameters: {'model_name': 'SimpleImputer', 'strategy': 'median'}. Best is trial 24 with value: 0.08405233435168191.
running
[I 2024-11-24 18:46:13,758] Trial 192 finished with value: 0.08405233435168191 and parameters: {'model_name': 'SimpleImputer', 'strategy': 'median'}. Best is trial 24 with value: 0.08405233435168191.
running
[I 2024-11-24 18:46:14,989] Trial 193 finished with value: 0.08405233435168191 and parameters: {'model_name': 'SimpleImputer', 'strategy': 'median'}. Best is trial 24 with value: 0.08405233435168191.
running
[I 2024-11-24 18:46:16,025] Trial 194 finished with value: 0.1543014748757539 and parameters: {'model_name': 'SimpleImputer', 'strategy': 'mean'}. Best is trial 24 with value: 0.08405233435168191.
running
[I 2024-11-24 18:46:17,275] Trial 195 finished with value: 0.08405233435168191 and parameters: {'model_name': 'SimpleImputer', 'strategy': 'median'}. Best is trial 24 with value: 0.08405233435168191.
running
[I 2024-11-24 18:46:18,529] Trial 196 finished with value: 0.08405233435168191 and parameters: {'model_name': 'SimpleImputer', 'strategy': 'median'}. Best is trial 24 with value: 0.08405233435168191.
running
[I 2024-11-24 18:46:19,868] Trial 197 finished with value: 0.08405233435168191 and parameters: {'model_name': 'SimpleImputer', 'strategy': 'median'}. Best is trial 24 with value: 0.08405233435168191.
running
[I 2024-11-24 18:46:20,925] Trial 198 finished with value: 0.08405233435168191 and parameters: {'model_name': 'SimpleImputer', 'strategy': 'median'}. Best is trial 24 with value: 0.08405233435168191.
running
[I 2024-11-24 18:46:21,921] Trial 199 finished with value: 0.08405233435168191 and parameters: {'model_name': 'SimpleImputer', 'strategy': 'median'}. Best is trial 24 with value: 0.08405233435168191.
[I 2024-11-24 18:47:24,690] Trial 190 finished with value: 0.17700115482999298 and parameters: {'model_name': 'KNNImputer', 'n_neighbors': 21269, 'weights': 'distance'}. Best is trial 24 with value: 0.08405233435168191.
