Run: 9
/cm/local/apps/slurm/var/spool/job1011280/slurm_script: line 26: 
pip install -e tpot2
pip install -r tpot2/ImputerExperiments/requirements_.txt
: No such file or directory
RunStart
Version 0.1.7a0 of tpot2 is outdated. Version 0.1.8a0 was released Tuesday September 17, 2024.
starting loops
../data/c/310/310.pkl
working on 
../data/c/310/class_full_MNAR_0.01_1
0.006787538528442383
running experiment 1/3 - Does large hyperparameter space improve reconstruction accuracy over simple
[I 2024-10-22 17:29:58,892] A new study created in memory with name: no-name-9dfb5c8a-7a68-4eac-90d5-45a5e10a8725
running
running
running
running
running
running
running
running
running
running
running
running
running
running
running
running
[I 2024-10-22 17:29:59,305] Trial 8 finished with value: 0.24187547203057597 and parameters: {'model_name': 'SimpleImputer', 'strategy': 'constant'}. Best is trial 8 with value: 0.24187547203057597.
running
[I 2024-10-22 17:29:59,579] Trial 4 finished with value: 0.2405879455303827 and parameters: {'model_name': 'SimpleImputer', 'strategy': 'median'}. Best is trial 4 with value: 0.2405879455303827.
running
[I 2024-10-22 17:29:59,788] Trial 14 finished with value: 0.24187547203057597 and parameters: {'model_name': 'SimpleImputer', 'strategy': 'constant'}. Best is trial 4 with value: 0.2405879455303827.
running
[I 2024-10-22 17:30:00,034] Trial 6 finished with value: 0.24187547203057597 and parameters: {'model_name': 'SimpleImputer', 'strategy': 'most_frequent'}. Best is trial 4 with value: 0.2405879455303827.
running
[I 2024-10-22 17:30:00,326] Trial 10 finished with value: 0.24187547203057597 and parameters: {'model_name': 'SimpleImputer', 'strategy': 'most_frequent'}. Best is trial 4 with value: 0.2405879455303827.
running
[I 2024-10-22 17:30:05,043] Trial 16 finished with value: 0.12650167755128297 and parameters: {'model_name': 'KNNImputer', 'n_neighbors': 3868, 'weights': 'uniform'}. Best is trial 16 with value: 0.12650167755128297.
running
[I 2024-10-22 17:30:06,192] Trial 0 finished with value: 0.13229344073835303 and parameters: {'model_name': 'KNNImputer', 'n_neighbors': 5145, 'weights': 'distance'}. Best is trial 16 with value: 0.12650167755128297.
running
[I 2024-10-22 17:30:06,881] Trial 18 finished with value: 0.12362431885095482 and parameters: {'model_name': 'KNNImputer', 'n_neighbors': 4056, 'weights': 'distance'}. Best is trial 18 with value: 0.12362431885095482.
running
[I 2024-10-22 17:30:07,788] Trial 23 finished with value: 0.24187547203057597 and parameters: {'model_name': 'SimpleImputer', 'strategy': 'most_frequent'}. Best is trial 18 with value: 0.12362431885095482.
running
[I 2024-10-22 17:30:08,397] Trial 24 finished with value: 0.2405879455303827 and parameters: {'model_name': 'SimpleImputer', 'strategy': 'median'}. Best is trial 18 with value: 0.12362431885095482.
running
[I 2024-10-22 17:30:12,099] Trial 22 finished with value: 0.0959311403214242 and parameters: {'model_name': 'KNNImputer', 'n_neighbors': 2176, 'weights': 'uniform'}. Best is trial 22 with value: 0.0959311403214242.
running
[I 2024-10-22 17:30:13,441] Trial 5 finished with value: 0.22468733535457114 and parameters: {'model_name': 'IterativeImputer', 'estimator': 'Bayesian', 'initial_strategy': 'mean', 'n_nearest_features': 1, 'imputation_order': 'ascending', 'sample_posterior': True}. Best is trial 22 with value: 0.0959311403214242.
running
[I 2024-10-22 17:30:14,256] Trial 17 finished with value: 0.23965926554735067 and parameters: {'model_name': 'GAIN', 'batch_size': 952, 'hint_rate': 0.7699159095046441, 'alpha': 87, 'iterations': 1, 'learning_rate': 0.0030666668565949937, 'p_miss': 0.015661319639255863}. Best is trial 22 with value: 0.0959311403214242.
running
[I 2024-10-22 17:30:15,998] Trial 15 finished with value: 0.3774359698013102 and parameters: {'model_name': 'VAE', 'batch_size': 51, 'iterations': 2, 'learning_rate': 0.035608539773627594, 'p_miss': 0.19593454276750105}. Best is trial 22 with value: 0.0959311403214242.
running
[I 2024-10-22 17:30:18,897] Trial 28 finished with value: 0.10891025952630498 and parameters: {'model_name': 'KNNImputer', 'n_neighbors': 135, 'weights': 'distance'}. Best is trial 22 with value: 0.0959311403214242.
[I 2024-10-22 17:30:19,045] Trial 27 finished with value: 0.08890160890675149 and parameters: {'model_name': 'KNNImputer', 'n_neighbors': 577, 'weights': 'uniform'}. Best is trial 27 with value: 0.08890160890675149.
running
running
[I 2024-10-22 17:30:20,231] Trial 7 finished with value: 0.11250596441363017 and parameters: {'model_name': 'IterativeImputer', 'estimator': 'KNN', 'initial_strategy': 'constant', 'n_nearest_features': 2, 'imputation_order': 'random'}. Best is trial 27 with value: 0.08890160890675149.
running
[I 2024-10-22 17:30:21,830] Trial 29 finished with value: 0.09478967116367253 and parameters: {'model_name': 'KNNImputer', 'n_neighbors': 1824, 'weights': 'uniform'}. Best is trial 27 with value: 0.08890160890675149.
running
[I 2024-10-22 17:30:22,059] Trial 3 finished with value: 0.42367346040731746 and parameters: {'model_name': 'VAE', 'batch_size': 91, 'iterations': 4, 'learning_rate': 0.0044387733255408825, 'p_miss': 0.25663502572914404}. Best is trial 27 with value: 0.08890160890675149.
running
[I 2024-10-22 17:30:22,296] Trial 2 finished with value: 0.0822291069352448 and parameters: {'model_name': 'IterativeImputer', 'estimator': 'KNN', 'initial_strategy': 'constant', 'n_nearest_features': 5, 'imputation_order': 'random'}. Best is trial 2 with value: 0.0822291069352448.
running
[I 2024-10-22 17:30:23,794] Trial 30 finished with value: 0.08887563204240817 and parameters: {'model_name': 'KNNImputer', 'n_neighbors': 257, 'weights': 'uniform'}. Best is trial 2 with value: 0.0822291069352448.
running
[I 2024-10-22 17:30:24,657] Trial 31 finished with value: 0.08858820669938136 and parameters: {'model_name': 'KNNImputer', 'n_neighbors': 539, 'weights': 'uniform'}. Best is trial 2 with value: 0.0822291069352448.
running
[I 2024-10-22 17:30:25,051] Trial 9 finished with value: 0.08120515049977747 and parameters: {'model_name': 'IterativeImputer', 'estimator': 'KNN', 'initial_strategy': 'most_frequent', 'n_nearest_features': 5, 'imputation_order': 'roman'}. Best is trial 9 with value: 0.08120515049977747.
running
[I 2024-10-22 17:30:26,033] Trial 32 finished with value: 0.09052435028924247 and parameters: {'model_name': 'KNNImputer', 'n_neighbors': 819, 'weights': 'uniform'}. Best is trial 9 with value: 0.08120515049977747.
running
[I 2024-10-22 17:30:26,731] Trial 26 finished with value: 0.43468276237066583 and parameters: {'model_name': 'VAE', 'batch_size': 285, 'iterations': 2, 'learning_rate': 0.002711432079420503, 'p_miss': 0.15682721511615352}. Best is trial 9 with value: 0.08120515049977747.
running
[I 2024-10-22 17:30:45,497] Trial 35 finished with value: 0.08276525192315957 and parameters: {'model_name': 'IterativeImputer', 'estimator': 'KNN', 'initial_strategy': 'constant', 'n_nearest_features': 6, 'imputation_order': 'random'}. Best is trial 9 with value: 0.08120515049977747.
running
[I 2024-10-22 17:30:47,885] Trial 37 finished with value: 0.08276525192315957 and parameters: {'model_name': 'IterativeImputer', 'estimator': 'KNN', 'initial_strategy': 'constant', 'n_nearest_features': 6, 'imputation_order': 'random'}. Best is trial 9 with value: 0.08120515049977747.
running
[I 2024-10-22 17:30:49,757] Trial 36 finished with value: 0.0822291069352448 and parameters: {'model_name': 'IterativeImputer', 'estimator': 'KNN', 'initial_strategy': 'constant', 'n_nearest_features': 5, 'imputation_order': 'random'}. Best is trial 9 with value: 0.08120515049977747.
running
[I 2024-10-22 17:30:50,816] Trial 40 finished with value: 0.08128075484247362 and parameters: {'model_name': 'IterativeImputer', 'estimator': 'KNN', 'initial_strategy': 'most_frequent', 'n_nearest_features': 6, 'imputation_order': 'roman'}. Best is trial 9 with value: 0.08120515049977747.
running
[I 2024-10-22 17:30:51,423] Trial 39 finished with value: 0.08128075484247362 and parameters: {'model_name': 'IterativeImputer', 'estimator': 'KNN', 'initial_strategy': 'most_frequent', 'n_nearest_features': 6, 'imputation_order': 'roman'}. Best is trial 9 with value: 0.08120515049977747.
running
[I 2024-10-22 17:30:52,698] Trial 38 finished with value: 0.08128075484247362 and parameters: {'model_name': 'IterativeImputer', 'estimator': 'KNN', 'initial_strategy': 'most_frequent', 'n_nearest_features': 6, 'imputation_order': 'roman'}. Best is trial 9 with value: 0.08120515049977747.
running
[I 2024-10-22 17:30:53,767] Trial 25 finished with value: 0.3872387102540448 and parameters: {'model_name': 'VAE', 'batch_size': 769, 'iterations': 3, 'learning_rate': 0.007610023251384112, 'p_miss': 0.050189216499453376}. Best is trial 9 with value: 0.08120515049977747.
running
[I 2024-10-22 17:31:04,603] Trial 44 finished with value: 0.1366840132753488 and parameters: {'model_name': 'IterativeImputer', 'estimator': 'Ridge', 'initial_strategy': 'most_frequent', 'n_nearest_features': 4, 'imputation_order': 'roman'}. Best is trial 9 with value: 0.08120515049977747.
running
[I 2024-10-22 17:31:04,880] Trial 46 finished with value: 0.13612003292311275 and parameters: {'model_name': 'IterativeImputer', 'estimator': 'Ridge', 'initial_strategy': 'most_frequent', 'n_nearest_features': 6, 'imputation_order': 'roman'}. Best is trial 9 with value: 0.08120515049977747.
running
[I 2024-10-22 17:31:05,477] Trial 47 finished with value: 0.13612003292311275 and parameters: {'model_name': 'IterativeImputer', 'estimator': 'Ridge', 'initial_strategy': 'most_frequent', 'n_nearest_features': 6, 'imputation_order': 'roman'}. Best is trial 9 with value: 0.08120515049977747.
running
[I 2024-10-22 17:31:10,948] Trial 41 finished with value: 0.08128075484247362 and parameters: {'model_name': 'IterativeImputer', 'estimator': 'KNN', 'initial_strategy': 'most_frequent', 'n_nearest_features': 6, 'imputation_order': 'roman'}. Best is trial 9 with value: 0.08120515049977747.
running
[I 2024-10-22 17:31:12,192] Trial 42 finished with value: 0.08128075484247362 and parameters: {'model_name': 'IterativeImputer', 'estimator': 'KNN', 'initial_strategy': 'most_frequent', 'n_nearest_features': 6, 'imputation_order': 'roman'}. Best is trial 9 with value: 0.08120515049977747.
running
[I 2024-10-22 17:31:30,247] Trial 12 finished with value: 0.2465278342213925 and parameters: {'model_name': 'GAIN', 'batch_size': 119, 'hint_rate': 0.3712702335520404, 'alpha': 31, 'iterations': 60, 'learning_rate': 0.0005199929270034723, 'p_miss': 0.24628457448343932}. Best is trial 9 with value: 0.08120515049977747.
running
[I 2024-10-22 17:31:50,646] Trial 53 finished with value: 0.08555769562326168 and parameters: {'model_name': 'IterativeImputer', 'estimator': 'KNN', 'initial_strategy': 'median', 'n_nearest_features': 5, 'imputation_order': 'descending'}. Best is trial 9 with value: 0.08120515049977747.
running
[I 2024-10-22 17:33:32,914] Trial 13 finished with value: inf and parameters: {'model_name': 'GAIN', 'batch_size': 4, 'hint_rate': 0.11347252016002321, 'alpha': 75, 'iterations': 738, 'learning_rate': 0.066342841295578, 'p_miss': 0.22836456988449189}. Best is trial 9 with value: 0.08120515049977747.
running
[I 2024-10-22 17:40:53,165] Trial 21 finished with value: 0.37380615713569415 and parameters: {'model_name': 'VAE', 'batch_size': 525, 'iterations': 175, 'learning_rate': 0.0003794565423810492, 'p_miss': 0.21329302935777913}. Best is trial 9 with value: 0.08120515049977747.
running
[I 2024-10-22 17:47:34,324] Trial 20 finished with value: 0.10271046729480293 and parameters: {'model_name': 'IterativeImputer', 'estimator': 'RFR', 'initial_strategy': 'most_frequent', 'n_nearest_features': 2, 'imputation_order': 'arabic'}. Best is trial 9 with value: 0.08120515049977747.
running
[I 2024-10-22 17:47:53,443] Trial 57 finished with value: 0.08120515049977747 and parameters: {'model_name': 'IterativeImputer', 'estimator': 'KNN', 'initial_strategy': 'most_frequent', 'n_nearest_features': 5, 'imputation_order': 'roman'}. Best is trial 9 with value: 0.08120515049977747.
running
[I 2024-10-22 17:48:11,759] Trial 58 finished with value: 0.08120515049977747 and parameters: {'model_name': 'IterativeImputer', 'estimator': 'KNN', 'initial_strategy': 'most_frequent', 'n_nearest_features': 5, 'imputation_order': 'roman'}. Best is trial 9 with value: 0.08120515049977747.
running
[I 2024-10-22 17:48:30,086] Trial 59 finished with value: 0.08150422837681667 and parameters: {'model_name': 'IterativeImputer', 'estimator': 'KNN', 'initial_strategy': 'most_frequent', 'n_nearest_features': 4, 'imputation_order': 'roman'}. Best is trial 9 with value: 0.08120515049977747.
running
[I 2024-10-22 17:48:49,440] Trial 60 finished with value: 0.08120515049977747 and parameters: {'model_name': 'IterativeImputer', 'estimator': 'KNN', 'initial_strategy': 'most_frequent', 'n_nearest_features': 5, 'imputation_order': 'roman'}. Best is trial 9 with value: 0.08120515049977747.
running
[I 2024-10-22 17:49:26,668] Trial 61 finished with value: 0.1451124461549399 and parameters: {'model_name': 'IterativeImputer', 'estimator': 'Bayesian', 'initial_strategy': 'most_frequent', 'n_nearest_features': 5, 'imputation_order': 'roman', 'sample_posterior': False}. Best is trial 9 with value: 0.08120515049977747.
running
[I 2024-10-22 17:51:19,145] Trial 19 finished with value: inf and parameters: {'model_name': 'GAIN', 'batch_size': 11, 'hint_rate': 0.8088761459859756, 'alpha': 5, 'iterations': 4511, 'learning_rate': 0.00011714004889456257, 'p_miss': 0.014973040561531752}. Best is trial 9 with value: 0.08120515049977747.
running
[I 2024-10-22 17:51:44,011] Trial 43 finished with value: 0.07621483892827474 and parameters: {'model_name': 'IterativeImputer', 'estimator': 'RFR', 'initial_strategy': 'most_frequent', 'n_nearest_features': 4, 'imputation_order': 'roman'}. Best is trial 43 with value: 0.07621483892827474.
running
[I 2024-10-22 17:52:15,477] Trial 11 finished with value: 0.07472162649697094 and parameters: {'model_name': 'IterativeImputer', 'estimator': 'RFR', 'initial_strategy': 'most_frequent', 'n_nearest_features': 6, 'imputation_order': 'arabic'}. Best is trial 11 with value: 0.07472162649697094.
running
[I 2024-10-22 17:52:54,959] Trial 45 finished with value: 0.07207007699634572 and parameters: {'model_name': 'IterativeImputer', 'estimator': 'RFR', 'initial_strategy': 'most_frequent', 'n_nearest_features': 5, 'imputation_order': 'roman'}. Best is trial 45 with value: 0.07207007699634572.
running
[I 2024-10-22 17:53:04,718] Trial 48 finished with value: 0.0753490802218357 and parameters: {'model_name': 'IterativeImputer', 'estimator': 'RFR', 'initial_strategy': 'most_frequent', 'n_nearest_features': 6, 'imputation_order': 'roman'}. Best is trial 45 with value: 0.07207007699634572.
running
[I 2024-10-22 17:53:09,642] Trial 51 finished with value: 0.0764597171156711 and parameters: {'model_name': 'IterativeImputer', 'estimator': 'RFR', 'initial_strategy': 'most_frequent', 'n_nearest_features': 5, 'imputation_order': 'arabic'}. Best is trial 45 with value: 0.07207007699634572.
running
[I 2024-10-22 17:53:14,665] Trial 49 finished with value: 0.07327960754550666 and parameters: {'model_name': 'IterativeImputer', 'estimator': 'RFR', 'initial_strategy': 'most_frequent', 'n_nearest_features': 6, 'imputation_order': 'roman'}. Best is trial 45 with value: 0.07207007699634572.
running
[I 2024-10-22 17:53:27,946] Trial 54 finished with value: 0.07563020946873374 and parameters: {'model_name': 'IterativeImputer', 'estimator': 'RFR', 'initial_strategy': 'most_frequent', 'n_nearest_features': 5, 'imputation_order': 'arabic'}. Best is trial 45 with value: 0.07207007699634572.
running
[I 2024-10-22 17:55:28,209] Trial 55 finished with value: 0.0756301667994919 and parameters: {'model_name': 'IterativeImputer', 'estimator': 'RFR', 'initial_strategy': 'most_frequent', 'n_nearest_features': 5, 'imputation_order': 'arabic'}. Best is trial 45 with value: 0.07207007699634572.
running
[I 2024-10-22 17:55:36,775] Trial 71 finished with value: inf and parameters: {'model_name': 'GAIN', 'batch_size': 1, 'hint_rate': 0.43465755789069116, 'alpha': 50, 'iterations': 23, 'learning_rate': 0.02165815523050228, 'p_miss': 0.08987851693775045}. Best is trial 45 with value: 0.07207007699634572.
running
[I 2024-10-22 18:02:28,112] Trial 56 finished with value: 0.0747822095737363 and parameters: {'model_name': 'IterativeImputer', 'estimator': 'RFR', 'initial_strategy': 'most_frequent', 'n_nearest_features': 5, 'imputation_order': 'roman'}. Best is trial 45 with value: 0.07207007699634572.
running
[I 2024-10-22 18:07:40,509] Trial 34 finished with value: inf and parameters: {'model_name': 'GAIN', 'batch_size': 1, 'hint_rate': 0.055319513428114975, 'alpha': 6, 'iterations': 7619, 'learning_rate': 0.00013806003085588966, 'p_miss': 0.048719171525833244}. Best is trial 45 with value: 0.07207007699634572.
running
[I 2024-10-22 18:09:48,605] Trial 62 finished with value: 0.07789578759072761 and parameters: {'model_name': 'IterativeImputer', 'estimator': 'RFR', 'initial_strategy': 'most_frequent', 'n_nearest_features': 4, 'imputation_order': 'roman'}. Best is trial 45 with value: 0.07207007699634572.
running
[I 2024-10-22 18:09:49,366] Trial 75 finished with value: 0.1674877303612149 and parameters: {'model_name': 'SimpleImputer', 'strategy': 'mean'}. Best is trial 45 with value: 0.07207007699634572.
running
[I 2024-10-22 18:11:32,436] Trial 63 finished with value: 0.07758279697385874 and parameters: {'model_name': 'IterativeImputer', 'estimator': 'RFR', 'initial_strategy': 'most_frequent', 'n_nearest_features': 4, 'imputation_order': 'roman'}. Best is trial 45 with value: 0.07207007699634572.
running
[I 2024-10-22 18:12:25,357] Trial 64 finished with value: 0.08501913741411875 and parameters: {'model_name': 'IterativeImputer', 'estimator': 'RFR', 'initial_strategy': 'median', 'n_nearest_features': 4, 'imputation_order': 'roman'}. Best is trial 45 with value: 0.07207007699634572.
running
[I 2024-10-22 18:12:25,911] Trial 50 finished with value: inf and parameters: {'model_name': 'GAIN', 'batch_size': 1, 'hint_rate': 0.06821276873179516, 'alpha': 10, 'iterations': 8404, 'learning_rate': 0.00010990950643839214, 'p_miss': 0.27977802050414124}. Best is trial 45 with value: 0.07207007699634572.
running
[I 2024-10-22 18:12:45,066] Trial 65 finished with value: 0.08410668274490898 and parameters: {'model_name': 'IterativeImputer', 'estimator': 'RFR', 'initial_strategy': 'median', 'n_nearest_features': 4, 'imputation_order': 'arabic'}. Best is trial 45 with value: 0.07207007699634572.
running
[I 2024-10-22 18:13:11,168] Trial 52 finished with value: inf and parameters: {'model_name': 'GAIN', 'batch_size': 1, 'hint_rate': 0.01891335668824662, 'alpha': 4, 'iterations': 8457, 'learning_rate': 0.00017118343108293163, 'p_miss': 0.29730740207659023}. Best is trial 45 with value: 0.07207007699634572.
running
[I 2024-10-22 18:13:23,030] Trial 66 finished with value: 0.08383002491106914 and parameters: {'model_name': 'IterativeImputer', 'estimator': 'RFR', 'initial_strategy': 'mean', 'n_nearest_features': 4, 'imputation_order': 'arabic'}. Best is trial 45 with value: 0.07207007699634572.
running
[I 2024-10-22 18:13:31,549] Trial 67 finished with value: 0.08647352773940234 and parameters: {'model_name': 'IterativeImputer', 'estimator': 'RFR', 'initial_strategy': 'median', 'n_nearest_features': 4, 'imputation_order': 'arabic'}. Best is trial 45 with value: 0.07207007699634572.
running
[I 2024-10-22 18:13:40,667] Trial 68 finished with value: 0.08579336329403092 and parameters: {'model_name': 'IterativeImputer', 'estimator': 'RFR', 'initial_strategy': 'median', 'n_nearest_features': 4, 'imputation_order': 'arabic'}. Best is trial 45 with value: 0.07207007699634572.
running
[I 2024-10-22 18:13:57,652] Trial 69 finished with value: 0.08750125934743064 and parameters: {'model_name': 'IterativeImputer', 'estimator': 'RFR', 'initial_strategy': 'median', 'n_nearest_features': 4, 'imputation_order': 'arabic'}. Best is trial 45 with value: 0.07207007699634572.
running
[I 2024-10-22 18:16:35,984] Trial 72 finished with value: 0.08502994463753813 and parameters: {'model_name': 'IterativeImputer', 'estimator': 'RFR', 'initial_strategy': 'median', 'n_nearest_features': 4, 'imputation_order': 'arabic'}. Best is trial 45 with value: 0.07207007699634572.
running
[I 2024-10-22 18:22:41,583] Trial 73 finished with value: 0.0846223024011539 and parameters: {'model_name': 'IterativeImputer', 'estimator': 'RFR', 'initial_strategy': 'median', 'n_nearest_features': 4, 'imputation_order': 'arabic'}. Best is trial 45 with value: 0.07207007699634572.
running
[I 2024-10-22 18:27:13,224] Trial 74 finished with value: 0.08247065966992231 and parameters: {'model_name': 'IterativeImputer', 'estimator': 'RFR', 'initial_strategy': 'mean', 'n_nearest_features': 4, 'imputation_order': 'arabic'}. Best is trial 45 with value: 0.07207007699634572.
running
[I 2024-10-22 18:30:28,533] Trial 76 finished with value: 0.07415505763220602 and parameters: {'model_name': 'IterativeImputer', 'estimator': 'RFR', 'initial_strategy': 'mean', 'n_nearest_features': 5, 'imputation_order': 'arabic'}. Best is trial 45 with value: 0.07207007699634572.
running
[I 2024-10-22 18:30:29,070] Trial 89 finished with value: 0.1674877303612149 and parameters: {'model_name': 'SimpleImputer', 'strategy': 'mean'}. Best is trial 45 with value: 0.07207007699634572.
running
[I 2024-10-22 18:31:51,449] Trial 77 finished with value: 0.08077652771094462 and parameters: {'model_name': 'IterativeImputer', 'estimator': 'RFR', 'initial_strategy': 'median', 'n_nearest_features': 5, 'imputation_order': 'arabic'}. Best is trial 45 with value: 0.07207007699634572.
running
