[I 2024-09-22 11:28:34,154] Trial 163 finished with value: 0.13244639738865296 and parameters: {'model_name': 'IterativeImputer', 'estimator': 'Ridge', 'initial_strategy': 'mean', 'n_nearest_features': 4, 'imputation_order': 'random'}. Best is trial 13 with value: 0.1316992340328043.
running
[I 2024-09-22 11:28:35,855] Trial 165 finished with value: 0.13244639738865296 and parameters: {'model_name': 'IterativeImputer', 'estimator': 'Ridge', 'initial_strategy': 'mean', 'n_nearest_features': 4, 'imputation_order': 'random'}. Best is trial 13 with value: 0.1316992340328043.
running
[I 2024-09-22 11:28:38,646] Trial 166 finished with value: 0.13244639738865296 and parameters: {'model_name': 'IterativeImputer', 'estimator': 'Ridge', 'initial_strategy': 'mean', 'n_nearest_features': 4, 'imputation_order': 'random'}. Best is trial 13 with value: 0.1316992340328043.
running
[I 2024-09-22 11:28:39,963] Trial 167 finished with value: 0.13244639738865296 and parameters: {'model_name': 'IterativeImputer', 'estimator': 'Ridge', 'initial_strategy': 'mean', 'n_nearest_features': 4, 'imputation_order': 'random'}. Best is trial 13 with value: 0.1316992340328043.
running
[I 2024-09-22 11:28:40,459] Trial 168 finished with value: 0.13244639738865296 and parameters: {'model_name': 'IterativeImputer', 'estimator': 'Ridge', 'initial_strategy': 'mean', 'n_nearest_features': 4, 'imputation_order': 'random'}. Best is trial 13 with value: 0.1316992340328043.
running
[I 2024-09-22 11:28:42,225] Trial 169 finished with value: 0.13244639738865296 and parameters: {'model_name': 'IterativeImputer', 'estimator': 'Ridge', 'initial_strategy': 'mean', 'n_nearest_features': 4, 'imputation_order': 'random'}. Best is trial 13 with value: 0.1316992340328043.
running
[I 2024-09-22 11:28:44,445] Trial 170 finished with value: 0.13244639738865296 and parameters: {'model_name': 'IterativeImputer', 'estimator': 'Ridge', 'initial_strategy': 'mean', 'n_nearest_features': 4, 'imputation_order': 'random'}. Best is trial 13 with value: 0.1316992340328043.
running
[I 2024-09-22 11:28:47,393] Trial 171 finished with value: 0.13244639738865296 and parameters: {'model_name': 'IterativeImputer', 'estimator': 'Ridge', 'initial_strategy': 'mean', 'n_nearest_features': 4, 'imputation_order': 'random'}. Best is trial 13 with value: 0.1316992340328043.
running
[I 2024-09-22 11:28:49,268] Trial 172 finished with value: 0.13244639738865296 and parameters: {'model_name': 'IterativeImputer', 'estimator': 'Ridge', 'initial_strategy': 'mean', 'n_nearest_features': 4, 'imputation_order': 'random'}. Best is trial 13 with value: 0.1316992340328043.
running
[I 2024-09-22 11:28:54,774] Trial 176 finished with value: 0.13244639738865296 and parameters: {'model_name': 'IterativeImputer', 'estimator': 'Ridge', 'initial_strategy': 'mean', 'n_nearest_features': 4, 'imputation_order': 'random'}. Best is trial 13 with value: 0.1316992340328043.
running
[I 2024-09-22 11:28:56,343] Trial 173 finished with value: 0.13243582733820702 and parameters: {'model_name': 'IterativeImputer', 'estimator': 'Bayesian', 'initial_strategy': 'mean', 'n_nearest_features': 4, 'imputation_order': 'random', 'sample_posterior': False}. Best is trial 13 with value: 0.1316992340328043.
running
[I 2024-09-22 11:28:59,643] Trial 175 finished with value: 0.13243582733820702 and parameters: {'model_name': 'IterativeImputer', 'estimator': 'Bayesian', 'initial_strategy': 'mean', 'n_nearest_features': 4, 'imputation_order': 'random', 'sample_posterior': False}. Best is trial 13 with value: 0.1316992340328043.
running
[I 2024-09-22 11:29:03,261] Trial 91 finished with value: 0.43673392883725376 and parameters: {'model_name': 'GAIN', 'batch_size': 8, 'hint_rate': 0.03525211393492983, 'alpha': 3, 'iterations': 3267, 'learning_rate': 0.00533178968203228, 'p_miss': 0.29764694712639717}. Best is trial 13 with value: 0.1316992340328043.
running
[I 2024-09-22 11:29:04,874] Trial 177 finished with value: 0.13243582733820702 and parameters: {'model_name': 'IterativeImputer', 'estimator': 'Bayesian', 'initial_strategy': 'mean', 'n_nearest_features': 4, 'imputation_order': 'random', 'sample_posterior': False}. Best is trial 13 with value: 0.1316992340328043.
running
[I 2024-09-22 11:29:10,132] Trial 178 finished with value: 0.13243582733820702 and parameters: {'model_name': 'IterativeImputer', 'estimator': 'Bayesian', 'initial_strategy': 'mean', 'n_nearest_features': 4, 'imputation_order': 'random', 'sample_posterior': False}. Best is trial 13 with value: 0.1316992340328043.
running
[I 2024-09-22 11:29:11,761] Trial 179 finished with value: 0.1327777779593724 and parameters: {'model_name': 'IterativeImputer', 'estimator': 'Bayesian', 'initial_strategy': 'most_frequent', 'n_nearest_features': 4, 'imputation_order': 'random', 'sample_posterior': False}. Best is trial 13 with value: 0.1316992340328043.
running
[I 2024-09-22 11:29:20,517] Trial 182 finished with value: 0.1327777779593724 and parameters: {'model_name': 'IterativeImputer', 'estimator': 'Bayesian', 'initial_strategy': 'most_frequent', 'n_nearest_features': 4, 'imputation_order': 'random', 'sample_posterior': False}. Best is trial 13 with value: 0.1316992340328043.
running
[I 2024-09-22 11:30:32,389] Trial 100 finished with value: 0.15205083381689907 and parameters: {'model_name': 'VAE', 'batch_size': 12, 'iterations': 851, 'learning_rate': 0.0002534342316526117, 'p_miss': 0.07317219750495552}. Best is trial 13 with value: 0.1316992340328043.
running
[I 2024-09-22 11:30:35,637] Trial 181 finished with value: 0.15616337659203725 and parameters: {'model_name': 'VAE', 'batch_size': 2, 'iterations': 64, 'learning_rate': 0.0022174361467355184, 'p_miss': 0.013195664367123355}. Best is trial 13 with value: 0.1316992340328043.
running
[I 2024-09-22 11:30:49,174] Trial 183 finished with value: 0.16232381522963862 and parameters: {'model_name': 'VAE', 'batch_size': 2, 'iterations': 82, 'learning_rate': 0.002465746448299165, 'p_miss': 0.01084675901766316}. Best is trial 13 with value: 0.1316992340328043.
running
[I 2024-09-22 11:30:50,207] Trial 186 finished with value: 0.13243582733820702 and parameters: {'model_name': 'IterativeImputer', 'estimator': 'Bayesian', 'initial_strategy': 'mean', 'n_nearest_features': 4, 'imputation_order': 'random', 'sample_posterior': False}. Best is trial 13 with value: 0.1316992340328043.
running
[I 2024-09-22 11:30:52,824] Trial 187 finished with value: 0.13243582733820702 and parameters: {'model_name': 'IterativeImputer', 'estimator': 'Bayesian', 'initial_strategy': 'mean', 'n_nearest_features': 4, 'imputation_order': 'random', 'sample_posterior': False}. Best is trial 13 with value: 0.1316992340328043.
running
[I 2024-09-22 11:30:56,331] Trial 174 finished with value: 0.16186459838395817 and parameters: {'model_name': 'VAE', 'batch_size': 2, 'iterations': 145, 'learning_rate': 0.002341161333338369, 'p_miss': 0.047642422789842764}. Best is trial 13 with value: 0.1316992340328043.
running
[I 2024-09-22 11:30:59,173] Trial 184 finished with value: 0.1602225477182023 and parameters: {'model_name': 'VAE', 'batch_size': 2, 'iterations': 93, 'learning_rate': 0.0028974526175861775, 'p_miss': 0.11815504667738538}. Best is trial 13 with value: 0.1316992340328043.
running
[I 2024-09-22 11:31:00,467] Trial 180 finished with value: 0.17393785406161485 and parameters: {'model_name': 'VAE', 'batch_size': 2, 'iterations': 122, 'learning_rate': 0.002503807097517741, 'p_miss': 0.12565760881710927}. Best is trial 13 with value: 0.1316992340328043.
running
[I 2024-09-22 11:31:02,724] Trial 188 finished with value: 0.13243582733820702 and parameters: {'model_name': 'IterativeImputer', 'estimator': 'Bayesian', 'initial_strategy': 'mean', 'n_nearest_features': 4, 'imputation_order': 'random', 'sample_posterior': False}. Best is trial 13 with value: 0.1316992340328043.
running
[I 2024-09-22 11:31:05,271] Trial 189 finished with value: 0.13243582733820702 and parameters: {'model_name': 'IterativeImputer', 'estimator': 'Bayesian', 'initial_strategy': 'mean', 'n_nearest_features': 4, 'imputation_order': 'random', 'sample_posterior': False}. Best is trial 13 with value: 0.1316992340328043.
running
[I 2024-09-22 11:31:07,249] Trial 190 finished with value: 0.13243582733820702 and parameters: {'model_name': 'IterativeImputer', 'estimator': 'Bayesian', 'initial_strategy': 'mean', 'n_nearest_features': 4, 'imputation_order': 'random', 'sample_posterior': False}. Best is trial 13 with value: 0.1316992340328043.
running
[I 2024-09-22 11:31:09,637] Trial 191 finished with value: 0.13243582733820702 and parameters: {'model_name': 'IterativeImputer', 'estimator': 'Bayesian', 'initial_strategy': 'mean', 'n_nearest_features': 4, 'imputation_order': 'random', 'sample_posterior': False}. Best is trial 13 with value: 0.1316992340328043.
running
[I 2024-09-22 11:31:13,006] Trial 192 finished with value: 0.13243582733820702 and parameters: {'model_name': 'IterativeImputer', 'estimator': 'Bayesian', 'initial_strategy': 'mean', 'n_nearest_features': 4, 'imputation_order': 'random', 'sample_posterior': False}. Best is trial 13 with value: 0.1316992340328043.
running
[I 2024-09-22 11:31:13,460] Trial 193 finished with value: 0.13243582733820702 and parameters: {'model_name': 'IterativeImputer', 'estimator': 'Bayesian', 'initial_strategy': 'mean', 'n_nearest_features': 4, 'imputation_order': 'random', 'sample_posterior': False}. Best is trial 13 with value: 0.1316992340328043.
running
[I 2024-09-22 11:31:16,621] Trial 194 finished with value: 0.13381030413175307 and parameters: {'model_name': 'IterativeImputer', 'estimator': 'Bayesian', 'initial_strategy': 'constant', 'n_nearest_features': 4, 'imputation_order': 'random', 'sample_posterior': False}. Best is trial 13 with value: 0.1316992340328043.
[I 2024-09-22 11:31:18,957] Trial 195 finished with value: 0.13381030413175307 and parameters: {'model_name': 'IterativeImputer', 'estimator': 'Bayesian', 'initial_strategy': 'constant', 'n_nearest_features': 4, 'imputation_order': 'random', 'sample_posterior': False}. Best is trial 13 with value: 0.1316992340328043.
[I 2024-09-22 11:31:20,730] Trial 196 finished with value: 0.13243582733820702 and parameters: {'model_name': 'IterativeImputer', 'estimator': 'Bayesian', 'initial_strategy': 'mean', 'n_nearest_features': 4, 'imputation_order': 'random', 'sample_posterior': False}. Best is trial 13 with value: 0.1316992340328043.
[I 2024-09-22 11:31:22,226] Trial 30 finished with value: 0.4433795910245282 and parameters: {'model_name': 'GAIN', 'batch_size': 26, 'hint_rate': 0.8969555881429067, 'alpha': 29, 'iterations': 4612, 'learning_rate': 0.0032988506054733528, 'p_miss': 0.1859510494833941}. Best is trial 13 with value: 0.1316992340328043.
[I 2024-09-22 11:31:22,942] Trial 197 finished with value: 0.13243582733820702 and parameters: {'model_name': 'IterativeImputer', 'estimator': 'Bayesian', 'initial_strategy': 'mean', 'n_nearest_features': 4, 'imputation_order': 'random', 'sample_posterior': False}. Best is trial 13 with value: 0.1316992340328043.
[I 2024-09-22 11:31:23,299] Trial 185 finished with value: 0.17756426922765195 and parameters: {'model_name': 'VAE', 'batch_size': 2, 'iterations': 125, 'learning_rate': 0.00287671761201063, 'p_miss': 0.1252100900552854}. Best is trial 13 with value: 0.1316992340328043.
[I 2024-09-22 11:31:25,471] Trial 199 finished with value: 0.13381030413175307 and parameters: {'model_name': 'IterativeImputer', 'estimator': 'Bayesian', 'initial_strategy': 'constant', 'n_nearest_features': 4, 'imputation_order': 'random', 'sample_posterior': False}. Best is trial 13 with value: 0.1316992340328043.
[I 2024-09-22 11:31:26,096] Trial 198 finished with value: 0.13381030413175307 and parameters: {'model_name': 'IterativeImputer', 'estimator': 'Bayesian', 'initial_strategy': 'constant', 'n_nearest_features': 4, 'imputation_order': 'random', 'sample_posterior': False}. Best is trial 13 with value: 0.1316992340328043.
[I 2024-09-22 11:32:39,975] Trial 96 finished with value: 0.15195495149323063 and parameters: {'model_name': 'VAE', 'batch_size': 7, 'iterations': 1144, 'learning_rate': 0.004732964853365301, 'p_miss': 0.19917120582419204}. Best is trial 13 with value: 0.1316992340328043.
[I 2024-09-22 11:38:11,707] Trial 31 finished with value: 0.14653553305201827 and parameters: {'model_name': 'VAE', 'batch_size': 60, 'iterations': 2366, 'learning_rate': 0.03950232693144386, 'p_miss': 0.0606162503575509}. Best is trial 13 with value: 0.1316992340328043.
[I 2024-09-22 11:54:52,970] Trial 88 finished with value: inf and parameters: {'model_name': 'GAIN', 'batch_size': 8, 'hint_rate': 0.09456228303211683, 'alpha': 9, 'iterations': 7558, 'learning_rate': 0.005455999516363288, 'p_miss': 0.19050953568777246}. Best is trial 13 with value: 0.1316992340328043.
[I 2024-09-22 11:59:50,398] Trial 92 finished with value: 0.4512509149757335 and parameters: {'model_name': 'GAIN', 'batch_size': 7, 'hint_rate': 0.029062880381876877, 'alpha': 0, 'iterations': 9203, 'learning_rate': 0.005479395018500655, 'p_miss': 0.29426180881589004}. Best is trial 13 with value: 0.1316992340328043.
[I 2024-09-22 12:00:09,188] Trial 34 finished with value: 0.43490007690039834 and parameters: {'model_name': 'GAIN', 'batch_size': 835, 'hint_rate': 0.5008956125711, 'alpha': 53, 'iterations': 9148, 'learning_rate': 0.09904935954812497, 'p_miss': 0.29599533776188347}. Best is trial 13 with value: 0.1316992340328043.
[I 2024-09-22 12:00:27,753] Trial 94 finished with value: 0.4339813558641959 and parameters: {'model_name': 'GAIN', 'batch_size': 6, 'hint_rate': 0.08100532539075023, 'alpha': 0, 'iterations': 9601, 'learning_rate': 0.0057453644530573895, 'p_miss': 0.29525787595125425}. Best is trial 13 with value: 0.1316992340328043.
[I 2024-09-22 12:03:27,430] Trial 95 finished with value: 0.1590445703687532 and parameters: {'model_name': 'VAE', 'batch_size': 7, 'iterations': 6661, 'learning_rate': 0.00017429489562822812, 'p_miss': 0.2019969849410135}. Best is trial 13 with value: 0.1316992340328043.
