[I 2024-08-26 17:31:00,571] Trial 199 finished with value: 0.22370280050845212 and parameters: {'model_name': 'SimpleImputer', 'strategy': 'mean'}. Best is trial 10 with value: 0.22370280050845212.
fit
simple fit
simple transform
0    0
1    0
2    0
3    0
4    0
5    0
6    0
7    0
8    0
9    0
dtype: int64
0    0
1    0
2    0
3    0
4    0
5    0
6    0
7    0
8    0
9    0
dtype: int64
0.22370280050845212
{'model_name': 'SimpleImputer', 'strategy': 'mean'}
running experiment 2/3 - Does reconstruction give good automl predictions
Start est fit
  0%|          | 0/25 [00:00<?, ?it/s]Generation:   0%|          | 0/25 [00:00<?, ?it/s]WARNING THIS INDIVIDUAL CAUSED AND EXCEPTION 
 <tpot2.search_spaces.pipelines.sequential.SequentialPipelineIndividual object at 0x155475b38280> 
 The 'criterion' parameter of DecisionTreeRegressor must be a str among {'friedman_mse', 'poisson', 'absolute_error', 'squared_error'}. Got 'mae' instead. 
 Traceback (most recent call last):
  File "/common/ketrong/tpotexp/tpot2/tpot2/utils/eval_utils.py", line 53, in objective_nan_wrapper
    value = func_timeout.func_timeout(timeout, objective_function, args=[individual], kwargs=objective_kwargs)
  File "/common/ketrong/tpotexp/env/lib/python3.10/site-packages/func_timeout/dafunc.py", line 108, in func_timeout
    raise_exception(exception)
  File "/common/ketrong/tpotexp/env/lib/python3.10/site-packages/func_timeout/py3_raise.py", line 7, in raise_exception
    raise exception[0] from None
  File "/common/ketrong/tpotexp/tpot2/tpot2/tpot_estimator/estimator.py", line 623, in objective_function
    return objective_function_generator(
  File "/common/ketrong/tpotexp/tpot2/tpot2/tpot_estimator/estimator_utils.py", line 55, in objective_function_generator
    cv_obj_scores = cross_val_score_objective(sklearn.base.clone(pipeline),x,y,scorers=scorers, cv=cv , fold=step)
  File "/common/ketrong/tpotexp/tpot2/tpot2/tpot_estimator/cross_val_utils.py", line 28, in cross_val_score_objective
    this_fold_pipeline.fit(X_train,y_train)
  File "/common/ketrong/tpotexp/env/lib/python3.10/site-packages/sklearn/base.py", line 1473, in wrapper
    return fit_method(estimator, *args, **kwargs)
  File "/common/ketrong/tpotexp/env/lib/python3.10/site-packages/sklearn/pipeline.py", line 473, in fit
    self._final_estimator.fit(Xt, y, **last_step_params["fit"])
  File "/common/ketrong/tpotexp/env/lib/python3.10/site-packages/sklearn/base.py", line 1466, in wrapper
    estimator._validate_params()
  File "/common/ketrong/tpotexp/env/lib/python3.10/site-packages/sklearn/base.py", line 666, in _validate_params
    validate_parameter_constraints(
  File "/common/ketrong/tpotexp/env/lib/python3.10/site-packages/sklearn/utils/_param_validation.py", line 95, in validate_parameter_constraints
    raise InvalidParameterError(
sklearn.utils._param_validation.InvalidParameterError: The 'criterion' parameter of DecisionTreeRegressor must be a str among {'friedman_mse', 'poisson', 'absolute_error', 'squared_error'}. Got 'mae' instead.

WARNING THIS INDIVIDUAL CAUSED AND EXCEPTION 
 <tpot2.search_spaces.pipelines.sequential.SequentialPipelineIndividual object at 0x1554764ca800> 
 The 'criterion' parameter of ExtraTreesRegressor must be a str among {'friedman_mse', 'poisson', 'absolute_error', 'squared_error'}. Got 'mae' instead. 
 Traceback (most recent call last):
  File "/common/ketrong/tpotexp/tpot2/tpot2/utils/eval_utils.py", line 53, in objective_nan_wrapper
    value = func_timeout.func_timeout(timeout, objective_function, args=[individual], kwargs=objective_kwargs)
  File "/common/ketrong/tpotexp/env/lib/python3.10/site-packages/func_timeout/dafunc.py", line 108, in func_timeout
    raise_exception(exception)
  File "/common/ketrong/tpotexp/env/lib/python3.10/site-packages/func_timeout/py3_raise.py", line 7, in raise_exception
    raise exception[0] from None
  File "/common/ketrong/tpotexp/tpot2/tpot2/tpot_estimator/estimator.py", line 623, in objective_function
    return objective_function_generator(
  File "/common/ketrong/tpotexp/tpot2/tpot2/tpot_estimator/estimator_utils.py", line 55, in objective_function_generator
    cv_obj_scores = cross_val_score_objective(sklearn.base.clone(pipeline),x,y,scorers=scorers, cv=cv , fold=step)
  File "/common/ketrong/tpotexp/tpot2/tpot2/tpot_estimator/cross_val_utils.py", line 28, in cross_val_score_objective
    this_fold_pipeline.fit(X_train,y_train)
  File "/common/ketrong/tpotexp/env/lib/python3.10/site-packages/sklearn/base.py", line 1473, in wrapper
    return fit_method(estimator, *args, **kwargs)
  File "/common/ketrong/tpotexp/env/lib/python3.10/site-packages/sklearn/pipeline.py", line 473, in fit
    self._final_estimator.fit(Xt, y, **last_step_params["fit"])
  File "/common/ketrong/tpotexp/env/lib/python3.10/site-packages/sklearn/base.py", line 1466, in wrapper
    estimator._validate_params()
  File "/common/ketrong/tpotexp/env/lib/python3.10/site-packages/sklearn/base.py", line 666, in _validate_params
    validate_parameter_constraints(
  File "/common/ketrong/tpotexp/env/lib/python3.10/site-packages/sklearn/utils/_param_validation.py", line 95, in validate_parameter_constraints
    raise InvalidParameterError(
sklearn.utils._param_validation.InvalidParameterError: The 'criterion' parameter of ExtraTreesRegressor must be a str among {'friedman_mse', 'poisson', 'absolute_error', 'squared_error'}. Got 'mae' instead.

Generation:  1
Best root_mean_squared_error score: -3.4162069665348547
Generation:   4%|▍         | 1/25 [00:47<18:53, 47.22s/it]WARNING THIS INDIVIDUAL CAUSED AND EXCEPTION 
 <tpot2.search_spaces.pipelines.sequential.SequentialPipelineIndividual object at 0x155475b2eb90> 
 The 'criterion' parameter of DecisionTreeRegressor must be a str among {'friedman_mse', 'poisson', 'absolute_error', 'squared_error'}. Got 'mae' instead. 
 Traceback (most recent call last):
  File "/common/ketrong/tpotexp/tpot2/tpot2/utils/eval_utils.py", line 53, in objective_nan_wrapper
    value = func_timeout.func_timeout(timeout, objective_function, args=[individual], kwargs=objective_kwargs)
  File "/common/ketrong/tpotexp/env/lib/python3.10/site-packages/func_timeout/dafunc.py", line 108, in func_timeout
    raise_exception(exception)
  File "/common/ketrong/tpotexp/env/lib/python3.10/site-packages/func_timeout/py3_raise.py", line 7, in raise_exception
    raise exception[0] from None
  File "/common/ketrong/tpotexp/tpot2/tpot2/tpot_estimator/estimator.py", line 623, in objective_function
    return objective_function_generator(
  File "/common/ketrong/tpotexp/tpot2/tpot2/tpot_estimator/estimator_utils.py", line 55, in objective_function_generator
    cv_obj_scores = cross_val_score_objective(sklearn.base.clone(pipeline),x,y,scorers=scorers, cv=cv , fold=step)
  File "/common/ketrong/tpotexp/tpot2/tpot2/tpot_estimator/cross_val_utils.py", line 28, in cross_val_score_objective
    this_fold_pipeline.fit(X_train,y_train)
  File "/common/ketrong/tpotexp/env/lib/python3.10/site-packages/sklearn/base.py", line 1473, in wrapper
    return fit_method(estimator, *args, **kwargs)
  File "/common/ketrong/tpotexp/env/lib/python3.10/site-packages/sklearn/pipeline.py", line 473, in fit
    self._final_estimator.fit(Xt, y, **last_step_params["fit"])
  File "/common/ketrong/tpotexp/env/lib/python3.10/site-packages/sklearn/base.py", line 1466, in wrapper
    estimator._validate_params()
  File "/common/ketrong/tpotexp/env/lib/python3.10/site-packages/sklearn/base.py", line 666, in _validate_params
    validate_parameter_constraints(
  File "/common/ketrong/tpotexp/env/lib/python3.10/site-packages/sklearn/utils/_param_validation.py", line 95, in validate_parameter_constraints
    raise InvalidParameterError(
sklearn.utils._param_validation.InvalidParameterError: The 'criterion' parameter of DecisionTreeRegressor must be a str among {'friedman_mse', 'poisson', 'absolute_error', 'squared_error'}. Got 'mae' instead.

Generation:  2
Best root_mean_squared_error score: -3.3738309656089216
Generation:   8%|▊         | 2/25 [03:36<45:36, 118.98s/it]WARNING THIS INDIVIDUAL CAUSED AND EXCEPTION 
 <tpot2.search_spaces.pipelines.sequential.SequentialPipelineIndividual object at 0x155475b58190> 
 The 'criterion' parameter of ExtraTreesRegressor must be a str among {'friedman_mse', 'poisson', 'absolute_error', 'squared_error'}. Got 'mae' instead. 
 Traceback (most recent call last):
  File "/common/ketrong/tpotexp/tpot2/tpot2/utils/eval_utils.py", line 53, in objective_nan_wrapper
    value = func_timeout.func_timeout(timeout, objective_function, args=[individual], kwargs=objective_kwargs)
  File "/common/ketrong/tpotexp/env/lib/python3.10/site-packages/func_timeout/dafunc.py", line 108, in func_timeout
    raise_exception(exception)
  File "/common/ketrong/tpotexp/env/lib/python3.10/site-packages/func_timeout/py3_raise.py", line 7, in raise_exception
    raise exception[0] from None
  File "/common/ketrong/tpotexp/tpot2/tpot2/tpot_estimator/estimator.py", line 623, in objective_function
    return objective_function_generator(
  File "/common/ketrong/tpotexp/tpot2/tpot2/tpot_estimator/estimator_utils.py", line 55, in objective_function_generator
    cv_obj_scores = cross_val_score_objective(sklearn.base.clone(pipeline),x,y,scorers=scorers, cv=cv , fold=step)
  File "/common/ketrong/tpotexp/tpot2/tpot2/tpot_estimator/cross_val_utils.py", line 28, in cross_val_score_objective
    this_fold_pipeline.fit(X_train,y_train)
  File "/common/ketrong/tpotexp/env/lib/python3.10/site-packages/sklearn/base.py", line 1473, in wrapper
    return fit_method(estimator, *args, **kwargs)
  File "/common/ketrong/tpotexp/env/lib/python3.10/site-packages/sklearn/pipeline.py", line 473, in fit
    self._final_estimator.fit(Xt, y, **last_step_params["fit"])
  File "/common/ketrong/tpotexp/env/lib/python3.10/site-packages/sklearn/base.py", line 1466, in wrapper
    estimator._validate_params()
  File "/common/ketrong/tpotexp/env/lib/python3.10/site-packages/sklearn/base.py", line 666, in _validate_params
    validate_parameter_constraints(
  File "/common/ketrong/tpotexp/env/lib/python3.10/site-packages/sklearn/utils/_param_validation.py", line 95, in validate_parameter_constraints
    raise InvalidParameterError(
sklearn.utils._param_validation.InvalidParameterError: The 'criterion' parameter of ExtraTreesRegressor must be a str among {'friedman_mse', 'poisson', 'absolute_error', 'squared_error'}. Got 'mae' instead.

Generation:  3
Best root_mean_squared_error score: -3.371092222205553
Generation:  12%|█▏        | 3/25 [03:59<27:29, 75.00s/it] WARNING THIS INDIVIDUAL CAUSED AND EXCEPTION 
 <tpot2.search_spaces.pipelines.sequential.SequentialPipelineIndividual object at 0x1554749baef0> 
 The 'criterion' parameter of ExtraTreesRegressor must be a str among {'friedman_mse', 'poisson', 'absolute_error', 'squared_error'}. Got 'mae' instead. 
 Traceback (most recent call last):
  File "/common/ketrong/tpotexp/tpot2/tpot2/utils/eval_utils.py", line 53, in objective_nan_wrapper
    value = func_timeout.func_timeout(timeout, objective_function, args=[individual], kwargs=objective_kwargs)
  File "/common/ketrong/tpotexp/env/lib/python3.10/site-packages/func_timeout/dafunc.py", line 108, in func_timeout
    raise_exception(exception)
  File "/common/ketrong/tpotexp/env/lib/python3.10/site-packages/func_timeout/py3_raise.py", line 7, in raise_exception
    raise exception[0] from None
  File "/common/ketrong/tpotexp/tpot2/tpot2/tpot_estimator/estimator.py", line 623, in objective_function
    return objective_function_generator(
  File "/common/ketrong/tpotexp/tpot2/tpot2/tpot_estimator/estimator_utils.py", line 55, in objective_function_generator
    cv_obj_scores = cross_val_score_objective(sklearn.base.clone(pipeline),x,y,scorers=scorers, cv=cv , fold=step)
  File "/common/ketrong/tpotexp/tpot2/tpot2/tpot_estimator/cross_val_utils.py", line 28, in cross_val_score_objective
    this_fold_pipeline.fit(X_train,y_train)
  File "/common/ketrong/tpotexp/env/lib/python3.10/site-packages/sklearn/base.py", line 1473, in wrapper
    return fit_method(estimator, *args, **kwargs)
  File "/common/ketrong/tpotexp/env/lib/python3.10/site-packages/sklearn/pipeline.py", line 473, in fit
    self._final_estimator.fit(Xt, y, **last_step_params["fit"])
  File "/common/ketrong/tpotexp/env/lib/python3.10/site-packages/sklearn/base.py", line 1466, in wrapper
    estimator._validate_params()
  File "/common/ketrong/tpotexp/env/lib/python3.10/site-packages/sklearn/base.py", line 666, in _validate_params
    validate_parameter_constraints(
  File "/common/ketrong/tpotexp/env/lib/python3.10/site-packages/sklearn/utils/_param_validation.py", line 95, in validate_parameter_constraints
    raise InvalidParameterError(
sklearn.utils._param_validation.InvalidParameterError: The 'criterion' parameter of ExtraTreesRegressor must be a str among {'friedman_mse', 'poisson', 'absolute_error', 'squared_error'}. Got 'mae' instead.

WARNING AN INDIVIDUAL TIMED OUT: 
 <tpot2.search_spaces.pipelines.sequential.SequentialPipelineIndividual object at 0x155475b7a3b0> 

WARNING AN INDIVIDUAL TIMED OUT: 
 <tpot2.search_spaces.pipelines.sequential.SequentialPipelineIndividual object at 0x155475ac9180> 

Generation:  4
Best root_mean_squared_error score: -3.371092222205553
Generation:  16%|█▌        | 4/25 [14:02<1:39:14, 283.57s/it]WARNING AN INDIVIDUAL TIMED OUT: 
 <tpot2.search_spaces.pipelines.sequential.SequentialPipelineIndividual object at 0x1554764cb790> 

WARNING AN INDIVIDUAL TIMED OUT: 
 <tpot2.search_spaces.pipelines.sequential.SequentialPipelineIndividual object at 0x155474e046a0> 

Generation:  5
Best root_mean_squared_error score: -3.371092222205553
Generation:  20%|██        | 5/25 [24:06<2:13:00, 399.01s/it]WARNING THIS INDIVIDUAL CAUSED AND EXCEPTION 
 <tpot2.search_spaces.pipelines.sequential.SequentialPipelineIndividual object at 0x155474dac490> 
 The 'criterion' parameter of RandomForestRegressor must be a str among {'friedman_mse', 'poisson', 'absolute_error', 'squared_error'}. Got 'mse' instead. 
 Traceback (most recent call last):
  File "/common/ketrong/tpotexp/tpot2/tpot2/utils/eval_utils.py", line 53, in objective_nan_wrapper
    value = func_timeout.func_timeout(timeout, objective_function, args=[individual], kwargs=objective_kwargs)
  File "/common/ketrong/tpotexp/env/lib/python3.10/site-packages/func_timeout/dafunc.py", line 108, in func_timeout
    raise_exception(exception)
  File "/common/ketrong/tpotexp/env/lib/python3.10/site-packages/func_timeout/py3_raise.py", line 7, in raise_exception
    raise exception[0] from None
  File "/common/ketrong/tpotexp/tpot2/tpot2/tpot_estimator/estimator.py", line 623, in objective_function
    return objective_function_generator(
  File "/common/ketrong/tpotexp/tpot2/tpot2/tpot_estimator/estimator_utils.py", line 55, in objective_function_generator
    cv_obj_scores = cross_val_score_objective(sklearn.base.clone(pipeline),x,y,scorers=scorers, cv=cv , fold=step)
  File "/common/ketrong/tpotexp/tpot2/tpot2/tpot_estimator/cross_val_utils.py", line 28, in cross_val_score_objective
    this_fold_pipeline.fit(X_train,y_train)
  File "/common/ketrong/tpotexp/env/lib/python3.10/site-packages/sklearn/base.py", line 1473, in wrapper
    return fit_method(estimator, *args, **kwargs)
  File "/common/ketrong/tpotexp/env/lib/python3.10/site-packages/sklearn/pipeline.py", line 473, in fit
    self._final_estimator.fit(Xt, y, **last_step_params["fit"])
  File "/common/ketrong/tpotexp/env/lib/python3.10/site-packages/sklearn/base.py", line 1466, in wrapper
    estimator._validate_params()
  File "/common/ketrong/tpotexp/env/lib/python3.10/site-packages/sklearn/base.py", line 666, in _validate_params
    validate_parameter_constraints(
  File "/common/ketrong/tpotexp/env/lib/python3.10/site-packages/sklearn/utils/_param_validation.py", line 95, in validate_parameter_constraints
    raise InvalidParameterError(
sklearn.utils._param_validation.InvalidParameterError: The 'criterion' parameter of RandomForestRegressor must be a str among {'friedman_mse', 'poisson', 'absolute_error', 'squared_error'}. Got 'mse' instead.

WARNING AN INDIVIDUAL TIMED OUT: 
 <tpot2.search_spaces.pipelines.sequential.SequentialPipelineIndividual object at 0x1554750b2260> 

Generation:  6
Best root_mean_squared_error score: -3.371092222205553
Generation:  24%|██▍       | 6/25 [34:09<2:28:21, 468.49s/it]WARNING THIS INDIVIDUAL CAUSED AND EXCEPTION 
 <tpot2.search_spaces.pipelines.sequential.SequentialPipelineIndividual object at 0x155474e5b4f0> 
 The 'criterion' parameter of RandomForestRegressor must be a str among {'friedman_mse', 'poisson', 'absolute_error', 'squared_error'}. Got 'mae' instead. 
 Traceback (most recent call last):
  File "/common/ketrong/tpotexp/tpot2/tpot2/utils/eval_utils.py", line 53, in objective_nan_wrapper
    value = func_timeout.func_timeout(timeout, objective_function, args=[individual], kwargs=objective_kwargs)
  File "/common/ketrong/tpotexp/env/lib/python3.10/site-packages/func_timeout/dafunc.py", line 108, in func_timeout
    raise_exception(exception)
  File "/common/ketrong/tpotexp/env/lib/python3.10/site-packages/func_timeout/py3_raise.py", line 7, in raise_exception
    raise exception[0] from None
  File "/common/ketrong/tpotexp/tpot2/tpot2/tpot_estimator/estimator.py", line 623, in objective_function
    return objective_function_generator(
  File "/common/ketrong/tpotexp/tpot2/tpot2/tpot_estimator/estimator_utils.py", line 55, in objective_function_generator
    cv_obj_scores = cross_val_score_objective(sklearn.base.clone(pipeline),x,y,scorers=scorers, cv=cv , fold=step)
  File "/common/ketrong/tpotexp/tpot2/tpot2/tpot_estimator/cross_val_utils.py", line 28, in cross_val_score_objective
    this_fold_pipeline.fit(X_train,y_train)
  File "/common/ketrong/tpotexp/env/lib/python3.10/site-packages/sklearn/base.py", line 1473, in wrapper
    return fit_method(estimator, *args, **kwargs)
  File "/common/ketrong/tpotexp/env/lib/python3.10/site-packages/sklearn/pipeline.py", line 473, in fit
    self._final_estimator.fit(Xt, y, **last_step_params["fit"])
  File "/common/ketrong/tpotexp/env/lib/python3.10/site-packages/sklearn/base.py", line 1466, in wrapper
    estimator._validate_params()
  File "/common/ketrong/tpotexp/env/lib/python3.10/site-packages/sklearn/base.py", line 666, in _validate_params
    validate_parameter_constraints(
  File "/common/ketrong/tpotexp/env/lib/python3.10/site-packages/sklearn/utils/_param_validation.py", line 95, in validate_parameter_constraints
    raise InvalidParameterError(
sklearn.utils._param_validation.InvalidParameterError: The 'criterion' parameter of RandomForestRegressor must be a str among {'friedman_mse', 'poisson', 'absolute_error', 'squared_error'}. Got 'mae' instead.

WARNING AN INDIVIDUAL TIMED OUT: 
 <tpot2.search_spaces.pipelines.sequential.SequentialPipelineIndividual object at 0x155475b3baf0> 

WARNING AN INDIVIDUAL TIMED OUT: 
 <tpot2.search_spaces.pipelines.sequential.SequentialPipelineIndividual object at 0x1554759cac20> 

WARNING AN INDIVIDUAL TIMED OUT: 
 <tpot2.search_spaces.pipelines.sequential.SequentialPipelineIndividual object at 0x155474f3ffa0> 

Generation:  7
Best root_mean_squared_error score: -3.371092222205553
Generation:  28%|██▊       | 7/25 [44:13<2:33:51, 512.84s/it]WARNING THIS INDIVIDUAL CAUSED AND EXCEPTION 
 <tpot2.search_spaces.pipelines.sequential.SequentialPipelineIndividual object at 0x155475b2d420> 
 The 'criterion' parameter of ExtraTreesRegressor must be a str among {'friedman_mse', 'poisson', 'absolute_error', 'squared_error'}. Got 'mae' instead. 
 Traceback (most recent call last):
  File "/common/ketrong/tpotexp/tpot2/tpot2/utils/eval_utils.py", line 53, in objective_nan_wrapper
    value = func_timeout.func_timeout(timeout, objective_function, args=[individual], kwargs=objective_kwargs)
  File "/common/ketrong/tpotexp/env/lib/python3.10/site-packages/func_timeout/dafunc.py", line 108, in func_timeout
    raise_exception(exception)
  File "/common/ketrong/tpotexp/env/lib/python3.10/site-packages/func_timeout/py3_raise.py", line 7, in raise_exception
    raise exception[0] from None
  File "/common/ketrong/tpotexp/tpot2/tpot2/tpot_estimator/estimator.py", line 623, in objective_function
    return objective_function_generator(
  File "/common/ketrong/tpotexp/tpot2/tpot2/tpot_estimator/estimator_utils.py", line 55, in objective_function_generator
    cv_obj_scores = cross_val_score_objective(sklearn.base.clone(pipeline),x,y,scorers=scorers, cv=cv , fold=step)
  File "/common/ketrong/tpotexp/tpot2/tpot2/tpot_estimator/cross_val_utils.py", line 28, in cross_val_score_objective
    this_fold_pipeline.fit(X_train,y_train)
  File "/common/ketrong/tpotexp/env/lib/python3.10/site-packages/sklearn/base.py", line 1473, in wrapper
    return fit_method(estimator, *args, **kwargs)
  File "/common/ketrong/tpotexp/env/lib/python3.10/site-packages/sklearn/pipeline.py", line 473, in fit
    self._final_estimator.fit(Xt, y, **last_step_params["fit"])
  File "/common/ketrong/tpotexp/env/lib/python3.10/site-packages/sklearn/base.py", line 1466, in wrapper
    estimator._validate_params()
  File "/common/ketrong/tpotexp/env/lib/python3.10/site-packages/sklearn/base.py", line 666, in _validate_params
    validate_parameter_constraints(
  File "/common/ketrong/tpotexp/env/lib/python3.10/site-packages/sklearn/utils/_param_validation.py", line 95, in validate_parameter_constraints
    raise InvalidParameterError(
sklearn.utils._param_validation.InvalidParameterError: The 'criterion' parameter of ExtraTreesRegressor must be a str among {'friedman_mse', 'poisson', 'absolute_error', 'squared_error'}. Got 'mae' instead.

Generation:  8
Best root_mean_squared_error score: -3.371092222205553
Generation:  32%|███▏      | 8/25 [52:14<2:22:26, 502.75s/it]WARNING THIS INDIVIDUAL CAUSED AND EXCEPTION 
 <tpot2.search_spaces.pipelines.sequential.SequentialPipelineIndividual o