Run: 22
/cm/local/apps/slurm/var/spool/job957877/slurm_script: line 26: 
pip install -e tpot2
pip install -r tpot2/ImputerExperiments/requirements_.txt
: No such file or directory
RunStart
Version 0.1.7a0 of tpot2 is outdated. Version 0.1.8a0 was released 2 days ago.
starting loops
../data/r/189/189.pkl
working on 
../data/r/189/reg_simple_MNAR_0.1_1
3.10880708694458
running experiment 1/3 - Does large hyperparameter space improve reconstruction accuracy over simple
[I 2024-09-19 17:50:22,521] A new study created in memory with name: no-name-3a373cee-be29-4efe-bc24-086c9ca236df
running
running
running
running
running
running
running
running
running
running
running
running
running
running
running
running
[I 2024-09-19 17:50:22,796] Trial 4 finished with value: 0.5503655951571014 and parameters: {'model_name': 'SimpleImputer', 'strategy': 'constant'}. Best is trial 4 with value: 0.5503655951571014.
running
[I 2024-09-19 17:50:22,917] Trial 5 finished with value: 0.2762014619798761 and parameters: {'model_name': 'SimpleImputer', 'strategy': 'mean'}. Best is trial 5 with value: 0.2762014619798761.
running
[I 2024-09-19 17:50:23,138] Trial 7 finished with value: 0.2762014619798761 and parameters: {'model_name': 'SimpleImputer', 'strategy': 'mean'}. Best is trial 5 with value: 0.2762014619798761.
running
[I 2024-09-19 17:50:23,250] Trial 13 finished with value: 0.5503655951571014 and parameters: {'model_name': 'SimpleImputer', 'strategy': 'constant'}. Best is trial 5 with value: 0.2762014619798761.
running
[I 2024-09-19 17:50:23,411] Trial 11 finished with value: 0.2762014619798761 and parameters: {'model_name': 'SimpleImputer', 'strategy': 'mean'}. Best is trial 5 with value: 0.2762014619798761.
running
[I 2024-09-19 17:50:23,536] Trial 2 finished with value: 0.2770508115625572 and parameters: {'model_name': 'SimpleImputer', 'strategy': 'median'}. Best is trial 5 with value: 0.2762014619798761.
running
[I 2024-09-19 17:50:23,667] Trial 9 finished with value: 0.2762014619798761 and parameters: {'model_name': 'SimpleImputer', 'strategy': 'mean'}. Best is trial 5 with value: 0.2762014619798761.
running
[I 2024-09-19 17:50:23,775] Trial 15 finished with value: 0.2762014619798761 and parameters: {'model_name': 'SimpleImputer', 'strategy': 'mean'}. Best is trial 5 with value: 0.2762014619798761.
[I 2024-09-19 17:50:23,917] Trial 0 finished with value: 0.2770508115625572 and parameters: {'model_name': 'SimpleImputer', 'strategy': 'median'}. Best is trial 5 with value: 0.2762014619798761.
running
[I 2024-09-19 17:50:24,009] Trial 16 finished with value: 0.5503655951571014 and parameters: {'model_name': 'SimpleImputer', 'strategy': 'constant'}. Best is trial 5 with value: 0.2762014619798761.
running
running
[I 2024-09-19 17:50:24,198] Trial 18 finished with value: 0.5503655951571014 and parameters: {'model_name': 'SimpleImputer', 'strategy': 'constant'}. Best is trial 5 with value: 0.2762014619798761.
[I 2024-09-19 17:50:24,287] Trial 10 finished with value: 0.2770508115625572 and parameters: {'model_name': 'SimpleImputer', 'strategy': 'median'}. Best is trial 5 with value: 0.2762014619798761.
running
running
[I 2024-09-19 17:50:24,390] Trial 8 finished with value: 0.2770508115625572 and parameters: {'model_name': 'SimpleImputer', 'strategy': 'median'}. Best is trial 5 with value: 0.2762014619798761.
running
[I 2024-09-19 17:50:24,636] Trial 6 finished with value: 0.2770508115625572 and parameters: {'model_name': 'SimpleImputer', 'strategy': 'median'}. Best is trial 5 with value: 0.2762014619798761.
running
[I 2024-09-19 17:50:24,828] Trial 22 finished with value: 0.5503655951571014 and parameters: {'model_name': 'SimpleImputer', 'strategy': 'constant'}. Best is trial 5 with value: 0.2762014619798761.
running
[I 2024-09-19 17:50:24,927] Trial 1 finished with value: 0.5503655951571014 and parameters: {'model_name': 'SimpleImputer', 'strategy': 'most_frequent'}. Best is trial 5 with value: 0.2762014619798761.
running
[I 2024-09-19 17:50:25,060] Trial 19 finished with value: 0.2770508115625572 and parameters: {'model_name': 'SimpleImputer', 'strategy': 'median'}. Best is trial 5 with value: 0.2762014619798761.
running
[I 2024-09-19 17:50:25,326] Trial 17 finished with value: 0.2770508115625572 and parameters: {'model_name': 'SimpleImputer', 'strategy': 'median'}. Best is trial 5 with value: 0.2762014619798761.
[I 2024-09-19 17:50:25,421] Trial 3 finished with value: 0.5503655951571014 and parameters: {'model_name': 'SimpleImputer', 'strategy': 'most_frequent'}. Best is trial 5 with value: 0.2762014619798761.
running
running
[I 2024-09-19 17:50:25,530] Trial 21 finished with value: 0.2770508115625572 and parameters: {'model_name': 'SimpleImputer', 'strategy': 'median'}. Best is trial 5 with value: 0.2762014619798761.
running
[I 2024-09-19 17:50:25,775] Trial 32 finished with value: 0.2762014619798761 and parameters: {'model_name': 'SimpleImputer', 'strategy': 'mean'}. Best is trial 5 with value: 0.2762014619798761.
running
[I 2024-09-19 17:50:25,925] Trial 31 finished with value: 0.2762014619798761 and parameters: {'model_name': 'SimpleImputer', 'strategy': 'mean'}. Best is trial 5 with value: 0.2762014619798761.
running
[I 2024-09-19 17:50:26,094] Trial 20 finished with value: 0.5503655951571014 and parameters: {'model_name': 'SimpleImputer', 'strategy': 'most_frequent'}. Best is trial 5 with value: 0.2762014619798761.
[I 2024-09-19 17:50:26,186] Trial 14 finished with value: 0.5503655951571014 and parameters: {'model_name': 'SimpleImputer', 'strategy': 'most_frequent'}. Best is trial 5 with value: 0.2762014619798761.
[I 2024-09-19 17:50:26,277] Trial 12 finished with value: 0.5503655951571014 and parameters: {'model_name': 'SimpleImputer', 'strategy': 'most_frequent'}. Best is trial 5 with value: 0.2762014619798761.
running
running
running
[I 2024-09-19 17:50:26,439] Trial 34 finished with value: 0.2762014619798761 and parameters: {'model_name': 'SimpleImputer', 'strategy': 'mean'}. Best is trial 5 with value: 0.2762014619798761.
running
[I 2024-09-19 17:50:26,550] Trial 30 finished with value: 0.2762014619798761 and parameters: {'model_name': 'SimpleImputer', 'strategy': 'mean'}. Best is trial 5 with value: 0.2762014619798761.
running
[I 2024-09-19 17:50:26,717] Trial 23 finished with value: 0.5503655951571014 and parameters: {'model_name': 'SimpleImputer', 'strategy': 'most_frequent'}. Best is trial 5 with value: 0.2762014619798761.
running
[I 2024-09-19 17:50:26,848] Trial 24 finished with value: 0.5503655951571014 and parameters: {'model_name': 'SimpleImputer', 'strategy': 'most_frequent'}. Best is trial 5 with value: 0.2762014619798761.
running
[I 2024-09-19 17:50:26,989] Trial 36 finished with value: 0.2762014619798761 and parameters: {'model_name': 'SimpleImputer', 'strategy': 'mean'}. Best is trial 5 with value: 0.2762014619798761.
[I 2024-09-19 17:50:27,106] Trial 33 finished with value: 0.2762014619798761 and parameters: {'model_name': 'SimpleImputer', 'strategy': 'mean'}. Best is trial 5 with value: 0.2762014619798761.
running
running
[I 2024-09-19 17:50:27,206] Trial 25 finished with value: 0.5503655951571014 and parameters: {'model_name': 'SimpleImputer', 'strategy': 'most_frequent'}. Best is trial 5 with value: 0.2762014619798761.
[I 2024-09-19 17:50:27,328] Trial 37 finished with value: 0.2762014619798761 and parameters: {'model_name': 'SimpleImputer', 'strategy': 'mean'}. Best is trial 5 with value: 0.2762014619798761.
running
running
[I 2024-09-19 17:50:27,451] Trial 27 finished with value: 0.5503655951571014 and parameters: {'model_name': 'SimpleImputer', 'strategy': 'most_frequent'}. Best is trial 5 with value: 0.2762014619798761.
running
[I 2024-09-19 17:50:27,602] Trial 38 finished with value: 0.2762014619798761 and parameters: {'model_name': 'SimpleImputer', 'strategy': 'mean'}. Best is trial 5 with value: 0.2762014619798761.
running
[I 2024-09-19 17:50:27,746] Trial 28 finished with value: 0.5503655951571014 and parameters: {'model_name': 'SimpleImputer', 'strategy': 'most_frequent'}. Best is trial 5 with value: 0.2762014619798761.
[I 2024-09-19 17:50:27,830] Trial 35 finished with value: 0.2762014619798761 and parameters: {'model_name': 'SimpleImputer', 'strategy': 'mean'}. Best is trial 5 with value: 0.2762014619798761.
running
running
[I 2024-09-19 17:50:27,944] Trial 26 finished with value: 0.5503655951571014 and parameters: {'model_name': 'SimpleImputer', 'strategy': 'most_frequent'}. Best is trial 5 with value: 0.2762014619798761.
running
[I 2024-09-19 17:50:28,062] Trial 40 finished with value: 0.2762014619798761 and parameters: {'model_name': 'SimpleImputer', 'strategy': 'mean'}. Best is trial 5 with value: 0.2762014619798761.
[I 2024-09-19 17:50:28,164] Trial 41 finished with value: 0.2762014619798761 and parameters: {'model_name': 'SimpleImputer', 'strategy': 'mean'}. Best is trial 5 with value: 0.2762014619798761.
running
running
[I 2024-09-19 17:50:28,321] Trial 42 finished with value: 0.2762014619798761 and parameters: {'model_name': 'SimpleImputer', 'strategy': 'mean'}. Best is trial 5 with value: 0.2762014619798761.
running
[I 2024-09-19 17:50:28,429] Trial 29 finished with value: 0.5503655951571014 and parameters: {'model_name': 'SimpleImputer', 'strategy': 'most_frequent'}. Best is trial 5 with value: 0.2762014619798761.
[I 2024-09-19 17:50:28,580] Trial 47 finished with value: 0.2762014619798761 and parameters: {'model_name': 'SimpleImputer', 'strategy': 'mean'}. Best is trial 5 with value: 0.2762014619798761.
running
running
[I 2024-09-19 17:50:28,735] Trial 43 finished with value: 0.2762014619798761 and parameters: {'model_name': 'SimpleImputer', 'strategy': 'mean'}. Best is trial 5 with value: 0.2762014619798761.
running
[I 2024-09-19 17:50:28,866] Trial 39 finished with value: 0.2762014619798761 and parameters: {'model_name': 'SimpleImputer', 'strategy': 'mean'}. Best is trial 5 with value: 0.2762014619798761.
running
[I 2024-09-19 17:50:29,016] Trial 52 finished with value: 0.2762014619798761 and parameters: {'model_name': 'SimpleImputer', 'strategy': 'mean'}. Best is trial 5 with value: 0.2762014619798761.
[I 2024-09-19 17:50:29,117] Trial 46 finished with value: 0.2762014619798761 and parameters: {'model_name': 'SimpleImputer', 'strategy': 'mean'}. Best is trial 5 with value: 0.2762014619798761.
running
running
[I 2024-09-19 17:50:29,216] Trial 49 finished with value: 0.2762014619798761 and parameters: {'model_name': 'SimpleImputer', 'strategy': 'mean'}. Best is trial 5 with value: 0.2762014619798761.
[I 2024-09-19 17:50:29,298] Trial 48 finished with value: 0.2762014619798761 and parameters: {'model_name': 'SimpleImputer', 'strategy': 'mean'}. Best is trial 5 with value: 0.2762014619798761.
running
running
[I 2024-09-19 17:50:29,388] Trial 45 finished with value: 0.2762014619798761 and parameters: {'model_name': 'SimpleImputer', 'strategy': 'mean'}. Best is trial 5 with value: 0.2762014619798761.
[I 2024-09-19 17:50:29,476] Trial 44 finished with value: 0.2762014619798761 and parameters: {'model_name': 'SimpleImputer', 'strategy': 'mean'}. Best is trial 5 with value: 0.2762014619798761.
running
[I 2024-09-19 17:50:29,587] Trial 50 finished with value: 0.2762014619798761 and parameters: {'model_name': 'SimpleImputer', 'strategy': 'mean'}. Best is trial 5 with value: 0.2762014619798761.
[I 2024-09-19 17:50:29,679] Trial 55 finished with value: 0.2762014619798761 and parameters: {'model_name': 'SimpleImputer', 'strategy': 'mean'}. Best is trial 5 with value: 0.2762014619798761.
running
running
running
[I 2024-09-19 17:50:29,919] Trial 53 finished with value: 0.2762014619798761 and parameters: {'model_name': 'SimpleImputer', 'strategy': 'mean'}. Best is trial 5 with value: 0.2762014619798761.
[I 2024-09-19 17:50:30,009] Trial 54 finished with value: 0.2762014619798761 and parameters: {'model_name': 'SimpleImputer', 'strategy': 'mean'}. Best is trial 5 with value: 0.2762014619798761.
running
running
[I 2024-09-19 17:50:30,165] Trial 67 finished with value: 0.5503655951571014 and parameters: {'model_name': 'SimpleImputer', 'strategy': 'constant'}. Best is trial 5 with value: 0.2762014619798761.
running
[I 2024-09-19 17:50:30,306] Trial 58 finished with value: 0.2762014619798761 and parameters: {'model_name': 'SimpleImputer', 'strategy': 'mean'}. Best is trial 5 with value: 0.2762014619798761.
[I 2024-09-19 17:50:30,436] Trial 51 finished with value: 0.2762014619798761 and parameters: {'model_name': 'SimpleImputer', 'strategy': 'mean'}. Best is trial 5 with value: 0.2762014619798761.
[I 2024-09-19 17:50:30,530] Trial 63 finished with value: 0.2762014619798761 and parameters: {'model_name': 'SimpleImputer', 'strategy': 'mean'}. Best is trial 5 with value: 0.2762014619798761.
[I 2024-09-19 17:50:30,622] Trial 60 finished with value: 0.2762014619798761 and parameters: {'model_name': 'SimpleImputer', 'strategy': 'mean'}. Best is trial 5 with value: 0.2762014619798761.
running
[I 2024-09-19 17:50:30,708] Trial 57 finished with value: 0.2762014619798761 and parameters: {'model_name': 'SimpleImputer', 'strategy': 'mean'}. Best is trial 5 with value: 0.2762014619798761.
[I 2024-09-19 17:50:30,789] Trial 56 finished with value: 0.2762014619798761 and parameters: {'model_name': 'SimpleImputer', 'strategy': 'mean'}. Best is trial 5 with value: 0.2762014619798761.
running
running
running
[I 2024-09-19 17:50:30,901] Trial 66 finished with value: 0.5503655951571014 and parameters: {'model_name': 'SimpleImputer', 'strategy': 'constant'}. Best is trial 5 with value: 0.2762014619798761.
[I 2024-09-19 17:50:30,994] Trial 68 finished with value: 0.5503655951571014 and parameters: {'model_name': 'SimpleImputer', 'strategy': 'constant'}. Best is trial 5 with value: 0.2762014619798761.
[I 2024-09-19 17:50:31,075] Trial 62 finished with value: 0.2762014619798761 and parameters: {'model_name': 'SimpleImputer', 'strategy': 'mean'}. Best is trial 5 with value: 0.2762014619798761.
running
[I 2024-09-19 17:50:31,167] Trial 64 finished with value: 0.2762014619798761 and parameters: {'model_name': 'SimpleImputer', 'strategy': 'mean'}. Best is trial 5 with value: 0.2762014619798761.
running
running
running
[I 2024-09-19 17:50:31,288] Trial 59 finished with value: 0.2762014619798761 and parameters: {'model_name': 'SimpleImputer', 'strategy': 'mean'}. Best is trial 5 with value: 0.2762014619798761.
[I 2024-09-19 17:50:31,376] Trial 61 finished with value: 0.2762014619798761 and parameters: {'model_name': 'SimpleImputer', 'strategy': 'mean'}. Best is trial 5 with value: 0.2762014619798761.
running
[I 2024-09-19 17:50:31,479] Trial 65 finished with value: 0.2762014619798761 and parameters: {'model_name': 'SimpleImputer', 'strategy': 'mean'}. Best is trial 5 with value: 0.2762014619798761.
running
running
running
running
[I 2024-09-19 17:50:31,781] Trial 69 finished with value: 0.5503655951571014 and parameters: {'model_name': 'SimpleImputer', 'strategy': 'constant'}. Best is trial 5 with value: 0.2762014619798761.
running
[I 2024-09-19 17:50:31,957] Trial 70 finished with value: 0.2770508115625572 and parameters: {'model_name': 'SimpleImputer', 'strategy': 'median'}. Best is trial 5 with value: 0.2762014619798761.
running
[I 2024-09-19 17:50:32,097] Trial 71 finished with value: 0.2770508115625572 and parameters: {'model_name': 'SimpleImputer', 'strategy': 'median'}. Best is trial 5 with value: 0.2762014619798761.
running
[I 2024-09-19 17:50:32,272] Trial 75 finished with value: 0.2770508115625572 and parameters: {'model_name': 'SimpleImputer', 'strategy': 'median'}. Best is trial 5 with value: 0.2762014619798761.
running
[I 2024-09-19 17:50:32,421] Trial 78 finished with value: 0.2770508115625572 and parameters: {'model_name': 'SimpleImputer', 'strategy': 'median'}. Best is trial 5 with value: 0.2762014619798761.
[I 2024-09-19 17:50:32,514] Trial 72 finished with value: 0.2770508115625572 and parameters: {'model_name': 'SimpleImputer', 'strategy': 'median'}. Best is trial 5 with value: 0.2762014619798761.
[I 2024-09-19 17:50:32,595] Trial 77 finished with value: 0.2770508115625572 and parameters: {'model_name': 'SimpleImputer', 'strategy': 'median'}. Best is trial 5 with value: 0.2762014619798761.
running
running
running
[I 2024-09-19 17:50:32,727] Trial 81 finished with value: 0.2770508115625572 and parameters: {'model_name': 'SimpleImputer', 'strategy': 'median'}. Best is trial 5 with value: 0.2762014619798761.
running
[I 2024-09-19 17:50:32,825] Trial 83 finished with value: 0.2770508115625572 and parameters: {'model_name': 'SimpleImputer', 'strategy': 'median'}. Best is trial 5 with value: 0.2762014619798761.
[I 2024-09-19 17:50:32,908] Trial 73 finished with value: 0.2770508115625572 and parameters: {'model_name': 'SimpleImputer', 'strategy': 'median'}. Best is trial 5 with value: 0.2762014619798761.
running
[I 2024-09-19 17:50:32,908] Trial 76 finished with value: 0.2770508115625572 and parameters: {'model_name': 'SimpleImputer', 'strategy': 'median'}. Best is trial 5 with value: 0.2762014619798761.
running
[I 2024-09-19 17:50:33,003] Trial 80 finished with value: 0.2770508115625572 and parameters: {'model_name': 'SimpleImputer', 'strategy': 'median'}. Best is trial 5 with value: 0.2762014619798761.
running
[I 2024-09-19 17:50:33,225] Trial 84 finished with value: 0.2770508115625572 and parameters: {'model_name': 'SimpleImputer', 'strategy': 'median'}. Best is trial 5 with value: 0.2762014619798761.
running
[I 2024-09-19 17:50:33,315] Trial 79 finished with value: 0.2770508115625572 and parameters: {'model_name': 'SimpleImputer', 'strategy': 'median'}. Best is trial 5 with value: 0.2762014619798761.
running
running
[I 2024-09-19 17:50:33,410] Trial 82 finished with value: 0.2770508115625572 and parameters: {'model_name': 'SimpleImputer', 'strategy': 'median'}. Best is trial 5 with value: 0.2762014619798761.
running
[I 2024-09-19 17:50:33,520] Trial 74 finished with value: 0.2770508115625572 and parameters: {'model_name': 'SimpleImputer', 'strategy': 'median'}. Best is trial 5 with value: 0.2762014619798761.
running
[I 2024-09-19 17:50:33,646] Trial 87 finished with value: 0.2762014619798761 and parameters: {'model_name': 'SimpleImputer', 'strategy': 'mean'}. Best is trial 5 with value: 0.2762014619798761.
[I 2024-09-19 17:50:33,786] Trial 88 finished with value: 0.2762014619798761 and parameters: {'model_name': 'SimpleImputer', 'strategy': 'mean'}. Best is trial 5 with value: 0.2762014619798761.
running
running
[I 2024-09-19 17:50:33,952] Trial 89 finished with value: 0.2762014619798761 and parameters: {'model_name': 'SimpleImputer', 'strategy': 'mean'}. Best is trial 5 with value: 0.2762014619798761.
running
[I 2024-09-19 17:50:34,120] Trial 86 finished with value: 0.2770508115625572 and parameters: {'model_name': 'SimpleImputer', 'strategy': 'median'}. Best is trial 5 with value: 0.2762014619798761.
[I 2024-09-19 17:50:34,203] Trial 90 finished with value: 0.2762014619798761 and parameters: {'model_name': 'SimpleImputer', 'strategy': 'mean'}. Best is trial 5 with value: 0.2762014619798761.
running
running
[I 2024-09-19 17:50:34,342] Trial 92 finished with value: 0.2762014619798761 and parameters: {'model_name': 'SimpleImputer', 'strategy': 'mean'}. Best is trial 5 with value: 0.2762014619798761.
[I 2024-09-19 17:50:34,449] Trial 94 finished with value: 0.2762014619798761 and parameters: {'model_name': 'SimpleImputer', 'strategy': 'mean'}. Best is trial 5 with value: 0.2762014619798761.
[I 2024-09-19 17:50:34,529] Trial 93 finished with value: 0.2762014619798761 and parameters: {'model_name': 'SimpleImputer', 'strategy': 'mean'}. Best is trial 5 with value: 0.2762014619798761.
running
running
[I 2024-09-19 17:50:34,636] Trial 85 finished with value: 0.2770508115625572 and parameters: {'model_name': 'SimpleImputer', 'strategy': 'median'}. Best is trial 5 with value: 0.2762014619798761.
[I 2024-09-19 17:50:34,723] Trial 91 finished with value: 0.2762014619798761 and parameters: {'model_name': 'SimpleImputer', 'strategy': 'mean'}. Best is trial 5 with value: 0.2762014619798761.
running
running
[I 2024-09-19 17:50:34,846] Trial 99 finished with value: 0.2762014619798761 and parameters: {'model_name': 'SimpleImputer', 'strategy': 'mean'}. Best is trial 5 with value: 0.2762014619798761.
running
[I 2024-09-19 17:50:34,942] Trial 98 finished with value: 0.2762014619798761 and parameters: {'model_name': 'SimpleImputer', 'strategy': 'mean'}. Best is trial 5 with value: 0.2762014619798761.
running
[I 2024-09-19 17:50:35,030] Trial 100 finished with value: 0.2762014619798761 and parameters: {'model_name': 'SimpleImputer', 'strategy': 'mean'}. Best is trial 5 with value: 0.2762014619798761.
running
[I 2024-09-19 17:50:35,135] Trial 97 finished with value: 0.2762014619798761 and parameters: {'model_name': 'SimpleImputer', 'strategy': 'mean'}. Best is trial 5 with value: 0.2762014619798761.
running
[I 2024-09-19 17:50:35,230] Trial 95 finished with value: 0.2762014619798761 and parameters: {'model_name': 'SimpleImputer', 'strategy': 'mean'}. Best is trial 5 with value: 0.2762014619798761.
[I 2024-09-19 17:50:35,320] Trial 102 finished with value: 0.2762014619798761 and parameters: {'model_name': 'SimpleImputer', 'strategy': 'mean'}. Best is trial 5 with value: 0.2762014619798761.
running
running
running
[I 2024-09-19 17:50:35,464] Trial 96 finished with value: 0.2762014619798761 and parameters: {'model_name': 'SimpleImputer', 'strategy': 'mean'}. Best is trial 5 with value: 0.2762014619798761.
running
[I 2024-09-19 17:50:35,563] Trial 101 finished with value: 0.2762014619798761 and parameters: {'model_name': 'SimpleImputer', 'strategy': 'mean'}. Best is trial 5 with value: 0.2762014619798761.
running
[I 2024-09-19 17:50:35,719] Trial 103 finished with value: 0.2762014619798761 and parameters: {'model_name': 'SimpleImputer', 'strategy': 'mean'}. Best is trial 5 with value: 0.2762014619798761.
running
