[I 2024-09-20 15:51:32,721] Trial 105 finished with value: 0.165990265495031 and parameters: {'model_name': 'SimpleImputer', 'strategy': 'mean'}. Best is trial 4 with value: 0.165990265495031.
running
[I 2024-09-20 15:51:32,915] Trial 104 finished with value: 0.165990265495031 and parameters: {'model_name': 'SimpleImputer', 'strategy': 'mean'}. Best is trial 4 with value: 0.165990265495031.
[I 2024-09-20 15:51:33,038] Trial 106 finished with value: 0.165990265495031 and parameters: {'model_name': 'SimpleImputer', 'strategy': 'mean'}. Best is trial 4 with value: 0.165990265495031.
[I 2024-09-20 15:51:33,141] Trial 108 finished with value: 0.165990265495031 and parameters: {'model_name': 'SimpleImputer', 'strategy': 'mean'}. Best is trial 4 with value: 0.165990265495031.
running
running
running
[I 2024-09-20 15:51:33,293] Trial 111 finished with value: 0.165990265495031 and parameters: {'model_name': 'SimpleImputer', 'strategy': 'mean'}. Best is trial 4 with value: 0.165990265495031.
running
[I 2024-09-20 15:51:33,438] Trial 107 finished with value: 0.165990265495031 and parameters: {'model_name': 'SimpleImputer', 'strategy': 'mean'}. Best is trial 4 with value: 0.165990265495031.
running
[I 2024-09-20 15:51:33,593] Trial 110 finished with value: 0.165990265495031 and parameters: {'model_name': 'SimpleImputer', 'strategy': 'mean'}. Best is trial 4 with value: 0.165990265495031.
running
[I 2024-09-20 15:51:33,753] Trial 109 finished with value: 0.165990265495031 and parameters: {'model_name': 'SimpleImputer', 'strategy': 'mean'}. Best is trial 4 with value: 0.165990265495031.
running
[I 2024-09-20 15:51:33,880] Trial 115 finished with value: 0.165990265495031 and parameters: {'model_name': 'SimpleImputer', 'strategy': 'mean'}. Best is trial 4 with value: 0.165990265495031.
running
[I 2024-09-20 15:51:34,002] Trial 113 finished with value: 0.165990265495031 and parameters: {'model_name': 'SimpleImputer', 'strategy': 'mean'}. Best is trial 4 with value: 0.165990265495031.
running
[I 2024-09-20 15:51:34,116] Trial 114 finished with value: 0.165990265495031 and parameters: {'model_name': 'SimpleImputer', 'strategy': 'mean'}. Best is trial 4 with value: 0.165990265495031.
running
[I 2024-09-20 15:51:34,226] Trial 112 finished with value: 0.165990265495031 and parameters: {'model_name': 'SimpleImputer', 'strategy': 'mean'}. Best is trial 4 with value: 0.165990265495031.
[I 2024-09-20 15:51:34,370] Trial 116 finished with value: 0.165990265495031 and parameters: {'model_name': 'SimpleImputer', 'strategy': 'mean'}. Best is trial 4 with value: 0.165990265495031.
running
running
[I 2024-09-20 15:51:34,546] Trial 118 finished with value: 0.165990265495031 and parameters: {'model_name': 'SimpleImputer', 'strategy': 'mean'}. Best is trial 4 with value: 0.165990265495031.
running
[I 2024-09-20 15:51:34,704] Trial 117 finished with value: 0.165990265495031 and parameters: {'model_name': 'SimpleImputer', 'strategy': 'mean'}. Best is trial 4 with value: 0.165990265495031.
running
[I 2024-09-20 15:51:34,843] Trial 120 finished with value: 0.165990265495031 and parameters: {'model_name': 'SimpleImputer', 'strategy': 'mean'}. Best is trial 4 with value: 0.165990265495031.
[I 2024-09-20 15:51:34,954] Trial 119 finished with value: 0.165990265495031 and parameters: {'model_name': 'SimpleImputer', 'strategy': 'mean'}. Best is trial 4 with value: 0.165990265495031.
[I 2024-09-20 15:51:35,064] Trial 122 finished with value: 0.165990265495031 and parameters: {'model_name': 'SimpleImputer', 'strategy': 'mean'}. Best is trial 4 with value: 0.165990265495031.
running
running
running
[I 2024-09-20 15:51:35,227] Trial 125 finished with value: 0.165990265495031 and parameters: {'model_name': 'SimpleImputer', 'strategy': 'mean'}. Best is trial 4 with value: 0.165990265495031.
running
[I 2024-09-20 15:51:35,350] Trial 124 finished with value: 0.165990265495031 and parameters: {'model_name': 'SimpleImputer', 'strategy': 'mean'}. Best is trial 4 with value: 0.165990265495031.
[I 2024-09-20 15:51:35,448] Trial 121 finished with value: 0.165990265495031 and parameters: {'model_name': 'SimpleImputer', 'strategy': 'mean'}. Best is trial 4 with value: 0.165990265495031.
running
running
[I 2024-09-20 15:51:35,605] Trial 123 finished with value: 0.165990265495031 and parameters: {'model_name': 'SimpleImputer', 'strategy': 'mean'}. Best is trial 4 with value: 0.165990265495031.
[I 2024-09-20 15:51:35,708] Trial 128 finished with value: 0.165990265495031 and parameters: {'model_name': 'SimpleImputer', 'strategy': 'mean'}. Best is trial 4 with value: 0.165990265495031.
running
running
[I 2024-09-20 15:51:35,824] Trial 126 finished with value: 0.165990265495031 and parameters: {'model_name': 'SimpleImputer', 'strategy': 'mean'}. Best is trial 4 with value: 0.165990265495031.
running
[I 2024-09-20 15:51:35,955] Trial 129 finished with value: 0.165990265495031 and parameters: {'model_name': 'SimpleImputer', 'strategy': 'mean'}. Best is trial 4 with value: 0.165990265495031.
running
[I 2024-09-20 15:51:36,117] Trial 127 finished with value: 0.165990265495031 and parameters: {'model_name': 'SimpleImputer', 'strategy': 'mean'}. Best is trial 4 with value: 0.165990265495031.
running
[I 2024-09-20 15:51:36,320] Trial 130 finished with value: 0.165990265495031 and parameters: {'model_name': 'SimpleImputer', 'strategy': 'mean'}. Best is trial 4 with value: 0.165990265495031.
running
[I 2024-09-20 15:51:36,549] Trial 132 finished with value: 0.165990265495031 and parameters: {'model_name': 'SimpleImputer', 'strategy': 'mean'}. Best is trial 4 with value: 0.165990265495031.
[I 2024-09-20 15:51:36,649] Trial 137 finished with value: 0.165990265495031 and parameters: {'model_name': 'SimpleImputer', 'strategy': 'mean'}. Best is trial 4 with value: 0.165990265495031.
running
running
[I 2024-09-20 15:51:36,777] Trial 131 finished with value: 0.165990265495031 and parameters: {'model_name': 'SimpleImputer', 'strategy': 'mean'}. Best is trial 4 with value: 0.165990265495031.
running
[I 2024-09-20 15:51:36,918] Trial 136 finished with value: 0.165990265495031 and parameters: {'model_name': 'SimpleImputer', 'strategy': 'mean'}. Best is trial 4 with value: 0.165990265495031.
running
[I 2024-09-20 15:51:37,034] Trial 135 finished with value: 0.165990265495031 and parameters: {'model_name': 'SimpleImputer', 'strategy': 'mean'}. Best is trial 4 with value: 0.165990265495031.
running
[I 2024-09-20 15:51:37,138] Trial 134 finished with value: 0.165990265495031 and parameters: {'model_name': 'SimpleImputer', 'strategy': 'mean'}. Best is trial 4 with value: 0.165990265495031.
running
[I 2024-09-20 15:51:37,324] Trial 138 finished with value: 0.165990265495031 and parameters: {'model_name': 'SimpleImputer', 'strategy': 'mean'}. Best is trial 4 with value: 0.165990265495031.
running
[I 2024-09-20 15:51:37,442] Trial 140 finished with value: 0.165990265495031 and parameters: {'model_name': 'SimpleImputer', 'strategy': 'mean'}. Best is trial 4 with value: 0.165990265495031.
running
[I 2024-09-20 15:51:37,570] Trial 141 finished with value: 0.165990265495031 and parameters: {'model_name': 'SimpleImputer', 'strategy': 'mean'}. Best is trial 4 with value: 0.165990265495031.
running
[I 2024-09-20 15:51:37,673] Trial 133 finished with value: 0.165990265495031 and parameters: {'model_name': 'SimpleImputer', 'strategy': 'mean'}. Best is trial 4 with value: 0.165990265495031.
running
[I 2024-09-20 15:51:37,793] Trial 142 finished with value: 0.165990265495031 and parameters: {'model_name': 'SimpleImputer', 'strategy': 'mean'}. Best is trial 4 with value: 0.165990265495031.
running
[I 2024-09-20 15:51:37,940] Trial 143 finished with value: 0.165990265495031 and parameters: {'model_name': 'SimpleImputer', 'strategy': 'mean'}. Best is trial 4 with value: 0.165990265495031.
[I 2024-09-20 15:51:38,040] Trial 139 finished with value: 0.165990265495031 and parameters: {'model_name': 'SimpleImputer', 'strategy': 'mean'}. Best is trial 4 with value: 0.165990265495031.
[I 2024-09-20 15:51:38,159] Trial 145 finished with value: 0.165990265495031 and parameters: {'model_name': 'SimpleImputer', 'strategy': 'mean'}. Best is trial 4 with value: 0.165990265495031.
running
running
running
[I 2024-09-20 15:51:38,286] Trial 144 finished with value: 0.165990265495031 and parameters: {'model_name': 'SimpleImputer', 'strategy': 'mean'}. Best is trial 4 with value: 0.165990265495031.
running
[I 2024-09-20 15:51:38,419] Trial 146 finished with value: 0.165990265495031 and parameters: {'model_name': 'SimpleImputer', 'strategy': 'mean'}. Best is trial 4 with value: 0.165990265495031.
running
[I 2024-09-20 15:51:38,633] Trial 149 finished with value: 0.165990265495031 and parameters: {'model_name': 'SimpleImputer', 'strategy': 'mean'}. Best is trial 4 with value: 0.165990265495031.
running
[I 2024-09-20 15:51:38,762] Trial 150 finished with value: 0.165990265495031 and parameters: {'model_name': 'SimpleImputer', 'strategy': 'mean'}. Best is trial 4 with value: 0.165990265495031.
[I 2024-09-20 15:51:38,871] Trial 148 finished with value: 0.165990265495031 and parameters: {'model_name': 'SimpleImputer', 'strategy': 'mean'}. Best is trial 4 with value: 0.165990265495031.
running
running
[I 2024-09-20 15:51:39,028] Trial 147 finished with value: 0.165990265495031 and parameters: {'model_name': 'SimpleImputer', 'strategy': 'mean'}. Best is trial 4 with value: 0.165990265495031.
running
[I 2024-09-20 15:51:39,171] Trial 151 finished with value: 0.165990265495031 and parameters: {'model_name': 'SimpleImputer', 'strategy': 'mean'}. Best is trial 4 with value: 0.165990265495031.
[I 2024-09-20 15:51:39,278] Trial 152 finished with value: 0.165990265495031 and parameters: {'model_name': 'SimpleImputer', 'strategy': 'mean'}. Best is trial 4 with value: 0.165990265495031.
running
running
[I 2024-09-20 15:51:39,516] Trial 153 finished with value: 0.165990265495031 and parameters: {'model_name': 'SimpleImputer', 'strategy': 'mean'}. Best is trial 4 with value: 0.165990265495031.
[I 2024-09-20 15:51:39,618] Trial 156 finished with value: 0.165990265495031 and parameters: {'model_name': 'SimpleImputer', 'strategy': 'mean'}. Best is trial 4 with value: 0.165990265495031.
running
running
[I 2024-09-20 15:51:39,794] Trial 157 finished with value: 0.165990265495031 and parameters: {'model_name': 'SimpleImputer', 'strategy': 'mean'}. Best is trial 4 with value: 0.165990265495031.
running
[I 2024-09-20 15:51:39,909] Trial 154 finished with value: 0.165990265495031 and parameters: {'model_name': 'SimpleImputer', 'strategy': 'mean'}. Best is trial 4 with value: 0.165990265495031.
running
[I 2024-09-20 15:51:40,029] Trial 161 finished with value: 0.165990265495031 and parameters: {'model_name': 'SimpleImputer', 'strategy': 'mean'}. Best is trial 4 with value: 0.165990265495031.
[I 2024-09-20 15:51:40,143] Trial 160 finished with value: 0.165990265495031 and parameters: {'model_name': 'SimpleImputer', 'strategy': 'mean'}. Best is trial 4 with value: 0.165990265495031.
running
running
[I 2024-09-20 15:51:40,264] Trial 155 finished with value: 0.165990265495031 and parameters: {'model_name': 'SimpleImputer', 'strategy': 'mean'}. Best is trial 4 with value: 0.165990265495031.
running
[I 2024-09-20 15:51:40,387] Trial 158 finished with value: 0.165990265495031 and parameters: {'model_name': 'SimpleImputer', 'strategy': 'mean'}. Best is trial 4 with value: 0.165990265495031.
running
[I 2024-09-20 15:51:40,503] Trial 162 finished with value: 0.165990265495031 and parameters: {'model_name': 'SimpleImputer', 'strategy': 'mean'}. Best is trial 4 with value: 0.165990265495031.
[I 2024-09-20 15:51:40,600] Trial 163 finished with value: 0.165990265495031 and parameters: {'model_name': 'SimpleImputer', 'strategy': 'mean'}. Best is trial 4 with value: 0.165990265495031.
[I 2024-09-20 15:51:40,695] Trial 159 finished with value: 0.165990265495031 and parameters: {'model_name': 'SimpleImputer', 'strategy': 'mean'}. Best is trial 4 with value: 0.165990265495031.
running
running
running
[I 2024-09-20 15:51:40,859] Trial 165 finished with value: 0.165990265495031 and parameters: {'model_name': 'SimpleImputer', 'strategy': 'mean'}. Best is trial 4 with value: 0.165990265495031.
running
[I 2024-09-20 15:51:41,066] Trial 166 finished with value: 0.165990265495031 and parameters: {'model_name': 'SimpleImputer', 'strategy': 'mean'}. Best is trial 4 with value: 0.165990265495031.
running
[I 2024-09-20 15:51:41,228] Trial 164 finished with value: 0.165990265495031 and parameters: {'model_name': 'SimpleImputer', 'strategy': 'mean'}. Best is trial 4 with value: 0.165990265495031.
running
[I 2024-09-20 15:51:41,389] Trial 168 finished with value: 0.165990265495031 and parameters: {'model_name': 'SimpleImputer', 'strategy': 'mean'}. Best is trial 4 with value: 0.165990265495031.
running
[I 2024-09-20 15:51:41,542] Trial 167 finished with value: 0.165990265495031 and parameters: {'model_name': 'SimpleImputer', 'strategy': 'mean'}. Best is trial 4 with value: 0.165990265495031.
running
[I 2024-09-20 15:51:41,695] Trial 173 finished with value: 0.165990265495031 and parameters: {'model_name': 'SimpleImputer', 'strategy': 'mean'}. Best is trial 4 with value: 0.165990265495031.
[I 2024-09-20 15:51:41,803] Trial 171 finished with value: 0.165990265495031 and parameters: {'model_name': 'SimpleImputer', 'strategy': 'mean'}. Best is trial 4 with value: 0.165990265495031.
running
[I 2024-09-20 15:51:41,911] Trial 170 finished with value: 0.165990265495031 and parameters: {'model_name': 'SimpleImputer', 'strategy': 'mean'}. Best is trial 4 with value: 0.165990265495031.
running
running
[I 2024-09-20 15:51:42,055] Trial 169 finished with value: 0.165990265495031 and parameters: {'model_name': 'SimpleImputer', 'strategy': 'mean'}. Best is trial 4 with value: 0.165990265495031.
running
[I 2024-09-20 15:51:42,176] Trial 172 finished with value: 0.165990265495031 and parameters: {'model_name': 'SimpleImputer', 'strategy': 'mean'}. Best is trial 4 with value: 0.165990265495031.
[I 2024-09-20 15:51:42,284] Trial 177 finished with value: 0.165990265495031 and parameters: {'model_name': 'SimpleImputer', 'strategy': 'mean'}. Best is trial 4 with value: 0.165990265495031.
running
running
[I 2024-09-20 15:51:42,491] Trial 175 finished with value: 0.165990265495031 and parameters: {'model_name': 'SimpleImputer', 'strategy': 'mean'}. Best is trial 4 with value: 0.165990265495031.
running
[I 2024-09-20 15:51:42,627] Trial 178 finished with value: 0.165990265495031 and parameters: {'model_name': 'SimpleImputer', 'strategy': 'mean'}. Best is trial 4 with value: 0.165990265495031.
[I 2024-09-20 15:51:42,729] Trial 179 finished with value: 0.165990265495031 and parameters: {'model_name': 'SimpleImputer', 'strategy': 'mean'}. Best is trial 4 with value: 0.165990265495031.
running
running
[I 2024-09-20 15:51:42,845] Trial 174 finished with value: 0.165990265495031 and parameters: {'model_name': 'SimpleImputer', 'strategy': 'mean'}. Best is trial 4 with value: 0.165990265495031.
running
[I 2024-09-20 15:51:42,981] Trial 176 finished with value: 0.165990265495031 and parameters: {'model_name': 'SimpleImputer', 'strategy': 'mean'}. Best is trial 4 with value: 0.165990265495031.
running
[I 2024-09-20 15:51:43,096] Trial 180 finished with value: 0.165990265495031 and parameters: {'model_name': 'SimpleImputer', 'strategy': 'mean'}. Best is trial 4 with value: 0.165990265495031.
running
[I 2024-09-20 15:51:43,270] Trial 182 finished with value: 0.165990265495031 and parameters: {'model_name': 'SimpleImputer', 'strategy': 'mean'}. Best is trial 4 with value: 0.165990265495031.
running
[I 2024-09-20 15:51:43,397] Trial 181 finished with value: 0.165990265495031 and parameters: {'model_name': 'SimpleImputer', 'strategy': 'mean'}. Best is trial 4 with value: 0.165990265495031.
running
[I 2024-09-20 15:51:43,525] Trial 183 finished with value: 0.165990265495031 and parameters: {'model_name': 'SimpleImputer', 'strategy': 'mean'}. Best is trial 4 with value: 0.165990265495031.
running
[I 2024-09-20 15:51:43,694] Trial 184 finished with value: 0.165990265495031 and parameters: {'model_name': 'SimpleImputer', 'strategy': 'mean'}. Best is trial 4 with value: 0.165990265495031.
[I 2024-09-20 15:51:43,799] Trial 185 finished with value: 0.165990265495031 and parameters: {'model_name': 'SimpleImputer', 'strategy': 'mean'}. Best is trial 4 with value: 0.165990265495031.
[I 2024-09-20 15:51:44,011] Trial 190 finished with value: 0.165990265495031 and parameters: {'model_name': 'SimpleImputer', 'strategy': 'mean'}. Best is trial 4 with value: 0.165990265495031.
[I 2024-09-20 15:51:44,151] Trial 188 finished with value: 0.165990265495031 and parameters: {'model_name': 'SimpleImputer', 'strategy': 'mean'}. Best is trial 4 with value: 0.165990265495031.
[I 2024-09-20 15:51:44,274] Trial 189 finished with value: 0.165990265495031 and parameters: {'model_name': 'SimpleImputer', 'strategy': 'mean'}. Best is trial 4 with value: 0.165990265495031.
[I 2024-09-20 15:51:44,374] Trial 187 finished with value: 0.165990265495031 and parameters: {'model_name': 'SimpleImputer', 'strategy': 'mean'}. Best is trial 4 with value: 0.165990265495031.
[I 2024-09-20 15:51:44,472] Trial 195 finished with value: 0.165990265495031 and parameters: {'model_name': 'SimpleImputer', 'strategy': 'mean'}. Best is trial 4 with value: 0.165990265495031.
[I 2024-09-20 15:51:44,568] Trial 194 finished with value: 0.165990265495031 and parameters: {'model_name': 'SimpleImputer', 'strategy': 'mean'}. Best is trial 4 with value: 0.165990265495031.
[I 2024-09-20 15:51:44,665] Trial 186 finished with value: 0.165990265495031 and parameters: {'model_name': 'SimpleImputer', 'strategy': 'mean'}. Best is trial 4 with value: 0.165990265495031.
[I 2024-09-20 15:51:44,762] Trial 193 finished with value: 0.165990265495031 and parameters: {'model_name': 'SimpleImputer', 'strategy': 'mean'}. Best is trial 4 with value: 0.165990265495031.
[I 2024-09-20 15:51:44,877] Trial 192 finished with value: 0.165990265495031 and parameters: {'model_name': 'SimpleImputer', 'strategy': 'mean'}. Best is trial 4 with value: 0.165990265495031.
[I 2024-09-20 15:51:44,977] Trial 199 finished with value: 0.165990265495031 and parameters: {'model_name': 'SimpleImputer', 'strategy': 'mean'}. Best is trial 4 with value: 0.165990265495031.
[I 2024-09-20 15:51:45,071] Trial 191 finished with value: 0.165990265495031 and parameters: {'model_name': 'SimpleImputer', 'strategy': 'mean'}. Best is trial 4 with value: 0.165990265495031.
[I 2024-09-20 15:51:45,162] Trial 196 finished with value: 0.165990265495031 and parameters: {'model_name': 'SimpleImputer', 'strategy': 'mean'}. Best is trial 4 with value: 0.165990265495031.
[I 2024-09-20 15:51:45,251] Trial 197 finished with value: 0.165990265495031 and parameters: {'model_name': 'SimpleImputer', 'strategy': 'mean'}. Best is trial 4 with value: 0.165990265495031.
