[I 2024-09-30 15:53:06,007] Trial 88 finished with value: 0.234282273695292 and parameters: {'model_name': 'IterativeImputer', 'estimator': 'Bayesian', 'initial_strategy': 'most_frequent', 'n_nearest_features': 8, 'imputation_order': 'ascending', 'sample_posterior': False}. Best is trial 40 with value: 0.23407864405802759.
running
[I 2024-09-30 15:53:11,812] Trial 90 finished with value: 0.23426715975154844 and parameters: {'model_name': 'IterativeImputer', 'estimator': 'Ridge', 'initial_strategy': 'constant', 'n_nearest_features': 5, 'imputation_order': 'ascending'}. Best is trial 40 with value: 0.23407864405802759.
running
[I 2024-09-30 15:53:12,372] Trial 92 finished with value: 0.2730432611036446 and parameters: {'model_name': 'SimpleImputer', 'strategy': 'median'}. Best is trial 40 with value: 0.23407864405802759.
running
[I 2024-09-30 15:53:26,134] Trial 91 finished with value: 0.23426715975154844 and parameters: {'model_name': 'IterativeImputer', 'estimator': 'Ridge', 'initial_strategy': 'constant', 'n_nearest_features': 5, 'imputation_order': 'ascending'}. Best is trial 40 with value: 0.23407864405802759.
running
[I 2024-09-30 15:53:32,097] Trial 89 finished with value: 0.2343369683552791 and parameters: {'model_name': 'IterativeImputer', 'estimator': 'Bayesian', 'initial_strategy': 'constant', 'n_nearest_features': 5, 'imputation_order': 'ascending', 'sample_posterior': False}. Best is trial 40 with value: 0.23407864405802759.
running
[I 2024-09-30 15:53:32,398] Trial 93 finished with value: 0.23408834435909479 and parameters: {'model_name': 'IterativeImputer', 'estimator': 'Ridge', 'initial_strategy': 'median', 'n_nearest_features': 5, 'imputation_order': 'ascending'}. Best is trial 40 with value: 0.23407864405802759.
running
[I 2024-09-30 15:53:35,641] Trial 85 finished with value: 0.322182866660884 and parameters: {'model_name': 'IterativeImputer', 'estimator': 'Bayesian', 'initial_strategy': 'most_frequent', 'n_nearest_features': 8, 'imputation_order': 'random', 'sample_posterior': True}. Best is trial 40 with value: 0.23407864405802759.
running
[I 2024-09-30 15:53:44,791] Trial 87 finished with value: 0.3172578239004708 and parameters: {'model_name': 'IterativeImputer', 'estimator': 'Bayesian', 'initial_strategy': 'median', 'n_nearest_features': 7, 'imputation_order': 'random', 'sample_posterior': True}. Best is trial 40 with value: 0.23407864405802759.
running
[I 2024-09-30 15:53:46,270] Trial 94 finished with value: 0.23407864405802759 and parameters: {'model_name': 'IterativeImputer', 'estimator': 'Ridge', 'initial_strategy': 'median', 'n_nearest_features': 6, 'imputation_order': 'roman'}. Best is trial 40 with value: 0.23407864405802759.
running
[I 2024-09-30 15:53:52,840] Trial 96 finished with value: 0.23424299966097442 and parameters: {'model_name': 'IterativeImputer', 'estimator': 'Ridge', 'initial_strategy': 'median', 'n_nearest_features': 6, 'imputation_order': 'ascending'}. Best is trial 40 with value: 0.23407864405802759.
running
[I 2024-09-30 15:53:56,082] Trial 97 finished with value: 0.23424299966097442 and parameters: {'model_name': 'IterativeImputer', 'estimator': 'Ridge', 'initial_strategy': 'median', 'n_nearest_features': 6, 'imputation_order': 'ascending'}. Best is trial 40 with value: 0.23407864405802759.
running
[I 2024-09-30 15:54:07,583] Trial 56 finished with value: 0.24247911697040644 and parameters: {'model_name': 'IterativeImputer', 'estimator': 'RFR', 'initial_strategy': 'median', 'n_nearest_features': 6, 'imputation_order': 'ascending'}. Best is trial 40 with value: 0.23407864405802759.
running
[I 2024-09-30 15:57:52,970] Trial 54 finished with value: 0.23984912178054438 and parameters: {'model_name': 'IterativeImputer', 'estimator': 'RFR', 'initial_strategy': 'median', 'n_nearest_features': 7, 'imputation_order': 'roman'}. Best is trial 40 with value: 0.23407864405802759.
running
[I 2024-09-30 15:58:31,857] Trial 103 finished with value: inf and parameters: {'model_name': 'GAIN', 'batch_size': 3, 'hint_rate': 0.9541128905263039, 'alpha': 100, 'iterations': 219, 'learning_rate': 0.0002194990418890528, 'p_miss': 0.2275119076848341}. Best is trial 40 with value: 0.23407864405802759.
running
[I 2024-09-30 15:58:37,700] Trial 57 finished with value: 0.24316100507743071 and parameters: {'model_name': 'IterativeImputer', 'estimator': 'RFR', 'initial_strategy': 'median', 'n_nearest_features': 6, 'imputation_order': 'ascending'}. Best is trial 40 with value: 0.23407864405802759.
running
[I 2024-09-30 15:59:02,167] Trial 55 finished with value: 0.23934688439322102 and parameters: {'model_name': 'IterativeImputer', 'estimator': 'RFR', 'initial_strategy': 'median', 'n_nearest_features': 7, 'imputation_order': 'roman'}. Best is trial 40 with value: 0.23407864405802759.
running
[I 2024-09-30 16:22:43,433] Trial 99 finished with value: 0.261136094985386 and parameters: {'model_name': 'VAE', 'batch_size': 6, 'iterations': 3842, 'learning_rate': 0.00010827272012570296, 'p_miss': 0.23765749077093856}. Best is trial 40 with value: 0.23407864405802759.
running
[I 2024-09-30 16:22:47,694] Trial 107 finished with value: 0.24764057255386943 and parameters: {'model_name': 'KNNImputer', 'n_neighbors': 5510, 'weights': 'uniform'}. Best is trial 40 with value: 0.23407864405802759.
running
[I 2024-09-30 16:23:05,331] Trial 108 finished with value: 0.2344287755513609 and parameters: {'model_name': 'IterativeImputer', 'estimator': 'Ridge', 'initial_strategy': 'median', 'n_nearest_features': 5, 'imputation_order': 'roman'}. Best is trial 40 with value: 0.23407864405802759.
running
[I 2024-09-30 16:23:22,603] Trial 109 finished with value: 0.23407864405802759 and parameters: {'model_name': 'IterativeImputer', 'estimator': 'Ridge', 'initial_strategy': 'median', 'n_nearest_features': 6, 'imputation_order': 'roman'}. Best is trial 40 with value: 0.23407864405802759.
running
[I 2024-09-30 16:23:40,049] Trial 110 finished with value: 0.23407864405802759 and parameters: {'model_name': 'IterativeImputer', 'estimator': 'Ridge', 'initial_strategy': 'median', 'n_nearest_features': 6, 'imputation_order': 'roman'}. Best is trial 40 with value: 0.23407864405802759.
running
[I 2024-09-30 16:23:57,893] Trial 111 finished with value: 0.23407864405802759 and parameters: {'model_name': 'IterativeImputer', 'estimator': 'Ridge', 'initial_strategy': 'median', 'n_nearest_features': 6, 'imputation_order': 'roman'}. Best is trial 40 with value: 0.23407864405802759.
running
[I 2024-09-30 16:30:51,858] Trial 102 finished with value: 0.2592807891720742 and parameters: {'model_name': 'VAE', 'batch_size': 4, 'iterations': 4793, 'learning_rate': 0.00011432722426691624, 'p_miss': 0.2247919333821096}. Best is trial 40 with value: 0.23407864405802759.
running
[I 2024-09-30 16:31:08,958] Trial 113 finished with value: 0.23407864405802759 and parameters: {'model_name': 'IterativeImputer', 'estimator': 'Ridge', 'initial_strategy': 'median', 'n_nearest_features': 6, 'imputation_order': 'roman'}. Best is trial 40 with value: 0.23407864405802759.
running
[I 2024-09-30 16:31:09,169] Trial 114 finished with value: 0.2488890344613197 and parameters: {'model_name': 'SimpleImputer', 'strategy': 'mean'}. Best is trial 40 with value: 0.23407864405802759.
running
[I 2024-09-30 16:31:27,652] Trial 115 finished with value: 0.23407864405802759 and parameters: {'model_name': 'IterativeImputer', 'estimator': 'Ridge', 'initial_strategy': 'median', 'n_nearest_features': 6, 'imputation_order': 'roman'}. Best is trial 40 with value: 0.23407864405802759.
running
[I 2024-09-30 16:31:45,641] Trial 116 finished with value: 0.23407864405802759 and parameters: {'model_name': 'IterativeImputer', 'estimator': 'Ridge', 'initial_strategy': 'median', 'n_nearest_features': 6, 'imputation_order': 'roman'}. Best is trial 40 with value: 0.23407864405802759.
running
[I 2024-09-30 16:32:03,999] Trial 117 finished with value: 0.23407864405802759 and parameters: {'model_name': 'IterativeImputer', 'estimator': 'Ridge', 'initial_strategy': 'median', 'n_nearest_features': 6, 'imputation_order': 'roman'}. Best is trial 40 with value: 0.23407864405802759.
running
[I 2024-09-30 16:32:21,804] Trial 118 finished with value: 0.23407864405802759 and parameters: {'model_name': 'IterativeImputer', 'estimator': 'Ridge', 'initial_strategy': 'median', 'n_nearest_features': 6, 'imputation_order': 'roman'}. Best is trial 40 with value: 0.23407864405802759.
running
[I 2024-09-30 16:32:39,401] Trial 119 finished with value: 0.23407864405802759 and parameters: {'model_name': 'IterativeImputer', 'estimator': 'Ridge', 'initial_strategy': 'median', 'n_nearest_features': 6, 'imputation_order': 'roman'}. Best is trial 40 with value: 0.23407864405802759.
running
[I 2024-09-30 16:32:57,832] Trial 120 finished with value: 0.23407864405802759 and parameters: {'model_name': 'IterativeImputer', 'estimator': 'Ridge', 'initial_strategy': 'median', 'n_nearest_features': 6, 'imputation_order': 'roman'}. Best is trial 40 with value: 0.23407864405802759.
running
[I 2024-09-30 16:33:55,320] Trial 121 finished with value: 0.3738851490335921 and parameters: {'model_name': 'GAIN', 'batch_size': 979, 'hint_rate': 0.4943182465034181, 'alpha': 97, 'iterations': 268, 'learning_rate': 0.011469882899156925, 'p_miss': 0.012848665684473737}. Best is trial 40 with value: 0.23407864405802759.
running
[I 2024-09-30 16:34:14,665] Trial 122 finished with value: 0.23436247045113978 and parameters: {'model_name': 'IterativeImputer', 'estimator': 'Ridge', 'initial_strategy': 'median', 'n_nearest_features': 7, 'imputation_order': 'roman'}. Best is trial 40 with value: 0.23407864405802759.
running
[I 2024-09-30 16:34:33,486] Trial 123 finished with value: 0.23407864405802759 and parameters: {'model_name': 'IterativeImputer', 'estimator': 'Ridge', 'initial_strategy': 'median', 'n_nearest_features': 6, 'imputation_order': 'roman'}. Best is trial 40 with value: 0.23407864405802759.
running
[I 2024-09-30 16:34:38,635] Trial 124 finished with value: 0.25495742214484396 and parameters: {'model_name': 'KNNImputer', 'n_neighbors': 8940, 'weights': 'distance'}. Best is trial 40 with value: 0.23407864405802759.
running
[I 2024-09-30 16:34:57,038] Trial 125 finished with value: 0.23407864405802759 and parameters: {'model_name': 'IterativeImputer', 'estimator': 'Ridge', 'initial_strategy': 'median', 'n_nearest_features': 6, 'imputation_order': 'roman'}. Best is trial 40 with value: 0.23407864405802759.
running
[I 2024-09-30 16:35:15,288] Trial 126 finished with value: 0.23407864405802759 and parameters: {'model_name': 'IterativeImputer', 'estimator': 'Ridge', 'initial_strategy': 'median', 'n_nearest_features': 6, 'imputation_order': 'roman'}. Best is trial 40 with value: 0.23407864405802759.
running
[I 2024-09-30 16:35:32,722] Trial 127 finished with value: 0.23407864405802759 and parameters: {'model_name': 'IterativeImputer', 'estimator': 'Ridge', 'initial_strategy': 'median', 'n_nearest_features': 6, 'imputation_order': 'roman'}. Best is trial 40 with value: 0.23407864405802759.
running
[I 2024-09-30 16:35:51,163] Trial 128 finished with value: 0.23407864405802759 and parameters: {'model_name': 'IterativeImputer', 'estimator': 'Ridge', 'initial_strategy': 'median', 'n_nearest_features': 6, 'imputation_order': 'roman'}. Best is trial 40 with value: 0.23407864405802759.
running
[I 2024-09-30 16:36:10,041] Trial 129 finished with value: 0.23436247045113978 and parameters: {'model_name': 'IterativeImputer', 'estimator': 'Ridge', 'initial_strategy': 'median', 'n_nearest_features': 7, 'imputation_order': 'roman'}. Best is trial 40 with value: 0.23407864405802759.
running
[I 2024-09-30 16:36:28,401] Trial 130 finished with value: 0.23407864405802759 and parameters: {'model_name': 'IterativeImputer', 'estimator': 'Ridge', 'initial_strategy': 'median', 'n_nearest_features': 6, 'imputation_order': 'roman'}. Best is trial 40 with value: 0.23407864405802759.
running
[I 2024-09-30 16:36:45,638] Trial 131 finished with value: 0.23407864405802759 and parameters: {'model_name': 'IterativeImputer', 'estimator': 'Ridge', 'initial_strategy': 'median', 'n_nearest_features': 6, 'imputation_order': 'roman'}. Best is trial 40 with value: 0.23407864405802759.
running
[I 2024-09-30 16:37:03,711] Trial 132 finished with value: 0.23416597933645042 and parameters: {'model_name': 'IterativeImputer', 'estimator': 'Ridge', 'initial_strategy': 'median', 'n_nearest_features': 7, 'imputation_order': 'arabic'}. Best is trial 40 with value: 0.23407864405802759.
running
[I 2024-09-30 16:37:21,718] Trial 133 finished with value: 0.23407864405802759 and parameters: {'model_name': 'IterativeImputer', 'estimator': 'Ridge', 'initial_strategy': 'median', 'n_nearest_features': 6, 'imputation_order': 'roman'}. Best is trial 40 with value: 0.23407864405802759.
running
[I 2024-09-30 16:37:39,803] Trial 134 finished with value: 0.23407864405802759 and parameters: {'model_name': 'IterativeImputer', 'estimator': 'Ridge', 'initial_strategy': 'median', 'n_nearest_features': 6, 'imputation_order': 'roman'}. Best is trial 40 with value: 0.23407864405802759.
running
[I 2024-09-30 16:37:58,498] Trial 135 finished with value: 0.23436247045113978 and parameters: {'model_name': 'IterativeImputer', 'estimator': 'Ridge', 'initial_strategy': 'median', 'n_nearest_features': 7, 'imputation_order': 'roman'}. Best is trial 40 with value: 0.23407864405802759.
running
[I 2024-09-30 16:38:16,534] Trial 136 finished with value: 0.23407864405802759 and parameters: {'model_name': 'IterativeImputer', 'estimator': 'Ridge', 'initial_strategy': 'median', 'n_nearest_features': 6, 'imputation_order': 'roman'}. Best is trial 40 with value: 0.23407864405802759.
running
[I 2024-09-30 16:38:29,577] Trial 137 finished with value: 0.24116635483017573 and parameters: {'model_name': 'IterativeImputer', 'estimator': 'Ridge', 'initial_strategy': 'median', 'n_nearest_features': 1, 'imputation_order': 'roman'}. Best is trial 40 with value: 0.23407864405802759.
running
[I 2024-09-30 16:38:47,948] Trial 138 finished with value: 0.23407864405802759 and parameters: {'model_name': 'IterativeImputer', 'estimator': 'Ridge', 'initial_strategy': 'median', 'n_nearest_features': 6, 'imputation_order': 'roman'}. Best is trial 40 with value: 0.23407864405802759.
running
[I 2024-09-30 16:39:04,931] Trial 139 finished with value: 0.23407864405802759 and parameters: {'model_name': 'IterativeImputer', 'estimator': 'Ridge', 'initial_strategy': 'median', 'n_nearest_features': 6, 'imputation_order': 'roman'}. Best is trial 40 with value: 0.23407864405802759.
running
[I 2024-09-30 16:39:22,004] Trial 140 finished with value: 0.23407864405802759 and parameters: {'model_name': 'IterativeImputer', 'estimator': 'Ridge', 'initial_strategy': 'median', 'n_nearest_features': 6, 'imputation_order': 'roman'}. Best is trial 40 with value: 0.23407864405802759.
running
[I 2024-09-30 16:39:39,093] Trial 141 finished with value: 0.23407864405802759 and parameters: {'model_name': 'IterativeImputer', 'estimator': 'Ridge', 'initial_strategy': 'median', 'n_nearest_features': 6, 'imputation_order': 'roman'}. Best is trial 40 with value: 0.23407864405802759.
running
[I 2024-09-30 16:49:05,697] Trial 101 finished with value: 0.2657648042132184 and parameters: {'model_name': 'VAE', 'batch_size': 3, 'iterations': 7295, 'learning_rate': 0.00026603000397926115, 'p_miss': 0.2246300324867211}. Best is trial 40 with value: 0.23407864405802759.
running
[I 2024-09-30 16:49:25,746] Trial 143 finished with value: 0.23436247045113978 and parameters: {'model_name': 'IterativeImputer', 'estimator': 'Ridge', 'initial_strategy': 'median', 'n_nearest_features': 7, 'imputation_order': 'roman'}. Best is trial 40 with value: 0.23407864405802759.
running
[I 2024-09-30 16:49:43,104] Trial 144 finished with value: 0.23407864405802759 and parameters: {'model_name': 'IterativeImputer', 'estimator': 'Ridge', 'initial_strategy': 'median', 'n_nearest_features': 6, 'imputation_order': 'roman'}. Best is trial 40 with value: 0.23407864405802759.
running
[I 2024-09-30 16:49:43,379] Trial 145 finished with value: 0.37277237724555967 and parameters: {'model_name': 'SimpleImputer', 'strategy': 'most_frequent'}. Best is trial 40 with value: 0.23407864405802759.
running
[I 2024-09-30 16:50:01,007] Trial 146 finished with value: 0.23407864405802759 and parameters: {'model_name': 'IterativeImputer', 'estimator': 'Ridge', 'initial_strategy': 'median', 'n_nearest_features': 6, 'imputation_order': 'roman'}. Best is trial 40 with value: 0.23407864405802759.
running
[I 2024-09-30 16:50:19,330] Trial 147 finished with value: 0.23407864405802759 and parameters: {'model_name': 'IterativeImputer', 'estimator': 'Ridge', 'initial_strategy': 'median', 'n_nearest_features': 6, 'imputation_order': 'roman'}. Best is trial 40 with value: 0.23407864405802759.
running
[I 2024-09-30 16:50:38,225] Trial 148 finished with value: 0.2346668809530447 and parameters: {'model_name': 'IterativeImputer', 'estimator': 'Ridge', 'initial_strategy': 'most_frequent', 'n_nearest_features': 6, 'imputation_order': 'roman'}. Best is trial 40 with value: 0.23407864405802759.
running
[I 2024-09-30 16:50:57,350] Trial 149 finished with value: 0.23407864405802759 and parameters: {'model_name': 'IterativeImputer', 'estimator': 'Ridge', 'initial_strategy': 'median', 'n_nearest_features': 6, 'imputation_order': 'roman'}. Best is trial 40 with value: 0.23407864405802759.
running
[I 2024-09-30 16:58:45,589] Trial 100 finished with value: 0.2614348209266751 and parameters: {'model_name': 'VAE', 'batch_size': 3, 'iterations': 9752, 'learning_rate': 0.00020912332578522396, 'p_miss': 0.22513807908232877}. Best is trial 40 with value: 0.23407864405802759.
running
[I 2024-09-30 16:59:46,223] Trial 142 finished with value: 0.25767456172567343 and parameters: {'model_name': 'VAE', 'batch_size': 12, 'iterations': 2615, 'learning_rate': 0.0073869216141647775, 'p_miss': 0.29985501899809164}. Best is trial 40 with value: 0.23407864405802759.
running
[I 2024-09-30 17:00:54,699] Trial 95 finished with value: 0.2645516690500016 and parameters: {'model_name': 'VAE', 'batch_size': 3, 'iterations': 9243, 'learning_rate': 0.00011749012424283413, 'p_miss': 0.2244919431481071}. Best is trial 40 with value: 0.23407864405802759.
running
[I 2024-09-30 17:06:56,153] Trial 98 finished with value: 0.27176237103178946 and parameters: {'model_name': 'VAE', 'batch_size': 3, 'iterations': 9807, 'learning_rate': 0.00018247161452524002, 'p_miss': 0.23402238169651168}. Best is trial 40 with value: 0.23407864405802759.
running
[I 2024-09-30 17:10:37,231] Trial 104 finished with value: 0.25585177162382666 and parameters: {'model_name': 'VAE', 'batch_size': 79, 'iterations': 6691, 'learning_rate': 0.011959332664128141, 'p_miss': 0.017394385518626487}. Best is trial 40 with value: 0.23407864405802759.
running
[I 2024-09-30 17:14:02,934] Trial 153 finished with value: 0.2561859403692631 and parameters: {'model_name': 'IterativeImputer', 'estimator': 'RFR', 'initial_strategy': 'median', 'n_nearest_features': 2, 'imputation_order': 'roman'}. Best is trial 40 with value: 0.23407864405802759.
running
[I 2024-09-30 17:14:27,121] Trial 156 finished with value: 0.23407864405802759 and parameters: {'model_name': 'IterativeImputer', 'estimator': 'Ridge', 'initial_strategy': 'median', 'n_nearest_features': 6, 'imputation_order': 'roman'}. Best is trial 40 with value: 0.23407864405802759.
running
[I 2024-09-30 17:14:51,897] Trial 157 finished with value: 0.23407864405802759 and parameters: {'model_name': 'IterativeImputer', 'estimator': 'Ridge', 'initial_strategy': 'median', 'n_nearest_features': 6, 'imputation_order': 'roman'}. Best is trial 40 with value: 0.23407864405802759.
running
[I 2024-09-30 17:15:14,789] Trial 158 finished with value: 0.23407864405802759 and parameters: {'model_name': 'IterativeImputer', 'estimator': 'Ridge', 'initial_strategy': 'median', 'n_nearest_features': 6, 'imputation_order': 'roman'}. Best is trial 40 with value: 0.23407864405802759.
running
[I 2024-09-30 17:15:38,838] Trial 159 finished with value: 0.23407864405802759 and parameters: {'model_name': 'IterativeImputer', 'estimator': 'Ridge', 'initial_strategy': 'median', 'n_nearest_features': 6, 'imputation_order': 'roman'}. Best is trial 40 with value: 0.23407864405802759.
running
[I 2024-09-30 17:19:32,511] Trial 160 finished with value: 0.387188230503584 and parameters: {'model_name': 'GAIN', 'batch_size': 66, 'hint_rate': 0.9471593444287112, 'alpha': 1, 'iterations': 1770, 'learning_rate': 0.00039167440179131236, 'p_miss': 0.1100748694361785}. Best is trial 40 with value: 0.23407864405802759.
running
[I 2024-09-30 17:19:46,668] Trial 105 finished with value: 0.25634289443041397 and parameters: {'model_name': 'VAE', 'batch_size': 84, 'iterations': 6455, 'learning_rate': 0.010730787651499747, 'p_miss': 0.2947956665193125}. Best is trial 40 with value: 0.23407864405802759.
running
[I 2024-09-30 17:19:57,617] Trial 161 finished with value: 0.23427832686236946 and parameters: {'model_name': 'IterativeImputer', 'estimator': 'Ridge', 'initial_strategy': 'median', 'n_nearest_features': 6, 'imputation_order': 'arabic'}. Best is trial 40 with value: 0.23407864405802759.
running
[I 2024-09-30 17:20:12,340] Trial 162 finished with value: 0.23427832686236946 and parameters: {'model_name': 'IterativeImputer', 'estimator': 'Ridge', 'initial_strategy': 'median', 'n_nearest_features': 6, 'imputation_order': 'arabic'}. Best is trial 40 with value: 0.23407864405802759.
running
[I 2024-09-30 17:20:25,574] Trial 163 finished with value: 0.23407864405802759 and parameters: {'model_name': 'IterativeImputer', 'estimator': 'Ridge', 'initial_strategy': 'median', 'n_nearest_features': 6, 'imputation_order': 'roman'}. Best is trial 40 with value: 0.23407864405802759.
running
