[I 2024-10-07 17:22:14,688] Trial 80 finished with value: 0.19931271341115525 and parameters: {'model_name': 'IterativeImputer', 'estimator': 'RFR', 'initial_strategy': 'mean', 'n_nearest_features': 11, 'imputation_order': 'roman'}. Best is trial 79 with value: 0.19914052959834713.
running
[I 2024-10-07 17:22:31,699] Trial 82 finished with value: 0.20067741507724102 and parameters: {'model_name': 'IterativeImputer', 'estimator': 'RFR', 'initial_strategy': 'mean', 'n_nearest_features': 10, 'imputation_order': 'descending'}. Best is trial 79 with value: 0.19914052959834713.
running
[I 2024-10-07 17:23:10,374] Trial 81 finished with value: 0.1994857262529905 and parameters: {'model_name': 'IterativeImputer', 'estimator': 'RFR', 'initial_strategy': 'mean', 'n_nearest_features': 11, 'imputation_order': 'descending'}. Best is trial 79 with value: 0.19914052959834713.
running
[I 2024-10-07 17:29:08,802] Trial 43 finished with value: 0.21742443842333473 and parameters: {'model_name': 'VAE', 'batch_size': 711, 'iterations': 4396, 'learning_rate': 0.0001065882297218758, 'p_miss': 0.29194184667150636}. Best is trial 79 with value: 0.19914052959834713.
running
[I 2024-10-07 17:32:59,790] Trial 83 finished with value: 0.20268278967770437 and parameters: {'model_name': 'IterativeImputer', 'estimator': 'RFR', 'initial_strategy': 'mean', 'n_nearest_features': 10, 'imputation_order': 'descending'}. Best is trial 79 with value: 0.19914052959834713.
running
[I 2024-10-07 17:33:05,497] Trial 93 finished with value: 0.20811708140673577 and parameters: {'model_name': 'KNNImputer', 'n_neighbors': 112, 'weights': 'uniform'}. Best is trial 79 with value: 0.19914052959834713.
running
[I 2024-10-07 17:34:43,587] Trial 84 finished with value: 0.20124198538808602 and parameters: {'model_name': 'IterativeImputer', 'estimator': 'RFR', 'initial_strategy': 'mean', 'n_nearest_features': 10, 'imputation_order': 'descending'}. Best is trial 79 with value: 0.19914052959834713.
running
[I 2024-10-07 17:39:05,266] Trial 85 finished with value: 0.20074825977181937 and parameters: {'model_name': 'IterativeImputer', 'estimator': 'RFR', 'initial_strategy': 'mean', 'n_nearest_features': 10, 'imputation_order': 'descending'}. Best is trial 79 with value: 0.19914052959834713.
running
[I 2024-10-07 17:49:02,960] Trial 86 finished with value: 0.2017741361673097 and parameters: {'model_name': 'IterativeImputer', 'estimator': 'RFR', 'initial_strategy': 'mean', 'n_nearest_features': 10, 'imputation_order': 'descending'}. Best is trial 79 with value: 0.19914052959834713.
running
[I 2024-10-07 17:50:38,015] Trial 45 finished with value: 0.2174140744607039 and parameters: {'model_name': 'VAE', 'batch_size': 613, 'iterations': 4756, 'learning_rate': 0.00010870333566409937, 'p_miss': 0.28833782213020354}. Best is trial 79 with value: 0.19914052959834713.
running
[I 2024-10-07 17:56:37,738] Trial 87 finished with value: 0.20277383482538952 and parameters: {'model_name': 'IterativeImputer', 'estimator': 'RFR', 'initial_strategy': 'mean', 'n_nearest_features': 10, 'imputation_order': 'descending'}. Best is trial 79 with value: 0.19914052959834713.
running
[I 2024-10-07 17:56:39,421] Trial 58 finished with value: 0.36473331783187296 and parameters: {'model_name': 'GAIN', 'batch_size': 933, 'hint_rate': 0.0291719800712677, 'alpha': 47, 'iterations': 9979, 'learning_rate': 0.00013301785450762693, 'p_miss': 0.10162697438912835}. Best is trial 79 with value: 0.19914052959834713.
running
[I 2024-10-07 17:57:36,597] Trial 88 finished with value: 0.20096721825715505 and parameters: {'model_name': 'IterativeImputer', 'estimator': 'RFR', 'initial_strategy': 'mean', 'n_nearest_features': 10, 'imputation_order': 'descending'}. Best is trial 79 with value: 0.19914052959834713.
running
[I 2024-10-07 18:06:40,496] Trial 89 finished with value: 0.20104694528118788 and parameters: {'model_name': 'IterativeImputer', 'estimator': 'RFR', 'initial_strategy': 'mean', 'n_nearest_features': 10, 'imputation_order': 'descending'}. Best is trial 79 with value: 0.19914052959834713.
running
[I 2024-10-07 18:07:11,232] Trial 90 finished with value: 0.20162864499955732 and parameters: {'model_name': 'IterativeImputer', 'estimator': 'RFR', 'initial_strategy': 'mean', 'n_nearest_features': 10, 'imputation_order': 'roman'}. Best is trial 79 with value: 0.19914052959834713.
running
[I 2024-10-07 18:07:11,750] Trial 91 finished with value: 0.20252001191161878 and parameters: {'model_name': 'IterativeImputer', 'estimator': 'RFR', 'initial_strategy': 'mean', 'n_nearest_features': 10, 'imputation_order': 'descending'}. Best is trial 79 with value: 0.19914052959834713.
running
[I 2024-10-07 18:12:04,180] Trial 92 finished with value: 0.20121857142195548 and parameters: {'model_name': 'IterativeImputer', 'estimator': 'RFR', 'initial_strategy': 'mean', 'n_nearest_features': 10, 'imputation_order': 'descending'}. Best is trial 79 with value: 0.19914052959834713.
running
[I 2024-10-07 18:16:33,719] Trial 94 finished with value: 0.2013438248440461 and parameters: {'model_name': 'IterativeImputer', 'estimator': 'RFR', 'initial_strategy': 'mean', 'n_nearest_features': 10, 'imputation_order': 'ascending'}. Best is trial 79 with value: 0.19914052959834713.
running
[I 2024-10-07 18:17:39,224] Trial 95 finished with value: 0.2003630368227701 and parameters: {'model_name': 'IterativeImputer', 'estimator': 'RFR', 'initial_strategy': 'mean', 'n_nearest_features': 10, 'imputation_order': 'ascending'}. Best is trial 79 with value: 0.19914052959834713.
running
[I 2024-10-07 18:18:08,227] Trial 49 finished with value: 0.21665579333326743 and parameters: {'model_name': 'VAE', 'batch_size': 897, 'iterations': 4896, 'learning_rate': 0.0001450475180423918, 'p_miss': 0.2764087572811099}. Best is trial 79 with value: 0.19914052959834713.
running
[I 2024-10-07 18:21:51,789] Trial 96 finished with value: 0.20011894074289316 and parameters: {'model_name': 'IterativeImputer', 'estimator': 'RFR', 'initial_strategy': 'mean', 'n_nearest_features': 10, 'imputation_order': 'ascending'}. Best is trial 79 with value: 0.19914052959834713.
running
[I 2024-10-07 18:33:35,909] Trial 97 finished with value: 0.19953874009695172 and parameters: {'model_name': 'IterativeImputer', 'estimator': 'RFR', 'initial_strategy': 'mean', 'n_nearest_features': 11, 'imputation_order': 'ascending'}. Best is trial 79 with value: 0.19914052959834713.
running
[I 2024-10-07 18:35:30,008] Trial 98 finished with value: 0.20022329735446132 and parameters: {'model_name': 'IterativeImputer', 'estimator': 'RFR', 'initial_strategy': 'mean', 'n_nearest_features': 11, 'imputation_order': 'ascending'}. Best is trial 79 with value: 0.19914052959834713.
running
[I 2024-10-07 18:40:17,747] Trial 100 finished with value: 0.1994579196588719 and parameters: {'model_name': 'IterativeImputer', 'estimator': 'RFR', 'initial_strategy': 'mean', 'n_nearest_features': 11, 'imputation_order': 'ascending'}. Best is trial 79 with value: 0.19914052959834713.
running
[I 2024-10-07 18:40:25,302] Trial 112 finished with value: 0.21414397437670143 and parameters: {'model_name': 'KNNImputer', 'n_neighbors': 8465, 'weights': 'uniform'}. Best is trial 79 with value: 0.19914052959834713.
running
[I 2024-10-07 18:41:22,378] Trial 99 finished with value: 0.20025587204352294 and parameters: {'model_name': 'IterativeImputer', 'estimator': 'RFR', 'initial_strategy': 'mean', 'n_nearest_features': 11, 'imputation_order': 'ascending'}. Best is trial 79 with value: 0.19914052959834713.
running
[I 2024-10-07 18:41:56,738] Trial 101 finished with value: 0.20027465902503633 and parameters: {'model_name': 'IterativeImputer', 'estimator': 'RFR', 'initial_strategy': 'mean', 'n_nearest_features': 11, 'imputation_order': 'ascending'}. Best is trial 79 with value: 0.19914052959834713.
running
[I 2024-10-07 18:51:21,767] Trial 102 finished with value: 0.19969366539152486 and parameters: {'model_name': 'IterativeImputer', 'estimator': 'RFR', 'initial_strategy': 'mean', 'n_nearest_features': 11, 'imputation_order': 'arabic'}. Best is trial 79 with value: 0.19914052959834713.
running
[I 2024-10-07 18:51:45,227] Trial 104 finished with value: 0.19995292975622309 and parameters: {'model_name': 'IterativeImputer', 'estimator': 'RFR', 'initial_strategy': 'median', 'n_nearest_features': 11, 'imputation_order': 'ascending'}. Best is trial 79 with value: 0.19914052959834713.
running
[I 2024-10-07 18:52:24,693] Trial 103 finished with value: 0.19923906680940467 and parameters: {'model_name': 'IterativeImputer', 'estimator': 'RFR', 'initial_strategy': 'mean', 'n_nearest_features': 11, 'imputation_order': 'arabic'}. Best is trial 79 with value: 0.19914052959834713.
running
[I 2024-10-07 18:52:58,331] Trial 118 finished with value: 0.22186087056740966 and parameters: {'model_name': 'IterativeImputer', 'estimator': 'KNN', 'initial_strategy': 'median', 'n_nearest_features': 6, 'imputation_order': 'arabic'}. Best is trial 79 with value: 0.19914052959834713.
running
[I 2024-10-07 18:55:49,994] Trial 105 finished with value: 0.1997988097679051 and parameters: {'model_name': 'IterativeImputer', 'estimator': 'RFR', 'initial_strategy': 'median', 'n_nearest_features': 11, 'imputation_order': 'ascending'}. Best is trial 79 with value: 0.19914052959834713.
running
[I 2024-10-07 19:01:11,247] Trial 106 finished with value: 0.20051837683395363 and parameters: {'model_name': 'IterativeImputer', 'estimator': 'RFR', 'initial_strategy': 'mean', 'n_nearest_features': 11, 'imputation_order': 'arabic'}. Best is trial 79 with value: 0.19914052959834713.
running
[I 2024-10-07 19:01:11,909] Trial 121 finished with value: 0.21414397437670143 and parameters: {'model_name': 'SimpleImputer', 'strategy': 'mean'}. Best is trial 79 with value: 0.19914052959834713.
running
[I 2024-10-07 19:02:08,902] Trial 107 finished with value: 0.19850015889912181 and parameters: {'model_name': 'IterativeImputer', 'estimator': 'RFR', 'initial_strategy': 'median', 'n_nearest_features': 11, 'imputation_order': 'ascending'}. Best is trial 107 with value: 0.19850015889912181.
running
[I 2024-10-07 19:03:07,584] Trial 108 finished with value: 0.20032375494326118 and parameters: {'model_name': 'IterativeImputer', 'estimator': 'RFR', 'initial_strategy': 'mean', 'n_nearest_features': 11, 'imputation_order': 'ascending'}. Best is trial 107 with value: 0.19850015889912181.
running
[I 2024-10-07 19:06:29,929] Trial 109 finished with value: 0.19850183066896837 and parameters: {'model_name': 'IterativeImputer', 'estimator': 'RFR', 'initial_strategy': 'median', 'n_nearest_features': 11, 'imputation_order': 'ascending'}. Best is trial 107 with value: 0.19850015889912181.
running
[I 2024-10-07 19:12:16,664] Trial 111 finished with value: 0.2179953500199598 and parameters: {'model_name': 'IterativeImputer', 'estimator': 'RFR', 'initial_strategy': 'most_frequent', 'n_nearest_features': 6, 'imputation_order': 'ascending'}. Best is trial 107 with value: 0.19850015889912181.
running
[I 2024-10-07 19:15:59,858] Trial 110 finished with value: 0.2019311731599104 and parameters: {'model_name': 'IterativeImputer', 'estimator': 'RFR', 'initial_strategy': 'median', 'n_nearest_features': 9, 'imputation_order': 'ascending'}. Best is trial 107 with value: 0.19850015889912181.
running
[I 2024-10-07 19:16:22,807] Trial 113 finished with value: 0.21238960991311448 and parameters: {'model_name': 'IterativeImputer', 'estimator': 'RFR', 'initial_strategy': 'median', 'n_nearest_features': 6, 'imputation_order': 'ascending'}. Best is trial 107 with value: 0.19850015889912181.
running
[I 2024-10-07 19:25:55,746] Trial 119 finished with value: 0.21827192559701264 and parameters: {'model_name': 'IterativeImputer', 'estimator': 'RFR', 'initial_strategy': 'median', 'n_nearest_features': 4, 'imputation_order': 'arabic'}. Best is trial 107 with value: 0.19850015889912181.
running
[I 2024-10-07 19:27:33,079] Trial 117 finished with value: 0.20879422933996175 and parameters: {'model_name': 'IterativeImputer', 'estimator': 'RFR', 'initial_strategy': 'median', 'n_nearest_features': 5, 'imputation_order': 'arabic'}. Best is trial 107 with value: 0.19850015889912181.
running
[I 2024-10-07 19:28:02,496] Trial 120 finished with value: 0.22198621058547588 and parameters: {'model_name': 'IterativeImputer', 'estimator': 'RFR', 'initial_strategy': 'median', 'n_nearest_features': 4, 'imputation_order': 'arabic'}. Best is trial 107 with value: 0.19850015889912181.
running
[I 2024-10-07 19:28:19,828] Trial 130 finished with value: 0.2202587265653658 and parameters: {'model_name': 'IterativeImputer', 'estimator': 'KNN', 'initial_strategy': 'median', 'n_nearest_features': 11, 'imputation_order': 'arabic'}. Best is trial 107 with value: 0.19850015889912181.
running
[I 2024-10-07 19:28:33,169] Trial 131 finished with value: 0.23579204918910746 and parameters: {'model_name': 'IterativeImputer', 'estimator': 'KNN', 'initial_strategy': 'most_frequent', 'n_nearest_features': 1, 'imputation_order': 'arabic'}. Best is trial 107 with value: 0.19850015889912181.
running
[I 2024-10-07 19:28:34,482] Trial 114 finished with value: 0.20008750022115618 and parameters: {'model_name': 'IterativeImputer', 'estimator': 'RFR', 'initial_strategy': 'most_frequent', 'n_nearest_features': 11, 'imputation_order': 'ascending'}. Best is trial 107 with value: 0.19850015889912181.
running
[I 2024-10-07 19:28:42,518] Trial 133 finished with value: 0.21339824563005622 and parameters: {'model_name': 'KNNImputer', 'n_neighbors': 1629, 'weights': 'uniform'}. Best is trial 107 with value: 0.19850015889912181.
running
[I 2024-10-07 19:28:44,122] Trial 134 finished with value: 0.2133799742168377 and parameters: {'model_name': 'KNNImputer', 'n_neighbors': 1994, 'weights': 'uniform'}. Best is trial 107 with value: 0.19850015889912181.
running
[I 2024-10-07 19:29:11,837] Trial 115 finished with value: 0.1996534695336199 and parameters: {'model_name': 'IterativeImputer', 'estimator': 'RFR', 'initial_strategy': 'most_frequent', 'n_nearest_features': 11, 'imputation_order': 'ascending'}. Best is trial 107 with value: 0.19850015889912181.
running
[I 2024-10-07 19:29:17,548] Trial 116 finished with value: 0.21123497882654013 and parameters: {'model_name': 'IterativeImputer', 'estimator': 'RFR', 'initial_strategy': 'median', 'n_nearest_features': 6, 'imputation_order': 'arabic'}. Best is trial 107 with value: 0.19850015889912181.
running
[I 2024-10-07 19:36:44,955] Trial 124 finished with value: 0.22125301514685422 and parameters: {'model_name': 'IterativeImputer', 'estimator': 'RFR', 'initial_strategy': 'median', 'n_nearest_features': 4, 'imputation_order': 'arabic'}. Best is trial 107 with value: 0.19850015889912181.
running
[I 2024-10-07 19:39:00,281] Trial 125 finished with value: 0.219492582315883 and parameters: {'model_name': 'IterativeImputer', 'estimator': 'RFR', 'initial_strategy': 'median', 'n_nearest_features': 4, 'imputation_order': 'arabic'}. Best is trial 107 with value: 0.19850015889912181.
running
[I 2024-10-07 19:41:03,999] Trial 128 finished with value: 0.21537261647330702 and parameters: {'model_name': 'IterativeImputer', 'estimator': 'RFR', 'initial_strategy': 'median', 'n_nearest_features': 2, 'imputation_order': 'arabic'}. Best is trial 107 with value: 0.19850015889912181.
running
[I 2024-10-07 19:44:58,911] Trial 122 finished with value: 0.20034955065580323 and parameters: {'model_name': 'IterativeImputer', 'estimator': 'RFR', 'initial_strategy': 'median', 'n_nearest_features': 9, 'imputation_order': 'arabic'}. Best is trial 107 with value: 0.19850015889912181.
running
[I 2024-10-07 19:49:14,333] Trial 123 finished with value: 0.2010064245210502 and parameters: {'model_name': 'IterativeImputer', 'estimator': 'RFR', 'initial_strategy': 'median', 'n_nearest_features': 11, 'imputation_order': 'arabic'}. Best is trial 107 with value: 0.19850015889912181.
running
[I 2024-10-07 19:49:15,501] Trial 143 finished with value: 0.26721967294989646 and parameters: {'model_name': 'SimpleImputer', 'strategy': 'most_frequent'}. Best is trial 107 with value: 0.19850015889912181.
running
[I 2024-10-07 19:49:19,794] Trial 132 finished with value: 0.21498062462088902 and parameters: {'model_name': 'IterativeImputer', 'estimator': 'RFR', 'initial_strategy': 'most_frequent', 'n_nearest_features': 1, 'imputation_order': 'arabic'}. Best is trial 107 with value: 0.19850015889912181.
running
[I 2024-10-07 19:55:50,259] Trial 126 finished with value: 0.20160714571866314 and parameters: {'model_name': 'IterativeImputer', 'estimator': 'RFR', 'initial_strategy': 'median', 'n_nearest_features': 9, 'imputation_order': 'arabic'}. Best is trial 107 with value: 0.19850015889912181.
running
[I 2024-10-07 19:56:51,361] Trial 41 finished with value: 0.21742807818165827 and parameters: {'model_name': 'VAE', 'batch_size': 717, 'iterations': 6736, 'learning_rate': 0.00010631460789813842, 'p_miss': 0.2847618798955095}. Best is trial 107 with value: 0.19850015889912181.
running
[I 2024-10-07 20:02:04,477] Trial 127 finished with value: 0.19986350911124678 and parameters: {'model_name': 'IterativeImputer', 'estimator': 'RFR', 'initial_strategy': 'median', 'n_nearest_features': 11, 'imputation_order': 'arabic'}. Best is trial 107 with value: 0.19850015889912181.
running
[I 2024-10-07 20:11:40,803] Trial 129 finished with value: 0.19964474508814417 and parameters: {'model_name': 'IterativeImputer', 'estimator': 'RFR', 'initial_strategy': 'median', 'n_nearest_features': 11, 'imputation_order': 'arabic'}. Best is trial 107 with value: 0.19850015889912181.
running
[I 2024-10-07 20:13:00,052] Trial 135 finished with value: 0.20008077949170583 and parameters: {'model_name': 'IterativeImputer', 'estimator': 'RFR', 'initial_strategy': 'median', 'n_nearest_features': 12, 'imputation_order': 'arabic'}. Best is trial 107 with value: 0.19850015889912181.
running
[I 2024-10-07 20:13:49,494] Trial 137 finished with value: 0.20075966090336675 and parameters: {'model_name': 'IterativeImputer', 'estimator': 'RFR', 'initial_strategy': 'most_frequent', 'n_nearest_features': 12, 'imputation_order': 'ascending'}. Best is trial 107 with value: 0.19850015889912181.
running
[I 2024-10-07 20:14:03,855] Trial 136 finished with value: 0.19980550783623596 and parameters: {'model_name': 'IterativeImputer', 'estimator': 'RFR', 'initial_strategy': 'median', 'n_nearest_features': 12, 'imputation_order': 'arabic'}. Best is trial 107 with value: 0.19850015889912181.
running
[I 2024-10-07 20:14:38,119] Trial 138 finished with value: 0.20063236336646623 and parameters: {'model_name': 'IterativeImputer', 'estimator': 'RFR', 'initial_strategy': 'most_frequent', 'n_nearest_features': 12, 'imputation_order': 'ascending'}. Best is trial 107 with value: 0.19850015889912181.
running
[I 2024-10-07 20:20:51,424] Trial 139 finished with value: 0.20009324271820156 and parameters: {'model_name': 'IterativeImputer', 'estimator': 'RFR', 'initial_strategy': 'most_frequent', 'n_nearest_features': 12, 'imputation_order': 'ascending'}. Best is trial 107 with value: 0.19850015889912181.
running
[I 2024-10-07 20:21:20,810] Trial 154 finished with value: 0.20655187568985472 and parameters: {'model_name': 'IterativeImputer', 'estimator': 'Ridge', 'initial_strategy': 'constant', 'n_nearest_features': 11, 'imputation_order': 'ascending'}. Best is trial 107 with value: 0.19850015889912181.
running
[I 2024-10-07 20:22:50,377] Trial 140 finished with value: 0.19934454183146316 and parameters: {'model_name': 'IterativeImputer', 'estimator': 'RFR', 'initial_strategy': 'most_frequent', 'n_nearest_features': 12, 'imputation_order': 'ascending'}. Best is trial 107 with value: 0.19850015889912181.
running
[I 2024-10-07 20:24:09,316] Trial 141 finished with value: 0.20042431858744733 and parameters: {'model_name': 'IterativeImputer', 'estimator': 'RFR', 'initial_strategy': 'most_frequent', 'n_nearest_features': 12, 'imputation_order': 'ascending'}. Best is trial 107 with value: 0.19850015889912181.
running
[I 2024-10-07 20:28:27,348] Trial 142 finished with value: 0.19886626862226406 and parameters: {'model_name': 'IterativeImputer', 'estimator': 'RFR', 'initial_strategy': 'most_frequent', 'n_nearest_features': 12, 'imputation_order': 'ascending'}. Best is trial 107 with value: 0.19850015889912181.
running
[I 2024-10-07 20:32:40,945] Trial 144 finished with value: 0.20006300429081084 and parameters: {'model_name': 'IterativeImputer', 'estimator': 'RFR', 'initial_strategy': 'most_frequent', 'n_nearest_features': 12, 'imputation_order': 'ascending'}. Best is trial 107 with value: 0.19850015889912181.
running
[I 2024-10-07 20:33:02,769] Trial 145 finished with value: 0.20074712841886022 and parameters: {'model_name': 'IterativeImputer', 'estimator': 'RFR', 'initial_strategy': 'most_frequent', 'n_nearest_features': 12, 'imputation_order': 'ascending'}. Best is trial 107 with value: 0.19850015889912181.
running
[I 2024-10-07 20:39:34,810] Trial 146 finished with value: 0.19962331165205688 and parameters: {'model_name': 'IterativeImputer', 'estimator': 'RFR', 'initial_strategy': 'most_frequent', 'n_nearest_features': 12, 'imputation_order': 'roman'}. Best is trial 107 with value: 0.19850015889912181.
running
[I 2024-10-07 20:40:06,118] Trial 147 finished with value: 0.19966232313998228 and parameters: {'model_name': 'IterativeImputer', 'estimator': 'RFR', 'initial_strategy': 'most_frequent', 'n_nearest_features': 12, 'imputation_order': 'roman'}. Best is trial 107 with value: 0.19850015889912181.
running
[I 2024-10-07 20:45:15,194] Trial 148 finished with value: 0.19947889521912515 and parameters: {'model_name': 'IterativeImputer', 'estimator': 'RFR', 'initial_strategy': 'most_frequent', 'n_nearest_features': 12, 'imputation_order': 'ascending'}. Best is trial 107 with value: 0.19850015889912181.
running
