[I 2024-08-26 17:30:43,542] Trial 103 finished with value: 0.29926411273580744 and parameters: {'model_name': 'SimpleImputer', 'strategy': 'constant'}. Best is trial 0 with value: 0.29926411273580744.
running
[I 2024-08-26 17:30:43,782] Trial 105 finished with value: 0.29926411273580744 and parameters: {'model_name': 'SimpleImputer', 'strategy': 'constant'}. Best is trial 0 with value: 0.29926411273580744.
running
[I 2024-08-26 17:30:43,916] Trial 106 finished with value: 0.29926411273580744 and parameters: {'model_name': 'SimpleImputer', 'strategy': 'constant'}. Best is trial 0 with value: 0.29926411273580744.
running
[I 2024-08-26 17:30:44,067] Trial 104 finished with value: 0.29926411273580744 and parameters: {'model_name': 'SimpleImputer', 'strategy': 'constant'}. Best is trial 0 with value: 0.29926411273580744.
running
[I 2024-08-26 17:30:44,699] Trial 108 finished with value: 0.29926411273580744 and parameters: {'model_name': 'SimpleImputer', 'strategy': 'median'}. Best is trial 0 with value: 0.29926411273580744.
running
[I 2024-08-26 17:30:44,833] Trial 107 finished with value: 0.29926411273580744 and parameters: {'model_name': 'SimpleImputer', 'strategy': 'median'}. Best is trial 0 with value: 0.29926411273580744.
running
[I 2024-08-26 17:30:44,963] Trial 109 finished with value: 0.29926411273580744 and parameters: {'model_name': 'SimpleImputer', 'strategy': 'median'}. Best is trial 0 with value: 0.29926411273580744.
running
[I 2024-08-26 17:30:45,306] Trial 114 finished with value: 0.29926411273580744 and parameters: {'model_name': 'SimpleImputer', 'strategy': 'median'}. Best is trial 0 with value: 0.29926411273580744.
running
[I 2024-08-26 17:30:45,429] Trial 112 finished with value: 0.29926411273580744 and parameters: {'model_name': 'SimpleImputer', 'strategy': 'median'}. Best is trial 0 with value: 0.29926411273580744.
running
[I 2024-08-26 17:30:45,643] Trial 116 finished with value: 0.29926411273580744 and parameters: {'model_name': 'SimpleImputer', 'strategy': 'median'}. Best is trial 0 with value: 0.29926411273580744.
[I 2024-08-26 17:30:45,752] Trial 110 finished with value: 0.29926411273580744 and parameters: {'model_name': 'SimpleImputer', 'strategy': 'median'}. Best is trial 0 with value: 0.29926411273580744.
[I 2024-08-26 17:30:45,854] Trial 115 finished with value: 0.29926411273580744 and parameters: {'model_name': 'SimpleImputer', 'strategy': 'median'}. Best is trial 0 with value: 0.29926411273580744.
running
running
running
[I 2024-08-26 17:30:45,992] Trial 113 finished with value: 0.29926411273580744 and parameters: {'model_name': 'SimpleImputer', 'strategy': 'median'}. Best is trial 0 with value: 0.29926411273580744.
running
[I 2024-08-26 17:30:46,128] Trial 111 finished with value: 0.29926411273580744 and parameters: {'model_name': 'SimpleImputer', 'strategy': 'median'}. Best is trial 0 with value: 0.29926411273580744.
running
[I 2024-08-26 17:30:46,284] Trial 117 finished with value: 0.29926411273580744 and parameters: {'model_name': 'SimpleImputer', 'strategy': 'median'}. Best is trial 0 with value: 0.29926411273580744.
running
[I 2024-08-26 17:30:46,551] Trial 119 finished with value: 0.29926411273580744 and parameters: {'model_name': 'SimpleImputer', 'strategy': 'median'}. Best is trial 0 with value: 0.29926411273580744.
running
[I 2024-08-26 17:30:46,651] Trial 120 finished with value: 0.29926411273580744 and parameters: {'model_name': 'SimpleImputer', 'strategy': 'median'}. Best is trial 0 with value: 0.29926411273580744.
running
[I 2024-08-26 17:30:46,814] Trial 118 finished with value: 0.29926411273580744 and parameters: {'model_name': 'SimpleImputer', 'strategy': 'median'}. Best is trial 0 with value: 0.29926411273580744.
running
[I 2024-08-26 17:30:47,104] Trial 122 finished with value: 0.29926411273580744 and parameters: {'model_name': 'SimpleImputer', 'strategy': 'median'}. Best is trial 0 with value: 0.29926411273580744.
running
[I 2024-08-26 17:30:47,247] Trial 121 finished with value: 0.29926411273580744 and parameters: {'model_name': 'SimpleImputer', 'strategy': 'median'}. Best is trial 0 with value: 0.29926411273580744.
running
[I 2024-08-26 17:30:47,609] Trial 123 finished with value: 0.29926411273580744 and parameters: {'model_name': 'SimpleImputer', 'strategy': 'median'}. Best is trial 0 with value: 0.29926411273580744.
running
[I 2024-08-26 17:30:48,042] Trial 125 finished with value: 0.29926411273580744 and parameters: {'model_name': 'SimpleImputer', 'strategy': 'median'}. Best is trial 0 with value: 0.29926411273580744.
running
[I 2024-08-26 17:30:48,189] Trial 124 finished with value: 0.29926411273580744 and parameters: {'model_name': 'SimpleImputer', 'strategy': 'median'}. Best is trial 0 with value: 0.29926411273580744.
running
[I 2024-08-26 17:30:48,388] Trial 126 finished with value: 0.29926411273580744 and parameters: {'model_name': 'SimpleImputer', 'strategy': 'median'}. Best is trial 0 with value: 0.29926411273580744.
running
[I 2024-08-26 17:30:48,691] Trial 128 finished with value: 0.29926411273580744 and parameters: {'model_name': 'SimpleImputer', 'strategy': 'median'}. Best is trial 0 with value: 0.29926411273580744.
[I 2024-08-26 17:30:48,798] Trial 132 finished with value: 0.29926411273580744 and parameters: {'model_name': 'SimpleImputer', 'strategy': 'median'}. Best is trial 0 with value: 0.29926411273580744.
running
running
[I 2024-08-26 17:30:48,930] Trial 127 finished with value: 0.29926411273580744 and parameters: {'model_name': 'SimpleImputer', 'strategy': 'median'}. Best is trial 0 with value: 0.29926411273580744.
running
[I 2024-08-26 17:30:49,106] Trial 130 finished with value: 0.29926411273580744 and parameters: {'model_name': 'SimpleImputer', 'strategy': 'median'}. Best is trial 0 with value: 0.29926411273580744.
running
[I 2024-08-26 17:30:49,232] Trial 129 finished with value: 0.29926411273580744 and parameters: {'model_name': 'SimpleImputer', 'strategy': 'median'}. Best is trial 0 with value: 0.29926411273580744.
running
[I 2024-08-26 17:30:49,596] Trial 131 finished with value: 0.29926411273580744 and parameters: {'model_name': 'SimpleImputer', 'strategy': 'median'}. Best is trial 0 with value: 0.29926411273580744.
[I 2024-08-26 17:30:49,723] Trial 135 finished with value: 0.29926411273580744 and parameters: {'model_name': 'SimpleImputer', 'strategy': 'median'}. Best is trial 0 with value: 0.29926411273580744.
running
running
[I 2024-08-26 17:30:49,881] Trial 133 finished with value: 0.29926411273580744 and parameters: {'model_name': 'SimpleImputer', 'strategy': 'median'}. Best is trial 0 with value: 0.29926411273580744.
running
[I 2024-08-26 17:30:50,020] Trial 134 finished with value: 0.29926411273580744 and parameters: {'model_name': 'SimpleImputer', 'strategy': 'median'}. Best is trial 0 with value: 0.29926411273580744.
running
[I 2024-08-26 17:30:50,359] Trial 136 finished with value: 0.29926411273580744 and parameters: {'model_name': 'SimpleImputer', 'strategy': 'median'}. Best is trial 0 with value: 0.29926411273580744.
running
[I 2024-08-26 17:30:50,846] Trial 137 finished with value: 0.29926411273580744 and parameters: {'model_name': 'SimpleImputer', 'strategy': 'median'}. Best is trial 0 with value: 0.29926411273580744.
running
[I 2024-08-26 17:30:51,372] Trial 149 finished with value: 0.29926411273580744 and parameters: {'model_name': 'SimpleImputer', 'strategy': 'constant'}. Best is trial 0 with value: 0.29926411273580744.
running
[I 2024-08-26 17:30:51,550] Trial 148 finished with value: 0.29926411273580744 and parameters: {'model_name': 'SimpleImputer', 'strategy': 'constant'}. Best is trial 0 with value: 0.29926411273580744.
running
[I 2024-08-26 17:30:51,784] Trial 152 finished with value: 0.29926411273580744 and parameters: {'model_name': 'SimpleImputer', 'strategy': 'constant'}. Best is trial 0 with value: 0.29926411273580744.
running
[I 2024-08-26 17:30:52,040] Trial 138 finished with value: 0.3194219506777331 and parameters: {'model_name': 'SimpleImputer', 'strategy': 'most_frequent'}. Best is trial 0 with value: 0.29926411273580744.
running
[I 2024-08-26 17:30:52,155] Trial 139 finished with value: 0.3194219506777331 and parameters: {'model_name': 'SimpleImputer', 'strategy': 'most_frequent'}. Best is trial 0 with value: 0.29926411273580744.
running
[I 2024-08-26 17:30:52,626] Trial 153 finished with value: 0.29926411273580744 and parameters: {'model_name': 'SimpleImputer', 'strategy': 'constant'}. Best is trial 0 with value: 0.29926411273580744.
running
[I 2024-08-26 17:30:53,045] Trial 142 finished with value: 0.3194219506777331 and parameters: {'model_name': 'SimpleImputer', 'strategy': 'most_frequent'}. Best is trial 0 with value: 0.29926411273580744.
running
[I 2024-08-26 17:30:53,293] Trial 143 finished with value: 0.3194219506777331 and parameters: {'model_name': 'SimpleImputer', 'strategy': 'most_frequent'}. Best is trial 0 with value: 0.29926411273580744.
running
[I 2024-08-26 17:30:53,419] Trial 140 finished with value: 0.3194219506777331 and parameters: {'model_name': 'SimpleImputer', 'strategy': 'most_frequent'}. Best is trial 0 with value: 0.29926411273580744.
running
[I 2024-08-26 17:30:53,703] Trial 151 finished with value: 0.3194219506777331 and parameters: {'model_name': 'SimpleImputer', 'strategy': 'most_frequent'}. Best is trial 0 with value: 0.29926411273580744.
running
[I 2024-08-26 17:30:53,859] Trial 158 finished with value: 0.29926411273580744 and parameters: {'model_name': 'SimpleImputer', 'strategy': 'constant'}. Best is trial 0 with value: 0.29926411273580744.
running
[I 2024-08-26 17:30:54,039] Trial 141 finished with value: 0.3194219506777331 and parameters: {'model_name': 'SimpleImputer', 'strategy': 'most_frequent'}. Best is trial 0 with value: 0.29926411273580744.
running
[I 2024-08-26 17:30:54,216] Trial 146 finished with value: 0.3194219506777331 and parameters: {'model_name': 'SimpleImputer', 'strategy': 'most_frequent'}. Best is trial 0 with value: 0.29926411273580744.
[I 2024-08-26 17:30:54,326] Trial 157 finished with value: 0.29926411273580744 and parameters: {'model_name': 'SimpleImputer', 'strategy': 'constant'}. Best is trial 0 with value: 0.29926411273580744.
running
[I 2024-08-26 17:30:54,428] Trial 145 finished with value: 0.3194219506777331 and parameters: {'model_name': 'SimpleImputer', 'strategy': 'most_frequent'}. Best is trial 0 with value: 0.29926411273580744.
[I 2024-08-26 17:30:54,527] Trial 147 finished with value: 0.3194219506777331 and parameters: {'model_name': 'SimpleImputer', 'strategy': 'most_frequent'}. Best is trial 0 with value: 0.29926411273580744.
running
running
running
[I 2024-08-26 17:30:54,714] Trial 144 finished with value: 0.3194219506777331 and parameters: {'model_name': 'SimpleImputer', 'strategy': 'most_frequent'}. Best is trial 0 with value: 0.29926411273580744.
running
[I 2024-08-26 17:30:55,049] Trial 159 finished with value: 0.29926411273580744 and parameters: {'model_name': 'SimpleImputer', 'strategy': 'constant'}. Best is trial 0 with value: 0.29926411273580744.
running
[I 2024-08-26 17:30:55,307] Trial 150 finished with value: 0.3194219506777331 and parameters: {'model_name': 'SimpleImputer', 'strategy': 'most_frequent'}. Best is trial 0 with value: 0.29926411273580744.
running
[I 2024-08-26 17:30:55,474] Trial 160 finished with value: 0.29926411273580744 and parameters: {'model_name': 'SimpleImputer', 'strategy': 'constant'}. Best is trial 0 with value: 0.29926411273580744.
running
[I 2024-08-26 17:30:55,803] Trial 161 finished with value: 0.29926411273580744 and parameters: {'model_name': 'SimpleImputer', 'strategy': 'constant'}. Best is trial 0 with value: 0.29926411273580744.
running
[I 2024-08-26 17:30:55,966] Trial 162 finished with value: 0.29926411273580744 and parameters: {'model_name': 'SimpleImputer', 'strategy': 'constant'}. Best is trial 0 with value: 0.29926411273580744.
[I 2024-08-26 17:30:56,076] Trial 164 finished with value: 0.29926411273580744 and parameters: {'model_name': 'SimpleImputer', 'strategy': 'constant'}. Best is trial 0 with value: 0.29926411273580744.
running
running
[I 2024-08-26 17:30:56,249] Trial 163 finished with value: 0.29926411273580744 and parameters: {'model_name': 'SimpleImputer', 'strategy': 'constant'}. Best is trial 0 with value: 0.29926411273580744.
running
[I 2024-08-26 17:30:56,424] Trial 166 finished with value: 0.29926411273580744 and parameters: {'model_name': 'SimpleImputer', 'strategy': 'constant'}. Best is trial 0 with value: 0.29926411273580744.
running
[I 2024-08-26 17:30:56,554] Trial 169 finished with value: 0.29926411273580744 and parameters: {'model_name': 'SimpleImputer', 'strategy': 'constant'}. Best is trial 0 with value: 0.29926411273580744.
running
[I 2024-08-26 17:30:56,710] Trial 165 finished with value: 0.29926411273580744 and parameters: {'model_name': 'SimpleImputer', 'strategy': 'constant'}. Best is trial 0 with value: 0.29926411273580744.
running
[I 2024-08-26 17:30:56,868] Trial 168 finished with value: 0.29926411273580744 and parameters: {'model_name': 'SimpleImputer', 'strategy': 'constant'}. Best is trial 0 with value: 0.29926411273580744.
running
[I 2024-08-26 17:30:57,002] Trial 167 finished with value: 0.29926411273580744 and parameters: {'model_name': 'SimpleImputer', 'strategy': 'constant'}. Best is trial 0 with value: 0.29926411273580744.
running
[I 2024-08-26 17:30:57,119] Trial 154 finished with value: 0.3194219506777331 and parameters: {'model_name': 'SimpleImputer', 'strategy': 'most_frequent'}. Best is trial 0 with value: 0.29926411273580744.
running
[I 2024-08-26 17:30:57,245] Trial 155 finished with value: 0.3194219506777331 and parameters: {'model_name': 'SimpleImputer', 'strategy': 'most_frequent'}. Best is trial 0 with value: 0.29926411273580744.
running
[I 2024-08-26 17:30:57,475] Trial 170 finished with value: 0.29926411273580744 and parameters: {'model_name': 'SimpleImputer', 'strategy': 'constant'}. Best is trial 0 with value: 0.29926411273580744.
running
[I 2024-08-26 17:30:57,630] Trial 171 finished with value: 0.29926411273580744 and parameters: {'model_name': 'SimpleImputer', 'strategy': 'constant'}. Best is trial 0 with value: 0.29926411273580744.
running
[I 2024-08-26 17:30:57,881] Trial 173 finished with value: 0.29926411273580744 and parameters: {'model_name': 'SimpleImputer', 'strategy': 'constant'}. Best is trial 0 with value: 0.29926411273580744.
[I 2024-08-26 17:30:58,019] Trial 172 finished with value: 0.29926411273580744 and parameters: {'model_name': 'SimpleImputer', 'strategy': 'constant'}. Best is trial 0 with value: 0.29926411273580744.
running
running
[I 2024-08-26 17:30:58,197] Trial 156 finished with value: 0.3194219506777331 and parameters: {'model_name': 'SimpleImputer', 'strategy': 'most_frequent'}. Best is trial 0 with value: 0.29926411273580744.
running
[I 2024-08-26 17:30:58,371] Trial 174 finished with value: 0.29926411273580744 and parameters: {'model_name': 'SimpleImputer', 'strategy': 'constant'}. Best is trial 0 with value: 0.29926411273580744.
running
[I 2024-08-26 17:30:59,090] Trial 175 finished with value: 0.29926411273580744 and parameters: {'model_name': 'SimpleImputer', 'strategy': 'median'}. Best is trial 0 with value: 0.29926411273580744.
running
[I 2024-08-26 17:30:59,261] Trial 179 finished with value: 0.29926411273580744 and parameters: {'model_name': 'SimpleImputer', 'strategy': 'median'}. Best is trial 0 with value: 0.29926411273580744.
running
[I 2024-08-26 17:30:59,459] Trial 176 finished with value: 0.29926411273580744 and parameters: {'model_name': 'SimpleImputer', 'strategy': 'median'}. Best is trial 0 with value: 0.29926411273580744.
[I 2024-08-26 17:30:59,554] Trial 177 finished with value: 0.29926411273580744 and parameters: {'model_name': 'SimpleImputer', 'strategy': 'median'}. Best is trial 0 with value: 0.29926411273580744.
running
running
[I 2024-08-26 17:30:59,811] Trial 178 finished with value: 0.29926411273580744 and parameters: {'model_name': 'SimpleImputer', 'strategy': 'median'}. Best is trial 0 with value: 0.29926411273580744.
[I 2024-08-26 17:30:59,920] Trial 182 finished with value: 0.29926411273580744 and parameters: {'model_name': 'SimpleImputer', 'strategy': 'median'}. Best is trial 0 with value: 0.29926411273580744.
running
running
[I 2024-08-26 17:31:00,036] Trial 184 finished with value: 0.29926411273580744 and parameters: {'model_name': 'SimpleImputer', 'strategy': 'median'}. Best is trial 0 with value: 0.29926411273580744.
running
[I 2024-08-26 17:31:00,147] Trial 180 finished with value: 0.29926411273580744 and parameters: {'model_name': 'SimpleImputer', 'strategy': 'median'}. Best is trial 0 with value: 0.29926411273580744.
running
[I 2024-08-26 17:31:00,376] Trial 181 finished with value: 0.29926411273580744 and parameters: {'model_name': 'SimpleImputer', 'strategy': 'median'}. Best is trial 0 with value: 0.29926411273580744.
running
[I 2024-08-26 17:31:00,551] Trial 186 finished with value: 0.29926411273580744 and parameters: {'model_name': 'SimpleImputer', 'strategy': 'median'}. Best is trial 0 with value: 0.29926411273580744.
[I 2024-08-26 17:31:00,737] Trial 183 finished with value: 0.29926411273580744 and parameters: {'model_name': 'SimpleImputer', 'strategy': 'median'}. Best is trial 0 with value: 0.29926411273580744.
[I 2024-08-26 17:31:00,845] Trial 185 finished with value: 0.29926411273580744 and parameters: {'model_name': 'SimpleImputer', 'strategy': 'median'}. Best is trial 0 with value: 0.29926411273580744.
[I 2024-08-26 17:31:01,001] Trial 188 finished with value: 0.29926411273580744 and parameters: {'model_name': 'SimpleImputer', 'strategy': 'median'}. Best is trial 0 with value: 0.29926411273580744.
[I 2024-08-26 17:31:01,215] Trial 190 finished with value: 0.29926411273580744 and parameters: {'model_name': 'SimpleImputer', 'strategy': 'median'}. Best is trial 0 with value: 0.29926411273580744.
[I 2024-08-26 17:31:01,327] Trial 189 finished with value: 0.29926411273580744 and parameters: {'model_name': 'SimpleImputer', 'strategy': 'median'}. Best is trial 0 with value: 0.29926411273580744.
[I 2024-08-26 17:31:01,500] Trial 187 finished with value: 0.29926411273580744 and parameters: {'model_name': 'SimpleImputer', 'strategy': 'median'}. Best is trial 0 with value: 0.29926411273580744.
[I 2024-08-26 17:31:01,887] Trial 193 finished with value: 0.29926411273580744 and parameters: {'model_name': 'SimpleImputer', 'strategy': 'median'}. Best is trial 0 with value: 0.29926411273580744.
[I 2024-08-26 17:31:01,984] Trial 192 finished with value: 0.29926411273580744 and parameters: {'model_name': 'SimpleImputer', 'strategy': 'median'}. Best is trial 0 with value: 0.29926411273580744.
[I 2024-08-26 17:31:02,068] Trial 194 finished with value: 0.29926411273580744 and parameters: {'model_name': 'SimpleImputer', 'strategy': 'median'}. Best is trial 0 with value: 0.29926411273580744.
[I 2024-08-26 17:31:02,187] Trial 191 finished with value: 0.29926411273580744 and parameters: {'model_name': 'SimpleImputer', 'strategy': 'median'}. Best is trial 0 with value: 0.29926411273580744.
[I 2024-08-26 17:31:02,314] Trial 195 finished with value: 0.29926411273580744 and parameters: {'model_name': 'SimpleImputer', 'strategy': 'median'}. Best is trial 0 with value: 0.29926411273580744.
[I 2024-08-26 17:31:02,439] Trial 198 finished with value: 0.29926411273580744 and parameters: {'model_name': 'SimpleImputer', 'strategy': 'median'}. Best is trial 0 with value: 0.29926411273580744.
[I 2024-08-26 17:31:02,540] Trial 196 finished with value: 0.29926411273580744 and parameters: {'model_name': 'SimpleImputer', 'strategy': 'median'}. Best is trial 0 with value: 0.29926411273580744.
[I 2024-08-26 17:31:02,651] Trial 197 finished with value: 0.29926411273580744 and parameters: {'model_name': 'SimpleImputer', 'strategy': 'median'}. Best is trial 0 with value: 0.29926411273580744.
