[I 2024-09-22 12:03:30,449] Trial 36 finished with value: 0.1733316165861271 and parameters: {'model_name': 'VAE', 'batch_size': 1, 'iterations': 8736, 'learning_rate': 0.00016932229100885516, 'p_miss': 0.2985979951387717}. Best is trial 13 with value: 0.1316992340328043.
fit
auto fit
auto transform
0    0
1    0
2    0
3    0
4    0
5    0
dtype: int64
0    0
1    0
2    0
3    0
4    0
5    0
dtype: int64
0.1316992340328043
{'model_name': 'KNNImputer', 'n_neighbors': 200, 'weights': 'uniform'}
running experiment 2/3 - Does reconstruction give good automl predictions
Start est fit
Version 0.1.7a0 of tpot2 is outdated. Version 0.1.8a0 was released 4 days ago.
Version 0.1.7a0 of tpot2 is outdated. Version 0.1.8a0 was released 4 days ago.
Version 0.1.7a0 of tpot2 is outdated. Version 0.1.8a0 was released 4 days ago.
Version 0.1.7a0 of tpot2 is outdated. Version 0.1.8a0 was released 4 days ago.
Version 0.1.7a0 of tpot2 is outdated. Version 0.1.8a0 was released 4 days ago.
Version 0.1.7a0 of tpot2 is outdated. Version 0.1.8a0 was released 4 days ago.
Version 0.1.7a0 of tpot2 is outdated. Version 0.1.8a0 was released 4 days ago.
Version 0.1.7a0 of tpot2 is outdated. Version 0.1.8a0 was released 4 days ago.
Version 0.1.7a0 of tpot2 is outdated. Version 0.1.8a0 was released 4 days ago.
Version 0.1.7a0 of tpot2 is outdated. Version 0.1.8a0 was released 4 days ago.
Version 0.1.7a0 of tpot2 is outdated. Version 0.1.8a0 was released 4 days ago.
Version 0.1.7a0 of tpot2 is outdated. Version 0.1.8a0 was released 4 days ago.
Version 0.1.7a0 of tpot2 is outdated. Version 0.1.8a0 was released 4 days ago.
Version 0.1.7a0 of tpot2 is outdated. Version 0.1.8a0 was released 4 days ago.
Version 0.1.7a0 of tpot2 is outdated. Version 0.1.8a0 was released 4 days ago.
Version 0.1.7a0 of tpot2 is outdated. Version 0.1.8a0 was released 4 days ago.
  0%|          | 0/25 [00:00<?, ?it/s]Generation:   0%|          | 0/25 [00:00<?, ?it/s]WARNING THIS INDIVIDUAL CAUSED AND EXCEPTION 
 <tpot2.search_spaces.pipelines.sequential.SequentialPipelineIndividual object at 0x155474cd12d0> 
 The 'criterion' parameter of DecisionTreeRegressor must be a str among {'friedman_mse', 'poisson', 'absolute_error', 'squared_error'}. Got 'mae' instead. 
 Traceback (most recent call last):
  File "/common/ketrong/tpotexp/tpot2/tpot2/utils/eval_utils.py", line 53, in objective_nan_wrapper
    value = func_timeout.func_timeout(timeout, objective_function, args=[individual], kwargs=objective_kwargs)
  File "/common/ketrong/tpotexp/env/lib/python3.10/site-packages/func_timeout/dafunc.py", line 108, in func_timeout
    raise_exception(exception)
  File "/common/ketrong/tpotexp/env/lib/python3.10/site-packages/func_timeout/py3_raise.py", line 7, in raise_exception
    raise exception[0] from None
  File "/common/ketrong/tpotexp/tpot2/tpot2/tpot_estimator/estimator.py", line 623, in objective_function
    return objective_function_generator(
  File "/common/ketrong/tpotexp/tpot2/tpot2/tpot_estimator/estimator_utils.py", line 55, in objective_function_generator
    cv_obj_scores = cross_val_score_objective(sklearn.base.clone(pipeline),x,y,scorers=scorers, cv=cv , fold=step)
  File "/common/ketrong/tpotexp/tpot2/tpot2/tpot_estimator/cross_val_utils.py", line 28, in cross_val_score_objective
    this_fold_pipeline.fit(X_train,y_train)
  File "/common/ketrong/tpotexp/env/lib/python3.10/site-packages/sklearn/base.py", line 1473, in wrapper
    return fit_method(estimator, *args, **kwargs)
  File "/common/ketrong/tpotexp/env/lib/python3.10/site-packages/sklearn/pipeline.py", line 473, in fit
    self._final_estimator.fit(Xt, y, **last_step_params["fit"])
  File "/common/ketrong/tpotexp/env/lib/python3.10/site-packages/sklearn/base.py", line 1466, in wrapper
    estimator._validate_params()
  File "/common/ketrong/tpotexp/env/lib/python3.10/site-packages/sklearn/base.py", line 666, in _validate_params
    validate_parameter_constraints(
  File "/common/ketrong/tpotexp/env/lib/python3.10/site-packages/sklearn/utils/_param_validation.py", line 95, in validate_parameter_constraints
    raise InvalidParameterError(
sklearn.utils._param_validation.InvalidParameterError: The 'criterion' parameter of DecisionTreeRegressor must be a str among {'friedman_mse', 'poisson', 'absolute_error', 'squared_error'}. Got 'mae' instead.

WARNING THIS INDIVIDUAL CAUSED AND EXCEPTION 
 <tpot2.search_spaces.pipelines.sequential.SequentialPipelineIndividual object at 0x155474cd0be0> 
 The 'criterion' parameter of DecisionTreeRegressor must be a str among {'friedman_mse', 'poisson', 'absolute_error', 'squared_error'}. Got 'mae' instead. 
 Traceback (most recent call last):
  File "/common/ketrong/tpotexp/tpot2/tpot2/utils/eval_utils.py", line 53, in objective_nan_wrapper
    value = func_timeout.func_timeout(timeout, objective_function, args=[individual], kwargs=objective_kwargs)
  File "/common/ketrong/tpotexp/env/lib/python3.10/site-packages/func_timeout/dafunc.py", line 108, in func_timeout
    raise_exception(exception)
  File "/common/ketrong/tpotexp/env/lib/python3.10/site-packages/func_timeout/py3_raise.py", line 7, in raise_exception
    raise exception[0] from None
  File "/common/ketrong/tpotexp/tpot2/tpot2/tpot_estimator/estimator.py", line 623, in objective_function
    return objective_function_generator(
  File "/common/ketrong/tpotexp/tpot2/tpot2/tpot_estimator/estimator_utils.py", line 55, in objective_function_generator
    cv_obj_scores = cross_val_score_objective(sklearn.base.clone(pipeline),x,y,scorers=scorers, cv=cv , fold=step)
  File "/common/ketrong/tpotexp/tpot2/tpot2/tpot_estimator/cross_val_utils.py", line 28, in cross_val_score_objective
    this_fold_pipeline.fit(X_train,y_train)
  File "/common/ketrong/tpotexp/env/lib/python3.10/site-packages/sklearn/base.py", line 1473, in wrapper
    return fit_method(estimator, *args, **kwargs)
  File "/common/ketrong/tpotexp/env/lib/python3.10/site-packages/sklearn/pipeline.py", line 473, in fit
    self._final_estimator.fit(Xt, y, **last_step_params["fit"])
  File "/common/ketrong/tpotexp/env/lib/python3.10/site-packages/sklearn/base.py", line 1466, in wrapper
    estimator._validate_params()
  File "/common/ketrong/tpotexp/env/lib/python3.10/site-packages/sklearn/base.py", line 666, in _validate_params
    validate_parameter_constraints(
  File "/common/ketrong/tpotexp/env/lib/python3.10/site-packages/sklearn/utils/_param_validation.py", line 95, in validate_parameter_constraints
    raise InvalidParameterError(
sklearn.utils._param_validation.InvalidParameterError: The 'criterion' parameter of DecisionTreeRegressor must be a str among {'friedman_mse', 'poisson', 'absolute_error', 'squared_error'}. Got 'mae' instead.

Generation:  1
Best root_mean_squared_error score: -0.0014375925128042924
Generation:   4%|▍         | 1/25 [00:23<09:23, 23.48s/it]Generation:  2
Best root_mean_squared_error score: -0.0014296880094516497
Generation:   8%|▊         | 2/25 [04:46<1:03:05, 164.58s/it]WARNING THIS INDIVIDUAL CAUSED AND EXCEPTION 
 <tpot2.search_spaces.pipelines.sequential.SequentialPipelineIndividual object at 0x1554746a41c0> 
 The 'criterion' parameter of RandomForestRegressor must be a str among {'friedman_mse', 'poisson', 'absolute_error', 'squared_error'}. Got 'mse' instead. 
 Traceback (most recent call last):
  File "/common/ketrong/tpotexp/tpot2/tpot2/utils/eval_utils.py", line 53, in objective_nan_wrapper
    value = func_timeout.func_timeout(timeout, objective_function, args=[individual], kwargs=objective_kwargs)
  File "/common/ketrong/tpotexp/env/lib/python3.10/site-packages/func_timeout/dafunc.py", line 108, in func_timeout
    raise_exception(exception)
  File "/common/ketrong/tpotexp/env/lib/python3.10/site-packages/func_timeout/py3_raise.py", line 7, in raise_exception
    raise exception[0] from None
  File "/common/ketrong/tpotexp/tpot2/tpot2/tpot_estimator/estimator.py", line 623, in objective_function
    return objective_function_generator(
  File "/common/ketrong/tpotexp/tpot2/tpot2/tpot_estimator/estimator_utils.py", line 55, in objective_function_generator
    cv_obj_scores = cross_val_score_objective(sklearn.base.clone(pipeline),x,y,scorers=scorers, cv=cv , fold=step)
  File "/common/ketrong/tpotexp/tpot2/tpot2/tpot_estimator/cross_val_utils.py", line 28, in cross_val_score_objective
    this_fold_pipeline.fit(X_train,y_train)
  File "/common/ketrong/tpotexp/env/lib/python3.10/site-packages/sklearn/base.py", line 1473, in wrapper
    return fit_method(estimator, *args, **kwargs)
  File "/common/ketrong/tpotexp/env/lib/python3.10/site-packages/sklearn/pipeline.py", line 473, in fit
    self._final_estimator.fit(Xt, y, **last_step_params["fit"])
  File "/common/ketrong/tpotexp/env/lib/python3.10/site-packages/sklearn/base.py", line 1466, in wrapper
    estimator._validate_params()
  File "/common/ketrong/tpotexp/env/lib/python3.10/site-packages/sklearn/base.py", line 666, in _validate_params
    validate_parameter_constraints(
  File "/common/ketrong/tpotexp/env/lib/python3.10/site-packages/sklearn/utils/_param_validation.py", line 95, in validate_parameter_constraints
    raise InvalidParameterError(
sklearn.utils._param_validation.InvalidParameterError: The 'criterion' parameter of RandomForestRegressor must be a str among {'friedman_mse', 'poisson', 'absolute_error', 'squared_error'}. Got 'mse' instead.

WARNING THIS INDIVIDUAL CAUSED AND EXCEPTION 
 <tpot2.search_spaces.pipelines.sequential.SequentialPipelineIndividual object at 0x155474708910> 
 The 'criterion' parameter of ExtraTreesRegressor must be a str among {'friedman_mse', 'poisson', 'absolute_error', 'squared_error'}. Got 'mae' instead. 
 Traceback (most recent call last):
  File "/common/ketrong/tpotexp/tpot2/tpot2/utils/eval_utils.py", line 53, in objective_nan_wrapper
    value = func_timeout.func_timeout(timeout, objective_function, args=[individual], kwargs=objective_kwargs)
  File "/common/ketrong/tpotexp/env/lib/python3.10/site-packages/func_timeout/dafunc.py", line 108, in func_timeout
    raise_exception(exception)
  File "/common/ketrong/tpotexp/env/lib/python3.10/site-packages/func_timeout/py3_raise.py", line 7, in raise_exception
    raise exception[0] from None
  File "/common/ketrong/tpotexp/tpot2/tpot2/tpot_estimator/estimator.py", line 623, in objective_function
    return objective_function_generator(
  File "/common/ketrong/tpotexp/tpot2/tpot2/tpot_estimator/estimator_utils.py", line 55, in objective_function_generator
    cv_obj_scores = cross_val_score_objective(sklearn.base.clone(pipeline),x,y,scorers=scorers, cv=cv , fold=step)
  File "/common/ketrong/tpotexp/tpot2/tpot2/tpot_estimator/cross_val_utils.py", line 28, in cross_val_score_objective
    this_fold_pipeline.fit(X_train,y_train)
  File "/common/ketrong/tpotexp/env/lib/python3.10/site-packages/sklearn/base.py", line 1473, in wrapper
    return fit_method(estimator, *args, **kwargs)
  File "/common/ketrong/tpotexp/env/lib/python3.10/site-packages/sklearn/pipeline.py", line 473, in fit
    self._final_estimator.fit(Xt, y, **last_step_params["fit"])
  File "/common/ketrong/tpotexp/env/lib/python3.10/site-packages/sklearn/base.py", line 1466, in wrapper
    estimator._validate_params()
  File "/common/ketrong/tpotexp/env/lib/python3.10/site-packages/sklearn/base.py", line 666, in _validate_params
    validate_parameter_constraints(
  File "/common/ketrong/tpotexp/env/lib/python3.10/site-packages/sklearn/utils/_param_validation.py", line 95, in validate_parameter_constraints
    raise InvalidParameterError(
sklearn.utils._param_validation.InvalidParameterError: The 'criterion' parameter of ExtraTreesRegressor must be a str among {'friedman_mse', 'poisson', 'absolute_error', 'squared_error'}. Got 'mae' instead.

Generation:  3
Best root_mean_squared_error score: -0.0014296880094516497
Generation:  12%|█▏        | 3/25 [09:41<1:22:04, 223.86s/it]WARNING THIS INDIVIDUAL CAUSED AND EXCEPTION 
 <tpot2.search_spaces.pipelines.sequential.SequentialPipelineIndividual object at 0x15547472d630> 
 The 'criterion' parameter of RandomForestRegressor must be a str among {'friedman_mse', 'poisson', 'absolute_error', 'squared_error'}. Got 'mae' instead. 
 Traceback (most recent call last):
  File "/common/ketrong/tpotexp/tpot2/tpot2/utils/eval_utils.py", line 53, in objective_nan_wrapper
    value = func_timeout.func_timeout(timeout, objective_function, args=[individual], kwargs=objective_kwargs)
  File "/common/ketrong/tpotexp/env/lib/python3.10/site-packages/func_timeout/dafunc.py", line 108, in func_timeout
    raise_exception(exception)
  File "/common/ketrong/tpotexp/env/lib/python3.10/site-packages/func_timeout/py3_raise.py", line 7, in raise_exception
    raise exception[0] from None
  File "/common/ketrong/tpotexp/tpot2/tpot2/tpot_estimator/estimator.py", line 623, in objective_function
    return objective_function_generator(
  File "/common/ketrong/tpotexp/tpot2/tpot2/tpot_estimator/estimator_utils.py", line 55, in objective_function_generator
    cv_obj_scores = cross_val_score_objective(sklearn.base.clone(pipeline),x,y,scorers=scorers, cv=cv , fold=step)
  File "/common/ketrong/tpotexp/tpot2/tpot2/tpot_estimator/cross_val_utils.py", line 28, in cross_val_score_objective
    this_fold_pipeline.fit(X_train,y_train)
  File "/common/ketrong/tpotexp/env/lib/python3.10/site-packages/sklearn/base.py", line 1473, in wrapper
    return fit_method(estimator, *args, **kwargs)
  File "/common/ketrong/tpotexp/env/lib/python3.10/site-packages/sklearn/pipeline.py", line 473, in fit
    self._final_estimator.fit(Xt, y, **last_step_params["fit"])
  File "/common/ketrong/tpotexp/env/lib/python3.10/site-packages/sklearn/base.py", line 1466, in wrapper
    estimator._validate_params()
  File "/common/ketrong/tpotexp/env/lib/python3.10/site-packages/sklearn/base.py", line 666, in _validate_params
    validate_parameter_constraints(
  File "/common/ketrong/tpotexp/env/lib/python3.10/site-packages/sklearn/utils/_param_validation.py", line 95, in validate_parameter_constraints
    raise InvalidParameterError(
sklearn.utils._param_validation.InvalidParameterError: The 'criterion' parameter of RandomForestRegressor must be a str among {'friedman_mse', 'poisson', 'absolute_error', 'squared_error'}. Got 'mae' instead.

WARNING THIS INDIVIDUAL CAUSED AND EXCEPTION 
 <tpot2.search_spaces.pipelines.sequential.SequentialPipelineIndividual object at 0x15547430aa10> 
 The 'criterion' parameter of RandomForestRegressor must be a str among {'friedman_mse', 'poisson', 'absolute_error', 'squared_error'}. Got 'mae' instead. 
 Traceback (most recent call last):
  File "/common/ketrong/tpotexp/tpot2/tpot2/utils/eval_utils.py", line 53, in objective_nan_wrapper
    value = func_timeout.func_timeout(timeout, objective_function, args=[individual], kwargs=objective_kwargs)
  File "/common/ketrong/tpotexp/env/lib/python3.10/site-packages/func_timeout/dafunc.py", line 108, in func_timeout
    raise_exception(exception)
  File "/common/ketrong/tpotexp/env/lib/python3.10/site-packages/func_timeout/py3_raise.py", line 7, in raise_exception
    raise exception[0] from None
  File "/common/ketrong/tpotexp/tpot2/tpot2/tpot_estimator/estimator.py", line 623, in objective_function
    return objective_function_generator(
  File "/common/ketrong/tpotexp/tpot2/tpot2/tpot_estimator/estimator_utils.py", line 55, in objective_function_generator
    cv_obj_scores = cross_val_score_objective(sklearn.base.clone(pipeline),x,y,scorers=scorers, cv=cv , fold=step)
  File "/common/ketrong/tpotexp/tpot2/tpot2/tpot_estimator/cross_val_utils.py", line 28, in cross_val_score_objective
    this_fold_pipeline.fit(X_train,y_train)
  File "/common/ketrong/tpotexp/env/lib/python3.10/site-packages/sklearn/base.py", line 1473, in wrapper
    return fit_method(estimator, *args, **kwargs)
  File "/common/ketrong/tpotexp/env/lib/python3.10/site-packages/sklearn/pipeline.py", line 473, in fit
    self._final_estimator.fit(Xt, y, **last_step_params["fit"])
  File "/common/ketrong/tpotexp/env/lib/python3.10/site-packages/sklearn/base.py", line 1466, in wrapper
    estimator._validate_params()
  File "/common/ketrong/tpotexp/env/lib/python3.10/site-packages/sklearn/base.py", line 666, in _validate_params
    validate_parameter_constraints(
  File "/common/ketrong/tpotexp/env/lib/python3.10/site-packages/sklearn/utils/_param_validation.py", line 95, in validate_parameter_constraints
    raise InvalidParameterError(
sklearn.utils._param_validation.InvalidParameterError: The 'criterion' parameter of RandomForestRegressor must be a str among {'friedman_mse', 'poisson', 'absolute_error', 'squared_error'}. Got 'mae' instead.

Generation:  4
Best root_mean_squared_error score: -0.0014296880094516497
Generation:  16%|█▌        | 4/25 [11:05<59:00, 168.58s/it]  WARNING THIS INDIVIDUAL CAUSED AND EXCEPTION 
 <tpot2.search_spaces.pipelines.sequential.SequentialPipelineIndividual object at 0x155474708ca0> 
 The 'criterion' parameter of ExtraTreesRegressor must be a str among {'friedman_mse', 'poisson', 'absolute_error', 'squared_error'}. Got 'mae' instead. 
 Traceback (most recent call last):
  File "/common/ketrong/tpotexp/tpot2/tpot2/utils/eval_utils.py", line 53, in objective_nan_wrapper
    value = func_timeout.func_timeout(timeout, objective_function, args=[individual], kwargs=objective_kwargs)
  File "/common/ketrong/tpotexp/env/lib/python3.10/site-packages/func_timeout/dafunc.py", line 108, in func_timeout
    raise_exception(exception)
  File "/common/ketrong/tpotexp/env/lib/python3.10/site-packages/func_timeout/py3_raise.py", line 7, in raise_exception
    raise exception[0] from None
  File "/common/ketrong/tpotexp/tpot2/tpot2/tpot_estimator/estimator.py", line 623, in objective_function
    return objective_function_generator(
  File "/common/ketrong/tpotexp/tpot2/tpot2/tpot_estimator/estimator_utils.py", line 55, in objective_function_generator
    cv_obj_scores = cross_val_score_objective(sklearn.base.clone(pipeline),x,y,scorers=scorers, cv=cv , fold=step)
  File "/common/ketrong/tpotexp/tpot2/tpot2/tpot_estimator/cross_val_utils.py", line 28, in cross_val_score_objective
    this_fold_pipeline.fit(X_train,y_train)
  File "/common/ketrong/tpotexp/env/lib/python3.10/site-packages/sklearn/base.py", line 1473, in wrapper
    return fit_method(estimator, *args, **kwargs)
  File "/common/ketrong/tpotexp/env/lib/python3.10/site-packages/sklearn/pipeline.py", line 473, in fit
    self._final_estimator.fit(Xt, y, **last_step_params["fit"])
  File "/common/ketrong/tpotexp/env/lib/python3.10/site-packages/sklearn/base.py", line 1466, in wrapper
    estimator._validate_params()
  File "/common/ketrong/tpotexp/env/lib/python3.10/site-packages/sklearn/base.py", line 666, in _validate_params
    validate_parameter_constraints(
  File "/common/ketrong/tpotexp/env/lib/python3.10/site-packages/sklearn/utils/_param_validation.py", line 95, in validate_parameter_constraints
    raise InvalidParameterError(
sklearn.utils._param_validation.InvalidParameterError: The 'criterion' parameter of ExtraTreesRegressor must be a str among {'friedman_mse', 'poisson', 'absolute_error', 'squared_error'}. Got 'mae' instead.

Generation:  5
Best root_mean_squared_error score: -0.0014296880094516497
Generation:  20%|██        | 5/25 [12:45<48:00, 144.03s/it]Generation:  6
Best root_mean_squared_error score: -0.0014296880094516497
Generation:  24%|██▍       | 6/25 [15:12<45:56, 145.08s/it]WARNING THIS INDIVIDUAL CAUSED AND EXCEPTION 
 <tpot2.search_spaces.pipelines.sequential.SequentialPipelineIndividual object at 0x155467f00ee0> 
 The 'criterion' parameter of RandomForestRegressor must be a str among {'friedman_mse', 'poisson', 'absolute_error', 'squared_error'}. Got 'mae' instead. 
 Traceback (most recent call last):
  File "/common/ketrong/tpotexp/tpot2/tpot2/utils/eval_utils.py", line 53, in objective_nan_wrapper
    value = func_timeout.func_timeout(timeout, objective_function, args=[individual], kwargs=objective_kwargs)
  File "/common/ketrong/tpotexp/env/lib/python3.10/site-packages/func_timeout/dafunc.py", line 108, in func_timeout
    raise_exception(exception)
  File "/common/ketrong/tpotexp/env/lib/python3.10/site-packages/func_timeout/py3_raise.py", line 7, in raise_exception
    raise exception[0] from None
  File "/common/ketrong/tpotexp/tpot2/tpot2/tpot_estimator/estimator.py", line 623, in objective_function
    return objective_function_generator(
  File "/common/ketrong/tpotexp/tpot2/tpot2/tpot_estimator/estimator_utils.py", line 55, in objective_function_generator
    cv_obj_scores = cross_val_score_objective(sklearn.base.clone(pipeline),x,y,scorers=scorers, cv=cv , fold=step)
  File "/common/ketrong/tpotexp/tpot2/tpot2/tpot_estimator/cross_val_utils.py", line 28, in cross_val_score_objective
    this_fold_pipeline.fit(X_train,y_train)
  File "/common/ketrong/tpotexp/env/lib/python3.10/site-packages/sklearn/base.py", line 1473, in wrapper
    return fit_method(estimator, *args, **kwargs)
  File "/common/ketrong/tpotexp/env/lib/python3.10/site-packages/sklearn/pipeline.py", line 473, in fit
    self._final_estimator.fit(Xt, y, **last_step_params["fit"])
  File "/common/ketrong/tpotexp/env/lib/python3.10/site-packages/sklearn/base.py", line 1466, in wrapper
    estimator._validate_params()
  File "/common/ketrong/tpotexp/env/lib/python3.10/site-packages/sklearn/base.py", line 666, in _validate_params
    validate_parameter_constraints(
  File "/common/ketrong/tpotexp/env/lib/python3.10/site-packages/sklearn/utils/_param_validation.py", line 95, in validate_parameter_constraints
    raise InvalidParameterError(
sklearn.utils._param_validation.InvalidParameterError: The 'criterion' parameter of RandomForestRegressor must be a str among {'friedman_mse', 'poisson', 'absolute_error', 'squared_error'}. Got 'mae' instead.

WARNING THIS INDIVIDUAL CAUSED AND EXCEPTION 
 <tpot2.search_spaces.pipelines.sequential.SequentialPipelineIndividual object at 