Run: 33
/cm/local/apps/slurm/var/spool/job1035844/slurm_script: line 27: 
pip install -e tpot2
pip install -r tpot2/ImputerExperiments/requirements_.txt
: No such file or directory
RunStart
Version 0.1.7a0 of tpot2 is outdated. Version 0.1.8a0 was released Tuesday September 17, 2024.
starting loops
../data/c/881/881.pkl
working on 
../data/c/881/class_full_MNAR_0.01_2
3.8760054111480713
running experiment 1/3 - Does large hyperparameter space improve reconstruction accuracy over simple
[I 2024-11-01 07:08:41,535] A new study created in memory with name: no-name-5f0167a2-e635-4344-8bbe-d032f3941de8
running
running
running
running
running
running
running
running
running
running
running
running
running
running
running
running
[I 2024-11-01 07:08:42,398] Trial 7 finished with value: 0.5544180086659619 and parameters: {'model_name': 'SimpleImputer', 'strategy': 'most_frequent'}. Best is trial 7 with value: 0.5544180086659619.
running
[I 2024-11-01 07:08:51,660] Trial 16 finished with value: 0.35749329729455664 and parameters: {'model_name': 'VAE', 'batch_size': 13, 'iterations': 2, 'learning_rate': 0.013343288004678893, 'p_miss': 0.02860245544883641}. Best is trial 16 with value: 0.35749329729455664.
running
[I 2024-11-01 07:08:58,309] Trial 13 finished with value: 0.35304823634543003 and parameters: {'model_name': 'VAE', 'batch_size': 5, 'iterations': 10, 'learning_rate': 0.07642924231739437, 'p_miss': 0.0366445372215546}. Best is trial 13 with value: 0.35304823634543003.
running
[I 2024-11-01 07:09:05,895] Trial 8 finished with value: 0.419331843186988 and parameters: {'model_name': 'VAE', 'batch_size': 1, 'iterations': 23, 'learning_rate': 0.03262601422868697, 'p_miss': 0.03327542891516513}. Best is trial 13 with value: 0.35304823634543003.
running
[I 2024-11-01 07:09:13,164] Trial 17 finished with value: 0.41829362961043676 and parameters: {'model_name': 'VAE', 'batch_size': 1, 'iterations': 23, 'learning_rate': 0.02391282974248586, 'p_miss': 0.06471011949313663}. Best is trial 13 with value: 0.35304823634543003.
running
[I 2024-11-01 07:09:15,886] Trial 19 finished with value: 0.5580680895662132 and parameters: {'model_name': 'GAIN', 'batch_size': 11, 'hint_rate': 0.6276552573258571, 'alpha': 77, 'iterations': 12, 'learning_rate': 0.07273739167850982, 'p_miss': 0.27686396179843015}. Best is trial 13 with value: 0.35304823634543003.
running
[I 2024-11-01 07:09:20,084] Trial 4 finished with value: 0.3181728331523326 and parameters: {'model_name': 'KNNImputer', 'n_neighbors': 4800, 'weights': 'uniform'}. Best is trial 4 with value: 0.3181728331523326.
running
[I 2024-11-01 07:09:22,083] Trial 5 finished with value: 0.3131796163783275 and parameters: {'model_name': 'KNNImputer', 'n_neighbors': 3221, 'weights': 'distance'}. Best is trial 5 with value: 0.3131796163783275.
running
[I 2024-11-01 07:09:25,332] Trial 11 finished with value: 0.3221104312131901 and parameters: {'model_name': 'KNNImputer', 'n_neighbors': 8153, 'weights': 'uniform'}. Best is trial 5 with value: 0.3131796163783275.
running
[I 2024-11-01 07:09:26,518] Trial 15 finished with value: 0.3228444213040164 and parameters: {'model_name': 'KNNImputer', 'n_neighbors': 8894, 'weights': 'uniform'}. Best is trial 5 with value: 0.3131796163783275.
running
[I 2024-11-01 07:09:34,057] Trial 3 finished with value: 0.32279615547651475 and parameters: {'model_name': 'KNNImputer', 'n_neighbors': 12006, 'weights': 'distance'}. Best is trial 5 with value: 0.3131796163783275.
running
[I 2024-11-01 07:09:35,366] Trial 18 finished with value: 0.3057108648902963 and parameters: {'model_name': 'IterativeImputer', 'estimator': 'Ridge', 'initial_strategy': 'mean', 'n_nearest_features': 4, 'imputation_order': 'random'}. Best is trial 18 with value: 0.3057108648902963.
running
[I 2024-11-01 07:09:36,262] Trial 2 finished with value: 0.36491166685717774 and parameters: {'model_name': 'VAE', 'batch_size': 4, 'iterations': 61, 'learning_rate': 0.01155244307235484, 'p_miss': 0.09796643385425344}. Best is trial 18 with value: 0.3057108648902963.
running
[I 2024-11-01 07:09:37,285] Trial 14 finished with value: 0.5882855012923851 and parameters: {'model_name': 'GAIN', 'batch_size': 17, 'hint_rate': 0.061301472533203276, 'alpha': 54, 'iterations': 87, 'learning_rate': 0.00033541927203412114, 'p_miss': 0.13816545713477657}. Best is trial 18 with value: 0.3057108648902963.
running
[I 2024-11-01 07:09:55,427] Trial 21 finished with value: 0.31758513260316196 and parameters: {'model_name': 'KNNImputer', 'n_neighbors': 4401, 'weights': 'uniform'}. Best is trial 18 with value: 0.3057108648902963.
running
[I 2024-11-01 07:09:57,529] Trial 0 finished with value: 0.30573997478515 and parameters: {'model_name': 'IterativeImputer', 'estimator': 'Bayesian', 'initial_strategy': 'constant', 'n_nearest_features': 4, 'imputation_order': 'roman', 'sample_posterior': False}. Best is trial 18 with value: 0.3057108648902963.
running
[I 2024-11-01 07:10:04,821] Trial 9 finished with value: inf and parameters: {'model_name': 'GAIN', 'batch_size': 1, 'hint_rate': 0.35272205324676364, 'alpha': 96, 'iterations': 709, 'learning_rate': 0.006166797036804412, 'p_miss': 0.25112111801073606}. Best is trial 18 with value: 0.3057108648902963.
running
[I 2024-11-01 07:10:09,067] Trial 29 finished with value: 0.3056735967004566 and parameters: {'model_name': 'IterativeImputer', 'estimator': 'Ridge', 'initial_strategy': 'mean', 'n_nearest_features': 3, 'imputation_order': 'random'}. Best is trial 29 with value: 0.3056735967004566.
running
[I 2024-11-01 07:10:10,329] Trial 28 finished with value: 0.3057108648902963 and parameters: {'model_name': 'IterativeImputer', 'estimator': 'Ridge', 'initial_strategy': 'mean', 'n_nearest_features': 4, 'imputation_order': 'random'}. Best is trial 29 with value: 0.3056735967004566.
running
[I 2024-11-01 07:10:10,912] Trial 27 finished with value: 0.3057108648902963 and parameters: {'model_name': 'IterativeImputer', 'estimator': 'Ridge', 'initial_strategy': 'mean', 'n_nearest_features': 4, 'imputation_order': 'random'}. Best is trial 29 with value: 0.3056735967004566.
running
[I 2024-11-01 07:10:21,243] Trial 24 finished with value: 0.33096155277295947 and parameters: {'model_name': 'KNNImputer', 'n_neighbors': 30432, 'weights': 'distance'}. Best is trial 29 with value: 0.3056735967004566.
running
[I 2024-11-01 07:10:27,025] Trial 30 finished with value: 0.3057108648902963 and parameters: {'model_name': 'IterativeImputer', 'estimator': 'Ridge', 'initial_strategy': 'mean', 'n_nearest_features': 4, 'imputation_order': 'random'}. Best is trial 29 with value: 0.3056735967004566.
running
[I 2024-11-01 07:10:35,131] Trial 34 finished with value: 0.30842996852159776 and parameters: {'model_name': 'IterativeImputer', 'estimator': 'Ridge', 'initial_strategy': 'mean', 'n_nearest_features': 1, 'imputation_order': 'random'}. Best is trial 29 with value: 0.3056735967004566.
running
[I 2024-11-01 07:10:39,460] Trial 33 finished with value: 0.3056735967004566 and parameters: {'model_name': 'IterativeImputer', 'estimator': 'Ridge', 'initial_strategy': 'mean', 'n_nearest_features': 3, 'imputation_order': 'random'}. Best is trial 29 with value: 0.3056735967004566.
running
[I 2024-11-01 07:10:41,399] Trial 35 finished with value: 0.3056727089238059 and parameters: {'model_name': 'IterativeImputer', 'estimator': 'Ridge', 'initial_strategy': 'mean', 'n_nearest_features': 10, 'imputation_order': 'ascending'}. Best is trial 35 with value: 0.3056727089238059.
running
[I 2024-11-01 07:10:45,225] Trial 26 finished with value: 0.3055858048714794 and parameters: {'model_name': 'IterativeImputer', 'estimator': 'Bayesian', 'initial_strategy': 'median', 'n_nearest_features': 4, 'imputation_order': 'roman', 'sample_posterior': False}. Best is trial 26 with value: 0.3055858048714794.
running
[I 2024-11-01 07:10:45,825] Trial 41 finished with value: 0.3353969001482483 and parameters: {'model_name': 'SimpleImputer', 'strategy': 'mean'}. Best is trial 26 with value: 0.3055858048714794.
running
[I 2024-11-01 07:10:49,792] Trial 36 finished with value: 0.3056735967004566 and parameters: {'model_name': 'IterativeImputer', 'estimator': 'Ridge', 'initial_strategy': 'mean', 'n_nearest_features': 3, 'imputation_order': 'random'}. Best is trial 26 with value: 0.3055858048714794.
running
[I 2024-11-01 07:10:51,228] Trial 37 finished with value: 0.30842996852159776 and parameters: {'model_name': 'IterativeImputer', 'estimator': 'Ridge', 'initial_strategy': 'mean', 'n_nearest_features': 1, 'imputation_order': 'random'}. Best is trial 26 with value: 0.3055858048714794.
running
[I 2024-11-01 07:11:06,563] Trial 12 finished with value: 0.3528451946062013 and parameters: {'model_name': 'VAE', 'batch_size': 4, 'iterations': 202, 'learning_rate': 0.0006469521068123358, 'p_miss': 0.2502083724770659}. Best is trial 26 with value: 0.3055858048714794.
running
[I 2024-11-01 07:11:06,938] Trial 31 finished with value: 0.30564522751663414 and parameters: {'model_name': 'IterativeImputer', 'estimator': 'Bayesian', 'initial_strategy': 'mean', 'n_nearest_features': 4, 'imputation_order': 'roman', 'sample_posterior': False}. Best is trial 26 with value: 0.3055858048714794.
running
[I 2024-11-01 07:11:13,789] Trial 22 finished with value: 0.4373052553289214 and parameters: {'model_name': 'IterativeImputer', 'estimator': 'Bayesian', 'initial_strategy': 'most_frequent', 'n_nearest_features': 7, 'imputation_order': 'descending', 'sample_posterior': True}. Best is trial 26 with value: 0.3055858048714794.
running
[I 2024-11-01 07:11:15,910] Trial 32 finished with value: 0.3057071906238689 and parameters: {'model_name': 'IterativeImputer', 'estimator': 'Bayesian', 'initial_strategy': 'constant', 'n_nearest_features': 4, 'imputation_order': 'random', 'sample_posterior': False}. Best is trial 26 with value: 0.3055858048714794.
running
[I 2024-11-01 07:12:45,595] Trial 44 finished with value: 0.30562119941768956 and parameters: {'model_name': 'IterativeImputer', 'estimator': 'Bayesian', 'initial_strategy': 'median', 'n_nearest_features': 10, 'imputation_order': 'ascending', 'sample_posterior': False}. Best is trial 26 with value: 0.3055858048714794.
running
[I 2024-11-01 07:12:51,876] Trial 46 finished with value: 0.30564429168925433 and parameters: {'model_name': 'IterativeImputer', 'estimator': 'Bayesian', 'initial_strategy': 'median', 'n_nearest_features': 7, 'imputation_order': 'ascending', 'sample_posterior': False}. Best is trial 26 with value: 0.3055858048714794.
running
[I 2024-11-01 07:13:10,766] Trial 47 finished with value: 0.30562119941768956 and parameters: {'model_name': 'IterativeImputer', 'estimator': 'Bayesian', 'initial_strategy': 'median', 'n_nearest_features': 10, 'imputation_order': 'ascending', 'sample_posterior': False}. Best is trial 26 with value: 0.3055858048714794.
running
[I 2024-11-01 07:13:11,710] Trial 51 finished with value: 0.3706745655003177 and parameters: {'model_name': 'SimpleImputer', 'strategy': 'median'}. Best is trial 26 with value: 0.3055858048714794.
running
[I 2024-11-01 07:13:16,284] Trial 43 finished with value: 0.3174817313538301 and parameters: {'model_name': 'IterativeImputer', 'estimator': 'KNN', 'initial_strategy': 'median', 'n_nearest_features': 10, 'imputation_order': 'ascending'}. Best is trial 26 with value: 0.3055858048714794.
running
[I 2024-11-01 07:13:16,754] Trial 45 finished with value: 0.4355176490112053 and parameters: {'model_name': 'IterativeImputer', 'estimator': 'Bayesian', 'initial_strategy': 'median', 'n_nearest_features': 10, 'imputation_order': 'ascending', 'sample_posterior': True}. Best is trial 26 with value: 0.3055858048714794.
running
[I 2024-11-01 07:13:17,286] Trial 54 finished with value: 0.6109202686034338 and parameters: {'model_name': 'SimpleImputer', 'strategy': 'constant'}. Best is trial 26 with value: 0.3055858048714794.
running
[I 2024-11-01 07:13:21,342] Trial 10 finished with value: 0.43672359681896483 and parameters: {'model_name': 'VAE', 'batch_size': 1, 'iterations': 402, 'learning_rate': 0.07397692130231945, 'p_miss': 0.17211972175960058}. Best is trial 26 with value: 0.3055858048714794.
running
[I 2024-11-01 07:13:22,189] Trial 1 finished with value: 0.33911775859353077 and parameters: {'model_name': 'VAE', 'batch_size': 233, 'iterations': 178, 'learning_rate': 0.05596235191774305, 'p_miss': 0.27954642467231966}. Best is trial 26 with value: 0.3055858048714794.
running
[I 2024-11-01 07:14:11,363] Trial 50 finished with value: 0.305640662470444 and parameters: {'model_name': 'IterativeImputer', 'estimator': 'Bayesian', 'initial_strategy': 'median', 'n_nearest_features': 7, 'imputation_order': 'roman', 'sample_posterior': False}. Best is trial 26 with value: 0.3055858048714794.
running
[I 2024-11-01 07:14:15,866] Trial 49 finished with value: 0.30562119941768956 and parameters: {'model_name': 'IterativeImputer', 'estimator': 'Bayesian', 'initial_strategy': 'median', 'n_nearest_features': 10, 'imputation_order': 'ascending', 'sample_posterior': False}. Best is trial 26 with value: 0.3055858048714794.
running
[I 2024-11-01 07:14:33,495] Trial 53 finished with value: 0.3056292481020198 and parameters: {'model_name': 'IterativeImputer', 'estimator': 'Bayesian', 'initial_strategy': 'median', 'n_nearest_features': 8, 'imputation_order': 'ascending', 'sample_posterior': False}. Best is trial 26 with value: 0.3055858048714794.
running
[I 2024-11-01 07:14:34,623] Trial 56 finished with value: 0.3056196926224733 and parameters: {'model_name': 'IterativeImputer', 'estimator': 'Bayesian', 'initial_strategy': 'median', 'n_nearest_features': 8, 'imputation_order': 'roman', 'sample_posterior': False}. Best is trial 26 with value: 0.3055858048714794.
running
[I 2024-11-01 07:14:36,413] Trial 57 finished with value: 0.3056196926224733 and parameters: {'model_name': 'IterativeImputer', 'estimator': 'Bayesian', 'initial_strategy': 'median', 'n_nearest_features': 8, 'imputation_order': 'roman', 'sample_posterior': False}. Best is trial 26 with value: 0.3055858048714794.
running
[I 2024-11-01 07:15:12,490] Trial 58 finished with value: 0.30562206641263107 and parameters: {'model_name': 'IterativeImputer', 'estimator': 'Bayesian', 'initial_strategy': 'median', 'n_nearest_features': 8, 'imputation_order': 'arabic', 'sample_posterior': False}. Best is trial 26 with value: 0.3055858048714794.
running
[I 2024-11-01 07:38:42,118] Trial 61 finished with value: 0.616389425910931 and parameters: {'model_name': 'GAIN', 'batch_size': 830, 'hint_rate': 0.967418717332954, 'alpha': 0, 'iterations': 5579, 'learning_rate': 0.001936448423614861, 'p_miss': 0.19085038917123148}. Best is trial 26 with value: 0.3055858048714794.
running
[I 2024-11-01 07:42:11,719] Trial 20 finished with value: 0.6039944688822076 and parameters: {'model_name': 'GAIN', 'batch_size': 148, 'hint_rate': 0.8989108125358762, 'alpha': 27, 'iterations': 9571, 'learning_rate': 0.05182353977289853, 'p_miss': 0.2679495185993327}. Best is trial 26 with value: 0.3055858048714794.
running
[I 2024-11-01 07:42:44,734] Trial 62 finished with value: 0.6113095692688508 and parameters: {'model_name': 'GAIN', 'batch_size': 572, 'hint_rate': 0.9817307621928837, 'alpha': 0, 'iterations': 8662, 'learning_rate': 0.0016433572551258467, 'p_miss': 0.2028156200378207}. Best is trial 26 with value: 0.3055858048714794.
running
[I 2024-11-01 07:43:00,786] Trial 63 finished with value: 0.6145999149450583 and parameters: {'model_name': 'GAIN', 'batch_size': 502, 'hint_rate': 0.9595847006113591, 'alpha': 11, 'iterations': 9071, 'learning_rate': 0.00011584323733566739, 'p_miss': 0.18241142422299417}. Best is trial 26 with value: 0.3055858048714794.
running
[I 2024-11-01 07:54:01,238] Trial 23 finished with value: 0.3350454554303365 and parameters: {'model_name': 'IterativeImputer', 'estimator': 'RFR', 'initial_strategy': 'constant', 'n_nearest_features': 1, 'imputation_order': 'random'}. Best is trial 26 with value: 0.3055858048714794.
running
[I 2024-11-01 07:54:44,264] Trial 68 finished with value: 0.3056211842305791 and parameters: {'model_name': 'IterativeImputer', 'estimator': 'Bayesian', 'initial_strategy': 'median', 'n_nearest_features': 9, 'imputation_order': 'roman', 'sample_posterior': False}. Best is trial 26 with value: 0.3055858048714794.
running
[I 2024-11-01 07:55:27,652] Trial 69 finished with value: 0.3056211842305791 and parameters: {'model_name': 'IterativeImputer', 'estimator': 'Bayesian', 'initial_strategy': 'median', 'n_nearest_features': 9, 'imputation_order': 'roman', 'sample_posterior': False}. Best is trial 26 with value: 0.3055858048714794.
running
[I 2024-11-01 07:56:10,791] Trial 70 finished with value: 0.3056211842305791 and parameters: {'model_name': 'IterativeImputer', 'estimator': 'Bayesian', 'initial_strategy': 'median', 'n_nearest_features': 9, 'imputation_order': 'roman', 'sample_posterior': False}. Best is trial 26 with value: 0.3055858048714794.
running
[I 2024-11-01 07:56:53,276] Trial 71 finished with value: 0.3172610723787495 and parameters: {'model_name': 'IterativeImputer', 'estimator': 'KNN', 'initial_strategy': 'median', 'n_nearest_features': 9, 'imputation_order': 'roman'}. Best is trial 26 with value: 0.3055858048714794.
running
[I 2024-11-01 07:56:53,749] Trial 72 finished with value: 0.3712790408611615 and parameters: {'model_name': 'VAE', 'batch_size': 47, 'iterations': 1, 'learning_rate': 0.0001118790566014582, 'p_miss': 0.1256309152082755}. Best is trial 26 with value: 0.3055858048714794.
running
[I 2024-11-01 08:14:12,764] Trial 39 finished with value: 0.3134999368827774 and parameters: {'model_name': 'IterativeImputer', 'estimator': 'RFR', 'initial_strategy': 'median', 'n_nearest_features': 2, 'imputation_order': 'arabic'}. Best is trial 26 with value: 0.3055858048714794.
running
[I 2024-11-01 08:14:41,675] Trial 74 finished with value: 0.3301586977683153 and parameters: {'model_name': 'KNNImputer', 'n_neighbors': 23768, 'weights': 'distance'}. Best is trial 26 with value: 0.3055858048714794.
running
[I 2024-11-01 08:15:26,336] Trial 75 finished with value: 0.3056211842305791 and parameters: {'model_name': 'IterativeImputer', 'estimator': 'Bayesian', 'initial_strategy': 'median', 'n_nearest_features': 9, 'imputation_order': 'roman', 'sample_posterior': False}. Best is trial 26 with value: 0.3055858048714794.
running
[I 2024-11-01 08:16:13,056] Trial 76 finished with value: 0.3056211842305791 and parameters: {'model_name': 'IterativeImputer', 'estimator': 'Bayesian', 'initial_strategy': 'median', 'n_nearest_features': 9, 'imputation_order': 'roman', 'sample_posterior': False}. Best is trial 26 with value: 0.3055858048714794.
running
[I 2024-11-01 08:16:57,495] Trial 77 finished with value: 0.3056211842305791 and parameters: {'model_name': 'IterativeImputer', 'estimator': 'Bayesian', 'initial_strategy': 'median', 'n_nearest_features': 9, 'imputation_order': 'roman', 'sample_posterior': False}. Best is trial 26 with value: 0.3055858048714794.
running
[I 2024-11-01 08:17:41,198] Trial 78 finished with value: 0.3056196926224733 and parameters: {'model_name': 'IterativeImputer', 'estimator': 'Bayesian', 'initial_strategy': 'median', 'n_nearest_features': 8, 'imputation_order': 'roman', 'sample_posterior': False}. Best is trial 26 with value: 0.3055858048714794.
running
[I 2024-11-01 08:18:24,276] Trial 79 finished with value: 0.30560544517246235 and parameters: {'model_name': 'IterativeImputer', 'estimator': 'Bayesian', 'initial_strategy': 'most_frequent', 'n_nearest_features': 8, 'imputation_order': 'roman', 'sample_posterior': False}. Best is trial 26 with value: 0.3055858048714794.
running
[I 2024-11-01 08:19:06,432] Trial 80 finished with value: 0.30560544517246235 and parameters: {'model_name': 'IterativeImputer', 'estimator': 'Bayesian', 'initial_strategy': 'most_frequent', 'n_nearest_features': 8, 'imputation_order': 'roman', 'sample_posterior': False}. Best is trial 26 with value: 0.3055858048714794.
running
[I 2024-11-01 08:19:48,768] Trial 81 finished with value: 0.30560544517246235 and parameters: {'model_name': 'IterativeImputer', 'estimator': 'Bayesian', 'initial_strategy': 'most_frequent', 'n_nearest_features': 8, 'imputation_order': 'roman', 'sample_posterior': False}. Best is trial 26 with value: 0.3055858048714794.
running
[I 2024-11-01 08:19:49,012] Trial 82 finished with value: 0.6109202686034338 and parameters: {'model_name': 'SimpleImputer', 'strategy': 'constant'}. Best is trial 26 with value: 0.3055858048714794.
running
[I 2024-11-01 08:20:54,863] Trial 83 finished with value: 0.34222213154841696 and parameters: {'model_name': 'VAE', 'batch_size': 50, 'iterations': 1332, 'learning_rate': 0.0005885481662570017, 'p_miss': 0.09244469692758663}. Best is trial 26 with value: 0.3055858048714794.
running
[I 2024-11-01 08:21:35,905] Trial 84 finished with value: 0.30562386395408536 and parameters: {'model_name': 'IterativeImputer', 'estimator': 'Bayesian', 'initial_strategy': 'most_frequent', 'n_nearest_features': 8, 'imputation_order': 'descending', 'sample_posterior': False}. Best is trial 26 with value: 0.3055858048714794.
running
[I 2024-11-01 08:21:59,524] Trial 85 finished with value: 0.33041925553667256 and parameters: {'model_name': 'KNNImputer', 'n_neighbors': 18920, 'weights': 'uniform'}. Best is trial 26 with value: 0.3055858048714794.
running
[I 2024-11-01 08:22:25,185] Trial 86 finished with value: 0.3056156734149681 and parameters: {'model_name': 'IterativeImputer', 'estimator': 'Bayesian', 'initial_strategy': 'most_frequent', 'n_nearest_features': 6, 'imputation_order': 'roman', 'sample_posterior': False}. Best is trial 26 with value: 0.3055858048714794.
running
