[I 2024-11-05 03:46:46,191] Trial 199 finished with value: 0.34891118703530627 and parameters: {'model_name': 'SimpleImputer', 'strategy': 'mean'}. Best is trial 1 with value: 0.34891118703530627.
fit
simple fit
simple transform
0    0
1    0
2    0
3    0
dtype: int64
0    0
1    0
2    0
3    0
dtype: int64
0.34891118703530627
{'model_name': 'SimpleImputer', 'strategy': 'mean'}
running experiment 2/3 - Does reconstruction give good automl predictions
Start est fit
Version 0.1.7a0 of tpot2 is outdated. Version 0.1.8a0 was released Tuesday September 17, 2024.
Version 0.1.7a0 of tpot2 is outdated. Version 0.1.8a0 was released Tuesday September 17, 2024.
Version 0.1.7a0 of tpot2 is outdated. Version 0.1.8a0 was released Tuesday September 17, 2024.
Version 0.1.7a0 of tpot2 is outdated. Version 0.1.8a0 was released Tuesday September 17, 2024.
Version 0.1.7a0 of tpot2 is outdated. Version 0.1.8a0 was released Tuesday September 17, 2024.
Version 0.1.7a0 of tpot2 is outdated. Version 0.1.8a0 was released Tuesday September 17, 2024.
Version 0.1.7a0 of tpot2 is outdated. Version 0.1.8a0 was released Tuesday September 17, 2024.
Version 0.1.7a0 of tpot2 is outdated. Version 0.1.8a0 was released Tuesday September 17, 2024.
Version 0.1.7a0 of tpot2 is outdated. Version 0.1.8a0 was released Tuesday September 17, 2024.
Version 0.1.7a0 of tpot2 is outdated. Version 0.1.8a0 was released Tuesday September 17, 2024.
Version 0.1.7a0 of tpot2 is outdated. Version 0.1.8a0 was released Tuesday September 17, 2024.
Version 0.1.7a0 of tpot2 is outdated. Version 0.1.8a0 was released Tuesday September 17, 2024.
Version 0.1.7a0 of tpot2 is outdated. Version 0.1.8a0 was released Tuesday September 17, 2024.
Version 0.1.7a0 of tpot2 is outdated. Version 0.1.8a0 was released Tuesday September 17, 2024.
Version 0.1.7a0 of tpot2 is outdated. Version 0.1.8a0 was released Tuesday September 17, 2024.
Version 0.1.7a0 of tpot2 is outdated. Version 0.1.8a0 was released Tuesday September 17, 2024.
  0%|          | 0/25 [00:00<?, ?it/s]Generation:   0%|          | 0/25 [00:00<?, ?it/s]Generation:  1
Best f1_score score: 0.9959079518424113
Generation:   4%|▍         | 1/25 [02:36<1:02:40, 156.69s/it]Generation:  2
Best f1_score score: 0.9959079518424113
Generation:   8%|▊         | 2/25 [03:42<39:37, 103.36s/it]  Generation:  3
Best f1_score score: 0.9960538480756315
Generation:  12%|█▏        | 3/25 [03:49<21:42, 59.22s/it] Generation:  4
Best f1_score score: 0.9960538480756315
Generation:  16%|█▌        | 4/25 [05:33<26:54, 76.86s/it]Generation:  5
Best f1_score score: 0.9966380741993017
Generation:  20%|██        | 5/25 [05:47<18:04, 54.21s/it]Generation:  6
Best f1_score score: 0.9966380741993017
Generation:  24%|██▍       | 6/25 [05:54<12:04, 38.11s/it]Generation:  7
Best f1_score score: 0.9966380741993017
Generation:  28%|██▊       | 7/25 [06:02<08:29, 28.33s/it]Generation:  8
Best f1_score score: 0.9966380741993017
Generation:  32%|███▏      | 8/25 [06:25<07:34, 26.75s/it]Generation:  9
Best f1_score score: 0.9966380741993017
Generation:  36%|███▌      | 9/25 [06:42<06:15, 23.46s/it]Generation:  10
Best f1_score score: 0.9966380741993017
Generation:  40%|████      | 10/25 [12:20<30:10, 120.72s/it]Generation:  11
Best f1_score score: 0.9966380741993017
Generation:  44%|████▍     | 11/25 [12:31<20:20, 87.18s/it] Generation:  12
Best f1_score score: 0.9966380741993017
Generation:  48%|████▊     | 12/25 [12:50<14:24, 66.52s/it]Generation:  13
Best f1_score score: 0.9966380741993017
Generation:  52%|█████▏    | 13/25 [13:27<11:28, 57.36s/it]Generation:  14
Best f1_score score: 0.9966380741993017
Generation:  56%|█████▌    | 14/25 [13:44<08:17, 45.25s/it]Generation:  15
Best f1_score score: 0.9966380741993017
Generation:  60%|██████    | 15/25 [14:44<08:17, 49.78s/it]Generation:  16
Best f1_score score: 0.9966380741993017
Generation:  64%|██████▍   | 16/25 [15:01<05:58, 39.82s/it]Generation:  17
Best f1_score score: 0.9966380741993017
Generation:  68%|██████▊   | 17/25 [16:02<06:09, 46.19s/it]Generation:  18
Best f1_score score: 0.9966380741993017
Generation:  72%|███████▏  | 18/25 [19:40<11:24, 97.78s/it]Generation:  19
Best f1_score score: 0.9966380741993017
Generation:  76%|███████▌  | 19/25 [19:53<07:14, 72.48s/it]Generation:  20
Best f1_score score: 0.9966380741993017
Generation:  80%|████████  | 20/25 [20:07<04:33, 54.78s/it]Generation:  21
Best f1_score score: 0.9966380741993017
Generation:  84%|████████▍ | 21/25 [20:22<02:51, 42.84s/it]Generation:  22
Best f1_score score: 0.9966380741993017
Generation:  88%|████████▊ | 22/25 [20:42<01:47, 35.92s/it]Generation:  23
Best f1_score score: 0.9966380741993017
Generation:  92%|█████████▏| 23/25 [21:03<01:03, 31.57s/it]Generation:  24
Best f1_score score: 0.9966380741993017
Generation:  96%|█████████▌| 24/25 [21:32<00:30, 30.67s/it]Generation:  25
Best f1_score score: 0.9966380741993017
Generation: 100%|██████████| 25/25 [21:57<00:00, 29.03s/it]Generation: 100%|██████████| 25/25 [22:02<00:00, 52.89s/it]
2024-11-05 04:08:54,075 - distributed.scheduler - ERROR - Removing worker 'tcp://127.0.0.1:39993' caused the cluster to lose scattered data, which can't be recovered: {'ndarray-6e51f2cc3c2fc7cbf591e69c3f7e8ad4', 'ndarray-782bc5f56dfe6ad3c3952dbb6d6329f9'} (stimulus_id='handle-worker-cleanup-1730808534.0755842')
Fitted
Pipeline(steps=[('histgradientboostingclassifier',
                 HistGradientBoostingClassifier(early_stopping=False,
                                                l2_regularization=4.492e-10,
                                                learning_rate=0.4542339576795,
                                                max_features=0.504160566071,
                                                max_leaf_nodes=1445, tol=0.0001,
                                                validation_fraction=None))])
score start
train score: {'auroc': 1.0, 'accuracy': 1.0, 'balanced_accuracy': 1.0, 'logloss': 1.1895324078882686e-06, 'f1': 1.0}
original test score: {'auroc': 1.0, 'accuracy': 1.0, 'balanced_accuracy': 1.0, 'logloss': 3.0736646473079246e-07, 'f1': 1.0}
imputed test score: {'auroc': 0.9760730823189769, 'accuracy': 0.9699248120300752, 'balanced_accuracy': 0.9725434463519662, 'logloss': 0.5260039317984122, 'f1': 0.9697718329482583}
score end
check intended
EXP2 Finished
running experiment 3/3 - What is the best automl settings?
<tpot2.search_spaces.pipelines.sequential.SequentialPipeline object at 0x15543504f9d0>
Start tpot fit
Version 0.1.7a0 of tpot2 is outdated. Version 0.1.8a0 was released Tuesday September 17, 2024.
Version 0.1.7a0 of tpot2 is outdated. Version 0.1.8a0 was released Tuesday September 17, 2024.
Version 0.1.7a0 of tpot2 is outdated. Version 0.1.8a0 was released Tuesday September 17, 2024.
Version 0.1.7a0 of tpot2 is outdated. Version 0.1.8a0 was released Tuesday September 17, 2024.
Version 0.1.7a0 of tpot2 is outdated. Version 0.1.8a0 was released Tuesday September 17, 2024.
Version 0.1.7a0 of tpot2 is outdated. Version 0.1.8a0 was released Tuesday September 17, 2024.
Version 0.1.7a0 of tpot2 is outdated. Version 0.1.8a0 was released Tuesday September 17, 2024.
Version 0.1.7a0 of tpot2 is outdated. Version 0.1.8a0 was released Tuesday September 17, 2024.
Version 0.1.7a0 of tpot2 is outdated. Version 0.1.8a0 was released Tuesday September 17, 2024.
Version 0.1.7a0 of tpot2 is outdated. Version 0.1.8a0 was released Tuesday September 17, 2024.
Version 0.1.7a0 of tpot2 is outdated. Version 0.1.8a0 was released Tuesday September 17, 2024.
Version 0.1.7a0 of tpot2 is outdated. Version 0.1.8a0 was released Tuesday September 17, 2024.
Version 0.1.7a0 of tpot2 is outdated. Version 0.1.8a0 was released Tuesday September 17, 2024.
Version 0.1.7a0 of tpot2 is outdated. Version 0.1.8a0 was released Tuesday September 17, 2024.
Version 0.1.7a0 of tpot2 is outdated. Version 0.1.8a0 was released Tuesday September 17, 2024.
Version 0.1.7a0 of tpot2 is outdated. Version 0.1.8a0 was released Tuesday September 17, 2024.
  0%|          | 0/25 [00:00<?, ?it/s]Generation:   0%|          | 0/25 [00:00<?, ?it/s]WARNING THIS INDIVIDUAL CAUSED AND EXCEPTION 
 <tpot2.search_spaces.pipelines.sequential.SequentialPipelineIndividual object at 0x155474d3acb0> 
 The 'min_samples_split' parameter of DecisionTreeClassifier must be an int in the range [2, inf) or a float in the range (0.0, 1.0]. Got 1 instead. 
 Traceback (most recent call last):
  File "/common/ketrong/tpotexp/tpot2/tpot2/utils/eval_utils.py", line 53, in objective_nan_wrapper
    value = func_timeout.func_timeout(timeout, objective_function, args=[individual], kwargs=objective_kwargs)
  File "/common/ketrong/tpotexp/env/lib/python3.10/site-packages/func_timeout/dafunc.py", line 108, in func_timeout
    raise_exception(exception)
  File "/common/ketrong/tpotexp/env/lib/python3.10/site-packages/func_timeout/py3_raise.py", line 7, in raise_exception
    raise exception[0] from None
  File "/common/ketrong/tpotexp/tpot2/tpot2/tpot_estimator/estimator.py", line 623, in objective_function
    return objective_function_generator(
  File "/common/ketrong/tpotexp/tpot2/tpot2/tpot_estimator/estimator_utils.py", line 55, in objective_function_generator
    cv_obj_scores = cross_val_score_objective(sklearn.base.clone(pipeline),x,y,scorers=scorers, cv=cv , fold=step)
  File "/common/ketrong/tpotexp/tpot2/tpot2/tpot_estimator/cross_val_utils.py", line 28, in cross_val_score_objective
    this_fold_pipeline.fit(X_train,y_train)
  File "/common/ketrong/tpotexp/env/lib/python3.10/site-packages/sklearn/base.py", line 1473, in wrapper
    return fit_method(estimator, *args, **kwargs)
  File "/common/ketrong/tpotexp/env/lib/python3.10/site-packages/sklearn/pipeline.py", line 473, in fit
    self._final_estimator.fit(Xt, y, **last_step_params["fit"])
  File "/common/ketrong/tpotexp/env/lib/python3.10/site-packages/sklearn/base.py", line 1466, in wrapper
    estimator._validate_params()
  File "/common/ketrong/tpotexp/env/lib/python3.10/site-packages/sklearn/base.py", line 666, in _validate_params
    validate_parameter_constraints(
  File "/common/ketrong/tpotexp/env/lib/python3.10/site-packages/sklearn/utils/_param_validation.py", line 95, in validate_parameter_constraints
    raise InvalidParameterError(
sklearn.utils._param_validation.InvalidParameterError: The 'min_samples_split' parameter of DecisionTreeClassifier must be an int in the range [2, inf) or a float in the range (0.0, 1.0]. Got 1 instead.

Generation:  1
Best f1_score score: 0.9916765516534973
Generation:   4%|▍         | 1/25 [00:05<02:13,  5.55s/it]Generation:  2
Best f1_score score: 0.9964913465924917
Generation:   8%|▊         | 2/25 [00:13<02:38,  6.88s/it]Generation:  3
Best f1_score score: 0.9964913465924917
Generation:  12%|█▏        | 3/25 [03:10<30:57, 84.42s/it]Generation:  4
Best f1_score score: 0.9964913465924917
Generation:  16%|█▌        | 4/25 [03:26<20:11, 57.69s/it]Generation:  5
Best f1_score score: 0.9964913465924917
Generation:  20%|██        | 5/25 [05:30<27:12, 81.64s/it]Generation:  6
Best f1_score score: 0.9964913465924917
Generation:  24%|██▍       | 6/25 [05:40<18:03, 57.03s/it]Generation:  7
Best f1_score score: 0.9964913465924917
Generation:  28%|██▊       | 7/25 [05:50<12:33, 41.88s/it]Generation:  8
Best f1_score score: 0.9964913465924917
Generation:  32%|███▏      | 8/25 [06:00<08:56, 31.55s/it]Generation:  9
Best f1_score score: 0.9964913465924917
Generation:  36%|███▌      | 9/25 [06:06<06:19, 23.70s/it]Generation:  10
Best f1_score score: 0.9964913465924917
Generation:  40%|████      | 10/25 [06:16<04:53, 19.54s/it]Generation:  11
Best f1_score score: 0.9964913465924917
Generation:  44%|████▍     | 11/25 [06:37<04:39, 19.95s/it]Generation:  12
Best f1_score score: 0.9964913465924917
Generation:  48%|████▊     | 12/25 [06:47<03:37, 16.71s/it]Generation:  13
Best f1_score score: 0.9964913465924917
Generation:  52%|█████▏    | 13/25 [06:57<02:55, 14.66s/it]Generation:  14
Best f1_score score: 0.9964913465924917
Generation:  56%|█████▌    | 14/25 [07:07<02:28, 13.49s/it]Generation:  15
Best f1_score score: 0.9964913465924917
Generation:  60%|██████    | 15/25 [10:53<12:53, 77.37s/it]Generation:  16
Best f1_score score: 0.9964913465924917
Generation:  64%|██████▍   | 16/25 [11:08<08:47, 58.64s/it]Generation:  17
Best f1_score score: 0.9964913465924917
Generation:  68%|██████▊   | 17/25 [11:15<05:44, 43.07s/it]Generation:  18
Best f1_score score: 0.9964913465924917
Generation:  72%|███████▏  | 18/25 [11:47<04:38, 39.85s/it]Generation:  19
Best f1_score score: 0.9964913465924917
Generation:  76%|███████▌  | 19/25 [11:55<03:01, 30.24s/it]Generation:  20
Best f1_score score: 0.9964913465924917
Generation:  80%|████████  | 20/25 [12:09<02:06, 25.34s/it]Generation:  21
Best f1_score score: 0.9964913465924917
Generation:  84%|████████▍ | 21/25 [12:21<01:25, 21.45s/it]Generation:  22
Best f1_score score: 0.9964913465924917
Generation:  88%|████████▊ | 22/25 [12:27<00:50, 16.89s/it]Generation:  23
Best f1_score score: 0.9964913465924917
Generation:  92%|█████████▏| 23/25 [12:33<00:27, 13.60s/it]Generation:  24
Best f1_score score: 0.9964913465924917
Generation:  96%|█████████▌| 24/25 [12:40<00:11, 11.56s/it]Generation:  25
Best f1_score score: 0.9964913465924917
Generation: 100%|██████████| 25/25 [12:45<00:00,  9.57s/it]Generation: 100%|██████████| 25/25 [12:45<00:00, 30.63s/it]
2024-11-05 04:21:47,694 - distributed.scheduler - ERROR - Removing worker 'tcp://127.0.0.1:47091' caused the cluster to lose scattered data, which can't be recovered: {'DataFrame-cc8d403777018b77f0f7ed15d62926fc', 'ndarray-782bc5f56dfe6ad3c3952dbb6d6329f9'} (stimulus_id='handle-worker-cleanup-1730809307.6944284')
Fitted
Pipeline(steps=[('simpleimputer', SimpleImputer()),
                ('histgradientboostingclassifier',
                 HistGradientBoostingClassifier(early_stopping=False,
                                                l2_regularization=1.663086e-06,
                                                learning_rate=0.3574954038363,
                                                max_features=0.8916799618259,
                                                max_leaf_nodes=1154,
                                                min_samples_leaf=71, tol=0.0001,
                                                validation_fraction=None))])
transform worked
try transform
transform worked
score start
train score: {'auroc': 1.0, 'accuracy': 1.0, 'balanced_accuracy': 1.0, 'logloss': 2.113193250505789e-06, 'f1': 1.0}
test score: {'auroc': 0.9751371172004033, 'accuracy': 0.9693464430306535, 'balanced_accuracy': 0.9717838616636797, 'logloss': 0.601040354789227, 'f1': 0.969182782283219}
original test score: {'auroc': 1.0, 'accuracy': 1.0, 'balanced_accuracy': 1.0, 'logloss': 3.700724699070904e-07, 'f1': 1.0}
score end
923
lvl
0.1
type
MAR
num_run
3
class_simple
finished
all finished
full run takes
0.5949362263414595
hours
DONE
