Run: 50
/cm/local/apps/slurm/var/spool/job995745/slurm_script: line 27: 
pip install -e tpot2
pip install -r tpot2/ImputerExperiments/requirements_.txt
: No such file or directory
RunStart
Version 0.1.7a0 of tpot2 is outdated. Version 0.1.8a0 was released Tuesday September 17, 2024.
starting loops
../data/r/42225/42225.pkl
working on 
../data/r/42225/reg_full_MCAR_0.1_3
1.3224868774414062
running experiment 1/3 - Does large hyperparameter space improve reconstruction accuracy over simple
[I 2024-10-10 11:02:45,107] A new study created in memory with name: no-name-140c21c6-f2d4-43b0-82aa-4218ef914d69
running
running
running
running
running
running
running
running
running
running
running
running
running
running
running
running
[I 2024-10-10 11:02:45,745] Trial 8 finished with value: 0.18588940926668707 and parameters: {'model_name': 'SimpleImputer', 'strategy': 'median'}. Best is trial 8 with value: 0.18588940926668707.
running
[I 2024-10-10 11:02:55,713] Trial 1 finished with value: 0.41463408096394677 and parameters: {'model_name': 'GAIN', 'batch_size': 541, 'hint_rate': 0.8890468709209296, 'alpha': 51, 'iterations': 6, 'learning_rate': 0.0009471192959783076, 'p_miss': 0.24399763952554998}. Best is trial 8 with value: 0.18588940926668707.
running
[I 2024-10-10 11:03:07,756] Trial 15 finished with value: 0.26384274952042686 and parameters: {'model_name': 'VAE', 'batch_size': 536, 'iterations': 3, 'learning_rate': 0.003528155478128487, 'p_miss': 0.018042316683486673}. Best is trial 8 with value: 0.18588940926668707.
running
[I 2024-10-10 11:03:49,562] Trial 4 finished with value: 0.16987864075020234 and parameters: {'model_name': 'KNNImputer', 'n_neighbors': 11860, 'weights': 'uniform'}. Best is trial 4 with value: 0.16987864075020234.
running
[I 2024-10-10 11:03:54,813] Trial 16 finished with value: 0.1573229478847673 and parameters: {'model_name': 'IterativeImputer', 'estimator': 'Bayesian', 'initial_strategy': 'median', 'n_nearest_features': 5, 'imputation_order': 'ascending', 'sample_posterior': False}. Best is trial 16 with value: 0.1573229478847673.
running
[I 2024-10-10 11:03:55,101] Trial 17 finished with value: 0.16362326393517962 and parameters: {'model_name': 'KNNImputer', 'n_neighbors': 3861, 'weights': 'distance'}. Best is trial 16 with value: 0.1573229478847673.
running
[I 2024-10-10 11:03:55,879] Trial 5 finished with value: 0.15746380172231467 and parameters: {'model_name': 'IterativeImputer', 'estimator': 'Bayesian', 'initial_strategy': 'most_frequent', 'n_nearest_features': 5, 'imputation_order': 'roman', 'sample_posterior': False}. Best is trial 16 with value: 0.1573229478847673.
running
[I 2024-10-10 11:03:58,184] Trial 9 finished with value: 0.41407409044169735 and parameters: {'model_name': 'GAIN', 'batch_size': 30, 'hint_rate': 0.1337958226699017, 'alpha': 66, 'iterations': 132, 'learning_rate': 0.0008157225465316595, 'p_miss': 0.22072841862660111}. Best is trial 16 with value: 0.1573229478847673.
running
[I 2024-10-10 11:04:00,842] Trial 22 finished with value: 0.423062258950207 and parameters: {'model_name': 'GAIN', 'batch_size': 59, 'hint_rate': 0.22044789708802728, 'alpha': 47, 'iterations': 2, 'learning_rate': 0.00017998445143886204, 'p_miss': 0.05317968327059241}. Best is trial 16 with value: 0.1573229478847673.
running
[I 2024-10-10 11:04:01,789] Trial 24 finished with value: 0.17374037363706474 and parameters: {'model_name': 'SimpleImputer', 'strategy': 'mean'}. Best is trial 16 with value: 0.1573229478847673.
running
[I 2024-10-10 11:04:08,590] Trial 11 finished with value: 0.17161619402530565 and parameters: {'model_name': 'KNNImputer', 'n_neighbors': 40217, 'weights': 'distance'}. Best is trial 16 with value: 0.1573229478847673.
running
[I 2024-10-10 11:04:09,103] Trial 19 finished with value: 0.4182355289842642 and parameters: {'model_name': 'GAIN', 'batch_size': 902, 'hint_rate': 0.5299086872998962, 'alpha': 36, 'iterations': 15, 'learning_rate': 0.0027756345645246496, 'p_miss': 0.2334341188388061}. Best is trial 16 with value: 0.1573229478847673.
running
[I 2024-10-10 11:04:11,273] Trial 13 finished with value: 0.2442403569057908 and parameters: {'model_name': 'IterativeImputer', 'estimator': 'Bayesian', 'initial_strategy': 'constant', 'n_nearest_features': 4, 'imputation_order': 'roman', 'sample_posterior': True}. Best is trial 16 with value: 0.1573229478847673.
running
[I 2024-10-10 11:04:14,399] Trial 14 finished with value: 0.17020282166669604 and parameters: {'model_name': 'KNNImputer', 'n_neighbors': 21457, 'weights': 'distance'}. Best is trial 16 with value: 0.1573229478847673.
running
[I 2024-10-10 11:04:17,008] Trial 18 finished with value: 0.16883493524705795 and parameters: {'model_name': 'IterativeImputer', 'estimator': 'KNN', 'initial_strategy': 'most_frequent', 'n_nearest_features': 2, 'imputation_order': 'descending'}. Best is trial 16 with value: 0.1573229478847673.
running
[I 2024-10-10 11:04:18,530] Trial 6 finished with value: 0.1705641664913126 and parameters: {'model_name': 'KNNImputer', 'n_neighbors': 23940, 'weights': 'distance'}. Best is trial 16 with value: 0.1573229478847673.
running
[I 2024-10-10 11:04:34,944] Trial 20 finished with value: 0.1574870341433284 and parameters: {'model_name': 'IterativeImputer', 'estimator': 'Ridge', 'initial_strategy': 'mean', 'n_nearest_features': 5, 'imputation_order': 'arabic'}. Best is trial 16 with value: 0.1573229478847673.
running
[I 2024-10-10 11:05:05,508] Trial 23 finished with value: 0.16569065832280028 and parameters: {'model_name': 'KNNImputer', 'n_neighbors': 6393, 'weights': 'distance'}. Best is trial 16 with value: 0.1573229478847673.
running
[I 2024-10-10 11:05:24,335] Trial 26 finished with value: 0.1573229478847673 and parameters: {'model_name': 'IterativeImputer', 'estimator': 'Bayesian', 'initial_strategy': 'median', 'n_nearest_features': 5, 'imputation_order': 'ascending', 'sample_posterior': False}. Best is trial 16 with value: 0.1573229478847673.
running
[I 2024-10-10 11:05:24,835] Trial 27 finished with value: 0.1573229478847673 and parameters: {'model_name': 'IterativeImputer', 'estimator': 'Bayesian', 'initial_strategy': 'median', 'n_nearest_features': 5, 'imputation_order': 'ascending', 'sample_posterior': False}. Best is trial 16 with value: 0.1573229478847673.
running
[I 2024-10-10 11:05:38,161] Trial 29 finished with value: 0.1573084644242271 and parameters: {'model_name': 'IterativeImputer', 'estimator': 'Bayesian', 'initial_strategy': 'median', 'n_nearest_features': 6, 'imputation_order': 'ascending', 'sample_posterior': False}. Best is trial 29 with value: 0.1573084644242271.
running
[I 2024-10-10 11:05:38,520] Trial 28 finished with value: 0.1573084644242271 and parameters: {'model_name': 'IterativeImputer', 'estimator': 'Bayesian', 'initial_strategy': 'median', 'n_nearest_features': 6, 'imputation_order': 'ascending', 'sample_posterior': False}. Best is trial 29 with value: 0.1573084644242271.
running
[I 2024-10-10 11:05:39,036] Trial 25 finished with value: 0.1572666264006292 and parameters: {'model_name': 'IterativeImputer', 'estimator': 'Bayesian', 'initial_strategy': 'median', 'n_nearest_features': 8, 'imputation_order': 'ascending', 'sample_posterior': False}. Best is trial 25 with value: 0.1572666264006292.
running
[I 2024-10-10 11:05:50,980] Trial 30 finished with value: 0.1572550324221398 and parameters: {'model_name': 'IterativeImputer', 'estimator': 'Bayesian', 'initial_strategy': 'median', 'n_nearest_features': 7, 'imputation_order': 'ascending', 'sample_posterior': False}. Best is trial 30 with value: 0.1572550324221398.
running
[I 2024-10-10 11:05:51,486] Trial 31 finished with value: 0.1572550324221398 and parameters: {'model_name': 'IterativeImputer', 'estimator': 'Bayesian', 'initial_strategy': 'median', 'n_nearest_features': 7, 'imputation_order': 'ascending', 'sample_posterior': False}. Best is trial 30 with value: 0.1572550324221398.
running
[I 2024-10-10 11:06:01,466] Trial 32 finished with value: 0.1572666264006292 and parameters: {'model_name': 'IterativeImputer', 'estimator': 'Bayesian', 'initial_strategy': 'median', 'n_nearest_features': 9, 'imputation_order': 'ascending', 'sample_posterior': False}. Best is trial 30 with value: 0.1572550324221398.
running
[I 2024-10-10 11:06:25,256] Trial 7 finished with value: 0.4079260429925909 and parameters: {'model_name': 'GAIN', 'batch_size': 13, 'hint_rate': 0.5993530104070696, 'alpha': 97, 'iterations': 403, 'learning_rate': 0.0008782495806558346, 'p_miss': 0.26624700428301057}. Best is trial 30 with value: 0.1572550324221398.
running
[I 2024-10-10 11:06:28,514] Trial 33 finished with value: 0.1572666264006292 and parameters: {'model_name': 'IterativeImputer', 'estimator': 'Bayesian', 'initial_strategy': 'median', 'n_nearest_features': 9, 'imputation_order': 'ascending', 'sample_posterior': False}. Best is trial 30 with value: 0.1572550324221398.
running
[I 2024-10-10 11:06:44,646] Trial 34 finished with value: 0.1572666264006292 and parameters: {'model_name': 'IterativeImputer', 'estimator': 'Bayesian', 'initial_strategy': 'median', 'n_nearest_features': 8, 'imputation_order': 'ascending', 'sample_posterior': False}. Best is trial 30 with value: 0.1572550324221398.
running
[I 2024-10-10 11:12:53,444] Trial 0 finished with value: 0.21477159046547137 and parameters: {'model_name': 'VAE', 'batch_size': 1, 'iterations': 374, 'learning_rate': 0.0006188787007265041, 'p_miss': 0.2554859208093753}. Best is trial 30 with value: 0.1572550324221398.
running
[I 2024-10-10 11:50:55,745] Trial 3 finished with value: 0.42382149093825366 and parameters: {'model_name': 'GAIN', 'batch_size': 73, 'hint_rate': 0.18055167688339188, 'alpha': 90, 'iterations': 2590, 'learning_rate': 0.00022939243156507163, 'p_miss': 0.13274892168596947}. Best is trial 30 with value: 0.1572550324221398.
running
[I 2024-10-10 12:15:52,561] Trial 2 finished with value: 0.4271680982881386 and parameters: {'model_name': 'GAIN', 'batch_size': 573, 'hint_rate': 0.6808388285549651, 'alpha': 40, 'iterations': 3048, 'learning_rate': 0.007038477614893023, 'p_miss': 0.025819848216088244}. Best is trial 30 with value: 0.1572550324221398.
running
[I 2024-10-10 12:17:17,606] Trial 47 finished with value: 0.19495415324624285 and parameters: {'model_name': 'VAE', 'batch_size': 2, 'iterations': 24, 'learning_rate': 0.062331900008272066, 'p_miss': 0.12594384332090883}. Best is trial 30 with value: 0.1572550324221398.
running
[I 2024-10-10 12:17:50,643] Trial 48 finished with value: 0.1572704818098667 and parameters: {'model_name': 'IterativeImputer', 'estimator': 'Ridge', 'initial_strategy': 'median', 'n_nearest_features': 8, 'imputation_order': 'random'}. Best is trial 30 with value: 0.1572550324221398.
running
[I 2024-10-10 12:27:10,077] Trial 10 finished with value: 0.18322253747186218 and parameters: {'model_name': 'VAE', 'batch_size': 9, 'iterations': 1780, 'learning_rate': 0.030630519813376646, 'p_miss': 0.26189126516056527}. Best is trial 30 with value: 0.1572550324221398.
running
[I 2024-10-10 12:43:58,405] Trial 21 finished with value: 0.13773441568888245 and parameters: {'model_name': 'IterativeImputer', 'estimator': 'RFR', 'initial_strategy': 'mean', 'n_nearest_features': 5, 'imputation_order': 'ascending'}. Best is trial 21 with value: 0.13773441568888245.
running
[I 2024-10-10 12:43:59,413] Trial 51 finished with value: 0.4368749724241151 and parameters: {'model_name': 'SimpleImputer', 'strategy': 'constant'}. Best is trial 21 with value: 0.13773441568888245.
running
[I 2024-10-10 13:08:46,901] Trial 45 finished with value: 0.20460453348525537 and parameters: {'model_name': 'VAE', 'batch_size': 1, 'iterations': 2971, 'learning_rate': 0.07814245435972082, 'p_miss': 0.13402137058449282}. Best is trial 21 with value: 0.13773441568888245.
running
[I 2024-10-10 13:19:35,464] Trial 37 finished with value: 0.12931583964137644 and parameters: {'model_name': 'IterativeImputer', 'estimator': 'RFR', 'initial_strategy': 'median', 'n_nearest_features': 8, 'imputation_order': 'ascending'}. Best is trial 37 with value: 0.12931583964137644.
running
[I 2024-10-10 13:19:50,475] Trial 39 finished with value: 0.12951838186605782 and parameters: {'model_name': 'IterativeImputer', 'estimator': 'RFR', 'initial_strategy': 'median', 'n_nearest_features': 9, 'imputation_order': 'random'}. Best is trial 37 with value: 0.12931583964137644.
running
[I 2024-10-10 13:20:32,632] Trial 36 finished with value: 0.12971412376629307 and parameters: {'model_name': 'IterativeImputer', 'estimator': 'RFR', 'initial_strategy': 'median', 'n_nearest_features': 8, 'imputation_order': 'ascending'}. Best is trial 37 with value: 0.12931583964137644.
running
[I 2024-10-10 13:35:31,224] Trial 38 finished with value: 0.20905628815928604 and parameters: {'model_name': 'VAE', 'batch_size': 1, 'iterations': 3806, 'learning_rate': 0.05636251784833631, 'p_miss': 0.12600067518886615}. Best is trial 37 with value: 0.12931583964137644.
running
[I 2024-10-10 13:49:33,519] Trial 35 finished with value: 0.2104323973318855 and parameters: {'model_name': 'VAE', 'batch_size': 1, 'iterations': 3885, 'learning_rate': 0.07680968518666074, 'p_miss': 0.1460130176740143}. Best is trial 37 with value: 0.12931583964137644.
running
[I 2024-10-10 14:31:10,140] Trial 49 finished with value: 0.1295379614280589 and parameters: {'model_name': 'IterativeImputer', 'estimator': 'RFR', 'initial_strategy': 'median', 'n_nearest_features': 8, 'imputation_order': 'ascending'}. Best is trial 37 with value: 0.12931583964137644.
running
[I 2024-10-10 14:39:45,765] Trial 50 finished with value: 0.12990365256934358 and parameters: {'model_name': 'IterativeImputer', 'estimator': 'RFR', 'initial_strategy': 'median', 'n_nearest_features': 8, 'imputation_order': 'ascending'}. Best is trial 37 with value: 0.12931583964137644.
running
[I 2024-10-10 14:42:53,075] Trial 52 finished with value: 0.13124263927839747 and parameters: {'model_name': 'IterativeImputer', 'estimator': 'RFR', 'initial_strategy': 'mean', 'n_nearest_features': 7, 'imputation_order': 'ascending'}. Best is trial 37 with value: 0.12931583964137644.
running
[I 2024-10-10 15:02:40,017] Trial 46 finished with value: 0.2624475588096423 and parameters: {'model_name': 'VAE', 'batch_size': 1, 'iterations': 5881, 'learning_rate': 0.09775392841714334, 'p_miss': 0.13468348836273994}. Best is trial 37 with value: 0.12931583964137644.
running
[I 2024-10-10 15:05:02,243] Trial 53 finished with value: 0.1313629309426039 and parameters: {'model_name': 'IterativeImputer', 'estimator': 'RFR', 'initial_strategy': 'mean', 'n_nearest_features': 7, 'imputation_order': 'ascending'}. Best is trial 37 with value: 0.12931583964137644.
running
[I 2024-10-10 15:05:03,043] Trial 63 finished with value: 0.34796318353534084 and parameters: {'model_name': 'SimpleImputer', 'strategy': 'most_frequent'}. Best is trial 37 with value: 0.12931583964137644.
running
[I 2024-10-10 15:08:52,439] Trial 12 finished with value: 0.17884053282806905 and parameters: {'model_name': 'VAE', 'batch_size': 262, 'iterations': 5621, 'learning_rate': 0.008516110418574571, 'p_miss': 0.010139613376757825}. Best is trial 37 with value: 0.12931583964137644.
running
[I 2024-10-10 15:11:06,034] Trial 41 finished with value: 0.20750950697573717 and parameters: {'model_name': 'VAE', 'batch_size': 1, 'iterations': 7393, 'learning_rate': 0.06900880790807536, 'p_miss': 0.12518466304694387}. Best is trial 37 with value: 0.12931583964137644.
running
[I 2024-10-10 15:13:40,786] Trial 42 finished with value: 0.20710028509576356 and parameters: {'model_name': 'VAE', 'batch_size': 1, 'iterations': 7131, 'learning_rate': 0.0994573114393403, 'p_miss': 0.1260051584499266}. Best is trial 37 with value: 0.12931583964137644.
running
[I 2024-10-10 15:14:02,523] Trial 44 finished with value: 0.22289311561315403 and parameters: {'model_name': 'VAE', 'batch_size': 1, 'iterations': 8783, 'learning_rate': 0.0800824529700691, 'p_miss': 0.12068374527331395}. Best is trial 37 with value: 0.12931583964137644.
running
[I 2024-10-10 15:16:13,491] Trial 40 finished with value: 0.22146630180865884 and parameters: {'model_name': 'VAE', 'batch_size': 1, 'iterations': 9948, 'learning_rate': 0.0875606844327432, 'p_miss': 0.12075503560500414}. Best is trial 37 with value: 0.12931583964137644.
running
[I 2024-10-10 15:16:43,402] Trial 43 finished with value: 0.22201016292245415 and parameters: {'model_name': 'VAE', 'batch_size': 1, 'iterations': 9813, 'learning_rate': 0.09010025538401056, 'p_miss': 0.12326583432600141}. Best is trial 37 with value: 0.12931583964137644.
running
[I 2024-10-10 15:17:20,304] Trial 54 finished with value: 0.1307771816166708 and parameters: {'model_name': 'IterativeImputer', 'estimator': 'RFR', 'initial_strategy': 'mean', 'n_nearest_features': 7, 'imputation_order': 'arabic'}. Best is trial 37 with value: 0.12931583964137644.
running
[I 2024-10-10 15:18:18,727] Trial 55 finished with value: 0.13069589969526074 and parameters: {'model_name': 'IterativeImputer', 'estimator': 'RFR', 'initial_strategy': 'mean', 'n_nearest_features': 7, 'imputation_order': 'random'}. Best is trial 37 with value: 0.12931583964137644.
running
[I 2024-10-10 15:19:51,775] Trial 56 finished with value: 0.13064545504589764 and parameters: {'model_name': 'IterativeImputer', 'estimator': 'RFR', 'initial_strategy': 'mean', 'n_nearest_features': 7, 'imputation_order': 'random'}. Best is trial 37 with value: 0.12931583964137644.
running
[I 2024-10-10 15:34:43,019] Trial 57 finished with value: 0.13106461959009327 and parameters: {'model_name': 'IterativeImputer', 'estimator': 'RFR', 'initial_strategy': 'mean', 'n_nearest_features': 7, 'imputation_order': 'random'}. Best is trial 37 with value: 0.12931583964137644.
running
[I 2024-10-10 15:34:44,026] Trial 74 finished with value: 0.4091864013905142 and parameters: {'model_name': 'GAIN', 'batch_size': 4, 'hint_rate': 0.9897743206693034, 'alpha': 2, 'iterations': 1, 'learning_rate': 0.00010762881412242864, 'p_miss': 0.29776615841817095}. Best is trial 37 with value: 0.12931583964137644.
running
[I 2024-10-10 15:48:14,319] Trial 58 finished with value: 0.1303031455296341 and parameters: {'model_name': 'IterativeImputer', 'estimator': 'RFR', 'initial_strategy': 'mean', 'n_nearest_features': 7, 'imputation_order': 'random'}. Best is trial 37 with value: 0.12931583964137644.
running
[I 2024-10-10 16:32:35,834] Trial 59 finished with value: 0.12996345709913934 and parameters: {'model_name': 'IterativeImputer', 'estimator': 'RFR', 'initial_strategy': 'mean', 'n_nearest_features': 9, 'imputation_order': 'random'}. Best is trial 37 with value: 0.12931583964137644.
running
[I 2024-10-10 16:39:58,591] Trial 60 finished with value: 0.1295359941249743 and parameters: {'model_name': 'IterativeImputer', 'estimator': 'RFR', 'initial_strategy': 'constant', 'n_nearest_features': 9, 'imputation_order': 'random'}. Best is trial 37 with value: 0.12931583964137644.
running
[I 2024-10-10 16:42:12,136] Trial 61 finished with value: 0.13002178318961638 and parameters: {'model_name': 'IterativeImputer', 'estimator': 'RFR', 'initial_strategy': 'constant', 'n_nearest_features': 9, 'imputation_order': 'random'}. Best is trial 37 with value: 0.12931583964137644.
running
[I 2024-10-10 16:59:12,432] Trial 62 finished with value: 0.13018015232158736 and parameters: {'model_name': 'IterativeImputer', 'estimator': 'RFR', 'initial_strategy': 'constant', 'n_nearest_features': 9, 'imputation_order': 'random'}. Best is trial 37 with value: 0.12931583964137644.
running
[I 2024-10-10 16:59:41,914] Trial 80 finished with value: 0.1737403736370647 and parameters: {'model_name': 'KNNImputer', 'n_neighbors': 42022, 'weights': 'uniform'}. Best is trial 37 with value: 0.12931583964137644.
running
[I 2024-10-10 17:01:30,404] Trial 64 finished with value: 0.12929129241221432 and parameters: {'model_name': 'IterativeImputer', 'estimator': 'RFR', 'initial_strategy': 'constant', 'n_nearest_features': 9, 'imputation_order': 'random'}. Best is trial 64 with value: 0.12929129241221432.
running
[I 2024-10-10 17:04:29,990] Trial 65 finished with value: 0.12926777449322535 and parameters: {'model_name': 'IterativeImputer', 'estimator': 'RFR', 'initial_strategy': 'constant', 'n_nearest_features': 9, 'imputation_order': 'random'}. Best is trial 65 with value: 0.12926777449322535.
running
[I 2024-10-10 17:06:13,250] Trial 66 finished with value: 0.12953005229525263 and parameters: {'model_name': 'IterativeImputer', 'estimator': 'RFR', 'initial_strategy': 'constant', 'n_nearest_features': 9, 'imputation_order': 'random'}. Best is trial 65 with value: 0.12926777449322535.
running
[I 2024-10-10 17:07:47,045] Trial 68 finished with value: 0.12923433356167482 and parameters: {'model_name': 'IterativeImputer', 'estimator': 'RFR', 'initial_strategy': 'constant', 'n_nearest_features': 9, 'imputation_order': 'random'}. Best is trial 68 with value: 0.12923433356167482.
running
[I 2024-10-10 17:07:48,551] Trial 85 finished with value: 0.42564892967089596 and parameters: {'model_name': 'GAIN', 'batch_size': 126, 'hint_rate': 0.34553068543154997, 'alpha': 0, 'iterations': 48, 'learning_rate': 0.027792772793035336, 'p_miss': 0.18134952022166392}. Best is trial 68 with value: 0.12923433356167482.
running
[I 2024-10-10 17:08:04,599] Trial 67 finished with value: 0.12973098493407548 and parameters: {'model_name': 'IterativeImputer', 'estimator': 'RFR', 'initial_strategy': 'constant', 'n_nearest_features': 9, 'imputation_order': 'random'}. Best is trial 68 with value: 0.12923433356167482.
running
[I 2024-10-10 17:08:46,834] Trial 87 finished with value: 0.16213540394766 and parameters: {'model_name': 'IterativeImputer', 'estimator': 'KNN', 'initial_strategy': 'constant', 'n_nearest_features': 9, 'imputation_order': 'roman'}. Best is trial 68 with value: 0.12923433356167482.
running
