[I 2024-10-10 23:04:46,054] Trial 145 finished with value: 0.1311479930195431 and parameters: {'model_name': 'IterativeImputer', 'estimator': 'RFR', 'initial_strategy': 'constant', 'n_nearest_features': 7, 'imputation_order': 'roman'}. Best is trial 140 with value: 0.1287530509798621.
running
[I 2024-10-10 23:04:46,688] Trial 164 finished with value: 0.41741091362497007 and parameters: {'model_name': 'GAIN', 'batch_size': 231, 'hint_rate': 0.34174875691766105, 'alpha': 18, 'iterations': 1, 'learning_rate': 0.00039054365150235145, 'p_miss': 0.17072087130489394}. Best is trial 140 with value: 0.1287530509798621.
running
[I 2024-10-10 23:38:02,976] Trial 147 finished with value: 0.13201428294114492 and parameters: {'model_name': 'IterativeImputer', 'estimator': 'RFR', 'initial_strategy': 'constant', 'n_nearest_features': 7, 'imputation_order': 'roman'}. Best is trial 140 with value: 0.1287530509798621.
running
[I 2024-10-10 23:38:46,108] Trial 148 finished with value: 0.13147663667793036 and parameters: {'model_name': 'IterativeImputer', 'estimator': 'RFR', 'initial_strategy': 'constant', 'n_nearest_features': 7, 'imputation_order': 'roman'}. Best is trial 140 with value: 0.1287530509798621.
running
[I 2024-10-10 23:48:13,055] Trial 146 finished with value: 0.1296243658708387 and parameters: {'model_name': 'IterativeImputer', 'estimator': 'RFR', 'initial_strategy': 'constant', 'n_nearest_features': 8, 'imputation_order': 'roman'}. Best is trial 140 with value: 0.1287530509798621.
running
[I 2024-10-10 23:55:54,408] Trial 149 finished with value: 0.13110551865430578 and parameters: {'model_name': 'IterativeImputer', 'estimator': 'RFR', 'initial_strategy': 'constant', 'n_nearest_features': 7, 'imputation_order': 'roman'}. Best is trial 140 with value: 0.1287530509798621.
running
[I 2024-10-10 23:56:42,076] Trial 150 finished with value: 0.13164680476179444 and parameters: {'model_name': 'IterativeImputer', 'estimator': 'RFR', 'initial_strategy': 'constant', 'n_nearest_features': 7, 'imputation_order': 'roman'}. Best is trial 140 with value: 0.1287530509798621.
running
[I 2024-10-11 00:00:03,615] Trial 151 finished with value: 0.1309322894600268 and parameters: {'model_name': 'IterativeImputer', 'estimator': 'RFR', 'initial_strategy': 'constant', 'n_nearest_features': 7, 'imputation_order': 'ascending'}. Best is trial 140 with value: 0.1287530509798621.
running
[I 2024-10-11 00:04:03,042] Trial 152 finished with value: 0.13094547804380846 and parameters: {'model_name': 'IterativeImputer', 'estimator': 'RFR', 'initial_strategy': 'constant', 'n_nearest_features': 7, 'imputation_order': 'descending'}. Best is trial 140 with value: 0.1287530509798621.
running
[I 2024-10-11 00:04:23,530] Trial 153 finished with value: 0.13123538747027066 and parameters: {'model_name': 'IterativeImputer', 'estimator': 'RFR', 'initial_strategy': 'constant', 'n_nearest_features': 7, 'imputation_order': 'ascending'}. Best is trial 140 with value: 0.1287530509798621.
running
[I 2024-10-11 00:04:23,778] Trial 173 finished with value: 0.17374037363706474 and parameters: {'model_name': 'SimpleImputer', 'strategy': 'mean'}. Best is trial 140 with value: 0.1287530509798621.
running
[I 2024-10-11 00:04:36,480] Trial 174 finished with value: 0.22026921819906828 and parameters: {'model_name': 'VAE', 'batch_size': 3, 'iterations': 274, 'learning_rate': 0.00046660335519467993, 'p_miss': 0.07944463740298856}. Best is trial 140 with value: 0.1287530509798621.
running
[I 2024-10-11 00:05:07,799] Trial 175 finished with value: 0.15841058793200022 and parameters: {'model_name': 'KNNImputer', 'n_neighbors': 1007, 'weights': 'distance'}. Best is trial 140 with value: 0.1287530509798621.
running
[I 2024-10-11 00:07:47,843] Trial 158 finished with value: 0.1303840911611041 and parameters: {'model_name': 'IterativeImputer', 'estimator': 'RFR', 'initial_strategy': 'constant', 'n_nearest_features': 7, 'imputation_order': 'descending'}. Best is trial 140 with value: 0.1287530509798621.
running
[I 2024-10-11 00:17:21,971] Trial 154 finished with value: 0.13032504906792725 and parameters: {'model_name': 'IterativeImputer', 'estimator': 'RFR', 'initial_strategy': 'most_frequent', 'n_nearest_features': 9, 'imputation_order': 'ascending'}. Best is trial 140 with value: 0.1287530509798621.
running
[I 2024-10-11 00:18:58,302] Trial 157 finished with value: 0.1295838987211328 and parameters: {'model_name': 'IterativeImputer', 'estimator': 'RFR', 'initial_strategy': 'constant', 'n_nearest_features': 9, 'imputation_order': 'descending'}. Best is trial 140 with value: 0.1287530509798621.
running
[I 2024-10-11 00:30:24,737] Trial 159 finished with value: 0.13004044775782048 and parameters: {'model_name': 'IterativeImputer', 'estimator': 'RFR', 'initial_strategy': 'constant', 'n_nearest_features': 9, 'imputation_order': 'descending'}. Best is trial 140 with value: 0.1287530509798621.
running
[I 2024-10-11 00:30:46,815] Trial 160 finished with value: 0.1296746056195043 and parameters: {'model_name': 'IterativeImputer', 'estimator': 'RFR', 'initial_strategy': 'constant', 'n_nearest_features': 9, 'imputation_order': 'descending'}. Best is trial 140 with value: 0.1287530509798621.
running
[I 2024-10-11 00:32:00,634] Trial 161 finished with value: 0.12999085709820488 and parameters: {'model_name': 'IterativeImputer', 'estimator': 'RFR', 'initial_strategy': 'constant', 'n_nearest_features': 9, 'imputation_order': 'descending'}. Best is trial 140 with value: 0.1287530509798621.
running
[I 2024-10-11 00:32:13,198] Trial 182 finished with value: 0.1572704818098667 and parameters: {'model_name': 'IterativeImputer', 'estimator': 'Ridge', 'initial_strategy': 'median', 'n_nearest_features': 8, 'imputation_order': 'random'}. Best is trial 140 with value: 0.1287530509798621.
running
[I 2024-10-11 00:42:28,217] Trial 163 finished with value: 0.13007376204777935 and parameters: {'model_name': 'IterativeImputer', 'estimator': 'RFR', 'initial_strategy': 'constant', 'n_nearest_features': 9, 'imputation_order': 'descending'}. Best is trial 140 with value: 0.1287530509798621.
running
[I 2024-10-11 00:51:21,779] Trial 165 finished with value: 0.12982611578454514 and parameters: {'model_name': 'IterativeImputer', 'estimator': 'RFR', 'initial_strategy': 'constant', 'n_nearest_features': 9, 'imputation_order': 'descending'}. Best is trial 140 with value: 0.1287530509798621.
running
[I 2024-10-11 01:24:25,576] Trial 166 finished with value: 0.12923593355064802 and parameters: {'model_name': 'IterativeImputer', 'estimator': 'RFR', 'initial_strategy': 'constant', 'n_nearest_features': 9, 'imputation_order': 'descending'}. Best is trial 140 with value: 0.1287530509798621.
running
[I 2024-10-11 01:25:02,924] Trial 167 finished with value: 0.12945305123721731 and parameters: {'model_name': 'IterativeImputer', 'estimator': 'RFR', 'initial_strategy': 'constant', 'n_nearest_features': 9, 'imputation_order': 'random'}. Best is trial 140 with value: 0.1287530509798621.
running
[I 2024-10-11 01:34:50,088] Trial 168 finished with value: 0.12995422739801685 and parameters: {'model_name': 'IterativeImputer', 'estimator': 'RFR', 'initial_strategy': 'constant', 'n_nearest_features': 9, 'imputation_order': 'descending'}. Best is trial 140 with value: 0.1287530509798621.
running
[I 2024-10-11 01:42:15,398] Trial 169 finished with value: 0.12957776548429517 and parameters: {'model_name': 'IterativeImputer', 'estimator': 'RFR', 'initial_strategy': 'constant', 'n_nearest_features': 9, 'imputation_order': 'descending'}. Best is trial 140 with value: 0.1287530509798621.
running
[I 2024-10-11 01:42:59,630] Trial 170 finished with value: 0.12960432697883476 and parameters: {'model_name': 'IterativeImputer', 'estimator': 'RFR', 'initial_strategy': 'median', 'n_nearest_features': 9, 'imputation_order': 'random'}. Best is trial 140 with value: 0.1287530509798621.
running
[I 2024-10-11 01:46:19,444] Trial 171 finished with value: 0.13001159738333132 and parameters: {'model_name': 'IterativeImputer', 'estimator': 'RFR', 'initial_strategy': 'median', 'n_nearest_features': 9, 'imputation_order': 'descending'}. Best is trial 140 with value: 0.1287530509798621.
running
[I 2024-10-11 01:50:21,634] Trial 172 finished with value: 0.1302441075885244 and parameters: {'model_name': 'IterativeImputer', 'estimator': 'RFR', 'initial_strategy': 'median', 'n_nearest_features': 9, 'imputation_order': 'random'}. Best is trial 140 with value: 0.1287530509798621.
running
[I 2024-10-11 01:51:28,011] Trial 176 finished with value: 0.13046106305282296 and parameters: {'model_name': 'IterativeImputer', 'estimator': 'RFR', 'initial_strategy': 'constant', 'n_nearest_features': 9, 'imputation_order': 'random'}. Best is trial 140 with value: 0.1287530509798621.
running
[I 2024-10-11 01:53:56,287] Trial 177 finished with value: 0.12936824935583408 and parameters: {'model_name': 'IterativeImputer', 'estimator': 'RFR', 'initial_strategy': 'median', 'n_nearest_features': 9, 'imputation_order': 'random'}. Best is trial 140 with value: 0.1287530509798621.
running
[I 2024-10-11 02:03:45,875] Trial 178 finished with value: 0.12912705662102938 and parameters: {'model_name': 'IterativeImputer', 'estimator': 'RFR', 'initial_strategy': 'median', 'n_nearest_features': 9, 'imputation_order': 'random'}. Best is trial 140 with value: 0.1287530509798621.
running
[I 2024-10-11 02:05:03,251] Trial 179 finished with value: 0.12957683119008587 and parameters: {'model_name': 'IterativeImputer', 'estimator': 'RFR', 'initial_strategy': 'median', 'n_nearest_features': 9, 'imputation_order': 'random'}. Best is trial 140 with value: 0.1287530509798621.
running
[I 2024-10-11 02:16:34,600] Trial 180 finished with value: 0.12970067504253513 and parameters: {'model_name': 'IterativeImputer', 'estimator': 'RFR', 'initial_strategy': 'median', 'n_nearest_features': 8, 'imputation_order': 'random'}. Best is trial 140 with value: 0.1287530509798621.
running
[I 2024-10-11 02:17:03,504] Trial 181 finished with value: 0.12914164126070063 and parameters: {'model_name': 'IterativeImputer', 'estimator': 'RFR', 'initial_strategy': 'mean', 'n_nearest_features': 8, 'imputation_order': 'random'}. Best is trial 140 with value: 0.1287530509798621.
running
[I 2024-10-11 02:18:35,854] Trial 183 finished with value: 0.12982212404107937 and parameters: {'model_name': 'IterativeImputer', 'estimator': 'RFR', 'initial_strategy': 'mean', 'n_nearest_features': 8, 'imputation_order': 'random'}. Best is trial 140 with value: 0.1287530509798621.
running
[I 2024-10-11 02:28:27,290] Trial 184 finished with value: 0.12964827545418967 and parameters: {'model_name': 'IterativeImputer', 'estimator': 'RFR', 'initial_strategy': 'constant', 'n_nearest_features': 8, 'imputation_order': 'random'}. Best is trial 140 with value: 0.1287530509798621.
[I 2024-10-11 02:37:14,263] Trial 185 finished with value: 0.12986342782068164 and parameters: {'model_name': 'IterativeImputer', 'estimator': 'RFR', 'initial_strategy': 'mean', 'n_nearest_features': 8, 'imputation_order': 'random'}. Best is trial 140 with value: 0.1287530509798621.
[I 2024-10-11 03:10:08,728] Trial 186 finished with value: 0.1303124065350893 and parameters: {'model_name': 'IterativeImputer', 'estimator': 'RFR', 'initial_strategy': 'constant', 'n_nearest_features': 8, 'imputation_order': 'random'}. Best is trial 140 with value: 0.1287530509798621.
[I 2024-10-11 03:10:45,909] Trial 187 finished with value: 0.13062959386633072 and parameters: {'model_name': 'IterativeImputer', 'estimator': 'RFR', 'initial_strategy': 'mean', 'n_nearest_features': 9, 'imputation_order': 'random'}. Best is trial 140 with value: 0.1287530509798621.
[I 2024-10-11 03:20:25,795] Trial 188 finished with value: 0.1298252266158093 and parameters: {'model_name': 'IterativeImputer', 'estimator': 'RFR', 'initial_strategy': 'mean', 'n_nearest_features': 9, 'imputation_order': 'random'}. Best is trial 140 with value: 0.1287530509798621.
[I 2024-10-11 03:28:05,055] Trial 189 finished with value: 0.12968345647587096 and parameters: {'model_name': 'IterativeImputer', 'estimator': 'RFR', 'initial_strategy': 'mean', 'n_nearest_features': 8, 'imputation_order': 'random'}. Best is trial 140 with value: 0.1287530509798621.
[I 2024-10-11 03:28:58,983] Trial 190 finished with value: 0.1295346126305457 and parameters: {'model_name': 'IterativeImputer', 'estimator': 'RFR', 'initial_strategy': 'mean', 'n_nearest_features': 8, 'imputation_order': 'random'}. Best is trial 140 with value: 0.1287530509798621.
[I 2024-10-11 03:32:08,819] Trial 191 finished with value: 0.12926957852313561 and parameters: {'model_name': 'IterativeImputer', 'estimator': 'RFR', 'initial_strategy': 'mean', 'n_nearest_features': 8, 'imputation_order': 'random'}. Best is trial 140 with value: 0.1287530509798621.
[I 2024-10-11 03:36:26,670] Trial 192 finished with value: 0.12982544528308984 and parameters: {'model_name': 'IterativeImputer', 'estimator': 'RFR', 'initial_strategy': 'constant', 'n_nearest_features': 8, 'imputation_order': 'random'}. Best is trial 140 with value: 0.1287530509798621.
[I 2024-10-11 03:36:58,910] Trial 193 finished with value: 0.13000675437230758 and parameters: {'model_name': 'IterativeImputer', 'estimator': 'RFR', 'initial_strategy': 'mean', 'n_nearest_features': 8, 'imputation_order': 'random'}. Best is trial 140 with value: 0.1287530509798621.
[I 2024-10-11 03:39:12,249] Trial 194 finished with value: 0.13022402581380937 and parameters: {'model_name': 'IterativeImputer', 'estimator': 'RFR', 'initial_strategy': 'mean', 'n_nearest_features': 9, 'imputation_order': 'random'}. Best is trial 140 with value: 0.1287530509798621.
[I 2024-10-11 03:48:55,128] Trial 195 finished with value: 0.12985265828269243 and parameters: {'model_name': 'IterativeImputer', 'estimator': 'RFR', 'initial_strategy': 'median', 'n_nearest_features': 8, 'imputation_order': 'random'}. Best is trial 140 with value: 0.1287530509798621.
[I 2024-10-11 03:49:52,823] Trial 196 finished with value: 0.12972506120382102 and parameters: {'model_name': 'IterativeImputer', 'estimator': 'RFR', 'initial_strategy': 'median', 'n_nearest_features': 9, 'imputation_order': 'random'}. Best is trial 140 with value: 0.1287530509798621.
[I 2024-10-11 04:01:15,001] Trial 197 finished with value: 0.12925491621305307 and parameters: {'model_name': 'IterativeImputer', 'estimator': 'RFR', 'initial_strategy': 'mean', 'n_nearest_features': 9, 'imputation_order': 'random'}. Best is trial 140 with value: 0.1287530509798621.
[I 2024-10-11 04:02:09,698] Trial 198 finished with value: 0.129982362308734 and parameters: {'model_name': 'IterativeImputer', 'estimator': 'RFR', 'initial_strategy': 'mean', 'n_nearest_features': 8, 'imputation_order': 'random'}. Best is trial 140 with value: 0.1287530509798621.
