[I 2024-10-08 06:23:02,695] Trial 147 finished with value: 0.21003619711334412 and parameters: {'model_name': 'IterativeImputer', 'estimator': 'RFR', 'initial_strategy': 'most_frequent', 'n_nearest_features': 12, 'imputation_order': 'descending'}. Best is trial 125 with value: 0.20792024123872607.
running
[I 2024-10-08 06:23:43,690] Trial 148 finished with value: 0.208977158327603 and parameters: {'model_name': 'IterativeImputer', 'estimator': 'RFR', 'initial_strategy': 'most_frequent', 'n_nearest_features': 12, 'imputation_order': 'descending'}. Best is trial 125 with value: 0.20792024123872607.
running
[I 2024-10-08 06:26:34,481] Trial 149 finished with value: 0.2095619041538101 and parameters: {'model_name': 'IterativeImputer', 'estimator': 'RFR', 'initial_strategy': 'most_frequent', 'n_nearest_features': 12, 'imputation_order': 'descending'}. Best is trial 125 with value: 0.20792024123872607.
running
[I 2024-10-08 06:28:26,737] Trial 169 finished with value: 0.23215563523472055 and parameters: {'model_name': 'IterativeImputer', 'estimator': 'Bayesian', 'initial_strategy': 'most_frequent', 'n_nearest_features': 12, 'imputation_order': 'roman', 'sample_posterior': False}. Best is trial 125 with value: 0.20792024123872607.
running
[I 2024-10-08 06:29:18,905] Trial 150 finished with value: 0.20906018090627976 and parameters: {'model_name': 'IterativeImputer', 'estimator': 'RFR', 'initial_strategy': 'most_frequent', 'n_nearest_features': 12, 'imputation_order': 'descending'}. Best is trial 125 with value: 0.20792024123872607.
running
[I 2024-10-08 06:34:04,498] Trial 151 finished with value: 0.20879900131066048 and parameters: {'model_name': 'IterativeImputer', 'estimator': 'RFR', 'initial_strategy': 'most_frequent', 'n_nearest_features': 12, 'imputation_order': 'descending'}. Best is trial 125 with value: 0.20792024123872607.
running
[I 2024-10-08 06:35:50,576] Trial 152 finished with value: 0.2092558845679487 and parameters: {'model_name': 'IterativeImputer', 'estimator': 'RFR', 'initial_strategy': 'most_frequent', 'n_nearest_features': 12, 'imputation_order': 'descending'}. Best is trial 125 with value: 0.20792024123872607.
running
[I 2024-10-08 06:36:16,139] Trial 153 finished with value: 0.20904341269475513 and parameters: {'model_name': 'IterativeImputer', 'estimator': 'RFR', 'initial_strategy': 'most_frequent', 'n_nearest_features': 12, 'imputation_order': 'descending'}. Best is trial 125 with value: 0.20792024123872607.
running
[I 2024-10-08 06:38:27,986] Trial 154 finished with value: 0.20842286398125842 and parameters: {'model_name': 'IterativeImputer', 'estimator': 'RFR', 'initial_strategy': 'most_frequent', 'n_nearest_features': 12, 'imputation_order': 'descending'}. Best is trial 125 with value: 0.20792024123872607.
running
[I 2024-10-08 06:44:04,187] Trial 171 finished with value: 0.2393516859028221 and parameters: {'model_name': 'IterativeImputer', 'estimator': 'RFR', 'initial_strategy': 'most_frequent', 'n_nearest_features': 1, 'imputation_order': 'descending'}. Best is trial 125 with value: 0.20792024123872607.
running
[I 2024-10-08 06:50:22,647] Trial 156 finished with value: 0.2087649649326575 and parameters: {'model_name': 'IterativeImputer', 'estimator': 'RFR', 'initial_strategy': 'most_frequent', 'n_nearest_features': 12, 'imputation_order': 'descending'}. Best is trial 125 with value: 0.20792024123872607.
running
[I 2024-10-08 06:51:55,032] Trial 157 finished with value: 0.20955306920722933 and parameters: {'model_name': 'IterativeImputer', 'estimator': 'RFR', 'initial_strategy': 'most_frequent', 'n_nearest_features': 12, 'imputation_order': 'descending'}. Best is trial 125 with value: 0.20792024123872607.
running
[I 2024-10-08 06:53:08,271] Trial 158 finished with value: 0.20847634085921146 and parameters: {'model_name': 'IterativeImputer', 'estimator': 'RFR', 'initial_strategy': 'most_frequent', 'n_nearest_features': 12, 'imputation_order': 'descending'}. Best is trial 125 with value: 0.20792024123872607.
running
[I 2024-10-08 06:54:17,833] Trial 159 finished with value: 0.20922897770293974 and parameters: {'model_name': 'IterativeImputer', 'estimator': 'RFR', 'initial_strategy': 'most_frequent', 'n_nearest_features': 12, 'imputation_order': 'descending'}. Best is trial 125 with value: 0.20792024123872607.
running
[I 2024-10-08 06:54:57,422] Trial 161 finished with value: 0.20878838602063463 and parameters: {'model_name': 'IterativeImputer', 'estimator': 'RFR', 'initial_strategy': 'most_frequent', 'n_nearest_features': 12, 'imputation_order': 'roman'}. Best is trial 125 with value: 0.20792024123872607.
running
[I 2024-10-08 06:55:25,756] Trial 163 finished with value: 0.20894470650212832 and parameters: {'model_name': 'IterativeImputer', 'estimator': 'RFR', 'initial_strategy': 'most_frequent', 'n_nearest_features': 12, 'imputation_order': 'roman'}. Best is trial 125 with value: 0.20792024123872607.
running
[I 2024-10-08 06:55:53,656] Trial 175 finished with value: 0.24687060729395785 and parameters: {'model_name': 'IterativeImputer', 'estimator': 'RFR', 'initial_strategy': 'most_frequent', 'n_nearest_features': 2, 'imputation_order': 'descending'}. Best is trial 125 with value: 0.20792024123872607.
running
[I 2024-10-08 06:58:43,944] Trial 164 finished with value: 0.2093768990067188 and parameters: {'model_name': 'IterativeImputer', 'estimator': 'RFR', 'initial_strategy': 'most_frequent', 'n_nearest_features': 12, 'imputation_order': 'roman'}. Best is trial 125 with value: 0.20792024123872607.
running
[I 2024-10-08 06:59:25,611] Trial 184 finished with value: 0.23273292101004203 and parameters: {'model_name': 'IterativeImputer', 'estimator': 'Ridge', 'initial_strategy': 'most_frequent', 'n_nearest_features': 12, 'imputation_order': 'roman'}. Best is trial 125 with value: 0.20792024123872607.
running
[I 2024-10-08 07:01:11,800] Trial 166 finished with value: 0.2095937703133787 and parameters: {'model_name': 'IterativeImputer', 'estimator': 'RFR', 'initial_strategy': 'most_frequent', 'n_nearest_features': 12, 'imputation_order': 'roman'}. Best is trial 125 with value: 0.20792024123872607.
running
[I 2024-10-08 07:03:27,179] Trial 167 finished with value: 0.21020342793306565 and parameters: {'model_name': 'IterativeImputer', 'estimator': 'RFR', 'initial_strategy': 'most_frequent', 'n_nearest_features': 12, 'imputation_order': 'roman'}. Best is trial 125 with value: 0.20792024123872607.
running
[I 2024-10-08 07:03:43,799] Trial 168 finished with value: 0.21009375610424846 and parameters: {'model_name': 'IterativeImputer', 'estimator': 'RFR', 'initial_strategy': 'most_frequent', 'n_nearest_features': 12, 'imputation_order': 'roman'}. Best is trial 125 with value: 0.20792024123872607.
running
[I 2024-10-08 07:07:16,141] Trial 170 finished with value: 0.2087250724354072 and parameters: {'model_name': 'IterativeImputer', 'estimator': 'RFR', 'initial_strategy': 'most_frequent', 'n_nearest_features': 12, 'imputation_order': 'roman'}. Best is trial 125 with value: 0.20792024123872607.
running
[I 2024-10-08 07:12:27,428] Trial 172 finished with value: 0.20926062008621113 and parameters: {'model_name': 'IterativeImputer', 'estimator': 'RFR', 'initial_strategy': 'most_frequent', 'n_nearest_features': 12, 'imputation_order': 'descending'}. Best is trial 125 with value: 0.20792024123872607.
running
[I 2024-10-08 07:14:22,667] Trial 173 finished with value: 0.20986753840551922 and parameters: {'model_name': 'IterativeImputer', 'estimator': 'RFR', 'initial_strategy': 'most_frequent', 'n_nearest_features': 12, 'imputation_order': 'roman'}. Best is trial 125 with value: 0.20792024123872607.
running
[I 2024-10-08 07:14:37,609] Trial 174 finished with value: 0.20868953105176838 and parameters: {'model_name': 'IterativeImputer', 'estimator': 'RFR', 'initial_strategy': 'most_frequent', 'n_nearest_features': 12, 'imputation_order': 'roman'}. Best is trial 125 with value: 0.20792024123872607.
running
[I 2024-10-08 07:19:21,364] Trial 192 finished with value: 0.29356310684134723 and parameters: {'model_name': 'VAE', 'batch_size': 5, 'iterations': 392, 'learning_rate': 0.0004547475635044349, 'p_miss': 0.18528805836474774}. Best is trial 125 with value: 0.20792024123872607.
running
[I 2024-10-08 07:19:51,917] Trial 193 finished with value: 0.23922831709583003 and parameters: {'model_name': 'IterativeImputer', 'estimator': 'KNN', 'initial_strategy': 'most_frequent', 'n_nearest_features': 12, 'imputation_order': 'roman'}. Best is trial 125 with value: 0.20792024123872607.
running
[I 2024-10-08 07:21:18,484] Trial 176 finished with value: 0.20901436102040488 and parameters: {'model_name': 'IterativeImputer', 'estimator': 'RFR', 'initial_strategy': 'most_frequent', 'n_nearest_features': 12, 'imputation_order': 'roman'}. Best is trial 125 with value: 0.20792024123872607.
running
[I 2024-10-08 07:21:26,134] Trial 195 finished with value: 0.2314412414269779 and parameters: {'model_name': 'KNNImputer', 'n_neighbors': 1938, 'weights': 'distance'}. Best is trial 125 with value: 0.20792024123872607.
running
[I 2024-10-08 07:27:10,061] Trial 177 finished with value: 0.20913551579843728 and parameters: {'model_name': 'IterativeImputer', 'estimator': 'RFR', 'initial_strategy': 'most_frequent', 'n_nearest_features': 12, 'imputation_order': 'descending'}. Best is trial 125 with value: 0.20792024123872607.
running
[I 2024-10-08 07:28:26,497] Trial 178 finished with value: 0.2086682829667442 and parameters: {'model_name': 'IterativeImputer', 'estimator': 'RFR', 'initial_strategy': 'most_frequent', 'n_nearest_features': 12, 'imputation_order': 'descending'}. Best is trial 125 with value: 0.20792024123872607.
running
[I 2024-10-08 07:29:23,314] Trial 179 finished with value: 0.20883826276701684 and parameters: {'model_name': 'IterativeImputer', 'estimator': 'RFR', 'initial_strategy': 'most_frequent', 'n_nearest_features': 12, 'imputation_order': 'descending'}. Best is trial 125 with value: 0.20792024123872607.
running
[I 2024-10-08 07:29:50,469] Trial 180 finished with value: 0.2102096484027836 and parameters: {'model_name': 'IterativeImputer', 'estimator': 'RFR', 'initial_strategy': 'most_frequent', 'n_nearest_features': 12, 'imputation_order': 'descending'}. Best is trial 125 with value: 0.20792024123872607.
[I 2024-10-08 07:30:08,660] Trial 181 finished with value: 0.2099651215980438 and parameters: {'model_name': 'IterativeImputer', 'estimator': 'RFR', 'initial_strategy': 'most_frequent', 'n_nearest_features': 12, 'imputation_order': 'roman'}. Best is trial 125 with value: 0.20792024123872607.
[I 2024-10-08 07:30:42,605] Trial 182 finished with value: 0.20819413179163626 and parameters: {'model_name': 'IterativeImputer', 'estimator': 'RFR', 'initial_strategy': 'most_frequent', 'n_nearest_features': 12, 'imputation_order': 'roman'}. Best is trial 125 with value: 0.20792024123872607.
[I 2024-10-08 07:31:37,964] Trial 183 finished with value: 0.208354938339908 and parameters: {'model_name': 'IterativeImputer', 'estimator': 'RFR', 'initial_strategy': 'most_frequent', 'n_nearest_features': 12, 'imputation_order': 'roman'}. Best is trial 125 with value: 0.20792024123872607.
[I 2024-10-08 07:33:39,661] Trial 185 finished with value: 0.2092377085570531 and parameters: {'model_name': 'IterativeImputer', 'estimator': 'RFR', 'initial_strategy': 'most_frequent', 'n_nearest_features': 12, 'imputation_order': 'roman'}. Best is trial 125 with value: 0.20792024123872607.
[I 2024-10-08 07:35:00,214] Trial 186 finished with value: 0.20896261655128018 and parameters: {'model_name': 'IterativeImputer', 'estimator': 'RFR', 'initial_strategy': 'most_frequent', 'n_nearest_features': 12, 'imputation_order': 'descending'}. Best is trial 125 with value: 0.20792024123872607.
[I 2024-10-08 07:36:40,243] Trial 187 finished with value: 0.209520959620561 and parameters: {'model_name': 'IterativeImputer', 'estimator': 'RFR', 'initial_strategy': 'most_frequent', 'n_nearest_features': 12, 'imputation_order': 'descending'}. Best is trial 125 with value: 0.20792024123872607.
[I 2024-10-08 07:36:47,103] Trial 188 finished with value: 0.2092551367395336 and parameters: {'model_name': 'IterativeImputer', 'estimator': 'RFR', 'initial_strategy': 'most_frequent', 'n_nearest_features': 12, 'imputation_order': 'descending'}. Best is trial 125 with value: 0.20792024123872607.
[I 2024-10-08 07:39:29,232] Trial 189 finished with value: 0.208742812084515 and parameters: {'model_name': 'IterativeImputer', 'estimator': 'RFR', 'initial_strategy': 'most_frequent', 'n_nearest_features': 12, 'imputation_order': 'roman'}. Best is trial 125 with value: 0.20792024123872607.
[I 2024-10-08 07:42:58,039] Trial 190 finished with value: 0.20894934747285263 and parameters: {'model_name': 'IterativeImputer', 'estimator': 'RFR', 'initial_strategy': 'most_frequent', 'n_nearest_features': 12, 'imputation_order': 'roman'}. Best is trial 125 with value: 0.20792024123872607.
[I 2024-10-08 07:44:10,471] Trial 191 finished with value: 0.2104525511080321 and parameters: {'model_name': 'IterativeImputer', 'estimator': 'RFR', 'initial_strategy': 'most_frequent', 'n_nearest_features': 12, 'imputation_order': 'roman'}. Best is trial 125 with value: 0.20792024123872607.
[I 2024-10-08 07:47:18,165] Trial 194 finished with value: 0.20792130957967458 and parameters: {'model_name': 'IterativeImputer', 'estimator': 'RFR', 'initial_strategy': 'most_frequent', 'n_nearest_features': 12, 'imputation_order': 'roman'}. Best is trial 125 with value: 0.20792024123872607.
[I 2024-10-08 07:48:30,657] Trial 196 finished with value: 0.20919424216896854 and parameters: {'model_name': 'IterativeImputer', 'estimator': 'RFR', 'initial_strategy': 'most_frequent', 'n_nearest_features': 12, 'imputation_order': 'roman'}. Best is trial 125 with value: 0.20792024123872607.
[I 2024-10-08 07:52:18,702] Trial 197 finished with value: 0.20746353211709795 and parameters: {'model_name': 'IterativeImputer', 'estimator': 'RFR', 'initial_strategy': 'most_frequent', 'n_nearest_features': 12, 'imputation_order': 'roman'}. Best is trial 197 with value: 0.20746353211709795.
[I 2024-10-08 07:53:07,980] Trial 198 finished with value: 0.208671772237654 and parameters: {'model_name': 'IterativeImputer', 'estimator': 'RFR', 'initial_strategy': 'most_frequent', 'n_nearest_features': 12, 'imputation_order': 'descending'}. Best is trial 197 with value: 0.20746353211709795.
