Run: 14
/cm/local/apps/slurm/var/spool/job944726/slurm_script: line 26: 
pip install -e tpot2
pip install -r tpot2/ImputerExperiments/requirements_.txt
: No such file or directory
RunStart
starting loops
../data/r/189/189.pkl
working on 
../data/r/189/reg_simple_MCAR_0.1_1
3.217928886413574
running experiment 1/3 - Does large hyperparameter space improve reconstruction accuracy over simple
[I 2024-09-05 12:14:54,730] A new study created in memory with name: no-name-29c7f59c-36a2-409c-9ade-43ac8698636c
running
running
running
running
running
running
running
running
running
running
running
[I 2024-09-05 12:14:54,805] Trial 2 finished with value: 0.5507185135473022 and parameters: {'model_name': 'SimpleImputer', 'strategy': 'constant'}. Best is trial 2 with value: 0.5507185135473022.
running
running
running
running
running
running
[I 2024-09-05 12:14:55,183] Trial 0 finished with value: 0.2771312869322611 and parameters: {'model_name': 'SimpleImputer', 'strategy': 'mean'}. Best is trial 0 with value: 0.2771312869322611.
[I 2024-09-05 12:14:55,281] Trial 8 finished with value: 0.5507185135473022 and parameters: {'model_name': 'SimpleImputer', 'strategy': 'constant'}. Best is trial 0 with value: 0.2771312869322611.
running
running
[I 2024-09-05 12:14:55,410] Trial 11 finished with value: 0.2771312869322611 and parameters: {'model_name': 'SimpleImputer', 'strategy': 'mean'}. Best is trial 0 with value: 0.2771312869322611.
[I 2024-09-05 12:14:55,493] Trial 12 finished with value: 0.2771312869322611 and parameters: {'model_name': 'SimpleImputer', 'strategy': 'mean'}. Best is trial 0 with value: 0.2771312869322611.
running
running
[I 2024-09-05 12:14:55,590] Trial 4 finished with value: 0.2771312869322611 and parameters: {'model_name': 'SimpleImputer', 'strategy': 'mean'}. Best is trial 0 with value: 0.2771312869322611.
[I 2024-09-05 12:14:55,697] Trial 3 finished with value: 0.5507185135473022 and parameters: {'model_name': 'SimpleImputer', 'strategy': 'constant'}. Best is trial 0 with value: 0.2771312869322611.
running
[I 2024-09-05 12:14:55,816] Trial 13 finished with value: 0.2771312869322611 and parameters: {'model_name': 'SimpleImputer', 'strategy': 'mean'}. Best is trial 0 with value: 0.2771312869322611.
[I 2024-09-05 12:14:55,912] Trial 9 finished with value: 0.2771312869322611 and parameters: {'model_name': 'SimpleImputer', 'strategy': 'mean'}. Best is trial 0 with value: 0.2771312869322611.
running
[I 2024-09-05 12:14:56,023] Trial 10 finished with value: 0.2771312869322611 and parameters: {'model_name': 'SimpleImputer', 'strategy': 'mean'}. Best is trial 0 with value: 0.2771312869322611.
running
running
running
[I 2024-09-05 12:14:56,171] Trial 7 finished with value: 0.5507185135473022 and parameters: {'model_name': 'SimpleImputer', 'strategy': 'constant'}. Best is trial 0 with value: 0.2771312869322611.
running
[I 2024-09-05 12:14:56,300] Trial 6 finished with value: 0.278267254414952 and parameters: {'model_name': 'SimpleImputer', 'strategy': 'median'}. Best is trial 0 with value: 0.2771312869322611.
running
[I 2024-09-05 12:14:56,441] Trial 21 finished with value: 0.5507185135473022 and parameters: {'model_name': 'SimpleImputer', 'strategy': 'constant'}. Best is trial 0 with value: 0.2771312869322611.
running
[I 2024-09-05 12:14:56,669] Trial 15 finished with value: 0.278267254414952 and parameters: {'model_name': 'SimpleImputer', 'strategy': 'median'}. Best is trial 0 with value: 0.2771312869322611.
running
[I 2024-09-05 12:14:56,816] Trial 1 finished with value: 0.278267254414952 and parameters: {'model_name': 'SimpleImputer', 'strategy': 'median'}. Best is trial 0 with value: 0.2771312869322611.
[I 2024-09-05 12:14:56,903] Trial 17 finished with value: 0.2771312869322611 and parameters: {'model_name': 'SimpleImputer', 'strategy': 'mean'}. Best is trial 0 with value: 0.2771312869322611.
[I 2024-09-05 12:14:56,984] Trial 16 finished with value: 0.278267254414952 and parameters: {'model_name': 'SimpleImputer', 'strategy': 'median'}. Best is trial 0 with value: 0.2771312869322611.
running
running
running
[I 2024-09-05 12:14:57,267] Trial 20 finished with value: 0.2771312869322611 and parameters: {'model_name': 'SimpleImputer', 'strategy': 'mean'}. Best is trial 0 with value: 0.2771312869322611.
running
[I 2024-09-05 12:14:57,457] Trial 25 finished with value: 0.278267254414952 and parameters: {'model_name': 'SimpleImputer', 'strategy': 'median'}. Best is trial 0 with value: 0.2771312869322611.
[I 2024-09-05 12:14:57,552] Trial 23 finished with value: 0.278267254414952 and parameters: {'model_name': 'SimpleImputer', 'strategy': 'median'}. Best is trial 0 with value: 0.2771312869322611.
running
running
[I 2024-09-05 12:14:57,661] Trial 14 finished with value: 0.5507185135473022 and parameters: {'model_name': 'SimpleImputer', 'strategy': 'most_frequent'}. Best is trial 0 with value: 0.2771312869322611.
running
[I 2024-09-05 12:14:57,878] Trial 19 finished with value: 0.5507185135473022 and parameters: {'model_name': 'SimpleImputer', 'strategy': 'most_frequent'}. Best is trial 0 with value: 0.2771312869322611.
running
[I 2024-09-05 12:14:58,054] Trial 26 finished with value: 0.278267254414952 and parameters: {'model_name': 'SimpleImputer', 'strategy': 'median'}. Best is trial 0 with value: 0.2771312869322611.
[I 2024-09-05 12:14:58,148] Trial 22 finished with value: 0.278267254414952 and parameters: {'model_name': 'SimpleImputer', 'strategy': 'median'}. Best is trial 0 with value: 0.2771312869322611.
running
[I 2024-09-05 12:14:58,242] Trial 5 finished with value: 0.5507185135473022 and parameters: {'model_name': 'SimpleImputer', 'strategy': 'most_frequent'}. Best is trial 0 with value: 0.2771312869322611.
running
running
[I 2024-09-05 12:14:58,574] Trial 24 finished with value: 0.5507185135473022 and parameters: {'model_name': 'SimpleImputer', 'strategy': 'most_frequent'}. Best is trial 0 with value: 0.2771312869322611.
running
[I 2024-09-05 12:14:58,706] Trial 36 finished with value: 0.2771312869322611 and parameters: {'model_name': 'SimpleImputer', 'strategy': 'mean'}. Best is trial 0 with value: 0.2771312869322611.
running
[I 2024-09-05 12:14:58,905] Trial 18 finished with value: 0.5507185135473022 and parameters: {'model_name': 'SimpleImputer', 'strategy': 'most_frequent'}. Best is trial 0 with value: 0.2771312869322611.
[I 2024-09-05 12:14:59,033] Trial 40 finished with value: 0.2771312869322611 and parameters: {'model_name': 'SimpleImputer', 'strategy': 'mean'}. Best is trial 0 with value: 0.2771312869322611.
running
running
[I 2024-09-05 12:14:59,184] Trial 28 finished with value: 0.5507185135473022 and parameters: {'model_name': 'SimpleImputer', 'strategy': 'most_frequent'}. Best is trial 0 with value: 0.2771312869322611.
[I 2024-09-05 12:14:59,276] Trial 37 finished with value: 0.2771312869322611 and parameters: {'model_name': 'SimpleImputer', 'strategy': 'mean'}. Best is trial 0 with value: 0.2771312869322611.
[I 2024-09-05 12:14:59,356] Trial 38 finished with value: 0.2771312869322611 and parameters: {'model_name': 'SimpleImputer', 'strategy': 'mean'}. Best is trial 0 with value: 0.2771312869322611.
running
[I 2024-09-05 12:14:59,447] Trial 31 finished with value: 0.5507185135473022 and parameters: {'model_name': 'SimpleImputer', 'strategy': 'most_frequent'}. Best is trial 0 with value: 0.2771312869322611.
[I 2024-09-05 12:14:59,553] Trial 39 finished with value: 0.2771312869322611 and parameters: {'model_name': 'SimpleImputer', 'strategy': 'mean'}. Best is trial 0 with value: 0.2771312869322611.
[I 2024-09-05 12:14:59,651] Trial 30 finished with value: 0.5507185135473022 and parameters: {'model_name': 'SimpleImputer', 'strategy': 'most_frequent'}. Best is trial 0 with value: 0.2771312869322611.
[I 2024-09-05 12:14:59,755] Trial 29 finished with value: 0.5507185135473022 and parameters: {'model_name': 'SimpleImputer', 'strategy': 'most_frequent'}. Best is trial 0 with value: 0.2771312869322611.
running
running
running
running
running
[I 2024-09-05 12:14:59,879] Trial 27 finished with value: 0.5507185135473022 and parameters: {'model_name': 'SimpleImputer', 'strategy': 'most_frequent'}. Best is trial 0 with value: 0.2771312869322611.
running
running
[I 2024-09-05 12:15:00,175] Trial 41 finished with value: 0.2771312869322611 and parameters: {'model_name': 'SimpleImputer', 'strategy': 'mean'}. Best is trial 0 with value: 0.2771312869322611.
[I 2024-09-05 12:15:00,274] Trial 32 finished with value: 0.5507185135473022 and parameters: {'model_name': 'SimpleImputer', 'strategy': 'most_frequent'}. Best is trial 0 with value: 0.2771312869322611.
[I 2024-09-05 12:15:00,368] Trial 44 finished with value: 0.2771312869322611 and parameters: {'model_name': 'SimpleImputer', 'strategy': 'mean'}. Best is trial 0 with value: 0.2771312869322611.
running
running
running
[I 2024-09-05 12:15:00,489] Trial 45 finished with value: 0.2771312869322611 and parameters: {'model_name': 'SimpleImputer', 'strategy': 'mean'}. Best is trial 0 with value: 0.2771312869322611.
[I 2024-09-05 12:15:00,570] Trial 42 finished with value: 0.2771312869322611 and parameters: {'model_name': 'SimpleImputer', 'strategy': 'mean'}. Best is trial 0 with value: 0.2771312869322611.
running
running
[I 2024-09-05 12:15:00,700] Trial 43 finished with value: 0.2771312869322611 and parameters: {'model_name': 'SimpleImputer', 'strategy': 'mean'}. Best is trial 0 with value: 0.2771312869322611.
[I 2024-09-05 12:15:00,801] Trial 33 finished with value: 0.5507185135473022 and parameters: {'model_name': 'SimpleImputer', 'strategy': 'most_frequent'}. Best is trial 0 with value: 0.2771312869322611.
[I 2024-09-05 12:15:00,812] Trial 50 finished with value: 0.2771312869322611 and parameters: {'model_name': 'SimpleImputer', 'strategy': 'mean'}. Best is trial 0 with value: 0.2771312869322611.
running
running
running
[I 2024-09-05 12:15:01,100] Trial 46 finished with value: 0.2771312869322611 and parameters: {'model_name': 'SimpleImputer', 'strategy': 'mean'}. Best is trial 0 with value: 0.2771312869322611.
[I 2024-09-05 12:15:01,108] Trial 51 finished with value: 0.2771312869322611 and parameters: {'model_name': 'SimpleImputer', 'strategy': 'mean'}. Best is trial 0 with value: 0.2771312869322611.
running
[I 2024-09-05 12:15:01,202] Trial 48 finished with value: 0.2771312869322611 and parameters: {'model_name': 'SimpleImputer', 'strategy': 'mean'}. Best is trial 0 with value: 0.2771312869322611.
running
running
[I 2024-09-05 12:15:01,440] Trial 52 finished with value: 0.2771312869322611 and parameters: {'model_name': 'SimpleImputer', 'strategy': 'mean'}. Best is trial 0 with value: 0.2771312869322611.
[I 2024-09-05 12:15:01,574] Trial 35 finished with value: 0.5507185135473022 and parameters: {'model_name': 'SimpleImputer', 'strategy': 'most_frequent'}. Best is trial 0 with value: 0.2771312869322611.
running
[I 2024-09-05 12:15:01,685] Trial 34 finished with value: 0.5507185135473022 and parameters: {'model_name': 'SimpleImputer', 'strategy': 'most_frequent'}. Best is trial 0 with value: 0.2771312869322611.
running
running
[I 2024-09-05 12:15:01,822] Trial 49 finished with value: 0.2771312869322611 and parameters: {'model_name': 'SimpleImputer', 'strategy': 'mean'}. Best is trial 0 with value: 0.2771312869322611.
[I 2024-09-05 12:15:01,908] Trial 47 finished with value: 0.2771312869322611 and parameters: {'model_name': 'SimpleImputer', 'strategy': 'mean'}. Best is trial 0 with value: 0.2771312869322611.
[I 2024-09-05 12:15:02,005] Trial 55 finished with value: 0.2771312869322611 and parameters: {'model_name': 'SimpleImputer', 'strategy': 'mean'}. Best is trial 0 with value: 0.2771312869322611.
running
[I 2024-09-05 12:15:02,121] Trial 56 finished with value: 0.2771312869322611 and parameters: {'model_name': 'SimpleImputer', 'strategy': 'mean'}. Best is trial 0 with value: 0.2771312869322611.
[I 2024-09-05 12:15:02,215] Trial 60 finished with value: 0.2771312869322611 and parameters: {'model_name': 'SimpleImputer', 'strategy': 'mean'}. Best is trial 0 with value: 0.2771312869322611.
running
[I 2024-09-05 12:15:02,337] Trial 54 finished with value: 0.2771312869322611 and parameters: {'model_name': 'SimpleImputer', 'strategy': 'mean'}. Best is trial 0 with value: 0.2771312869322611.
running
running
running
running
[I 2024-09-05 12:15:02,507] Trial 59 finished with value: 0.2771312869322611 and parameters: {'model_name': 'SimpleImputer', 'strategy': 'mean'}. Best is trial 0 with value: 0.2771312869322611.
[I 2024-09-05 12:15:02,625] Trial 53 finished with value: 0.2771312869322611 and parameters: {'model_name': 'SimpleImputer', 'strategy': 'mean'}. Best is trial 0 with value: 0.2771312869322611.
running
[I 2024-09-05 12:15:02,742] Trial 61 finished with value: 0.5507185135473022 and parameters: {'model_name': 'SimpleImputer', 'strategy': 'constant'}. Best is trial 0 with value: 0.2771312869322611.
running
[I 2024-09-05 12:15:02,837] Trial 62 finished with value: 0.5507185135473022 and parameters: {'model_name': 'SimpleImputer', 'strategy': 'constant'}. Best is trial 0 with value: 0.2771312869322611.
running
[I 2024-09-05 12:15:02,942] Trial 64 finished with value: 0.5507185135473022 and parameters: {'model_name': 'SimpleImputer', 'strategy': 'constant'}. Best is trial 0 with value: 0.2771312869322611.
running
running
[I 2024-09-05 12:15:03,052] Trial 66 finished with value: 0.5507185135473022 and parameters: {'model_name': 'SimpleImputer', 'strategy': 'constant'}. Best is trial 0 with value: 0.2771312869322611.
[I 2024-09-05 12:15:03,160] Trial 57 finished with value: 0.2771312869322611 and parameters: {'model_name': 'SimpleImputer', 'strategy': 'mean'}. Best is trial 0 with value: 0.2771312869322611.
running
[I 2024-09-05 12:15:03,288] Trial 72 finished with value: 0.5507185135473022 and parameters: {'model_name': 'SimpleImputer', 'strategy': 'constant'}. Best is trial 0 with value: 0.2771312869322611.
running
[I 2024-09-05 12:15:03,395] Trial 63 finished with value: 0.5507185135473022 and parameters: {'model_name': 'SimpleImputer', 'strategy': 'constant'}. Best is trial 0 with value: 0.2771312869322611.
[I 2024-09-05 12:15:03,481] Trial 58 finished with value: 0.2771312869322611 and parameters: {'model_name': 'SimpleImputer', 'strategy': 'mean'}. Best is trial 0 with value: 0.2771312869322611.
running
running
running
[I 2024-09-05 12:15:03,611] Trial 70 finished with value: 0.5507185135473022 and parameters: {'model_name': 'SimpleImputer', 'strategy': 'constant'}. Best is trial 0 with value: 0.2771312869322611.
running
[I 2024-09-05 12:15:03,745] Trial 71 finished with value: 0.5507185135473022 and parameters: {'model_name': 'SimpleImputer', 'strategy': 'constant'}. Best is trial 0 with value: 0.2771312869322611.
[I 2024-09-05 12:15:03,842] Trial 67 finished with value: 0.5507185135473022 and parameters: {'model_name': 'SimpleImputer', 'strategy': 'constant'}. Best is trial 0 with value: 0.2771312869322611.
[I 2024-09-05 12:15:03,926] Trial 65 finished with value: 0.5507185135473022 and parameters: {'model_name': 'SimpleImputer', 'strategy': 'constant'}. Best is trial 0 with value: 0.2771312869322611.
running
running
running
[I 2024-09-05 12:15:04,035] Trial 74 finished with value: 0.5507185135473022 and parameters: {'model_name': 'SimpleImputer', 'strategy': 'constant'}. Best is trial 0 with value: 0.2771312869322611.
[I 2024-09-05 12:15:04,129] Trial 68 finished with value: 0.5507185135473022 and parameters: {'model_name': 'SimpleImputer', 'strategy': 'constant'}. Best is trial 0 with value: 0.2771312869322611.
running
running
[I 2024-09-05 12:15:04,286] Trial 73 finished with value: 0.5507185135473022 and parameters: {'model_name': 'SimpleImputer', 'strategy': 'constant'}. Best is trial 0 with value: 0.2771312869322611.
running
[I 2024-09-05 12:15:04,400] Trial 78 finished with value: 0.2771312869322611 and parameters: {'model_name': 'SimpleImputer', 'strategy': 'mean'}. Best is trial 0 with value: 0.2771312869322611.
[I 2024-09-05 12:15:04,496] Trial 69 finished with value: 0.5507185135473022 and parameters: {'model_name': 'SimpleImputer', 'strategy': 'constant'}. Best is trial 0 with value: 0.2771312869322611.
running
running
[I 2024-09-05 12:15:04,655] Trial 75 finished with value: 0.2771312869322611 and parameters: {'model_name': 'SimpleImputer', 'strategy': 'mean'}. Best is trial 0 with value: 0.2771312869322611.
[I 2024-09-05 12:15:04,759] Trial 77 finished with value: 0.2771312869322611 and parameters: {'model_name': 'SimpleImputer', 'strategy': 'mean'}. Best is trial 0 with value: 0.2771312869322611.
running
running
[I 2024-09-05 12:15:04,898] Trial 76 finished with value: 0.2771312869322611 and parameters: {'model_name': 'SimpleImputer', 'strategy': 'mean'}. Best is trial 0 with value: 0.2771312869322611.
running
[I 2024-09-05 12:15:05,153] Trial 81 finished with value: 0.278267254414952 and parameters: {'model_name': 'SimpleImputer', 'strategy': 'median'}. Best is trial 0 with value: 0.2771312869322611.
running
[I 2024-09-05 12:15:05,298] Trial 85 finished with value: 0.278267254414952 and parameters: {'model_name': 'SimpleImputer', 'strategy': 'median'}. Best is trial 0 with value: 0.2771312869322611.
running
[I 2024-09-05 12:15:05,408] Trial 82 finished with value: 0.278267254414952 and parameters: {'model_name': 'SimpleImputer', 'strategy': 'median'}. Best is trial 0 with value: 0.2771312869322611.
[I 2024-09-05 12:15:05,501] Trial 83 finished with value: 0.278267254414952 and parameters: {'model_name': 'SimpleImputer', 'strategy': 'median'}. Best is trial 0 with value: 0.2771312869322611.
running
[I 2024-09-05 12:15:05,631] Trial 87 finished with value: 0.278267254414952 and parameters: {'model_name': 'SimpleImputer', 'strategy': 'median'}. Best is trial 0 with value: 0.2771312869322611.
[I 2024-09-05 12:15:05,739] Trial 86 finished with value: 0.278267254414952 and parameters: {'model_name': 'SimpleImputer', 'strategy': 'median'}. Best is trial 0 with value: 0.2771312869322611.
running
running
running
[I 2024-09-05 12:15:05,887] Trial 79 finished with value: 0.278267254414952 and parameters: {'model_name': 'SimpleImputer', 'strategy': 'median'}. Best is trial 0 with value: 0.2771312869322611.
running
[I 2024-09-05 12:15:06,012] Trial 89 finished with value: 0.278267254414952 and parameters: {'model_name': 'SimpleImputer', 'strategy': 'median'}. Best is trial 0 with value: 0.2771312869322611.
[I 2024-09-05 12:15:06,129] Trial 88 finished with value: 0.278267254414952 and parameters: {'model_name': 'SimpleImputer', 'strategy': 'median'}. Best is trial 0 with value: 0.2771312869322611.
running
[I 2024-09-05 12:15:06,232] Trial 84 finished with value: 0.278267254414952 and parameters: {'model_name': 'SimpleImputer', 'strategy': 'median'}. Best is trial 0 with value: 0.2771312869322611.
running
[I 2024-09-05 12:15:06,339] Trial 80 finished with value: 0.278267254414952 and parameters: {'model_name': 'SimpleImputer', 'strategy': 'median'}. Best is trial 0 with value: 0.2771312869322611.
[I 2024-09-05 12:15:06,441] Trial 91 finished with value: 0.278267254414952 and parameters: {'model_name': 'SimpleImputer', 'strategy': 'median'}. Best is trial 0 with value: 0.2771312869322611.
running
running
running
[I 2024-09-05 12:15:06,600] Trial 90 finished with value: 0.278267254414952 and parameters: {'model_name': 'SimpleImputer', 'strategy': 'median'}. Best is trial 0 with value: 0.2771312869322611.
running
[I 2024-09-05 12:15:06,743] Trial 95 finished with value: 0.2771312869322611 and parameters: {'model_name': 'SimpleImputer', 'strategy': 'mean'}. Best is trial 0 with value: 0.2771312869322611.
[I 2024-09-05 12:15:06,843] Trial 94 finished with value: 0.278267254414952 and parameters: {'model_name': 'SimpleImputer', 'strategy': 'median'}. Best is trial 0 with value: 0.2771312869322611.
running
running
[I 2024-09-05 12:15:06,972] Trial 97 finished with value: 0.2771312869322611 and parameters: {'model_name': 'SimpleImputer', 'strategy': 'mean'}. Best is trial 0 with value: 0.2771312869322611.
[I 2024-09-05 12:15:07,069] Trial 96 finished with value: 0.2771312869322611 and parameters: {'model_name': 'SimpleImputer', 'strategy': 'mean'}. Best is trial 0 with value: 0.2771312869322611.
running
running
[I 2024-09-05 12:15:07,229] Trial 92 finished with value: 0.278267254414952 and parameters: {'model_name': 'SimpleImputer', 'strategy': 'median'}. Best is trial 0 with value: 0.2771312869322611.
[I 2024-09-05 12:15:07,322] Trial 99 finished with value: 0.2771312869322611 and parameters: {'model_name': 'SimpleImputer', 'strategy': 'mean'}. Best is trial 0 with value: 0.2771312869322611.
[I 2024-09-05 12:15:07,426] Trial 98 finished with value: 0.2771312869322611 and parameters: {'model_name': 'SimpleImputer', 'strategy': 'mean'}. Best is trial 0 with value: 0.2771312869322611.
running
running
[I 2024-09-05 12:15:07,574] Trial 93 finished with value: 0.278267254414952 and parameters: {'model_name': 'SimpleImputer', 'strategy': 'median'}. Best is trial 0 with value: 0.2771312869322611.
running
running
[I 2024-09-05 12:15:07,696] Trial 100 finished with value: 0.2771312869322611 and parameters: {'model_name': 'SimpleImputer', 'strategy': 'mean'}. Best is trial 0 with value: 0.2771312869322611.
running
[I 2024-09-05 12:15:07,852] Trial 101 finished with value: 0.2771312869322611 and parameters: {'model_name': 'SimpleImputer', 'strategy': 'mean'}. Best is trial 0 with value: 0.2771312869322611.
[I 2024-09-05 12:15:07,952] Trial 103 finished with value: 0.2771312869322611 and parameters: {'model_name': 'SimpleImputer', 'strategy': 'mean'}. Best is trial 0 with value: 0.2771312869322611.
[I 2024-09-05 12:15:08,044] Trial 102 finished with value: 0.2771312869322611 and parameters: {'model_name': 'SimpleImputer', 'strategy': 'mean'}. Best is trial 0 with value: 0.2771312869322611.
running
running
