Run: 5
/cm/local/apps/slurm/var/spool/job1012830/slurm_script: line 26: 
pip install -e tpot2
pip install -r tpot2/ImputerExperiments/requirements_.txt
: No such file or directory
RunStart
Version 0.1.7a0 of tpot2 is outdated. Version 0.1.8a0 was released Tuesday September 17, 2024.
starting loops
../data/r/1213/1213.pkl
working on 
../data/r/1213/reg_full_MAR_0.01_1
1.8919503688812256
running experiment 1/3 - Does large hyperparameter space improve reconstruction accuracy over simple
[I 2024-10-23 18:31:03,919] A new study created in memory with name: no-name-f1a7b278-b286-4fd9-9ee0-4555b769f926
running
running
running
running
running
running
running
running
running
running
running
running
running
running
running
running
[I 2024-10-23 18:31:05,592] Trial 14 finished with value: 0.6361381121501279 and parameters: {'model_name': 'SimpleImputer', 'strategy': 'constant'}. Best is trial 14 with value: 0.6361381121501279.
running
[I 2024-10-23 18:31:30,230] Trial 16 finished with value: 0.35617599266564814 and parameters: {'model_name': 'VAE', 'batch_size': 11, 'iterations': 1, 'learning_rate': 0.01603316930444983, 'p_miss': 0.16643878082565516}. Best is trial 16 with value: 0.35617599266564814.
running
[I 2024-10-23 18:31:36,576] Trial 5 finished with value: 0.32686956098788766 and parameters: {'model_name': 'VAE', 'batch_size': 87, 'iterations': 2, 'learning_rate': 0.022323578804051208, 'p_miss': 0.0378407161384987}. Best is trial 5 with value: 0.32686956098788766.
running
[I 2024-10-23 18:31:38,640] Trial 18 finished with value: 0.4608914952406651 and parameters: {'model_name': 'SimpleImputer', 'strategy': 'most_frequent'}. Best is trial 5 with value: 0.32686956098788766.
running
[I 2024-10-23 18:31:55,287] Trial 11 finished with value: 0.6103369663739894 and parameters: {'model_name': 'GAIN', 'batch_size': 42, 'hint_rate': 0.280930585037954, 'alpha': 64, 'iterations': 27, 'learning_rate': 0.0015017499553042614, 'p_miss': 0.16345235404487565}. Best is trial 5 with value: 0.32686956098788766.
running
[I 2024-10-23 18:32:06,972] Trial 4 finished with value: 0.3035950014902241 and parameters: {'model_name': 'IterativeImputer', 'estimator': 'Ridge', 'initial_strategy': 'most_frequent', 'n_nearest_features': 4, 'imputation_order': 'random'}. Best is trial 4 with value: 0.3035950014902241.
running
[I 2024-10-23 18:32:41,356] Trial 7 finished with value: 0.3231376947694023 and parameters: {'model_name': 'IterativeImputer', 'estimator': 'KNN', 'initial_strategy': 'median', 'n_nearest_features': 3, 'imputation_order': 'ascending'}. Best is trial 4 with value: 0.3035950014902241.
running
[I 2024-10-23 18:32:41,684] Trial 3 finished with value: 0.32577881387470004 and parameters: {'model_name': 'IterativeImputer', 'estimator': 'KNN', 'initial_strategy': 'most_frequent', 'n_nearest_features': 3, 'imputation_order': 'ascending'}. Best is trial 4 with value: 0.3035950014902241.
running
[I 2024-10-23 18:32:48,387] Trial 1 finished with value: 0.3144253477084866 and parameters: {'model_name': 'KNNImputer', 'n_neighbors': 46654, 'weights': 'uniform'}. Best is trial 4 with value: 0.3035950014902241.
running
[I 2024-10-23 18:32:48,841] Trial 12 finished with value: 0.314095649868873 and parameters: {'model_name': 'KNNImputer', 'n_neighbors': 44370, 'weights': 'uniform'}. Best is trial 4 with value: 0.3035950014902241.
running
[I 2024-10-23 18:32:51,022] Trial 6 finished with value: 0.3137138958131562 and parameters: {'model_name': 'KNNImputer', 'n_neighbors': 41956, 'weights': 'uniform'}. Best is trial 4 with value: 0.3035950014902241.
running
[I 2024-10-23 18:32:55,239] Trial 2 finished with value: 0.30328448839643973 and parameters: {'model_name': 'IterativeImputer', 'estimator': 'Bayesian', 'initial_strategy': 'most_frequent', 'n_nearest_features': 9, 'imputation_order': 'arabic', 'sample_posterior': False}. Best is trial 2 with value: 0.30328448839643973.
running
[I 2024-10-23 18:32:55,647] Trial 24 finished with value: 0.6247897728497158 and parameters: {'model_name': 'GAIN', 'batch_size': 5, 'hint_rate': 0.5772916012368939, 'alpha': 77, 'iterations': 1, 'learning_rate': 0.009349298958043583, 'p_miss': 0.06441218318113247}. Best is trial 2 with value: 0.30328448839643973.
running
[I 2024-10-23 18:33:00,684] Trial 17 finished with value: 0.3148390555349402 and parameters: {'model_name': 'KNNImputer', 'n_neighbors': 58370, 'weights': 'uniform'}. Best is trial 2 with value: 0.30328448839643973.
running
[I 2024-10-23 18:33:10,751] Trial 13 finished with value: inf and parameters: {'model_name': 'GAIN', 'batch_size': 1, 'hint_rate': 0.19072061424077272, 'alpha': 10, 'iterations': 617, 'learning_rate': 0.032699043268743525, 'p_miss': 0.13274969290040542}. Best is trial 2 with value: 0.30328448839643973.
running
[I 2024-10-23 18:33:26,900] Trial 19 finished with value: 0.3136420107876909 and parameters: {'model_name': 'KNNImputer', 'n_neighbors': 41514, 'weights': 'uniform'}. Best is trial 2 with value: 0.30328448839643973.
running
[I 2024-10-23 18:33:42,469] Trial 25 finished with value: 0.3032719156997737 and parameters: {'model_name': 'IterativeImputer', 'estimator': 'Ridge', 'initial_strategy': 'most_frequent', 'n_nearest_features': 10, 'imputation_order': 'random'}. Best is trial 25 with value: 0.3032719156997737.
running
[I 2024-10-23 18:33:48,629] Trial 26 finished with value: 0.3032720364991282 and parameters: {'model_name': 'IterativeImputer', 'estimator': 'Ridge', 'initial_strategy': 'most_frequent', 'n_nearest_features': 9, 'imputation_order': 'random'}. Best is trial 25 with value: 0.3032719156997737.
running
[I 2024-10-23 18:34:16,025] Trial 20 finished with value: 0.31152965109478237 and parameters: {'model_name': 'KNNImputer', 'n_neighbors': 36782, 'weights': 'distance'}. Best is trial 25 with value: 0.3032719156997737.
running
[I 2024-10-23 18:34:28,991] Trial 22 finished with value: 0.3106902957301062 and parameters: {'model_name': 'KNNImputer', 'n_neighbors': 20149, 'weights': 'uniform'}. Best is trial 25 with value: 0.3032719156997737.
running
[I 2024-10-23 18:34:40,245] Trial 33 finished with value: 0.30327185042844984 and parameters: {'model_name': 'IterativeImputer', 'estimator': 'Ridge', 'initial_strategy': 'mean', 'n_nearest_features': 10, 'imputation_order': 'random'}. Best is trial 33 with value: 0.30327185042844984.
running
[I 2024-10-23 18:34:57,299] Trial 27 finished with value: 0.30328448839643973 and parameters: {'model_name': 'IterativeImputer', 'estimator': 'Bayesian', 'initial_strategy': 'most_frequent', 'n_nearest_features': 10, 'imputation_order': 'arabic', 'sample_posterior': False}. Best is trial 33 with value: 0.30327185042844984.
running
[I 2024-10-23 18:34:57,584] Trial 23 finished with value: 0.31064004478665064 and parameters: {'model_name': 'KNNImputer', 'n_neighbors': 28849, 'weights': 'distance'}. Best is trial 33 with value: 0.30327185042844984.
running
[I 2024-10-23 18:35:06,144] Trial 29 finished with value: 0.30328448839643973 and parameters: {'model_name': 'IterativeImputer', 'estimator': 'Bayesian', 'initial_strategy': 'most_frequent', 'n_nearest_features': 10, 'imputation_order': 'arabic', 'sample_posterior': False}. Best is trial 33 with value: 0.30327185042844984.
running
[I 2024-10-23 18:35:11,740] Trial 28 finished with value: 0.30328450477743163 and parameters: {'model_name': 'IterativeImputer', 'estimator': 'Bayesian', 'initial_strategy': 'most_frequent', 'n_nearest_features': 10, 'imputation_order': 'random', 'sample_posterior': False}. Best is trial 33 with value: 0.30327185042844984.
running
[I 2024-10-23 18:35:15,570] Trial 34 finished with value: 0.3032721061511461 and parameters: {'model_name': 'IterativeImputer', 'estimator': 'Ridge', 'initial_strategy': 'constant', 'n_nearest_features': 10, 'imputation_order': 'random'}. Best is trial 33 with value: 0.30327185042844984.
running
[I 2024-10-23 18:35:23,657] Trial 35 finished with value: 0.30327185042844984 and parameters: {'model_name': 'IterativeImputer', 'estimator': 'Ridge', 'initial_strategy': 'mean', 'n_nearest_features': 10, 'imputation_order': 'random'}. Best is trial 33 with value: 0.30327185042844984.
running
[I 2024-10-23 18:35:31,722] Trial 30 finished with value: 0.3032846294092187 and parameters: {'model_name': 'IterativeImputer', 'estimator': 'Bayesian', 'initial_strategy': 'most_frequent', 'n_nearest_features': 9, 'imputation_order': 'random', 'sample_posterior': False}. Best is trial 33 with value: 0.30327185042844984.
running
[I 2024-10-23 18:35:32,378] Trial 36 finished with value: 0.30327185042844984 and parameters: {'model_name': 'IterativeImputer', 'estimator': 'Ridge', 'initial_strategy': 'mean', 'n_nearest_features': 10, 'imputation_order': 'random'}. Best is trial 33 with value: 0.30327185042844984.
running
[I 2024-10-23 18:35:36,259] Trial 21 finished with value: 0.43599075879253235 and parameters: {'model_name': 'IterativeImputer', 'estimator': 'Bayesian', 'initial_strategy': 'most_frequent', 'n_nearest_features': 5, 'imputation_order': 'descending', 'sample_posterior': True}. Best is trial 33 with value: 0.30327185042844984.
running
[I 2024-10-23 18:35:36,567] Trial 31 finished with value: 0.30328450477743163 and parameters: {'model_name': 'IterativeImputer', 'estimator': 'Bayesian', 'initial_strategy': 'most_frequent', 'n_nearest_features': 10, 'imputation_order': 'random', 'sample_posterior': False}. Best is trial 33 with value: 0.30327185042844984.
running
[I 2024-10-23 18:35:37,324] Trial 32 finished with value: 0.30328448839643973 and parameters: {'model_name': 'IterativeImputer', 'estimator': 'Bayesian', 'initial_strategy': 'most_frequent', 'n_nearest_features': 10, 'imputation_order': 'arabic', 'sample_posterior': False}. Best is trial 33 with value: 0.30327185042844984.
running
[I 2024-10-23 18:35:37,659] Trial 45 finished with value: 0.3148390555349402 and parameters: {'model_name': 'SimpleImputer', 'strategy': 'mean'}. Best is trial 33 with value: 0.30327185042844984.
running
[I 2024-10-23 18:36:00,557] Trial 15 finished with value: 0.3504562181016765 and parameters: {'model_name': 'VAE', 'batch_size': 123, 'iterations': 122, 'learning_rate': 0.00016814057845035635, 'p_miss': 0.09713941789066413}. Best is trial 33 with value: 0.30327185042844984.
running
[I 2024-10-23 18:36:02,080] Trial 37 finished with value: 0.3032948159507205 and parameters: {'model_name': 'IterativeImputer', 'estimator': 'Ridge', 'initial_strategy': 'mean', 'n_nearest_features': 8, 'imputation_order': 'random'}. Best is trial 33 with value: 0.30327185042844984.
running
[I 2024-10-23 18:36:05,092] Trial 39 finished with value: 0.3032873561950374 and parameters: {'model_name': 'IterativeImputer', 'estimator': 'Ridge', 'initial_strategy': 'mean', 'n_nearest_features': 7, 'imputation_order': 'random'}. Best is trial 33 with value: 0.30327185042844984.
running
[I 2024-10-23 18:36:06,321] Trial 38 finished with value: 0.3032948159507205 and parameters: {'model_name': 'IterativeImputer', 'estimator': 'Ridge', 'initial_strategy': 'mean', 'n_nearest_features': 8, 'imputation_order': 'random'}. Best is trial 33 with value: 0.30327185042844984.
running
[I 2024-10-23 18:36:08,195] Trial 40 finished with value: 0.3032873561950374 and parameters: {'model_name': 'IterativeImputer', 'estimator': 'Ridge', 'initial_strategy': 'mean', 'n_nearest_features': 7, 'imputation_order': 'random'}. Best is trial 33 with value: 0.30327185042844984.
running
[I 2024-10-23 18:36:09,849] Trial 41 finished with value: 0.3032873561950374 and parameters: {'model_name': 'IterativeImputer', 'estimator': 'Ridge', 'initial_strategy': 'mean', 'n_nearest_features': 7, 'imputation_order': 'random'}. Best is trial 33 with value: 0.30327185042844984.
running
[I 2024-10-23 18:36:14,613] Trial 42 finished with value: 0.30330768770968136 and parameters: {'model_name': 'IterativeImputer', 'estimator': 'Ridge', 'initial_strategy': 'mean', 'n_nearest_features': 7, 'imputation_order': 'descending'}. Best is trial 33 with value: 0.30327185042844984.
running
[I 2024-10-23 18:36:20,653] Trial 46 finished with value: 0.3032825743461392 and parameters: {'model_name': 'IterativeImputer', 'estimator': 'Ridge', 'initial_strategy': 'mean', 'n_nearest_features': 7, 'imputation_order': 'roman'}. Best is trial 33 with value: 0.30327185042844984.
running
[I 2024-10-23 18:36:22,214] Trial 48 finished with value: 0.3032825743461392 and parameters: {'model_name': 'IterativeImputer', 'estimator': 'Ridge', 'initial_strategy': 'mean', 'n_nearest_features': 7, 'imputation_order': 'roman'}. Best is trial 33 with value: 0.30327185042844984.
running
[I 2024-10-23 18:36:42,443] Trial 49 finished with value: 0.3032825743461392 and parameters: {'model_name': 'IterativeImputer', 'estimator': 'Ridge', 'initial_strategy': 'mean', 'n_nearest_features': 7, 'imputation_order': 'roman'}. Best is trial 33 with value: 0.30327185042844984.
running
[I 2024-10-23 19:03:02,120] Trial 0 finished with value: inf and parameters: {'model_name': 'GAIN', 'batch_size': 1, 'hint_rate': 0.8698547825267714, 'alpha': 57, 'iterations': 9835, 'learning_rate': 0.01822481954364735, 'p_miss': 0.01730681692224971}. Best is trial 33 with value: 0.30327185042844984.
running
[I 2024-10-23 19:22:14,265] Trial 8 finished with value: 0.6020168276600552 and parameters: {'model_name': 'GAIN', 'batch_size': 6, 'hint_rate': 0.7864583760103567, 'alpha': 19, 'iterations': 2856, 'learning_rate': 0.0003399667955274841, 'p_miss': 0.23874788595662494}. Best is trial 33 with value: 0.30327185042844984.
running
[I 2024-10-23 19:23:52,349] Trial 60 finished with value: 0.3475989872932593 and parameters: {'model_name': 'VAE', 'batch_size': 720, 'iterations': 16, 'learning_rate': 0.0015226151681098671, 'p_miss': 0.2846127779023047}. Best is trial 33 with value: 0.30327185042844984.
running
[I 2024-10-23 19:36:37,739] Trial 10 finished with value: 0.6363027319644159 and parameters: {'model_name': 'GAIN', 'batch_size': 46, 'hint_rate': 0.18179020028897658, 'alpha': 16, 'iterations': 3536, 'learning_rate': 0.014820446900781369, 'p_miss': 0.10681182874276379}. Best is trial 33 with value: 0.30327185042844984.
running
[I 2024-10-23 19:42:14,888] Trial 55 finished with value: 0.31990933593021553 and parameters: {'model_name': 'VAE', 'batch_size': 382, 'iterations': 1526, 'learning_rate': 0.00012587925159865558, 'p_miss': 0.2984163931973398}. Best is trial 33 with value: 0.30327185042844984.
running
[I 2024-10-23 20:39:53,527] Trial 9 finished with value: 0.34761346192556786 and parameters: {'model_name': 'IterativeImputer', 'estimator': 'RFR', 'initial_strategy': 'median', 'n_nearest_features': 1, 'imputation_order': 'ascending'}. Best is trial 33 with value: 0.30327185042844984.
running
[I 2024-10-23 21:24:02,905] Trial 47 finished with value: 0.3195128840281838 and parameters: {'model_name': 'VAE', 'batch_size': 583, 'iterations': 3477, 'learning_rate': 0.00027983094416930444, 'p_miss': 0.2764704598482416}. Best is trial 33 with value: 0.30327185042844984.
running
[I 2024-10-23 21:24:04,060] Trial 65 finished with value: 0.3510572467533807 and parameters: {'model_name': 'SimpleImputer', 'strategy': 'median'}. Best is trial 33 with value: 0.30327185042844984.
running
[I 2024-10-23 21:24:41,708] Trial 66 finished with value: 0.30327190475863214 and parameters: {'model_name': 'IterativeImputer', 'estimator': 'Ridge', 'initial_strategy': 'constant', 'n_nearest_features': 9, 'imputation_order': 'random'}. Best is trial 33 with value: 0.30327185042844984.
running
[I 2024-10-23 21:25:19,966] Trial 67 finished with value: 0.30327190475863214 and parameters: {'model_name': 'IterativeImputer', 'estimator': 'Ridge', 'initial_strategy': 'constant', 'n_nearest_features': 9, 'imputation_order': 'random'}. Best is trial 33 with value: 0.30327185042844984.
running
[I 2024-10-23 21:29:36,947] Trial 61 finished with value: 0.36252134405218406 and parameters: {'model_name': 'IterativeImputer', 'estimator': 'RFR', 'initial_strategy': 'median', 'n_nearest_features': 1, 'imputation_order': 'random'}. Best is trial 33 with value: 0.30327185042844984.
running
[I 2024-10-23 21:30:09,416] Trial 69 finished with value: 0.30327190475863214 and parameters: {'model_name': 'IterativeImputer', 'estimator': 'Ridge', 'initial_strategy': 'constant', 'n_nearest_features': 9, 'imputation_order': 'random'}. Best is trial 33 with value: 0.30327185042844984.
running
[I 2024-10-23 21:30:41,449] Trial 70 finished with value: 0.30327190475863214 and parameters: {'model_name': 'IterativeImputer', 'estimator': 'Ridge', 'initial_strategy': 'constant', 'n_nearest_features': 9, 'imputation_order': 'random'}. Best is trial 33 with value: 0.30327185042844984.
running
[I 2024-10-23 21:32:51,812] Trial 71 finished with value: 0.5946909162337817 and parameters: {'model_name': 'GAIN', 'batch_size': 3, 'hint_rate': 0.504296954822125, 'alpha': 100, 'iterations': 158, 'learning_rate': 0.004097461356417424, 'p_miss': 0.21707239744553164}. Best is trial 33 with value: 0.30327185042844984.
running
[I 2024-10-23 21:33:25,054] Trial 72 finished with value: 0.30327190475863214 and parameters: {'model_name': 'IterativeImputer', 'estimator': 'Ridge', 'initial_strategy': 'constant', 'n_nearest_features': 9, 'imputation_order': 'random'}. Best is trial 33 with value: 0.30327185042844984.
running
[I 2024-10-23 21:34:06,212] Trial 73 finished with value: 0.3033068346613347 and parameters: {'model_name': 'IterativeImputer', 'estimator': 'Ridge', 'initial_strategy': 'constant', 'n_nearest_features': 8, 'imputation_order': 'random'}. Best is trial 33 with value: 0.30327185042844984.
running
[I 2024-10-23 21:35:38,521] Trial 74 finished with value: 0.3294597381669667 and parameters: {'model_name': 'IterativeImputer', 'estimator': 'KNN', 'initial_strategy': 'constant', 'n_nearest_features': 9, 'imputation_order': 'random'}. Best is trial 33 with value: 0.30327185042844984.
running
[I 2024-10-23 21:35:39,392] Trial 75 finished with value: 0.3510572467533807 and parameters: {'model_name': 'SimpleImputer', 'strategy': 'median'}. Best is trial 33 with value: 0.30327185042844984.
running
[I 2024-10-23 21:36:09,971] Trial 76 finished with value: 0.30327190475863214 and parameters: {'model_name': 'IterativeImputer', 'estimator': 'Ridge', 'initial_strategy': 'constant', 'n_nearest_features': 9, 'imputation_order': 'random'}. Best is trial 33 with value: 0.30327185042844984.
running
[I 2024-10-23 21:36:41,771] Trial 77 finished with value: 0.30327190475863214 and parameters: {'model_name': 'IterativeImputer', 'estimator': 'Ridge', 'initial_strategy': 'constant', 'n_nearest_features': 9, 'imputation_order': 'random'}. Best is trial 33 with value: 0.30327185042844984.
running
[I 2024-10-23 21:37:12,275] Trial 78 finished with value: 0.30327190475863214 and parameters: {'model_name': 'IterativeImputer', 'estimator': 'Ridge', 'initial_strategy': 'constant', 'n_nearest_features': 9, 'imputation_order': 'random'}. Best is trial 33 with value: 0.30327185042844984.
running
[I 2024-10-23 21:37:51,245] Trial 79 finished with value: 0.30328981859372517 and parameters: {'model_name': 'IterativeImputer', 'estimator': 'Ridge', 'initial_strategy': 'constant', 'n_nearest_features': 8, 'imputation_order': 'ascending'}. Best is trial 33 with value: 0.30327185042844984.
running
[I 2024-10-23 21:47:19,302] Trial 57 finished with value: 0.319557149176412 and parameters: {'model_name': 'VAE', 'batch_size': 670, 'iterations': 4294, 'learning_rate': 0.00011300646711179412, 'p_miss': 0.2911751324792061}. Best is trial 33 with value: 0.30327185042844984.
running
[I 2024-10-23 21:47:26,752] Trial 81 finished with value: 0.6141335421337942 and parameters: {'model_name': 'GAIN', 'batch_size': 175, 'hint_rate': 0.01227924679067477, 'alpha': 32, 'iterations': 5, 'learning_rate': 0.09070575271715378, 'p_miss': 0.19816476302202668}. Best is trial 33 with value: 0.30327185042844984.
running
[I 2024-10-23 21:51:08,737] Trial 58 finished with value: 0.3187536802588507 and parameters: {'model_name': 'VAE', 'batch_size': 761, 'iterations': 4472, 'learning_rate': 0.00012255016603435927, 'p_miss': 0.266807749970986}. Best is trial 33 with value: 0.30327185042844984.
running
[I 2024-10-23 21:54:09,408] Trial 59 finished with value: 0.3189171147697823 and parameters: {'model_name': 'VAE', 'batch_size': 866, 'iterations': 3145, 'learning_rate': 0.00010578023695233948, 'p_miss': 0.2942573179853711}. Best is trial 33 with value: 0.30327185042844984.
running
[I 2024-10-23 21:54:40,449] Trial 53 finished with value: 0.318244074829093 and parameters: {'model_name': 'VAE', 'batch_size': 653, 'iterations': 4504, 'learning_rate': 0.0001084374413955192, 'p_miss': 0.2987395092219515}. Best is trial 33 with value: 0.30327185042844984.
running
[I 2024-10-23 22:05:09,221] Trial 54 finished with value: 0.31939293324076307 and parameters: {'model_name': 'VAE', 'batch_size': 813, 'iterations': 5564, 'learning_rate': 0.00010400501015761499, 'p_miss': 0.2802385083147503}. Best is trial 33 with value: 0.30327185042844984.
running
[I 2024-10-23 22:05:21,041] Trial 86 finished with value: 0.30327190475863214 and parameters: {'model_name': 'IterativeImputer', 'estimator': 'Ridge', 'initial_strategy': 'constant', 'n_nearest_features': 9, 'imputation_order': 'random'}. Best is trial 33 with value: 0.30327185042844984.
running
[I 2024-10-23 22:05:31,446] Trial 87 finished with value: 0.3032721061511461 and parameters: {'model_name': 'IterativeImputer', 'estimator': 'Ridge', 'initial_strategy': 'constant', 'n_nearest_features': 10, 'imputation_order': 'random'}. Best is trial 33 with value: 0.30327185042844984.
running
