[I 2024-10-23 11:58:27,128] Trial 196 finished with value: 0.22829013333538378 and parameters: {'model_name': 'SimpleImputer', 'strategy': 'mean'}. Best is trial 4 with value: 0.22829013333538378.
fit
simple fit
simple transform
0    0
1    0
2    0
3    0
4    0
5    0
6    0
7    0
dtype: int64
0    0
1    0
2    0
3    0
4    0
5    0
6    0
7    0
dtype: int64
0.22829013333538378
{'model_name': 'SimpleImputer', 'strategy': 'mean'}
running experiment 2/3 - Does reconstruction give good automl predictions
Start est fit
Version 0.1.7a0 of tpot2 is outdated. Version 0.1.8a0 was released Tuesday September 17, 2024.
Version 0.1.7a0 of tpot2 is outdated. Version 0.1.8a0 was released Tuesday September 17, 2024.
Version 0.1.7a0 of tpot2 is outdated. Version 0.1.8a0 was released Tuesday September 17, 2024.
Version 0.1.7a0 of tpot2 is outdated. Version 0.1.8a0 was released Tuesday September 17, 2024.
Version 0.1.7a0 of tpot2 is outdated. Version 0.1.8a0 was released Tuesday September 17, 2024.
Version 0.1.7a0 of tpot2 is outdated. Version 0.1.8a0 was released Tuesday September 17, 2024.
Version 0.1.7a0 of tpot2 is outdated. Version 0.1.8a0 was released Tuesday September 17, 2024.
Version 0.1.7a0 of tpot2 is outdated. Version 0.1.8a0 was released Tuesday September 17, 2024.
Version 0.1.7a0 of tpot2 is outdated. Version 0.1.8a0 was released Tuesday September 17, 2024.
Version 0.1.7a0 of tpot2 is outdated. Version 0.1.8a0 was released Tuesday September 17, 2024.
Version 0.1.7a0 of tpot2 is outdated. Version 0.1.8a0 was released Tuesday September 17, 2024.
Version 0.1.7a0 of tpot2 is outdated. Version 0.1.8a0 was released Tuesday September 17, 2024.
Version 0.1.7a0 of tpot2 is outdated. Version 0.1.8a0 was released Tuesday September 17, 2024.
Version 0.1.7a0 of tpot2 is outdated. Version 0.1.8a0 was released Tuesday September 17, 2024.
Version 0.1.7a0 of tpot2 is outdated. Version 0.1.8a0 was released Tuesday September 17, 2024.
Version 0.1.7a0 of tpot2 is outdated. Version 0.1.8a0 was released Tuesday September 17, 2024.
  0%|          | 0/25 [00:00<?, ?it/s]Generation:   0%|          | 0/25 [00:00<?, ?it/s]Generation:  1
Best f1_score score: 0.8724630005874807
Generation:   4%|▍         | 1/25 [00:25<10:01, 25.08s/it]Generation:  2
Best f1_score score: 0.8724630005874807
Generation:   8%|▊         | 2/25 [01:17<15:52, 41.41s/it]Generation:  3
Best f1_score score: 0.8733651936670492
Generation:  12%|█▏        | 3/25 [05:12<47:28, 129.46s/it]Generation:  4
Best f1_score score: 0.873481884050778
Generation:  16%|█▌        | 4/25 [05:46<32:13, 92.07s/it] Generation:  5
Best f1_score score: 0.8743937258614368
Generation:  20%|██        | 5/25 [06:58<28:16, 84.80s/it]Generation:  6
Best f1_score score: 0.8747850623211955
Generation:  24%|██▍       | 6/25 [07:34<21:30, 67.93s/it]Generation:  7
Best f1_score score: 0.8747850623211955
Generation:  28%|██▊       | 7/25 [15:02<57:44, 192.46s/it]Generation:  8
Best f1_score score: 0.8747850623211955
Generation:  32%|███▏      | 8/25 [15:35<40:05, 141.50s/it]Generation:  9
Best f1_score score: 0.8747850623211955
Generation:  36%|███▌      | 9/25 [15:58<27:50, 104.42s/it]Generation:  10
Best f1_score score: 0.8747850623211955
Generation:  40%|████      | 10/25 [17:52<26:51, 107.46s/it]Generation:  11
Best f1_score score: 0.8748899725953831
Generation:  44%|████▍     | 11/25 [18:19<19:21, 82.97s/it] Generation:  12
Best f1_score score: 0.8748899725953831
Generation:  48%|████▊     | 12/25 [18:44<14:07, 65.17s/it]Generation:  13
Best f1_score score: 0.8748899725953831
Generation:  52%|█████▏    | 13/25 [19:08<10:33, 52.76s/it]Generation:  14
Best f1_score score: 0.8748899725953831
Generation:  56%|█████▌    | 14/25 [19:34<08:10, 44.55s/it]Generation:  15
Best f1_score score: 0.8748899725953831
Generation:  60%|██████    | 15/25 [19:56<06:18, 37.81s/it]Generation:  16
Best f1_score score: 0.8761393088678169
Generation:  64%|██████▍   | 16/25 [20:24<05:15, 35.01s/it]Generation:  17
Best f1_score score: 0.8761393088678169
Generation:  68%|██████▊   | 17/25 [20:54<04:26, 33.35s/it]Generation:  18
Best f1_score score: 0.8761393088678169
Generation:  72%|███████▏  | 18/25 [21:21<03:40, 31.46s/it]Generation:  19
Best f1_score score: 0.8761393088678169
Generation:  76%|███████▌  | 19/25 [21:54<03:11, 31.85s/it]Generation:  20
Best f1_score score: 0.8761393088678169
Generation:  80%|████████  | 20/25 [22:30<02:45, 33.18s/it]Generation:  21
Best f1_score score: 0.8761393088678169
Generation:  84%|████████▍ | 21/25 [31:37<12:29, 187.40s/it]Generation:  22
Best f1_score score: 0.8761393088678169
Generation:  88%|████████▊ | 22/25 [32:42<07:31, 150.61s/it]Generation:  23
Best f1_score score: 0.8761393088678169
Generation:  92%|█████████▏| 23/25 [33:16<03:51, 115.86s/it]Generation:  24
Best f1_score score: 0.8761393088678169
Generation:  96%|█████████▌| 24/25 [35:40<02:04, 124.07s/it]Generation:  25
Best f1_score score: 0.8761393088678169
Generation: 100%|██████████| 25/25 [38:40<00:00, 140.93s/it]Generation: 100%|██████████| 25/25 [38:43<00:00, 92.95s/it] 
2024-10-23 12:37:16,990 - distributed.scheduler - ERROR - Removing worker 'tcp://127.0.0.1:43883' caused the cluster to lose scattered data, which can't be recovered: {'ndarray-422b2c53f5e51e71a00dd009dc06b86a', 'ndarray-a197283df6368a610ff12edfa8f4ce77'} (stimulus_id='handle-worker-cleanup-1729712236.9904034')
Fitted
Pipeline(steps=[('histgradientboostingclassifier',
                 HistGradientBoostingClassifier(early_stopping=False,
                                                l2_regularization=1.516968e-07,
                                                learning_rate=0.019275292171,
                                                max_features=0.5224399606773,
                                                max_leaf_nodes=447,
                                                min_samples_leaf=51, tol=0.0001,
                                                validation_fraction=None))])
score start
train score: {'auroc': 0.9724478700083005, 'accuracy': 0.90157179917595, 'balanced_accuracy': 0.8886409633285801, 'logloss': 0.2665927294758439, 'f1': 0.8956424706801263}
original test score: {'auroc': 0.9886297222832086, 'accuracy': 0.9450884685784015, 'balanced_accuracy': 0.9390861413724114, 'logloss': 0.1985713632357483, 'f1': 0.9425116683658676}
imputed test score: {'auroc': 0.9442324521393871, 'accuracy': 0.8962782184258694, 'balanced_accuracy': 0.8866992179648533, 'logloss': 0.2892586814834567, 'f1': 0.8909898278560251}
score end
check intended
EXP2 Finished
running experiment 3/3 - What is the best automl settings?
<tpot2.search_spaces.pipelines.sequential.SequentialPipeline object at 0x15543504f9d0>
Start tpot fit
Version 0.1.7a0 of tpot2 is outdated. Version 0.1.8a0 was released Tuesday September 17, 2024.
Version 0.1.7a0 of tpot2 is outdated. Version 0.1.8a0 was released Tuesday September 17, 2024.
Version 0.1.7a0 of tpot2 is outdated. Version 0.1.8a0 was released Tuesday September 17, 2024.
Version 0.1.7a0 of tpot2 is outdated. Version 0.1.8a0 was released Tuesday September 17, 2024.
Version 0.1.7a0 of tpot2 is outdated. Version 0.1.8a0 was released Tuesday September 17, 2024.
Version 0.1.7a0 of tpot2 is outdated. Version 0.1.8a0 was released Tuesday September 17, 2024.
Version 0.1.7a0 of tpot2 is outdated. Version 0.1.8a0 was released Tuesday September 17, 2024.
Version 0.1.7a0 of tpot2 is outdated. Version 0.1.8a0 was released Tuesday September 17, 2024.
Version 0.1.7a0 of tpot2 is outdated. Version 0.1.8a0 was released Tuesday September 17, 2024.
Version 0.1.7a0 of tpot2 is outdated. Version 0.1.8a0 was released Tuesday September 17, 2024.
Version 0.1.7a0 of tpot2 is outdated. Version 0.1.8a0 was released Tuesday September 17, 2024.
Version 0.1.7a0 of tpot2 is outdated. Version 0.1.8a0 was released Tuesday September 17, 2024.
Version 0.1.7a0 of tpot2 is outdated. Version 0.1.8a0 was released Tuesday September 17, 2024.
Version 0.1.7a0 of tpot2 is outdated. Version 0.1.8a0 was released Tuesday September 17, 2024.
Version 0.1.7a0 of tpot2 is outdated. Version 0.1.8a0 was released Tuesday September 17, 2024.
Version 0.1.7a0 of tpot2 is outdated. Version 0.1.8a0 was released Tuesday September 17, 2024.
  0%|          | 0/25 [00:00<?, ?it/s]Generation:   0%|          | 0/25 [00:00<?, ?it/s]Generation:  1
Best f1_score score: 0.8752815377920852
Generation:   4%|▍         | 1/25 [00:16<06:41, 16.71s/it]Generation:  2
Best f1_score score: 0.8752815377920852
Generation:   8%|▊         | 2/25 [00:27<05:03, 13.21s/it]Generation:  3
Best f1_score score: 0.8752815377920852
Generation:  12%|█▏        | 3/25 [00:39<04:35, 12.53s/it]Generation:  4
Best f1_score score: 0.8752815377920852
Generation:  16%|█▌        | 4/25 [02:19<16:32, 47.27s/it]Generation:  5
Best f1_score score: 0.8779466285556969
Generation:  20%|██        | 5/25 [02:31<11:28, 34.44s/it]Generation:  6
Best f1_score score: 0.8779466285556969
Generation:  24%|██▍       | 6/25 [02:40<08:12, 25.93s/it]Generation:  7
Best f1_score score: 0.8779466285556969
Generation:  28%|██▊       | 7/25 [02:45<05:39, 18.85s/it]WARNING THIS INDIVIDUAL CAUSED AND EXCEPTION 
 <tpot2.search_spaces.pipelines.sequential.SequentialPipelineIndividual object at 0x155474220ca0> 
 Unsupported set of arguments: The combination of penalty='l1' and loss='hinge' is not supported, Parameters: penalty='l1', loss='hinge', dual=True 
 Traceback (most recent call last):
  File "/common/ketrong/tpotexp/tpot2/tpot2/utils/eval_utils.py", line 53, in objective_nan_wrapper
    value = func_timeout.func_timeout(timeout, objective_function, args=[individual], kwargs=objective_kwargs)
  File "/common/ketrong/tpotexp/env/lib/python3.10/site-packages/func_timeout/dafunc.py", line 108, in func_timeout
    raise_exception(exception)
  File "/common/ketrong/tpotexp/env/lib/python3.10/site-packages/func_timeout/py3_raise.py", line 7, in raise_exception
    raise exception[0] from None
  File "/common/ketrong/tpotexp/tpot2/tpot2/tpot_estimator/estimator.py", line 623, in objective_function
    return objective_function_generator(
  File "/common/ketrong/tpotexp/tpot2/tpot2/tpot_estimator/estimator_utils.py", line 55, in objective_function_generator
    cv_obj_scores = cross_val_score_objective(sklearn.base.clone(pipeline),x,y,scorers=scorers, cv=cv , fold=step)
  File "/common/ketrong/tpotexp/tpot2/tpot2/tpot_estimator/cross_val_utils.py", line 28, in cross_val_score_objective
    this_fold_pipeline.fit(X_train,y_train)
  File "/common/ketrong/tpotexp/env/lib/python3.10/site-packages/sklearn/base.py", line 1473, in wrapper
    return fit_method(estimator, *args, **kwargs)
  File "/common/ketrong/tpotexp/env/lib/python3.10/site-packages/sklearn/pipeline.py", line 473, in fit
    self._final_estimator.fit(Xt, y, **last_step_params["fit"])
  File "/common/ketrong/tpotexp/env/lib/python3.10/site-packages/sklearn/base.py", line 1473, in wrapper
    return fit_method(estimator, *args, **kwargs)
  File "/common/ketrong/tpotexp/env/lib/python3.10/site-packages/sklearn/svm/_classes.py", line 317, in fit
    self.coef_, self.intercept_, n_iter_ = _fit_liblinear(
  File "/common/ketrong/tpotexp/env/lib/python3.10/site-packages/sklearn/svm/_base.py", line 1214, in _fit_liblinear
    solver_type = _get_liblinear_solver_type(multi_class, penalty, loss, dual)
  File "/common/ketrong/tpotexp/env/lib/python3.10/site-packages/sklearn/svm/_base.py", line 1046, in _get_liblinear_solver_type
    raise ValueError(
ValueError: Unsupported set of arguments: The combination of penalty='l1' and loss='hinge' is not supported, Parameters: penalty='l1', loss='hinge', dual=True

Generation:  8
Best f1_score score: 0.8779466285556969
Generation:  32%|███▏      | 8/25 [02:59<04:55, 17.38s/it]Generation:  9
Best f1_score score: 0.8779466285556969
Generation:  36%|███▌      | 9/25 [03:04<03:38, 13.68s/it]Generation:  10
Best f1_score score: 0.8779466285556969
Generation:  40%|████      | 10/25 [03:09<02:42, 10.82s/it]Generation:  11
Best f1_score score: 0.8779641184051912
Generation:  44%|████▍     | 11/25 [03:15<02:10,  9.32s/it]Generation:  12
Best f1_score score: 0.8779641184051912
Generation:  48%|████▊     | 12/25 [03:19<01:42,  7.92s/it]Generation:  13
Best f1_score score: 0.8779641184051912
Generation:  52%|█████▏    | 13/25 [03:36<02:06, 10.55s/it]Generation:  14
Best f1_score score: 0.8787258709144409
Generation:  56%|█████▌    | 14/25 [03:41<01:35,  8.72s/it]Generation:  15
Best f1_score score: 0.8787258709144409
Generation:  60%|██████    | 15/25 [03:54<01:40, 10.06s/it]Generation:  16
Best f1_score score: 0.8787258709144409
Generation:  64%|██████▍   | 16/25 [04:07<01:40, 11.12s/it]Generation:  17
Best f1_score score: 0.8787258709144409
Generation:  68%|██████▊   | 17/25 [04:31<02:00, 15.01s/it]Generation:  18
Best f1_score score: 0.8787258709144409
Generation:  72%|███████▏  | 18/25 [04:37<01:25, 12.24s/it]Generation:  19
Best f1_score score: 0.8787258709144409
Generation:  76%|███████▌  | 19/25 [04:57<01:27, 14.66s/it]Generation:  20
Best f1_score score: 0.8787258709144409
Generation:  80%|████████  | 20/25 [05:30<01:40, 20.10s/it]Generation:  21
Best f1_score score: 0.8787258709144409
Generation:  84%|████████▍ | 21/25 [05:44<01:12, 18.14s/it]Generation:  22
Best f1_score score: 0.8787258709144409
Generation:  88%|████████▊ | 22/25 [05:54<00:47, 15.76s/it]Generation:  23
Best f1_score score: 0.8787258709144409
Generation:  92%|█████████▏| 23/25 [05:58<00:24, 12.12s/it]Generation:  24
Best f1_score score: 0.8787258709144409
Generation:  96%|█████████▌| 24/25 [06:17<00:14, 14.24s/it]Generation:  25
Best f1_score score: 0.8787258709144409
Generation: 100%|██████████| 25/25 [15:52<00:00, 182.52s/it]Generation: 100%|██████████| 25/25 [15:52<00:00, 38.10s/it] 
2024-10-23 12:53:17,290 - distributed.scheduler - ERROR - Removing worker 'tcp://127.0.0.1:43525' caused the cluster to lose scattered data, which can't be recovered: {'ndarray-422b2c53f5e51e71a00dd009dc06b86a', 'DataFrame-b109b21976fcfdf9556195b75bf48ebb'} (stimulus_id='handle-worker-cleanup-1729713197.2904263')
Fitted
Pipeline(steps=[('simpleimputer', SimpleImputer(strategy='median')),
                ('linearsvc', LinearSVC(C=6.8432636192119, loss='hinge'))])
transform worked
try transform
transform worked
score start
failed on 
../data/c/725/class_simple_MAR_0.3_1
local variable 'this_auroc_score' referenced before assignment
Traceback (most recent call last):
  File "/common/ketrong/tpotexp/tpot2/ImputerExperiments/Locally_run_code/utils.py", line 679, in loop_through_tasks
    train_score = score(tpot_space, X_train_M, y_train, r_or_c=r_or_c)
  File "/common/ketrong/tpotexp/tpot2/ImputerExperiments/Locally_run_code/utils.py", line 50, in score
    return { "auroc": this_auroc_score,
UnboundLocalError: local variable 'this_auroc_score' referenced before assignment

full run takes
0.923101561135716
hours
DONE
