Run: 15
/cm/local/apps/slurm/var/spool/job1014624/slurm_script: line 26: 
pip install -e tpot2
pip install -r tpot2/ImputerExperiments/requirements_.txt
: No such file or directory
RunStart
Version 0.1.7a0 of tpot2 is outdated. Version 0.1.8a0 was released Tuesday September 17, 2024.
starting loops
../data/c/728/728.pkl
working on 
../data/c/728/class_simple_MCAR_0.3_1
0.3172879219055176
running experiment 1/3 - Does large hyperparameter space improve reconstruction accuracy over simple
[I 2024-10-24 14:35:02,123] A new study created in memory with name: no-name-ee7fbf10-d335-403e-ab96-400a93c4fa93
running
running
running
running
running
running
running
running
running
running
running
running
[I 2024-10-24 14:35:02,246] Trial 1 finished with value: 0.4021300326473399 and parameters: {'model_name': 'SimpleImputer', 'strategy': 'constant'}. Best is trial 1 with value: 0.4021300326473399.
running
running
running
running
[I 2024-10-24 14:35:02,424] Trial 0 finished with value: 0.4021300326473399 and parameters: {'model_name': 'SimpleImputer', 'strategy': 'constant'}. Best is trial 1 with value: 0.4021300326473399.
running
running
[I 2024-10-24 14:35:02,600] Trial 3 finished with value: 0.2998466920089524 and parameters: {'model_name': 'SimpleImputer', 'strategy': 'mean'}. Best is trial 3 with value: 0.2998466920089524.
running
[I 2024-10-24 14:35:02,741] Trial 6 finished with value: 0.2998466920089524 and parameters: {'model_name': 'SimpleImputer', 'strategy': 'mean'}. Best is trial 3 with value: 0.2998466920089524.
[I 2024-10-24 14:35:02,824] Trial 11 finished with value: 0.2998466920089524 and parameters: {'model_name': 'SimpleImputer', 'strategy': 'mean'}. Best is trial 3 with value: 0.2998466920089524.
[I 2024-10-24 14:35:02,900] Trial 8 finished with value: 0.2998466920089524 and parameters: {'model_name': 'SimpleImputer', 'strategy': 'mean'}. Best is trial 3 with value: 0.2998466920089524.
running
running
[I 2024-10-24 14:35:03,032] Trial 5 finished with value: 0.2998466920089524 and parameters: {'model_name': 'SimpleImputer', 'strategy': 'mean'}. Best is trial 3 with value: 0.2998466920089524.
running
[I 2024-10-24 14:35:03,144] Trial 7 finished with value: 0.4021300326473399 and parameters: {'model_name': 'SimpleImputer', 'strategy': 'constant'}. Best is trial 3 with value: 0.2998466920089524.
running
[I 2024-10-24 14:35:03,263] Trial 14 finished with value: 0.4021300326473399 and parameters: {'model_name': 'SimpleImputer', 'strategy': 'constant'}. Best is trial 3 with value: 0.2998466920089524.
running
[I 2024-10-24 14:35:03,348] Trial 2 finished with value: 0.36837579137603005 and parameters: {'model_name': 'SimpleImputer', 'strategy': 'median'}. Best is trial 3 with value: 0.2998466920089524.
[I 2024-10-24 14:35:03,438] Trial 10 finished with value: 0.36837579137603005 and parameters: {'model_name': 'SimpleImputer', 'strategy': 'median'}. Best is trial 3 with value: 0.2998466920089524.
[I 2024-10-24 14:35:03,531] Trial 12 finished with value: 0.4021300326473399 and parameters: {'model_name': 'SimpleImputer', 'strategy': 'constant'}. Best is trial 3 with value: 0.2998466920089524.
running
running
[I 2024-10-24 14:35:03,618] Trial 13 finished with value: 0.2998466920089524 and parameters: {'model_name': 'SimpleImputer', 'strategy': 'mean'}. Best is trial 3 with value: 0.2998466920089524.
running
running
[I 2024-10-24 14:35:03,736] Trial 16 finished with value: 0.4021300326473399 and parameters: {'model_name': 'SimpleImputer', 'strategy': 'constant'}. Best is trial 3 with value: 0.2998466920089524.
running
running
[I 2024-10-24 14:35:03,892] Trial 4 finished with value: 0.4021300326473399 and parameters: {'model_name': 'SimpleImputer', 'strategy': 'most_frequent'}. Best is trial 3 with value: 0.2998466920089524.
running
[I 2024-10-24 14:35:04,067] Trial 18 finished with value: 0.2998466920089524 and parameters: {'model_name': 'SimpleImputer', 'strategy': 'mean'}. Best is trial 3 with value: 0.2998466920089524.
running
[I 2024-10-24 14:35:04,201] Trial 22 finished with value: 0.2998466920089524 and parameters: {'model_name': 'SimpleImputer', 'strategy': 'mean'}. Best is trial 3 with value: 0.2998466920089524.
running
[I 2024-10-24 14:35:04,344] Trial 9 finished with value: 0.36837579137603005 and parameters: {'model_name': 'SimpleImputer', 'strategy': 'median'}. Best is trial 3 with value: 0.2998466920089524.
running
[I 2024-10-24 14:35:04,519] Trial 17 finished with value: 0.36837579137603005 and parameters: {'model_name': 'SimpleImputer', 'strategy': 'median'}. Best is trial 3 with value: 0.2998466920089524.
running
[I 2024-10-24 14:35:04,831] Trial 15 finished with value: 0.4021300326473399 and parameters: {'model_name': 'SimpleImputer', 'strategy': 'most_frequent'}. Best is trial 3 with value: 0.2998466920089524.
[I 2024-10-24 14:35:04,941] Trial 20 finished with value: 0.4021300326473399 and parameters: {'model_name': 'SimpleImputer', 'strategy': 'most_frequent'}. Best is trial 3 with value: 0.2998466920089524.
[I 2024-10-24 14:35:05,047] Trial 30 finished with value: 0.2998466920089524 and parameters: {'model_name': 'SimpleImputer', 'strategy': 'mean'}. Best is trial 3 with value: 0.2998466920089524.
running
[I 2024-10-24 14:35:05,055] Trial 19 finished with value: 0.4021300326473399 and parameters: {'model_name': 'SimpleImputer', 'strategy': 'most_frequent'}. Best is trial 3 with value: 0.2998466920089524.
running
running
running
[I 2024-10-24 14:35:05,301] Trial 26 finished with value: 0.4021300326473399 and parameters: {'model_name': 'SimpleImputer', 'strategy': 'most_frequent'}. Best is trial 3 with value: 0.2998466920089524.
[I 2024-10-24 14:35:05,412] Trial 23 finished with value: 0.36837579137603005 and parameters: {'model_name': 'SimpleImputer', 'strategy': 'median'}. Best is trial 3 with value: 0.2998466920089524.
[I 2024-10-24 14:35:05,500] Trial 25 finished with value: 0.4021300326473399 and parameters: {'model_name': 'SimpleImputer', 'strategy': 'most_frequent'}. Best is trial 3 with value: 0.2998466920089524.
running
running
[I 2024-10-24 14:35:05,516] Trial 27 finished with value: 0.4021300326473399 and parameters: {'model_name': 'SimpleImputer', 'strategy': 'most_frequent'}. Best is trial 3 with value: 0.2998466920089524.
[I 2024-10-24 14:35:05,683] Trial 21 finished with value: 0.4021300326473399 and parameters: {'model_name': 'SimpleImputer', 'strategy': 'most_frequent'}. Best is trial 3 with value: 0.2998466920089524.
running
running
running
[I 2024-10-24 14:35:05,836] Trial 35 finished with value: 0.2998466920089524 and parameters: {'model_name': 'SimpleImputer', 'strategy': 'mean'}. Best is trial 3 with value: 0.2998466920089524.
running
[I 2024-10-24 14:35:05,989] Trial 24 finished with value: 0.4021300326473399 and parameters: {'model_name': 'SimpleImputer', 'strategy': 'most_frequent'}. Best is trial 3 with value: 0.2998466920089524.
running
[I 2024-10-24 14:35:06,180] Trial 29 finished with value: 0.4021300326473399 and parameters: {'model_name': 'SimpleImputer', 'strategy': 'most_frequent'}. Best is trial 3 with value: 0.2998466920089524.
[I 2024-10-24 14:35:06,273] Trial 38 finished with value: 0.2998466920089524 and parameters: {'model_name': 'SimpleImputer', 'strategy': 'mean'}. Best is trial 3 with value: 0.2998466920089524.
[I 2024-10-24 14:35:06,350] Trial 28 finished with value: 0.4021300326473399 and parameters: {'model_name': 'SimpleImputer', 'strategy': 'most_frequent'}. Best is trial 3 with value: 0.2998466920089524.
[I 2024-10-24 14:35:06,435] Trial 37 finished with value: 0.2998466920089524 and parameters: {'model_name': 'SimpleImputer', 'strategy': 'mean'}. Best is trial 3 with value: 0.2998466920089524.
running
[I 2024-10-24 14:35:06,542] Trial 33 finished with value: 0.4021300326473399 and parameters: {'model_name': 'SimpleImputer', 'strategy': 'most_frequent'}. Best is trial 3 with value: 0.2998466920089524.
running
[I 2024-10-24 14:35:06,633] Trial 36 finished with value: 0.2998466920089524 and parameters: {'model_name': 'SimpleImputer', 'strategy': 'mean'}. Best is trial 3 with value: 0.2998466920089524.
running
[I 2024-10-24 14:35:06,715] Trial 41 finished with value: 0.2998466920089524 and parameters: {'model_name': 'SimpleImputer', 'strategy': 'mean'}. Best is trial 3 with value: 0.2998466920089524.
running
running
running
running
[I 2024-10-24 14:35:06,852] Trial 32 finished with value: 0.4021300326473399 and parameters: {'model_name': 'SimpleImputer', 'strategy': 'most_frequent'}. Best is trial 3 with value: 0.2998466920089524.
[I 2024-10-24 14:35:06,941] Trial 39 finished with value: 0.2998466920089524 and parameters: {'model_name': 'SimpleImputer', 'strategy': 'mean'}. Best is trial 3 with value: 0.2998466920089524.
[I 2024-10-24 14:35:07,017] Trial 34 finished with value: 0.4021300326473399 and parameters: {'model_name': 'SimpleImputer', 'strategy': 'most_frequent'}. Best is trial 3 with value: 0.2998466920089524.
[I 2024-10-24 14:35:07,097] Trial 44 finished with value: 0.2998466920089524 and parameters: {'model_name': 'SimpleImputer', 'strategy': 'mean'}. Best is trial 3 with value: 0.2998466920089524.
running
[I 2024-10-24 14:35:07,193] Trial 40 finished with value: 0.2998466920089524 and parameters: {'model_name': 'SimpleImputer', 'strategy': 'mean'}. Best is trial 3 with value: 0.2998466920089524.
running
[I 2024-10-24 14:35:07,281] Trial 31 finished with value: 0.4021300326473399 and parameters: {'model_name': 'SimpleImputer', 'strategy': 'most_frequent'}. Best is trial 3 with value: 0.2998466920089524.
running
running
[I 2024-10-24 14:35:07,381] Trial 45 finished with value: 0.2998466920089524 and parameters: {'model_name': 'SimpleImputer', 'strategy': 'mean'}. Best is trial 3 with value: 0.2998466920089524.
running
running
running
[I 2024-10-24 14:35:07,560] Trial 43 finished with value: 0.2998466920089524 and parameters: {'model_name': 'SimpleImputer', 'strategy': 'mean'}. Best is trial 3 with value: 0.2998466920089524.
running
[I 2024-10-24 14:35:07,671] Trial 42 finished with value: 0.2998466920089524 and parameters: {'model_name': 'SimpleImputer', 'strategy': 'mean'}. Best is trial 3 with value: 0.2998466920089524.
[I 2024-10-24 14:35:07,796] Trial 50 finished with value: 0.2998466920089524 and parameters: {'model_name': 'SimpleImputer', 'strategy': 'mean'}. Best is trial 3 with value: 0.2998466920089524.
running
[I 2024-10-24 14:35:07,906] Trial 46 finished with value: 0.2998466920089524 and parameters: {'model_name': 'SimpleImputer', 'strategy': 'mean'}. Best is trial 3 with value: 0.2998466920089524.
[I 2024-10-24 14:35:07,985] Trial 49 finished with value: 0.2998466920089524 and parameters: {'model_name': 'SimpleImputer', 'strategy': 'mean'}. Best is trial 3 with value: 0.2998466920089524.
[I 2024-10-24 14:35:08,074] Trial 51 finished with value: 0.2998466920089524 and parameters: {'model_name': 'SimpleImputer', 'strategy': 'mean'}. Best is trial 3 with value: 0.2998466920089524.
running
[I 2024-10-24 14:35:08,154] Trial 52 finished with value: 0.2998466920089524 and parameters: {'model_name': 'SimpleImputer', 'strategy': 'mean'}. Best is trial 3 with value: 0.2998466920089524.
running
[I 2024-10-24 14:35:08,258] Trial 47 finished with value: 0.2998466920089524 and parameters: {'model_name': 'SimpleImputer', 'strategy': 'mean'}. Best is trial 3 with value: 0.2998466920089524.
running
running
[I 2024-10-24 14:35:08,376] Trial 56 finished with value: 0.2998466920089524 and parameters: {'model_name': 'SimpleImputer', 'strategy': 'mean'}. Best is trial 3 with value: 0.2998466920089524.
running
[I 2024-10-24 14:35:08,482] Trial 54 finished with value: 0.2998466920089524 and parameters: {'model_name': 'SimpleImputer', 'strategy': 'mean'}. Best is trial 3 with value: 0.2998466920089524.
[I 2024-10-24 14:35:08,582] Trial 53 finished with value: 0.2998466920089524 and parameters: {'model_name': 'SimpleImputer', 'strategy': 'mean'}. Best is trial 3 with value: 0.2998466920089524.
running
[I 2024-10-24 14:35:08,685] Trial 57 finished with value: 0.2998466920089524 and parameters: {'model_name': 'SimpleImputer', 'strategy': 'mean'}. Best is trial 3 with value: 0.2998466920089524.
running
running
[I 2024-10-24 14:35:08,785] Trial 60 finished with value: 0.2998466920089524 and parameters: {'model_name': 'SimpleImputer', 'strategy': 'mean'}. Best is trial 3 with value: 0.2998466920089524.
[I 2024-10-24 14:35:08,865] Trial 61 finished with value: 0.4021300326473399 and parameters: {'model_name': 'SimpleImputer', 'strategy': 'constant'}. Best is trial 3 with value: 0.2998466920089524.
[I 2024-10-24 14:35:08,947] Trial 58 finished with value: 0.2998466920089524 and parameters: {'model_name': 'SimpleImputer', 'strategy': 'mean'}. Best is trial 3 with value: 0.2998466920089524.
[I 2024-10-24 14:35:09,032] Trial 48 finished with value: 0.2998466920089524 and parameters: {'model_name': 'SimpleImputer', 'strategy': 'mean'}. Best is trial 3 with value: 0.2998466920089524.
running
[I 2024-10-24 14:35:09,130] Trial 63 finished with value: 0.4021300326473399 and parameters: {'model_name': 'SimpleImputer', 'strategy': 'constant'}. Best is trial 3 with value: 0.2998466920089524.
[I 2024-10-24 14:35:09,215] Trial 55 finished with value: 0.2998466920089524 and parameters: {'model_name': 'SimpleImputer', 'strategy': 'mean'}. Best is trial 3 with value: 0.2998466920089524.
running
[I 2024-10-24 14:35:09,311] Trial 59 finished with value: 0.2998466920089524 and parameters: {'model_name': 'SimpleImputer', 'strategy': 'mean'}. Best is trial 3 with value: 0.2998466920089524.
running
running
running
running
running
running
[I 2024-10-24 14:35:09,468] Trial 68 finished with value: 0.4021300326473399 and parameters: {'model_name': 'SimpleImputer', 'strategy': 'constant'}. Best is trial 3 with value: 0.2998466920089524.
[I 2024-10-24 14:35:09,575] Trial 64 finished with value: 0.4021300326473399 and parameters: {'model_name': 'SimpleImputer', 'strategy': 'constant'}. Best is trial 3 with value: 0.2998466920089524.
[I 2024-10-24 14:35:09,658] Trial 66 finished with value: 0.4021300326473399 and parameters: {'model_name': 'SimpleImputer', 'strategy': 'constant'}. Best is trial 3 with value: 0.2998466920089524.
running
[I 2024-10-24 14:35:09,800] Trial 62 finished with value: 0.4021300326473399 and parameters: {'model_name': 'SimpleImputer', 'strategy': 'constant'}. Best is trial 3 with value: 0.2998466920089524.
running
running
running
[I 2024-10-24 14:35:09,919] Trial 67 finished with value: 0.4021300326473399 and parameters: {'model_name': 'SimpleImputer', 'strategy': 'constant'}. Best is trial 3 with value: 0.2998466920089524.
running
[I 2024-10-24 14:35:10,067] Trial 65 finished with value: 0.4021300326473399 and parameters: {'model_name': 'SimpleImputer', 'strategy': 'constant'}. Best is trial 3 with value: 0.2998466920089524.
running
running
[I 2024-10-24 14:35:10,266] Trial 75 finished with value: 0.36837579137603005 and parameters: {'model_name': 'SimpleImputer', 'strategy': 'median'}. Best is trial 3 with value: 0.2998466920089524.
running
[I 2024-10-24 14:35:10,444] Trial 69 finished with value: 0.36837579137603005 and parameters: {'model_name': 'SimpleImputer', 'strategy': 'median'}. Best is trial 3 with value: 0.2998466920089524.
[I 2024-10-24 14:35:10,539] Trial 71 finished with value: 0.36837579137603005 and parameters: {'model_name': 'SimpleImputer', 'strategy': 'median'}. Best is trial 3 with value: 0.2998466920089524.
running
running
[I 2024-10-24 14:35:10,672] Trial 76 finished with value: 0.36837579137603005 and parameters: {'model_name': 'SimpleImputer', 'strategy': 'median'}. Best is trial 3 with value: 0.2998466920089524.
running
[I 2024-10-24 14:35:10,794] Trial 74 finished with value: 0.36837579137603005 and parameters: {'model_name': 'SimpleImputer', 'strategy': 'median'}. Best is trial 3 with value: 0.2998466920089524.
running
[I 2024-10-24 14:35:10,954] Trial 79 finished with value: 0.36837579137603005 and parameters: {'model_name': 'SimpleImputer', 'strategy': 'median'}. Best is trial 3 with value: 0.2998466920089524.
[I 2024-10-24 14:35:11,053] Trial 73 finished with value: 0.36837579137603005 and parameters: {'model_name': 'SimpleImputer', 'strategy': 'median'}. Best is trial 3 with value: 0.2998466920089524.
running
running
[I 2024-10-24 14:35:11,241] Trial 82 finished with value: 0.36837579137603005 and parameters: {'model_name': 'SimpleImputer', 'strategy': 'median'}. Best is trial 3 with value: 0.2998466920089524.
[I 2024-10-24 14:35:11,346] Trial 70 finished with value: 0.36837579137603005 and parameters: {'model_name': 'SimpleImputer', 'strategy': 'median'}. Best is trial 3 with value: 0.2998466920089524.
[I 2024-10-24 14:35:11,440] Trial 77 finished with value: 0.36837579137603005 and parameters: {'model_name': 'SimpleImputer', 'strategy': 'median'}. Best is trial 3 with value: 0.2998466920089524.
running
running
[I 2024-10-24 14:35:11,570] Trial 78 finished with value: 0.36837579137603005 and parameters: {'model_name': 'SimpleImputer', 'strategy': 'median'}. Best is trial 3 with value: 0.2998466920089524.
running
[I 2024-10-24 14:35:11,684] Trial 88 finished with value: 0.2998466920089524 and parameters: {'model_name': 'SimpleImputer', 'strategy': 'mean'}. Best is trial 3 with value: 0.2998466920089524.
[I 2024-10-24 14:35:11,787] Trial 72 finished with value: 0.36837579137603005 and parameters: {'model_name': 'SimpleImputer', 'strategy': 'median'}. Best is trial 3 with value: 0.2998466920089524.
running
[I 2024-10-24 14:35:11,898] Trial 89 finished with value: 0.2998466920089524 and parameters: {'model_name': 'SimpleImputer', 'strategy': 'mean'}. Best is trial 3 with value: 0.2998466920089524.
[I 2024-10-24 14:35:12,020] Trial 81 finished with value: 0.36837579137603005 and parameters: {'model_name': 'SimpleImputer', 'strategy': 'median'}. Best is trial 3 with value: 0.2998466920089524.
[I 2024-10-24 14:35:12,128] Trial 80 finished with value: 0.36837579137603005 and parameters: {'model_name': 'SimpleImputer', 'strategy': 'median'}. Best is trial 3 with value: 0.2998466920089524.
[I 2024-10-24 14:35:12,239] Trial 87 finished with value: 0.2998466920089524 and parameters: {'model_name': 'SimpleImputer', 'strategy': 'mean'}. Best is trial 3 with value: 0.2998466920089524.
running
[I 2024-10-24 14:35:12,386] Trial 83 finished with value: 0.36837579137603005 and parameters: {'model_name': 'SimpleImputer', 'strategy': 'median'}. Best is trial 3 with value: 0.2998466920089524.
running
running
[I 2024-10-24 14:35:12,525] Trial 85 finished with value: 0.36837579137603005 and parameters: {'model_name': 'SimpleImputer', 'strategy': 'median'}. Best is trial 3 with value: 0.2998466920089524.
running
running
[I 2024-10-24 14:35:12,539] Trial 91 finished with value: 0.2998466920089524 and parameters: {'model_name': 'SimpleImputer', 'strategy': 'mean'}. Best is trial 3 with value: 0.2998466920089524.
running
[I 2024-10-24 14:35:12,770] Trial 86 finished with value: 0.2998466920089524 and parameters: {'model_name': 'SimpleImputer', 'strategy': 'mean'}. Best is trial 3 with value: 0.2998466920089524.
[I 2024-10-24 14:35:12,863] Trial 84 finished with value: 0.36837579137603005 and parameters: {'model_name': 'SimpleImputer', 'strategy': 'median'}. Best is trial 3 with value: 0.2998466920089524.
[I 2024-10-24 14:35:12,958] Trial 90 finished with value: 0.2998466920089524 and parameters: {'model_name': 'SimpleImputer', 'strategy': 'mean'}. Best is trial 3 with value: 0.2998466920089524.
[I 2024-10-24 14:35:13,080] Trial 94 finished with value: 0.2998466920089524 and parameters: {'model_name': 'SimpleImputer', 'strategy': 'mean'}. Best is trial 3 with value: 0.2998466920089524.
[I 2024-10-24 14:35:13,188] Trial 92 finished with value: 0.2998466920089524 and parameters: {'model_name': 'SimpleImputer', 'strategy': 'mean'}. Best is trial 3 with value: 0.2998466920089524.
running
running
running
running
running
running
running
[I 2024-10-24 14:35:13,436] Trial 93 finished with value: 0.2998466920089524 and parameters: {'model_name': 'SimpleImputer', 'strategy': 'mean'}. Best is trial 3 with value: 0.2998466920089524.
running
running
[I 2024-10-24 14:35:13,576] Trial 100 finished with value: 0.2998466920089524 and parameters: {'model_name': 'SimpleImputer', 'strategy': 'mean'}. Best is trial 3 with value: 0.2998466920089524.
running
[I 2024-10-24 14:35:13,719] Trial 96 finished with value: 0.2998466920089524 and parameters: {'model_name': 'SimpleImputer', 'strategy': 'mean'}. Best is trial 3 with value: 0.2998466920089524.
[I 2024-10-24 14:35:13,816] Trial 98 finished with value: 0.2998466920089524 and parameters: {'model_name': 'SimpleImputer', 'strategy': 'mean'}. Best is trial 3 with value: 0.2998466920089524.
running
running
[I 2024-10-24 14:35:13,977] Trial 99 finished with value: 0.2998466920089524 and parameters: {'model_name': 'SimpleImputer', 'strategy': 'mean'}. Best is trial 3 with value: 0.2998466920089524.
[I 2024-10-24 14:35:14,078] Trial 95 finished with value: 0.2998466920089524 and parameters: {'model_name': 'SimpleImputer', 'strategy': 'mean'}. Best is trial 3 with value: 0.2998466920089524.
running
running
[I 2024-10-24 14:35:14,288] Trial 109 finished with value: 0.2998466920089524 and parameters: {'model_name': 'SimpleImputer', 'strategy': 'mean'}. Best is trial 3 with value: 0.2998466920089524.
running
[I 2024-10-24 14:35:14,453] Trial 102 finished with value: 0.2998466920089524 and parameters: {'model_name': 'SimpleImputer', 'strategy': 'mean'}. Best is trial 3 with value: 0.2998466920089524.
[I 2024-10-24 14:35:14,551] Trial 97 finished with value: 0.2998466920089524 and parameters: {'model_name': 'SimpleImputer', 'strategy': 'mean'}. Best is trial 3 with value: 0.2998466920089524.
[I 2024-10-24 14:35:14,656] Trial 105 finished with value: 0.2998466920089524 and parameters: {'model_name': 'SimpleImputer', 'strategy': 'mean'}. Best is trial 3 with value: 0.2998466920089524.
running
running
