Run: 70
/cm/local/apps/slurm/var/spool/job1012798/slurm_script: line 26: 
pip install -e tpot2
pip install -r tpot2/ImputerExperiments/requirements_.txt
: No such file or directory
RunStart
Version 0.1.7a0 of tpot2 is outdated. Version 0.1.8a0 was released Tuesday September 17, 2024.
starting loops
../data/c/725/725.pkl
working on 
../data/c/725/class_simple_MNAR_0.1_3
3.3325095176696777
running experiment 1/3 - Does large hyperparameter space improve reconstruction accuracy over simple
[I 2024-10-23 17:52:07,502] A new study created in memory with name: no-name-032a7df4-2cc9-463d-8dad-ec3ac0293c6e
running
running
running
running
running
running
running
running
running
running
running
running
running
running
running
running
[I 2024-10-23 17:52:07,822] Trial 10 finished with value: 0.48718920258567844 and parameters: {'model_name': 'SimpleImputer', 'strategy': 'constant'}. Best is trial 10 with value: 0.48718920258567844.
running
[I 2024-10-23 17:52:07,997] Trial 9 finished with value: 0.48718920258567844 and parameters: {'model_name': 'SimpleImputer', 'strategy': 'constant'}. Best is trial 10 with value: 0.48718920258567844.
running
[I 2024-10-23 17:52:08,130] Trial 5 finished with value: 0.24911941107400004 and parameters: {'model_name': 'SimpleImputer', 'strategy': 'mean'}. Best is trial 5 with value: 0.24911941107400004.
[I 2024-10-23 17:52:08,274] Trial 2 finished with value: 0.24911941107400004 and parameters: {'model_name': 'SimpleImputer', 'strategy': 'mean'}. Best is trial 5 with value: 0.24911941107400004.
running
[I 2024-10-23 17:52:08,414] Trial 14 finished with value: 0.48718920258567844 and parameters: {'model_name': 'SimpleImputer', 'strategy': 'constant'}. Best is trial 5 with value: 0.24911941107400004.
running
[I 2024-10-23 17:52:08,588] Trial 0 finished with value: 0.24911941107400004 and parameters: {'model_name': 'SimpleImputer', 'strategy': 'mean'}. Best is trial 5 with value: 0.24911941107400004.
running
[I 2024-10-23 17:52:08,721] Trial 7 finished with value: 0.24911941107400004 and parameters: {'model_name': 'SimpleImputer', 'strategy': 'mean'}. Best is trial 5 with value: 0.24911941107400004.
running
running
[I 2024-10-23 17:52:08,851] Trial 13 finished with value: 0.24911941107400004 and parameters: {'model_name': 'SimpleImputer', 'strategy': 'mean'}. Best is trial 5 with value: 0.24911941107400004.
running
[I 2024-10-23 17:52:09,005] Trial 15 finished with value: 0.24911941107400004 and parameters: {'model_name': 'SimpleImputer', 'strategy': 'mean'}. Best is trial 5 with value: 0.24911941107400004.
running
[I 2024-10-23 17:52:09,306] Trial 16 finished with value: 0.24911941107400004 and parameters: {'model_name': 'SimpleImputer', 'strategy': 'mean'}. Best is trial 5 with value: 0.24911941107400004.
running
[I 2024-10-23 17:52:09,452] Trial 4 finished with value: 0.2544554031932653 and parameters: {'model_name': 'SimpleImputer', 'strategy': 'median'}. Best is trial 5 with value: 0.24911941107400004.
running
[I 2024-10-23 17:52:09,568] Trial 18 finished with value: 0.48718920258567844 and parameters: {'model_name': 'SimpleImputer', 'strategy': 'constant'}. Best is trial 5 with value: 0.24911941107400004.
running
[I 2024-10-23 17:52:09,684] Trial 21 finished with value: 0.48718920258567844 and parameters: {'model_name': 'SimpleImputer', 'strategy': 'constant'}. Best is trial 5 with value: 0.24911941107400004.
running
[I 2024-10-23 17:52:09,832] Trial 3 finished with value: 0.2544554031932653 and parameters: {'model_name': 'SimpleImputer', 'strategy': 'median'}. Best is trial 5 with value: 0.24911941107400004.
running
[I 2024-10-23 17:52:09,994] Trial 17 finished with value: 0.24911941107400004 and parameters: {'model_name': 'SimpleImputer', 'strategy': 'mean'}. Best is trial 5 with value: 0.24911941107400004.
[I 2024-10-23 17:52:10,142] Trial 24 finished with value: 0.48718920258567844 and parameters: {'model_name': 'SimpleImputer', 'strategy': 'constant'}. Best is trial 5 with value: 0.24911941107400004.
running
running
[I 2024-10-23 17:52:10,271] Trial 6 finished with value: 0.48718920258567844 and parameters: {'model_name': 'SimpleImputer', 'strategy': 'most_frequent'}. Best is trial 5 with value: 0.24911941107400004.
running
[I 2024-10-23 17:52:10,455] Trial 23 finished with value: 0.24911941107400004 and parameters: {'model_name': 'SimpleImputer', 'strategy': 'mean'}. Best is trial 5 with value: 0.24911941107400004.
running
[I 2024-10-23 17:52:10,596] Trial 20 finished with value: 0.24911941107400004 and parameters: {'model_name': 'SimpleImputer', 'strategy': 'mean'}. Best is trial 5 with value: 0.24911941107400004.
[I 2024-10-23 17:52:10,711] Trial 22 finished with value: 0.48718920258567844 and parameters: {'model_name': 'SimpleImputer', 'strategy': 'constant'}. Best is trial 5 with value: 0.24911941107400004.
running
running
[I 2024-10-23 17:52:10,884] Trial 1 finished with value: 0.48718920258567844 and parameters: {'model_name': 'SimpleImputer', 'strategy': 'most_frequent'}. Best is trial 5 with value: 0.24911941107400004.
[I 2024-10-23 17:52:11,065] Trial 8 finished with value: 0.2544554031932653 and parameters: {'model_name': 'SimpleImputer', 'strategy': 'median'}. Best is trial 5 with value: 0.24911941107400004.
running
running
[I 2024-10-23 17:52:11,290] Trial 12 finished with value: 0.48718920258567844 and parameters: {'model_name': 'SimpleImputer', 'strategy': 'most_frequent'}. Best is trial 5 with value: 0.24911941107400004.
running
[I 2024-10-23 17:52:11,475] Trial 11 finished with value: 0.48718920258567844 and parameters: {'model_name': 'SimpleImputer', 'strategy': 'most_frequent'}. Best is trial 5 with value: 0.24911941107400004.
running
[I 2024-10-23 17:52:11,930] Trial 39 finished with value: 0.24911941107400004 and parameters: {'model_name': 'SimpleImputer', 'strategy': 'mean'}. Best is trial 5 with value: 0.24911941107400004.
running
[I 2024-10-23 17:52:12,063] Trial 36 finished with value: 0.24911941107400004 and parameters: {'model_name': 'SimpleImputer', 'strategy': 'mean'}. Best is trial 5 with value: 0.24911941107400004.
running
[I 2024-10-23 17:52:12,178] Trial 38 finished with value: 0.24911941107400004 and parameters: {'model_name': 'SimpleImputer', 'strategy': 'mean'}. Best is trial 5 with value: 0.24911941107400004.
running
[I 2024-10-23 17:52:12,334] Trial 37 finished with value: 0.24911941107400004 and parameters: {'model_name': 'SimpleImputer', 'strategy': 'mean'}. Best is trial 5 with value: 0.24911941107400004.
running
[I 2024-10-23 17:52:12,793] Trial 28 finished with value: 0.48718920258567844 and parameters: {'model_name': 'SimpleImputer', 'strategy': 'most_frequent'}. Best is trial 5 with value: 0.24911941107400004.
running
[I 2024-10-23 17:52:12,936] Trial 25 finished with value: 0.48718920258567844 and parameters: {'model_name': 'SimpleImputer', 'strategy': 'most_frequent'}. Best is trial 5 with value: 0.24911941107400004.
running
[I 2024-10-23 17:52:13,086] Trial 19 finished with value: 0.48718920258567844 and parameters: {'model_name': 'SimpleImputer', 'strategy': 'most_frequent'}. Best is trial 5 with value: 0.24911941107400004.
running
[I 2024-10-23 17:52:13,228] Trial 27 finished with value: 0.48718920258567844 and parameters: {'model_name': 'SimpleImputer', 'strategy': 'most_frequent'}. Best is trial 5 with value: 0.24911941107400004.
[I 2024-10-23 17:52:13,369] Trial 33 finished with value: 0.48718920258567844 and parameters: {'model_name': 'SimpleImputer', 'strategy': 'most_frequent'}. Best is trial 5 with value: 0.24911941107400004.
[I 2024-10-23 17:52:13,498] Trial 40 finished with value: 0.24911941107400004 and parameters: {'model_name': 'SimpleImputer', 'strategy': 'mean'}. Best is trial 5 with value: 0.24911941107400004.
[I 2024-10-23 17:52:13,607] Trial 26 finished with value: 0.48718920258567844 and parameters: {'model_name': 'SimpleImputer', 'strategy': 'most_frequent'}. Best is trial 5 with value: 0.24911941107400004.
running
[I 2024-10-23 17:52:13,722] Trial 29 finished with value: 0.48718920258567844 and parameters: {'model_name': 'SimpleImputer', 'strategy': 'most_frequent'}. Best is trial 5 with value: 0.24911941107400004.
running
running
[I 2024-10-23 17:52:13,857] Trial 42 finished with value: 0.24911941107400004 and parameters: {'model_name': 'SimpleImputer', 'strategy': 'mean'}. Best is trial 5 with value: 0.24911941107400004.
running
running
[I 2024-10-23 17:52:14,001] Trial 32 finished with value: 0.48718920258567844 and parameters: {'model_name': 'SimpleImputer', 'strategy': 'most_frequent'}. Best is trial 5 with value: 0.24911941107400004.
[I 2024-10-23 17:52:14,179] Trial 34 finished with value: 0.48718920258567844 and parameters: {'model_name': 'SimpleImputer', 'strategy': 'most_frequent'}. Best is trial 5 with value: 0.24911941107400004.
running
running
running
[I 2024-10-23 17:52:14,324] Trial 31 finished with value: 0.48718920258567844 and parameters: {'model_name': 'SimpleImputer', 'strategy': 'most_frequent'}. Best is trial 5 with value: 0.24911941107400004.
[I 2024-10-23 17:52:14,444] Trial 35 finished with value: 0.48718920258567844 and parameters: {'model_name': 'SimpleImputer', 'strategy': 'most_frequent'}. Best is trial 5 with value: 0.24911941107400004.
running
[I 2024-10-23 17:52:14,582] Trial 43 finished with value: 0.24911941107400004 and parameters: {'model_name': 'SimpleImputer', 'strategy': 'mean'}. Best is trial 5 with value: 0.24911941107400004.
[I 2024-10-23 17:52:14,701] Trial 41 finished with value: 0.24911941107400004 and parameters: {'model_name': 'SimpleImputer', 'strategy': 'mean'}. Best is trial 5 with value: 0.24911941107400004.
running
running
running
[I 2024-10-23 17:52:14,965] Trial 30 finished with value: 0.48718920258567844 and parameters: {'model_name': 'SimpleImputer', 'strategy': 'most_frequent'}. Best is trial 5 with value: 0.24911941107400004.
running
[I 2024-10-23 17:52:15,143] Trial 45 finished with value: 0.24911941107400004 and parameters: {'model_name': 'SimpleImputer', 'strategy': 'mean'}. Best is trial 5 with value: 0.24911941107400004.
running
[I 2024-10-23 17:52:15,320] Trial 46 finished with value: 0.24911941107400004 and parameters: {'model_name': 'SimpleImputer', 'strategy': 'mean'}. Best is trial 5 with value: 0.24911941107400004.
running
[I 2024-10-23 17:52:15,559] Trial 44 finished with value: 0.24911941107400004 and parameters: {'model_name': 'SimpleImputer', 'strategy': 'mean'}. Best is trial 5 with value: 0.24911941107400004.
running
[I 2024-10-23 17:52:15,750] Trial 53 finished with value: 0.2544554031932653 and parameters: {'model_name': 'SimpleImputer', 'strategy': 'median'}. Best is trial 5 with value: 0.24911941107400004.
running
[I 2024-10-23 17:52:15,905] Trial 49 finished with value: 0.2544554031932653 and parameters: {'model_name': 'SimpleImputer', 'strategy': 'median'}. Best is trial 5 with value: 0.24911941107400004.
running
[I 2024-10-23 17:52:16,072] Trial 55 finished with value: 0.2544554031932653 and parameters: {'model_name': 'SimpleImputer', 'strategy': 'median'}. Best is trial 5 with value: 0.24911941107400004.
[I 2024-10-23 17:52:16,194] Trial 50 finished with value: 0.2544554031932653 and parameters: {'model_name': 'SimpleImputer', 'strategy': 'median'}. Best is trial 5 with value: 0.24911941107400004.
running
running
[I 2024-10-23 17:52:16,335] Trial 48 finished with value: 0.2544554031932653 and parameters: {'model_name': 'SimpleImputer', 'strategy': 'median'}. Best is trial 5 with value: 0.24911941107400004.
running
[I 2024-10-23 17:52:16,522] Trial 57 finished with value: 0.2544554031932653 and parameters: {'model_name': 'SimpleImputer', 'strategy': 'median'}. Best is trial 5 with value: 0.24911941107400004.
[I 2024-10-23 17:52:16,655] Trial 56 finished with value: 0.2544554031932653 and parameters: {'model_name': 'SimpleImputer', 'strategy': 'median'}. Best is trial 5 with value: 0.24911941107400004.
[I 2024-10-23 17:52:16,780] Trial 47 finished with value: 0.2544554031932653 and parameters: {'model_name': 'SimpleImputer', 'strategy': 'median'}. Best is trial 5 with value: 0.24911941107400004.
running
running
running
[I 2024-10-23 17:52:16,962] Trial 52 finished with value: 0.2544554031932653 and parameters: {'model_name': 'SimpleImputer', 'strategy': 'median'}. Best is trial 5 with value: 0.24911941107400004.
[I 2024-10-23 17:52:17,091] Trial 54 finished with value: 0.2544554031932653 and parameters: {'model_name': 'SimpleImputer', 'strategy': 'median'}. Best is trial 5 with value: 0.24911941107400004.
running
[I 2024-10-23 17:52:17,250] Trial 58 finished with value: 0.2544554031932653 and parameters: {'model_name': 'SimpleImputer', 'strategy': 'median'}. Best is trial 5 with value: 0.24911941107400004.
running
[I 2024-10-23 17:52:17,387] Trial 59 finished with value: 0.2544554031932653 and parameters: {'model_name': 'SimpleImputer', 'strategy': 'median'}. Best is trial 5 with value: 0.24911941107400004.
running
running
[I 2024-10-23 17:52:17,608] Trial 65 finished with value: 0.24911941107400004 and parameters: {'model_name': 'SimpleImputer', 'strategy': 'mean'}. Best is trial 5 with value: 0.24911941107400004.
running
[I 2024-10-23 17:52:17,764] Trial 51 finished with value: 0.2544554031932653 and parameters: {'model_name': 'SimpleImputer', 'strategy': 'median'}. Best is trial 5 with value: 0.24911941107400004.
running
[I 2024-10-23 17:52:17,929] Trial 64 finished with value: 0.24911941107400004 and parameters: {'model_name': 'SimpleImputer', 'strategy': 'mean'}. Best is trial 5 with value: 0.24911941107400004.
running
[I 2024-10-23 17:52:18,133] Trial 66 finished with value: 0.24911941107400004 and parameters: {'model_name': 'SimpleImputer', 'strategy': 'mean'}. Best is trial 5 with value: 0.24911941107400004.
running
[I 2024-10-23 17:52:18,272] Trial 60 finished with value: 0.2544554031932653 and parameters: {'model_name': 'SimpleImputer', 'strategy': 'median'}. Best is trial 5 with value: 0.24911941107400004.
running
[I 2024-10-23 17:52:18,444] Trial 61 finished with value: 0.2544554031932653 and parameters: {'model_name': 'SimpleImputer', 'strategy': 'median'}. Best is trial 5 with value: 0.24911941107400004.
[I 2024-10-23 17:52:18,581] Trial 67 finished with value: 0.24911941107400004 and parameters: {'model_name': 'SimpleImputer', 'strategy': 'mean'}. Best is trial 5 with value: 0.24911941107400004.
running
running
[I 2024-10-23 17:52:18,756] Trial 68 finished with value: 0.24911941107400004 and parameters: {'model_name': 'SimpleImputer', 'strategy': 'mean'}. Best is trial 5 with value: 0.24911941107400004.
[I 2024-10-23 17:52:18,766] Trial 63 finished with value: 0.2544554031932653 and parameters: {'model_name': 'SimpleImputer', 'strategy': 'median'}. Best is trial 5 with value: 0.24911941107400004.
running
running
[I 2024-10-23 17:52:18,905] Trial 73 finished with value: 0.24911941107400004 and parameters: {'model_name': 'SimpleImputer', 'strategy': 'mean'}. Best is trial 5 with value: 0.24911941107400004.
[I 2024-10-23 17:52:19,185] Trial 71 finished with value: 0.24911941107400004 and parameters: {'model_name': 'SimpleImputer', 'strategy': 'mean'}. Best is trial 5 with value: 0.24911941107400004.
[I 2024-10-23 17:52:19,308] Trial 69 finished with value: 0.24911941107400004 and parameters: {'model_name': 'SimpleImputer', 'strategy': 'mean'}. Best is trial 5 with value: 0.24911941107400004.
running
running
[I 2024-10-23 17:52:19,461] Trial 75 finished with value: 0.24911941107400004 and parameters: {'model_name': 'SimpleImputer', 'strategy': 'mean'}. Best is trial 5 with value: 0.24911941107400004.
running
[I 2024-10-23 17:52:19,606] Trial 62 finished with value: 0.2544554031932653 and parameters: {'model_name': 'SimpleImputer', 'strategy': 'median'}. Best is trial 5 with value: 0.24911941107400004.
running
running
[I 2024-10-23 17:52:19,751] Trial 70 finished with value: 0.24911941107400004 and parameters: {'model_name': 'SimpleImputer', 'strategy': 'mean'}. Best is trial 5 with value: 0.24911941107400004.
running
[I 2024-10-23 17:52:19,995] Trial 77 finished with value: 0.24911941107400004 and parameters: {'model_name': 'SimpleImputer', 'strategy': 'mean'}. Best is trial 5 with value: 0.24911941107400004.
running
[I 2024-10-23 17:52:20,180] Trial 76 finished with value: 0.24911941107400004 and parameters: {'model_name': 'SimpleImputer', 'strategy': 'mean'}. Best is trial 5 with value: 0.24911941107400004.
[I 2024-10-23 17:52:20,327] Trial 79 finished with value: 0.24911941107400004 and parameters: {'model_name': 'SimpleImputer', 'strategy': 'mean'}. Best is trial 5 with value: 0.24911941107400004.
running
running
[I 2024-10-23 17:52:20,489] Trial 74 finished with value: 0.24911941107400004 and parameters: {'model_name': 'SimpleImputer', 'strategy': 'mean'}. Best is trial 5 with value: 0.24911941107400004.
running
[I 2024-10-23 17:52:20,656] Trial 72 finished with value: 0.24911941107400004 and parameters: {'model_name': 'SimpleImputer', 'strategy': 'mean'}. Best is trial 5 with value: 0.24911941107400004.
running
[I 2024-10-23 17:52:20,835] Trial 78 finished with value: 0.24911941107400004 and parameters: {'model_name': 'SimpleImputer', 'strategy': 'mean'}. Best is trial 5 with value: 0.24911941107400004.
[I 2024-10-23 17:52:20,971] Trial 81 finished with value: 0.24911941107400004 and parameters: {'model_name': 'SimpleImputer', 'strategy': 'mean'}. Best is trial 5 with value: 0.24911941107400004.
running
[I 2024-10-23 17:52:21,158] Trial 82 finished with value: 0.24911941107400004 and parameters: {'model_name': 'SimpleImputer', 'strategy': 'mean'}. Best is trial 5 with value: 0.24911941107400004.
[I 2024-10-23 17:52:21,287] Trial 86 finished with value: 0.24911941107400004 and parameters: {'model_name': 'SimpleImputer', 'strategy': 'mean'}. Best is trial 5 with value: 0.24911941107400004.
[I 2024-10-23 17:52:21,416] Trial 85 finished with value: 0.24911941107400004 and parameters: {'model_name': 'SimpleImputer', 'strategy': 'mean'}. Best is trial 5 with value: 0.24911941107400004.
running
running
running
[I 2024-10-23 17:52:21,651] Trial 83 finished with value: 0.24911941107400004 and parameters: {'model_name': 'SimpleImputer', 'strategy': 'mean'}. Best is trial 5 with value: 0.24911941107400004.
running
[I 2024-10-23 17:52:21,780] Trial 87 finished with value: 0.24911941107400004 and parameters: {'model_name': 'SimpleImputer', 'strategy': 'mean'}. Best is trial 5 with value: 0.24911941107400004.
[I 2024-10-23 17:52:21,963] Trial 80 finished with value: 0.24911941107400004 and parameters: {'model_name': 'SimpleImputer', 'strategy': 'mean'}. Best is trial 5 with value: 0.24911941107400004.
running
running
[I 2024-10-23 17:52:22,110] Trial 88 finished with value: 0.24911941107400004 and parameters: {'model_name': 'SimpleImputer', 'strategy': 'mean'}. Best is trial 5 with value: 0.24911941107400004.
[I 2024-10-23 17:52:22,228] Trial 90 finished with value: 0.48718920258567844 and parameters: {'model_name': 'SimpleImputer', 'strategy': 'constant'}. Best is trial 5 with value: 0.24911941107400004.
[I 2024-10-23 17:52:22,326] Trial 91 finished with value: 0.48718920258567844 and parameters: {'model_name': 'SimpleImputer', 'strategy': 'constant'}. Best is trial 5 with value: 0.24911941107400004.
[I 2024-10-23 17:52:22,478] Trial 84 finished with value: 0.24911941107400004 and parameters: {'model_name': 'SimpleImputer', 'strategy': 'mean'}. Best is trial 5 with value: 0.24911941107400004.
[I 2024-10-23 17:52:22,629] Trial 93 finished with value: 0.48718920258567844 and parameters: {'model_name': 'SimpleImputer', 'strategy': 'constant'}. Best is trial 5 with value: 0.24911941107400004.
running
[I 2024-10-23 17:52:22,629] Trial 92 finished with value: 0.48718920258567844 and parameters: {'model_name': 'SimpleImputer', 'strategy': 'constant'}. Best is trial 5 with value: 0.24911941107400004.
[I 2024-10-23 17:52:22,641] Trial 89 finished with value: 0.24911941107400004 and parameters: {'model_name': 'SimpleImputer', 'strategy': 'mean'}. Best is trial 5 with value: 0.24911941107400004.
[I 2024-10-23 17:52:22,648] Trial 94 finished with value: 0.48718920258567844 and parameters: {'model_name': 'SimpleImputer', 'strategy': 'constant'}. Best is trial 5 with value: 0.24911941107400004.
running
running
running
running
[I 2024-10-23 17:52:23,235] Trial 95 finished with value: 0.48718920258567844 and parameters: {'model_name': 'SimpleImputer', 'strategy': 'constant'}. Best is trial 5 with value: 0.24911941107400004.
running
running
running
running
[I 2024-10-23 17:52:23,386] Trial 96 finished with value: 0.48718920258567844 and parameters: {'model_name': 'SimpleImputer', 'strategy': 'constant'}. Best is trial 5 with value: 0.24911941107400004.
running
running
[I 2024-10-23 17:52:23,580] Trial 99 finished with value: 0.48718920258567844 and parameters: {'model_name': 'SimpleImputer', 'strategy': 'constant'}. Best is trial 5 with value: 0.24911941107400004.
running
[I 2024-10-23 17:52:23,800] Trial 100 finished with value: 0.48718920258567844 and parameters: {'model_name': 'SimpleImputer', 'strategy': 'constant'}. Best is trial 5 with value: 0.24911941107400004.
running
[I 2024-10-23 17:52:23,979] Trial 98 finished with value: 0.48718920258567844 and parameters: {'model_name': 'SimpleImputer', 'strategy': 'constant'}. Best is trial 5 with value: 0.24911941107400004.
running
[I 2024-10-23 17:52:24,177] Trial 97 finished with value: 0.48718920258567844 and parameters: {'model_name': 'SimpleImputer', 'strategy': 'constant'}. Best is trial 5 with value: 0.24911941107400004.
running
[I 2024-10-23 17:52:24,365] Trial 102 finished with value: 0.24911941107400004 and parameters: {'model_name': 'SimpleImputer', 'strategy': 'mean'}. Best is trial 5 with value: 0.24911941107400004.
running
[I 2024-10-23 17:52:24,564] Trial 111 finished with value: 0.24911941107400004 and parameters: {'model_name': 'SimpleImputer', 'strategy': 'mean'}. Best is trial 5 with value: 0.24911941107400004.
