[I 2024-11-21 21:18:58,342] Trial 199 finished with value: 0.3604004952420291 and parameters: {'model_name': 'SimpleImputer', 'strategy': 'mean'}. Best is trial 1 with value: 0.3604004952420291.
fit
simple fit
simple transform
0    0
1    0
2    0
3    0
4    0
5    0
dtype: int64
0    0
1    0
2    0
3    0
4    0
5    0
dtype: int64
0.3604004952420291
{'model_name': 'SimpleImputer', 'strategy': 'mean'}
running experiment 2/3 - Does reconstruction give good automl predictions
Start est fit
Version 0.1.7a0 of tpot2 is outdated. Version 0.1.8a0 was released Tuesday September 17, 2024.
Version 0.1.7a0 of tpot2 is outdated. Version 0.1.8a0 was released Tuesday September 17, 2024.
Version 0.1.7a0 of tpot2 is outdated. Version 0.1.8a0 was released Tuesday September 17, 2024.
Version 0.1.7a0 of tpot2 is outdated. Version 0.1.8a0 was released Tuesday September 17, 2024.
Version 0.1.7a0 of tpot2 is outdated. Version 0.1.8a0 was released Tuesday September 17, 2024.
Version 0.1.7a0 of tpot2 is outdated. Version 0.1.8a0 was released Tuesday September 17, 2024.
Version 0.1.7a0 of tpot2 is outdated. Version 0.1.8a0 was released Tuesday September 17, 2024.
Version 0.1.7a0 of tpot2 is outdated. Version 0.1.8a0 was released Tuesday September 17, 2024.
Version 0.1.7a0 of tpot2 is outdated. Version 0.1.8a0 was released Tuesday September 17, 2024.
Version 0.1.7a0 of tpot2 is outdated. Version 0.1.8a0 was released Tuesday September 17, 2024.
Version 0.1.7a0 of tpot2 is outdated. Version 0.1.8a0 was released Tuesday September 17, 2024.
Version 0.1.7a0 of tpot2 is outdated. Version 0.1.8a0 was released Tuesday September 17, 2024.
Version 0.1.7a0 of tpot2 is outdated. Version 0.1.8a0 was released Tuesday September 17, 2024.
Version 0.1.7a0 of tpot2 is outdated. Version 0.1.8a0 was released Tuesday September 17, 2024.
Version 0.1.7a0 of tpot2 is outdated. Version 0.1.8a0 was released Tuesday September 17, 2024.
Version 0.1.7a0 of tpot2 is outdated. Version 0.1.8a0 was released Tuesday September 17, 2024.
  0%|          | 0/25 [00:00<?, ?it/s]Generation:   0%|          | 0/25 [00:00<?, ?it/s]WARNING AN INDIVIDUAL TIMED OUT: 
 <tpot2.search_spaces.pipelines.sequential.SequentialPipelineIndividual object at 0x155474d1f460> 

Generation:  1
Best f1_score score: 0.7653604466626805
Generation:   4%|▍         | 1/25 [10:02<4:01:11, 602.97s/it]Generation:  2
Best f1_score score: 0.8075870984011564
Generation:   8%|▊         | 2/25 [10:26<1:40:24, 261.94s/it]WARNING THIS INDIVIDUAL CAUSED AND EXCEPTION 
 <tpot2.search_spaces.pipelines.sequential.SequentialPipelineIndividual object at 0x155474559e10> 
 The 'min_samples_split' parameter of DecisionTreeClassifier must be an int in the range [2, inf) or a float in the range (0.0, 1.0]. Got 1 instead. 
 Traceback (most recent call last):
  File "/common/ketrong/tpotexp/tpot2/tpot2/utils/eval_utils.py", line 53, in objective_nan_wrapper
    value = func_timeout.func_timeout(timeout, objective_function, args=[individual], kwargs=objective_kwargs)
  File "/common/ketrong/tpotexp/env/lib/python3.10/site-packages/func_timeout/dafunc.py", line 108, in func_timeout
    raise_exception(exception)
  File "/common/ketrong/tpotexp/env/lib/python3.10/site-packages/func_timeout/py3_raise.py", line 7, in raise_exception
    raise exception[0] from None
  File "/common/ketrong/tpotexp/tpot2/tpot2/tpot_estimator/estimator.py", line 623, in objective_function
    return objective_function_generator(
  File "/common/ketrong/tpotexp/tpot2/tpot2/tpot_estimator/estimator_utils.py", line 55, in objective_function_generator
    cv_obj_scores = cross_val_score_objective(sklearn.base.clone(pipeline),x,y,scorers=scorers, cv=cv , fold=step)
  File "/common/ketrong/tpotexp/tpot2/tpot2/tpot_estimator/cross_val_utils.py", line 28, in cross_val_score_objective
    this_fold_pipeline.fit(X_train,y_train)
  File "/common/ketrong/tpotexp/env/lib/python3.10/site-packages/sklearn/base.py", line 1473, in wrapper
    return fit_method(estimator, *args, **kwargs)
  File "/common/ketrong/tpotexp/env/lib/python3.10/site-packages/sklearn/pipeline.py", line 473, in fit
    self._final_estimator.fit(Xt, y, **last_step_params["fit"])
  File "/common/ketrong/tpotexp/env/lib/python3.10/site-packages/sklearn/base.py", line 1466, in wrapper
    estimator._validate_params()
  File "/common/ketrong/tpotexp/env/lib/python3.10/site-packages/sklearn/base.py", line 666, in _validate_params
    validate_parameter_constraints(
  File "/common/ketrong/tpotexp/env/lib/python3.10/site-packages/sklearn/utils/_param_validation.py", line 95, in validate_parameter_constraints
    raise InvalidParameterError(
sklearn.utils._param_validation.InvalidParameterError: The 'min_samples_split' parameter of DecisionTreeClassifier must be an int in the range [2, inf) or a float in the range (0.0, 1.0]. Got 1 instead.

Generation:  3
Best f1_score score: 0.8075870984011564
Generation:  12%|█▏        | 3/25 [10:48<55:52, 152.39s/it]  Generation:  4
Best f1_score score: 0.8075870984011564
Generation:  16%|█▌        | 4/25 [11:13<35:45, 102.18s/it]WARNING THIS INDIVIDUAL CAUSED AND EXCEPTION 
 <tpot2.search_spaces.pipelines.sequential.SequentialPipelineIndividual object at 0x155474cd4ac0> 
 The 'min_samples_split' parameter of DecisionTreeClassifier must be an int in the range [2, inf) or a float in the range (0.0, 1.0]. Got 1 instead. 
 Traceback (most recent call last):
  File "/common/ketrong/tpotexp/tpot2/tpot2/utils/eval_utils.py", line 53, in objective_nan_wrapper
    value = func_timeout.func_timeout(timeout, objective_function, args=[individual], kwargs=objective_kwargs)
  File "/common/ketrong/tpotexp/env/lib/python3.10/site-packages/func_timeout/dafunc.py", line 108, in func_timeout
    raise_exception(exception)
  File "/common/ketrong/tpotexp/env/lib/python3.10/site-packages/func_timeout/py3_raise.py", line 7, in raise_exception
    raise exception[0] from None
  File "/common/ketrong/tpotexp/tpot2/tpot2/tpot_estimator/estimator.py", line 623, in objective_function
    return objective_function_generator(
  File "/common/ketrong/tpotexp/tpot2/tpot2/tpot_estimator/estimator_utils.py", line 55, in objective_function_generator
    cv_obj_scores = cross_val_score_objective(sklearn.base.clone(pipeline),x,y,scorers=scorers, cv=cv , fold=step)
  File "/common/ketrong/tpotexp/tpot2/tpot2/tpot_estimator/cross_val_utils.py", line 28, in cross_val_score_objective
    this_fold_pipeline.fit(X_train,y_train)
  File "/common/ketrong/tpotexp/env/lib/python3.10/site-packages/sklearn/base.py", line 1473, in wrapper
    return fit_method(estimator, *args, **kwargs)
  File "/common/ketrong/tpotexp/env/lib/python3.10/site-packages/sklearn/pipeline.py", line 473, in fit
    self._final_estimator.fit(Xt, y, **last_step_params["fit"])
  File "/common/ketrong/tpotexp/env/lib/python3.10/site-packages/sklearn/base.py", line 1466, in wrapper
    estimator._validate_params()
  File "/common/ketrong/tpotexp/env/lib/python3.10/site-packages/sklearn/base.py", line 666, in _validate_params
    validate_parameter_constraints(
  File "/common/ketrong/tpotexp/env/lib/python3.10/site-packages/sklearn/utils/_param_validation.py", line 95, in validate_parameter_constraints
    raise InvalidParameterError(
sklearn.utils._param_validation.InvalidParameterError: The 'min_samples_split' parameter of DecisionTreeClassifier must be an int in the range [2, inf) or a float in the range (0.0, 1.0]. Got 1 instead.

Generation:  5
Best f1_score score: 0.8407453108584668
Generation:  20%|██        | 5/25 [11:45<25:34, 76.72s/it] Generation:  6
Best f1_score score: 0.8407453108584668
Generation:  24%|██▍       | 6/25 [12:56<23:45, 75.05s/it]Generation:  7
Best f1_score score: 0.8407453108584668
Generation:  28%|██▊       | 7/25 [13:48<20:15, 67.53s/it]Generation:  8
Best f1_score score: 0.8407453108584668
Generation:  32%|███▏      | 8/25 [18:04<36:08, 127.56s/it]Generation:  9
Best f1_score score: 0.8407453108584668
Generation:  36%|███▌      | 9/25 [24:58<57:51, 216.95s/it]Generation:  10
Best f1_score score: 0.8407453108584668
Generation:  40%|████      | 10/25 [32:06<1:10:32, 282.14s/it]Generation:  11
Best f1_score score: 0.8407453108584668
Generation:  44%|████▍     | 11/25 [36:27<1:04:17, 275.56s/it]Generation:  12
Best f1_score score: 0.8407453108584668
Generation:  48%|████▊     | 12/25 [36:52<43:12, 199.40s/it]  Generation:  13
Best f1_score score: 0.8407453108584668
Generation:  52%|█████▏    | 13/25 [37:15<29:13, 146.14s/it]Generation:  14
Best f1_score score: 0.8407453108584668
Generation:  56%|█████▌    | 14/25 [38:07<21:34, 117.70s/it]Generation:  15
Best f1_score score: 0.8407453108584668
Generation:  60%|██████    | 15/25 [38:25<14:33, 87.39s/it] Generation:  16
Best f1_score score: 0.8407453108584668
Generation:  64%|██████▍   | 16/25 [45:02<27:05, 180.65s/it]WARNING AN INDIVIDUAL TIMED OUT: 
 <tpot2.search_spaces.pipelines.sequential.SequentialPipelineIndividual object at 0x15545d7e3e50> 

Generation:  17
Best f1_score score: 0.8407453108584668
Generation:  68%|██████▊   | 17/25 [55:11<41:15, 309.38s/it]Generation:  18
Best f1_score score: 0.8455401312245152
Generation:  72%|███████▏  | 18/25 [1:01:58<39:31, 338.75s/it]Generation:  19
Best f1_score score: 0.8455401312245152
Generation:  76%|███████▌  | 19/25 [1:02:17<24:17, 242.85s/it]Generation:  20
Best f1_score score: 0.8455401312245152
Generation:  80%|████████  | 20/25 [1:04:14<17:05, 205.15s/it]Generation:  21
Best f1_score score: 0.8455401312245152
Generation:  84%|████████▍ | 21/25 [1:04:47<10:13, 153.35s/it]Generation:  22
Best f1_score score: 0.8455401312245152
Generation:  88%|████████▊ | 22/25 [1:08:48<08:59, 179.77s/it]Generation:  23
Best f1_score score: 0.8455401312245152
Generation:  92%|█████████▏| 23/25 [1:09:24<04:32, 136.38s/it]WARNING AN INDIVIDUAL TIMED OUT: 
 <tpot2.search_spaces.pipelines.sequential.SequentialPipelineIndividual object at 0x1554740b2d70> 

Generation:  24
Best f1_score score: 0.8455401312245152
Generation:  96%|█████████▌| 24/25 [1:19:35<04:39, 279.02s/it]Generation:  25
Best f1_score score: 0.8455401312245152
Generation: 100%|██████████| 25/25 [1:20:00<00:00, 202.77s/it]Generation: 100%|██████████| 25/25 [1:20:03<00:00, 192.15s/it]
2024-11-21 22:39:07,962 - distributed.scheduler - ERROR - Removing worker 'tcp://127.0.0.1:46981' caused the cluster to lose scattered data, which can't be recovered: {'ndarray-c0e1dfc69052b1282401483081fb3324', 'ndarray-bbcff8349ee42c708f6fa6a3154c2ae0'} (stimulus_id='handle-worker-cleanup-1732257547.9621499')
Fitted
Pipeline(steps=[('kneighborsclassifier',
                 KNeighborsClassifier(n_jobs=1, n_neighbors=22, p=1))])
score start
train score: {'auroc': 0.9781652191884399, 'accuracy': 0.9104169571886767, 'balanced_accuracy': 0.8579388034625136, 'logloss': 0.3223205363704233, 'f1': 0.8798983953549566}
original test score: {'auroc': 0.9779417546590258, 'accuracy': 0.9035029004908522, 'balanced_accuracy': 0.8506001188031399, 'logloss': 0.3300742930373642, 'f1': 0.8720986754840417}
imputed test score: {'auroc': 0.970440653376513, 'accuracy': 0.893239625167336, 'balanced_accuracy': 0.83798905881671, 'logloss': 0.3949016477832383, 'f1': 0.8591998645451929}
score end
check intended
EXP2 Finished
running experiment 3/3 - What is the best automl settings?
<tpot2.search_spaces.pipelines.sequential.SequentialPipeline object at 0x15543504f9d0>
Start tpot fit
Version 0.1.7a0 of tpot2 is outdated. Version 0.1.8a0 was released Tuesday September 17, 2024.
Version 0.1.7a0 of tpot2 is outdated. Version 0.1.8a0 was released Tuesday September 17, 2024.
Version 0.1.7a0 of tpot2 is outdated. Version 0.1.8a0 was released Tuesday September 17, 2024.
Version 0.1.7a0 of tpot2 is outdated. Version 0.1.8a0 was released Tuesday September 17, 2024.
Version 0.1.7a0 of tpot2 is outdated. Version 0.1.8a0 was released Tuesday September 17, 2024.
Version 0.1.7a0 of tpot2 is outdated. Version 0.1.8a0 was released Tuesday September 17, 2024.
Version 0.1.7a0 of tpot2 is outdated. Version 0.1.8a0 was released Tuesday September 17, 2024.
Version 0.1.7a0 of tpot2 is outdated. Version 0.1.8a0 was released Tuesday September 17, 2024.
Version 0.1.7a0 of tpot2 is outdated. Version 0.1.8a0 was released Tuesday September 17, 2024.
Version 0.1.7a0 of tpot2 is outdated. Version 0.1.8a0 was released Tuesday September 17, 2024.
Version 0.1.7a0 of tpot2 is outdated. Version 0.1.8a0 was released Tuesday September 17, 2024.
Version 0.1.7a0 of tpot2 is outdated. Version 0.1.8a0 was released Tuesday September 17, 2024.
Version 0.1.7a0 of tpot2 is outdated. Version 0.1.8a0 was released Tuesday September 17, 2024.
Version 0.1.7a0 of tpot2 is outdated. Version 0.1.8a0 was released Tuesday September 17, 2024.
Version 0.1.7a0 of tpot2 is outdated. Version 0.1.8a0 was released Tuesday September 17, 2024.
Version 0.1.7a0 of tpot2 is outdated. Version 0.1.8a0 was released Tuesday September 17, 2024.
  0%|          | 0/25 [00:00<?, ?it/s]Generation:   0%|          | 0/25 [00:00<?, ?it/s]Generation:  1
Best f1_score score: 0.8142130977682939
Generation:   4%|▍         | 1/25 [06:38<2:39:24, 398.53s/it]Generation:  2
Best f1_score score: 0.8142130977682939
Generation:   8%|▊         | 2/25 [07:26<1:13:40, 192.18s/it]Generation:  3
Best f1_score score: 0.8142130977682939
Generation:  12%|█▏        | 3/25 [11:44<1:21:28, 222.21s/it]Generation:  4
Best f1_score score: 0.8226864518240443
Generation:  16%|█▌        | 4/25 [17:47<1:37:13, 277.81s/it]Generation:  5
Best f1_score score: 0.8244083124762343
Generation:  20%|██        | 5/25 [27:17<2:07:48, 383.42s/it]WARNING AN INDIVIDUAL TIMED OUT: 
 <tpot2.search_spaces.pipelines.sequential.SequentialPipelineIndividual object at 0x155474716110> 

WARNING AN INDIVIDUAL TIMED OUT: 
 <tpot2.search_spaces.pipelines.sequential.SequentialPipelineIndividual object at 0x155467ad9b70> 

Generation:  6
Best f1_score score: 0.8244083124762343
Generation:  24%|██▍       | 6/25 [37:20<2:25:02, 458.04s/it]WARNING AN INDIVIDUAL TIMED OUT: 
 <tpot2.search_spaces.pipelines.sequential.SequentialPipelineIndividual object at 0x1554746a8f70> 

WARNING AN INDIVIDUAL TIMED OUT: 
 <tpot2.search_spaces.pipelines.sequential.SequentialPipelineIndividual object at 0x155467f0a080> 

Generation:  7
Best f1_score score: 0.8370726233523454
Generation:  28%|██▊       | 7/25 [47:25<2:31:46, 505.92s/it]WARNING AN INDIVIDUAL TIMED OUT: 
 <tpot2.search_spaces.pipelines.sequential.SequentialPipelineIndividual object at 0x155467ae19f0> 

WARNING AN INDIVIDUAL TIMED OUT: 
 <tpot2.search_spaces.pipelines.sequential.SequentialPipelineIndividual object at 0x1554746553f0> 

WARNING AN INDIVIDUAL TIMED OUT: 
 <tpot2.search_spaces.pipelines.sequential.SequentialPipelineIndividual object at 0x155467f08d90> 

WARNING AN INDIVIDUAL TIMED OUT: 
 <tpot2.search_spaces.pipelines.sequential.SequentialPipelineIndividual object at 0x155474736b60> 

WARNING AN INDIVIDUAL TIMED OUT: 
 <tpot2.search_spaces.pipelines.sequential.SequentialPipelineIndividual object at 0x155467988490> 

WARNING AN INDIVIDUAL TIMED OUT: 
 <tpot2.search_spaces.pipelines.sequential.SequentialPipelineIndividual object at 0x15548648b160> 

Generation:  8
Best f1_score score: 0.8370726233523454
Generation:  32%|███▏      | 8/25 [57:29<2:32:13, 537.28s/it]WARNING AN INDIVIDUAL TIMED OUT: 
 <tpot2.search_spaces.pipelines.sequential.SequentialPipelineIndividual object at 0x155467eb79d0> 

Generation:  9
Best f1_score score: 0.8434352861025772
Generation:  36%|███▌      | 9/25 [1:07:33<2:28:51, 558.21s/it]WARNING AN INDIVIDUAL TIMED OUT: 
 <tpot2.search_spaces.pipelines.sequential.SequentialPipelineIndividual object at 0x1554675a3a60> 

WARNING AN INDIVIDUAL TIMED OUT: 
 <tpot2.search_spaces.pipelines.sequential.SequentialPipelineIndividual object at 0x1554746a6800> 

Generation:  10
Best f1_score score: 0.8434352861025772
Generation:  40%|████      | 10/25 [1:17:39<2:23:11, 572.78s/it]WARNING AN INDIVIDUAL TIMED OUT: 
 <tpot2.search_spaces.pipelines.sequential.SequentialPipelineIndividual object at 0x1554650630a0> 

WARNING AN INDIVIDUAL TIMED OUT: 
 <tpot2.search_spaces.pipelines.sequential.SequentialPipelineIndividual object at 0x1554746f8fa0> 

Generation:  11
Best f1_score score: 0.8434352861025772
Generation:  44%|████▍     | 11/25 [1:27:44<2:15:58, 582.78s/it]WARNING AN INDIVIDUAL TIMED OUT: 
 <tpot2.search_spaces.pipelines.sequential.SequentialPipelineIndividual object at 0x1554747365f0> 

WARNING AN INDIVIDUAL TIMED OUT: 
 <tpot2.search_spaces.pipelines.sequential.SequentialPipelineIndividual object at 0x1554677b6770> 

WARNING AN INDIVIDUAL TIMED OUT: 
 <tpot2.search_spaces.pipelines.sequential.SequentialPipelineIndividual object at 0x15546796b2b0> 

WARNING AN INDIVIDUAL TIMED OUT: 
 <tpot2.search_spaces.pipelines.sequential.SequentialPipelineIndividual object at 0x155464c50b50> 

WARNING AN INDIVIDUAL TIMED OUT: 
 <tpot2.search_spaces.pipelines.sequential.SequentialPipelineIndividual object at 0x1554746fabc0> 

Generation:  12
Best f1_score score: 0.8434352861025772
Generation:  48%|████▊     | 12/25 [1:37:48<2:07:39, 589.17s/it]WARNING AN INDIVIDUAL TIMED OUT: 
 <tpot2.search_spaces.pipelines.sequential.SequentialPipelineIndividual object at 0x155464cdc1f0> 

Generation:  13
Best f1_score score: 0.8434352861025772
Generation:  52%|█████▏    | 13/25 [1:47:53<1:58:45, 593.79s/it]WARNING AN INDIVIDUAL TIMED OUT: 
 <tpot2.search_spaces.pipelines.sequential.SequentialPipelineIndividual object at 0x155465258c70> 

WARNING AN INDIVIDUAL TIMED OUT: 
 <tpot2.search_spaces.pipelines.sequential.SequentialPipelineIndividual object at 0x15545b40d3f0> 

Generation:  14
Best f1_score score: 0.8434352861025772
Generation:  56%|█████▌    | 14/25 [1:57:57<1:49:25, 596.90s/it]WARNING AN INDIVIDUAL TIMED OUT: 
 <tpot2.search_spaces.pipelines.sequential.SequentialPipelineIndividual object at 0x155464cb6110> 

WARNING AN INDIVIDUAL TIMED OUT: 
 <tpot2.search_spaces.pipelines.sequential.SequentialPipelineIndividual object at 0x155474735630> 

WARNING AN INDIVIDUAL TIMED OUT: 
 <tpot2.search_spaces.pipelines.sequential.SequentialPipelineIndividual object at 0x155467ed64a0> 

Generation:  15
Best f1_score score: 0.8434352861025772
Generation:  60%|██████    | 15/25 [2:08:00<1:39:49, 598.97s/it]WARNING AN INDIVIDUAL TIMED OUT: 
 <tpot2.search_spaces.pipelines.sequential.SequentialPipelineIndividual object at 0x155467f05f30> 

WARNING AN INDIVIDUAL TIMED OUT: 
 <tpot2.search_spaces.pipelines.sequential.SequentialPipelineIndividual object at 0x155467ec8f40> 

WARNING AN INDIVIDUAL TIMED OUT: 
 <tpot2.search_spaces.pipelines.sequential.SequentialPipelineIndividual object at 0x1554649900a0> 

Generation:  16
Best f1_score score: 0.8434352861025772
Generation:  64%|██████▍   | 16/25 [2:18:05<1:30:06, 600.72s/it]WARNING AN INDIVIDUAL TIMED OUT: 
 <tpot2.search_spaces.pipelines.sequential.SequentialPipelineIndividual object at 0x155467ee7280> 

WARNING AN INDIVIDUAL TIMED OUT: 
 <tpot2.search_spaces.pipelines.sequential.SequentialPipelineIndividual object at 0x155467ee1270> 

WARNING AN INDIVIDUAL TIMED OUT: 
 <tpot2.search_spaces.pipelines.sequential.SequentialPipelineIndividual object at 0x155467537940> 

Generation:  17
Best f1_score score: 0.8434352861025772
Generation:  68%|██████▊   | 17/25 [2:28:09<1:20:12, 601.56s/it]WARNING THIS INDIVIDUAL CAUSED AND EXCEPTION 
 <tpot2.search_spaces.pipelines.sequential.SequentialPipelineIndividual object at 0x155464d29f60> 
 The 'min_samples_split' parameter of DecisionTreeClassifier must be an int in the range [2, inf) or a float in the range (0.0, 1.0]. Got 1 instead. 
 Traceback (most recent call last):
  File "/common/ketrong/tpotexp/tpot2/tpot2/utils/eval_utils.py", line 53, in objective_nan_wrapper
    value = func_timeout.func_timeout(timeout, objective_function, args=[individual], kwargs=objective_kwargs)
  File "/common/ketrong/tpotexp/env/lib/python3.10/site-packages/func_timeout/dafunc.py", line 108, in func_timeout
    raise_exception(exception)
  File "/common/ketrong/tpotexp/env/lib/python3.10/site-packages/func_timeout/py3_raise.py", line 7, in raise_exception
    raise exception[0] from None
  File "/common/ketrong/tpotexp/tpot2/tpot2/tpot_estimator/estimator.py", line 623, in objective_function
    return objective_function_generator(
  File "/common/ketrong/tpotexp/tpot2/tpot2/tpot_estimator/estimator_utils.py", line 55, in objective_function_generator
    cv_obj_scores = cross_val_score_objective(sklearn.base.clone(pipeline),x,y,scorers=scorers, cv=cv , fold=step)
  File "/common/ketrong/tpotexp/tpot2/tpot2/tpot_estimator/cross_val_utils.py", line 28, in cross_val_score_objective
    this_fold_pipeline.fit(X_train,y_train)
  File "/common/ketrong/tpotexp/env/lib/python3.10/site-packages/sklearn/base.py", line 1473, in wrapper
    return fit_method(estimator, *args, **kwargs)
  File "/common/ketrong/tpotexp/env/lib/python3.10/site-packages/sklearn/pipeline.py", line 473, in fit
    self._final_estimator.fit(Xt, y, **last_step_params["fit"])
  File "/common/ketrong/tpotexp/env/lib/python3.10/site-packages/sklearn/base.py", line 1466, in wrapper
    estimator._validate_params()
  File "/common/ketrong/tpotexp/env/lib/python3.10/site-packages/sklearn/base.py", line 666, in _validate_params
    validate_parameter_constraints(
  File "/common/ketrong/tpotexp/env/lib/python3.10/site-packages/sklearn/utils/_param_validation.py", line 95, in validate_parameter_constraints
    raise InvalidParameterError(
sklearn.utils._param_validation.InvalidParameterError: The 'min_samples_split' parameter of DecisionTreeClassifier must be an int in the range [2, inf) or a float in the range (0.0, 1.0]. Got 1 instead.

WARNING AN INDIVIDUAL TIMED OUT: 
 <tpot2.search_spaces.pipelines.sequential.SequentialPipelineIndividual object at 0x1554646b16f0> 

WARNING AN INDIVIDUAL TIMED OUT: 
 <tpot2.search_spaces.pipelines.sequential.SequentialPipelineIndividual object at 0x1554675447