Run: 53
/cm/local/apps/slurm/var/spool/job991102/slurm_script: line 26: 
pip install -e tpot2
pip install -r tpot2/ImputerExperiments/requirements_.txt
: No such file or directory
RunStart
Version 0.1.7a0 of tpot2 is outdated. Version 0.1.8a0 was released Tuesday September 17, 2024.
starting loops
../data/r/287/287.pkl
working on 
../data/r/287/reg_full_MAR_0.01_3
3.9384026527404785
running experiment 1/3 - Does large hyperparameter space improve reconstruction accuracy over simple
[I 2024-10-07 08:25:11,528] A new study created in memory with name: no-name-00e7185f-0756-4943-8510-c26c4f37ee36
running
running
running
running
running
running
running
running
running
running
running
running
running
running
running
running
[I 2024-10-07 08:25:11,875] Trial 1 finished with value: 0.10905955252269146 and parameters: {'model_name': 'SimpleImputer', 'strategy': 'most_frequent'}. Best is trial 1 with value: 0.10905955252269146.
running
[I 2024-10-07 08:25:13,308] Trial 2 finished with value: 0.07019444602905947 and parameters: {'model_name': 'KNNImputer', 'n_neighbors': 598, 'weights': 'distance'}. Best is trial 2 with value: 0.07019444602905947.
running
[I 2024-10-07 08:25:13,590] Trial 14 finished with value: 0.09983845368176915 and parameters: {'model_name': 'KNNImputer', 'n_neighbors': 4344, 'weights': 'uniform'}. Best is trial 2 with value: 0.07019444602905947.
running
[I 2024-10-07 08:25:14,199] Trial 6 finished with value: 0.08770478852399252 and parameters: {'model_name': 'KNNImputer', 'n_neighbors': 4135, 'weights': 'distance'}. Best is trial 2 with value: 0.07019444602905947.
running
[I 2024-10-07 08:25:14,689] Trial 7 finished with value: 0.0861043109959805 and parameters: {'model_name': 'KNNImputer', 'n_neighbors': 3337, 'weights': 'distance'}. Best is trial 2 with value: 0.07019444602905947.
[I 2024-10-07 08:25:14,694] Trial 12 finished with value: 0.08420724879827253 and parameters: {'model_name': 'KNNImputer', 'n_neighbors': 2713, 'weights': 'distance'}. Best is trial 2 with value: 0.07019444602905947.
[I 2024-10-07 08:25:14,933] Trial 4 finished with value: 0.08459639835469528 and parameters: {'model_name': 'KNNImputer', 'n_neighbors': 2833, 'weights': 'distance'}. Best is trial 2 with value: 0.07019444602905947.
running
running
running
[I 2024-10-07 08:25:16,809] Trial 21 finished with value: 0.07427323454745274 and parameters: {'model_name': 'KNNImputer', 'n_neighbors': 411, 'weights': 'uniform'}. Best is trial 2 with value: 0.07019444602905947.
running
[I 2024-10-07 08:25:17,093] Trial 23 finished with value: 0.09983845368176913 and parameters: {'model_name': 'SimpleImputer', 'strategy': 'mean'}. Best is trial 2 with value: 0.07019444602905947.
running
[I 2024-10-07 08:25:24,794] Trial 5 finished with value: 0.09128564843994033 and parameters: {'model_name': 'IterativeImputer', 'estimator': 'KNN', 'initial_strategy': 'constant', 'n_nearest_features': 2, 'imputation_order': 'roman'}. Best is trial 2 with value: 0.07019444602905947.
running
[I 2024-10-07 08:25:25,054] Trial 18 finished with value: 0.16151503368088313 and parameters: {'model_name': 'VAE', 'batch_size': 60, 'iterations': 2, 'learning_rate': 0.03336494557438841, 'p_miss': 0.09057186383955633}. Best is trial 2 with value: 0.07019444602905947.
running
[I 2024-10-07 08:25:25,845] Trial 22 finished with value: 0.08371289207262235 and parameters: {'model_name': 'IterativeImputer', 'estimator': 'Ridge', 'initial_strategy': 'most_frequent', 'n_nearest_features': 4, 'imputation_order': 'random'}. Best is trial 2 with value: 0.07019444602905947.
running
[I 2024-10-07 08:25:28,381] Trial 19 finished with value: inf and parameters: {'model_name': 'GAIN', 'batch_size': 3, 'hint_rate': 0.1280961407412893, 'alpha': 59, 'iterations': 83, 'learning_rate': 0.027903796600318016, 'p_miss': 0.12984655526803035}. Best is trial 2 with value: 0.07019444602905947.
running
[I 2024-10-07 08:25:29,024] Trial 25 finished with value: inf and parameters: {'model_name': 'GAIN', 'batch_size': 1, 'hint_rate': 0.05151546688451547, 'alpha': 60, 'iterations': 46, 'learning_rate': 0.00020032480802557556, 'p_miss': 0.29848334103870555}. Best is trial 2 with value: 0.07019444602905947.
running
[I 2024-10-07 08:25:31,140] Trial 9 finished with value: 0.2273287462416309 and parameters: {'model_name': 'GAIN', 'batch_size': 651, 'hint_rate': 0.6400395534228971, 'alpha': 7, 'iterations': 13, 'learning_rate': 0.022518914795568543, 'p_miss': 0.12706115122141387}. Best is trial 2 with value: 0.07019444602905947.
running
[I 2024-10-07 08:25:34,325] Trial 17 finished with value: 0.07024638229592758 and parameters: {'model_name': 'IterativeImputer', 'estimator': 'KNN', 'initial_strategy': 'constant', 'n_nearest_features': 5, 'imputation_order': 'arabic'}. Best is trial 2 with value: 0.07019444602905947.
running
[I 2024-10-07 08:25:35,129] Trial 8 finished with value: inf and parameters: {'model_name': 'GAIN', 'batch_size': 7, 'hint_rate': 0.8450452329995175, 'alpha': 88, 'iterations': 165, 'learning_rate': 0.0001334589627546106, 'p_miss': 0.04724854189736004}. Best is trial 2 with value: 0.07019444602905947.
running
[I 2024-10-07 08:25:41,600] Trial 20 finished with value: 0.06513789865403237 and parameters: {'model_name': 'IterativeImputer', 'estimator': 'KNN', 'initial_strategy': 'constant', 'n_nearest_features': 7, 'imputation_order': 'random'}. Best is trial 20 with value: 0.06513789865403237.
running
[I 2024-10-07 08:26:04,450] Trial 11 finished with value: 0.0742632207257153 and parameters: {'model_name': 'IterativeImputer', 'estimator': 'Bayesian', 'initial_strategy': 'constant', 'n_nearest_features': 9, 'imputation_order': 'ascending', 'sample_posterior': False}. Best is trial 20 with value: 0.06513789865403237.
running
[I 2024-10-07 08:26:08,103] Trial 0 finished with value: inf and parameters: {'model_name': 'GAIN', 'batch_size': 1, 'hint_rate': 0.9808515207322361, 'alpha': 68, 'iterations': 584, 'learning_rate': 0.0160097740019522, 'p_miss': 0.06491355098249979}. Best is trial 20 with value: 0.06513789865403237.
running
[I 2024-10-07 08:26:12,064] Trial 13 finished with value: 0.07348004945239675 and parameters: {'model_name': 'IterativeImputer', 'estimator': 'Bayesian', 'initial_strategy': 'constant', 'n_nearest_features': 10, 'imputation_order': 'random', 'sample_posterior': False}. Best is trial 20 with value: 0.06513789865403237.
running
[I 2024-10-07 08:26:13,678] Trial 31 finished with value: 0.060124535489580966 and parameters: {'model_name': 'IterativeImputer', 'estimator': 'KNN', 'initial_strategy': 'constant', 'n_nearest_features': 10, 'imputation_order': 'arabic'}. Best is trial 31 with value: 0.060124535489580966.
running
[I 2024-10-07 08:26:15,402] Trial 32 finished with value: 0.060124535489580966 and parameters: {'model_name': 'IterativeImputer', 'estimator': 'KNN', 'initial_strategy': 'constant', 'n_nearest_features': 10, 'imputation_order': 'arabic'}. Best is trial 31 with value: 0.060124535489580966.
running
[I 2024-10-07 08:26:31,975] Trial 36 finished with value: 0.06691627840625809 and parameters: {'model_name': 'IterativeImputer', 'estimator': 'KNN', 'initial_strategy': 'mean', 'n_nearest_features': 6, 'imputation_order': 'arabic'}. Best is trial 31 with value: 0.060124535489580966.
running
[I 2024-10-07 08:26:36,088] Trial 38 finished with value: 0.06240987773030828 and parameters: {'model_name': 'IterativeImputer', 'estimator': 'KNN', 'initial_strategy': 'median', 'n_nearest_features': 8, 'imputation_order': 'arabic'}. Best is trial 31 with value: 0.060124535489580966.
running
[I 2024-10-07 08:26:51,296] Trial 39 finished with value: 0.06005084511292158 and parameters: {'model_name': 'IterativeImputer', 'estimator': 'KNN', 'initial_strategy': 'median', 'n_nearest_features': 11, 'imputation_order': 'arabic'}. Best is trial 39 with value: 0.06005084511292158.
running
[I 2024-10-07 08:28:58,693] Trial 15 finished with value: 0.20669502491170233 and parameters: {'model_name': 'GAIN', 'batch_size': 5, 'hint_rate': 0.17397507051157274, 'alpha': 31, 'iterations': 220, 'learning_rate': 0.015784091335811826, 'p_miss': 0.2100249678731031}. Best is trial 39 with value: 0.06005084511292158.
running
[I 2024-10-07 08:29:58,660] Trial 10 finished with value: 0.24054453935971637 and parameters: {'model_name': 'GAIN', 'batch_size': 86, 'hint_rate': 0.5376627410672643, 'alpha': 52, 'iterations': 253, 'learning_rate': 0.03447514797930595, 'p_miss': 0.11703030696067061}. Best is trial 39 with value: 0.06005084511292158.
running
[I 2024-10-07 08:31:21,826] Trial 24 finished with value: 0.26521195036724526 and parameters: {'model_name': 'GAIN', 'batch_size': 163, 'hint_rate': 0.48613791180036975, 'alpha': 9, 'iterations': 306, 'learning_rate': 0.005868900524497548, 'p_miss': 0.2640995819734982}. Best is trial 39 with value: 0.06005084511292158.
running
[I 2024-10-07 08:54:41,853] Trial 16 finished with value: 0.05620385153003723 and parameters: {'model_name': 'IterativeImputer', 'estimator': 'RFR', 'initial_strategy': 'constant', 'n_nearest_features': 6, 'imputation_order': 'random'}. Best is trial 16 with value: 0.05620385153003723.
running
[I 2024-10-07 09:01:53,129] Trial 27 finished with value: inf and parameters: {'model_name': 'GAIN', 'batch_size': 2, 'hint_rate': 0.9356060978238414, 'alpha': 49, 'iterations': 7219, 'learning_rate': 0.0001213874780411409, 'p_miss': 0.28460795814381534}. Best is trial 16 with value: 0.05620385153003723.
running
[I 2024-10-07 09:10:38,766] Trial 26 finished with value: inf and parameters: {'model_name': 'GAIN', 'batch_size': 1, 'hint_rate': 0.5393752765445389, 'alpha': 28, 'iterations': 8650, 'learning_rate': 0.00014345900425958067, 'p_miss': 0.2990999517993554}. Best is trial 16 with value: 0.05620385153003723.
running
[I 2024-10-07 09:39:14,337] Trial 46 finished with value: 0.052408177805964795 and parameters: {'model_name': 'IterativeImputer', 'estimator': 'RFR', 'initial_strategy': 'median', 'n_nearest_features': 11, 'imputation_order': 'descending'}. Best is trial 46 with value: 0.052408177805964795.
running
[I 2024-10-07 09:39:20,888] Trial 48 finished with value: 0.31822871891368376 and parameters: {'model_name': 'VAE', 'batch_size': 21, 'iterations': 1, 'learning_rate': 0.0008062270411632649, 'p_miss': 0.011674303624324672}. Best is trial 46 with value: 0.052408177805964795.
running
[I 2024-10-07 09:48:52,553] Trial 47 finished with value: 0.05290337751471323 and parameters: {'model_name': 'IterativeImputer', 'estimator': 'RFR', 'initial_strategy': 'median', 'n_nearest_features': 11, 'imputation_order': 'arabic'}. Best is trial 46 with value: 0.052408177805964795.
running
[I 2024-10-07 09:48:52,921] Trial 50 finished with value: 0.25315299271463926 and parameters: {'model_name': 'SimpleImputer', 'strategy': 'constant'}. Best is trial 46 with value: 0.052408177805964795.
running
[I 2024-10-07 10:19:47,025] Trial 49 finished with value: 0.05285442643058289 and parameters: {'model_name': 'IterativeImputer', 'estimator': 'RFR', 'initial_strategy': 'median', 'n_nearest_features': 11, 'imputation_order': 'descending'}. Best is trial 46 with value: 0.052408177805964795.
running
[I 2024-10-07 10:30:57,760] Trial 51 finished with value: 0.05274836072529173 and parameters: {'model_name': 'IterativeImputer', 'estimator': 'RFR', 'initial_strategy': 'median', 'n_nearest_features': 11, 'imputation_order': 'descending'}. Best is trial 46 with value: 0.052408177805964795.
running
[I 2024-10-07 11:01:29,335] Trial 52 finished with value: 0.05262086242369861 and parameters: {'model_name': 'IterativeImputer', 'estimator': 'RFR', 'initial_strategy': 'median', 'n_nearest_features': 11, 'imputation_order': 'descending'}. Best is trial 46 with value: 0.052408177805964795.
running
[I 2024-10-07 11:02:17,606] Trial 54 finished with value: 0.30362215643382423 and parameters: {'model_name': 'VAE', 'batch_size': 931, 'iterations': 6, 'learning_rate': 0.0019429374414720152, 'p_miss': 0.18589833600414707}. Best is trial 46 with value: 0.052408177805964795.
running
[I 2024-10-07 11:13:10,320] Trial 53 finished with value: 0.052467347451425186 and parameters: {'model_name': 'IterativeImputer', 'estimator': 'RFR', 'initial_strategy': 'median', 'n_nearest_features': 11, 'imputation_order': 'descending'}. Best is trial 46 with value: 0.052408177805964795.
running
[I 2024-10-07 11:25:26,009] Trial 3 finished with value: 0.23642284951929682 and parameters: {'model_name': 'GAIN', 'batch_size': 152, 'hint_rate': 0.44576178600825905, 'alpha': 99, 'iterations': 6487, 'learning_rate': 0.0054267253877528275, 'p_miss': 0.1316026524427944}. Best is trial 46 with value: 0.052408177805964795.
running
[I 2024-10-07 11:43:58,809] Trial 55 finished with value: 0.05238939134313201 and parameters: {'model_name': 'IterativeImputer', 'estimator': 'RFR', 'initial_strategy': 'median', 'n_nearest_features': 11, 'imputation_order': 'descending'}. Best is trial 55 with value: 0.05238939134313201.
running
[I 2024-10-07 11:55:23,048] Trial 56 finished with value: 0.052979365470862363 and parameters: {'model_name': 'IterativeImputer', 'estimator': 'RFR', 'initial_strategy': 'median', 'n_nearest_features': 11, 'imputation_order': 'descending'}. Best is trial 55 with value: 0.05238939134313201.
running
[I 2024-10-07 12:06:16,471] Trial 57 finished with value: 0.05284650831486163 and parameters: {'model_name': 'IterativeImputer', 'estimator': 'RFR', 'initial_strategy': 'median', 'n_nearest_features': 11, 'imputation_order': 'descending'}. Best is trial 55 with value: 0.05238939134313201.
running
[I 2024-10-07 12:17:45,497] Trial 41 finished with value: 0.09879386039163973 and parameters: {'model_name': 'VAE', 'batch_size': 69, 'iterations': 4380, 'learning_rate': 0.0018267999745125868, 'p_miss': 0.23665290874150635}. Best is trial 55 with value: 0.05238939134313201.
running
[I 2024-10-07 12:26:07,069] Trial 58 finished with value: 0.05268071914330998 and parameters: {'model_name': 'IterativeImputer', 'estimator': 'RFR', 'initial_strategy': 'median', 'n_nearest_features': 11, 'imputation_order': 'descending'}. Best is trial 55 with value: 0.05238939134313201.
running
[I 2024-10-07 12:26:07,683] Trial 62 finished with value: 0.10158907480741546 and parameters: {'model_name': 'SimpleImputer', 'strategy': 'median'}. Best is trial 55 with value: 0.05238939134313201.
running
[I 2024-10-07 12:36:21,793] Trial 59 finished with value: 0.05462175000509922 and parameters: {'model_name': 'IterativeImputer', 'estimator': 'RFR', 'initial_strategy': 'median', 'n_nearest_features': 9, 'imputation_order': 'descending'}. Best is trial 55 with value: 0.05238939134313201.
running
[I 2024-10-07 12:44:49,587] Trial 35 finished with value: 0.09888442803826474 and parameters: {'model_name': 'VAE', 'batch_size': 78, 'iterations': 5277, 'learning_rate': 0.0008452450950797583, 'p_miss': 0.23461446876134037}. Best is trial 55 with value: 0.05238939134313201.
running
[I 2024-10-07 12:45:39,179] Trial 60 finished with value: 0.05446050218839814 and parameters: {'model_name': 'IterativeImputer', 'estimator': 'RFR', 'initial_strategy': 'median', 'n_nearest_features': 9, 'imputation_order': 'descending'}. Best is trial 55 with value: 0.05238939134313201.
running
[I 2024-10-07 12:57:48,883] Trial 61 finished with value: 0.054335437218277695 and parameters: {'model_name': 'IterativeImputer', 'estimator': 'RFR', 'initial_strategy': 'median', 'n_nearest_features': 9, 'imputation_order': 'descending'}. Best is trial 55 with value: 0.05238939134313201.
running
[I 2024-10-07 13:06:11,828] Trial 63 finished with value: 0.05472826638317381 and parameters: {'model_name': 'IterativeImputer', 'estimator': 'RFR', 'initial_strategy': 'median', 'n_nearest_features': 9, 'imputation_order': 'descending'}. Best is trial 55 with value: 0.05238939134313201.
running
[I 2024-10-07 13:17:36,415] Trial 64 finished with value: 0.05436392502764016 and parameters: {'model_name': 'IterativeImputer', 'estimator': 'RFR', 'initial_strategy': 'median', 'n_nearest_features': 9, 'imputation_order': 'descending'}. Best is trial 55 with value: 0.05238939134313201.
running
[I 2024-10-07 13:23:44,834] Trial 65 finished with value: 0.05454814910739848 and parameters: {'model_name': 'IterativeImputer', 'estimator': 'RFR', 'initial_strategy': 'median', 'n_nearest_features': 9, 'imputation_order': 'descending'}. Best is trial 55 with value: 0.05238939134313201.
running
[I 2024-10-07 13:26:58,574] Trial 66 finished with value: 0.05284298031195154 and parameters: {'model_name': 'IterativeImputer', 'estimator': 'RFR', 'initial_strategy': 'median', 'n_nearest_features': 10, 'imputation_order': 'descending'}. Best is trial 55 with value: 0.05238939134313201.
running
[I 2024-10-07 13:27:13,852] Trial 71 finished with value: 0.07173959890415191 and parameters: {'model_name': 'IterativeImputer', 'estimator': 'Ridge', 'initial_strategy': 'mean', 'n_nearest_features': 11, 'imputation_order': 'descending'}. Best is trial 55 with value: 0.05238939134313201.
running
[I 2024-10-07 13:27:18,019] Trial 72 finished with value: 0.08779374125823089 and parameters: {'model_name': 'KNNImputer', 'n_neighbors': 1508, 'weights': 'uniform'}. Best is trial 55 with value: 0.05238939134313201.
running
[I 2024-10-07 13:40:01,830] Trial 67 finished with value: 0.05261009844689749 and parameters: {'model_name': 'IterativeImputer', 'estimator': 'RFR', 'initial_strategy': 'median', 'n_nearest_features': 10, 'imputation_order': 'descending'}. Best is trial 55 with value: 0.05238939134313201.
running
[I 2024-10-07 13:48:57,528] Trial 68 finished with value: 0.052513527309312816 and parameters: {'model_name': 'IterativeImputer', 'estimator': 'RFR', 'initial_strategy': 'median', 'n_nearest_features': 10, 'imputation_order': 'descending'}. Best is trial 55 with value: 0.05238939134313201.
running
[I 2024-10-07 13:48:58,309] Trial 75 finished with value: 0.10158907480741546 and parameters: {'model_name': 'SimpleImputer', 'strategy': 'median'}. Best is trial 55 with value: 0.05238939134313201.
running
[I 2024-10-07 13:59:50,717] Trial 40 finished with value: 0.09896697085246656 and parameters: {'model_name': 'VAE', 'batch_size': 109, 'iterations': 6902, 'learning_rate': 0.0013674399004039422, 'p_miss': 0.23538822056397404}. Best is trial 55 with value: 0.05238939134313201.
running
[I 2024-10-07 14:00:35,041] Trial 69 finished with value: 0.05258555562137994 and parameters: {'model_name': 'IterativeImputer', 'estimator': 'RFR', 'initial_strategy': 'median', 'n_nearest_features': 11, 'imputation_order': 'descending'}. Best is trial 55 with value: 0.05238939134313201.
running
[I 2024-10-07 14:05:04,123] Trial 70 finished with value: 0.052421592088270574 and parameters: {'model_name': 'IterativeImputer', 'estimator': 'RFR', 'initial_strategy': 'most_frequent', 'n_nearest_features': 11, 'imputation_order': 'descending'}. Best is trial 55 with value: 0.05238939134313201.
running
[I 2024-10-07 14:08:46,641] Trial 73 finished with value: 0.052496986882319505 and parameters: {'model_name': 'IterativeImputer', 'estimator': 'RFR', 'initial_strategy': 'most_frequent', 'n_nearest_features': 10, 'imputation_order': 'descending'}. Best is trial 55 with value: 0.05238939134313201.
running
[I 2024-10-07 14:22:11,827] Trial 74 finished with value: 0.05210967171280036 and parameters: {'model_name': 'IterativeImputer', 'estimator': 'RFR', 'initial_strategy': 'most_frequent', 'n_nearest_features': 10, 'imputation_order': 'roman'}. Best is trial 74 with value: 0.05210967171280036.
running
[I 2024-10-07 14:31:11,239] Trial 76 finished with value: 0.052097870268951366 and parameters: {'model_name': 'IterativeImputer', 'estimator': 'RFR', 'initial_strategy': 'most_frequent', 'n_nearest_features': 10, 'imputation_order': 'descending'}. Best is trial 76 with value: 0.052097870268951366.
running
[I 2024-10-07 14:32:56,948] Trial 82 finished with value: 0.10497484302325147 and parameters: {'model_name': 'IterativeImputer', 'estimator': 'Bayesian', 'initial_strategy': 'most_frequent', 'n_nearest_features': 10, 'imputation_order': 'roman', 'sample_posterior': True}. Best is trial 76 with value: 0.052097870268951366.
running
[I 2024-10-07 14:33:01,287] Trial 83 finished with value: 0.09983845368176915 and parameters: {'model_name': 'KNNImputer', 'n_neighbors': 5147, 'weights': 'uniform'}. Best is trial 76 with value: 0.052097870268951366.
running
[I 2024-10-07 14:34:13,875] Trial 84 finished with value: 0.12594503981831146 and parameters: {'model_name': 'IterativeImputer', 'estimator': 'Bayesian', 'initial_strategy': 'most_frequent', 'n_nearest_features': 3, 'imputation_order': 'roman', 'sample_posterior': True}. Best is trial 76 with value: 0.052097870268951366.
running
[I 2024-10-07 14:43:06,866] Trial 77 finished with value: 0.05259139965017221 and parameters: {'model_name': 'IterativeImputer', 'estimator': 'RFR', 'initial_strategy': 'most_frequent', 'n_nearest_features': 10, 'imputation_order': 'descending'}. Best is trial 76 with value: 0.052097870268951366.
running
[I 2024-10-07 14:44:58,206] Trial 78 finished with value: 0.05249335268829741 and parameters: {'model_name': 'IterativeImputer', 'estimator': 'RFR', 'initial_strategy': 'most_frequent', 'n_nearest_features': 10, 'imputation_order': 'roman'}. Best is trial 76 with value: 0.052097870268951366.
running
[I 2024-10-07 14:47:43,034] Trial 79 finished with value: 0.05254319935032705 and parameters: {'model_name': 'IterativeImputer', 'estimator': 'RFR', 'initial_strategy': 'most_frequent', 'n_nearest_features': 10, 'imputation_order': 'roman'}. Best is trial 76 with value: 0.052097870268951366.
running
[I 2024-10-07 14:49:26,010] Trial 30 finished with value: 0.09857906156615809 and parameters: {'model_name': 'VAE', 'batch_size': 826, 'iterations': 4986, 'learning_rate': 0.00010104803063400285, 'p_miss': 0.011593444542137482}. Best is trial 76 with value: 0.052097870268951366.
running
