[I 2024-10-22 05:44:44,616] Trial 84 finished with value: 0.16127006511662997 and parameters: {'model_name': 'IterativeImputer', 'estimator': 'RFR', 'initial_strategy': 'most_frequent', 'n_nearest_features': 9, 'imputation_order': 'arabic'}. Best is trial 47 with value: 0.16071067842782566.
running
[I 2024-10-22 06:13:50,785] Trial 85 finished with value: 0.23861013961228936 and parameters: {'model_name': 'VAE', 'batch_size': 2, 'iterations': 1836, 'learning_rate': 0.0008013315636957147, 'p_miss': 0.2941792129765807}. Best is trial 47 with value: 0.16071067842782566.
running
[I 2024-10-22 06:30:22,811] Trial 22 finished with value: 0.21774942894276697 and parameters: {'model_name': 'VAE', 'batch_size': 699, 'iterations': 4849, 'learning_rate': 0.01453454400069783, 'p_miss': 0.2782624664869126}. Best is trial 47 with value: 0.16071067842782566.
running
[I 2024-10-22 06:34:53,168] Trial 87 finished with value: 0.1609924328406421 and parameters: {'model_name': 'IterativeImputer', 'estimator': 'RFR', 'initial_strategy': 'most_frequent', 'n_nearest_features': 9, 'imputation_order': 'arabic'}. Best is trial 47 with value: 0.16071067842782566.
running
[I 2024-10-22 06:37:19,766] Trial 88 finished with value: 0.16155165821236459 and parameters: {'model_name': 'IterativeImputer', 'estimator': 'RFR', 'initial_strategy': 'most_frequent', 'n_nearest_features': 9, 'imputation_order': 'arabic'}. Best is trial 47 with value: 0.16071067842782566.
running
[I 2024-10-22 06:37:40,003] Trial 94 finished with value: 0.17854774780937607 and parameters: {'model_name': 'KNNImputer', 'n_neighbors': 526, 'weights': 'uniform'}. Best is trial 47 with value: 0.16071067842782566.
running
[I 2024-10-22 06:38:46,987] Trial 73 finished with value: 0.21865314292951493 and parameters: {'model_name': 'VAE', 'batch_size': 18, 'iterations': 2459, 'learning_rate': 0.0006097000104313281, 'p_miss': 0.014305268092797307}. Best is trial 47 with value: 0.16071067842782566.
running
[I 2024-10-22 06:43:14,419] Trial 77 finished with value: 0.2178426331347349 and parameters: {'model_name': 'VAE', 'batch_size': 966, 'iterations': 2576, 'learning_rate': 0.0006862651840537852, 'p_miss': 0.011027470244659637}. Best is trial 47 with value: 0.16071067842782566.
running
[I 2024-10-22 06:57:52,099] Trial 89 finished with value: 0.16129968961103439 and parameters: {'model_name': 'IterativeImputer', 'estimator': 'RFR', 'initial_strategy': 'most_frequent', 'n_nearest_features': 9, 'imputation_order': 'arabic'}. Best is trial 47 with value: 0.16071067842782566.
running
[I 2024-10-22 07:02:44,123] Trial 79 finished with value: 0.21762955593866867 and parameters: {'model_name': 'VAE', 'batch_size': 980, 'iterations': 2646, 'learning_rate': 0.0006656401744874441, 'p_miss': 0.2968375040534679}. Best is trial 47 with value: 0.16071067842782566.
running
[I 2024-10-22 07:17:35,615] Trial 90 finished with value: 0.16089449980583093 and parameters: {'model_name': 'IterativeImputer', 'estimator': 'RFR', 'initial_strategy': 'most_frequent', 'n_nearest_features': 9, 'imputation_order': 'arabic'}. Best is trial 47 with value: 0.16071067842782566.
running
[I 2024-10-22 07:44:41,687] Trial 91 finished with value: 0.16087803996178668 and parameters: {'model_name': 'IterativeImputer', 'estimator': 'RFR', 'initial_strategy': 'most_frequent', 'n_nearest_features': 9, 'imputation_order': 'arabic'}. Best is trial 47 with value: 0.16071067842782566.
running
[I 2024-10-22 07:55:26,075] Trial 76 finished with value: 0.21795523360639996 and parameters: {'model_name': 'VAE', 'batch_size': 645, 'iterations': 4706, 'learning_rate': 0.0006333172060877849, 'p_miss': 0.2916408428671772}. Best is trial 47 with value: 0.16071067842782566.
running
[I 2024-10-22 07:58:58,932] Trial 92 finished with value: 0.16139117201367262 and parameters: {'model_name': 'IterativeImputer', 'estimator': 'RFR', 'initial_strategy': 'most_frequent', 'n_nearest_features': 9, 'imputation_order': 'arabic'}. Best is trial 47 with value: 0.16071067842782566.
running
[I 2024-10-22 08:04:03,224] Trial 93 finished with value: 0.1615979650295008 and parameters: {'model_name': 'IterativeImputer', 'estimator': 'RFR', 'initial_strategy': 'most_frequent', 'n_nearest_features': 9, 'imputation_order': 'arabic'}. Best is trial 47 with value: 0.16071067842782566.
running
[I 2024-10-22 08:06:30,354] Trial 95 finished with value: 0.16092442673290405 and parameters: {'model_name': 'IterativeImputer', 'estimator': 'RFR', 'initial_strategy': 'most_frequent', 'n_nearest_features': 9, 'imputation_order': 'arabic'}. Best is trial 47 with value: 0.16071067842782566.
running
[I 2024-10-22 08:07:54,800] Trial 96 finished with value: 0.16089997587022906 and parameters: {'model_name': 'IterativeImputer', 'estimator': 'RFR', 'initial_strategy': 'most_frequent', 'n_nearest_features': 9, 'imputation_order': 'arabic'}. Best is trial 47 with value: 0.16071067842782566.
running
[I 2024-10-22 08:11:16,356] Trial 97 finished with value: 0.1610549856836343 and parameters: {'model_name': 'IterativeImputer', 'estimator': 'RFR', 'initial_strategy': 'most_frequent', 'n_nearest_features': 9, 'imputation_order': 'arabic'}. Best is trial 47 with value: 0.16071067842782566.
running
[I 2024-10-22 08:26:06,700] Trial 98 finished with value: 0.160941280200724 and parameters: {'model_name': 'IterativeImputer', 'estimator': 'RFR', 'initial_strategy': 'most_frequent', 'n_nearest_features': 9, 'imputation_order': 'arabic'}. Best is trial 47 with value: 0.16071067842782566.
running
[I 2024-10-22 08:27:11,062] Trial 103 finished with value: 0.20862836754579597 and parameters: {'model_name': 'IterativeImputer', 'estimator': 'RFR', 'initial_strategy': 'most_frequent', 'n_nearest_features': 1, 'imputation_order': 'arabic'}. Best is trial 47 with value: 0.16071067842782566.
running
[I 2024-10-22 08:31:16,060] Trial 99 finished with value: 0.16129092783901072 and parameters: {'model_name': 'IterativeImputer', 'estimator': 'RFR', 'initial_strategy': 'most_frequent', 'n_nearest_features': 9, 'imputation_order': 'arabic'}. Best is trial 47 with value: 0.16071067842782566.
running
[I 2024-10-22 08:34:09,010] Trial 74 finished with value: 0.21761558844145826 and parameters: {'model_name': 'VAE', 'batch_size': 789, 'iterations': 5386, 'learning_rate': 0.000694310586884101, 'p_miss': 0.012010221051642983}. Best is trial 47 with value: 0.16071067842782566.
running
[I 2024-10-22 08:45:47,126] Trial 100 finished with value: 0.16140320368013816 and parameters: {'model_name': 'IterativeImputer', 'estimator': 'RFR', 'initial_strategy': 'most_frequent', 'n_nearest_features': 9, 'imputation_order': 'arabic'}. Best is trial 47 with value: 0.16071067842782566.
running
[I 2024-10-22 08:52:42,516] Trial 108 finished with value: 0.20622904769623407 and parameters: {'model_name': 'IterativeImputer', 'estimator': 'RFR', 'initial_strategy': 'median', 'n_nearest_features': 1, 'imputation_order': 'random'}. Best is trial 47 with value: 0.16071067842782566.
running
[I 2024-10-22 08:54:19,193] Trial 113 finished with value: 0.23610063678019771 and parameters: {'model_name': 'IterativeImputer', 'estimator': 'Bayesian', 'initial_strategy': 'most_frequent', 'n_nearest_features': 9, 'imputation_order': 'arabic', 'sample_posterior': True}. Best is trial 47 with value: 0.16071067842782566.
running
[I 2024-10-22 08:54:19,696] Trial 114 finished with value: 0.27649210471238905 and parameters: {'model_name': 'SimpleImputer', 'strategy': 'constant'}. Best is trial 47 with value: 0.16071067842782566.
running
[I 2024-10-22 09:11:09,000] Trial 101 finished with value: 0.16102305869665245 and parameters: {'model_name': 'IterativeImputer', 'estimator': 'RFR', 'initial_strategy': 'most_frequent', 'n_nearest_features': 9, 'imputation_order': 'arabic'}. Best is trial 47 with value: 0.16071067842782566.
running
[I 2024-10-22 09:20:45,482] Trial 102 finished with value: 0.16103928776949702 and parameters: {'model_name': 'IterativeImputer', 'estimator': 'RFR', 'initial_strategy': 'most_frequent', 'n_nearest_features': 9, 'imputation_order': 'arabic'}. Best is trial 47 with value: 0.16071067842782566.
running
[I 2024-10-22 09:28:17,054] Trial 72 finished with value: 0.21799524056923136 and parameters: {'model_name': 'VAE', 'batch_size': 957, 'iterations': 7192, 'learning_rate': 0.0007730579356308191, 'p_miss': 0.026764146576094022}. Best is trial 47 with value: 0.16071067842782566.
running
[I 2024-10-22 09:29:24,756] Trial 104 finished with value: 0.16100448786131955 and parameters: {'model_name': 'IterativeImputer', 'estimator': 'RFR', 'initial_strategy': 'most_frequent', 'n_nearest_features': 9, 'imputation_order': 'arabic'}. Best is trial 47 with value: 0.16071067842782566.
running
[I 2024-10-22 09:31:19,945] Trial 105 finished with value: 0.16073882510251863 and parameters: {'model_name': 'IterativeImputer', 'estimator': 'RFR', 'initial_strategy': 'most_frequent', 'n_nearest_features': 9, 'imputation_order': 'random'}. Best is trial 47 with value: 0.16071067842782566.
running
[I 2024-10-22 09:33:23,593] Trial 106 finished with value: 0.1610705485193893 and parameters: {'model_name': 'IterativeImputer', 'estimator': 'RFR', 'initial_strategy': 'most_frequent', 'n_nearest_features': 9, 'imputation_order': 'arabic'}. Best is trial 47 with value: 0.16071067842782566.
running
[I 2024-10-22 09:35:31,646] Trial 107 finished with value: 0.16043796504570268 and parameters: {'model_name': 'IterativeImputer', 'estimator': 'RFR', 'initial_strategy': 'median', 'n_nearest_features': 9, 'imputation_order': 'random'}. Best is trial 107 with value: 0.16043796504570268.
running
[I 2024-10-22 09:49:01,296] Trial 75 finished with value: 0.21763888423488664 and parameters: {'model_name': 'VAE', 'batch_size': 883, 'iterations': 7372, 'learning_rate': 0.000588981878263142, 'p_miss': 0.011544507814234772}. Best is trial 107 with value: 0.16043796504570268.
running
[I 2024-10-22 09:49:28,319] Trial 109 finished with value: 0.16086848286818284 and parameters: {'model_name': 'IterativeImputer', 'estimator': 'RFR', 'initial_strategy': 'median', 'n_nearest_features': 9, 'imputation_order': 'random'}. Best is trial 107 with value: 0.16043796504570268.
running
[I 2024-10-22 09:52:14,452] Trial 78 finished with value: 0.2175969717886943 and parameters: {'model_name': 'VAE', 'batch_size': 816, 'iterations': 7710, 'learning_rate': 0.0007561033289306331, 'p_miss': 0.29989219053401006}. Best is trial 107 with value: 0.16043796504570268.
running
[I 2024-10-22 09:53:21,299] Trial 110 finished with value: 0.16070687889591873 and parameters: {'model_name': 'IterativeImputer', 'estimator': 'RFR', 'initial_strategy': 'median', 'n_nearest_features': 9, 'imputation_order': 'random'}. Best is trial 107 with value: 0.16043796504570268.
running
[I 2024-10-22 09:55:15,051] Trial 111 finished with value: 0.16089352928213882 and parameters: {'model_name': 'IterativeImputer', 'estimator': 'RFR', 'initial_strategy': 'median', 'n_nearest_features': 9, 'imputation_order': 'arabic'}. Best is trial 107 with value: 0.16043796504570268.
running
[I 2024-10-22 10:00:09,268] Trial 71 finished with value: 0.21801915895572357 and parameters: {'model_name': 'VAE', 'batch_size': 662, 'iterations': 9061, 'learning_rate': 0.0008771305517214505, 'p_miss': 0.29857583598954707}. Best is trial 107 with value: 0.16043796504570268.
running
[I 2024-10-22 10:02:29,344] Trial 80 finished with value: 0.2202326659672531 and parameters: {'model_name': 'VAE', 'batch_size': 23, 'iterations': 9362, 'learning_rate': 0.0007309717960428932, 'p_miss': 0.016975534376762552}. Best is trial 107 with value: 0.16043796504570268.
running
[I 2024-10-22 10:04:36,110] Trial 112 finished with value: 0.16087392342151519 and parameters: {'model_name': 'IterativeImputer', 'estimator': 'RFR', 'initial_strategy': 'median', 'n_nearest_features': 9, 'imputation_order': 'random'}. Best is trial 107 with value: 0.16043796504570268.
running
[I 2024-10-22 10:10:37,921] Trial 115 finished with value: 0.16065507242575613 and parameters: {'model_name': 'IterativeImputer', 'estimator': 'RFR', 'initial_strategy': 'most_frequent', 'n_nearest_features': 9, 'imputation_order': 'arabic'}. Best is trial 107 with value: 0.16043796504570268.
running
[I 2024-10-22 10:23:10,626] Trial 116 finished with value: 0.1611167798074155 and parameters: {'model_name': 'IterativeImputer', 'estimator': 'RFR', 'initial_strategy': 'most_frequent', 'n_nearest_features': 9, 'imputation_order': 'arabic'}. Best is trial 107 with value: 0.16043796504570268.
running
[I 2024-10-22 10:30:09,375] Trial 117 finished with value: 0.16091842675493334 and parameters: {'model_name': 'IterativeImputer', 'estimator': 'RFR', 'initial_strategy': 'most_frequent', 'n_nearest_features': 9, 'imputation_order': 'arabic'}. Best is trial 107 with value: 0.16043796504570268.
running
[I 2024-10-22 10:36:16,347] Trial 118 finished with value: 0.16090265231897108 and parameters: {'model_name': 'IterativeImputer', 'estimator': 'RFR', 'initial_strategy': 'most_frequent', 'n_nearest_features': 9, 'imputation_order': 'arabic'}. Best is trial 107 with value: 0.16043796504570268.
running
[I 2024-10-22 10:36:53,638] Trial 134 finished with value: 0.23297858525000534 and parameters: {'model_name': 'IterativeImputer', 'estimator': 'Bayesian', 'initial_strategy': 'median', 'n_nearest_features': 9, 'imputation_order': 'random', 'sample_posterior': True}. Best is trial 107 with value: 0.16043796504570268.
running
[I 2024-10-22 10:37:11,123] Trial 135 finished with value: 0.2054070437026981 and parameters: {'model_name': 'KNNImputer', 'n_neighbors': 8966, 'weights': 'uniform'}. Best is trial 107 with value: 0.16043796504570268.
running
[I 2024-10-22 10:37:24,181] Trial 119 finished with value: 0.1604895867245963 and parameters: {'model_name': 'IterativeImputer', 'estimator': 'RFR', 'initial_strategy': 'most_frequent', 'n_nearest_features': 9, 'imputation_order': 'random'}. Best is trial 107 with value: 0.16043796504570268.
running
[I 2024-10-22 10:38:58,143] Trial 120 finished with value: 0.16097334824439283 and parameters: {'model_name': 'IterativeImputer', 'estimator': 'RFR', 'initial_strategy': 'constant', 'n_nearest_features': 9, 'imputation_order': 'random'}. Best is trial 107 with value: 0.16043796504570268.
running
[I 2024-10-22 10:40:51,264] Trial 121 finished with value: 0.16086571727897184 and parameters: {'model_name': 'IterativeImputer', 'estimator': 'RFR', 'initial_strategy': 'constant', 'n_nearest_features': 9, 'imputation_order': 'random'}. Best is trial 107 with value: 0.16043796504570268.
running
[I 2024-10-22 10:42:21,848] Trial 122 finished with value: 0.16047842148010377 and parameters: {'model_name': 'IterativeImputer', 'estimator': 'RFR', 'initial_strategy': 'median', 'n_nearest_features': 9, 'imputation_order': 'random'}. Best is trial 107 with value: 0.16043796504570268.
running
[I 2024-10-22 10:53:11,765] Trial 123 finished with value: 0.160841378814815 and parameters: {'model_name': 'IterativeImputer', 'estimator': 'RFR', 'initial_strategy': 'median', 'n_nearest_features': 9, 'imputation_order': 'random'}. Best is trial 107 with value: 0.16043796504570268.
running
[I 2024-10-22 10:53:39,797] Trial 124 finished with value: 0.16092829822061797 and parameters: {'model_name': 'IterativeImputer', 'estimator': 'RFR', 'initial_strategy': 'median', 'n_nearest_features': 9, 'imputation_order': 'random'}. Best is trial 107 with value: 0.16043796504570268.
running
[I 2024-10-22 10:55:57,690] Trial 125 finished with value: 0.16061920573509497 and parameters: {'model_name': 'IterativeImputer', 'estimator': 'RFR', 'initial_strategy': 'median', 'n_nearest_features': 9, 'imputation_order': 'random'}. Best is trial 107 with value: 0.16043796504570268.
running
[I 2024-10-22 10:55:58,399] Trial 143 finished with value: 0.27449040421106186 and parameters: {'model_name': 'GAIN', 'batch_size': 300, 'hint_rate': 0.9838610366635703, 'alpha': 54, 'iterations': 10, 'learning_rate': 0.00678856037566303, 'p_miss': 0.1067013680313839}. Best is trial 107 with value: 0.16043796504570268.
running
[I 2024-10-22 10:57:00,014] Trial 126 finished with value: 0.16067399330347273 and parameters: {'model_name': 'IterativeImputer', 'estimator': 'RFR', 'initial_strategy': 'median', 'n_nearest_features': 9, 'imputation_order': 'random'}. Best is trial 107 with value: 0.16043796504570268.
running
[I 2024-10-22 10:57:00,292] Trial 145 finished with value: 0.26342172599851416 and parameters: {'model_name': 'SimpleImputer', 'strategy': 'most_frequent'}. Best is trial 107 with value: 0.16043796504570268.
running
[I 2024-10-22 10:58:40,478] Trial 127 finished with value: 0.16083250071688568 and parameters: {'model_name': 'IterativeImputer', 'estimator': 'RFR', 'initial_strategy': 'median', 'n_nearest_features': 9, 'imputation_order': 'random'}. Best is trial 107 with value: 0.16043796504570268.
running
[I 2024-10-22 10:59:26,042] Trial 147 finished with value: 0.17486794042381176 and parameters: {'model_name': 'IterativeImputer', 'estimator': 'KNN', 'initial_strategy': 'median', 'n_nearest_features': 8, 'imputation_order': 'random'}. Best is trial 107 with value: 0.16043796504570268.
running
[I 2024-10-22 11:03:11,558] Trial 128 finished with value: 0.16097194977220236 and parameters: {'model_name': 'IterativeImputer', 'estimator': 'RFR', 'initial_strategy': 'median', 'n_nearest_features': 9, 'imputation_order': 'random'}. Best is trial 107 with value: 0.16043796504570268.
running
[I 2024-10-22 11:05:29,806] Trial 129 finished with value: 0.16022705138057977 and parameters: {'model_name': 'IterativeImputer', 'estimator': 'RFR', 'initial_strategy': 'median', 'n_nearest_features': 9, 'imputation_order': 'random'}. Best is trial 129 with value: 0.16022705138057977.
running
[I 2024-10-22 11:07:31,246] Trial 130 finished with value: 0.16080463652216365 and parameters: {'model_name': 'IterativeImputer', 'estimator': 'RFR', 'initial_strategy': 'median', 'n_nearest_features': 9, 'imputation_order': 'random'}. Best is trial 129 with value: 0.16022705138057977.
running
[I 2024-10-22 11:13:53,043] Trial 131 finished with value: 0.16051129379433007 and parameters: {'model_name': 'IterativeImputer', 'estimator': 'RFR', 'initial_strategy': 'median', 'n_nearest_features': 9, 'imputation_order': 'random'}. Best is trial 129 with value: 0.16022705138057977.
running
[I 2024-10-22 11:15:56,013] Trial 142 finished with value: 0.18511417600592173 and parameters: {'model_name': 'IterativeImputer', 'estimator': 'RFR', 'initial_strategy': 'median', 'n_nearest_features': 3, 'imputation_order': 'random'}. Best is trial 129 with value: 0.16022705138057977.
running
[I 2024-10-22 11:21:07,456] Trial 150 finished with value: 0.19388413500811277 and parameters: {'model_name': 'IterativeImputer', 'estimator': 'RFR', 'initial_strategy': 'median', 'n_nearest_features': 2, 'imputation_order': 'random'}. Best is trial 129 with value: 0.16022705138057977.
running
[I 2024-10-22 11:21:47,184] Trial 148 finished with value: 0.18517960503913894 and parameters: {'model_name': 'IterativeImputer', 'estimator': 'RFR', 'initial_strategy': 'median', 'n_nearest_features': 3, 'imputation_order': 'random'}. Best is trial 129 with value: 0.16022705138057977.
running
[I 2024-10-22 11:23:16,440] Trial 141 finished with value: 0.17398151147048174 and parameters: {'model_name': 'IterativeImputer', 'estimator': 'RFR', 'initial_strategy': 'median', 'n_nearest_features': 4, 'imputation_order': 'random'}. Best is trial 129 with value: 0.16022705138057977.
running
[I 2024-10-22 11:26:34,581] Trial 132 finished with value: 0.16053741885551945 and parameters: {'model_name': 'IterativeImputer', 'estimator': 'RFR', 'initial_strategy': 'median', 'n_nearest_features': 9, 'imputation_order': 'random'}. Best is trial 129 with value: 0.16022705138057977.
running
[I 2024-10-22 11:29:50,871] Trial 151 finished with value: 0.18488957589596383 and parameters: {'model_name': 'IterativeImputer', 'estimator': 'RFR', 'initial_strategy': 'median', 'n_nearest_features': 3, 'imputation_order': 'random'}. Best is trial 129 with value: 0.16022705138057977.
running
[I 2024-10-22 11:33:40,298] Trial 133 finished with value: 0.16125738080874358 and parameters: {'model_name': 'IterativeImputer', 'estimator': 'RFR', 'initial_strategy': 'median', 'n_nearest_features': 9, 'imputation_order': 'random'}. Best is trial 129 with value: 0.16022705138057977.
running
[I 2024-10-22 11:35:55,258] Trial 152 finished with value: 0.18546169257628548 and parameters: {'model_name': 'IterativeImputer', 'estimator': 'RFR', 'initial_strategy': 'median', 'n_nearest_features': 3, 'imputation_order': 'random'}. Best is trial 129 with value: 0.16022705138057977.
running
[I 2024-10-22 11:40:14,402] Trial 136 finished with value: 0.161014468965594 and parameters: {'model_name': 'IterativeImputer', 'estimator': 'RFR', 'initial_strategy': 'median', 'n_nearest_features': 9, 'imputation_order': 'random'}. Best is trial 129 with value: 0.16022705138057977.
running
[I 2024-10-22 11:40:29,439] Trial 137 finished with value: 0.16060537597759192 and parameters: {'model_name': 'IterativeImputer', 'estimator': 'RFR', 'initial_strategy': 'median', 'n_nearest_features': 9, 'imputation_order': 'random'}. Best is trial 129 with value: 0.16022705138057977.
running
[I 2024-10-22 11:41:15,723] Trial 162 finished with value: 0.1748450913909115 and parameters: {'model_name': 'IterativeImputer', 'estimator': 'KNN', 'initial_strategy': 'median', 'n_nearest_features': 8, 'imputation_order': 'descending'}. Best is trial 129 with value: 0.16022705138057977.
running
[I 2024-10-22 11:42:17,143] Trial 138 finished with value: 0.16103994067605581 and parameters: {'model_name': 'IterativeImputer', 'estimator': 'RFR', 'initial_strategy': 'median', 'n_nearest_features': 9, 'imputation_order': 'random'}. Best is trial 129 with value: 0.16022705138057977.
running
