[I 2024-09-19 17:50:35,871] Trial 109 finished with value: 0.2762014619798761 and parameters: {'model_name': 'SimpleImputer', 'strategy': 'mean'}. Best is trial 5 with value: 0.2762014619798761.
running
[I 2024-09-19 17:50:35,974] Trial 104 finished with value: 0.2762014619798761 and parameters: {'model_name': 'SimpleImputer', 'strategy': 'mean'}. Best is trial 5 with value: 0.2762014619798761.
running
[I 2024-09-19 17:50:36,126] Trial 107 finished with value: 0.2762014619798761 and parameters: {'model_name': 'SimpleImputer', 'strategy': 'mean'}. Best is trial 5 with value: 0.2762014619798761.
[I 2024-09-19 17:50:36,215] Trial 105 finished with value: 0.2762014619798761 and parameters: {'model_name': 'SimpleImputer', 'strategy': 'mean'}. Best is trial 5 with value: 0.2762014619798761.
running
[I 2024-09-19 17:50:36,311] Trial 106 finished with value: 0.2762014619798761 and parameters: {'model_name': 'SimpleImputer', 'strategy': 'mean'}. Best is trial 5 with value: 0.2762014619798761.
running
running
[I 2024-09-19 17:50:36,426] Trial 111 finished with value: 0.2762014619798761 and parameters: {'model_name': 'SimpleImputer', 'strategy': 'mean'}. Best is trial 5 with value: 0.2762014619798761.
running
[I 2024-09-19 17:50:36,528] Trial 110 finished with value: 0.2762014619798761 and parameters: {'model_name': 'SimpleImputer', 'strategy': 'mean'}. Best is trial 5 with value: 0.2762014619798761.
[I 2024-09-19 17:50:36,629] Trial 112 finished with value: 0.2762014619798761 and parameters: {'model_name': 'SimpleImputer', 'strategy': 'mean'}. Best is trial 5 with value: 0.2762014619798761.
running
[I 2024-09-19 17:50:36,773] Trial 113 finished with value: 0.2762014619798761 and parameters: {'model_name': 'SimpleImputer', 'strategy': 'mean'}. Best is trial 5 with value: 0.2762014619798761.
running
[I 2024-09-19 17:50:36,885] Trial 108 finished with value: 0.2762014619798761 and parameters: {'model_name': 'SimpleImputer', 'strategy': 'mean'}. Best is trial 5 with value: 0.2762014619798761.
running
[I 2024-09-19 17:50:36,987] Trial 115 finished with value: 0.2762014619798761 and parameters: {'model_name': 'SimpleImputer', 'strategy': 'mean'}. Best is trial 5 with value: 0.2762014619798761.
running
[I 2024-09-19 17:50:37,080] Trial 114 finished with value: 0.2762014619798761 and parameters: {'model_name': 'SimpleImputer', 'strategy': 'mean'}. Best is trial 5 with value: 0.2762014619798761.
[I 2024-09-19 17:50:37,162] Trial 118 finished with value: 0.2762014619798761 and parameters: {'model_name': 'SimpleImputer', 'strategy': 'mean'}. Best is trial 5 with value: 0.2762014619798761.
running
running
running
[I 2024-09-19 17:50:37,329] Trial 119 finished with value: 0.2762014619798761 and parameters: {'model_name': 'SimpleImputer', 'strategy': 'mean'}. Best is trial 5 with value: 0.2762014619798761.
[I 2024-09-19 17:50:37,424] Trial 120 finished with value: 0.2762014619798761 and parameters: {'model_name': 'SimpleImputer', 'strategy': 'mean'}. Best is trial 5 with value: 0.2762014619798761.
running
running
[I 2024-09-19 17:50:37,560] Trial 117 finished with value: 0.2762014619798761 and parameters: {'model_name': 'SimpleImputer', 'strategy': 'mean'}. Best is trial 5 with value: 0.2762014619798761.
[I 2024-09-19 17:50:37,660] Trial 116 finished with value: 0.2762014619798761 and parameters: {'model_name': 'SimpleImputer', 'strategy': 'mean'}. Best is trial 5 with value: 0.2762014619798761.
running
running
[I 2024-09-19 17:50:37,947] Trial 128 finished with value: 0.2762014619798761 and parameters: {'model_name': 'SimpleImputer', 'strategy': 'mean'}. Best is trial 5 with value: 0.2762014619798761.
running
[I 2024-09-19 17:50:38,153] Trial 125 finished with value: 0.2762014619798761 and parameters: {'model_name': 'SimpleImputer', 'strategy': 'mean'}. Best is trial 5 with value: 0.2762014619798761.
running
[I 2024-09-19 17:50:38,667] Trial 124 finished with value: 0.5503655951571014 and parameters: {'model_name': 'SimpleImputer', 'strategy': 'most_frequent'}. Best is trial 5 with value: 0.2762014619798761.
running
[I 2024-09-19 17:50:38,824] Trial 126 finished with value: 0.5503655951571014 and parameters: {'model_name': 'SimpleImputer', 'strategy': 'most_frequent'}. Best is trial 5 with value: 0.2762014619798761.
[I 2024-09-19 17:50:38,922] Trial 122 finished with value: 0.5503655951571014 and parameters: {'model_name': 'SimpleImputer', 'strategy': 'most_frequent'}. Best is trial 5 with value: 0.2762014619798761.
running
[I 2024-09-19 17:50:39,012] Trial 121 finished with value: 0.5503655951571014 and parameters: {'model_name': 'SimpleImputer', 'strategy': 'most_frequent'}. Best is trial 5 with value: 0.2762014619798761.
running
running
[I 2024-09-19 17:50:39,177] Trial 130 finished with value: 0.5503655951571014 and parameters: {'model_name': 'SimpleImputer', 'strategy': 'most_frequent'}. Best is trial 5 with value: 0.2762014619798761.
running
[I 2024-09-19 17:50:39,308] Trial 129 finished with value: 0.5503655951571014 and parameters: {'model_name': 'SimpleImputer', 'strategy': 'most_frequent'}. Best is trial 5 with value: 0.2762014619798761.
running
[I 2024-09-19 17:50:39,429] Trial 123 finished with value: 0.5503655951571014 and parameters: {'model_name': 'SimpleImputer', 'strategy': 'most_frequent'}. Best is trial 5 with value: 0.2762014619798761.
[I 2024-09-19 17:50:39,436] Trial 133 finished with value: 0.5503655951571014 and parameters: {'model_name': 'SimpleImputer', 'strategy': 'most_frequent'}. Best is trial 5 with value: 0.2762014619798761.
[I 2024-09-19 17:50:39,664] Trial 142 finished with value: 0.5503655951571014 and parameters: {'model_name': 'SimpleImputer', 'strategy': 'constant'}. Best is trial 5 with value: 0.2762014619798761.
[I 2024-09-19 17:50:39,751] Trial 127 finished with value: 0.5503655951571014 and parameters: {'model_name': 'SimpleImputer', 'strategy': 'most_frequent'}. Best is trial 5 with value: 0.2762014619798761.
running
running
running
[I 2024-09-19 17:50:39,883] Trial 132 finished with value: 0.5503655951571014 and parameters: {'model_name': 'SimpleImputer', 'strategy': 'most_frequent'}. Best is trial 5 with value: 0.2762014619798761.
running
running
[I 2024-09-19 17:50:40,070] Trial 137 finished with value: 0.5503655951571014 and parameters: {'model_name': 'SimpleImputer', 'strategy': 'most_frequent'}. Best is trial 5 with value: 0.2762014619798761.
[I 2024-09-19 17:50:40,074] Trial 139 finished with value: 0.5503655951571014 and parameters: {'model_name': 'SimpleImputer', 'strategy': 'constant'}. Best is trial 5 with value: 0.2762014619798761.
[I 2024-09-19 17:50:40,264] Trial 140 finished with value: 0.2762014619798761 and parameters: {'model_name': 'SimpleImputer', 'strategy': 'mean'}. Best is trial 5 with value: 0.2762014619798761.
running
[I 2024-09-19 17:50:40,354] Trial 143 finished with value: 0.2762014619798761 and parameters: {'model_name': 'SimpleImputer', 'strategy': 'mean'}. Best is trial 5 with value: 0.2762014619798761.
running
[I 2024-09-19 17:50:40,467] Trial 144 finished with value: 0.5503655951571014 and parameters: {'model_name': 'SimpleImputer', 'strategy': 'constant'}. Best is trial 5 with value: 0.2762014619798761.
[I 2024-09-19 17:50:40,549] Trial 131 finished with value: 0.5503655951571014 and parameters: {'model_name': 'SimpleImputer', 'strategy': 'most_frequent'}. Best is trial 5 with value: 0.2762014619798761.
running
running
[I 2024-09-19 17:50:40,654] Trial 136 finished with value: 0.5503655951571014 and parameters: {'model_name': 'SimpleImputer', 'strategy': 'most_frequent'}. Best is trial 5 with value: 0.2762014619798761.
[I 2024-09-19 17:50:40,741] Trial 134 finished with value: 0.5503655951571014 and parameters: {'model_name': 'SimpleImputer', 'strategy': 'most_frequent'}. Best is trial 5 with value: 0.2762014619798761.
running
running
[I 2024-09-19 17:50:40,835] Trial 135 finished with value: 0.5503655951571014 and parameters: {'model_name': 'SimpleImputer', 'strategy': 'most_frequent'}. Best is trial 5 with value: 0.2762014619798761.
[I 2024-09-19 17:50:40,940] Trial 141 finished with value: 0.5503655951571014 and parameters: {'model_name': 'SimpleImputer', 'strategy': 'constant'}. Best is trial 5 with value: 0.2762014619798761.
[I 2024-09-19 17:50:41,032] Trial 145 finished with value: 0.2762014619798761 and parameters: {'model_name': 'SimpleImputer', 'strategy': 'mean'}. Best is trial 5 with value: 0.2762014619798761.
[I 2024-09-19 17:50:41,126] Trial 146 finished with value: 0.2762014619798761 and parameters: {'model_name': 'SimpleImputer', 'strategy': 'mean'}. Best is trial 5 with value: 0.2762014619798761.
[I 2024-09-19 17:50:41,207] Trial 147 finished with value: 0.2762014619798761 and parameters: {'model_name': 'SimpleImputer', 'strategy': 'mean'}. Best is trial 5 with value: 0.2762014619798761.
running
running
running
[I 2024-09-19 17:50:41,323] Trial 148 finished with value: 0.2762014619798761 and parameters: {'model_name': 'SimpleImputer', 'strategy': 'mean'}. Best is trial 5 with value: 0.2762014619798761.
running
running
running
running
[I 2024-09-19 17:50:41,496] Trial 150 finished with value: 0.2762014619798761 and parameters: {'model_name': 'SimpleImputer', 'strategy': 'mean'}. Best is trial 5 with value: 0.2762014619798761.
running
running
[I 2024-09-19 17:50:41,698] Trial 149 finished with value: 0.2762014619798761 and parameters: {'model_name': 'SimpleImputer', 'strategy': 'mean'}. Best is trial 5 with value: 0.2762014619798761.
running
[I 2024-09-19 17:50:41,821] Trial 151 finished with value: 0.2762014619798761 and parameters: {'model_name': 'SimpleImputer', 'strategy': 'mean'}. Best is trial 5 with value: 0.2762014619798761.
[I 2024-09-19 17:50:41,905] Trial 153 finished with value: 0.2762014619798761 and parameters: {'model_name': 'SimpleImputer', 'strategy': 'mean'}. Best is trial 5 with value: 0.2762014619798761.
running
running
[I 2024-09-19 17:50:42,039] Trial 138 finished with value: 0.5503655951571014 and parameters: {'model_name': 'SimpleImputer', 'strategy': 'most_frequent'}. Best is trial 5 with value: 0.2762014619798761.
[I 2024-09-19 17:50:42,128] Trial 154 finished with value: 0.2762014619798761 and parameters: {'model_name': 'SimpleImputer', 'strategy': 'mean'}. Best is trial 5 with value: 0.2762014619798761.
running
running
[I 2024-09-19 17:50:42,235] Trial 152 finished with value: 0.2762014619798761 and parameters: {'model_name': 'SimpleImputer', 'strategy': 'mean'}. Best is trial 5 with value: 0.2762014619798761.
running
[I 2024-09-19 17:50:42,385] Trial 155 finished with value: 0.2762014619798761 and parameters: {'model_name': 'SimpleImputer', 'strategy': 'mean'}. Best is trial 5 with value: 0.2762014619798761.
[I 2024-09-19 17:50:42,527] Trial 161 finished with value: 0.2762014619798761 and parameters: {'model_name': 'SimpleImputer', 'strategy': 'mean'}. Best is trial 5 with value: 0.2762014619798761.
running
running
[I 2024-09-19 17:50:42,644] Trial 157 finished with value: 0.2762014619798761 and parameters: {'model_name': 'SimpleImputer', 'strategy': 'mean'}. Best is trial 5 with value: 0.2762014619798761.
running
[I 2024-09-19 17:50:42,795] Trial 160 finished with value: 0.2762014619798761 and parameters: {'model_name': 'SimpleImputer', 'strategy': 'mean'}. Best is trial 5 with value: 0.2762014619798761.
[I 2024-09-19 17:50:42,906] Trial 158 finished with value: 0.2762014619798761 and parameters: {'model_name': 'SimpleImputer', 'strategy': 'mean'}. Best is trial 5 with value: 0.2762014619798761.
[I 2024-09-19 17:50:43,006] Trial 163 finished with value: 0.2762014619798761 and parameters: {'model_name': 'SimpleImputer', 'strategy': 'mean'}. Best is trial 5 with value: 0.2762014619798761.
running
running
[I 2024-09-19 17:50:43,099] Trial 162 finished with value: 0.2762014619798761 and parameters: {'model_name': 'SimpleImputer', 'strategy': 'mean'}. Best is trial 5 with value: 0.2762014619798761.
running
[I 2024-09-19 17:50:43,197] Trial 159 finished with value: 0.2762014619798761 and parameters: {'model_name': 'SimpleImputer', 'strategy': 'mean'}. Best is trial 5 with value: 0.2762014619798761.
[I 2024-09-19 17:50:43,309] Trial 167 finished with value: 0.2762014619798761 and parameters: {'model_name': 'SimpleImputer', 'strategy': 'mean'}. Best is trial 5 with value: 0.2762014619798761.
[I 2024-09-19 17:50:43,399] Trial 166 finished with value: 0.2762014619798761 and parameters: {'model_name': 'SimpleImputer', 'strategy': 'mean'}. Best is trial 5 with value: 0.2762014619798761.
running
running
running
running
[I 2024-09-19 17:50:43,531] Trial 164 finished with value: 0.2762014619798761 and parameters: {'model_name': 'SimpleImputer', 'strategy': 'mean'}. Best is trial 5 with value: 0.2762014619798761.
running
[I 2024-09-19 17:50:43,664] Trial 156 finished with value: 0.2762014619798761 and parameters: {'model_name': 'SimpleImputer', 'strategy': 'mean'}. Best is trial 5 with value: 0.2762014619798761.
running
[I 2024-09-19 17:50:43,769] Trial 165 finished with value: 0.2762014619798761 and parameters: {'model_name': 'SimpleImputer', 'strategy': 'mean'}. Best is trial 5 with value: 0.2762014619798761.
[I 2024-09-19 17:50:43,863] Trial 169 finished with value: 0.2762014619798761 and parameters: {'model_name': 'SimpleImputer', 'strategy': 'mean'}. Best is trial 5 with value: 0.2762014619798761.
running
running
[I 2024-09-19 17:50:43,977] Trial 172 finished with value: 0.2762014619798761 and parameters: {'model_name': 'SimpleImputer', 'strategy': 'mean'}. Best is trial 5 with value: 0.2762014619798761.
[I 2024-09-19 17:50:44,080] Trial 168 finished with value: 0.2762014619798761 and parameters: {'model_name': 'SimpleImputer', 'strategy': 'mean'}. Best is trial 5 with value: 0.2762014619798761.
running
running
[I 2024-09-19 17:50:44,192] Trial 175 finished with value: 0.2762014619798761 and parameters: {'model_name': 'SimpleImputer', 'strategy': 'mean'}. Best is trial 5 with value: 0.2762014619798761.
running
[I 2024-09-19 17:50:44,309] Trial 173 finished with value: 0.2762014619798761 and parameters: {'model_name': 'SimpleImputer', 'strategy': 'mean'}. Best is trial 5 with value: 0.2762014619798761.
running
[I 2024-09-19 17:50:44,412] Trial 170 finished with value: 0.2762014619798761 and parameters: {'model_name': 'SimpleImputer', 'strategy': 'mean'}. Best is trial 5 with value: 0.2762014619798761.
running
[I 2024-09-19 17:50:44,557] Trial 176 finished with value: 0.2762014619798761 and parameters: {'model_name': 'SimpleImputer', 'strategy': 'mean'}. Best is trial 5 with value: 0.2762014619798761.
running
[I 2024-09-19 17:50:44,719] Trial 171 finished with value: 0.2762014619798761 and parameters: {'model_name': 'SimpleImputer', 'strategy': 'mean'}. Best is trial 5 with value: 0.2762014619798761.
running
[I 2024-09-19 17:50:44,832] Trial 180 finished with value: 0.2762014619798761 and parameters: {'model_name': 'SimpleImputer', 'strategy': 'mean'}. Best is trial 5 with value: 0.2762014619798761.
running
[I 2024-09-19 17:50:44,936] Trial 182 finished with value: 0.2762014619798761 and parameters: {'model_name': 'SimpleImputer', 'strategy': 'mean'}. Best is trial 5 with value: 0.2762014619798761.
running
[I 2024-09-19 17:50:45,046] Trial 178 finished with value: 0.2762014619798761 and parameters: {'model_name': 'SimpleImputer', 'strategy': 'mean'}. Best is trial 5 with value: 0.2762014619798761.
running
[I 2024-09-19 17:50:45,152] Trial 177 finished with value: 0.2762014619798761 and parameters: {'model_name': 'SimpleImputer', 'strategy': 'mean'}. Best is trial 5 with value: 0.2762014619798761.
[I 2024-09-19 17:50:45,238] Trial 174 finished with value: 0.2762014619798761 and parameters: {'model_name': 'SimpleImputer', 'strategy': 'mean'}. Best is trial 5 with value: 0.2762014619798761.
[I 2024-09-19 17:50:45,333] Trial 183 finished with value: 0.2762014619798761 and parameters: {'model_name': 'SimpleImputer', 'strategy': 'mean'}. Best is trial 5 with value: 0.2762014619798761.
running
[I 2024-09-19 17:50:45,417] Trial 179 finished with value: 0.2762014619798761 and parameters: {'model_name': 'SimpleImputer', 'strategy': 'mean'}. Best is trial 5 with value: 0.2762014619798761.
running
[I 2024-09-19 17:50:45,510] Trial 181 finished with value: 0.2762014619798761 and parameters: {'model_name': 'SimpleImputer', 'strategy': 'mean'}. Best is trial 5 with value: 0.2762014619798761.
running
running
running
[I 2024-09-19 17:50:45,650] Trial 186 finished with value: 0.2762014619798761 and parameters: {'model_name': 'SimpleImputer', 'strategy': 'mean'}. Best is trial 5 with value: 0.2762014619798761.
[I 2024-09-19 17:50:45,756] Trial 184 finished with value: 0.2762014619798761 and parameters: {'model_name': 'SimpleImputer', 'strategy': 'mean'}. Best is trial 5 with value: 0.2762014619798761.
[I 2024-09-19 17:50:45,876] Trial 189 finished with value: 0.2762014619798761 and parameters: {'model_name': 'SimpleImputer', 'strategy': 'mean'}. Best is trial 5 with value: 0.2762014619798761.
[I 2024-09-19 17:50:45,997] Trial 187 finished with value: 0.2762014619798761 and parameters: {'model_name': 'SimpleImputer', 'strategy': 'mean'}. Best is trial 5 with value: 0.2762014619798761.
[I 2024-09-19 17:50:46,103] Trial 185 finished with value: 0.2762014619798761 and parameters: {'model_name': 'SimpleImputer', 'strategy': 'mean'}. Best is trial 5 with value: 0.2762014619798761.
[I 2024-09-19 17:50:46,197] Trial 188 finished with value: 0.2762014619798761 and parameters: {'model_name': 'SimpleImputer', 'strategy': 'mean'}. Best is trial 5 with value: 0.2762014619798761.
[I 2024-09-19 17:50:46,345] Trial 193 finished with value: 0.2762014619798761 and parameters: {'model_name': 'SimpleImputer', 'strategy': 'mean'}. Best is trial 5 with value: 0.2762014619798761.
[I 2024-09-19 17:50:46,445] Trial 199 finished with value: 0.2762014619798761 and parameters: {'model_name': 'SimpleImputer', 'strategy': 'mean'}. Best is trial 5 with value: 0.2762014619798761.
[I 2024-09-19 17:50:46,526] Trial 192 finished with value: 0.2762014619798761 and parameters: {'model_name': 'SimpleImputer', 'strategy': 'mean'}. Best is trial 5 with value: 0.2762014619798761.
[I 2024-09-19 17:50:46,604] Trial 198 finished with value: 0.2762014619798761 and parameters: {'model_name': 'SimpleImputer', 'strategy': 'mean'}. Best is trial 5 with value: 0.2762014619798761.
[I 2024-09-19 17:50:46,699] Trial 195 finished with value: 0.2762014619798761 and parameters: {'model_name': 'SimpleImputer', 'strategy': 'mean'}. Best is trial 5 with value: 0.2762014619798761.
[I 2024-09-19 17:50:46,781] Trial 197 finished with value: 0.2762014619798761 and parameters: {'model_name': 'SimpleImputer', 'strategy': 'mean'}. Best is trial 5 with value: 0.2762014619798761.
[I 2024-09-19 17:50:46,859] Trial 194 finished with value: 0.2762014619798761 and parameters: {'model_name': 'SimpleImputer', 'strategy': 'mean'}. Best is trial 5 with value: 0.2762014619798761.
[I 2024-09-19 17:50:46,943] Trial 191 finished with value: 0.2762014619798761 and parameters: {'model_name': 'SimpleImputer', 'strategy': 'mean'}. Best is trial 5 with value: 0.2762014619798761.
[I 2024-09-19 17:50:47,022] Trial 196 finished with value: 0.2762014619798761 and parameters: {'model_name': 'SimpleImputer', 'strategy': 'mean'}. Best is trial 5 with value: 0.2762014619798761.
