[I 2024-08-13 19:23:57,795] Trial 89 finished with value: 0.04717004053426334 and parameters: {'model_name': 'IterativeImputer', 'estimator': 'RFR', 'initial_strategy': 'most_frequent', 'n_nearest_features': 10, 'imputation_order': 'random'}. Best is trial 77 with value: 0.04712227312068532.
running
[I 2024-08-13 19:35:36,580] Trial 65 finished with value: 0.3048076871117691 and parameters: {'model_name': 'GAIN', 'batch_size': 892, 'hint_rate': 0.5356481547863245, 'alpha': 99, 'iterations': 7381, 'learning_rate': 0.00010557560471920202, 'p_miss': 0.014935260998678673}. Best is trial 77 with value: 0.04712227312068532.
running
[I 2024-08-13 19:38:35,543] Trial 90 finished with value: 0.047289341020441564 and parameters: {'model_name': 'IterativeImputer', 'estimator': 'RFR', 'initial_strategy': 'most_frequent', 'n_nearest_features': 10, 'imputation_order': 'random'}. Best is trial 77 with value: 0.04712227312068532.
running
[I 2024-08-13 19:40:29,623] Trial 91 finished with value: 0.04787791124265421 and parameters: {'model_name': 'IterativeImputer', 'estimator': 'RFR', 'initial_strategy': 'most_frequent', 'n_nearest_features': 10, 'imputation_order': 'random'}. Best is trial 77 with value: 0.04712227312068532.
running
[I 2024-08-13 19:40:54,298] Trial 81 finished with value: 0.3202570514470556 and parameters: {'model_name': 'GAIN', 'batch_size': 627, 'hint_rate': 0.03247541744678378, 'alpha': 99, 'iterations': 6435, 'learning_rate': 0.0971972403734791, 'p_miss': 0.1318555059590052}. Best is trial 77 with value: 0.04712227312068532.
running
[I 2024-08-13 19:47:05,875] Trial 92 finished with value: 0.047921352320816984 and parameters: {'model_name': 'IterativeImputer', 'estimator': 'RFR', 'initial_strategy': 'most_frequent', 'n_nearest_features': 10, 'imputation_order': 'random'}. Best is trial 77 with value: 0.04712227312068532.
running
[I 2024-08-13 19:48:09,150] Trial 93 finished with value: 0.0458692748749441 and parameters: {'model_name': 'IterativeImputer', 'estimator': 'RFR', 'initial_strategy': 'constant', 'n_nearest_features': 10, 'imputation_order': 'random'}. Best is trial 93 with value: 0.0458692748749441.
running
[I 2024-08-13 20:03:32,170] Trial 94 finished with value: 0.04856367089910518 and parameters: {'model_name': 'IterativeImputer', 'estimator': 'RFR', 'initial_strategy': 'constant', 'n_nearest_features': 10, 'imputation_order': 'random'}. Best is trial 93 with value: 0.0458692748749441.
running
[I 2024-08-13 20:16:46,556] Trial 95 finished with value: 0.047317584739321086 and parameters: {'model_name': 'IterativeImputer', 'estimator': 'RFR', 'initial_strategy': 'constant', 'n_nearest_features': 10, 'imputation_order': 'random'}. Best is trial 93 with value: 0.0458692748749441.
running
[I 2024-08-13 20:25:01,173] Trial 96 finished with value: 0.04854704561696359 and parameters: {'model_name': 'IterativeImputer', 'estimator': 'RFR', 'initial_strategy': 'constant', 'n_nearest_features': 9, 'imputation_order': 'random'}. Best is trial 93 with value: 0.0458692748749441.
running
[I 2024-08-13 20:26:07,965] Trial 60 finished with value: 0.30403583391856165 and parameters: {'model_name': 'GAIN', 'batch_size': 913, 'hint_rate': 0.5094362390193513, 'alpha': 89, 'iterations': 9068, 'learning_rate': 0.08445308021741567, 'p_miss': 0.013867449394248832}. Best is trial 93 with value: 0.0458692748749441.
running
[I 2024-08-13 20:36:58,523] Trial 97 finished with value: 0.04807620930634213 and parameters: {'model_name': 'IterativeImputer', 'estimator': 'RFR', 'initial_strategy': 'constant', 'n_nearest_features': 9, 'imputation_order': 'random'}. Best is trial 93 with value: 0.0458692748749441.
running
[I 2024-08-13 20:38:21,442] Trial 67 finished with value: 0.3030826868125356 and parameters: {'model_name': 'GAIN', 'batch_size': 901, 'hint_rate': 0.5379218564740975, 'alpha': 94, 'iterations': 9208, 'learning_rate': 0.08541023470929615, 'p_miss': 0.017874008475835285}. Best is trial 93 with value: 0.0458692748749441.
running
[I 2024-08-13 20:39:57,997] Trial 61 finished with value: 0.3053286919807222 and parameters: {'model_name': 'GAIN', 'batch_size': 979, 'hint_rate': 0.5852021822882658, 'alpha': 90, 'iterations': 9337, 'learning_rate': 0.09497812196453849, 'p_miss': 0.03126072461229766}. Best is trial 93 with value: 0.0458692748749441.
running
[I 2024-08-13 20:41:18,533] Trial 82 finished with value: 0.3228632262302978 and parameters: {'model_name': 'GAIN', 'batch_size': 622, 'hint_rate': 0.6885402644168837, 'alpha': 88, 'iterations': 9233, 'learning_rate': 0.06250454034887218, 'p_miss': 0.12933937942357474}. Best is trial 93 with value: 0.0458692748749441.
running
[I 2024-08-13 20:43:01,596] Trial 98 finished with value: 0.04831494572379133 and parameters: {'model_name': 'IterativeImputer', 'estimator': 'RFR', 'initial_strategy': 'most_frequent', 'n_nearest_features': 10, 'imputation_order': 'random'}. Best is trial 93 with value: 0.0458692748749441.
running
[I 2024-08-13 20:46:32,506] Trial 99 finished with value: 0.047380509917800635 and parameters: {'model_name': 'IterativeImputer', 'estimator': 'RFR', 'initial_strategy': 'constant', 'n_nearest_features': 9, 'imputation_order': 'random'}. Best is trial 93 with value: 0.0458692748749441.
running
[I 2024-08-13 20:55:48,576] Trial 100 finished with value: 0.047843314521042006 and parameters: {'model_name': 'IterativeImputer', 'estimator': 'RFR', 'initial_strategy': 'constant', 'n_nearest_features': 9, 'imputation_order': 'random'}. Best is trial 93 with value: 0.0458692748749441.
running
[I 2024-08-13 20:57:56,919] Trial 101 finished with value: 0.047598148956928876 and parameters: {'model_name': 'IterativeImputer', 'estimator': 'RFR', 'initial_strategy': 'most_frequent', 'n_nearest_features': 9, 'imputation_order': 'random'}. Best is trial 93 with value: 0.0458692748749441.
running
[I 2024-08-13 20:58:27,100] Trial 102 finished with value: 0.04736017333732441 and parameters: {'model_name': 'IterativeImputer', 'estimator': 'RFR', 'initial_strategy': 'constant', 'n_nearest_features': 9, 'imputation_order': 'random'}. Best is trial 93 with value: 0.0458692748749441.
running
[I 2024-08-13 20:59:04,197] Trial 103 finished with value: 0.04922264172041233 and parameters: {'model_name': 'IterativeImputer', 'estimator': 'RFR', 'initial_strategy': 'constant', 'n_nearest_features': 9, 'imputation_order': 'random'}. Best is trial 93 with value: 0.0458692748749441.
running
[I 2024-08-13 21:04:37,172] Trial 104 finished with value: 0.047578871120587306 and parameters: {'model_name': 'IterativeImputer', 'estimator': 'RFR', 'initial_strategy': 'most_frequent', 'n_nearest_features': 9, 'imputation_order': 'random'}. Best is trial 93 with value: 0.0458692748749441.
running
[I 2024-08-13 21:05:21,306] Trial 105 finished with value: 0.04762737735403688 and parameters: {'model_name': 'IterativeImputer', 'estimator': 'RFR', 'initial_strategy': 'constant', 'n_nearest_features': 9, 'imputation_order': 'random'}. Best is trial 93 with value: 0.0458692748749441.
running
[I 2024-08-13 21:05:38,631] Trial 120 finished with value: 0.055195071230561984 and parameters: {'model_name': 'IterativeImputer', 'estimator': 'Bayesian', 'initial_strategy': 'constant', 'n_nearest_features': 8, 'imputation_order': 'random', 'sample_posterior': False}. Best is trial 93 with value: 0.0458692748749441.
running
[I 2024-08-13 21:06:15,353] Trial 121 finished with value: 0.055195071230561984 and parameters: {'model_name': 'IterativeImputer', 'estimator': 'Bayesian', 'initial_strategy': 'constant', 'n_nearest_features': 8, 'imputation_order': 'random', 'sample_posterior': False}. Best is trial 93 with value: 0.0458692748749441.
running
[I 2024-08-13 21:18:46,412] Trial 106 finished with value: 0.04932318316750929 and parameters: {'model_name': 'IterativeImputer', 'estimator': 'RFR', 'initial_strategy': 'most_frequent', 'n_nearest_features': 9, 'imputation_order': 'random'}. Best is trial 93 with value: 0.0458692748749441.
running
[I 2024-08-13 21:29:42,563] Trial 107 finished with value: 0.04764263521181776 and parameters: {'model_name': 'IterativeImputer', 'estimator': 'RFR', 'initial_strategy': 'constant', 'n_nearest_features': 9, 'imputation_order': 'random'}. Best is trial 93 with value: 0.0458692748749441.
running
[I 2024-08-13 21:36:47,545] Trial 108 finished with value: 0.04817441708086083 and parameters: {'model_name': 'IterativeImputer', 'estimator': 'RFR', 'initial_strategy': 'most_frequent', 'n_nearest_features': 9, 'imputation_order': 'random'}. Best is trial 93 with value: 0.0458692748749441.
running
[I 2024-08-13 21:37:19,284] Trial 109 finished with value: 0.04914892125666938 and parameters: {'model_name': 'IterativeImputer', 'estimator': 'RFR', 'initial_strategy': 'most_frequent', 'n_nearest_features': 9, 'imputation_order': 'random'}. Best is trial 93 with value: 0.0458692748749441.
running
[I 2024-08-13 21:45:18,999] Trial 114 finished with value: 0.04951485029775508 and parameters: {'model_name': 'IterativeImputer', 'estimator': 'RFR', 'initial_strategy': 'most_frequent', 'n_nearest_features': 8, 'imputation_order': 'random'}. Best is trial 93 with value: 0.0458692748749441.
running
[I 2024-08-13 21:46:22,953] Trial 110 finished with value: 0.04800428350147011 and parameters: {'model_name': 'IterativeImputer', 'estimator': 'RFR', 'initial_strategy': 'most_frequent', 'n_nearest_features': 10, 'imputation_order': 'random'}. Best is trial 93 with value: 0.0458692748749441.
running
[I 2024-08-13 21:46:23,207] Trial 129 finished with value: 0.07137041862442584 and parameters: {'model_name': 'SimpleImputer', 'strategy': 'median'}. Best is trial 93 with value: 0.0458692748749441.
running
[I 2024-08-13 21:47:27,242] Trial 111 finished with value: 0.047484355872492126 and parameters: {'model_name': 'IterativeImputer', 'estimator': 'RFR', 'initial_strategy': 'most_frequent', 'n_nearest_features': 10, 'imputation_order': 'random'}. Best is trial 93 with value: 0.0458692748749441.
running
[I 2024-08-13 21:48:57,616] Trial 112 finished with value: 0.0488280783892596 and parameters: {'model_name': 'IterativeImputer', 'estimator': 'RFR', 'initial_strategy': 'most_frequent', 'n_nearest_features': 10, 'imputation_order': 'random'}. Best is trial 93 with value: 0.0458692748749441.
running
[I 2024-08-13 21:49:25,685] Trial 115 finished with value: 0.04800140800818415 and parameters: {'model_name': 'IterativeImputer', 'estimator': 'RFR', 'initial_strategy': 'constant', 'n_nearest_features': 8, 'imputation_order': 'random'}. Best is trial 93 with value: 0.0458692748749441.
running
[I 2024-08-13 21:50:42,141] Trial 113 finished with value: 0.048017199166686494 and parameters: {'model_name': 'IterativeImputer', 'estimator': 'RFR', 'initial_strategy': 'most_frequent', 'n_nearest_features': 10, 'imputation_order': 'random'}. Best is trial 93 with value: 0.0458692748749441.
running
[I 2024-08-13 21:58:46,471] Trial 116 finished with value: 0.04778034982550724 and parameters: {'model_name': 'IterativeImputer', 'estimator': 'RFR', 'initial_strategy': 'constant', 'n_nearest_features': 8, 'imputation_order': 'random'}. Best is trial 93 with value: 0.0458692748749441.
running
[I 2024-08-13 21:59:07,417] Trial 135 finished with value: 0.0641601271777624 and parameters: {'model_name': 'IterativeImputer', 'estimator': 'KNN', 'initial_strategy': 'constant', 'n_nearest_features': 4, 'imputation_order': 'roman'}. Best is trial 93 with value: 0.0458692748749441.
running
[I 2024-08-13 22:01:16,914] Trial 117 finished with value: 0.04887702932518051 and parameters: {'model_name': 'IterativeImputer', 'estimator': 'RFR', 'initial_strategy': 'constant', 'n_nearest_features': 8, 'imputation_order': 'random'}. Best is trial 93 with value: 0.0458692748749441.
running
[I 2024-08-13 22:01:58,181] Trial 118 finished with value: 0.0492052039337835 and parameters: {'model_name': 'IterativeImputer', 'estimator': 'RFR', 'initial_strategy': 'constant', 'n_nearest_features': 8, 'imputation_order': 'random'}. Best is trial 93 with value: 0.0458692748749441.
running
[I 2024-08-13 22:02:39,897] Trial 119 finished with value: 0.04950511988254665 and parameters: {'model_name': 'IterativeImputer', 'estimator': 'RFR', 'initial_strategy': 'constant', 'n_nearest_features': 8, 'imputation_order': 'random'}. Best is trial 93 with value: 0.0458692748749441.
running
[I 2024-08-13 22:03:12,850] Trial 139 finished with value: 0.056967635446168764 and parameters: {'model_name': 'IterativeImputer', 'estimator': 'Ridge', 'initial_strategy': 'mean', 'n_nearest_features': 6, 'imputation_order': 'arabic'}. Best is trial 93 with value: 0.0458692748749441.
running
[I 2024-08-13 22:08:54,206] Trial 122 finished with value: 0.048194015595058495 and parameters: {'model_name': 'IterativeImputer', 'estimator': 'RFR', 'initial_strategy': 'constant', 'n_nearest_features': 8, 'imputation_order': 'random'}. Best is trial 93 with value: 0.0458692748749441.
running
[I 2024-08-13 22:08:54,451] Trial 141 finished with value: 0.07618823314153232 and parameters: {'model_name': 'SimpleImputer', 'strategy': 'mean'}. Best is trial 93 with value: 0.0458692748749441.
running
[I 2024-08-13 22:09:08,804] Trial 123 finished with value: 0.04804842098674939 and parameters: {'model_name': 'IterativeImputer', 'estimator': 'RFR', 'initial_strategy': 'constant', 'n_nearest_features': 8, 'imputation_order': 'random'}. Best is trial 93 with value: 0.0458692748749441.
running
[I 2024-08-13 22:22:20,367] Trial 124 finished with value: 0.048307746883194946 and parameters: {'model_name': 'IterativeImputer', 'estimator': 'RFR', 'initial_strategy': 'constant', 'n_nearest_features': 8, 'imputation_order': 'arabic'}. Best is trial 93 with value: 0.0458692748749441.
running
[I 2024-08-13 22:23:44,307] Trial 144 finished with value: 0.10745091144369301 and parameters: {'model_name': 'IterativeImputer', 'estimator': 'Bayesian', 'initial_strategy': 'median', 'n_nearest_features': 10, 'imputation_order': 'descending', 'sample_posterior': True}. Best is trial 93 with value: 0.0458692748749441.
running
[I 2024-08-13 22:29:22,668] Trial 128 finished with value: 0.053663031371346225 and parameters: {'model_name': 'IterativeImputer', 'estimator': 'RFR', 'initial_strategy': 'constant', 'n_nearest_features': 5, 'imputation_order': 'roman'}. Best is trial 93 with value: 0.0458692748749441.
running
[I 2024-08-13 22:31:45,339] Trial 131 finished with value: 0.05238934732222791 and parameters: {'model_name': 'IterativeImputer', 'estimator': 'RFR', 'initial_strategy': 'constant', 'n_nearest_features': 5, 'imputation_order': 'roman'}. Best is trial 93 with value: 0.0458692748749441.
running
[I 2024-08-13 22:33:38,265] Trial 125 finished with value: 0.047785777054358644 and parameters: {'model_name': 'IterativeImputer', 'estimator': 'RFR', 'initial_strategy': 'constant', 'n_nearest_features': 8, 'imputation_order': 'random'}. Best is trial 93 with value: 0.0458692748749441.
running
[I 2024-08-13 22:40:43,228] Trial 126 finished with value: 0.04764309735001639 and parameters: {'model_name': 'IterativeImputer', 'estimator': 'RFR', 'initial_strategy': 'constant', 'n_nearest_features': 8, 'imputation_order': 'arabic'}. Best is trial 93 with value: 0.0458692748749441.
running
[I 2024-08-13 22:41:02,872] Trial 149 finished with value: 0.05887812361012297 and parameters: {'model_name': 'IterativeImputer', 'estimator': 'KNN', 'initial_strategy': 'most_frequent', 'n_nearest_features': 10, 'imputation_order': 'ascending'}. Best is trial 93 with value: 0.0458692748749441.
running
[I 2024-08-13 22:41:35,566] Trial 127 finished with value: 0.0485187350415413 and parameters: {'model_name': 'IterativeImputer', 'estimator': 'RFR', 'initial_strategy': 'constant', 'n_nearest_features': 8, 'imputation_order': 'arabic'}. Best is trial 93 with value: 0.0458692748749441.
running
[I 2024-08-13 22:50:06,258] Trial 130 finished with value: 0.04831585780577732 and parameters: {'model_name': 'IterativeImputer', 'estimator': 'RFR', 'initial_strategy': 'constant', 'n_nearest_features': 8, 'imputation_order': 'arabic'}. Best is trial 93 with value: 0.0458692748749441.
running
[I 2024-08-13 22:52:39,285] Trial 132 finished with value: 0.04826152731991011 and parameters: {'model_name': 'IterativeImputer', 'estimator': 'RFR', 'initial_strategy': 'constant', 'n_nearest_features': 8, 'imputation_order': 'roman'}. Best is trial 93 with value: 0.0458692748749441.
running
[I 2024-08-13 22:59:29,185] Trial 133 finished with value: 0.0472952797083835 and parameters: {'model_name': 'IterativeImputer', 'estimator': 'RFR', 'initial_strategy': 'constant', 'n_nearest_features': 10, 'imputation_order': 'roman'}. Best is trial 93 with value: 0.0458692748749441.
running
[I 2024-08-13 22:59:53,450] Trial 154 finished with value: 0.05622331297014427 and parameters: {'model_name': 'IterativeImputer', 'estimator': 'Ridge', 'initial_strategy': 'most_frequent', 'n_nearest_features': 10, 'imputation_order': 'ascending'}. Best is trial 93 with value: 0.0458692748749441.
running
[I 2024-08-13 22:59:53,704] Trial 155 finished with value: 0.07137041862442584 and parameters: {'model_name': 'SimpleImputer', 'strategy': 'median'}. Best is trial 93 with value: 0.0458692748749441.
running
[I 2024-08-13 23:00:59,862] Trial 134 finished with value: 0.047746212727196743 and parameters: {'model_name': 'IterativeImputer', 'estimator': 'RFR', 'initial_strategy': 'constant', 'n_nearest_features': 10, 'imputation_order': 'roman'}. Best is trial 93 with value: 0.0458692748749441.
running
[I 2024-08-13 23:09:00,816] Trial 136 finished with value: 0.048454856653079456 and parameters: {'model_name': 'IterativeImputer', 'estimator': 'RFR', 'initial_strategy': 'mean', 'n_nearest_features': 10, 'imputation_order': 'arabic'}. Best is trial 93 with value: 0.0458692748749441.
running
[I 2024-08-13 23:10:59,723] Trial 137 finished with value: 0.048583218396646234 and parameters: {'model_name': 'IterativeImputer', 'estimator': 'RFR', 'initial_strategy': 'mean', 'n_nearest_features': 10, 'imputation_order': 'descending'}. Best is trial 93 with value: 0.0458692748749441.
running
[I 2024-08-13 23:11:34,497] Trial 138 finished with value: 0.047836217754737426 and parameters: {'model_name': 'IterativeImputer', 'estimator': 'RFR', 'initial_strategy': 'mean', 'n_nearest_features': 10, 'imputation_order': 'arabic'}. Best is trial 93 with value: 0.0458692748749441.
running
[I 2024-08-13 23:12:28,199] Trial 140 finished with value: 0.04831869113127174 and parameters: {'model_name': 'IterativeImputer', 'estimator': 'RFR', 'initial_strategy': 'median', 'n_nearest_features': 10, 'imputation_order': 'descending'}. Best is trial 93 with value: 0.0458692748749441.
running
[I 2024-08-13 23:18:20,580] Trial 143 finished with value: 0.04807322305046576 and parameters: {'model_name': 'IterativeImputer', 'estimator': 'RFR', 'initial_strategy': 'median', 'n_nearest_features': 10, 'imputation_order': 'ascending'}. Best is trial 93 with value: 0.0458692748749441.
running
[I 2024-08-13 23:18:23,966] Trial 142 finished with value: 0.04871997479710863 and parameters: {'model_name': 'IterativeImputer', 'estimator': 'RFR', 'initial_strategy': 'median', 'n_nearest_features': 10, 'imputation_order': 'descending'}. Best is trial 93 with value: 0.0458692748749441.
running
[I 2024-08-13 23:31:27,409] Trial 145 finished with value: 0.047964243351178236 and parameters: {'model_name': 'IterativeImputer', 'estimator': 'RFR', 'initial_strategy': 'most_frequent', 'n_nearest_features': 10, 'imputation_order': 'ascending'}. Best is trial 93 with value: 0.0458692748749441.
running
[I 2024-08-13 23:31:29,846] Trial 164 finished with value: 0.06582306020121118 and parameters: {'model_name': 'KNNImputer', 'n_neighbors': 1230, 'weights': 'uniform'}. Best is trial 93 with value: 0.0458692748749441.
running
[I 2024-08-13 23:37:14,436] Trial 146 finished with value: 0.047725210334610677 and parameters: {'model_name': 'IterativeImputer', 'estimator': 'RFR', 'initial_strategy': 'most_frequent', 'n_nearest_features': 9, 'imputation_order': 'random'}. Best is trial 93 with value: 0.0458692748749441.
running
[I 2024-08-13 23:39:27,191] Trial 147 finished with value: 0.04736083859521438 and parameters: {'model_name': 'IterativeImputer', 'estimator': 'RFR', 'initial_strategy': 'most_frequent', 'n_nearest_features': 10, 'imputation_order': 'random'}. Best is trial 93 with value: 0.0458692748749441.
running
[I 2024-08-13 23:41:25,512] Trial 148 finished with value: 0.04784215887118469 and parameters: {'model_name': 'IterativeImputer', 'estimator': 'RFR', 'initial_strategy': 'most_frequent', 'n_nearest_features': 10, 'imputation_order': 'ascending'}. Best is trial 93 with value: 0.0458692748749441.
running
[I 2024-08-13 23:48:40,260] Trial 150 finished with value: 0.04817091157718997 and parameters: {'model_name': 'IterativeImputer', 'estimator': 'RFR', 'initial_strategy': 'most_frequent', 'n_nearest_features': 9, 'imputation_order': 'random'}. Best is trial 93 with value: 0.0458692748749441.
running
[I 2024-08-13 23:49:02,551] Trial 151 finished with value: 0.04798993288967889 and parameters: {'model_name': 'IterativeImputer', 'estimator': 'RFR', 'initial_strategy': 'most_frequent', 'n_nearest_features': 9, 'imputation_order': 'descending'}. Best is trial 93 with value: 0.0458692748749441.
running
[I 2024-08-13 23:57:51,832] Trial 152 finished with value: 0.048330307389690776 and parameters: {'model_name': 'IterativeImputer', 'estimator': 'RFR', 'initial_strategy': 'most_frequent', 'n_nearest_features': 9, 'imputation_order': 'random'}. Best is trial 93 with value: 0.0458692748749441.
running
[I 2024-08-14 00:00:17,756] Trial 153 finished with value: 0.04838990945722776 and parameters: {'model_name': 'IterativeImputer', 'estimator': 'RFR', 'initial_strategy': 'most_frequent', 'n_nearest_features': 9, 'imputation_order': 'descending'}. Best is trial 93 with value: 0.0458692748749441.
running
