[I 2024-08-15 23:55:13,545] Trial 199 finished with value: 0.07906713047117861 and parameters: {'model_name': 'SimpleImputer', 'strategy': 'median'}. Best is trial 6 with value: 0.07906713047117861.
[I 2024-08-15 23:57:03,636] Trial 27 finished with value: 0.08529922000682627 and parameters: {'model_name': 'IterativeImputer', 'estimator': 'RFR', 'initial_strategy': 'most_frequent', 'n_nearest_features': 6, 'imputation_order': 'random'}. Best is trial 6 with value: 0.07906713047117861.
[I 2024-08-16 00:12:08,165] Trial 140 finished with value: 0.08540454317852202 and parameters: {'model_name': 'IterativeImputer', 'estimator': 'RFR', 'initial_strategy': 'median', 'n_nearest_features': 6, 'imputation_order': 'random'}. Best is trial 6 with value: 0.07906713047117861.
slurmstepd: error: Detected 1 oom-kill event(s) in StepId=924541.0. Some of your processes may have been killed by the cgroup out-of-memory handler.
srun: error: esplhpc-cp003: task 0: Out Of Memory
slurmstepd: error: Detected 1 oom-kill event(s) in StepId=924541.batch. Some of your processes may have been killed by the cgroup out-of-memory handler.
