[I 2024-10-10 17:08:55,580] Trial 71 finished with value: 0.1300289684278088 and parameters: {'model_name': 'IterativeImputer', 'estimator': 'RFR', 'initial_strategy': 'median', 'n_nearest_features': 9, 'imputation_order': 'arabic'}. Best is trial 68 with value: 0.12923433356167482.
running
[I 2024-10-10 17:09:35,922] Trial 69 finished with value: 0.1294498799893872 and parameters: {'model_name': 'IterativeImputer', 'estimator': 'RFR', 'initial_strategy': 'constant', 'n_nearest_features': 9, 'imputation_order': 'random'}. Best is trial 68 with value: 0.12923433356167482.
running
[I 2024-10-10 17:09:44,433] Trial 72 finished with value: 0.12957473405705267 and parameters: {'model_name': 'IterativeImputer', 'estimator': 'RFR', 'initial_strategy': 'constant', 'n_nearest_features': 9, 'imputation_order': 'random'}. Best is trial 68 with value: 0.12923433356167482.
running
[I 2024-10-10 17:10:01,180] Trial 70 finished with value: 0.1303592469776001 and parameters: {'model_name': 'IterativeImputer', 'estimator': 'RFR', 'initial_strategy': 'constant', 'n_nearest_features': 9, 'imputation_order': 'random'}. Best is trial 68 with value: 0.12923433356167482.
running
[I 2024-10-10 17:10:39,174] Trial 92 finished with value: 0.17289567451170604 and parameters: {'model_name': 'KNNImputer', 'n_neighbors': 27885, 'weights': 'uniform'}. Best is trial 68 with value: 0.12923433356167482.
running
[I 2024-10-10 17:10:39,410] Trial 93 finished with value: 0.34796318353534084 and parameters: {'model_name': 'SimpleImputer', 'strategy': 'most_frequent'}. Best is trial 68 with value: 0.12923433356167482.
running
[I 2024-10-10 17:10:52,256] Trial 73 finished with value: 0.12927465677920452 and parameters: {'model_name': 'IterativeImputer', 'estimator': 'RFR', 'initial_strategy': 'constant', 'n_nearest_features': 9, 'imputation_order': 'random'}. Best is trial 68 with value: 0.12923433356167482.
running
[I 2024-10-10 17:11:01,391] Trial 94 finished with value: 0.15259075788315216 and parameters: {'model_name': 'IterativeImputer', 'estimator': 'KNN', 'initial_strategy': 'constant', 'n_nearest_features': 4, 'imputation_order': 'descending'}. Best is trial 68 with value: 0.12923433356167482.
running
[I 2024-10-10 17:11:10,272] Trial 95 finished with value: 0.15763006760653617 and parameters: {'model_name': 'IterativeImputer', 'estimator': 'KNN', 'initial_strategy': 'constant', 'n_nearest_features': 3, 'imputation_order': 'descending'}. Best is trial 68 with value: 0.12923433356167482.
running
[I 2024-10-10 17:22:33,488] Trial 96 finished with value: 0.15939644072301293 and parameters: {'model_name': 'IterativeImputer', 'estimator': 'RFR', 'initial_strategy': 'constant', 'n_nearest_features': 1, 'imputation_order': 'random'}. Best is trial 68 with value: 0.12923433356167482.
running
[I 2024-10-10 17:22:51,385] Trial 75 finished with value: 0.1298638755746413 and parameters: {'model_name': 'IterativeImputer', 'estimator': 'RFR', 'initial_strategy': 'median', 'n_nearest_features': 9, 'imputation_order': 'random'}. Best is trial 68 with value: 0.12923433356167482.
running
[I 2024-10-10 17:23:05,017] Trial 99 finished with value: 0.15727186919984712 and parameters: {'model_name': 'IterativeImputer', 'estimator': 'Ridge', 'initial_strategy': 'most_frequent', 'n_nearest_features': 8, 'imputation_order': 'random'}. Best is trial 68 with value: 0.12923433356167482.
running
[I 2024-10-10 17:34:02,596] Trial 76 finished with value: 0.12951521754090473 and parameters: {'model_name': 'IterativeImputer', 'estimator': 'RFR', 'initial_strategy': 'constant', 'n_nearest_features': 9, 'imputation_order': 'random'}. Best is trial 68 with value: 0.12923433356167482.
running
[I 2024-10-10 17:35:15,459] Trial 90 finished with value: 0.1623480045289531 and parameters: {'model_name': 'IterativeImputer', 'estimator': 'RFR', 'initial_strategy': 'constant', 'n_nearest_features': 2, 'imputation_order': 'random'}. Best is trial 68 with value: 0.12923433356167482.
running
[I 2024-10-10 17:35:22,388] Trial 91 finished with value: 0.16382109594767766 and parameters: {'model_name': 'IterativeImputer', 'estimator': 'RFR', 'initial_strategy': 'constant', 'n_nearest_features': 2, 'imputation_order': 'descending'}. Best is trial 68 with value: 0.12923433356167482.
running
[I 2024-10-10 18:18:31,192] Trial 77 finished with value: 0.12998759159224546 and parameters: {'model_name': 'IterativeImputer', 'estimator': 'RFR', 'initial_strategy': 'constant', 'n_nearest_features': 9, 'imputation_order': 'random'}. Best is trial 68 with value: 0.12923433356167482.
running
[I 2024-10-10 18:18:34,740] Trial 104 finished with value: inf and parameters: {'model_name': 'GAIN', 'batch_size': 5, 'hint_rate': 0.021294001345820657, 'alpha': 22, 'iterations': 849, 'learning_rate': 0.012922225864574309, 'p_miss': 0.08679360115355111}. Best is trial 68 with value: 0.12923433356167482.
running
[I 2024-10-10 18:26:10,081] Trial 78 finished with value: 0.12992553689075645 and parameters: {'model_name': 'IterativeImputer', 'estimator': 'RFR', 'initial_strategy': 'constant', 'n_nearest_features': 9, 'imputation_order': 'random'}. Best is trial 68 with value: 0.12923433356167482.
running
[I 2024-10-10 18:28:38,706] Trial 79 finished with value: 0.12992707660252614 and parameters: {'model_name': 'IterativeImputer', 'estimator': 'RFR', 'initial_strategy': 'constant', 'n_nearest_features': 9, 'imputation_order': 'random'}. Best is trial 68 with value: 0.12923433356167482.
running
[I 2024-10-10 18:46:01,908] Trial 81 finished with value: 0.12985292591792785 and parameters: {'model_name': 'IterativeImputer', 'estimator': 'RFR', 'initial_strategy': 'most_frequent', 'n_nearest_features': 8, 'imputation_order': 'descending'}. Best is trial 68 with value: 0.12923433356167482.
running
[I 2024-10-10 18:47:55,076] Trial 82 finished with value: 0.13002410468549294 and parameters: {'model_name': 'IterativeImputer', 'estimator': 'RFR', 'initial_strategy': 'constant', 'n_nearest_features': 8, 'imputation_order': 'descending'}. Best is trial 68 with value: 0.12923433356167482.
running
[I 2024-10-10 18:50:56,945] Trial 83 finished with value: 0.12986113309445074 and parameters: {'model_name': 'IterativeImputer', 'estimator': 'RFR', 'initial_strategy': 'constant', 'n_nearest_features': 8, 'imputation_order': 'roman'}. Best is trial 68 with value: 0.12923433356167482.
running
[I 2024-10-10 18:51:08,940] Trial 110 finished with value: 0.1572725161829168 and parameters: {'model_name': 'IterativeImputer', 'estimator': 'Ridge', 'initial_strategy': 'constant', 'n_nearest_features': 9, 'imputation_order': 'random'}. Best is trial 68 with value: 0.12923433356167482.
running
[I 2024-10-10 18:52:37,179] Trial 84 finished with value: 0.12961455528931845 and parameters: {'model_name': 'IterativeImputer', 'estimator': 'RFR', 'initial_strategy': 'constant', 'n_nearest_features': 9, 'imputation_order': 'roman'}. Best is trial 68 with value: 0.12923433356167482.
running
[I 2024-10-10 18:53:15,763] Trial 112 finished with value: 0.17371447911864585 and parameters: {'model_name': 'KNNImputer', 'n_neighbors': 32689, 'weights': 'uniform'}. Best is trial 68 with value: 0.12923433356167482.
running
[I 2024-10-10 18:53:15,973] Trial 113 finished with value: 0.4368749724241151 and parameters: {'model_name': 'SimpleImputer', 'strategy': 'constant'}. Best is trial 68 with value: 0.12923433356167482.
running
[I 2024-10-10 18:54:25,046] Trial 86 finished with value: 0.12956520143155076 and parameters: {'model_name': 'IterativeImputer', 'estimator': 'RFR', 'initial_strategy': 'constant', 'n_nearest_features': 9, 'imputation_order': 'random'}. Best is trial 68 with value: 0.12923433356167482.
running
[I 2024-10-10 18:55:14,527] Trial 88 finished with value: 0.12960317414877545 and parameters: {'model_name': 'IterativeImputer', 'estimator': 'RFR', 'initial_strategy': 'constant', 'n_nearest_features': 9, 'imputation_order': 'random'}. Best is trial 68 with value: 0.12923433356167482.
running
[I 2024-10-10 18:55:17,845] Trial 89 finished with value: 0.12935994217807617 and parameters: {'model_name': 'IterativeImputer', 'estimator': 'RFR', 'initial_strategy': 'constant', 'n_nearest_features': 8, 'imputation_order': 'descending'}. Best is trial 68 with value: 0.12923433356167482.
running
[I 2024-10-10 18:57:42,648] Trial 97 finished with value: 0.12933252469537382 and parameters: {'model_name': 'IterativeImputer', 'estimator': 'RFR', 'initial_strategy': 'constant', 'n_nearest_features': 8, 'imputation_order': 'random'}. Best is trial 68 with value: 0.12923433356167482.
running
[I 2024-10-10 19:08:56,615] Trial 98 finished with value: 0.12955016402234842 and parameters: {'model_name': 'IterativeImputer', 'estimator': 'RFR', 'initial_strategy': 'most_frequent', 'n_nearest_features': 9, 'imputation_order': 'random'}. Best is trial 68 with value: 0.12923433356167482.
running
[I 2024-10-10 19:09:10,939] Trial 100 finished with value: 0.12960618483916347 and parameters: {'model_name': 'IterativeImputer', 'estimator': 'RFR', 'initial_strategy': 'constant', 'n_nearest_features': 9, 'imputation_order': 'random'}. Best is trial 68 with value: 0.12923433356167482.
running
[I 2024-10-10 19:20:37,701] Trial 101 finished with value: 0.13006803717025606 and parameters: {'model_name': 'IterativeImputer', 'estimator': 'RFR', 'initial_strategy': 'constant', 'n_nearest_features': 8, 'imputation_order': 'random'}. Best is trial 68 with value: 0.12923433356167482.
running
[I 2024-10-10 19:21:50,223] Trial 102 finished with value: 0.13010256558335304 and parameters: {'model_name': 'IterativeImputer', 'estimator': 'RFR', 'initial_strategy': 'constant', 'n_nearest_features': 8, 'imputation_order': 'roman'}. Best is trial 68 with value: 0.12923433356167482.
running
[I 2024-10-10 19:21:50,833] Trial 103 finished with value: 0.1301376337484853 and parameters: {'model_name': 'IterativeImputer', 'estimator': 'RFR', 'initial_strategy': 'constant', 'n_nearest_features': 8, 'imputation_order': 'roman'}. Best is trial 68 with value: 0.12923433356167482.
running
[I 2024-10-10 20:05:39,358] Trial 105 finished with value: 0.12945343567320286 and parameters: {'model_name': 'IterativeImputer', 'estimator': 'RFR', 'initial_strategy': 'constant', 'n_nearest_features': 8, 'imputation_order': 'roman'}. Best is trial 68 with value: 0.12923433356167482.
running
[I 2024-10-10 20:13:06,230] Trial 106 finished with value: 0.129626392483308 and parameters: {'model_name': 'IterativeImputer', 'estimator': 'RFR', 'initial_strategy': 'constant', 'n_nearest_features': 8, 'imputation_order': 'roman'}. Best is trial 68 with value: 0.12923433356167482.
running
[I 2024-10-10 20:15:32,615] Trial 107 finished with value: 0.1293200067816296 and parameters: {'model_name': 'IterativeImputer', 'estimator': 'RFR', 'initial_strategy': 'constant', 'n_nearest_features': 8, 'imputation_order': 'roman'}. Best is trial 68 with value: 0.12923433356167482.
running
[I 2024-10-10 20:33:11,420] Trial 108 finished with value: 0.12909702806780632 and parameters: {'model_name': 'IterativeImputer', 'estimator': 'RFR', 'initial_strategy': 'constant', 'n_nearest_features': 8, 'imputation_order': 'roman'}. Best is trial 108 with value: 0.12909702806780632.
running
[I 2024-10-10 20:34:39,629] Trial 109 finished with value: 0.12929740778069138 and parameters: {'model_name': 'IterativeImputer', 'estimator': 'RFR', 'initial_strategy': 'constant', 'n_nearest_features': 9, 'imputation_order': 'roman'}. Best is trial 108 with value: 0.12909702806780632.
running
[I 2024-10-10 20:37:59,666] Trial 111 finished with value: 0.12983108381279085 and parameters: {'model_name': 'IterativeImputer', 'estimator': 'RFR', 'initial_strategy': 'constant', 'n_nearest_features': 9, 'imputation_order': 'random'}. Best is trial 108 with value: 0.12909702806780632.
running
[I 2024-10-10 20:40:03,315] Trial 114 finished with value: 0.13030974522785416 and parameters: {'model_name': 'IterativeImputer', 'estimator': 'RFR', 'initial_strategy': 'constant', 'n_nearest_features': 8, 'imputation_order': 'random'}. Best is trial 108 with value: 0.12909702806780632.
running
[I 2024-10-10 20:41:33,287] Trial 115 finished with value: 0.12992903903972794 and parameters: {'model_name': 'IterativeImputer', 'estimator': 'RFR', 'initial_strategy': 'constant', 'n_nearest_features': 8, 'imputation_order': 'random'}. Best is trial 108 with value: 0.12909702806780632.
running
[I 2024-10-10 20:41:44,533] Trial 131 finished with value: 0.15738011125325962 and parameters: {'model_name': 'IterativeImputer', 'estimator': 'Ridge', 'initial_strategy': 'constant', 'n_nearest_features': 6, 'imputation_order': 'roman'}. Best is trial 108 with value: 0.12909702806780632.
running
[I 2024-10-10 20:42:14,364] Trial 117 finished with value: 0.13015473728573723 and parameters: {'model_name': 'IterativeImputer', 'estimator': 'RFR', 'initial_strategy': 'constant', 'n_nearest_features': 8, 'imputation_order': 'random'}. Best is trial 108 with value: 0.12909702806780632.
running
[I 2024-10-10 20:42:35,425] Trial 116 finished with value: 0.12947160384612572 and parameters: {'model_name': 'IterativeImputer', 'estimator': 'RFR', 'initial_strategy': 'median', 'n_nearest_features': 8, 'imputation_order': 'random'}. Best is trial 108 with value: 0.12909702806780632.
running
[I 2024-10-10 20:42:37,758] Trial 134 finished with value: 0.4142618711016241 and parameters: {'model_name': 'GAIN', 'batch_size': 25, 'hint_rate': 0.7651068924473012, 'alpha': 75, 'iterations': 81, 'learning_rate': 0.0018451913607552561, 'p_miss': 0.19812828836926719}. Best is trial 108 with value: 0.12909702806780632.
running
[I 2024-10-10 20:44:45,034] Trial 118 finished with value: 0.12943802953877884 and parameters: {'model_name': 'IterativeImputer', 'estimator': 'RFR', 'initial_strategy': 'constant', 'n_nearest_features': 8, 'imputation_order': 'random'}. Best is trial 108 with value: 0.12909702806780632.
running
[I 2024-10-10 20:56:02,861] Trial 119 finished with value: 0.1297509267120477 and parameters: {'model_name': 'IterativeImputer', 'estimator': 'RFR', 'initial_strategy': 'constant', 'n_nearest_features': 8, 'imputation_order': 'random'}. Best is trial 108 with value: 0.12909702806780632.
running
[I 2024-10-10 20:56:11,783] Trial 120 finished with value: 0.12937239096600645 and parameters: {'model_name': 'IterativeImputer', 'estimator': 'RFR', 'initial_strategy': 'constant', 'n_nearest_features': 8, 'imputation_order': 'random'}. Best is trial 108 with value: 0.12909702806780632.
running
[I 2024-10-10 21:07:34,203] Trial 121 finished with value: 0.12948550803770179 and parameters: {'model_name': 'IterativeImputer', 'estimator': 'RFR', 'initial_strategy': 'constant', 'n_nearest_features': 8, 'imputation_order': 'random'}. Best is trial 108 with value: 0.12909702806780632.
running
[I 2024-10-10 21:08:17,276] Trial 139 finished with value: 0.24404501091657704 and parameters: {'model_name': 'IterativeImputer', 'estimator': 'Bayesian', 'initial_strategy': 'constant', 'n_nearest_features': 7, 'imputation_order': 'arabic', 'sample_posterior': True}. Best is trial 108 with value: 0.12909702806780632.
running
[I 2024-10-10 21:09:18,523] Trial 122 finished with value: 0.12990491895651982 and parameters: {'model_name': 'IterativeImputer', 'estimator': 'RFR', 'initial_strategy': 'constant', 'n_nearest_features': 8, 'imputation_order': 'arabic'}. Best is trial 108 with value: 0.12909702806780632.
running
[I 2024-10-10 21:09:18,819] Trial 141 finished with value: 0.18588940926668707 and parameters: {'model_name': 'SimpleImputer', 'strategy': 'median'}. Best is trial 108 with value: 0.12909702806780632.
running
[I 2024-10-10 21:09:30,539] Trial 123 finished with value: 0.12997366056227305 and parameters: {'model_name': 'IterativeImputer', 'estimator': 'RFR', 'initial_strategy': 'constant', 'n_nearest_features': 8, 'imputation_order': 'arabic'}. Best is trial 108 with value: 0.12909702806780632.
running
[I 2024-10-10 21:10:02,708] Trial 143 finished with value: 0.17051772030091197 and parameters: {'model_name': 'KNNImputer', 'n_neighbors': 14192, 'weights': 'uniform'}. Best is trial 108 with value: 0.12909702806780632.
running
[I 2024-10-10 21:29:55,497] Trial 124 finished with value: 0.1363242373818407 and parameters: {'model_name': 'IterativeImputer', 'estimator': 'RFR', 'initial_strategy': 'constant', 'n_nearest_features': 6, 'imputation_order': 'random'}. Best is trial 108 with value: 0.12909702806780632.
running
[I 2024-10-10 22:00:42,726] Trial 125 finished with value: 0.12998416872996138 and parameters: {'model_name': 'IterativeImputer', 'estimator': 'RFR', 'initial_strategy': 'median', 'n_nearest_features': 8, 'imputation_order': 'arabic'}. Best is trial 108 with value: 0.12909702806780632.
running
[I 2024-10-10 22:03:18,705] Trial 126 finished with value: 0.12950508059815108 and parameters: {'model_name': 'IterativeImputer', 'estimator': 'RFR', 'initial_strategy': 'constant', 'n_nearest_features': 8, 'imputation_order': 'roman'}. Best is trial 108 with value: 0.12909702806780632.
running
[I 2024-10-10 22:03:59,239] Trial 130 finished with value: 0.13272294898986287 and parameters: {'model_name': 'IterativeImputer', 'estimator': 'RFR', 'initial_strategy': 'constant', 'n_nearest_features': 6, 'imputation_order': 'roman'}. Best is trial 108 with value: 0.12909702806780632.
running
[I 2024-10-10 22:20:47,865] Trial 127 finished with value: 0.12962563079518225 and parameters: {'model_name': 'IterativeImputer', 'estimator': 'RFR', 'initial_strategy': 'constant', 'n_nearest_features': 8, 'imputation_order': 'roman'}. Best is trial 108 with value: 0.12909702806780632.
running
[I 2024-10-10 22:22:06,492] Trial 128 finished with value: 0.1298667521751073 and parameters: {'model_name': 'IterativeImputer', 'estimator': 'RFR', 'initial_strategy': 'constant', 'n_nearest_features': 8, 'imputation_order': 'roman'}. Best is trial 108 with value: 0.12909702806780632.
running
[I 2024-10-10 22:25:25,544] Trial 129 finished with value: 0.12983491627534532 and parameters: {'model_name': 'IterativeImputer', 'estimator': 'RFR', 'initial_strategy': 'constant', 'n_nearest_features': 8, 'imputation_order': 'roman'}. Best is trial 108 with value: 0.12909702806780632.
running
[I 2024-10-10 22:28:58,563] Trial 132 finished with value: 0.12941430736961376 and parameters: {'model_name': 'IterativeImputer', 'estimator': 'RFR', 'initial_strategy': 'constant', 'n_nearest_features': 8, 'imputation_order': 'roman'}. Best is trial 108 with value: 0.12909702806780632.
running
[I 2024-10-10 22:29:39,310] Trial 133 finished with value: 0.12969216173815137 and parameters: {'model_name': 'IterativeImputer', 'estimator': 'RFR', 'initial_strategy': 'constant', 'n_nearest_features': 8, 'imputation_order': 'roman'}. Best is trial 108 with value: 0.12909702806780632.
running
[I 2024-10-10 22:30:08,763] Trial 135 finished with value: 0.12946721804277783 and parameters: {'model_name': 'IterativeImputer', 'estimator': 'RFR', 'initial_strategy': 'constant', 'n_nearest_features': 8, 'imputation_order': 'roman'}. Best is trial 108 with value: 0.12909702806780632.
running
[I 2024-10-10 22:31:18,415] Trial 138 finished with value: 0.1310521902081751 and parameters: {'model_name': 'IterativeImputer', 'estimator': 'RFR', 'initial_strategy': 'constant', 'n_nearest_features': 7, 'imputation_order': 'arabic'}. Best is trial 108 with value: 0.12909702806780632.
running
[I 2024-10-10 22:32:02,821] Trial 136 finished with value: 0.12981194263263734 and parameters: {'model_name': 'IterativeImputer', 'estimator': 'RFR', 'initial_strategy': 'constant', 'n_nearest_features': 8, 'imputation_order': 'roman'}. Best is trial 108 with value: 0.12909702806780632.
running
[I 2024-10-10 22:32:04,434] Trial 155 finished with value: 0.16195644147980545 and parameters: {'model_name': 'IterativeImputer', 'estimator': 'KNN', 'initial_strategy': 'most_frequent', 'n_nearest_features': 9, 'imputation_order': 'ascending'}. Best is trial 108 with value: 0.12909702806780632.
running
[I 2024-10-10 22:32:47,492] Trial 156 finished with value: 0.16196369962172455 and parameters: {'model_name': 'IterativeImputer', 'estimator': 'KNN', 'initial_strategy': 'constant', 'n_nearest_features': 9, 'imputation_order': 'ascending'}. Best is trial 108 with value: 0.12909702806780632.
running
[I 2024-10-10 22:43:36,348] Trial 137 finished with value: 0.12956569140954732 and parameters: {'model_name': 'IterativeImputer', 'estimator': 'RFR', 'initial_strategy': 'constant', 'n_nearest_features': 8, 'imputation_order': 'roman'}. Best is trial 108 with value: 0.12909702806780632.
running
[I 2024-10-10 22:43:56,104] Trial 142 finished with value: 0.13132247708912545 and parameters: {'model_name': 'IterativeImputer', 'estimator': 'RFR', 'initial_strategy': 'constant', 'n_nearest_features': 7, 'imputation_order': 'roman'}. Best is trial 108 with value: 0.12909702806780632.
running
[I 2024-10-10 22:44:59,348] Trial 144 finished with value: 0.13162509046681983 and parameters: {'model_name': 'IterativeImputer', 'estimator': 'RFR', 'initial_strategy': 'constant', 'n_nearest_features': 7, 'imputation_order': 'roman'}. Best is trial 108 with value: 0.12909702806780632.
running
[I 2024-10-10 22:55:19,508] Trial 140 finished with value: 0.1287530509798621 and parameters: {'model_name': 'IterativeImputer', 'estimator': 'RFR', 'initial_strategy': 'constant', 'n_nearest_features': 8, 'imputation_order': 'roman'}. Best is trial 140 with value: 0.1287530509798621.
running
[I 2024-10-10 22:56:00,371] Trial 162 finished with value: 0.24953969674047055 and parameters: {'model_name': 'IterativeImputer', 'estimator': 'Bayesian', 'initial_strategy': 'constant', 'n_nearest_features': 9, 'imputation_order': 'descending', 'sample_posterior': True}. Best is trial 140 with value: 0.1287530509798621.
running
