Run: 28
/cm/local/apps/slurm/var/spool/job962419/slurm_script: line 26: 
pip install -e tpot2
pip install -r tpot2/ImputerExperiments/requirements_.txt
: No such file or directory
RunStart
Version 0.1.7a0 of tpot2 is outdated. Version 0.1.8a0 was released 3 days ago.
starting loops
../data/r/197/197.pkl
working on 
../data/r/197/reg_full_MCAR_0.5_2
2.3014135360717773
running experiment 1/3 - Does large hyperparameter space improve reconstruction accuracy over simple
[I 2024-09-21 00:53:50,952] A new study created in memory with name: no-name-59a1ab2f-0ce1-482b-8181-db053b4822a3
running
running
running
running
running
running
running
running
running
running
running
running
running
running
running
running
[I 2024-09-21 00:53:51,472] Trial 14 finished with value: 0.12154076887083318 and parameters: {'model_name': 'SimpleImputer', 'strategy': 'constant'}. Best is trial 14 with value: 0.12154076887083318.
[I 2024-09-21 00:53:51,631] Trial 4 finished with value: 0.1210790281216935 and parameters: {'model_name': 'SimpleImputer', 'strategy': 'median'}. Best is trial 4 with value: 0.1210790281216935.
running
[I 2024-09-21 00:53:51,740] Trial 5 finished with value: 0.1210790281216935 and parameters: {'model_name': 'SimpleImputer', 'strategy': 'median'}. Best is trial 4 with value: 0.1210790281216935.
[I 2024-09-21 00:53:51,824] Trial 12 finished with value: 0.12154076887083318 and parameters: {'model_name': 'SimpleImputer', 'strategy': 'constant'}. Best is trial 4 with value: 0.1210790281216935.
running
running
running
[I 2024-09-21 00:53:52,804] Trial 3 finished with value: 0.12154076887083318 and parameters: {'model_name': 'SimpleImputer', 'strategy': 'most_frequent'}. Best is trial 4 with value: 0.1210790281216935.
running
[I 2024-09-21 00:54:05,922] Trial 16 finished with value: 0.08271326687362675 and parameters: {'model_name': 'KNNImputer', 'n_neighbors': 4545, 'weights': 'uniform'}. Best is trial 16 with value: 0.08271326687362675.
running
[I 2024-09-21 00:54:07,664] Trial 13 finished with value: 0.08107766094841268 and parameters: {'model_name': 'KNNImputer', 'n_neighbors': 2940, 'weights': 'distance'}. Best is trial 13 with value: 0.08107766094841268.
running
[I 2024-09-21 00:54:08,181] Trial 19 finished with value: 0.08125452415954208 and parameters: {'model_name': 'KNNImputer', 'n_neighbors': 6139, 'weights': 'distance'}. Best is trial 13 with value: 0.08107766094841268.
running
[I 2024-09-21 00:54:10,019] Trial 18 finished with value: 0.08127965122256339 and parameters: {'model_name': 'KNNImputer', 'n_neighbors': 3850, 'weights': 'distance'}. Best is trial 13 with value: 0.08107766094841268.
running
[I 2024-09-21 00:54:14,575] Trial 11 finished with value: 0.13381159852983618 and parameters: {'model_name': 'GAIN', 'batch_size': 16, 'hint_rate': 0.5199906870447539, 'alpha': 81, 'iterations': 1, 'learning_rate': 0.00035585190964727224, 'p_miss': 0.16027096914734965}. Best is trial 13 with value: 0.08107766094841268.
running
[I 2024-09-21 00:54:15,665] Trial 24 finished with value: 0.12911017959606663 and parameters: {'model_name': 'GAIN', 'batch_size': 10, 'hint_rate': 0.3428367029127764, 'alpha': 64, 'iterations': 2, 'learning_rate': 0.017111053131209857, 'p_miss': 0.19932940155940265}. Best is trial 13 with value: 0.08107766094841268.
running
[I 2024-09-21 00:54:20,342] Trial 7 finished with value: 0.07619660432857642 and parameters: {'model_name': 'IterativeImputer', 'estimator': 'Ridge', 'initial_strategy': 'median', 'n_nearest_features': 21, 'imputation_order': 'ascending'}. Best is trial 7 with value: 0.07619660432857642.
running
[I 2024-09-21 00:54:36,301] Trial 15 finished with value: 0.12888968616074564 and parameters: {'model_name': 'GAIN', 'batch_size': 125, 'hint_rate': 0.49941358778050793, 'alpha': 40, 'iterations': 16, 'learning_rate': 0.00032016703111721693, 'p_miss': 0.14127592445627446}. Best is trial 7 with value: 0.07619660432857642.
running
[I 2024-09-21 00:54:40,866] Trial 8 finished with value: 0.07643114264221686 and parameters: {'model_name': 'IterativeImputer', 'estimator': 'Ridge', 'initial_strategy': 'constant', 'n_nearest_features': 11, 'imputation_order': 'descending'}. Best is trial 7 with value: 0.07619660432857642.
running
[I 2024-09-21 00:54:42,669] Trial 6 finished with value: 0.07639944201091572 and parameters: {'model_name': 'IterativeImputer', 'estimator': 'Ridge', 'initial_strategy': 'most_frequent', 'n_nearest_features': 11, 'imputation_order': 'roman'}. Best is trial 7 with value: 0.07619660432857642.
running
[I 2024-09-21 00:54:46,549] Trial 27 finished with value: 0.07619660432857643 and parameters: {'model_name': 'IterativeImputer', 'estimator': 'Ridge', 'initial_strategy': 'median', 'n_nearest_features': 21, 'imputation_order': 'ascending'}. Best is trial 7 with value: 0.07619660432857642.
running
[I 2024-09-21 00:55:01,864] Trial 28 finished with value: 0.07619660432857643 and parameters: {'model_name': 'IterativeImputer', 'estimator': 'Ridge', 'initial_strategy': 'median', 'n_nearest_features': 21, 'imputation_order': 'ascending'}. Best is trial 7 with value: 0.07619660432857642.
running
[I 2024-09-21 00:55:04,490] Trial 25 finished with value: 0.07703445470479961 and parameters: {'model_name': 'IterativeImputer', 'estimator': 'Ridge', 'initial_strategy': 'most_frequent', 'n_nearest_features': 10, 'imputation_order': 'descending'}. Best is trial 7 with value: 0.07619660432857642.
running
[I 2024-09-21 00:55:11,834] Trial 30 finished with value: 0.07619660432857643 and parameters: {'model_name': 'IterativeImputer', 'estimator': 'Ridge', 'initial_strategy': 'median', 'n_nearest_features': 20, 'imputation_order': 'ascending'}. Best is trial 7 with value: 0.07619660432857642.
running
[I 2024-09-21 00:55:27,724] Trial 29 finished with value: 0.07630572700195319 and parameters: {'model_name': 'IterativeImputer', 'estimator': 'Ridge', 'initial_strategy': 'median', 'n_nearest_features': 12, 'imputation_order': 'descending'}. Best is trial 7 with value: 0.07619660432857642.
running
[I 2024-09-21 00:55:29,673] Trial 0 finished with value: 0.07718992973442616 and parameters: {'model_name': 'IterativeImputer', 'estimator': 'KNN', 'initial_strategy': 'most_frequent', 'n_nearest_features': 8, 'imputation_order': 'descending'}. Best is trial 7 with value: 0.07619660432857642.
running
[I 2024-09-21 00:55:41,726] Trial 20 finished with value: 0.10551570704432751 and parameters: {'model_name': 'IterativeImputer', 'estimator': 'Bayesian', 'initial_strategy': 'constant', 'n_nearest_features': 12, 'imputation_order': 'random', 'sample_posterior': True}. Best is trial 7 with value: 0.07619660432857642.
running
[I 2024-09-21 00:55:46,812] Trial 21 finished with value: 0.08191747272358534 and parameters: {'model_name': 'VAE', 'batch_size': 47, 'iterations': 51, 'learning_rate': 0.009207097922209846, 'p_miss': 0.0904934133640527}. Best is trial 7 with value: 0.07619660432857642.
running
[I 2024-09-21 00:55:53,548] Trial 9 finished with value: 0.10142107988463463 and parameters: {'model_name': 'IterativeImputer', 'estimator': 'Bayesian', 'initial_strategy': 'most_frequent', 'n_nearest_features': 18, 'imputation_order': 'ascending', 'sample_posterior': True}. Best is trial 7 with value: 0.07619660432857642.
running
[I 2024-09-21 00:56:53,036] Trial 22 finished with value: 0.3079025803133957 and parameters: {'model_name': 'VAE', 'batch_size': 153, 'iterations': 77, 'learning_rate': 0.00018760979150769775, 'p_miss': 0.19616168722670874}. Best is trial 7 with value: 0.07619660432857642.
running
[I 2024-09-21 00:59:06,952] Trial 23 finished with value: 0.07925405253113002 and parameters: {'model_name': 'IterativeImputer', 'estimator': 'KNN', 'initial_strategy': 'most_frequent', 'n_nearest_features': 18, 'imputation_order': 'roman'}. Best is trial 7 with value: 0.07619660432857642.
running
[I 2024-09-21 01:01:06,423] Trial 2 finished with value: 0.08139084569046912 and parameters: {'model_name': 'VAE', 'batch_size': 47, 'iterations': 255, 'learning_rate': 0.0018225308595803105, 'p_miss': 0.10134056733717656}. Best is trial 7 with value: 0.07619660432857642.
running
[I 2024-09-21 01:09:02,924] Trial 10 finished with value: 0.13073973202387287 and parameters: {'model_name': 'GAIN', 'batch_size': 6, 'hint_rate': 0.2286465494531522, 'alpha': 54, 'iterations': 763, 'learning_rate': 0.004058472387353266, 'p_miss': 0.19405911967087236}. Best is trial 7 with value: 0.07619660432857642.
running
[I 2024-09-21 01:12:33,532] Trial 1 finished with value: 0.17387335042139124 and parameters: {'model_name': 'GAIN', 'batch_size': 72, 'hint_rate': 0.35248026210254785, 'alpha': 23, 'iterations': 895, 'learning_rate': 0.00023156030222950307, 'p_miss': 0.28420378878829977}. Best is trial 7 with value: 0.07619660432857642.
running
[I 2024-09-21 01:35:33,517] Trial 17 finished with value: 0.08350281722894423 and parameters: {'model_name': 'IterativeImputer', 'estimator': 'RFR', 'initial_strategy': 'most_frequent', 'n_nearest_features': 2, 'imputation_order': 'arabic'}. Best is trial 7 with value: 0.07619660432857642.
running
[I 2024-09-21 01:35:58,863] Trial 45 finished with value: 0.07619660432857642 and parameters: {'model_name': 'IterativeImputer', 'estimator': 'Ridge', 'initial_strategy': 'median', 'n_nearest_features': 21, 'imputation_order': 'ascending'}. Best is trial 7 with value: 0.07619660432857642.
running
[I 2024-09-21 01:36:20,922] Trial 46 finished with value: 0.07619660432857642 and parameters: {'model_name': 'IterativeImputer', 'estimator': 'Ridge', 'initial_strategy': 'median', 'n_nearest_features': 21, 'imputation_order': 'ascending'}. Best is trial 7 with value: 0.07619660432857642.
running
[I 2024-09-21 01:36:42,266] Trial 47 finished with value: 0.07619660432857642 and parameters: {'model_name': 'IterativeImputer', 'estimator': 'Ridge', 'initial_strategy': 'median', 'n_nearest_features': 21, 'imputation_order': 'ascending'}. Best is trial 7 with value: 0.07619660432857642.
running
[I 2024-09-21 01:37:29,136] Trial 48 finished with value: 0.07625475380812949 and parameters: {'model_name': 'IterativeImputer', 'estimator': 'Ridge', 'initial_strategy': 'mean', 'n_nearest_features': 17, 'imputation_order': 'ascending'}. Best is trial 7 with value: 0.07619660432857642.
running
[I 2024-09-21 01:38:17,564] Trial 49 finished with value: 0.07624999675089743 and parameters: {'model_name': 'IterativeImputer', 'estimator': 'Ridge', 'initial_strategy': 'median', 'n_nearest_features': 15, 'imputation_order': 'ascending'}. Best is trial 7 with value: 0.07619660432857642.
running
[I 2024-09-21 02:39:14,758] Trial 33 finished with value: 0.08536306840835386 and parameters: {'model_name': 'VAE', 'batch_size': 1, 'iterations': 2594, 'learning_rate': 0.0910680836198697, 'p_miss': 0.014183771584758087}. Best is trial 7 with value: 0.07619660432857642.
running
[I 2024-09-21 02:57:43,462] Trial 40 finished with value: 0.07120253122969432 and parameters: {'model_name': 'IterativeImputer', 'estimator': 'RFR', 'initial_strategy': 'median', 'n_nearest_features': 21, 'imputation_order': 'ascending'}. Best is trial 40 with value: 0.07120253122969432.
running
[I 2024-09-21 02:59:39,248] Trial 41 finished with value: 0.07106888765359205 and parameters: {'model_name': 'IterativeImputer', 'estimator': 'RFR', 'initial_strategy': 'median', 'n_nearest_features': 21, 'imputation_order': 'ascending'}. Best is trial 41 with value: 0.07106888765359205.
running
[I 2024-09-21 03:01:48,416] Trial 42 finished with value: 0.07166942542328167 and parameters: {'model_name': 'IterativeImputer', 'estimator': 'RFR', 'initial_strategy': 'median', 'n_nearest_features': 21, 'imputation_order': 'ascending'}. Best is trial 41 with value: 0.07106888765359205.
running
[I 2024-09-21 03:08:21,630] Trial 43 finished with value: 0.07110497274489394 and parameters: {'model_name': 'IterativeImputer', 'estimator': 'RFR', 'initial_strategy': 'median', 'n_nearest_features': 21, 'imputation_order': 'ascending'}. Best is trial 41 with value: 0.07106888765359205.
running
[I 2024-09-21 03:10:51,883] Trial 44 finished with value: 0.07071123572909359 and parameters: {'model_name': 'IterativeImputer', 'estimator': 'RFR', 'initial_strategy': 'median', 'n_nearest_features': 21, 'imputation_order': 'ascending'}. Best is trial 44 with value: 0.07071123572909359.
running
[I 2024-09-21 03:13:50,728] Trial 34 finished with value: 0.08513687052069073 and parameters: {'model_name': 'VAE', 'batch_size': 1, 'iterations': 3575, 'learning_rate': 0.08312544570737486, 'p_miss': 0.027411623598873863}. Best is trial 44 with value: 0.07071123572909359.
running
[I 2024-09-21 03:36:23,977] Trial 50 finished with value: 0.07095448397909128 and parameters: {'model_name': 'IterativeImputer', 'estimator': 'RFR', 'initial_strategy': 'median', 'n_nearest_features': 21, 'imputation_order': 'ascending'}. Best is trial 44 with value: 0.07071123572909359.
running
[I 2024-09-21 03:50:55,147] Trial 37 finished with value: 0.0855762536904284 and parameters: {'model_name': 'VAE', 'batch_size': 1, 'iterations': 4369, 'learning_rate': 0.06669586907723503, 'p_miss': 0.013769737743492522}. Best is trial 44 with value: 0.07071123572909359.
running
[I 2024-09-21 04:03:56,202] Trial 38 finished with value: 0.10006828121895284 and parameters: {'model_name': 'VAE', 'batch_size': 1, 'iterations': 5157, 'learning_rate': 0.08525907671407733, 'p_miss': 0.29732409701856655}. Best is trial 44 with value: 0.07071123572909359.
running
[I 2024-09-21 04:26:17,909] Trial 39 finished with value: 0.09131274726461289 and parameters: {'model_name': 'VAE', 'batch_size': 1, 'iterations': 6036, 'learning_rate': 0.06259477076126814, 'p_miss': 0.275422645336928}. Best is trial 44 with value: 0.07071123572909359.
running
[I 2024-09-21 04:34:34,345] Trial 51 finished with value: 0.07066071565883761 and parameters: {'model_name': 'IterativeImputer', 'estimator': 'RFR', 'initial_strategy': 'median', 'n_nearest_features': 21, 'imputation_order': 'ascending'}. Best is trial 51 with value: 0.07066071565883761.
running
[I 2024-09-21 04:34:34,891] Trial 62 finished with value: 0.08252673139007194 and parameters: {'model_name': 'SimpleImputer', 'strategy': 'mean'}. Best is trial 51 with value: 0.07066071565883761.
running
[I 2024-09-21 04:38:24,786] Trial 53 finished with value: 0.07185389482466818 and parameters: {'model_name': 'IterativeImputer', 'estimator': 'RFR', 'initial_strategy': 'median', 'n_nearest_features': 16, 'imputation_order': 'ascending'}. Best is trial 51 with value: 0.07066071565883761.
running
[I 2024-09-21 04:40:25,861] Trial 54 finished with value: 0.07083442353774635 and parameters: {'model_name': 'IterativeImputer', 'estimator': 'RFR', 'initial_strategy': 'median', 'n_nearest_features': 16, 'imputation_order': 'arabic'}. Best is trial 51 with value: 0.07066071565883761.
running
[I 2024-09-21 04:45:54,520] Trial 55 finished with value: 0.07230170566080366 and parameters: {'model_name': 'IterativeImputer', 'estimator': 'RFR', 'initial_strategy': 'mean', 'n_nearest_features': 16, 'imputation_order': 'arabic'}. Best is trial 51 with value: 0.07066071565883761.
running
[I 2024-09-21 04:48:40,300] Trial 52 finished with value: 0.07008405044821016 and parameters: {'model_name': 'IterativeImputer', 'estimator': 'RFR', 'initial_strategy': 'median', 'n_nearest_features': 19, 'imputation_order': 'ascending'}. Best is trial 52 with value: 0.07008405044821016.
running
[I 2024-09-21 04:55:58,450] Trial 56 finished with value: 0.07105061057750003 and parameters: {'model_name': 'IterativeImputer', 'estimator': 'RFR', 'initial_strategy': 'median', 'n_nearest_features': 18, 'imputation_order': 'ascending'}. Best is trial 52 with value: 0.07008405044821016.
running
[I 2024-09-21 04:58:22,535] Trial 57 finished with value: 0.07100059116590526 and parameters: {'model_name': 'IterativeImputer', 'estimator': 'RFR', 'initial_strategy': 'median', 'n_nearest_features': 18, 'imputation_order': 'ascending'}. Best is trial 52 with value: 0.07008405044821016.
running
[I 2024-09-21 05:10:38,982] Trial 31 finished with value: 0.08437633705832973 and parameters: {'model_name': 'VAE', 'batch_size': 1, 'iterations': 7085, 'learning_rate': 0.09386682513723994, 'p_miss': 0.017365788877415522}. Best is trial 52 with value: 0.07008405044821016.
running
[I 2024-09-21 05:10:48,021] Trial 70 finished with value: 0.13418323644872496 and parameters: {'model_name': 'GAIN', 'batch_size': 544, 'hint_rate': 0.9225534730245166, 'alpha': 0, 'iterations': 5, 'learning_rate': 0.0010553719535926266, 'p_miss': 0.23605907517525576}. Best is trial 52 with value: 0.07008405044821016.
running
[I 2024-09-21 05:10:48,424] Trial 71 finished with value: 0.08252673139007194 and parameters: {'model_name': 'SimpleImputer', 'strategy': 'mean'}. Best is trial 52 with value: 0.07008405044821016.
running
[I 2024-09-21 05:11:11,526] Trial 32 finished with value: 0.08453533497343402 and parameters: {'model_name': 'VAE', 'batch_size': 1, 'iterations': 6930, 'learning_rate': 0.0982059135821211, 'p_miss': 0.011878028360228027}. Best is trial 52 with value: 0.07008405044821016.
running
[I 2024-09-21 05:11:16,158] Trial 73 finished with value: 0.0795515579049794 and parameters: {'model_name': 'KNNImputer', 'n_neighbors': 449, 'weights': 'uniform'}. Best is trial 52 with value: 0.07008405044821016.
running
[I 2024-09-21 05:19:27,713] Trial 58 finished with value: 0.0713592919875276 and parameters: {'model_name': 'IterativeImputer', 'estimator': 'RFR', 'initial_strategy': 'median', 'n_nearest_features': 18, 'imputation_order': 'arabic'}. Best is trial 52 with value: 0.07008405044821016.
running
[I 2024-09-21 05:20:28,086] Trial 35 finished with value: 0.090584075695636 and parameters: {'model_name': 'VAE', 'batch_size': 1, 'iterations': 7629, 'learning_rate': 0.09098852451947612, 'p_miss': 0.02759611262630418}. Best is trial 52 with value: 0.07008405044821016.
running
[I 2024-09-21 05:28:00,950] Trial 36 finished with value: 0.08395496260141506 and parameters: {'model_name': 'VAE', 'batch_size': 1, 'iterations': 9356, 'learning_rate': 0.05494788241825006, 'p_miss': 0.026796714517435954}. Best is trial 52 with value: 0.07008405044821016.
running
[I 2024-09-21 05:31:59,660] Trial 59 finished with value: 0.0707482646117643 and parameters: {'model_name': 'IterativeImputer', 'estimator': 'RFR', 'initial_strategy': 'median', 'n_nearest_features': 18, 'imputation_order': 'arabic'}. Best is trial 52 with value: 0.07008405044821016.
running
[I 2024-09-21 05:34:53,534] Trial 26 finished with value: 0.08417606210847994 and parameters: {'model_name': 'VAE', 'batch_size': 704, 'iterations': 7596, 'learning_rate': 0.054704798016928756, 'p_miss': 0.010804145709261609}. Best is trial 52 with value: 0.07008405044821016.
running
[I 2024-09-21 05:42:10,231] Trial 60 finished with value: 0.07045159717389773 and parameters: {'model_name': 'IterativeImputer', 'estimator': 'RFR', 'initial_strategy': 'median', 'n_nearest_features': 18, 'imputation_order': 'arabic'}. Best is trial 52 with value: 0.07008405044821016.
running
[I 2024-09-21 05:59:07,032] Trial 61 finished with value: 0.07103892436570187 and parameters: {'model_name': 'IterativeImputer', 'estimator': 'RFR', 'initial_strategy': 'median', 'n_nearest_features': 18, 'imputation_order': 'arabic'}. Best is trial 52 with value: 0.07008405044821016.
running
[I 2024-09-21 06:05:46,456] Trial 63 finished with value: 0.07080771592248265 and parameters: {'model_name': 'IterativeImputer', 'estimator': 'RFR', 'initial_strategy': 'mean', 'n_nearest_features': 18, 'imputation_order': 'random'}. Best is trial 52 with value: 0.07008405044821016.
running
[I 2024-09-21 06:12:30,027] Trial 64 finished with value: 0.07080994621530942 and parameters: {'model_name': 'IterativeImputer', 'estimator': 'RFR', 'initial_strategy': 'mean', 'n_nearest_features': 19, 'imputation_order': 'random'}. Best is trial 52 with value: 0.07008405044821016.
running
[I 2024-09-21 06:13:40,627] Trial 65 finished with value: 0.07117115908674002 and parameters: {'model_name': 'IterativeImputer', 'estimator': 'RFR', 'initial_strategy': 'mean', 'n_nearest_features': 19, 'imputation_order': 'arabic'}. Best is trial 52 with value: 0.07008405044821016.
running
[I 2024-09-21 06:13:41,184] Trial 84 finished with value: 0.12411719083342039 and parameters: {'model_name': 'GAIN', 'batch_size': 4, 'hint_rate': 0.04222380475490167, 'alpha': 94, 'iterations': 7, 'learning_rate': 0.0007644703124354153, 'p_miss': 0.07472390922357665}. Best is trial 52 with value: 0.07008405044821016.
running
[I 2024-09-21 06:18:15,840] Trial 66 finished with value: 0.07095113613454909 and parameters: {'model_name': 'IterativeImputer', 'estimator': 'RFR', 'initial_strategy': 'median', 'n_nearest_features': 19, 'imputation_order': 'arabic'}. Best is trial 52 with value: 0.07008405044821016.
running
[I 2024-09-21 06:20:33,773] Trial 67 finished with value: 0.07127341376908879 and parameters: {'model_name': 'IterativeImputer', 'estimator': 'RFR', 'initial_strategy': 'median', 'n_nearest_features': 19, 'imputation_order': 'arabic'}. Best is trial 52 with value: 0.07008405044821016.
running
[I 2024-09-21 06:26:03,835] Trial 68 finished with value: 0.07090421141447285 and parameters: {'model_name': 'IterativeImputer', 'estimator': 'RFR', 'initial_strategy': 'median', 'n_nearest_features': 19, 'imputation_order': 'arabic'}. Best is trial 52 with value: 0.07008405044821016.
running
[I 2024-09-21 06:26:31,917] Trial 88 finished with value: 0.07744858848857043 and parameters: {'model_name': 'IterativeImputer', 'estimator': 'KNN', 'initial_strategy': 'mean', 'n_nearest_features': 15, 'imputation_order': 'random'}. Best is trial 52 with value: 0.07008405044821016.
running
[I 2024-09-21 06:26:34,082] Trial 89 finished with value: 0.07776031407115357 and parameters: {'model_name': 'KNNImputer', 'n_neighbors': 15, 'weights': 'uniform'}. Best is trial 52 with value: 0.07008405044821016.
running
