[I 2024-11-23 04:52:14,999] Trial 95 finished with value: 0.2255354844259209 and parameters: {'model_name': 'IterativeImputer', 'estimator': 'KNN', 'initial_strategy': 'median', 'n_nearest_features': 1, 'imputation_order': 'random'}. Best is trial 81 with value: 0.2255354844259209.
running
[I 2024-11-23 04:52:29,971] Trial 96 finished with value: 0.2255354844259209 and parameters: {'model_name': 'IterativeImputer', 'estimator': 'KNN', 'initial_strategy': 'median', 'n_nearest_features': 1, 'imputation_order': 'random'}. Best is trial 81 with value: 0.2255354844259209.
running
[I 2024-11-23 04:52:31,151] Trial 97 finished with value: 0.2255354844259209 and parameters: {'model_name': 'IterativeImputer', 'estimator': 'KNN', 'initial_strategy': 'median', 'n_nearest_features': 1, 'imputation_order': 'random'}. Best is trial 81 with value: 0.2255354844259209.
running
[I 2024-11-23 04:52:33,927] Trial 98 finished with value: 0.2255354844259209 and parameters: {'model_name': 'IterativeImputer', 'estimator': 'KNN', 'initial_strategy': 'median', 'n_nearest_features': 1, 'imputation_order': 'random'}. Best is trial 81 with value: 0.2255354844259209.
running
[I 2024-11-23 04:52:35,103] Trial 99 finished with value: 0.2255354844259209 and parameters: {'model_name': 'IterativeImputer', 'estimator': 'KNN', 'initial_strategy': 'median', 'n_nearest_features': 1, 'imputation_order': 'random'}. Best is trial 81 with value: 0.2255354844259209.
running
[I 2024-11-23 04:52:45,935] Trial 100 finished with value: 0.2255354844259209 and parameters: {'model_name': 'IterativeImputer', 'estimator': 'KNN', 'initial_strategy': 'median', 'n_nearest_features': 1, 'imputation_order': 'random'}. Best is trial 81 with value: 0.2255354844259209.
running
[I 2024-11-23 04:53:47,613] Trial 101 finished with value: 0.2255354844259209 and parameters: {'model_name': 'IterativeImputer', 'estimator': 'KNN', 'initial_strategy': 'median', 'n_nearest_features': 1, 'imputation_order': 'random'}. Best is trial 81 with value: 0.2255354844259209.
running
[I 2024-11-23 04:54:01,991] Trial 102 finished with value: 0.2255354844259209 and parameters: {'model_name': 'IterativeImputer', 'estimator': 'KNN', 'initial_strategy': 'median', 'n_nearest_features': 1, 'imputation_order': 'random'}. Best is trial 81 with value: 0.2255354844259209.
running
[I 2024-11-23 04:54:03,796] Trial 103 finished with value: 0.2255354844259209 and parameters: {'model_name': 'IterativeImputer', 'estimator': 'KNN', 'initial_strategy': 'median', 'n_nearest_features': 1, 'imputation_order': 'random'}. Best is trial 81 with value: 0.2255354844259209.
running
[I 2024-11-23 04:54:06,524] Trial 104 finished with value: 0.2255354844259209 and parameters: {'model_name': 'IterativeImputer', 'estimator': 'KNN', 'initial_strategy': 'median', 'n_nearest_features': 1, 'imputation_order': 'random'}. Best is trial 81 with value: 0.2255354844259209.
running
[I 2024-11-23 04:54:07,966] Trial 105 finished with value: 0.2255354844259209 and parameters: {'model_name': 'IterativeImputer', 'estimator': 'KNN', 'initial_strategy': 'median', 'n_nearest_features': 1, 'imputation_order': 'random'}. Best is trial 81 with value: 0.2255354844259209.
running
[I 2024-11-23 04:54:18,301] Trial 106 finished with value: 0.2255354844259209 and parameters: {'model_name': 'IterativeImputer', 'estimator': 'KNN', 'initial_strategy': 'median', 'n_nearest_features': 1, 'imputation_order': 'random'}. Best is trial 81 with value: 0.2255354844259209.
running
[I 2024-11-23 04:55:19,952] Trial 107 finished with value: 0.2255354844259209 and parameters: {'model_name': 'IterativeImputer', 'estimator': 'KNN', 'initial_strategy': 'median', 'n_nearest_features': 1, 'imputation_order': 'random'}. Best is trial 81 with value: 0.2255354844259209.
running
[I 2024-11-23 04:55:34,480] Trial 108 finished with value: 0.2255354844259209 and parameters: {'model_name': 'IterativeImputer', 'estimator': 'KNN', 'initial_strategy': 'median', 'n_nearest_features': 1, 'imputation_order': 'random'}. Best is trial 81 with value: 0.2255354844259209.
running
[I 2024-11-23 04:55:37,149] Trial 109 finished with value: 0.2255354844259209 and parameters: {'model_name': 'IterativeImputer', 'estimator': 'KNN', 'initial_strategy': 'median', 'n_nearest_features': 1, 'imputation_order': 'random'}. Best is trial 81 with value: 0.2255354844259209.
running
[I 2024-11-23 04:55:39,773] Trial 110 finished with value: 0.2255354844259209 and parameters: {'model_name': 'IterativeImputer', 'estimator': 'KNN', 'initial_strategy': 'median', 'n_nearest_features': 1, 'imputation_order': 'random'}. Best is trial 81 with value: 0.2255354844259209.
running
[I 2024-11-23 04:55:41,425] Trial 111 finished with value: 0.2255354844259209 and parameters: {'model_name': 'IterativeImputer', 'estimator': 'KNN', 'initial_strategy': 'median', 'n_nearest_features': 1, 'imputation_order': 'random'}. Best is trial 81 with value: 0.2255354844259209.
running
[I 2024-11-23 04:55:51,801] Trial 112 finished with value: 0.2255354844259209 and parameters: {'model_name': 'IterativeImputer', 'estimator': 'KNN', 'initial_strategy': 'median', 'n_nearest_features': 1, 'imputation_order': 'random'}. Best is trial 81 with value: 0.2255354844259209.
running
[I 2024-11-23 04:55:54,643] Trial 114 finished with value: 0.22798127072562968 and parameters: {'model_name': 'IterativeImputer', 'estimator': 'KNN', 'initial_strategy': 'median', 'n_nearest_features': 2, 'imputation_order': 'random'}. Best is trial 81 with value: 0.2255354844259209.
running
[I 2024-11-23 04:56:53,805] Trial 113 finished with value: 0.2255354844259209 and parameters: {'model_name': 'IterativeImputer', 'estimator': 'KNN', 'initial_strategy': 'median', 'n_nearest_features': 1, 'imputation_order': 'random'}. Best is trial 81 with value: 0.2255354844259209.
running
[I 2024-11-23 04:57:13,675] Trial 116 finished with value: 0.2255354844259209 and parameters: {'model_name': 'IterativeImputer', 'estimator': 'KNN', 'initial_strategy': 'median', 'n_nearest_features': 1, 'imputation_order': 'random'}. Best is trial 81 with value: 0.2255354844259209.
running
[I 2024-11-23 04:59:30,576] Trial 80 finished with value: 0.22169037580862624 and parameters: {'model_name': 'IterativeImputer', 'estimator': 'RFR', 'initial_strategy': 'most_frequent', 'n_nearest_features': 1, 'imputation_order': 'random'}. Best is trial 80 with value: 0.22169037580862624.
running
[I 2024-11-23 04:59:56,144] Trial 84 finished with value: 0.2208467895039828 and parameters: {'model_name': 'IterativeImputer', 'estimator': 'RFR', 'initial_strategy': 'constant', 'n_nearest_features': 1, 'imputation_order': 'random'}. Best is trial 84 with value: 0.2208467895039828.
running
[I 2024-11-23 05:00:01,073] Trial 85 finished with value: 0.2201952092400632 and parameters: {'model_name': 'IterativeImputer', 'estimator': 'RFR', 'initial_strategy': 'constant', 'n_nearest_features': 1, 'imputation_order': 'random'}. Best is trial 85 with value: 0.2201952092400632.
running
[I 2024-11-23 05:00:05,656] Trial 87 finished with value: 0.2208881199280816 and parameters: {'model_name': 'IterativeImputer', 'estimator': 'RFR', 'initial_strategy': 'constant', 'n_nearest_features': 1, 'imputation_order': 'random'}. Best is trial 85 with value: 0.2201952092400632.
running
[I 2024-11-23 05:00:08,778] Trial 91 finished with value: 0.2215803809493099 and parameters: {'model_name': 'IterativeImputer', 'estimator': 'RFR', 'initial_strategy': 'most_frequent', 'n_nearest_features': 1, 'imputation_order': 'random'}. Best is trial 85 with value: 0.2201952092400632.
running
[I 2024-11-23 05:00:10,215] Trial 94 finished with value: 0.22111004600812686 and parameters: {'model_name': 'IterativeImputer', 'estimator': 'RFR', 'initial_strategy': 'most_frequent', 'n_nearest_features': 1, 'imputation_order': 'random'}. Best is trial 85 with value: 0.2201952092400632.
running
[I 2024-11-23 05:00:39,508] Trial 79 finished with value: 0.21719188260236483 and parameters: {'model_name': 'IterativeImputer', 'estimator': 'RFR', 'initial_strategy': 'median', 'n_nearest_features': 1, 'imputation_order': 'random'}. Best is trial 79 with value: 0.21719188260236483.
running
[I 2024-11-23 05:00:51,951] Trial 83 finished with value: 0.21849939630924126 and parameters: {'model_name': 'IterativeImputer', 'estimator': 'RFR', 'initial_strategy': 'median', 'n_nearest_features': 1, 'imputation_order': 'random'}. Best is trial 79 with value: 0.21719188260236483.
running
[I 2024-11-23 05:01:01,823] Trial 92 finished with value: 0.21897271836964766 and parameters: {'model_name': 'IterativeImputer', 'estimator': 'RFR', 'initial_strategy': 'median', 'n_nearest_features': 1, 'imputation_order': 'random'}. Best is trial 79 with value: 0.21719188260236483.
running
[I 2024-11-23 05:01:11,347] Trial 93 finished with value: 0.21816381599541246 and parameters: {'model_name': 'IterativeImputer', 'estimator': 'RFR', 'initial_strategy': 'median', 'n_nearest_features': 1, 'imputation_order': 'random'}. Best is trial 79 with value: 0.21719188260236483.
running
[I 2024-11-23 05:06:38,483] Trial 119 finished with value: 0.21814790252175822 and parameters: {'model_name': 'IterativeImputer', 'estimator': 'RFR', 'initial_strategy': 'median', 'n_nearest_features': 1, 'imputation_order': 'random'}. Best is trial 79 with value: 0.21719188260236483.
running
[I 2024-11-23 05:06:38,685] Trial 132 finished with value: inf and parameters: {'model_name': 'VAE', 'batch_size': 3, 'iterations': 9945, 'learning_rate': 0.007576588884253684, 'p_miss': 0.1487227621194946}. Best is trial 79 with value: 0.21719188260236483.
running
[I 2024-11-23 05:14:59,614] Trial 115 finished with value: 0.218661156540151 and parameters: {'model_name': 'IterativeImputer', 'estimator': 'RFR', 'initial_strategy': 'median', 'n_nearest_features': 2, 'imputation_order': 'random'}. Best is trial 79 with value: 0.21719188260236483.
running
[I 2024-11-23 05:14:59,910] Trial 134 finished with value: 0.23097951525617555 and parameters: {'model_name': 'SimpleImputer', 'strategy': 'mean'}. Best is trial 79 with value: 0.21719188260236483.
running
[I 2024-11-23 05:15:18,327] Trial 117 finished with value: 0.21824582033186882 and parameters: {'model_name': 'IterativeImputer', 'estimator': 'RFR', 'initial_strategy': 'median', 'n_nearest_features': 2, 'imputation_order': 'random'}. Best is trial 79 with value: 0.21719188260236483.
running
[I 2024-11-23 05:15:26,490] Trial 118 finished with value: 0.2173923068841636 and parameters: {'model_name': 'IterativeImputer', 'estimator': 'RFR', 'initial_strategy': 'median', 'n_nearest_features': 2, 'imputation_order': 'random'}. Best is trial 79 with value: 0.21719188260236483.
running
[I 2024-11-23 05:16:18,490] Trial 120 finished with value: 0.21780939634214094 and parameters: {'model_name': 'IterativeImputer', 'estimator': 'RFR', 'initial_strategy': 'median', 'n_nearest_features': 2, 'imputation_order': 'random'}. Best is trial 79 with value: 0.21719188260236483.
running
[I 2024-11-23 05:16:32,550] Trial 121 finished with value: 0.21821075334289763 and parameters: {'model_name': 'IterativeImputer', 'estimator': 'RFR', 'initial_strategy': 'median', 'n_nearest_features': 2, 'imputation_order': 'random'}. Best is trial 79 with value: 0.21719188260236483.
running
[I 2024-11-23 05:18:33,387] Trial 122 finished with value: 0.22214484894918257 and parameters: {'model_name': 'IterativeImputer', 'estimator': 'RFR', 'initial_strategy': 'most_frequent', 'n_nearest_features': 2, 'imputation_order': 'random'}. Best is trial 79 with value: 0.21719188260236483.
running
[I 2024-11-23 05:18:54,665] Trial 123 finished with value: 0.22153173982601645 and parameters: {'model_name': 'IterativeImputer', 'estimator': 'RFR', 'initial_strategy': 'most_frequent', 'n_nearest_features': 2, 'imputation_order': 'random'}. Best is trial 79 with value: 0.21719188260236483.
running
[I 2024-11-23 05:19:12,841] Trial 126 finished with value: 0.22223392773545575 and parameters: {'model_name': 'IterativeImputer', 'estimator': 'RFR', 'initial_strategy': 'constant', 'n_nearest_features': 2, 'imputation_order': 'random'}. Best is trial 79 with value: 0.21719188260236483.
running
[I 2024-11-23 05:19:15,810] Trial 127 finished with value: 0.22208424625525414 and parameters: {'model_name': 'IterativeImputer', 'estimator': 'RFR', 'initial_strategy': 'most_frequent', 'n_nearest_features': 2, 'imputation_order': 'random'}. Best is trial 79 with value: 0.21719188260236483.
running
[I 2024-11-23 05:19:17,541] Trial 143 finished with value: 0.4053078573585255 and parameters: {'model_name': 'GAIN', 'batch_size': 342, 'hint_rate': 0.9741374789729198, 'alpha': 100, 'iterations': 36, 'learning_rate': 0.004991068008418419, 'p_miss': 0.1429388802865213}. Best is trial 79 with value: 0.21719188260236483.
running
[I 2024-11-23 05:19:20,019] Trial 124 finished with value: 0.22278439188612187 and parameters: {'model_name': 'IterativeImputer', 'estimator': 'RFR', 'initial_strategy': 'constant', 'n_nearest_features': 2, 'imputation_order': 'random'}. Best is trial 79 with value: 0.21719188260236483.
running
[I 2024-11-23 05:19:20,792] Trial 125 finished with value: 0.22138117601152266 and parameters: {'model_name': 'IterativeImputer', 'estimator': 'RFR', 'initial_strategy': 'constant', 'n_nearest_features': 2, 'imputation_order': 'random'}. Best is trial 79 with value: 0.21719188260236483.
running
[I 2024-11-23 05:19:37,529] Trial 128 finished with value: 0.2210418282965561 and parameters: {'model_name': 'IterativeImputer', 'estimator': 'RFR', 'initial_strategy': 'constant', 'n_nearest_features': 2, 'imputation_order': 'random'}. Best is trial 79 with value: 0.21719188260236483.
running
[I 2024-11-23 05:19:43,936] Trial 130 finished with value: 0.2199025055441119 and parameters: {'model_name': 'IterativeImputer', 'estimator': 'RFR', 'initial_strategy': 'constant', 'n_nearest_features': 2, 'imputation_order': 'arabic'}. Best is trial 79 with value: 0.21719188260236483.
running
[I 2024-11-23 05:19:58,283] Trial 131 finished with value: 0.21872309880234395 and parameters: {'model_name': 'IterativeImputer', 'estimator': 'RFR', 'initial_strategy': 'constant', 'n_nearest_features': 2, 'imputation_order': 'arabic'}. Best is trial 79 with value: 0.21719188260236483.
running
[I 2024-11-23 05:20:00,482] Trial 129 finished with value: 0.21829242230936768 and parameters: {'model_name': 'IterativeImputer', 'estimator': 'RFR', 'initial_strategy': 'constant', 'n_nearest_features': 2, 'imputation_order': 'ascending'}. Best is trial 79 with value: 0.21719188260236483.
running
[I 2024-11-23 05:25:13,952] Trial 133 finished with value: 0.2191687757139494 and parameters: {'model_name': 'IterativeImputer', 'estimator': 'RFR', 'initial_strategy': 'constant', 'n_nearest_features': 2, 'imputation_order': 'arabic'}. Best is trial 79 with value: 0.21719188260236483.
running
[I 2024-11-23 05:33:31,948] Trial 135 finished with value: 0.21937493473419356 and parameters: {'model_name': 'IterativeImputer', 'estimator': 'RFR', 'initial_strategy': 'constant', 'n_nearest_features': 2, 'imputation_order': 'arabic'}. Best is trial 79 with value: 0.21719188260236483.
running
[I 2024-11-23 05:33:32,289] Trial 152 finished with value: inf and parameters: {'model_name': 'VAE', 'batch_size': 11, 'iterations': 2492, 'learning_rate': 0.09368320963281884, 'p_miss': 0.011729787426875304}. Best is trial 79 with value: 0.21719188260236483.
running
[I 2024-11-23 05:33:48,530] Trial 136 finished with value: 0.2196912621052812 and parameters: {'model_name': 'IterativeImputer', 'estimator': 'RFR', 'initial_strategy': 'constant', 'n_nearest_features': 2, 'imputation_order': 'arabic'}. Best is trial 79 with value: 0.21719188260236483.
running
[I 2024-11-23 05:33:48,781] Trial 154 finished with value: 0.23097951525617555 and parameters: {'model_name': 'SimpleImputer', 'strategy': 'mean'}. Best is trial 79 with value: 0.21719188260236483.
running
[I 2024-11-23 05:33:57,902] Trial 137 finished with value: 0.21948622734868808 and parameters: {'model_name': 'IterativeImputer', 'estimator': 'RFR', 'initial_strategy': 'constant', 'n_nearest_features': 2, 'imputation_order': 'arabic'}. Best is trial 79 with value: 0.21719188260236483.
running
[I 2024-11-23 05:34:50,404] Trial 138 finished with value: 0.21919166237223403 and parameters: {'model_name': 'IterativeImputer', 'estimator': 'RFR', 'initial_strategy': 'constant', 'n_nearest_features': 2, 'imputation_order': 'arabic'}. Best is trial 79 with value: 0.21719188260236483.
running
[I 2024-11-23 05:35:05,032] Trial 139 finished with value: 0.21924354224197887 and parameters: {'model_name': 'IterativeImputer', 'estimator': 'RFR', 'initial_strategy': 'constant', 'n_nearest_features': 2, 'imputation_order': 'arabic'}. Best is trial 79 with value: 0.21719188260236483.
running
[I 2024-11-23 05:37:11,759] Trial 140 finished with value: 0.21881684577292124 and parameters: {'model_name': 'IterativeImputer', 'estimator': 'RFR', 'initial_strategy': 'constant', 'n_nearest_features': 2, 'imputation_order': 'arabic'}. Best is trial 79 with value: 0.21719188260236483.
running
[I 2024-11-23 05:37:19,586] Trial 159 finished with value: 0.24497876695295787 and parameters: {'model_name': 'IterativeImputer', 'estimator': 'Bayesian', 'initial_strategy': 'mean', 'n_nearest_features': 3, 'imputation_order': 'ascending', 'sample_posterior': False}. Best is trial 79 with value: 0.21719188260236483.
running
[I 2024-11-23 05:37:29,570] Trial 141 finished with value: 0.2220294236677988 and parameters: {'model_name': 'IterativeImputer', 'estimator': 'RFR', 'initial_strategy': 'constant', 'n_nearest_features': 2, 'imputation_order': 'roman'}. Best is trial 79 with value: 0.21719188260236483.
running
[I 2024-11-23 05:37:53,742] Trial 142 finished with value: 0.2188929295133571 and parameters: {'model_name': 'IterativeImputer', 'estimator': 'RFR', 'initial_strategy': 'constant', 'n_nearest_features': 2, 'imputation_order': 'arabic'}. Best is trial 79 with value: 0.21719188260236483.
running
[I 2024-11-23 05:38:00,453] Trial 144 finished with value: 0.21994865405426198 and parameters: {'model_name': 'IterativeImputer', 'estimator': 'RFR', 'initial_strategy': 'constant', 'n_nearest_features': 2, 'imputation_order': 'arabic'}. Best is trial 79 with value: 0.21719188260236483.
running
[I 2024-11-23 05:38:03,604] Trial 145 finished with value: 0.21869971764427615 and parameters: {'model_name': 'IterativeImputer', 'estimator': 'RFR', 'initial_strategy': 'constant', 'n_nearest_features': 2, 'imputation_order': 'arabic'}. Best is trial 79 with value: 0.21719188260236483.
running
[I 2024-11-23 05:38:04,041] Trial 146 finished with value: 0.21952223859755488 and parameters: {'model_name': 'IterativeImputer', 'estimator': 'RFR', 'initial_strategy': 'constant', 'n_nearest_features': 2, 'imputation_order': 'arabic'}. Best is trial 79 with value: 0.21719188260236483.
running
[I 2024-11-23 05:38:13,318] Trial 164 finished with value: 0.23984595692993788 and parameters: {'model_name': 'IterativeImputer', 'estimator': 'Ridge', 'initial_strategy': 'mean', 'n_nearest_features': 3, 'imputation_order': 'descending'}. Best is trial 79 with value: 0.21719188260236483.
running
[I 2024-11-23 05:38:15,794] Trial 165 finished with value: 0.40060808660590463 and parameters: {'model_name': 'GAIN', 'batch_size': 58, 'hint_rate': 0.7866211971273779, 'alpha': 35, 'iterations': 15, 'learning_rate': 0.0007999911542906618, 'p_miss': 0.2762226180604055}. Best is trial 79 with value: 0.21719188260236483.
running
[I 2024-11-23 05:38:17,049] Trial 163 finished with value: 0.23975654326153212 and parameters: {'model_name': 'IterativeImputer', 'estimator': 'Ridge', 'initial_strategy': 'mean', 'n_nearest_features': 2, 'imputation_order': 'descending'}. Best is trial 79 with value: 0.21719188260236483.
running
[I 2024-11-23 05:38:26,075] Trial 147 finished with value: 0.21904651637669675 and parameters: {'model_name': 'IterativeImputer', 'estimator': 'RFR', 'initial_strategy': 'constant', 'n_nearest_features': 2, 'imputation_order': 'arabic'}. Best is trial 79 with value: 0.21719188260236483.
running
[I 2024-11-23 05:38:34,237] Trial 148 finished with value: 0.21961113212541608 and parameters: {'model_name': 'IterativeImputer', 'estimator': 'RFR', 'initial_strategy': 'constant', 'n_nearest_features': 2, 'imputation_order': 'arabic'}. Best is trial 79 with value: 0.21719188260236483.
running
[I 2024-11-23 05:38:36,152] Trial 149 finished with value: 0.22153627871701706 and parameters: {'model_name': 'IterativeImputer', 'estimator': 'RFR', 'initial_strategy': 'mean', 'n_nearest_features': 2, 'imputation_order': 'arabic'}. Best is trial 79 with value: 0.21719188260236483.
running
[I 2024-11-23 05:38:47,190] Trial 150 finished with value: 0.2195290480434467 and parameters: {'model_name': 'IterativeImputer', 'estimator': 'RFR', 'initial_strategy': 'constant', 'n_nearest_features': 2, 'imputation_order': 'arabic'}. Best is trial 79 with value: 0.21719188260236483.
running
[I 2024-11-23 05:43:45,161] Trial 151 finished with value: 0.22148621805224017 and parameters: {'model_name': 'IterativeImputer', 'estimator': 'RFR', 'initial_strategy': 'mean', 'n_nearest_features': 2, 'imputation_order': 'arabic'}. Best is trial 79 with value: 0.21719188260236483.
running
[I 2024-11-23 05:52:09,824] Trial 153 finished with value: 0.22113136149396 and parameters: {'model_name': 'IterativeImputer', 'estimator': 'RFR', 'initial_strategy': 'mean', 'n_nearest_features': 2, 'imputation_order': 'arabic'}. Best is trial 79 with value: 0.21719188260236483.
running
[I 2024-11-23 05:52:15,671] Trial 155 finished with value: 0.22199153024464188 and parameters: {'model_name': 'IterativeImputer', 'estimator': 'RFR', 'initial_strategy': 'mean', 'n_nearest_features': 2, 'imputation_order': 'ascending'}. Best is trial 79 with value: 0.21719188260236483.
running
