[I 2024-08-19 08:40:00,794] Trial 106 finished with value: 0.34986789326469747 and parameters: {'model_name': 'SimpleImputer', 'strategy': 'mean'}. Best is trial 10 with value: 0.34986789326469747.
running
[I 2024-08-19 08:40:01,447] Trial 107 finished with value: 0.34986789326469747 and parameters: {'model_name': 'SimpleImputer', 'strategy': 'mean'}. Best is trial 10 with value: 0.34986789326469747.
running
[I 2024-08-19 08:40:01,913] Trial 108 finished with value: 0.3499044248182545 and parameters: {'model_name': 'SimpleImputer', 'strategy': 'constant'}. Best is trial 10 with value: 0.34986789326469747.
running
[I 2024-08-19 08:40:02,549] Trial 109 finished with value: 0.34986789326469747 and parameters: {'model_name': 'SimpleImputer', 'strategy': 'mean'}. Best is trial 10 with value: 0.34986789326469747.
running
[I 2024-08-19 08:51:55,052] Trial 83 finished with value: 0.5544521234921234 and parameters: {'model_name': 'GAIN', 'batch_size': 929, 'hint_rate': 0.3006817393178959, 'alpha': 76, 'iterations': 615, 'learning_rate': 0.07411698641572607, 'p_miss': 0.09432122843763213}. Best is trial 10 with value: 0.34986789326469747.
running
[I 2024-08-19 08:52:16,150] Trial 111 finished with value: 0.3500489612206619 and parameters: {'model_name': 'IterativeImputer', 'estimator': 'Ridge', 'initial_strategy': 'mean', 'n_nearest_features': 3, 'imputation_order': 'arabic'}. Best is trial 10 with value: 0.34986789326469747.
running
[I 2024-08-19 08:52:16,592] Trial 112 finished with value: 0.34986789326469747 and parameters: {'model_name': 'SimpleImputer', 'strategy': 'mean'}. Best is trial 10 with value: 0.34986789326469747.
running
[I 2024-08-19 08:52:17,094] Trial 113 finished with value: 0.34986789326469747 and parameters: {'model_name': 'SimpleImputer', 'strategy': 'mean'}. Best is trial 10 with value: 0.34986789326469747.
running
[I 2024-08-19 08:52:17,729] Trial 114 finished with value: 0.3498888855878405 and parameters: {'model_name': 'SimpleImputer', 'strategy': 'median'}. Best is trial 10 with value: 0.34986789326469747.
running
[I 2024-08-19 08:52:18,150] Trial 115 finished with value: 0.34986789326469747 and parameters: {'model_name': 'SimpleImputer', 'strategy': 'mean'}. Best is trial 10 with value: 0.34986789326469747.
running
[I 2024-08-19 08:52:18,614] Trial 116 finished with value: 0.34986789326469747 and parameters: {'model_name': 'SimpleImputer', 'strategy': 'mean'}. Best is trial 10 with value: 0.34986789326469747.
running
[I 2024-08-19 08:52:19,040] Trial 117 finished with value: 0.34986789326469747 and parameters: {'model_name': 'SimpleImputer', 'strategy': 'mean'}. Best is trial 10 with value: 0.34986789326469747.
running
[I 2024-08-19 08:52:19,487] Trial 118 finished with value: 0.34986789326469747 and parameters: {'model_name': 'SimpleImputer', 'strategy': 'mean'}. Best is trial 10 with value: 0.34986789326469747.
running
[I 2024-08-19 08:52:19,930] Trial 119 finished with value: 0.34986789326469747 and parameters: {'model_name': 'SimpleImputer', 'strategy': 'mean'}. Best is trial 10 with value: 0.34986789326469747.
running
[I 2024-08-19 08:52:20,458] Trial 120 finished with value: 0.34986789326469747 and parameters: {'model_name': 'SimpleImputer', 'strategy': 'mean'}. Best is trial 10 with value: 0.34986789326469747.
running
[I 2024-08-19 08:52:25,288] Trial 121 finished with value: 0.3498553294055835 and parameters: {'model_name': 'KNNImputer', 'n_neighbors': 5312, 'weights': 'uniform'}. Best is trial 121 with value: 0.3498553294055835.
running
[I 2024-08-19 08:52:29,643] Trial 122 finished with value: 0.34987583552962886 and parameters: {'model_name': 'KNNImputer', 'n_neighbors': 5107, 'weights': 'uniform'}. Best is trial 121 with value: 0.3498553294055835.
running
[I 2024-08-19 08:57:57,326] Trial 95 finished with value: 0.5492369284895784 and parameters: {'model_name': 'GAIN', 'batch_size': 116, 'hint_rate': 0.3690078221554759, 'alpha': 73, 'iterations': 563, 'learning_rate': 0.09839187185392421, 'p_miss': 0.07730527775974569}. Best is trial 121 with value: 0.3498553294055835.
running
[I 2024-08-19 08:58:01,352] Trial 124 finished with value: 0.3498659824678237 and parameters: {'model_name': 'KNNImputer', 'n_neighbors': 5744, 'weights': 'uniform'}. Best is trial 121 with value: 0.3498553294055835.
running
[I 2024-08-19 08:58:05,610] Trial 125 finished with value: 0.3498553123069857 and parameters: {'model_name': 'KNNImputer', 'n_neighbors': 5662, 'weights': 'uniform'}. Best is trial 125 with value: 0.3498553123069857.
running
[I 2024-08-19 08:58:09,758] Trial 126 finished with value: 0.3498700926478195 and parameters: {'model_name': 'KNNImputer', 'n_neighbors': 5734, 'weights': 'uniform'}. Best is trial 125 with value: 0.3498553123069857.
running
[I 2024-08-19 08:58:12,549] Trial 127 finished with value: 0.34986789326469747 and parameters: {'model_name': 'KNNImputer', 'n_neighbors': 7172, 'weights': 'uniform'}. Best is trial 125 with value: 0.3498553123069857.
running
[I 2024-08-19 08:58:16,823] Trial 128 finished with value: 0.3499121812846741 and parameters: {'model_name': 'KNNImputer', 'n_neighbors': 4398, 'weights': 'uniform'}. Best is trial 125 with value: 0.3498553123069857.
running
[I 2024-08-19 08:58:20,730] Trial 129 finished with value: 0.34985423559757056 and parameters: {'model_name': 'KNNImputer', 'n_neighbors': 5940, 'weights': 'uniform'}. Best is trial 129 with value: 0.34985423559757056.
running
[I 2024-08-19 08:58:24,645] Trial 130 finished with value: 0.3498585393506813 and parameters: {'model_name': 'KNNImputer', 'n_neighbors': 5812, 'weights': 'uniform'}. Best is trial 129 with value: 0.34985423559757056.
running
[I 2024-08-19 08:58:28,679] Trial 131 finished with value: 0.3498597459007267 and parameters: {'model_name': 'KNNImputer', 'n_neighbors': 5904, 'weights': 'uniform'}. Best is trial 129 with value: 0.34985423559757056.
running
[I 2024-08-19 08:58:33,790] Trial 132 finished with value: 0.3498521079752343 and parameters: {'model_name': 'KNNImputer', 'n_neighbors': 5934, 'weights': 'uniform'}. Best is trial 132 with value: 0.3498521079752343.
running
[I 2024-08-19 08:58:39,010] Trial 133 finished with value: 0.3498608554490953 and parameters: {'model_name': 'KNNImputer', 'n_neighbors': 5870, 'weights': 'uniform'}. Best is trial 132 with value: 0.3498521079752343.
running
[I 2024-08-19 08:58:44,123] Trial 134 finished with value: 0.34985958114355387 and parameters: {'model_name': 'KNNImputer', 'n_neighbors': 5882, 'weights': 'uniform'}. Best is trial 132 with value: 0.3498521079752343.
running
[I 2024-08-19 08:58:49,224] Trial 135 finished with value: 0.34985162328263353 and parameters: {'model_name': 'KNNImputer', 'n_neighbors': 5927, 'weights': 'uniform'}. Best is trial 135 with value: 0.34985162328263353.
running
[I 2024-08-19 08:58:54,463] Trial 136 finished with value: 0.3498546247194015 and parameters: {'model_name': 'KNNImputer', 'n_neighbors': 5917, 'weights': 'uniform'}. Best is trial 135 with value: 0.34985162328263353.
running
[I 2024-08-19 08:58:59,425] Trial 137 finished with value: 0.3498590251914919 and parameters: {'model_name': 'KNNImputer', 'n_neighbors': 5883, 'weights': 'uniform'}. Best is trial 135 with value: 0.34985162328263353.
running
[I 2024-08-19 08:59:04,259] Trial 138 finished with value: 0.3498625096301607 and parameters: {'model_name': 'KNNImputer', 'n_neighbors': 5841, 'weights': 'uniform'}. Best is trial 135 with value: 0.34985162328263353.
running
[I 2024-08-19 08:59:09,262] Trial 139 finished with value: 0.3498573227941817 and parameters: {'model_name': 'KNNImputer', 'n_neighbors': 5877, 'weights': 'uniform'}. Best is trial 135 with value: 0.34985162328263353.
running
[I 2024-08-19 08:59:14,664] Trial 140 finished with value: 0.3498601974903725 and parameters: {'model_name': 'KNNImputer', 'n_neighbors': 5903, 'weights': 'uniform'}. Best is trial 135 with value: 0.34985162328263353.
running
[I 2024-08-19 08:59:19,994] Trial 141 finished with value: 0.3498451801776204 and parameters: {'model_name': 'KNNImputer', 'n_neighbors': 6112, 'weights': 'uniform'}. Best is trial 141 with value: 0.3498451801776204.
running
[I 2024-08-19 08:59:24,869] Trial 142 finished with value: 0.34985788183310124 and parameters: {'model_name': 'KNNImputer', 'n_neighbors': 6206, 'weights': 'uniform'}. Best is trial 141 with value: 0.3498451801776204.
running
[I 2024-08-19 08:59:28,895] Trial 143 finished with value: 0.34986789326469747 and parameters: {'model_name': 'KNNImputer', 'n_neighbors': 6395, 'weights': 'uniform'}. Best is trial 141 with value: 0.3498451801776204.
running
[I 2024-08-19 08:59:34,117] Trial 144 finished with value: 0.34985537792361077 and parameters: {'model_name': 'KNNImputer', 'n_neighbors': 6224, 'weights': 'uniform'}. Best is trial 141 with value: 0.3498451801776204.
running
[I 2024-08-19 08:59:38,620] Trial 145 finished with value: 0.34986789326469747 and parameters: {'model_name': 'KNNImputer', 'n_neighbors': 6380, 'weights': 'uniform'}. Best is trial 141 with value: 0.3498451801776204.
running
[I 2024-08-19 08:59:43,456] Trial 146 finished with value: 0.34985311971585725 and parameters: {'model_name': 'KNNImputer', 'n_neighbors': 5488, 'weights': 'uniform'}. Best is trial 141 with value: 0.3498451801776204.
running
[I 2024-08-19 08:59:48,177] Trial 147 finished with value: 0.3498630562339858 and parameters: {'model_name': 'KNNImputer', 'n_neighbors': 5264, 'weights': 'uniform'}. Best is trial 141 with value: 0.3498451801776204.
running
[I 2024-08-19 08:59:53,304] Trial 148 finished with value: 0.3498533215335346 and parameters: {'model_name': 'KNNImputer', 'n_neighbors': 5478, 'weights': 'uniform'}. Best is trial 141 with value: 0.3498451801776204.
running
[I 2024-08-19 08:59:58,212] Trial 149 finished with value: 0.34985720304925144 and parameters: {'model_name': 'KNNImputer', 'n_neighbors': 5423, 'weights': 'uniform'}. Best is trial 141 with value: 0.3498451801776204.
running
[I 2024-08-19 09:00:03,057] Trial 150 finished with value: 0.3498580763506454 and parameters: {'model_name': 'KNNImputer', 'n_neighbors': 5318, 'weights': 'uniform'}. Best is trial 141 with value: 0.3498451801776204.
running
[I 2024-08-19 09:00:08,149] Trial 151 finished with value: 0.34985295188292187 and parameters: {'model_name': 'KNNImputer', 'n_neighbors': 5238, 'weights': 'uniform'}. Best is trial 141 with value: 0.3498451801776204.
running
[I 2024-08-19 09:00:13,148] Trial 152 finished with value: 0.34985835689503963 and parameters: {'model_name': 'KNNImputer', 'n_neighbors': 5349, 'weights': 'uniform'}. Best is trial 141 with value: 0.3498451801776204.
running
[I 2024-08-19 09:00:17,238] Trial 153 finished with value: 0.34986789326469747 and parameters: {'model_name': 'KNNImputer', 'n_neighbors': 6398, 'weights': 'uniform'}. Best is trial 141 with value: 0.3498451801776204.
running
[I 2024-08-19 09:00:22,625] Trial 154 finished with value: 0.34985362445633933 and parameters: {'model_name': 'KNNImputer', 'n_neighbors': 5437, 'weights': 'uniform'}. Best is trial 141 with value: 0.3498451801776204.
running
[I 2024-08-19 09:00:27,781] Trial 155 finished with value: 0.3498580799854346 and parameters: {'model_name': 'KNNImputer', 'n_neighbors': 5425, 'weights': 'uniform'}. Best is trial 141 with value: 0.3498451801776204.
running
[I 2024-08-19 09:00:32,969] Trial 156 finished with value: 0.349855370320892 and parameters: {'model_name': 'KNNImputer', 'n_neighbors': 6181, 'weights': 'uniform'}. Best is trial 141 with value: 0.3498451801776204.
running
[I 2024-08-19 09:00:38,301] Trial 157 finished with value: 0.34985367014077845 and parameters: {'model_name': 'KNNImputer', 'n_neighbors': 5494, 'weights': 'uniform'}. Best is trial 141 with value: 0.3498451801776204.
running
[I 2024-08-19 09:00:44,472] Trial 158 finished with value: 0.3498904848705181 and parameters: {'model_name': 'KNNImputer', 'n_neighbors': 4904, 'weights': 'uniform'}. Best is trial 141 with value: 0.3498451801776204.
running
[I 2024-08-19 09:00:49,365] Trial 159 finished with value: 0.34985078000329045 and parameters: {'model_name': 'KNNImputer', 'n_neighbors': 5471, 'weights': 'uniform'}. Best is trial 141 with value: 0.3498451801776204.
running
[I 2024-08-19 09:00:54,474] Trial 160 finished with value: 0.34984772118155594 and parameters: {'model_name': 'KNNImputer', 'n_neighbors': 5466, 'weights': 'uniform'}. Best is trial 141 with value: 0.3498451801776204.
running
[I 2024-08-19 09:00:59,494] Trial 161 finished with value: 0.34985367014077845 and parameters: {'model_name': 'KNNImputer', 'n_neighbors': 5494, 'weights': 'uniform'}. Best is trial 141 with value: 0.3498451801776204.
running
[I 2024-08-19 09:01:04,672] Trial 162 finished with value: 0.34984415302468097 and parameters: {'model_name': 'KNNImputer', 'n_neighbors': 5553, 'weights': 'uniform'}. Best is trial 162 with value: 0.34984415302468097.
running
[I 2024-08-19 09:01:09,901] Trial 163 finished with value: 0.3498939974514897 and parameters: {'model_name': 'KNNImputer', 'n_neighbors': 4775, 'weights': 'uniform'}. Best is trial 162 with value: 0.34984415302468097.
running
[I 2024-08-19 09:01:14,514] Trial 41 finished with value: 0.5557899080506704 and parameters: {'model_name': 'GAIN', 'batch_size': 984, 'hint_rate': 0.034306765261292615, 'alpha': 14, 'iterations': 2733, 'learning_rate': 0.0001471131391827907, 'p_miss': 0.2979275275463238}. Best is trial 162 with value: 0.34984415302468097.
running
[I 2024-08-19 09:01:15,009] Trial 164 finished with value: 0.34984430687131324 and parameters: {'model_name': 'KNNImputer', 'n_neighbors': 5544, 'weights': 'uniform'}. Best is trial 162 with value: 0.34984415302468097.
running
[I 2024-08-19 09:01:19,772] Trial 165 finished with value: 0.3498432987020502 and parameters: {'model_name': 'KNNImputer', 'n_neighbors': 5548, 'weights': 'uniform'}. Best is trial 165 with value: 0.3498432987020502.
running
[I 2024-08-19 09:01:20,000] Trial 166 finished with value: 0.3498450942000704 and parameters: {'model_name': 'KNNImputer', 'n_neighbors': 5556, 'weights': 'uniform'}. Best is trial 165 with value: 0.3498432987020502.
running
[I 2024-08-19 09:01:24,623] Trial 167 finished with value: 0.34985050953371044 and parameters: {'model_name': 'KNNImputer', 'n_neighbors': 5526, 'weights': 'uniform'}. Best is trial 165 with value: 0.3498432987020502.
running
[I 2024-08-19 09:01:25,200] Trial 168 finished with value: 0.3498494656987815 and parameters: {'model_name': 'KNNImputer', 'n_neighbors': 5451, 'weights': 'uniform'}. Best is trial 165 with value: 0.3498432987020502.
running
[I 2024-08-19 09:01:30,105] Trial 169 finished with value: 0.3498493732526762 and parameters: {'model_name': 'KNNImputer', 'n_neighbors': 5517, 'weights': 'uniform'}. Best is trial 165 with value: 0.3498432987020502.
running
[I 2024-08-19 09:01:30,970] Trial 170 finished with value: 0.34984379291200807 and parameters: {'model_name': 'KNNImputer', 'n_neighbors': 5535, 'weights': 'uniform'}. Best is trial 165 with value: 0.3498432987020502.
running
[I 2024-08-19 09:01:36,099] Trial 172 finished with value: 0.3498719023885871 and parameters: {'model_name': 'KNNImputer', 'n_neighbors': 5048, 'weights': 'uniform'}. Best is trial 165 with value: 0.3498432987020502.
running
[I 2024-08-19 09:01:36,965] Trial 171 finished with value: 0.3499182925724089 and parameters: {'model_name': 'KNNImputer', 'n_neighbors': 5110, 'weights': 'distance'}. Best is trial 165 with value: 0.3498432987020502.
running
[I 2024-08-19 09:01:42,589] Trial 174 finished with value: 0.34984969217554746 and parameters: {'model_name': 'KNNImputer', 'n_neighbors': 5570, 'weights': 'uniform'}. Best is trial 165 with value: 0.3498432987020502.
running
[I 2024-08-19 09:01:43,022] Trial 173 finished with value: 0.3498938268684559 and parameters: {'model_name': 'KNNImputer', 'n_neighbors': 5572, 'weights': 'distance'}. Best is trial 165 with value: 0.3498432987020502.
running
[I 2024-08-19 09:01:47,271] Trial 175 finished with value: 0.3498495740081772 and parameters: {'model_name': 'KNNImputer', 'n_neighbors': 5584, 'weights': 'uniform'}. Best is trial 165 with value: 0.3498432987020502.
running
[I 2024-08-19 09:01:47,547] Trial 176 finished with value: 0.3498452002568382 and parameters: {'model_name': 'KNNImputer', 'n_neighbors': 5592, 'weights': 'uniform'}. Best is trial 165 with value: 0.3498432987020502.
running
[I 2024-08-19 09:01:52,640] Trial 177 finished with value: 0.3498442624890254 and parameters: {'model_name': 'KNNImputer', 'n_neighbors': 5607, 'weights': 'uniform'}. Best is trial 165 with value: 0.3498432987020502.
running
[I 2024-08-19 09:01:52,871] Trial 178 finished with value: 0.34986945522779045 and parameters: {'model_name': 'KNNImputer', 'n_neighbors': 5153, 'weights': 'uniform'}. Best is trial 165 with value: 0.3498432987020502.
running
[I 2024-08-19 09:01:57,487] Trial 179 finished with value: 0.3498626662468159 and parameters: {'model_name': 'KNNImputer', 'n_neighbors': 5671, 'weights': 'uniform'}. Best is trial 165 with value: 0.3498432987020502.
running
[I 2024-08-19 09:01:58,145] Trial 180 finished with value: 0.3498559419883719 and parameters: {'model_name': 'KNNImputer', 'n_neighbors': 5656, 'weights': 'uniform'}. Best is trial 165 with value: 0.3498432987020502.
running
[I 2024-08-19 09:02:02,197] Trial 181 finished with value: 0.34993914478422095 and parameters: {'model_name': 'KNNImputer', 'n_neighbors': 3457, 'weights': 'uniform'}. Best is trial 165 with value: 0.3498432987020502.
running
[I 2024-08-19 09:02:03,507] Trial 182 finished with value: 0.3498560479544558 and parameters: {'model_name': 'KNNImputer', 'n_neighbors': 5635, 'weights': 'uniform'}. Best is trial 165 with value: 0.3498432987020502.
running
[I 2024-08-19 09:02:06,943] Trial 183 finished with value: 0.3498486257132762 and parameters: {'model_name': 'KNNImputer', 'n_neighbors': 6073, 'weights': 'uniform'}. Best is trial 165 with value: 0.3498432987020502.
running
[I 2024-08-19 09:02:08,224] Trial 184 finished with value: 0.3498450187585832 and parameters: {'model_name': 'KNNImputer', 'n_neighbors': 6095, 'weights': 'uniform'}. Best is trial 165 with value: 0.3498432987020502.
running
[I 2024-08-19 09:02:11,738] Trial 185 finished with value: 0.34986789326469747 and parameters: {'model_name': 'KNNImputer', 'n_neighbors': 6743, 'weights': 'uniform'}. Best is trial 165 with value: 0.3498432987020502.
running
[I 2024-08-19 09:02:13,384] Trial 186 finished with value: 0.34984861753935637 and parameters: {'model_name': 'KNNImputer', 'n_neighbors': 6156, 'weights': 'uniform'}. Best is trial 165 with value: 0.3498432987020502.
running
[I 2024-08-19 09:02:17,204] Trial 187 finished with value: 0.3498558160681095 and parameters: {'model_name': 'KNNImputer', 'n_neighbors': 6011, 'weights': 'uniform'}. Best is trial 165 with value: 0.3498432987020502.
running
[I 2024-08-19 09:02:18,822] Trial 188 finished with value: 0.34984728815873206 and parameters: {'model_name': 'KNNImputer', 'n_neighbors': 6146, 'weights': 'uniform'}. Best is trial 165 with value: 0.3498432987020502.
running
[I 2024-08-19 09:02:22,830] Trial 189 finished with value: 0.3498538995275319 and parameters: {'model_name': 'KNNImputer', 'n_neighbors': 5658, 'weights': 'uniform'}. Best is trial 165 with value: 0.3498432987020502.
running
[I 2024-08-19 09:02:24,022] Trial 190 finished with value: 0.3498481327830201 and parameters: {'model_name': 'KNNImputer', 'n_neighbors': 6151, 'weights': 'uniform'}. Best is trial 165 with value: 0.3498432987020502.
running
[I 2024-08-19 09:02:26,855] Trial 191 finished with value: 0.34986789326469747 and parameters: {'model_name': 'KNNImputer', 'n_neighbors': 6552, 'weights': 'uniform'}. Best is trial 165 with value: 0.3498432987020502.
running
[I 2024-08-19 09:02:28,416] Trial 192 finished with value: 0.34986789326469747 and parameters: {'model_name': 'KNNImputer', 'n_neighbors': 6647, 'weights': 'uniform'}. Best is trial 165 with value: 0.3498432987020502.
running
[I 2024-08-19 09:02:32,220] Trial 193 finished with value: 0.3498446865102326 and parameters: {'model_name': 'KNNImputer', 'n_neighbors': 6134, 'weights': 'uniform'}. Best is trial 165 with value: 0.3498432987020502.
running
[I 2024-08-19 09:02:33,532] Trial 194 finished with value: 0.3498587793940776 and parameters: {'model_name': 'KNNImputer', 'n_neighbors': 6226, 'weights': 'uniform'}. Best is trial 165 with value: 0.3498432987020502.
running
[I 2024-08-19 09:02:38,918] Trial 196 finished with value: 0.3498484639539051 and parameters: {'model_name': 'KNNImputer', 'n_neighbors': 6045, 'weights': 'uniform'}. Best is trial 165 with value: 0.3498432987020502.
running
[I 2024-08-19 09:02:44,287] Trial 197 finished with value: 0.34984444971177564 and parameters: {'model_name': 'KNNImputer', 'n_neighbors': 6136, 'weights': 'uniform'}. Best is trial 165 with value: 0.3498432987020502.
running
[I 2024-08-19 09:04:33,080] Trial 45 finished with value: 0.5802040911095239 and parameters: {'model_name': 'GAIN', 'batch_size': 523, 'hint_rate': 0.01309472529696537, 'alpha': 0, 'iterations': 2969, 'learning_rate': 0.00013585273843354405, 'p_miss': 0.2772471904633711}. Best is trial 165 with value: 0.3498432987020502.
running
[I 2024-08-19 09:36:17,468] Trial 65 finished with value: 0.5742907610478374 and parameters: {'model_name': 'GAIN', 'batch_size': 864, 'hint_rate': 0.026079454440683936, 'alpha': 0, 'iterations': 3195, 'learning_rate': 0.0001727003076617073, 'p_miss': 0.29767575246626776}. Best is trial 165 with value: 0.3498432987020502.
[I 2024-08-19 09:55:48,494] Trial 61 finished with value: 0.6007485942563713 and parameters: {'model_name': 'GAIN', 'batch_size': 317, 'hint_rate': 0.018270198232149204, 'alpha': 4, 'iterations': 4531, 'learning_rate': 0.00014625371666947718, 'p_miss': 0.2969200544029965}. Best is trial 165 with value: 0.3498432987020502.
