Run: 26
/cm/local/apps/slurm/var/spool/job1001148/slurm_script: line 26: 
pip install -e tpot2
pip install -r tpot2/ImputerExperiments/requirements_.txt
: No such file or directory
RunStart
Version 0.1.7a0 of tpot2 is outdated. Version 0.1.8a0 was released Tuesday September 17, 2024.
starting loops
../data/r/1213/1213.pkl
working on 
../data/r/1213/reg_full_MCAR_0.1_2
3.9154860973358154
running experiment 1/3 - Does large hyperparameter space improve reconstruction accuracy over simple
[I 2024-10-14 12:21:24,216] A new study created in memory with name: no-name-9a5a51d2-1e9e-4849-bcc6-afa2f0e262b3
running
running
running
running
running
running
running
running
running
running
running
running
running
running
running
running
[I 2024-10-14 12:21:24,849] Trial 0 finished with value: 0.2936129512155716 and parameters: {'model_name': 'SimpleImputer', 'strategy': 'mean'}. Best is trial 0 with value: 0.2936129512155716.
running
[I 2024-10-14 12:21:25,001] Trial 1 finished with value: 0.5516497772363793 and parameters: {'model_name': 'SimpleImputer', 'strategy': 'constant'}. Best is trial 0 with value: 0.2936129512155716.
running
[I 2024-10-14 12:21:25,372] Trial 10 finished with value: 0.5516497772363793 and parameters: {'model_name': 'SimpleImputer', 'strategy': 'constant'}. Best is trial 0 with value: 0.2936129512155716.
running
[I 2024-10-14 12:21:26,388] Trial 6 finished with value: 0.3309590620783004 and parameters: {'model_name': 'SimpleImputer', 'strategy': 'median'}. Best is trial 0 with value: 0.2936129512155716.
running
[I 2024-10-14 12:21:26,773] Trial 3 finished with value: 0.5138010225084263 and parameters: {'model_name': 'SimpleImputer', 'strategy': 'most_frequent'}. Best is trial 0 with value: 0.2936129512155716.
running
[I 2024-10-14 12:21:27,117] Trial 17 finished with value: 0.3309590620783004 and parameters: {'model_name': 'SimpleImputer', 'strategy': 'median'}. Best is trial 0 with value: 0.2936129512155716.
running
[I 2024-10-14 12:21:36,380] Trial 4 finished with value: 0.31543165717462174 and parameters: {'model_name': 'VAE', 'batch_size': 1, 'iterations': 1, 'learning_rate': 0.0003726822050533727, 'p_miss': 0.061915199622908194}. Best is trial 0 with value: 0.2936129512155716.
running
[I 2024-10-14 12:21:36,766] Trial 11 finished with value: 0.31668691022659345 and parameters: {'model_name': 'VAE', 'batch_size': 43, 'iterations': 1, 'learning_rate': 0.0005530590192004473, 'p_miss': 0.23974579031523555}. Best is trial 0 with value: 0.2936129512155716.
running
[I 2024-10-14 12:21:37,716] Trial 22 finished with value: 0.2936129512155716 and parameters: {'model_name': 'SimpleImputer', 'strategy': 'mean'}. Best is trial 0 with value: 0.2936129512155716.
running
[I 2024-10-14 12:21:42,585] Trial 20 finished with value: 0.5382981158195312 and parameters: {'model_name': 'GAIN', 'batch_size': 320, 'hint_rate': 0.3742410930294853, 'alpha': 39, 'iterations': 3, 'learning_rate': 0.07260587993253637, 'p_miss': 0.049186132624771034}. Best is trial 0 with value: 0.2936129512155716.
running
[I 2024-10-14 12:22:02,926] Trial 2 finished with value: 0.3138740546789094 and parameters: {'model_name': 'VAE', 'batch_size': 7, 'iterations': 11, 'learning_rate': 0.0006932564967025049, 'p_miss': 0.28907382132023063}. Best is trial 0 with value: 0.2936129512155716.
running
[I 2024-10-14 12:22:20,772] Trial 9 finished with value: 0.31156136210158325 and parameters: {'model_name': 'VAE', 'batch_size': 5, 'iterations': 20, 'learning_rate': 0.0020641699305107243, 'p_miss': 0.27221292750498344}. Best is trial 0 with value: 0.2936129512155716.
running
[I 2024-10-14 12:22:22,066] Trial 15 finished with value: 0.5252138367337919 and parameters: {'model_name': 'GAIN', 'batch_size': 262, 'hint_rate': 0.1956958751511446, 'alpha': 16, 'iterations': 33, 'learning_rate': 0.00012243712398987523, 'p_miss': 0.15730174058703114}. Best is trial 0 with value: 0.2936129512155716.
running
[I 2024-10-14 12:22:32,328] Trial 23 finished with value: 0.31490564300224866 and parameters: {'model_name': 'VAE', 'batch_size': 64, 'iterations': 20, 'learning_rate': 0.00035509762443181405, 'p_miss': 0.06548665166094567}. Best is trial 0 with value: 0.2936129512155716.
running
[I 2024-10-14 12:23:02,110] Trial 18 finished with value: 0.2888939043662275 and parameters: {'model_name': 'KNNImputer', 'n_neighbors': 3583, 'weights': 'uniform'}. Best is trial 18 with value: 0.2888939043662275.
running
[I 2024-10-14 12:23:18,481] Trial 21 finished with value: 0.29067356375768155 and parameters: {'model_name': 'KNNImputer', 'n_neighbors': 11903, 'weights': 'uniform'}. Best is trial 18 with value: 0.2888939043662275.
running
[I 2024-10-14 12:23:28,997] Trial 19 finished with value: 0.3379923945249492 and parameters: {'model_name': 'VAE', 'batch_size': 1, 'iterations': 44, 'learning_rate': 0.017320422050689302, 'p_miss': 0.1528066770560335}. Best is trial 18 with value: 0.2888939043662275.
running
[I 2024-10-14 12:23:42,805] Trial 5 finished with value: 0.2929688174570296 and parameters: {'model_name': 'KNNImputer', 'n_neighbors': 39759, 'weights': 'uniform'}. Best is trial 18 with value: 0.2888939043662275.
running
[I 2024-10-14 12:24:08,226] Trial 25 finished with value: 0.29350291599963974 and parameters: {'model_name': 'KNNImputer', 'n_neighbors': 46924, 'weights': 'uniform'}. Best is trial 18 with value: 0.2888939043662275.
running
[I 2024-10-14 12:24:09,985] Trial 24 finished with value: 0.2914598449121864 and parameters: {'model_name': 'KNNImputer', 'n_neighbors': 21495, 'weights': 'distance'}. Best is trial 18 with value: 0.2888939043662275.
running
[I 2024-10-14 12:24:25,463] Trial 12 finished with value: 0.29278399385098125 and parameters: {'model_name': 'KNNImputer', 'n_neighbors': 43513, 'weights': 'distance'}. Best is trial 18 with value: 0.2888939043662275.
running
[I 2024-10-14 12:24:40,428] Trial 29 finished with value: 0.3106996269159904 and parameters: {'model_name': 'IterativeImputer', 'estimator': 'KNN', 'initial_strategy': 'median', 'n_nearest_features': 5, 'imputation_order': 'random'}. Best is trial 18 with value: 0.2888939043662275.
running
[I 2024-10-14 12:24:47,153] Trial 30 finished with value: 0.2880061913987788 and parameters: {'model_name': 'KNNImputer', 'n_neighbors': 1853, 'weights': 'uniform'}. Best is trial 30 with value: 0.2880061913987788.
running
[I 2024-10-14 12:25:03,759] Trial 31 finished with value: 0.2891197447020188 and parameters: {'model_name': 'KNNImputer', 'n_neighbors': 4213, 'weights': 'uniform'}. Best is trial 30 with value: 0.2880061913987788.
running
[I 2024-10-14 12:25:15,736] Trial 27 finished with value: 0.3119118523044945 and parameters: {'model_name': 'IterativeImputer', 'estimator': 'KNN', 'initial_strategy': 'constant', 'n_nearest_features': 7, 'imputation_order': 'descending'}. Best is trial 30 with value: 0.2880061913987788.
running
[I 2024-10-14 12:25:18,694] Trial 32 finished with value: 0.28910180003675257 and parameters: {'model_name': 'KNNImputer', 'n_neighbors': 4146, 'weights': 'uniform'}. Best is trial 30 with value: 0.2880061913987788.
running
[I 2024-10-14 12:25:21,348] Trial 28 finished with value: 0.29210534103654623 and parameters: {'model_name': 'KNNImputer', 'n_neighbors': 31332, 'weights': 'distance'}. Best is trial 30 with value: 0.2880061913987788.
running
[I 2024-10-14 12:25:28,154] Trial 33 finished with value: 0.2879605715978292 and parameters: {'model_name': 'KNNImputer', 'n_neighbors': 1764, 'weights': 'uniform'}. Best is trial 33 with value: 0.2879605715978292.
running
[I 2024-10-14 12:25:34,046] Trial 16 finished with value: inf and parameters: {'model_name': 'GAIN', 'batch_size': 1, 'hint_rate': 0.23600009671495253, 'alpha': 66, 'iterations': 965, 'learning_rate': 0.006140442659642746, 'p_miss': 0.1312002679339349}. Best is trial 33 with value: 0.2879605715978292.
running
[I 2024-10-14 12:26:14,232] Trial 35 finished with value: 0.31065875608873944 and parameters: {'model_name': 'IterativeImputer', 'estimator': 'KNN', 'initial_strategy': 'mean', 'n_nearest_features': 5, 'imputation_order': 'ascending'}. Best is trial 33 with value: 0.2879605715978292.
running
[I 2024-10-14 12:26:15,323] Trial 34 finished with value: 0.2886867010372093 and parameters: {'model_name': 'KNNImputer', 'n_neighbors': 3257, 'weights': 'distance'}. Best is trial 33 with value: 0.2879605715978292.
running
[I 2024-10-14 12:26:24,692] Trial 36 finished with value: 0.2888554632416956 and parameters: {'model_name': 'KNNImputer', 'n_neighbors': 3491, 'weights': 'uniform'}. Best is trial 33 with value: 0.2879605715978292.
running
[I 2024-10-14 12:26:33,533] Trial 8 finished with value: 0.5463210780479557 and parameters: {'model_name': 'GAIN', 'batch_size': 927, 'hint_rate': 0.30755471633353254, 'alpha': 54, 'iterations': 251, 'learning_rate': 0.035867845041402224, 'p_miss': 0.14212362699594566}. Best is trial 33 with value: 0.2879605715978292.
running
[I 2024-10-14 12:26:35,423] Trial 38 finished with value: 0.28597324302803456 and parameters: {'model_name': 'KNNImputer', 'n_neighbors': 272, 'weights': 'uniform'}. Best is trial 38 with value: 0.28597324302803456.
running
[I 2024-10-14 12:26:44,755] Trial 37 finished with value: 0.28954810228944067 and parameters: {'model_name': 'KNNImputer', 'n_neighbors': 5642, 'weights': 'uniform'}. Best is trial 38 with value: 0.28597324302803456.
running
[I 2024-10-14 12:26:56,813] Trial 39 finished with value: 0.28651264930667475 and parameters: {'model_name': 'KNNImputer', 'n_neighbors': 499, 'weights': 'uniform'}. Best is trial 38 with value: 0.28597324302803456.
running
[I 2024-10-14 12:27:06,007] Trial 40 finished with value: 0.2873136127808569 and parameters: {'model_name': 'KNNImputer', 'n_neighbors': 41, 'weights': 'uniform'}. Best is trial 38 with value: 0.28597324302803456.
running
[I 2024-10-14 12:27:11,356] Trial 41 finished with value: 0.2859474867690468 and parameters: {'model_name': 'KNNImputer', 'n_neighbors': 255, 'weights': 'uniform'}. Best is trial 41 with value: 0.2859474867690468.
running
[I 2024-10-14 12:27:14,132] Trial 42 finished with value: 0.28595143096398357 and parameters: {'model_name': 'KNNImputer', 'n_neighbors': 166, 'weights': 'uniform'}. Best is trial 41 with value: 0.2859474867690468.
running
[I 2024-10-14 12:27:29,948] Trial 44 finished with value: 0.28772532979068755 and parameters: {'model_name': 'KNNImputer', 'n_neighbors': 1456, 'weights': 'uniform'}. Best is trial 41 with value: 0.2859474867690468.
running
[I 2024-10-14 12:28:04,636] Trial 43 finished with value: 0.2936129512155716 and parameters: {'model_name': 'KNNImputer', 'n_neighbors': 61964, 'weights': 'uniform'}. Best is trial 41 with value: 0.2859474867690468.
running
[I 2024-10-14 12:28:07,460] Trial 45 finished with value: 0.28657829032528914 and parameters: {'model_name': 'KNNImputer', 'n_neighbors': 522, 'weights': 'uniform'}. Best is trial 41 with value: 0.2859474867690468.
running
[I 2024-10-14 12:28:10,833] Trial 46 finished with value: 0.28598509537483274 and parameters: {'model_name': 'KNNImputer', 'n_neighbors': 280, 'weights': 'uniform'}. Best is trial 41 with value: 0.2859474867690468.
running
[I 2024-10-14 12:28:13,958] Trial 14 finished with value: 0.5270052993421774 and parameters: {'model_name': 'GAIN', 'batch_size': 35, 'hint_rate': 0.4556941955294386, 'alpha': 37, 'iterations': 774, 'learning_rate': 0.08920493500388324, 'p_miss': 0.1229710136202077}. Best is trial 41 with value: 0.2859474867690468.
running
[I 2024-10-14 12:28:18,785] Trial 47 finished with value: 0.29065110779345193 and parameters: {'model_name': 'KNNImputer', 'n_neighbors': 22, 'weights': 'uniform'}. Best is trial 41 with value: 0.2859474867690468.
running
[I 2024-10-14 12:28:27,413] Trial 48 finished with value: 0.2871868203572849 and parameters: {'model_name': 'KNNImputer', 'n_neighbors': 920, 'weights': 'uniform'}. Best is trial 41 with value: 0.2859474867690468.
running
[I 2024-10-14 12:29:32,429] Trial 51 finished with value: 0.2936129512155716 and parameters: {'model_name': 'KNNImputer', 'n_neighbors': 58828, 'weights': 'uniform'}. Best is trial 41 with value: 0.2859474867690468.
running
[I 2024-10-14 12:29:41,765] Trial 53 finished with value: 0.2908222679612355 and parameters: {'model_name': 'KNNImputer', 'n_neighbors': 13039, 'weights': 'uniform'}. Best is trial 41 with value: 0.2859474867690468.
running
[I 2024-10-14 12:29:44,746] Trial 50 finished with value: 0.2907063122661323 and parameters: {'model_name': 'KNNImputer', 'n_neighbors': 13528, 'weights': 'distance'}. Best is trial 41 with value: 0.2859474867690468.
running
[I 2024-10-14 12:29:44,994] Trial 63 finished with value: 0.5138010225084263 and parameters: {'model_name': 'SimpleImputer', 'strategy': 'most_frequent'}. Best is trial 41 with value: 0.2859474867690468.
running
[I 2024-10-14 12:29:45,408] Trial 52 finished with value: 0.2936129512155716 and parameters: {'model_name': 'KNNImputer', 'n_neighbors': 62616, 'weights': 'uniform'}. Best is trial 41 with value: 0.2859474867690468.
running
[I 2024-10-14 12:29:48,472] Trial 64 finished with value: 0.5138010225084263 and parameters: {'model_name': 'SimpleImputer', 'strategy': 'most_frequent'}. Best is trial 41 with value: 0.2859474867690468.
running
[I 2024-10-14 12:30:00,992] Trial 54 finished with value: 0.29143318881183894 and parameters: {'model_name': 'KNNImputer', 'n_neighbors': 18628, 'weights': 'uniform'}. Best is trial 41 with value: 0.2859474867690468.
running
[I 2024-10-14 12:30:16,055] Trial 55 finished with value: 0.2909016405065735 and parameters: {'model_name': 'KNNImputer', 'n_neighbors': 13642, 'weights': 'uniform'}. Best is trial 41 with value: 0.2859474867690468.
running
[I 2024-10-14 12:30:24,669] Trial 49 finished with value: 0.29305119689954673 and parameters: {'model_name': 'KNNImputer', 'n_neighbors': 62559, 'weights': 'distance'}. Best is trial 41 with value: 0.2859474867690468.
running
[I 2024-10-14 12:30:30,827] Trial 62 finished with value: 0.28961107572582245 and parameters: {'model_name': 'IterativeImputer', 'estimator': 'Ridge', 'initial_strategy': 'most_frequent', 'n_nearest_features': 1, 'imputation_order': 'arabic'}. Best is trial 41 with value: 0.2859474867690468.
running
[I 2024-10-14 12:30:41,476] Trial 57 finished with value: 0.29075298338495437 and parameters: {'model_name': 'KNNImputer', 'n_neighbors': 12515, 'weights': 'uniform'}. Best is trial 41 with value: 0.2859474867690468.
running
[I 2024-10-14 12:30:43,986] Trial 56 finished with value: 0.29087911175408 and parameters: {'model_name': 'KNNImputer', 'n_neighbors': 13470, 'weights': 'uniform'}. Best is trial 41 with value: 0.2859474867690468.
running
[I 2024-10-14 12:30:50,140] Trial 58 finished with value: 0.29080550030695995 and parameters: {'model_name': 'KNNImputer', 'n_neighbors': 12896, 'weights': 'uniform'}. Best is trial 41 with value: 0.2859474867690468.
running
[I 2024-10-14 12:30:50,878] Trial 60 finished with value: 0.2906624909293558 and parameters: {'model_name': 'KNNImputer', 'n_neighbors': 11806, 'weights': 'uniform'}. Best is trial 41 with value: 0.2859474867690468.
running
[I 2024-10-14 12:30:53,566] Trial 59 finished with value: 0.29103092845897316 and parameters: {'model_name': 'KNNImputer', 'n_neighbors': 14805, 'weights': 'uniform'}. Best is trial 41 with value: 0.2859474867690468.
running
[I 2024-10-14 12:30:57,904] Trial 61 finished with value: 0.29070520353843443 and parameters: {'model_name': 'KNNImputer', 'n_neighbors': 12154, 'weights': 'uniform'}. Best is trial 41 with value: 0.2859474867690468.
running
[I 2024-10-14 12:31:38,330] Trial 66 finished with value: 0.2902792443114265 and parameters: {'model_name': 'KNNImputer', 'n_neighbors': 9092, 'weights': 'uniform'}. Best is trial 41 with value: 0.2859474867690468.
running
[I 2024-10-14 12:31:41,075] Trial 67 finished with value: 0.29027264125232605 and parameters: {'model_name': 'KNNImputer', 'n_neighbors': 9060, 'weights': 'uniform'}. Best is trial 41 with value: 0.2859474867690468.
running
[I 2024-10-14 12:31:47,100] Trial 68 finished with value: 0.2902157803012799 and parameters: {'model_name': 'KNNImputer', 'n_neighbors': 8723, 'weights': 'uniform'}. Best is trial 41 with value: 0.2859474867690468.
running
[I 2024-10-14 12:45:51,532] Trial 7 finished with value: 0.3058950388744849 and parameters: {'model_name': 'VAE', 'batch_size': 5, 'iterations': 1052, 'learning_rate': 0.00011330911277181315, 'p_miss': 0.18748220164341678}. Best is trial 41 with value: 0.2859474867690468.
running
[I 2024-10-14 13:06:47,252] Trial 81 finished with value: inf and parameters: {'model_name': 'GAIN', 'batch_size': 12, 'hint_rate': 0.9603368513180253, 'alpha': 95, 'iterations': 4682, 'learning_rate': 0.005898631381073376, 'p_miss': 0.01962958977849419}. Best is trial 41 with value: 0.2859474867690468.
running
[I 2024-10-14 14:29:13,735] Trial 79 finished with value: 0.5208028768918808 and parameters: {'model_name': 'GAIN', 'batch_size': 7, 'hint_rate': 0.985142424040955, 'alpha': 89, 'iterations': 4955, 'learning_rate': 0.0047018035050487, 'p_miss': 0.2119249219449728}. Best is trial 41 with value: 0.2859474867690468.
running
[I 2024-10-14 14:37:12,007] Trial 83 finished with value: 0.298604633801267 and parameters: {'model_name': 'VAE', 'batch_size': 120, 'iterations': 144, 'learning_rate': 0.0019206966411801389, 'p_miss': 0.09972474101174861}. Best is trial 41 with value: 0.2859474867690468.
running
[I 2024-10-14 14:38:42,344] Trial 84 finished with value: 0.29827006926908756 and parameters: {'model_name': 'VAE', 'batch_size': 821, 'iterations': 6, 'learning_rate': 0.016027112690750255, 'p_miss': 0.252560088118817}. Best is trial 41 with value: 0.2859474867690468.
running
[I 2024-10-14 16:25:55,079] Trial 78 finished with value: 0.3116756431716559 and parameters: {'model_name': 'VAE', 'batch_size': 7, 'iterations': 4791, 'learning_rate': 0.0052592647641993544, 'p_miss': 0.012984159913349835}. Best is trial 41 with value: 0.2859474867690468.
running
[I 2024-10-14 16:27:13,323] Trial 86 finished with value: 0.28996068892265897 and parameters: {'model_name': 'KNNImputer', 'n_neighbors': 7354, 'weights': 'uniform'}. Best is trial 41 with value: 0.2859474867690468.
running
[I 2024-10-14 16:28:22,953] Trial 87 finished with value: 0.28626004309976577 and parameters: {'model_name': 'KNNImputer', 'n_neighbors': 394, 'weights': 'uniform'}. Best is trial 41 with value: 0.2859474867690468.
running
[I 2024-10-14 16:29:41,985] Trial 88 finished with value: 0.2896405442482934 and parameters: {'model_name': 'KNNImputer', 'n_neighbors': 6011, 'weights': 'uniform'}. Best is trial 41 with value: 0.2859474867690468.
running
[I 2024-10-14 16:30:49,670] Trial 89 finished with value: 0.3085148841064281 and parameters: {'model_name': 'KNNImputer', 'n_neighbors': 6, 'weights': 'uniform'}. Best is trial 41 with value: 0.2859474867690468.
running
[I 2024-10-14 16:31:48,785] Trial 90 finished with value: 0.2876417052118752 and parameters: {'model_name': 'IterativeImputer', 'estimator': 'Bayesian', 'initial_strategy': 'most_frequent', 'n_nearest_features': 10, 'imputation_order': 'roman', 'sample_posterior': False}. Best is trial 41 with value: 0.2859474867690468.
running
[I 2024-10-14 16:33:20,397] Trial 91 finished with value: 0.2920787994590057 and parameters: {'model_name': 'KNNImputer', 'n_neighbors': 26155, 'weights': 'uniform'}. Best is trial 41 with value: 0.2859474867690468.
running
[I 2024-10-14 16:34:37,176] Trial 92 finished with value: 0.28926873620598414 and parameters: {'model_name': 'KNNImputer', 'n_neighbors': 4693, 'weights': 'uniform'}. Best is trial 41 with value: 0.2859474867690468.
running
[I 2024-10-14 16:34:37,996] Trial 93 finished with value: 0.5516497772363793 and parameters: {'model_name': 'SimpleImputer', 'strategy': 'constant'}. Best is trial 41 with value: 0.2859474867690468.
running
[I 2024-10-14 16:35:30,912] Trial 80 finished with value: 0.31343514677412243 and parameters: {'model_name': 'VAE', 'batch_size': 7, 'iterations': 4871, 'learning_rate': 0.00518872688761918, 'p_miss': 0.20334456826287872}. Best is trial 41 with value: 0.2859474867690468.
running
[I 2024-10-14 16:35:52,267] Trial 94 finished with value: 0.288634500040767 and parameters: {'model_name': 'KNNImputer', 'n_neighbors': 2966, 'weights': 'uniform'}. Best is trial 41 with value: 0.2859474867690468.
running
[I 2024-10-14 16:36:50,074] Trial 95 finished with value: 0.2886503427143531 and parameters: {'model_name': 'KNNImputer', 'n_neighbors': 3009, 'weights': 'uniform'}. Best is trial 41 with value: 0.2859474867690468.
running
[I 2024-10-14 16:37:09,143] Trial 96 finished with value: 0.2869912270265346 and parameters: {'model_name': 'KNNImputer', 'n_neighbors': 788, 'weights': 'uniform'}. Best is trial 41 with value: 0.2859474867690468.
running
[I 2024-10-14 16:38:02,677] Trial 97 finished with value: 0.2859712609647339 and parameters: {'model_name': 'KNNImputer', 'n_neighbors': 273, 'weights': 'uniform'}. Best is trial 41 with value: 0.2859474867690468.
running
[I 2024-10-14 16:38:32,314] Trial 98 finished with value: 0.2896471315032955 and parameters: {'model_name': 'KNNImputer', 'n_neighbors': 6042, 'weights': 'uniform'}. Best is trial 41 with value: 0.2859474867690468.
running
[I 2024-10-14 16:39:23,917] Trial 99 finished with value: 0.2897415367375888 and parameters: {'model_name': 'KNNImputer', 'n_neighbors': 6394, 'weights': 'uniform'}. Best is trial 41 with value: 0.2859474867690468.
running
[I 2024-10-14 16:39:31,918] Trial 76 finished with value: 0.3262175074413216 and parameters: {'model_name': 'VAE', 'batch_size': 5, 'iterations': 4932, 'learning_rate': 0.00546754414300752, 'p_miss': 0.21336986897945096}. Best is trial 41 with value: 0.2859474867690468.
running
[I 2024-10-14 16:39:52,307] Trial 100 finished with value: 0.2886193186390872 and parameters: {'model_name': 'KNNImputer', 'n_neighbors': 2942, 'weights': 'uniform'}. Best is trial 41 with value: 0.2859474867690468.
running
