[I 2024-11-20 22:47:00,760] Trial 194 finished with value: 0.5864889703340403 and parameters: {'model_name': 'SimpleImputer', 'strategy': 'median'}. Best is trial 9 with value: 0.43223081596941393.
fit
simple fit
simple transform
0     0
1     0
2     0
3     0
4     0
5     0
6     0
7     0
8     0
9     0
10    0
11    0
12    0
13    0
14    0
15    0
16    0
17    0
18    0
19    0
20    0
21    0
22    0
23    0
dtype: int64
0     0
1     0
2     0
3     0
4     0
5     0
6     0
7     0
8     0
9     0
10    0
11    0
12    0
13    0
14    0
15    0
16    0
17    0
18    0
19    0
20    0
21    0
22    0
23    0
dtype: int64
0.43223081596941393
{'model_name': 'SimpleImputer', 'strategy': 'mean'}
running experiment 2/3 - Does reconstruction give good automl predictions
Start est fit
Version 0.1.7a0 of tpot2 is outdated. Version 0.1.8a0 was released Tuesday September 17, 2024.
Version 0.1.7a0 of tpot2 is outdated. Version 0.1.8a0 was released Tuesday September 17, 2024.
Version 0.1.7a0 of tpot2 is outdated. Version 0.1.8a0 was released Tuesday September 17, 2024.
Version 0.1.7a0 of tpot2 is outdated. Version 0.1.8a0 was released Tuesday September 17, 2024.
Version 0.1.7a0 of tpot2 is outdated. Version 0.1.8a0 was released Tuesday September 17, 2024.
Version 0.1.7a0 of tpot2 is outdated. Version 0.1.8a0 was released Tuesday September 17, 2024.
Version 0.1.7a0 of tpot2 is outdated. Version 0.1.8a0 was released Tuesday September 17, 2024.
Version 0.1.7a0 of tpot2 is outdated. Version 0.1.8a0 was released Tuesday September 17, 2024.
Version 0.1.7a0 of tpot2 is outdated. Version 0.1.8a0 was released Tuesday September 17, 2024.
Version 0.1.7a0 of tpot2 is outdated. Version 0.1.8a0 was released Tuesday September 17, 2024.
Version 0.1.7a0 of tpot2 is outdated. Version 0.1.8a0 was released Tuesday September 17, 2024.
Version 0.1.7a0 of tpot2 is outdated. Version 0.1.8a0 was released Tuesday September 17, 2024.
Version 0.1.7a0 of tpot2 is outdated. Version 0.1.8a0 was released Tuesday September 17, 2024.
Version 0.1.7a0 of tpot2 is outdated. Version 0.1.8a0 was released Tuesday September 17, 2024.
Version 0.1.7a0 of tpot2 is outdated. Version 0.1.8a0 was released Tuesday September 17, 2024.
Version 0.1.7a0 of tpot2 is outdated. Version 0.1.8a0 was released Tuesday September 17, 2024.
  0%|          | 0/25 [00:00<?, ?it/s]Generation:   0%|          | 0/25 [00:00<?, ?it/s]WARNING THIS INDIVIDUAL CAUSED AND EXCEPTION 
 <tpot2.search_spaces.pipelines.sequential.SequentialPipelineIndividual object at 0x155474d18310> 
 Argument 'metric' has incorrect type (expected str, got numpy.str_) 
 Traceback (most recent call last):
  File "/common/ketrong/tpotexp/tpot2/tpot2/utils/eval_utils.py", line 53, in objective_nan_wrapper
    value = func_timeout.func_timeout(timeout, objective_function, args=[individual], kwargs=objective_kwargs)
  File "/common/ketrong/tpotexp/env/lib/python3.10/site-packages/func_timeout/dafunc.py", line 108, in func_timeout
    raise_exception(exception)
  File "/common/ketrong/tpotexp/env/lib/python3.10/site-packages/func_timeout/py3_raise.py", line 7, in raise_exception
    raise exception[0] from None
  File "/common/ketrong/tpotexp/tpot2/tpot2/tpot_estimator/estimator.py", line 623, in objective_function
    return objective_function_generator(
  File "/common/ketrong/tpotexp/tpot2/tpot2/tpot_estimator/estimator_utils.py", line 55, in objective_function_generator
    cv_obj_scores = cross_val_score_objective(sklearn.base.clone(pipeline),x,y,scorers=scorers, cv=cv , fold=step)
  File "/common/ketrong/tpotexp/tpot2/tpot2/tpot_estimator/cross_val_utils.py", line 31, in cross_val_score_objective
    this_fold_scores = [sklearn.metrics.get_scorer(scorer)(this_fold_pipeline, X_test, y_test) for scorer in scorers]
  File "/common/ketrong/tpotexp/tpot2/tpot2/tpot_estimator/cross_val_utils.py", line 31, in <listcomp>
    this_fold_scores = [sklearn.metrics.get_scorer(scorer)(this_fold_pipeline, X_test, y_test) for scorer in scorers]
  File "/common/ketrong/tpotexp/env/lib/python3.10/site-packages/sklearn/metrics/_scorer.py", line 279, in __call__
    return self._score(partial(_cached_call, None), estimator, X, y_true, **_kwargs)
  File "/common/ketrong/tpotexp/env/lib/python3.10/site-packages/sklearn/metrics/_scorer.py", line 371, in _score
    y_pred = method_caller(
  File "/common/ketrong/tpotexp/env/lib/python3.10/site-packages/sklearn/metrics/_scorer.py", line 89, in _cached_call
    result, _ = _get_response_values(
  File "/common/ketrong/tpotexp/env/lib/python3.10/site-packages/sklearn/utils/_response.py", line 211, in _get_response_values
    y_pred = prediction_method(X)
  File "/common/ketrong/tpotexp/env/lib/python3.10/site-packages/sklearn/pipeline.py", line 601, in predict
    return self.steps[-1][1].predict(Xt, **params)
  File "/common/ketrong/tpotexp/env/lib/python3.10/site-packages/sklearn/neighbors/_classification.py", line 259, in predict
    probabilities = self.predict_proba(X)
  File "/common/ketrong/tpotexp/env/lib/python3.10/site-packages/sklearn/neighbors/_classification.py", line 343, in predict_proba
    probabilities = ArgKminClassMode.compute(
  File "/common/ketrong/tpotexp/env/lib/python3.10/site-packages/sklearn/metrics/_pairwise_distances_reduction/_dispatcher.py", line 584, in compute
    return ArgKminClassMode64.compute(
TypeError: Argument 'metric' has incorrect type (expected str, got numpy.str_)

Generation:  1
Best f1_score score: 0.568008786626037
Generation:   4%|▍         | 1/25 [00:49<19:52, 49.67s/it]Generation:  2
Best f1_score score: 0.568008786626037
Generation:   8%|▊         | 2/25 [00:59<10:04, 26.28s/it]Generation:  3
Best f1_score score: 0.568008786626037
Generation:  12%|█▏        | 3/25 [01:14<07:41, 20.96s/it]Generation:  4
Best f1_score score: 0.5689522874577754
Generation:  16%|█▌        | 4/25 [01:28<06:20, 18.14s/it]Generation:  5
Best f1_score score: 0.5689522874577754
Generation:  20%|██        | 5/25 [01:36<04:53, 14.68s/it]Generation:  6
Best f1_score score: 0.5689522874577754
Generation:  24%|██▍       | 6/25 [01:46<04:10, 13.17s/it]Generation:  7
Best f1_score score: 0.5689522874577754
Generation:  28%|██▊       | 7/25 [01:54<03:26, 11.45s/it]Generation:  8
Best f1_score score: 0.5689522874577754
Generation:  32%|███▏      | 8/25 [02:06<03:14, 11.43s/it]Generation:  9
Best f1_score score: 0.5689522874577754
Generation:  36%|███▌      | 9/25 [02:17<03:00, 11.26s/it]Generation:  10
Best f1_score score: 0.5689587511591523
Generation:  40%|████      | 10/25 [02:27<02:44, 10.97s/it]Generation:  11
Best f1_score score: 0.5689587511591523
Generation:  44%|████▍     | 11/25 [02:38<02:35, 11.12s/it]Generation:  12
Best f1_score score: 0.5689587511591523
Generation:  48%|████▊     | 12/25 [02:58<02:56, 13.59s/it]WARNING THIS INDIVIDUAL CAUSED AND EXCEPTION 
 <tpot2.search_spaces.pipelines.sequential.SequentialPipelineIndividual object at 0x155474171300> 
 The 'min_samples_split' parameter of DecisionTreeClassifier must be an int in the range [2, inf) or a float in the range (0.0, 1.0]. Got 1 instead. 
 Traceback (most recent call last):
  File "/common/ketrong/tpotexp/tpot2/tpot2/utils/eval_utils.py", line 53, in objective_nan_wrapper
    value = func_timeout.func_timeout(timeout, objective_function, args=[individual], kwargs=objective_kwargs)
  File "/common/ketrong/tpotexp/env/lib/python3.10/site-packages/func_timeout/dafunc.py", line 108, in func_timeout
    raise_exception(exception)
  File "/common/ketrong/tpotexp/env/lib/python3.10/site-packages/func_timeout/py3_raise.py", line 7, in raise_exception
    raise exception[0] from None
  File "/common/ketrong/tpotexp/tpot2/tpot2/tpot_estimator/estimator.py", line 623, in objective_function
    return objective_function_generator(
  File "/common/ketrong/tpotexp/tpot2/tpot2/tpot_estimator/estimator_utils.py", line 55, in objective_function_generator
    cv_obj_scores = cross_val_score_objective(sklearn.base.clone(pipeline),x,y,scorers=scorers, cv=cv , fold=step)
  File "/common/ketrong/tpotexp/tpot2/tpot2/tpot_estimator/cross_val_utils.py", line 28, in cross_val_score_objective
    this_fold_pipeline.fit(X_train,y_train)
  File "/common/ketrong/tpotexp/env/lib/python3.10/site-packages/sklearn/base.py", line 1473, in wrapper
    return fit_method(estimator, *args, **kwargs)
  File "/common/ketrong/tpotexp/env/lib/python3.10/site-packages/sklearn/pipeline.py", line 473, in fit
    self._final_estimator.fit(Xt, y, **last_step_params["fit"])
  File "/common/ketrong/tpotexp/env/lib/python3.10/site-packages/sklearn/base.py", line 1466, in wrapper
    estimator._validate_params()
  File "/common/ketrong/tpotexp/env/lib/python3.10/site-packages/sklearn/base.py", line 666, in _validate_params
    validate_parameter_constraints(
  File "/common/ketrong/tpotexp/env/lib/python3.10/site-packages/sklearn/utils/_param_validation.py", line 95, in validate_parameter_constraints
    raise InvalidParameterError(
sklearn.utils._param_validation.InvalidParameterError: The 'min_samples_split' parameter of DecisionTreeClassifier must be an int in the range [2, inf) or a float in the range (0.0, 1.0]. Got 1 instead.

Generation:  13
Best f1_score score: 0.5689587511591523
Generation:  52%|█████▏    | 13/25 [03:21<03:17, 16.45s/it]Generation:  14
Best f1_score score: 0.5689587511591523
Generation:  56%|█████▌    | 14/25 [03:30<02:37, 14.33s/it]Generation:  15
Best f1_score score: 0.5689587511591523
Generation:  60%|██████    | 15/25 [03:47<02:30, 15.06s/it]Generation:  16
Best f1_score score: 0.5689587511591523
Generation:  64%|██████▍   | 16/25 [04:08<02:31, 16.88s/it]WARNING THIS INDIVIDUAL CAUSED AND EXCEPTION 
 <tpot2.search_spaces.pipelines.sequential.SequentialPipelineIndividual object at 0x15545bb9c3a0> 
 Argument 'metric' has incorrect type (expected str, got numpy.str_) 
 Traceback (most recent call last):
  File "/common/ketrong/tpotexp/tpot2/tpot2/utils/eval_utils.py", line 53, in objective_nan_wrapper
    value = func_timeout.func_timeout(timeout, objective_function, args=[individual], kwargs=objective_kwargs)
  File "/common/ketrong/tpotexp/env/lib/python3.10/site-packages/func_timeout/dafunc.py", line 108, in func_timeout
    raise_exception(exception)
  File "/common/ketrong/tpotexp/env/lib/python3.10/site-packages/func_timeout/py3_raise.py", line 7, in raise_exception
    raise exception[0] from None
  File "/common/ketrong/tpotexp/tpot2/tpot2/tpot_estimator/estimator.py", line 623, in objective_function
    return objective_function_generator(
  File "/common/ketrong/tpotexp/tpot2/tpot2/tpot_estimator/estimator_utils.py", line 55, in objective_function_generator
    cv_obj_scores = cross_val_score_objective(sklearn.base.clone(pipeline),x,y,scorers=scorers, cv=cv , fold=step)
  File "/common/ketrong/tpotexp/tpot2/tpot2/tpot_estimator/cross_val_utils.py", line 31, in cross_val_score_objective
    this_fold_scores = [sklearn.metrics.get_scorer(scorer)(this_fold_pipeline, X_test, y_test) for scorer in scorers]
  File "/common/ketrong/tpotexp/tpot2/tpot2/tpot_estimator/cross_val_utils.py", line 31, in <listcomp>
    this_fold_scores = [sklearn.metrics.get_scorer(scorer)(this_fold_pipeline, X_test, y_test) for scorer in scorers]
  File "/common/ketrong/tpotexp/env/lib/python3.10/site-packages/sklearn/metrics/_scorer.py", line 279, in __call__
    return self._score(partial(_cached_call, None), estimator, X, y_true, **_kwargs)
  File "/common/ketrong/tpotexp/env/lib/python3.10/site-packages/sklearn/metrics/_scorer.py", line 371, in _score
    y_pred = method_caller(
  File "/common/ketrong/tpotexp/env/lib/python3.10/site-packages/sklearn/metrics/_scorer.py", line 89, in _cached_call
    result, _ = _get_response_values(
  File "/common/ketrong/tpotexp/env/lib/python3.10/site-packages/sklearn/utils/_response.py", line 211, in _get_response_values
    y_pred = prediction_method(X)
  File "/common/ketrong/tpotexp/env/lib/python3.10/site-packages/sklearn/pipeline.py", line 601, in predict
    return self.steps[-1][1].predict(Xt, **params)
  File "/common/ketrong/tpotexp/env/lib/python3.10/site-packages/sklearn/neighbors/_classification.py", line 259, in predict
    probabilities = self.predict_proba(X)
  File "/common/ketrong/tpotexp/env/lib/python3.10/site-packages/sklearn/neighbors/_classification.py", line 343, in predict_proba
    probabilities = ArgKminClassMode.compute(
  File "/common/ketrong/tpotexp/env/lib/python3.10/site-packages/sklearn/metrics/_pairwise_distances_reduction/_dispatcher.py", line 584, in compute
    return ArgKminClassMode64.compute(
TypeError: Argument 'metric' has incorrect type (expected str, got numpy.str_)

Generation:  17
Best f1_score score: 0.5689587511591523
Generation:  68%|██████▊   | 17/25 [04:31<02:30, 18.75s/it]Generation:  18
Best f1_score score: 0.5689587511591523
Generation:  72%|███████▏  | 18/25 [04:43<01:56, 16.59s/it]Generation:  19
Best f1_score score: 0.5689587511591523
Generation:  76%|███████▌  | 19/25 [04:56<01:34, 15.68s/it]Generation:  20
Best f1_score score: 0.5693315411388961
Generation:  80%|████████  | 20/25 [05:10<01:16, 15.30s/it]WARNING THIS INDIVIDUAL CAUSED AND EXCEPTION 
 <tpot2.search_spaces.pipelines.sequential.SequentialPipelineIndividual object at 0x15545bfcad10> 
 Argument 'metric' has incorrect type (expected str, got numpy.str_) 
 Traceback (most recent call last):
  File "/common/ketrong/tpotexp/tpot2/tpot2/utils/eval_utils.py", line 53, in objective_nan_wrapper
    value = func_timeout.func_timeout(timeout, objective_function, args=[individual], kwargs=objective_kwargs)
  File "/common/ketrong/tpotexp/env/lib/python3.10/site-packages/func_timeout/dafunc.py", line 108, in func_timeout
    raise_exception(exception)
  File "/common/ketrong/tpotexp/env/lib/python3.10/site-packages/func_timeout/py3_raise.py", line 7, in raise_exception
    raise exception[0] from None
  File "/common/ketrong/tpotexp/tpot2/tpot2/tpot_estimator/estimator.py", line 623, in objective_function
    return objective_function_generator(
  File "/common/ketrong/tpotexp/tpot2/tpot2/tpot_estimator/estimator_utils.py", line 55, in objective_function_generator
    cv_obj_scores = cross_val_score_objective(sklearn.base.clone(pipeline),x,y,scorers=scorers, cv=cv , fold=step)
  File "/common/ketrong/tpotexp/tpot2/tpot2/tpot_estimator/cross_val_utils.py", line 31, in cross_val_score_objective
    this_fold_scores = [sklearn.metrics.get_scorer(scorer)(this_fold_pipeline, X_test, y_test) for scorer in scorers]
  File "/common/ketrong/tpotexp/tpot2/tpot2/tpot_estimator/cross_val_utils.py", line 31, in <listcomp>
    this_fold_scores = [sklearn.metrics.get_scorer(scorer)(this_fold_pipeline, X_test, y_test) for scorer in scorers]
  File "/common/ketrong/tpotexp/env/lib/python3.10/site-packages/sklearn/metrics/_scorer.py", line 279, in __call__
    return self._score(partial(_cached_call, None), estimator, X, y_true, **_kwargs)
  File "/common/ketrong/tpotexp/env/lib/python3.10/site-packages/sklearn/metrics/_scorer.py", line 371, in _score
    y_pred = method_caller(
  File "/common/ketrong/tpotexp/env/lib/python3.10/site-packages/sklearn/metrics/_scorer.py", line 89, in _cached_call
    result, _ = _get_response_values(
  File "/common/ketrong/tpotexp/env/lib/python3.10/site-packages/sklearn/utils/_response.py", line 211, in _get_response_values
    y_pred = prediction_method(X)
  File "/common/ketrong/tpotexp/env/lib/python3.10/site-packages/sklearn/pipeline.py", line 601, in predict
    return self.steps[-1][1].predict(Xt, **params)
  File "/common/ketrong/tpotexp/env/lib/python3.10/site-packages/sklearn/neighbors/_classification.py", line 259, in predict
    probabilities = self.predict_proba(X)
  File "/common/ketrong/tpotexp/env/lib/python3.10/site-packages/sklearn/neighbors/_classification.py", line 343, in predict_proba
    probabilities = ArgKminClassMode.compute(
  File "/common/ketrong/tpotexp/env/lib/python3.10/site-packages/sklearn/metrics/_pairwise_distances_reduction/_dispatcher.py", line 584, in compute
    return ArgKminClassMode64.compute(
TypeError: Argument 'metric' has incorrect type (expected str, got numpy.str_)

Generation:  21
Best f1_score score: 0.5693315411388961
Generation:  84%|████████▍ | 21/25 [05:26<01:01, 15.33s/it]Generation:  22
Best f1_score score: 0.5693315411388961
Generation:  88%|████████▊ | 22/25 [06:39<01:38, 32.76s/it]Generation:  23
Best f1_score score: 0.5693315411388961
Generation:  92%|█████████▏| 23/25 [06:57<00:56, 28.22s/it]Generation:  24
Best f1_score score: 0.5693315411388961
Generation:  96%|█████████▌| 24/25 [07:11<00:24, 24.07s/it]Generation:  25
Best f1_score score: 0.5693315411388961
Generation: 100%|██████████| 25/25 [07:40<00:00, 25.61s/it]Generation: 100%|██████████| 25/25 [07:44<00:00, 18.58s/it]
2024-11-20 22:54:51,466 - distributed.scheduler - ERROR - Removing worker 'tcp://127.0.0.1:45047' caused the cluster to lose scattered data, which can't be recovered: {'ndarray-aaa2b88d19f9f0691588887cb76384e0', 'ndarray-f164f99589c317fd70cfff5e1e03bbdd'} (stimulus_id='handle-worker-cleanup-1732172091.466703')
Fitted
Pipeline(steps=[('lineardiscriminantanalysis',
                 LinearDiscriminantAnalysis(shrinkage=0.2314911665338,
                                            solver='lsqr'))])
score start
train score: {'auroc': 0.9199636956472947, 'accuracy': 0.580078125, 'balanced_accuracy': 0.581032644074403, 'logloss': 1.2076430849263597, 'f1': 0.5820915335104329}
original test score: {'auroc': 0.9596123198299917, 'accuracy': 0.7453125, 'balanced_accuracy': 0.7455254131895237, 'logloss': 0.8260658214560401, 'f1': 0.7390306849672091}
imputed test score: {'auroc': 0.9048717427614037, 'accuracy': 0.5484375, 'balanced_accuracy': 0.5499098793375227, 'logloss': 1.3568489777722295, 'f1': 0.5520585982335466}
score end
check intended
EXP2 Finished
running experiment 3/3 - What is the best automl settings?
<tpot2.search_spaces.pipelines.sequential.SequentialPipeline object at 0x15543504f9d0>
Start tpot fit
Version 0.1.7a0 of tpot2 is outdated. Version 0.1.8a0 was released Tuesday September 17, 2024.
Version 0.1.7a0 of tpot2 is outdated. Version 0.1.8a0 was released Tuesday September 17, 2024.
Version 0.1.7a0 of tpot2 is outdated. Version 0.1.8a0 was released Tuesday September 17, 2024.
Version 0.1.7a0 of tpot2 is outdated. Version 0.1.8a0 was released Tuesday September 17, 2024.
Version 0.1.7a0 of tpot2 is outdated. Version 0.1.8a0 was released Tuesday September 17, 2024.
Version 0.1.7a0 of tpot2 is outdated. Version 0.1.8a0 was released Tuesday September 17, 2024.
Version 0.1.7a0 of tpot2 is outdated. Version 0.1.8a0 was released Tuesday September 17, 2024.
Version 0.1.7a0 of tpot2 is outdated. Version 0.1.8a0 was released Tuesday September 17, 2024.
Version 0.1.7a0 of tpot2 is outdated. Version 0.1.8a0 was released Tuesday September 17, 2024.
Version 0.1.7a0 of tpot2 is outdated. Version 0.1.8a0 was released Tuesday September 17, 2024.
Version 0.1.7a0 of tpot2 is outdated. Version 0.1.8a0 was released Tuesday September 17, 2024.
Version 0.1.7a0 of tpot2 is outdated. Version 0.1.8a0 was released Tuesday September 17, 2024.
Version 0.1.7a0 of tpot2 is outdated. Version 0.1.8a0 was released Tuesday September 17, 2024.
Version 0.1.7a0 of tpot2 is outdated. Version 0.1.8a0 was released Tuesday September 17, 2024.
Version 0.1.7a0 of tpot2 is outdated. Version 0.1.8a0 was released Tuesday September 17, 2024.
Version 0.1.7a0 of tpot2 is outdated. Version 0.1.8a0 was released Tuesday September 17, 2024.
  0%|          | 0/25 [00:00<?, ?it/s]Generation:   0%|          | 0/25 [00:00<?, ?it/s]Generation:  1
Best f1_score score: 0.5656968710947325
Generation:   4%|▍         | 1/25 [00:10<04:00, 10.02s/it]Generation:  2
Best f1_score score: 0.5656968710947325
Generation:   8%|▊         | 2/25 [00:15<02:47,  7.27s/it]Generation:  3
Best f1_score score: 0.5656968710947325
Generation:  12%|█▏        | 3/25 [00:26<03:19,  9.05s/it]WARNING THIS INDIVIDUAL CAUSED AND EXCEPTION 
 <tpot2.search_spaces.pipelines.sequential.SequentialPipelineIndividual object at 0x15547464a680> 
 shrinkage not supported with 'svd' solver. 
 Traceback (most recent call last):
  File "/common/ketrong/tpotexp/tpot2/tpot2/utils/eval_utils.py", line 53, in objective_nan_wrapper
    value = func_timeout.func_timeout(timeout, objective_function, args=[individual], kwargs=objective_kwargs)
  File "/common/ketrong/tpotexp/env/lib/python3.10/site-packages/func_timeout/dafunc.py", line 108, in func_timeout
    raise_exception(exception)
  File "/common/ketrong/tpotexp/env/lib/python3.10/site-packages/func_timeout/py3_raise.py", line 7, in raise_exception
    raise exception[0] from None
  File "/common/ketrong/tpotexp/tpot2/tpot2/tpot_estimator/estimator.py", line 623, in objective_function
    return objective_function_generator(
  File "/common/ketrong/tpotexp/tpot2/tpot2/tpot_estimator/estimator_utils.py", line 55, in objective_function_generator
    cv_obj_scores = cross_val_score_objective(sklearn.base.clone(pipeline),x,y,scorers=scorers, cv=cv , fold=step)
  File "/common/ketrong/tpotexp/tpot2/tpot2/tpot_estimator/cross_val_utils.py", line 28, in cross_val_score_objective
    this_fold_pipeline.fit(X_train,y_train)
  File "/common/ketrong/tpotexp/env/lib/python3.10/site-packages/sklearn/base.py", line 1473, in wrapper
    return fit_method(estimator, *args, **kwargs)
  File "/common/ketrong/tpotexp/env/lib/python3.10/site-packages/sklearn/pipeline.py", line 473, in fit
    self._final_estimator.fit(Xt, y, **last_step_params["fit"])
  File "/common/ketrong/tpotexp/env/lib/python3.10/site-packages/sklearn/base.py", line 1473, in wrapper
    return fit_method(estimator, *args, **kwargs)
  File "/common/ketrong/tpotexp/env/lib/python3.10/site-packages/sklearn/discriminant_analysis.py", line 629, in fit
    raise NotImplementedError("shrinkage not supported with 'svd' solver.")
NotImplementedError: shrinkage not support