[I 2024-08-14 02:24:54,684] Trial 199 finished with value: 0.04763124268667594 and parameters: {'model_name': 'IterativeImputer', 'estimator': 'RFR', 'initial_strategy': 'constant', 'n_nearest_features': 10, 'imputation_order': 'random'}. Best is trial 93 with value: 0.0458692748749441.
fit
auto fit
auto transform
0    0
1    0
2    0
3    0
4    0
5    0
6    0
7    0
8    0
9    0
dtype: int64
0    0
1    0
2    0
3    0
4    0
5    0
6    0
7    0
8    0
9    0
dtype: int64
0.0458692748749441
{'model_name': 'IterativeImputer', 'estimator': 'RFR', 'initial_strategy': 'constant', 'n_nearest_features': 10, 'imputation_order': 'random'}
running experiment 2/3 - Does reconstruction give good automl predictions
Start est fit
  0%|          | 0/25 [00:00<?, ?it/s]Generation:   0%|          | 0/25 [00:00<?, ?it/s]Generation:  1
Best f1_score score: 0.9665884536956574
Generation:   4%|▍         | 1/25 [00:36<14:34, 36.45s/it]Generation:  2
Best f1_score score: 0.9695081733557978
Generation:   8%|▊         | 2/25 [01:28<17:25, 45.45s/it]Generation:  3
Best f1_score score: 0.9695081733557978
Generation:  12%|█▏        | 3/25 [05:32<50:02, 136.46s/it]Generation:  4
Best f1_score score: 0.9695081733557978
Generation:  16%|█▌        | 4/25 [06:04<33:17, 95.11s/it] Generation:  5
Best f1_score score: 0.9695081733557978
Generation:  20%|██        | 5/25 [06:51<25:55, 77.76s/it]Generation:  6
Best f1_score score: 0.9695081733557978
Generation:  24%|██▍       | 6/25 [07:56<23:13, 73.34s/it]Generation:  7
Best f1_score score: 0.9701094904020332
Generation:  28%|██▊       | 7/25 [12:20<40:45, 135.83s/it]Generation:  8
Best f1_score score: 0.9701094904020332
Generation:  32%|███▏      | 8/25 [13:07<30:23, 107.29s/it]Generation:  9
Best f1_score score: 0.9705838953371015
Generation:  36%|███▌      | 9/25 [13:36<22:07, 82.98s/it] Generation:  10
Best f1_score score: 0.9705838953371015
Generation:  40%|████      | 10/25 [14:01<16:17, 65.17s/it]Generation:  11
Best f1_score score: 0.9705838953371015
Generation:  44%|████▍     | 11/25 [15:54<18:33, 79.53s/it]Generation:  12
Best f1_score score: 0.9705838953371015
Generation:  48%|████▊     | 12/25 [16:38<14:54, 68.83s/it]WARNING THIS INDIVIDUAL CAUSED AND EXCEPTION 
 <tpot2.search_spaces.pipelines.sequential.SequentialPipelineIndividual object at 0x155475b47a60> 
 The 'min_samples_split' parameter of DecisionTreeClassifier must be an int in the range [2, inf) or a float in the range (0.0, 1.0]. Got 1 instead. 
 Traceback (most recent call last):
  File "/common/ketrong/tpotexp/tpot2/tpot2/utils/eval_utils.py", line 53, in objective_nan_wrapper
    value = func_timeout.func_timeout(timeout, objective_function, args=[individual], kwargs=objective_kwargs)
  File "/common/ketrong/tpotexp/env/lib/python3.10/site-packages/func_timeout/dafunc.py", line 108, in func_timeout
    raise_exception(exception)
  File "/common/ketrong/tpotexp/env/lib/python3.10/site-packages/func_timeout/py3_raise.py", line 7, in raise_exception
    raise exception[0] from None
  File "/common/ketrong/tpotexp/tpot2/tpot2/tpot_estimator/estimator.py", line 623, in objective_function
    return objective_function_generator(
  File "/common/ketrong/tpotexp/tpot2/tpot2/tpot_estimator/estimator_utils.py", line 55, in objective_function_generator
    cv_obj_scores = cross_val_score_objective(sklearn.base.clone(pipeline),x,y,scorers=scorers, cv=cv , fold=step)
  File "/common/ketrong/tpotexp/tpot2/tpot2/tpot_estimator/cross_val_utils.py", line 28, in cross_val_score_objective
    this_fold_pipeline.fit(X_train,y_train)
  File "/common/ketrong/tpotexp/env/lib/python3.10/site-packages/sklearn/base.py", line 1473, in wrapper
    return fit_method(estimator, *args, **kwargs)
  File "/common/ketrong/tpotexp/env/lib/python3.10/site-packages/sklearn/pipeline.py", line 473, in fit
    self._final_estimator.fit(Xt, y, **last_step_params["fit"])
  File "/common/ketrong/tpotexp/env/lib/python3.10/site-packages/sklearn/base.py", line 1466, in wrapper
    estimator._validate_params()
  File "/common/ketrong/tpotexp/env/lib/python3.10/site-packages/sklearn/base.py", line 666, in _validate_params
    validate_parameter_constraints(
  File "/common/ketrong/tpotexp/env/lib/python3.10/site-packages/sklearn/utils/_param_validation.py", line 95, in validate_parameter_constraints
    raise InvalidParameterError(
sklearn.utils._param_validation.InvalidParameterError: The 'min_samples_split' parameter of DecisionTreeClassifier must be an int in the range [2, inf) or a float in the range (0.0, 1.0]. Got 1 instead.

Generation:  13
Best f1_score score: 0.9705838953371015
Generation:  52%|█████▏    | 13/25 [19:33<20:10, 100.91s/it]Generation:  14
Best f1_score score: 0.9705838953371015
Generation:  56%|█████▌    | 14/25 [20:03<14:35, 79.60s/it] Generation:  15
Best f1_score score: 0.9705838953371015
Generation:  60%|██████    | 15/25 [20:32<10:44, 64.42s/it]Generation:  16
Best f1_score score: 0.971178826261309
Generation:  64%|██████▍   | 16/25 [21:09<08:24, 56.04s/it]Generation:  17
Best f1_score score: 0.971178826261309
Generation:  68%|██████▊   | 17/25 [22:12<07:46, 58.32s/it]Generation:  18
Best f1_score score: 0.971178826261309
Generation:  72%|███████▏  | 18/25 [25:30<11:41, 100.17s/it]Generation:  19
Best f1_score score: 0.971178826261309
Generation:  76%|███████▌  | 19/25 [26:25<08:39, 86.59s/it] Generation:  20
Best f1_score score: 0.971178826261309
Generation:  80%|████████  | 20/25 [27:52<07:14, 86.82s/it]Generation:  21
Best f1_score score: 0.971178826261309
Generation:  84%|████████▍ | 21/25 [28:54<05:17, 79.36s/it]Generation:  22
Best f1_score score: 0.971178826261309
Generation:  88%|████████▊ | 22/25 [29:20<03:10, 63.35s/it]Generation:  23
Best f1_score score: 0.971178826261309
Generation:  92%|█████████▏| 23/25 [29:46<01:44, 52.04s/it]Generation:  24
Best f1_score score: 0.971178826261309
Generation:  96%|█████████▌| 24/25 [31:03<00:59, 59.65s/it]Generation:  25
Best f1_score score: 0.971178826261309
Generation: 100%|██████████| 25/25 [32:15<00:00, 63.17s/it]Generation: 100%|██████████| 25/25 [32:18<00:00, 77.54s/it]
2024-08-14 03:02:45,026 - distributed.scheduler - ERROR - Removing worker 'tcp://127.0.0.1:34695' caused the cluster to lose scattered data, which can't be recovered: {'ndarray-23f0eef1ec7034d09b67651117ebaf48', 'ndarray-c642d3726a5c9bdf70cede789f7cfb3d'} (stimulus_id='handle-worker-cleanup-1723629765.0259757')
Fitted
Pipeline(steps=[('xgbclassifier',
                 XGBClassifier(base_score=None, booster=None, callbacks=None,
                               colsample_bylevel=None, colsample_bynode=None,
                               colsample_bytree=None, device=None,
                               early_stopping_rounds=None,
                               enable_categorical=False, eval_metric=None,
                               feature_types=None, gamma=0.2394415919578,
                               grow_policy=None, importance_type=None,
                               interaction_constraints=None,
                               learning_rate=0.0647050105386, max_bin=None,
                               max_cat_threshold=None, max_cat_to_onehot=None,
                               max_delta_step=None, max_depth=12,
                               max_leaves=None, min_child_weight=6, missing=nan,
                               monotone_constraints=None, multi_strategy=None,
                               n_estimators=100, n_jobs=1, nthread=1,
                               num_parallel_tree=None, ...))])
score start
train score: {'auroc': 0.9976233909237383, 'accuracy': 0.9841624365482233, 'balanced_accuracy': 0.9035381031914321, 'logloss': 0.05948565187582741, 'f1': 0.9838595910077009}
original test score: {'auroc': 0.996950188964105, 'accuracy': 0.9726277372262774, 'balanced_accuracy': 0.8355383099285538, 'logloss': 0.07788059841732442, 'f1': 0.9724774581365392}
imputed test score: {'auroc': 0.9968039585723236, 'accuracy': 0.9726277372262774, 'balanced_accuracy': 0.8355383099285538, 'logloss': 0.07818290501203473, 'f1': 0.9724774581365392}
score end
check intended
EXP2 Finished
running experiment 3/3 - What is the best automl settings?
<tpot2.search_spaces.pipelines.sequential.SequentialPipeline object at 0x155436506260>
Start tpot fit
  0%|          | 0/25 [00:00<?, ?it/s]Generation:   0%|          | 0/25 [00:00<?, ?it/s]WARNING THIS INDIVIDUAL CAUSED AND EXCEPTION 
 <tpot2.search_spaces.pipelines.sequential.SequentialPipelineIndividual object at 0x155475d3a2f0> 
 Input X contains NaN.
LogisticRegression does not accept missing values encoded as NaN natively. For supervised learning, you might want to consider sklearn.ensemble.HistGradientBoostingClassifier and Regressor which accept missing values encoded as NaNs natively. Alternatively, it is possible to preprocess the data, for instance by using an imputer transformer in a pipeline or drop samples with missing values. See https://scikit-learn.org/stable/modules/impute.html You can find a list of all estimators that handle NaN values at the following page: https://scikit-learn.org/stable/modules/impute.html#estimators-that-handle-nan-values 
 Traceback (most recent call last):
  File "/common/ketrong/tpotexp/tpot2/tpot2/utils/eval_utils.py", line 53, in objective_nan_wrapper
    value = func_timeout.func_timeout(timeout, objective_function, args=[individual], kwargs=objective_kwargs)
  File "/common/ketrong/tpotexp/env/lib/python3.10/site-packages/func_timeout/dafunc.py", line 108, in func_timeout
    raise_exception(exception)
  File "/common/ketrong/tpotexp/env/lib/python3.10/site-packages/func_timeout/py3_raise.py", line 7, in raise_exception
    raise exception[0] from None
  File "/common/ketrong/tpotexp/tpot2/tpot2/tpot_estimator/estimator.py", line 623, in objective_function
    return objective_function_generator(
  File "/common/ketrong/tpotexp/tpot2/tpot2/tpot_estimator/estimator_utils.py", line 55, in objective_function_generator
    cv_obj_scores = cross_val_score_objective(sklearn.base.clone(pipeline),x,y,scorers=scorers, cv=cv , fold=step)
  File "/common/ketrong/tpotexp/tpot2/tpot2/tpot_estimator/cross_val_utils.py", line 28, in cross_val_score_objective
    this_fold_pipeline.fit(X_train,y_train)
  File "/common/ketrong/tpotexp/env/lib/python3.10/site-packages/sklearn/base.py", line 1473, in wrapper
    return fit_method(estimator, *args, **kwargs)
  File "/common/ketrong/tpotexp/env/lib/python3.10/site-packages/sklearn/pipeline.py", line 473, in fit
    self._final_estimator.fit(Xt, y, **last_step_params["fit"])
  File "/common/ketrong/tpotexp/env/lib/python3.10/site-packages/sklearn/base.py", line 1473, in wrapper
    return fit_method(estimator, *args, **kwargs)
  File "/common/ketrong/tpotexp/env/lib/python3.10/site-packages/sklearn/linear_model/_logistic.py", line 1223, in fit
    X, y = self._validate_data(
  File "/common/ketrong/tpotexp/env/lib/python3.10/site-packages/sklearn/base.py", line 650, in _validate_data
    X, y = check_X_y(X, y, **check_params)
  File "/common/ketrong/tpotexp/env/lib/python3.10/site-packages/sklearn/utils/validation.py", line 1301, in check_X_y
    X = check_array(
  File "/common/ketrong/tpotexp/env/lib/python3.10/site-packages/sklearn/utils/validation.py", line 1064, in check_array
    _assert_all_finite(
  File "/common/ketrong/tpotexp/env/lib/python3.10/site-packages/sklearn/utils/validation.py", line 123, in _assert_all_finite
    _assert_all_finite_element_wise(
  File "/common/ketrong/tpotexp/env/lib/python3.10/site-packages/sklearn/utils/validation.py", line 172, in _assert_all_finite_element_wise
    raise ValueError(msg_err)
ValueError: Input X contains NaN.
LogisticRegression does not accept missing values encoded as NaN natively. For supervised learning, you might want to consider sklearn.ensemble.HistGradientBoostingClassifier and Regressor which accept missing values encoded as NaNs natively. Alternatively, it is possible to preprocess the data, for instance by using an imputer transformer in a pipeline or drop samples with missing values. See https://scikit-learn.org/stable/modules/impute.html You can find a list of all estimators that handle NaN values at the following page: https://scikit-learn.org/stable/modules/impute.html#estimators-that-handle-nan-values

WARNING THIS INDIVIDUAL CAUSED AND EXCEPTION 
 <tpot2.search_spaces.pipelines.sequential.SequentialPipelineIndividual object at 0x155475d3a2f0> 
 Input X contains NaN.
GaussianNB does not accept missing values encoded as NaN natively. For supervised learning, you might want to consider sklearn.ensemble.HistGradientBoostingClassifier and Regressor which accept missing values encoded as NaNs natively. Alternatively, it is possible to preprocess the data, for instance by using an imputer transformer in a pipeline or drop samples with missing values. See https://scikit-learn.org/stable/modules/impute.html You can find a list of all estimators that handle NaN values at the following page: https://scikit-learn.org/stable/modules/impute.html#estimators-that-handle-nan-values 
 Traceback (most recent call last):
  File "/common/ketrong/tpotexp/tpot2/tpot2/utils/eval_utils.py", line 53, in objective_nan_wrapper
    value = func_timeout.func_timeout(timeout, objective_function, args=[individual], kwargs=objective_kwargs)
  File "/common/ketrong/tpotexp/env/lib/python3.10/site-packages/func_timeout/dafunc.py", line 108, in func_timeout
    raise_exception(exception)
  File "/common/ketrong/tpotexp/env/lib/python3.10/site-packages/func_timeout/py3_raise.py", line 7, in raise_exception
    raise exception[0] from None
  File "/common/ketrong/tpotexp/tpot2/tpot2/tpot_estimator/estimator.py", line 623, in objective_function
    return objective_function_generator(
  File "/common/ketrong/tpotexp/tpot2/tpot2/tpot_estimator/estimator_utils.py", line 55, in objective_function_generator
    cv_obj_scores = cross_val_score_objective(sklearn.base.clone(pipeline),x,y,scorers=scorers, cv=cv , fold=step)
  File "/common/ketrong/tpotexp/tpot2/tpot2/tpot_estimator/cross_val_utils.py", line 28, in cross_val_score_objective
    this_fold_pipeline.fit(X_train,y_train)
  File "/common/ketrong/tpotexp/env/lib/python3.10/site-packages/sklearn/base.py", line 1473, in wrapper
    return fit_method(estimator, *args, **kwargs)
  File "/common/ketrong/tpotexp/env/lib/python3.10/site-packages/sklearn/pipeline.py", line 473, in fit
    self._final_estimator.fit(Xt, y, **last_step_params["fit"])
  File "/common/ketrong/tpotexp/env/lib/python3.10/site-packages/sklearn/base.py", line 1473, in wrapper
    return fit_method(estimator, *args, **kwargs)
  File "/common/ketrong/tpotexp/env/lib/python3.10/site-packages/sklearn/naive_bayes.py", line 263, in fit
    return self._partial_fit(
  File "/common/ketrong/tpotexp/env/lib/python3.10/site-packages/sklearn/naive_bayes.py", line 423, in _partial_fit
    X, y = self._validate_data(X, y, reset=first_call)
  File "/common/ketrong/tpotexp/env/lib/python3.10/site-packages/sklearn/base.py", line 650, in _validate_data
    X, y = check_X_y(X, y, **check_params)
  File "/common/ketrong/tpotexp/env/lib/python3.10/site-packages/sklearn/utils/validation.py", line 1301, in check_X_y
    X = check_array(
  File "/common/ketrong/tpotexp/env/lib/python3.10/site-packages/sklearn/utils/validation.py", line 1064, in check_array
    _assert_all_finite(
  File "/common/ketrong/tpotexp/env/lib/python3.10/site-packages/sklearn/utils/validation.py", line 123, in _assert_all_finite
    _assert_all_finite_element_wise(
  File "/common/ketrong/tpotexp/env/lib/python3.10/site-packages/sklearn/utils/validation.py", line 172, in _assert_all_finite_element_wise
    raise ValueError(msg_err)
ValueError: Input X contains NaN.
GaussianNB does not accept missing values encoded as NaN natively. For supervised learning, you might want to consider sklearn.ensemble.HistGradientBoostingClassifier and Regressor which accept missing values encoded as NaNs natively. Alternatively, it is possible to preprocess the data, for instance by using an imputer transformer in a pipeline or drop samples with missing values. See https://scikit-learn.org/stable/modules/impute.html You can find a list of all estimators that handle NaN values at the following page: https://scikit-learn.org/stable/modules/impute.html#estimators-that-handle-nan-values

Generation:  1
Best f1_score score: 0.9660936948558086
Generation:   4%|▍         | 1/25 [00:22<09:09, 22.89s/it]WARNING AN INDIVIDUAL TIMED OUT: 
 <tpot2.search_spaces.pipelines.sequential.SequentialPipelineIndividual object at 0x155475d3a6b0> 

Generation:  2
Best f1_score score: 0.9662613029403104
Generation:   8%|▊         | 2/25 [10:26<2:19:48, 364.70s/it]Generation:  3
Best f1_score score: 0.9662613029403104
Generation:  12%|█▏        | 3/25 [10:56<1:17:37, 211.71s/it]WARNING AN INDIVIDUAL TIMED OUT: 
 <tpot2.search_spaces.pipelines.sequential.SequentialPipelineIndividual object at 0x15545869d8d0> 

Generation:  4
Best f1_score score: 0.9676285354444772
Generation:  16%|█▌        | 4/25 [20:59<2:08:13, 366.38s/it]WARNING AN INDIVIDUAL TIMED OUT: 
 <tpot2.search_spaces.pipelines.sequential.SequentialPipelineIndividual object at 0x155475789f60> 

Generation:  5
Best f1_score score: 0.9676285354444772
Generation:  20%|██        | 5/25 [31:04<2:30:47, 452.39s/it]WARNING AN INDIVIDUAL TIMED OUT: 
 <tpot2.search_spaces.pipelines.sequential.SequentialPipelineIndividual object at 0x155475711570> 

Generation:  6
Best f1_score score: 0.9682701599558714
Generation:  24%|██▍       | 6/25 [41:08<2:39:31, 503.78s/it]WARNING AN INDIVIDUAL TIMED OUT: 
 <tpot2.search_spaces.pipelines.sequential.SequentialPipelineIndividual object at 0x155475e1bc70> 

Generation:  7
Best f1_score score: 0.9692476125963194
Generation:  28%|██▊       | 7/25 [51:13<2:41:04, 536.93s/it]WARNING AN INDIVIDUAL TIMED OUT: 
 <tpot2.search_spaces.pipelines.sequential.SequentialPipelineIndividual object at 0x155475dc5d80> 

Generation:  8
Best f1_score score: 0.9694566006522083
Generation:  32%|███▏      | 8/25 [1:01:17<2:38:08, 558.12s/it]WARNING AN INDIVIDUAL TIMED OUT: 
 <tpot2.search_spaces.pipelines.sequential.SequentialPipelineIndividual object at 0x1554756c8040> 

Generation:  9
Best f1_score score: 0.9694566006522083
Generation:  36%|███▌      | 9/25 [1:11:22<2:32:48, 573.05s/it]WARNING AN INDIVIDUAL TIMED OUT: 
 <tpot2.search_spaces.pipelines.sequential.SequentialPipelineIndividual object at 0x1554754346d0> 

WARNING AN INDIVIDUAL TIMED OUT: 
 <tpot2.search_spaces.pipelines.sequential.SequentialPipelineIndividual object at 0x1554752f30a0> 

Generation:  10
Best f1_score score: 0.9694566006522083
Generation:  40%|████      | 10/25 [1:21:29<2:25:48, 583.24s/it]WARNING AN INDIVIDUAL TIMED OUT: 
 <tpot2.search_spaces.pipelines.sequential.SequentialPipelineIndividual object at 0x1554756d61a0> 

Generation:  11
Best f1_score score: 0.9694566006522083
Generation:  44%|████▍     | 11/25 [1:31:32<2:17:32, 589.50s/it]WARNING AN INDIVIDUAL TIMED OUT: 
 <tpot2.search_spaces.pipelines.sequential.SequentialPipelineIndividual object at 0x155474fd58a0> 

WARNING AN INDIVIDUAL TIMED OUT: 
 <tpot2.search_spaces.pipelines.sequential.SequentialPipelineIndividual object at 0x15545f4d2920> 

Generation:  12
Best f1_score score: 0.9700971089981273
Generation:  48%|████▊     | 12/25 [1:41:38<2:08:49, 594.56s/it]WARNING AN INDIVIDUAL TIMED OUT: 
 <tpot2.search_spaces.pipelines.sequential.SequentialPipelineIndividual object at 0x155474beead0> 

WARNING AN INDIVIDUAL TIMED OUT: 
 <tpot2.search_spaces.pipelines.sequential.SequentialPipelineIndividual object at 0x1554580ebd30> 

WARNING AN INDIVIDUAL TIMED OUT: 
 <tpot2.search_spaces.pipelines.sequential.SequentialPipelineIndividual object at 0x1554506e6c80> 

Generation:  13
Best f1_score score: 0.9700971089981273
Generation:  52%|█████▏    | 13/25 [1:51:43<1:59:29, 597.49s/it]Generation:  14
Best f1_score score: 0.9700971089981273
Generation:  56%|█████▌    | 14/25 [1:52:05<1:17:42, 423.91s/it]Generation:  15
Best f1_score score: 0.9700971089981273
Generation:  60%|██████    | 15/25 [1:56:08<1:01:32, 369.21s/it]WARNING AN INDIVIDUAL TIMED OUT: 
 <tpot2.search_spaces.pipelines.sequential.SequentialPipelineIndividual object at 0x1554584e36d0> 

WARNING AN INDIVIDUAL TIMED OUT: 
 <tpot2.search_spaces.pipelines.sequential.SequentialPipelineIndividual object at 0x155474dae050> 

Generation:  16
Best f1_score score: 0.9700971089981273
Generation:  64%|██████▍   | 16/25 [2:06:14<1:06:04, 440.49s/it]WARNING THIS INDIVIDUAL CAUSED AND EXCEPTION 
 <tpot2.search_spaces.pipelines.sequential.SequentialPipelineIndividual object at 0x155474b4b0d0> 
 Negative values in data passed to MultinomialNB (input X) 
 Traceback (most recent call last):
  File "/common/ketrong/tpotexp/tpot2/tpot2/utils/eval_utils.py", line 53, in objective_nan_wrapper
    value = func_timeout.func_timeout(timeout, objective_function, args=[individual], kwargs=objective_kwargs)
  File "/common/ketrong/tpotexp/env/lib/python3.10/site-packages/func_timeout/dafunc.py", line 108, in func_timeout
    raise_exception(exception)
  File "/common/ketrong/tpotexp/env/lib/python3.10/site-packages/func_timeout/py3_raise.py", line 7, in raise_exception
    raise exception[0] from None
  File "/common/ketrong/tpotexp/tpot2/tpot2/tpot_estimator/estimator.py", line 623, in objective_function
    return objective_function_generator(
  File "/common/ketrong/tpotexp/tpot2/tpot2/tpot_estimator/estimator_utils.py", line 55, in objective_function_generator
    cv_obj_scores = cross_val_score_objective(sklearn.base.clone(pipeline),x,y,scorers=scorers, cv=cv , fold=step)
  File "/common/ketrong/tpotexp/tpot2/tpot2/tpot_estimator/cross_val_utils.py", line 28, in cross_val_score_objective
    this_fold_pipeline.fit(X_train,y_train)
  File "/common/ketrong/tpotexp/env/lib/python3.10/site-packages/sklearn/base.py", line 1473, in wr