[I 2024-08-15 20:41:50,626] Trial 103 finished with value: 0.08992884018924999 and parameters: {'model_name': 'KNNImputer', 'n_neighbors': 13853, 'weights': 'uniform'}. Best is trial 6 with value: 0.07906713047117861.
running
[I 2024-08-15 20:41:54,219] Trial 104 finished with value: 0.20835393386139786 and parameters: {'model_name': 'SimpleImputer', 'strategy': 'most_frequent'}. Best is trial 6 with value: 0.07906713047117861.
running
[I 2024-08-15 20:41:55,966] Trial 105 finished with value: 0.07906713047117861 and parameters: {'model_name': 'SimpleImputer', 'strategy': 'median'}. Best is trial 6 with value: 0.07906713047117861.
running
[I 2024-08-15 20:41:57,559] Trial 106 finished with value: 0.07906713047117861 and parameters: {'model_name': 'SimpleImputer', 'strategy': 'median'}. Best is trial 6 with value: 0.07906713047117861.
running
[I 2024-08-15 20:41:59,123] Trial 107 finished with value: 0.07906713047117861 and parameters: {'model_name': 'SimpleImputer', 'strategy': 'median'}. Best is trial 6 with value: 0.07906713047117861.
running
[I 2024-08-15 20:42:00,090] Trial 108 finished with value: 0.09083261660032763 and parameters: {'model_name': 'SimpleImputer', 'strategy': 'mean'}. Best is trial 6 with value: 0.07906713047117861.
running
[I 2024-08-15 20:42:01,632] Trial 109 finished with value: 0.07906713047117861 and parameters: {'model_name': 'SimpleImputer', 'strategy': 'median'}. Best is trial 6 with value: 0.07906713047117861.
running
[I 2024-08-15 20:42:03,400] Trial 110 finished with value: 0.07906713047117861 and parameters: {'model_name': 'SimpleImputer', 'strategy': 'median'}. Best is trial 6 with value: 0.07906713047117861.
running
[I 2024-08-15 20:42:05,035] Trial 111 finished with value: 0.07906713047117861 and parameters: {'model_name': 'SimpleImputer', 'strategy': 'median'}. Best is trial 6 with value: 0.07906713047117861.
running
[I 2024-08-15 20:42:51,788] Trial 75 finished with value: inf and parameters: {'model_name': 'GAIN', 'batch_size': 6, 'hint_rate': 0.6506749131294302, 'alpha': 48, 'iterations': 1931, 'learning_rate': 0.09966228890903425, 'p_miss': 0.0346472740696441}. Best is trial 6 with value: 0.07906713047117861.
running
[I 2024-08-15 20:42:53,654] Trial 113 finished with value: 0.07906713047117861 and parameters: {'model_name': 'SimpleImputer', 'strategy': 'median'}. Best is trial 6 with value: 0.07906713047117861.
running
[I 2024-08-15 20:42:55,408] Trial 114 finished with value: 0.07906713047117861 and parameters: {'model_name': 'SimpleImputer', 'strategy': 'median'}. Best is trial 6 with value: 0.07906713047117861.
running
[I 2024-08-15 20:42:57,303] Trial 115 finished with value: 0.07906713047117861 and parameters: {'model_name': 'SimpleImputer', 'strategy': 'median'}. Best is trial 6 with value: 0.07906713047117861.
running
[I 2024-08-15 20:42:59,041] Trial 116 finished with value: 0.07906713047117861 and parameters: {'model_name': 'SimpleImputer', 'strategy': 'median'}. Best is trial 6 with value: 0.07906713047117861.
running
[I 2024-08-15 20:43:00,969] Trial 117 finished with value: 0.07906713047117861 and parameters: {'model_name': 'SimpleImputer', 'strategy': 'median'}. Best is trial 6 with value: 0.07906713047117861.
running
[I 2024-08-15 20:43:02,023] Trial 118 finished with value: 0.20835393386139786 and parameters: {'model_name': 'SimpleImputer', 'strategy': 'constant'}. Best is trial 6 with value: 0.07906713047117861.
running
[I 2024-08-15 20:43:03,951] Trial 119 finished with value: 0.07906713047117861 and parameters: {'model_name': 'SimpleImputer', 'strategy': 'median'}. Best is trial 6 with value: 0.07906713047117861.
running
[I 2024-08-15 20:43:05,799] Trial 120 finished with value: 0.07906713047117861 and parameters: {'model_name': 'SimpleImputer', 'strategy': 'median'}. Best is trial 6 with value: 0.07906713047117861.
running
[I 2024-08-15 20:49:45,802] Trial 67 finished with value: inf and parameters: {'model_name': 'GAIN', 'batch_size': 6, 'hint_rate': 0.6351619728562276, 'alpha': 100, 'iterations': 6722, 'learning_rate': 0.04635575159207216, 'p_miss': 0.01878506455477033}. Best is trial 6 with value: 0.07906713047117861.
running
[I 2024-08-15 20:50:11,093] Trial 122 finished with value: 0.08922088913127844 and parameters: {'model_name': 'KNNImputer', 'n_neighbors': 12071, 'weights': 'uniform'}. Best is trial 6 with value: 0.07906713047117861.
running
[I 2024-08-15 20:50:15,321] Trial 123 finished with value: 0.20835393386139786 and parameters: {'model_name': 'SimpleImputer', 'strategy': 'most_frequent'}. Best is trial 6 with value: 0.07906713047117861.
running
[I 2024-08-15 20:50:16,887] Trial 124 finished with value: 0.07906713047117861 and parameters: {'model_name': 'SimpleImputer', 'strategy': 'median'}. Best is trial 6 with value: 0.07906713047117861.
running
[I 2024-08-15 20:50:18,549] Trial 125 finished with value: 0.07906713047117861 and parameters: {'model_name': 'SimpleImputer', 'strategy': 'median'}. Best is trial 6 with value: 0.07906713047117861.
running
[I 2024-08-15 20:50:20,380] Trial 126 finished with value: 0.07906713047117861 and parameters: {'model_name': 'SimpleImputer', 'strategy': 'median'}. Best is trial 6 with value: 0.07906713047117861.
running
[I 2024-08-15 20:50:22,075] Trial 127 finished with value: 0.07906713047117861 and parameters: {'model_name': 'SimpleImputer', 'strategy': 'median'}. Best is trial 6 with value: 0.07906713047117861.
running
[I 2024-08-15 20:50:23,106] Trial 128 finished with value: 0.09083261660032763 and parameters: {'model_name': 'SimpleImputer', 'strategy': 'mean'}. Best is trial 6 with value: 0.07906713047117861.
running
[I 2024-08-15 20:50:24,723] Trial 129 finished with value: 0.07906713047117861 and parameters: {'model_name': 'SimpleImputer', 'strategy': 'median'}. Best is trial 6 with value: 0.07906713047117861.
running
[I 2024-08-15 20:50:26,555] Trial 130 finished with value: 0.07906713047117861 and parameters: {'model_name': 'SimpleImputer', 'strategy': 'median'}. Best is trial 6 with value: 0.07906713047117861.
running
[I 2024-08-15 20:50:28,394] Trial 131 finished with value: 0.07906713047117861 and parameters: {'model_name': 'SimpleImputer', 'strategy': 'median'}. Best is trial 6 with value: 0.07906713047117861.
running
[I 2024-08-15 20:51:14,746] Trial 69 finished with value: inf and parameters: {'model_name': 'GAIN', 'batch_size': 6, 'hint_rate': 0.6436237371719487, 'alpha': 99, 'iterations': 6060, 'learning_rate': 0.09067136928610302, 'p_miss': 0.026848105310171705}. Best is trial 6 with value: 0.07906713047117861.
running
[I 2024-08-15 20:51:16,430] Trial 133 finished with value: 0.07906713047117861 and parameters: {'model_name': 'SimpleImputer', 'strategy': 'median'}. Best is trial 6 with value: 0.07906713047117861.
running
[I 2024-08-15 20:51:18,305] Trial 134 finished with value: 0.07906713047117861 and parameters: {'model_name': 'SimpleImputer', 'strategy': 'median'}. Best is trial 6 with value: 0.07906713047117861.
running
[I 2024-08-15 20:51:19,201] Trial 135 finished with value: 0.20835393386139786 and parameters: {'model_name': 'SimpleImputer', 'strategy': 'constant'}. Best is trial 6 with value: 0.07906713047117861.
running
[I 2024-08-15 20:51:20,845] Trial 136 finished with value: 0.07906713047117861 and parameters: {'model_name': 'SimpleImputer', 'strategy': 'median'}. Best is trial 6 with value: 0.07906713047117861.
running
[I 2024-08-15 20:51:22,544] Trial 137 finished with value: 0.07906713047117861 and parameters: {'model_name': 'SimpleImputer', 'strategy': 'median'}. Best is trial 6 with value: 0.07906713047117861.
running
[I 2024-08-15 20:51:24,189] Trial 138 finished with value: 0.07906713047117861 and parameters: {'model_name': 'SimpleImputer', 'strategy': 'median'}. Best is trial 6 with value: 0.07906713047117861.
running
[I 2024-08-15 20:51:25,999] Trial 139 finished with value: 0.07906713047117861 and parameters: {'model_name': 'SimpleImputer', 'strategy': 'median'}. Best is trial 6 with value: 0.07906713047117861.
running
[I 2024-08-15 20:51:40,877] Trial 121 finished with value: 0.211074132696024 and parameters: {'model_name': 'GAIN', 'batch_size': 169, 'hint_rate': 0.9712001264827161, 'alpha': 7, 'iterations': 180, 'learning_rate': 0.0005542561510127692, 'p_miss': 0.12813532725817592}. Best is trial 6 with value: 0.07906713047117861.
running
[I 2024-08-15 20:56:16,124] Trial 112 finished with value: 0.20917089089589497 and parameters: {'model_name': 'GAIN', 'batch_size': 159, 'hint_rate': 0.9449373158493208, 'alpha': 46, 'iterations': 311, 'learning_rate': 0.0005857562266459121, 'p_miss': 0.12048008288977216}. Best is trial 6 with value: 0.07906713047117861.
running
[I 2024-08-15 20:56:17,890] Trial 142 finished with value: 0.07906713047117861 and parameters: {'model_name': 'SimpleImputer', 'strategy': 'median'}. Best is trial 6 with value: 0.07906713047117861.
running
[I 2024-08-15 20:57:03,305] Trial 94 finished with value: 0.2193083738907749 and parameters: {'model_name': 'GAIN', 'batch_size': 125, 'hint_rate': 0.3355729830114453, 'alpha': 1, 'iterations': 370, 'learning_rate': 0.0006850613562627062, 'p_miss': 0.11194495083594203}. Best is trial 6 with value: 0.07906713047117861.
running
[I 2024-08-15 21:00:34,392] Trial 132 finished with value: 0.21133683341762272 and parameters: {'model_name': 'GAIN', 'batch_size': 178, 'hint_rate': 0.9889636331431375, 'alpha': 0, 'iterations': 242, 'learning_rate': 0.0004884296179812088, 'p_miss': 0.12340635053873558}. Best is trial 6 with value: 0.07906713047117861.
running
[I 2024-08-15 21:02:33,758] Trial 71 finished with value: inf and parameters: {'model_name': 'GAIN', 'batch_size': 6, 'hint_rate': 0.600646619123991, 'alpha': 100, 'iterations': 8835, 'learning_rate': 0.03406424746125188, 'p_miss': 0.018116203782896717}. Best is trial 6 with value: 0.07906713047117861.
running
[I 2024-08-15 21:02:35,291] Trial 146 finished with value: 0.07906713047117861 and parameters: {'model_name': 'SimpleImputer', 'strategy': 'median'}. Best is trial 6 with value: 0.07906713047117861.
running
[I 2024-08-15 21:02:36,570] Trial 147 finished with value: 0.07906713047117861 and parameters: {'model_name': 'SimpleImputer', 'strategy': 'median'}. Best is trial 6 with value: 0.07906713047117861.
running
[I 2024-08-15 21:03:22,784] Trial 70 finished with value: inf and parameters: {'model_name': 'GAIN', 'batch_size': 5, 'hint_rate': 0.6676880372142387, 'alpha': 98, 'iterations': 9055, 'learning_rate': 0.0848865707818972, 'p_miss': 0.024325868693363867}. Best is trial 6 with value: 0.07906713047117861.
running
[I 2024-08-15 21:04:04,212] Trial 68 finished with value: inf and parameters: {'model_name': 'GAIN', 'batch_size': 8, 'hint_rate': 0.6403572528299587, 'alpha': 95, 'iterations': 9883, 'learning_rate': 0.09833580236864986, 'p_miss': 0.01413679532754819}. Best is trial 6 with value: 0.07906713047117861.
running
[I 2024-08-15 21:04:59,229] Trial 72 finished with value: inf and parameters: {'model_name': 'GAIN', 'batch_size': 6, 'hint_rate': 0.6527913013465471, 'alpha': 98, 'iterations': 9678, 'learning_rate': 0.09378725939673706, 'p_miss': 0.041464347732289075}. Best is trial 6 with value: 0.07906713047117861.
running
[I 2024-08-15 21:05:00,375] Trial 151 finished with value: 0.07906713047117861 and parameters: {'model_name': 'SimpleImputer', 'strategy': 'median'}. Best is trial 6 with value: 0.07906713047117861.
running
[I 2024-08-15 21:06:33,937] Trial 77 finished with value: inf and parameters: {'model_name': 'GAIN', 'batch_size': 6, 'hint_rate': 0.6470853887903032, 'alpha': 90, 'iterations': 9405, 'learning_rate': 0.08730565172620923, 'p_miss': 0.04253188401366784}. Best is trial 6 with value: 0.07906713047117861.
running
[I 2024-08-15 21:14:23,919] Trial 13 finished with value: 0.20125419559723423 and parameters: {'model_name': 'GAIN', 'batch_size': 5, 'hint_rate': 0.8448915145277677, 'alpha': 10, 'iterations': 3110, 'learning_rate': 0.0003081064457159321, 'p_miss': 0.15191059054677283}. Best is trial 6 with value: 0.07906713047117861.
running
[I 2024-08-15 21:14:24,811] Trial 154 finished with value: 0.07906713047117861 and parameters: {'model_name': 'SimpleImputer', 'strategy': 'median'}. Best is trial 6 with value: 0.07906713047117861.
running
[I 2024-08-15 21:14:25,879] Trial 155 finished with value: 0.07906713047117861 and parameters: {'model_name': 'SimpleImputer', 'strategy': 'median'}. Best is trial 6 with value: 0.07906713047117861.
running
[I 2024-08-15 21:27:43,674] Trial 82 finished with value: 0.22406601668457976 and parameters: {'model_name': 'GAIN', 'batch_size': 164, 'hint_rate': 0.9805961367148456, 'alpha': 0, 'iterations': 8346, 'learning_rate': 0.0007709649774878325, 'p_miss': 0.1164370491203381}. Best is trial 6 with value: 0.07906713047117861.
running
[I 2024-08-15 21:27:52,165] Trial 76 finished with value: 0.20994856749977617 and parameters: {'model_name': 'GAIN', 'batch_size': 131, 'hint_rate': 0.6291205276007359, 'alpha': 46, 'iterations': 8544, 'learning_rate': 0.09937386219928479, 'p_miss': 0.12762318227125607}. Best is trial 6 with value: 0.07906713047117861.
running
[I 2024-08-15 23:29:03,244] Trial 22 finished with value: 0.08778897026834584 and parameters: {'model_name': 'IterativeImputer', 'estimator': 'RFR', 'initial_strategy': 'constant', 'n_nearest_features': 5, 'imputation_order': 'arabic'}. Best is trial 6 with value: 0.07906713047117861.
running
[I 2024-08-15 23:29:03,706] Trial 159 finished with value: 0.07906713047117861 and parameters: {'model_name': 'SimpleImputer', 'strategy': 'median'}. Best is trial 6 with value: 0.07906713047117861.
running
[I 2024-08-15 23:29:04,136] Trial 160 finished with value: 0.07906713047117861 and parameters: {'model_name': 'SimpleImputer', 'strategy': 'median'}. Best is trial 6 with value: 0.07906713047117861.
running
[I 2024-08-15 23:52:34,958] Trial 148 finished with value: 0.08735305955966123 and parameters: {'model_name': 'IterativeImputer', 'estimator': 'RFR', 'initial_strategy': 'most_frequent', 'n_nearest_features': 5, 'imputation_order': 'roman'}. Best is trial 6 with value: 0.07906713047117861.
running
[I 2024-08-15 23:52:35,360] Trial 162 finished with value: 0.07906713047117861 and parameters: {'model_name': 'SimpleImputer', 'strategy': 'median'}. Best is trial 6 with value: 0.07906713047117861.
running
[I 2024-08-15 23:52:50,025] Trial 163 finished with value: 0.08654309533155187 and parameters: {'model_name': 'KNNImputer', 'n_neighbors': 4851, 'weights': 'distance'}. Best is trial 6 with value: 0.07906713047117861.
running
[I 2024-08-15 23:52:50,430] Trial 164 finished with value: 0.20835393386139786 and parameters: {'model_name': 'SimpleImputer', 'strategy': 'most_frequent'}. Best is trial 6 with value: 0.07906713047117861.
running
[I 2024-08-15 23:52:50,846] Trial 165 finished with value: 0.07906713047117861 and parameters: {'model_name': 'SimpleImputer', 'strategy': 'median'}. Best is trial 6 with value: 0.07906713047117861.
running
[I 2024-08-15 23:52:51,231] Trial 166 finished with value: 0.07906713047117861 and parameters: {'model_name': 'SimpleImputer', 'strategy': 'median'}. Best is trial 6 with value: 0.07906713047117861.
running
[I 2024-08-15 23:52:51,620] Trial 167 finished with value: 0.07906713047117861 and parameters: {'model_name': 'SimpleImputer', 'strategy': 'median'}. Best is trial 6 with value: 0.07906713047117861.
running
[I 2024-08-15 23:52:51,999] Trial 168 finished with value: 0.07906713047117861 and parameters: {'model_name': 'SimpleImputer', 'strategy': 'median'}. Best is trial 6 with value: 0.07906713047117861.
running
[I 2024-08-15 23:52:52,417] Trial 169 finished with value: 0.07906713047117861 and parameters: {'model_name': 'SimpleImputer', 'strategy': 'median'}. Best is trial 6 with value: 0.07906713047117861.
running
[I 2024-08-15 23:52:52,674] Trial 170 finished with value: 0.09083261660032763 and parameters: {'model_name': 'SimpleImputer', 'strategy': 'mean'}. Best is trial 6 with value: 0.07906713047117861.
running
[I 2024-08-15 23:52:53,053] Trial 171 finished with value: 0.07906713047117861 and parameters: {'model_name': 'SimpleImputer', 'strategy': 'median'}. Best is trial 6 with value: 0.07906713047117861.
running
[I 2024-08-15 23:52:53,467] Trial 172 finished with value: 0.07906713047117861 and parameters: {'model_name': 'SimpleImputer', 'strategy': 'median'}. Best is trial 6 with value: 0.07906713047117861.
running
[I 2024-08-15 23:52:53,859] Trial 173 finished with value: 0.07906713047117861 and parameters: {'model_name': 'SimpleImputer', 'strategy': 'median'}. Best is trial 6 with value: 0.07906713047117861.
running
[I 2024-08-15 23:52:54,324] Trial 174 finished with value: 0.07906713047117861 and parameters: {'model_name': 'SimpleImputer', 'strategy': 'median'}. Best is trial 6 with value: 0.07906713047117861.
running
[I 2024-08-15 23:52:54,700] Trial 175 finished with value: 0.07906713047117861 and parameters: {'model_name': 'SimpleImputer', 'strategy': 'median'}. Best is trial 6 with value: 0.07906713047117861.
running
[I 2024-08-15 23:52:55,085] Trial 176 finished with value: 0.07906713047117861 and parameters: {'model_name': 'SimpleImputer', 'strategy': 'median'}. Best is trial 6 with value: 0.07906713047117861.
running
[I 2024-08-15 23:52:55,575] Trial 177 finished with value: 0.07906713047117861 and parameters: {'model_name': 'SimpleImputer', 'strategy': 'median'}. Best is trial 6 with value: 0.07906713047117861.
running
[I 2024-08-15 23:52:55,957] Trial 178 finished with value: 0.07906713047117861 and parameters: {'model_name': 'SimpleImputer', 'strategy': 'median'}. Best is trial 6 with value: 0.07906713047117861.
running
[I 2024-08-15 23:52:56,231] Trial 179 finished with value: 0.20835393386139786 and parameters: {'model_name': 'SimpleImputer', 'strategy': 'constant'}. Best is trial 6 with value: 0.07906713047117861.
running
[I 2024-08-15 23:52:56,708] Trial 180 finished with value: 0.07906713047117861 and parameters: {'model_name': 'SimpleImputer', 'strategy': 'median'}. Best is trial 6 with value: 0.07906713047117861.
running
[I 2024-08-15 23:52:57,092] Trial 181 finished with value: 0.07906713047117861 and parameters: {'model_name': 'SimpleImputer', 'strategy': 'median'}. Best is trial 6 with value: 0.07906713047117861.
running
[I 2024-08-15 23:52:57,473] Trial 182 finished with value: 0.07906713047117861 and parameters: {'model_name': 'SimpleImputer', 'strategy': 'median'}. Best is trial 6 with value: 0.07906713047117861.
running
[I 2024-08-15 23:52:57,924] Trial 183 finished with value: 0.07906713047117861 and parameters: {'model_name': 'SimpleImputer', 'strategy': 'median'}. Best is trial 6 with value: 0.07906713047117861.
running
[I 2024-08-15 23:54:52,165] Trial 152 finished with value: 0.08858764160240622 and parameters: {'model_name': 'IterativeImputer', 'estimator': 'RFR', 'initial_strategy': 'most_frequent', 'n_nearest_features': 5, 'imputation_order': 'random'}. Best is trial 6 with value: 0.07906713047117861.
running
[I 2024-08-15 23:54:52,774] Trial 185 finished with value: 0.07906713047117861 and parameters: {'model_name': 'SimpleImputer', 'strategy': 'median'}. Best is trial 6 with value: 0.07906713047117861.
running
[I 2024-08-15 23:54:53,203] Trial 186 finished with value: 0.07906713047117861 and parameters: {'model_name': 'SimpleImputer', 'strategy': 'median'}. Best is trial 6 with value: 0.07906713047117861.
running
[I 2024-08-15 23:54:53,657] Trial 187 finished with value: 0.07906713047117861 and parameters: {'model_name': 'SimpleImputer', 'strategy': 'median'}. Best is trial 6 with value: 0.07906713047117861.
running
[I 2024-08-15 23:54:54,059] Trial 188 finished with value: 0.07906713047117861 and parameters: {'model_name': 'SimpleImputer', 'strategy': 'median'}. Best is trial 6 with value: 0.07906713047117861.
running
[I 2024-08-15 23:54:54,526] Trial 189 finished with value: 0.20835393386139786 and parameters: {'model_name': 'SimpleImputer', 'strategy': 'most_frequent'}. Best is trial 6 with value: 0.07906713047117861.
running
[I 2024-08-15 23:55:09,660] Trial 190 finished with value: 0.08925178458090702 and parameters: {'model_name': 'KNNImputer', 'n_neighbors': 12153, 'weights': 'uniform'}. Best is trial 6 with value: 0.07906713047117861.
running
[I 2024-08-15 23:55:10,052] Trial 191 finished with value: 0.07906713047117861 and parameters: {'model_name': 'SimpleImputer', 'strategy': 'median'}. Best is trial 6 with value: 0.07906713047117861.
running
[I 2024-08-15 23:55:10,553] Trial 192 finished with value: 0.07906713047117861 and parameters: {'model_name': 'SimpleImputer', 'strategy': 'median'}. Best is trial 6 with value: 0.07906713047117861.
running
[I 2024-08-15 23:55:10,942] Trial 193 finished with value: 0.07906713047117861 and parameters: {'model_name': 'SimpleImputer', 'strategy': 'median'}. Best is trial 6 with value: 0.07906713047117861.
running
[I 2024-08-15 23:55:11,454] Trial 194 finished with value: 0.07906713047117861 and parameters: {'model_name': 'SimpleImputer', 'strategy': 'median'}. Best is trial 6 with value: 0.07906713047117861.
running
[I 2024-08-15 23:55:11,751] Trial 195 finished with value: 0.09083261660032763 and parameters: {'model_name': 'SimpleImputer', 'strategy': 'mean'}. Best is trial 6 with value: 0.07906713047117861.
running
[I 2024-08-15 23:55:12,168] Trial 196 finished with value: 0.07906713047117861 and parameters: {'model_name': 'SimpleImputer', 'strategy': 'median'}. Best is trial 6 with value: 0.07906713047117861.
running
[I 2024-08-15 23:55:12,621] Trial 197 finished with value: 0.07906713047117861 and parameters: {'model_name': 'SimpleImputer', 'strategy': 'median'}. Best is trial 6 with value: 0.07906713047117861.
running
[I 2024-08-15 23:55:13,035] Trial 198 finished with value: 0.07906713047117861 and parameters: {'model_name': 'SimpleImputer', 'strategy': 'median'}. Best is trial 6 with value: 0.07906713047117861.
running
