Run: 16
/cm/local/apps/slurm/var/spool/job931363/slurm_script: line 26: 
pip install -e tpot2
pip install -r tpot2/ImputerExperiments/requirements_.txt
: No such file or directory
RunStart
starting loops
../data/r/215/215.pkl
working on 
../data/r/215/reg_simple_MCAR_0.5_1
2.3214900493621826
running experiment 1/3 - Does large hyperparameter space improve reconstruction accuracy over simple
[I 2024-08-26 17:30:23,325] A new study created in memory with name: no-name-7ae00402-df63-404b-b998-f74425bcf33f
running
running
running
running
running
running
running
running
running
running
running
running
running
running
running
running
[I 2024-08-26 17:30:24,107] Trial 11 finished with value: 0.2237068928061158 and parameters: {'model_name': 'SimpleImputer', 'strategy': 'constant'}. Best is trial 11 with value: 0.2237068928061158.
running
[I 2024-08-26 17:30:24,420] Trial 0 finished with value: 0.2237068928061158 and parameters: {'model_name': 'SimpleImputer', 'strategy': 'constant'}. Best is trial 11 with value: 0.2237068928061158.
running
[I 2024-08-26 17:30:24,588] Trial 10 finished with value: 0.22370280050845212 and parameters: {'model_name': 'SimpleImputer', 'strategy': 'mean'}. Best is trial 10 with value: 0.22370280050845212.
running
[I 2024-08-26 17:30:24,910] Trial 3 finished with value: 0.22370280050845212 and parameters: {'model_name': 'SimpleImputer', 'strategy': 'mean'}. Best is trial 10 with value: 0.22370280050845212.
running
[I 2024-08-26 17:30:25,237] Trial 12 finished with value: 0.22370280050845212 and parameters: {'model_name': 'SimpleImputer', 'strategy': 'mean'}. Best is trial 10 with value: 0.22370280050845212.
running
[I 2024-08-26 17:30:25,590] Trial 5 finished with value: 0.2237068928061158 and parameters: {'model_name': 'SimpleImputer', 'strategy': 'median'}. Best is trial 10 with value: 0.22370280050845212.
running
[I 2024-08-26 17:30:25,742] Trial 14 finished with value: 0.2237068928061158 and parameters: {'model_name': 'SimpleImputer', 'strategy': 'median'}. Best is trial 10 with value: 0.22370280050845212.
running
[I 2024-08-26 17:30:25,869] Trial 6 finished with value: 0.2237068928061158 and parameters: {'model_name': 'SimpleImputer', 'strategy': 'median'}. Best is trial 10 with value: 0.22370280050845212.
running
[I 2024-08-26 17:30:26,027] Trial 4 finished with value: 0.2237068928061158 and parameters: {'model_name': 'SimpleImputer', 'strategy': 'median'}. Best is trial 10 with value: 0.22370280050845212.
running
[I 2024-08-26 17:30:26,224] Trial 9 finished with value: 0.2237068928061158 and parameters: {'model_name': 'SimpleImputer', 'strategy': 'median'}. Best is trial 10 with value: 0.22370280050845212.
[I 2024-08-26 17:30:26,322] Trial 17 finished with value: 0.2237068928061158 and parameters: {'model_name': 'SimpleImputer', 'strategy': 'constant'}. Best is trial 10 with value: 0.22370280050845212.
running
running
[I 2024-08-26 17:30:26,416] Trial 7 finished with value: 0.2237068928061158 and parameters: {'model_name': 'SimpleImputer', 'strategy': 'most_frequent'}. Best is trial 10 with value: 0.22370280050845212.
running
[I 2024-08-26 17:30:26,795] Trial 15 finished with value: 0.2237068928061158 and parameters: {'model_name': 'SimpleImputer', 'strategy': 'most_frequent'}. Best is trial 10 with value: 0.22370280050845212.
running
[I 2024-08-26 17:30:27,058] Trial 16 finished with value: 0.2237068928061158 and parameters: {'model_name': 'SimpleImputer', 'strategy': 'median'}. Best is trial 10 with value: 0.22370280050845212.
running
[I 2024-08-26 17:30:27,189] Trial 2 finished with value: 0.2237068928061158 and parameters: {'model_name': 'SimpleImputer', 'strategy': 'most_frequent'}. Best is trial 10 with value: 0.22370280050845212.
running
[I 2024-08-26 17:30:27,429] Trial 13 finished with value: 0.2237068928061158 and parameters: {'model_name': 'SimpleImputer', 'strategy': 'most_frequent'}. Best is trial 10 with value: 0.22370280050845212.
running
[I 2024-08-26 17:30:27,585] Trial 1 finished with value: 0.2237068928061158 and parameters: {'model_name': 'SimpleImputer', 'strategy': 'most_frequent'}. Best is trial 10 with value: 0.22370280050845212.
running
[I 2024-08-26 17:30:27,700] Trial 8 finished with value: 0.2237068928061158 and parameters: {'model_name': 'SimpleImputer', 'strategy': 'most_frequent'}. Best is trial 10 with value: 0.22370280050845212.
running
[I 2024-08-26 17:30:27,821] Trial 23 finished with value: 0.2237068928061158 and parameters: {'model_name': 'SimpleImputer', 'strategy': 'constant'}. Best is trial 10 with value: 0.22370280050845212.
running
[I 2024-08-26 17:30:27,988] Trial 22 finished with value: 0.22370280050845212 and parameters: {'model_name': 'SimpleImputer', 'strategy': 'mean'}. Best is trial 10 with value: 0.22370280050845212.
running
[I 2024-08-26 17:30:28,339] Trial 27 finished with value: 0.22370280050845212 and parameters: {'model_name': 'SimpleImputer', 'strategy': 'mean'}. Best is trial 10 with value: 0.22370280050845212.
[I 2024-08-26 17:30:28,432] Trial 19 finished with value: 0.2237068928061158 and parameters: {'model_name': 'SimpleImputer', 'strategy': 'median'}. Best is trial 10 with value: 0.22370280050845212.
running
running
[I 2024-08-26 17:30:28,585] Trial 21 finished with value: 0.22370280050845212 and parameters: {'model_name': 'SimpleImputer', 'strategy': 'mean'}. Best is trial 10 with value: 0.22370280050845212.
running
[I 2024-08-26 17:30:28,694] Trial 26 finished with value: 0.22370280050845212 and parameters: {'model_name': 'SimpleImputer', 'strategy': 'mean'}. Best is trial 10 with value: 0.22370280050845212.
running
[I 2024-08-26 17:30:28,699] Trial 20 finished with value: 0.2237068928061158 and parameters: {'model_name': 'SimpleImputer', 'strategy': 'median'}. Best is trial 10 with value: 0.22370280050845212.
running
[I 2024-08-26 17:30:28,953] Trial 25 finished with value: 0.22370280050845212 and parameters: {'model_name': 'SimpleImputer', 'strategy': 'mean'}. Best is trial 10 with value: 0.22370280050845212.
running
[I 2024-08-26 17:30:29,193] Trial 28 finished with value: 0.22370280050845212 and parameters: {'model_name': 'SimpleImputer', 'strategy': 'mean'}. Best is trial 10 with value: 0.22370280050845212.
running
[I 2024-08-26 17:30:29,329] Trial 18 finished with value: 0.2237068928061158 and parameters: {'model_name': 'SimpleImputer', 'strategy': 'most_frequent'}. Best is trial 10 with value: 0.22370280050845212.
running
[I 2024-08-26 17:30:29,530] Trial 30 finished with value: 0.22370280050845212 and parameters: {'model_name': 'SimpleImputer', 'strategy': 'mean'}. Best is trial 10 with value: 0.22370280050845212.
running
[I 2024-08-26 17:30:29,703] Trial 31 finished with value: 0.22370280050845212 and parameters: {'model_name': 'SimpleImputer', 'strategy': 'mean'}. Best is trial 10 with value: 0.22370280050845212.
running
[I 2024-08-26 17:30:29,828] Trial 24 finished with value: 0.2237068928061158 and parameters: {'model_name': 'SimpleImputer', 'strategy': 'median'}. Best is trial 10 with value: 0.22370280050845212.
running
[I 2024-08-26 17:30:29,975] Trial 29 finished with value: 0.22370280050845212 and parameters: {'model_name': 'SimpleImputer', 'strategy': 'mean'}. Best is trial 10 with value: 0.22370280050845212.
running
[I 2024-08-26 17:30:30,203] Trial 32 finished with value: 0.22370280050845212 and parameters: {'model_name': 'SimpleImputer', 'strategy': 'mean'}. Best is trial 10 with value: 0.22370280050845212.
running
[I 2024-08-26 17:30:30,322] Trial 33 finished with value: 0.22370280050845212 and parameters: {'model_name': 'SimpleImputer', 'strategy': 'mean'}. Best is trial 10 with value: 0.22370280050845212.
running
[I 2024-08-26 17:30:30,606] Trial 34 finished with value: 0.22370280050845212 and parameters: {'model_name': 'SimpleImputer', 'strategy': 'mean'}. Best is trial 10 with value: 0.22370280050845212.
running
[I 2024-08-26 17:30:30,772] Trial 35 finished with value: 0.22370280050845212 and parameters: {'model_name': 'SimpleImputer', 'strategy': 'mean'}. Best is trial 10 with value: 0.22370280050845212.
running
[I 2024-08-26 17:30:30,894] Trial 36 finished with value: 0.22370280050845212 and parameters: {'model_name': 'SimpleImputer', 'strategy': 'mean'}. Best is trial 10 with value: 0.22370280050845212.
running
[I 2024-08-26 17:30:31,081] Trial 37 finished with value: 0.22370280050845212 and parameters: {'model_name': 'SimpleImputer', 'strategy': 'mean'}. Best is trial 10 with value: 0.22370280050845212.
running
[I 2024-08-26 17:30:31,248] Trial 40 finished with value: 0.22370280050845212 and parameters: {'model_name': 'SimpleImputer', 'strategy': 'mean'}. Best is trial 10 with value: 0.22370280050845212.
running
[I 2024-08-26 17:30:31,422] Trial 39 finished with value: 0.22370280050845212 and parameters: {'model_name': 'SimpleImputer', 'strategy': 'mean'}. Best is trial 10 with value: 0.22370280050845212.
running
[I 2024-08-26 17:30:31,601] Trial 38 finished with value: 0.22370280050845212 and parameters: {'model_name': 'SimpleImputer', 'strategy': 'mean'}. Best is trial 10 with value: 0.22370280050845212.
running
[I 2024-08-26 17:30:31,813] Trial 42 finished with value: 0.22370280050845212 and parameters: {'model_name': 'SimpleImputer', 'strategy': 'mean'}. Best is trial 10 with value: 0.22370280050845212.
[I 2024-08-26 17:30:31,926] Trial 41 finished with value: 0.22370280050845212 and parameters: {'model_name': 'SimpleImputer', 'strategy': 'mean'}. Best is trial 10 with value: 0.22370280050845212.
running
running
[I 2024-08-26 17:30:32,156] Trial 43 finished with value: 0.22370280050845212 and parameters: {'model_name': 'SimpleImputer', 'strategy': 'mean'}. Best is trial 10 with value: 0.22370280050845212.
running
[I 2024-08-26 17:30:32,289] Trial 46 finished with value: 0.22370280050845212 and parameters: {'model_name': 'SimpleImputer', 'strategy': 'mean'}. Best is trial 10 with value: 0.22370280050845212.
running
[I 2024-08-26 17:30:32,483] Trial 44 finished with value: 0.22370280050845212 and parameters: {'model_name': 'SimpleImputer', 'strategy': 'mean'}. Best is trial 10 with value: 0.22370280050845212.
running
[I 2024-08-26 17:30:32,644] Trial 45 finished with value: 0.22370280050845212 and parameters: {'model_name': 'SimpleImputer', 'strategy': 'mean'}. Best is trial 10 with value: 0.22370280050845212.
running
[I 2024-08-26 17:30:32,833] Trial 49 finished with value: 0.22370280050845212 and parameters: {'model_name': 'SimpleImputer', 'strategy': 'mean'}. Best is trial 10 with value: 0.22370280050845212.
running
[I 2024-08-26 17:30:32,964] Trial 48 finished with value: 0.22370280050845212 and parameters: {'model_name': 'SimpleImputer', 'strategy': 'mean'}. Best is trial 10 with value: 0.22370280050845212.
running
[I 2024-08-26 17:30:33,134] Trial 47 finished with value: 0.22370280050845212 and parameters: {'model_name': 'SimpleImputer', 'strategy': 'mean'}. Best is trial 10 with value: 0.22370280050845212.
running
[I 2024-08-26 17:30:33,254] Trial 52 finished with value: 0.22370280050845212 and parameters: {'model_name': 'SimpleImputer', 'strategy': 'mean'}. Best is trial 10 with value: 0.22370280050845212.
running
[I 2024-08-26 17:30:33,432] Trial 50 finished with value: 0.22370280050845212 and parameters: {'model_name': 'SimpleImputer', 'strategy': 'mean'}. Best is trial 10 with value: 0.22370280050845212.
running
[I 2024-08-26 17:30:33,575] Trial 51 finished with value: 0.22370280050845212 and parameters: {'model_name': 'SimpleImputer', 'strategy': 'mean'}. Best is trial 10 with value: 0.22370280050845212.
[I 2024-08-26 17:30:33,680] Trial 53 finished with value: 0.22370280050845212 and parameters: {'model_name': 'SimpleImputer', 'strategy': 'mean'}. Best is trial 10 with value: 0.22370280050845212.
running
running
[I 2024-08-26 17:30:33,965] Trial 54 finished with value: 0.22370280050845212 and parameters: {'model_name': 'SimpleImputer', 'strategy': 'mean'}. Best is trial 10 with value: 0.22370280050845212.
running
[I 2024-08-26 17:30:34,167] Trial 55 finished with value: 0.2237068928061158 and parameters: {'model_name': 'SimpleImputer', 'strategy': 'constant'}. Best is trial 10 with value: 0.22370280050845212.
running
[I 2024-08-26 17:30:34,392] Trial 62 finished with value: 0.2237068928061158 and parameters: {'model_name': 'SimpleImputer', 'strategy': 'constant'}. Best is trial 10 with value: 0.22370280050845212.
[I 2024-08-26 17:30:34,397] Trial 56 finished with value: 0.22370280050845212 and parameters: {'model_name': 'SimpleImputer', 'strategy': 'mean'}. Best is trial 10 with value: 0.22370280050845212.
running
running
[I 2024-08-26 17:30:34,607] Trial 60 finished with value: 0.2237068928061158 and parameters: {'model_name': 'SimpleImputer', 'strategy': 'constant'}. Best is trial 10 with value: 0.22370280050845212.
running
[I 2024-08-26 17:30:34,726] Trial 58 finished with value: 0.22370280050845212 and parameters: {'model_name': 'SimpleImputer', 'strategy': 'mean'}. Best is trial 10 with value: 0.22370280050845212.
running
[I 2024-08-26 17:30:34,927] Trial 59 finished with value: 0.2237068928061158 and parameters: {'model_name': 'SimpleImputer', 'strategy': 'constant'}. Best is trial 10 with value: 0.22370280050845212.
running
[I 2024-08-26 17:30:35,024] Trial 61 finished with value: 0.2237068928061158 and parameters: {'model_name': 'SimpleImputer', 'strategy': 'constant'}. Best is trial 10 with value: 0.22370280050845212.
running
[I 2024-08-26 17:30:35,348] Trial 57 finished with value: 0.22370280050845212 and parameters: {'model_name': 'SimpleImputer', 'strategy': 'mean'}. Best is trial 10 with value: 0.22370280050845212.
running
[I 2024-08-26 17:30:35,501] Trial 64 finished with value: 0.2237068928061158 and parameters: {'model_name': 'SimpleImputer', 'strategy': 'constant'}. Best is trial 10 with value: 0.22370280050845212.
[I 2024-08-26 17:30:35,613] Trial 63 finished with value: 0.2237068928061158 and parameters: {'model_name': 'SimpleImputer', 'strategy': 'constant'}. Best is trial 10 with value: 0.22370280050845212.
[I 2024-08-26 17:30:35,708] Trial 65 finished with value: 0.2237068928061158 and parameters: {'model_name': 'SimpleImputer', 'strategy': 'constant'}. Best is trial 10 with value: 0.22370280050845212.
running
[I 2024-08-26 17:30:35,799] Trial 69 finished with value: 0.2237068928061158 and parameters: {'model_name': 'SimpleImputer', 'strategy': 'constant'}. Best is trial 10 with value: 0.22370280050845212.
running
running
running
[I 2024-08-26 17:30:35,984] Trial 67 finished with value: 0.2237068928061158 and parameters: {'model_name': 'SimpleImputer', 'strategy': 'constant'}. Best is trial 10 with value: 0.22370280050845212.
[I 2024-08-26 17:30:36,081] Trial 68 finished with value: 0.2237068928061158 and parameters: {'model_name': 'SimpleImputer', 'strategy': 'constant'}. Best is trial 10 with value: 0.22370280050845212.
running
running
[I 2024-08-26 17:30:36,560] Trial 70 finished with value: 0.2237068928061158 and parameters: {'model_name': 'SimpleImputer', 'strategy': 'constant'}. Best is trial 10 with value: 0.22370280050845212.
running
[I 2024-08-26 17:30:36,857] Trial 72 finished with value: 0.2237068928061158 and parameters: {'model_name': 'SimpleImputer', 'strategy': 'constant'}. Best is trial 10 with value: 0.22370280050845212.
running
[I 2024-08-26 17:30:38,392] Trial 66 finished with value: 0.2237068928061158 and parameters: {'model_name': 'SimpleImputer', 'strategy': 'most_frequent'}. Best is trial 10 with value: 0.22370280050845212.
running
[I 2024-08-26 17:30:38,768] Trial 74 finished with value: 0.2237068928061158 and parameters: {'model_name': 'SimpleImputer', 'strategy': 'most_frequent'}. Best is trial 10 with value: 0.22370280050845212.
running
[I 2024-08-26 17:30:39,057] Trial 73 finished with value: 0.2237068928061158 and parameters: {'model_name': 'SimpleImputer', 'strategy': 'most_frequent'}. Best is trial 10 with value: 0.22370280050845212.
running
[I 2024-08-26 17:30:39,425] Trial 77 finished with value: 0.2237068928061158 and parameters: {'model_name': 'SimpleImputer', 'strategy': 'most_frequent'}. Best is trial 10 with value: 0.22370280050845212.
[I 2024-08-26 17:30:39,532] Trial 75 finished with value: 0.2237068928061158 and parameters: {'model_name': 'SimpleImputer', 'strategy': 'most_frequent'}. Best is trial 10 with value: 0.22370280050845212.
running
running
[I 2024-08-26 17:30:39,694] Trial 71 finished with value: 0.2237068928061158 and parameters: {'model_name': 'SimpleImputer', 'strategy': 'most_frequent'}. Best is trial 10 with value: 0.22370280050845212.
running
[I 2024-08-26 17:30:39,889] Trial 83 finished with value: 0.2237068928061158 and parameters: {'model_name': 'SimpleImputer', 'strategy': 'most_frequent'}. Best is trial 10 with value: 0.22370280050845212.
running
[I 2024-08-26 17:30:40,028] Trial 82 finished with value: 0.2237068928061158 and parameters: {'model_name': 'SimpleImputer', 'strategy': 'most_frequent'}. Best is trial 10 with value: 0.22370280050845212.
running
[I 2024-08-26 17:30:40,197] Trial 76 finished with value: 0.2237068928061158 and parameters: {'model_name': 'SimpleImputer', 'strategy': 'most_frequent'}. Best is trial 10 with value: 0.22370280050845212.
running
[I 2024-08-26 17:30:40,479] Trial 80 finished with value: 0.2237068928061158 and parameters: {'model_name': 'SimpleImputer', 'strategy': 'most_frequent'}. Best is trial 10 with value: 0.22370280050845212.
running
[I 2024-08-26 17:30:40,592] Trial 81 finished with value: 0.2237068928061158 and parameters: {'model_name': 'SimpleImputer', 'strategy': 'most_frequent'}. Best is trial 10 with value: 0.22370280050845212.
running
[I 2024-08-26 17:30:40,709] Trial 78 finished with value: 0.2237068928061158 and parameters: {'model_name': 'SimpleImputer', 'strategy': 'most_frequent'}. Best is trial 10 with value: 0.22370280050845212.
running
[I 2024-08-26 17:30:40,896] Trial 84 finished with value: 0.2237068928061158 and parameters: {'model_name': 'SimpleImputer', 'strategy': 'most_frequent'}. Best is trial 10 with value: 0.22370280050845212.
[I 2024-08-26 17:30:40,989] Trial 79 finished with value: 0.2237068928061158 and parameters: {'model_name': 'SimpleImputer', 'strategy': 'most_frequent'}. Best is trial 10 with value: 0.22370280050845212.
running
running
[I 2024-08-26 17:30:41,108] Trial 86 finished with value: 0.2237068928061158 and parameters: {'model_name': 'SimpleImputer', 'strategy': 'most_frequent'}. Best is trial 10 with value: 0.22370280050845212.
running
[I 2024-08-26 17:30:41,326] Trial 85 finished with value: 0.2237068928061158 and parameters: {'model_name': 'SimpleImputer', 'strategy': 'most_frequent'}. Best is trial 10 with value: 0.22370280050845212.
running
[I 2024-08-26 17:30:42,198] Trial 98 finished with value: 0.22370280050845212 and parameters: {'model_name': 'SimpleImputer', 'strategy': 'mean'}. Best is trial 10 with value: 0.22370280050845212.
running
[I 2024-08-26 17:30:42,371] Trial 88 finished with value: 0.2237068928061158 and parameters: {'model_name': 'SimpleImputer', 'strategy': 'median'}. Best is trial 10 with value: 0.22370280050845212.
[I 2024-08-26 17:30:42,499] Trial 87 finished with value: 0.2237068928061158 and parameters: {'model_name': 'SimpleImputer', 'strategy': 'most_frequent'}. Best is trial 10 with value: 0.22370280050845212.
running
[I 2024-08-26 17:30:42,605] Trial 97 finished with value: 0.22370280050845212 and parameters: {'model_name': 'SimpleImputer', 'strategy': 'mean'}. Best is trial 10 with value: 0.22370280050845212.
running
running
[I 2024-08-26 17:30:42,766] Trial 89 finished with value: 0.2237068928061158 and parameters: {'model_name': 'SimpleImputer', 'strategy': 'median'}. Best is trial 10 with value: 0.22370280050845212.
running
[I 2024-08-26 17:30:42,881] Trial 99 finished with value: 0.22370280050845212 and parameters: {'model_name': 'SimpleImputer', 'strategy': 'mean'}. Best is trial 10 with value: 0.22370280050845212.
[I 2024-08-26 17:30:42,973] Trial 96 finished with value: 0.22370280050845212 and parameters: {'model_name': 'SimpleImputer', 'strategy': 'mean'}. Best is trial 10 with value: 0.22370280050845212.
running
running
[I 2024-08-26 17:30:43,112] Trial 90 finished with value: 0.2237068928061158 and parameters: {'model_name': 'SimpleImputer', 'strategy': 'median'}. Best is trial 10 with value: 0.22370280050845212.
running
[I 2024-08-26 17:30:43,241] Trial 101 finished with value: 0.22370280050845212 and parameters: {'model_name': 'SimpleImputer', 'strategy': 'mean'}. Best is trial 10 with value: 0.22370280050845212.
running
[I 2024-08-26 17:30:43,367] Trial 102 finished with value: 0.22370280050845212 and parameters: {'model_name': 'SimpleImputer', 'strategy': 'mean'}. Best is trial 10 with value: 0.22370280050845212.
running
[I 2024-08-26 17:30:43,548] Trial 94 finished with value: 0.2237068928061158 and parameters: {'model_name': 'SimpleImputer', 'strategy': 'median'}. Best is trial 10 with value: 0.22370280050845212.
running
[I 2024-08-26 17:30:43,650] Trial 100 finished with value: 0.22370280050845212 and parameters: {'model_name': 'SimpleImputer', 'strategy': 'mean'}. Best is trial 10 with value: 0.22370280050845212.
running
[I 2024-08-26 17:30:43,758] Trial 93 finished with value: 0.2237068928061158 and parameters: {'model_name': 'SimpleImputer', 'strategy': 'median'}. Best is trial 10 with value: 0.22370280050845212.
running
[I 2024-08-26 17:30:43,976] Trial 92 finished with value: 0.2237068928061158 and parameters: {'model_name': 'SimpleImputer', 'strategy': 'median'}. Best is trial 10 with value: 0.22370280050845212.
running
[I 2024-08-26 17:30:44,104] Trial 95 finished with value: 0.2237068928061158 and parameters: {'model_name': 'SimpleImputer', 'strategy': 'median'}. Best is trial 10 with value: 0.22370280050845212.
running
