[I 2024-11-12 02:02:12,179] Trial 199 finished with value: 0.1627821640205836 and parameters: {'model_name': 'SimpleImputer', 'strategy': 'mean'}. Best is trial 1 with value: 0.1627821640205836.
fit
simple fit
simple transform
0    0
1    0
2    0
3    0
4    0
dtype: int64
0    0
1    0
2    0
3    0
4    0
dtype: int64
0.1627821640205836
{'model_name': 'SimpleImputer', 'strategy': 'mean'}
running experiment 2/3 - Does reconstruction give good automl predictions
Start est fit
Version 0.1.7a0 of tpot2 is outdated. Version 0.1.8a0 was released Tuesday September 17, 2024.
Version 0.1.7a0 of tpot2 is outdated. Version 0.1.8a0 was released Tuesday September 17, 2024.
Version 0.1.7a0 of tpot2 is outdated. Version 0.1.8a0 was released Tuesday September 17, 2024.
Version 0.1.7a0 of tpot2 is outdated. Version 0.1.8a0 was released Tuesday September 17, 2024.
Version 0.1.7a0 of tpot2 is outdated. Version 0.1.8a0 was released Tuesday September 17, 2024.
Version 0.1.7a0 of tpot2 is outdated. Version 0.1.8a0 was released Tuesday September 17, 2024.
Version 0.1.7a0 of tpot2 is outdated. Version 0.1.8a0 was released Tuesday September 17, 2024.
Version 0.1.7a0 of tpot2 is outdated. Version 0.1.8a0 was released Tuesday September 17, 2024.
Version 0.1.7a0 of tpot2 is outdated. Version 0.1.8a0 was released Tuesday September 17, 2024.
Version 0.1.7a0 of tpot2 is outdated. Version 0.1.8a0 was released Tuesday September 17, 2024.
Version 0.1.7a0 of tpot2 is outdated. Version 0.1.8a0 was released Tuesday September 17, 2024.
Version 0.1.7a0 of tpot2 is outdated. Version 0.1.8a0 was released Tuesday September 17, 2024.
Version 0.1.7a0 of tpot2 is outdated. Version 0.1.8a0 was released Tuesday September 17, 2024.
Version 0.1.7a0 of tpot2 is outdated. Version 0.1.8a0 was released Tuesday September 17, 2024.
Version 0.1.7a0 of tpot2 is outdated. Version 0.1.8a0 was released Tuesday September 17, 2024.
Version 0.1.7a0 of tpot2 is outdated. Version 0.1.8a0 was released Tuesday September 17, 2024.
  0%|          | 0/25 [00:00<?, ?it/s]Generation:   0%|          | 0/25 [00:00<?, ?it/s]Generation:  1
Best f1_score score: 0.857394293623163
Generation:   4%|▍         | 1/25 [00:23<09:14, 23.11s/it]Generation:  2
Best f1_score score: 0.8613306455628029
Generation:   8%|▊         | 2/25 [08:23<1:51:58, 292.10s/it]Generation:  3
Best f1_score score: 0.8613306455628029
Generation:  12%|█▏        | 3/25 [08:31<59:27, 162.16s/it]  Generation:  4
Best f1_score score: 0.8613306455628029
Generation:  16%|█▌        | 4/25 [11:20<57:49, 165.22s/it]Generation:  5
Best f1_score score: 0.8613306455628029
Generation:  20%|██        | 5/25 [11:31<36:31, 109.57s/it]Generation:  6
Best f1_score score: 0.8652302553139115
Generation:  24%|██▍       | 6/25 [11:47<24:38, 77.80s/it] Generation:  7
Best f1_score score: 0.8652302553139115
Generation:  28%|██▊       | 7/25 [12:44<21:15, 70.83s/it]Generation:  8
Best f1_score score: 0.8652302553139115
Generation:  32%|███▏      | 8/25 [12:59<15:03, 53.15s/it]Generation:  9
Best f1_score score: 0.8652302553139115
Generation:  36%|███▌      | 9/25 [13:29<12:13, 45.82s/it]Generation:  10
Best f1_score score: 0.8689045886594264
Generation:  40%|████      | 10/25 [13:46<09:12, 36.86s/it]Generation:  11
Best f1_score score: 0.8689045886594264
Generation:  44%|████▍     | 11/25 [16:42<18:34, 79.64s/it]Generation:  12
Best f1_score score: 0.8689045886594264
Generation:  48%|████▊     | 12/25 [18:01<17:10, 79.23s/it]Generation:  13
Best f1_score score: 0.8689045886594264
Generation:  52%|█████▏    | 13/25 [18:18<12:06, 60.53s/it]Generation:  14
Best f1_score score: 0.8689045886594264
Generation:  56%|█████▌    | 14/25 [19:26<11:28, 62.58s/it]Generation:  15
Best f1_score score: 0.8689045886594264
Generation:  60%|██████    | 15/25 [19:42<08:05, 48.55s/it]Generation:  16
Best f1_score score: 0.8696862352326488
Generation:  64%|██████▍   | 16/25 [20:02<06:02, 40.22s/it]Generation:  17
Best f1_score score: 0.8696862352326488
Generation:  68%|██████▊   | 17/25 [20:24<04:37, 34.64s/it]Generation:  18
Best f1_score score: 0.8696862352326488
Generation:  72%|███████▏  | 18/25 [20:43<03:28, 29.79s/it]Generation:  19
Best f1_score score: 0.8696862352326488
Generation:  76%|███████▌  | 19/25 [21:04<02:43, 27.31s/it]Generation:  20
Best f1_score score: 0.8696862352326488
Generation:  80%|████████  | 20/25 [21:26<02:08, 25.64s/it]Generation:  21
Best f1_score score: 0.8696862352326488
Generation:  84%|████████▍ | 21/25 [21:46<01:35, 23.87s/it]Generation:  22
Best f1_score score: 0.8696862352326488
Generation:  88%|████████▊ | 22/25 [22:11<01:13, 24.43s/it]Generation:  23
Best f1_score score: 0.8696862352326488
Generation:  92%|█████████▏| 23/25 [22:33<00:47, 23.70s/it]Generation:  24
Best f1_score score: 0.8696862352326488
Generation:  96%|█████████▌| 24/25 [22:54<00:22, 22.91s/it]Generation:  25
Best f1_score score: 0.8696862352326488
Generation: 100%|██████████| 25/25 [26:48<00:00, 86.05s/it]Generation: 100%|██████████| 25/25 [26:51<00:00, 64.47s/it]
2024-11-12 02:29:10,531 - distributed.scheduler - ERROR - Removing worker 'tcp://127.0.0.1:42201' caused the cluster to lose scattered data, which can't be recovered: {'ndarray-517cd59f157fc470f6fab3a5fae55ce9', 'ndarray-7e55ad49325d73b5fca88ed01aa17ff8'} (stimulus_id='handle-worker-cleanup-1731407350.531421')
Fitted
Pipeline(steps=[('randomforestclassifier',
                 RandomForestClassifier(bootstrap=False,
                                        max_features=0.4331549406474,
                                        min_samples_split=3,
                                        n_estimators=128))])
score start
train score: {'auroc': 1.0, 'accuracy': 1.0, 'balanced_accuracy': 1.0, 'logloss': 0.00783597280279909, 'f1': 1.0}
original test score: {'auroc': 0.9689311609163129, 'accuracy': 0.9158186864014801, 'balanced_accuracy': 0.8943031859547128, 'logloss': 0.26272497795480343, 'f1': 0.8975968770331815}
imputed test score: {'auroc': 0.969385353527012, 'accuracy': 0.9121184088806661, 'balanced_accuracy': 0.8916853849075924, 'logloss': 0.2353938403844108, 'f1': 0.8934983100978267}
score end
check intended
EXP2 Finished
running experiment 3/3 - What is the best automl settings?
<tpot2.search_spaces.pipelines.sequential.SequentialPipeline object at 0x15543504f9d0>
Start tpot fit
Version 0.1.7a0 of tpot2 is outdated. Version 0.1.8a0 was released Tuesday September 17, 2024.
Version 0.1.7a0 of tpot2 is outdated. Version 0.1.8a0 was released Tuesday September 17, 2024.
Version 0.1.7a0 of tpot2 is outdated. Version 0.1.8a0 was released Tuesday September 17, 2024.
Version 0.1.7a0 of tpot2 is outdated. Version 0.1.8a0 was released Tuesday September 17, 2024.
Version 0.1.7a0 of tpot2 is outdated. Version 0.1.8a0 was released Tuesday September 17, 2024.
Version 0.1.7a0 of tpot2 is outdated. Version 0.1.8a0 was released Tuesday September 17, 2024.
Version 0.1.7a0 of tpot2 is outdated. Version 0.1.8a0 was released Tuesday September 17, 2024.
Version 0.1.7a0 of tpot2 is outdated. Version 0.1.8a0 was released Tuesday September 17, 2024.
Version 0.1.7a0 of tpot2 is outdated. Version 0.1.8a0 was released Tuesday September 17, 2024.
Version 0.1.7a0 of tpot2 is outdated. Version 0.1.8a0 was released Tuesday September 17, 2024.
Version 0.1.7a0 of tpot2 is outdated. Version 0.1.8a0 was released Tuesday September 17, 2024.
Version 0.1.7a0 of tpot2 is outdated. Version 0.1.8a0 was released Tuesday September 17, 2024.
Version 0.1.7a0 of tpot2 is outdated. Version 0.1.8a0 was released Tuesday September 17, 2024.
Version 0.1.7a0 of tpot2 is outdated. Version 0.1.8a0 was released Tuesday September 17, 2024.
Version 0.1.7a0 of tpot2 is outdated. Version 0.1.8a0 was released Tuesday September 17, 2024.
Version 0.1.7a0 of tpot2 is outdated. Version 0.1.8a0 was released Tuesday September 17, 2024.
  0%|          | 0/25 [00:00<?, ?it/s]Generation:   0%|          | 0/25 [00:00<?, ?it/s]Generation:  1
Best f1_score score: 0.8554896639576837
Generation:   4%|▍         | 1/25 [00:11<04:34, 11.43s/it]Generation:  2
Best f1_score score: 0.8601296461299615
Generation:   8%|▊         | 2/25 [00:24<04:38, 12.12s/it]Generation:  3
Best f1_score score: 0.8601296461299615
Generation:  12%|█▏        | 3/25 [02:10<20:12, 55.10s/it]Generation:  4
Best f1_score score: 0.8625654128095647
Generation:  16%|█▌        | 4/25 [02:22<13:22, 38.21s/it]Generation:  5
Best f1_score score: 0.8655727229420307
Generation:  20%|██        | 5/25 [02:56<12:12, 36.61s/it]Generation:  6
Best f1_score score: 0.8680476822608029
Generation:  24%|██▍       | 6/25 [03:09<09:06, 28.76s/it]WARNING THIS INDIVIDUAL CAUSED AND EXCEPTION 
 <tpot2.search_spaces.pipelines.sequential.SequentialPipelineIndividual object at 0x155474d6af80> 
 The 'min_samples_split' parameter of DecisionTreeClassifier must be an int in the range [2, inf) or a float in the range (0.0, 1.0]. Got 1 instead. 
 Traceback (most recent call last):
  File "/common/ketrong/tpotexp/tpot2/tpot2/utils/eval_utils.py", line 53, in objective_nan_wrapper
    value = func_timeout.func_timeout(timeout, objective_function, args=[individual], kwargs=objective_kwargs)
  File "/common/ketrong/tpotexp/env/lib/python3.10/site-packages/func_timeout/dafunc.py", line 108, in func_timeout
    raise_exception(exception)
  File "/common/ketrong/tpotexp/env/lib/python3.10/site-packages/func_timeout/py3_raise.py", line 7, in raise_exception
    raise exception[0] from None
  File "/common/ketrong/tpotexp/tpot2/tpot2/tpot_estimator/estimator.py", line 623, in objective_function
    return objective_function_generator(
  File "/common/ketrong/tpotexp/tpot2/tpot2/tpot_estimator/estimator_utils.py", line 55, in objective_function_generator
    cv_obj_scores = cross_val_score_objective(sklearn.base.clone(pipeline),x,y,scorers=scorers, cv=cv , fold=step)
  File "/common/ketrong/tpotexp/tpot2/tpot2/tpot_estimator/cross_val_utils.py", line 28, in cross_val_score_objective
    this_fold_pipeline.fit(X_train,y_train)
  File "/common/ketrong/tpotexp/env/lib/python3.10/site-packages/sklearn/base.py", line 1473, in wrapper
    return fit_method(estimator, *args, **kwargs)
  File "/common/ketrong/tpotexp/env/lib/python3.10/site-packages/sklearn/pipeline.py", line 473, in fit
    self._final_estimator.fit(Xt, y, **last_step_params["fit"])
  File "/common/ketrong/tpotexp/env/lib/python3.10/site-packages/sklearn/base.py", line 1466, in wrapper
    estimator._validate_params()
  File "/common/ketrong/tpotexp/env/lib/python3.10/site-packages/sklearn/base.py", line 666, in _validate_params
    validate_parameter_constraints(
  File "/common/ketrong/tpotexp/env/lib/python3.10/site-packages/sklearn/utils/_param_validation.py", line 95, in validate_parameter_constraints
    raise InvalidParameterError(
sklearn.utils._param_validation.InvalidParameterError: The 'min_samples_split' parameter of DecisionTreeClassifier must be an int in the range [2, inf) or a float in the range (0.0, 1.0]. Got 1 instead.

Generation:  7
Best f1_score score: 0.8696899483402387
Generation:  28%|██▊       | 7/25 [03:22<07:00, 23.39s/it]Generation:  8
Best f1_score score: 0.8696899483402387
Generation:  32%|███▏      | 8/25 [03:35<05:43, 20.20s/it]Generation:  9
Best f1_score score: 0.8696899483402387
Generation:  36%|███▌      | 9/25 [03:47<04:42, 17.65s/it]Generation:  10
Best f1_score score: 0.8696899483402387
Generation:  40%|████      | 10/25 [04:00<04:01, 16.11s/it]Generation:  11
Best f1_score score: 0.8696899483402387
Generation:  44%|████▍     | 11/25 [04:11<03:22, 14.46s/it]Generation:  12
Best f1_score score: 0.8696899483402387
Generation:  48%|████▊     | 12/25 [04:24<03:02, 14.06s/it]Generation:  13
Best f1_score score: 0.8714387183469527
Generation:  52%|█████▏    | 13/25 [04:37<02:44, 13.72s/it]Generation:  14
Best f1_score score: 0.8714387183469527
Generation:  56%|█████▌    | 14/25 [04:48<02:23, 13.03s/it]Generation:  15
Best f1_score score: 0.8714387183469527
Generation:  60%|██████    | 15/25 [05:28<03:32, 21.25s/it]Generation:  16
Best f1_score score: 0.8714387183469527
Generation:  64%|██████▍   | 16/25 [05:39<02:42, 18.10s/it]Generation:  17
Best f1_score score: 0.8714387183469527
Generation:  68%|██████▊   | 17/25 [05:52<02:11, 16.43s/it]Generation:  18
Best f1_score score: 0.8714387183469527
Generation:  72%|███████▏  | 18/25 [06:05<01:48, 15.52s/it]Generation:  19
Best f1_score score: 0.8724597966855481
Generation:  76%|███████▌  | 19/25 [06:20<01:32, 15.45s/it]WARNING THIS INDIVIDUAL CAUSED AND EXCEPTION 
 <tpot2.search_spaces.pipelines.sequential.SequentialPipelineIndividual object at 0x15547416d2a0> 
 The 'min_samples_split' parameter of DecisionTreeClassifier must be an int in the range [2, inf) or a float in the range (0.0, 1.0]. Got 1 instead. 
 Traceback (most recent call last):
  File "/common/ketrong/tpotexp/tpot2/tpot2/utils/eval_utils.py", line 53, in objective_nan_wrapper
    value = func_timeout.func_timeout(timeout, objective_function, args=[individual], kwargs=objective_kwargs)
  File "/common/ketrong/tpotexp/env/lib/python3.10/site-packages/func_timeout/dafunc.py", line 108, in func_timeout
    raise_exception(exception)
  File "/common/ketrong/tpotexp/env/lib/python3.10/site-packages/func_timeout/py3_raise.py", line 7, in raise_exception
    raise exception[0] from None
  File "/common/ketrong/tpotexp/tpot2/tpot2/tpot_estimator/estimator.py", line 623, in objective_function
    return objective_function_generator(
  File "/common/ketrong/tpotexp/tpot2/tpot2/tpot_estimator/estimator_utils.py", line 55, in objective_function_generator
    cv_obj_scores = cross_val_score_objective(sklearn.base.clone(pipeline),x,y,scorers=scorers, cv=cv , fold=step)
  File "/common/ketrong/tpotexp/tpot2/tpot2/tpot_estimator/cross_val_utils.py", line 28, in cross_val_score_objective
    this_fold_pipeline.fit(X_train,y_train)
  File "/common/ketrong/tpotexp/env/lib/python3.10/site-packages/sklearn/base.py", line 1473, in wrapper
    return fit_method(estimator, *args, **kwargs)
  File "/common/ketrong/tpotexp/env/lib/python3.10/site-packages/sklearn/pipeline.py", line 473, in fit
    self._final_estimator.fit(Xt, y, **last_step_params["fit"])
  File "/common/ketrong/tpotexp/env/lib/python3.10/site-packages/sklearn/base.py", line 1466, in wrapper
    estimator._validate_params()
  File "/common/ketrong/tpotexp/env/lib/python3.10/site-packages/sklearn/base.py", line 666, in _validate_params
    validate_parameter_constraints(
  File "/common/ketrong/tpotexp/env/lib/python3.10/site-packages/sklearn/utils/_param_validation.py", line 95, in validate_parameter_constraints
    raise InvalidParameterError(
sklearn.utils._param_validation.InvalidParameterError: The 'min_samples_split' parameter of DecisionTreeClassifier must be an int in the range [2, inf) or a float in the range (0.0, 1.0]. Got 1 instead.

Generation:  20
Best f1_score score: 0.8724597966855481
Generation:  80%|████████  | 20/25 [06:32<01:11, 14.24s/it]Generation:  21
Best f1_score score: 0.8724597966855481
Generation:  84%|████████▍ | 21/25 [06:41<00:51, 12.88s/it]Generation:  22
Best f1_score score: 0.8728391728302217
Generation:  88%|████████▊ | 22/25 [06:53<00:37, 12.61s/it]Generation:  23
Best f1_score score: 0.8756166625647411
Generation:  92%|█████████▏| 23/25 [07:02<00:22, 11.39s/it]Generation:  24
Best f1_score score: 0.8780415988439045
Generation:  96%|█████████▌| 24/25 [07:20<00:13, 13.30s/it]Generation:  25
Best f1_score score: 0.8780415988439045
Generation: 100%|██████████| 25/25 [07:34<00:00, 13.64s/it]Generation: 100%|██████████| 25/25 [07:34<00:00, 18.19s/it]
2024-11-12 02:36:54,989 - distributed.scheduler - ERROR - Removing worker 'tcp://127.0.0.1:42525' caused the cluster to lose scattered data, which can't be recovered: {'DataFrame-80085a5f4c836228c0a495364fea8901', 'ndarray-517cd59f157fc470f6fab3a5fae55ce9'} (stimulus_id='handle-worker-cleanup-1731407814.9892623')
Fitted
Pipeline(steps=[('simpleimputer', SimpleImputer()),
                ('extratreesclassifier',
                 ExtraTreesClassifier(class_weight='balanced',
                                      criterion='entropy',
                                      max_features=0.9910063260622,
                                      min_samples_split=6, n_jobs=1))])
transform worked
try transform
transform worked
score start
train score: {'auroc': 0.9999984518230557, 'accuracy': 0.9951422623178349, 'balanced_accuracy': 0.9965618860510805, 'logloss': 0.07754993968951444, 'f1': 0.9941718470223957}
test score: {'auroc': 0.9701327068227987, 'accuracy': 0.913968547641073, 'balanced_accuracy': 0.9086825111070738, 'logloss': 0.25392657451147765, 'f1': 0.8986726952581284}
original test score: {'auroc': 0.9701905131550698, 'accuracy': 0.9167437557816837, 'balanced_accuracy': 0.9106458618924141, 'logloss': 0.25165260509598397, 'f1': 0.9016907294832827}
score end
1489
lvl
0.01
type
MCAR
num_run
1
class_simple
finished
all finished
full run takes
0.586333144042227
hours
DONE
