[I 2024-09-22 10:40:12,178] Trial 58 finished with value: 0.13491973090057927 and parameters: {'model_name': 'IterativeImputer', 'estimator': 'RFR', 'initial_strategy': 'mean', 'n_nearest_features': 6, 'imputation_order': 'descending'}. Best is trial 13 with value: 0.1316992340328043.
running
[I 2024-09-22 10:46:42,538] Trial 69 finished with value: 0.13593947056898145 and parameters: {'model_name': 'IterativeImputer', 'estimator': 'RFR', 'initial_strategy': 'mean', 'n_nearest_features': 5, 'imputation_order': 'ascending'}. Best is trial 13 with value: 0.1316992340328043.
running
[I 2024-09-22 10:47:53,212] Trial 89 finished with value: inf and parameters: {'model_name': 'GAIN', 'batch_size': 1, 'hint_rate': 0.02841822925952686, 'alpha': 2, 'iterations': 4417, 'learning_rate': 0.006062798174895335, 'p_miss': 0.18924259890820644}. Best is trial 13 with value: 0.1316992340328043.
running
[I 2024-09-22 10:49:41,433] Trial 35 finished with value: inf and parameters: {'model_name': 'GAIN', 'batch_size': 1, 'hint_rate': 0.011254205281194696, 'alpha': 6, 'iterations': 9714, 'learning_rate': 0.00010017287006362706, 'p_miss': 0.29417404532905556}. Best is trial 13 with value: 0.1316992340328043.
running
[I 2024-09-22 11:00:40,030] Trial 85 finished with value: inf and parameters: {'model_name': 'GAIN', 'batch_size': 6, 'hint_rate': 0.011426324924664388, 'alpha': 5, 'iterations': 7917, 'learning_rate': 0.005265733893036126, 'p_miss': 0.1887614636621981}. Best is trial 13 with value: 0.1316992340328043.
running
[I 2024-09-22 11:00:47,757] Trial 97 finished with value: 0.14038258534391612 and parameters: {'model_name': 'IterativeImputer', 'estimator': 'Ridge', 'initial_strategy': 'constant', 'n_nearest_features': 1, 'imputation_order': 'random'}. Best is trial 13 with value: 0.1316992340328043.
running
[I 2024-09-22 11:00:57,359] Trial 90 finished with value: inf and parameters: {'model_name': 'GAIN', 'batch_size': 6, 'hint_rate': 0.1261316133293468, 'alpha': 100, 'iterations': 7263, 'learning_rate': 0.005768308714460897, 'p_miss': 0.19002077082402807}. Best is trial 13 with value: 0.1316992340328043.
running
[I 2024-09-22 11:01:01,693] Trial 99 finished with value: 0.1327068721896851 and parameters: {'model_name': 'IterativeImputer', 'estimator': 'Ridge', 'initial_strategy': 'mean', 'n_nearest_features': 5, 'imputation_order': 'ascending'}. Best is trial 13 with value: 0.1316992340328043.
running
[I 2024-09-22 11:02:33,620] Trial 84 finished with value: inf and parameters: {'model_name': 'GAIN', 'batch_size': 7, 'hint_rate': 0.026989877320279965, 'alpha': 2, 'iterations': 2715, 'learning_rate': 0.004968788697128193, 'p_miss': 0.20049454319126375}. Best is trial 13 with value: 0.1316992340328043.
running
[I 2024-09-22 11:12:46,073] Trial 27 finished with value: 0.1518319917316528 and parameters: {'model_name': 'VAE', 'batch_size': 20, 'iterations': 1468, 'learning_rate': 0.0008835373649084957, 'p_miss': 0.20019588883413675}. Best is trial 13 with value: 0.1316992340328043.
running
[I 2024-09-22 11:25:28,375] Trial 102 finished with value: 0.15309848615285887 and parameters: {'model_name': 'VAE', 'batch_size': 13, 'iterations': 279, 'learning_rate': 0.00024100365078250956, 'p_miss': 0.09011346026955099}. Best is trial 13 with value: 0.1316992340328043.
running
[I 2024-09-22 11:25:31,828] Trial 103 finished with value: 0.1327068721896851 and parameters: {'model_name': 'IterativeImputer', 'estimator': 'Ridge', 'initial_strategy': 'mean', 'n_nearest_features': 6, 'imputation_order': 'ascending'}. Best is trial 13 with value: 0.1316992340328043.
running
[I 2024-09-22 11:25:35,745] Trial 104 finished with value: 0.1327068721896851 and parameters: {'model_name': 'IterativeImputer', 'estimator': 'Ridge', 'initial_strategy': 'mean', 'n_nearest_features': 5, 'imputation_order': 'ascending'}. Best is trial 13 with value: 0.1316992340328043.
running
[I 2024-09-22 11:25:36,091] Trial 105 finished with value: 0.1428107407170946 and parameters: {'model_name': 'SimpleImputer', 'strategy': 'mean'}. Best is trial 13 with value: 0.1316992340328043.
running
[I 2024-09-22 11:25:40,516] Trial 106 finished with value: 0.1327068721896851 and parameters: {'model_name': 'IterativeImputer', 'estimator': 'Ridge', 'initial_strategy': 'mean', 'n_nearest_features': 5, 'imputation_order': 'ascending'}. Best is trial 13 with value: 0.1316992340328043.
running
[I 2024-09-22 11:25:44,376] Trial 107 finished with value: 0.1327068721896851 and parameters: {'model_name': 'IterativeImputer', 'estimator': 'Ridge', 'initial_strategy': 'mean', 'n_nearest_features': 5, 'imputation_order': 'ascending'}. Best is trial 13 with value: 0.1316992340328043.
running
[I 2024-09-22 11:25:49,025] Trial 108 finished with value: 0.1327068721896851 and parameters: {'model_name': 'IterativeImputer', 'estimator': 'Ridge', 'initial_strategy': 'mean', 'n_nearest_features': 5, 'imputation_order': 'ascending'}. Best is trial 13 with value: 0.1316992340328043.
running
[I 2024-09-22 11:25:57,206] Trial 109 finished with value: 0.1326715163407029 and parameters: {'model_name': 'IterativeImputer', 'estimator': 'Ridge', 'initial_strategy': 'mean', 'n_nearest_features': 4, 'imputation_order': 'ascending'}. Best is trial 13 with value: 0.1316992340328043.
running
[I 2024-09-22 11:26:06,359] Trial 110 finished with value: 0.1326715163407029 and parameters: {'model_name': 'IterativeImputer', 'estimator': 'Ridge', 'initial_strategy': 'mean', 'n_nearest_features': 4, 'imputation_order': 'ascending'}. Best is trial 13 with value: 0.1316992340328043.
running
[I 2024-09-22 11:26:13,942] Trial 111 finished with value: 0.13320911106671252 and parameters: {'model_name': 'IterativeImputer', 'estimator': 'Ridge', 'initial_strategy': 'constant', 'n_nearest_features': 4, 'imputation_order': 'ascending'}. Best is trial 13 with value: 0.1316992340328043.
running
[I 2024-09-22 11:26:21,745] Trial 112 finished with value: 0.13244639738865296 and parameters: {'model_name': 'IterativeImputer', 'estimator': 'Ridge', 'initial_strategy': 'mean', 'n_nearest_features': 4, 'imputation_order': 'random'}. Best is trial 13 with value: 0.1316992340328043.
running
[I 2024-09-22 11:26:24,073] Trial 113 finished with value: 0.1337463387402678 and parameters: {'model_name': 'KNNImputer', 'n_neighbors': 691, 'weights': 'uniform'}. Best is trial 13 with value: 0.1316992340328043.
running
[I 2024-09-22 11:26:26,841] Trial 98 finished with value: 0.15311650402901184 and parameters: {'model_name': 'VAE', 'batch_size': 9, 'iterations': 597, 'learning_rate': 0.0003623026451242909, 'p_miss': 0.07178013655821984}. Best is trial 13 with value: 0.1316992340328043.
running
[I 2024-09-22 11:26:32,258] Trial 114 finished with value: 0.13244639738865296 and parameters: {'model_name': 'IterativeImputer', 'estimator': 'Ridge', 'initial_strategy': 'mean', 'n_nearest_features': 4, 'imputation_order': 'random'}. Best is trial 13 with value: 0.1316992340328043.
running
[I 2024-09-22 11:26:35,584] Trial 115 finished with value: 0.13244639738865296 and parameters: {'model_name': 'IterativeImputer', 'estimator': 'Ridge', 'initial_strategy': 'mean', 'n_nearest_features': 4, 'imputation_order': 'random'}. Best is trial 13 with value: 0.1316992340328043.
running
[I 2024-09-22 11:26:41,164] Trial 116 finished with value: 0.13244639738865296 and parameters: {'model_name': 'IterativeImputer', 'estimator': 'Ridge', 'initial_strategy': 'mean', 'n_nearest_features': 4, 'imputation_order': 'random'}. Best is trial 13 with value: 0.1316992340328043.
running
[I 2024-09-22 11:26:43,606] Trial 117 finished with value: 0.13244639738865296 and parameters: {'model_name': 'IterativeImputer', 'estimator': 'Ridge', 'initial_strategy': 'mean', 'n_nearest_features': 4, 'imputation_order': 'random'}. Best is trial 13 with value: 0.1316992340328043.
running
[I 2024-09-22 11:26:45,804] Trial 19 finished with value: 0.42580076353878865 and parameters: {'model_name': 'GAIN', 'batch_size': 36, 'hint_rate': 0.02452028804330702, 'alpha': 53, 'iterations': 3851, 'learning_rate': 0.0008571657449225212, 'p_miss': 0.24518960115162539}. Best is trial 13 with value: 0.1316992340328043.
running
[I 2024-09-22 11:26:50,880] Trial 118 finished with value: 0.13244639738865296 and parameters: {'model_name': 'IterativeImputer', 'estimator': 'Ridge', 'initial_strategy': 'mean', 'n_nearest_features': 4, 'imputation_order': 'random'}. Best is trial 13 with value: 0.1316992340328043.
running
[I 2024-09-22 11:26:51,751] Trial 119 finished with value: 0.13244639738865296 and parameters: {'model_name': 'IterativeImputer', 'estimator': 'Ridge', 'initial_strategy': 'mean', 'n_nearest_features': 4, 'imputation_order': 'random'}. Best is trial 13 with value: 0.1316992340328043.
running
[I 2024-09-22 11:26:55,318] Trial 120 finished with value: 0.13244639738865296 and parameters: {'model_name': 'IterativeImputer', 'estimator': 'Ridge', 'initial_strategy': 'mean', 'n_nearest_features': 4, 'imputation_order': 'random'}. Best is trial 13 with value: 0.1316992340328043.
running
[I 2024-09-22 11:27:08,225] Trial 121 finished with value: 0.1397298483868195 and parameters: {'model_name': 'IterativeImputer', 'estimator': 'KNN', 'initial_strategy': 'mean', 'n_nearest_features': 4, 'imputation_order': 'random'}. Best is trial 13 with value: 0.1316992340328043.
running
[I 2024-09-22 11:27:08,869] Trial 122 finished with value: 0.1397298483868195 and parameters: {'model_name': 'IterativeImputer', 'estimator': 'KNN', 'initial_strategy': 'mean', 'n_nearest_features': 4, 'imputation_order': 'random'}. Best is trial 13 with value: 0.1316992340328043.
running
[I 2024-09-22 11:27:11,510] Trial 123 finished with value: 0.1397298483868195 and parameters: {'model_name': 'IterativeImputer', 'estimator': 'KNN', 'initial_strategy': 'mean', 'n_nearest_features': 4, 'imputation_order': 'random'}. Best is trial 13 with value: 0.1316992340328043.
running
[I 2024-09-22 11:27:14,848] Trial 125 finished with value: 0.16052970168198927 and parameters: {'model_name': 'KNNImputer', 'n_neighbors': 2802, 'weights': 'distance'}. Best is trial 13 with value: 0.1316992340328043.
running
[I 2024-09-22 11:27:15,469] Trial 101 finished with value: 0.14957385120239752 and parameters: {'model_name': 'VAE', 'batch_size': 15, 'iterations': 670, 'learning_rate': 0.0003145276022242449, 'p_miss': 0.08168728300971093}. Best is trial 13 with value: 0.1316992340328043.
running
[I 2024-09-22 11:27:18,035] Trial 124 finished with value: 0.13295263198484625 and parameters: {'model_name': 'IterativeImputer', 'estimator': 'Ridge', 'initial_strategy': 'median', 'n_nearest_features': 4, 'imputation_order': 'random'}. Best is trial 13 with value: 0.1316992340328043.
running
[I 2024-09-22 11:27:21,095] Trial 126 finished with value: 0.13295263198484625 and parameters: {'model_name': 'IterativeImputer', 'estimator': 'Ridge', 'initial_strategy': 'median', 'n_nearest_features': 4, 'imputation_order': 'random'}. Best is trial 13 with value: 0.1316992340328043.
running
[I 2024-09-22 11:27:23,471] Trial 127 finished with value: 0.13295263198484625 and parameters: {'model_name': 'IterativeImputer', 'estimator': 'Ridge', 'initial_strategy': 'median', 'n_nearest_features': 4, 'imputation_order': 'random'}. Best is trial 13 with value: 0.1316992340328043.
running
[I 2024-09-22 11:27:24,196] Trial 128 finished with value: 0.13295263198484625 and parameters: {'model_name': 'IterativeImputer', 'estimator': 'Ridge', 'initial_strategy': 'median', 'n_nearest_features': 4, 'imputation_order': 'random'}. Best is trial 13 with value: 0.1316992340328043.
running
[I 2024-09-22 11:27:26,054] Trial 129 finished with value: 0.13244639738865296 and parameters: {'model_name': 'IterativeImputer', 'estimator': 'Ridge', 'initial_strategy': 'mean', 'n_nearest_features': 4, 'imputation_order': 'random'}. Best is trial 13 with value: 0.1316992340328043.
running
[I 2024-09-22 11:27:29,736] Trial 130 finished with value: 0.13244639738865296 and parameters: {'model_name': 'IterativeImputer', 'estimator': 'Ridge', 'initial_strategy': 'mean', 'n_nearest_features': 4, 'imputation_order': 'random'}. Best is trial 13 with value: 0.1316992340328043.
running
[I 2024-09-22 11:27:30,043] Trial 134 finished with value: 0.5364276143163089 and parameters: {'model_name': 'SimpleImputer', 'strategy': 'constant'}. Best is trial 13 with value: 0.1316992340328043.
running
[I 2024-09-22 11:27:32,301] Trial 131 finished with value: 0.13244639738865296 and parameters: {'model_name': 'IterativeImputer', 'estimator': 'Ridge', 'initial_strategy': 'mean', 'n_nearest_features': 4, 'imputation_order': 'random'}. Best is trial 13 with value: 0.1316992340328043.
running
[I 2024-09-22 11:27:33,216] Trial 132 finished with value: 0.13244639738865296 and parameters: {'model_name': 'IterativeImputer', 'estimator': 'Ridge', 'initial_strategy': 'mean', 'n_nearest_features': 4, 'imputation_order': 'random'}. Best is trial 13 with value: 0.1316992340328043.
running
[I 2024-09-22 11:27:35,129] Trial 133 finished with value: 0.13244639738865296 and parameters: {'model_name': 'IterativeImputer', 'estimator': 'Ridge', 'initial_strategy': 'mean', 'n_nearest_features': 4, 'imputation_order': 'random'}. Best is trial 13 with value: 0.1316992340328043.
running
[I 2024-09-22 11:27:37,888] Trial 135 finished with value: 0.13244639738865296 and parameters: {'model_name': 'IterativeImputer', 'estimator': 'Ridge', 'initial_strategy': 'mean', 'n_nearest_features': 4, 'imputation_order': 'random'}. Best is trial 13 with value: 0.1316992340328043.
running
[I 2024-09-22 11:27:41,680] Trial 136 finished with value: 0.13244639738865296 and parameters: {'model_name': 'IterativeImputer', 'estimator': 'Ridge', 'initial_strategy': 'mean', 'n_nearest_features': 4, 'imputation_order': 'random'}. Best is trial 13 with value: 0.1316992340328043.
running
[I 2024-09-22 11:27:42,164] Trial 137 finished with value: 0.13244639738865296 and parameters: {'model_name': 'IterativeImputer', 'estimator': 'Ridge', 'initial_strategy': 'mean', 'n_nearest_features': 4, 'imputation_order': 'random'}. Best is trial 13 with value: 0.1316992340328043.
running
[I 2024-09-22 11:27:43,484] Trial 138 finished with value: 0.13244639738865296 and parameters: {'model_name': 'IterativeImputer', 'estimator': 'Ridge', 'initial_strategy': 'mean', 'n_nearest_features': 4, 'imputation_order': 'random'}. Best is trial 13 with value: 0.1316992340328043.
running
[I 2024-09-22 11:27:46,449] Trial 139 finished with value: 0.13244639738865296 and parameters: {'model_name': 'IterativeImputer', 'estimator': 'Ridge', 'initial_strategy': 'mean', 'n_nearest_features': 4, 'imputation_order': 'random'}. Best is trial 13 with value: 0.1316992340328043.
running
[I 2024-09-22 11:27:49,962] Trial 140 finished with value: 0.13387262133948546 and parameters: {'model_name': 'IterativeImputer', 'estimator': 'Ridge', 'initial_strategy': 'mean', 'n_nearest_features': 3, 'imputation_order': 'random'}. Best is trial 13 with value: 0.1316992340328043.
running
[I 2024-09-22 11:27:50,628] Trial 141 finished with value: 0.13387262133948546 and parameters: {'model_name': 'IterativeImputer', 'estimator': 'Ridge', 'initial_strategy': 'mean', 'n_nearest_features': 3, 'imputation_order': 'random'}. Best is trial 13 with value: 0.1316992340328043.
running
[I 2024-09-22 11:27:51,372] Trial 142 finished with value: 0.13387262133948546 and parameters: {'model_name': 'IterativeImputer', 'estimator': 'Ridge', 'initial_strategy': 'mean', 'n_nearest_features': 3, 'imputation_order': 'random'}. Best is trial 13 with value: 0.1316992340328043.
running
[I 2024-09-22 11:27:52,011] Trial 143 finished with value: 0.14032100193947195 and parameters: {'model_name': 'KNNImputer', 'n_neighbors': 4035, 'weights': 'uniform'}. Best is trial 13 with value: 0.1316992340328043.
running
[I 2024-09-22 11:27:54,992] Trial 144 finished with value: 0.14065275190292417 and parameters: {'model_name': 'KNNImputer', 'n_neighbors': 4248, 'weights': 'uniform'}. Best is trial 13 with value: 0.1316992340328043.
running
[I 2024-09-22 11:27:55,979] Trial 146 finished with value: 0.14045677120299482 and parameters: {'model_name': 'KNNImputer', 'n_neighbors': 4128, 'weights': 'uniform'}. Best is trial 13 with value: 0.1316992340328043.
running
[I 2024-09-22 11:27:56,196] Trial 145 finished with value: 0.14030404370557695 and parameters: {'model_name': 'KNNImputer', 'n_neighbors': 4026, 'weights': 'uniform'}. Best is trial 13 with value: 0.1316992340328043.
running
[I 2024-09-22 11:28:00,862] Trial 147 finished with value: 0.13244639738865296 and parameters: {'model_name': 'IterativeImputer', 'estimator': 'Ridge', 'initial_strategy': 'mean', 'n_nearest_features': 4, 'imputation_order': 'random'}. Best is trial 13 with value: 0.1316992340328043.
running
[I 2024-09-22 11:28:03,960] Trial 148 finished with value: 0.13244639738865296 and parameters: {'model_name': 'IterativeImputer', 'estimator': 'Ridge', 'initial_strategy': 'mean', 'n_nearest_features': 4, 'imputation_order': 'random'}. Best is trial 13 with value: 0.1316992340328043.
running
[I 2024-09-22 11:28:04,394] Trial 149 finished with value: 0.13244639738865296 and parameters: {'model_name': 'IterativeImputer', 'estimator': 'Ridge', 'initial_strategy': 'mean', 'n_nearest_features': 4, 'imputation_order': 'random'}. Best is trial 13 with value: 0.1316992340328043.
running
[I 2024-09-22 11:28:04,937] Trial 150 finished with value: 0.13244639738865296 and parameters: {'model_name': 'IterativeImputer', 'estimator': 'Ridge', 'initial_strategy': 'mean', 'n_nearest_features': 4, 'imputation_order': 'random'}. Best is trial 13 with value: 0.1316992340328043.
running
[I 2024-09-22 11:28:09,484] Trial 151 finished with value: 0.13244639738865296 and parameters: {'model_name': 'IterativeImputer', 'estimator': 'Ridge', 'initial_strategy': 'mean', 'n_nearest_features': 4, 'imputation_order': 'random'}. Best is trial 13 with value: 0.1316992340328043.
running
[I 2024-09-22 11:28:11,860] Trial 152 finished with value: 0.13244639738865296 and parameters: {'model_name': 'IterativeImputer', 'estimator': 'Ridge', 'initial_strategy': 'mean', 'n_nearest_features': 4, 'imputation_order': 'random'}. Best is trial 13 with value: 0.1316992340328043.
running
[I 2024-09-22 11:28:13,350] Trial 153 finished with value: 0.1328810991085041 and parameters: {'model_name': 'IterativeImputer', 'estimator': 'Ridge', 'initial_strategy': 'mean', 'n_nearest_features': 4, 'imputation_order': 'arabic'}. Best is trial 13 with value: 0.1316992340328043.
running
[I 2024-09-22 11:28:14,763] Trial 154 finished with value: 0.1328810991085041 and parameters: {'model_name': 'IterativeImputer', 'estimator': 'Ridge', 'initial_strategy': 'mean', 'n_nearest_features': 4, 'imputation_order': 'arabic'}. Best is trial 13 with value: 0.1316992340328043.
running
[I 2024-09-22 11:28:17,585] Trial 155 finished with value: 0.13337990256638305 and parameters: {'model_name': 'IterativeImputer', 'estimator': 'Ridge', 'initial_strategy': 'constant', 'n_nearest_features': 4, 'imputation_order': 'arabic'}. Best is trial 13 with value: 0.1316992340328043.
running
[I 2024-09-22 11:28:21,229] Trial 156 finished with value: 0.1328810991085041 and parameters: {'model_name': 'IterativeImputer', 'estimator': 'Ridge', 'initial_strategy': 'mean', 'n_nearest_features': 4, 'imputation_order': 'arabic'}. Best is trial 13 with value: 0.1316992340328043.
running
[I 2024-09-22 11:28:22,682] Trial 158 finished with value: 0.13288197912867003 and parameters: {'model_name': 'IterativeImputer', 'estimator': 'Ridge', 'initial_strategy': 'mean', 'n_nearest_features': 4, 'imputation_order': 'roman'}. Best is trial 13 with value: 0.1316992340328043.
running
[I 2024-09-22 11:28:23,327] Trial 157 finished with value: 0.13288197912867003 and parameters: {'model_name': 'IterativeImputer', 'estimator': 'Ridge', 'initial_strategy': 'mean', 'n_nearest_features': 4, 'imputation_order': 'roman'}. Best is trial 13 with value: 0.1316992340328043.
running
[I 2024-09-22 11:28:25,181] Trial 93 finished with value: inf and parameters: {'model_name': 'GAIN', 'batch_size': 7, 'hint_rate': 0.016426763105428843, 'alpha': 1, 'iterations': 4604, 'learning_rate': 0.007395311746692658, 'p_miss': 0.19059239721067525}. Best is trial 13 with value: 0.1316992340328043.
running
[I 2024-09-22 11:28:26,187] Trial 159 finished with value: 0.13244639738865296 and parameters: {'model_name': 'IterativeImputer', 'estimator': 'Ridge', 'initial_strategy': 'mean', 'n_nearest_features': 4, 'imputation_order': 'random'}. Best is trial 13 with value: 0.1316992340328043.
running
[I 2024-09-22 11:28:26,714] Trial 164 finished with value: 0.1427272005741961 and parameters: {'model_name': 'SimpleImputer', 'strategy': 'median'}. Best is trial 13 with value: 0.1316992340328043.
running
[I 2024-09-22 11:28:30,194] Trial 160 finished with value: 0.13288197912867003 and parameters: {'model_name': 'IterativeImputer', 'estimator': 'Ridge', 'initial_strategy': 'mean', 'n_nearest_features': 4, 'imputation_order': 'roman'}. Best is trial 13 with value: 0.1316992340328043.
running
[I 2024-09-22 11:28:31,440] Trial 161 finished with value: 0.13244639738865296 and parameters: {'model_name': 'IterativeImputer', 'estimator': 'Ridge', 'initial_strategy': 'mean', 'n_nearest_features': 4, 'imputation_order': 'random'}. Best is trial 13 with value: 0.1316992340328043.
running
[I 2024-09-22 11:28:32,550] Trial 162 finished with value: 0.13244639738865296 and parameters: {'model_name': 'IterativeImputer', 'estimator': 'Ridge', 'initial_strategy': 'mean', 'n_nearest_features': 4, 'imputation_order': 'random'}. Best is trial 13 with value: 0.1316992340328043.
running
