[I 2024-09-05 12:15:08,165] Trial 104 finished with value: 0.2771312869322611 and parameters: {'model_name': 'SimpleImputer', 'strategy': 'mean'}. Best is trial 0 with value: 0.2771312869322611.
[I 2024-09-05 12:15:08,251] Trial 106 finished with value: 0.2771312869322611 and parameters: {'model_name': 'SimpleImputer', 'strategy': 'mean'}. Best is trial 0 with value: 0.2771312869322611.
running
[I 2024-09-05 12:15:08,351] Trial 107 finished with value: 0.2771312869322611 and parameters: {'model_name': 'SimpleImputer', 'strategy': 'mean'}. Best is trial 0 with value: 0.2771312869322611.
running
running
[I 2024-09-05 12:15:08,465] Trial 109 finished with value: 0.2771312869322611 and parameters: {'model_name': 'SimpleImputer', 'strategy': 'mean'}. Best is trial 0 with value: 0.2771312869322611.
[I 2024-09-05 12:15:08,556] Trial 108 finished with value: 0.2771312869322611 and parameters: {'model_name': 'SimpleImputer', 'strategy': 'mean'}. Best is trial 0 with value: 0.2771312869322611.
[I 2024-09-05 12:15:08,642] Trial 105 finished with value: 0.2771312869322611 and parameters: {'model_name': 'SimpleImputer', 'strategy': 'mean'}. Best is trial 0 with value: 0.2771312869322611.
[I 2024-09-05 12:15:08,728] Trial 111 finished with value: 0.2771312869322611 and parameters: {'model_name': 'SimpleImputer', 'strategy': 'mean'}. Best is trial 0 with value: 0.2771312869322611.
running
running
running
running
running
[I 2024-09-05 12:15:08,895] Trial 112 finished with value: 0.2771312869322611 and parameters: {'model_name': 'SimpleImputer', 'strategy': 'mean'}. Best is trial 0 with value: 0.2771312869322611.
running
[I 2024-09-05 12:15:09,025] Trial 110 finished with value: 0.2771312869322611 and parameters: {'model_name': 'SimpleImputer', 'strategy': 'mean'}. Best is trial 0 with value: 0.2771312869322611.
[I 2024-09-05 12:15:09,028] Trial 116 finished with value: 0.2771312869322611 and parameters: {'model_name': 'SimpleImputer', 'strategy': 'mean'}. Best is trial 0 with value: 0.2771312869322611.
running
running
[I 2024-09-05 12:15:09,278] Trial 113 finished with value: 0.2771312869322611 and parameters: {'model_name': 'SimpleImputer', 'strategy': 'mean'}. Best is trial 0 with value: 0.2771312869322611.
running
[I 2024-09-05 12:15:09,439] Trial 115 finished with value: 0.2771312869322611 and parameters: {'model_name': 'SimpleImputer', 'strategy': 'mean'}. Best is trial 0 with value: 0.2771312869322611.
[I 2024-09-05 12:15:09,550] Trial 117 finished with value: 0.2771312869322611 and parameters: {'model_name': 'SimpleImputer', 'strategy': 'mean'}. Best is trial 0 with value: 0.2771312869322611.
running
running
[I 2024-09-05 12:15:09,715] Trial 114 finished with value: 0.2771312869322611 and parameters: {'model_name': 'SimpleImputer', 'strategy': 'mean'}. Best is trial 0 with value: 0.2771312869322611.
running
[I 2024-09-05 12:15:09,818] Trial 120 finished with value: 0.2771312869322611 and parameters: {'model_name': 'SimpleImputer', 'strategy': 'mean'}. Best is trial 0 with value: 0.2771312869322611.
running
[I 2024-09-05 12:15:09,943] Trial 121 finished with value: 0.2771312869322611 and parameters: {'model_name': 'SimpleImputer', 'strategy': 'mean'}. Best is trial 0 with value: 0.2771312869322611.
[I 2024-09-05 12:15:10,078] Trial 124 finished with value: 0.2771312869322611 and parameters: {'model_name': 'SimpleImputer', 'strategy': 'mean'}. Best is trial 0 with value: 0.2771312869322611.
[I 2024-09-05 12:15:10,173] Trial 126 finished with value: 0.2771312869322611 and parameters: {'model_name': 'SimpleImputer', 'strategy': 'mean'}. Best is trial 0 with value: 0.2771312869322611.
running
running
[I 2024-09-05 12:15:10,266] Trial 128 finished with value: 0.2771312869322611 and parameters: {'model_name': 'SimpleImputer', 'strategy': 'mean'}. Best is trial 0 with value: 0.2771312869322611.
running
[I 2024-09-05 12:15:10,364] Trial 118 finished with value: 0.2771312869322611 and parameters: {'model_name': 'SimpleImputer', 'strategy': 'mean'}. Best is trial 0 with value: 0.2771312869322611.
running
running
[I 2024-09-05 12:15:10,524] Trial 125 finished with value: 0.2771312869322611 and parameters: {'model_name': 'SimpleImputer', 'strategy': 'mean'}. Best is trial 0 with value: 0.2771312869322611.
running
[I 2024-09-05 12:15:10,659] Trial 119 finished with value: 0.2771312869322611 and parameters: {'model_name': 'SimpleImputer', 'strategy': 'mean'}. Best is trial 0 with value: 0.2771312869322611.
running
[I 2024-09-05 12:15:10,804] Trial 122 finished with value: 0.2771312869322611 and parameters: {'model_name': 'SimpleImputer', 'strategy': 'mean'}. Best is trial 0 with value: 0.2771312869322611.
[I 2024-09-05 12:15:10,895] Trial 127 finished with value: 0.2771312869322611 and parameters: {'model_name': 'SimpleImputer', 'strategy': 'mean'}. Best is trial 0 with value: 0.2771312869322611.
running
[I 2024-09-05 12:15:10,998] Trial 132 finished with value: 0.2771312869322611 and parameters: {'model_name': 'SimpleImputer', 'strategy': 'mean'}. Best is trial 0 with value: 0.2771312869322611.
running
[I 2024-09-05 12:15:11,104] Trial 129 finished with value: 0.2771312869322611 and parameters: {'model_name': 'SimpleImputer', 'strategy': 'mean'}. Best is trial 0 with value: 0.2771312869322611.
[I 2024-09-05 12:15:11,189] Trial 123 finished with value: 0.2771312869322611 and parameters: {'model_name': 'SimpleImputer', 'strategy': 'mean'}. Best is trial 0 with value: 0.2771312869322611.
running
running
[I 2024-09-05 12:15:11,295] Trial 134 finished with value: 0.2771312869322611 and parameters: {'model_name': 'SimpleImputer', 'strategy': 'mean'}. Best is trial 0 with value: 0.2771312869322611.
running
running
[I 2024-09-05 12:15:11,460] Trial 131 finished with value: 0.2771312869322611 and parameters: {'model_name': 'SimpleImputer', 'strategy': 'mean'}. Best is trial 0 with value: 0.2771312869322611.
[I 2024-09-05 12:15:11,558] Trial 130 finished with value: 0.2771312869322611 and parameters: {'model_name': 'SimpleImputer', 'strategy': 'mean'}. Best is trial 0 with value: 0.2771312869322611.
running
running
[I 2024-09-05 12:15:11,687] Trial 133 finished with value: 0.2771312869322611 and parameters: {'model_name': 'SimpleImputer', 'strategy': 'mean'}. Best is trial 0 with value: 0.2771312869322611.
running
[I 2024-09-05 12:15:11,829] Trial 139 finished with value: 0.2771312869322611 and parameters: {'model_name': 'SimpleImputer', 'strategy': 'mean'}. Best is trial 0 with value: 0.2771312869322611.
running
[I 2024-09-05 12:15:11,953] Trial 135 finished with value: 0.2771312869322611 and parameters: {'model_name': 'SimpleImputer', 'strategy': 'mean'}. Best is trial 0 with value: 0.2771312869322611.
running
[I 2024-09-05 12:15:12,102] Trial 138 finished with value: 0.2771312869322611 and parameters: {'model_name': 'SimpleImputer', 'strategy': 'mean'}. Best is trial 0 with value: 0.2771312869322611.
[I 2024-09-05 12:15:12,244] Trial 140 finished with value: 0.2771312869322611 and parameters: {'model_name': 'SimpleImputer', 'strategy': 'mean'}. Best is trial 0 with value: 0.2771312869322611.
running
[I 2024-09-05 12:15:12,346] Trial 136 finished with value: 0.2771312869322611 and parameters: {'model_name': 'SimpleImputer', 'strategy': 'mean'}. Best is trial 0 with value: 0.2771312869322611.
[I 2024-09-05 12:15:12,447] Trial 137 finished with value: 0.2771312869322611 and parameters: {'model_name': 'SimpleImputer', 'strategy': 'mean'}. Best is trial 0 with value: 0.2771312869322611.
running
running
running
[I 2024-09-05 12:15:13,161] Trial 141 finished with value: 0.5507185135473022 and parameters: {'model_name': 'SimpleImputer', 'strategy': 'most_frequent'}. Best is trial 0 with value: 0.2771312869322611.
running
[I 2024-09-05 12:15:13,413] Trial 144 finished with value: 0.5507185135473022 and parameters: {'model_name': 'SimpleImputer', 'strategy': 'most_frequent'}. Best is trial 0 with value: 0.2771312869322611.
[I 2024-09-05 12:15:13,556] Trial 143 finished with value: 0.5507185135473022 and parameters: {'model_name': 'SimpleImputer', 'strategy': 'most_frequent'}. Best is trial 0 with value: 0.2771312869322611.
running
running
[I 2024-09-05 12:15:13,722] Trial 146 finished with value: 0.5507185135473022 and parameters: {'model_name': 'SimpleImputer', 'strategy': 'most_frequent'}. Best is trial 0 with value: 0.2771312869322611.
[I 2024-09-05 12:15:13,818] Trial 147 finished with value: 0.5507185135473022 and parameters: {'model_name': 'SimpleImputer', 'strategy': 'most_frequent'}. Best is trial 0 with value: 0.2771312869322611.
running
[I 2024-09-05 12:15:13,921] Trial 152 finished with value: 0.5507185135473022 and parameters: {'model_name': 'SimpleImputer', 'strategy': 'most_frequent'}. Best is trial 0 with value: 0.2771312869322611.
running
running
[I 2024-09-05 12:15:14,039] Trial 150 finished with value: 0.5507185135473022 and parameters: {'model_name': 'SimpleImputer', 'strategy': 'most_frequent'}. Best is trial 0 with value: 0.2771312869322611.
running
[I 2024-09-05 12:15:14,169] Trial 145 finished with value: 0.5507185135473022 and parameters: {'model_name': 'SimpleImputer', 'strategy': 'most_frequent'}. Best is trial 0 with value: 0.2771312869322611.
running
[I 2024-09-05 12:15:14,349] Trial 148 finished with value: 0.5507185135473022 and parameters: {'model_name': 'SimpleImputer', 'strategy': 'most_frequent'}. Best is trial 0 with value: 0.2771312869322611.
[I 2024-09-05 12:15:14,439] Trial 154 finished with value: 0.5507185135473022 and parameters: {'model_name': 'SimpleImputer', 'strategy': 'most_frequent'}. Best is trial 0 with value: 0.2771312869322611.
running
[I 2024-09-05 12:15:14,448] Trial 142 finished with value: 0.5507185135473022 and parameters: {'model_name': 'SimpleImputer', 'strategy': 'most_frequent'}. Best is trial 0 with value: 0.2771312869322611.
[I 2024-09-05 12:15:14,660] Trial 149 finished with value: 0.5507185135473022 and parameters: {'model_name': 'SimpleImputer', 'strategy': 'most_frequent'}. Best is trial 0 with value: 0.2771312869322611.
[I 2024-09-05 12:15:14,745] Trial 151 finished with value: 0.5507185135473022 and parameters: {'model_name': 'SimpleImputer', 'strategy': 'most_frequent'}. Best is trial 0 with value: 0.2771312869322611.
running
running
running
running
[I 2024-09-05 12:15:14,954] Trial 156 finished with value: 0.5507185135473022 and parameters: {'model_name': 'SimpleImputer', 'strategy': 'most_frequent'}. Best is trial 0 with value: 0.2771312869322611.
running
[I 2024-09-05 12:15:15,083] Trial 157 finished with value: 0.2771312869322611 and parameters: {'model_name': 'SimpleImputer', 'strategy': 'mean'}. Best is trial 0 with value: 0.2771312869322611.
[I 2024-09-05 12:15:15,211] Trial 164 finished with value: 0.2771312869322611 and parameters: {'model_name': 'SimpleImputer', 'strategy': 'mean'}. Best is trial 0 with value: 0.2771312869322611.
running
[I 2024-09-05 12:15:15,317] Trial 158 finished with value: 0.2771312869322611 and parameters: {'model_name': 'SimpleImputer', 'strategy': 'mean'}. Best is trial 0 with value: 0.2771312869322611.
running
[I 2024-09-05 12:15:15,399] Trial 160 finished with value: 0.2771312869322611 and parameters: {'model_name': 'SimpleImputer', 'strategy': 'mean'}. Best is trial 0 with value: 0.2771312869322611.
[I 2024-09-05 12:15:15,479] Trial 155 finished with value: 0.5507185135473022 and parameters: {'model_name': 'SimpleImputer', 'strategy': 'most_frequent'}. Best is trial 0 with value: 0.2771312869322611.
[I 2024-09-05 12:15:15,567] Trial 159 finished with value: 0.2771312869322611 and parameters: {'model_name': 'SimpleImputer', 'strategy': 'mean'}. Best is trial 0 with value: 0.2771312869322611.
running
[I 2024-09-05 12:15:15,684] Trial 163 finished with value: 0.2771312869322611 and parameters: {'model_name': 'SimpleImputer', 'strategy': 'mean'}. Best is trial 0 with value: 0.2771312869322611.
running
running
running
running
[I 2024-09-05 12:15:15,817] Trial 153 finished with value: 0.5507185135473022 and parameters: {'model_name': 'SimpleImputer', 'strategy': 'most_frequent'}. Best is trial 0 with value: 0.2771312869322611.
running
[I 2024-09-05 12:15:15,960] Trial 165 finished with value: 0.2771312869322611 and parameters: {'model_name': 'SimpleImputer', 'strategy': 'mean'}. Best is trial 0 with value: 0.2771312869322611.
[I 2024-09-05 12:15:16,066] Trial 161 finished with value: 0.2771312869322611 and parameters: {'model_name': 'SimpleImputer', 'strategy': 'mean'}. Best is trial 0 with value: 0.2771312869322611.
[I 2024-09-05 12:15:16,157] Trial 166 finished with value: 0.2771312869322611 and parameters: {'model_name': 'SimpleImputer', 'strategy': 'mean'}. Best is trial 0 with value: 0.2771312869322611.
running
running
[I 2024-09-05 12:15:16,291] Trial 162 finished with value: 0.2771312869322611 and parameters: {'model_name': 'SimpleImputer', 'strategy': 'mean'}. Best is trial 0 with value: 0.2771312869322611.
running
running
[I 2024-09-05 12:15:16,464] Trial 167 finished with value: 0.2771312869322611 and parameters: {'model_name': 'SimpleImputer', 'strategy': 'mean'}. Best is trial 0 with value: 0.2771312869322611.
running
[I 2024-09-05 12:15:16,616] Trial 168 finished with value: 0.2771312869322611 and parameters: {'model_name': 'SimpleImputer', 'strategy': 'mean'}. Best is trial 0 with value: 0.2771312869322611.
running
[I 2024-09-05 12:15:16,748] Trial 175 finished with value: 0.2771312869322611 and parameters: {'model_name': 'SimpleImputer', 'strategy': 'mean'}. Best is trial 0 with value: 0.2771312869322611.
running
[I 2024-09-05 12:15:16,898] Trial 172 finished with value: 0.2771312869322611 and parameters: {'model_name': 'SimpleImputer', 'strategy': 'mean'}. Best is trial 0 with value: 0.2771312869322611.
[I 2024-09-05 12:15:16,985] Trial 174 finished with value: 0.2771312869322611 and parameters: {'model_name': 'SimpleImputer', 'strategy': 'mean'}. Best is trial 0 with value: 0.2771312869322611.
[I 2024-09-05 12:15:17,066] Trial 169 finished with value: 0.2771312869322611 and parameters: {'model_name': 'SimpleImputer', 'strategy': 'mean'}. Best is trial 0 with value: 0.2771312869322611.
[I 2024-09-05 12:15:17,147] Trial 170 finished with value: 0.2771312869322611 and parameters: {'model_name': 'SimpleImputer', 'strategy': 'mean'}. Best is trial 0 with value: 0.2771312869322611.
running
running
running
running
[I 2024-09-05 12:15:17,301] Trial 171 finished with value: 0.2771312869322611 and parameters: {'model_name': 'SimpleImputer', 'strategy': 'mean'}. Best is trial 0 with value: 0.2771312869322611.
[I 2024-09-05 12:15:17,414] Trial 173 finished with value: 0.2771312869322611 and parameters: {'model_name': 'SimpleImputer', 'strategy': 'mean'}. Best is trial 0 with value: 0.2771312869322611.
running
[I 2024-09-05 12:15:17,518] Trial 176 finished with value: 0.2771312869322611 and parameters: {'model_name': 'SimpleImputer', 'strategy': 'mean'}. Best is trial 0 with value: 0.2771312869322611.
[I 2024-09-05 12:15:17,625] Trial 177 finished with value: 0.2771312869322611 and parameters: {'model_name': 'SimpleImputer', 'strategy': 'mean'}. Best is trial 0 with value: 0.2771312869322611.
[I 2024-09-05 12:15:17,712] Trial 178 finished with value: 0.2771312869322611 and parameters: {'model_name': 'SimpleImputer', 'strategy': 'mean'}. Best is trial 0 with value: 0.2771312869322611.
running
running
running
running
[I 2024-09-05 12:15:17,831] Trial 184 finished with value: 0.2771312869322611 and parameters: {'model_name': 'SimpleImputer', 'strategy': 'mean'}. Best is trial 0 with value: 0.2771312869322611.
running
[I 2024-09-05 12:15:17,931] Trial 179 finished with value: 0.2771312869322611 and parameters: {'model_name': 'SimpleImputer', 'strategy': 'mean'}. Best is trial 0 with value: 0.2771312869322611.
running
[I 2024-09-05 12:15:18,105] Trial 180 finished with value: 0.2771312869322611 and parameters: {'model_name': 'SimpleImputer', 'strategy': 'mean'}. Best is trial 0 with value: 0.2771312869322611.
running
[I 2024-09-05 12:15:18,249] Trial 183 finished with value: 0.2771312869322611 and parameters: {'model_name': 'SimpleImputer', 'strategy': 'mean'}. Best is trial 0 with value: 0.2771312869322611.
[I 2024-09-05 12:15:18,352] Trial 181 finished with value: 0.2771312869322611 and parameters: {'model_name': 'SimpleImputer', 'strategy': 'mean'}. Best is trial 0 with value: 0.2771312869322611.
running
running
[I 2024-09-05 12:15:18,507] Trial 182 finished with value: 0.2771312869322611 and parameters: {'model_name': 'SimpleImputer', 'strategy': 'mean'}. Best is trial 0 with value: 0.2771312869322611.
[I 2024-09-05 12:15:18,699] Trial 191 finished with value: 0.2771312869322611 and parameters: {'model_name': 'SimpleImputer', 'strategy': 'mean'}. Best is trial 0 with value: 0.2771312869322611.
[I 2024-09-05 12:15:18,805] Trial 186 finished with value: 0.2771312869322611 and parameters: {'model_name': 'SimpleImputer', 'strategy': 'mean'}. Best is trial 0 with value: 0.2771312869322611.
[I 2024-09-05 12:15:18,885] Trial 189 finished with value: 0.2771312869322611 and parameters: {'model_name': 'SimpleImputer', 'strategy': 'mean'}. Best is trial 0 with value: 0.2771312869322611.
[I 2024-09-05 12:15:18,998] Trial 196 finished with value: 0.2771312869322611 and parameters: {'model_name': 'SimpleImputer', 'strategy': 'mean'}. Best is trial 0 with value: 0.2771312869322611.
[I 2024-09-05 12:15:19,086] Trial 192 finished with value: 0.2771312869322611 and parameters: {'model_name': 'SimpleImputer', 'strategy': 'mean'}. Best is trial 0 with value: 0.2771312869322611.
[I 2024-09-05 12:15:19,187] Trial 185 finished with value: 0.2771312869322611 and parameters: {'model_name': 'SimpleImputer', 'strategy': 'mean'}. Best is trial 0 with value: 0.2771312869322611.
[I 2024-09-05 12:15:19,271] Trial 194 finished with value: 0.2771312869322611 and parameters: {'model_name': 'SimpleImputer', 'strategy': 'mean'}. Best is trial 0 with value: 0.2771312869322611.
[I 2024-09-05 12:15:19,351] Trial 195 finished with value: 0.2771312869322611 and parameters: {'model_name': 'SimpleImputer', 'strategy': 'mean'}. Best is trial 0 with value: 0.2771312869322611.
[I 2024-09-05 12:15:19,436] Trial 187 finished with value: 0.2771312869322611 and parameters: {'model_name': 'SimpleImputer', 'strategy': 'mean'}. Best is trial 0 with value: 0.2771312869322611.
[I 2024-09-05 12:15:19,517] Trial 190 finished with value: 0.2771312869322611 and parameters: {'model_name': 'SimpleImputer', 'strategy': 'mean'}. Best is trial 0 with value: 0.2771312869322611.
[I 2024-09-05 12:15:19,623] Trial 199 finished with value: 0.2771312869322611 and parameters: {'model_name': 'SimpleImputer', 'strategy': 'mean'}. Best is trial 0 with value: 0.2771312869322611.
[I 2024-09-05 12:15:19,722] Trial 193 finished with value: 0.2771312869322611 and parameters: {'model_name': 'SimpleImputer', 'strategy': 'mean'}. Best is trial 0 with value: 0.2771312869322611.
[I 2024-09-05 12:15:19,806] Trial 197 finished with value: 0.2771312869322611 and parameters: {'model_name': 'SimpleImputer', 'strategy': 'mean'}. Best is trial 0 with value: 0.2771312869322611.
[I 2024-09-05 12:15:19,890] Trial 188 finished with value: 0.2771312869322611 and parameters: {'model_name': 'SimpleImputer', 'strategy': 'mean'}. Best is trial 0 with value: 0.2771312869322611.
