[I 2024-10-24 14:35:14,771] Trial 101 finished with value: 0.2998466920089524 and parameters: {'model_name': 'SimpleImputer', 'strategy': 'mean'}. Best is trial 3 with value: 0.2998466920089524.
running
[I 2024-10-24 14:35:14,904] Trial 103 finished with value: 0.2998466920089524 and parameters: {'model_name': 'SimpleImputer', 'strategy': 'mean'}. Best is trial 3 with value: 0.2998466920089524.
running
[I 2024-10-24 14:35:15,002] Trial 113 finished with value: 0.2998466920089524 and parameters: {'model_name': 'SimpleImputer', 'strategy': 'mean'}. Best is trial 3 with value: 0.2998466920089524.
[I 2024-10-24 14:35:15,121] Trial 106 finished with value: 0.2998466920089524 and parameters: {'model_name': 'SimpleImputer', 'strategy': 'mean'}. Best is trial 3 with value: 0.2998466920089524.
[I 2024-10-24 14:35:15,218] Trial 108 finished with value: 0.2998466920089524 and parameters: {'model_name': 'SimpleImputer', 'strategy': 'mean'}. Best is trial 3 with value: 0.2998466920089524.
[I 2024-10-24 14:35:15,310] Trial 112 finished with value: 0.2998466920089524 and parameters: {'model_name': 'SimpleImputer', 'strategy': 'mean'}. Best is trial 3 with value: 0.2998466920089524.
[I 2024-10-24 14:35:15,399] Trial 111 finished with value: 0.2998466920089524 and parameters: {'model_name': 'SimpleImputer', 'strategy': 'mean'}. Best is trial 3 with value: 0.2998466920089524.
[I 2024-10-24 14:35:15,486] Trial 107 finished with value: 0.2998466920089524 and parameters: {'model_name': 'SimpleImputer', 'strategy': 'mean'}. Best is trial 3 with value: 0.2998466920089524.
running
[I 2024-10-24 14:35:15,577] Trial 104 finished with value: 0.2998466920089524 and parameters: {'model_name': 'SimpleImputer', 'strategy': 'mean'}. Best is trial 3 with value: 0.2998466920089524.
running
running
running
running
running
running
[I 2024-10-24 14:35:15,792] Trial 110 finished with value: 0.2998466920089524 and parameters: {'model_name': 'SimpleImputer', 'strategy': 'mean'}. Best is trial 3 with value: 0.2998466920089524.
running
running
[I 2024-10-24 14:35:15,949] Trial 120 finished with value: 0.2998466920089524 and parameters: {'model_name': 'SimpleImputer', 'strategy': 'mean'}. Best is trial 3 with value: 0.2998466920089524.
[I 2024-10-24 14:35:16,063] Trial 116 finished with value: 0.2998466920089524 and parameters: {'model_name': 'SimpleImputer', 'strategy': 'mean'}. Best is trial 3 with value: 0.2998466920089524.
[I 2024-10-24 14:35:16,161] Trial 119 finished with value: 0.2998466920089524 and parameters: {'model_name': 'SimpleImputer', 'strategy': 'mean'}. Best is trial 3 with value: 0.2998466920089524.
[I 2024-10-24 14:35:16,246] Trial 114 finished with value: 0.2998466920089524 and parameters: {'model_name': 'SimpleImputer', 'strategy': 'mean'}. Best is trial 3 with value: 0.2998466920089524.
running
[I 2024-10-24 14:35:16,351] Trial 115 finished with value: 0.2998466920089524 and parameters: {'model_name': 'SimpleImputer', 'strategy': 'mean'}. Best is trial 3 with value: 0.2998466920089524.
running
running
running
running
[I 2024-10-24 14:35:16,561] Trial 118 finished with value: 0.2998466920089524 and parameters: {'model_name': 'SimpleImputer', 'strategy': 'mean'}. Best is trial 3 with value: 0.2998466920089524.
[I 2024-10-24 14:35:16,673] Trial 127 finished with value: 0.2998466920089524 and parameters: {'model_name': 'SimpleImputer', 'strategy': 'mean'}. Best is trial 3 with value: 0.2998466920089524.
running
[I 2024-10-24 14:35:16,787] Trial 126 finished with value: 0.2998466920089524 and parameters: {'model_name': 'SimpleImputer', 'strategy': 'mean'}. Best is trial 3 with value: 0.2998466920089524.
running
[I 2024-10-24 14:35:16,873] Trial 117 finished with value: 0.2998466920089524 and parameters: {'model_name': 'SimpleImputer', 'strategy': 'mean'}. Best is trial 3 with value: 0.2998466920089524.
[I 2024-10-24 14:35:16,991] Trial 123 finished with value: 0.2998466920089524 and parameters: {'model_name': 'SimpleImputer', 'strategy': 'mean'}. Best is trial 3 with value: 0.2998466920089524.
running
running
running
[I 2024-10-24 14:35:17,147] Trial 124 finished with value: 0.2998466920089524 and parameters: {'model_name': 'SimpleImputer', 'strategy': 'mean'}. Best is trial 3 with value: 0.2998466920089524.
[I 2024-10-24 14:35:17,238] Trial 121 finished with value: 0.2998466920089524 and parameters: {'model_name': 'SimpleImputer', 'strategy': 'mean'}. Best is trial 3 with value: 0.2998466920089524.
[I 2024-10-24 14:35:17,355] Trial 130 finished with value: 0.2998466920089524 and parameters: {'model_name': 'SimpleImputer', 'strategy': 'mean'}. Best is trial 3 with value: 0.2998466920089524.
[I 2024-10-24 14:35:17,453] Trial 128 finished with value: 0.2998466920089524 and parameters: {'model_name': 'SimpleImputer', 'strategy': 'mean'}. Best is trial 3 with value: 0.2998466920089524.
running
running
running
running
[I 2024-10-24 14:35:17,612] Trial 132 finished with value: 0.2998466920089524 and parameters: {'model_name': 'SimpleImputer', 'strategy': 'mean'}. Best is trial 3 with value: 0.2998466920089524.
[I 2024-10-24 14:35:17,749] Trial 129 finished with value: 0.2998466920089524 and parameters: {'model_name': 'SimpleImputer', 'strategy': 'mean'}. Best is trial 3 with value: 0.2998466920089524.
[I 2024-10-24 14:35:17,842] Trial 125 finished with value: 0.2998466920089524 and parameters: {'model_name': 'SimpleImputer', 'strategy': 'mean'}. Best is trial 3 with value: 0.2998466920089524.
running
[I 2024-10-24 14:35:17,998] Trial 134 finished with value: 0.2998466920089524 and parameters: {'model_name': 'SimpleImputer', 'strategy': 'mean'}. Best is trial 3 with value: 0.2998466920089524.
running
running
running
[I 2024-10-24 14:35:18,157] Trial 122 finished with value: 0.2998466920089524 and parameters: {'model_name': 'SimpleImputer', 'strategy': 'mean'}. Best is trial 3 with value: 0.2998466920089524.
[I 2024-10-24 14:35:18,258] Trial 137 finished with value: 0.2998466920089524 and parameters: {'model_name': 'SimpleImputer', 'strategy': 'mean'}. Best is trial 3 with value: 0.2998466920089524.
running
[I 2024-10-24 14:35:18,383] Trial 131 finished with value: 0.2998466920089524 and parameters: {'model_name': 'SimpleImputer', 'strategy': 'mean'}. Best is trial 3 with value: 0.2998466920089524.
running
running
[I 2024-10-24 14:35:18,668] Trial 135 finished with value: 0.2998466920089524 and parameters: {'model_name': 'SimpleImputer', 'strategy': 'mean'}. Best is trial 3 with value: 0.2998466920089524.
running
[I 2024-10-24 14:35:19,129] Trial 138 finished with value: 0.4021300326473399 and parameters: {'model_name': 'SimpleImputer', 'strategy': 'most_frequent'}. Best is trial 3 with value: 0.2998466920089524.
running
[I 2024-10-24 14:35:19,261] Trial 140 finished with value: 0.4021300326473399 and parameters: {'model_name': 'SimpleImputer', 'strategy': 'most_frequent'}. Best is trial 3 with value: 0.2998466920089524.
running
[I 2024-10-24 14:35:19,427] Trial 149 finished with value: 0.2998466920089524 and parameters: {'model_name': 'SimpleImputer', 'strategy': 'mean'}. Best is trial 3 with value: 0.2998466920089524.
[I 2024-10-24 14:35:19,582] Trial 139 finished with value: 0.4021300326473399 and parameters: {'model_name': 'SimpleImputer', 'strategy': 'most_frequent'}. Best is trial 3 with value: 0.2998466920089524.
running
[I 2024-10-24 14:35:19,787] Trial 136 finished with value: 0.4021300326473399 and parameters: {'model_name': 'SimpleImputer', 'strategy': 'most_frequent'}. Best is trial 3 with value: 0.2998466920089524.
[I 2024-10-24 14:35:19,886] Trial 146 finished with value: 0.4021300326473399 and parameters: {'model_name': 'SimpleImputer', 'strategy': 'most_frequent'}. Best is trial 3 with value: 0.2998466920089524.
running
[I 2024-10-24 14:35:19,988] Trial 133 finished with value: 0.4021300326473399 and parameters: {'model_name': 'SimpleImputer', 'strategy': 'most_frequent'}. Best is trial 3 with value: 0.2998466920089524.
running
[I 2024-10-24 14:35:20,102] Trial 153 finished with value: 0.2998466920089524 and parameters: {'model_name': 'SimpleImputer', 'strategy': 'mean'}. Best is trial 3 with value: 0.2998466920089524.
running
running
[I 2024-10-24 14:35:20,214] Trial 142 finished with value: 0.4021300326473399 and parameters: {'model_name': 'SimpleImputer', 'strategy': 'most_frequent'}. Best is trial 3 with value: 0.2998466920089524.
running
[I 2024-10-24 14:35:20,369] Trial 141 finished with value: 0.4021300326473399 and parameters: {'model_name': 'SimpleImputer', 'strategy': 'most_frequent'}. Best is trial 3 with value: 0.2998466920089524.
running
running
[I 2024-10-24 14:35:20,569] Trial 152 finished with value: 0.2998466920089524 and parameters: {'model_name': 'SimpleImputer', 'strategy': 'mean'}. Best is trial 3 with value: 0.2998466920089524.
[I 2024-10-24 14:35:20,682] Trial 144 finished with value: 0.4021300326473399 and parameters: {'model_name': 'SimpleImputer', 'strategy': 'most_frequent'}. Best is trial 3 with value: 0.2998466920089524.
[I 2024-10-24 14:35:20,783] Trial 143 finished with value: 0.4021300326473399 and parameters: {'model_name': 'SimpleImputer', 'strategy': 'most_frequent'}. Best is trial 3 with value: 0.2998466920089524.
[I 2024-10-24 14:35:20,867] Trial 148 finished with value: 0.4021300326473399 and parameters: {'model_name': 'SimpleImputer', 'strategy': 'most_frequent'}. Best is trial 3 with value: 0.2998466920089524.
running
[I 2024-10-24 14:35:20,973] Trial 154 finished with value: 0.2998466920089524 and parameters: {'model_name': 'SimpleImputer', 'strategy': 'mean'}. Best is trial 3 with value: 0.2998466920089524.
[I 2024-10-24 14:35:21,067] Trial 147 finished with value: 0.4021300326473399 and parameters: {'model_name': 'SimpleImputer', 'strategy': 'most_frequent'}. Best is trial 3 with value: 0.2998466920089524.
running
running
[I 2024-10-24 14:35:21,205] Trial 145 finished with value: 0.4021300326473399 and parameters: {'model_name': 'SimpleImputer', 'strategy': 'most_frequent'}. Best is trial 3 with value: 0.2998466920089524.
running
running
running
running
[I 2024-10-24 14:35:21,376] Trial 155 finished with value: 0.2998466920089524 and parameters: {'model_name': 'SimpleImputer', 'strategy': 'mean'}. Best is trial 3 with value: 0.2998466920089524.
running
[I 2024-10-24 14:35:21,479] Trial 158 finished with value: 0.2998466920089524 and parameters: {'model_name': 'SimpleImputer', 'strategy': 'mean'}. Best is trial 3 with value: 0.2998466920089524.
[I 2024-10-24 14:35:21,571] Trial 157 finished with value: 0.2998466920089524 and parameters: {'model_name': 'SimpleImputer', 'strategy': 'mean'}. Best is trial 3 with value: 0.2998466920089524.
running
running
[I 2024-10-24 14:35:21,704] Trial 151 finished with value: 0.4021300326473399 and parameters: {'model_name': 'SimpleImputer', 'strategy': 'most_frequent'}. Best is trial 3 with value: 0.2998466920089524.
[I 2024-10-24 14:35:21,818] Trial 159 finished with value: 0.2998466920089524 and parameters: {'model_name': 'SimpleImputer', 'strategy': 'mean'}. Best is trial 3 with value: 0.2998466920089524.
[I 2024-10-24 14:35:21,908] Trial 150 finished with value: 0.4021300326473399 and parameters: {'model_name': 'SimpleImputer', 'strategy': 'most_frequent'}. Best is trial 3 with value: 0.2998466920089524.
running
[I 2024-10-24 14:35:22,010] Trial 156 finished with value: 0.2998466920089524 and parameters: {'model_name': 'SimpleImputer', 'strategy': 'mean'}. Best is trial 3 with value: 0.2998466920089524.
running
running
[I 2024-10-24 14:35:22,162] Trial 160 finished with value: 0.2998466920089524 and parameters: {'model_name': 'SimpleImputer', 'strategy': 'mean'}. Best is trial 3 with value: 0.2998466920089524.
[I 2024-10-24 14:35:22,271] Trial 161 finished with value: 0.2998466920089524 and parameters: {'model_name': 'SimpleImputer', 'strategy': 'mean'}. Best is trial 3 with value: 0.2998466920089524.
running
running
[I 2024-10-24 14:35:22,424] Trial 163 finished with value: 0.2998466920089524 and parameters: {'model_name': 'SimpleImputer', 'strategy': 'mean'}. Best is trial 3 with value: 0.2998466920089524.
[I 2024-10-24 14:35:22,521] Trial 165 finished with value: 0.2998466920089524 and parameters: {'model_name': 'SimpleImputer', 'strategy': 'mean'}. Best is trial 3 with value: 0.2998466920089524.
running
running
[I 2024-10-24 14:35:22,637] Trial 166 finished with value: 0.2998466920089524 and parameters: {'model_name': 'SimpleImputer', 'strategy': 'mean'}. Best is trial 3 with value: 0.2998466920089524.
running
[I 2024-10-24 14:35:22,797] Trial 164 finished with value: 0.2998466920089524 and parameters: {'model_name': 'SimpleImputer', 'strategy': 'mean'}. Best is trial 3 with value: 0.2998466920089524.
running
running
[I 2024-10-24 14:35:22,957] Trial 168 finished with value: 0.2998466920089524 and parameters: {'model_name': 'SimpleImputer', 'strategy': 'mean'}. Best is trial 3 with value: 0.2998466920089524.
[I 2024-10-24 14:35:23,072] Trial 170 finished with value: 0.2998466920089524 and parameters: {'model_name': 'SimpleImputer', 'strategy': 'mean'}. Best is trial 3 with value: 0.2998466920089524.
running
[I 2024-10-24 14:35:23,179] Trial 175 finished with value: 0.2998466920089524 and parameters: {'model_name': 'SimpleImputer', 'strategy': 'mean'}. Best is trial 3 with value: 0.2998466920089524.
[I 2024-10-24 14:35:23,299] Trial 171 finished with value: 0.2998466920089524 and parameters: {'model_name': 'SimpleImputer', 'strategy': 'mean'}. Best is trial 3 with value: 0.2998466920089524.
running
[I 2024-10-24 14:35:23,397] Trial 167 finished with value: 0.2998466920089524 and parameters: {'model_name': 'SimpleImputer', 'strategy': 'mean'}. Best is trial 3 with value: 0.2998466920089524.
[I 2024-10-24 14:35:23,487] Trial 162 finished with value: 0.2998466920089524 and parameters: {'model_name': 'SimpleImputer', 'strategy': 'mean'}. Best is trial 3 with value: 0.2998466920089524.
running
running
running
running
[I 2024-10-24 14:35:23,633] Trial 176 finished with value: 0.2998466920089524 and parameters: {'model_name': 'SimpleImputer', 'strategy': 'mean'}. Best is trial 3 with value: 0.2998466920089524.
running
[I 2024-10-24 14:35:23,780] Trial 169 finished with value: 0.2998466920089524 and parameters: {'model_name': 'SimpleImputer', 'strategy': 'mean'}. Best is trial 3 with value: 0.2998466920089524.
[I 2024-10-24 14:35:23,895] Trial 172 finished with value: 0.2998466920089524 and parameters: {'model_name': 'SimpleImputer', 'strategy': 'mean'}. Best is trial 3 with value: 0.2998466920089524.
[I 2024-10-24 14:35:23,982] Trial 174 finished with value: 0.2998466920089524 and parameters: {'model_name': 'SimpleImputer', 'strategy': 'mean'}. Best is trial 3 with value: 0.2998466920089524.
running
[I 2024-10-24 14:35:24,075] Trial 180 finished with value: 0.2998466920089524 and parameters: {'model_name': 'SimpleImputer', 'strategy': 'mean'}. Best is trial 3 with value: 0.2998466920089524.
running
[I 2024-10-24 14:35:24,226] Trial 177 finished with value: 0.2998466920089524 and parameters: {'model_name': 'SimpleImputer', 'strategy': 'mean'}. Best is trial 3 with value: 0.2998466920089524.
[I 2024-10-24 14:35:24,361] Trial 173 finished with value: 0.2998466920089524 and parameters: {'model_name': 'SimpleImputer', 'strategy': 'mean'}. Best is trial 3 with value: 0.2998466920089524.
running
running
running
running
[I 2024-10-24 14:35:24,600] Trial 185 finished with value: 0.4021300326473399 and parameters: {'model_name': 'SimpleImputer', 'strategy': 'constant'}. Best is trial 3 with value: 0.2998466920089524.
[I 2024-10-24 14:35:24,703] Trial 182 finished with value: 0.2998466920089524 and parameters: {'model_name': 'SimpleImputer', 'strategy': 'mean'}. Best is trial 3 with value: 0.2998466920089524.
[I 2024-10-24 14:35:24,795] Trial 183 finished with value: 0.2998466920089524 and parameters: {'model_name': 'SimpleImputer', 'strategy': 'mean'}. Best is trial 3 with value: 0.2998466920089524.
[I 2024-10-24 14:35:24,797] Trial 178 finished with value: 0.2998466920089524 and parameters: {'model_name': 'SimpleImputer', 'strategy': 'mean'}. Best is trial 3 with value: 0.2998466920089524.
[I 2024-10-24 14:35:24,885] Trial 188 finished with value: 0.4021300326473399 and parameters: {'model_name': 'SimpleImputer', 'strategy': 'constant'}. Best is trial 3 with value: 0.2998466920089524.
running
[I 2024-10-24 14:35:24,890] Trial 189 finished with value: 0.4021300326473399 and parameters: {'model_name': 'SimpleImputer', 'strategy': 'constant'}. Best is trial 3 with value: 0.2998466920089524.
[I 2024-10-24 14:35:24,908] Trial 187 finished with value: 0.4021300326473399 and parameters: {'model_name': 'SimpleImputer', 'strategy': 'constant'}. Best is trial 3 with value: 0.2998466920089524.
running
[I 2024-10-24 14:35:25,181] Trial 190 finished with value: 0.2998466920089524 and parameters: {'model_name': 'SimpleImputer', 'strategy': 'mean'}. Best is trial 3 with value: 0.2998466920089524.
running
running
[I 2024-10-24 14:35:25,187] Trial 179 finished with value: 0.2998466920089524 and parameters: {'model_name': 'SimpleImputer', 'strategy': 'mean'}. Best is trial 3 with value: 0.2998466920089524.
running
[I 2024-10-24 14:35:25,381] Trial 184 finished with value: 0.4021300326473399 and parameters: {'model_name': 'SimpleImputer', 'strategy': 'constant'}. Best is trial 3 with value: 0.2998466920089524.
[I 2024-10-24 14:35:25,393] Trial 181 finished with value: 0.2998466920089524 and parameters: {'model_name': 'SimpleImputer', 'strategy': 'mean'}. Best is trial 3 with value: 0.2998466920089524.
[I 2024-10-24 14:35:25,616] Trial 186 finished with value: 0.4021300326473399 and parameters: {'model_name': 'SimpleImputer', 'strategy': 'constant'}. Best is trial 3 with value: 0.2998466920089524.
[I 2024-10-24 14:35:25,633] Trial 192 finished with value: 0.4021300326473399 and parameters: {'model_name': 'SimpleImputer', 'strategy': 'constant'}. Best is trial 3 with value: 0.2998466920089524.
[I 2024-10-24 14:35:25,734] Trial 194 finished with value: 0.4021300326473399 and parameters: {'model_name': 'SimpleImputer', 'strategy': 'constant'}. Best is trial 3 with value: 0.2998466920089524.
[I 2024-10-24 14:35:25,738] Trial 191 finished with value: 0.2998466920089524 and parameters: {'model_name': 'SimpleImputer', 'strategy': 'mean'}. Best is trial 3 with value: 0.2998466920089524.
[I 2024-10-24 14:35:25,741] Trial 193 finished with value: 0.4021300326473399 and parameters: {'model_name': 'SimpleImputer', 'strategy': 'constant'}. Best is trial 3 with value: 0.2998466920089524.
[I 2024-10-24 14:35:26,187] Trial 196 finished with value: 0.2998466920089524 and parameters: {'model_name': 'SimpleImputer', 'strategy': 'mean'}. Best is trial 3 with value: 0.2998466920089524.
[I 2024-10-24 14:35:26,321] Trial 199 finished with value: 0.2998466920089524 and parameters: {'model_name': 'SimpleImputer', 'strategy': 'mean'}. Best is trial 3 with value: 0.2998466920089524.
[I 2024-10-24 14:35:26,416] Trial 195 finished with value: 0.2998466920089524 and parameters: {'model_name': 'SimpleImputer', 'strategy': 'mean'}. Best is trial 3 with value: 0.2998466920089524.
[I 2024-10-24 14:35:26,508] Trial 197 finished with value: 0.2998466920089524 and parameters: {'model_name': 'SimpleImputer', 'strategy': 'mean'}. Best is trial 3 with value: 0.2998466920089524.
