Run: 17
/cm/local/apps/slurm/var/spool/job923859/slurm_script: line 26: 
pip install -e tpot2
pip install -r tpot2/ImputerExperiments/requirements_.txt
: No such file or directory
RunStart
starting loops
../data/c/6/6.pkl
working on 
../data/c/6/class_simple_MAR_0.01_1
2.9819588661193848
running experiment 1/3 - Does large hyperparameter space improve reconstruction accuracy over simple
[I 2024-08-15 10:45:01,645] A new study created in memory with name: no-name-7c06bfad-b032-4ecd-9880-eecaa1f75ec6
running
running
running
running
running
running
running
running
running
running
running
running
running
running
running
running
[I 2024-08-15 10:45:02,402] Trial 0 finished with value: 0.26840750861409834 and parameters: {'model_name': 'SimpleImputer', 'strategy': 'constant'}. Best is trial 0 with value: 0.26840750861409834.
running
[I 2024-08-15 10:45:02,683] Trial 10 finished with value: 0.26840750861409834 and parameters: {'model_name': 'SimpleImputer', 'strategy': 'constant'}. Best is trial 0 with value: 0.26840750861409834.
[I 2024-08-15 10:45:02,786] Trial 3 finished with value: 0.26840750861409834 and parameters: {'model_name': 'SimpleImputer', 'strategy': 'constant'}. Best is trial 0 with value: 0.26840750861409834.
running
[I 2024-08-15 10:45:02,905] Trial 12 finished with value: 0.26840750861409834 and parameters: {'model_name': 'SimpleImputer', 'strategy': 'constant'}. Best is trial 0 with value: 0.26840750861409834.
running
running
[I 2024-08-15 10:45:03,111] Trial 5 finished with value: 0.09450815842681276 and parameters: {'model_name': 'SimpleImputer', 'strategy': 'mean'}. Best is trial 5 with value: 0.09450815842681276.
running
[I 2024-08-15 10:45:03,262] Trial 7 finished with value: 0.26840750861409834 and parameters: {'model_name': 'SimpleImputer', 'strategy': 'constant'}. Best is trial 5 with value: 0.09450815842681276.
[I 2024-08-15 10:45:03,401] Trial 1 finished with value: 0.09450815842681276 and parameters: {'model_name': 'SimpleImputer', 'strategy': 'mean'}. Best is trial 5 with value: 0.09450815842681276.
[I 2024-08-15 10:45:03,495] Trial 11 finished with value: 0.09450815842681276 and parameters: {'model_name': 'SimpleImputer', 'strategy': 'mean'}. Best is trial 5 with value: 0.09450815842681276.
running
running
[I 2024-08-15 10:45:03,613] Trial 13 finished with value: 0.09450815842681276 and parameters: {'model_name': 'SimpleImputer', 'strategy': 'mean'}. Best is trial 5 with value: 0.09450815842681276.
running
running
[I 2024-08-15 10:45:03,860] Trial 4 finished with value: 0.09450815842681276 and parameters: {'model_name': 'SimpleImputer', 'strategy': 'mean'}. Best is trial 5 with value: 0.09450815842681276.
running
[I 2024-08-15 10:45:04,505] Trial 8 finished with value: 0.09424039737062251 and parameters: {'model_name': 'SimpleImputer', 'strategy': 'median'}. Best is trial 8 with value: 0.09424039737062251.
running
[I 2024-08-15 10:45:04,954] Trial 20 finished with value: 0.26840750861409834 and parameters: {'model_name': 'SimpleImputer', 'strategy': 'constant'}. Best is trial 8 with value: 0.09424039737062251.
[I 2024-08-15 10:45:05,087] Trial 21 finished with value: 0.26840750861409834 and parameters: {'model_name': 'SimpleImputer', 'strategy': 'constant'}. Best is trial 8 with value: 0.09424039737062251.
running
running
[I 2024-08-15 10:45:05,680] Trial 17 finished with value: 0.09424039737062251 and parameters: {'model_name': 'SimpleImputer', 'strategy': 'median'}. Best is trial 8 with value: 0.09424039737062251.
running
[I 2024-08-15 10:45:05,889] Trial 19 finished with value: 0.09424039737062251 and parameters: {'model_name': 'SimpleImputer', 'strategy': 'median'}. Best is trial 8 with value: 0.09424039737062251.
running
[I 2024-08-15 10:45:06,137] Trial 18 finished with value: 0.09424039737062251 and parameters: {'model_name': 'SimpleImputer', 'strategy': 'median'}. Best is trial 8 with value: 0.09424039737062251.
running
[I 2024-08-15 10:45:06,388] Trial 16 finished with value: 0.09424039737062251 and parameters: {'model_name': 'SimpleImputer', 'strategy': 'median'}. Best is trial 8 with value: 0.09424039737062251.
running
[I 2024-08-15 10:45:06,654] Trial 22 finished with value: 0.09424039737062251 and parameters: {'model_name': 'SimpleImputer', 'strategy': 'median'}. Best is trial 8 with value: 0.09424039737062251.
running
[I 2024-08-15 10:45:07,315] Trial 26 finished with value: 0.09424039737062251 and parameters: {'model_name': 'SimpleImputer', 'strategy': 'median'}. Best is trial 8 with value: 0.09424039737062251.
running
[I 2024-08-15 10:45:07,957] Trial 27 finished with value: 0.09424039737062251 and parameters: {'model_name': 'SimpleImputer', 'strategy': 'median'}. Best is trial 8 with value: 0.09424039737062251.
running
[I 2024-08-15 10:45:08,116] Trial 15 finished with value: 0.24675289608797285 and parameters: {'model_name': 'SimpleImputer', 'strategy': 'most_frequent'}. Best is trial 8 with value: 0.09424039737062251.
running
[I 2024-08-15 10:45:08,308] Trial 6 finished with value: 0.24675289608797285 and parameters: {'model_name': 'SimpleImputer', 'strategy': 'most_frequent'}. Best is trial 8 with value: 0.09424039737062251.
running
[I 2024-08-15 10:45:08,517] Trial 28 finished with value: 0.09424039737062251 and parameters: {'model_name': 'SimpleImputer', 'strategy': 'median'}. Best is trial 8 with value: 0.09424039737062251.
running
[I 2024-08-15 10:45:08,679] Trial 14 finished with value: 0.24675289608797285 and parameters: {'model_name': 'SimpleImputer', 'strategy': 'most_frequent'}. Best is trial 8 with value: 0.09424039737062251.
running
[I 2024-08-15 10:45:09,053] Trial 2 finished with value: 0.24675289608797285 and parameters: {'model_name': 'SimpleImputer', 'strategy': 'most_frequent'}. Best is trial 8 with value: 0.09424039737062251.
running
[I 2024-08-15 10:45:09,237] Trial 30 finished with value: 0.09424039737062251 and parameters: {'model_name': 'SimpleImputer', 'strategy': 'median'}. Best is trial 8 with value: 0.09424039737062251.
running
[I 2024-08-15 10:45:09,387] Trial 29 finished with value: 0.09424039737062251 and parameters: {'model_name': 'SimpleImputer', 'strategy': 'median'}. Best is trial 8 with value: 0.09424039737062251.
running
[I 2024-08-15 10:45:09,557] Trial 9 finished with value: 0.24675289608797285 and parameters: {'model_name': 'SimpleImputer', 'strategy': 'most_frequent'}. Best is trial 8 with value: 0.09424039737062251.
running
[I 2024-08-15 10:45:10,321] Trial 23 finished with value: 0.24675289608797285 and parameters: {'model_name': 'SimpleImputer', 'strategy': 'most_frequent'}. Best is trial 8 with value: 0.09424039737062251.
running
[I 2024-08-15 10:45:10,610] Trial 24 finished with value: 0.24675289608797285 and parameters: {'model_name': 'SimpleImputer', 'strategy': 'most_frequent'}. Best is trial 8 with value: 0.09424039737062251.
running
[I 2024-08-15 10:45:10,982] Trial 25 finished with value: 0.24675289608797285 and parameters: {'model_name': 'SimpleImputer', 'strategy': 'most_frequent'}. Best is trial 8 with value: 0.09424039737062251.
running
[I 2024-08-15 10:45:11,081] Trial 36 finished with value: 0.09424039737062251 and parameters: {'model_name': 'SimpleImputer', 'strategy': 'median'}. Best is trial 8 with value: 0.09424039737062251.
running
[I 2024-08-15 10:45:11,347] Trial 39 finished with value: 0.09424039737062251 and parameters: {'model_name': 'SimpleImputer', 'strategy': 'median'}. Best is trial 8 with value: 0.09424039737062251.
running
[I 2024-08-15 10:45:11,527] Trial 37 finished with value: 0.09424039737062251 and parameters: {'model_name': 'SimpleImputer', 'strategy': 'median'}. Best is trial 8 with value: 0.09424039737062251.
running
[I 2024-08-15 10:45:11,689] Trial 38 finished with value: 0.09424039737062251 and parameters: {'model_name': 'SimpleImputer', 'strategy': 'median'}. Best is trial 8 with value: 0.09424039737062251.
running
[I 2024-08-15 10:45:11,813] Trial 40 finished with value: 0.09424039737062251 and parameters: {'model_name': 'SimpleImputer', 'strategy': 'median'}. Best is trial 8 with value: 0.09424039737062251.
running
[I 2024-08-15 10:45:12,167] Trial 41 finished with value: 0.09424039737062251 and parameters: {'model_name': 'SimpleImputer', 'strategy': 'median'}. Best is trial 8 with value: 0.09424039737062251.
running
[I 2024-08-15 10:45:12,323] Trial 43 finished with value: 0.09424039737062251 and parameters: {'model_name': 'SimpleImputer', 'strategy': 'median'}. Best is trial 8 with value: 0.09424039737062251.
running
[I 2024-08-15 10:45:12,456] Trial 42 finished with value: 0.09424039737062251 and parameters: {'model_name': 'SimpleImputer', 'strategy': 'median'}. Best is trial 8 with value: 0.09424039737062251.
running
[I 2024-08-15 10:45:13,102] Trial 31 finished with value: 0.24675289608797285 and parameters: {'model_name': 'SimpleImputer', 'strategy': 'most_frequent'}. Best is trial 8 with value: 0.09424039737062251.
running
[I 2024-08-15 10:45:13,224] Trial 33 finished with value: 0.24675289608797285 and parameters: {'model_name': 'SimpleImputer', 'strategy': 'most_frequent'}. Best is trial 8 with value: 0.09424039737062251.
running
[I 2024-08-15 10:45:13,408] Trial 32 finished with value: 0.24675289608797285 and parameters: {'model_name': 'SimpleImputer', 'strategy': 'most_frequent'}. Best is trial 8 with value: 0.09424039737062251.
running
[I 2024-08-15 10:45:13,649] Trial 45 finished with value: 0.09424039737062251 and parameters: {'model_name': 'SimpleImputer', 'strategy': 'median'}. Best is trial 8 with value: 0.09424039737062251.
running
[I 2024-08-15 10:45:13,814] Trial 46 finished with value: 0.09424039737062251 and parameters: {'model_name': 'SimpleImputer', 'strategy': 'median'}. Best is trial 8 with value: 0.09424039737062251.
running
[I 2024-08-15 10:45:13,948] Trial 47 finished with value: 0.09424039737062251 and parameters: {'model_name': 'SimpleImputer', 'strategy': 'median'}. Best is trial 8 with value: 0.09424039737062251.
running
[I 2024-08-15 10:45:14,118] Trial 44 finished with value: 0.09424039737062251 and parameters: {'model_name': 'SimpleImputer', 'strategy': 'median'}. Best is trial 8 with value: 0.09424039737062251.
running
[I 2024-08-15 10:45:14,286] Trial 48 finished with value: 0.09424039737062251 and parameters: {'model_name': 'SimpleImputer', 'strategy': 'median'}. Best is trial 8 with value: 0.09424039737062251.
running
[I 2024-08-15 10:45:14,479] Trial 51 finished with value: 0.09424039737062251 and parameters: {'model_name': 'SimpleImputer', 'strategy': 'median'}. Best is trial 8 with value: 0.09424039737062251.
running
[I 2024-08-15 10:45:14,649] Trial 49 finished with value: 0.09424039737062251 and parameters: {'model_name': 'SimpleImputer', 'strategy': 'median'}. Best is trial 8 with value: 0.09424039737062251.
running
[I 2024-08-15 10:45:14,795] Trial 34 finished with value: 0.24675289608797285 and parameters: {'model_name': 'SimpleImputer', 'strategy': 'most_frequent'}. Best is trial 8 with value: 0.09424039737062251.
running
[I 2024-08-15 10:45:15,014] Trial 50 finished with value: 0.09424039737062251 and parameters: {'model_name': 'SimpleImputer', 'strategy': 'median'}. Best is trial 8 with value: 0.09424039737062251.
running
[I 2024-08-15 10:45:15,153] Trial 35 finished with value: 0.24675289608797285 and parameters: {'model_name': 'SimpleImputer', 'strategy': 'most_frequent'}. Best is trial 8 with value: 0.09424039737062251.
running
[I 2024-08-15 10:45:15,337] Trial 53 finished with value: 0.09424039737062251 and parameters: {'model_name': 'SimpleImputer', 'strategy': 'median'}. Best is trial 8 with value: 0.09424039737062251.
running
[I 2024-08-15 10:45:15,517] Trial 54 finished with value: 0.09424039737062251 and parameters: {'model_name': 'SimpleImputer', 'strategy': 'median'}. Best is trial 8 with value: 0.09424039737062251.
running
[I 2024-08-15 10:45:15,775] Trial 52 finished with value: 0.09424039737062251 and parameters: {'model_name': 'SimpleImputer', 'strategy': 'median'}. Best is trial 8 with value: 0.09424039737062251.
running
[I 2024-08-15 10:45:16,053] Trial 60 finished with value: 0.09450815842681276 and parameters: {'model_name': 'SimpleImputer', 'strategy': 'mean'}. Best is trial 8 with value: 0.09424039737062251.
running
[I 2024-08-15 10:45:16,172] Trial 63 finished with value: 0.09450815842681276 and parameters: {'model_name': 'SimpleImputer', 'strategy': 'mean'}. Best is trial 8 with value: 0.09424039737062251.
running
[I 2024-08-15 10:45:16,310] Trial 61 finished with value: 0.09450815842681276 and parameters: {'model_name': 'SimpleImputer', 'strategy': 'mean'}. Best is trial 8 with value: 0.09424039737062251.
running
[I 2024-08-15 10:45:16,507] Trial 56 finished with value: 0.09424039737062251 and parameters: {'model_name': 'SimpleImputer', 'strategy': 'median'}. Best is trial 8 with value: 0.09424039737062251.
[I 2024-08-15 10:45:16,606] Trial 55 finished with value: 0.09424039737062251 and parameters: {'model_name': 'SimpleImputer', 'strategy': 'median'}. Best is trial 8 with value: 0.09424039737062251.
running
running
[I 2024-08-15 10:45:16,908] Trial 57 finished with value: 0.09424039737062251 and parameters: {'model_name': 'SimpleImputer', 'strategy': 'median'}. Best is trial 8 with value: 0.09424039737062251.
running
[I 2024-08-15 10:45:17,028] Trial 64 finished with value: 0.09450815842681276 and parameters: {'model_name': 'SimpleImputer', 'strategy': 'mean'}. Best is trial 8 with value: 0.09424039737062251.
running
[I 2024-08-15 10:45:17,221] Trial 67 finished with value: 0.09450815842681276 and parameters: {'model_name': 'SimpleImputer', 'strategy': 'mean'}. Best is trial 8 with value: 0.09424039737062251.
running
[I 2024-08-15 10:45:17,340] Trial 62 finished with value: 0.09450815842681276 and parameters: {'model_name': 'SimpleImputer', 'strategy': 'mean'}. Best is trial 8 with value: 0.09424039737062251.
running
[I 2024-08-15 10:45:17,500] Trial 58 finished with value: 0.09424039737062251 and parameters: {'model_name': 'SimpleImputer', 'strategy': 'median'}. Best is trial 8 with value: 0.09424039737062251.
running
[I 2024-08-15 10:45:17,623] Trial 68 finished with value: 0.09450815842681276 and parameters: {'model_name': 'SimpleImputer', 'strategy': 'mean'}. Best is trial 8 with value: 0.09424039737062251.
running
[I 2024-08-15 10:45:17,746] Trial 66 finished with value: 0.09450815842681276 and parameters: {'model_name': 'SimpleImputer', 'strategy': 'mean'}. Best is trial 8 with value: 0.09424039737062251.
running
[I 2024-08-15 10:45:17,921] Trial 65 finished with value: 0.09450815842681276 and parameters: {'model_name': 'SimpleImputer', 'strategy': 'mean'}. Best is trial 8 with value: 0.09424039737062251.
running
[I 2024-08-15 10:45:18,105] Trial 69 finished with value: 0.09450815842681276 and parameters: {'model_name': 'SimpleImputer', 'strategy': 'mean'}. Best is trial 8 with value: 0.09424039737062251.
running
[I 2024-08-15 10:45:18,287] Trial 71 finished with value: 0.26840750861409834 and parameters: {'model_name': 'SimpleImputer', 'strategy': 'constant'}. Best is trial 8 with value: 0.09424039737062251.
[I 2024-08-15 10:45:18,387] Trial 59 finished with value: 0.09424039737062251 and parameters: {'model_name': 'SimpleImputer', 'strategy': 'median'}. Best is trial 8 with value: 0.09424039737062251.
running
running
[I 2024-08-15 10:45:18,587] Trial 73 finished with value: 0.26840750861409834 and parameters: {'model_name': 'SimpleImputer', 'strategy': 'constant'}. Best is trial 8 with value: 0.09424039737062251.
running
[I 2024-08-15 10:45:18,780] Trial 74 finished with value: 0.26840750861409834 and parameters: {'model_name': 'SimpleImputer', 'strategy': 'constant'}. Best is trial 8 with value: 0.09424039737062251.
running
[I 2024-08-15 10:45:18,965] Trial 70 finished with value: 0.09450815842681276 and parameters: {'model_name': 'SimpleImputer', 'strategy': 'mean'}. Best is trial 8 with value: 0.09424039737062251.
running
[I 2024-08-15 10:45:19,134] Trial 77 finished with value: 0.26840750861409834 and parameters: {'model_name': 'SimpleImputer', 'strategy': 'constant'}. Best is trial 8 with value: 0.09424039737062251.
running
[I 2024-08-15 10:45:19,303] Trial 78 finished with value: 0.26840750861409834 and parameters: {'model_name': 'SimpleImputer', 'strategy': 'constant'}. Best is trial 8 with value: 0.09424039737062251.
running
[I 2024-08-15 10:45:19,476] Trial 79 finished with value: 0.26840750861409834 and parameters: {'model_name': 'SimpleImputer', 'strategy': 'constant'}. Best is trial 8 with value: 0.09424039737062251.
[I 2024-08-15 10:45:19,574] Trial 81 finished with value: 0.26840750861409834 and parameters: {'model_name': 'SimpleImputer', 'strategy': 'constant'}. Best is trial 8 with value: 0.09424039737062251.
running
running
[I 2024-08-15 10:45:19,678] Trial 75 finished with value: 0.26840750861409834 and parameters: {'model_name': 'SimpleImputer', 'strategy': 'constant'}. Best is trial 8 with value: 0.09424039737062251.
running
[I 2024-08-15 10:45:19,827] Trial 80 finished with value: 0.26840750861409834 and parameters: {'model_name': 'SimpleImputer', 'strategy': 'constant'}. Best is trial 8 with value: 0.09424039737062251.
running
[I 2024-08-15 10:45:20,061] Trial 82 finished with value: 0.26840750861409834 and parameters: {'model_name': 'SimpleImputer', 'strategy': 'constant'}. Best is trial 8 with value: 0.09424039737062251.
running
[I 2024-08-15 10:45:20,202] Trial 83 finished with value: 0.26840750861409834 and parameters: {'model_name': 'SimpleImputer', 'strategy': 'constant'}. Best is trial 8 with value: 0.09424039737062251.
running
[I 2024-08-15 10:45:20,376] Trial 72 finished with value: 0.09424039737062251 and parameters: {'model_name': 'SimpleImputer', 'strategy': 'median'}. Best is trial 8 with value: 0.09424039737062251.
running
[I 2024-08-15 10:45:20,647] Trial 84 finished with value: 0.26840750861409834 and parameters: {'model_name': 'SimpleImputer', 'strategy': 'constant'}. Best is trial 8 with value: 0.09424039737062251.
running
[I 2024-08-15 10:45:20,895] Trial 76 finished with value: 0.09424039737062251 and parameters: {'model_name': 'SimpleImputer', 'strategy': 'median'}. Best is trial 8 with value: 0.09424039737062251.
running
[I 2024-08-15 10:45:21,265] Trial 85 finished with value: 0.09424039737062251 and parameters: {'model_name': 'SimpleImputer', 'strategy': 'median'}. Best is trial 8 with value: 0.09424039737062251.
running
[I 2024-08-15 10:45:21,636] Trial 89 finished with value: 0.09424039737062251 and parameters: {'model_name': 'SimpleImputer', 'strategy': 'median'}. Best is trial 8 with value: 0.09424039737062251.
[I 2024-08-15 10:45:21,746] Trial 88 finished with value: 0.09424039737062251 and parameters: {'model_name': 'SimpleImputer', 'strategy': 'median'}. Best is trial 8 with value: 0.09424039737062251.
running
running
[I 2024-08-15 10:45:21,912] Trial 91 finished with value: 0.09424039737062251 and parameters: {'model_name': 'SimpleImputer', 'strategy': 'median'}. Best is trial 8 with value: 0.09424039737062251.
[I 2024-08-15 10:45:22,010] Trial 86 finished with value: 0.09424039737062251 and parameters: {'model_name': 'SimpleImputer', 'strategy': 'median'}. Best is trial 8 with value: 0.09424039737062251.
running
running
[I 2024-08-15 10:45:22,171] Trial 90 finished with value: 0.09424039737062251 and parameters: {'model_name': 'SimpleImputer', 'strategy': 'median'}. Best is trial 8 with value: 0.09424039737062251.
running
[I 2024-08-15 10:45:22,414] Trial 93 finished with value: 0.09424039737062251 and parameters: {'model_name': 'SimpleImputer', 'strategy': 'median'}. Best is trial 8 with value: 0.09424039737062251.
running
[I 2024-08-15 10:45:22,579] Trial 94 finished with value: 0.09424039737062251 and parameters: {'model_name': 'SimpleImputer', 'strategy': 'median'}. Best is trial 8 with value: 0.09424039737062251.
running
[I 2024-08-15 10:45:22,755] Trial 87 finished with value: 0.09424039737062251 and parameters: {'model_name': 'SimpleImputer', 'strategy': 'median'}. Best is trial 8 with value: 0.09424039737062251.
running
[I 2024-08-15 10:45:22,928] Trial 92 finished with value: 0.09424039737062251 and parameters: {'model_name': 'SimpleImputer', 'strategy': 'median'}. Best is trial 8 with value: 0.09424039737062251.
running
[I 2024-08-15 10:45:23,048] Trial 96 finished with value: 0.09424039737062251 and parameters: {'model_name': 'SimpleImputer', 'strategy': 'median'}. Best is trial 8 with value: 0.09424039737062251.
running
[I 2024-08-15 10:45:23,183] Trial 95 finished with value: 0.09424039737062251 and parameters: {'model_name': 'SimpleImputer', 'strategy': 'median'}. Best is trial 8 with value: 0.09424039737062251.
running
[I 2024-08-15 10:45:23,317] Trial 98 finished with value: 0.09424039737062251 and parameters: {'model_name': 'SimpleImputer', 'strategy': 'median'}. Best is trial 8 with value: 0.09424039737062251.
running
[I 2024-08-15 10:45:23,428] Trial 97 finished with value: 0.09424039737062251 and parameters: {'model_name': 'SimpleImputer', 'strategy': 'median'}. Best is trial 8 with value: 0.09424039737062251.
running
[I 2024-08-15 10:45:23,702] Trial 99 finished with value: 0.09424039737062251 and parameters: {'model_name': 'SimpleImputer', 'strategy': 'median'}. Best is trial 8 with value: 0.09424039737062251.
running
[I 2024-08-15 10:45:24,053] Trial 100 finished with value: 0.09424039737062251 and parameters: {'model_name': 'SimpleImputer', 'strategy': 'median'}. Best is trial 8 with value: 0.09424039737062251.
running
[I 2024-08-15 10:45:24,528] Trial 105 finished with value: 0.09424039737062251 and parameters: {'model_name': 'SimpleImputer', 'strategy': 'median'}. Best is trial 8 with value: 0.09424039737062251.
running
[I 2024-08-15 10:45:24,723] Trial 104 finished with value: 0.09424039737062251 and parameters: {'model_name': 'SimpleImputer', 'strategy': 'median'}. Best is trial 8 with value: 0.09424039737062251.
running
