[I 2024-10-07 14:51:44,297] Trial 80 finished with value: 0.05220623792367418 and parameters: {'model_name': 'IterativeImputer', 'estimator': 'RFR', 'initial_strategy': 'most_frequent', 'n_nearest_features': 10, 'imputation_order': 'roman'}. Best is trial 76 with value: 0.052097870268951366.
running
[I 2024-10-07 14:51:56,996] Trial 90 finished with value: 0.09046253063199404 and parameters: {'model_name': 'IterativeImputer', 'estimator': 'Ridge', 'initial_strategy': 'most_frequent', 'n_nearest_features': 1, 'imputation_order': 'roman'}. Best is trial 76 with value: 0.052097870268951366.
running
[I 2024-10-07 15:05:34,160] Trial 81 finished with value: 0.052798415982044676 and parameters: {'model_name': 'IterativeImputer', 'estimator': 'RFR', 'initial_strategy': 'most_frequent', 'n_nearest_features': 10, 'imputation_order': 'roman'}. Best is trial 76 with value: 0.052097870268951366.
running
[I 2024-10-07 15:16:26,202] Trial 85 finished with value: 0.053066372621779434 and parameters: {'model_name': 'IterativeImputer', 'estimator': 'RFR', 'initial_strategy': 'most_frequent', 'n_nearest_features': 10, 'imputation_order': 'ascending'}. Best is trial 76 with value: 0.052097870268951366.
running
[I 2024-10-07 15:17:54,664] Trial 42 finished with value: 0.09860848867820625 and parameters: {'model_name': 'VAE', 'batch_size': 895, 'iterations': 5674, 'learning_rate': 0.0012470137371368862, 'p_miss': 0.21768663493863763}. Best is trial 76 with value: 0.052097870268951366.
running
[I 2024-10-07 15:20:40,815] Trial 43 finished with value: 0.09835443604701484 and parameters: {'model_name': 'VAE', 'batch_size': 681, 'iterations': 6209, 'learning_rate': 0.0011690192815603272, 'p_miss': 0.20874449241974463}. Best is trial 76 with value: 0.052097870268951366.
running
[I 2024-10-07 15:23:27,914] Trial 87 finished with value: 0.056083288697924616 and parameters: {'model_name': 'IterativeImputer', 'estimator': 'RFR', 'initial_strategy': 'most_frequent', 'n_nearest_features': 8, 'imputation_order': 'roman'}. Best is trial 76 with value: 0.052097870268951366.
running
[I 2024-10-07 15:24:18,068] Trial 86 finished with value: 0.052830664423760484 and parameters: {'model_name': 'IterativeImputer', 'estimator': 'RFR', 'initial_strategy': 'most_frequent', 'n_nearest_features': 10, 'imputation_order': 'ascending'}. Best is trial 76 with value: 0.052097870268951366.
running
[I 2024-10-07 15:24:35,704] Trial 88 finished with value: 0.05513552093252688 and parameters: {'model_name': 'IterativeImputer', 'estimator': 'RFR', 'initial_strategy': 'most_frequent', 'n_nearest_features': 8, 'imputation_order': 'roman'}. Best is trial 76 with value: 0.052097870268951366.
running
[I 2024-10-07 15:27:22,700] Trial 89 finished with value: 0.05628263094269452 and parameters: {'model_name': 'IterativeImputer', 'estimator': 'RFR', 'initial_strategy': 'most_frequent', 'n_nearest_features': 8, 'imputation_order': 'ascending'}. Best is trial 76 with value: 0.052097870268951366.
running
[I 2024-10-07 15:32:32,272] Trial 91 finished with value: 0.05307541150373157 and parameters: {'model_name': 'IterativeImputer', 'estimator': 'RFR', 'initial_strategy': 'most_frequent', 'n_nearest_features': 10, 'imputation_order': 'ascending'}. Best is trial 76 with value: 0.052097870268951366.
running
[I 2024-10-07 15:42:25,262] Trial 92 finished with value: 0.056544313477230254 and parameters: {'model_name': 'IterativeImputer', 'estimator': 'RFR', 'initial_strategy': 'most_frequent', 'n_nearest_features': 8, 'imputation_order': 'ascending'}. Best is trial 76 with value: 0.052097870268951366.
running
[I 2024-10-07 15:42:26,274] Trial 101 finished with value: 0.10905955252269146 and parameters: {'model_name': 'SimpleImputer', 'strategy': 'most_frequent'}. Best is trial 76 with value: 0.052097870268951366.
running
[I 2024-10-07 15:44:43,149] Trial 34 finished with value: 0.09861665822843033 and parameters: {'model_name': 'VAE', 'batch_size': 92, 'iterations': 9172, 'learning_rate': 0.0014723492620783054, 'p_miss': 0.24780766579030242}. Best is trial 76 with value: 0.052097870268951366.
running
[I 2024-10-07 15:47:33,577] Trial 37 finished with value: 0.09836411677539457 and parameters: {'model_name': 'VAE', 'batch_size': 89, 'iterations': 9801, 'learning_rate': 0.00210638300575408, 'p_miss': 0.24650242068148692}. Best is trial 76 with value: 0.052097870268951366.
running
[I 2024-10-07 15:51:44,950] Trial 94 finished with value: 0.05554378788057661 and parameters: {'model_name': 'IterativeImputer', 'estimator': 'RFR', 'initial_strategy': 'most_frequent', 'n_nearest_features': 7, 'imputation_order': 'roman'}. Best is trial 76 with value: 0.052097870268951366.
running
[I 2024-10-07 15:56:30,512] Trial 93 finished with value: 0.053035419209971915 and parameters: {'model_name': 'IterativeImputer', 'estimator': 'RFR', 'initial_strategy': 'most_frequent', 'n_nearest_features': 11, 'imputation_order': 'roman'}. Best is trial 76 with value: 0.052097870268951366.
running
[I 2024-10-07 15:56:52,006] Trial 95 finished with value: 0.05527993281565986 and parameters: {'model_name': 'IterativeImputer', 'estimator': 'RFR', 'initial_strategy': 'most_frequent', 'n_nearest_features': 8, 'imputation_order': 'roman'}. Best is trial 76 with value: 0.052097870268951366.
running
[I 2024-10-07 16:03:17,204] Trial 98 finished with value: 0.05280724263340784 and parameters: {'model_name': 'IterativeImputer', 'estimator': 'RFR', 'initial_strategy': 'most_frequent', 'n_nearest_features': 11, 'imputation_order': 'random'}. Best is trial 76 with value: 0.052097870268951366.
running
[I 2024-10-07 16:03:21,961] Trial 97 finished with value: 0.05267051028710662 and parameters: {'model_name': 'IterativeImputer', 'estimator': 'RFR', 'initial_strategy': 'most_frequent', 'n_nearest_features': 11, 'imputation_order': 'roman'}. Best is trial 76 with value: 0.052097870268951366.
running
[I 2024-10-07 16:03:51,919] Trial 96 finished with value: 0.05318894773840834 and parameters: {'model_name': 'IterativeImputer', 'estimator': 'RFR', 'initial_strategy': 'most_frequent', 'n_nearest_features': 10, 'imputation_order': 'roman'}. Best is trial 76 with value: 0.052097870268951366.
running
[I 2024-10-07 16:07:05,650] Trial 99 finished with value: 0.05242191081877753 and parameters: {'model_name': 'IterativeImputer', 'estimator': 'RFR', 'initial_strategy': 'most_frequent', 'n_nearest_features': 11, 'imputation_order': 'random'}. Best is trial 76 with value: 0.052097870268951366.
running
[I 2024-10-07 16:09:48,708] Trial 102 finished with value: 0.21351888527463014 and parameters: {'model_name': 'GAIN', 'batch_size': 14, 'hint_rate': 0.2976633722621417, 'alpha': 80, 'iterations': 1050, 'learning_rate': 0.07222100578220618, 'p_miss': 0.17177846674167105}. Best is trial 76 with value: 0.052097870268951366.
running
[I 2024-10-07 16:11:00,271] Trial 112 finished with value: 0.1067222828610928 and parameters: {'model_name': 'IterativeImputer', 'estimator': 'Bayesian', 'initial_strategy': 'mean', 'n_nearest_features': 11, 'imputation_order': 'random', 'sample_posterior': True}. Best is trial 76 with value: 0.052097870268951366.
running
[I 2024-10-07 16:11:03,789] Trial 113 finished with value: 0.08854301574195719 and parameters: {'model_name': 'KNNImputer', 'n_neighbors': 1610, 'weights': 'uniform'}. Best is trial 76 with value: 0.052097870268951366.
running
[I 2024-10-07 16:11:20,451] Trial 114 finished with value: 0.07173975830617947 and parameters: {'model_name': 'IterativeImputer', 'estimator': 'Ridge', 'initial_strategy': 'constant', 'n_nearest_features': 11, 'imputation_order': 'random'}. Best is trial 76 with value: 0.052097870268951366.
running
[I 2024-10-07 16:11:44,906] Trial 115 finished with value: 0.06060415656867665 and parameters: {'model_name': 'IterativeImputer', 'estimator': 'KNN', 'initial_strategy': 'most_frequent', 'n_nearest_features': 11, 'imputation_order': 'random'}. Best is trial 76 with value: 0.052097870268951366.
running
[I 2024-10-07 16:12:09,847] Trial 100 finished with value: 0.052112405133221906 and parameters: {'model_name': 'IterativeImputer', 'estimator': 'RFR', 'initial_strategy': 'most_frequent', 'n_nearest_features': 11, 'imputation_order': 'random'}. Best is trial 76 with value: 0.052097870268951366.
running
[I 2024-10-07 16:12:55,436] Trial 104 finished with value: 0.21537436809564806 and parameters: {'model_name': 'GAIN', 'batch_size': 17, 'hint_rate': 0.28265119388424353, 'alpha': 77, 'iterations': 1160, 'learning_rate': 0.08675652159752818, 'p_miss': 0.1675762145174587}. Best is trial 76 with value: 0.052097870268951366.
running
[I 2024-10-07 16:15:52,080] Trial 103 finished with value: 0.2143192714583174 and parameters: {'model_name': 'GAIN', 'batch_size': 22, 'hint_rate': 0.3229547155686001, 'alpha': 77, 'iterations': 1303, 'learning_rate': 0.09541045136829229, 'p_miss': 0.17497412165242623}. Best is trial 76 with value: 0.052097870268951366.
running
[I 2024-10-07 16:21:17,868] Trial 108 finished with value: 0.21324139936431283 and parameters: {'model_name': 'GAIN', 'batch_size': 17, 'hint_rate': 0.309213260735679, 'alpha': 79, 'iterations': 874, 'learning_rate': 0.00034682632150009955, 'p_miss': 0.17055385351471938}. Best is trial 76 with value: 0.052097870268951366.
running
[I 2024-10-07 16:21:29,543] Trial 107 finished with value: 0.2171751538619182 and parameters: {'model_name': 'GAIN', 'batch_size': 22, 'hint_rate': 0.3376062214921196, 'alpha': 77, 'iterations': 1046, 'learning_rate': 0.08233010382930137, 'p_miss': 0.18177543966402426}. Best is trial 76 with value: 0.052097870268951366.
running
[I 2024-10-07 16:24:50,272] Trial 105 finished with value: 0.20883566436034054 and parameters: {'model_name': 'GAIN', 'batch_size': 16, 'hint_rate': 0.7410089005658824, 'alpha': 79, 'iterations': 1420, 'learning_rate': 0.09962082588731248, 'p_miss': 0.1891152710033207}. Best is trial 76 with value: 0.052097870268951366.
running
[I 2024-10-07 16:31:10,931] Trial 109 finished with value: 0.21034771636905827 and parameters: {'model_name': 'GAIN', 'batch_size': 16, 'hint_rate': 0.2805154805561587, 'alpha': 75, 'iterations': 1220, 'learning_rate': 0.09307712822946118, 'p_miss': 0.17106621059524496}. Best is trial 76 with value: 0.052097870268951366.
running
[I 2024-10-07 16:33:04,556] Trial 110 finished with value: 0.21306025916180427 and parameters: {'model_name': 'GAIN', 'batch_size': 17, 'hint_rate': 0.28244045599427847, 'alpha': 79, 'iterations': 1219, 'learning_rate': 0.07887294302891604, 'p_miss': 0.16403343622331526}. Best is trial 76 with value: 0.052097870268951366.
running
[I 2024-10-07 16:36:06,372] Trial 106 finished with value: 0.05298955766329955 and parameters: {'model_name': 'IterativeImputer', 'estimator': 'RFR', 'initial_strategy': 'mean', 'n_nearest_features': 10, 'imputation_order': 'random'}. Best is trial 76 with value: 0.052097870268951366.
running
[I 2024-10-07 16:40:01,949] Trial 111 finished with value: 0.20952589358713683 and parameters: {'model_name': 'GAIN', 'batch_size': 10, 'hint_rate': 0.27772871437128865, 'alpha': 77, 'iterations': 1369, 'learning_rate': 0.0003335492393225849, 'p_miss': 0.16978200290901113}. Best is trial 76 with value: 0.052097870268951366.
running
[I 2024-10-07 16:51:02,711] Trial 117 finished with value: 0.052464955099886815 and parameters: {'model_name': 'IterativeImputer', 'estimator': 'RFR', 'initial_strategy': 'most_frequent', 'n_nearest_features': 11, 'imputation_order': 'random'}. Best is trial 76 with value: 0.052097870268951366.
running
[I 2024-10-07 16:51:09,073] Trial 116 finished with value: 0.052373593232673654 and parameters: {'model_name': 'IterativeImputer', 'estimator': 'RFR', 'initial_strategy': 'most_frequent', 'n_nearest_features': 10, 'imputation_order': 'descending'}. Best is trial 76 with value: 0.052097870268951366.
running
[I 2024-10-07 16:51:10,334] Trial 118 finished with value: 0.05297293280549629 and parameters: {'model_name': 'IterativeImputer', 'estimator': 'RFR', 'initial_strategy': 'most_frequent', 'n_nearest_features': 11, 'imputation_order': 'random'}. Best is trial 76 with value: 0.052097870268951366.
running
[I 2024-10-07 16:55:27,085] Trial 119 finished with value: 0.05225303881664602 and parameters: {'model_name': 'IterativeImputer', 'estimator': 'RFR', 'initial_strategy': 'most_frequent', 'n_nearest_features': 11, 'imputation_order': 'random'}. Best is trial 76 with value: 0.052097870268951366.
running
[I 2024-10-07 17:00:00,860] Trial 120 finished with value: 0.05229697384623705 and parameters: {'model_name': 'IterativeImputer', 'estimator': 'RFR', 'initial_strategy': 'most_frequent', 'n_nearest_features': 11, 'imputation_order': 'random'}. Best is trial 76 with value: 0.052097870268951366.
running
[I 2024-10-07 17:01:10,729] Trial 121 finished with value: 0.0531611602062102 and parameters: {'model_name': 'IterativeImputer', 'estimator': 'RFR', 'initial_strategy': 'most_frequent', 'n_nearest_features': 11, 'imputation_order': 'descending'}. Best is trial 76 with value: 0.052097870268951366.
running
[I 2024-10-07 17:03:31,906] Trial 124 finished with value: 0.061796082559274615 and parameters: {'model_name': 'IterativeImputer', 'estimator': 'RFR', 'initial_strategy': 'most_frequent', 'n_nearest_features': 5, 'imputation_order': 'random'}. Best is trial 76 with value: 0.052097870268951366.
running
[I 2024-10-07 17:04:20,472] Trial 122 finished with value: 0.05217320246007243 and parameters: {'model_name': 'IterativeImputer', 'estimator': 'RFR', 'initial_strategy': 'most_frequent', 'n_nearest_features': 11, 'imputation_order': 'random'}. Best is trial 76 with value: 0.052097870268951366.
running
[I 2024-10-07 17:10:25,406] Trial 123 finished with value: 0.05243322379518892 and parameters: {'model_name': 'IterativeImputer', 'estimator': 'RFR', 'initial_strategy': 'most_frequent', 'n_nearest_features': 11, 'imputation_order': 'random'}. Best is trial 76 with value: 0.052097870268951366.
running
[I 2024-10-07 17:15:45,987] Trial 125 finished with value: 0.05296373073988664 and parameters: {'model_name': 'IterativeImputer', 'estimator': 'RFR', 'initial_strategy': 'most_frequent', 'n_nearest_features': 11, 'imputation_order': 'random'}. Best is trial 76 with value: 0.052097870268951366.
running
[I 2024-10-07 17:19:49,769] Trial 126 finished with value: 0.0527877627803071 and parameters: {'model_name': 'IterativeImputer', 'estimator': 'RFR', 'initial_strategy': 'most_frequent', 'n_nearest_features': 11, 'imputation_order': 'descending'}. Best is trial 76 with value: 0.052097870268951366.
running
[I 2024-10-07 17:23:54,349] Trial 33 finished with value: 0.09855338763173327 and parameters: {'model_name': 'VAE', 'batch_size': 921, 'iterations': 7177, 'learning_rate': 0.0012349557930086711, 'p_miss': 0.25611265537073546}. Best is trial 76 with value: 0.052097870268951366.
running
[I 2024-10-07 17:29:06,475] Trial 129 finished with value: 0.0523121231561394 and parameters: {'model_name': 'IterativeImputer', 'estimator': 'RFR', 'initial_strategy': 'most_frequent', 'n_nearest_features': 11, 'imputation_order': 'random'}. Best is trial 76 with value: 0.052097870268951366.
running
[I 2024-10-07 17:29:21,029] Trial 127 finished with value: 0.05257877826129329 and parameters: {'model_name': 'IterativeImputer', 'estimator': 'RFR', 'initial_strategy': 'most_frequent', 'n_nearest_features': 11, 'imputation_order': 'random'}. Best is trial 76 with value: 0.052097870268951366.
running
[I 2024-10-07 17:30:01,663] Trial 128 finished with value: 0.052270863990346896 and parameters: {'model_name': 'IterativeImputer', 'estimator': 'RFR', 'initial_strategy': 'most_frequent', 'n_nearest_features': 11, 'imputation_order': 'random'}. Best is trial 76 with value: 0.052097870268951366.
running
[I 2024-10-07 17:33:50,192] Trial 130 finished with value: 0.052071303397718816 and parameters: {'model_name': 'IterativeImputer', 'estimator': 'RFR', 'initial_strategy': 'most_frequent', 'n_nearest_features': 11, 'imputation_order': 'random'}. Best is trial 130 with value: 0.052071303397718816.
running
[I 2024-10-07 17:33:50,688] Trial 142 finished with value: 0.25315299271463926 and parameters: {'model_name': 'SimpleImputer', 'strategy': 'constant'}. Best is trial 130 with value: 0.052071303397718816.
running
[I 2024-10-07 17:35:26,194] Trial 45 finished with value: 0.0985935155974583 and parameters: {'model_name': 'VAE', 'batch_size': 798, 'iterations': 7860, 'learning_rate': 0.0006681873887577618, 'p_miss': 0.01661489176248196}. Best is trial 130 with value: 0.052071303397718816.
running
[I 2024-10-07 17:37:19,200] Trial 131 finished with value: 0.052797156477487193 and parameters: {'model_name': 'IterativeImputer', 'estimator': 'RFR', 'initial_strategy': 'most_frequent', 'n_nearest_features': 11, 'imputation_order': 'random'}. Best is trial 130 with value: 0.052071303397718816.
running
[I 2024-10-07 17:37:38,589] Trial 145 finished with value: 0.0621034396871071 and parameters: {'model_name': 'IterativeImputer', 'estimator': 'KNN', 'initial_strategy': 'constant', 'n_nearest_features': 9, 'imputation_order': 'random'}. Best is trial 130 with value: 0.052071303397718816.
running
[I 2024-10-07 17:39:12,696] Trial 132 finished with value: 0.053058901591872806 and parameters: {'model_name': 'IterativeImputer', 'estimator': 'RFR', 'initial_strategy': 'most_frequent', 'n_nearest_features': 11, 'imputation_order': 'random'}. Best is trial 130 with value: 0.052071303397718816.
running
[I 2024-10-07 17:41:31,943] Trial 133 finished with value: 0.052771516592929224 and parameters: {'model_name': 'IterativeImputer', 'estimator': 'RFR', 'initial_strategy': 'most_frequent', 'n_nearest_features': 11, 'imputation_order': 'random'}. Best is trial 130 with value: 0.052071303397718816.
running
[I 2024-10-07 17:41:36,548] Trial 134 finished with value: 0.05271990969137572 and parameters: {'model_name': 'IterativeImputer', 'estimator': 'RFR', 'initial_strategy': 'constant', 'n_nearest_features': 11, 'imputation_order': 'random'}. Best is trial 130 with value: 0.052071303397718816.
running
[I 2024-10-07 17:47:16,964] Trial 135 finished with value: 0.052382384267014706 and parameters: {'model_name': 'IterativeImputer', 'estimator': 'RFR', 'initial_strategy': 'constant', 'n_nearest_features': 11, 'imputation_order': 'random'}. Best is trial 130 with value: 0.052071303397718816.
running
[I 2024-10-07 17:48:54,315] Trial 29 finished with value: 0.09855599008215102 and parameters: {'model_name': 'VAE', 'batch_size': 773, 'iterations': 7730, 'learning_rate': 0.00010544688217537155, 'p_miss': 0.012083803195792248}. Best is trial 130 with value: 0.052071303397718816.
running
[I 2024-10-07 17:52:18,701] Trial 136 finished with value: 0.05235079570891306 and parameters: {'model_name': 'IterativeImputer', 'estimator': 'RFR', 'initial_strategy': 'most_frequent', 'n_nearest_features': 11, 'imputation_order': 'random'}. Best is trial 130 with value: 0.052071303397718816.
running
[I 2024-10-07 17:52:23,138] Trial 152 finished with value: 0.08003163042555457 and parameters: {'model_name': 'KNNImputer', 'n_neighbors': 1744, 'weights': 'distance'}. Best is trial 130 with value: 0.052071303397718816.
running
[I 2024-10-07 17:56:07,342] Trial 137 finished with value: 0.052466432647345615 and parameters: {'model_name': 'IterativeImputer', 'estimator': 'RFR', 'initial_strategy': 'constant', 'n_nearest_features': 11, 'imputation_order': 'random'}. Best is trial 130 with value: 0.052071303397718816.
running
[I 2024-10-07 17:59:48,636] Trial 138 finished with value: 0.05242483595983309 and parameters: {'model_name': 'IterativeImputer', 'estimator': 'RFR', 'initial_strategy': 'constant', 'n_nearest_features': 11, 'imputation_order': 'random'}. Best is trial 130 with value: 0.052071303397718816.
running
[I 2024-10-07 18:04:00,072] Trial 139 finished with value: 0.052148636279087876 and parameters: {'model_name': 'IterativeImputer', 'estimator': 'RFR', 'initial_strategy': 'constant', 'n_nearest_features': 11, 'imputation_order': 'random'}. Best is trial 130 with value: 0.052071303397718816.
running
[I 2024-10-07 18:04:32,424] Trial 140 finished with value: 0.052129788217879704 and parameters: {'model_name': 'IterativeImputer', 'estimator': 'RFR', 'initial_strategy': 'constant', 'n_nearest_features': 11, 'imputation_order': 'random'}. Best is trial 130 with value: 0.052071303397718816.
running
[I 2024-10-07 18:05:29,697] Trial 141 finished with value: 0.05203007935391997 and parameters: {'model_name': 'IterativeImputer', 'estimator': 'RFR', 'initial_strategy': 'constant', 'n_nearest_features': 11, 'imputation_order': 'random'}. Best is trial 141 with value: 0.05203007935391997.
running
[I 2024-10-07 18:07:25,240] Trial 143 finished with value: 0.054579283164604975 and parameters: {'model_name': 'IterativeImputer', 'estimator': 'RFR', 'initial_strategy': 'most_frequent', 'n_nearest_features': 9, 'imputation_order': 'random'}. Best is trial 141 with value: 0.05203007935391997.
running
[I 2024-10-07 18:08:16,625] Trial 144 finished with value: 0.05293287718200647 and parameters: {'model_name': 'IterativeImputer', 'estimator': 'RFR', 'initial_strategy': 'constant', 'n_nearest_features': 9, 'imputation_order': 'random'}. Best is trial 141 with value: 0.05203007935391997.
running
[I 2024-10-07 18:12:16,051] Trial 146 finished with value: 0.05237030674745803 and parameters: {'model_name': 'IterativeImputer', 'estimator': 'RFR', 'initial_strategy': 'most_frequent', 'n_nearest_features': 11, 'imputation_order': 'random'}. Best is trial 141 with value: 0.05203007935391997.
running
[I 2024-10-07 18:14:35,406] Trial 147 finished with value: 0.05279273612418928 and parameters: {'model_name': 'IterativeImputer', 'estimator': 'RFR', 'initial_strategy': 'most_frequent', 'n_nearest_features': 11, 'imputation_order': 'random'}. Best is trial 141 with value: 0.05203007935391997.
running
