Run: 22
/cm/local/apps/slurm/var/spool/job931369/slurm_script: line 26: 
pip install -e tpot2
pip install -r tpot2/ImputerExperiments/requirements_.txt
: No such file or directory
RunStart
starting loops
../data/r/215/215.pkl
working on 
../data/r/215/reg_simple_MNAR_0.1_1
3.2528655529022217
running experiment 1/3 - Does large hyperparameter space improve reconstruction accuracy over simple
[I 2024-08-26 17:30:22,392] A new study created in memory with name: no-name-d7d6bb7a-15f4-47ed-87fe-7bf618af2c0b
running
running
running
running
running
running
running
running
running
running
running
running
running
running
running
running
[I 2024-08-26 17:30:23,251] Trial 0 finished with value: 0.29926411273580744 and parameters: {'model_name': 'SimpleImputer', 'strategy': 'constant'}. Best is trial 0 with value: 0.29926411273580744.
running
[I 2024-08-26 17:30:23,412] Trial 4 finished with value: 0.2992732538592092 and parameters: {'model_name': 'SimpleImputer', 'strategy': 'mean'}. Best is trial 0 with value: 0.29926411273580744.
[I 2024-08-26 17:30:23,522] Trial 8 finished with value: 0.29926411273580744 and parameters: {'model_name': 'SimpleImputer', 'strategy': 'constant'}. Best is trial 0 with value: 0.29926411273580744.
running
running
[I 2024-08-26 17:30:23,668] Trial 3 finished with value: 0.29926411273580744 and parameters: {'model_name': 'SimpleImputer', 'strategy': 'constant'}. Best is trial 0 with value: 0.29926411273580744.
[I 2024-08-26 17:30:23,777] Trial 15 finished with value: 0.29926411273580744 and parameters: {'model_name': 'SimpleImputer', 'strategy': 'constant'}. Best is trial 0 with value: 0.29926411273580744.
running
running
[I 2024-08-26 17:30:23,900] Trial 9 finished with value: 0.29926411273580744 and parameters: {'model_name': 'SimpleImputer', 'strategy': 'constant'}. Best is trial 0 with value: 0.29926411273580744.
running
[I 2024-08-26 17:30:24,036] Trial 14 finished with value: 0.29926411273580744 and parameters: {'model_name': 'SimpleImputer', 'strategy': 'constant'}. Best is trial 0 with value: 0.29926411273580744.
running
[I 2024-08-26 17:30:24,293] Trial 7 finished with value: 0.2992732538592092 and parameters: {'model_name': 'SimpleImputer', 'strategy': 'mean'}. Best is trial 0 with value: 0.29926411273580744.
running
[I 2024-08-26 17:30:24,479] Trial 1 finished with value: 0.29926411273580744 and parameters: {'model_name': 'SimpleImputer', 'strategy': 'median'}. Best is trial 0 with value: 0.29926411273580744.
running
[I 2024-08-26 17:30:24,745] Trial 5 finished with value: 0.2992732538592092 and parameters: {'model_name': 'SimpleImputer', 'strategy': 'mean'}. Best is trial 0 with value: 0.29926411273580744.
running
[I 2024-08-26 17:30:25,071] Trial 10 finished with value: 0.29926411273580744 and parameters: {'model_name': 'SimpleImputer', 'strategy': 'median'}. Best is trial 0 with value: 0.29926411273580744.
[I 2024-08-26 17:30:25,175] Trial 2 finished with value: 0.29926411273580744 and parameters: {'model_name': 'SimpleImputer', 'strategy': 'median'}. Best is trial 0 with value: 0.29926411273580744.
running
running
[I 2024-08-26 17:30:25,331] Trial 13 finished with value: 0.29926411273580744 and parameters: {'model_name': 'SimpleImputer', 'strategy': 'median'}. Best is trial 0 with value: 0.29926411273580744.
running
[I 2024-08-26 17:30:25,501] Trial 18 finished with value: 0.29926411273580744 and parameters: {'model_name': 'SimpleImputer', 'strategy': 'constant'}. Best is trial 0 with value: 0.29926411273580744.
[I 2024-08-26 17:30:25,619] Trial 12 finished with value: 0.29926411273580744 and parameters: {'model_name': 'SimpleImputer', 'strategy': 'median'}. Best is trial 0 with value: 0.29926411273580744.
running
running
[I 2024-08-26 17:30:25,818] Trial 6 finished with value: 0.29926411273580744 and parameters: {'model_name': 'SimpleImputer', 'strategy': 'median'}. Best is trial 0 with value: 0.29926411273580744.
running
[I 2024-08-26 17:30:25,925] Trial 11 finished with value: 0.29926411273580744 and parameters: {'model_name': 'SimpleImputer', 'strategy': 'median'}. Best is trial 0 with value: 0.29926411273580744.
running
[I 2024-08-26 17:30:26,317] Trial 20 finished with value: 0.2992732538592092 and parameters: {'model_name': 'SimpleImputer', 'strategy': 'mean'}. Best is trial 0 with value: 0.29926411273580744.
running
[I 2024-08-26 17:30:26,727] Trial 21 finished with value: 0.2992732538592092 and parameters: {'model_name': 'SimpleImputer', 'strategy': 'mean'}. Best is trial 0 with value: 0.29926411273580744.
running
[I 2024-08-26 17:30:26,876] Trial 23 finished with value: 0.2992732538592092 and parameters: {'model_name': 'SimpleImputer', 'strategy': 'mean'}. Best is trial 0 with value: 0.29926411273580744.
running
[I 2024-08-26 17:30:27,219] Trial 22 finished with value: 0.29926411273580744 and parameters: {'model_name': 'SimpleImputer', 'strategy': 'median'}. Best is trial 0 with value: 0.29926411273580744.
running
[I 2024-08-26 17:30:27,684] Trial 17 finished with value: 0.29926411273580744 and parameters: {'model_name': 'SimpleImputer', 'strategy': 'median'}. Best is trial 0 with value: 0.29926411273580744.
running
[I 2024-08-26 17:30:28,104] Trial 16 finished with value: 0.3194219506777331 and parameters: {'model_name': 'SimpleImputer', 'strategy': 'most_frequent'}. Best is trial 0 with value: 0.29926411273580744.
running
[I 2024-08-26 17:30:28,570] Trial 24 finished with value: 0.3194219506777331 and parameters: {'model_name': 'SimpleImputer', 'strategy': 'most_frequent'}. Best is trial 0 with value: 0.29926411273580744.
running
[I 2024-08-26 17:30:28,789] Trial 19 finished with value: 0.3194219506777331 and parameters: {'model_name': 'SimpleImputer', 'strategy': 'most_frequent'}. Best is trial 0 with value: 0.29926411273580744.
running
[I 2024-08-26 17:30:29,444] Trial 25 finished with value: 0.3194219506777331 and parameters: {'model_name': 'SimpleImputer', 'strategy': 'most_frequent'}. Best is trial 0 with value: 0.29926411273580744.
running
[I 2024-08-26 17:30:29,719] Trial 30 finished with value: 0.3194219506777331 and parameters: {'model_name': 'SimpleImputer', 'strategy': 'most_frequent'}. Best is trial 0 with value: 0.29926411273580744.
running
[I 2024-08-26 17:30:29,854] Trial 27 finished with value: 0.3194219506777331 and parameters: {'model_name': 'SimpleImputer', 'strategy': 'most_frequent'}. Best is trial 0 with value: 0.29926411273580744.
running
[I 2024-08-26 17:30:30,102] Trial 26 finished with value: 0.3194219506777331 and parameters: {'model_name': 'SimpleImputer', 'strategy': 'most_frequent'}. Best is trial 0 with value: 0.29926411273580744.
running
[I 2024-08-26 17:30:30,340] Trial 32 finished with value: 0.3194219506777331 and parameters: {'model_name': 'SimpleImputer', 'strategy': 'most_frequent'}. Best is trial 0 with value: 0.29926411273580744.
[I 2024-08-26 17:30:30,446] Trial 28 finished with value: 0.3194219506777331 and parameters: {'model_name': 'SimpleImputer', 'strategy': 'most_frequent'}. Best is trial 0 with value: 0.29926411273580744.
running
running
[I 2024-08-26 17:30:30,666] Trial 29 finished with value: 0.3194219506777331 and parameters: {'model_name': 'SimpleImputer', 'strategy': 'most_frequent'}. Best is trial 0 with value: 0.29926411273580744.
running
[I 2024-08-26 17:30:30,909] Trial 31 finished with value: 0.3194219506777331 and parameters: {'model_name': 'SimpleImputer', 'strategy': 'most_frequent'}. Best is trial 0 with value: 0.29926411273580744.
running
[I 2024-08-26 17:30:31,040] Trial 35 finished with value: 0.3194219506777331 and parameters: {'model_name': 'SimpleImputer', 'strategy': 'most_frequent'}. Best is trial 0 with value: 0.29926411273580744.
[I 2024-08-26 17:30:31,140] Trial 34 finished with value: 0.3194219506777331 and parameters: {'model_name': 'SimpleImputer', 'strategy': 'most_frequent'}. Best is trial 0 with value: 0.29926411273580744.
running
running
[I 2024-08-26 17:30:31,362] Trial 33 finished with value: 0.3194219506777331 and parameters: {'model_name': 'SimpleImputer', 'strategy': 'most_frequent'}. Best is trial 0 with value: 0.29926411273580744.
running
[I 2024-08-26 17:30:31,604] Trial 36 finished with value: 0.3194219506777331 and parameters: {'model_name': 'SimpleImputer', 'strategy': 'most_frequent'}. Best is trial 0 with value: 0.29926411273580744.
running
[I 2024-08-26 17:30:32,006] Trial 39 finished with value: 0.29926411273580744 and parameters: {'model_name': 'SimpleImputer', 'strategy': 'median'}. Best is trial 0 with value: 0.29926411273580744.
running
[I 2024-08-26 17:30:32,160] Trial 46 finished with value: 0.29926411273580744 and parameters: {'model_name': 'SimpleImputer', 'strategy': 'constant'}. Best is trial 0 with value: 0.29926411273580744.
running
[I 2024-08-26 17:30:32,428] Trial 45 finished with value: 0.29926411273580744 and parameters: {'model_name': 'SimpleImputer', 'strategy': 'constant'}. Best is trial 0 with value: 0.29926411273580744.
running
[I 2024-08-26 17:30:32,632] Trial 47 finished with value: 0.29926411273580744 and parameters: {'model_name': 'SimpleImputer', 'strategy': 'constant'}. Best is trial 0 with value: 0.29926411273580744.
[I 2024-08-26 17:30:32,733] Trial 40 finished with value: 0.29926411273580744 and parameters: {'model_name': 'SimpleImputer', 'strategy': 'median'}. Best is trial 0 with value: 0.29926411273580744.
running
running
[I 2024-08-26 17:30:32,859] Trial 50 finished with value: 0.29926411273580744 and parameters: {'model_name': 'SimpleImputer', 'strategy': 'constant'}. Best is trial 0 with value: 0.29926411273580744.
[I 2024-08-26 17:30:32,961] Trial 49 finished with value: 0.29926411273580744 and parameters: {'model_name': 'SimpleImputer', 'strategy': 'constant'}. Best is trial 0 with value: 0.29926411273580744.
running
running
[I 2024-08-26 17:30:33,185] Trial 38 finished with value: 0.3194219506777331 and parameters: {'model_name': 'SimpleImputer', 'strategy': 'most_frequent'}. Best is trial 0 with value: 0.29926411273580744.
running
[I 2024-08-26 17:30:33,307] Trial 37 finished with value: 0.3194219506777331 and parameters: {'model_name': 'SimpleImputer', 'strategy': 'most_frequent'}. Best is trial 0 with value: 0.29926411273580744.
[I 2024-08-26 17:30:33,413] Trial 42 finished with value: 0.29926411273580744 and parameters: {'model_name': 'SimpleImputer', 'strategy': 'median'}. Best is trial 0 with value: 0.29926411273580744.
running
[I 2024-08-26 17:30:33,519] Trial 41 finished with value: 0.29926411273580744 and parameters: {'model_name': 'SimpleImputer', 'strategy': 'median'}. Best is trial 0 with value: 0.29926411273580744.
running
running
[I 2024-08-26 17:30:33,658] Trial 51 finished with value: 0.29926411273580744 and parameters: {'model_name': 'SimpleImputer', 'strategy': 'constant'}. Best is trial 0 with value: 0.29926411273580744.
[I 2024-08-26 17:30:33,771] Trial 48 finished with value: 0.29926411273580744 and parameters: {'model_name': 'SimpleImputer', 'strategy': 'constant'}. Best is trial 0 with value: 0.29926411273580744.
running
running
[I 2024-08-26 17:30:33,992] Trial 52 finished with value: 0.29926411273580744 and parameters: {'model_name': 'SimpleImputer', 'strategy': 'constant'}. Best is trial 0 with value: 0.29926411273580744.
running
[I 2024-08-26 17:30:34,225] Trial 53 finished with value: 0.29926411273580744 and parameters: {'model_name': 'SimpleImputer', 'strategy': 'constant'}. Best is trial 0 with value: 0.29926411273580744.
running
[I 2024-08-26 17:30:34,372] Trial 44 finished with value: 0.29926411273580744 and parameters: {'model_name': 'SimpleImputer', 'strategy': 'median'}. Best is trial 0 with value: 0.29926411273580744.
running
[I 2024-08-26 17:30:34,502] Trial 54 finished with value: 0.29926411273580744 and parameters: {'model_name': 'SimpleImputer', 'strategy': 'constant'}. Best is trial 0 with value: 0.29926411273580744.
running
[I 2024-08-26 17:30:34,848] Trial 43 finished with value: 0.29926411273580744 and parameters: {'model_name': 'SimpleImputer', 'strategy': 'median'}. Best is trial 0 with value: 0.29926411273580744.
running
[I 2024-08-26 17:30:35,027] Trial 55 finished with value: 0.29926411273580744 and parameters: {'model_name': 'SimpleImputer', 'strategy': 'constant'}. Best is trial 0 with value: 0.29926411273580744.
running
[I 2024-08-26 17:30:35,768] Trial 56 finished with value: 0.29926411273580744 and parameters: {'model_name': 'SimpleImputer', 'strategy': 'median'}. Best is trial 0 with value: 0.29926411273580744.
running
[I 2024-08-26 17:30:35,955] Trial 58 finished with value: 0.29926411273580744 and parameters: {'model_name': 'SimpleImputer', 'strategy': 'median'}. Best is trial 0 with value: 0.29926411273580744.
[I 2024-08-26 17:30:36,066] Trial 62 finished with value: 0.29926411273580744 and parameters: {'model_name': 'SimpleImputer', 'strategy': 'median'}. Best is trial 0 with value: 0.29926411273580744.
running
[I 2024-08-26 17:30:36,173] Trial 57 finished with value: 0.29926411273580744 and parameters: {'model_name': 'SimpleImputer', 'strategy': 'median'}. Best is trial 0 with value: 0.29926411273580744.
[I 2024-08-26 17:30:36,277] Trial 59 finished with value: 0.29926411273580744 and parameters: {'model_name': 'SimpleImputer', 'strategy': 'median'}. Best is trial 0 with value: 0.29926411273580744.
running
running
running
[I 2024-08-26 17:30:36,478] Trial 64 finished with value: 0.29926411273580744 and parameters: {'model_name': 'SimpleImputer', 'strategy': 'median'}. Best is trial 0 with value: 0.29926411273580744.
[I 2024-08-26 17:30:36,584] Trial 61 finished with value: 0.29926411273580744 and parameters: {'model_name': 'SimpleImputer', 'strategy': 'median'}. Best is trial 0 with value: 0.29926411273580744.
running
running
[I 2024-08-26 17:30:36,718] Trial 60 finished with value: 0.29926411273580744 and parameters: {'model_name': 'SimpleImputer', 'strategy': 'median'}. Best is trial 0 with value: 0.29926411273580744.
running
[I 2024-08-26 17:30:36,881] Trial 67 finished with value: 0.29926411273580744 and parameters: {'model_name': 'SimpleImputer', 'strategy': 'median'}. Best is trial 0 with value: 0.29926411273580744.
[I 2024-08-26 17:30:36,979] Trial 68 finished with value: 0.29926411273580744 and parameters: {'model_name': 'SimpleImputer', 'strategy': 'median'}. Best is trial 0 with value: 0.29926411273580744.
running
running
[I 2024-08-26 17:30:37,135] Trial 65 finished with value: 0.29926411273580744 and parameters: {'model_name': 'SimpleImputer', 'strategy': 'median'}. Best is trial 0 with value: 0.29926411273580744.
running
[I 2024-08-26 17:30:37,262] Trial 66 finished with value: 0.29926411273580744 and parameters: {'model_name': 'SimpleImputer', 'strategy': 'median'}. Best is trial 0 with value: 0.29926411273580744.
running
[I 2024-08-26 17:30:37,553] Trial 63 finished with value: 0.29926411273580744 and parameters: {'model_name': 'SimpleImputer', 'strategy': 'median'}. Best is trial 0 with value: 0.29926411273580744.
running
[I 2024-08-26 17:30:37,797] Trial 69 finished with value: 0.29926411273580744 and parameters: {'model_name': 'SimpleImputer', 'strategy': 'median'}. Best is trial 0 with value: 0.29926411273580744.
running
[I 2024-08-26 17:30:38,086] Trial 71 finished with value: 0.29926411273580744 and parameters: {'model_name': 'SimpleImputer', 'strategy': 'median'}. Best is trial 0 with value: 0.29926411273580744.
[I 2024-08-26 17:30:38,187] Trial 70 finished with value: 0.29926411273580744 and parameters: {'model_name': 'SimpleImputer', 'strategy': 'median'}. Best is trial 0 with value: 0.29926411273580744.
running
running
[I 2024-08-26 17:30:38,498] Trial 73 finished with value: 0.2992732538592092 and parameters: {'model_name': 'SimpleImputer', 'strategy': 'mean'}. Best is trial 0 with value: 0.29926411273580744.
running
[I 2024-08-26 17:30:38,640] Trial 75 finished with value: 0.2992732538592092 and parameters: {'model_name': 'SimpleImputer', 'strategy': 'mean'}. Best is trial 0 with value: 0.29926411273580744.
running
[I 2024-08-26 17:30:38,840] Trial 76 finished with value: 0.2992732538592092 and parameters: {'model_name': 'SimpleImputer', 'strategy': 'mean'}. Best is trial 0 with value: 0.29926411273580744.
running
[I 2024-08-26 17:30:39,006] Trial 77 finished with value: 0.2992732538592092 and parameters: {'model_name': 'SimpleImputer', 'strategy': 'mean'}. Best is trial 0 with value: 0.29926411273580744.
[I 2024-08-26 17:30:39,112] Trial 82 finished with value: 0.2992732538592092 and parameters: {'model_name': 'SimpleImputer', 'strategy': 'mean'}. Best is trial 0 with value: 0.29926411273580744.
running
running
[I 2024-08-26 17:30:39,264] Trial 74 finished with value: 0.2992732538592092 and parameters: {'model_name': 'SimpleImputer', 'strategy': 'mean'}. Best is trial 0 with value: 0.29926411273580744.
running
[I 2024-08-26 17:30:39,389] Trial 79 finished with value: 0.2992732538592092 and parameters: {'model_name': 'SimpleImputer', 'strategy': 'mean'}. Best is trial 0 with value: 0.29926411273580744.
running
[I 2024-08-26 17:30:39,504] Trial 81 finished with value: 0.2992732538592092 and parameters: {'model_name': 'SimpleImputer', 'strategy': 'mean'}. Best is trial 0 with value: 0.29926411273580744.
running
[I 2024-08-26 17:30:39,674] Trial 80 finished with value: 0.2992732538592092 and parameters: {'model_name': 'SimpleImputer', 'strategy': 'mean'}. Best is trial 0 with value: 0.29926411273580744.
running
[I 2024-08-26 17:30:39,823] Trial 78 finished with value: 0.2992732538592092 and parameters: {'model_name': 'SimpleImputer', 'strategy': 'mean'}. Best is trial 0 with value: 0.29926411273580744.
running
[I 2024-08-26 17:30:40,117] Trial 83 finished with value: 0.2992732538592092 and parameters: {'model_name': 'SimpleImputer', 'strategy': 'mean'}. Best is trial 0 with value: 0.29926411273580744.
running
[I 2024-08-26 17:30:40,291] Trial 84 finished with value: 0.2992732538592092 and parameters: {'model_name': 'SimpleImputer', 'strategy': 'mean'}. Best is trial 0 with value: 0.29926411273580744.
running
[I 2024-08-26 17:30:40,404] Trial 87 finished with value: 0.29926411273580744 and parameters: {'model_name': 'SimpleImputer', 'strategy': 'constant'}. Best is trial 0 with value: 0.29926411273580744.
running
[I 2024-08-26 17:30:40,651] Trial 72 finished with value: 0.29926411273580744 and parameters: {'model_name': 'SimpleImputer', 'strategy': 'median'}. Best is trial 0 with value: 0.29926411273580744.
running
[I 2024-08-26 17:30:40,778] Trial 89 finished with value: 0.29926411273580744 and parameters: {'model_name': 'SimpleImputer', 'strategy': 'constant'}. Best is trial 0 with value: 0.29926411273580744.
[I 2024-08-26 17:30:40,891] Trial 85 finished with value: 0.2992732538592092 and parameters: {'model_name': 'SimpleImputer', 'strategy': 'mean'}. Best is trial 0 with value: 0.29926411273580744.
running
running
[I 2024-08-26 17:30:41,096] Trial 88 finished with value: 0.29926411273580744 and parameters: {'model_name': 'SimpleImputer', 'strategy': 'constant'}. Best is trial 0 with value: 0.29926411273580744.
running
[I 2024-08-26 17:30:41,290] Trial 93 finished with value: 0.29926411273580744 and parameters: {'model_name': 'SimpleImputer', 'strategy': 'constant'}. Best is trial 0 with value: 0.29926411273580744.
running
[I 2024-08-26 17:30:41,508] Trial 90 finished with value: 0.29926411273580744 and parameters: {'model_name': 'SimpleImputer', 'strategy': 'constant'}. Best is trial 0 with value: 0.29926411273580744.
running
[I 2024-08-26 17:30:41,624] Trial 91 finished with value: 0.29926411273580744 and parameters: {'model_name': 'SimpleImputer', 'strategy': 'constant'}. Best is trial 0 with value: 0.29926411273580744.
running
[I 2024-08-26 17:30:41,724] Trial 92 finished with value: 0.29926411273580744 and parameters: {'model_name': 'SimpleImputer', 'strategy': 'constant'}. Best is trial 0 with value: 0.29926411273580744.
[I 2024-08-26 17:30:41,826] Trial 86 finished with value: 0.2992732538592092 and parameters: {'model_name': 'SimpleImputer', 'strategy': 'mean'}. Best is trial 0 with value: 0.29926411273580744.
running
running
[I 2024-08-26 17:30:42,010] Trial 94 finished with value: 0.29926411273580744 and parameters: {'model_name': 'SimpleImputer', 'strategy': 'constant'}. Best is trial 0 with value: 0.29926411273580744.
running
[I 2024-08-26 17:30:42,123] Trial 96 finished with value: 0.29926411273580744 and parameters: {'model_name': 'SimpleImputer', 'strategy': 'constant'}. Best is trial 0 with value: 0.29926411273580744.
running
[I 2024-08-26 17:30:42,357] Trial 95 finished with value: 0.29926411273580744 and parameters: {'model_name': 'SimpleImputer', 'strategy': 'constant'}. Best is trial 0 with value: 0.29926411273580744.
running
[I 2024-08-26 17:30:42,489] Trial 97 finished with value: 0.29926411273580744 and parameters: {'model_name': 'SimpleImputer', 'strategy': 'constant'}. Best is trial 0 with value: 0.29926411273580744.
running
[I 2024-08-26 17:30:42,642] Trial 98 finished with value: 0.29926411273580744 and parameters: {'model_name': 'SimpleImputer', 'strategy': 'constant'}. Best is trial 0 with value: 0.29926411273580744.
running
[I 2024-08-26 17:30:42,799] Trial 99 finished with value: 0.29926411273580744 and parameters: {'model_name': 'SimpleImputer', 'strategy': 'constant'}. Best is trial 0 with value: 0.29926411273580744.
running
[I 2024-08-26 17:30:42,948] Trial 100 finished with value: 0.29926411273580744 and parameters: {'model_name': 'SimpleImputer', 'strategy': 'constant'}. Best is trial 0 with value: 0.29926411273580744.
running
[I 2024-08-26 17:30:43,234] Trial 101 finished with value: 0.29926411273580744 and parameters: {'model_name': 'SimpleImputer', 'strategy': 'constant'}. Best is trial 0 with value: 0.29926411273580744.
running
[I 2024-08-26 17:30:43,363] Trial 102 finished with value: 0.29926411273580744 and parameters: {'model_name': 'SimpleImputer', 'strategy': 'constant'}. Best is trial 0 with value: 0.29926411273580744.
running
