[I 2024-10-16 00:24:37,715] Trial 103 finished with value: 0.21080759083096906 and parameters: {'model_name': 'SimpleImputer', 'strategy': 'median'}. Best is trial 2 with value: 0.21080759083096906.
running
[I 2024-10-16 00:24:37,892] Trial 102 finished with value: 0.21080759083096906 and parameters: {'model_name': 'SimpleImputer', 'strategy': 'median'}. Best is trial 2 with value: 0.21080759083096906.
running
[I 2024-10-16 00:24:38,069] Trial 104 finished with value: 0.21080759083096906 and parameters: {'model_name': 'SimpleImputer', 'strategy': 'median'}. Best is trial 2 with value: 0.21080759083096906.
running
[I 2024-10-16 00:24:38,189] Trial 105 finished with value: 0.21080759083096906 and parameters: {'model_name': 'SimpleImputer', 'strategy': 'median'}. Best is trial 2 with value: 0.21080759083096906.
[I 2024-10-16 00:24:38,301] Trial 106 finished with value: 0.21080759083096906 and parameters: {'model_name': 'SimpleImputer', 'strategy': 'median'}. Best is trial 2 with value: 0.21080759083096906.
running
running
[I 2024-10-16 00:24:38,434] Trial 107 finished with value: 0.21080759083096906 and parameters: {'model_name': 'SimpleImputer', 'strategy': 'median'}. Best is trial 2 with value: 0.21080759083096906.
running
[I 2024-10-16 00:24:38,545] Trial 108 finished with value: 0.21080759083096906 and parameters: {'model_name': 'SimpleImputer', 'strategy': 'median'}. Best is trial 2 with value: 0.21080759083096906.
running
[I 2024-10-16 00:24:38,802] Trial 109 finished with value: 0.21080759083096906 and parameters: {'model_name': 'SimpleImputer', 'strategy': 'median'}. Best is trial 2 with value: 0.21080759083096906.
running
[I 2024-10-16 00:24:38,949] Trial 110 finished with value: 0.21080759083096906 and parameters: {'model_name': 'SimpleImputer', 'strategy': 'median'}. Best is trial 2 with value: 0.21080759083096906.
running
[I 2024-10-16 00:24:39,223] Trial 111 finished with value: 0.21080759083096906 and parameters: {'model_name': 'SimpleImputer', 'strategy': 'median'}. Best is trial 2 with value: 0.21080759083096906.
[I 2024-10-16 00:24:39,326] Trial 112 finished with value: 0.21080759083096906 and parameters: {'model_name': 'SimpleImputer', 'strategy': 'median'}. Best is trial 2 with value: 0.21080759083096906.
running
running
[I 2024-10-16 00:24:39,515] Trial 114 finished with value: 0.21080759083096906 and parameters: {'model_name': 'SimpleImputer', 'strategy': 'median'}. Best is trial 2 with value: 0.21080759083096906.
running
[I 2024-10-16 00:24:39,628] Trial 113 finished with value: 0.21080759083096906 and parameters: {'model_name': 'SimpleImputer', 'strategy': 'median'}. Best is trial 2 with value: 0.21080759083096906.
running
[I 2024-10-16 00:24:39,833] Trial 116 finished with value: 0.21080759083096906 and parameters: {'model_name': 'SimpleImputer', 'strategy': 'median'}. Best is trial 2 with value: 0.21080759083096906.
[I 2024-10-16 00:24:39,937] Trial 117 finished with value: 0.21080759083096906 and parameters: {'model_name': 'SimpleImputer', 'strategy': 'median'}. Best is trial 2 with value: 0.21080759083096906.
running
running
[I 2024-10-16 00:24:40,050] Trial 115 finished with value: 0.21080759083096906 and parameters: {'model_name': 'SimpleImputer', 'strategy': 'median'}. Best is trial 2 with value: 0.21080759083096906.
running
[I 2024-10-16 00:24:40,258] Trial 119 finished with value: 0.21080759083096906 and parameters: {'model_name': 'SimpleImputer', 'strategy': 'median'}. Best is trial 2 with value: 0.21080759083096906.
[I 2024-10-16 00:24:40,377] Trial 118 finished with value: 0.21080759083096906 and parameters: {'model_name': 'SimpleImputer', 'strategy': 'median'}. Best is trial 2 with value: 0.21080759083096906.
running
running
[I 2024-10-16 00:24:40,514] Trial 120 finished with value: 0.21080759083096906 and parameters: {'model_name': 'SimpleImputer', 'strategy': 'median'}. Best is trial 2 with value: 0.21080759083096906.
running
[I 2024-10-16 00:24:40,727] Trial 123 finished with value: 0.21080759083096906 and parameters: {'model_name': 'SimpleImputer', 'strategy': 'median'}. Best is trial 2 with value: 0.21080759083096906.
running
[I 2024-10-16 00:24:40,831] Trial 121 finished with value: 0.21080759083096906 and parameters: {'model_name': 'SimpleImputer', 'strategy': 'median'}. Best is trial 2 with value: 0.21080759083096906.
running
[I 2024-10-16 00:24:40,988] Trial 122 finished with value: 0.21080759083096906 and parameters: {'model_name': 'SimpleImputer', 'strategy': 'median'}. Best is trial 2 with value: 0.21080759083096906.
running
[I 2024-10-16 00:24:41,133] Trial 125 finished with value: 0.21080759083096906 and parameters: {'model_name': 'SimpleImputer', 'strategy': 'median'}. Best is trial 2 with value: 0.21080759083096906.
running
[I 2024-10-16 00:24:41,286] Trial 124 finished with value: 0.21080759083096906 and parameters: {'model_name': 'SimpleImputer', 'strategy': 'median'}. Best is trial 2 with value: 0.21080759083096906.
running
[I 2024-10-16 00:24:41,473] Trial 128 finished with value: 0.21080759083096906 and parameters: {'model_name': 'SimpleImputer', 'strategy': 'median'}. Best is trial 2 with value: 0.21080759083096906.
running
[I 2024-10-16 00:24:41,729] Trial 126 finished with value: 0.21080759083096906 and parameters: {'model_name': 'SimpleImputer', 'strategy': 'median'}. Best is trial 2 with value: 0.21080759083096906.
running
[I 2024-10-16 00:24:41,916] Trial 127 finished with value: 0.21080759083096906 and parameters: {'model_name': 'SimpleImputer', 'strategy': 'median'}. Best is trial 2 with value: 0.21080759083096906.
running
[I 2024-10-16 00:24:42,070] Trial 129 finished with value: 0.21080759083096906 and parameters: {'model_name': 'SimpleImputer', 'strategy': 'median'}. Best is trial 2 with value: 0.21080759083096906.
running
[I 2024-10-16 00:24:42,239] Trial 130 finished with value: 0.21080759083096906 and parameters: {'model_name': 'SimpleImputer', 'strategy': 'median'}. Best is trial 2 with value: 0.21080759083096906.
running
[I 2024-10-16 00:24:42,450] Trial 132 finished with value: 0.21080759083096906 and parameters: {'model_name': 'SimpleImputer', 'strategy': 'median'}. Best is trial 2 with value: 0.21080759083096906.
running
[I 2024-10-16 00:24:42,600] Trial 134 finished with value: 0.21080759083096906 and parameters: {'model_name': 'SimpleImputer', 'strategy': 'median'}. Best is trial 2 with value: 0.21080759083096906.
running
[I 2024-10-16 00:24:42,731] Trial 133 finished with value: 0.21080759083096906 and parameters: {'model_name': 'SimpleImputer', 'strategy': 'median'}. Best is trial 2 with value: 0.21080759083096906.
[I 2024-10-16 00:24:42,846] Trial 131 finished with value: 0.21080759083096906 and parameters: {'model_name': 'SimpleImputer', 'strategy': 'median'}. Best is trial 2 with value: 0.21080759083096906.
running
[I 2024-10-16 00:24:42,962] Trial 136 finished with value: 0.21080759083096906 and parameters: {'model_name': 'SimpleImputer', 'strategy': 'median'}. Best is trial 2 with value: 0.21080759083096906.
running
running
[I 2024-10-16 00:24:43,129] Trial 142 finished with value: 0.21080759083096906 and parameters: {'model_name': 'SimpleImputer', 'strategy': 'median'}. Best is trial 2 with value: 0.21080759083096906.
running
[I 2024-10-16 00:24:43,306] Trial 135 finished with value: 0.21080759083096906 and parameters: {'model_name': 'SimpleImputer', 'strategy': 'median'}. Best is trial 2 with value: 0.21080759083096906.
running
[I 2024-10-16 00:24:43,474] Trial 137 finished with value: 0.21080759083096906 and parameters: {'model_name': 'SimpleImputer', 'strategy': 'median'}. Best is trial 2 with value: 0.21080759083096906.
running
[I 2024-10-16 00:24:43,599] Trial 138 finished with value: 0.21080759083096906 and parameters: {'model_name': 'SimpleImputer', 'strategy': 'median'}. Best is trial 2 with value: 0.21080759083096906.
running
[I 2024-10-16 00:24:43,837] Trial 139 finished with value: 0.21080759083096906 and parameters: {'model_name': 'SimpleImputer', 'strategy': 'median'}. Best is trial 2 with value: 0.21080759083096906.
running
[I 2024-10-16 00:24:44,007] Trial 141 finished with value: 0.21080759083096906 and parameters: {'model_name': 'SimpleImputer', 'strategy': 'median'}. Best is trial 2 with value: 0.21080759083096906.
running
[I 2024-10-16 00:24:44,209] Trial 140 finished with value: 0.21080759083096906 and parameters: {'model_name': 'SimpleImputer', 'strategy': 'median'}. Best is trial 2 with value: 0.21080759083096906.
running
[I 2024-10-16 00:24:44,402] Trial 145 finished with value: 0.21080759083096906 and parameters: {'model_name': 'SimpleImputer', 'strategy': 'median'}. Best is trial 2 with value: 0.21080759083096906.
running
[I 2024-10-16 00:24:44,549] Trial 143 finished with value: 0.21080759083096906 and parameters: {'model_name': 'SimpleImputer', 'strategy': 'median'}. Best is trial 2 with value: 0.21080759083096906.
running
[I 2024-10-16 00:24:44,717] Trial 146 finished with value: 0.21080759083096906 and parameters: {'model_name': 'SimpleImputer', 'strategy': 'median'}. Best is trial 2 with value: 0.21080759083096906.
[I 2024-10-16 00:24:44,718] Trial 147 finished with value: 0.21080759083096906 and parameters: {'model_name': 'SimpleImputer', 'strategy': 'median'}. Best is trial 2 with value: 0.21080759083096906.
running
running
[I 2024-10-16 00:24:44,960] Trial 144 finished with value: 0.21080759083096906 and parameters: {'model_name': 'SimpleImputer', 'strategy': 'median'}. Best is trial 2 with value: 0.21080759083096906.
running
[I 2024-10-16 00:24:45,103] Trial 152 finished with value: 0.21080759083096906 and parameters: {'model_name': 'SimpleImputer', 'strategy': 'median'}. Best is trial 2 with value: 0.21080759083096906.
running
[I 2024-10-16 00:24:45,350] Trial 153 finished with value: 0.21080759083096906 and parameters: {'model_name': 'SimpleImputer', 'strategy': 'median'}. Best is trial 2 with value: 0.21080759083096906.
[I 2024-10-16 00:24:45,461] Trial 150 finished with value: 0.21080759083096906 and parameters: {'model_name': 'SimpleImputer', 'strategy': 'median'}. Best is trial 2 with value: 0.21080759083096906.
running
running
[I 2024-10-16 00:24:45,644] Trial 151 finished with value: 0.21080759083096906 and parameters: {'model_name': 'SimpleImputer', 'strategy': 'median'}. Best is trial 2 with value: 0.21080759083096906.
[I 2024-10-16 00:24:45,747] Trial 149 finished with value: 0.21080759083096906 and parameters: {'model_name': 'SimpleImputer', 'strategy': 'median'}. Best is trial 2 with value: 0.21080759083096906.
running
running
[I 2024-10-16 00:24:45,888] Trial 148 finished with value: 0.21080759083096906 and parameters: {'model_name': 'SimpleImputer', 'strategy': 'median'}. Best is trial 2 with value: 0.21080759083096906.
running
[I 2024-10-16 00:24:46,035] Trial 154 finished with value: 0.21080759083096906 and parameters: {'model_name': 'SimpleImputer', 'strategy': 'median'}. Best is trial 2 with value: 0.21080759083096906.
running
[I 2024-10-16 00:24:46,286] Trial 156 finished with value: 0.21080759083096906 and parameters: {'model_name': 'SimpleImputer', 'strategy': 'median'}. Best is trial 2 with value: 0.21080759083096906.
running
[I 2024-10-16 00:24:46,398] Trial 155 finished with value: 0.21080759083096906 and parameters: {'model_name': 'SimpleImputer', 'strategy': 'median'}. Best is trial 2 with value: 0.21080759083096906.
running
[I 2024-10-16 00:24:46,645] Trial 164 finished with value: 0.21080759083096906 and parameters: {'model_name': 'SimpleImputer', 'strategy': 'median'}. Best is trial 2 with value: 0.21080759083096906.
running
[I 2024-10-16 00:24:46,861] Trial 158 finished with value: 0.21080759083096906 and parameters: {'model_name': 'SimpleImputer', 'strategy': 'median'}. Best is trial 2 with value: 0.21080759083096906.
running
[I 2024-10-16 00:24:46,998] Trial 157 finished with value: 0.21080759083096906 and parameters: {'model_name': 'SimpleImputer', 'strategy': 'median'}. Best is trial 2 with value: 0.21080759083096906.
running
[I 2024-10-16 00:24:47,161] Trial 160 finished with value: 0.21080759083096906 and parameters: {'model_name': 'SimpleImputer', 'strategy': 'median'}. Best is trial 2 with value: 0.21080759083096906.
running
[I 2024-10-16 00:24:47,312] Trial 161 finished with value: 0.21080759083096906 and parameters: {'model_name': 'SimpleImputer', 'strategy': 'median'}. Best is trial 2 with value: 0.21080759083096906.
running
[I 2024-10-16 00:24:47,526] Trial 159 finished with value: 0.21080759083096906 and parameters: {'model_name': 'SimpleImputer', 'strategy': 'median'}. Best is trial 2 with value: 0.21080759083096906.
running
[I 2024-10-16 00:24:47,686] Trial 166 finished with value: 0.21080759083096906 and parameters: {'model_name': 'SimpleImputer', 'strategy': 'median'}. Best is trial 2 with value: 0.21080759083096906.
[I 2024-10-16 00:24:47,786] Trial 165 finished with value: 0.21080759083096906 and parameters: {'model_name': 'SimpleImputer', 'strategy': 'median'}. Best is trial 2 with value: 0.21080759083096906.
running
running
[I 2024-10-16 00:24:47,889] Trial 162 finished with value: 0.21080759083096906 and parameters: {'model_name': 'SimpleImputer', 'strategy': 'median'}. Best is trial 2 with value: 0.21080759083096906.
running
[I 2024-10-16 00:24:48,127] Trial 163 finished with value: 0.21080759083096906 and parameters: {'model_name': 'SimpleImputer', 'strategy': 'median'}. Best is trial 2 with value: 0.21080759083096906.
running
[I 2024-10-16 00:24:48,297] Trial 169 finished with value: 0.21080759083096906 and parameters: {'model_name': 'SimpleImputer', 'strategy': 'median'}. Best is trial 2 with value: 0.21080759083096906.
running
[I 2024-10-16 00:24:48,465] Trial 173 finished with value: 0.21080759083096906 and parameters: {'model_name': 'SimpleImputer', 'strategy': 'median'}. Best is trial 2 with value: 0.21080759083096906.
[I 2024-10-16 00:24:48,656] Trial 168 finished with value: 0.21080759083096906 and parameters: {'model_name': 'SimpleImputer', 'strategy': 'median'}. Best is trial 2 with value: 0.21080759083096906.
running
running
[I 2024-10-16 00:24:48,837] Trial 167 finished with value: 0.21080759083096906 and parameters: {'model_name': 'SimpleImputer', 'strategy': 'median'}. Best is trial 2 with value: 0.21080759083096906.
running
[I 2024-10-16 00:24:49,016] Trial 170 finished with value: 0.21080759083096906 and parameters: {'model_name': 'SimpleImputer', 'strategy': 'median'}. Best is trial 2 with value: 0.21080759083096906.
[I 2024-10-16 00:24:49,130] Trial 174 finished with value: 0.21080759083096906 and parameters: {'model_name': 'SimpleImputer', 'strategy': 'median'}. Best is trial 2 with value: 0.21080759083096906.
[I 2024-10-16 00:24:49,237] Trial 171 finished with value: 0.21080759083096906 and parameters: {'model_name': 'SimpleImputer', 'strategy': 'median'}. Best is trial 2 with value: 0.21080759083096906.
running
running
running
[I 2024-10-16 00:24:49,506] Trial 181 finished with value: 0.4456924911163494 and parameters: {'model_name': 'SimpleImputer', 'strategy': 'constant'}. Best is trial 2 with value: 0.21080759083096906.
[I 2024-10-16 00:24:49,616] Trial 172 finished with value: 0.21080759083096906 and parameters: {'model_name': 'SimpleImputer', 'strategy': 'median'}. Best is trial 2 with value: 0.21080759083096906.
running
running
[I 2024-10-16 00:24:49,814] Trial 177 finished with value: 0.21080759083096906 and parameters: {'model_name': 'SimpleImputer', 'strategy': 'median'}. Best is trial 2 with value: 0.21080759083096906.
running
[I 2024-10-16 00:24:50,020] Trial 185 finished with value: 0.4456924911163494 and parameters: {'model_name': 'SimpleImputer', 'strategy': 'constant'}. Best is trial 2 with value: 0.21080759083096906.
running
[I 2024-10-16 00:24:50,144] Trial 176 finished with value: 0.21080759083096906 and parameters: {'model_name': 'SimpleImputer', 'strategy': 'median'}. Best is trial 2 with value: 0.21080759083096906.
running
[I 2024-10-16 00:24:50,264] Trial 175 finished with value: 0.21080759083096906 and parameters: {'model_name': 'SimpleImputer', 'strategy': 'median'}. Best is trial 2 with value: 0.21080759083096906.
running
[I 2024-10-16 00:24:50,381] Trial 184 finished with value: 0.4456924911163494 and parameters: {'model_name': 'SimpleImputer', 'strategy': 'constant'}. Best is trial 2 with value: 0.21080759083096906.
running
[I 2024-10-16 00:24:50,540] Trial 178 finished with value: 0.21080759083096906 and parameters: {'model_name': 'SimpleImputer', 'strategy': 'median'}. Best is trial 2 with value: 0.21080759083096906.
running
[I 2024-10-16 00:24:50,856] Trial 179 finished with value: 0.21080759083096906 and parameters: {'model_name': 'SimpleImputer', 'strategy': 'median'}. Best is trial 2 with value: 0.21080759083096906.
running
[I 2024-10-16 00:24:50,993] Trial 188 finished with value: 0.4456924911163494 and parameters: {'model_name': 'SimpleImputer', 'strategy': 'constant'}. Best is trial 2 with value: 0.21080759083096906.
running
[I 2024-10-16 00:24:51,141] Trial 186 finished with value: 0.4456924911163494 and parameters: {'model_name': 'SimpleImputer', 'strategy': 'constant'}. Best is trial 2 with value: 0.21080759083096906.
[I 2024-10-16 00:24:51,251] Trial 183 finished with value: 0.21080759083096906 and parameters: {'model_name': 'SimpleImputer', 'strategy': 'median'}. Best is trial 2 with value: 0.21080759083096906.
[I 2024-10-16 00:24:51,348] Trial 180 finished with value: 0.21080759083096906 and parameters: {'model_name': 'SimpleImputer', 'strategy': 'median'}. Best is trial 2 with value: 0.21080759083096906.
[I 2024-10-16 00:24:51,460] Trial 187 finished with value: 0.4456924911163494 and parameters: {'model_name': 'SimpleImputer', 'strategy': 'constant'}. Best is trial 2 with value: 0.21080759083096906.
[I 2024-10-16 00:24:51,579] Trial 182 finished with value: 0.21080759083096906 and parameters: {'model_name': 'SimpleImputer', 'strategy': 'median'}. Best is trial 2 with value: 0.21080759083096906.
[I 2024-10-16 00:24:51,718] Trial 189 finished with value: 0.4456924911163494 and parameters: {'model_name': 'SimpleImputer', 'strategy': 'constant'}. Best is trial 2 with value: 0.21080759083096906.
[I 2024-10-16 00:24:52,151] Trial 192 finished with value: 0.21080759083096906 and parameters: {'model_name': 'SimpleImputer', 'strategy': 'median'}. Best is trial 2 with value: 0.21080759083096906.
[I 2024-10-16 00:24:52,260] Trial 193 finished with value: 0.21080759083096906 and parameters: {'model_name': 'SimpleImputer', 'strategy': 'median'}. Best is trial 2 with value: 0.21080759083096906.
[I 2024-10-16 00:24:52,470] Trial 196 finished with value: 0.21080759083096906 and parameters: {'model_name': 'SimpleImputer', 'strategy': 'median'}. Best is trial 2 with value: 0.21080759083096906.
[I 2024-10-16 00:24:52,586] Trial 191 finished with value: 0.38969972723503693 and parameters: {'model_name': 'SimpleImputer', 'strategy': 'most_frequent'}. Best is trial 2 with value: 0.21080759083096906.
[I 2024-10-16 00:24:52,730] Trial 190 finished with value: 0.38969972723503693 and parameters: {'model_name': 'SimpleImputer', 'strategy': 'most_frequent'}. Best is trial 2 with value: 0.21080759083096906.
[I 2024-10-16 00:24:52,837] Trial 194 finished with value: 0.38969972723503693 and parameters: {'model_name': 'SimpleImputer', 'strategy': 'most_frequent'}. Best is trial 2 with value: 0.21080759083096906.
[I 2024-10-16 00:24:52,936] Trial 197 finished with value: 0.38969972723503693 and parameters: {'model_name': 'SimpleImputer', 'strategy': 'most_frequent'}. Best is trial 2 with value: 0.21080759083096906.
[I 2024-10-16 00:24:53,039] Trial 195 finished with value: 0.38969972723503693 and parameters: {'model_name': 'SimpleImputer', 'strategy': 'most_frequent'}. Best is trial 2 with value: 0.21080759083096906.
[I 2024-10-16 00:24:53,161] Trial 198 finished with value: 0.38969972723503693 and parameters: {'model_name': 'SimpleImputer', 'strategy': 'most_frequent'}. Best is trial 2 with value: 0.21080759083096906.
