[I 2024-11-21 19:33:40,721] Trial 155 finished with value: 0.05233033497931779 and parameters: {'model_name': 'IterativeImputer', 'estimator': 'RFR', 'initial_strategy': 'mean', 'n_nearest_features': 4, 'imputation_order': 'arabic'}. Best is trial 129 with value: 0.05187520716833951.
running
[I 2024-11-21 19:34:49,576] Trial 156 finished with value: 0.05319340632337992 and parameters: {'model_name': 'IterativeImputer', 'estimator': 'RFR', 'initial_strategy': 'mean', 'n_nearest_features': 4, 'imputation_order': 'arabic'}. Best is trial 129 with value: 0.05187520716833951.
running
[I 2024-11-21 19:36:15,297] Trial 158 finished with value: 0.053613179345671315 and parameters: {'model_name': 'IterativeImputer', 'estimator': 'RFR', 'initial_strategy': 'mean', 'n_nearest_features': 4, 'imputation_order': 'arabic'}. Best is trial 129 with value: 0.05187520716833951.
running
[I 2024-11-21 19:36:15,910] Trial 157 finished with value: 0.05285621097245017 and parameters: {'model_name': 'IterativeImputer', 'estimator': 'RFR', 'initial_strategy': 'mean', 'n_nearest_features': 4, 'imputation_order': 'arabic'}. Best is trial 129 with value: 0.05187520716833951.
running
[I 2024-11-21 19:40:55,836] Trial 159 finished with value: 0.05235596230794846 and parameters: {'model_name': 'IterativeImputer', 'estimator': 'RFR', 'initial_strategy': 'mean', 'n_nearest_features': 4, 'imputation_order': 'arabic'}. Best is trial 129 with value: 0.05187520716833951.
running
[I 2024-11-21 19:41:24,254] Trial 160 finished with value: 0.05275242378313207 and parameters: {'model_name': 'IterativeImputer', 'estimator': 'RFR', 'initial_strategy': 'mean', 'n_nearest_features': 4, 'imputation_order': 'arabic'}. Best is trial 129 with value: 0.05187520716833951.
running
[I 2024-11-21 19:42:34,734] Trial 161 finished with value: 0.053811639722948876 and parameters: {'model_name': 'IterativeImputer', 'estimator': 'RFR', 'initial_strategy': 'mean', 'n_nearest_features': 4, 'imputation_order': 'arabic'}. Best is trial 129 with value: 0.05187520716833951.
running
[I 2024-11-21 19:44:53,138] Trial 163 finished with value: 0.0527569489613812 and parameters: {'model_name': 'IterativeImputer', 'estimator': 'RFR', 'initial_strategy': 'mean', 'n_nearest_features': 4, 'imputation_order': 'arabic'}. Best is trial 129 with value: 0.05187520716833951.
running
[I 2024-11-21 19:44:57,293] Trial 172 finished with value: 0.07088140610704731 and parameters: {'model_name': 'KNNImputer', 'n_neighbors': 3119, 'weights': 'distance'}. Best is trial 129 with value: 0.05187520716833951.
running
[I 2024-11-21 19:45:07,952] Trial 173 finished with value: 0.06199125274360686 and parameters: {'model_name': 'IterativeImputer', 'estimator': 'Ridge', 'initial_strategy': 'mean', 'n_nearest_features': 4, 'imputation_order': 'arabic'}. Best is trial 129 with value: 0.05187520716833951.
running
[I 2024-11-21 19:47:43,136] Trial 165 finished with value: 0.052432399171200086 and parameters: {'model_name': 'IterativeImputer', 'estimator': 'RFR', 'initial_strategy': 'mean', 'n_nearest_features': 4, 'imputation_order': 'arabic'}. Best is trial 129 with value: 0.05187520716833951.
running
[I 2024-11-21 19:47:53,379] Trial 164 finished with value: 0.05275922309798925 and parameters: {'model_name': 'IterativeImputer', 'estimator': 'RFR', 'initial_strategy': 'mean', 'n_nearest_features': 4, 'imputation_order': 'arabic'}. Best is trial 129 with value: 0.05187520716833951.
running
[I 2024-11-21 19:49:19,448] Trial 166 finished with value: 0.05301930549951535 and parameters: {'model_name': 'IterativeImputer', 'estimator': 'RFR', 'initial_strategy': 'mean', 'n_nearest_features': 4, 'imputation_order': 'arabic'}. Best is trial 129 with value: 0.05187520716833951.
running
[I 2024-11-21 19:49:50,972] Trial 168 finished with value: 0.05277100055615643 and parameters: {'model_name': 'IterativeImputer', 'estimator': 'RFR', 'initial_strategy': 'mean', 'n_nearest_features': 4, 'imputation_order': 'arabic'}. Best is trial 129 with value: 0.05187520716833951.
running
[I 2024-11-21 19:50:40,104] Trial 167 finished with value: 0.052565541726918644 and parameters: {'model_name': 'IterativeImputer', 'estimator': 'RFR', 'initial_strategy': 'mean', 'n_nearest_features': 4, 'imputation_order': 'arabic'}. Best is trial 129 with value: 0.05187520716833951.
running
[I 2024-11-21 19:50:52,065] Trial 179 finished with value: 0.31384366825929316 and parameters: {'model_name': 'GAIN', 'batch_size': 64, 'hint_rate': 0.2824976218432042, 'alpha': 99, 'iterations': 6, 'learning_rate': 0.018659479181504533, 'p_miss': 0.23336001954887342}. Best is trial 129 with value: 0.05187520716833951.
running
[I 2024-11-21 19:51:41,111] Trial 45 finished with value: 0.07483318802069057 and parameters: {'model_name': 'VAE', 'batch_size': 26, 'iterations': 4335, 'learning_rate': 0.00018218796229624513, 'p_miss': 0.2815282720474305}. Best is trial 129 with value: 0.05187520716833951.
running
[I 2024-11-21 19:54:23,684] Trial 169 finished with value: 0.053413227848955046 and parameters: {'model_name': 'IterativeImputer', 'estimator': 'RFR', 'initial_strategy': 'mean', 'n_nearest_features': 4, 'imputation_order': 'arabic'}. Best is trial 129 with value: 0.05187520716833951.
running
[I 2024-11-21 19:54:30,771] Trial 170 finished with value: 0.05299560958033772 and parameters: {'model_name': 'IterativeImputer', 'estimator': 'RFR', 'initial_strategy': 'mean', 'n_nearest_features': 4, 'imputation_order': 'arabic'}. Best is trial 129 with value: 0.05187520716833951.
running
[I 2024-11-21 19:56:36,940] Trial 171 finished with value: 0.05253162249112928 and parameters: {'model_name': 'IterativeImputer', 'estimator': 'RFR', 'initial_strategy': 'mean', 'n_nearest_features': 4, 'imputation_order': 'arabic'}. Best is trial 129 with value: 0.05187520716833951.
running
[I 2024-11-21 19:56:37,406] Trial 184 finished with value: 0.07270054619150003 and parameters: {'model_name': 'SimpleImputer', 'strategy': 'mean'}. Best is trial 129 with value: 0.05187520716833951.
running
[I 2024-11-21 19:59:32,755] Trial 174 finished with value: 0.052481473734036464 and parameters: {'model_name': 'IterativeImputer', 'estimator': 'RFR', 'initial_strategy': 'mean', 'n_nearest_features': 4, 'imputation_order': 'arabic'}. Best is trial 129 with value: 0.05187520716833951.
running
[I 2024-11-21 20:01:52,022] Trial 175 finished with value: 0.053192207493211796 and parameters: {'model_name': 'IterativeImputer', 'estimator': 'RFR', 'initial_strategy': 'mean', 'n_nearest_features': 4, 'imputation_order': 'arabic'}. Best is trial 129 with value: 0.05187520716833951.
running
[I 2024-11-21 20:02:11,761] Trial 176 finished with value: 0.05251952742326438 and parameters: {'model_name': 'IterativeImputer', 'estimator': 'RFR', 'initial_strategy': 'mean', 'n_nearest_features': 4, 'imputation_order': 'arabic'}. Best is trial 129 with value: 0.05187520716833951.
running
[I 2024-11-21 20:03:08,454] Trial 178 finished with value: 0.052570079146138815 and parameters: {'model_name': 'IterativeImputer', 'estimator': 'RFR', 'initial_strategy': 'mean', 'n_nearest_features': 4, 'imputation_order': 'arabic'}. Best is trial 129 with value: 0.05187520716833951.
running
[I 2024-11-21 20:03:36,005] Trial 177 finished with value: 0.05320900242802732 and parameters: {'model_name': 'IterativeImputer', 'estimator': 'RFR', 'initial_strategy': 'mean', 'n_nearest_features': 4, 'imputation_order': 'arabic'}. Best is trial 129 with value: 0.05187520716833951.
running
[I 2024-11-21 20:05:04,890] Trial 180 finished with value: 0.052518906437436695 and parameters: {'model_name': 'IterativeImputer', 'estimator': 'RFR', 'initial_strategy': 'mean', 'n_nearest_features': 4, 'imputation_order': 'arabic'}. Best is trial 129 with value: 0.05187520716833951.
running
[I 2024-11-21 20:05:27,238] Trial 181 finished with value: 0.05268366957963112 and parameters: {'model_name': 'IterativeImputer', 'estimator': 'RFR', 'initial_strategy': 'mean', 'n_nearest_features': 4, 'imputation_order': 'arabic'}. Best is trial 129 with value: 0.05187520716833951.
running
[I 2024-11-21 20:08:00,765] Trial 183 finished with value: 0.052863409165672406 and parameters: {'model_name': 'IterativeImputer', 'estimator': 'RFR', 'initial_strategy': 'mean', 'n_nearest_features': 4, 'imputation_order': 'arabic'}. Best is trial 129 with value: 0.05187520716833951.
running
[I 2024-11-21 20:08:08,126] Trial 182 finished with value: 0.052674233213321695 and parameters: {'model_name': 'IterativeImputer', 'estimator': 'RFR', 'initial_strategy': 'mean', 'n_nearest_features': 4, 'imputation_order': 'arabic'}. Best is trial 129 with value: 0.05187520716833951.
running
[I 2024-11-21 20:08:29,235] Trial 193 finished with value: 0.09270653549010888 and parameters: {'model_name': 'IterativeImputer', 'estimator': 'Bayesian', 'initial_strategy': 'mean', 'n_nearest_features': 4, 'imputation_order': 'random', 'sample_posterior': True}. Best is trial 129 with value: 0.05187520716833951.
running
[I 2024-11-21 20:08:36,744] Trial 194 finished with value: 0.09182179588344037 and parameters: {'model_name': 'IterativeImputer', 'estimator': 'Bayesian', 'initial_strategy': 'mean', 'n_nearest_features': 4, 'imputation_order': 'arabic', 'sample_posterior': True}. Best is trial 129 with value: 0.05187520716833951.
running
[I 2024-11-21 20:11:07,097] Trial 185 finished with value: 0.05221850144245506 and parameters: {'model_name': 'IterativeImputer', 'estimator': 'RFR', 'initial_strategy': 'mean', 'n_nearest_features': 4, 'imputation_order': 'arabic'}. Best is trial 129 with value: 0.05187520716833951.
running
[I 2024-11-21 20:14:01,582] Trial 186 finished with value: 0.052862706985402054 and parameters: {'model_name': 'IterativeImputer', 'estimator': 'RFR', 'initial_strategy': 'mean', 'n_nearest_features': 4, 'imputation_order': 'arabic'}. Best is trial 129 with value: 0.05187520716833951.
running
[I 2024-11-21 20:16:43,180] Trial 188 finished with value: 0.053304758781811824 and parameters: {'model_name': 'IterativeImputer', 'estimator': 'RFR', 'initial_strategy': 'mean', 'n_nearest_features': 4, 'imputation_order': 'arabic'}. Best is trial 129 with value: 0.05187520716833951.
running
[I 2024-11-21 20:16:46,307] Trial 187 finished with value: 0.053007965529720834 and parameters: {'model_name': 'IterativeImputer', 'estimator': 'RFR', 'initial_strategy': 'mean', 'n_nearest_features': 4, 'imputation_order': 'arabic'}. Best is trial 129 with value: 0.05187520716833951.
[I 2024-11-21 20:17:34,182] Trial 189 finished with value: 0.052192682035704166 and parameters: {'model_name': 'IterativeImputer', 'estimator': 'RFR', 'initial_strategy': 'mean', 'n_nearest_features': 4, 'imputation_order': 'arabic'}. Best is trial 129 with value: 0.05187520716833951.
[I 2024-11-21 20:18:11,575] Trial 190 finished with value: 0.05300708891095094 and parameters: {'model_name': 'IterativeImputer', 'estimator': 'RFR', 'initial_strategy': 'mean', 'n_nearest_features': 4, 'imputation_order': 'random'}. Best is trial 129 with value: 0.05187520716833951.
[I 2024-11-21 20:19:19,154] Trial 192 finished with value: 0.05263301066514092 and parameters: {'model_name': 'IterativeImputer', 'estimator': 'RFR', 'initial_strategy': 'mean', 'n_nearest_features': 4, 'imputation_order': 'random'}. Best is trial 129 with value: 0.05187520716833951.
[I 2024-11-21 20:19:21,192] Trial 191 finished with value: 0.05282754339935941 and parameters: {'model_name': 'IterativeImputer', 'estimator': 'RFR', 'initial_strategy': 'mean', 'n_nearest_features': 4, 'imputation_order': 'random'}. Best is trial 129 with value: 0.05187520716833951.
[I 2024-11-21 20:21:14,885] Trial 195 finished with value: 0.0526720211212109 and parameters: {'model_name': 'IterativeImputer', 'estimator': 'RFR', 'initial_strategy': 'mean', 'n_nearest_features': 4, 'imputation_order': 'arabic'}. Best is trial 129 with value: 0.05187520716833951.
[I 2024-11-21 20:21:37,687] Trial 196 finished with value: 0.053711103330275733 and parameters: {'model_name': 'IterativeImputer', 'estimator': 'RFR', 'initial_strategy': 'mean', 'n_nearest_features': 4, 'imputation_order': 'arabic'}. Best is trial 129 with value: 0.05187520716833951.
[I 2024-11-21 20:23:17,143] Trial 197 finished with value: 0.05309557386353564 and parameters: {'model_name': 'IterativeImputer', 'estimator': 'RFR', 'initial_strategy': 'mean', 'n_nearest_features': 4, 'imputation_order': 'arabic'}. Best is trial 129 with value: 0.05187520716833951.
[I 2024-11-21 20:23:37,153] Trial 44 finished with value: 0.08017791663646881 and parameters: {'model_name': 'VAE', 'batch_size': 29, 'iterations': 4589, 'learning_rate': 0.00010167807886865516, 'p_miss': 0.27783452822634486}. Best is trial 129 with value: 0.05187520716833951.
[I 2024-11-21 20:24:14,230] Trial 33 finished with value: 0.07453112680801297 and parameters: {'model_name': 'VAE', 'batch_size': 271, 'iterations': 4695, 'learning_rate': 0.09569386493529133, 'p_miss': 0.016004821407239578}. Best is trial 129 with value: 0.05187520716833951.
[I 2024-11-21 20:24:48,956] Trial 198 finished with value: 0.052845567399727136 and parameters: {'model_name': 'IterativeImputer', 'estimator': 'RFR', 'initial_strategy': 'mean', 'n_nearest_features': 4, 'imputation_order': 'arabic'}. Best is trial 129 with value: 0.05187520716833951.
[I 2024-11-21 20:25:51,024] Trial 199 finished with value: 0.05297991709187024 and parameters: {'model_name': 'IterativeImputer', 'estimator': 'RFR', 'initial_strategy': 'mean', 'n_nearest_features': 4, 'imputation_order': 'arabic'}. Best is trial 129 with value: 0.05187520716833951.
[I 2024-11-21 20:32:18,038] Trial 64 finished with value: 0.07472279791489601 and parameters: {'model_name': 'VAE', 'batch_size': 13, 'iterations': 7457, 'learning_rate': 0.008632690390421457, 'p_miss': 0.018715794625555893}. Best is trial 129 with value: 0.05187520716833951.
[I 2024-11-21 20:34:05,073] Trial 55 finished with value: 0.07579438260085518 and parameters: {'model_name': 'VAE', 'batch_size': 12, 'iterations': 8694, 'learning_rate': 0.01617582599816988, 'p_miss': 0.01808487277346424}. Best is trial 129 with value: 0.05187520716833951.
[I 2024-11-21 20:34:05,696] Trial 58 finished with value: 0.07643007633706204 and parameters: {'model_name': 'VAE', 'batch_size': 11, 'iterations': 9518, 'learning_rate': 0.010340241923021484, 'p_miss': 0.012830113735720433}. Best is trial 129 with value: 0.05187520716833951.
