[I 2024-09-24 10:50:37,278] Trial 60 finished with value: 0.32319253389036773 and parameters: {'model_name': 'GAIN', 'batch_size': 63, 'hint_rate': 0.02577968784267598, 'alpha': 98, 'iterations': 8715, 'learning_rate': 0.0015567259496908038, 'p_miss': 0.28557104502282904}. Best is trial 71 with value: 0.03949394053020468.
running
[I 2024-09-24 10:51:23,514] Trial 58 finished with value: 0.31334559818700675 and parameters: {'model_name': 'GAIN', 'batch_size': 56, 'hint_rate': 0.04778964622732218, 'alpha': 97, 'iterations': 9561, 'learning_rate': 0.0010463015272874775, 'p_miss': 0.2897540071076841}. Best is trial 71 with value: 0.03949394053020468.
running
[I 2024-09-24 10:53:16,607] Trial 57 finished with value: 0.10082130133722819 and parameters: {'model_name': 'VAE', 'batch_size': 64, 'iterations': 8958, 'learning_rate': 0.0015906695696873985, 'p_miss': 0.2950497944121992}. Best is trial 71 with value: 0.03949394053020468.
running
[I 2024-09-24 10:59:48,370] Trial 73 finished with value: 0.0395557766209505 and parameters: {'model_name': 'IterativeImputer', 'estimator': 'RFR', 'initial_strategy': 'most_frequent', 'n_nearest_features': 19, 'imputation_order': 'arabic'}. Best is trial 71 with value: 0.03949394053020468.
running
[I 2024-09-24 11:18:38,860] Trial 74 finished with value: 0.039550092823273604 and parameters: {'model_name': 'IterativeImputer', 'estimator': 'RFR', 'initial_strategy': 'most_frequent', 'n_nearest_features': 19, 'imputation_order': 'arabic'}. Best is trial 71 with value: 0.03949394053020468.
running
[I 2024-09-24 11:28:16,389] Trial 75 finished with value: 0.03929982637745939 and parameters: {'model_name': 'IterativeImputer', 'estimator': 'RFR', 'initial_strategy': 'most_frequent', 'n_nearest_features': 19, 'imputation_order': 'arabic'}. Best is trial 75 with value: 0.03929982637745939.
running
[I 2024-09-24 11:38:03,763] Trial 78 finished with value: 0.039221137283727864 and parameters: {'model_name': 'IterativeImputer', 'estimator': 'RFR', 'initial_strategy': 'most_frequent', 'n_nearest_features': 19, 'imputation_order': 'arabic'}. Best is trial 78 with value: 0.039221137283727864.
running
[I 2024-09-24 11:38:41,258] Trial 79 finished with value: 0.039700207932786245 and parameters: {'model_name': 'IterativeImputer', 'estimator': 'RFR', 'initial_strategy': 'most_frequent', 'n_nearest_features': 19, 'imputation_order': 'arabic'}. Best is trial 78 with value: 0.039221137283727864.
running
[I 2024-09-24 11:46:16,532] Trial 80 finished with value: 0.039066720511836725 and parameters: {'model_name': 'IterativeImputer', 'estimator': 'RFR', 'initial_strategy': 'most_frequent', 'n_nearest_features': 20, 'imputation_order': 'arabic'}. Best is trial 80 with value: 0.039066720511836725.
running
[I 2024-09-24 11:50:44,159] Trial 81 finished with value: 0.03961730770380645 and parameters: {'model_name': 'IterativeImputer', 'estimator': 'RFR', 'initial_strategy': 'most_frequent', 'n_nearest_features': 19, 'imputation_order': 'arabic'}. Best is trial 80 with value: 0.039066720511836725.
running
[I 2024-09-24 11:55:17,296] Trial 82 finished with value: 0.039247305232061165 and parameters: {'model_name': 'IterativeImputer', 'estimator': 'RFR', 'initial_strategy': 'most_frequent', 'n_nearest_features': 19, 'imputation_order': 'arabic'}. Best is trial 80 with value: 0.039066720511836725.
running
[I 2024-09-24 12:15:53,330] Trial 83 finished with value: 0.0398177833752592 and parameters: {'model_name': 'IterativeImputer', 'estimator': 'RFR', 'initial_strategy': 'most_frequent', 'n_nearest_features': 19, 'imputation_order': 'arabic'}. Best is trial 80 with value: 0.039066720511836725.
running
[I 2024-09-24 12:20:25,262] Trial 84 finished with value: 0.03938412322717542 and parameters: {'model_name': 'IterativeImputer', 'estimator': 'RFR', 'initial_strategy': 'most_frequent', 'n_nearest_features': 19, 'imputation_order': 'arabic'}. Best is trial 80 with value: 0.039066720511836725.
running
[I 2024-09-24 12:24:51,619] Trial 86 finished with value: 0.03960896590529015 and parameters: {'model_name': 'IterativeImputer', 'estimator': 'RFR', 'initial_strategy': 'most_frequent', 'n_nearest_features': 19, 'imputation_order': 'arabic'}. Best is trial 80 with value: 0.039066720511836725.
running
[I 2024-09-24 12:26:44,616] Trial 85 finished with value: 0.03917427272041519 and parameters: {'model_name': 'IterativeImputer', 'estimator': 'RFR', 'initial_strategy': 'most_frequent', 'n_nearest_features': 20, 'imputation_order': 'roman'}. Best is trial 80 with value: 0.039066720511836725.
running
[I 2024-09-24 12:26:46,529] Trial 102 finished with value: 0.0628487535135829 and parameters: {'model_name': 'KNNImputer', 'n_neighbors': 161, 'weights': 'distance'}. Best is trial 80 with value: 0.039066720511836725.
running
[I 2024-09-24 12:26:49,158] Trial 87 finished with value: 0.039308717450185514 and parameters: {'model_name': 'IterativeImputer', 'estimator': 'RFR', 'initial_strategy': 'most_frequent', 'n_nearest_features': 19, 'imputation_order': 'arabic'}. Best is trial 80 with value: 0.039066720511836725.
running
[I 2024-09-24 12:27:38,882] Trial 88 finished with value: 0.03935339995672906 and parameters: {'model_name': 'IterativeImputer', 'estimator': 'RFR', 'initial_strategy': 'most_frequent', 'n_nearest_features': 19, 'imputation_order': 'arabic'}. Best is trial 80 with value: 0.039066720511836725.
running
[I 2024-09-24 12:28:39,867] Trial 89 finished with value: 0.039356089218802556 and parameters: {'model_name': 'IterativeImputer', 'estimator': 'RFR', 'initial_strategy': 'most_frequent', 'n_nearest_features': 19, 'imputation_order': 'arabic'}. Best is trial 80 with value: 0.039066720511836725.
running
[I 2024-09-24 12:30:07,620] Trial 90 finished with value: 0.0391371754599549 and parameters: {'model_name': 'IterativeImputer', 'estimator': 'RFR', 'initial_strategy': 'most_frequent', 'n_nearest_features': 19, 'imputation_order': 'arabic'}. Best is trial 80 with value: 0.039066720511836725.
running
[I 2024-09-24 12:40:56,804] Trial 91 finished with value: 0.03918842375850316 and parameters: {'model_name': 'IterativeImputer', 'estimator': 'RFR', 'initial_strategy': 'most_frequent', 'n_nearest_features': 20, 'imputation_order': 'arabic'}. Best is trial 80 with value: 0.039066720511836725.
running
[I 2024-09-24 12:59:44,824] Trial 92 finished with value: 0.039690504481857944 and parameters: {'model_name': 'IterativeImputer', 'estimator': 'RFR', 'initial_strategy': 'most_frequent', 'n_nearest_features': 20, 'imputation_order': 'arabic'}. Best is trial 80 with value: 0.039066720511836725.
running
[I 2024-09-24 13:09:43,316] Trial 93 finished with value: 0.03923051830495837 and parameters: {'model_name': 'IterativeImputer', 'estimator': 'RFR', 'initial_strategy': 'most_frequent', 'n_nearest_features': 20, 'imputation_order': 'random'}. Best is trial 80 with value: 0.039066720511836725.
running
[I 2024-09-24 13:19:11,305] Trial 94 finished with value: 0.03933078560808225 and parameters: {'model_name': 'IterativeImputer', 'estimator': 'RFR', 'initial_strategy': 'most_frequent', 'n_nearest_features': 20, 'imputation_order': 'arabic'}. Best is trial 80 with value: 0.039066720511836725.
running
[I 2024-09-24 13:19:11,692] Trial 111 finished with value: 0.178024056996342 and parameters: {'model_name': 'SimpleImputer', 'strategy': 'constant'}. Best is trial 80 with value: 0.039066720511836725.
running
[I 2024-09-24 13:20:07,181] Trial 95 finished with value: 0.0394235560221884 and parameters: {'model_name': 'IterativeImputer', 'estimator': 'RFR', 'initial_strategy': 'most_frequent', 'n_nearest_features': 20, 'imputation_order': 'arabic'}. Best is trial 80 with value: 0.039066720511836725.
running
[I 2024-09-24 13:27:24,618] Trial 96 finished with value: 0.0395609684213943 and parameters: {'model_name': 'IterativeImputer', 'estimator': 'RFR', 'initial_strategy': 'most_frequent', 'n_nearest_features': 20, 'imputation_order': 'arabic'}. Best is trial 80 with value: 0.039066720511836725.
running
[I 2024-09-24 13:30:40,973] Trial 97 finished with value: 0.039106501884801644 and parameters: {'model_name': 'IterativeImputer', 'estimator': 'RFR', 'initial_strategy': 'most_frequent', 'n_nearest_features': 20, 'imputation_order': 'arabic'}. Best is trial 80 with value: 0.039066720511836725.
running
[I 2024-09-24 13:36:20,559] Trial 98 finished with value: 0.03937344407651331 and parameters: {'model_name': 'IterativeImputer', 'estimator': 'RFR', 'initial_strategy': 'most_frequent', 'n_nearest_features': 20, 'imputation_order': 'arabic'}. Best is trial 80 with value: 0.039066720511836725.
running
[I 2024-09-24 13:56:43,406] Trial 99 finished with value: 0.03916046844302461 and parameters: {'model_name': 'IterativeImputer', 'estimator': 'RFR', 'initial_strategy': 'most_frequent', 'n_nearest_features': 21, 'imputation_order': 'arabic'}. Best is trial 80 with value: 0.039066720511836725.
running
[I 2024-09-24 14:00:37,332] Trial 100 finished with value: 0.039281839693017365 and parameters: {'model_name': 'IterativeImputer', 'estimator': 'RFR', 'initial_strategy': 'most_frequent', 'n_nearest_features': 21, 'imputation_order': 'arabic'}. Best is trial 80 with value: 0.039066720511836725.
running
[I 2024-09-24 14:04:39,121] Trial 101 finished with value: 0.039197769486245926 and parameters: {'model_name': 'IterativeImputer', 'estimator': 'RFR', 'initial_strategy': 'most_frequent', 'n_nearest_features': 21, 'imputation_order': 'arabic'}. Best is trial 80 with value: 0.039066720511836725.
running
[I 2024-09-24 14:06:37,477] Trial 104 finished with value: 0.0394379101917383 and parameters: {'model_name': 'IterativeImputer', 'estimator': 'RFR', 'initial_strategy': 'most_frequent', 'n_nearest_features': 21, 'imputation_order': 'roman'}. Best is trial 80 with value: 0.039066720511836725.
running
[I 2024-09-24 14:06:40,045] Trial 120 finished with value: 0.1099909224278834 and parameters: {'model_name': 'VAE', 'batch_size': 214, 'iterations': 7, 'learning_rate': 0.026205385039404425, 'p_miss': 0.09921139498801548}. Best is trial 80 with value: 0.039066720511836725.
running
[I 2024-09-24 14:06:47,079] Trial 103 finished with value: 0.039607361945102275 and parameters: {'model_name': 'IterativeImputer', 'estimator': 'RFR', 'initial_strategy': 'most_frequent', 'n_nearest_features': 21, 'imputation_order': 'arabic'}. Best is trial 80 with value: 0.039066720511836725.
running
[I 2024-09-24 14:07:27,331] Trial 105 finished with value: 0.039361124721321555 and parameters: {'model_name': 'IterativeImputer', 'estimator': 'RFR', 'initial_strategy': 'most_frequent', 'n_nearest_features': 20, 'imputation_order': 'roman'}. Best is trial 80 with value: 0.039066720511836725.
running
[I 2024-09-24 14:07:29,697] Trial 123 finished with value: 0.09026705261454046 and parameters: {'model_name': 'KNNImputer', 'n_neighbors': 6542, 'weights': 'distance'}. Best is trial 80 with value: 0.039066720511836725.
running
[I 2024-09-24 14:07:41,243] Trial 124 finished with value: 0.08577008236866851 and parameters: {'model_name': 'IterativeImputer', 'estimator': 'Bayesian', 'initial_strategy': 'mean', 'n_nearest_features': 21, 'imputation_order': 'random', 'sample_posterior': True}. Best is trial 80 with value: 0.039066720511836725.
running
[I 2024-09-24 14:08:24,848] Trial 106 finished with value: 0.03964504512929699 and parameters: {'model_name': 'IterativeImputer', 'estimator': 'RFR', 'initial_strategy': 'most_frequent', 'n_nearest_features': 21, 'imputation_order': 'arabic'}. Best is trial 80 with value: 0.039066720511836725.
running
[I 2024-09-24 14:10:10,545] Trial 107 finished with value: 0.03921995856033868 and parameters: {'model_name': 'IterativeImputer', 'estimator': 'RFR', 'initial_strategy': 'most_frequent', 'n_nearest_features': 20, 'imputation_order': 'roman'}. Best is trial 80 with value: 0.039066720511836725.
running
[I 2024-09-24 14:21:14,853] Trial 108 finished with value: 0.0394029677241765 and parameters: {'model_name': 'IterativeImputer', 'estimator': 'RFR', 'initial_strategy': 'most_frequent', 'n_nearest_features': 21, 'imputation_order': 'roman'}. Best is trial 80 with value: 0.039066720511836725.
running
[I 2024-09-24 14:40:12,814] Trial 109 finished with value: 0.039445005913190154 and parameters: {'model_name': 'IterativeImputer', 'estimator': 'RFR', 'initial_strategy': 'most_frequent', 'n_nearest_features': 21, 'imputation_order': 'roman'}. Best is trial 80 with value: 0.039066720511836725.
running
[I 2024-09-24 14:40:17,198] Trial 129 finished with value: 0.060000880009873137 and parameters: {'model_name': 'IterativeImputer', 'estimator': 'Ridge', 'initial_strategy': 'median', 'n_nearest_features': 20, 'imputation_order': 'ascending'}. Best is trial 80 with value: 0.039066720511836725.
running
[I 2024-09-24 14:49:42,397] Trial 110 finished with value: 0.03967398678676789 and parameters: {'model_name': 'IterativeImputer', 'estimator': 'RFR', 'initial_strategy': 'mean', 'n_nearest_features': 21, 'imputation_order': 'random'}. Best is trial 80 with value: 0.039066720511836725.
running
[I 2024-09-24 14:59:36,723] Trial 112 finished with value: 0.0392808141128813 and parameters: {'model_name': 'IterativeImputer', 'estimator': 'RFR', 'initial_strategy': 'mean', 'n_nearest_features': 20, 'imputation_order': 'random'}. Best is trial 80 with value: 0.039066720511836725.
running
[I 2024-09-24 15:00:06,312] Trial 113 finished with value: 0.039515127012479556 and parameters: {'model_name': 'IterativeImputer', 'estimator': 'RFR', 'initial_strategy': 'mean', 'n_nearest_features': 21, 'imputation_order': 'random'}. Best is trial 80 with value: 0.039066720511836725.
running
[I 2024-09-24 15:00:06,622] Trial 133 finished with value: 0.10754797919449854 and parameters: {'model_name': 'SimpleImputer', 'strategy': 'median'}. Best is trial 80 with value: 0.039066720511836725.
running
[I 2024-09-24 15:07:37,131] Trial 114 finished with value: 0.039557210526039575 and parameters: {'model_name': 'IterativeImputer', 'estimator': 'RFR', 'initial_strategy': 'mean', 'n_nearest_features': 21, 'imputation_order': 'random'}. Best is trial 80 with value: 0.039066720511836725.
running
[I 2024-09-24 15:09:25,746] Trial 115 finished with value: 0.03921215988917614 and parameters: {'model_name': 'IterativeImputer', 'estimator': 'RFR', 'initial_strategy': 'mean', 'n_nearest_features': 21, 'imputation_order': 'random'}. Best is trial 80 with value: 0.039066720511836725.
running
[I 2024-09-24 15:16:47,900] Trial 116 finished with value: 0.039426662981845495 and parameters: {'model_name': 'IterativeImputer', 'estimator': 'RFR', 'initial_strategy': 'mean', 'n_nearest_features': 21, 'imputation_order': 'ascending'}. Best is trial 80 with value: 0.039066720511836725.
running
[I 2024-09-24 15:37:38,978] Trial 117 finished with value: 0.03922383930711406 and parameters: {'model_name': 'IterativeImputer', 'estimator': 'RFR', 'initial_strategy': 'mean', 'n_nearest_features': 21, 'imputation_order': 'random'}. Best is trial 80 with value: 0.039066720511836725.
running
[I 2024-09-24 15:39:56,891] Trial 118 finished with value: 0.039989650627894904 and parameters: {'model_name': 'IterativeImputer', 'estimator': 'RFR', 'initial_strategy': 'mean', 'n_nearest_features': 21, 'imputation_order': 'random'}. Best is trial 80 with value: 0.039066720511836725.
running
[I 2024-09-24 15:43:06,645] Trial 119 finished with value: 0.03966841702547301 and parameters: {'model_name': 'IterativeImputer', 'estimator': 'RFR', 'initial_strategy': 'mean', 'n_nearest_features': 21, 'imputation_order': 'random'}. Best is trial 80 with value: 0.039066720511836725.
running
[I 2024-09-24 15:43:18,447] Trial 140 finished with value: 0.08752129869447266 and parameters: {'model_name': 'IterativeImputer', 'estimator': 'Bayesian', 'initial_strategy': 'median', 'n_nearest_features': 18, 'imputation_order': 'descending', 'sample_posterior': True}. Best is trial 80 with value: 0.039066720511836725.
running
[I 2024-09-24 15:45:30,214] Trial 122 finished with value: 0.03958411530960291 and parameters: {'model_name': 'IterativeImputer', 'estimator': 'RFR', 'initial_strategy': 'mean', 'n_nearest_features': 21, 'imputation_order': 'random'}. Best is trial 80 with value: 0.039066720511836725.
running
[I 2024-09-24 15:45:31,489] Trial 142 finished with value: 0.1471378966838734 and parameters: {'model_name': 'VAE', 'batch_size': 299, 'iterations': 1, 'learning_rate': 0.03695832976815685, 'p_miss': 0.2132292305882749}. Best is trial 80 with value: 0.039066720511836725.
running
[I 2024-09-24 15:45:42,849] Trial 121 finished with value: 0.03948646519543292 and parameters: {'model_name': 'IterativeImputer', 'estimator': 'RFR', 'initial_strategy': 'mean', 'n_nearest_features': 21, 'imputation_order': 'random'}. Best is trial 80 with value: 0.039066720511836725.
running
[I 2024-09-24 15:45:51,456] Trial 144 finished with value: 0.06005921258053274 and parameters: {'model_name': 'IterativeImputer', 'estimator': 'Ridge', 'initial_strategy': 'constant', 'n_nearest_features': 18, 'imputation_order': 'roman'}. Best is trial 80 with value: 0.039066720511836725.
running
[I 2024-09-24 15:46:25,695] Trial 125 finished with value: 0.03959123879084338 and parameters: {'model_name': 'IterativeImputer', 'estimator': 'RFR', 'initial_strategy': 'median', 'n_nearest_features': 21, 'imputation_order': 'ascending'}. Best is trial 80 with value: 0.039066720511836725.
running
[I 2024-09-24 15:47:00,157] Trial 126 finished with value: 0.039119370810973934 and parameters: {'model_name': 'IterativeImputer', 'estimator': 'RFR', 'initial_strategy': 'median', 'n_nearest_features': 21, 'imputation_order': 'random'}. Best is trial 80 with value: 0.039066720511836725.
running
[I 2024-09-24 15:48:49,091] Trial 127 finished with value: 0.03930517719771026 and parameters: {'model_name': 'IterativeImputer', 'estimator': 'RFR', 'initial_strategy': 'median', 'n_nearest_features': 21, 'imputation_order': 'ascending'}. Best is trial 80 with value: 0.039066720511836725.
running
[I 2024-09-24 16:02:34,967] Trial 128 finished with value: 0.03909047867907186 and parameters: {'model_name': 'IterativeImputer', 'estimator': 'RFR', 'initial_strategy': 'median', 'n_nearest_features': 20, 'imputation_order': 'ascending'}. Best is trial 80 with value: 0.039066720511836725.
running
[I 2024-09-24 16:13:24,810] Trial 130 finished with value: 0.03994037015967847 and parameters: {'model_name': 'IterativeImputer', 'estimator': 'RFR', 'initial_strategy': 'mean', 'n_nearest_features': 18, 'imputation_order': 'random'}. Best is trial 80 with value: 0.039066720511836725.
running
[I 2024-09-24 16:21:57,829] Trial 145 finished with value: 0.0497881507785973 and parameters: {'model_name': 'IterativeImputer', 'estimator': 'RFR', 'initial_strategy': 'most_frequent', 'n_nearest_features': 6, 'imputation_order': 'roman'}. Best is trial 80 with value: 0.039066720511836725.
running
[I 2024-09-24 16:23:42,299] Trial 131 finished with value: 0.03969654859507503 and parameters: {'model_name': 'IterativeImputer', 'estimator': 'RFR', 'initial_strategy': 'median', 'n_nearest_features': 18, 'imputation_order': 'descending'}. Best is trial 80 with value: 0.039066720511836725.
running
[I 2024-09-24 16:23:44,844] Trial 152 finished with value: 0.08461154727655887 and parameters: {'model_name': 'KNNImputer', 'n_neighbors': 3070, 'weights': 'distance'}. Best is trial 80 with value: 0.039066720511836725.
running
[I 2024-09-24 16:33:42,112] Trial 132 finished with value: 0.03956352409256115 and parameters: {'model_name': 'IterativeImputer', 'estimator': 'RFR', 'initial_strategy': 'mean', 'n_nearest_features': 18, 'imputation_order': 'random'}. Best is trial 80 with value: 0.039066720511836725.
running
[I 2024-09-24 16:34:23,610] Trial 134 finished with value: 0.03967837724265812 and parameters: {'model_name': 'IterativeImputer', 'estimator': 'RFR', 'initial_strategy': 'mean', 'n_nearest_features': 18, 'imputation_order': 'descending'}. Best is trial 80 with value: 0.039066720511836725.
running
[I 2024-09-24 16:41:05,083] Trial 136 finished with value: 0.03949276384840449 and parameters: {'model_name': 'IterativeImputer', 'estimator': 'RFR', 'initial_strategy': 'mean', 'n_nearest_features': 18, 'imputation_order': 'random'}. Best is trial 80 with value: 0.039066720511836725.
running
[I 2024-09-24 16:51:07,464] Trial 135 finished with value: 0.03946971253602628 and parameters: {'model_name': 'IterativeImputer', 'estimator': 'RFR', 'initial_strategy': 'median', 'n_nearest_features': 20, 'imputation_order': 'descending'}. Best is trial 80 with value: 0.039066720511836725.
running
[I 2024-09-24 16:52:02,068] Trial 137 finished with value: 0.040038679573482526 and parameters: {'model_name': 'IterativeImputer', 'estimator': 'RFR', 'initial_strategy': 'mean', 'n_nearest_features': 18, 'imputation_order': 'random'}. Best is trial 80 with value: 0.039066720511836725.
running
[I 2024-09-24 17:00:15,845] Trial 150 finished with value: 0.04393231310612928 and parameters: {'model_name': 'IterativeImputer', 'estimator': 'RFR', 'initial_strategy': 'median', 'n_nearest_features': 8, 'imputation_order': 'descending'}. Best is trial 80 with value: 0.039066720511836725.
running
[I 2024-09-24 17:13:37,809] Trial 138 finished with value: 0.039624273074466546 and parameters: {'model_name': 'IterativeImputer', 'estimator': 'RFR', 'initial_strategy': 'median', 'n_nearest_features': 18, 'imputation_order': 'descending'}. Best is trial 80 with value: 0.039066720511836725.
running
[I 2024-09-24 17:13:55,308] Trial 139 finished with value: 0.04021559261682942 and parameters: {'model_name': 'IterativeImputer', 'estimator': 'RFR', 'initial_strategy': 'median', 'n_nearest_features': 18, 'imputation_order': 'descending'}. Best is trial 80 with value: 0.039066720511836725.
running
