[I 2024-09-20 15:51:45,344] Trial 198 finished with value: 0.165990265495031 and parameters: {'model_name': 'SimpleImputer', 'strategy': 'mean'}. Best is trial 4 with value: 0.165990265495031.
fit
simple fit
simple transform
0     0
1     0
2     0
3     0
4     0
5     0
6     0
7     0
8     0
9     0
10    0
11    0
12    0
13    0
14    0
15    0
dtype: int64
0     0
1     0
2     0
3     0
4     0
5     0
6     0
7     0
8     0
9     0
10    0
11    0
12    0
13    0
14    0
15    0
dtype: int64
0.165990265495031
{'model_name': 'SimpleImputer', 'strategy': 'mean'}
running experiment 2/3 - Does reconstruction give good automl predictions
Start est fit
Version 0.1.7a0 of tpot2 is outdated. Version 0.1.8a0 was released 3 days ago.
Version 0.1.7a0 of tpot2 is outdated. Version 0.1.8a0 was released 3 days ago.
Version 0.1.7a0 of tpot2 is outdated. Version 0.1.8a0 was released 3 days ago.
Version 0.1.7a0 of tpot2 is outdated. Version 0.1.8a0 was released 3 days ago.
Version 0.1.7a0 of tpot2 is outdated. Version 0.1.8a0 was released 3 days ago.
Version 0.1.7a0 of tpot2 is outdated. Version 0.1.8a0 was released 3 days ago.
Version 0.1.7a0 of tpot2 is outdated. Version 0.1.8a0 was released 3 days ago.
Version 0.1.7a0 of tpot2 is outdated. Version 0.1.8a0 was released 3 days ago.
Version 0.1.7a0 of tpot2 is outdated. Version 0.1.8a0 was released 3 days ago.
Version 0.1.7a0 of tpot2 is outdated. Version 0.1.8a0 was released 3 days ago.
Version 0.1.7a0 of tpot2 is outdated. Version 0.1.8a0 was released 3 days ago.
Version 0.1.7a0 of tpot2 is outdated. Version 0.1.8a0 was released 3 days ago.
Version 0.1.7a0 of tpot2 is outdated. Version 0.1.8a0 was released 3 days ago.
Version 0.1.7a0 of tpot2 is outdated. Version 0.1.8a0 was released 3 days ago.
Version 0.1.7a0 of tpot2 is outdated. Version 0.1.8a0 was released 3 days ago.
Version 0.1.7a0 of tpot2 is outdated. Version 0.1.8a0 was released 3 days ago.
  0%|          | 0/25 [00:00<?, ?it/s]Generation:   0%|          | 0/25 [00:00<?, ?it/s]Generation:  1
Best f1_score score: 0.9276746595598924
Generation:   4%|▍         | 1/25 [02:09<51:38, 129.08s/it]Generation:  2
Best f1_score score: 0.9276746595598924
Generation:   8%|▊         | 2/25 [03:00<32:04, 83.65s/it] Generation:  3
Best f1_score score: 0.9280656866549538
Generation:  12%|█▏        | 3/25 [03:26<20:55, 57.07s/it]Generation:  4
Best f1_score score: 0.9466355296449581
Generation:  16%|█▌        | 4/25 [07:24<44:56, 128.40s/it]Generation:  5
Best f1_score score: 0.9466355296449581
Generation:  20%|██        | 5/25 [11:39<58:06, 174.34s/it]Generation:  6
Best f1_score score: 0.9466355296449581
Generation:  24%|██▍       | 6/25 [15:02<58:16, 184.04s/it]Generation:  7
Best f1_score score: 0.9466355296449581
Generation:  28%|██▊       | 7/25 [17:45<53:07, 177.07s/it]Generation:  8
Best f1_score score: 0.9480365453269062
Generation:  32%|███▏      | 8/25 [20:41<50:02, 176.62s/it]Generation:  9
Best f1_score score: 0.9515427192467779
Generation:  36%|███▌      | 9/25 [24:59<53:55, 202.21s/it]WARNING THIS INDIVIDUAL CAUSED AND EXCEPTION 
 <tpot2.search_spaces.pipelines.sequential.SequentialPipelineIndividual object at 0x15547448e170> 
 Argument 'metric' has incorrect type (expected str, got numpy.str_) 
 Traceback (most recent call last):
  File "/common/ketrong/tpotexp/tpot2/tpot2/utils/eval_utils.py", line 53, in objective_nan_wrapper
    value = func_timeout.func_timeout(timeout, objective_function, args=[individual], kwargs=objective_kwargs)
  File "/common/ketrong/tpotexp/env/lib/python3.10/site-packages/func_timeout/dafunc.py", line 108, in func_timeout
    raise_exception(exception)
  File "/common/ketrong/tpotexp/env/lib/python3.10/site-packages/func_timeout/py3_raise.py", line 7, in raise_exception
    raise exception[0] from None
  File "/common/ketrong/tpotexp/tpot2/tpot2/tpot_estimator/estimator.py", line 623, in objective_function
    return objective_function_generator(
  File "/common/ketrong/tpotexp/tpot2/tpot2/tpot_estimator/estimator_utils.py", line 55, in objective_function_generator
    cv_obj_scores = cross_val_score_objective(sklearn.base.clone(pipeline),x,y,scorers=scorers, cv=cv , fold=step)
  File "/common/ketrong/tpotexp/tpot2/tpot2/tpot_estimator/cross_val_utils.py", line 31, in cross_val_score_objective
    this_fold_scores = [sklearn.metrics.get_scorer(scorer)(this_fold_pipeline, X_test, y_test) for scorer in scorers]
  File "/common/ketrong/tpotexp/tpot2/tpot2/tpot_estimator/cross_val_utils.py", line 31, in <listcomp>
    this_fold_scores = [sklearn.metrics.get_scorer(scorer)(this_fold_pipeline, X_test, y_test) for scorer in scorers]
  File "/common/ketrong/tpotexp/env/lib/python3.10/site-packages/sklearn/metrics/_scorer.py", line 279, in __call__
    return self._score(partial(_cached_call, None), estimator, X, y_true, **_kwargs)
  File "/common/ketrong/tpotexp/env/lib/python3.10/site-packages/sklearn/metrics/_scorer.py", line 371, in _score
    y_pred = method_caller(
  File "/common/ketrong/tpotexp/env/lib/python3.10/site-packages/sklearn/metrics/_scorer.py", line 89, in _cached_call
    result, _ = _get_response_values(
  File "/common/ketrong/tpotexp/env/lib/python3.10/site-packages/sklearn/utils/_response.py", line 211, in _get_response_values
    y_pred = prediction_method(X)
  File "/common/ketrong/tpotexp/env/lib/python3.10/site-packages/sklearn/pipeline.py", line 601, in predict
    return self.steps[-1][1].predict(Xt, **params)
  File "/common/ketrong/tpotexp/env/lib/python3.10/site-packages/sklearn/neighbors/_classification.py", line 259, in predict
    probabilities = self.predict_proba(X)
  File "/common/ketrong/tpotexp/env/lib/python3.10/site-packages/sklearn/neighbors/_classification.py", line 343, in predict_proba
    probabilities = ArgKminClassMode.compute(
  File "/common/ketrong/tpotexp/env/lib/python3.10/site-packages/sklearn/metrics/_pairwise_distances_reduction/_dispatcher.py", line 584, in compute
    return ArgKminClassMode64.compute(
TypeError: Argument 'metric' has incorrect type (expected str, got numpy.str_)

Generation:  10
Best f1_score score: 0.9515427192467779
Generation:  40%|████      | 10/25 [26:52<43:37, 174.51s/it]WARNING THIS INDIVIDUAL CAUSED AND EXCEPTION 
 <tpot2.search_spaces.pipelines.sequential.SequentialPipelineIndividual object at 0x15547412b250> 
 Argument 'metric' has incorrect type (expected str, got numpy.str_) 
 Traceback (most recent call last):
  File "/common/ketrong/tpotexp/tpot2/tpot2/utils/eval_utils.py", line 53, in objective_nan_wrapper
    value = func_timeout.func_timeout(timeout, objective_function, args=[individual], kwargs=objective_kwargs)
  File "/common/ketrong/tpotexp/env/lib/python3.10/site-packages/func_timeout/dafunc.py", line 108, in func_timeout
    raise_exception(exception)
  File "/common/ketrong/tpotexp/env/lib/python3.10/site-packages/func_timeout/py3_raise.py", line 7, in raise_exception
    raise exception[0] from None
  File "/common/ketrong/tpotexp/tpot2/tpot2/tpot_estimator/estimator.py", line 623, in objective_function
    return objective_function_generator(
  File "/common/ketrong/tpotexp/tpot2/tpot2/tpot_estimator/estimator_utils.py", line 55, in objective_function_generator
    cv_obj_scores = cross_val_score_objective(sklearn.base.clone(pipeline),x,y,scorers=scorers, cv=cv , fold=step)
  File "/common/ketrong/tpotexp/tpot2/tpot2/tpot_estimator/cross_val_utils.py", line 31, in cross_val_score_objective
    this_fold_scores = [sklearn.metrics.get_scorer(scorer)(this_fold_pipeline, X_test, y_test) for scorer in scorers]
  File "/common/ketrong/tpotexp/tpot2/tpot2/tpot_estimator/cross_val_utils.py", line 31, in <listcomp>
    this_fold_scores = [sklearn.metrics.get_scorer(scorer)(this_fold_pipeline, X_test, y_test) for scorer in scorers]
  File "/common/ketrong/tpotexp/env/lib/python3.10/site-packages/sklearn/metrics/_scorer.py", line 279, in __call__
    return self._score(partial(_cached_call, None), estimator, X, y_true, **_kwargs)
  File "/common/ketrong/tpotexp/env/lib/python3.10/site-packages/sklearn/metrics/_scorer.py", line 371, in _score
    y_pred = method_caller(
  File "/common/ketrong/tpotexp/env/lib/python3.10/site-packages/sklearn/metrics/_scorer.py", line 89, in _cached_call
    result, _ = _get_response_values(
  File "/common/ketrong/tpotexp/env/lib/python3.10/site-packages/sklearn/utils/_response.py", line 211, in _get_response_values
    y_pred = prediction_method(X)
  File "/common/ketrong/tpotexp/env/lib/python3.10/site-packages/sklearn/pipeline.py", line 601, in predict
    return self.steps[-1][1].predict(Xt, **params)
  File "/common/ketrong/tpotexp/env/lib/python3.10/site-packages/sklearn/neighbors/_classification.py", line 259, in predict
    probabilities = self.predict_proba(X)
  File "/common/ketrong/tpotexp/env/lib/python3.10/site-packages/sklearn/neighbors/_classification.py", line 343, in predict_proba
    probabilities = ArgKminClassMode.compute(
  File "/common/ketrong/tpotexp/env/lib/python3.10/site-packages/sklearn/metrics/_pairwise_distances_reduction/_dispatcher.py", line 584, in compute
    return ArgKminClassMode64.compute(
TypeError: Argument 'metric' has incorrect type (expected str, got numpy.str_)

Generation:  11
Best f1_score score: 0.9515427192467779
Generation:  44%|████▍     | 11/25 [31:33<48:21, 207.24s/it]WARNING THIS INDIVIDUAL CAUSED AND EXCEPTION 
 <tpot2.search_spaces.pipelines.sequential.SequentialPipelineIndividual object at 0x15545db39ab0> 
 Argument 'metric' has incorrect type (expected str, got numpy.str_) 
 Traceback (most recent call last):
  File "/common/ketrong/tpotexp/tpot2/tpot2/utils/eval_utils.py", line 53, in objective_nan_wrapper
    value = func_timeout.func_timeout(timeout, objective_function, args=[individual], kwargs=objective_kwargs)
  File "/common/ketrong/tpotexp/env/lib/python3.10/site-packages/func_timeout/dafunc.py", line 108, in func_timeout
    raise_exception(exception)
  File "/common/ketrong/tpotexp/env/lib/python3.10/site-packages/func_timeout/py3_raise.py", line 7, in raise_exception
    raise exception[0] from None
  File "/common/ketrong/tpotexp/tpot2/tpot2/tpot_estimator/estimator.py", line 623, in objective_function
    return objective_function_generator(
  File "/common/ketrong/tpotexp/tpot2/tpot2/tpot_estimator/estimator_utils.py", line 55, in objective_function_generator
    cv_obj_scores = cross_val_score_objective(sklearn.base.clone(pipeline),x,y,scorers=scorers, cv=cv , fold=step)
  File "/common/ketrong/tpotexp/tpot2/tpot2/tpot_estimator/cross_val_utils.py", line 31, in cross_val_score_objective
    this_fold_scores = [sklearn.metrics.get_scorer(scorer)(this_fold_pipeline, X_test, y_test) for scorer in scorers]
  File "/common/ketrong/tpotexp/tpot2/tpot2/tpot_estimator/cross_val_utils.py", line 31, in <listcomp>
    this_fold_scores = [sklearn.metrics.get_scorer(scorer)(this_fold_pipeline, X_test, y_test) for scorer in scorers]
  File "/common/ketrong/tpotexp/env/lib/python3.10/site-packages/sklearn/metrics/_scorer.py", line 279, in __call__
    return self._score(partial(_cached_call, None), estimator, X, y_true, **_kwargs)
  File "/common/ketrong/tpotexp/env/lib/python3.10/site-packages/sklearn/metrics/_scorer.py", line 371, in _score
    y_pred = method_caller(
  File "/common/ketrong/tpotexp/env/lib/python3.10/site-packages/sklearn/metrics/_scorer.py", line 89, in _cached_call
    result, _ = _get_response_values(
  File "/common/ketrong/tpotexp/env/lib/python3.10/site-packages/sklearn/utils/_response.py", line 211, in _get_response_values
    y_pred = prediction_method(X)
  File "/common/ketrong/tpotexp/env/lib/python3.10/site-packages/sklearn/pipeline.py", line 601, in predict
    return self.steps[-1][1].predict(Xt, **params)
  File "/common/ketrong/tpotexp/env/lib/python3.10/site-packages/sklearn/neighbors/_classification.py", line 259, in predict
    probabilities = self.predict_proba(X)
  File "/common/ketrong/tpotexp/env/lib/python3.10/site-packages/sklearn/neighbors/_classification.py", line 343, in predict_proba
    probabilities = ArgKminClassMode.compute(
  File "/common/ketrong/tpotexp/env/lib/python3.10/site-packages/sklearn/metrics/_pairwise_distances_reduction/_dispatcher.py", line 584, in compute
    return ArgKminClassMode64.compute(
TypeError: Argument 'metric' has incorrect type (expected str, got numpy.str_)

Generation:  12
Best f1_score score: 0.9515427192467779
Generation:  48%|████▊     | 12/25 [40:13<1:05:32, 302.47s/it]Generation:  13
Best f1_score score: 0.9515427192467779
Generation:  52%|█████▏    | 13/25 [41:37<47:12, 236.07s/it]  Generation:  14
Best f1_score score: 0.9515427192467779
Generation:  56%|█████▌    | 14/25 [43:48<37:28, 204.38s/it]Generation:  15
Best f1_score score: 0.9515427192467779
Generation:  60%|██████    | 15/25 [46:53<33:05, 198.51s/it]Generation:  16
Best f1_score score: 0.9515427192467779
Generation:  64%|██████▍   | 16/25 [48:20<24:44, 164.91s/it]WARNING AN INDIVIDUAL TIMED OUT: 
 <tpot2.search_spaces.pipelines.sequential.SequentialPipelineIndividual object at 0x15545d431b40> 

WARNING AN INDIVIDUAL TIMED OUT: 
 <tpot2.search_spaces.pipelines.sequential.SequentialPipelineIndividual object at 0x155474d3b5b0> 

Generation:  17
Best f1_score score: 0.9515427192467779
Generation:  68%|██████▊   | 17/25 [58:31<39:53, 299.23s/it]WARNING AN INDIVIDUAL TIMED OUT: 
 <tpot2.search_spaces.pipelines.sequential.SequentialPipelineIndividual object at 0x15545dff1fc0> 

Generation:  18
Best f1_score score: 0.9515427192467779
Generation:  72%|███████▏  | 18/25 [1:08:42<45:50, 392.96s/it]Generation:  19
Best f1_score score: 0.9515427192467779
Generation:  76%|███████▌  | 19/25 [1:11:53<33:12, 332.17s/it]Generation:  20
Best f1_score score: 0.9515427192467779
Generation:  80%|████████  | 20/25 [1:14:00<22:33, 270.73s/it]Generation:  21
Best f1_score score: 0.9515427192467779
Generation:  84%|████████▍ | 21/25 [1:18:04<17:30, 262.59s/it]Generation:  22
Best f1_score score: 0.9515427192467779
Generation:  88%|████████▊ | 22/25 [1:20:09<11:03, 221.23s/it]Generation:  23
Best f1_score score: 0.9515427192467779
Generation:  92%|█████████▏| 23/25 [1:26:55<09:13, 276.84s/it]Generation:  24
Best f1_score score: 0.9518090253159649
Generation:  96%|█████████▌| 24/25 [1:28:35<03:43, 223.58s/it]WARNING THIS INDIVIDUAL CAUSED AND EXCEPTION 
 <tpot2.search_spaces.pipelines.sequential.SequentialPipelineIndividual object at 0x15545f8c1a20> 
 Argument 'metric' has incorrect type (expected str, got numpy.str_) 
 Traceback (most recent call last):
  File "/common/ketrong/tpotexp/tpot2/tpot2/utils/eval_utils.py", line 53, in objective_nan_wrapper
    value = func_timeout.func_timeout(timeout, objective_function, args=[individual], kwargs=objective_kwargs)
  File "/common/ketrong/tpotexp/env/lib/python3.10/site-packages/func_timeout/dafunc.py", line 108, in func_timeout
    raise_exception(exception)
  File "/common/ketrong/tpotexp/env/lib/python3.10/site-packages/func_timeout/py3_raise.py", line 7, in raise_exception
    raise exception[0] from None
  File "/common/ketrong/tpotexp/tpot2/tpot2/tpot_estimator/estimator.py", line 623, in objective_function
    return objective_function_generator(
  File "/common/ketrong/tpotexp/tpot2/tpot2/tpot_estimator/estimator_utils.py", line 55, in objective_function_generator
    cv_obj_scores = cross_val_score_objective(sklearn.base.clone(pipeline),x,y,scorers=scorers, cv=cv , fold=step)
  File "/common/ketrong/tpotexp/tpot2/tpot2/tpot_estimator/cross_val_utils.py", line 31, in cross_val_score_objective
    this_fold_scores = [sklearn.metrics.get_scorer(scorer)(this_fold_pipeline, X_test, y_test) for scorer in scorers]
  File "/common/ketrong/tpotexp/tpot2/tpot2/tpot_estimator/cross_val_utils.py", line 31, in <listcomp>
    this_fold_scores = [sklearn.metrics.get_scorer(scorer)(this_fold_pipeline, X_test, y_test) for scorer in scorers]
  File "/common/ketrong/tpotexp/env/lib/python3.10/site-packages/sklearn/metrics/_scorer.py", line 279, in __call__
    return self._score(partial(_cached_call, None), estimator, X, y_true, **_kwargs)
  File "/common/ketrong/tpotexp/env/lib/python3.10/site-packages/sklearn/metrics/_scorer.py", line 371, in _score
    y_pred = method_caller(
  File "/common/ketrong/tpotexp/env/lib/python3.10/site-packages/sklearn/metrics/_scorer.py", line 89, in _cached_call
    result, _ = _get_response_values(
  File "/common/ketrong/tpotexp/env/lib/python3.10/site-packages/sklearn/utils/_response.py", line 211, in _get_response_values
    y_pred = prediction_method(X)
  File "/common/ketrong/tpotexp/env/lib/python3.10/site-packages/sklearn/pipeline.py", line 601, in predict
    return self.steps[-1][1].predict(Xt, **params)
  File "/common/ketrong/tpotexp/env/lib/python3.10/site-packages/sklearn/neighbors/_classification.py", line 259, in predict
    probabilities = self.predict_proba(X)
  File "/common/ketrong/tpotexp/env/lib/python3.10/site-packages/sklearn/neighbors/_classification.py", line 343, in predict_proba
    probabilities = ArgKminClassMode.compute(
  File "/common/ketrong/tpotexp/env/lib/python3.10/site-packages/sklearn/metrics/_pairwise_distances_reduction/_dispatcher.py", line 584, in compute
    return ArgKminClassMode64.compute(
TypeError: Argument 'metric' has incorrect type (expected str, got numpy.str_)

WARNING THIS INDIVIDUAL CAUSED AND EXCEPTION 
 <tpot2.search_spaces.pipelines.sequential.SequentialPipelineIndividual object at 0x155474d1db70> 
 Argument 'metric' has incorrect type (expected str, got numpy.str_) 
 Traceback (most recent call last):
  File "/common/ketrong/tpotexp/tpot2/tpot2/utils/eval_utils.py", line 53, in objective_nan_wrapper
    value = func_timeout.func_timeout(timeout, objective_function, args=[individual], kwargs=objective_kwargs)
  File "/common/ketrong/tpotexp/env/lib/python3.10/site-packages/func_timeout/dafunc.py", line 108, in func_timeout
    raise_exception(exception)
  File "/common/ketrong/tpotexp/env/lib/python3.10/site-packages/func_timeout/py3_raise.py", line 7, in raise_exception
    raise exception[0] from None
  File "/common/ketrong/tpotexp/tpot2/tpot2/tpot_estimator/estimator.py", line 623, in objective_function
    return objective_function_generator(
  File "/common/ketrong/tpotexp/tpot2/tpot2/tpot_estimator/estimator_utils.py", line 55, in objective_function_generator
    cv_obj_scores = cross_val_score_objective(sklearn.base.clone(pipeline),x,y,scorers=scorers, cv=cv , fold=step)
  File "/common/ketrong/tpotexp/tpot2/tpot2/tpot_estimator/cross_val_utils.py", line 31, in cross_val_score_objective
    this_fold_scores = [sklearn.metrics.get_scorer(scorer)(this_fold_pipeline, X_test, y_test) for scorer in scorers]
  File "/common/ketrong/tpotexp/tpot2/tpot2/tpot_estimator/cross_val_utils.py", line 31, in <listcomp>
    this_fold_scores = [sklearn.metrics.get_scorer(scorer)(this_fold_pipeline, X_test, y_test) for scorer in scorers]
  File "/common/ketrong/tpotexp/env/lib/python3.10/site-packages/sklearn/metrics/_scorer.py", line 279, in __call__
    return self._score(partial(_cached_call, None), estimator, X, y_true, **_kwargs)
  File "/common/ketrong/tpotexp/env/lib/python3.10/site-packages/sklearn/metrics/_scorer.py", line 371, in _score
    y_pred = method_caller(
  File "/common/ketrong/tpotexp/env/lib/python3.10/site-packages/sklearn/metrics/_scorer.py", line 89, in _cached_call
    result, _ = _get_response_values(
  File "/common/ketrong/tpotexp/env/lib/python3.10/site-packages/sklearn/utils/_response.py", line 211, in _get_response_values
    y_pred = prediction_method(X)
  File "/common/ketrong/tpotexp/env/lib/python3.10/site-packages/sklearn/pipeline.py", line 601, in predict
    return self.steps[-1][1].predict(Xt, **params)
  File "/common/ketrong/tpotexp/env/lib/python3.10/site-packages/sklearn/neighbors/_classification.py", line 259, in predict
    probabilities = self.predict_proba(X)
  File "/common/ketrong/tpotexp/env/lib/python3.10/site-packages/sklearn/neighbors/_classification.py", line 343, in predict_proba
    probabilities = ArgKminClassMode.compute(
  File "/common/ketrong/tpotexp/env/lib/python3.10/site-packages/sklearn/metrics/_pairwise_distances_reduction/_dispatcher.py", line 584, in compute
    return ArgKminClassMode64.compute(
TypeError: Argument 'metric' has incorrect type (expected str, got numpy.str_)

Generation:  25
Best f1_score score: 0.9518098871097861
Generation: 100%|██████████| 25/25 [1:30:41<00:00, 194.32s/it]Generation: 100%|██████████| 25/25 [1:30:44<00:00, 217.79s/it]
2024-09-20 17:22:56,134 - distributed.scheduler - ERROR - Removing worker 'tcp://127.0.0.1:43511' caused the cluster to lose scattered data, which can't be recovered: {'ndarray-f44562fbd7a1642dc081874940e80174', 'ndarray-f430bc9ccb1f3648236e4de9f63fdac6'} (stimulus_id='handle-worker-cleanup-1726878176.134575')
Fitted
Pipeline(steps=[('histgradientboostingclassifier',
                 HistGradientBoostingClassifier(early_stopping=True,
                                                l2_regularization=8.52821e-08,
                                                learning_rate=0.1528455249346,
                                                max_features=0.9610774355841,
                                                max_leaf_nodes=1077,
                                                min_samples_leaf=84,
                                                n_iter_no_change=12, tol=0.0001,
                                                validation_fraction=None))])
score start
train score: {'auroc': 1.0, 'accuracy': 1.0, 'balanced_accuracy': 1.0, 'logloss': 4.381034156567042e-05, 'f1': 1.0}
original test score: {'auroc': 0.9996705337261784, 'accuracy': 0.96525, 'balanced_accuracy': 0.9652427719871558, 'logloss': 0.12019307587223392, 'f1': 0.9651866853971118}
imputed test score: {'auroc': 0.9991879694252608, 'accuracy': 0.9445, 'balanced_accuracy': 0.9445674176044011, 'logloss': 0.20437083393096112, '