[I 2024-11-16 20:54:25,245] Trial 99 finished with value: 0.1163213134132115 and parameters: {'model_name': 'SimpleImputer', 'strategy': 'median'}. Best is trial 7 with value: 0.1163213134132115.
running
[I 2024-11-16 20:54:25,355] Trial 105 finished with value: 0.1163213134132115 and parameters: {'model_name': 'SimpleImputer', 'strategy': 'median'}. Best is trial 7 with value: 0.1163213134132115.
[I 2024-11-16 20:54:25,439] Trial 106 finished with value: 0.1163213134132115 and parameters: {'model_name': 'SimpleImputer', 'strategy': 'median'}. Best is trial 7 with value: 0.1163213134132115.
[I 2024-11-16 20:54:25,521] Trial 102 finished with value: 0.1163213134132115 and parameters: {'model_name': 'SimpleImputer', 'strategy': 'median'}. Best is trial 7 with value: 0.1163213134132115.
running
running
running
running
[I 2024-11-16 20:54:25,717] Trial 107 finished with value: 0.1163213134132115 and parameters: {'model_name': 'SimpleImputer', 'strategy': 'median'}. Best is trial 7 with value: 0.1163213134132115.
running
[I 2024-11-16 20:54:25,848] Trial 110 finished with value: 0.1163213134132115 and parameters: {'model_name': 'SimpleImputer', 'strategy': 'median'}. Best is trial 7 with value: 0.1163213134132115.
[I 2024-11-16 20:54:25,953] Trial 108 finished with value: 0.1163213134132115 and parameters: {'model_name': 'SimpleImputer', 'strategy': 'median'}. Best is trial 7 with value: 0.1163213134132115.
running
running
[I 2024-11-16 20:54:26,077] Trial 111 finished with value: 0.1163213134132115 and parameters: {'model_name': 'SimpleImputer', 'strategy': 'median'}. Best is trial 7 with value: 0.1163213134132115.
[I 2024-11-16 20:54:26,183] Trial 113 finished with value: 0.1163213134132115 and parameters: {'model_name': 'SimpleImputer', 'strategy': 'median'}. Best is trial 7 with value: 0.1163213134132115.
running
running
[I 2024-11-16 20:54:26,347] Trial 115 finished with value: 0.1163213134132115 and parameters: {'model_name': 'SimpleImputer', 'strategy': 'median'}. Best is trial 7 with value: 0.1163213134132115.
running
[I 2024-11-16 20:54:26,469] Trial 109 finished with value: 0.1163213134132115 and parameters: {'model_name': 'SimpleImputer', 'strategy': 'median'}. Best is trial 7 with value: 0.1163213134132115.
[I 2024-11-16 20:54:26,562] Trial 112 finished with value: 0.1163213134132115 and parameters: {'model_name': 'SimpleImputer', 'strategy': 'median'}. Best is trial 7 with value: 0.1163213134132115.
running
running
[I 2024-11-16 20:54:26,781] Trial 120 finished with value: 0.1163213134132115 and parameters: {'model_name': 'SimpleImputer', 'strategy': 'median'}. Best is trial 7 with value: 0.1163213134132115.
[I 2024-11-16 20:54:26,875] Trial 118 finished with value: 0.1163213134132115 and parameters: {'model_name': 'SimpleImputer', 'strategy': 'median'}. Best is trial 7 with value: 0.1163213134132115.
running
[I 2024-11-16 20:54:26,966] Trial 114 finished with value: 0.1163213134132115 and parameters: {'model_name': 'SimpleImputer', 'strategy': 'median'}. Best is trial 7 with value: 0.1163213134132115.
running
running
[I 2024-11-16 20:54:27,073] Trial 116 finished with value: 0.1163213134132115 and parameters: {'model_name': 'SimpleImputer', 'strategy': 'median'}. Best is trial 7 with value: 0.1163213134132115.
[I 2024-11-16 20:54:27,156] Trial 117 finished with value: 0.1163213134132115 and parameters: {'model_name': 'SimpleImputer', 'strategy': 'median'}. Best is trial 7 with value: 0.1163213134132115.
running
[I 2024-11-16 20:54:27,269] Trial 122 finished with value: 0.1163213134132115 and parameters: {'model_name': 'SimpleImputer', 'strategy': 'median'}. Best is trial 7 with value: 0.1163213134132115.
running
running
[I 2024-11-16 20:54:27,397] Trial 119 finished with value: 0.1163213134132115 and parameters: {'model_name': 'SimpleImputer', 'strategy': 'median'}. Best is trial 7 with value: 0.1163213134132115.
[I 2024-11-16 20:54:27,491] Trial 130 finished with value: 0.3217958001009661 and parameters: {'model_name': 'SimpleImputer', 'strategy': 'constant'}. Best is trial 7 with value: 0.1163213134132115.
[I 2024-11-16 20:54:27,581] Trial 129 finished with value: 0.3217958001009661 and parameters: {'model_name': 'SimpleImputer', 'strategy': 'constant'}. Best is trial 7 with value: 0.1163213134132115.
[I 2024-11-16 20:54:27,662] Trial 123 finished with value: 0.1163213134132115 and parameters: {'model_name': 'SimpleImputer', 'strategy': 'median'}. Best is trial 7 with value: 0.1163213134132115.
running
running
running
[I 2024-11-16 20:54:27,774] Trial 121 finished with value: 0.1163213134132115 and parameters: {'model_name': 'SimpleImputer', 'strategy': 'median'}. Best is trial 7 with value: 0.1163213134132115.
[I 2024-11-16 20:54:27,877] Trial 131 finished with value: 0.3217958001009661 and parameters: {'model_name': 'SimpleImputer', 'strategy': 'constant'}. Best is trial 7 with value: 0.1163213134132115.
running
[I 2024-11-16 20:54:27,992] Trial 125 finished with value: 0.1163213134132115 and parameters: {'model_name': 'SimpleImputer', 'strategy': 'median'}. Best is trial 7 with value: 0.1163213134132115.
running
running
running
[I 2024-11-16 20:54:28,185] Trial 127 finished with value: 0.1163213134132115 and parameters: {'model_name': 'SimpleImputer', 'strategy': 'median'}. Best is trial 7 with value: 0.1163213134132115.
running
[I 2024-11-16 20:54:28,292] Trial 124 finished with value: 0.1163213134132115 and parameters: {'model_name': 'SimpleImputer', 'strategy': 'median'}. Best is trial 7 with value: 0.1163213134132115.
running
[I 2024-11-16 20:54:28,386] Trial 134 finished with value: 0.3217958001009661 and parameters: {'model_name': 'SimpleImputer', 'strategy': 'constant'}. Best is trial 7 with value: 0.1163213134132115.
[I 2024-11-16 20:54:28,387] Trial 126 finished with value: 0.1163213134132115 and parameters: {'model_name': 'SimpleImputer', 'strategy': 'median'}. Best is trial 7 with value: 0.1163213134132115.
running
running
[I 2024-11-16 20:54:28,473] Trial 128 finished with value: 0.1163213134132115 and parameters: {'model_name': 'SimpleImputer', 'strategy': 'median'}. Best is trial 7 with value: 0.1163213134132115.
[I 2024-11-16 20:54:28,517] Trial 135 finished with value: 0.3217958001009661 and parameters: {'model_name': 'SimpleImputer', 'strategy': 'constant'}. Best is trial 7 with value: 0.1163213134132115.
running
running
[I 2024-11-16 20:54:28,849] Trial 136 finished with value: 0.3217958001009661 and parameters: {'model_name': 'SimpleImputer', 'strategy': 'constant'}. Best is trial 7 with value: 0.1163213134132115.
running
[I 2024-11-16 20:54:29,024] Trial 133 finished with value: 0.1163213134132115 and parameters: {'model_name': 'SimpleImputer', 'strategy': 'median'}. Best is trial 7 with value: 0.1163213134132115.
running
[I 2024-11-16 20:54:29,149] Trial 132 finished with value: 0.1163213134132115 and parameters: {'model_name': 'SimpleImputer', 'strategy': 'median'}. Best is trial 7 with value: 0.1163213134132115.
running
[I 2024-11-16 20:54:29,316] Trial 139 finished with value: 0.1163213134132115 and parameters: {'model_name': 'SimpleImputer', 'strategy': 'median'}. Best is trial 7 with value: 0.1163213134132115.
running
[I 2024-11-16 20:54:29,458] Trial 138 finished with value: 0.1163213134132115 and parameters: {'model_name': 'SimpleImputer', 'strategy': 'median'}. Best is trial 7 with value: 0.1163213134132115.
running
[I 2024-11-16 20:54:29,570] Trial 140 finished with value: 0.1163213134132115 and parameters: {'model_name': 'SimpleImputer', 'strategy': 'median'}. Best is trial 7 with value: 0.1163213134132115.
running
[I 2024-11-16 20:54:29,687] Trial 143 finished with value: 0.1163213134132115 and parameters: {'model_name': 'SimpleImputer', 'strategy': 'median'}. Best is trial 7 with value: 0.1163213134132115.
running
[I 2024-11-16 20:54:29,813] Trial 141 finished with value: 0.1163213134132115 and parameters: {'model_name': 'SimpleImputer', 'strategy': 'median'}. Best is trial 7 with value: 0.1163213134132115.
[I 2024-11-16 20:54:29,911] Trial 148 finished with value: 0.1163213134132115 and parameters: {'model_name': 'SimpleImputer', 'strategy': 'median'}. Best is trial 7 with value: 0.1163213134132115.
[I 2024-11-16 20:54:30,000] Trial 137 finished with value: 0.1163213134132115 and parameters: {'model_name': 'SimpleImputer', 'strategy': 'median'}. Best is trial 7 with value: 0.1163213134132115.
running
running
running
[I 2024-11-16 20:54:30,106] Trial 144 finished with value: 0.1163213134132115 and parameters: {'model_name': 'SimpleImputer', 'strategy': 'median'}. Best is trial 7 with value: 0.1163213134132115.
running
[I 2024-11-16 20:54:30,252] Trial 146 finished with value: 0.1163213134132115 and parameters: {'model_name': 'SimpleImputer', 'strategy': 'median'}. Best is trial 7 with value: 0.1163213134132115.
running
[I 2024-11-16 20:54:30,363] Trial 149 finished with value: 0.1163213134132115 and parameters: {'model_name': 'SimpleImputer', 'strategy': 'median'}. Best is trial 7 with value: 0.1163213134132115.
[I 2024-11-16 20:54:30,453] Trial 142 finished with value: 0.1163213134132115 and parameters: {'model_name': 'SimpleImputer', 'strategy': 'median'}. Best is trial 7 with value: 0.1163213134132115.
running
running
[I 2024-11-16 20:54:30,602] Trial 147 finished with value: 0.1163213134132115 and parameters: {'model_name': 'SimpleImputer', 'strategy': 'median'}. Best is trial 7 with value: 0.1163213134132115.
[I 2024-11-16 20:54:30,698] Trial 150 finished with value: 0.1163213134132115 and parameters: {'model_name': 'SimpleImputer', 'strategy': 'median'}. Best is trial 7 with value: 0.1163213134132115.
running
running
[I 2024-11-16 20:54:30,874] Trial 152 finished with value: 0.1163213134132115 and parameters: {'model_name': 'SimpleImputer', 'strategy': 'median'}. Best is trial 7 with value: 0.1163213134132115.
[I 2024-11-16 20:54:31,006] Trial 154 finished with value: 0.1163213134132115 and parameters: {'model_name': 'SimpleImputer', 'strategy': 'median'}. Best is trial 7 with value: 0.1163213134132115.
running
[I 2024-11-16 20:54:31,105] Trial 145 finished with value: 0.1163213134132115 and parameters: {'model_name': 'SimpleImputer', 'strategy': 'median'}. Best is trial 7 with value: 0.1163213134132115.
running
running
[I 2024-11-16 20:54:31,243] Trial 161 finished with value: 0.11673540380339838 and parameters: {'model_name': 'SimpleImputer', 'strategy': 'mean'}. Best is trial 7 with value: 0.1163213134132115.
running
[I 2024-11-16 20:54:31,384] Trial 160 finished with value: 0.11673540380339838 and parameters: {'model_name': 'SimpleImputer', 'strategy': 'mean'}. Best is trial 7 with value: 0.1163213134132115.
[I 2024-11-16 20:54:31,488] Trial 151 finished with value: 0.1163213134132115 and parameters: {'model_name': 'SimpleImputer', 'strategy': 'median'}. Best is trial 7 with value: 0.1163213134132115.
[I 2024-11-16 20:54:31,573] Trial 162 finished with value: 0.11673540380339838 and parameters: {'model_name': 'SimpleImputer', 'strategy': 'mean'}. Best is trial 7 with value: 0.1163213134132115.
running
running
[I 2024-11-16 20:54:31,694] Trial 157 finished with value: 0.1163213134132115 and parameters: {'model_name': 'SimpleImputer', 'strategy': 'median'}. Best is trial 7 with value: 0.1163213134132115.
running
running
[I 2024-11-16 20:54:31,803] Trial 156 finished with value: 0.1163213134132115 and parameters: {'model_name': 'SimpleImputer', 'strategy': 'median'}. Best is trial 7 with value: 0.1163213134132115.
running
[I 2024-11-16 20:54:31,925] Trial 158 finished with value: 0.1163213134132115 and parameters: {'model_name': 'SimpleImputer', 'strategy': 'median'}. Best is trial 7 with value: 0.1163213134132115.
running
[I 2024-11-16 20:54:32,051] Trial 159 finished with value: 0.1163213134132115 and parameters: {'model_name': 'SimpleImputer', 'strategy': 'median'}. Best is trial 7 with value: 0.1163213134132115.
running
[I 2024-11-16 20:54:32,168] Trial 164 finished with value: 0.11673540380339838 and parameters: {'model_name': 'SimpleImputer', 'strategy': 'mean'}. Best is trial 7 with value: 0.1163213134132115.
[I 2024-11-16 20:54:32,265] Trial 155 finished with value: 0.1163213134132115 and parameters: {'model_name': 'SimpleImputer', 'strategy': 'median'}. Best is trial 7 with value: 0.1163213134132115.
[I 2024-11-16 20:54:32,363] Trial 163 finished with value: 0.11673540380339838 and parameters: {'model_name': 'SimpleImputer', 'strategy': 'mean'}. Best is trial 7 with value: 0.1163213134132115.
running
running
running
[I 2024-11-16 20:54:32,493] Trial 167 finished with value: 0.11673540380339838 and parameters: {'model_name': 'SimpleImputer', 'strategy': 'mean'}. Best is trial 7 with value: 0.1163213134132115.
[I 2024-11-16 20:54:32,604] Trial 168 finished with value: 0.11673540380339838 and parameters: {'model_name': 'SimpleImputer', 'strategy': 'mean'}. Best is trial 7 with value: 0.1163213134132115.
[I 2024-11-16 20:54:32,753] Trial 165 finished with value: 0.11673540380339838 and parameters: {'model_name': 'SimpleImputer', 'strategy': 'mean'}. Best is trial 7 with value: 0.1163213134132115.
running
[I 2024-11-16 20:54:32,886] Trial 153 finished with value: 0.1163213134132115 and parameters: {'model_name': 'SimpleImputer', 'strategy': 'median'}. Best is trial 7 with value: 0.1163213134132115.
running
running
running
[I 2024-11-16 20:54:33,004] Trial 166 finished with value: 0.1163213134132115 and parameters: {'model_name': 'SimpleImputer', 'strategy': 'median'}. Best is trial 7 with value: 0.1163213134132115.
running
[I 2024-11-16 20:54:33,189] Trial 172 finished with value: 0.1163213134132115 and parameters: {'model_name': 'SimpleImputer', 'strategy': 'median'}. Best is trial 7 with value: 0.1163213134132115.
running
[I 2024-11-16 20:54:33,398] Trial 174 finished with value: 0.1163213134132115 and parameters: {'model_name': 'SimpleImputer', 'strategy': 'median'}. Best is trial 7 with value: 0.1163213134132115.
[I 2024-11-16 20:54:33,495] Trial 173 finished with value: 0.1163213134132115 and parameters: {'model_name': 'SimpleImputer', 'strategy': 'median'}. Best is trial 7 with value: 0.1163213134132115.
running
[I 2024-11-16 20:54:33,616] Trial 171 finished with value: 0.1163213134132115 and parameters: {'model_name': 'SimpleImputer', 'strategy': 'median'}. Best is trial 7 with value: 0.1163213134132115.
running
running
[I 2024-11-16 20:54:33,780] Trial 169 finished with value: 0.1163213134132115 and parameters: {'model_name': 'SimpleImputer', 'strategy': 'median'}. Best is trial 7 with value: 0.1163213134132115.
[I 2024-11-16 20:54:33,880] Trial 175 finished with value: 0.1163213134132115 and parameters: {'model_name': 'SimpleImputer', 'strategy': 'median'}. Best is trial 7 with value: 0.1163213134132115.
running
running
[I 2024-11-16 20:54:33,995] Trial 170 finished with value: 0.1163213134132115 and parameters: {'model_name': 'SimpleImputer', 'strategy': 'median'}. Best is trial 7 with value: 0.1163213134132115.
running
[I 2024-11-16 20:54:34,180] Trial 178 finished with value: 0.1163213134132115 and parameters: {'model_name': 'SimpleImputer', 'strategy': 'median'}. Best is trial 7 with value: 0.1163213134132115.
running
[I 2024-11-16 20:54:34,300] Trial 176 finished with value: 0.1163213134132115 and parameters: {'model_name': 'SimpleImputer', 'strategy': 'median'}. Best is trial 7 with value: 0.1163213134132115.
running
[I 2024-11-16 20:54:34,402] Trial 179 finished with value: 0.1163213134132115 and parameters: {'model_name': 'SimpleImputer', 'strategy': 'median'}. Best is trial 7 with value: 0.1163213134132115.
running
[I 2024-11-16 20:54:34,624] Trial 185 finished with value: 0.1163213134132115 and parameters: {'model_name': 'SimpleImputer', 'strategy': 'median'}. Best is trial 7 with value: 0.1163213134132115.
[I 2024-11-16 20:54:34,727] Trial 180 finished with value: 0.1163213134132115 and parameters: {'model_name': 'SimpleImputer', 'strategy': 'median'}. Best is trial 7 with value: 0.1163213134132115.
running
[I 2024-11-16 20:54:34,840] Trial 181 finished with value: 0.1163213134132115 and parameters: {'model_name': 'SimpleImputer', 'strategy': 'median'}. Best is trial 7 with value: 0.1163213134132115.
running
running
[I 2024-11-16 20:54:34,956] Trial 182 finished with value: 0.1163213134132115 and parameters: {'model_name': 'SimpleImputer', 'strategy': 'median'}. Best is trial 7 with value: 0.1163213134132115.
[I 2024-11-16 20:54:35,051] Trial 186 finished with value: 0.1163213134132115 and parameters: {'model_name': 'SimpleImputer', 'strategy': 'median'}. Best is trial 7 with value: 0.1163213134132115.
running
running
[I 2024-11-16 20:54:35,163] Trial 183 finished with value: 0.1163213134132115 and parameters: {'model_name': 'SimpleImputer', 'strategy': 'median'}. Best is trial 7 with value: 0.1163213134132115.
[I 2024-11-16 20:54:35,285] Trial 184 finished with value: 0.1163213134132115 and parameters: {'model_name': 'SimpleImputer', 'strategy': 'median'}. Best is trial 7 with value: 0.1163213134132115.
[I 2024-11-16 20:54:35,372] Trial 177 finished with value: 0.1163213134132115 and parameters: {'model_name': 'SimpleImputer', 'strategy': 'median'}. Best is trial 7 with value: 0.1163213134132115.
[I 2024-11-16 20:54:35,510] Trial 188 finished with value: 0.1163213134132115 and parameters: {'model_name': 'SimpleImputer', 'strategy': 'median'}. Best is trial 7 with value: 0.1163213134132115.
[I 2024-11-16 20:54:35,602] Trial 190 finished with value: 0.1163213134132115 and parameters: {'model_name': 'SimpleImputer', 'strategy': 'median'}. Best is trial 7 with value: 0.1163213134132115.
[I 2024-11-16 20:54:35,604] Trial 187 finished with value: 0.1163213134132115 and parameters: {'model_name': 'SimpleImputer', 'strategy': 'median'}. Best is trial 7 with value: 0.1163213134132115.
[I 2024-11-16 20:54:35,806] Trial 192 finished with value: 0.1163213134132115 and parameters: {'model_name': 'SimpleImputer', 'strategy': 'median'}. Best is trial 7 with value: 0.1163213134132115.
[I 2024-11-16 20:54:35,907] Trial 189 finished with value: 0.1163213134132115 and parameters: {'model_name': 'SimpleImputer', 'strategy': 'median'}. Best is trial 7 with value: 0.1163213134132115.
[I 2024-11-16 20:54:36,003] Trial 191 finished with value: 0.1163213134132115 and parameters: {'model_name': 'SimpleImputer', 'strategy': 'median'}. Best is trial 7 with value: 0.1163213134132115.
[I 2024-11-16 20:54:36,124] Trial 193 finished with value: 0.1163213134132115 and parameters: {'model_name': 'SimpleImputer', 'strategy': 'median'}. Best is trial 7 with value: 0.1163213134132115.
[I 2024-11-16 20:54:36,224] Trial 194 finished with value: 0.1163213134132115 and parameters: {'model_name': 'SimpleImputer', 'strategy': 'median'}. Best is trial 7 with value: 0.1163213134132115.
[I 2024-11-16 20:54:36,310] Trial 199 finished with value: 0.1163213134132115 and parameters: {'model_name': 'SimpleImputer', 'strategy': 'median'}. Best is trial 7 with value: 0.1163213134132115.
[I 2024-11-16 20:54:36,393] Trial 195 finished with value: 0.1163213134132115 and parameters: {'model_name': 'SimpleImputer', 'strategy': 'median'}. Best is trial 7 with value: 0.1163213134132115.
[I 2024-11-16 20:54:36,485] Trial 196 finished with value: 0.1163213134132115 and parameters: {'model_name': 'SimpleImputer', 'strategy': 'median'}. Best is trial 7 with value: 0.1163213134132115.
[I 2024-11-16 20:54:36,568] Trial 198 finished with value: 0.1163213134132115 and parameters: {'model_name': 'SimpleImputer', 'strategy': 'median'}. Best is trial 7 with value: 0.1163213134132115.
