[I 2024-11-01 19:35:07,222] Trial 146 finished with value: 0.2810248405939445 and parameters: {'model_name': 'IterativeImputer', 'estimator': 'RFR', 'initial_strategy': 'constant', 'n_nearest_features': 9, 'imputation_order': 'descending'}. Best is trial 141 with value: 0.2802742625010633.
running
[I 2024-11-01 20:17:47,365] Trial 147 finished with value: 0.2808940759254749 and parameters: {'model_name': 'IterativeImputer', 'estimator': 'RFR', 'initial_strategy': 'constant', 'n_nearest_features': 9, 'imputation_order': 'descending'}. Best is trial 141 with value: 0.2802742625010633.
running
[I 2024-11-01 20:46:44,846] Trial 148 finished with value: 0.28083320479506824 and parameters: {'model_name': 'IterativeImputer', 'estimator': 'RFR', 'initial_strategy': 'constant', 'n_nearest_features': 10, 'imputation_order': 'descending'}. Best is trial 141 with value: 0.2802742625010633.
running
[I 2024-11-01 20:46:57,349] Trial 149 finished with value: 0.2812552247539621 and parameters: {'model_name': 'IterativeImputer', 'estimator': 'RFR', 'initial_strategy': 'constant', 'n_nearest_features': 10, 'imputation_order': 'descending'}. Best is trial 141 with value: 0.2802742625010633.
running
[I 2024-11-01 20:49:18,520] Trial 150 finished with value: 0.2807517506283491 and parameters: {'model_name': 'IterativeImputer', 'estimator': 'RFR', 'initial_strategy': 'constant', 'n_nearest_features': 9, 'imputation_order': 'descending'}. Best is trial 141 with value: 0.2802742625010633.
running
[I 2024-11-01 20:50:02,483] Trial 151 finished with value: 0.28088219702895445 and parameters: {'model_name': 'IterativeImputer', 'estimator': 'RFR', 'initial_strategy': 'mean', 'n_nearest_features': 9, 'imputation_order': 'descending'}. Best is trial 141 with value: 0.2802742625010633.
running
[I 2024-11-01 21:04:36,846] Trial 152 finished with value: 0.2813506353398477 and parameters: {'model_name': 'IterativeImputer', 'estimator': 'RFR', 'initial_strategy': 'median', 'n_nearest_features': 9, 'imputation_order': 'ascending'}. Best is trial 141 with value: 0.2802742625010633.
running
[I 2024-11-01 21:59:40,823] Trial 153 finished with value: 0.28155396293368906 and parameters: {'model_name': 'IterativeImputer', 'estimator': 'RFR', 'initial_strategy': 'median', 'n_nearest_features': 9, 'imputation_order': 'ascending'}. Best is trial 141 with value: 0.2802742625010633.
running
[I 2024-11-01 22:00:56,589] Trial 155 finished with value: 0.2806555702817425 and parameters: {'model_name': 'IterativeImputer', 'estimator': 'RFR', 'initial_strategy': 'median', 'n_nearest_features': 9, 'imputation_order': 'ascending'}. Best is trial 141 with value: 0.2802742625010633.
running
[I 2024-11-01 22:00:56,832] Trial 171 finished with value: 0.3353969001482483 and parameters: {'model_name': 'SimpleImputer', 'strategy': 'mean'}. Best is trial 141 with value: 0.2802742625010633.
running
[I 2024-11-01 22:01:03,310] Trial 156 finished with value: 0.28094486917354056 and parameters: {'model_name': 'IterativeImputer', 'estimator': 'RFR', 'initial_strategy': 'median', 'n_nearest_features': 9, 'imputation_order': 'descending'}. Best is trial 141 with value: 0.2802742625010633.
running
[I 2024-11-01 22:01:49,824] Trial 169 finished with value: 0.3125438501064225 and parameters: {'model_name': 'IterativeImputer', 'estimator': 'RFR', 'initial_strategy': 'mean', 'n_nearest_features': 2, 'imputation_order': 'descending'}. Best is trial 141 with value: 0.2802742625010633.
running
[I 2024-11-01 22:02:05,872] Trial 157 finished with value: 0.28176252939413493 and parameters: {'model_name': 'IterativeImputer', 'estimator': 'RFR', 'initial_strategy': 'median', 'n_nearest_features': 9, 'imputation_order': 'descending'}. Best is trial 141 with value: 0.2802742625010633.
running
[I 2024-11-01 22:02:07,467] Trial 174 finished with value: 0.29630839333720804 and parameters: {'model_name': 'KNNImputer', 'n_neighbors': 93, 'weights': 'uniform'}. Best is trial 141 with value: 0.2802742625010633.
running
[I 2024-11-01 22:06:50,111] Trial 172 finished with value: 0.35143427833361895 and parameters: {'model_name': 'VAE', 'batch_size': 8, 'iterations': 2384, 'learning_rate': 0.013534078681538185, 'p_miss': 0.22404917576008374}. Best is trial 141 with value: 0.2802742625010633.
running
[I 2024-11-01 22:07:15,264] Trial 173 finished with value: 0.3390279810545597 and parameters: {'model_name': 'VAE', 'batch_size': 265, 'iterations': 2137, 'learning_rate': 0.010168910604211122, 'p_miss': 0.013189647205692184}. Best is trial 141 with value: 0.2802742625010633.
running
[I 2024-11-01 22:08:06,649] Trial 158 finished with value: 0.2809880296910808 and parameters: {'model_name': 'IterativeImputer', 'estimator': 'RFR', 'initial_strategy': 'median', 'n_nearest_features': 9, 'imputation_order': 'descending'}. Best is trial 141 with value: 0.2802742625010633.
running
[I 2024-11-01 22:23:02,492] Trial 159 finished with value: 0.28092363602267356 and parameters: {'model_name': 'IterativeImputer', 'estimator': 'RFR', 'initial_strategy': 'median', 'n_nearest_features': 9, 'imputation_order': 'descending'}. Best is trial 141 with value: 0.2802742625010633.
running
[I 2024-11-01 22:23:15,073] Trial 180 finished with value: 0.3056494789116444 and parameters: {'model_name': 'IterativeImputer', 'estimator': 'Ridge', 'initial_strategy': 'mean', 'n_nearest_features': 8, 'imputation_order': 'descending'}. Best is trial 141 with value: 0.2802742625010633.
running
[I 2024-11-01 22:26:27,966] Trial 160 finished with value: 0.2809164591237635 and parameters: {'model_name': 'IterativeImputer', 'estimator': 'RFR', 'initial_strategy': 'median', 'n_nearest_features': 9, 'imputation_order': 'descending'}. Best is trial 141 with value: 0.2802742625010633.
running
[I 2024-11-01 22:29:52,302] Trial 161 finished with value: 0.2812189545233176 and parameters: {'model_name': 'IterativeImputer', 'estimator': 'RFR', 'initial_strategy': 'median', 'n_nearest_features': 9, 'imputation_order': 'descending'}. Best is trial 141 with value: 0.2802742625010633.
running
[I 2024-11-01 22:30:21,796] Trial 162 finished with value: 0.28086405488225846 and parameters: {'model_name': 'IterativeImputer', 'estimator': 'RFR', 'initial_strategy': 'median', 'n_nearest_features': 9, 'imputation_order': 'descending'}. Best is trial 141 with value: 0.2802742625010633.
running
[I 2024-11-01 22:30:23,078] Trial 184 finished with value: 0.5930218164317839 and parameters: {'model_name': 'GAIN', 'batch_size': 80, 'hint_rate': 0.32184568689992793, 'alpha': 72, 'iterations': 40, 'learning_rate': 0.0003169802990542237, 'p_miss': 0.11311754726651811}. Best is trial 141 with value: 0.2802742625010633.
running
[I 2024-11-01 22:32:34,786] Trial 163 finished with value: 0.281692899684335 and parameters: {'model_name': 'IterativeImputer', 'estimator': 'RFR', 'initial_strategy': 'median', 'n_nearest_features': 9, 'imputation_order': 'descending'}. Best is trial 141 with value: 0.2802742625010633.
running
[I 2024-11-01 23:15:55,001] Trial 164 finished with value: 0.28107577138952794 and parameters: {'model_name': 'IterativeImputer', 'estimator': 'RFR', 'initial_strategy': 'constant', 'n_nearest_features': 9, 'imputation_order': 'descending'}. Best is trial 141 with value: 0.2802742625010633.
running
[I 2024-11-01 23:44:17,939] Trial 165 finished with value: 0.2811149304442658 and parameters: {'model_name': 'IterativeImputer', 'estimator': 'RFR', 'initial_strategy': 'constant', 'n_nearest_features': 9, 'imputation_order': 'descending'}. Best is trial 141 with value: 0.2802742625010633.
running
[I 2024-11-01 23:44:23,612] Trial 166 finished with value: 0.28128800187909936 and parameters: {'model_name': 'IterativeImputer', 'estimator': 'RFR', 'initial_strategy': 'constant', 'n_nearest_features': 9, 'imputation_order': 'descending'}. Best is trial 141 with value: 0.2802742625010633.
running
[I 2024-11-01 23:46:27,629] Trial 167 finished with value: 0.2820592028477463 and parameters: {'model_name': 'IterativeImputer', 'estimator': 'RFR', 'initial_strategy': 'constant', 'n_nearest_features': 9, 'imputation_order': 'descending'}. Best is trial 141 with value: 0.2802742625010633.
running
[I 2024-11-01 23:47:35,647] Trial 168 finished with value: 0.2802704145147891 and parameters: {'model_name': 'IterativeImputer', 'estimator': 'RFR', 'initial_strategy': 'mean', 'n_nearest_features': 9, 'imputation_order': 'descending'}. Best is trial 168 with value: 0.2802704145147891.
running
[I 2024-11-02 00:40:40,860] Trial 175 finished with value: 0.28144972064536866 and parameters: {'model_name': 'IterativeImputer', 'estimator': 'RFR', 'initial_strategy': 'constant', 'n_nearest_features': 8, 'imputation_order': 'descending'}. Best is trial 168 with value: 0.2802704145147891.
running
[I 2024-11-02 00:40:57,605] Trial 170 finished with value: 0.28176356055702556 and parameters: {'model_name': 'IterativeImputer', 'estimator': 'RFR', 'initial_strategy': 'mean', 'n_nearest_features': 8, 'imputation_order': 'descending'}. Best is trial 168 with value: 0.2802704145147891.
running
[I 2024-11-02 00:41:31,209] Trial 193 finished with value: 0.3119724963573078 and parameters: {'model_name': 'IterativeImputer', 'estimator': 'KNN', 'initial_strategy': 'median', 'n_nearest_features': 8, 'imputation_order': 'random'}. Best is trial 168 with value: 0.2802704145147891.
running
[I 2024-11-02 00:43:14,739] Trial 176 finished with value: 0.28199546296624883 and parameters: {'model_name': 'IterativeImputer', 'estimator': 'RFR', 'initial_strategy': 'mean', 'n_nearest_features': 8, 'imputation_order': 'descending'}. Best is trial 168 with value: 0.2802704145147891.
running
[I 2024-11-02 00:43:44,082] Trial 177 finished with value: 0.2812562878550578 and parameters: {'model_name': 'IterativeImputer', 'estimator': 'RFR', 'initial_strategy': 'constant', 'n_nearest_features': 8, 'imputation_order': 'descending'}. Best is trial 168 with value: 0.2802704145147891.
running
[I 2024-11-02 00:45:25,782] Trial 179 finished with value: 0.2814582654266099 and parameters: {'model_name': 'IterativeImputer', 'estimator': 'RFR', 'initial_strategy': 'constant', 'n_nearest_features': 8, 'imputation_order': 'descending'}. Best is trial 168 with value: 0.2802704145147891.
running
[I 2024-11-02 00:48:28,243] Trial 178 finished with value: 0.28175711438556794 and parameters: {'model_name': 'IterativeImputer', 'estimator': 'RFR', 'initial_strategy': 'mean', 'n_nearest_features': 8, 'imputation_order': 'descending'}. Best is trial 168 with value: 0.2802704145147891.
running
[I 2024-11-02 01:03:55,350] Trial 181 finished with value: 0.28233269304449127 and parameters: {'model_name': 'IterativeImputer', 'estimator': 'RFR', 'initial_strategy': 'mean', 'n_nearest_features': 8, 'imputation_order': 'descending'}. Best is trial 168 with value: 0.2802704145147891.
running
[I 2024-11-02 01:07:04,245] Trial 185 finished with value: 0.2814071048051131 and parameters: {'model_name': 'IterativeImputer', 'estimator': 'RFR', 'initial_strategy': 'constant', 'n_nearest_features': 8, 'imputation_order': 'descending'}. Best is trial 168 with value: 0.2802704145147891.
[I 2024-11-02 01:07:07,282] Trial 183 finished with value: 0.2811652315037255 and parameters: {'model_name': 'IterativeImputer', 'estimator': 'RFR', 'initial_strategy': 'constant', 'n_nearest_features': 8, 'imputation_order': 'descending'}. Best is trial 168 with value: 0.2802704145147891.
[I 2024-11-02 01:13:26,593] Trial 186 finished with value: 0.28191422410670647 and parameters: {'model_name': 'IterativeImputer', 'estimator': 'RFR', 'initial_strategy': 'mean', 'n_nearest_features': 8, 'imputation_order': 'descending'}. Best is trial 168 with value: 0.2802704145147891.
[I 2024-11-02 01:23:31,176] Trial 182 finished with value: 0.28110008225057487 and parameters: {'model_name': 'IterativeImputer', 'estimator': 'RFR', 'initial_strategy': 'mean', 'n_nearest_features': 9, 'imputation_order': 'descending'}. Best is trial 168 with value: 0.2802704145147891.
[I 2024-11-02 01:55:44,055] Trial 187 finished with value: 0.2822679574344129 and parameters: {'model_name': 'IterativeImputer', 'estimator': 'RFR', 'initial_strategy': 'mean', 'n_nearest_features': 8, 'imputation_order': 'descending'}. Best is trial 168 with value: 0.2802704145147891.
[I 2024-11-02 02:19:52,902] Trial 189 finished with value: 0.2813099347124454 and parameters: {'model_name': 'IterativeImputer', 'estimator': 'RFR', 'initial_strategy': 'constant', 'n_nearest_features': 8, 'imputation_order': 'descending'}. Best is trial 168 with value: 0.2802704145147891.
[I 2024-11-02 02:24:12,787] Trial 188 finished with value: 0.28228624044566797 and parameters: {'model_name': 'IterativeImputer', 'estimator': 'RFR', 'initial_strategy': 'mean', 'n_nearest_features': 8, 'imputation_order': 'descending'}. Best is trial 168 with value: 0.2802704145147891.
[I 2024-11-02 02:26:00,801] Trial 190 finished with value: 0.2810619734203417 and parameters: {'model_name': 'IterativeImputer', 'estimator': 'RFR', 'initial_strategy': 'mean', 'n_nearest_features': 8, 'imputation_order': 'random'}. Best is trial 168 with value: 0.2802704145147891.
[I 2024-11-02 02:28:31,866] Trial 191 finished with value: 0.28066951812170543 and parameters: {'model_name': 'IterativeImputer', 'estimator': 'RFR', 'initial_strategy': 'mean', 'n_nearest_features': 8, 'imputation_order': 'random'}. Best is trial 168 with value: 0.2802704145147891.
[I 2024-11-02 03:00:18,365] Trial 195 finished with value: 0.28270106098005776 and parameters: {'model_name': 'IterativeImputer', 'estimator': 'RFR', 'initial_strategy': 'median', 'n_nearest_features': 7, 'imputation_order': 'ascending'}. Best is trial 168 with value: 0.2802704145147891.
[I 2024-11-02 03:19:23,527] Trial 192 finished with value: 0.2821338650549503 and parameters: {'model_name': 'IterativeImputer', 'estimator': 'RFR', 'initial_strategy': 'mean', 'n_nearest_features': 8, 'imputation_order': 'descending'}. Best is trial 168 with value: 0.2802704145147891.
[I 2024-11-02 03:35:25,476] Trial 194 finished with value: 0.2809045048856083 and parameters: {'model_name': 'IterativeImputer', 'estimator': 'RFR', 'initial_strategy': 'median', 'n_nearest_features': 9, 'imputation_order': 'ascending'}. Best is trial 168 with value: 0.2802704145147891.
[I 2024-11-02 03:37:40,413] Trial 196 finished with value: 0.2813053446531502 and parameters: {'model_name': 'IterativeImputer', 'estimator': 'RFR', 'initial_strategy': 'mean', 'n_nearest_features': 9, 'imputation_order': 'descending'}. Best is trial 168 with value: 0.2802704145147891.
[I 2024-11-02 03:39:30,233] Trial 197 finished with value: 0.28105831118036495 and parameters: {'model_name': 'IterativeImputer', 'estimator': 'RFR', 'initial_strategy': 'mean', 'n_nearest_features': 9, 'imputation_order': 'ascending'}. Best is trial 168 with value: 0.2802704145147891.
[I 2024-11-02 03:42:00,780] Trial 198 finished with value: 0.2811110000236159 and parameters: {'model_name': 'IterativeImputer', 'estimator': 'RFR', 'initial_strategy': 'mean', 'n_nearest_features': 9, 'imputation_order': 'ascending'}. Best is trial 168 with value: 0.2802704145147891.
