Run: 26
/cm/local/apps/slurm/var/spool/job1042849/slurm_script: line 27: 
pip install -e tpot2
pip install -r tpot2/ImputerExperiments/requirements_.txt
: No such file or directory
RunStart
Version 0.1.7a0 of tpot2 is outdated. Version 0.1.8a0 was released Tuesday September 17, 2024.
starting loops
../data/c/1558/1558.pkl
working on 
../data/c/1558/class_full_MCAR_0.1_2
2.4713754653930664
running experiment 1/3 - Does large hyperparameter space improve reconstruction accuracy over simple
[I 2024-11-06 20:49:44,438] A new study created in memory with name: no-name-0ee88975-04ed-4824-82a1-c0634bb268d1
running
running
running
running
running
running
running
running
running
running
running
running
running
running
running
running
[I 2024-11-06 20:49:44,697] Trial 6 finished with value: 0.29517637676582387 and parameters: {'model_name': 'SimpleImputer', 'strategy': 'median'}. Best is trial 6 with value: 0.29517637676582387.
running
[I 2024-11-06 20:49:44,914] Trial 1 finished with value: 0.29517637676582387 and parameters: {'model_name': 'SimpleImputer', 'strategy': 'median'}. Best is trial 6 with value: 0.29517637676582387.
running
[I 2024-11-06 20:49:45,088] Trial 13 finished with value: 0.29517637676582387 and parameters: {'model_name': 'SimpleImputer', 'strategy': 'median'}. Best is trial 6 with value: 0.29517637676582387.
running
[I 2024-11-06 20:49:47,965] Trial 0 finished with value: 0.24657206421321573 and parameters: {'model_name': 'KNNImputer', 'n_neighbors': 136, 'weights': 'distance'}. Best is trial 0 with value: 0.24657206421321573.
running
[I 2024-11-06 20:49:50,690] Trial 4 finished with value: 0.25767043138317386 and parameters: {'model_name': 'KNNImputer', 'n_neighbors': 2652, 'weights': 'uniform'}. Best is trial 0 with value: 0.24657206421321573.
running
[I 2024-11-06 20:50:00,502] Trial 12 finished with value: 0.39448914722355655 and parameters: {'model_name': 'VAE', 'batch_size': 141, 'iterations': 5, 'learning_rate': 0.0006685459553243988, 'p_miss': 0.25486975617478735}. Best is trial 0 with value: 0.24657206421321573.
running
[I 2024-11-06 20:50:03,497] Trial 5 finished with value: inf and parameters: {'model_name': 'GAIN', 'batch_size': 5, 'hint_rate': 0.10704769318961467, 'alpha': 65, 'iterations': 46, 'learning_rate': 0.05471344130211186, 'p_miss': 0.0468758734463639}. Best is trial 0 with value: 0.24657206421321573.
running
[I 2024-11-06 20:50:04,451] Trial 22 finished with value: 0.25793793757773076 and parameters: {'model_name': 'SimpleImputer', 'strategy': 'mean'}. Best is trial 0 with value: 0.24657206421321573.
running
[I 2024-11-06 20:50:04,954] Trial 3 finished with value: 0.24463364031299123 and parameters: {'model_name': 'IterativeImputer', 'estimator': 'Ridge', 'initial_strategy': 'median', 'n_nearest_features': 3, 'imputation_order': 'roman'}. Best is trial 3 with value: 0.24463364031299123.
running
[I 2024-11-06 20:50:07,878] Trial 21 finished with value: 0.44787450158010456 and parameters: {'model_name': 'GAIN', 'batch_size': 11, 'hint_rate': 0.7182918128472967, 'alpha': 13, 'iterations': 10, 'learning_rate': 0.010537314324602193, 'p_miss': 0.05913488828864156}. Best is trial 3 with value: 0.24463364031299123.
running
[I 2024-11-06 20:50:10,696] Trial 11 finished with value: 0.4492888657786221 and parameters: {'model_name': 'GAIN', 'batch_size': 137, 'hint_rate': 0.4752160489327508, 'alpha': 76, 'iterations': 20, 'learning_rate': 0.010687810954311275, 'p_miss': 0.01597445561259707}. Best is trial 3 with value: 0.24463364031299123.
running
[I 2024-11-06 20:50:14,190] Trial 20 finished with value: 0.2416608666547253 and parameters: {'model_name': 'IterativeImputer', 'estimator': 'Ridge', 'initial_strategy': 'most_frequent', 'n_nearest_features': 15, 'imputation_order': 'descending'}. Best is trial 20 with value: 0.2416608666547253.
running
[I 2024-11-06 20:50:19,726] Trial 14 finished with value: 0.2703988554801248 and parameters: {'model_name': 'IterativeImputer', 'estimator': 'KNN', 'initial_strategy': 'constant', 'n_nearest_features': 1, 'imputation_order': 'descending'}. Best is trial 20 with value: 0.2416608666547253.
running
[I 2024-11-06 20:50:26,268] Trial 25 finished with value: 0.24722290531155672 and parameters: {'model_name': 'IterativeImputer', 'estimator': 'Ridge', 'initial_strategy': 'median', 'n_nearest_features': 2, 'imputation_order': 'roman'}. Best is trial 20 with value: 0.2416608666547253.
running
[I 2024-11-06 20:50:28,065] Trial 24 finished with value: 0.4640133965326666 and parameters: {'model_name': 'GAIN', 'batch_size': 125, 'hint_rate': 0.8949948214477141, 'alpha': 23, 'iterations': 36, 'learning_rate': 0.00022088292219091761, 'p_miss': 0.10408105238582041}. Best is trial 20 with value: 0.2416608666547253.
running
[I 2024-11-06 20:50:29,258] Trial 26 finished with value: 0.24722290531155672 and parameters: {'model_name': 'IterativeImputer', 'estimator': 'Ridge', 'initial_strategy': 'median', 'n_nearest_features': 2, 'imputation_order': 'roman'}. Best is trial 20 with value: 0.2416608666547253.
running
[I 2024-11-06 20:50:30,221] Trial 17 finished with value: 0.25105175498462173 and parameters: {'model_name': 'IterativeImputer', 'estimator': 'KNN', 'initial_strategy': 'constant', 'n_nearest_features': 7, 'imputation_order': 'random'}. Best is trial 20 with value: 0.2416608666547253.
running
[I 2024-11-06 20:50:35,610] Trial 15 finished with value: 0.38465550511174534 and parameters: {'model_name': 'VAE', 'batch_size': 188, 'iterations': 27, 'learning_rate': 0.0005249931365599367, 'p_miss': 0.19627903097361754}. Best is trial 20 with value: 0.2416608666547253.
running
[I 2024-11-06 20:50:40,780] Trial 28 finished with value: 0.24166082720653756 and parameters: {'model_name': 'IterativeImputer', 'estimator': 'Ridge', 'initial_strategy': 'median', 'n_nearest_features': 15, 'imputation_order': 'roman'}. Best is trial 28 with value: 0.24166082720653756.
running
[I 2024-11-06 20:50:45,587] Trial 27 finished with value: 0.24133164787582384 and parameters: {'model_name': 'IterativeImputer', 'estimator': 'Ridge', 'initial_strategy': 'median', 'n_nearest_features': 4, 'imputation_order': 'roman'}. Best is trial 27 with value: 0.24133164787582384.
running
[I 2024-11-06 20:50:49,387] Trial 29 finished with value: 0.24166082199798272 and parameters: {'model_name': 'IterativeImputer', 'estimator': 'Ridge', 'initial_strategy': 'most_frequent', 'n_nearest_features': 16, 'imputation_order': 'roman'}. Best is trial 27 with value: 0.24133164787582384.
running
[I 2024-11-06 20:50:53,439] Trial 19 finished with value: 0.38491117694947574 and parameters: {'model_name': 'VAE', 'batch_size': 237, 'iterations': 40, 'learning_rate': 0.00045171713003746677, 'p_miss': 0.09673050188386707}. Best is trial 27 with value: 0.24133164787582384.
running
[I 2024-11-06 20:50:53,812] Trial 32 finished with value: 0.2416608666547253 and parameters: {'model_name': 'IterativeImputer', 'estimator': 'Ridge', 'initial_strategy': 'most_frequent', 'n_nearest_features': 16, 'imputation_order': 'descending'}. Best is trial 27 with value: 0.24133164787582384.
running
[I 2024-11-06 20:50:54,760] Trial 30 finished with value: 0.24166082199798272 and parameters: {'model_name': 'IterativeImputer', 'estimator': 'Ridge', 'initial_strategy': 'most_frequent', 'n_nearest_features': 15, 'imputation_order': 'roman'}. Best is trial 27 with value: 0.24133164787582384.
running
[I 2024-11-06 20:51:04,009] Trial 33 finished with value: 0.2416608666547253 and parameters: {'model_name': 'IterativeImputer', 'estimator': 'Ridge', 'initial_strategy': 'most_frequent', 'n_nearest_features': 16, 'imputation_order': 'descending'}. Best is trial 27 with value: 0.24133164787582384.
running
[I 2024-11-06 20:51:06,397] Trial 8 finished with value: 0.26686394172662575 and parameters: {'model_name': 'IterativeImputer', 'estimator': 'KNN', 'initial_strategy': 'mean', 'n_nearest_features': 16, 'imputation_order': 'roman'}. Best is trial 27 with value: 0.24133164787582384.
running
[I 2024-11-06 20:51:15,198] Trial 31 finished with value: 0.24166404470347355 and parameters: {'model_name': 'IterativeImputer', 'estimator': 'Ridge', 'initial_strategy': 'most_frequent', 'n_nearest_features': 14, 'imputation_order': 'arabic'}. Best is trial 27 with value: 0.24133164787582384.
running
[I 2024-11-06 20:51:17,253] Trial 10 finished with value: 0.2611635656076383 and parameters: {'model_name': 'VAE', 'batch_size': 515, 'iterations': 16, 'learning_rate': 0.012602446564375553, 'p_miss': 0.15010293587746018}. Best is trial 27 with value: 0.24133164787582384.
running
[I 2024-11-06 20:51:20,103] Trial 42 finished with value: 0.25793793757773076 and parameters: {'model_name': 'KNNImputer', 'n_neighbors': 3555, 'weights': 'uniform'}. Best is trial 27 with value: 0.24133164787582384.
running
[I 2024-11-06 20:51:22,288] Trial 43 finished with value: 0.25793793757773076 and parameters: {'model_name': 'KNNImputer', 'n_neighbors': 3520, 'weights': 'uniform'}. Best is trial 27 with value: 0.24133164787582384.
running
[I 2024-11-06 20:51:26,347] Trial 44 finished with value: 0.24963932731277733 and parameters: {'model_name': 'KNNImputer', 'n_neighbors': 649, 'weights': 'distance'}. Best is trial 27 with value: 0.24133164787582384.
running
[I 2024-11-06 20:51:37,167] Trial 2 finished with value: inf and parameters: {'model_name': 'GAIN', 'batch_size': 25, 'hint_rate': 0.7426264492397043, 'alpha': 18, 'iterations': 837, 'learning_rate': 0.005327244594995978, 'p_miss': 0.026352795798075188}. Best is trial 27 with value: 0.24133164787582384.
running
[I 2024-11-06 20:52:40,481] Trial 36 finished with value: 0.24167737537670314 and parameters: {'model_name': 'IterativeImputer', 'estimator': 'Bayesian', 'initial_strategy': 'mean', 'n_nearest_features': 16, 'imputation_order': 'roman', 'sample_posterior': False}. Best is trial 27 with value: 0.24133164787582384.
running
[I 2024-11-06 20:53:07,713] Trial 23 finished with value: 0.38017257917519004 and parameters: {'model_name': 'VAE', 'batch_size': 939, 'iterations': 39, 'learning_rate': 0.0005032626521693782, 'p_miss': 0.053029739496334105}. Best is trial 27 with value: 0.24133164787582384.
running
[I 2024-11-06 20:54:22,432] Trial 38 finished with value: 0.24146642454173167 and parameters: {'model_name': 'IterativeImputer', 'estimator': 'Bayesian', 'initial_strategy': 'mean', 'n_nearest_features': 12, 'imputation_order': 'roman', 'sample_posterior': False}. Best is trial 27 with value: 0.24133164787582384.
running
[I 2024-11-06 20:54:46,532] Trial 40 finished with value: 0.3474587299523811 and parameters: {'model_name': 'IterativeImputer', 'estimator': 'Bayesian', 'initial_strategy': 'mean', 'n_nearest_features': 10, 'imputation_order': 'arabic', 'sample_posterior': True}. Best is trial 27 with value: 0.24133164787582384.
running
[I 2024-11-06 20:54:58,311] Trial 35 finished with value: 0.3526337949139796 and parameters: {'model_name': 'IterativeImputer', 'estimator': 'Bayesian', 'initial_strategy': 'mean', 'n_nearest_features': 16, 'imputation_order': 'arabic', 'sample_posterior': True}. Best is trial 27 with value: 0.24133164787582384.
running
[I 2024-11-06 20:55:22,247] Trial 47 finished with value: 0.3451597889488626 and parameters: {'model_name': 'IterativeImputer', 'estimator': 'Bayesian', 'initial_strategy': 'median', 'n_nearest_features': 12, 'imputation_order': 'ascending', 'sample_posterior': True}. Best is trial 27 with value: 0.24133164787582384.
running
[I 2024-11-06 20:58:11,149] Trial 50 finished with value: 0.24152973292864197 and parameters: {'model_name': 'IterativeImputer', 'estimator': 'Bayesian', 'initial_strategy': 'mean', 'n_nearest_features': 12, 'imputation_order': 'ascending', 'sample_posterior': False}. Best is trial 27 with value: 0.24133164787582384.
running
[I 2024-11-06 21:31:38,275] Trial 9 finished with value: 0.24546569514656444 and parameters: {'model_name': 'IterativeImputer', 'estimator': 'RFR', 'initial_strategy': 'median', 'n_nearest_features': 4, 'imputation_order': 'ascending'}. Best is trial 27 with value: 0.24133164787582384.
running
[I 2024-11-06 21:31:38,759] Trial 55 finished with value: 0.44933240409668684 and parameters: {'model_name': 'SimpleImputer', 'strategy': 'constant'}. Best is trial 27 with value: 0.24133164787582384.
running
[I 2024-11-06 21:35:28,245] Trial 56 finished with value: 0.24161697928312376 and parameters: {'model_name': 'IterativeImputer', 'estimator': 'Bayesian', 'initial_strategy': 'most_frequent', 'n_nearest_features': 11, 'imputation_order': 'roman', 'sample_posterior': False}. Best is trial 27 with value: 0.24133164787582384.
running
[I 2024-11-06 21:39:06,919] Trial 57 finished with value: 0.24152973292864197 and parameters: {'model_name': 'IterativeImputer', 'estimator': 'Bayesian', 'initial_strategy': 'mean', 'n_nearest_features': 12, 'imputation_order': 'ascending', 'sample_posterior': False}. Best is trial 27 with value: 0.24133164787582384.
running
[I 2024-11-06 21:42:47,081] Trial 58 finished with value: 0.24152973292864197 and parameters: {'model_name': 'IterativeImputer', 'estimator': 'Bayesian', 'initial_strategy': 'mean', 'n_nearest_features': 12, 'imputation_order': 'ascending', 'sample_posterior': False}. Best is trial 27 with value: 0.24133164787582384.
running
[I 2024-11-06 21:44:39,593] Trial 54 finished with value: 0.2478547806312001 and parameters: {'model_name': 'IterativeImputer', 'estimator': 'RFR', 'initial_strategy': 'mean', 'n_nearest_features': 7, 'imputation_order': 'ascending'}. Best is trial 27 with value: 0.24133164787582384.
running
[I 2024-11-06 21:45:03,830] Trial 45 finished with value: 0.23040139619297723 and parameters: {'model_name': 'IterativeImputer', 'estimator': 'RFR', 'initial_strategy': 'most_frequent', 'n_nearest_features': 12, 'imputation_order': 'ascending'}. Best is trial 45 with value: 0.23040139619297723.
running
[I 2024-11-06 21:45:38,606] Trial 41 finished with value: 0.230614329545579 and parameters: {'model_name': 'IterativeImputer', 'estimator': 'RFR', 'initial_strategy': 'most_frequent', 'n_nearest_features': 12, 'imputation_order': 'arabic'}. Best is trial 45 with value: 0.23040139619297723.
running
[I 2024-11-06 21:46:02,949] Trial 59 finished with value: 0.24162269617161086 and parameters: {'model_name': 'IterativeImputer', 'estimator': 'Bayesian', 'initial_strategy': 'mean', 'n_nearest_features': 13, 'imputation_order': 'ascending', 'sample_posterior': False}. Best is trial 45 with value: 0.23040139619297723.
running
[I 2024-11-06 21:46:03,820] Trial 7 finished with value: 0.22714786829364203 and parameters: {'model_name': 'IterativeImputer', 'estimator': 'RFR', 'initial_strategy': 'mean', 'n_nearest_features': 14, 'imputation_order': 'ascending'}. Best is trial 7 with value: 0.22714786829364203.
running
[I 2024-11-06 21:46:04,404] Trial 63 finished with value: 0.3492679421911211 and parameters: {'model_name': 'SimpleImputer', 'strategy': 'most_frequent'}. Best is trial 7 with value: 0.22714786829364203.
running
[I 2024-11-06 21:46:06,392] Trial 65 finished with value: 0.4659183433340021 and parameters: {'model_name': 'GAIN', 'batch_size': 2, 'hint_rate': 0.06166650776581356, 'alpha': 97, 'iterations': 1, 'learning_rate': 0.0808386380008138, 'p_miss': 0.2769266960224789}. Best is trial 7 with value: 0.22714786829364203.
running
[I 2024-11-06 21:46:07,299] Trial 64 finished with value: 0.46150395752026724 and parameters: {'model_name': 'GAIN', 'batch_size': 1, 'hint_rate': 0.07789052279915487, 'alpha': 99, 'iterations': 1, 'learning_rate': 0.09704144973366434, 'p_miss': 0.2995767995747898}. Best is trial 7 with value: 0.22714786829364203.
running
[I 2024-11-06 21:47:56,041] Trial 60 finished with value: 0.24162269617161086 and parameters: {'model_name': 'IterativeImputer', 'estimator': 'Bayesian', 'initial_strategy': 'mean', 'n_nearest_features': 13, 'imputation_order': 'ascending', 'sample_posterior': False}. Best is trial 7 with value: 0.22714786829364203.
running
[I 2024-11-06 21:49:20,525] Trial 49 finished with value: 0.2311609432903441 and parameters: {'model_name': 'IterativeImputer', 'estimator': 'RFR', 'initial_strategy': 'median', 'n_nearest_features': 12, 'imputation_order': 'ascending'}. Best is trial 7 with value: 0.22714786829364203.
running
[I 2024-11-06 21:49:22,556] Trial 51 finished with value: 0.2310702214094476 and parameters: {'model_name': 'IterativeImputer', 'estimator': 'RFR', 'initial_strategy': 'most_frequent', 'n_nearest_features': 12, 'imputation_order': 'ascending'}. Best is trial 7 with value: 0.22714786829364203.
running
[I 2024-11-06 21:49:24,582] Trial 52 finished with value: 0.2301739978976661 and parameters: {'model_name': 'IterativeImputer', 'estimator': 'RFR', 'initial_strategy': 'most_frequent', 'n_nearest_features': 12, 'imputation_order': 'ascending'}. Best is trial 7 with value: 0.22714786829364203.
running
[I 2024-11-06 21:49:43,968] Trial 39 finished with value: 0.2293394022738659 and parameters: {'model_name': 'IterativeImputer', 'estimator': 'RFR', 'initial_strategy': 'mean', 'n_nearest_features': 12, 'imputation_order': 'ascending'}. Best is trial 7 with value: 0.22714786829364203.
running
[I 2024-11-06 21:50:02,031] Trial 48 finished with value: 0.22755718841091702 and parameters: {'model_name': 'IterativeImputer', 'estimator': 'RFR', 'initial_strategy': 'median', 'n_nearest_features': 13, 'imputation_order': 'ascending'}. Best is trial 7 with value: 0.22714786829364203.
running
[I 2024-11-06 21:50:05,944] Trial 46 finished with value: 0.22965798981904348 and parameters: {'model_name': 'IterativeImputer', 'estimator': 'RFR', 'initial_strategy': 'median', 'n_nearest_features': 12, 'imputation_order': 'ascending'}. Best is trial 7 with value: 0.22714786829364203.
running
[I 2024-11-06 21:50:43,376] Trial 34 finished with value: 0.22366811790116725 and parameters: {'model_name': 'IterativeImputer', 'estimator': 'RFR', 'initial_strategy': 'most_frequent', 'n_nearest_features': 15, 'imputation_order': 'arabic'}. Best is trial 34 with value: 0.22366811790116725.
running
[I 2024-11-06 21:50:47,909] Trial 53 finished with value: 0.22859646828173114 and parameters: {'model_name': 'IterativeImputer', 'estimator': 'RFR', 'initial_strategy': 'most_frequent', 'n_nearest_features': 13, 'imputation_order': 'roman'}. Best is trial 34 with value: 0.22366811790116725.
running
[I 2024-11-06 21:50:50,455] Trial 37 finished with value: 0.22583336796923265 and parameters: {'model_name': 'IterativeImputer', 'estimator': 'RFR', 'initial_strategy': 'mean', 'n_nearest_features': 15, 'imputation_order': 'roman'}. Best is trial 34 with value: 0.22366811790116725.
running
[I 2024-11-06 22:30:03,607] Trial 67 finished with value: 0.2353714593417418 and parameters: {'model_name': 'IterativeImputer', 'estimator': 'RFR', 'initial_strategy': 'mean', 'n_nearest_features': 10, 'imputation_order': 'ascending'}. Best is trial 34 with value: 0.22366811790116725.
running
[I 2024-11-06 22:30:18,603] Trial 62 finished with value: 0.23487585231471958 and parameters: {'model_name': 'IterativeImputer', 'estimator': 'RFR', 'initial_strategy': 'mean', 'n_nearest_features': 9, 'imputation_order': 'random'}. Best is trial 34 with value: 0.22366811790116725.
running
[I 2024-11-06 22:30:27,524] Trial 79 finished with value: 0.25103879747547675 and parameters: {'model_name': 'KNNImputer', 'n_neighbors': 1141, 'weights': 'distance'}. Best is trial 34 with value: 0.22366811790116725.
running
[I 2024-11-06 22:30:50,884] Trial 66 finished with value: 0.2358351706198901 and parameters: {'model_name': 'IterativeImputer', 'estimator': 'RFR', 'initial_strategy': 'mean', 'n_nearest_features': 10, 'imputation_order': 'ascending'}. Best is trial 34 with value: 0.22366811790116725.
running
[I 2024-11-06 22:31:48,890] Trial 61 finished with value: 0.23029596614588663 and parameters: {'model_name': 'IterativeImputer', 'estimator': 'RFR', 'initial_strategy': 'mean', 'n_nearest_features': 13, 'imputation_order': 'ascending'}. Best is trial 34 with value: 0.22366811790116725.
running
[I 2024-11-06 22:32:13,827] Trial 68 finished with value: 0.2357576221477359 and parameters: {'model_name': 'IterativeImputer', 'estimator': 'RFR', 'initial_strategy': 'mean', 'n_nearest_features': 10, 'imputation_order': 'random'}. Best is trial 34 with value: 0.22366811790116725.
running
[I 2024-11-06 22:32:22,720] Trial 70 finished with value: 0.23410974357316466 and parameters: {'model_name': 'IterativeImputer', 'estimator': 'RFR', 'initial_strategy': 'median', 'n_nearest_features': 10, 'imputation_order': 'ascending'}. Best is trial 34 with value: 0.22366811790116725.
running
[I 2024-11-06 22:33:06,360] Trial 69 finished with value: 0.23460965456012453 and parameters: {'model_name': 'IterativeImputer', 'estimator': 'RFR', 'initial_strategy': 'median', 'n_nearest_features': 10, 'imputation_order': 'random'}. Best is trial 34 with value: 0.22366811790116725.
running
[I 2024-11-06 23:57:45,385] Trial 18 finished with value: 0.46192390574621245 and parameters: {'model_name': 'GAIN', 'batch_size': 44, 'hint_rate': 0.49932003396865654, 'alpha': 15, 'iterations': 8921, 'learning_rate': 0.0001755255229916371, 'p_miss': 0.045448565277132}. Best is trial 34 with value: 0.22366811790116725.
running
[I 2024-11-07 00:13:46,921] Trial 86 finished with value: 0.2808399717607358 and parameters: {'model_name': 'VAE', 'batch_size': 4, 'iterations': 276, 'learning_rate': 0.0015607508626491796, 'p_miss': 0.22170411297000842}. Best is trial 34 with value: 0.22366811790116725.
running
[I 2024-11-07 00:50:12,836] Trial 16 finished with value: 0.4557950987466012 and parameters: {'model_name': 'GAIN', 'batch_size': 366, 'hint_rate': 0.441523254396255, 'alpha': 66, 'iterations': 8759, 'learning_rate': 0.005839692476506138, 'p_miss': 0.06385346127609622}. Best is trial 34 with value: 0.22366811790116725.
running
