Run: 66
/cm/local/apps/slurm/var/spool/job1040709/slurm_script: line 27: 
pip install -e tpot2
pip install -r tpot2/ImputerExperiments/requirements_.txt
: No such file or directory
RunStart
Version 0.1.7a0 of tpot2 is outdated. Version 0.1.8a0 was released Tuesday September 17, 2024.
starting loops
../data/c/923/923.pkl
working on 
../data/c/923/class_simple_MAR_0.1_3
0.6359724998474121
running experiment 1/3 - Does large hyperparameter space improve reconstruction accuracy over simple
[I 2024-11-05 03:46:16,261] A new study created in memory with name: no-name-cb6255ca-07ca-431e-bdbe-7f7eb89d547d
running
running
running
running
running
running
running
running
running
[I 2024-11-05 03:46:16,349] Trial 3 finished with value: 0.5243961098230672 and parameters: {'model_name': 'SimpleImputer', 'strategy': 'constant'}. Best is trial 3 with value: 0.5243961098230672.
running
running
running
running
running
running
running
[I 2024-11-05 03:46:16,624] Trial 5 finished with value: 0.5243961098230672 and parameters: {'model_name': 'SimpleImputer', 'strategy': 'constant'}. Best is trial 3 with value: 0.5243961098230672.
running
running
[I 2024-11-05 03:46:16,758] Trial 1 finished with value: 0.34891118703530627 and parameters: {'model_name': 'SimpleImputer', 'strategy': 'mean'}. Best is trial 1 with value: 0.34891118703530627.
[I 2024-11-05 03:46:16,883] Trial 8 finished with value: 0.5243961098230672 and parameters: {'model_name': 'SimpleImputer', 'strategy': 'constant'}. Best is trial 1 with value: 0.34891118703530627.
running
running
[I 2024-11-05 03:46:17,024] Trial 7 finished with value: 0.34891118703530627 and parameters: {'model_name': 'SimpleImputer', 'strategy': 'mean'}. Best is trial 1 with value: 0.34891118703530627.
[I 2024-11-05 03:46:17,159] Trial 6 finished with value: 0.34891118703530627 and parameters: {'model_name': 'SimpleImputer', 'strategy': 'mean'}. Best is trial 1 with value: 0.34891118703530627.
running
running
[I 2024-11-05 03:46:17,343] Trial 17 finished with value: 0.5243961098230672 and parameters: {'model_name': 'SimpleImputer', 'strategy': 'constant'}. Best is trial 1 with value: 0.34891118703530627.
running
[I 2024-11-05 03:46:17,462] Trial 12 finished with value: 0.34891118703530627 and parameters: {'model_name': 'SimpleImputer', 'strategy': 'mean'}. Best is trial 1 with value: 0.34891118703530627.
running
[I 2024-11-05 03:46:17,630] Trial 15 finished with value: 0.34891118703530627 and parameters: {'model_name': 'SimpleImputer', 'strategy': 'mean'}. Best is trial 1 with value: 0.34891118703530627.
running
[I 2024-11-05 03:46:17,630] Trial 4 finished with value: 0.38028494262767426 and parameters: {'model_name': 'SimpleImputer', 'strategy': 'median'}. Best is trial 1 with value: 0.34891118703530627.
[I 2024-11-05 03:46:17,638] Trial 18 finished with value: 0.5243961098230672 and parameters: {'model_name': 'SimpleImputer', 'strategy': 'constant'}. Best is trial 1 with value: 0.34891118703530627.
[I 2024-11-05 03:46:18,007] Trial 0 finished with value: 0.47312537612273375 and parameters: {'model_name': 'SimpleImputer', 'strategy': 'most_frequent'}. Best is trial 1 with value: 0.34891118703530627.
running
[I 2024-11-05 03:46:18,188] Trial 11 finished with value: 0.38028494262767426 and parameters: {'model_name': 'SimpleImputer', 'strategy': 'median'}. Best is trial 1 with value: 0.34891118703530627.
running
running
[I 2024-11-05 03:46:18,326] Trial 2 finished with value: 0.38028494262767426 and parameters: {'model_name': 'SimpleImputer', 'strategy': 'median'}. Best is trial 1 with value: 0.34891118703530627.
[I 2024-11-05 03:46:18,482] Trial 9 finished with value: 0.47312537612273375 and parameters: {'model_name': 'SimpleImputer', 'strategy': 'most_frequent'}. Best is trial 1 with value: 0.34891118703530627.
running
running
running
[I 2024-11-05 03:46:18,629] Trial 22 finished with value: 0.5243961098230672 and parameters: {'model_name': 'SimpleImputer', 'strategy': 'constant'}. Best is trial 1 with value: 0.34891118703530627.
running
[I 2024-11-05 03:46:18,743] Trial 20 finished with value: 0.34891118703530627 and parameters: {'model_name': 'SimpleImputer', 'strategy': 'mean'}. Best is trial 1 with value: 0.34891118703530627.
running
[I 2024-11-05 03:46:18,952] Trial 10 finished with value: 0.38028494262767426 and parameters: {'model_name': 'SimpleImputer', 'strategy': 'median'}. Best is trial 1 with value: 0.34891118703530627.
running
[I 2024-11-05 03:46:19,080] Trial 21 finished with value: 0.34891118703530627 and parameters: {'model_name': 'SimpleImputer', 'strategy': 'mean'}. Best is trial 1 with value: 0.34891118703530627.
running
[I 2024-11-05 03:46:19,277] Trial 23 finished with value: 0.5243961098230672 and parameters: {'model_name': 'SimpleImputer', 'strategy': 'constant'}. Best is trial 1 with value: 0.34891118703530627.
running
[I 2024-11-05 03:46:19,455] Trial 14 finished with value: 0.47312537612273375 and parameters: {'model_name': 'SimpleImputer', 'strategy': 'most_frequent'}. Best is trial 1 with value: 0.34891118703530627.
running
[I 2024-11-05 03:46:19,584] Trial 13 finished with value: 0.38028494262767426 and parameters: {'model_name': 'SimpleImputer', 'strategy': 'median'}. Best is trial 1 with value: 0.34891118703530627.
running
[I 2024-11-05 03:46:19,731] Trial 31 finished with value: 0.34891118703530627 and parameters: {'model_name': 'SimpleImputer', 'strategy': 'mean'}. Best is trial 1 with value: 0.34891118703530627.
[I 2024-11-05 03:46:19,824] Trial 28 finished with value: 0.34891118703530627 and parameters: {'model_name': 'SimpleImputer', 'strategy': 'mean'}. Best is trial 1 with value: 0.34891118703530627.
[I 2024-11-05 03:46:19,911] Trial 16 finished with value: 0.47312537612273375 and parameters: {'model_name': 'SimpleImputer', 'strategy': 'most_frequent'}. Best is trial 1 with value: 0.34891118703530627.
[I 2024-11-05 03:46:20,006] Trial 19 finished with value: 0.47312537612273375 and parameters: {'model_name': 'SimpleImputer', 'strategy': 'most_frequent'}. Best is trial 1 with value: 0.34891118703530627.
[I 2024-11-05 03:46:20,189] Trial 33 finished with value: 0.34891118703530627 and parameters: {'model_name': 'SimpleImputer', 'strategy': 'mean'}. Best is trial 1 with value: 0.34891118703530627.
[I 2024-11-05 03:46:20,334] Trial 27 finished with value: 0.34891118703530627 and parameters: {'model_name': 'SimpleImputer', 'strategy': 'mean'}. Best is trial 1 with value: 0.34891118703530627.
[I 2024-11-05 03:46:20,437] Trial 29 finished with value: 0.34891118703530627 and parameters: {'model_name': 'SimpleImputer', 'strategy': 'mean'}. Best is trial 1 with value: 0.34891118703530627.
running
[I 2024-11-05 03:46:20,599] Trial 25 finished with value: 0.34891118703530627 and parameters: {'model_name': 'SimpleImputer', 'strategy': 'mean'}. Best is trial 1 with value: 0.34891118703530627.
running
[I 2024-11-05 03:46:20,716] Trial 32 finished with value: 0.34891118703530627 and parameters: {'model_name': 'SimpleImputer', 'strategy': 'mean'}. Best is trial 1 with value: 0.34891118703530627.
running
running
[I 2024-11-05 03:46:20,901] Trial 26 finished with value: 0.34891118703530627 and parameters: {'model_name': 'SimpleImputer', 'strategy': 'mean'}. Best is trial 1 with value: 0.34891118703530627.
[I 2024-11-05 03:46:21,051] Trial 34 finished with value: 0.34891118703530627 and parameters: {'model_name': 'SimpleImputer', 'strategy': 'mean'}. Best is trial 1 with value: 0.34891118703530627.
[I 2024-11-05 03:46:21,176] Trial 30 finished with value: 0.34891118703530627 and parameters: {'model_name': 'SimpleImputer', 'strategy': 'mean'}. Best is trial 1 with value: 0.34891118703530627.
running
running
running
running
running
running
[I 2024-11-05 03:46:21,350] Trial 24 finished with value: 0.47312537612273375 and parameters: {'model_name': 'SimpleImputer', 'strategy': 'most_frequent'}. Best is trial 1 with value: 0.34891118703530627.
running
running
running
[I 2024-11-05 03:46:21,505] Trial 36 finished with value: 0.34891118703530627 and parameters: {'model_name': 'SimpleImputer', 'strategy': 'mean'}. Best is trial 1 with value: 0.34891118703530627.
running
[I 2024-11-05 03:46:21,720] Trial 37 finished with value: 0.34891118703530627 and parameters: {'model_name': 'SimpleImputer', 'strategy': 'mean'}. Best is trial 1 with value: 0.34891118703530627.
running
[I 2024-11-05 03:46:21,976] Trial 39 finished with value: 0.34891118703530627 and parameters: {'model_name': 'SimpleImputer', 'strategy': 'mean'}. Best is trial 1 with value: 0.34891118703530627.
running
[I 2024-11-05 03:46:22,121] Trial 42 finished with value: 0.34891118703530627 and parameters: {'model_name': 'SimpleImputer', 'strategy': 'mean'}. Best is trial 1 with value: 0.34891118703530627.
[I 2024-11-05 03:46:22,250] Trial 43 finished with value: 0.34891118703530627 and parameters: {'model_name': 'SimpleImputer', 'strategy': 'mean'}. Best is trial 1 with value: 0.34891118703530627.
running
[I 2024-11-05 03:46:22,430] Trial 40 finished with value: 0.34891118703530627 and parameters: {'model_name': 'SimpleImputer', 'strategy': 'mean'}. Best is trial 1 with value: 0.34891118703530627.
running
running
[I 2024-11-05 03:46:22,582] Trial 41 finished with value: 0.34891118703530627 and parameters: {'model_name': 'SimpleImputer', 'strategy': 'mean'}. Best is trial 1 with value: 0.34891118703530627.
[I 2024-11-05 03:46:22,672] Trial 35 finished with value: 0.34891118703530627 and parameters: {'model_name': 'SimpleImputer', 'strategy': 'mean'}. Best is trial 1 with value: 0.34891118703530627.
running
[I 2024-11-05 03:46:22,778] Trial 49 finished with value: 0.34891118703530627 and parameters: {'model_name': 'SimpleImputer', 'strategy': 'mean'}. Best is trial 1 with value: 0.34891118703530627.
running
[I 2024-11-05 03:46:22,879] Trial 50 finished with value: 0.34891118703530627 and parameters: {'model_name': 'SimpleImputer', 'strategy': 'mean'}. Best is trial 1 with value: 0.34891118703530627.
[I 2024-11-05 03:46:23,001] Trial 46 finished with value: 0.34891118703530627 and parameters: {'model_name': 'SimpleImputer', 'strategy': 'mean'}. Best is trial 1 with value: 0.34891118703530627.
[I 2024-11-05 03:46:23,176] Trial 38 finished with value: 0.34891118703530627 and parameters: {'model_name': 'SimpleImputer', 'strategy': 'mean'}. Best is trial 1 with value: 0.34891118703530627.
[I 2024-11-05 03:46:23,280] Trial 45 finished with value: 0.34891118703530627 and parameters: {'model_name': 'SimpleImputer', 'strategy': 'mean'}. Best is trial 1 with value: 0.34891118703530627.
running
running
running
[I 2024-11-05 03:46:23,397] Trial 48 finished with value: 0.34891118703530627 and parameters: {'model_name': 'SimpleImputer', 'strategy': 'mean'}. Best is trial 1 with value: 0.34891118703530627.
[I 2024-11-05 03:46:23,488] Trial 44 finished with value: 0.34891118703530627 and parameters: {'model_name': 'SimpleImputer', 'strategy': 'mean'}. Best is trial 1 with value: 0.34891118703530627.
running
running
[I 2024-11-05 03:46:23,618] Trial 47 finished with value: 0.34891118703530627 and parameters: {'model_name': 'SimpleImputer', 'strategy': 'mean'}. Best is trial 1 with value: 0.34891118703530627.
running
[I 2024-11-05 03:46:23,825] Trial 51 finished with value: 0.34891118703530627 and parameters: {'model_name': 'SimpleImputer', 'strategy': 'mean'}. Best is trial 1 with value: 0.34891118703530627.
running
running
running
[I 2024-11-05 03:46:24,007] Trial 55 finished with value: 0.34891118703530627 and parameters: {'model_name': 'SimpleImputer', 'strategy': 'mean'}. Best is trial 1 with value: 0.34891118703530627.
[I 2024-11-05 03:46:24,115] Trial 52 finished with value: 0.34891118703530627 and parameters: {'model_name': 'SimpleImputer', 'strategy': 'mean'}. Best is trial 1 with value: 0.34891118703530627.
[I 2024-11-05 03:46:24,269] Trial 53 finished with value: 0.34891118703530627 and parameters: {'model_name': 'SimpleImputer', 'strategy': 'mean'}. Best is trial 1 with value: 0.34891118703530627.
running
running
running
[I 2024-11-05 03:46:24,495] Trial 56 finished with value: 0.34891118703530627 and parameters: {'model_name': 'SimpleImputer', 'strategy': 'mean'}. Best is trial 1 with value: 0.34891118703530627.
running
[I 2024-11-05 03:46:24,721] Trial 54 finished with value: 0.38028494262767426 and parameters: {'model_name': 'SimpleImputer', 'strategy': 'median'}. Best is trial 1 with value: 0.34891118703530627.
running
[I 2024-11-05 03:46:24,922] Trial 58 finished with value: 0.38028494262767426 and parameters: {'model_name': 'SimpleImputer', 'strategy': 'median'}. Best is trial 1 with value: 0.34891118703530627.
[I 2024-11-05 03:46:25,019] Trial 59 finished with value: 0.38028494262767426 and parameters: {'model_name': 'SimpleImputer', 'strategy': 'median'}. Best is trial 1 with value: 0.34891118703530627.
running
[I 2024-11-05 03:46:25,123] Trial 57 finished with value: 0.38028494262767426 and parameters: {'model_name': 'SimpleImputer', 'strategy': 'median'}. Best is trial 1 with value: 0.34891118703530627.
running
running
[I 2024-11-05 03:46:25,327] Trial 61 finished with value: 0.38028494262767426 and parameters: {'model_name': 'SimpleImputer', 'strategy': 'median'}. Best is trial 1 with value: 0.34891118703530627.
running
[I 2024-11-05 03:46:25,453] Trial 62 finished with value: 0.38028494262767426 and parameters: {'model_name': 'SimpleImputer', 'strategy': 'median'}. Best is trial 1 with value: 0.34891118703530627.
[I 2024-11-05 03:46:25,547] Trial 60 finished with value: 0.38028494262767426 and parameters: {'model_name': 'SimpleImputer', 'strategy': 'median'}. Best is trial 1 with value: 0.34891118703530627.
running
running
[I 2024-11-05 03:46:25,696] Trial 68 finished with value: 0.38028494262767426 and parameters: {'model_name': 'SimpleImputer', 'strategy': 'median'}. Best is trial 1 with value: 0.34891118703530627.
running
[I 2024-11-05 03:46:25,838] Trial 64 finished with value: 0.38028494262767426 and parameters: {'model_name': 'SimpleImputer', 'strategy': 'median'}. Best is trial 1 with value: 0.34891118703530627.
[I 2024-11-05 03:46:25,940] Trial 69 finished with value: 0.38028494262767426 and parameters: {'model_name': 'SimpleImputer', 'strategy': 'median'}. Best is trial 1 with value: 0.34891118703530627.
[I 2024-11-05 03:46:26,078] Trial 65 finished with value: 0.38028494262767426 and parameters: {'model_name': 'SimpleImputer', 'strategy': 'median'}. Best is trial 1 with value: 0.34891118703530627.
running
running
running
[I 2024-11-05 03:46:26,303] Trial 66 finished with value: 0.38028494262767426 and parameters: {'model_name': 'SimpleImputer', 'strategy': 'median'}. Best is trial 1 with value: 0.34891118703530627.
[I 2024-11-05 03:46:26,500] Trial 70 finished with value: 0.38028494262767426 and parameters: {'model_name': 'SimpleImputer', 'strategy': 'median'}. Best is trial 1 with value: 0.34891118703530627.
running
running
[I 2024-11-05 03:46:26,723] Trial 67 finished with value: 0.38028494262767426 and parameters: {'model_name': 'SimpleImputer', 'strategy': 'median'}. Best is trial 1 with value: 0.34891118703530627.
running
[I 2024-11-05 03:46:26,970] Trial 73 finished with value: 0.47312537612273375 and parameters: {'model_name': 'SimpleImputer', 'strategy': 'most_frequent'}. Best is trial 1 with value: 0.34891118703530627.
running
[I 2024-11-05 03:46:27,196] Trial 71 finished with value: 0.38028494262767426 and parameters: {'model_name': 'SimpleImputer', 'strategy': 'median'}. Best is trial 1 with value: 0.34891118703530627.
running
[I 2024-11-05 03:46:27,336] Trial 63 finished with value: 0.47312537612273375 and parameters: {'model_name': 'SimpleImputer', 'strategy': 'most_frequent'}. Best is trial 1 with value: 0.34891118703530627.
running
[I 2024-11-05 03:46:27,611] Trial 72 finished with value: 0.38028494262767426 and parameters: {'model_name': 'SimpleImputer', 'strategy': 'median'}. Best is trial 1 with value: 0.34891118703530627.
[I 2024-11-05 03:46:27,731] Trial 77 finished with value: 0.47312537612273375 and parameters: {'model_name': 'SimpleImputer', 'strategy': 'most_frequent'}. Best is trial 1 with value: 0.34891118703530627.
[I 2024-11-05 03:46:27,909] Trial 75 finished with value: 0.47312537612273375 and parameters: {'model_name': 'SimpleImputer', 'strategy': 'most_frequent'}. Best is trial 1 with value: 0.34891118703530627.
running
running
[I 2024-11-05 03:46:28,034] Trial 86 finished with value: 0.5243961098230672 and parameters: {'model_name': 'SimpleImputer', 'strategy': 'constant'}. Best is trial 1 with value: 0.34891118703530627.
running
running
[I 2024-11-05 03:46:28,251] Trial 76 finished with value: 0.47312537612273375 and parameters: {'model_name': 'SimpleImputer', 'strategy': 'most_frequent'}. Best is trial 1 with value: 0.34891118703530627.
[I 2024-11-05 03:46:28,421] Trial 88 finished with value: 0.5243961098230672 and parameters: {'model_name': 'SimpleImputer', 'strategy': 'constant'}. Best is trial 1 with value: 0.34891118703530627.
running
[I 2024-11-05 03:46:28,544] Trial 87 finished with value: 0.5243961098230672 and parameters: {'model_name': 'SimpleImputer', 'strategy': 'constant'}. Best is trial 1 with value: 0.34891118703530627.
running
running
[I 2024-11-05 03:46:28,704] Trial 74 finished with value: 0.47312537612273375 and parameters: {'model_name': 'SimpleImputer', 'strategy': 'most_frequent'}. Best is trial 1 with value: 0.34891118703530627.
running
[I 2024-11-05 03:46:28,873] Trial 92 finished with value: 0.34891118703530627 and parameters: {'model_name': 'SimpleImputer', 'strategy': 'mean'}. Best is trial 1 with value: 0.34891118703530627.
running
[I 2024-11-05 03:46:29,051] Trial 78 finished with value: 0.47312537612273375 and parameters: {'model_name': 'SimpleImputer', 'strategy': 'most_frequent'}. Best is trial 1 with value: 0.34891118703530627.
running
[I 2024-11-05 03:46:29,272] Trial 85 finished with value: 0.47312537612273375 and parameters: {'model_name': 'SimpleImputer', 'strategy': 'most_frequent'}. Best is trial 1 with value: 0.34891118703530627.
[I 2024-11-05 03:46:29,410] Trial 90 finished with value: 0.5243961098230672 and parameters: {'model_name': 'SimpleImputer', 'strategy': 'constant'}. Best is trial 1 with value: 0.34891118703530627.
[I 2024-11-05 03:46:29,565] Trial 80 finished with value: 0.47312537612273375 and parameters: {'model_name': 'SimpleImputer', 'strategy': 'most_frequent'}. Best is trial 1 with value: 0.34891118703530627.
[I 2024-11-05 03:46:29,680] Trial 83 finished with value: 0.47312537612273375 and parameters: {'model_name': 'SimpleImputer', 'strategy': 'most_frequent'}. Best is trial 1 with value: 0.34891118703530627.
running
running
running
[I 2024-11-05 03:46:29,827] Trial 79 finished with value: 0.47312537612273375 and parameters: {'model_name': 'SimpleImputer', 'strategy': 'most_frequent'}. Best is trial 1 with value: 0.34891118703530627.
running
running
[I 2024-11-05 03:46:29,990] Trial 89 finished with value: 0.5243961098230672 and parameters: {'model_name': 'SimpleImputer', 'strategy': 'constant'}. Best is trial 1 with value: 0.34891118703530627.
[I 2024-11-05 03:46:30,176] Trial 94 finished with value: 0.34891118703530627 and parameters: {'model_name': 'SimpleImputer', 'strategy': 'mean'}. Best is trial 1 with value: 0.34891118703530627.
running
running
[I 2024-11-05 03:46:30,326] Trial 97 finished with value: 0.34891118703530627 and parameters: {'model_name': 'SimpleImputer', 'strategy': 'mean'}. Best is trial 1 with value: 0.34891118703530627.
[I 2024-11-05 03:46:30,429] Trial 81 finished with value: 0.47312537612273375 and parameters: {'model_name': 'SimpleImputer', 'strategy': 'most_frequent'}. Best is trial 1 with value: 0.34891118703530627.
[I 2024-11-05 03:46:30,583] Trial 96 finished with value: 0.34891118703530627 and parameters: {'model_name': 'SimpleImputer', 'strategy': 'mean'}. Best is trial 1 with value: 0.34891118703530627.
[I 2024-11-05 03:46:30,694] Trial 91 finished with value: 0.34891118703530627 and parameters: {'model_name': 'SimpleImputer', 'strategy': 'mean'}. Best is trial 1 with value: 0.34891118703530627.
running
running
[I 2024-11-05 03:46:30,833] Trial 95 finished with value: 0.34891118703530627 and parameters: {'model_name': 'SimpleImputer', 'strategy': 'mean'}. Best is trial 1 with value: 0.34891118703530627.
running
running
running
[I 2024-11-05 03:46:31,048] Trial 98 finished with value: 0.34891118703530627 and parameters: {'model_name': 'SimpleImputer', 'strategy': 'mean'}. Best is trial 1 with value: 0.34891118703530627.
[I 2024-11-05 03:46:31,232] Trial 84 finished with value: 0.47312537612273375 and parameters: {'model_name': 'SimpleImputer', 'strategy': 'most_frequent'}. Best is trial 1 with value: 0.34891118703530627.
running
[I 2024-11-05 03:46:31,397] Trial 82 finished with value: 0.47312537612273375 and parameters: {'model_name': 'SimpleImputer', 'strategy': 'most_frequent'}. Best is trial 1 with value: 0.34891118703530627.
running
running
[I 2024-11-05 03:46:31,601] Trial 102 finished with value: 0.34891118703530627 and parameters: {'model_name': 'SimpleImputer', 'strategy': 'mean'}. Best is trial 1 with value: 0.34891118703530627.
running
[I 2024-11-05 03:46:31,782] Trial 93 finished with value: 0.34891118703530627 and parameters: {'model_name': 'SimpleImputer', 'strategy': 'mean'}. Best is trial 1 with value: 0.34891118703530627.
[I 2024-11-05 03:46:31,904] Trial 107 finished with value: 0.34891118703530627 and parameters: {'model_name': 'SimpleImputer', 'strategy': 'mean'}. Best is trial 1 with value: 0.34891118703530627.
[I 2024-11-05 03:46:32,070] Trial 99 finished with value: 0.34891118703530627 and parameters: {'model_name': 'SimpleImputer', 'strategy': 'mean'}. Best is trial 1 with value: 0.34891118703530627.
[I 2024-11-05 03:46:32,175] Trial 100 finished with value: 0.34891118703530627 and parameters: {'model_name': 'SimpleImputer', 'strategy': 'mean'}. Best is trial 1 with value: 0.34891118703530627.
running
running
running
running
