[I 2024-10-14 18:49:46,395] Trial 188 finished with value: 0.2870226335993664 and parameters: {'model_name': 'KNNImputer', 'n_neighbors': 808, 'weights': 'uniform'}. Best is trial 120 with value: 0.28586420058143397.
running
[I 2024-10-14 18:50:00,962] Trial 189 finished with value: 0.28724768010623086 and parameters: {'model_name': 'KNNImputer', 'n_neighbors': 993, 'weights': 'uniform'}. Best is trial 120 with value: 0.28586420058143397.
running
[I 2024-10-14 18:50:03,604] Trial 190 finished with value: 0.28703920115345344 and parameters: {'model_name': 'KNNImputer', 'n_neighbors': 816, 'weights': 'uniform'}. Best is trial 120 with value: 0.28586420058143397.
running
[I 2024-10-14 18:50:08,521] Trial 191 finished with value: 0.28719670422885785 and parameters: {'model_name': 'KNNImputer', 'n_neighbors': 936, 'weights': 'uniform'}. Best is trial 120 with value: 0.28586420058143397.
running
[I 2024-10-14 18:50:12,604] Trial 192 finished with value: 0.2864762385252833 and parameters: {'model_name': 'KNNImputer', 'n_neighbors': 58, 'weights': 'uniform'}. Best is trial 120 with value: 0.28586420058143397.
[I 2024-10-14 18:50:36,761] Trial 193 finished with value: 0.28689722809984264 and parameters: {'model_name': 'KNNImputer', 'n_neighbors': 725, 'weights': 'uniform'}. Best is trial 120 with value: 0.28586420058143397.
[I 2024-10-14 18:50:47,911] Trial 194 finished with value: 0.28626177074714015 and parameters: {'model_name': 'KNNImputer', 'n_neighbors': 77, 'weights': 'uniform'}. Best is trial 120 with value: 0.28586420058143397.
[I 2024-10-14 18:51:14,588] Trial 195 finished with value: 0.28676122832041767 and parameters: {'model_name': 'KNNImputer', 'n_neighbors': 49, 'weights': 'uniform'}. Best is trial 120 with value: 0.28586420058143397.
[I 2024-10-14 18:51:17,293] Trial 196 finished with value: 0.28597543619634636 and parameters: {'model_name': 'KNNImputer', 'n_neighbors': 136, 'weights': 'uniform'}. Best is trial 120 with value: 0.28586420058143397.
[I 2024-10-14 18:51:27,503] Trial 197 finished with value: 0.28859977520777014 and parameters: {'model_name': 'KNNImputer', 'n_neighbors': 2916, 'weights': 'uniform'}. Best is trial 120 with value: 0.28586420058143397.
[I 2024-10-14 18:51:29,012] Trial 198 finished with value: 0.28601603741692666 and parameters: {'model_name': 'KNNImputer', 'n_neighbors': 95, 'weights': 'uniform'}. Best is trial 120 with value: 0.28586420058143397.
[I 2024-10-14 18:51:32,383] Trial 199 finished with value: 0.28864844931245914 and parameters: {'model_name': 'KNNImputer', 'n_neighbors': 30, 'weights': 'uniform'}. Best is trial 120 with value: 0.28586420058143397.
[I 2024-10-14 19:20:28,685] Trial 119 finished with value: 0.33499100456637854 and parameters: {'model_name': 'IterativeImputer', 'estimator': 'RFR', 'initial_strategy': 'constant', 'n_nearest_features': 1, 'imputation_order': 'arabic'}. Best is trial 120 with value: 0.28586420058143397.
[I 2024-10-14 19:22:38,127] Trial 122 finished with value: 0.3342753233876225 and parameters: {'model_name': 'IterativeImputer', 'estimator': 'RFR', 'initial_strategy': 'constant', 'n_nearest_features': 1, 'imputation_order': 'random'}. Best is trial 120 with value: 0.28586420058143397.
[I 2024-10-14 19:23:20,815] Trial 123 finished with value: 0.33469353287159065 and parameters: {'model_name': 'IterativeImputer', 'estimator': 'RFR', 'initial_strategy': 'constant', 'n_nearest_features': 1, 'imputation_order': 'random'}. Best is trial 120 with value: 0.28586420058143397.
[I 2024-10-14 19:29:35,108] Trial 26 finished with value: 0.28655990280291477 and parameters: {'model_name': 'IterativeImputer', 'estimator': 'RFR', 'initial_strategy': 'mean', 'n_nearest_features': 9, 'imputation_order': 'random'}. Best is trial 120 with value: 0.28586420058143397.
[I 2024-10-14 19:44:46,731] Trial 124 finished with value: 0.3362888543057766 and parameters: {'model_name': 'IterativeImputer', 'estimator': 'RFR', 'initial_strategy': 'constant', 'n_nearest_features': 1, 'imputation_order': 'arabic'}. Best is trial 120 with value: 0.28586420058143397.
[I 2024-10-14 19:55:17,840] Trial 126 finished with value: 0.3336872759658674 and parameters: {'model_name': 'IterativeImputer', 'estimator': 'RFR', 'initial_strategy': 'mean', 'n_nearest_features': 1, 'imputation_order': 'random'}. Best is trial 120 with value: 0.28586420058143397.
[I 2024-10-14 19:58:00,644] Trial 127 finished with value: 0.3362972847429739 and parameters: {'model_name': 'IterativeImputer', 'estimator': 'RFR', 'initial_strategy': 'median', 'n_nearest_features': 1, 'imputation_order': 'arabic'}. Best is trial 120 with value: 0.28586420058143397.
