Run: 20
/cm/local/apps/slurm/var/spool/job1069515/slurm_script: line 27: 
pip install -e tpot2
pip install -r tpot2/ImputerExperiments/requirements_.txt
: No such file or directory
RunStart
Version 0.1.7a0 of tpot2 is outdated. Version 0.1.8a0 was released Tuesday September 17, 2024.
starting loops
../data/c/40922/40922.pkl
working on 
../data/c/40922/class_simple_MAR_0.5_1
4.110272407531738
running experiment 1/3 - Does large hyperparameter space improve reconstruction accuracy over simple
[I 2024-11-23 18:51:44,838] A new study created in memory with name: no-name-718d421d-a1e2-4db9-b47d-852f6266ed49
running
running
running
running
running
running
running
running
running
running
running
running
running
running
running
running
[I 2024-11-23 18:51:45,245] Trial 4 finished with value: 0.5132839642232323 and parameters: {'model_name': 'SimpleImputer', 'strategy': 'constant'}. Best is trial 4 with value: 0.5132839642232323.
running
[I 2024-11-23 18:51:45,560] Trial 8 finished with value: 0.13480086029808153 and parameters: {'model_name': 'SimpleImputer', 'strategy': 'mean'}. Best is trial 8 with value: 0.13480086029808153.
[I 2024-11-23 18:51:45,656] Trial 12 finished with value: 0.13480086029808153 and parameters: {'model_name': 'SimpleImputer', 'strategy': 'mean'}. Best is trial 8 with value: 0.13480086029808153.
running
[I 2024-11-23 18:51:45,741] Trial 13 finished with value: 0.13480086029808153 and parameters: {'model_name': 'SimpleImputer', 'strategy': 'mean'}. Best is trial 8 with value: 0.13480086029808153.
running
running
[I 2024-11-23 18:51:45,898] Trial 1 finished with value: 0.5132839642232323 and parameters: {'model_name': 'SimpleImputer', 'strategy': 'constant'}. Best is trial 8 with value: 0.13480086029808153.
[I 2024-11-23 18:51:45,994] Trial 0 finished with value: 0.13480086029808153 and parameters: {'model_name': 'SimpleImputer', 'strategy': 'mean'}. Best is trial 8 with value: 0.13480086029808153.
running
running
[I 2024-11-23 18:51:46,251] Trial 2 finished with value: 0.20295914952802435 and parameters: {'model_name': 'SimpleImputer', 'strategy': 'median'}. Best is trial 8 with value: 0.13480086029808153.
running
[I 2024-11-23 18:51:46,402] Trial 5 finished with value: 0.20295914952802435 and parameters: {'model_name': 'SimpleImputer', 'strategy': 'median'}. Best is trial 8 with value: 0.13480086029808153.
running
[I 2024-11-23 18:51:46,523] Trial 6 finished with value: 0.20295914952802435 and parameters: {'model_name': 'SimpleImputer', 'strategy': 'median'}. Best is trial 8 with value: 0.13480086029808153.
running
[I 2024-11-23 18:51:46,681] Trial 14 finished with value: 0.20295914952802435 and parameters: {'model_name': 'SimpleImputer', 'strategy': 'median'}. Best is trial 8 with value: 0.13480086029808153.
[I 2024-11-23 18:51:46,781] Trial 3 finished with value: 0.20295914952802435 and parameters: {'model_name': 'SimpleImputer', 'strategy': 'median'}. Best is trial 8 with value: 0.13480086029808153.
running
running
[I 2024-11-23 18:51:46,905] Trial 10 finished with value: 0.20295914952802435 and parameters: {'model_name': 'SimpleImputer', 'strategy': 'median'}. Best is trial 8 with value: 0.13480086029808153.
running
[I 2024-11-23 18:51:47,073] Trial 11 finished with value: 0.22798445989836907 and parameters: {'model_name': 'SimpleImputer', 'strategy': 'most_frequent'}. Best is trial 8 with value: 0.13480086029808153.
[I 2024-11-23 18:51:47,169] Trial 7 finished with value: 0.22798445989836907 and parameters: {'model_name': 'SimpleImputer', 'strategy': 'most_frequent'}. Best is trial 8 with value: 0.13480086029808153.
running
[I 2024-11-23 18:51:47,258] Trial 19 finished with value: 0.5132839642232323 and parameters: {'model_name': 'SimpleImputer', 'strategy': 'constant'}. Best is trial 8 with value: 0.13480086029808153.
running
running
[I 2024-11-23 18:51:47,360] Trial 17 finished with value: 0.5132839642232323 and parameters: {'model_name': 'SimpleImputer', 'strategy': 'constant'}. Best is trial 8 with value: 0.13480086029808153.
running
[I 2024-11-23 18:51:47,556] Trial 20 finished with value: 0.13480086029808153 and parameters: {'model_name': 'SimpleImputer', 'strategy': 'mean'}. Best is trial 8 with value: 0.13480086029808153.
[I 2024-11-23 18:51:47,651] Trial 9 finished with value: 0.22798445989836907 and parameters: {'model_name': 'SimpleImputer', 'strategy': 'most_frequent'}. Best is trial 8 with value: 0.13480086029808153.
running
running
[I 2024-11-23 18:51:47,808] Trial 16 finished with value: 0.20295914952802435 and parameters: {'model_name': 'SimpleImputer', 'strategy': 'median'}. Best is trial 8 with value: 0.13480086029808153.
running
[I 2024-11-23 18:51:47,972] Trial 15 finished with value: 0.22798445989836907 and parameters: {'model_name': 'SimpleImputer', 'strategy': 'most_frequent'}. Best is trial 8 with value: 0.13480086029808153.
running
[I 2024-11-23 18:51:48,161] Trial 24 finished with value: 0.5132839642232323 and parameters: {'model_name': 'SimpleImputer', 'strategy': 'constant'}. Best is trial 8 with value: 0.13480086029808153.
running
[I 2024-11-23 18:51:48,389] Trial 26 finished with value: 0.13480086029808153 and parameters: {'model_name': 'SimpleImputer', 'strategy': 'mean'}. Best is trial 8 with value: 0.13480086029808153.
running
[I 2024-11-23 18:51:48,510] Trial 31 finished with value: 0.13480086029808153 and parameters: {'model_name': 'SimpleImputer', 'strategy': 'mean'}. Best is trial 8 with value: 0.13480086029808153.
running
[I 2024-11-23 18:51:48,631] Trial 30 finished with value: 0.13480086029808153 and parameters: {'model_name': 'SimpleImputer', 'strategy': 'mean'}. Best is trial 8 with value: 0.13480086029808153.
[I 2024-11-23 18:51:48,726] Trial 29 finished with value: 0.13480086029808153 and parameters: {'model_name': 'SimpleImputer', 'strategy': 'mean'}. Best is trial 8 with value: 0.13480086029808153.
running
running
[I 2024-11-23 18:51:48,860] Trial 25 finished with value: 0.13480086029808153 and parameters: {'model_name': 'SimpleImputer', 'strategy': 'mean'}. Best is trial 8 with value: 0.13480086029808153.
running
[I 2024-11-23 18:51:48,987] Trial 18 finished with value: 0.22798445989836907 and parameters: {'model_name': 'SimpleImputer', 'strategy': 'most_frequent'}. Best is trial 8 with value: 0.13480086029808153.
running
[I 2024-11-23 18:51:49,124] Trial 28 finished with value: 0.13480086029808153 and parameters: {'model_name': 'SimpleImputer', 'strategy': 'mean'}. Best is trial 8 with value: 0.13480086029808153.
running
[I 2024-11-23 18:51:49,290] Trial 21 finished with value: 0.22798445989836907 and parameters: {'model_name': 'SimpleImputer', 'strategy': 'most_frequent'}. Best is trial 8 with value: 0.13480086029808153.
running
[I 2024-11-23 18:51:49,414] Trial 23 finished with value: 0.20295914952802435 and parameters: {'model_name': 'SimpleImputer', 'strategy': 'median'}. Best is trial 8 with value: 0.13480086029808153.
running
[I 2024-11-23 18:51:49,548] Trial 32 finished with value: 0.13480086029808153 and parameters: {'model_name': 'SimpleImputer', 'strategy': 'mean'}. Best is trial 8 with value: 0.13480086029808153.
running
[I 2024-11-23 18:51:49,647] Trial 33 finished with value: 0.13480086029808153 and parameters: {'model_name': 'SimpleImputer', 'strategy': 'mean'}. Best is trial 8 with value: 0.13480086029808153.
running
[I 2024-11-23 18:51:49,769] Trial 34 finished with value: 0.13480086029808153 and parameters: {'model_name': 'SimpleImputer', 'strategy': 'mean'}. Best is trial 8 with value: 0.13480086029808153.
running
[I 2024-11-23 18:51:49,922] Trial 36 finished with value: 0.13480086029808153 and parameters: {'model_name': 'SimpleImputer', 'strategy': 'mean'}. Best is trial 8 with value: 0.13480086029808153.
running
[I 2024-11-23 18:51:50,145] Trial 35 finished with value: 0.13480086029808153 and parameters: {'model_name': 'SimpleImputer', 'strategy': 'mean'}. Best is trial 8 with value: 0.13480086029808153.
running
[I 2024-11-23 18:51:50,255] Trial 38 finished with value: 0.13480086029808153 and parameters: {'model_name': 'SimpleImputer', 'strategy': 'mean'}. Best is trial 8 with value: 0.13480086029808153.
running
[I 2024-11-23 18:51:50,380] Trial 39 finished with value: 0.13480086029808153 and parameters: {'model_name': 'SimpleImputer', 'strategy': 'mean'}. Best is trial 8 with value: 0.13480086029808153.
running
[I 2024-11-23 18:51:50,485] Trial 37 finished with value: 0.13480086029808153 and parameters: {'model_name': 'SimpleImputer', 'strategy': 'mean'}. Best is trial 8 with value: 0.13480086029808153.
running
[I 2024-11-23 18:51:50,595] Trial 41 finished with value: 0.13480086029808153 and parameters: {'model_name': 'SimpleImputer', 'strategy': 'mean'}. Best is trial 8 with value: 0.13480086029808153.
running
[I 2024-11-23 18:51:50,731] Trial 40 finished with value: 0.13480086029808153 and parameters: {'model_name': 'SimpleImputer', 'strategy': 'mean'}. Best is trial 8 with value: 0.13480086029808153.
[I 2024-11-23 18:51:50,826] Trial 22 finished with value: 0.22798445989836907 and parameters: {'model_name': 'SimpleImputer', 'strategy': 'most_frequent'}. Best is trial 8 with value: 0.13480086029808153.
running
running
[I 2024-11-23 18:51:50,959] Trial 42 finished with value: 0.13480086029808153 and parameters: {'model_name': 'SimpleImputer', 'strategy': 'mean'}. Best is trial 8 with value: 0.13480086029808153.
running
[I 2024-11-23 18:51:51,064] Trial 27 finished with value: 0.22798445989836907 and parameters: {'model_name': 'SimpleImputer', 'strategy': 'most_frequent'}. Best is trial 8 with value: 0.13480086029808153.
running
[I 2024-11-23 18:51:51,200] Trial 43 finished with value: 0.13480086029808153 and parameters: {'model_name': 'SimpleImputer', 'strategy': 'mean'}. Best is trial 8 with value: 0.13480086029808153.
running
[I 2024-11-23 18:51:51,363] Trial 44 finished with value: 0.13480086029808153 and parameters: {'model_name': 'SimpleImputer', 'strategy': 'mean'}. Best is trial 8 with value: 0.13480086029808153.
running
[I 2024-11-23 18:51:51,495] Trial 49 finished with value: 0.13480086029808153 and parameters: {'model_name': 'SimpleImputer', 'strategy': 'mean'}. Best is trial 8 with value: 0.13480086029808153.
running
[I 2024-11-23 18:51:51,618] Trial 46 finished with value: 0.13480086029808153 and parameters: {'model_name': 'SimpleImputer', 'strategy': 'mean'}. Best is trial 8 with value: 0.13480086029808153.
running
[I 2024-11-23 18:51:51,740] Trial 48 finished with value: 0.13480086029808153 and parameters: {'model_name': 'SimpleImputer', 'strategy': 'mean'}. Best is trial 8 with value: 0.13480086029808153.
running
[I 2024-11-23 18:51:51,852] Trial 45 finished with value: 0.13480086029808153 and parameters: {'model_name': 'SimpleImputer', 'strategy': 'mean'}. Best is trial 8 with value: 0.13480086029808153.
running
[I 2024-11-23 18:51:52,008] Trial 47 finished with value: 0.13480086029808153 and parameters: {'model_name': 'SimpleImputer', 'strategy': 'mean'}. Best is trial 8 with value: 0.13480086029808153.
running
[I 2024-11-23 18:51:52,270] Trial 54 finished with value: 0.13480086029808153 and parameters: {'model_name': 'SimpleImputer', 'strategy': 'mean'}. Best is trial 8 with value: 0.13480086029808153.
running
[I 2024-11-23 18:51:52,392] Trial 52 finished with value: 0.13480086029808153 and parameters: {'model_name': 'SimpleImputer', 'strategy': 'mean'}. Best is trial 8 with value: 0.13480086029808153.
running
[I 2024-11-23 18:51:52,506] Trial 51 finished with value: 0.13480086029808153 and parameters: {'model_name': 'SimpleImputer', 'strategy': 'mean'}. Best is trial 8 with value: 0.13480086029808153.
running
[I 2024-11-23 18:51:52,615] Trial 50 finished with value: 0.13480086029808153 and parameters: {'model_name': 'SimpleImputer', 'strategy': 'mean'}. Best is trial 8 with value: 0.13480086029808153.
running
[I 2024-11-23 18:51:52,720] Trial 55 finished with value: 0.13480086029808153 and parameters: {'model_name': 'SimpleImputer', 'strategy': 'mean'}. Best is trial 8 with value: 0.13480086029808153.
running
[I 2024-11-23 18:51:52,826] Trial 57 finished with value: 0.13480086029808153 and parameters: {'model_name': 'SimpleImputer', 'strategy': 'mean'}. Best is trial 8 with value: 0.13480086029808153.
[I 2024-11-23 18:51:52,922] Trial 53 finished with value: 0.13480086029808153 and parameters: {'model_name': 'SimpleImputer', 'strategy': 'mean'}. Best is trial 8 with value: 0.13480086029808153.
running
[I 2024-11-23 18:51:53,013] Trial 61 finished with value: 0.5132839642232323 and parameters: {'model_name': 'SimpleImputer', 'strategy': 'constant'}. Best is trial 8 with value: 0.13480086029808153.
running
[I 2024-11-23 18:51:53,111] Trial 56 finished with value: 0.13480086029808153 and parameters: {'model_name': 'SimpleImputer', 'strategy': 'mean'}. Best is trial 8 with value: 0.13480086029808153.
running
running
[I 2024-11-23 18:51:53,296] Trial 58 finished with value: 0.13480086029808153 and parameters: {'model_name': 'SimpleImputer', 'strategy': 'mean'}. Best is trial 8 with value: 0.13480086029808153.
running
[I 2024-11-23 18:51:53,422] Trial 64 finished with value: 0.5132839642232323 and parameters: {'model_name': 'SimpleImputer', 'strategy': 'constant'}. Best is trial 8 with value: 0.13480086029808153.
running
[I 2024-11-23 18:51:53,546] Trial 59 finished with value: 0.13480086029808153 and parameters: {'model_name': 'SimpleImputer', 'strategy': 'mean'}. Best is trial 8 with value: 0.13480086029808153.
running
[I 2024-11-23 18:51:53,667] Trial 62 finished with value: 0.5132839642232323 and parameters: {'model_name': 'SimpleImputer', 'strategy': 'constant'}. Best is trial 8 with value: 0.13480086029808153.
running
[I 2024-11-23 18:51:53,782] Trial 60 finished with value: 0.13480086029808153 and parameters: {'model_name': 'SimpleImputer', 'strategy': 'mean'}. Best is trial 8 with value: 0.13480086029808153.
running
[I 2024-11-23 18:51:53,895] Trial 65 finished with value: 0.5132839642232323 and parameters: {'model_name': 'SimpleImputer', 'strategy': 'constant'}. Best is trial 8 with value: 0.13480086029808153.
running
[I 2024-11-23 18:51:54,054] Trial 63 finished with value: 0.5132839642232323 and parameters: {'model_name': 'SimpleImputer', 'strategy': 'constant'}. Best is trial 8 with value: 0.13480086029808153.
running
[I 2024-11-23 18:51:54,225] Trial 66 finished with value: 0.5132839642232323 and parameters: {'model_name': 'SimpleImputer', 'strategy': 'constant'}. Best is trial 8 with value: 0.13480086029808153.
running
[I 2024-11-23 18:51:54,378] Trial 67 finished with value: 0.5132839642232323 and parameters: {'model_name': 'SimpleImputer', 'strategy': 'constant'}. Best is trial 8 with value: 0.13480086029808153.
running
[I 2024-11-23 18:51:54,517] Trial 68 finished with value: 0.5132839642232323 and parameters: {'model_name': 'SimpleImputer', 'strategy': 'constant'}. Best is trial 8 with value: 0.13480086029808153.
running
[I 2024-11-23 18:51:54,668] Trial 69 finished with value: 0.5132839642232323 and parameters: {'model_name': 'SimpleImputer', 'strategy': 'constant'}. Best is trial 8 with value: 0.13480086029808153.
[I 2024-11-23 18:51:54,775] Trial 70 finished with value: 0.5132839642232323 and parameters: {'model_name': 'SimpleImputer', 'strategy': 'constant'}. Best is trial 8 with value: 0.13480086029808153.
running
running
[I 2024-11-23 18:51:54,905] Trial 71 finished with value: 0.5132839642232323 and parameters: {'model_name': 'SimpleImputer', 'strategy': 'constant'}. Best is trial 8 with value: 0.13480086029808153.
running
[I 2024-11-23 18:51:55,257] Trial 74 finished with value: 0.20295914952802435 and parameters: {'model_name': 'SimpleImputer', 'strategy': 'median'}. Best is trial 8 with value: 0.13480086029808153.
[I 2024-11-23 18:51:55,378] Trial 73 finished with value: 0.20295914952802435 and parameters: {'model_name': 'SimpleImputer', 'strategy': 'median'}. Best is trial 8 with value: 0.13480086029808153.
running
running
[I 2024-11-23 18:51:55,535] Trial 80 finished with value: 0.20295914952802435 and parameters: {'model_name': 'SimpleImputer', 'strategy': 'median'}. Best is trial 8 with value: 0.13480086029808153.
running
[I 2024-11-23 18:51:55,655] Trial 77 finished with value: 0.20295914952802435 and parameters: {'model_name': 'SimpleImputer', 'strategy': 'median'}. Best is trial 8 with value: 0.13480086029808153.
running
[I 2024-11-23 18:51:55,793] Trial 75 finished with value: 0.20295914952802435 and parameters: {'model_name': 'SimpleImputer', 'strategy': 'median'}. Best is trial 8 with value: 0.13480086029808153.
running
[I 2024-11-23 18:51:55,904] Trial 72 finished with value: 0.20295914952802435 and parameters: {'model_name': 'SimpleImputer', 'strategy': 'median'}. Best is trial 8 with value: 0.13480086029808153.
running
[I 2024-11-23 18:51:55,997] Trial 76 finished with value: 0.20295914952802435 and parameters: {'model_name': 'SimpleImputer', 'strategy': 'median'}. Best is trial 8 with value: 0.13480086029808153.
running
[I 2024-11-23 18:51:56,130] Trial 78 finished with value: 0.20295914952802435 and parameters: {'model_name': 'SimpleImputer', 'strategy': 'median'}. Best is trial 8 with value: 0.13480086029808153.
running
[I 2024-11-23 18:51:56,285] Trial 79 finished with value: 0.20295914952802435 and parameters: {'model_name': 'SimpleImputer', 'strategy': 'median'}. Best is trial 8 with value: 0.13480086029808153.
running
[I 2024-11-23 18:51:56,487] Trial 81 finished with value: 0.20295914952802435 and parameters: {'model_name': 'SimpleImputer', 'strategy': 'median'}. Best is trial 8 with value: 0.13480086029808153.
running
[I 2024-11-23 18:51:56,674] Trial 83 finished with value: 0.20295914952802435 and parameters: {'model_name': 'SimpleImputer', 'strategy': 'median'}. Best is trial 8 with value: 0.13480086029808153.
running
[I 2024-11-23 18:51:56,800] Trial 86 finished with value: 0.20295914952802435 and parameters: {'model_name': 'SimpleImputer', 'strategy': 'median'}. Best is trial 8 with value: 0.13480086029808153.
running
[I 2024-11-23 18:51:56,903] Trial 82 finished with value: 0.20295914952802435 and parameters: {'model_name': 'SimpleImputer', 'strategy': 'median'}. Best is trial 8 with value: 0.13480086029808153.
running
[I 2024-11-23 18:51:57,030] Trial 85 finished with value: 0.20295914952802435 and parameters: {'model_name': 'SimpleImputer', 'strategy': 'median'}. Best is trial 8 with value: 0.13480086029808153.
running
[I 2024-11-23 18:51:57,201] Trial 87 finished with value: 0.20295914952802435 and parameters: {'model_name': 'SimpleImputer', 'strategy': 'median'}. Best is trial 8 with value: 0.13480086029808153.
running
[I 2024-11-23 18:51:57,459] Trial 84 finished with value: 0.22798445989836907 and parameters: {'model_name': 'SimpleImputer', 'strategy': 'most_frequent'}. Best is trial 8 with value: 0.13480086029808153.
running
[I 2024-11-23 18:51:57,605] Trial 96 finished with value: 0.13480086029808153 and parameters: {'model_name': 'SimpleImputer', 'strategy': 'mean'}. Best is trial 8 with value: 0.13480086029808153.
running
[I 2024-11-23 18:51:57,846] Trial 97 finished with value: 0.13480086029808153 and parameters: {'model_name': 'SimpleImputer', 'strategy': 'mean'}. Best is trial 8 with value: 0.13480086029808153.
running
[I 2024-11-23 18:51:58,013] Trial 99 finished with value: 0.13480086029808153 and parameters: {'model_name': 'SimpleImputer', 'strategy': 'mean'}. Best is trial 8 with value: 0.13480086029808153.
running
[I 2024-11-23 18:51:58,167] Trial 98 finished with value: 0.13480086029808153 and parameters: {'model_name': 'SimpleImputer', 'strategy': 'mean'}. Best is trial 8 with value: 0.13480086029808153.
running
[I 2024-11-23 18:51:58,280] Trial 101 finished with value: 0.13480086029808153 and parameters: {'model_name': 'SimpleImputer', 'strategy': 'mean'}. Best is trial 8 with value: 0.13480086029808153.
running
[I 2024-11-23 18:51:58,393] Trial 89 finished with value: 0.22798445989836907 and parameters: {'model_name': 'SimpleImputer', 'strategy': 'most_frequent'}. Best is trial 8 with value: 0.13480086029808153.
running
[I 2024-11-23 18:51:58,493] Trial 90 finished with value: 0.22798445989836907 and parameters: {'model_name': 'SimpleImputer', 'strategy': 'most_frequent'}. Best is trial 8 with value: 0.13480086029808153.
running
[I 2024-11-23 18:51:58,744] Trial 103 finished with value: 0.13480086029808153 and parameters: {'model_name': 'SimpleImputer', 'strategy': 'mean'}. Best is trial 8 with value: 0.13480086029808153.
[I 2024-11-23 18:51:58,837] Trial 91 finished with value: 0.22798445989836907 and parameters: {'model_name': 'SimpleImputer', 'strategy': 'most_frequent'}. Best is trial 8 with value: 0.13480086029808153.
running
running
[I 2024-11-23 18:51:58,951] Trial 100 finished with value: 0.13480086029808153 and parameters: {'model_name': 'SimpleImputer', 'strategy': 'mean'}. Best is trial 8 with value: 0.13480086029808153.
running
[I 2024-11-23 18:51:59,088] Trial 102 finished with value: 0.13480086029808153 and parameters: {'model_name': 'SimpleImputer', 'strategy': 'mean'}. Best is trial 8 with value: 0.13480086029808153.
running
[I 2024-11-23 18:51:59,225] Trial 92 finished with value: 0.22798445989836907 and parameters: {'model_name': 'SimpleImputer', 'strategy': 'most_frequent'}. Best is trial 8 with value: 0.13480086029808153.
running
[I 2024-11-23 18:51:59,363] Trial 93 finished with value: 0.22798445989836907 and parameters: {'model_name': 'SimpleImputer', 'strategy': 'most_frequent'}. Best is trial 8 with value: 0.13480086029808153.
running
[I 2024-11-23 18:51:59,470] Trial 104 finished with value: 0.13480086029808153 and parameters: {'model_name': 'SimpleImputer', 'strategy': 'mean'}. Best is trial 8 with value: 0.13480086029808153.
running
[I 2024-11-23 18:51:59,603] Trial 88 finished with value: 0.22798445989836907 and parameters: {'model_name': 'SimpleImputer', 'strategy': 'most_frequent'}. Best is trial 8 with value: 0.13480086029808153.
running
