[I 2024-10-15 09:28:08,982] Trial 104 finished with value: 0.34689599756520667 and parameters: {'model_name': 'SimpleImputer', 'strategy': 'mean'}. Best is trial 9 with value: 0.34689599756520667.
running
[I 2024-10-15 09:28:09,086] Trial 103 finished with value: 0.34689599756520667 and parameters: {'model_name': 'SimpleImputer', 'strategy': 'mean'}. Best is trial 9 with value: 0.34689599756520667.
running
[I 2024-10-15 09:28:09,211] Trial 106 finished with value: 0.34689599756520667 and parameters: {'model_name': 'SimpleImputer', 'strategy': 'mean'}. Best is trial 9 with value: 0.34689599756520667.
running
[I 2024-10-15 09:28:09,320] Trial 105 finished with value: 0.34689599756520667 and parameters: {'model_name': 'SimpleImputer', 'strategy': 'mean'}. Best is trial 9 with value: 0.34689599756520667.
running
[I 2024-10-15 09:28:09,523] Trial 107 finished with value: 0.34689599756520667 and parameters: {'model_name': 'SimpleImputer', 'strategy': 'mean'}. Best is trial 9 with value: 0.34689599756520667.
running
[I 2024-10-15 09:28:09,657] Trial 108 finished with value: 0.34689599756520667 and parameters: {'model_name': 'SimpleImputer', 'strategy': 'mean'}. Best is trial 9 with value: 0.34689599756520667.
running
[I 2024-10-15 09:28:09,822] Trial 109 finished with value: 0.34689599756520667 and parameters: {'model_name': 'SimpleImputer', 'strategy': 'mean'}. Best is trial 9 with value: 0.34689599756520667.
running
[I 2024-10-15 09:28:09,997] Trial 113 finished with value: 0.34689599756520667 and parameters: {'model_name': 'SimpleImputer', 'strategy': 'mean'}. Best is trial 9 with value: 0.34689599756520667.
running
[I 2024-10-15 09:28:10,126] Trial 112 finished with value: 0.34689599756520667 and parameters: {'model_name': 'SimpleImputer', 'strategy': 'mean'}. Best is trial 9 with value: 0.34689599756520667.
running
[I 2024-10-15 09:28:10,235] Trial 111 finished with value: 0.34689599756520667 and parameters: {'model_name': 'SimpleImputer', 'strategy': 'mean'}. Best is trial 9 with value: 0.34689599756520667.
running
[I 2024-10-15 09:28:10,337] Trial 110 finished with value: 0.34689599756520667 and parameters: {'model_name': 'SimpleImputer', 'strategy': 'mean'}. Best is trial 9 with value: 0.34689599756520667.
running
[I 2024-10-15 09:28:10,439] Trial 116 finished with value: 0.34689599756520667 and parameters: {'model_name': 'SimpleImputer', 'strategy': 'mean'}. Best is trial 9 with value: 0.34689599756520667.
[I 2024-10-15 09:28:10,538] Trial 114 finished with value: 0.34689599756520667 and parameters: {'model_name': 'SimpleImputer', 'strategy': 'mean'}. Best is trial 9 with value: 0.34689599756520667.
running
running
[I 2024-10-15 09:28:10,652] Trial 118 finished with value: 0.34689599756520667 and parameters: {'model_name': 'SimpleImputer', 'strategy': 'mean'}. Best is trial 9 with value: 0.34689599756520667.
running
[I 2024-10-15 09:28:10,750] Trial 115 finished with value: 0.34689599756520667 and parameters: {'model_name': 'SimpleImputer', 'strategy': 'mean'}. Best is trial 9 with value: 0.34689599756520667.
running
[I 2024-10-15 09:28:10,913] Trial 117 finished with value: 0.34689599756520667 and parameters: {'model_name': 'SimpleImputer', 'strategy': 'mean'}. Best is trial 9 with value: 0.34689599756520667.
running
[I 2024-10-15 09:28:11,098] Trial 121 finished with value: 0.5040131968124747 and parameters: {'model_name': 'SimpleImputer', 'strategy': 'median'}. Best is trial 9 with value: 0.34689599756520667.
running
[I 2024-10-15 09:28:11,214] Trial 120 finished with value: 0.34689599756520667 and parameters: {'model_name': 'SimpleImputer', 'strategy': 'mean'}. Best is trial 9 with value: 0.34689599756520667.
running
[I 2024-10-15 09:28:11,356] Trial 119 finished with value: 0.34689599756520667 and parameters: {'model_name': 'SimpleImputer', 'strategy': 'mean'}. Best is trial 9 with value: 0.34689599756520667.
running
[I 2024-10-15 09:28:11,595] Trial 122 finished with value: 0.5040131968124747 and parameters: {'model_name': 'SimpleImputer', 'strategy': 'median'}. Best is trial 9 with value: 0.34689599756520667.
running
[I 2024-10-15 09:28:11,806] Trial 123 finished with value: 0.5040131968124747 and parameters: {'model_name': 'SimpleImputer', 'strategy': 'median'}. Best is trial 9 with value: 0.34689599756520667.
running
[I 2024-10-15 09:28:11,975] Trial 133 finished with value: 0.34689599756520667 and parameters: {'model_name': 'SimpleImputer', 'strategy': 'mean'}. Best is trial 9 with value: 0.34689599756520667.
running
[I 2024-10-15 09:28:12,097] Trial 124 finished with value: 0.5040131968124747 and parameters: {'model_name': 'SimpleImputer', 'strategy': 'median'}. Best is trial 9 with value: 0.34689599756520667.
running
[I 2024-10-15 09:28:12,201] Trial 129 finished with value: 0.5040131968124747 and parameters: {'model_name': 'SimpleImputer', 'strategy': 'median'}. Best is trial 9 with value: 0.34689599756520667.
running
[I 2024-10-15 09:28:12,357] Trial 131 finished with value: 0.5040131968124747 and parameters: {'model_name': 'SimpleImputer', 'strategy': 'median'}. Best is trial 9 with value: 0.34689599756520667.
[I 2024-10-15 09:28:12,461] Trial 126 finished with value: 0.5040131968124747 and parameters: {'model_name': 'SimpleImputer', 'strategy': 'median'}. Best is trial 9 with value: 0.34689599756520667.
running
[I 2024-10-15 09:28:12,468] Trial 127 finished with value: 0.5040131968124747 and parameters: {'model_name': 'SimpleImputer', 'strategy': 'median'}. Best is trial 9 with value: 0.34689599756520667.
running
[I 2024-10-15 09:28:12,472] Trial 125 finished with value: 0.5040131968124747 and parameters: {'model_name': 'SimpleImputer', 'strategy': 'median'}. Best is trial 9 with value: 0.34689599756520667.
running
running
[I 2024-10-15 09:28:12,771] Trial 136 finished with value: 0.34689599756520667 and parameters: {'model_name': 'SimpleImputer', 'strategy': 'mean'}. Best is trial 9 with value: 0.34689599756520667.
[I 2024-10-15 09:28:12,867] Trial 130 finished with value: 0.5040131968124747 and parameters: {'model_name': 'SimpleImputer', 'strategy': 'median'}. Best is trial 9 with value: 0.34689599756520667.
running
[I 2024-10-15 09:28:12,970] Trial 128 finished with value: 0.5040131968124747 and parameters: {'model_name': 'SimpleImputer', 'strategy': 'median'}. Best is trial 9 with value: 0.34689599756520667.
running
running
[I 2024-10-15 09:28:13,172] Trial 132 finished with value: 0.5040131968124747 and parameters: {'model_name': 'SimpleImputer', 'strategy': 'median'}. Best is trial 9 with value: 0.34689599756520667.
running
[I 2024-10-15 09:28:13,283] Trial 137 finished with value: 0.34689599756520667 and parameters: {'model_name': 'SimpleImputer', 'strategy': 'mean'}. Best is trial 9 with value: 0.34689599756520667.
running
[I 2024-10-15 09:28:13,483] Trial 135 finished with value: 0.5040131968124747 and parameters: {'model_name': 'SimpleImputer', 'strategy': 'median'}. Best is trial 9 with value: 0.34689599756520667.
running
[I 2024-10-15 09:28:13,600] Trial 134 finished with value: 0.5040131968124747 and parameters: {'model_name': 'SimpleImputer', 'strategy': 'median'}. Best is trial 9 with value: 0.34689599756520667.
running
[I 2024-10-15 09:28:13,751] Trial 142 finished with value: 0.34689599756520667 and parameters: {'model_name': 'SimpleImputer', 'strategy': 'mean'}. Best is trial 9 with value: 0.34689599756520667.
running
[I 2024-10-15 09:28:13,901] Trial 138 finished with value: 0.34689599756520667 and parameters: {'model_name': 'SimpleImputer', 'strategy': 'mean'}. Best is trial 9 with value: 0.34689599756520667.
[I 2024-10-15 09:28:14,010] Trial 144 finished with value: 0.34689599756520667 and parameters: {'model_name': 'SimpleImputer', 'strategy': 'mean'}. Best is trial 9 with value: 0.34689599756520667.
running
running
[I 2024-10-15 09:28:14,140] Trial 139 finished with value: 0.34689599756520667 and parameters: {'model_name': 'SimpleImputer', 'strategy': 'mean'}. Best is trial 9 with value: 0.34689599756520667.
running
[I 2024-10-15 09:28:14,356] Trial 140 finished with value: 0.34689599756520667 and parameters: {'model_name': 'SimpleImputer', 'strategy': 'mean'}. Best is trial 9 with value: 0.34689599756520667.
running
[I 2024-10-15 09:28:14,475] Trial 143 finished with value: 0.34689599756520667 and parameters: {'model_name': 'SimpleImputer', 'strategy': 'mean'}. Best is trial 9 with value: 0.34689599756520667.
[I 2024-10-15 09:28:14,581] Trial 141 finished with value: 0.34689599756520667 and parameters: {'model_name': 'SimpleImputer', 'strategy': 'mean'}. Best is trial 9 with value: 0.34689599756520667.
[I 2024-10-15 09:28:14,680] Trial 145 finished with value: 0.34689599756520667 and parameters: {'model_name': 'SimpleImputer', 'strategy': 'mean'}. Best is trial 9 with value: 0.34689599756520667.
running
running
running
[I 2024-10-15 09:28:14,824] Trial 148 finished with value: 0.34689599756520667 and parameters: {'model_name': 'SimpleImputer', 'strategy': 'mean'}. Best is trial 9 with value: 0.34689599756520667.
running
[I 2024-10-15 09:28:14,937] Trial 147 finished with value: 0.34689599756520667 and parameters: {'model_name': 'SimpleImputer', 'strategy': 'mean'}. Best is trial 9 with value: 0.34689599756520667.
running
[I 2024-10-15 09:28:15,042] Trial 149 finished with value: 0.34689599756520667 and parameters: {'model_name': 'SimpleImputer', 'strategy': 'mean'}. Best is trial 9 with value: 0.34689599756520667.
running
[I 2024-10-15 09:28:15,199] Trial 150 finished with value: 0.34689599756520667 and parameters: {'model_name': 'SimpleImputer', 'strategy': 'mean'}. Best is trial 9 with value: 0.34689599756520667.
running
[I 2024-10-15 09:28:15,353] Trial 146 finished with value: 0.34689599756520667 and parameters: {'model_name': 'SimpleImputer', 'strategy': 'mean'}. Best is trial 9 with value: 0.34689599756520667.
running
[I 2024-10-15 09:28:15,514] Trial 151 finished with value: 0.34689599756520667 and parameters: {'model_name': 'SimpleImputer', 'strategy': 'mean'}. Best is trial 9 with value: 0.34689599756520667.
running
[I 2024-10-15 09:28:15,678] Trial 153 finished with value: 0.34689599756520667 and parameters: {'model_name': 'SimpleImputer', 'strategy': 'mean'}. Best is trial 9 with value: 0.34689599756520667.
running
[I 2024-10-15 09:28:15,840] Trial 152 finished with value: 0.34689599756520667 and parameters: {'model_name': 'SimpleImputer', 'strategy': 'mean'}. Best is trial 9 with value: 0.34689599756520667.
running
[I 2024-10-15 09:28:15,980] Trial 155 finished with value: 0.34689599756520667 and parameters: {'model_name': 'SimpleImputer', 'strategy': 'mean'}. Best is trial 9 with value: 0.34689599756520667.
[I 2024-10-15 09:28:16,078] Trial 154 finished with value: 0.34689599756520667 and parameters: {'model_name': 'SimpleImputer', 'strategy': 'mean'}. Best is trial 9 with value: 0.34689599756520667.
[I 2024-10-15 09:28:16,169] Trial 157 finished with value: 0.34689599756520667 and parameters: {'model_name': 'SimpleImputer', 'strategy': 'mean'}. Best is trial 9 with value: 0.34689599756520667.
running
running
running
[I 2024-10-15 09:28:16,321] Trial 156 finished with value: 0.34689599756520667 and parameters: {'model_name': 'SimpleImputer', 'strategy': 'mean'}. Best is trial 9 with value: 0.34689599756520667.
running
[I 2024-10-15 09:28:16,477] Trial 161 finished with value: 0.34689599756520667 and parameters: {'model_name': 'SimpleImputer', 'strategy': 'mean'}. Best is trial 9 with value: 0.34689599756520667.
[I 2024-10-15 09:28:16,577] Trial 158 finished with value: 0.34689599756520667 and parameters: {'model_name': 'SimpleImputer', 'strategy': 'mean'}. Best is trial 9 with value: 0.34689599756520667.
running
running
[I 2024-10-15 09:28:16,697] Trial 160 finished with value: 0.34689599756520667 and parameters: {'model_name': 'SimpleImputer', 'strategy': 'mean'}. Best is trial 9 with value: 0.34689599756520667.
running
[I 2024-10-15 09:28:16,865] Trial 163 finished with value: 0.34689599756520667 and parameters: {'model_name': 'SimpleImputer', 'strategy': 'mean'}. Best is trial 9 with value: 0.34689599756520667.
[I 2024-10-15 09:28:16,962] Trial 162 finished with value: 0.34689599756520667 and parameters: {'model_name': 'SimpleImputer', 'strategy': 'mean'}. Best is trial 9 with value: 0.34689599756520667.
running
running
[I 2024-10-15 09:28:17,090] Trial 165 finished with value: 0.34689599756520667 and parameters: {'model_name': 'SimpleImputer', 'strategy': 'mean'}. Best is trial 9 with value: 0.34689599756520667.
running
[I 2024-10-15 09:28:17,224] Trial 159 finished with value: 0.34689599756520667 and parameters: {'model_name': 'SimpleImputer', 'strategy': 'mean'}. Best is trial 9 with value: 0.34689599756520667.
running
[I 2024-10-15 09:28:17,391] Trial 164 finished with value: 0.34689599756520667 and parameters: {'model_name': 'SimpleImputer', 'strategy': 'mean'}. Best is trial 9 with value: 0.34689599756520667.
running
[I 2024-10-15 09:28:17,584] Trial 168 finished with value: 0.34689599756520667 and parameters: {'model_name': 'SimpleImputer', 'strategy': 'mean'}. Best is trial 9 with value: 0.34689599756520667.
[I 2024-10-15 09:28:17,687] Trial 166 finished with value: 0.34689599756520667 and parameters: {'model_name': 'SimpleImputer', 'strategy': 'mean'}. Best is trial 9 with value: 0.34689599756520667.
running
running
[I 2024-10-15 09:28:17,812] Trial 167 finished with value: 0.34689599756520667 and parameters: {'model_name': 'SimpleImputer', 'strategy': 'mean'}. Best is trial 9 with value: 0.34689599756520667.
running
[I 2024-10-15 09:28:17,954] Trial 169 finished with value: 0.34689599756520667 and parameters: {'model_name': 'SimpleImputer', 'strategy': 'mean'}. Best is trial 9 with value: 0.34689599756520667.
[I 2024-10-15 09:28:18,054] Trial 172 finished with value: 0.34689599756520667 and parameters: {'model_name': 'SimpleImputer', 'strategy': 'mean'}. Best is trial 9 with value: 0.34689599756520667.
running
running
[I 2024-10-15 09:28:18,253] Trial 171 finished with value: 0.34689599756520667 and parameters: {'model_name': 'SimpleImputer', 'strategy': 'mean'}. Best is trial 9 with value: 0.34689599756520667.
running
[I 2024-10-15 09:28:18,380] Trial 173 finished with value: 0.34689599756520667 and parameters: {'model_name': 'SimpleImputer', 'strategy': 'mean'}. Best is trial 9 with value: 0.34689599756520667.
running
[I 2024-10-15 09:28:18,482] Trial 174 finished with value: 0.34689599756520667 and parameters: {'model_name': 'SimpleImputer', 'strategy': 'mean'}. Best is trial 9 with value: 0.34689599756520667.
running
[I 2024-10-15 09:28:18,604] Trial 175 finished with value: 0.34689599756520667 and parameters: {'model_name': 'SimpleImputer', 'strategy': 'mean'}. Best is trial 9 with value: 0.34689599756520667.
running
[I 2024-10-15 09:28:18,733] Trial 170 finished with value: 0.34689599756520667 and parameters: {'model_name': 'SimpleImputer', 'strategy': 'mean'}. Best is trial 9 with value: 0.34689599756520667.
[I 2024-10-15 09:28:18,842] Trial 176 finished with value: 0.34689599756520667 and parameters: {'model_name': 'SimpleImputer', 'strategy': 'mean'}. Best is trial 9 with value: 0.34689599756520667.
running
running
[I 2024-10-15 09:28:18,997] Trial 177 finished with value: 0.34689599756520667 and parameters: {'model_name': 'SimpleImputer', 'strategy': 'mean'}. Best is trial 9 with value: 0.34689599756520667.
running
[I 2024-10-15 09:28:19,153] Trial 178 finished with value: 0.34689599756520667 and parameters: {'model_name': 'SimpleImputer', 'strategy': 'mean'}. Best is trial 9 with value: 0.34689599756520667.
running
[I 2024-10-15 09:28:19,277] Trial 181 finished with value: 0.34689599756520667 and parameters: {'model_name': 'SimpleImputer', 'strategy': 'mean'}. Best is trial 9 with value: 0.34689599756520667.
running
[I 2024-10-15 09:28:19,411] Trial 180 finished with value: 0.34689599756520667 and parameters: {'model_name': 'SimpleImputer', 'strategy': 'mean'}. Best is trial 9 with value: 0.34689599756520667.
running
[I 2024-10-15 09:28:19,545] Trial 179 finished with value: 0.34689599756520667 and parameters: {'model_name': 'SimpleImputer', 'strategy': 'mean'}. Best is trial 9 with value: 0.34689599756520667.
running
[I 2024-10-15 09:28:19,753] Trial 186 finished with value: 0.34689599756520667 and parameters: {'model_name': 'SimpleImputer', 'strategy': 'mean'}. Best is trial 9 with value: 0.34689599756520667.
[I 2024-10-15 09:28:19,851] Trial 185 finished with value: 0.34689599756520667 and parameters: {'model_name': 'SimpleImputer', 'strategy': 'mean'}. Best is trial 9 with value: 0.34689599756520667.
running
[I 2024-10-15 09:28:19,961] Trial 182 finished with value: 0.34689599756520667 and parameters: {'model_name': 'SimpleImputer', 'strategy': 'mean'}. Best is trial 9 with value: 0.34689599756520667.
running
[I 2024-10-15 09:28:20,076] Trial 184 finished with value: 0.34689599756520667 and parameters: {'model_name': 'SimpleImputer', 'strategy': 'mean'}. Best is trial 9 with value: 0.34689599756520667.
[I 2024-10-15 09:28:20,207] Trial 183 finished with value: 0.34689599756520667 and parameters: {'model_name': 'SimpleImputer', 'strategy': 'mean'}. Best is trial 9 with value: 0.34689599756520667.
[I 2024-10-15 09:28:20,341] Trial 189 finished with value: 0.34689599756520667 and parameters: {'model_name': 'SimpleImputer', 'strategy': 'mean'}. Best is trial 9 with value: 0.34689599756520667.
[I 2024-10-15 09:28:20,443] Trial 187 finished with value: 0.34689599756520667 and parameters: {'model_name': 'SimpleImputer', 'strategy': 'mean'}. Best is trial 9 with value: 0.34689599756520667.
[I 2024-10-15 09:28:20,547] Trial 190 finished with value: 0.34689599756520667 and parameters: {'model_name': 'SimpleImputer', 'strategy': 'mean'}. Best is trial 9 with value: 0.34689599756520667.
[I 2024-10-15 09:28:20,700] Trial 188 finished with value: 0.34689599756520667 and parameters: {'model_name': 'SimpleImputer', 'strategy': 'mean'}. Best is trial 9 with value: 0.34689599756520667.
[I 2024-10-15 09:28:20,810] Trial 192 finished with value: 0.34689599756520667 and parameters: {'model_name': 'SimpleImputer', 'strategy': 'mean'}. Best is trial 9 with value: 0.34689599756520667.
[I 2024-10-15 09:28:20,961] Trial 196 finished with value: 0.34689599756520667 and parameters: {'model_name': 'SimpleImputer', 'strategy': 'mean'}. Best is trial 9 with value: 0.34689599756520667.
[I 2024-10-15 09:28:21,062] Trial 191 finished with value: 0.34689599756520667 and parameters: {'model_name': 'SimpleImputer', 'strategy': 'mean'}. Best is trial 9 with value: 0.34689599756520667.
[I 2024-10-15 09:28:21,166] Trial 194 finished with value: 0.34689599756520667 and parameters: {'model_name': 'SimpleImputer', 'strategy': 'mean'}. Best is trial 9 with value: 0.34689599756520667.
[I 2024-10-15 09:28:21,266] Trial 193 finished with value: 0.34689599756520667 and parameters: {'model_name': 'SimpleImputer', 'strategy': 'mean'}. Best is trial 9 with value: 0.34689599756520667.
[I 2024-10-15 09:28:21,364] Trial 195 finished with value: 0.34689599756520667 and parameters: {'model_name': 'SimpleImputer', 'strategy': 'mean'}. Best is trial 9 with value: 0.34689599756520667.
[I 2024-10-15 09:28:21,469] Trial 197 finished with value: 0.34689599756520667 and parameters: {'model_name': 'SimpleImputer', 'strategy': 'mean'}. Best is trial 9 with value: 0.34689599756520667.
[I 2024-10-15 09:28:21,563] Trial 199 finished with value: 0.34689599756520667 and parameters: {'model_name': 'SimpleImputer', 'strategy': 'mean'}. Best is trial 9 with value: 0.34689599756520667.
