[I 2024-10-07 22:58:34,735] Trial 199 finished with value: 0.19939579159472917 and parameters: {'model_name': 'IterativeImputer', 'estimator': 'RFR', 'initial_strategy': 'mean', 'n_nearest_features': 12, 'imputation_order': 'ascending'}. Best is trial 107 with value: 0.19850015889912181.
fit
auto fit
auto transform
0     0
1     0
2     0
3     0
4     0
5     0
6     0
7     0
8     0
9     0
10    0
11    0
dtype: int64
0     0
1     0
2     0
3     0
4     0
5     0
6     0
7     0
8     0
9     0
10    0
11    0
dtype: int64
0.19850015889912181
{'model_name': 'IterativeImputer', 'estimator': 'RFR', 'initial_strategy': 'median', 'n_nearest_features': 11, 'imputation_order': 'ascending'}
running experiment 2/3 - Does reconstruction give good automl predictions
Start est fit
Version 0.1.7a0 of tpot2 is outdated. Version 0.1.8a0 was released Tuesday September 17, 2024.
Version 0.1.7a0 of tpot2 is outdated. Version 0.1.8a0 was released Tuesday September 17, 2024.
Version 0.1.7a0 of tpot2 is outdated. Version 0.1.8a0 was released Tuesday September 17, 2024.
Version 0.1.7a0 of tpot2 is outdated. Version 0.1.8a0 was released Tuesday September 17, 2024.
Version 0.1.7a0 of tpot2 is outdated. Version 0.1.8a0 was released Tuesday September 17, 2024.
Version 0.1.7a0 of tpot2 is outdated. Version 0.1.8a0 was released Tuesday September 17, 2024.
Version 0.1.7a0 of tpot2 is outdated. Version 0.1.8a0 was released Tuesday September 17, 2024.
Version 0.1.7a0 of tpot2 is outdated. Version 0.1.8a0 was released Tuesday September 17, 2024.
Version 0.1.7a0 of tpot2 is outdated. Version 0.1.8a0 was released Tuesday September 17, 2024.
Version 0.1.7a0 of tpot2 is outdated. Version 0.1.8a0 was released Tuesday September 17, 2024.
Version 0.1.7a0 of tpot2 is outdated. Version 0.1.8a0 was released Tuesday September 17, 2024.
Version 0.1.7a0 of tpot2 is outdated. Version 0.1.8a0 was released Tuesday September 17, 2024.
Version 0.1.7a0 of tpot2 is outdated. Version 0.1.8a0 was released Tuesday September 17, 2024.
Version 0.1.7a0 of tpot2 is outdated. Version 0.1.8a0 was released Tuesday September 17, 2024.
Version 0.1.7a0 of tpot2 is outdated. Version 0.1.8a0 was released Tuesday September 17, 2024.
Version 0.1.7a0 of tpot2 is outdated. Version 0.1.8a0 was released Tuesday September 17, 2024.
  0%|          | 0/25 [00:00<?, ?it/s]Generation:   0%|          | 0/25 [00:00<?, ?it/s]WARNING THIS INDIVIDUAL CAUSED AND EXCEPTION 
 <tpot2.search_spaces.pipelines.sequential.SequentialPipelineIndividual object at 0x1554746a0d60> 
 The 'criterion' parameter of RandomForestRegressor must be a str among {'friedman_mse', 'poisson', 'absolute_error', 'squared_error'}. Got 'mse' instead. 
 Traceback (most recent call last):
  File "/common/ketrong/tpotexp/tpot2/tpot2/utils/eval_utils.py", line 53, in objective_nan_wrapper
    value = func_timeout.func_timeout(timeout, objective_function, args=[individual], kwargs=objective_kwargs)
  File "/common/ketrong/tpotexp/env/lib/python3.10/site-packages/func_timeout/dafunc.py", line 108, in func_timeout
    raise_exception(exception)
  File "/common/ketrong/tpotexp/env/lib/python3.10/site-packages/func_timeout/py3_raise.py", line 7, in raise_exception
    raise exception[0] from None
  File "/common/ketrong/tpotexp/tpot2/tpot2/tpot_estimator/estimator.py", line 623, in objective_function
    return objective_function_generator(
  File "/common/ketrong/tpotexp/tpot2/tpot2/tpot_estimator/estimator_utils.py", line 55, in objective_function_generator
    cv_obj_scores = cross_val_score_objective(sklearn.base.clone(pipeline),x,y,scorers=scorers, cv=cv , fold=step)
  File "/common/ketrong/tpotexp/tpot2/tpot2/tpot_estimator/cross_val_utils.py", line 28, in cross_val_score_objective
    this_fold_pipeline.fit(X_train,y_train)
  File "/common/ketrong/tpotexp/env/lib/python3.10/site-packages/sklearn/base.py", line 1473, in wrapper
    return fit_method(estimator, *args, **kwargs)
  File "/common/ketrong/tpotexp/env/lib/python3.10/site-packages/sklearn/pipeline.py", line 473, in fit
    self._final_estimator.fit(Xt, y, **last_step_params["fit"])
  File "/common/ketrong/tpotexp/env/lib/python3.10/site-packages/sklearn/base.py", line 1466, in wrapper
    estimator._validate_params()
  File "/common/ketrong/tpotexp/env/lib/python3.10/site-packages/sklearn/base.py", line 666, in _validate_params
    validate_parameter_constraints(
  File "/common/ketrong/tpotexp/env/lib/python3.10/site-packages/sklearn/utils/_param_validation.py", line 95, in validate_parameter_constraints
    raise InvalidParameterError(
sklearn.utils._param_validation.InvalidParameterError: The 'criterion' parameter of RandomForestRegressor must be a str among {'friedman_mse', 'poisson', 'absolute_error', 'squared_error'}. Got 'mse' instead.

WARNING THIS INDIVIDUAL CAUSED AND EXCEPTION 
 <tpot2.search_spaces.pipelines.sequential.SequentialPipelineIndividual object at 0x1554746ed270> 
 The 'criterion' parameter of ExtraTreesRegressor must be a str among {'friedman_mse', 'poisson', 'absolute_error', 'squared_error'}. Got 'mae' instead. 
 Traceback (most recent call last):
  File "/common/ketrong/tpotexp/tpot2/tpot2/utils/eval_utils.py", line 53, in objective_nan_wrapper
    value = func_timeout.func_timeout(timeout, objective_function, args=[individual], kwargs=objective_kwargs)
  File "/common/ketrong/tpotexp/env/lib/python3.10/site-packages/func_timeout/dafunc.py", line 108, in func_timeout
    raise_exception(exception)
  File "/common/ketrong/tpotexp/env/lib/python3.10/site-packages/func_timeout/py3_raise.py", line 7, in raise_exception
    raise exception[0] from None
  File "/common/ketrong/tpotexp/tpot2/tpot2/tpot_estimator/estimator.py", line 623, in objective_function
    return objective_function_generator(
  File "/common/ketrong/tpotexp/tpot2/tpot2/tpot_estimator/estimator_utils.py", line 55, in objective_function_generator
    cv_obj_scores = cross_val_score_objective(sklearn.base.clone(pipeline),x,y,scorers=scorers, cv=cv , fold=step)
  File "/common/ketrong/tpotexp/tpot2/tpot2/tpot_estimator/cross_val_utils.py", line 28, in cross_val_score_objective
    this_fold_pipeline.fit(X_train,y_train)
  File "/common/ketrong/tpotexp/env/lib/python3.10/site-packages/sklearn/base.py", line 1473, in wrapper
    return fit_method(estimator, *args, **kwargs)
  File "/common/ketrong/tpotexp/env/lib/python3.10/site-packages/sklearn/pipeline.py", line 473, in fit
    self._final_estimator.fit(Xt, y, **last_step_params["fit"])
  File "/common/ketrong/tpotexp/env/lib/python3.10/site-packages/sklearn/base.py", line 1466, in wrapper
    estimator._validate_params()
  File "/common/ketrong/tpotexp/env/lib/python3.10/site-packages/sklearn/base.py", line 666, in _validate_params
    validate_parameter_constraints(
  File "/common/ketrong/tpotexp/env/lib/python3.10/site-packages/sklearn/utils/_param_validation.py", line 95, in validate_parameter_constraints
    raise InvalidParameterError(
sklearn.utils._param_validation.InvalidParameterError: The 'criterion' parameter of ExtraTreesRegressor must be a str among {'friedman_mse', 'poisson', 'absolute_error', 'squared_error'}. Got 'mae' instead.

Generation:  1
Best root_mean_squared_error score: -13052.884847824733
Generation:   4%|▍         | 1/25 [03:04<1:13:39, 184.15s/it]WARNING THIS INDIVIDUAL CAUSED AND EXCEPTION 
 <tpot2.search_spaces.pipelines.sequential.SequentialPipelineIndividual object at 0x1554746f3550> 
 The 'criterion' parameter of RandomForestRegressor must be a str among {'friedman_mse', 'poisson', 'absolute_error', 'squared_error'}. Got 'mae' instead. 
 Traceback (most recent call last):
  File "/common/ketrong/tpotexp/tpot2/tpot2/utils/eval_utils.py", line 53, in objective_nan_wrapper
    value = func_timeout.func_timeout(timeout, objective_function, args=[individual], kwargs=objective_kwargs)
  File "/common/ketrong/tpotexp/env/lib/python3.10/site-packages/func_timeout/dafunc.py", line 108, in func_timeout
    raise_exception(exception)
  File "/common/ketrong/tpotexp/env/lib/python3.10/site-packages/func_timeout/py3_raise.py", line 7, in raise_exception
    raise exception[0] from None
  File "/common/ketrong/tpotexp/tpot2/tpot2/tpot_estimator/estimator.py", line 623, in objective_function
    return objective_function_generator(
  File "/common/ketrong/tpotexp/tpot2/tpot2/tpot_estimator/estimator_utils.py", line 55, in objective_function_generator
    cv_obj_scores = cross_val_score_objective(sklearn.base.clone(pipeline),x,y,scorers=scorers, cv=cv , fold=step)
  File "/common/ketrong/tpotexp/tpot2/tpot2/tpot_estimator/cross_val_utils.py", line 28, in cross_val_score_objective
    this_fold_pipeline.fit(X_train,y_train)
  File "/common/ketrong/tpotexp/env/lib/python3.10/site-packages/sklearn/base.py", line 1473, in wrapper
    return fit_method(estimator, *args, **kwargs)
  File "/common/ketrong/tpotexp/env/lib/python3.10/site-packages/sklearn/pipeline.py", line 473, in fit
    self._final_estimator.fit(Xt, y, **last_step_params["fit"])
  File "/common/ketrong/tpotexp/env/lib/python3.10/site-packages/sklearn/base.py", line 1466, in wrapper
    estimator._validate_params()
  File "/common/ketrong/tpotexp/env/lib/python3.10/site-packages/sklearn/base.py", line 666, in _validate_params
    validate_parameter_constraints(
  File "/common/ketrong/tpotexp/env/lib/python3.10/site-packages/sklearn/utils/_param_validation.py", line 95, in validate_parameter_constraints
    raise InvalidParameterError(
sklearn.utils._param_validation.InvalidParameterError: The 'criterion' parameter of RandomForestRegressor must be a str among {'friedman_mse', 'poisson', 'absolute_error', 'squared_error'}. Got 'mae' instead.

WARNING THIS INDIVIDUAL CAUSED AND EXCEPTION 
 <tpot2.search_spaces.pipelines.sequential.SequentialPipelineIndividual object at 0x155467a9d5a0> 
 The 'criterion' parameter of RandomForestRegressor must be a str among {'friedman_mse', 'poisson', 'absolute_error', 'squared_error'}. Got 'mae' instead. 
 Traceback (most recent call last):
  File "/common/ketrong/tpotexp/tpot2/tpot2/utils/eval_utils.py", line 53, in objective_nan_wrapper
    value = func_timeout.func_timeout(timeout, objective_function, args=[individual], kwargs=objective_kwargs)
  File "/common/ketrong/tpotexp/env/lib/python3.10/site-packages/func_timeout/dafunc.py", line 108, in func_timeout
    raise_exception(exception)
  File "/common/ketrong/tpotexp/env/lib/python3.10/site-packages/func_timeout/py3_raise.py", line 7, in raise_exception
    raise exception[0] from None
  File "/common/ketrong/tpotexp/tpot2/tpot2/tpot_estimator/estimator.py", line 623, in objective_function
    return objective_function_generator(
  File "/common/ketrong/tpotexp/tpot2/tpot2/tpot_estimator/estimator_utils.py", line 55, in objective_function_generator
    cv_obj_scores = cross_val_score_objective(sklearn.base.clone(pipeline),x,y,scorers=scorers, cv=cv , fold=step)
  File "/common/ketrong/tpotexp/tpot2/tpot2/tpot_estimator/cross_val_utils.py", line 28, in cross_val_score_objective
    this_fold_pipeline.fit(X_train,y_train)
  File "/common/ketrong/tpotexp/env/lib/python3.10/site-packages/sklearn/base.py", line 1473, in wrapper
    return fit_method(estimator, *args, **kwargs)
  File "/common/ketrong/tpotexp/env/lib/python3.10/site-packages/sklearn/pipeline.py", line 473, in fit
    self._final_estimator.fit(Xt, y, **last_step_params["fit"])
  File "/common/ketrong/tpotexp/env/lib/python3.10/site-packages/sklearn/base.py", line 1466, in wrapper
    estimator._validate_params()
  File "/common/ketrong/tpotexp/env/lib/python3.10/site-packages/sklearn/base.py", line 666, in _validate_params
    validate_parameter_constraints(
  File "/common/ketrong/tpotexp/env/lib/python3.10/site-packages/sklearn/utils/_param_validation.py", line 95, in validate_parameter_constraints
    raise InvalidParameterError(
sklearn.utils._param_validation.InvalidParameterError: The 'criterion' parameter of RandomForestRegressor must be a str among {'friedman_mse', 'poisson', 'absolute_error', 'squared_error'}. Got 'mae' instead.

Generation:  2
Best root_mean_squared_error score: -13052.884847824733
Generation:   8%|▊         | 2/25 [03:35<36:01, 94.00s/it]   WARNING THIS INDIVIDUAL CAUSED AND EXCEPTION 
 <tpot2.search_spaces.pipelines.sequential.SequentialPipelineIndividual object at 0x1554746face0> 
 The 'criterion' parameter of DecisionTreeRegressor must be a str among {'friedman_mse', 'poisson', 'absolute_error', 'squared_error'}. Got 'mae' instead. 
 Traceback (most recent call last):
  File "/common/ketrong/tpotexp/tpot2/tpot2/utils/eval_utils.py", line 53, in objective_nan_wrapper
    value = func_timeout.func_timeout(timeout, objective_function, args=[individual], kwargs=objective_kwargs)
  File "/common/ketrong/tpotexp/env/lib/python3.10/site-packages/func_timeout/dafunc.py", line 108, in func_timeout
    raise_exception(exception)
  File "/common/ketrong/tpotexp/env/lib/python3.10/site-packages/func_timeout/py3_raise.py", line 7, in raise_exception
    raise exception[0] from None
  File "/common/ketrong/tpotexp/tpot2/tpot2/tpot_estimator/estimator.py", line 623, in objective_function
    return objective_function_generator(
  File "/common/ketrong/tpotexp/tpot2/tpot2/tpot_estimator/estimator_utils.py", line 55, in objective_function_generator
    cv_obj_scores = cross_val_score_objective(sklearn.base.clone(pipeline),x,y,scorers=scorers, cv=cv , fold=step)
  File "/common/ketrong/tpotexp/tpot2/tpot2/tpot_estimator/cross_val_utils.py", line 28, in cross_val_score_objective
    this_fold_pipeline.fit(X_train,y_train)
  File "/common/ketrong/tpotexp/env/lib/python3.10/site-packages/sklearn/base.py", line 1473, in wrapper
    return fit_method(estimator, *args, **kwargs)
  File "/common/ketrong/tpotexp/env/lib/python3.10/site-packages/sklearn/pipeline.py", line 473, in fit
    self._final_estimator.fit(Xt, y, **last_step_params["fit"])
  File "/common/ketrong/tpotexp/env/lib/python3.10/site-packages/sklearn/base.py", line 1466, in wrapper
    estimator._validate_params()
  File "/common/ketrong/tpotexp/env/lib/python3.10/site-packages/sklearn/base.py", line 666, in _validate_params
    validate_parameter_constraints(
  File "/common/ketrong/tpotexp/env/lib/python3.10/site-packages/sklearn/utils/_param_validation.py", line 95, in validate_parameter_constraints
    raise InvalidParameterError(
sklearn.utils._param_validation.InvalidParameterError: The 'criterion' parameter of DecisionTreeRegressor must be a str among {'friedman_mse', 'poisson', 'absolute_error', 'squared_error'}. Got 'mae' instead.

WARNING THIS INDIVIDUAL CAUSED AND EXCEPTION 
 <tpot2.search_spaces.pipelines.sequential.SequentialPipelineIndividual object at 0x155467af0460> 
 The 'criterion' parameter of ExtraTreesRegressor must be a str among {'friedman_mse', 'poisson', 'absolute_error', 'squared_error'}. Got 'mae' instead. 
 Traceback (most recent call last):
  File "/common/ketrong/tpotexp/tpot2/tpot2/utils/eval_utils.py", line 53, in objective_nan_wrapper
    value = func_timeout.func_timeout(timeout, objective_function, args=[individual], kwargs=objective_kwargs)
  File "/common/ketrong/tpotexp/env/lib/python3.10/site-packages/func_timeout/dafunc.py", line 108, in func_timeout
    raise_exception(exception)
  File "/common/ketrong/tpotexp/env/lib/python3.10/site-packages/func_timeout/py3_raise.py", line 7, in raise_exception
    raise exception[0] from None
  File "/common/ketrong/tpotexp/tpot2/tpot2/tpot_estimator/estimator.py", line 623, in objective_function
    return objective_function_generator(
  File "/common/ketrong/tpotexp/tpot2/tpot2/tpot_estimator/estimator_utils.py", line 55, in objective_function_generator
    cv_obj_scores = cross_val_score_objective(sklearn.base.clone(pipeline),x,y,scorers=scorers, cv=cv , fold=step)
  File "/common/ketrong/tpotexp/tpot2/tpot2/tpot_estimator/cross_val_utils.py", line 28, in cross_val_score_objective
    this_fold_pipeline.fit(X_train,y_train)
  File "/common/ketrong/tpotexp/env/lib/python3.10/site-packages/sklearn/base.py", line 1473, in wrapper
    return fit_method(estimator, *args, **kwargs)
  File "/common/ketrong/tpotexp/env/lib/python3.10/site-packages/sklearn/pipeline.py", line 473, in fit
    self._final_estimator.fit(Xt, y, **last_step_params["fit"])
  File "/common/ketrong/tpotexp/env/lib/python3.10/site-packages/sklearn/base.py", line 1466, in wrapper
    estimator._validate_params()
  File "/common/ketrong/tpotexp/env/lib/python3.10/site-packages/sklearn/base.py", line 666, in _validate_params
    validate_parameter_constraints(
  File "/common/ketrong/tpotexp/env/lib/python3.10/site-packages/sklearn/utils/_param_validation.py", line 95, in validate_parameter_constraints
    raise InvalidParameterError(
sklearn.utils._param_validation.InvalidParameterError: The 'criterion' parameter of ExtraTreesRegressor must be a str among {'friedman_mse', 'poisson', 'absolute_error', 'squared_error'}. Got 'mae' instead.

WARNING THIS INDIVIDUAL CAUSED AND EXCEPTION 
 <tpot2.search_spaces.pipelines.sequential.SequentialPipelineIndividual object at 0x15547470dc00> 
 The 'criterion' parameter of RandomForestRegressor must be a str among {'friedman_mse', 'poisson', 'absolute_error', 'squared_error'}. Got 'mae' instead. 
 Traceback (most recent call last):
  File "/common/ketrong/tpotexp/tpot2/tpot2/utils/eval_utils.py", line 53, in objective_nan_wrapper
    value = func_timeout.func_timeout(timeout, objective_function, args=[individual], kwargs=objective_kwargs)
  File "/common/ketrong/tpotexp/env/lib/python3.10/site-packages/func_timeout/dafunc.py", line 108, in func_timeout
    raise_exception(exception)
  File "/common/ketrong/tpotexp/env/lib/python3.10/site-packages/func_timeout/py3_raise.py", line 7, in raise_exception
    raise exception[0] from None
  File "/common/ketrong/tpotexp/tpot2/tpot2/tpot_estimator/estimator.py", line 623, in objective_function
    return objective_function_generator(
  File "/common/ketrong/tpotexp/tpot2/tpot2/tpot_estimator/estimator_utils.py", line 55, in objective_function_generator
    cv_obj_scores = cross_val_score_objective(sklearn.base.clone(pipeline),x,y,scorers=scorers, cv=cv , fold=step)
  File "/common/ketrong/tpotexp/tpot2/tpot2/tpot_estimator/cross_val_utils.py", line 28, in cross_val_score_objective
    this_fold_pipeline.fit(X_train,y_train)
  File "/common/ketrong/tpotexp/env/lib/python3.10/site-packages/sklearn/base.py", line 1473, in wrapper
    return fit_method(estimator, *args, **kwargs)
  File "/common/ketrong/tpotexp/env/lib/python3.10/site-packages/sklearn/pipeline.py", line 473, in fit
    self._final_estimator.fit(Xt, y, **last_step_params["fit"])
  File "/common/ketrong/tpotexp/env/lib/python3.10/site-packages/sklearn/base.py", line 1466, in wrapper
    estimator._validate_params()
  File "/common/ketrong/tpotexp/env/lib/python3.10/site-packages/sklearn/base.py", line 666, in _validate_params
    validate_parameter_constraints(
  File "/common/ketrong/tpotexp/env/lib/python3.10/site-packages/sklearn/utils/_param_validation.py", line 95, in validate_parameter_constraints
    raise InvalidParameterError(
sklearn.utils._param_validation.InvalidParameterError: The 'criterion' parameter of RandomForestRegressor must be a str among {'friedman_mse', 'poisson', 'absolute_error', 'squared_error'}. Got 'mae' instead.

Generation:  3
Best root_mean_squared_error score: -13052.884847824733
Generation:  12%|█▏        | 3/25 [04:08<24:21, 66.43s/it]WARNING THIS INDIVIDUAL CAUSED AND EXCEPTION 
 <tpot2.search_spaces.pipelines.sequential.SequentialPipelineIndividual object at 0x15547472d9f0> 
 The 'criterion' parameter of RandomForestRegressor must be a str among {'friedman_mse', 'poisson', 'absolute_error', 'squared_error'}. Got 'mse' instead. 
 Traceback (most recent call last):
  File "/common/ketrong/tpotexp/tpot2/tpot2/utils/eval_utils.py", line 53, in objective_nan_wrapper
    value = func_timeout.func_timeout(timeout, objective_function, args=[individual], kwargs=objective_kwargs)
  File "/common/ketrong/tpotexp/env/lib/python3.10/site-packages/func_timeout/dafunc.py", line 108, in func_timeout
    raise_exception(exception)
  File "/common/ketrong/tpotexp/env/lib/python3.10/site-packages/func_timeout/py3_raise.py", line 7, in raise_exception
    raise exception[0] from None
  File "/common/ketrong/tpotexp/tpot2/tpot2/tpot_estimator/estimator.py", line 623, in objective_function
    return objective_function_generator(
  File "/common/ketrong/tpotexp/tpot2/tpot2/tpot_estimator/estimator_utils.py", line 55, in objective_function_generator
    cv_obj_scores = cross_val_score_objective(sklearn.base.clone(pipeline),x,y,scorers=scorers, cv=cv , fold=step)
  File "/common/ketrong/tpotexp/tpot2/tpot2/tpot_estimator/cross_val_utils.py", line 28, in cross_val_score_objective
    this_fold_pipeline.fit(X_train,y_train)
  File "/common/ketrong/tpotexp/env/lib/python3.10/site-packages/sklearn/base.py", line 1473, in wrapper
    return fit_method(estimator, *args, **kwargs)
  File "/common/ketrong/tpotexp/env/lib/python3.10/site-packages/sklearn/pipeline.py", line 473, in fit
    self._final_estimator.fit(Xt, y, **last_step_params["fit"])
  File "/common/ketrong/tpotexp/env/lib/python3.10/site-packages/sklearn/base.py", line 1466, in wrapper
    estimator._validate_params()
  File "/common/ketrong/tpotexp/env/lib/python3.10/site-packages/sklearn/base.py", line 666, in _validate_params
    validate_parameter_constraints(
  File "/common/ketrong/tpotexp/env/lib/python3.10/site-packages/sklearn/utils/_param_validation.py", line 95, in validate_parameter_constraints
    raise InvalidParameterError(
sklearn.utils._param_validation.InvalidParameterError: The 'criterion' parameter of RandomForestRegressor must be a str among {'friedman_mse', 'poisson', 'absolute_error', 'squared_error'}. Got 'mse' instead.

Generation:  4
Best root_mean_squared_error score: -13052.884847824733
Generation:  16