[I 2024-11-07 01:05:41,035] Trial 88 finished with value: 0.26095716983350475 and parameters: {'model_name': 'VAE', 'batch_size': 48, 'iterations': 262, 'learning_rate': 0.02911515752979369, 'p_miss': 0.1645079166879238}. Best is trial 34 with value: 0.22366811790116725.
running
[I 2024-11-07 01:05:41,589] Trial 89 finished with value: 0.44933240409668684 and parameters: {'model_name': 'SimpleImputer', 'strategy': 'constant'}. Best is trial 34 with value: 0.22366811790116725.
running
[I 2024-11-07 01:26:03,096] Trial 73 finished with value: 0.2617167207147916 and parameters: {'model_name': 'VAE', 'batch_size': 33, 'iterations': 3514, 'learning_rate': 0.0015356178237081227, 'p_miss': 0.21638664484571235}. Best is trial 34 with value: 0.22366811790116725.
running
[I 2024-11-07 01:46:04,022] Trial 90 finished with value: 0.22667482788254634 and parameters: {'model_name': 'IterativeImputer', 'estimator': 'RFR', 'initial_strategy': 'constant', 'n_nearest_features': 14, 'imputation_order': 'arabic'}. Best is trial 34 with value: 0.22366811790116725.
running
[I 2024-11-07 01:46:47,586] Trial 92 finished with value: 0.26239352220574946 and parameters: {'model_name': 'IterativeImputer', 'estimator': 'KNN', 'initial_strategy': 'constant', 'n_nearest_features': 14, 'imputation_order': 'arabic'}. Best is trial 34 with value: 0.22366811790116725.
running
[I 2024-11-07 02:05:10,383] Trial 91 finished with value: 0.2275869397016757 and parameters: {'model_name': 'IterativeImputer', 'estimator': 'RFR', 'initial_strategy': 'constant', 'n_nearest_features': 14, 'imputation_order': 'arabic'}. Best is trial 34 with value: 0.22366811790116725.
running
[I 2024-11-07 02:27:10,268] Trial 93 finished with value: 0.2261080269732541 and parameters: {'model_name': 'IterativeImputer', 'estimator': 'RFR', 'initial_strategy': 'constant', 'n_nearest_features': 14, 'imputation_order': 'arabic'}. Best is trial 34 with value: 0.22366811790116725.
running
[I 2024-11-07 02:34:11,503] Trial 75 finished with value: 0.2629238692415157 and parameters: {'model_name': 'VAE', 'batch_size': 27, 'iterations': 4092, 'learning_rate': 0.0017720841304563809, 'p_miss': 0.21367798367206445}. Best is trial 34 with value: 0.22366811790116725.
running
[I 2024-11-07 02:44:24,274] Trial 94 finished with value: 0.22673907962456546 and parameters: {'model_name': 'IterativeImputer', 'estimator': 'RFR', 'initial_strategy': 'constant', 'n_nearest_features': 14, 'imputation_order': 'arabic'}. Best is trial 34 with value: 0.22366811790116725.
running
[I 2024-11-07 02:54:03,967] Trial 78 finished with value: 0.2614565503971183 and parameters: {'model_name': 'VAE', 'batch_size': 30, 'iterations': 4900, 'learning_rate': 0.0016954991235285915, 'p_miss': 0.21092630011783195}. Best is trial 34 with value: 0.22366811790116725.
running
[I 2024-11-07 03:09:31,823] Trial 95 finished with value: 0.22663420155315572 and parameters: {'model_name': 'IterativeImputer', 'estimator': 'RFR', 'initial_strategy': 'constant', 'n_nearest_features': 14, 'imputation_order': 'arabic'}. Best is trial 34 with value: 0.22366811790116725.
running
[I 2024-11-07 03:16:45,129] Trial 96 finished with value: 0.22511302041858797 and parameters: {'model_name': 'IterativeImputer', 'estimator': 'RFR', 'initial_strategy': 'constant', 'n_nearest_features': 14, 'imputation_order': 'arabic'}. Best is trial 34 with value: 0.22366811790116725.
running
[I 2024-11-07 03:19:21,721] Trial 74 finished with value: 0.2612842878596149 and parameters: {'model_name': 'VAE', 'batch_size': 33, 'iterations': 5399, 'learning_rate': 0.00010529816543181328, 'p_miss': 0.21497106887326572}. Best is trial 34 with value: 0.22366811790116725.
running
[I 2024-11-07 03:25:03,046] Trial 97 finished with value: 0.22688063509240414 and parameters: {'model_name': 'IterativeImputer', 'estimator': 'RFR', 'initial_strategy': 'constant', 'n_nearest_features': 14, 'imputation_order': 'arabic'}. Best is trial 34 with value: 0.22366811790116725.
running
[I 2024-11-07 03:37:04,663] Trial 98 finished with value: 0.22633514275270855 and parameters: {'model_name': 'IterativeImputer', 'estimator': 'RFR', 'initial_strategy': 'constant', 'n_nearest_features': 14, 'imputation_order': 'arabic'}. Best is trial 34 with value: 0.22366811790116725.
running
[I 2024-11-07 03:52:32,582] Trial 99 finished with value: 0.22672432227076875 and parameters: {'model_name': 'IterativeImputer', 'estimator': 'RFR', 'initial_strategy': 'constant', 'n_nearest_features': 14, 'imputation_order': 'arabic'}. Best is trial 34 with value: 0.22366811790116725.
running
[I 2024-11-07 04:00:22,032] Trial 100 finished with value: 0.22267099946030527 and parameters: {'model_name': 'IterativeImputer', 'estimator': 'RFR', 'initial_strategy': 'constant', 'n_nearest_features': 15, 'imputation_order': 'arabic'}. Best is trial 100 with value: 0.22267099946030527.
running
[I 2024-11-07 04:00:28,726] Trial 105 finished with value: 0.2553604670956326 and parameters: {'model_name': 'KNNImputer', 'n_neighbors': 1883, 'weights': 'uniform'}. Best is trial 100 with value: 0.22267099946030527.
running
[I 2024-11-07 04:03:21,559] Trial 101 finished with value: 0.22288110786298362 and parameters: {'model_name': 'IterativeImputer', 'estimator': 'RFR', 'initial_strategy': 'constant', 'n_nearest_features': 15, 'imputation_order': 'arabic'}. Best is trial 100 with value: 0.22267099946030527.
running
[I 2024-11-07 04:07:45,031] Trial 102 finished with value: 0.2240887397722565 and parameters: {'model_name': 'IterativeImputer', 'estimator': 'RFR', 'initial_strategy': 'constant', 'n_nearest_features': 15, 'imputation_order': 'arabic'}. Best is trial 100 with value: 0.22267099946030527.
running
[I 2024-11-07 04:20:58,208] Trial 103 finished with value: 0.2251530779172582 and parameters: {'model_name': 'IterativeImputer', 'estimator': 'RFR', 'initial_strategy': 'constant', 'n_nearest_features': 15, 'imputation_order': 'arabic'}. Best is trial 100 with value: 0.22267099946030527.
running
[I 2024-11-07 04:21:43,341] Trial 109 finished with value: 0.2677501995612328 and parameters: {'model_name': 'IterativeImputer', 'estimator': 'KNN', 'initial_strategy': 'constant', 'n_nearest_features': 15, 'imputation_order': 'arabic'}. Best is trial 100 with value: 0.22267099946030527.
running
[I 2024-11-07 04:35:38,356] Trial 82 finished with value: 0.2619747945246103 and parameters: {'model_name': 'VAE', 'batch_size': 29, 'iterations': 5596, 'learning_rate': 0.0020062295151107522, 'p_miss': 0.21363388544582754}. Best is trial 100 with value: 0.22267099946030527.
running
[I 2024-11-07 04:35:38,632] Trial 104 finished with value: 0.22287710975934316 and parameters: {'model_name': 'IterativeImputer', 'estimator': 'RFR', 'initial_strategy': 'constant', 'n_nearest_features': 15, 'imputation_order': 'arabic'}. Best is trial 100 with value: 0.22267099946030527.
running
[I 2024-11-07 04:40:20,103] Trial 80 finished with value: 0.2612788661823023 and parameters: {'model_name': 'VAE', 'batch_size': 34, 'iterations': 6438, 'learning_rate': 0.0019348944158452438, 'p_miss': 0.1962592284379862}. Best is trial 100 with value: 0.22267099946030527.
running
[I 2024-11-07 04:44:16,344] Trial 106 finished with value: 0.2253397447795331 and parameters: {'model_name': 'IterativeImputer', 'estimator': 'RFR', 'initial_strategy': 'constant', 'n_nearest_features': 15, 'imputation_order': 'arabic'}. Best is trial 100 with value: 0.22267099946030527.
running
[I 2024-11-07 04:48:00,432] Trial 107 finished with value: 0.22363582157056267 and parameters: {'model_name': 'IterativeImputer', 'estimator': 'RFR', 'initial_strategy': 'constant', 'n_nearest_features': 15, 'imputation_order': 'arabic'}. Best is trial 100 with value: 0.22267099946030527.
running
[I 2024-11-07 04:51:21,485] Trial 108 finished with value: 0.22360927556247087 and parameters: {'model_name': 'IterativeImputer', 'estimator': 'RFR', 'initial_strategy': 'constant', 'n_nearest_features': 15, 'imputation_order': 'arabic'}. Best is trial 100 with value: 0.22267099946030527.
running
[I 2024-11-07 05:05:24,572] Trial 110 finished with value: 0.22416063678599193 and parameters: {'model_name': 'IterativeImputer', 'estimator': 'RFR', 'initial_strategy': 'constant', 'n_nearest_features': 15, 'imputation_order': 'arabic'}. Best is trial 100 with value: 0.22267099946030527.
running
[I 2024-11-07 05:19:43,885] Trial 112 finished with value: 0.22406251643677288 and parameters: {'model_name': 'IterativeImputer', 'estimator': 'RFR', 'initial_strategy': 'constant', 'n_nearest_features': 15, 'imputation_order': 'arabic'}. Best is trial 100 with value: 0.22267099946030527.
running
[I 2024-11-07 05:20:37,060] Trial 111 finished with value: 0.22400188210036315 and parameters: {'model_name': 'IterativeImputer', 'estimator': 'RFR', 'initial_strategy': 'constant', 'n_nearest_features': 15, 'imputation_order': 'arabic'}. Best is trial 100 with value: 0.22267099946030527.
running
[I 2024-11-07 05:24:18,411] Trial 113 finished with value: 0.2235252156941741 and parameters: {'model_name': 'IterativeImputer', 'estimator': 'RFR', 'initial_strategy': 'constant', 'n_nearest_features': 15, 'imputation_order': 'arabic'}. Best is trial 100 with value: 0.22267099946030527.
running
[I 2024-11-07 05:29:47,191] Trial 114 finished with value: 0.225562387838559 and parameters: {'model_name': 'IterativeImputer', 'estimator': 'RFR', 'initial_strategy': 'constant', 'n_nearest_features': 15, 'imputation_order': 'arabic'}. Best is trial 100 with value: 0.22267099946030527.
running
[I 2024-11-07 05:34:12,724] Trial 115 finished with value: 0.22428091125755795 and parameters: {'model_name': 'IterativeImputer', 'estimator': 'RFR', 'initial_strategy': 'constant', 'n_nearest_features': 15, 'imputation_order': 'arabic'}. Best is trial 100 with value: 0.22267099946030527.
running
[I 2024-11-07 05:34:15,565] Trial 122 finished with value: inf and parameters: {'model_name': 'GAIN', 'batch_size': 1, 'hint_rate': 0.31718190887052516, 'alpha': 40, 'iterations': 4, 'learning_rate': 0.027022346371397405, 'p_miss': 0.11880859326491018}. Best is trial 100 with value: 0.22267099946030527.
running
[I 2024-11-07 05:34:16,154] Trial 123 finished with value: 0.25793793757773076 and parameters: {'model_name': 'SimpleImputer', 'strategy': 'mean'}. Best is trial 100 with value: 0.22267099946030527.
running
[I 2024-11-07 05:34:34,310] Trial 116 finished with value: 0.22505893951982459 and parameters: {'model_name': 'IterativeImputer', 'estimator': 'RFR', 'initial_strategy': 'constant', 'n_nearest_features': 15, 'imputation_order': 'arabic'}. Best is trial 100 with value: 0.22267099946030527.
running
[I 2024-11-07 05:48:53,850] Trial 117 finished with value: 0.22438437559524305 and parameters: {'model_name': 'IterativeImputer', 'estimator': 'RFR', 'initial_strategy': 'constant', 'n_nearest_features': 15, 'imputation_order': 'arabic'}. Best is trial 100 with value: 0.22267099946030527.
running
[I 2024-11-07 05:53:04,107] Trial 87 finished with value: 0.32161216746077 and parameters: {'model_name': 'VAE', 'batch_size': 1, 'iterations': 5627, 'learning_rate': 0.00010108225153390855, 'p_miss': 0.15738721372527079}. Best is trial 100 with value: 0.22267099946030527.
running
[I 2024-11-07 06:02:46,915] Trial 118 finished with value: 0.22386838556878338 and parameters: {'model_name': 'IterativeImputer', 'estimator': 'RFR', 'initial_strategy': 'constant', 'n_nearest_features': 16, 'imputation_order': 'arabic'}. Best is trial 100 with value: 0.22267099946030527.
running
[I 2024-11-07 06:06:59,485] Trial 119 finished with value: 0.2237096176022375 and parameters: {'model_name': 'IterativeImputer', 'estimator': 'RFR', 'initial_strategy': 'constant', 'n_nearest_features': 16, 'imputation_order': 'arabic'}. Best is trial 100 with value: 0.22267099946030527.
running
[I 2024-11-07 06:10:08,829] Trial 120 finished with value: 0.22358796555451463 and parameters: {'model_name': 'IterativeImputer', 'estimator': 'RFR', 'initial_strategy': 'constant', 'n_nearest_features': 16, 'imputation_order': 'arabic'}. Best is trial 100 with value: 0.22267099946030527.
running
[I 2024-11-07 06:14:13,350] Trial 83 finished with value: 0.26149204696038464 and parameters: {'model_name': 'VAE', 'batch_size': 44, 'iterations': 8835, 'learning_rate': 0.00010067569917169669, 'p_miss': 0.2257643665771508}. Best is trial 100 with value: 0.22267099946030527.
running
[I 2024-11-07 06:15:34,932] Trial 121 finished with value: 0.22404451110679613 and parameters: {'model_name': 'IterativeImputer', 'estimator': 'RFR', 'initial_strategy': 'constant', 'n_nearest_features': 16, 'imputation_order': 'arabic'}. Best is trial 100 with value: 0.22267099946030527.
running
[I 2024-11-07 06:18:41,260] Trial 71 finished with value: 0.2618256557967408 and parameters: {'model_name': 'VAE', 'batch_size': 20, 'iterations': 6040, 'learning_rate': 0.0026104182362558575, 'p_miss': 0.20778002427093006}. Best is trial 100 with value: 0.22267099946030527.
running
[I 2024-11-07 06:19:18,719] Trial 125 finished with value: 0.22502112408146974 and parameters: {'model_name': 'IterativeImputer', 'estimator': 'RFR', 'initial_strategy': 'constant', 'n_nearest_features': 16, 'imputation_order': 'arabic'}. Best is trial 100 with value: 0.22267099946030527.
running
[I 2024-11-07 06:20:22,907] Trial 124 finished with value: 0.2248799240900758 and parameters: {'model_name': 'IterativeImputer', 'estimator': 'RFR', 'initial_strategy': 'constant', 'n_nearest_features': 16, 'imputation_order': 'arabic'}. Best is trial 100 with value: 0.22267099946030527.
running
[I 2024-11-07 06:21:14,157] Trial 135 finished with value: 0.2668098754434827 and parameters: {'model_name': 'IterativeImputer', 'estimator': 'KNN', 'initial_strategy': 'constant', 'n_nearest_features': 16, 'imputation_order': 'descending'}. Best is trial 100 with value: 0.22267099946030527.
running
[I 2024-11-07 06:33:02,199] Trial 126 finished with value: 0.2236021560830365 and parameters: {'model_name': 'IterativeImputer', 'estimator': 'RFR', 'initial_strategy': 'constant', 'n_nearest_features': 16, 'imputation_order': 'arabic'}. Best is trial 100 with value: 0.22267099946030527.
running
[I 2024-11-07 06:39:26,989] Trial 127 finished with value: 0.22350862075662267 and parameters: {'model_name': 'IterativeImputer', 'estimator': 'RFR', 'initial_strategy': 'constant', 'n_nearest_features': 16, 'imputation_order': 'arabic'}. Best is trial 100 with value: 0.22267099946030527.
running
[I 2024-11-07 06:46:49,453] Trial 128 finished with value: 0.22345470456935507 and parameters: {'model_name': 'IterativeImputer', 'estimator': 'RFR', 'initial_strategy': 'constant', 'n_nearest_features': 16, 'imputation_order': 'arabic'}. Best is trial 100 with value: 0.22267099946030527.
running
[I 2024-11-07 06:46:59,364] Trial 76 finished with value: 0.26124425578344473 and parameters: {'model_name': 'VAE', 'batch_size': 36, 'iterations': 8619, 'learning_rate': 0.0018648749307685329, 'p_miss': 0.22219482092130316}. Best is trial 100 with value: 0.22267099946030527.
running
[I 2024-11-07 06:53:20,288] Trial 85 finished with value: 0.26265173832723643 and parameters: {'model_name': 'VAE', 'batch_size': 41, 'iterations': 8693, 'learning_rate': 0.0018833150496346078, 'p_miss': 0.2158629006780588}. Best is trial 100 with value: 0.22267099946030527.
running
[I 2024-11-07 06:53:48,888] Trial 129 finished with value: 0.2245210712367327 and parameters: {'model_name': 'IterativeImputer', 'estimator': 'RFR', 'initial_strategy': 'constant', 'n_nearest_features': 16, 'imputation_order': 'arabic'}. Best is trial 100 with value: 0.22267099946030527.
running
[I 2024-11-07 06:56:44,858] Trial 130 finished with value: 0.22256771513806659 and parameters: {'model_name': 'IterativeImputer', 'estimator': 'RFR', 'initial_strategy': 'constant', 'n_nearest_features': 16, 'imputation_order': 'descending'}. Best is trial 130 with value: 0.22256771513806659.
running
[I 2024-11-07 06:58:12,471] Trial 72 finished with value: 0.2615076823638745 and parameters: {'model_name': 'VAE', 'batch_size': 31, 'iterations': 9419, 'learning_rate': 0.00010364720573047314, 'p_miss': 0.21062201620910603}. Best is trial 130 with value: 0.22256771513806659.
running
[I 2024-11-07 07:00:59,259] Trial 131 finished with value: 0.22339418256142746 and parameters: {'model_name': 'IterativeImputer', 'estimator': 'RFR', 'initial_strategy': 'constant', 'n_nearest_features': 16, 'imputation_order': 'arabic'}. Best is trial 130 with value: 0.22256771513806659.
running
[I 2024-11-07 07:01:12,667] Trial 145 finished with value: 0.253615418081558 and parameters: {'model_name': 'KNNImputer', 'n_neighbors': 2048, 'weights': 'distance'}. Best is trial 130 with value: 0.22256771513806659.
running
[I 2024-11-07 07:02:29,000] Trial 132 finished with value: 0.2242802248217742 and parameters: {'model_name': 'IterativeImputer', 'estimator': 'RFR', 'initial_strategy': 'constant', 'n_nearest_features': 16, 'imputation_order': 'descending'}. Best is trial 130 with value: 0.22256771513806659.
running
[I 2024-11-07 07:04:22,179] Trial 133 finished with value: 0.22371159830474205 and parameters: {'model_name': 'IterativeImputer', 'estimator': 'RFR', 'initial_strategy': 'constant', 'n_nearest_features': 16, 'imputation_order': 'descending'}. Best is trial 130 with value: 0.22256771513806659.
running
[I 2024-11-07 07:05:44,719] Trial 134 finished with value: 0.22414691757794047 and parameters: {'model_name': 'IterativeImputer', 'estimator': 'RFR', 'initial_strategy': 'constant', 'n_nearest_features': 16, 'imputation_order': 'descending'}. Best is trial 130 with value: 0.22256771513806659.
running
[I 2024-11-07 07:06:14,805] Trial 149 finished with value: 0.24166088143740364 and parameters: {'model_name': 'IterativeImputer', 'estimator': 'Ridge', 'initial_strategy': 'constant', 'n_nearest_features': 16, 'imputation_order': 'arabic'}. Best is trial 130 with value: 0.22256771513806659.
running
[I 2024-11-07 07:09:38,014] Trial 136 finished with value: 0.22335654394936616 and parameters: {'model_name': 'IterativeImputer', 'estimator': 'RFR', 'initial_strategy': 'constant', 'n_nearest_features': 16, 'imputation_order': 'arabic'}. Best is trial 130 with value: 0.22256771513806659.
running
[I 2024-11-07 07:18:42,140] Trial 137 finished with value: 0.22419355029420068 and parameters: {'model_name': 'IterativeImputer', 'estimator': 'RFR', 'initial_strategy': 'constant', 'n_nearest_features': 16, 'imputation_order': 'arabic'}. Best is trial 130 with value: 0.22256771513806659.
running
[I 2024-11-07 07:28:22,288] Trial 138 finished with value: 0.2236154380032452 and parameters: {'model_name': 'IterativeImputer', 'estimator': 'RFR', 'initial_strategy': 'constant', 'n_nearest_features': 16, 'imputation_order': 'arabic'}. Best is trial 130 with value: 0.22256771513806659.
running
[I 2024-11-07 07:34:15,373] Trial 139 finished with value: 0.22436089433072573 and parameters: {'model_name': 'IterativeImputer', 'estimator': 'RFR', 'initial_strategy': 'constant', 'n_nearest_features': 16, 'imputation_order': 'arabic'}. Best is trial 130 with value: 0.22256771513806659.
running
[I 2024-11-07 07:34:59,643] Trial 140 finished with value: 0.22532010856993256 and parameters: {'model_name': 'IterativeImputer', 'estimator': 'RFR', 'initial_strategy': 'constant', 'n_nearest_features': 16, 'imputation_order': 'arabic'}. Best is trial 130 with value: 0.22256771513806659.
running
[I 2024-11-07 07:36:48,290] Trial 84 finished with value: 0.2617461130161416 and parameters: {'model_name': 'VAE', 'batch_size': 36, 'iterations': 6828, 'learning_rate': 0.0022113632421049165, 'p_miss': 0.1970446480762274}. Best is trial 130 with value: 0.22256771513806659.
running
[I 2024-11-07 07:41:35,507] Trial 141 finished with value: 0.22356994596612711 and parameters: {'model_name': 'IterativeImputer', 'estimator': 'RFR', 'initial_strategy': 'constant', 'n_nearest_features': 16, 'imputation_order': 'arabic'}. Best is trial 130 with value: 0.22256771513806659.
running
[I 2024-11-07 07:42:41,291] Trial 142 finished with value: 0.2220855877448483 and parameters: {'model_name': 'IterativeImputer', 'estimator': 'RFR', 'initial_strategy': 'constant', 'n_nearest_features': 16, 'imputation_order': 'arabic'}. Best is trial 142 with value: 0.2220855877448483.
running
[I 2024-11-07 07:43:56,479] Trial 143 finished with value: 0.22435643824572896 and parameters: {'model_name': 'IterativeImputer', 'estimator': 'RFR', 'initial_strategy': 'constant', 'n_nearest_features': 16, 'imputation_order': 'descending'}. Best is trial 142 with value: 0.2220855877448483.
running
[I 2024-11-07 07:48:56,190] Trial 144 finished with value: 0.22371214194246103 and parameters: {'model_name': 'IterativeImputer', 'estimator': 'RFR', 'initial_strategy': 'constant', 'n_nearest_features': 16, 'imputation_order': 'descending'}. Best is trial 142 with value: 0.2220855877448483.
running
[I 2024-11-07 07:51:39,791] Trial 146 finished with value: 0.2231471454236514 and parameters: {'model_name': 'IterativeImputer', 'estimator': 'RFR', 'initial_strategy': 'constant', 'n_nearest_features': 16, 'imputation_order': 'arabic'}. Best is trial 142 with value: 0.2220855877448483.
running
[I 2024-11-07 07:51:40,810] Trial 161 finished with value: 0.3492679421911211 and parameters: {'model_name': 'SimpleImputer', 'strategy': 'most_frequent'}. Best is trial 142 with value: 0.2220855877448483.
running
[I 2024-11-07 07:51:45,252] Trial 147 finished with value: 0.22470053640137463 and parameters: {'model_name': 'IterativeImputer', 'estimator': 'RFR', 'initial_strategy': 'constant', 'n_nearest_features': 16, 'imputation_order': 'descending'}. Best is trial 142 with value: 0.2220855877448483.
running
